score,review
7,긴장감 도는 순간에도 아.. 줄리아로버츠 예쁘다는 생각이 안 떠남.ㅎㅎ 오래된 영화치곤 재밌게 봄~ 
8,남편   나올때  죠스 보는느낌  ㅋㅋㅋㅋ빠밤~빠밤 
6,내려간 변기물도 다시보자 
8,지나칠 정도로 자신의 여자에게 세심한 남자. 때로는 자상한 남자의 전형으로 비춰질 만한 이런 남성들 중에 상대방에게 병적으로 집착하며 의심하는 의처증으로 불리는 편집성 인격장애인들이 있다. 
10,와 진짜...무서워서..ㅋㅋㅋ 남편 연기 진짜...와... 
8,26년된 영환데..공포영화보다 이런게 더 무서워요.... 
8,"초반 탈출하기 위한 짧은 준비가 인상깊네요, "
10,"너없인 살수 없어, 나없이 살게하진 않을꺼야 윽 정말 소름끼칠정도로섬뜩하다 "
8,스릴러속에서도 빛나는 줄리아로버츠의 미소 무조건응원하게되는 그녀 
10,여자 주인공이 너무도 예쁜데 괴롭히는 남자 배역도 딱 그런 타입으로 골라서 진짜 인상깊은 영화.. 
7,줄리아로버츠 젊엇을때도 역시 미모는 굿이군요 ^^ 
9,90년대가 영화전성기..역시나 스릴러의 수작.. 
8,스릴러물은 90년대에서 2000년대 초반이 르네상스인듯 
10,심장떨려죽는쥴알앗넹; 결벽증 극혐; 
10,스릴러의 최고봉 
7,두고두고 생각 날 줄리아 로버츠의 라스트 전화 씬.. 
8,남편의 눈빛 생각만해도 소름끼쳐요 
10,마지막에 총쏘는 모습 멋짐 쥴리아 로버츠 수작이네 
7,런닝타임도 길지 않고 적절한 긴장감도 줄 수 있는 수작 스릴러 
10,정말 옛영화 그당시 넘 잼났는데 ㅋ 
10,남편 완전 OOO 영화보는 내내 긴장하고 봐서 영화 끝나고 나니 멀미 오더라. 줄리아 로버츠 진짜 햇살같이 이뻐 
10,옛날에 어릴땐 19금되어있고 더구나 제목에 동침이란 말이 무슨 보면 큰일나구 절대 안되는 엄청 야한영화처럼 알고있다가 스릴러라고해서 보구 엄청 무서워하면서 본 기억이 난다ㅋㅋ 
7,잔잔한 스릴러군 ....볼만했음 
8, 예전에 진짜 재미있게 본 영화.남편 히틀러같고 진짜 무서웠다 
10,"강박증, 강박장애를 스릴러 소재로써 굉장히 효과적으로 표현한 영화. "
8,소재도 독특하고 남편이 연기를 잘해요..마지막 부분은 긴장감이 폭발 
8,변화 앞에서 용기는 필수사항. 담대하기 
9,무섭다 진짜 잘만든 스토커 영화~ 
8,시대가 지난 지금 영화보고 아 별루네 하는 건 실례야... 상당한 영화였다구 이건 
10,엄청 옛날 영화라 별 기대 안하고봤는데 잼나게봄. 배우들 연기가 좋았음. 
10,진짜 무섭네 ㄷㄷㄷ ㅜ.ㅜ 
5,오래된 영화라 조금 연출이 떨어져 보이긴 하지만 스토리 라인이나 긴장감은 꽉 찬 편 
8,소름이였던영화 연기 쩐다 
10,이정도 몰입도와 긴장감이라면 10점이다. 줄리아의 미소는 역시 100만불이 아깝지 않다. 
7,간결하면서도 몰입하게 만드는 90년대 미국 스릴러 영화 특유의 매력. 남편이 돈 많다고 다 행복한 것은 아니라는 것. 
10,다시봐도  재미짱  스릴 짱 
10,써스펜스물의 정석 재미남 
10,마지막 총을 쏘며 웃는 줄리아로버츠의 모습은 정말 잊혀지지 않는다 
10,어린 나이에 봐서 임팩트가 컸다... 
10,저런 남자 만날까봐 겁나...숨죽이면서 본 영화... 
6,편집증을 가진 남자와 산다는 것은 ..미국에서 빅히트친 작품 
10,이 영화의 긴장감은 대단했다 
9,이 영화는 스릴러가 아니라 공포물이다~! 
10,공포영화볼때도 조용히보는편인데 이거보면서 엄청쫄면서봄 
10,지루 하지 않고 잼있어요 배우분들 연기력 짱! 입니다 그래서 더 몰입하게 되나봐요 또 보고 싶네요 
9,긴장감 넘친다 가정폭력에 대해서 생각해보게 된다 
10,영화 첫 장면에서 줄리아 로버츠가 너무 예뻐서 놀랐네요. 영화도 스릴 있고 쫄깃해요. 
9,잘봤어요 흥미진진은근..갈수록 
10,심장쫄깃. 시간이 지나도 명화 
10,또보네요  스릴최고예요 
10,손꼽는 영화 
10,잼있습니다. 
9,뒤늦게 보고 딴지걸지 마시고.. 당시엔 의처증 소재로 섬득하고 긴장감 넘쳤던 스릴러 
5,중간에 춤추는장면이 멋있음. 마지막 스릴러도 괜찮음. 
8,결국은 누구에게도 기댈수 없고 스스로의 손으로 매듭을 지을 수 밖에... 
8,굿-남편너무무서움.. 
6,무섭당 
8,very good ! 
8,지금 생각해도 마지막 암시는 너무도 섬뜩하다. 
8,지금 극장에서 다시 상영한다해도 보러 갈 영화 
8,"멋진 스릴러, 후반부 조금만 더 신경썼으면.. "
7,good 
10,남편의 의처증 연기가 덜덜덜... 
4,서스펜스 스릴러가 아니라 줄리아로버츠 영화다 
8,의처증 남편 무서워서 혼났습니다. 집에서 혼자 불끄고 보니 재밌네요 
7,이래서 남편을 남 편이라 부르나 보다. 
10,jou1318님 여자가맞을짓하면 맞다니요 부부는서로 동등한관계입니다.. 
10,줄리아가 너무 이뻐요!!! 
8,긴장감을 가지고 잘 감상했습니다 우리 주변에도 적과의 동침하는 부부가 많을 것 같아요 ㅎㅎ 
5,지금보면 그냥 볼만한 스릴러. 
8,옛날 영화라는 점을 감안해도 적당한 긴장감과 스릴감이 좋았다 
10,다시 봐도 재미있네^^ 
7,스파이물인줄 알았는데 의처증 소재 스릴러물이었군. 근데 좀 상투적인것 같아 아쉬움 
9,"오래전 작품이지만, 나름 긴장감 있었고 볼만하네요. "
10,좋아요 
7,나도 모르게 점점 긴장되는 스릴러 
10,의처증 무섭다. 남자 사이코. ㅋㅋ 
10,괜찮..볼만...ㅋㅋ 
10,후반부로 갈수록 아쉬워는 영화 
10,상영시간동안 단 1분도 방심의 끈을 놓을 수 없게 만드는 영화............ 
10,말이 필요없는 가슴깊이 조여드는 서스펜스의 명작 
6,결혼후 돌변하는 남자들의 본성에 대한 영화... 
10,너무 재밌는데?! 17년 전에 이런영화가 만들어 졌다니..... 놀라울 따름^ ^ 
9,손 안닿는 곳을 시원하게 긁어준 영화 
6,"귀여운 여인 줄리아 로버츠가 새롭게 스릴러물에 도전, 실패작은 아니다 "
9,몰입하게하고 김장감도주고...재밌게 본걸로 기억되는 영화 
7,그냥 평작정도는 간다.. 볼만한 스릴러정도.. 
8,굿 
10,처음으로 10점 주는 영화. 모든 것이 다 너무 좋았음. 
10,처음부터 끝까지 긴장감을 놓을수가 없네요 
8,역시 사람이 제일 무섭다. 
9,굉장히 스릴있네요 
10,제가 초등학교때 본 영환데... 그때 기억으로 재밌었는데.. 
10,"저희 아버지가 스물여덟일때 기억나는 작품이라고,, "
10,"우리 아버지께서 28세 때, 기억나시는 작품이라고,, "
10,"우리 아버지가 28살 때, 기억나는 작품이라고,, "
3,솔직히 뭐냐.. 완전 기대이하다 
7,two thumps up! 
5,"공포라니, 장르선별 바로 하자! "
6,그냥 정신병자와 그 주변사람들에 대한 평범한 이야기다 
5,좀 그래요잉 
9,"로라는 용감한 여자이다,1 "
4,몇몇 인상적인 장면들이 있지만 스릴러로서 너무 구멍이 많다.. 
8,그땐 정말재미 있게본 영화중하나.재미있답니다. 
9,재밌네요;; 남편 짜증나 죽는줄 알았음.. -_ㅡ+ 
9,이야...꽤 오래된 영화네..근래에 나온영화인줄 알앗는데...재밌음.. 
10,jou1318 영화 제대로 안봤나보네. 뭘 본거냐?? 
8,줄리아로버츠만 빛나는 멜로 스릴러물 
6,이게 뭐죠???이게 뭐죠???이게 뭐죠???이게 뭐죠??? 
8,위험한정사와 비교해서 봐도 좋을듯. 상대방이 싫다고 하면 그만두는게 사랑이다. 
6,정점이 지나치게 높네요 
9,이제는 보기 힘든 90년대 특유의 느낌의 스릴러물 중 한편. 괜찮았다. 
7,'사랑과 전쟁'의 스릴러판 같은데 작은 얘기지만 스릴 있게 만든 솜씨가 훌륭하다. 
9,영화 미저리를 연상케하는군!!!! 
9,줄리아 로버츠가 주연으로 나온다는사실이 더 충격적 
5,후반부 급허무개콘 됨.. 그럴 거면 벤은 대체 왜 등장했으며 그렇게 장황하게 이야기는 왜 만듦..ㅋ..최악이다. 진짜 별점 엄청 후하게 주는 편인데 이건 딱 이게 적당한 영화. 그나마 초중반부 스릴 때문에 5점이라도...
3,단순히 줄리아로버츠라는 여배우의 힘만으로 끌고가기에는 러닝타임내내 너무 버겁다. 
1,스릴러로서 상당히 임팩트 없는 비호감 줄리아 로버츠 주연의 영화 
3,사춘기 시절 본  인상깊은 영화라 진짜 오랫만에 다시봤는데 워낙 오랜 시간이 흘러서 그런지 그때의 재미나 스릴은 사라지고  구성이나 연출편집 등등 여기저기 매우 허술한 단점만 보이는  그 시대의 추억물일뿐...추억은...
2,옛날 영화라도 흥미진진한 게 있는데 이 영화는 아님 
1,지금 보긴 좀 힘든 영화... 
10,여자가 맞을짓하면 맞는거지뭐... 
