score,review
10,디즈니 르네상스를 열어준 그녀! Part of your world는 세월이 지나도 명곡이다 
10,디즈니 영화는 모두좋지만 노래화면성우내용까지 고퀄리티 ㄷㄷ 진짜보는내내빠져든다 ㄷㄷ뮬란도조음ㅎㅎㅎㅎ휴ㅠㅠㅠㅠ 
9,어떻게 하면 이런 음악이 나오지? 
10,디즈니 중에서도 가장 사랑하는 인어공주~~ 너무예뿌고 노래도 너뮤좋다 열번을봐도 매번 재미있음 
10,역대 디즈니 공주 중 최고. 수 십 번도 더 봤지만 볼 때마다 감동이 있다. 
8,대게 결말이 바뀌면 실망하게 되지만.. 아이들을 위한 영화임을 생각하면 자연스럽게 바뀐 결말을 수긍하게 된다. 
10,맨날  호통치시는 용왕아빠가 딸을 위해 큰희생을 할때 눈물이 주륵 ㅠㅠ 
10,처음 봤을때의 순수함을 잊을수가없다. 
10,실사 영화 에리얼로 흑인 여성이 발탁되었습니다. 삼가 고작의 명복을 빕니다. 
9,유쾌해지는 under the sea 하나만으로도 9점 ㅋㅋ 
10,디즈니의 화려한부활을 알린 최초 히트작이라 더더욱 의미있는 명작. 
10,"거의 25년만에 다시 이 영화를 보았네요. 중학생이던 당시에는 에리얼만 눈에 들어왔는데, 이제 아이 엄마가 되어 다시 이 영화를 보니 에리얼의 아버지 킹트라이튼의 마음을 느끼며 그만 눈물을 왈칵 쏟아 버렸습니다. 역..."
10,지금봐도 최고의 감동이죠 
10,디즈니 애니 중에서 레알 레전드 
10,디즈니 애니메이션 음악중 가장 기억에 남는 part of your world 
10,"상처 가득한 슬픈 얼굴로 비극적인 최후를 맞이하였던 인어 공주에게 디즈니가 선물한 해피 엔딩, 그녀의 행복한 미소처럼 찬란하고 아름다운 명작. "
10,실사화 인어공주의 가장큰문제는 노래는 둘째치더라도 에리얼과 이미지가 하나도 일치되지않으며 전혀 안어울린다는 것이다.. 
10,어릴적 가슴을 설래게 했던 인어공주 여기 잠들다. 
10,과거에 봤을때 이뻣는데 실사 인어공주 캐스팅된거 보니까 더 예뻐보인다 
8,잠시나마 동심~^^*ㅋㅋㅋㅋ근데 커서 보니까 에리얼 진짜 철딱서니네 
10,디즈니 만화중 최고가 아니었나 싶다Ost도 캐릭터들도 스토리도 완벽하다겨울왕국에 비할수 없는 명작이다 
10,내생각으로는 디즈니 공주중 인어공주가 제일임.옛날영화임에도 퀄리티는 전혀 꿀리지 않아..ost도 정말 주옥같음 
10,정말정말정말 좋아하는 애니~이렇게 재미있고 모든 사운드트랙이 훌륭한 애니도 없을듯. 세바스찬은 애니조연중 역대최강~너의 두툼한 아랫입술을 사랑한단다~~ 
10,"화질이 아쉽긴한데 음악,노래,연출,움직임은 진짜 최고였음 "
10,언더더씨 ~~ 언더더씨 ~~~ 
10,언더 더 씨... 불후의 명곡... 몸과 마음이 힐링됨^^ 
10,말이 필요없는 명작 
10,어릴때 본 이솝우화에서는 인어공주 원작을 바탕으로 해서 물거품 되는 결말이 너무 슬펐는데ㅠㅠ 디즈니에서는 해피엔딩으로 만들어줘서 볼때마다 슬픈 인어공주가 아니라 신나는 인어공주라서 좋다 
10,디즈니 역사상 최고의 영화.. 잊을 수 없음! 
10,꼭보세요!  너무사랑스러운 영화~ 
10,겨울왕국따위는 비교할수 없는 고퀄리티... 최고다 
10,"어릴적 추억의 보물상자같은, 마음을 울리는 최고의 영화.에리얼은 얼마나 예쁘던지 보는내내 감탄, 노래들은 하나같이 다 전율을 일게하고 마법같은 장면 하나하나가 어릴적 그때로 되돌려주는듯 설레게 한다.사실 디즈니 만화..."
10,디즈니 최고의 공주 애리얼. 능동적인 캐릭터라 너무 좋고 노래도 최고. 캐릭터들도 적재적소에 활용돼서 언제봐도 즐겁고 감동... 악역까지 강렬하고 (+노래도 쩔고ㅋㅋ)완벽했던 영화.  제발 실사화 안했으면 좋겠는 작...
10,서른넘고도 아직 설렌다 
10,거의 20년전 영화인데 신기하게도 아직도 촌스럽지 않고 재밌다. 뮤지컬 애니메이션의 조상 
10,뭐 더이상 말이 필요없는 영화.. 개봉당시 가서 보고 또 가서 보고 또 보고싶어서 
10,스물다섯 군필 남자인데 밤에 혼자 보다가 마지막 장면에 트리톤이 마지막 남은 문제는 내가 저 아이를 얼마나 그리워하게될지라며 딸을 보내주는 장면에 울었다. 
10,디즈니영화는 어릴땐몰랐지만 크고다시보면 느낄수있다.이게 어떻게 89년작인가.노래까지 너무좋음 
10,디즈니중 최애 제일이쁨 ㅜ 
10,10살때 보고 30대 후반 되어서 다시봐도 너무 죠아 
10,지금 39살인데.. 처음 보네. 인어공주는.ost는 익숙한데..시작 부분 보는데 왜 이리 가슴이 저리지..어렸을때로 돌아가고싶다 
10,맑고 청아한 목소리에반함.에리얼공주님ㅠㅠㅠ 
10,최고의 애니메이션!! 
10,이거개쩜진짜 감탄밖에안나오는영화 
10,하하 나이먹고보니까 더재밋다는ㅠㅠ동심의세계로돌아간거같아서ㅠㅠ후엉ㅇ 
10,진짜 최고 ^^ 이렇게 어른이 되서 봐도 재밌다니 ㅠㅠㅠ 
10,박력 넘치는 Louis 주방장님께 박수!~ ㅋㅋㅋ 
10,그림이 너무 아름답다 물론 내용과 음악도 
10,이건 최고의 명작. 겨울왕국이 요즘 흥하던데 이거보단 완성도가 낮지. 
10,자라서 다시 보니 대사를 눈여겨 보게 된다. 동화라는 가벼운 비주얼로 감싼 인생에 대한 가치관. 
10,첫 디즈니 영화 사랑해요ㅠㅠ 
10,너무 순수해 ㅠ_ㅠ 
10, ~ UndeR the Sea ~ 
10,"미녀와 야수, 알라딘, 라이온 킹 등 다 실사화 되고 있는데 이 작품이야말로 디즈니가 실사영화로 만들었으면 좋겠다. 음악도 진짜 좋았는데 "
10,꿀잼!!!언제봐도 넘나 재밌음'~` 
10,어릴적부터 지금까지 인생영화♡ 
10,인어공주가 너무 예쁘다 
10,봐도 봐도 잘만든 걸작이라고 생각함. 
10,"세상에 30년이 넘었다니~OST의 임팩트는 영원할 것 같다.최근 알라딘까지 어떻게 끊임이 없이 좋을까~작사가가 너무 일찍 사망한 것이 아쉽고 또 아쉽다. ""How much I'm going to mis..."
7,원작 엔딩때메 안봤는데 해피엔딩이었네. 90년대 후 2000년 초반에 나온지 알았는데 89년도 작품이라니.. 역시 디즈니. 
9,분위기 진짜 개 이쁨 
9,2D 뮤지컬애니메이션의 정점 
10,Part of your world 노래를 부르기 위해 찾아서 보게 되었는데 뭐죠...왜 눈에서 눈물이 나는거죠ㅠㅜㅠ아버지의 딸을 향한 마음에 그만 눈물이 왈칵 쏟아졌어요Part of your world도 최고고 un...
9,재미있었다. 디즈니영화에서 2번째로 재미있었다. 
10,목소리가대박입니다에리얼♡ 
9,원작의 인어공주가 안데르센 자신이고 그가 동성애자라는 사실 
10,더 어릴 적에 보았으면 좋았을 것을.. 
10,최고의 디즈니영화. 이것도 좀있음 알바들이 평점깎으려고하겠지? 슬프다 ㅜ 
10,아름답고 동화같은 이야기 순수한 열정이 담긴 눈이 인어공주를 더 사랑스러워 보이게 하는 것 같아요 
8,나는 아직도 디즈니 공주라 하면 에리얼의 호기심어린 눈동자와 장난스런 미소가 떠오른다. 
10,옛날 거라고 치기엔뛰어난 스토리. 
9,"'니모를 찾아서'의 아버지격인 영상미, 원작에서 추가된 아름다운 음악과 로맨스와 캐릭터. 드디어 디즈니(1901~1966) 없이도 화려하게 일어선 디즈니 "
10,
10,너무너무 감동적이었고 왕자도 용감하고 에리얼아빠ㅠㅠㅠ 사랑해요 ㅠㅠ 
10,어릴적 처음 비디오로 소장했던 영화. ost는 말 할 것도 없고 바닷속 장면도 너무 예쁘다 
10,안다다씨 너무 좋다 듣고만 있어도 행복해져 
10,인어공주는 지금 봐도 최고네요 
10,나이36에 7살감성으로보는중..어릴때 부모가안보여줘서 아직도 애니만찾아서솨요 
10,지금 봐도 감동 이다 정말 좋아 이 영화 
10,문어숙회가 일품입니다. 
7,언더더 씨는 아는데 이제서야  보았다. 
7,추억의 인어공주..  알고 보면 슬픈이야기인데.. 즐겁게 봄 
10,25년만에 다시 봐도 최고 
10,내 어린시절 가장 좋아했던 만화♡♡내꿈을 인어공주로 만들어놓았었지 ㅜㅜ 
9,침체기였던 디즈니의 르네상스 시대를 열어준영화 
10,"어렸을적에 비디오로 수십번 아니 수백번을 봤던 나의 최초의, 너무나도 사랑했던 영화.  20몇년이 지나서 우리딸을 보여주는데 다시 그 감동, 설렘을 다시 느꼈다 "
10,비극이 희극으로 변했을 때의 즐거움. 디즈니. 
10,내 인생 디지니 영화. Under the Sea가 더 유명하지만 영화를 보다보면 Part of your World가 더 깊게 와닿음을 알 수 있을것이다. 
10,노래 성우 다 좋고 어릴때 벅찬 마음으로 영화를봤던 기억들이 아직도 새록새록 감정이 올라오네요 
10,개인적으로 디즈니 모든 작품중 가장 퀄리티가 뛰어난듯 음악이 음악자체로 아름다운건 인어공주뿐인듯 겨울왕국과는 비교가 안될정도로 섬세하고 아름답다 ㅠ 
10,2013년에 겨울왕국이 대세였다면 1989년에는 인어공주가 대세였다. 
9,part of your world. 30살 남자의 심금을 울리는구나... 
10,"불후의 명작 , 불후의 명곡 "
10,일년에 몇번을 보게만드는 디즈니 영화중하나죠. 명작.명곡! 
10,음악 작화 스토리 모든것이 역대급 
10,말이 필요없죠 역대 디즈니작품중 최고죠! 
9,다채로운 영화. 에리얼 목소리가 정말 예뻐서 듣기 좋았다. 사랑스럽고 호기심 많은 공주의 표본. 
10,"원작의 각색이 나름 매끄럽고, 어렸을 때 부터 성인이 된 지금까지 한 3~4번은 본 듯 한데 볼 때 마다 새롭고 즐겁다. 최근의 프로즌 렛잇고 등에 맞먹는 흥행 ost. 눈과 귀와 마음이 모두 충만하다 ^^ "
9,"플롯 자체가 비극에 어울리는 구성인데, 무리한 해피엔딩이 좀 아쉽긴 하다. 하지만 음악이나 연출, 모두 25년전 작품인데도 전혀 촌스럽지않다. 다시봐도 명작은 명작... 캐릭터면에서도 에리얼이나 악역 우르슐라나 모두..."
10,고3되서 이거보는데 퀄리티장난아니네 내용좋고 말못하는 에리얼 이쁘다 
10,원작은 슬픈동화인데 디즈니애니는 다 해피앤딩 ㅋ 
8,원작을 어기면서까지 기어이 해피엔딩을 만들어 내는 디즈니사의 솜씨! 
10,원작 인어공주의 배드엔딩을 해피엔딩으로 만들어 낸 최고의 작품 
10,디즈니 공주중에 가장 사랑하는 인어공주.30넘어서 다시 보는데 인어아부지 왜케 찡한지..재밌고 감동이고 왕자 멋있고 가재 웃기고ㅠㅠ넘좋다 또봐야지^^ 
9,기술의 발전이 불러온 영상도 줄 수 없는 색채와 고상한 멋에 감탄한다. 그림의 질감에 머무르기에 가능하다. 청자를 고려하는 장쾌한 음악과 현대적 해석으로 사랑이 더 해진 이야기도 마찬가지로 충만하다. 
10,
8,실사화를 하는건 좋은데 뜬끔없이 흑인섭외가뭐냐 
8,조연들의 매력이 다른작품들에 비해 빈약하다 
10,
10,디즈니라는 명작소를 강하게 각인시킨 영화 개봉하고 영화를 극장에서만 수십번을 봤던걸로 기억한다. 이영화 이후 극장에 디즈니 영화가 개봉을하면 이유를 막론하고 무조건 시청했으니... 
10,지금 보니 아빠가 에리얼을 생각하는 부분들이 기억에 남네요 에리얼이 결혼하면서 아빠께 사랑한다고 말할 때 눈물 찔끔 ㅜ 
10,인어공주를 지켜주세요 ㅠㅠ 
10,너무 사랑스러운 에리얼.. 디즈니의 프린세스 감성은 정말 최고다 
10,지금까지 계속 보고있다... 
10,너무 예쁘다... 봐도 봐도 또 보고싶다 
10,진짜 디즈니중에 젤잼... 
10,"대 디즈니 시대를 연 OO점이지만, 디즈니가 이 애니에 공을 엄청 들인게 보임. 진짜 알라딘, 라이온킹, 인어 공주, 미녀와 야수 이런 거 또 나오기 힘들겠지?ㅠㅠ "
10,당시 극장에서 본 인어공주.. 너무 감동이었음. 최고... 노래가 너무 좋음 
7,Under the Sea 
10,벌써 30년이나 지났다니... 
6,"지금은 상투적이어도, 고전동화로써의 가치는 여전하다 "
10,인생영화입니다 커서보니 마지막엔 눈물도 왈칵 나더군요 
10,어린시절 봤던 인어공주 성인이 되서 봐도 너무감동적이다ㅠㅠ 
10,아 나의 어린 시절이여ㅠㅠㅠㅠ 
10,누구라도 빠져들 수밖에 없는 영화 
10,누구나 인정하는 디즈니 최고의 영화 
7,바다가재아저씨 또 보고싶다. 
10,어릴때 보았어서 한국어더빙 버전이 오히려 더 익숙하기도 한 인어공주.... 애리얼 너무 이쁨 
10,모든 것이 완벽했던 나의 인생 애니메이션 
9,90년대 디즈니 애니의 전성기를 연 작품..ost 또한 신나고 좋다 
7,알고 있던 노래였지만 영화를 보면서 보니까 감회가 다르네요 
7,누구나 몰입하고 볼 수 밖에 없는 디즈니 인어공주 
10,언다다씨 가즈아  ㅋㅋ내 어린 시절 인어공주랑 결혼 하고 싶었는데가장 재미있게 봤던 디즈니 레전드 명작 이쥐 
10,Part Of Your World 
10,말안해도 다 아는 명작이죠ㅜㅜ어릴 적 꿈이 인어공주였네요ㅋㅋ 
8,추억의 애니메이션. 노래가 너무 좋아요. 
8,어리석지만 당돌한 모습에 반하네 
10,어릴때 여기 나왔던 노래들 거의 외울때까지 들었던 기억이 나네요 
10,말이더필요할까!@#~ 
8,Under the sea 노래 좋아서 영화 궁금해서 찾아봤네요 ㅎ 
10,동심을 이끄는 최고의 영화 
10,최고의 명작입니다. 디즈니 영화관에서 다시 보니 즐거웠네요. 
10,결말이 바껴도 아쉽지않고 여운이 남는영화 
9,클래식한 모습의 디즈니 애니메이션의 정수.. 
7,The Little Mermaid 
7,디즈니 고전영화의 아름담움이란 
9,너무나 유명한 동화라서 볼 기회가 오히려 없었는데 시간내서 보게되었다. 
10,아무리 오랜 시간이지난 후 보아도 좋네요 
10,동심에 빠져 엊그제 본 기억이 생생하건만...벌써 27년된 작품이라니... 속절없는 세월의 무상함에 마음한구석이 허전해지는구나... 
10,노래 너무 좋음 ♡♡♡♡ 
8,Under the sea~~ 
9,어린시절 테잎이 늘어지게 봤던 추억의 명화.. 
10,볼 때 마다 소름돋는다 후속작도 재밌고(2편말고 3편) 
10,여릴때 처음으로봣던 애니메이션영화로 기억난다. 아직까지도 너무너무좋아함 
10,정말 꼭 보세요 디즈니 짱짱짱  아리엘 진짜 너무 사랑스러워 
10,어릴 때 너무 재미있게 봤는데 ㅎㅎ 음악이 너무 좋죠 이 애니 나온 이후로 여름마다 언더더씨 나오죠 
10,어릴적 Tv에서 방영됬던 디즈니특선영화 인어공주는 Under the sea를 듣는것만으로도 기분좋게해주는 힘과 추억이 있다. 
10,알라딘과 함께 한손에 꼽히는 최고의 애니메이션 ~ ! OST는 그냥 무조건 넘버1 ~ ! ~ ! 
10,1997년 애니메이션이라는게 대단 
10,공주들 중엔 인어공주가 제일임. 악역은 말레피센트가 짱이고. 
10,my favorite ! 
10,언 더 더 쉬 ~ ^^ 환 타 지 
10,내 인생 최고의 디즈니 애니메이션.. 멋진 OST.. 
10,z;zz;zzz;zzzz;; 
10,말이 필요한가 디즈니의 명작 
10,"수십번봐도 질리지않는 애니메이션, 최고!! "
10,개요에 나와있는 모든 장르의 수준이 최상급! 노래도 너무 아름답고 엄청 재밌어! 왜 걸작이라고 하는지 알겠네. 
10,음... 꽤 재미있었어용 
10,재미임ㅈㅁ다옵ㅈㅂㅁ벼봊ㄴㄷㄴㅁ 
8,ost는 정말 좋네ㅎㅎ 
10,명작.. 언제나봐도 재밌는 추억의 영화? 
9,개인적으로 디즈니만화는 너무 상업적이라 안좋아했는데 이건 좀 다르다. 순수했던 어린시절로 잠시 돌아간 기분. 
10,굿이다 최고의 명작임 10자 압박 
9,디즈니의 전설적인 영화중에 하나! 
9,캐릭터들이 귀여워서 재밌고 음악이 좋아요. 영어공부하고 싶어져요. 
10,나이 더 먹기전에 봐야겠다... 순수했던 기억으로 돌아가서.. 
10,디즈니가 보여주는 새로운 여성상 
10,나름의 상징성과 부정을 느끼게하는 좋은만화 
10,디즈니 르네상스의 시작 
10,가갸거겨고교구규그기 
10,20년이 지나서 다시봐도 명작이다 
10,명불허전 인.어.공.주 
10,디즈니 꺼는 모두 다 볼 것이다. ㅎ 
10,디즈니 영화를 어느누가 감히 평가하겠는가??진짜 최고다 이시기에 이런 명작을 만들어 내다니 
10,인어공주  너무 이쁘고 이야기 재밌었음ㅎ 
10,완벽 그 자체입니다ㅋ 대작 
10,제가 젤좋아하는공주!!!!!!!!!스토리도 노래도 다좋아요~ 
10,66ㅛ 
10,정말 다시봐도 명작..잊을 수 없는 영화 
10,내여신 에리얼ㅜㅠㅠㅠㅠㅠ절대로잊을수없다 
10,역대 디즈니 애니메이션 중 최고! 
10,맨날맨날봐도안질린다! 정말최고다! 
10,말로 표현 못함 
9,어렸을때보고 22살이 되서 다시봐도 두근거린다.. 아 너무 좋은 영화.음악도굿!! 
10,20년이 지나고 봐도 최고다.. 특히 에리얼 성우 조디밴슨 목소리는 완전 더 최고다 
9,"아,,, 해피엔딩이라서 정말 다행이야 ㅜㅜ "
10,펄펙트 
9,ost는너무좋은데 해피엔딩이아닌게더재밋엇을듯 
10,인어공주는 최고다 ㅠ 
10,완전 최고중 최고이다. 
10,디즈니 명작 !!! 
10,신데렐라도그렇고 진짜 시작할때 따리리라리라~~ 하는거 진심 좋음 ㅠㅠㅠㅠㅠㅠㅠㅠ 
10,어렸을때 테이프가 늘어지도록 봤던..ㅠㅠ지금 봐도 재밌네요^_^ 
10,어렸을때부터 지금까지 내 인생에서 가장 큰 비중을 담당하고 있는 동화임! 
10,내인생 최고의 애니메이션 
10,그야말로 최고 
10,이때의 디즈니 애니메이션은 정말 명불허전.. 
9,어렸을 적 재밌게 본 기억이.. 
10,"조카들과 함께 본 인어공주, 애리얼과 결혼하는게 꿈이었던 그시절이 떠오른다.. "
9,정말 진짜 너무 좋아함 .. OST 너무 좋음 무한반복.. 
10,이거 보고 원작을 봤어요;;정말 이 시대의 최고의 걸작 판타지 스토리 
10,이건 최고다 솔까말 
10,재미있음 ㅋ 
9,classic:) 
10,오오오오오오오오오오오 
8,너무다시보고시펏던 영화.. 지금봐도 어렷을때의느낌이그대로 
9,"너무 재밌다ㅋ 신비함,스릴감,두근거림,감동 모두 적절히 잘 어울린 애니메이션 "
10,내가 이 영화를 보려고 얼마나 노력했던지.. 역시 내 기대를 져버리지 않는 영화!! 
10,"이 영화가 없었다면, 지금의 디즈니는 사라졌을것이다.. "
10,저는 이거보다 안다다씨가 너무좋네요 초딩에마음에 맞는 인어공주너무재밌어요 
10,인어공주 오랜만에 봤는데도 너무 재밌네요 디즈니껀 다재밌어요 
10,처음 본 날 밤 꿈에 에리얼이 나왔었는데... ㅎㅎ 
10,다시 봐도 명작 ㅠㅠ 
9,Under the Sea~ 공주중에 가장 매력적인 에리얼 
10,첫사랑이란 인어에게도 바라보기만 해도 좋고 함께 있는 감정을 주는 신비의 약 
10,"최고로 재밌었고, 감동 적이었어요!! 인어공주 홧팅(^.~) "
10,"어렸을때 이 영화보고 진짜 감명받았던 기억이,, "
10,인어공주 완전 예뻐~! 
10,최고~ 최고~!! 
10,"음악부터 그림까지,,내 평생 정말 최고의 애니메이션 영화,, "
10,under the sea 짜아아아아아아아아아아아아앙~~~~~! 
10,인억공주 넘 재밌음 ㅋㅋ 
8,다시 시작되는 디즈니의 전설.제프리 카첸버그의 퇴사와 함께 바로 막을 내렸지만... 
10,재미있다!또 보고 싶어....♥ 
10,올만에 봤는데 최고!! 
10,인어공주 잼있다..최고..^^ ㅋㅋ 
10,우와 우리집에있던 애니메이션책이랑은 다른결말이네 ㅋㅋ재밌당 
10,완전 재밌고 좋음♡ 
10,상상력은 지식보다 우월하다. 
10,"이영화가 전하는 메시지가 ""아이들은 자유로워야 한다""인데 그럼 세드 엔딩이겠니? "
10,디지니는 모든지 다 쵝오~ 
10,와우!! 역시 디지니공주들이 쵝오!! 
10,말이필요없음 
10,와우 
10,디즈니가 최고임! 
10,난 디즈니가 재미있던데~이거 정말루 재미있어요 
10,디즈니 에니메이션의 최고 작품 
10,커서 느낀 건 이만한 애니메이션이 더 안 나오는 게 아쉽다는 거다 
8,옛날거라서 좀 그렇지만 재미쌈 
10,짱짱짱짱짱짱짱짱짱짱짱짱짱짱짱짱 
10,재미 있어요. 
10,역시 디즈니 
10,아...언제나봐도 명작이야..원작이랑은 다르지만^^해피엔딩이좋은걸~ 
10,나도 인어공주를 디즈니 최고의 영화라고 생각함. 
10,더빙판을 본사람이라면 애리얼의 아아아 음성은 잊지 못할것이다. 
10,재미있어요~~ 근데 좀 슬픔 ㅠㅠ 
10,"원복의 비극을 해피엔딩으로 전환하며, 아이들에게 꿈을 심어주는 최고걸작 "
10,좋은 걸요.  그리고 재미있었어요^*^ 
8,Under The Sea!! 확실히 디즈니애니에 비극적 결말은 안 어울리지 
10,끝네줍니다. 
9,왜이렇게 슬프지 
10,내인생최고의애니메이션. 포크로 머릴 빗던 에리얼을 잊지못하는 
10,디즈니 최고의 영화. 
10,재밌어요 
10,"정말...크면서 볼수록 재밌는거 같아요~ 알라딘, 인어공주가 젤 재밌는 듯~ ^^ "
10,감동적 그 자체 입니다. 
10,아주 재미 있게 보았습니다. 
10,신데렐라 인어공주 백성공주..정말..지금봐도 꿀리지 않는 애니 
10,"디즈니 애니메이션의 빅3(인어공주,미녀와야수,알라딘) 그중에서 단연최고! "
10,디즈니의 전성기를 열어 준 디즈니 세계최고의 애니메이션 인어공주. 
10,노래 좋고 주인공들도 좋고~! 
10,최고!! 디즈니 에니 중에서 단연 최고다!! 
9,사랑스런 주인공. 언더 더 씨~ 
10,디즈니 혁명 디즈니 르네상스의 시작 
10,"역시 월트디즈니~음악좋고 넘흐쩌는 내용까지,, "
10,이거 음악도 좋고 진짜 재밌게 본 애니 
10,어렸을때 추억이 떠올르고~참 재미있었던 디즈니중 하나인거 같다~^^ 
10,너무 좋아요~ 
10,정말 잊을수없는 만화영화.. 만화영화를 뛰어넘어 예술작품이라고 할수있다.. 
10,대박~!!!! 
10,어렷을때의 추억이 떠오른다.. 
8,이제는 꼭 보고 넘어가야할 고전이 되어버린. 
10,최고다.. 
10,제가 국민학교4학년때 92년 극장에서 본 기억이 있는데..97년이라.. 
10,너무 감독적이에요. 
10,어렸을때 보아도 이때까지 잊혀지지않는 감동적인 영화. 
10,9년이 지난 후에 다시 봐도 손색이 없는 만화영화. 
10,잊을 수 없는 어린시절. 그리고 에리얼. 
10,"어렸을때봐도,다커서봐도 가슴을울린다 "
10,끝부분 보면서 내내 박수를 쳤던~ 
10,몇번을 다시봐도 재밌다. 이런게 명작이다. 
10,한글더빙으로 봐도 영어 원어로 들어도 생생한 감동이 
10,안데르센도 흡족해 할만한 디즈니의 명품 애니메이션. 
10,정말 어릴때보고도 10년이 지났는데도 그 감동이 포스터를 볼때마다 살아납니다 ^^* 
8,디즈니를 부활시킨 전설의 동화 ... 원작을 그대로 유지하면서 재미는 그대로 
10,디즈니 정말 최고였는데... 요즘은 픽사.. 
10,정말 감동적임 ㅠㅠ!! 애니이상의 감동이였다.. 
7,"디즈니 애니의 방향선회작. 새로운 시도, 당시 '만화도 이럴 수 있구나~' "
10,그 무엇보다도 ost가 매우 좋았다. 아직도 귓가에 맴도는 멜로디...그립다. 
10,빛나는 드레스입고 두팔을 벌린채 바닷가로 걸어나오는 모습 잊혀지지 않는다 
10,해피엔딩으로 끝났기 때문에 원작보다 좋았다. 
10,난 월트디즈니 공주중에서 인어공주가 제일좋다♥ 내가 사랑하는 애니! 
10,"꿈을 주는 동화, 스토리부터 ost 까지 완벽하다 "
10,역시~~~감동 ㅠㅠ보는 내내 소름의 연속! 
9,넘 좋아용 ~~~~ 아아아~아 아아아~~~ 
8,내가 언젠가 커서 재마스터할 디즈니 컬렉션 중 하나 
10,세월이 흘러도 변치않는 감동.. 
9,너무나도 동화같아서 재밌는 영화 
10,저는 이게 너무 좋아 항상 인어공주 노래를 흥얼거려요. 
10,어렸을때 아버지가 비디오를 사주셔서 맨날 봤는데.. 올만에 보니깐 눈물이 
10,10년 만에 다시 본 인어공주..음악&캐릭터&성우 다 최고.. 
10,언더더씨♡ 
10,"디즈니의 최대명작, 이걸 이제야 보게되다니...!!! "
10,디즈니 음악은 참 좋다는 거. 
10,다시한번보고시퍼요ㅎㅎ 
10,진짜 재미있었어요 ㅋㅋ 
10,아직도 Under the Sea 가 귓가에 멤도는 듯.. 
10,지금봐도 너무 재미있습니다 최고최고^^ 
10,최고! 
10,아너무좋아ㅜㅜㅜ음악도진짜좋아 ㅜㅜb 
10,역시 월트디즈니 
10,디즈니최고 넘재밌었따 . 
10,인어공주... 정말 좋은 영화다. 
10,ssw1379님은 개인적으로 순수함을 벗어난것 같습니다.이런 명작을... 
10,최고!! 음악도 넘 아름다움.. 
10,디즈니 전성기의 시작! 
10,귓가에 맴도는 ~~Under the sea~~ 
10,정말 재밌게 봤다. 언더더씨! 
