score,review
8,1990년... 중1때... 주말 tv에서 보여줘서 봤는데....  엠마누엘 베아르는.. 정말 천사인줄 알았어.. 
10,지금 보면 굉장히 유치할 수 있지만 예전에 정말 인상깊게 보았던 영화... 특히 여주인공 정말 천사인 줄 알았당 
10,엠마누엘 베아르가 피비게이츠 떡실신시키는 영화 
8,"유치하고 단순한 내용이지만 , 그 만큼 순수한 전개가 기분좋은 영화 ! 사실상 악역들도 귀여운 수준이라 자극적인 영화들에 지칠 때 본다면 더할나위 없이 좋음~~ 남주인공이나 여주인공이나 참 사랑스럽다^^~~ "
8,우리집에도 천사가 왔으면 좋겠다 
8,엠마뉴엘 베아르...이땐 천사였는데...요즘은 인조인간이 되었지...T_T 
6,피비케이츠 팬이었는데 천사역의 엠마뉴엘 베아르가 정말 정말 예뻤음 
10,영화를 다 본후에도 천사가 눈앞에 아른거렸다. 
8,사촌누나들이 피비케이츠 나온다고 보길래 같이 봤다가 천사한테 한방에 훅 갔던 기억이 나는구만요... 
10,단순한 내용에 아름다운 주인공인 영화스토리보단 주인공에 점수를 후하게 칠수밖에없는영화볼것이라곤 엠마뉴엘베아르의 천사연기지만그것만으로도 충분히 볼가치가잇는영화임 
9,진심 좋다... 우리나라도 이런 영화가 나오면 좋겠다. 영화가 이래야 재밌지ㅋ 
8,자꾸 보다보니 진짜 천사 같더라 
9,피비 게이츠가 외모에서 밀린게 이영화가 첨이자 마지막일듯... 그만큼 엠마누엘 베아르가 개쩔었음.... 
7,중간중간 천사라기보단 강아지같은 애완동물의 매력을 내뿜는 베아르.. 유치함과 낭만이 섞인 야릇한 느낌으로 그리 높은 완성도가 아님에도 만족스러웠던건 대다수의 사람들처럼 나또한 천사에게 홀려서인듯 
10,"헐리웃 기준으로 세계 3대미녀라던 피비 게이츠가 유럽의 조연급 엠마뉴엘 베아르에게 쳐발린 영화. 세계 최고 미녀라던 브룩 쉴즈야말로 제대로 꿀빨던 시절. 자타공인 엘프국인 체코 슬로바키아, 헝가리, 루마니아, 소련은..."
10,헐 피비케이츠가 발리다니... 
8,짐 친구들 그 OOO들 3명만 없었다면 더 완벽했을텐데 
10,중3때.. 친구들과 극장서본 첫 헐리웃 감성영화..추억과 시간의 아쉬움이 여운으로.. 
10,유치하지만. 유치한만큼 순수하고 깨끗한 영화. 이런사랑이 있을까?? 
10,아.. 여주.. 넘이뻐ㅠ 
8,엠마뉘엘 베아르는 도대체 왜 저런 완벽한 얼굴에 손을 댔을까 진심 불가사의하네 
10,20년만에 봐도 꿀잼이네여 
10,정말 아름답고 멋진 영화입니다 
10,87년에 직접봤다면....천사하면 떠오르는 배우로 영원히 고정되었겠지? 
10,진짜 천사인줄 알았습니다 너무 예뻐요~ 
10,진짜 천사를 데려와서 찍은 영화.베아르 초리즈 시절 
8,이 영화를 보고 감자튀김을 사랑하게 되었지. 
10,엠마누엘 베아르의 리즈시절은 정말 천사가 따로 없네요 ♥ 
10,어릴 때 본 영화...그때의 신선한 충격을 잊을수가 없네요.신비하고 아름답고 재미잇엇어요.날갯짓 너무 우아하고 아름다웟다는 ㅡㅡ 지금 다시 개봉해도 사랑받을 듯 
9,어릴때 정말 재밌게 봤었는데 다시 보고싶네요 
10,보고나서 스토리에 대한 것보다 천사로 나온 엠마누엘 베아르에 대한 잔상이 계속해서 남아 있었네요. 
10,어릴적 추억의 영화.이제 볼 수 없나요 
10,어릴때 내 감성을 자극했던 영화 너무 애잔해서 좋아 
8,둘다 너무 이쁨 
10,이거쓸려구로그인했음ㅋㅋㅋㅋㅋ아진심너무귀여워서 노트북깨물어버릴뻔ㅋㅋㅋㅋㅋㅋ 
7,"유치하지만, 재밌네 "
10,재밌네요 ㅎㅎ 
9, 다시 봐도 어색하지 않고 오래도록 기억이 남네여 
10,지금이거찾고있는데 어찌못볼까여?울면서 봤었는데 국딩때^^ 
10,사춘기때 엠마뉴엘의 천사같은외모에 반넋이 나간채로 보았던 기억이... 
10,최고였습니다.. 엠마누엘 베아르 커서도 계속 기억남는 영화.. 
10,참 어릴때 진정한판타지멜로라 생각하며 재밌게봤던 엔딩이 참 기억에 남는 작품 
10,약간 유치하기도 하지만 재밌게 잘 봤습니다 
10,국딩때 토요명화 에서 본듯(?) 세월이 많이 흘렀지만 지금도 잊을수 없는 영화.. 
9,소재도 참신했고 무엇보다 진짜 천사같은 엠마누엘 베아르의 미모는 잊을수 없다 
10,좋구만 
7,재미있는 소재와 정말 천사같았던 엠마뉴엘의 모습이 기억에 남는 영화 
10,다시보고싶은 영화 
10,이 영화 다시 볼수없나... 다시 보고싶어 미치겠다... 
10,엠마뉴엘 베아르에 때묻지 않는 연기를 보고 가슴두근두근 했던 생각이... 
10,어릴적 토요명화로 봤었는데 드뎌 찾았네요. 아직도 떨리는 느낌을 기억할정도의 영화 
10,최고 
10,나는 엠마뉴엘 베아르의 여리고 청순한 이미지를 사랑한다 
9,너무나 아름다운 천사와의 꿈같은 이야기. 꼭 다시보고 싶은 영화. 
10,중딩때 극장가서 보고 뿅~반해 버린영화..천사도 이뿌지만 스토리도 괜찮은..^^ 
10,정말 한심하게 유쾌한 영화. 
9,정말 오래전 추억의 영화...어린시절 이 영화로 인해 나에게도 이상형이 생겼었지... 
4,피비보려고 20년전 연흥극장에서 본 영화. 
10,모든 점수를 주어도 아깝지 않을 정말 예술적인 영화입니다. 모두들 빠져 봅시다!! 
10,꼭 다시 볼거얌 
10,아~~진짜 또 보구 싶다..^^;;추억의 영화... 
10,올만에 기억해 낸 영화...초딩인지 중딩인지 주말명화같은데서 했는데 
10,이젠 추억이 된 영화... 
10,어떠케구할수있나여 
10,꼭한번 다시 보고 싶습니다 초딩때 봤는데 아직도 아른아른 
10,이영화 구할려고 전국 비디오가계 수소문했다 
10,너무좋아하는영화!!!!!!! 
10,정말 이쁘다... 
10,베아르 여사의 살인미모;;모든남자가 꿈꾸는 바로 그 천사!!!--; 
10,영화의 작품성은 일단 무시하고 베아르의 미모로 모든게 용서 
10,엠마뉴엘 베아르를 위한 영화..피비케이츠는 굴욕적인.. 
10,정말옜날에봤는데너무좋은영화몇번을봐도 절대 안질림! 
10,죽기전에 마지막으로 보고 싶은 영화... 
10,참 아름답게 느껴졌던 천사로 기억되는 영화 
10,"저도 엄청 어렸을때 봐서 몰랐었는데 드디어 알게됐네요,이영화였어ㅠㅠ "
10,정말 좋은 영화예요... 평론은 별로 일지 몰라도 보면 감동의 물결^^ 
10,내 생애 최고의 영화 이 영화 구할수는 없나요 ㅠ.ㅠ 
10,내생에최고의영화 
6,8명의 연인보셔요~ㅋㅋ 
7,이 영화로 인해 엠마뉴엘 베아르를 너무도 좋아했었죠...지금은 뭐하는지. 
9,파워레인져 보다 유치한느낌인데 여주인공 너무이쁘다 그냥 여주보는맛으로 봐도 재밌다 ㅋㅋㅋㅋ 악역개불쌍 
2,베아르는 예쁘다. 근데...너무 유치; 
5,베아르만으론 허술함을 메우지 못한다. 
10,줄거리에 스토리 네타 다 되어 있네 ㅡ ㅡ 미쳤나 네이버 
10,재밌게 봤습니다 ㅎㅎㅎ 
8,피비케이츠 피비케이츠 하더니 명불허전 진짜 귀여워 미치는 줄... 엠마뉴엘 베아르란 천사역 여배우도 정말 이쁘지만 피비케이츠가 발렸다는 표현은 수긍이 안감 
1,난 1점준다 난 1993년생이라 잘 모르지만1980-1999년 영화를 572개 봤다.이렇게 망작영화는 몇개 안된다리들리 스콧 올리버스톤 프란시스 포드 코폴라 제임스 카메론 스티븐스필버그 데이빗 린치 스탠리 큐브릭 시...
6,막장 친구 vs. 막장 애인 vs. 막장부모 vs. 막장 천사.. ;;; 
2,그녀는 하나의 별 
5,피비 케이츠가 망가지는 영화..뭐 솔직히 지금보면 유치하다. 화장 진한 천사도 좀;;; 
3,20년 전에 봤다면 대작! 10년 전에 봤다면 수작! 하지만 판타지는 23년이란 시간이 독 
3,라스트씬은 괜찮았다. 
5,스플래쉬 천사판? 개인적으로는 천사가 그닥... 
1,엠마뉴엘 베아르를 위한 영화. 
5,에마뉴엘 베아르때문인가 평점은 이 정도밖에 줄 수없다 
1,최악의 영화 평점이 너무 높다... 안봤을때로 시간을 돌리고 싶음... 
