score,review
10,포스터가 어디서 많이 낮익다 
10,재밌어요 ..ㅠㅜ 
10,ㅠㅠㅠ........ 
9,발견 
9,오랫동안 기억에 남을것 같아요  오늘도 그장면 잊지 못하는걸 보니... 
10,가슴을 후벼파네요. 
10,야한것라고만 생각하다가 점점 빠져드는 정말 짠한 무언가가있는.... 
10,여운이 남는 영화 
8,너무 화려한 사랑 얘기를 기대하면 안될 영화군요.. 
7,솔직하지 못해서..근데 줄거리가 스포뺨치네 ㅋㅋ 
10,단지 에로에불과할줄알았던영화였는데 뭔가 잔잔한 감동이.... 
10,진짜...정말 재밌었던....ㅠㅠ아직도 짠하네요..ㅠㅠ 
10,"프라하의 봄,지붕킥은 쨉도 안되는 사랑의 자각. 탁월하다. "
10,아!! 다시 보고 싶다!! 근데... 어디서 받지...? ㅜ.ㅜ 
10,이토록 뜨거운 순간 
10,제인마치덕분에 비디오를 연체했었지 꿈에서나 봄직한 환상의 미소녀 
10,장자크 아노의 매력이 물씬 담겨있는 영화. 
10,고등학교때 봤던 감흥이 아직도 남아있어 나이든 지금 다시 보고픈 명작... 
9,개봉당시에  파격적인 베드신이었는데.. 
10,지금까지 가장 기억에 남는 영화. 장면이 포근하게 느껴진다.. 
9,내가 이걸 고딩때..봤는데; 정말 충격적이면서도 재밌었던걸로 기억 
10,남자의 로망 
10,고딩때 봤을때 무지 찐했던 기억이... 
10,최고다 소설로도 읽어보는거 추천 
10,음악도 너무 좋다.. 
10,내가 원했던 영화!(소년은 없나?) 
7,소설만큼은 아니지만 감독의 연출력만큼은 놀라울따름이다 
10,"캬, 중학교 때 비됴빌려보고 충격먹었던.. "
8,언제나 아련하고 불완전한 이미지로 내 가슴에 남아있는 영화 
9,장면장면 여운이 남는다. 
10,예전에 모르고 봤는데.. 명장 장자끄아노 라니.. 양가휘의 재발견 !! 
10,지금바도 멋진영화지만 제인마치이빨이 존헤저닮음.(나폴레옹다이너마이트) 
10,"야하지만 아름답다.. 영상도 아름답고,두 주인공 너무 매력적/ "
10,몸으로 눈빛으로 눈물로 사랑을 말하다. 내 가슴은찢어진다 
10,최고라는 말 밖엔 더이상 말이 필요없는 영화다. 
10,보고나서 어찌나 가슴이 아프던지..몇날 몇일 멜랑콜리하게 만들어버린 영화 
10,이 영화 정말 좋았다. 
10,어렸을때 봤을때랑 나이 먹고 보니 더 가슴아픈 사랑이야기 
9,이토록 잔잔한 멜로가 또 있을까..마치 옆 친구의 얘기를 듣는 느낌이다. 
10,소녀를 향한 남자의 간절한 사랑..장면장면이..계속 떠오른다. 
10,마지막 장면 소녀가 울때 나도 따라 울었다.. 사랑이란 그런거겠지 
10,이런 영화를 왜 이제서야 본거야..ㅜ.ㅜ 
10,고립된 남녀의 부딪힘. 사랑에 관한 최고의 영화. 
10,잊혀질만하면 또보게되는 영화. 그것도 사랑이었다... 
10,남녀사이의 미묘한 심리와 애증을 너무나 완벽하게 그려낸 영화 
9,사랑을 나누는 연인들의 섬세한 손길 같은 영화. 
10,최고!!! 가슴떨림의 극치~ 
9,곱씹을수록 좋은영화 
10,그들은 연인... 
10,이루어질수없었던 사랑이라해도..빛바라지 않는 사랑이기에.. 
8,가슴이 짠~하게 아려온다... 
8,외설을 거부하기 힘든 예술로 승화시키는 장 자크 아노의 능력. 
10,여운이 남는 영화.... 마음이 짠해지는그런참괜찮은영화다ㅋㅋ 
10,가슴이 아련해진다... 씁쓸한 여운.. 감동 그 자체 입니다. ㅠ 
10,지루한거같으면서도두배우의매력과영상에 빠져들게 되네요. 
10,여운이남는다란걸 느끼게 해주는영화 
10,정말 최고의 멜로.. 뒤쳐지지 않는 영상의세련미 
10,내 생에 가장 아름다운 영화 / 가장 감동깊은 영화 
10,쵝오 로리타이후로.. 난 왜이런장르를 좋아하는걸까-_- 
7,프리티 베이비보단 못하지만 장 자끄 아노감독의 다재다능함은.. 
10,가슴이 아픈영화 
10,극 중 이들 연인의 이름이 왜 기억이 안나지? 
10,제인마치의 17세 배드신만으로도 10점 
9,"나는 소녀가 되고, 소녀는 내가 된다. "
5,초딩때 18금이라 못봤는데 역시 상당히 야하다. 제인마치였다니 
6,괜찮았지만..깊이있진 않았다..ㅡㅡ; 
10,차안에서 슬며시 손잡는 장면을 어쩜 그리 스릴있고 야하게 담아 냈을까? 영화 내내 가장 여하게 느껴졌던 그 장면이 나에겐 손잡는 장면있었음. 
10,너무 슬퍼 그냥 감정이 너무 와닿아서.... 
6,"사랑이란 무엇일까 첫눈에 반해 담배를 건내 주는 것?, 낯선 타인과 육체적 관계를 수차례 맺고 난 후에 오는 것? 사랑은 언제 어디서 어떻게 오는 건지 많은 생각을 들게 한 영화. 사랑을 바로 깨닫기엔 그녀도 나도 ..."
9,평점이 높은 이유가 있네요 
9,예전에 그랬듯이 지금도 사랑하고 사랑을 멈추지 않을것이며 죽을때까지 사랑할거라고... 
10,나의 첫경험 나의 연인 . 
10,내가본영화중최고입니다 
10,러닝타임 내내 미묘한 감정선을 달린다. 그리고 마지막에 폭발한다. 단언컨데 인생영화. 
9,소녀처럼 그도 나를 생각해주었을까 
10,여운남는 가슴 먹먹해지는영화.. 
10,최근본영화중에젤재밌었당 
9,서로를 다른 이유와 방식으로 사랑했던. 시대상과 함께한 이야기 
9,유투브에서 내용이 좋다고해서 봤는데 넘 잼나게봤어요 양가휘가 지금은 아저씨지만 그 당시에는 정말 멋있게 나오네요 그렇게 멋있는 줄 몰랐어요 내용이 정말 좋네요 강추합니다 
10,여운이 깊은 영화입니다 
10,끝까지남는진한여운과아련함 
10,세밀한 감정 디테일까지 살린 걸작 
9,명작은 몇번을 다시봐도 명작. 
10,차안에서 손 잡는부분과 남주의 눈빛이 계속 떠오르네요 
8,이별이 사랑을 확인하는 엔딩씬 좋아슴 
8,배우들의 눈빛에서 감정이 느껴진다ㅔ 
10,아무생각없이 들어갔다 센치해져나오는 영화 
10,최고..손떨림과 미세한 감정 연기 ♥ 최고엥노 
8,오랜만에 양가휘 보니 반가웠어요 
10,옛날에 별 느낌없이 봤던 영화였는데..그냥 제인 마치라는배우만 기억하고..근데 나이를 먹어서 보니 이게 아름다운사랑 영화였다는걸 알았어요.마지막에 쇼팽 피아노곡 들으며 우는 장면 찡하더라는..아름다운 영화를 보게 되...
10,너무나 반가운 영화...꼭 다시 보고 싶어요 
10,커뮤니티 명작 소개글에서 본 것 같음! 분위기 완전 내 스타일이던데...재개봉하네 보러 가야겠다! 
10,대학4학년때개봉했던것같다..그땐이런슬픔과감동을못느꼈었다. 
10,"선상에서 만난 두 사람의 모습에 대한 기억에 이끌려... 사이공의 북적임, 전혀 다른 이방인 둘.. "
10,오랜만에 심장이 멎을뻔 했어요 
10,여운이 정말 많이 남았던 영화... 
10,마지막 이별하는 고동소리.. 멀리서 숨은듯 멈춰 바라보는 까만 차..배안에서 음악을 들으면서 웃음과 울음 섞인 슬픔ㅜㅜ 남자의 사랑이 애처롭고 슬펐습니다.. 
10,마지막에 소녀가 그 남자를 사랑함을 뒤늦게 깨닫고 눈물 흘릴 때를 잊을 수 없네요. 최근에 본 영화 중 가장 가슴아픈 사랑 이야기인듯.. 
10,아 페리안에서 우는 소녀..그리고 마지막 장면...가슴이 먹먹하다..소장하고 싶은 영화 
6,영상의 미화가 무안할 정도로 1차원적인 감정의 흐름.. 
6,과연 사랑일까 .. 감독의 제작의도가 궁금하네 .. 
8,8점이상이되 9점이하.요즘시점에선 그다지 선정적이지않다.대단히 서정적 
5,평이하고 공허함.. 
5,내 취향은  아닌듯. .그냥 다 따로노는 느낌 
9,사랑이라 할수없다 ...아프다 
10,사랑의 행위가 추하지 읺고 아름답게 느껴지는 영화다최고!!! 
10,"바라보기만 해도 뜨거워지는 마음, 이들이 연인이 아니면 누가 연인이란 말인가. "
10,넘 볼만한 영화에요강추합니다. 
10,남자는 평생 나을 수 없는 큰 상처를 안고 살아갔겠죠 ㅠㅠ 
3,뭔가? 아무느낌도 여운도 없다..게다가..지루함까지.. 
9,눈물난다! 엔딩크레딧 올라갈때 
10,사랑만 하고 살게 그냥 놔두면 안되나요? 넘 슬펐어요 
3,중딩시절 1994년쯤 한국에로비디오랑같이 비디오가게서 빌려본걸로 기억하는데 연인 진짜 재미없었음 평점이이렇게 높은지 이해가 안되네요.. 
10,꼴페미들이 이 영화 보고 아동 성매매 그루밍 이라고 랄지 랄지를 떠는 형태를 보니 지금 대한민국 에서는 못 만드는 명작!!! 마지막 장면에 울었다ㅠ 
6,나한텐 지루 했었다 정말 
1,뭐 이런 별 거 없는 영화가 평점이 이래높냐? 
1,어릴때 봤고 다시봤는데..네이버 평점이 부풀려져 너무높아서 작게준다. 
6,"보는 내내 찝찝했다. 예술로 포장한 소아성애영화. 중간에 때리는 장면에서 보다 말았다. 그러다가 일주일 뒤 한번 본건 끝까지 봐야지 했는데, 역시나 별로다. 다만 연출 장면구성이 아름다워서 그걸로먼 6점을 준다. "
3,너무 억지스럽고 애매했던 영화 
1,이건  원조교제죠안돼요 안돼 
10,24년전보고  티브이에서  우연히  다시봤는데제인마치와  양가휘의 연기가 다시한번  돋보이네여 
10,몇번을 봐도 여운이 남는 영화... 결국은 사랑이였음에도 이루어 질 수 없어 더 애절한 영화... 
9,여운 엄청나다찌질하면서도 순수한듯한 그를 양가휘가 멋있게 잘 표현해준 것 같다 
10,미성년자와의밀회사랑 그런나이격차에대한 편견이나 프레임을 가지고영화를 봤는데  보고난후 모든게해제 되버렸다고 설명해야하나가장 인상 깊고 좋았던건10대소녀 30대 성인어른남자 와의얘기라 꽤 칙칙함이있을지 알았는데양가휘의...
10,
10,슬픈영화네요  옛 생각도 나고??? 
10,야한영화라 생각하고 봤다가 슬픔을 느꼈네요.마지막 통화가 마음을 후벼파네요 
10,
10,이 영화가 비디오로 나올 당시 내가 중학생이었는데 여중생들 사이에 영화가 야하다고  소문났었지. 난 당시 못봤는데 그 당시엔 파격적이었겠다. 쓸데없이 베드신이 많긴한데 참 애절하다. 
9,
10,"2020년도에 보게됬지만 연출,영상,연기 모두 완벽한 작품....연령대 높은 영화일수록 스토리가 무너지는데 이영화는띵작입니다 ...남자주인공의 연기는 보는사람도 홀리네요.... "
10,정말 아름다운영화에요~여운이 남네요~오래갈것같아요~ 
10,사랑인줄 모르고..  후에 찾아오는 절절한 뜨거운감정을 느끼게되니 너무슬프고눈물이난다 
10,쇼팽 왈츠 10번눈물이왜이렇게 날까 
10,두고두고 보고 싶은 영화에요 
10,
10,진짜 다 끝나고나서후폭풍오는 영화 ..한번더봤다 
1,
10,
10,
10,영화를 보고 나서 한참동안이나 두 주인공이 계속 머릿속을 맴돈다. 뻔한 러브스토리를 뻔하지 않게 표현한 연출력과 배우들의 연기력이 영화를 이끌고 간다. 여러번 봐도 질리지 않고 볼 때마다 감동이 더 해가는 아름다운 ...
10,
10,
10,
10,아름답지 못한 시대 속 아름다운 삶. 지금의 관점으로만 재단해서는 모를. 
9,
10,아름다운 영화. 뭔가 답답하고 간질간질하다 
10,음악이 슬픔을 더한다... 
10,생각없이 봤는데 가슴이 절절해진 영화 
10,
10,각본을 엄마랑 남동생역으로 나온분들이 썼내요 
9,맑고깨끗한 금지된 사랑이랄까 남녀사이의 사랑엔 2가지가 있는데 이루어질수없는 사랑과 이루어질수 있는사랑그중에 이루어질수 없는 사랑이 더 강렬하고 더 뜨겁지 기억에 남는다 
10,
10,사랑은 부재할때 그의미를 알게 된다. 마지막까지 아름다웠던 영화 
10,
10,
10,
8,
10,
10,"사랑과 혐오, 빈곤과 부, 전쟁과 도피, 순수와 관능.그것은 사랑일까 트라우마일까. "
10,
10,
10,그냥슬펐다 가슴한켠이아파오는영화 
10,스토리가 잔잔하게 흐르는데 몰입되고 끝에 마음이 먹먹해지면서 여운이 깊게 남았어요 흑ㅠㅠ 
10,여주인공의 놀랄만한 미모에 끌려 보다가어느새 스토리에 빨려들어간 영화랄까.. 
8,
10,
10,여...여고생이 왜 남자랑 자는지 알아요? 외...외로워서에요. - 은교 
10,
10,
10,
10,
10,
10,
10,
10,사랑은 끝난게 끝난게 아니다 
10,이루지  못한  사랑이라서  슬프고  아름답다.  999일에  하루 모자라서  승천못한 이무기 
7,사랑의 절제 그리고 섬세함이 배우들로부터 잘 드러났다. 
10,"처음에 볼 때 나이차가 많이 나는 사랑이라서 단지 쾌락으로 끝날거라고 생각했지만 진짜 사랑이여서 더맘이 아프고 여운이 깊게 남네요.물론 폭력적인 부분은 별로였지만, 그래도 늙어서 몇OO이 지났을때도 사랑한다고 하는 ..."
10,야한 영화라고 했지만 사실 야한 부분은 조금이고 나머지는 그냥 애절하고 슬픔 ㅠㅠ 특히 마지막 장면은 더 슬픔 ㅠㅠ 나만 슬픈가 싶었던가?? 했더만 평점을 보니 다들 슬프다길래 다행..불륜영화처럼 소개된 점이 아쉽지...
10,이보다 아름다운 사랑이 있을까. 
10,"그들 앞에 거칠것이 없었다한들 그 남자의 사랑이 끝맺지 못한 사랑보다 더 영원할 수 있었을까, 그 여자의 사랑이 편견과 자존심보다 강할 수 있었을까. 헤어져서 더 아름다운 사람들. "
10,스토리가 아름답습니다. 
9,이게 언제적영환데 다시 재개봉을..ㅎㅎ 수작이라 지금 세대위해서 개봉했남..옛날에 무지 야하게봤던 영화였었는데..양가휘도 한때 잘나갔던 배우였었고..다시보니 새롭다.. 
9,가슴이 먹먹하고 마음이 복잡스럽다...소녀의 덤덤하게 중국인남자를 대하는 모습을 보면남자가 애잔하다... 
10,공백공백공백공백공백 
10,원작 소설도 일품... 
10,이 얼마나 아름다운 백일몽인가. 
10,참 재미있어요. 10자10자 
7,나름 볼만해요애매한 애정관계가 잘 느껴졌음 
10,"잔잔한 여운을 던지는 영화다운 아름다움-촬영예술감각 베트남의 시대적 ,배경이 아직도 아른거린다. "
8,죽은사람에게..어떻게 사랑한다고 할 수 있을까..지금 이 시대에도..똑같은 이유로 헤어지는 많은 연인들이 존재하지 않을까...슬펐다.. 
8,흐르는 분위기 숨소리 만으로 야하다. 그러나 너무나 저리고 아린영화. 
8,운명을 거스르는 마음 하나. 
10,저릿한 마음 나도 사랑을 원하는 사람 이라는걸  느끼게해준 영화  최고의 영화임 
9,양가휘가 짝사랑했던 쌤 닮아서 더 아련했던 영화 .... 
10,나름 영화kid라고;; 그 시절 몰래 본 높은 수위의 영화였으나 모든면에서 굉장한 수작 
8,흠... 이해는가네요.. 
10,여친이 추천해준 영화...........굿! 
8,좀 지루함은 있었지만 여운이 남는 영화 
8,알듯말듯 
6,글쎄.. 
10,"이걸 에로영화라고 말하는 사람은 대가리가 OO인가,? "
10,참나 고품격 에로영화라뇨? 
10,이걸 에로영화라고 말하는이는 그렇게 밖에 생각을 못해서이다 
10,무삭제영화를 보라. 야하다. 가난해서 슬픈 사람들의 담론... 
8,여주인공... 마지막에 울긴 왜울어ㅠㅠ 뚝!! 사랑이란 말이지... 
8,야한것뿐이아닌. 씁슬한 사랑? 이 우울하게 만든다.. 
10,멋진 영화! 화면이며 내용이며.. 
9,야한영화인줄만 알았는데..ㅠ 너무 감동적이잖아!!! 
9,무정하고 절제된 사랑... 씁슬한 뒷맛은 나를 젖게하였다 
10,이렇게가슴졸이면서본영화는처음이다.. 
10,절실한 그리움....... 스틸만 봐도 눈물이 난다. 
10,아름답고슬픈사랑...이루어질수없는... 
10,"날 눈물 범벅으로 만든,,,이보다 더 아름다운 멜로가 있을까. "
10,세계적인 소설을 세계적인 감독이 명작으로 빚어내다 
10,"내용,연기,영상,캐스팅..무엇하나완벽하지않은것이없다. "
9,소녀의 오열에 가슴이 먹먹해지는 영화 
7,아름다운 배경 만큼이나 두 배우는 잘 어울린다 .. 
10,정말 눈물이 주르륵 ㅠㅠ 
10,이때까지본영화들중에 가장 가슴이 아련해지는 영화다... 
10,가슴이너무아팠던영화..꼭한번보세요..잊을수없습니다 
10,굿굿. 
7,그냥 그렇던데-ㅅ- 
10,아픈 영화... 
10,내가슴에후유증을남긴최고의영화4편중하나..몇번을봐도눈물이... 
7,민망했고..기대이하였음 
10,정신없이 사랑하고 현명하게 이별한 연인 
10,남자는사랑을소녀는인생을말하다남자는유약하고소녀는성숙하다 
10,"왕가휘의 감정연기가 매우인상적이었고, 여운이많이남는영화 "
10,모처럼 정말 맘에드는 영화. 기분이 좋다. 
10,참... 아픈 영화... 지금 알 수 없는 것들에 대한 원망... 
6,두배우의매력♥하지만캐릭터설명이부족 
10,태어나 4번째로 나에게 깊은 눈물을 가져다 준 영화..... 
10,이영화가 진정 단 1개의 상도 수상하지 못했단말인가.... 
10,멍해집니다. 멍해져요..... 
10,꼭 볼영화.이런 영화1점주는 사람은 어떤사람일까. 
10,오랜만에 가슴을 뭉클하게 만든 영화다. 여운이 가시지 않는다. 
10,감동적. 다시 보고 싶은 그런 영화. 
10,양가휘~ 최고!!! 
10,"감동, "
10,그는 떨리는 손으로 내게 다가왔다. 
10,"이별이 보이기에, 그리고 너무나 다르기에 아름다웠던 그들 "
9,이렇게 야하게 울릴수도 있구나 가슴이 먹먹하다 
10,3번에 걸쳐서 드디어 끝까지 봤는데 정말 마지막 감동이다ㅠㅠ 
9,난 짐승이였군... 
10,최고의 영화.. 고3에게 일주일의 여운이란 악영향을 미친 영화! 
9,정말 오래전에 봤지만 그 감동만큼은 잊을수가 없는 영화. 
10,정말 감동이었습니다. 예전에 본건데 잊지 못하는 영화예요 
9,다시 보고싶다 
10,추천~! 
10,소녀가 배를타고 갈때 배웅나왔던 그장면...진짜 잊을수 없어요 
10,최고. 아름다운 영화 . 양가휘의 매력 
10,이루어질 수 없는 사랑으로 인한 이별...좋습니다 
10,안봤으면 큰일날뻔한 영화 
8,"소설로 봤다,,, 영화가 낫다 "
10,너무 아름다운영화...라는 말밖에는없는영화.. 
10,내겐 너무 아프고 아픈영화.. 
9,그냥 여운이 엄청나게 남는 영화 
10,꽤 된 영화였다니 볼때는그런느낌을못받은 영화이제라도봐서다행 
10,좋다는 말밖에 안나온다...근데 이게 나온지 10년도 넘었다니; 
10,몇번을 봐도 새로운 영화. Look at me.잊지못한다. 
10,아련한사랑의아픔이밀려온다 ..'널사랑하게될까봐두려워'.. 
10,뒤늦게 본 영화! 안보면 후회할 뻔 했어요.감동적이며 양가휘 짱 
10,아름답고 감동적이어서 야한부분이 추잡하게 느껴지지 않음!! 
10,섹시한 양가휘의 몸짓과 눈빛이 관건이었어요^^ 
10,너무너무 감동 감동 양가휘의 눈빛을 잊을수가 없어요.. 
9,92년 개봉작? 대단하다~ 이영화를 만든이들에게 찬사를 보낸다~ 
10,정말 가슴아픈 사랑 ㅜㅜ ............ 
10,명작! 
10,내 가슴이 왜 저리는지 나에게 설명이 필요했던 아름다은 영화 
10,"정말, 가슴 한구석이 저려오는 영화... "
10,몇년이 지나도..잊혀지지 않는 영화.. 
10,"""난 너에 대한 사랑 때문에 죽어가고 있어"" "
8,걸작 가슴 시린 사랑의 아픔 
10,"미세한 심리묘사가 맘에드는 작품, 다시보고싶다.. "
8,음 
10,사랑... 그 깊고도 가슴시린.. 지울수 없는 흔적.. 
9,"현실적이고 일상적이지만 내면을 파고드는, 진짜 사랑 영화 "
10,보면볼수록 생각나는 영화... 가슴에리는... 
10,지금까지본영화중최고로수위가높았던것같다. 보고난뒤공허함이가슴을에인다. 
10,양가휘 연기 잘하더라 ㅋㅋ 제가 정말 좋아하는 영화예요 
7,미성년이 보기엔 쬐금 야하죠^^:; 
10,양가휘를 좋아하게된 영화입니다..^^ 
10,마지막 장면... 정말 최고였습니다... 정말 감동이 찡~ 하게... 
10,"언젠가 이영화속의두사람같은사랑을 해볼꺼라고 꿈꾼다면 아직 어린걸까요,, "
10,가슴한구석이 찡한 영화.. 저도 마지막 장면에서 정말...ㅠ.ㅠ 
10,제인마치가 배에서 울었을땐 나도 눈물이 펑펑..독특한 사랑영화라고 생각함 
10,할 말이 없어지는 영화. 제대로 돈 쓴 영화!!! 
8,육체의 집요함을 넘 추구한 영화 뭔가 씁쓸해~아쉬워랕 
10,제인마치가 한 발을 배의 난간에 걸치고 먼곳을 응시하는 그림같은 장면은영 
10,"너무 아련 하네요, 눈물이나요 "
10,이거 왜이렇게 아름답냐..ㅜㅜ 
10,10점만점에 10점 25년전 영화가 어떻게 이럴 수가... 
10,순수하고 아름다운 사랑과 자연 
8,좋은 사랑 이야기 같아요. 
10,어릴 적에는 모르고 지나갔던 영화인데 나이가 들어보니 아름다운 작품이였네.그 사랑도 아름답고~ 
8,가난한 프랑스 소녀 옷차림이  인상적이네~~    근데 나만 이 영화가 괜찮았던건 아니었나봐. 
7,끌어들이는 마법같이 집중해서 본 영화 
10,"남자와 여자, 백인과 황인의 대비가 아슬아슬한 균형을 이루며 흔들리지만. 결국 같은 마음이었다는 것. "
10,시간이 지나도 멋진 명품영화 
10,여운이 남아 미치겠다. 무슨 말로 이 감정들을 표현해야할지... 
10,긴 여운이 남는 영화였다. 
7,사랑의 궁극을 돈과 순수로 표현하려 했지만  선정성을 극복하기에는 다소 부족했던 극전개가 아쉬운 작품 
10,스크린에서 볼 수 있어서 행복. 이국적인 분위기와 매력적인 두 사람. 두고 두고 보고 싶은 나의 연인! 
9,제 개봉되어 이렇게 좋은 영화를 볼 수 있어서 너무 좋았습니다. 
10,내생애 최고의 영화사랑에 빠진 남자의 감정을 너무 완벽히 묘사한 Tony Leung 때문에몇일이 지나도 심장이 두근거리는 영화 
8,마지막에 흘러 나오는 음악이 특히 좋았습니다. 
10,해당 소재로 만들 수 있는 꽤 괜찮은 영화 
8,예전의 추억을 되새기며 새로운 감성을 다시 불러 일으키는 영화네요.어렸을때는 몰랐던 사랑이라는 느낌을 알게되고추억을  되새김질하는 좋은 시간을가졌네요 
9,기대한만큼 충분히 뜨겁고 아름다웠던 영화. 결국  아련아련해지게 만들었어...ㅠㅠ 
10,소설로 먼저 알던 작품인데 원작에서받았던 느낌을 잘 살린거같아요 
10,다시보니 처음이랑 다른 느낌 
10,양가휘...소녀가부러웠다ㅠ. 중국인남자와소녀 너무안타까웠다...베드신이야하게느껴지지않을정도로 아름답고먹먹한 로맨스영화ㅠㅠ 
7,L'Amant.... 
6,"초중반까지는 소녀 버전 엠마뉴엘을 보는 느낌이었으나, 이별 장면부터는 감동적이었음.식민지에 간 프랑스인, 프랑스 유학 다녀온 중국인이 영어를 말한다는게 좀 안어울림. 프랑스어였다면 몰입도가 더 좋았을듯... "
10,양가휘 너무멋지다.지금모습은 아니지만.. 
10,아름다운 영화입니다. 여운이 정말 오래가고가슴이 저리네요 ㅠ 
10,쿵쿵쿵쿵쿵쾅쾅 
7,주인공들 연기가 좀 아쉽 
9,소년과 남자의 아름다운 사랑 
10,무삭제판의 야릇함...을 뛰어넘는 서정미 
8,몇몇 불필요한 선정적장면이 없었더라면 더 예쁘게 완성됐을텐데 
10,인생영화. 여운이 강하게 남는다. 
10,이 영화보고 남자볼때 손 보게된 여자들 꽤 될걸?말이 필요없다. 아름다운 영화란 이런것. 
9,무심함과 건조함으로 섬세하게도 표현해내는 감정 
10,"너무 좋았어요, 고전 영화 재개봉하는거 정말 좋아요 "
9,오랜만에 다시 보는 영화였네요. 추천합니다. 
9,영화는역사이며고전임이틀림없습니다시간이한참지난후에다시만나는영화인지라감동도큽니다섬세한연기에감동할수있어서감사드려요 
10,90년대 최고 고단백영화 
10,good!  좋은영화같습니다 
6,사실 베드씬밖에 건질게 없다 ㅋㅋ 
10,최고의영화봐도봐도 설레고 가슴 저리는...에로틱을 뛰어넘는 수작둘다 최고의 남녀배우나의청춘이그립다 
9,이해할 수 없는 장치인데도 설득당해버렸다. 
9,기억에 남을 아름다운 로맨스 영화. 연인과 함께 보러갔는데 서로의 기억속에 영원히 남을 것 같습니다. 
8,볼만하고 남자가 불쌍합니다.ㅜㅜㅜ 
8,좀 야하긴 한데 그걸 떠나 스토리 자체는 생각보다 괜찮았다. 
10,기대 이상이네요. 오랫만에 넘 좋았어요~~ 
8,된장녀와 반푼이재벌2세. 그래도 사랑은 아름답다. 그래서 눈물난다. 
1,사랑같은 소리하고 자빠졌네. 사랑팔이하니까 은교같이 미성년자 탐하는 변태미화하는 사람이 생기는거야 
