score,review
10,"마지막씬에서 울었네요,, "
10,마지막까지.. 진짜 사랑이였구나 느껴짐 
8,영화의 색채가 예쁜듯하다 
9,예술과 외설의 차이점을 극명하게 설명해줄수 있는 영화. 포스터와는 상반되는 내용과 연출에 놀랐고  영화의 뛰어난 메세지가 오랫동안  가슴에 남는다. 
10,뭔가 지저분하면서 아련한 영화 
8,제인 마치.. 
10,간절한  떨림...... 
10,이틀전 본  영화 연인  소녀의순결은 이영화에서처럼 누군가에게 선물이되야한다고 나는생각한다   지금세대는 순결의값 이 뭔지도모르는  동물차원으로추락한듯ㅠㅠ   소녀를 얻기위해  아버지께 간청하는남자   ??  모든것...
10,"연인 영화감상 후 후폭풍이 ㅠ 이런 사랑해보고 싶네요. 차안에서 손터치로 오는 온몸의 전율, 말없이 서로를 미친듯 갈망하는 sex. 양가휘 너무 섹시하네요. "
10,꼭 봐라 두번 봐라 열번봐도 된다 
5,마지막 소리없는 배웅에 기분이 묘해진다 
8,스토리는 단순함. 돈많고 할일없는 한량과 불안정한 소녀의 불장난. 주인공들의 아름다움과 영상미로 눈호강함. 
9,사랑이었을까? 개봉 당시는 엄청 논란이었는데요.. 
10,"지금까지 수없이 봤고 앞으로도, 늙어서도 수없이 볼 인생영화.연출,연기,배경,음악,어느것하나 흠잡을 수 없는 영화.볼때마다 느낌이 다르고, 볼때마다  가슴이 저리고, 동시에 설레기도 하는, 그리고 인생에 대해서 생각..."
10,20년이나 지난는 되도  이영화는 내머리 에서 사라지질  않았네  나에겐 예술인가보다 
10,떠나온 배안에서 소녀는 비로소 깨달았다...그것은 사랑이었노라고... 
10,헐.. 이거 재개봉임? ㄷㄷㄷ 
9,태어나기도 전에 만들어진 영화...하지만 내 새끼손가락이 떨리고 가슴이먹먹해지는 멜로였다. 
10,사랑... 끝없는 자존심의 대립... 
7,옛 사랑에 대한 추억을 떠올리게 하는 영화. 
7,이렇게 격정적인 사랑을 추하지 않게 그렸다는 것만으로도 괜찮다. 
10,소녀가 뒤마호에 타서 차를 바라보던 그 장면이 자꾸 생각난다 차 안 남자는 어땠을까.. 
9,야한장면 보려고 돌려봤고 두번째 봤을땐 울면서 봤다. 
10,어릴땐 그저 야한 영화인줄만 알았죠 .. 나이먹어 다시보니 넘 슬픈 영화 .. 
9,시간이 지나도 절절한 영화.. 
10,"계속 생각남,  짠하다,,  이런게 여운이 남는다고 하는건가,, "
9,지독한 아트영화! 어찌 이 영화에 외설을 거론할 수 있나 
10,아름다우면서도 애절하다.. 내 생애의 영화 top10안에 든다.. 아릿하다. 
10,"돈많은 중국인이 좋았던 소녀. 돈에 끌렸던, 여자가 되어가는 소녀에게 중국인은 성적호기심을 풀어줄 대상이었던건 간에 그둘의 사랑은 뜨거웠고 , 아름다웠다. "
1,사랑이 아니라 범죄다.. 
4,불만투성이 서양소녀가 동양떼부자아들과 놀아난다는.. 엑조틱한 배경으로 뜬 과대평가된 작품. 
1,이게 명작이라고? 진심 단체로 머리에 총맞았나ㅋㅋㅋ 
10,"후유증이 있는 영화, 너무 디테일해서 몇번을 봐도 새로운 뜻을 발견할 수 있다. 남주가 하얀수트를 입을 때면 사랑의 시작과 혹시나 모를 연결의 희망, 설레임을 담아내고. 검은수트에는 다툼, 사무치는 괴로움, 미래를 ..."
10,남자의 사랑이 너무 마음 아팠고 마지막 검은차 나올때부터 가슴이 먹먹하게 울었네요 
10,"마지막, 차 안에서 남자의 마음은 어땠을까...그들은 연인이었다. "
10,여운이 많이 남는 영화. 손이 맞닿을 때 어느 장면보다 더 로맨틱했었음 
10,"슬프다 애절한 눈빛에 몸짓에, 대사에,음악에 "
10,이 영화 이제서야보고 엔딩크레딧이 올라갈때야 펑펑 눈물이 나는 영화....이렇게 먹먹하고 변하지않는 사랑이라니...  엉엉 
10,가슴이 먹먹.. 양가휘의 표정연기의 섬세함에서 모든 감정이 이입됐다.. 아름답고 슬픈..여운이 짙게 남는 영화 
10,나도 이런사랑을 했었던가끝나고 난 후 눈물이 멈추질 않네연인과 보고싶은 최고의 영화 
10,너무 마음이 아리는 영화네요... 소녀는 쇼팽의 음악을 들으며 그를 사랑했었고 둘은 연인이었단걸 깨달았죠 
8,양가휘인상적이다. 이제사 보다니. 어리석다.1992년 작품을.그때 봤어야 하는데.영화는 타이밍이다.영화가 개봉될 때 시대를 알고 봐야한다.타이밍을 놓치면 당시에 애절하게 표현하고 싶었던 영화적 메세지를 지나치고 세월...
10,개인적으로 로리타보다 훨씬좋았다 시를 영화로 표현한느낌이랄까 가슴아프다 
10,아 진짜 계속 먹먹하네.. 왜이리 슬픈지.. 소녀가 사랑을 깨닫는순간..정말슬퍼 
10,이보다 에로틱속에 로맨스를 잘 녹여낼 영화가 있을까. 
10,사랑이었다는.... 
9,빗소리마저 요염하다.슬프고 애잔하다. 
8,풍덩하고 빠져보는것도 사랑이다. 
9,워낙 인상적이고 매력적인 영화라 예전에도 dvd로 몇번이고 봐서 영화관에서 봤을 때 큰 감흥은 없었다. 그럼에도 역시 명작인건 분명! 양가위와 제인마치의 열연이 매혹적이다. 
10,여러봐도  그때마디 느낌이 달라집니다.20대에 30대에 40대에~~~이젠 가슴이 아련하게 저며옵니다.장자크 아노   베트남 사이공에 가고싶을만큼아흠답게  그곳을 찍었습니다.20년이 지나도  아흠다운건 변하지않습니다....
10,태어난 해에 개봉한 영화를 스크린으로 보니 느낌이 새롭네요. 소설로 봤을 때와는 또 다른 느낌이어서 좋았습니다. 
8,에로영화의 로맨스화 랄까 
10,책보다 영화가 더 감동적인 작품입니다. 여운이 오래가네요.. 
8,세월이 한참 지나서도 사랑한다고 고백... 나는 저럴 수 있을까? 
10,이거 오래 되서 기억이 거의 나지 않지만 이거 참 아름다운 영화였다고 생각했었음 
7,가랑이 사이로 휘두른 욕망은 가슴에게 사랑이었다고 이야기한다. 
7,"가난하건 부자건 상관없이, 그들에게 삶이란 너무 버겁고 힘들다. 그래서 누구는 마약에, 누구는 사랑에 취해 정신없이 살아가고 있는 것인지 모른다. 나름  괜찮은 영화다 "
9,정말 아름다운 사랑이야기다 나도 이런 사랑해보고싶다 
10,최고의 영화!! +_+)b 
10,애절한 사랑... 
10,난생 처음으로 별점준다. 장자끄아노의 장면 장면마다의 연출력은 죽여준다. 
10,너무 강렬하게 가슴깊이 남는영화.신선한 충격.그리고 알수없는 여운.잊을수가 없다.. 
10,정말 가슴이 너무 아리는 영화다. 
10,"아팠다, 그리고 생각났다 그 순간들이 "
10,육체적인사랑도사랑인것이다...섬세하다...최고다... 
10,아 그건 사랑이었구나 사랑이었어 
7,그건 아마 사랑이었을거야 
7,아련함이 오래 가네요... 
9,대학교 1학년때 개봉했던 그 영화를 40대가 되어 다시  볼 수 있는 즐거움이란..  다시 봐도 좋은 명작...  카메라 앵들에  담아낸 장면 하나하나가 예술..음악도 예술.. 달밤에 쇼팽의 왈츠를 통해  뒤늦게 깨...
8,제인마치의 연기가 인상깊네요 
8,다시 보는 작픔인대도 괜찮네요..파격적일땐 과감하게 표현은 과하지 않게 묘한 매력이 맀는 작품입니다 
10,사랑스럽고 아름다운 영화 
6,아름답다고는 할수없지만 그렇다고 추하지도 않다.. 
10,당시 배경이 식민지배를 받던 환경이 이들 사랑을 더욱 착잡하고 안타깝게 만들어준것같다그리고 제인 마치는 요즘 뭐하는지ㅠㅠ 작품좀 많이 찍어주시지... 
10,오늘 재개봉 시사회 가는데 기대 됩니다 
10,"10년이 넘는 세월이 지났음에도 영화음악과, 영화 장면하나하나가 기억에 남는다. 이렇게 슬프고도 아름답고 에로틱한 영화를 찾아 보기도 힘들듯. "
10,잔잔한 영상 가운데 격한 감정의 흐름이 느껴짐 
10,내인생잊지못할최고의영화 
10,갈래머리에 모자를쓴 제인마치의 모습이 고귀해 보이던...ㅎ 
4,내로남불이란 말이 딱이다. 내가 하면 사랑 남이 하면 매춘 같이 있을 때 사랑한다고 해본적도 없는 그녀는 과연 사랑을 했던 것이라 할 수있을까? 자신의 매춘을 사랑이었다고 포장한 스토리 혹은 매춘과정에서 피어난 정 ...
10,외설과 예술의 차이를 이 영화를 보고서 느꼈네요. 영화를 보고 다양한 생각을 할 수 있지만 ‘로리타’가 먼저 떠오르는 사람들이 이 영화를 칭찬하는 사람들보다 더 외설적인 것 같네요. 양가휘의 섬세하고 아름다운 연기 ...
10,"정말로 아름답고, 가슴시린 러브스토리 입니다. "
10,Perfect Love 
2,이렇게까지 별점이 높다니... 
8,위대한 개츠비가 떠오르는 영화. 
8,원작에 너무 감명받아서 실망할줄알았는데 되게괜찮음 원작에 나름 충실한데다 시각적즐거움까지ㅎ 
1,"원조교제의 지나친 미화, 소문처럼 야하진 않음 "
8,2020년에 다시보는데 왜케 재밌지... 슬프기도하고 
10,로맨스의 고전으로 계속 기억될 명작 
10,진한 여운이 남는 영화 나이들어 다시보니 감동이 다르네요 
10,끈적하지만 먹먹하다.. 
10,사랑은 늦게 아는법... 
10,상상했던 것보다 멋진 영화였음 
10,끝날때 씁슬한 기분을 느꼈다. 야하다기보단 슬픈영화였다. 
9,슬프다. 뇌리에서 오랫동안머무를거같으다.콕! 
10,어릴때 볼땐 그냥 야하다고 생각했는데 나이들고 보니.. 눈물 나더라ㅠ 
10,"시대적 배경을 잘 그려낸거같아서 너무 재밌게 봤어요. 연출,연기 모든게 완벽한 예술적인 영화! "
7,열연을 펼친 제인마치! 
10,먹먹하고 답답하고 슬프고 아름다워요... 
10,아련한 영화음악이 더 와닿는 영화! 
8,그를 원망하진 않는다. 자신이 세워놓은 거리감이 슬프다는 것만 깨닫고. 
8,여운이 길게 남은 영화였다. 마지막 선박 장면이 참 슬펐다. 
10,재개봉해서 다시 봤는데 재밋네요강추합니다 
10,25살때 보고 20년이 훌쩍 넘어서 오늘 재개봉으로 다시 봤습니다.더 진한 여운으로 소녀같이 눈물을 흘리고 왔네요.예전에 못 느꼈던 감정이 나이 들어서 보니까 알지못할 가슴 한 켠이 아려 옵니다 
10,아름답고 슬프로 아련한 첫사랑을 파격적으로 그린 must-see-film. 
10,고딩때 봤지만 아름답다고 생각했음.. 
10,유학시절 이루지못했던 첫사랑을 떠올리게 한 영화 그때는 그사람을 사랑했는지 몰랐지만  세월이 흐르고 결혼도 하고 애도 낳았지만  아직도  잊지못하고 때때로 가슴 먹먹해지는건  그사람을 사랑했었다는것  지금도 사랑한다...
10, 가슴속 뭉클한  열병  사람과 사람  여자와 남자  어렵지 않은거  맞는거지  사랑이라는거 
9,예술적 외설물. 아름답고 비극적이다 
9,너무 짠하고..에로틱하네요~굿 
10,볼때마다~!!최고의영화다!! 
10,볼때마다 가슴시린..정말 내생에 최고의 영화!! 
10,goooood 
10,내 생애 최고의 영화중 하나 
8,에로틱하고 아름답다 
10,"죽기전에 꼭봐야할 멜로영화,,여운이 남는 짠한영화,,,,,,최고임. "
10,물결처럼 여운이 퍼져 나가는 영화 
8,"당시 엄청 야했고, 제인 마치의 앳된 외모와 가슴 아린 엔딩이 잊혀지지 않던 작품 "
10,가슴에 남는영화 
10,잔잔하지만 굉장히 인상깊게 봤습니다~ 
10,가슴에 남는 영화 
10,"여운이 깊게 남는영화, "
8,가슴아픈 사랑을 정말 서정적으로 잘 그린 영화라고 생각한다. 
10,살아가면서 저런 열정적인 사랑한번쯤 해볼수 있을까... 
9,아슬아슬한 소녀의 마음이 알듯 전해져온다 
8,사랑이었을까...........?사랑이다라고 감히 말하고싶은... 
10,"뭔가 가슴이 따뜻해지는,, 주인공 둘다 너무 매력있다. "
9,영화가 너무 섬세해서 아름다운 소설 한 편을 읽은 것 같다 쓸데없이 자극적이고 야한 영화를 극혐하는데 이 영화는 그들의 정사씬이 반드시 필요했다 사랑을 대놓고 표현 할 수 없는 이 두 사람에게 몸을 섞는 행위야말로 ...
10,누가봐도 서로를 사랑하고 있는 연인인데.. 연인이라 떳떳히 말할수 없는 슬픈 연인ㅠㅠ 사랑은 국적도 나이도 뛰어넘는다는 말을 이 영화를보고 마음속 깊이 깨닳았습니다. 영화를 보며 펑펑 울었어요. 예전에 우연히 보았고...
10, 패션 관련 일을 하는 나는 제인마치의 스타일링이  이렇게 오랜 시간이 지나도록 센스있음에 감탄하며 보다가 양가휘의 매력에 감탄하다 감독과 영상미에 또 감탄한 근래 가장 기억에 남는 영화였다. 
10,진짜 인생영화 등극.. 이 좋은 영화를 왜 이제서야 봤을까?! 양가휘는 너무멋있고 제인마치는 너무 아름답다.. 영화를 보고 하루종일 엉엉 울었다.. 여운이 가시질않는다. 인생영화라 계속 보고싶은데 차마 너무 슬퍼서 ...
8,옛날에 보고 지금보니 느낌이 다른.. 옛날 영화라 요즘 감성과 살짝 달라 감정이입이 방해되는 듯 하나 어찌되었든 좋은 작품 좀 더  감정 몰입이되었으면 
10,앨범에 잘 보관해 내 인생과 함께 가는 영화 
10,내용을 다 떠나 여주인공이 너무 예뻐서 기억에 남는 영화. 
10,나도 모르게 눈물이 또로록 
9,아련한 첫사랑이련가? 
7,애틋한 사랑이 연기를 통해 더 잘 드러났다면 좋았을 듯 싶다. 
4,뒤라스마저 손떼 버렸던 형편없는 졸작. 목석같은 연기. 
6,제인마치 예뻣고 영화 상당히 야했다. 고품격 에로영화일뿐. 
5,뜬금없게도 가난과 불우한 가정환경이 매춘과 조금 관계가 있을 수도 있겠다라는 생각을 하게 하는 슬픈 영화. 
9,소리.청각까지 아름다운 영화!명작은 역시 시간이지나도 세련되고 뭉클하다. 
7,서로 끌림에 의해 만났지만 사랑이 아니라고 부정하다 헤어질때야 비로소 깨닫게된다. 잔잔한 음악과 메콩강의 풍광은 아름답지만 조금은 지루했다. 
10,잊지 못할 사랑을 해본 사람은 행복하겠죠? 
10,극장에서 또 보고싶은데 어디서 하는지 좀... 
3,발연기의 향연과 발연기를 돋보이게 하는 촌스러운 카메라 무빙. 어딘가 많이 부족한 스토리. 하지만 배 떠나가는 씬만큼은 인정. 
5,"스토리 전개과정이나 연출이 진부하고 어색하게 느껴지는 대목도 많은데, 진짜 영화를 보고 평점 매긴게 맞는지 모르겠다. 모르지.. 당시에는 이런 내용이 신선했는지도.. 하지만 지금 시대에 평가하자면..쩝 "
1,걍 그래...후....별루.... 
2,네이버 평점에 낚인 영화...도대체 어떤 부분이 그렇게 감동적인건지 이해가 안가고 돈이 많아서 일도안하고 평생 사랑만 해오면서 외국여자도 많이 만나봤던 남자가 갑자기 여자주인공한테 푹빠져서 평생을 잊지 못할정도로 사...
1,그냥 로리타다 욕정 이런거 조아하면 소아성애지다 
2,도대체 어느부분이 아름다운 사랑인건지.. 어리고 예쁜 서양여자의 외모에 홀려서 찝쩍거리는 나이많은 동양남자와 성에 호기심있는 어린여학생의 문란한 성생활로밖에 보이지않음. 
4,결국은 원조교제나 다름없는걸 아름답게 미화시킨. 배경이 옛날 베트남이라 그럴수 있다고 그냥 넘어간다 
10,고딩때 그저 야한영화 정도로만 생각하고 친구랑 엄마몰래 본 기억이 있었다 그때는 스토리보다는 그당시 충격적이었던 정사씬만 가물가물 기억이 났었는데 40대가 된지금 다시 천천히 영화를보니 아름다운 영상미와 스토리 그리...
10,항구에서 배가 멀어질 때 서서히 보이기 시작하는 남자의 까만 자동차와 함께 흐르는 배경음악에 항상 눈물이 주르륵 그리고 바다 한가운데서 뒤늦게 깨닫게 된 소녀의 사랑이 절절하다. 
10,요즘시대와비교할수없는느낌 
10,다 떠나서 영상미촬영감독 대박이다 
10,그녀를 사랑하지만  이루어질수없는 현실앞에선 너무도 나약한 그이기에그 슬픔을 고스란히 안고가는 그 모습이 너무도 슬펐당두번째 보니 양가휘 감정선이 그려지면서 너무도슬프네요 ㅠㅠ 
10,"이 영화를 마지막으로 양가휘 영화를 끊었다. '중국인 남자'의 캐릭터가 온전하게 내 인생에 영향을 미치게 하기 위해서, 다른 캐릭터로 분한 양가휘를 볼 수가 없다.  진짜가 아니고, 단지 영화에서의 캐..."
7,넷플릭스에 있기에 우연히 봤다가 2시간 동안 몰입해서 봄. 노출은 상당히 강함에도 불구하고 전혀 거부감 없이 잔잔하게 봤음. 마지막 항구 장면에서 나도 모르게 먹먹한 감정이 올라온다. 
10,"스토리, 영상미, 감정선 모두 좋은데, 그 무엇보다 여배우의 연기가 정말 자연스럽네. 마치 진짜로 사랑을 느끼는 것 같아... "
9,어릴때 하도이슈화되서 궁금해봤을때는 못느낀것들이...지금 다 와닿아진다..그녀도 처음부터 사랑이었는데. 지금보아도 영상이 참아름답고 선정을 위해 만든 영화가아닌 한장면한장면 모두 의미있지만 간결하고 담백하게 그려낸듯...
10,이런 아름다운 스토리에 에로틱한 영화가 또 있을까? 
10,막판에 울었음..ㅜㅜ 
7,그를 사랑했는지는 잘 모르지만 사랑을 잃었다는 것은 확신할 수 있다 
10,그냥 최고 꼭 보세요 강추합니다 
10,항상 담담한 소녀가 쇼팽의 왈츠를 듣고 마지막에 흐르는 눈물....담담히 영화를 보다 마지막에 강이 눈물이 터져버렸다... 
10,보고 보고 또 봐도 너무나 아름다운 영화 
10,가슴 속 깊이  남을 아름다운 영화입니다.살면서  한번쯤은 경험해볼  숨막히게  빠져드는  사랑과  가슴시린  이별의  감정선을  너무  잘  표현한것같아요.. 여운이  크게  남네요.... 
7,가슴이 저려오는 에로시티즘 
10,서툴지만 섬세하고 아름다운 사랑 이야기.. 쇼팽 노래가 아직도 귓가에 맴돈다 
10,"어떡해요...가슴이 미어진다. 영화가 끝난 뒤, 먹먹한 사랑에 눈물만 흐르고ㅠㅠ양가휘의 눈빛, 표정에서 그의 모든 고뇌와 사랑..진심이 고스란히..전해졌다.너무 슬프다.내 인생영화. 잊지 못할 것 같다. "
10,아름다워요. 배경도 음악도 연기도 먹먹하네요. 
10,늦게나마 찾아본영화 베드신이 워낙유명해 찾아본 영화지만 본순간 양가휘에 대사한마디 마지막 눈물과대사에 결국 같이 울어버리고만..가벼운맘으로본영화지만 결국가슴에 알수없는 아련함한가득 대사하나 가슴에꼿히는 영화ㅜ 
10,내가 가장 기억에 남는 장면은 첫째 오빠가 배타고 떠나는 장면. 단 몇 초만에 책에서만 볼 수 있는 이 가족의 비극적인 슬픔을 보여준다. 다들 연기 최고다. 
10,처음부터 끝까지 푹 빠져 봤어요. 
7,사랑은 사랑이 끝난뒤에 비로소 알수있는 감정이었다 
10,너무 가슴아픈 영화.. 이거 보고 얼마나 방황했는지... 
9,정말 사랑일까? 사랑이다.. 지독하게 아련한.. 부조화스러운 연인들의 사랑 
10,배에서 자신의 사랑을 깨닫고 우는 제인마치의 모습이 인상적 
10,진짜 재밌게 봤다내가 태어나기도 전의 영화인데전혀 촌스럽지않고 오히려 멋스러웠다.양가위 존잘 
8,명작이라고 소개해준 영상을 보고 찾아봐서 보게 되었는데 여운이 남아서 하루종일 검색해보고 있는중.. 양가휘는 너무 매력적이었고  제인마치는 정말 너무 이뻣다. 야하다는 느낌보다 애잔하고 아름다운.. 이뤄질수없는 .....
8,옛날에 멋모르고 봤을 때와는 이해도가 다르네요.여운이 많이 남는 영화입니다. 
10,25년이 지나도 전혀 촌스럽지가 않은영화 
8,"두 사람의 감정 연기가 인상 깊었던 영화. 소녀가 피아노 소리를 들으며 흐느끼는 장면이 제일 기억에 남는다. 연인이라는 정의에 대해서 다시 생각해보게 한다. 바보같은 선택이 최선의 선택이라는 것이, 어린 소녀의 담대..."
9,통속적이지 않게 에로틱한장면을 영상예술로 잘빚어냈다. 끝나고 엄습해오는 아련한  첫사랑의 아쉬움은 무엇인가? 
10,시사회 당첨되서 보러 가는데 기대됩니다 
10,점점볼수록 발기가 되지않았다 
10,개설렘손잡을때내가다설렘 
10,야한데 아련함이 이기는 영화 강추~~ 
4,자신의 성적호기심과 가난함을 찌질한 갑부에게서 해결한걸 합리화하는것 같다. 나중에서야 사랑이었다고 하지만 찝찝한건 여전. 
1,이걸 왜봤지ㅠ.ㅠ. 
1,별로 
1,15살 32살 말이되냐? 소아성애 영화 ; 정신감정 해봐야합니다 
4,그들이 사랑이라고 한다면 사랑이겠지만... 
10,그동안 에로영화로만 알고 있어서 영화에 미안했다.  정말 배우들 연기도 좋고 아련하고...가슴저릿한 감동이 있는영화 
10,끝까지 봐야 모든 장면 하나하나가 의미를 담고 있다는걸 깨닫는 그런 여운이 깊은 영화. 웬만하면 평점 안남기지만 진짜 가슴에 남는 영화네요. 추천합니다 
8,"그에게는 자신을 파멸로 이끄는, 그녀에게는 시간이 흐른후에 사랑임을 깨닫는 인간의 어리석은 감정, 하지만 살면서 이를 피할 순 없다. Gabriel Yared의 OST가 인도차이나의 강줄기를 따라 격조있게 흐르는 애..."
9,작년 CGV 기획전에서 처음 본 영화. 혼자 보러 가서 왼쪽에 혼자온 여성 분 오른쪽에 혼자온 남성 분과 나란히 앉아서 봤는데 셋 다 울면서 감상했다. 선정적인 연출은 별로 기억에 없고 슬픈 사랑이야기만 기억에 남는...
10,난 서로 사랑한다는걸 알고 있다고 믿고 싶다 
10,"우연히 봤을땐 단순히 야한영화라고 생각했는데, 보면볼수록 생각을 많이하게 만드는영화.연기도 정말 잘하고.잘만든 영화같다. "
10,어렸을때 잘 몰랐던 감성을 다시 느낍니다. 어른이 되고나니. 이렇게 아름답다는 것을 그땐 잘 몰랐습니다. 
10,가슴이 너무 아픈 영화.. 
10,재개봉 다시봤어요..다시봐도 감동이.. 
10,차 안에서 손가락 처음 닿는 장면에서 감탄을.. 
10,사랑은 영원히 흐르는 강물의 풍경처럼 마음에 흐른다.. 
10,정말 아름다운 에로티시즘을 보여주는 명작 
10,얼마전에 본 메디슨 카운티의 다리에서도 영원한 사랑의 표현들을 보면서 애잔하지만 저런 사랑이 진짜 있을까 싶었다. 이 영화를 보면서 마찬가지의 의구심이 들었는데 아마도 내가 아직 진짜의 경험이 없어서인 것 같다.. 
10,최고에 영화여자에 가족들이 너무나도 싫었다 
10,"짱짱 여운이 오래감,, "
10,슬프다.. 여운이 남는 
10,마음이 아픈영화 아닌거같으면서도 끝에는 마음이아프다 
10,20년이 지나 다시 봣는데..정말 잊지못하고 다시 본 보람이 있네요..몇번 더 다시 볼 것 같아요. 
10,예상하지 못한 먹먹함.. 마지막까지 항구에 있단 검정 차량이 계속 생각나네요 
9,명작이다. 관련영화 : 로리타 베티블루 
10,영화가 시대적배경도 참좋았어요 
8,기대를너무많이했나요?ㅎㅎ 그래도영상은 아름답네요 
10,"영화가 끝나고 난 뒤 남는 짙은 여운은, 2016년의 극장에서 다시 봐도 같은가봐요. "
9,진실한 사랑  배트남사람들의 생활 메콩강의 풍경 등 좋은 영화였습니다 
7,오랜시간 사랑받은 영화! 그 이유는 알것같은데 큰 공감은 되지않은ㅠㅠ 
10,오래전 기억이 떠오른다 
9,아름다운 음악과 영상미..진정한 에로티시즘이 뭔지 보여주는 영화.이상하게 힐링마저 되는 것 같다. 
10,넘나 재밌었어요~~~ 
10,마지막 여주인공 떠날때 남주인공의 애틋함...감동입니다... 
9,다시보니 더 느낌이 좋은영화중 하나 
10,싸이공이였던거같은데  배경도멋있고 여운이 남는 영화를봤네요. 
8,약간충격적이면서도슬프면서도불안하면서도어떻게저렇게까지사랑할수있나싶기도하면서... 불어가아닌영어로바뀌어상영이되어서조금아쉬웠다 그래도추천! 
9,좋게보았읍니다.... 
10,배경이 넘 멋지구요. 제인마치 진짜 어리네요. 제인마치 가족들과 양가휘와의 첫 식사장면 넘 재밌고 인상적이였네요 
10,마지막 배를 타고 떠나는 소녀를 지켜보는 검정차 안의 남자가 인상적이었다.아주 
8,처음 봤을 때 이해할 수 없었고 아직까지도 이해할 수 없는 영화.그럼에도 보기를 멈출 수 없는 영화. 
9,좋다 ! 그냥 좋다! 말이 필요있나! 좋다! 
10,최고...슬프네요...ㅜ.ㅜ 
