score,review
2,"73년생 제인마치가 찍은 연인이 92년에 개봉했다->개봉했을 때도 미성년자였고, 촬영 때는 더더욱 미성년자였다. 그리고 캐스팅할 때도 미성년자 였고...과연 영상이 이쁘면 용납되는가? 웰컴 투 비디오 사이트랑 ..."
10,"나의 어린시절!연인보고 양가휘 한테 김정 이입 오지게 했는데,쌍커풀 없고 날카로운듯 샤프한 양가휘..세월이 야속하다..나의10대는 아무것도 없었다 "
10,부드러운듯 살짝 독한 풋풋하지만 농염한 술을   한모금 한듯한 여운 
10,너무 아픈 사랑은 사랑이 아니였음을...그건 운명이였다 
8,책에는 미치지 못하지만...배우들의 호연에 한 번씩 떠오른다 
10,잔잔하게 가슴을 적시는 영화. 과거의 감동이 되살아난다 
10,Pure itself... The love of the young makes us happier than ever... 
8,영화내용도 좋고 촬영이 상당히 돋보인 영화이네요 
9,좋은 영화입니다  그 시절에  이런영화 드물었죠 
10,끝이 보이는 사랑이지만... 정말 어쩔 수 없는... ㅠㅠ 
10,10점드릴게요 10ㅈ 
8,주제가 원작에 비해 터무니없이 빈약하다. 인물들의 미장센과 연기는 좋았다. 이 영화가 뒤라스의 연인이 되기엔 무리가 있다. 
10,감동이네요.. 다시 보고 싶습니다. 
10,이거 내 인생의 베드씬영화 2위 
6,"영상의 미화가 무색할 정도로, 1차원적인 감정의 흐름이 이어진다.. "
5,the way to be a prostitute 
6,제인마치는 예쁘지만 지루했다 ㅋ 
10,"이거 야하다고 하는인간들 이거 끝까지 보긴 본거야? 또라이들,, "
10,영상밖에 볼게 없는데도...이 영화는 최고의 수작이다. 
6,사실 아무것도 아닌 스토리에 그다지 볼것도 없는데..양가휘가 다 먹여살린 영화. 
10,최고의 영화입니다~~~ 
8,책이 더 좋지만 그래도 좋았음 
9,앞부분의 정사씬들이 조금만 짧았으면 더 좋지 않았을까 하는 ....영상미와 촬영은 정말 수준급인 영화 
7,"현재 똑같은 영화를 만든다면 높은 점수는 어려울 것이다. 요즘은 접하기 쉽고 많이 익숙한 내용과 스타일이지만, 이 영화가 만들어질 당시에는 모든 면에서 돋보이는 영화였고 그래서 고전의 위치에 올라 그 후 많은 영화들..."
9,재개봉을 두번이나 할만한 영화였어요 
2,재미있게 잘봤어요ㅡgysuifsuhs8hdutidz 
10,T.V를 통해  몇번이고 봐  왔던  영화였건만  감정이입에 폭풍  심장 박동이  가동~~~ㅎ좋았습니다 
5,생각했던것 보다는 진부했다 베트남 풍경만 기억에 남을뿐 
4,그저그런. . 프랑스감독 특유의. . 야하고 관능적영화.그리 작품성이나 감동은 느껴지지않는다. . . 고교2년의 미성년여자와 돈많은 남자의 육체적 사랑. 이런 영화가지금나왔다면. .   아마도 끔직하게 비난받겠지. ...
10,진짜 기대안하고 봤는데 후회없는 영화 소장각 
10,"영상미가 있고, 여운이 남는 영화 "
9,마지막 까지 죽는 날까지 사랑하겠단 마지막 말이 인상적이 었다. 
2,원작소설을 읽었다면 분명 꺼버릴수밖에 없을거다ㅠㅠ안타깝다정말 
10,배타고 끝나는 부분만 있었으면 더 아련했을듯합니다 
8,아름다운 영상과 더불어 소녀에게 감정이입이 되어 보았습니다. 슬프지만 아름다운 사랑 이야기 
9,이런영화였구나. 과거에 봤었을때 인지하지 못했던 자연배경 도시의시끌벅적함이 생생하게 다가옴. 제인마치는 지금봐도 매력적임 
10,한마디로 아름답고 예술적인 영화. 
1,그냥 비디오로 돌려봐야할 영화 평점 높은건 변태들이 높은점수 줘서 글타 
10,오늘 다시 보고 100% 이해하고 200% 감동했다.대사 한마디 한마디 장면 하나하나 모든 것이 말로 다 할 수 없이아름답고 섬세했다. 중간정도부터 끝날때까지 너무 많이 울면서 봤다. 
10,오래된 영화.특히 남주인공의 사랑이 기억에 남는다 
10,"2016년에 본 영화 중에 단연 최고. 나이, 인종, 신분을 뛰어넘은 진짜 사랑을 느낄 수 있었다. "
8,"색정도 사랑일 수 있을까. 뭐, 사랑에도 여러 종류가 있을 수 있으니 불가능하다고 생각하진 않는다. 하지만 그저 예술지상주의로서만 받아들일 뿐이다. "
4,솔직히 본지 오래되어 기억이 정확하게 나지는 않지만 그리 대단한 작품은 아니었다 뭘 보라는거지 
1,평이 너무 높네 좀 낮춰야지 양가휘아님 보지도 않았을 영화 
4,그냥 야한 영화라는 생각밖에는... 
10,"시간가는 줄 모르고 봤던 영화.. 제인마치의 이야기로 이어지는 영화내용이 참 좋았다, 감동이었고,,마지막에 여자가 사랑이었음을 알았을때 표현에 있어 살짝 아쉬웠지만  전체적으로 야하단 생각이 전혀 안들었던 영화. 시..."
10,thank u all:) good film! 
6,IMDb평점하고도 심하게 차이나는..한국네티즌들의 모 아니면 도 식 평가를 느낄수있음 
1,nnmmmnnmnnmmn 
8,사랑은...아프다.... 
10,영화 야한줄만알았는데 굉장히 감명깊게잘보았습니다. 
10,남녀 주인공 모두에게 빠지게 되네.. 
10,20대초반에  본 그때의  감정이  다시  살아날까 생각하고 갔는데  역쉬나 기억의 저편에  조각조각처럼 다시  되살아 나는 아련한 사랑의 아픔들이 오늘 비처럼  내렸다 조만간  한번 더 봐야될것 같다 
4,리메이크가 절실한 작품. 원작의 다층성을 슬픈 격정멜로로 단순화시킨 느낌. 훗날 뒤라스는 이 작품을 맹렬히 깠다지. 
10,가난한 소녀들만이 온전히 이해할 수 있는 영화. 가난한 소녀를 사랑했던 남자들만이 눈물 흘릴 수 있는 영화. 
2,이게 아름답단 사람들은 소아성애자의 사랑을 이해해주는거임? 범죄보고 아름답단 소리하니까 좀 소름끼치는데 
1,아름답게 보이면 10대 소녀와 해도 되나?..  예술과 외설은 차이는 손녀와 할마버지가 같이 볼 수 있어야 한다.. 이 영화는 같이 볼 수 있는가? 
1,인간들아 정신차려라 ; 로리타에 미쳐가지고 
1,hjkhgjhjugyhj 
1,yuyugfhjhfj 
10,감정없는 사랑이 이렇게 오래토록 아름다울 수가...이런 영화를 92년에 만들었다니 ... 
9,시대적 배경 속에 녹아든 보편적 연인의 이야기 
10,숨죽이고 보게됨  추천합니다. 
5,단순한 이야기지만 몰입이 되는 것은 두 주연 배우의 연기 덕분일 것이다. 하지만 깊은 감정을 느끼기엔 영화가 다루는 상황이 너무 피상적이라 공감하기는 힘들다. 
8,솔직히 말하면 왜 명작인지 모르겠으나 좋게 봤습니다 
10,앞으로 이런 영화가 나올수 있을까... 
7,다 연기를 너무 못해요 ㅜ 
2,로리타랑 별반다를게 없는데? 소아성애를 미화한영화를 이렇게 예술적영화로 평받다니 놀랍닼ㅋㅋㅋㅋ 
9,어떻게 미소녀가 이런 영화를 찍을 수가 있었을까 ㄷㄷㄷ 남자배우도 양가휘가 아닌 더 잘생긴 배우였으면 좋았겠다..영화는 훌륭하다! 
2,"..,,..,,..,, "
7,가난한 집. 순진한듯 걸레인듯 소녀.집에 불만 많음. 무능한 가장 큰오빠의 횡포.부자 남친. 양가 집안의 반대. 내 몸만을 원한거야?. 내 돈만을 원한거야?. 해외도피. 멀리서 슬쩍 보는 남자. 있을거 다 있는 여자...
5,음.. 우리나라 사람 정서에 잘맞는 영화인거 같음.. 그런데 개인적으론 성향에 안맞아서 아무느낌도 없었음. 내가 이걸 왜본거지 ㄷㄷ 
1,스토리 있는 야동이지 뭨ㅋㅋㅋ 
1,그 때도 틀렸고 지금도 틀리다. 
5,"가난한 소녀와 부잣집 남자를 엮으려는 뻔한 감정선, 뻔한 스토리. 영화가 나온 연도를 보면 감안해야 하는 걸지도... "
2,남주가 별로임 눈이 이쁜 남주가 해야 함 
7,다 연기를 너무 못해요 ㅜ 
2,로리타랑 별반다를게 없는데? 소아성애를 미화한영화를 이렇게 예술적영화로 평받다니 놀랍닼ㅋㅋㅋㅋ 
9,어떻게 미소녀가 이런 영화를 찍을 수가 있었을까 ㄷㄷㄷ 남자배우도 양가휘가 아닌 더 잘생긴 배우였으면 좋았겠다..영화는 훌륭하다! 
2,"..,,..,,..,, "
7,가난한 집. 순진한듯 걸레인듯 소녀.집에 불만 많음. 무능한 가장 큰오빠의 횡포.부자 남친. 양가 집안의 반대. 내 몸만을 원한거야?. 내 돈만을 원한거야?. 해외도피. 멀리서 슬쩍 보는 남자. 있을거 다 있는 여자...
5,음.. 우리나라 사람 정서에 잘맞는 영화인거 같음.. 그런데 개인적으론 성향에 안맞아서 아무느낌도 없었음. 내가 이걸 왜본거지 ㄷㄷ 
1,스토리 있는 야동이지 뭨ㅋㅋㅋ 
1,그 때도 틀렸고 지금도 틀리다. 
5,"가난한 소녀와 부잣집 남자를 엮으려는 뻔한 감정선, 뻔한 스토리. 영화가 나온 연도를 보면 감안해야 하는 걸지도... "
2,남주가 별로임 눈이 이쁜 남주가 해야 함 
