score,review
8,오늘날 영화들 보다 전체적으로 미술이 볼만하다 
10,퇴폐적으로 면모한 로마를 이보다 더 자극적으로 고증할 순 없다. 
9, 폭군의 말로를 보여준장면도 좋았고 무엇보다 말콤의 연기력이놀라웠다 선정적이긴했지만ㅋㅋ 
10,79년에 포르노시대극에 1800만달러의 제작비.. 당시 블럭버스터급인데ㄷㄷ 
9,야한영화라고 하기에는 아깝네 
8,다들 외설적인 부분만 보신듯 미적으로도 참 아름다운 영상이었는데 
9,"말콤 멕도웰의 광기에 찬 연기가 폭군 칼리귤라를 완벽하게 재현. 뽀르노 영화로만 취급되기엔 압도적 스케일의 세트, 훌륭한 미술, 연기파 배우들의 호연과 작품성이 너무나 아까운 세기의 작품 "
10,평점이 너무 낮네요. 진짜 명작인데.. 
7,너무나 낯익은 그녀의 얼굴은 헬렌미렌. 드루실라 역의 여배우가 인상에 남는다 
7,말콤 맥도웰과 헬렌 미렌이라니! 
10,스펙터클한 대작..인간의 욕망과 허무를 아주 잘~연기도 장난구..모처럼 거대한 작품~ 
7,"칼리귤라, 성애의 제국의 몰락 "
7,어찌됐건 영화사에 길이 남을 충격적인 작품임은 분명하다 
10,탐욕은 허무를 부른다... 
9,생각보다 수위가 너무 높아서 깜놀... 그치만 스토리는 괜찮음.. 
10,예전에 봤지만 후덜덜;;; 
9,영화가 야하면 왜 안되는데? 시대극에 +＠까지. 거의 완벽하다. 
7,말콤 맥도웰의 연기가 정말 대단하다.. 
8,전반적으로 어두운 느낌의 영화다. 권력의 광기라서 그럴까. 
6,미친 권력의 광기를 여지없이 드러낸다. 인간의 가장 추악한 모습을 보여준다. 
10,대작이다 
8,논란속의 작품....명작은 아니지만 수작!!! 
8,대박영화! 이태리 영화 매냐라면 한번쯤은 봐줘야 할... 
9,이영화를 보지않고서는 역사를 논하면 안된다. 
9,포르노를 지겹지 않게..감상후는 인간의 욕망과 허무함을 웅변하는 대작.. 
8,온 천하를 얻고도 그 영혼을 잃는다면 그 무엇이 유익하리오 
10,다 알고 보면서 보고나면 욕하는 위선자들아! 
10,다시 나오기 힘든 최고의 걸작이다 
8,게리 올드만과 히스레저가 흠모한 배우. 말콤 멕도웰의 쩌는 연기와 에로티시즘 비주얼리스트 최고봉 틴토 브라스의 진지함. 
8,야동에 식상한 이들을 위하여 소장함. 
8,무능하고 어리석은 인간에게 권력이 주어지면 결국 나라꼴이 이렇게 되는거야 
7,역사를 왜곡했다는 평이있지만 틴토브라스의 스펙터클함과 말콤맥도웰의 연기가인상적 
10,웬지 짠한 느낌이 들지. 영화학도라면 어쨋거나 봐야겠지 
8,이런 영화를 만들 수 있는 미국이란 나라는 참.. 포르노가 예술로 나아가려 할 때. 
7,판단하기 약간은 조심스럽지만. 그렇게 싫지는 않았다. 배우들은 대단하다. 
10,완전 포로노 대작 
9,Unrated를 보면 충격의 연속 고문과 난교 고급 포르노물(하드코어 장면도 많다) 
8,이런영화를 다신 못본다는게 아쉽다 
10,대작임엔 틀림없지 않을까 
8,숨김없이 당시의 로마를 가장 잘 보여준것 같은 영화... 
8,말콤 맥도웰의 연기력도 뛰어나고 옛날 영화치고 스케일이 컸다. 흥미롭게 봤다. 
10,30년전에 이렇게 큰 스케일의 포르노를 찍을 수 있었던 것이 매우 놀랍다. 
8,제작과정에 잡음이 많아 감독교체가 잇달아. 그럼에도 불구하고 뽀루노판 벤허라고 할 만한 대작. 성경말씀의 진리를 느껴보시길. 
8,재밌었다. 예술적이고 
8,예술과 외설의 경계를 넘나드는 재주부터 시대와 권력의 그늘을 통찰하는 깊이까지 
10,이런 작품은 계속 해서 나와야 하는데..ㅠㅠ 
9,"컬러가 화려하고, 싸이코 같은 분위기의 영화 "
10,로마의 광기를 넘어선 인간의 광기를 적나라하게 표현한 영화는 없었음. 정말임. 
10,볼만한 영화다 
7,어디서 많이 본 배우다 했더니 시계태엽오렌지에서 봤던 말콤이였군 
8,충격..광기어린연기 압권.. 
10,명작 
10,위선적인영화들속에보석같은용기있는영화 
10,예술적인 영환데 평점 너무 낮네요 
9,흔히 볼 수 없는 타락을 풍부하고 아름답게 볼 수 있었다. 
10,시계태엽 오렌지 이후 말콤 맥도웰이 한층 또라이 스러워졌음 ㄷㄷ; 
9,포르노 영화지만 내용도 있고 영상미도 뛰어나다. 
9,마지막 장면을 보고 나서야 옛날에 이미 봤다는 걸 깨달았다. 거의 절반이 잘린 걸 봤으니 그럴수밖에. 미술적으로 굉장히 훌륭하고 연기 음악 다 좋았다. 뒷부분 제작자가 직접 만든 야동만 뺀다면 예술로 남을 수 있었는...
9,스케일이 크고 볼거리가 많음. 음악은 최고 
6,옛날엔 컬처쇼크좀 있었을듯함. 타락의 끝을 표현하려고 한듯 
7,오래된영화지만. 확실히 내용과 메세지가있다!! 1970년대 찍은 국내영화랑은 제작비에 레벨까지 다르다!!! 그리고. 야해서 좋다!! 
5,당시 상황에 집중시키던가...외설적인것에 집중시키던가... 
8,포르노적 선정성을 배제하면 상당히 잘만들어진 최고의 명작영화 
10,그냥.. 카이사르 동생만 불쌍하다 -_- 
6,너무 외설적이네.. 
4,작품성을 떠나서 보고 나면 너무너무 찝찝해 지는 영화.. 
1,뻔한 얘기에 뻔한 영상 시대를 넘어서는 수작이 아닌 그냥 어설프게 멈춘 영화 
10,세상을정복해도인간은죽음을피하지못한다북한지김일성김정일을보는것같다 
10,굉장하군.. 
5,인간의 본성을 맨몸으로 잘 표현 
7,권력이란~ 또 하나의 미친 황제의 최후..야하고 잔인 큰재미는 없지만 봐줄만함 
7,"바보들, 여자의 전라가 보고 싶은 거면 진짜 포르X를 봐라! "
7,틴토브라스. 무엇이 그를 변하게 만들었나! 
3,모니 이건.. 
4,아 상상이 안간다. 
7,한 번 더 보면 괜찮을까...황제의 성도착증에 관한 포르노급 영상물 
2,x3배속으로 봤던영화....-_-주인공남자 충격적이네..저사람이라니 
4,솔직히 엄청지루하다... 마지막은 쫌 충격이였지만.. 
9,세상을 얻고도 자신을 잃으면 무슨 소용이요 
7,피터 오툴과 헬렌 미렌의 연기에는 그저 전율만이... 
8,카리큘라 역사적 진실보다 앞서는 주연의 광기...단연 압권 
8,역사의 꼭두각시... 왠지모를 동정이... 
7,짙고 강렬하다. 그리고... 볼만하다. 
9,성에 대해 성스럽다 말하는 '생각하는 동물'에게 충격을... 
8,여러 모로 본능에 충실한 영화. 불필요한 포르노장면은 감점. 
1,이건 틴토 브라스 영화가 아니라 Guccione의 포르노일 뿐 
8,"틴토 브라스다운 포르노급 영상, 특히 ost가 맘에 들었다. "
1,이해 안되는 무개념 영화 
7,어마어마한 제작비가 들어간 마지막 블록버스터 포르노. 
3,적응 안되는 이야기 
10,마우스를 바꾸니까 동영상이 안끊겨요 
8,무섭더라. 하나의 시도라는 점에 의의를 두자. 
10,인간 칼리큘라의 내면을 잘 표현한 영화 
1,최악이다! 평점0 이다.1점도아깝다. 
2,"인간의 탐욕,쾌락, 너무 표현을 잘한.. "
7,"이것을 역사적 사실대로 찍었다면, 정말 무서워요! "
7,무삭제 봤는데... 죽는줄 알았네.ㅡ.ㅡ 어떻게 이런영화를 만들수 있을까 
7,스펙터클 포르노. 한번쯤은 볼만한 영화. 
7,일급배우들이 과감히 벗었다는것만으로도...왜 개봉이 안되는지 알겠음 
10,"정말 손색이 없는영화,  다시볼수없는 명작이다, "
10,무삭제 
10,피터 오툴이 트로이에서 헥토르 아버지를연기하게 된 이유~물론 피터 오툴의 대표작은 아라비아의 로렌스지만...말콤 맥도웰도 시계태엽장치 오렌지 이상의 연기를 선보임.그러고 보니 말콤 마이클 마이어스 일대기에서 박사 역...
9,포르노라기엔 너무 잘만든 영화 
5,틴토 브라스는 직구의 맛이 있지 
8,에로감독 틴토에게도 이런 영화가 ㅋㅋ 
8,스펙타클 포르노.ㅋ 
4,지대로포르노네 
1,제작비가 많이 들어간 쓰레기. 이 영화 제작비의 만분의 일의 돈으로도 비슷한 퀄리티의 하드코어 슬래셔 포르노를 민들 수있다. 말콤 맥도웰은 그렇다 치더라도 피터 오툴은 왜 이런 영화에 출연하게 된건지 이해가 안된다....
7,작품성이나 미적요소를 논하기 이전에영화가 그냥 포르노인걸 짚고넘어가야한다 
7,"다시는 나올 수 없는 ""쓰레기""를 경배하라. "
7,야한장면이 역겹기는 오랜만. 
10,8점정도가 적당 
6,정신이 피페해지는 156분 훌륭하지만 기분이 너무 나쁨 
3,80년도에 극장용으로 이런걸 찍었다는게 놀라울 뿐... 별로 추천하고 싶지 않은 작품 
1,쓰레기 영화. 그냥 포르노다. 
2,내가 봐도 이 영화는 역겹고 폭력적이다. 
1,이걸 영화라고 ;;; 
1,인간의 악한 본성..... 굳이 이렇게 그려낼 필요까지 있었을까?? 
5,시대극을 표방한 (준)포르노... 
1,아나 욕나온다 이게 포르노지 영화냐... 
5,"포르노도, 대작도 아닌 어정쩡한 영화 "
4,감독의 예술성을 제작자 Guccione가 포르노로 바꾸어 버렸다고 
8,칼리큘라의 성도착증을 그대로 재연하였으나 별로 재미는 없었다 
9,명작인지는 잘모르겠음.. 하지만..충격적..그리고 재밌어.ㅋ 
1,더러운 영화 
6,명작이라기엔 좀..의미전달 희박..너무 자극적인것에 치중됨 
6,영화는 전혀 아니올시다.. 
6,그렇게 나쁘진 않습니다. 볼만함.. 그러나 좀 엽기적입니다. 
8,좋은 영화인데 평이 낮네. 나도 저런 인생을 살고 싶다. 남자라면 저렇게 살아야 한다. 
1,쓰레기..  토나오더라ㅡㅡ 
1,별로 쇼킹하지도 않고 내용도 없는 영화니까 왼만하면 보지마세요 
1,유명 배우들의 잊고 싶은 악몽일 듯 ... 
5,틴토 브라스는 자신이 포르노를 표방한 영화를 추구하지만 에로티즘은 전혀없어서별로 
6,그나마 이게 제일 나음. 
3,홈비디오 이전 포르노 전용관 시절에 만든 그냥 성인물같다.. 사람들이... 너무 많은 의미부여를 하는 것 같다...전혀 에로틱하지도 않고 그저 고어물처럼 징그럽고 기괴할 뿐...흥행도 별로였을 것 같고 그저 스케일만...
1,눈이 썪는다 
