score,review
4,아는만큼 보인다. 모르겠다. 
10,고혹적이고 아름다운 영화. 영화음악도 인상적... 
10,"가장 좋아하는 감독, 가장 좋아하는 영화,,몽환적인 분위기와 아름다운 영화음악, 미쟝센이 돋보이는,,최고의 영화! "
8,한글 제목을 잘못 정했어...내용을 달리 오해할 듯... 
10,뭔가 불편하지만 포근한 영화 
10,영상이 너무 매력있다 
10,결코 언어화 할 수 없는. 
10,번역좀제대로 하자. 베로니카의 두개의 삶.  이중생활이라니까  명랑영화 기대하고 보는 사람들도. 
10,정말 뛰어난 걸작이죠^^b 
10,"이렌느 야곱, 마치 살아움직이는 명화마냥 "
10,"감독의 작품중에서도 매우 난해해서 별점이 낮은 듯하지만,걸작임에는 틀림없다 "
10,15년 전인가쯤에 우연히 만났던 영화. 지금까지 그립게 만드는 영화다. 
10,이렌트야곱은최고다.. 
8,그들은 과연 같은 사람인가? 같다면 신의 실수인가? 
10,최고!! 너무 아름다운 그녀 
10,열 손가락 안에 드는... 잘 만들어진 영화 
10,내내 기억에 남는 아름다운 영화. 
8,RED의 전초전... 
10,머리로 이해하려고 하면  아무것도 느낄수 없는 영화 
10,"잘 만들어진 영화, 그리고 아름다운 음악 "
10,Van Den Budenmayor Concerto in e minor 머릿속에 맴돈다 
8,끈. 정말 인상깊다. 여배우가 너무 예쁘네. 
10,우연 그리고 운명  선택 . 이세가지가 쏟아내는 빛 
10,야곱의 연기만큼이나 테마곡도 한몫했죠... 
9,"고민을 잊고 영화에 빠져들었어요,보고나면 몽롱한 기분입니다.전형적인 프랑스 영화스럽다구 생각했는데, 재개봉영화였군요. 베로니카와 베로니끄의 1인 2역 연기는 정말 환상적이었습니다.프랑스영화 느낌 좋아하시면 재미있게 ..."
10,철학적으로미학적으로생각의여지를주네요 
10,"키에슬롭스키, 아름답고 서늘하다 "
8,개인취향이겠지만 난 이런 자기성찰적인 영화가 너무 좋다. 
10,묘한 매력이 있는 영화..보는 동안 딴세상에 있는듯한 묘한 기분.. 
9,유럽쪽 낭만이 묻어나던 거리의 향수를 볼수 있을겁니다 
10,"하나의 영화를, 내 모든 얕은 지식과 인식의 범위안에서, 사회과학으로, 인문학으로, 미학으로, 철학으로, 그림으로, 음악으로, 볼 때마다 다르게 체험하는 경이로움 "
10,"그냥  그 안에 계속 머물고 싶은, 취하고 싶은 영화.  내가 사랑하는 영화 "
10,약간 동양적인 느낌도들고 배경음악도 좋고 
10,인간에게 찾아온 뜻모를 감정을 감독자신만의 환상으로 풀어낸 영화! 
7,즈비그니에프 프라이즈너의 음악과 이렌 야곱의 매력 만큼 강렬하지는 않다. 
9,이유없이 슬퍼진다..영상이 아름다웠음. 
9,베로니끄가 사진속의 베로니카를 확인할때 나도 눈물이 났다... 
10,너무 아름답다... 
9,너무 강렬해서 영화의 느낌을 잊을수가 없다 
9,결말이 각자 받아들이는 느낌에 따라 다를 것 같아 좋았음 
8,서로 다른 두 공간에 존재하는 주 인물의 삶의 궤적 
10,확실히 내용이 어렵긴하지만 대단한 작품 
10,하늘은 이런 천재를 왜 그리 일찍 데려가셨는지! 
5,연출은 볼만한데. 내용은 별거 없다. 이미지나 분위기로만 남는 영화. 
10,잔잔하고 멋있게 영화다운 영화다. 
10,다소 난해하지만 예술영화의 본질을 보여준다 
8,이해하고 싶어요... 
6,도무지 모르겠다. 무슨 의미가 있는지... 
1,이해할 수 없는 평점 
1,대체 뭘 말하고자 한건지..남는 것도 없고 프랑스 영화의 허무함만.. 
10,"내 인생의 최고의 영화. 최고의 영화음악, 이렌느야콥을 생전에 볼 수 있으려나... "
7,The Double Life of Veronique 
10,"처음 봤을 땐 이게 뭔가 싶었는데 영상과 음악에 이끌려 영화를 내리 두 번을 봤다. 두 번째 봤을 때 비로소 영화가 이해가 됐다. 마지막에 베로니끄가 정원의 나무를 만지고, 아버지가 나무 자르는 것을 멈추는 장면에 ..."
1,이사람 영화들은 존나게 졸려움 
7,다시한번 봐야될거 같은.. 
8,초반부터  몰입도 높게 전개되는군 
10,"91년, 그리고 2016년. "
10,아름다운 영상과 날카로운듯한 음악들이인상깊게 느껴졌다. 그리고 여배우의 아름다움에 취해서 본 것같다 . 
7,도플갱어라는 생소한 소재. 그나저나 제목 번역 좀 제대로 해주셨으면 합니다.. 이중생활이라니  -.-;; 
8,독보적인 베로니카 베로키크 ...제목은 독특하지만 영화내용을 온전히 담아낸다기엔 좀.. 
10,블루레이 정식 발매 해주세요~!! 
10,걍 최고 뭐 쓸말이 없다 걍 봐라 
8,잔잔하지만 강렬해서 엔딩 크레딧이 올라갈 때까지 일어설 수 없다. 두 여인이 서로에 느꼈던 유대감 그리고 베로니크의 상실감이 은유를 통해 물밀듯이 느껴진다. 
10,낭만적인 줄거리에 빠져들 수 밖에 없었던 영화! 
10,아름답다.. 아름답다.. 아름답다... 
10,다시 또 보고 싶은 영화?? 
10,운명과 우연에 대한 생각과 음악이 정말 너무 멋진 영화 
9,어렵지만 아름다운 영화 
10,정말 좋은영화강력추천 
10,너무 잘 만들어진 영화 어느하나가 튀는일없이 모든 요소가 어우러진다 
9,촬영기법도 대단하고 치밀한 연출력도 좋았음. 
10,영화가 끝난 뒤에도 자꾸 생각나는 영화 
10,"소리, 색감, 움직임 모두 수수께끼같은 영화 "
10,20년만에 다시 보아도 아름다운. 
8,프랑스영화오래만에봤는데 신선함. 알수없는 묘한 분위기 
10,정말좋았어요 또보고싶네요 
7,감독이 직접 한 말에 따르면  한 사람의 언행이 다른 사람에게 영향을 미치는 것에 관한 영화라고 한다. 그러므로 조심스럽게 살아야할 필요성이 있는 것이라고. 옛날 VTR시절에도 엉뚱한 한국어제목 때문에 많은 사람들이...
7,알고보면 무시무시할 정도로 소름 돋는 
7,휘둘리는 인형극처럼 연결된 쌍둥이의 삶. 
10,내 심장의 첫 갈피 
10,마지막에 나오는 대사와 이 영화에 관련된 내용을 보고 이해가 갔다. 심오한 작품 
10,"겉으로 보이는 잔잔함 속의 예술성과., 품고 있는 본연의 본질성 "
10,"몽환적인 조명, 깊은 묘사력과 야곱의 연기력 good ^_^ "
8,깊이있는 묘사와 화면 그리고 연기력이 나름 매력있었던 영화^^ 
7,"운명, 우연이란 것의 신비로운 미로 헤매기. 나의 이중생활은? "
9,이렌트야곱의 깊이있는 연기... 작품성의 척도 
9,아름답고 신비스러운 도플갱어 이야기 
10,베로니카와 베로니끄의 이중주를 통해 나긋나긋 속삭이는 영화의 힘 
10,어릴적봣지만그때의감동은아직그대로 
10,인생의의미에관하여..운명에관하여..아름다운영화.. 
10,9점 / 아름답고 아름답고 아름답도다.... 
10,dvd는 왜 안나오는 거야..  젠장 
7,우연을 가장한 필연.남겨진자의 슬픔. 
10,"아무도생각하지못한이야기,그러나 누구나한번쯤생각한이야기 "
10,깊은 인상을 준 영화. 
8,감성적 영화이면서도 묘하게 지성의 문을 두드리는 좋은 영화 
5,여주가 너무 예쁘네 몸매에 완벽한 얼굴까지... 
7,뭔 내용인지는 모르겠지만 이렌느 야곱은 정말 예쁘다. 
6,"영화가 판타지 였다는것을 알면, 안보았음. "
6,세가지 색과 십계시리즈를 10여년 전에 먼저  괜찮게 봤었다.(영화감상 막 시작했던 시기)베로니카는 그동안 영화를 정말 많이 본 상태에서 이제서야 봐서인가... 음 감독이 심장마비로 죽지 않고 00년대 초까지만 있었...
8,사람들 사이의 인연에는 인간의 언어로 설명할 수 없는 무언가가 분명히 있다. 
9,자신도 모르는 또다른 자신의 죽음. 어찌보면 우리가 살아가는 동안 누구나 겪는 일. 우리는 삶을 살며 어느 순간 진짜 자신을 숨기고 살아가야만 하는 때가 온다. 그러나 베로니카처럼 또다른 자신의 죽음을 알아채는 것은...
10,나한테도 이런 존재가 있을까..? 
10,다른 공간에서 살아오던 그들이 같은 공간에서 서로를 바라봤을 때. 
8,"숙명적 비애가 느껴지는 서정적 도플갱어 이야기, "
8,감성적인 연출이 좋은작품 
9,오묘하고 인상적이다. 남겨진 그녀의 슬픔이 느껴진달까... 
10,"정말 재밌습니다, "
8,말로 설명하기 어려운 매력과 여운이 있는 영화..이렌느 야곱의 연기가 빛난다 
8,우리 모두에게는 이유 없이 슬픈일이 있다. 
4,난해하고 어렵지만... 거장이라는 이유만으로???? 
1,"아무런 의미도 없고 아무런 가치도 없는, 한 없이 심심하고 무료한 영화. "
7,정말 어려운 영화더군요.. 저 같은 사람은 진짜 이해하기 힘든 영화였음.. 
9,걸작으로 남을 이유가 분명하다. 이야기의 힘보다는 황홀하도록 우아하고 아름다운 시청각의 경험을 보장하는 작품. 
8,약간 지루한면이 없지않아 있는듯 
8,이렌느 요세프의 미모가 너무나 비현실적이다 
6,십계보다도 지루하고 밋밋하다. 취향을 심하게 탈 법한 영화 
8,"묘하게 인상적인 영화, 여배우가 너무 이뻤다 "
8,도플갱어를 주제로 이토록 묘한 감정의 파동을 일으킬 수 있을까 
5,"솔직히 말해서 ,, 평점이 높아서 봣지만.. 고3이 생각하기엔 너무나..어렵다 "
10,20대 초반에 보고 아무것도 모른 채 묻어두었다가 20년 만에 다시 보는데 요즘 영화들에서 보기 힘든 깊은 우수와 철학이 있네요. 어떤 면에선 불친절할 만큼 시종일관 조용하지만 그래서 더 몰입되고 재미있습니다. 죽음...
1,X] 크쥐시토프 키에슬로프스키 감독 이름 참 기네 이런 영화 아직 이해하기는 정신 상태가 낮다 어려워 
10,영상미 미장센이 아름답게펼쳐지는 영화.그리고 필름영화의 매력..역시 영화는 필름의 색감과 질감 따라올수없다 
5,재미없다. 그나마 짧아서 다행 
6,미쟝센은 아멜리에 뺨치게 감각적인데 스토리는 너무 작가주의다. 
2,그래서? 하고 싶은 이야기는? 
8,몽환적이고 아름답습니다. 깊은 성찰까지 이어지기엔 내가 너무 얕아서.. 
3,재미없다 지루하고 묘한 분위기 말고는 아무것도 없다 
2,뭐니 이게.........정말 작품성이 있는ㄱ영화라고 할수있나?????????? 
6,별 내용도 없네 
2,나의감정을건드리지못했고 보는내내 지루했다. 
7,남은 영혼은 살아가야 하나 그 뒷날은 한없이 우울해만 보인다 
10,최고의 영화 
10,음악과 영상이 하나로 합일된 시대의 걸작! 
1,스토리 있는 포르노나 다름없다. 이 영화가 고평가 받는 이유를 모르겠다. 
1,"너무 재미없고 지루하여 관람 내내 졸았음. 불면증에 걸리신 분들이 보면 좋을듯, "
4,개노잼. 지루함의 극치. 여주 벌거벗은 몸이 피부도 뽀얀게 볼만함. 
