score,review
10,순수한 즐거운 음악의 비틀즈 
10,극장에서 보는 내내 나도 모르게 실없는 웃음이. 이렇게 영화관에서 만나볼 수 있게 되어 감사할 따름. 좋아요. 사랑해요! 
9,비글돌 비틀즈덕분에 많이 웃었음모든 멤버가 그렇긴 하지만 특히나 어린 폴 매카트니의 비주얼은 충격!! 
10,존 레논과 조지 해리슨이 지금도 살아있었다면 어땠을까하는 진한 아쉬움이 드네요.. 영화내내 등장하는 비틀즈의 음악들하며 신나게 뛰어다니는 멤버들의 천진난만한모습들을 기분좋게 즐길 수 있었어요ㅎㅎ 그리고 폴의 할아버지...
10,젊었을때 모습 보니 신선하고 좋네요 
10,존 레논과  조지 헤리슨의  생전의 모습을 스크린을 통해 보게 될줄이야... 처음브로 비틀즈를 스크린에서 보고 나니 그 시절에 비틀즈 본사람들은 얼마나 행복했을까? 생각하게 된다.. 
10,어느 누가 감히 레전드를 욕되는가? 
10,너무 풋풋하고 사랑스러워서 사랑에 빠졌습니다. 유쾌하고 즐거운 영화 
10,음악영화는 늘 좋다그들의 우정과 열정과 재치에 한순간도 놓치고 싶지 않았다 
10,보는 내내 너무 어깨가들썩 ㅋㅋ 뭔가 흑백영화라 더 신비롭기도 하고요 비틀즈 노래는 언제들어도 명곡이네요 ㅋㅋㅋ 
9,비틀즈에 다시 반한 계기가 되었어요 
7,"비틀즈 노래 따라부르는 재미, 비틀즈 어색한 연기 보는 재미 말고는 감동도 스토리도 없는 영화. "
6,비틀즈 팬을 위한 영화. 좋아하면 마냥 좋을 영화지만 비틀즈 잘 모르는 사람이랑 같이 보면 욕먹기 딱좋음ㅎ 
10,21세기에 만나는 20세기의 비틀즈! 웃음을 주면서 감동이네요- 
10,비틀매니아로서 충실한 느낌 
10,최고입니다 말이필요없음!! 
10,비틀즈 멤버들의 풋풋한 모습들을 볼 수 있다ㅎㅎ비틀즈 팬이라면 다 좋아할듯 
10,귀여우면 ok 입니다 존귀 
10,말이 필요없지.. 그 시절 비틀즈를 만날 수 있는것만으로도 행복! 
9,신선하고 발랄한 비틀즈 사운드 She Love You느긋하고 아름다운 하모니 If I Fell여름 해변 늦은 밤 칵테일 마시며 듣고 싶은 And I Love Her 
8,비틀즈 초년의 장난끼 많은 모습과 음악들을 만나 볼 수 있습니다. 비틀즈를 사랑 하시는 모든 분들께 강력추천 해요♡ 
10,계속 보게됨 링고스타 잘생긴 얼굴 보려고 ^^ 
10,이 앨범의 수록곱 뿌만 아니라 다른 곡들고 들을수 있어서 참 좋았어요  폴 링고 넘 귀엽네요^^ 
10,비틀즈 사진으로봤을때는 몰랐는데 영상으로보니까 너무 잘생겼고....시트콤보는줄알았어요 넘 유쾌하고 음악도 좋고ㅜㅠㅜ 보길 넘 잘했어요!! 
7,노래는 좋은데 웃음코드가 맞지 않아 즐기지는 못했네요:: 
6,난해함....음악은 조았어요 
10,아.. 몇번을 더 봐야합니다. 공연을 보는것 같아 소리를 지르고 싶은 
3,비틀즈 팬분들이 좋아할 영화 . 아님 좀 지루할 수도 
10,WOWWOWWOWWOW 
10,존레논 욕실에서 장난치는거 보고 대뇌가 띵했다폴매카트니의 깨방정이 나의 심장을 흥분시켰다조지해리슨의 눈썹 꿈틀꿈틀이 내 척추를 치고갔다링고스타의 허당매력이 나의 중추신경계를 흔들었다 
10,비틀즈의 음악과 그들의 천진난만과 풋풋함을 함께 볼수 있어 행복한'러닝'타임! 
1,감히 똥양놈들이 비틀즈를 평가하려들다니 우습다 ㅎㅎㅎ 
7,좋은 노래 잘 들었습니다 
10,역시 비틀즈 리더는 존레논 
1,오노 요코 아들만 아니었도 1점은 안 줬을 듯. 
1,ㅡ ㅡ 별로 별로별로별로별로별로 
7,비틀즈 팬심으로 봐야할 영화... 성숙한 후기 비틀즈 생각하고 보면 후회함. 애들일때의 풋풋함 보고싶다면 강추.. 
10,비틀즈의 모든 모습들이 사랑스러운 영화 
10,이 영화는 비틀즈 자체였다. 
8,전성기 비틀스의 모습과 세월의 허무함 
7,너무 젊고 예쁘고 아름답고 찬란했다! 
10,링고스타성님은  여기서도 출연진(더보기) 해야 나온다네. 
10,와우!신나게 웃었네여^^ 
7,유쾌한 내용에 재미있게 관람했어요! 
7,"여러 번 봤던 영화지만, 극장 개봉한다니 별 수 있나.. 가서 봐야지.. "
6,폴이 참 예쁘고 존도 멋있다 
7,풋풋한 시절의 비틀즈를 만날 수 있는 즐거운 시간 
7,젊은시절 비틀즈의 모습을 보는 것만으로도 만족~ 귀를 사로잡는 음악은 보너스!! 
7,주체할 수 없는 비글들의 88분짜리 명랑 뮤직비디오. 
7,비틀즈를 봤다는 것 만으로도 
8,좋은 음악과 함께 즐거웠습니다 
8,If I fell!!! ㅎㅎㅎ 
8,아무조건없이 당신이 조아효 
8,재미있게 봤어요. 역시 음악이 최고. 
8,지금은 전설이지만 그들도 풋풋했었다 
7,비틀즈다운 영화입니다. 
7,음악이 좋고 음악이 좋았다.난해한 고전코미디 웃음코드. 어쩌다 한번씩 실소나는. 수준 높은 평론가처럼 느끼고 파헤치고 싶었지만 그러지 못했다. 하하하하 
8,"반갑고 귀여웠던, ㅋ 자유로운 영혼들을 누가 말려 ㅋ "
7,그때나 지금이나 거기나 여기나 인기있는 연예인들 생활이 비슷한 면이 있는 거 같네요. 연출이겠으나 참 악동들이네요. 
8,무엇보다 내내 비틀즈 노래 나와서 좋았음 
8,음악으로만 알던 비틀즈를 살아 숨쉬게 해주는 영화예요 
7,비틀즈의 음악을 들을수 있어서 좋았습니다. 
8,비틀즈의 앳된 모습을 보는 것만으로도 의의가 있는 
10,'비틀즈'라는 것만으로... 
1,옛날옛적 아주 오래된 이야기. 
10,그때의 비틀즈를 볼 수 있다는 것으로도 행복한... 
10,완전좋은^^다시만나보는 비틀즈!!비틀즈-4EVER 
10,음악 들으며 행복했습니다. 
7,"비틀즈의 팬이기에 재미있었고, 멤버들의 깨알같은 캐릭터를 알아볼수있었던 영화.... 하지만 같이간 후배는 졸았다. "
10,8천원으로 콘서트 본 느낌 
8,조금 유치하면 어떠리~ 이렇게나 귀여운 비틀즌데!!  영상 속의 비틀즈 멤버들은 너무나 귀엽고 유쾌했다. *ㅅ* 
9,신나는 음악 오랜만에 보는 비틀즈 영상 
10,너무 즐거웠어요~비틀즈를 극장에 볼수있었다니... 넘 좋았어요 
7,비틀즈 멤버를 볼 수 있어서 좋았습니다 
9,"아 모르겠고 귀엽다.,, "
6,비틀즈 팬들에게 특별한 선물 
10,완전!! 짱 !!조았어요 비틀즈 좋아요 ㅠㅠ 
8,렛잇비렛잇비렛잇비틀즈 
10,배우 비틀즈. 스크린에서 바라보는 것 만으로도 행복. 엔딩엔 눈물 핑. 
10,"프레디 머큐리, 마이클 잭슨, 존레논 모두 세상에 없지만 아직 폴 메카트니가 있다 "
9,열한살 아이들 4명과 엄마들4명 모두  8명이 가서 관람했는데엄마들도 좋았지만 열한살들도 좋았다고 해요.감미로운 내용의 가사들과 미소년들의 좌충우돌 행동들이 의외로 아이들 마음 저격.. 
10,"그야말로 나를 비틀즈 입덕으로 이끈 영화...  신나고 흥겨운 노래는 물론이고  재치있고 실없는 코미디와 왠지 각본에 의한 게 아닌 거 같은, 아이돌이었던 멤버들의 비글미가 시종일관 웃게 한다. 정말 다들 매력 쩔음..."
10,"최고의 음악, 기억, 청춘! "
10,유쾌하다. 킬링타임용 으로 딱인듯 
10,재개봉 원합니다~~~!!! 
8,끼와 독특한 유머가  넘쳐나는 날것의 연기를 보는 재미쏠쏠하네요~~ 
5,내용은 별로  곡도 몇몇만 반복되어서 종  지리하네요 
10,그들의 젊었던 시절을 엿볼 수 있는 좋은 영화 
10,노래가 너무 좋아요 또 보고싶네요 
8,"링고,존,폴 그리고 조지가 뛰노는 모습을 눈으로 본 것 10점링고,존,폴 그리고 조지의 연기력은 -2점 그래서 8점보는 내내 A hard days night 앨범 곡들이 흘러나오는 행복을 누리세요 "
9,구드ㄱ?ㅅ굿긋틎극?ㅅ극ㄴ 
10,영화관 깔끔하고 분위기 좋아요 
10,멤버들의 젊은날을 볼수있는 좋은기회였어요 
10,비틀즈가 활동했던 그 시절의 모습들을 관찰하는 재미가 있는... 비틀즈 음악의 아름다운 멜로디와 가사를 한껏  음미할수있는 영화!! 
10,슬금슬금 웃으며 감사한 한시간 반을 보내게 된다. 
10,비틀즈 신나는 비탈즈 비틀즈 
10,영화도 보고 공연도 보고 슬램도 하고 
10,방황의 링고스타 ...코가 왜? 뭐~ .. 
10,웃고 떠들고 장난치고 노래하는 젊은 비틀즈반짝반짝 빛이 난다 
9,오래된 영화이지만 그들을 볼 수 있어서좋은영화.여전히 좋은 느낌으로 들려오는 그들의노래. 
10,각 멤버들의 개성을 볼수 있었던 시간.  너무너무 좋은 음악들은 덤! 
9,비틀즈 팬들에게는 최고의 선물!! 
9,"전혀 힘들어 보이지 않은 비틀즈의 유쾌함, 풀밭의 개들처럼 뛰어노는 60년대 그들의 활력 "
10,예전에 찍은 영화인데도  전혀 촌스럽지 않고  좋았습니다 
8,"팬이 아니라면 다소 지루할 수 있으나, 팬이라면 한번쯤은 꼭 봐야 하는 영화 "
9,초창기 노래 및 공연이 흥겨웠고  비틀즈가 성장하기 시작함을 알려주는 풋풋함이 좋았습니다. 
10,팬이라면 꼭 보시길... 
10,남자친구랑 같이 봤는데로맨틱했어요 
8,옛날코미디 보는듯한 재미에  풋풋한 그시절 비틀즈생얼보면서 라이브듣는 재미가 더해져 볼만하던걸요.ㅎ 
9,단순한 코믹스토리지만 비틀즈 네명의 멤버를 그 당시 그 모습으로 볼 수 있는 사실만으로도  흥분과 감동을 느끼기에 충분했습니다^^ 
10,취향에  꼭  맞는  매우 만족스러운 영화입니다.  음악을 좋아하며 그 시절 청춘을  되돓아 볼 수 있는  계기가 되는  즐거운 영화 였습니다 
8,비틀즈 팬이라면 절로 미소지을 것 
10,발랄하다 재밌다 노래쩐다 
8,비틀즈의  시작은 아이돌밴드! 아이돌 밴드로서의 매력 발견 그리고 패티보이드 
10,너무 신나는 영화입니다 잘 보았습니다 
8,처음엔 영국유머가 어색했지만 바로 적응!! 명불허전 비틀즈!!! 
8,아는 만큼 즐겁지만 몰라도 충분히 즐겁다 
9,비틀즈를 좋아하는 사람이라면... 
9,부모님이 아주좋아하셨습니다 
10,1960 년대 영화인데 새로운 형식의 연출력이 뛰어난것 같아요 비틀즈초기 노래를 들을 수 있는 영화 우리나라에 처음 개봉 볼수 있어서 너무 행복했어요 
10,시대차이때문에 조금 루즈할때도 있지만 이정도면 요즘 나오는 영화라고해도 손색없어요!!비틀즈의 젊은 모습을 볼수있어 너무너무 좋았어요!~!! 
9,주옥같은 노래들?좋아요 
10,시대를 가리지 않는 훌륭한 영화와 훌륭한 음악 
10,옛추억이 나서 괜찮았다. 
9,"히트곡이나 국내 정서에 맞는 곡들에 익숙하다가들어본적 없던 곡들에 다시 한번 푹~~빠져봅니다.고된 일정속에 사랑,자유를 동경하는 십대 아이돌 모습이 애잔하네요. "
9,벌써 끝났네~~하고 깜짝 놀랄정도로 재밌게 봤습니다~~~~ 
9,젊은날의 비틀즈를 만날 수 있는 좋은 시간 이였습니다. 
9,보는내내 흥겹고 미소짓게하는 유쾌한 영화. 몇번더보고싶다 
10,비틀즈 음악(초창기) 좋아한다면 보세요!!! 
10,If I fell  꼭 들어보세요~ 언제 들어도 사랑스런 노래예요 
10,인기그룹가수  비틀즈  영화를보면서  감동과  엔돌핀이 넘치는노래의매력들   진정으로 재밋게  감상했읍니다  강추천합니다   아시운건 상영관이 적다는거   좋은영화인데 상영관  좀  널러주었으면  하는바램입니다 
10,정감있는 리얼리티와 여유로운 위트로 스크린에 재현해낸 팝의 레전드 비틀즈. 3집 정규앨범 소재로 시간이흘러도 위안과 행복감을 선사하는 'Great moments'.무겁지도 가볍지도 않은 페이크다큐 기법...
9,그들의 60년대를 조금이라도 보고 싶다면! 
10,"노래를 부르거나, 영화를 부르거나 "
10,영화에 나오는 팬 무리들은 엑스트라가 아닌 실제 연출안된 팬 무리들... 
9,노래가 좋고 비틀즈의 진짜 매력을 느낄 수 있는 영화! 즐겁게 보고 올 수 있는 영화입니다 
9,"대사 , 음악  모두 좋았어요 "
10,이 영화는 감히 평가할 수 없다 
10,비틀즈 세대가 아니어도 재미있게 볼수있는 유쾌한 영화~ 
10,비틀즈 멤버들의 생생한 모습과 음악까지 어우러져서 넘 좋았습니다^^ 또 다시 보고 싶네요~~~ 
10,마치 괴거로 돌아긴듯(나) 풋풋한  젊은청년  비틀즈~~좋았고  신기했고 즐거웠네요~~~ 
10,우리가 알던 비틀즈와 당시 비틀즈를 만끽하는 시간 
10,레전드 비틀즈의 모습을 볼 수 있어서 넘 좋았어요~ 
9,난생 처음 제대로 들어보는 비틀즈! 그리고 첫눈에 반했다ㅎㅎㅎ 
10,What a wonderful!!!! Beatles 
10,비틀즈 딱 세글자만으로도 설명이 되네 
10,평식이가7점도주네 이거 봐서다행이다 
10,비틀즈~  가족들의 세대공감 이었네요... 
10,비틀즈!! 비틀즈!! 비틀즈!! 비틀즈!! 
10,영화와 잘 어울리는 에무시네마에서 보고 집에 가는 길. 어색한 네 사람의 연기가 사랑스럽다. 개구쟁이 모습도 익살스런 말장난도 귀여운. 비틀즈 음악이 나올 때마다 살랑살랑 춤을 추고 싶었으나 꾹 참았다. 집에 가면 ...
10,꼭보세요 인생영화.... 
1,이거 진짜 존나 재미 없음 OOOO ㅡㅡ 비틀드 좋아 해서 봤는데 좆 쓰렉 ㅡㅡ 
1,비틀즈 팬이거나 비틀즈 노래에 관심이 많다면 봐도 후회 않할듯 아무관심없이 걍 봤는데 흑백에다 스토리고 모르겠고 노래 가끔나오고 존나재미없어서 사십분보다 나왔네요 영화보다 나온건 처음이에요 비틀즈 관심없으면 비추 
