score,review
9,영화에서 '영국인을 조심하라'는 대사가 많이 나오는데 아미쉬 교도들에게 English는 영국인이 아니라 바깥세상 사람을 뜻함. 
9,굉장히 재밌다. 해리슨 포드의 젊은 모습 ㅠㅠ 너무 잘생겼어잉 
10,마지막장면의 안타까움이란 정말 사람 속타게 하는 수준 
10,"연기, 시나리오, 연출력, 배경음악 다 좋은 수작이다! 아미쉬 교도들의 독특한 생활모습이 영화의 매력을 더 상승시켰고 해리슨포드가 헛간에서  켈리 맥길리스에게 불러준  노래가 정말 기억에 남는다^^ 스릴러,드라마, ..."
10,개인적으로 해리슨 포드의 작품 중에서 제일 감명 깊게 본 영화예요. 
10,11살때 주말의영화에서 본거 기억난다 ㅋㅋ 근데 다시보니까 진짜 재미있네 ㅋㅋ 
10,오래된 영화이지만 재미 있습니다..~^^* 
10,"25년이 지난 지금 봐도 손색없는 영화, 여운이 오래 남네요. 정말 잘 봤습니다. "
10,오래된영화같지 않네...여운이 남는영화..ㅜㅜ 
9,"또봐도 참 잘 만든 영화..모리스자르의 음악과 비고 몰텐슨의 신선한 모습.,. "
10,25여년전 보았던 멋진 장면들의 잔상이 아직 남아있는 멋진 영화입니다. 
9,"한번 보고나면 영단어 witness를 알게 되고, 두번 보면 아미쉬가 눈에 들어 오죠. 세번 이상 보면 여주 켈리 맥길리스의 근황이 궁금해집니다 "
10,평점 올리러 들어왔다. 남녀 주인공의 내면연기 완젼 쩌는 영화. 
10,헤리슨포드 최고명작 
10,해리슨 포드의 대표작은 <인디애나 존스>나 <스타워즈>가 아니다. <하노버 스트리트>와 <위트니스>이다. 그는 액션 배우가 아니라 멜로 배우이다. 
7,아미쉬 교도인들에대해 알게되어 좋았고 사랑이 이어지길 바랬지만 서로 많이 다르기에 떠나는 결말도 맘에들었음 연기랑 긴장감이 좋은 영화.. 
10,여배우 눈빛연기 좋네요. 포드형이야 뭐... 당연 좋고...ㅎㅎ 
9,범죄물로 종교와 인습을 초월하는 사랑을 말하다. 두 배우의 키스씬이 압권이다! 
10,조금 덜 알려진 해리슨 포드의 점잖은 수작.. 
7,악당이 아미쉬 만큼 착해.. ㅋㅋ 
10,돈 많이 안 드리고도 이런 좋은 영화 충분히 만들수 있지 않습니까. 왜 우리는 못 만드냐. 거의 제작비가 독립영화 수준인데. 이 영화가 미국에서 호주출신 감독이 데뷔작입니다. 35년전 영화에요. 
9,좋은 영화치고는 사람들이 별로 보지 않았네 
10,이 영화가 아카데미 작품상을 못타다니..이해할수없다 
10,명작 오브 명작 절제미 속 아름다움 
8,이 영화는 액션영화가 아니다 삶과 사랑의 수작 드라마! 
9,이영화가 왜 팔점밖에 안되...개명작이고만 
9,30년전영화....  그러나 너무 재미있다.... 풋풋했던 그시절 
10,이 영화에 곤도르의 왕이 나오는거 아시나요 
9,흔치않는 아미쉬를 배경으로한 영화 충분히  재미있었다 
10,가슴에 영원히 남아있을 영화입니다. 
8,미국영화에는 마약사범과 내통하는 경찰의 부패상이 자주 묘사되는데 우리나라 마약수사관들은 정말 괜찮을까 
9,개인적으론 피터위어 영화중에 젤 좋다. 서로를 너무나 간절히 원하는 두배우의 슬픈눈빛이 기억에 남는다. 근데.. 개명작 이런 표현 좀 쓰지마라. 이 언어쓰레기들아. 같은 영화를 좋아한다는게 넘 부끄러워진다. 이런넘들...
10,케이블에서 하길래 아무 기대없이 봤는데 너무 좋다.ㅠ 요즘시대 자극적인 영화만 보다가 이 영화를 누워서 보는데 마음이 정화되는 기분. 생각해보면 영화고 음악이고 옛날이 좋았다. 
8,무난히 즐길수 있었던 수작 영화 
10,몰입도가 짱입니다. 아미쉬공동체는 현재도 영화속 그들처럼 평화롭게 살아가겠죠스릴러.액션.로맨스 장르가 버무려진 수작입니다 
10,우연히 채널돌리다 봤는데 완전 빠져들어서 봤네요.. 명작!! 
8,뭐야 ㅋㅋㅋ 범죄물을 가장한 사랑영화였어! 
10,또 하나의 명작.... 잘 봤습니다. 
10,다시 보게되는 명화~~ 
10,재미도 있고 여운도 있고...아미시를 편견없이 그대로 보여준것도 인상깊고...다소 느린 전개의 옛날영화가 주는 평온한 느낌도 좋으네요...^^ 
8,생각을 많이 하게 만드는 영화다. 
10,켈리를 볼수있었다는것만으로도 ㅎㅎ 
9,누가 이방인인가? 
10,영화를 좋아하게 된 계기가 된 영화 
8,이 영화에서 젤 기억에남는  아이? 목격자인 새뮤얼?진짜 너무 너무 이쁜 꼬마?어찌나 이쁜지?해리슨 포드 젊은 모습도 꼬마 새뮤얼의 비쥬얼을 막지못한다?지금은 너무 변해버린 루카스 하스  모습이너무  슬플뿐!  영화...
9,다시 봐도 좋다. 특히 캘리 맥길리스의 연기가 돋보인다. 
10,최고다 몰입감쩐다 꼭보시길 
10,"범죄 스릴러, 드라마, 로맨스를 잘 섞은데다 해리슨 포드를 포함한 배우들의 연기와 음악도 좋았다. 영화 잘 만들었네. 아카데미 각본상과 편집상을 받을 만함. "
9,85년도 작품. 부패경찰에 맞서 싸우는 해리슨포드와 탑건의 켈리 맥길리스의 풋풋한 모습을 볼 수 있어 좋았다. 애미쉬교파와 연계된 스토리도 굿. 
10,롱롱키스~사랑하기에....서로 갈구하는  마음을 표현할 수 있는 유일한 키스.. 그 키스하나로 모두 표현되었다.여운을 오랜  추억으로 간직하게 한  명작이다. 
9,"특이한 소재, 내용의 애정스릴러. 성경대로 실천하고 사는 아미쉬 마을 헛간에서 샘쿡의 흥겨운 팝에 맞춰 얼쑤. 해리슨포드 출연작들은 수준급의 재미를 보장한다. 인디~와 스타워즈 외에도 워킹걸, 블레이드러너, 도망자,..."
10,좋다 
10,멋진영화 결말이 너무 아쉬웠음 포드아저씨 멋짐 
10,어제 정말 재밌게 봤어요 
9,범죄사건 사이의 로맨스...여러모로 내용이 재밌었다. 
10,재밌군... 
8,지금은 확실한 아줌마가 되어버린 켈리 멕길리스 
8,시종일관 팽팽한 긴장감을 유지한 피터 위어 감독의  연출이 빛나는군 
10,인디필름에서지금한다 미국도저때 저런시골이 있다는거에 노랍지만 한편으론 행복하겠다는생각을 해본다 지금기준으로 매우 잘만들어진영화라고 본다 
10," 감독은 이후 죽은시인의사회, 트루먼쇼,워이백 등을 연출했다. 사건과 감성을 적절히 연결시켜 관객에게 생각과 여운을 남긴다. 해리슨 포드는 로맨스도 액션도 만능인 훌륭한 배우다. 나는 개봉시 극장에서 들었던 심장 뛰..."
10,"정말 재밌다. 영화 안에 스릴러 드라마 로맨스 다 들어가 있네 영상미, 스토리, 연기력 ost까지 다 좋다. 이렇게 완벽한 영화는 처음 본다. 웬만한 요즘 영화들보다 훨씬 나은 것 같고 여운이 많이 남는다. 마지막이..."
10,
10,
10,심장폭격. 해리슨포드의 리즈시절 잘생김 뿜뿜 
10,다시 봐도 멋 진 영화입니다.여주인공의 청순한 이미지가 너무 아름답습니다. 
10,1986년에 이런 퀄리티의 영화를 만들다니???놀라울 뿐이다. 
8,멜로에 더 치중했음 좋았을텐데 이 영화 처음 볼 때도 그랬고 다시봐도 좀 어정쩡하다.그래도 마지막장면은 참 많이 여운이 남는다. 
8,풋풋한 해리슨포드.. 그리고 아직 해맑은 비고 모텐슨 
10,기억이 가물했었는데 다시봐도 역시~~엔딩은 ㅠㅠ 
10,아미쉬 컨트리 가본 사람으로서 한마디 하자면 이 영화는  아미쉬마을에 대해 과장된 묘사를 하긴 하지만 그래도 명작이었습니다. 이 영화가 아미쉬를 방문하게된 계기였으니까요. 
6,타락한 형사에 쫓기는 정의로운 형사와 아미쉬교 마을의 삶과 아미쉬 여성과의 사랑. 큰 줄기 만으로도 재미 담보. 
10,와 이런영화를 이제서야 보다니.해리슨포드 액션전문 배우인줄 알았더니... 
6,"추억의 소환...해리슨의 젊은 모습과 스쳐지나가는 비고 모텐슨의 모습,다이하드1에서 악역했던 배우...34년전 영화지만 피터 위어의 감각이 많이 녹아있다. "
10,피터 위어 감독은 그냥 인간이기엔 너무 천재아닌가? 
10,OST도 넘 좋고 정말 명작입니다~!!계속해서 여운이 남습니다~ 
8,고1 개봉할때 봤던 영환데 다시보니 완전 새롭네요.많이 삭제한 부분이 아쉬웠어요. 
10,스릴넘치고 재미있었어요. 
10,오래된 영화가아니듯 ~~스토리며  음악 배우들의 연기 모두 좋아요♡ 
10,명작. 생각나고 기억되는 작품. 
8,아쉬웠다. 중점은 이시대에 백인과 흑인을 인종차별없이 인간의 진정한 모습을 그려냈지만 로맨스가 그걸 방해하는 느낌이었다.. 
10,오늘 첨봤어요 해리슨포드에 위트니스가 좋은영화라는 얘기는 많이들었는데 오늘에서야 봤네요~^^역쉬였고 음악배경이 독특해서 감명 받았어요 
10,쫄깃하고 재밌어요 옛날영화라고 믿기지않을만큼 
10, 최고의 영화였죠 30여년전이네요 
9,비폭력의 메시지가 추적 낭만 스릴러의 재미로  엮여진 수작 
10,시나리오의 완성도와 영화의 연출이 지금 제작되는 그 어떤 영화보다도 뛰어난 작품 
9,"인간의 이기와 쇠붙이들에 대항하는 자연과 공동체, 그리고 낭만이 있었던 시간들. "
10,인디아나 존스도 재미있지만 이것도 재미있는 편 
9,저  때만 해도  해리슨포드  젊네... 
10,아니 이 명작이 8 점대라니... 
10,피터위어 영화는 역시 뭔가가 있다. 영화가 끝나고 남는 여운이 정말 오래간다. 마지막에 해리슨 포드의 눈빛 연기는 아직도 잊지 못할 것 같다 
9,"두 남녀 배우의 압도적인 눈빛연기와 꽃미남 저리 가라 할 아역의 담백한 연기가 좋았다 몇 컷의 비고는 보너스~ 이거 재밌게 보신분들께 ""레이버데이""를 추천합니다 "
8,아..마지막 OO 아쉽다.. 
10,이국적이고 내 스타일과 맞는 영화.. 그러나 스릴러와는 좀 동떨어짐?? 
8,영화는 재미있었지만 대니글로버의 악역은 안어울려요 ^^; 
9,반지의 제왕 히어로 비고모텐슨의 대사 하나도없는 초단역절정판 
8,보기드문 순수체 로맨스의 승리 
8,해리슨포드 멋있어영.근데 결말이 넘 싱거워서 아쉬움 
9,그 나쁜 놈이 대니 글로버 아저씨였구나 T_T 
8,아미쉬 마을을 배경으로 스릴러와 로맨스의 결합... 
8,젊은 헤리슨포드..피터위어의 연출도 좋고 암튼 볼만한 영화 
8,재미는 있는편인데.. 결말이 쪼끔 싱겁네.. 
9,스릴러의 걸작..피터 위어의 미국 데뷔작.. 
7,20세기의 정취가 그리워질때... 
10,순수함의 힘이란 대단하다. 그걸 영화로 연출한것도 훌륭했다. 
7,생소한 아미시에 대해 알게되었다.. 단순한 듯 보이나 은근 지루하지않은 고전의 매력~ 해리슨포드아저씨 소싯적모습 볼수있고 30년 전 영화라는것도 놀라움. 
8,"아미쉬 공동체의 문화와 생활을 통해서, 부패한 경찰/공권력 등을 다루는 많은 영화들 보다, 더 깊은 의미(The Meaning)를 전달하는 것 같음. 눈빛연기, 시선처리, 음악 좋음. 할아버지와 아이의 대화 장면 인..."
4,실화라 더 재밌었어요. 
7,나쁘지 않는 연출에 볼만한 영화 
6,이제서야 본 작품인데 루카스 하스는 지금이랑 완전 똑같네요 ㅎㅎ 
7,액션과 멜로가 적절히 혼합된 상업영화 
7,볼만하구나 
7,스릴러물로서의 긴장감은 다소 부족하나 전반적으로 짜임새 있는 괜찮은 영화. 
7,good 
7,해리슨포드 볼만하다 
6,good 
6,오래된 수작이란 이런느낌? 
6,보기 드문 희귀한 영화 피터웨어의 장르 바꾸기 
7,초반은 스릴러 후반으로갈수록 로맨스로 바뀜 조금 싱거움 
7,긴장감있던 영화가 한순간에 시골 남녀의 로맨스로 탈바꿈. 
6,나름대로 수작 
6,러브라인만 없어도 좋았을텐데 
1,초반에 반짝했던 신선함도 클리셰로 빠진다. 
3,긴장감 없는 뻔한 내러티브와 연출 
8,"인위적인 소박일지언정 이는 여전히 귀중한 것이다. 그들에 대해 섬세하고 신중하게 하나씩 쌓아올리면서 이방인 목격자들에게 깊은 감명을 준다. 아쉽게도 멜로를 끼얹어버려 인류학적 고찰에는 못 미쳤지만, 수사물이자 스릴러..."
4,엥? 막판 부패상관 허무...?;;; 
6,볼만한 고전 
6,언능 범인잡을생각은 안하고 한가롭게 탱자탱자... 
2,중구난방... 이 영화가 얘기하고 싶은게 도대체 뭐지? 
5,그냥 보통의 영화임 . 그나저나 어떡하면 개명작으로 느낄 수 있지 ? 한심하다 ㅋ 
