score,review
10,내 생애 가장 아름다운 3개의 영화 중 하나... 
10,무슨 말이 필요하랴? 봐라!보고나면 생각만해도 가슴아려온다! 
10,아 왜~DVD가 나오지 않는걸까..기다리는사람도 많을텐데... 
10,"김희선의 신화를 보고난뒤, 진용이 생각나는건 뭘까.. "
10, 아직도 공리가 불속을 들어가던 장면이. 
10,유일하게 눈물을 흘린영화 
10,아...좀 여운이 남는영화 
10,유난히 기억에 오래 남는 영화.영화란 이런게 필요하지 않을까? 
10,중국영화에 대한 나의 편견을 없애준영화...아직도 감동이 ㅠㅠ 
8,개인적으로는 처음 접했던 환생 스토리같은 생각이 든다. 
10,최고다!! 
10,다시 봐도 역시 최강;;;; 아름다운영화 중 하나인거삼 
6,볼만함 사랑을 쉽게 잊지 못하는 남자 
10,다시 보고 싶어요~구하기 힘들다. 
10,10년이 지나고 여전히 기억에 남는 영화. 공리가 이쁘지 
10,초등학교2학년때멋모르고봤다.감동적이였다. 
10,환생을 다룬영화중에 이처럼 아름다운 영화는 없을것이다.. 
10,ㅋㅋ 신화랑 비교 된당.. 
9,"배우 연기는 물론 소제, 진한 여운까지 모두 좋았던 영화. "
8,명작이지만 주연이 장예모인게 걸렸다. 
10,나의 사랑의 개념을 잡아준 영화 
10,고등학교때이영화를보고지금은30이넘었지만아직도가슴이저리다 
10,기억속에서 잔상이 많이 남는 영화 
10,중학교때봤는데20살이훨씬넘은지금까지도기억남는영화!강추~!! 
10,홍콩판 은행나무 침대라니? 이걸보고 배낀겨 
10,이영화는걸작이에요 다시보구싶은영화 
10,주성치가 패러디 했었죠?? 어렸을 때 봤었는데...ㅋㅋ 
10,가끔 문득 이영화가 머리속을 스쳐간다.. 
10,홍콩판 은행나무 침대 
10,",,,,,,, 김지은 선생님께,,,,,,,  사랑합니다... "
10,"공리의 순수한 아름다움,  환생 주제로 다룬 영화중 최고! "
10,마음을 움직이는 작품입니다 추천합니다 
9,마지막에는 정말 환생을 믿고싶어질 정도였다 
10,10여년이 지난 지금도 여전히 가슴에 여운을 남기는 영화... 
10,한마디말보다 직접 보기를 권하고 싶다... 
10,감동적임. 
8,재미있게 보았지만 장예모 감독 기용은 조금 오버였던 듯 
10,몽천방의 캐릭터가 아직도 생생하다 
10,10년이 훨씬 지난 지금까지도 기억에 남는 영화 
10,좋습니다 ^^ 
10,지존무상3에 패러디 한 장면이 나오죠... 
10,수많은 영화를 봤고 몇안되는 명작이 있었지만 진용이 최고다. 
10,나도 사춘기때 본영화인데. 아직 기억하는걸 보니 좋네요. 
10,10여년 넘게 지난 지금까지도 여운이 남는 영화... 
10,최고의 영화였음 
10,아직도 그 붉은 옷을 입고 불로 뛰어들어가는 공리를 잊을 수 없다. 
10,영원한 사랑이란 이런것이 아닐까.... 
9,과거에서 올라온 사람에 관한 영화는 이게 최고다. 
10,"강경옥 작가 '설희'와 '별그대' 작가가 표절로 싸운다더라, 사실 강경옥이 400년을 산 사람이 외모가 같은 전생의 인연을 찾는다는 설정이 본인의 창작이라 소송을 건다고 하던데, 강작가도..."
10,"오래된 영화이지만, 지금봐도 영상이 너무 예쁨. ㅠㅠ 천녀유혼 보다 더 애틋하고 절절했던 영화. ㅠㅠ 마지막 장면은 아직도 잊혀지지 않네요. 특히 주제곡 분심이화 이 영화 배경과 너무 잘 어울림.ㅠㅠ "
7,추억의 영화...재미있게 봤던기억이..  이때 공리가 막떠오르고 있을때였지.. 
10,애틋한 사랑을 안 해본 사람은 감히 이 영화를 평가하지 말라 
1,아무리 오래된영화라지만.. 허술하고// 유치하고// 평점너무 과한듯... 
1,옛날에 봤던 추억의 영화라고 평점을 높게 주면 안되지 ㅉㅉ 
1,이 영화를 보려는가? 부디 평점에 속지 마시길 
1,전 너무 지루하게 봤습니다 과거에 봤으면 또 모르지만 
4,이 영화가 9점이나 나오는게 이해가 안됩니다.산만하고 억지스러운 전개때문에 많이 아쉬운 영화입니다. 
1,erer4retrdtdr 
6,스토리는 스펙터클한데 제작 시대에 맞게 유치하게 담아냈다. 
10,내이름하고 같아서 좋은영화 
10,중국영화중에서 제일 좋아하는 영화!! 어릴때 봤는데도 아직 기억에 남는다! 
7,옛날에야 재밌을 영화 
7,ㅋ너무 순박한 내용이라서 좀 웃겼다. 예전엔 감동이었는데 역시 지금은... 
3,제작년도를 생각하면 걸작이지만 ... 
5,절말 재밌나여? ㅜㅜ 이렇게 유치 하루줄이야 ; 
10,"분심이화란 노래, 내 생애 저런 사랑을 해볼 수 있을것인가 "
1,평점믿고 봤더니.  그냥 진부한 드라마네요. 
1,전부 놀부 심보로 평점 올렸다.너도 당해봐라 이거지? 
1,mmnnmnnmmnmm 
2,시나리오가 별로임. 한쪽이 매번 기억을 못한다면 그건 아무런 의미도 없는 것이다 
3,"장예모, 공리가 함께한 영화임에도 실망을 감출수 없다. "
1,장예모 공리 이름이 아깝다. 
1,좋아하던 장예모에게 넌더리가 나게 만들다. 
1,현실성없는줄거리내용도유치엔딩씬만볼만이런유치한영화를왜좋아할까? 
4,"그저그런 줄거리, 밋밋한 액션, 유치한 불로장생의 약, 난데없이 연기를하는 감독과 최악의 배경음악 ㅋ 공리때문에 별두개. 어휴 겨우봤네.. "
