score,review
9,"어릴때 우연히 TV에서 보고 15년이 지나도 기억에 남아있고 결말부분도 생생하게 기억이 난다.20년이 넘은 영화라 분명CG부분은 허술하지만 스토리나 주인공들의 애틋한 사랑은 정말 좋다.백발마녀전,천녀유혼보다 더 슬픈..."
10,내인생 기억에남는 영화 세손까락에 꼽히는  공리 정말 예뻤어요^^ 
10,진용에서의 공리 미모는 정말 최고. 
8,좀 더 세련되게 리메이크 했으면.. 
10,중학교때 본 영화지만 아직도 기억에 남아있는 영화. 시대상 스토리와 참신한 아이디어가 남달른 영화였음 진시황의 불로장생에 대한 이야기와 그시대의 로맨스가 적절히 어울러져 현대시대에 옛사람이 격는 스토리등등 너무재미있...
10,나는 이 영화를 볼 때마다 가슴 깊은 곳에서 흐르는 눈물을주체할 수 없다. 3천년이라는 세월을 초월하였지만 결코 이루어질 수 없는 애틋한 사랑. 마지막 장면의 여운은 마치 영화 레옹의 그것과 견줄만 하다. 
10,초딩때 봤을땐 재밌어고 중년이 되서 보니 또 재밌고하지만 가슴 한켠이 아려온다... 
10,이 영화를 볼때는 제작 연도를 감안하고보세요 그래도 스토리라든지 연기력에담겨있는 표현력... 제가 어릴적 개봉했을때 보고 생각나서 자꾸만 순수함을 찾게돼는 영화데 시대가 어떻니 쓰레기같은 평은 지금 처음본 어린이들 ...
10,빨간색 깃발이 교차해서 지나가고 공리가 빨간색 옷입고 불로 뛰어드는 장면.... 가슴 아프지만 명장면이다.  진시황 시대 공리모습 너무 예쁘다.... 
10,애절한사랑연기가 일품 
10,이 영화가 89년에 만들어진 영화란 말인가? 지금나오는 시답잖은 멜로보다 훨낫다 
9,"어렸을때 봤던 영화중에서 천녀유혼 만큼이나 강렬한 영화, 공리가 매우 아름답게 나왔던 걸로 기억함, 불현듯 보고 싶은 영화, 다운받을 수 있을려나 너무 오래되서 "
10,나의10대 시절에 처음봐서 지금은 10번 넘께 본영화는 이영화가 처음이자 마지막일꺼 같습니다. 배경음악도 너무 좋았음 
10,잊을수가 없는 영화다..장예모 연기가 멋짐.. 
10,아 이거 정말 재미있게 봤었는데. 공리 완전 이쁘고 장이모우 완전 멋지고. 쵝오였어. 
10,한번씩 생각나는 영화입니다 
10,"시간이 지나 10년, 20년, 이 지난 지금도 다시 보고싶은 작품이고 기억의 회자작품이라 본다. 장예모의 우스꽝스런 속에 슬픈 눈동자 장예모는 사실 감독으로도 유명하다 아름다운 공리와 우리의 첫사랑을 찾아헤메는 장예..."
9,공리 정말 이쁘다.. 공리같은 외모가 질리지 않는 외모라 생각한다. 
9,80~90 홍콩영화팬이라면 꼭 봐야 할 영화!! 
10,적절하며 신선한 소재 훌륭한 시나리오 
10,"1989년 영화, 장예모 감독의 눈빛 연기가 인상적이다, 연기자로 꾸준히 갔어도 좋은 작품 여럿 남겼을 거 같다. "
10,으아악 하고 비명을 만들게만한 한남자의 지고지순한 사랑! 
10,주인공이 장예모감독이었어 
10,1990년에 개봉한 영화를 25년이 지난 지금에서 봅니다 제가 초등학교때 나왔던 영화네요 그 당시에 봤다면 어땠을까? 라는 생각이 듭니다 지금 보면 얼핏 유치할 수도 있다고 생각하지만 진시황릉의 병마용에 대해 궁금증...
10,아주예전에 보신분들이라면잊혀지질 않을듯 
10,영화의 스케일이 너무 멋지다.불멸의존재의 무한반복되는 기다림의고통 그리고 로맨스 
10,이 영화를  기억해 준 나에게  감사. 정말 손 꼽는 영화. 
10,장예모 주연 신선하다. 
10,마지막장면 ;;결국 나라가달라서 이제 말도 못붙여보네;;ㄷㄷㄷ 
10,"진용,서유기[월광보합.선리기연]시대의 영화만큼 슬프고마음아픈영화는못만나보는구나 "
10,나랑 같은분 또있으시네완전 꼬맹이때 TV에서 보고 하나도 기억에서 지워지지 않고 생생히 남아있었다방금 다시봤는데 그감동 그데로 남네요 
10,"디지털화 작업으로 블루레이버전이 출시된다면 평생소장용으로 구입용의가 있다..  제발 나와다오....아마도.. 별에서온그대.. 도깨비.. 등은 이 영화가 모티브가 되지않았나 싶다.., "
10,난 87년생인데 어린이날에 아빠랑 극장가서 이영화봤음.내인생 최초의 극장영화ㅋㅋ아이스크림 먹으면서 봤는데 막연히 그때가  6살쯤일거라 생각했는데 90년개봉이라니;; 
10,내용이 산으로 가는게 없지 않아 있었지만 24년전의 영화니 감안하면 명작인건 확실하다.다만 눈물날 정도로 감동적이진 않았다. 
10,3천년이 지나도 변하지 않는 사랑 
10,선리기연과 함께 최고의 영화~ ^^ 
10,"사실 중국영화는 세계인들에게 감동을 주긴 좀 어려운데, 이 영화는 정말 누가 봐도 감동을 주는 작품이다. 정말 너무나 대단한 명작 "
10,정말  오래된영화인데도  전혀 지루하지않은 스토리에요... 
10,이 짱깨영화는  인정한다 
10,"남자를 알아보지 못하는 여자의 무심한 눈빛,  그걸 바라보는  남자의 아련한 눈빛. "
10,진용을 보고 꼭 서안에 가고팠는데..직접 가보고 감동 
10,어릴적 보고 머리에서 지워지지 않았다. 그후루 30년이상 지났지만 매년 생갈날때 보곤한다 
9,어릴적 어쩌다 봤는데 거의 수OO동안 기억에 생생히 남아있던 영화.. 오늘 다시 보는데 아주 낯익고 재밌었음... 
8,배우 장예:모 .공리는 참 이쁘다. 
9,공리와 장예모의 썸이 시작되다 
10,"어릴적 본 영화중 가장 아련히 생각나는 영화 당시 공리의 미모와 ost, 아름답고도 신선한 스토리 "
10,"불사의 장수와 끝없이 환생하는 한 여인과의 독특하고도 애틋한 사랑. 스토리도, 액션도 아주 흥미진진하다. "
10,"개봉 이후 테마를 너무도 많이 베꼈기때문에 재미없을수도 있지만,원조이고 명작이다. "
10,마지막 장면은 정말 길이길이 남을 명장면.. 
8,가슴을 칼로 후벼파는 듯한 슬픔이 남는 영화. 사랑하지만 이루지 못하는 운명. 
10,ㅇ ㅏ.어릴 때 보고 커서 다시 봤었는데 완전 짱인 영화에요!!!! 
10,15년만에 또봐도 눈물쏟게 하는 여운가득한 영화. 공리와 장이모 너무 예쁘고 멋진! 
10,정말 재밌게 본 영화입니다. 
10,진용..제목을 찾기도힘들다 ^^;; 초등학교 들어가기전 본 영화중 최고 기억에 
10,역시 전성기시절의 홍콩 영화는 다재미있군요  영상미와 배경음이 참맘에들더군요 
9,원작도 명작이지만 리메이크 되어도 매우 좋은 작품일듯 싶네요~ 
10,중국 최고의 미녀는 보지도 못한 양귀비가 아니다..살아 있는 공리다라고 말할 수 있는 최고의 영화 
7,진짜 재밌게 잘봤는데  남주 얼굴 너무 늙었어.... 못생겼다는게 아니라 여주랑 나이차이 엄청나보임.. 연기력은 인정할게요 장이머우 감독님 
10,이 영화가 89년도 작품이라니 ... 
10,저 알찬 남자가 누군가 했더니 장예모우 감독이었네. . .모처럼 사랑 이라는 감정의 소중함을 알게해준 영화 
10,진용 대단한 명작인데 나중에 그레이트월 같은 졸작을 만들 줄이야.ㅜㅜ 
10,내 인생에 가장 강렬한 기억을 선사해준 영화 
8,"초등학교때 보고 제목이 생각이 안나서 겨우 찾은영화,지금보니 허술하긴 하지만 몽천방의 선글라스 정면과 영화의 마지막 장면은 아직도 기억에 남는다 "
10,20여년동안 10번은 봤나 싶네요. 역시 좋은 영화는 몇번을 봐도 질리지가 않고 늘 새롭다는... 
10,어렸을때 이걸 보고 한참 울었던 기억이...ㅜㅜ 
10,100여년이라는 짧지 않은 시간 동안 좋은 기억으로 남을 겁니다 
9,"참신한 스토리와 소재, 아쉬운 구성과 연출 "
10,마지막 장면만큼은 홍콩영화 최고의 엔딩 
6,그냥 무난했음. 
10,재미있게 본 영화~다시 보고 싶은 영화~ 
10,아름다운 비극. 몽장군님 화이삼. 
10,어렸을적 보고 아직까지 뇌리에 깊게 박힌....감동적인 영화.. 
7,불로장생과 함께하는 불멸의 사랑ㅜㅜ 
6,진흙 전사의 사랑 이야기 
10,너무 안타깝고 슬펐음 노래는 몇OO이 지났는데도 기억남 
10,인생영화 다시봐도 어릴적 봤던 그 강렬했던 여운들이 다시금 샘솟게해주는 최고의 영화 
10,천녀유혼에 버금가는 중국 최고 판타지 로맨스 영화. 불로장생의 운명을 가진 강직한 무사와 윤회를 거듭하는 한 여자의 영원불멸한 사랑을 다룬다. 특히 라스트씬의 여운이 두고두고 남는 영화 중 하나. 
10,
9,
10,공리가 불타 죽는 장면 패러디한 주성치 출연한 영화 지존무상3가 생각나네요 ㅋㅋ 
10,어릴때 봤던 영환데 아직도 문득 생각나는 영화..다시 한번 제대로 봐야겠다 
8,"인간이 길망하는 영생, 권력, 명예, 부.. 이 모든 것들이 뒤범벅 되어 결국, 흙더미 속으로 빨려들어가는 인간욕망의 허무를 다룬  수작 "
8,"중걸이가 보라해서 봤는데, 확실히 30년전 작품이라 지금의 기준으로 판단하면 안되긴 하다. "
10,내가본 환생 스토리 영화중 최고 
10,어릴때 어렴풋 기억이 나는데 25년 넘어서 본듯 한데.. 다시 보니 재미 있네요.. 
10,까까머리 중학생때 봐서 중국영화에 빠지게 해준.. 바로 그영화네요.. 내생에 명작중 명작 꼭 보시길... 
9,정말 괜찮게 본 중국 판타지 멜로영화.. 
10,티비에세 본기억이나요어린맘에도 참 슬픈사랑애기 주제곡이  넘기억나네요 
10,대박~ 나 꼬꼬마때7살무렵 본건데 주인공이 공리였어ㅎㄷㄷ 그시절 나에게 사랑이야기는 기억에 남지않고 영화의 배경이었던 진시황 무덤... 진용~ 너무너무 강하고 놀라운 내용.. 그 놀라운 장면을 볼수있어서 좋았다. 
10,중딩때 극장에서 봤음~ 정말 명작이다~ 그당시 여운이 아직도 남아있다~ 남자 주인공의 수천년의 사랑과 공리의 환생~ 공리 누나 정말 사랑스럽고 이쁘다~ 이영화 짝퉁영화가 '은행나무 침대' 였던걸로 기억...
10,모르는 사람이 지나갈때 왠지 그리운 감정이 들었다면 ...전생의 연이었을지도..지금봐도 너무 멋진영화!! 
10,명작. 말이 없는 명작. 다시봐도 명작. 
9,흥미로운 스토리와 젊을적 공리의 모습이 보기 좋았다 
10,명작! 꼭 봐야 되는 영화 
9,20년도 훨씬전에 딱 한번 봤지만 지금도 기억이 생생하게 남아있는 몇 안되는 영화 
10,.공리의 그 슬픈눈망울의 연기 정말진용은 여러번 봐도 볼때마다 사랑이라는 정의를 다시내리게 하는 영화임. 1989년도 작이라는게 믿어지지않을정도로 잘만들어진 영화 
10,비디오로 친구네서 본지가 30년 가까이 지났지만 아직도 기억에 남는 인상 깊었던 영화. tvn드라마 도깨비의 마지막 씬은 이 영화의 마지막 장면을 떠올리게 해 생각나 함 들러본다. 
7,장예모 감독의 연기를 볼수 있는 작품! 그 시절 완성도 높았던 중국 본토 영화였다는게 꽤나 인상깊었었다. 아름다운 시절의 공리 를 추억할 수 있는 영화 
10,작가님 부탁드려요 정말 잘만들거 아니면 이런 귀한 소재는 따가지 마세요 진용을 그리 유치한 대사와 이도저도 아닌 흔해빠진 드라마로 만들어 시청률 올리니 만족스러우십니까? 한심해 ㅁㅊ겠네 
10,최근 도깨비 드라마를 보다가 다시 생각났다. 
10,명작입니다 어릴때보고 큰뒤에 봐도 여전히 명작이네요 가슴이 아파오네요 
10,서유기시리즈와 함께 개인적으로 좋아하는 몇 안되는 중국영화. 
8,공리의 젊은시절에서 장쯔이가 보인다..장이머우 감독의 주연작품... 
9,배우 장예모와 풋풋했던 공리의 신인시절을 볼 수 있어서 좋았다. 평점은 8점 주려고 했으나 엔딩신이 여운이 깊어서 9점 ㅜㅜ 
10,정말 재밌게 봤던 작품!!다만 후반부로 갈수록 스토리 전개가 약간 아쉽습니다! 
9,"우리는 감히, 이 映畵를 위해 「충격」이라는 말을 아껴왔다! "
10,아직까지도기억에남는영화 
10,정말 재밌게 잘봤어요. 
10,중간정도에서는흙으로뒤덥혀잇는생로병사분이깨어있는모습그리고흙이떨어져있는모습도 인상적이었음.그리고동하를구해주는도와주는모습도 인상적이었음.그리고혼자생로병사어깨붓으로청소해주는모습.그래서버스를타고온일본여인과만나시다.이게중간정도...
7,그냥본다그냥보고있다근데잼나다 
10,이 영화 정말 감동을 주더군요. 
7,너무 기대했는듯.. 지금은 이런류가 꽤 많아서 신선하지 않은데 그 당시였다면 꽤나 신선했을듯 싶다. 
7,공리는 예뻤음...장예모만의 영상미가 좀 떨어지는듯..;;역시 감독이 아니라서 그런건지..;;; 
10,다시보고 싶은 추억의 영화 
10,"밑에 분 말씀에 공감. 저도 대략 초등학교땐가 중학교땐가 딱 한번 밖에 안봤지만 10여년이 지난 지금도 잊혀지지 않는 영화. 명작중에 명작, 장예모 공리 주연. 흐아.. 다시 보고 싶은데 너무 오래전 영화라... "
10,견줄만한 영화가 있다면 같은급이라면 ..레옹 급이다 
7,추억의 영화는 추억으로 남기는게 좋을듯.. 어릴때 tv에서 보고 정말 감동이고 최고의 영화라고 생각하며 잔상이 남았는데 지금 다시 보니 좀 많이 허술한게...어쩔 수 없겠지... 요즘 타임슬립작품으로 더 복잡하고 재...
10,제가진짜감동적으로본영화입니다 
10,또 보고 싶다. 정말...대작임. 
10,어릴때봤는데지금도장면하나하나기억이나는영화..이영화는다시봐도다시박힐꺼같은영화지금학생들은이해할까요?전그랬는데..너무그립네요이런영화... 
10,어릴 때 친구집에서 비디오로 보고 20년이 흐른 지금 갑자기 생각나서 힘들게 찾아봤는데.. 최고다. 지금봐도 정말 대단하다. 
10,사랑을 잊지 못하는 사람들에겐 추억과도 같은 영화.. 이 영화를 보며 중학교 시절 꿈꾸웠던 사랑이야기를 서른이 넘은 지금도 꿈꿔본다.. 
10,유년시절 최고의 작품 
9,마지막 장면에서 감동받음 
10,여운이 있는 영화 
10,그시대의 최고수작 
7,"스케일은 컸지만, 무언가 짜임새도 부족했고 마지막에 신파극으로 치닫는 장면은 좀 아쉬웠음 "
6,공리 나와서봤지만 90년대영화라 그런가 재미있진않았다. 
9,"다시보고싶은영화,, "
9,이게 진정 중국 스케일~! 
10,어릴 적 많이 울었던 기억 
10,정말 거의 20년만에 본건 같다... 이번에 정식 dvd로 출시되어 다시 감상..베스트~ 
10,지금 다시 본다면 어떨지 모르겠지만.. 나의 기억속에 남는 명작 중에 하나.. 
10,예전에 SBS영화특급때 성우더빙으로 처음 봤는데 아직까지도 기억에남습니다 대작임 
10,15년전 꼬맹이일때 보았던 잊을 수 없었던 감동의 영화.이땐여주가 공리인지도 몰랐네 
8,아시아적인 정서(스토리)가 담긴 중국판 하이랜더. 
10,"정말 어렸을 때 본영환데 우연히 다시 보게 되네요..,그때의 감동이란.. "
8,그 옛날 영화관에서 생각지도 못한 중국영화의 새로운 경험을 함... 
10,주제가 때문에 10점! 
10,"진정한 사랑, 감동 대작.ㅋ "
8,후반의 유치한 듯한 액션씬을 빼면 최고 
8,시대를 초월한 사랑 
8,중반까지의 슬픈 사랑이야기 부분은 참 좋다 
10,시대가 지나도 그 사랑을 간직하고 있다는것에 요즘 인스턴트같은 사랑과 비교가되니 
10,어렴풋이 기억나는 추억의 영화네 ㅋㅋㅋ 이런 소재 정말 좋다 
10,"이런 사랑을 기다리고싶다... 레옹,랭고리얼과 더불어 내인생 탑3에 드는영화.. "
7,엽천문 노래는 최고...장예모가 연기까지!! But 요즘보기엔 진시황릉비밀이 더 나은듯 
10,몇번을 봐도 감동적이다... 
10,참 기억에 오래 남는 영화임에 틀림없다...요즘 세대가 보면 좀 유치 할지도 모른다 
7,시간을 초월한 사랑은 가슴아픈데(이것땜에7점)재미는 없다.진나라때까진 참 좋았는데 
10,정말 오랜만에 다시보는데.. 역시나 명작이네요.. . 
10,3개의 시간이 흐르는 모습과 그때마다 다른캐릭터의 공리의 모습에 감탄하게된다 
10,정말 잊혀지지 않는영화 
9,신선한 소재에  재미있는 장면들..  그때 당시에는 참 엄청난 작품이었겠다 
5,평점이 너무 높은거 아닌가요..? '추억의 영화' 타이틀만 빼면 남는게 없는데. 
10,정말 애뜻하고 슬픈이야기 감동적이예요 
7,조금 촌스럽. 
10,어린시절 봤었는데 제목이 기억이 안나 그동안 못봤었는데 드디어 ㅎ 역시 감동 
10,감동 감동~ 
10,갑자기 이 영화 생각나서 파인더로 찾았네요 ㅎㅎ 
10,맨 마지막 부분 너무나 인상깊네요.. 
9,불멸의 사랑에 대한 환상을 심어준 영화. 
4,추억과 함께 풋풋한 공리를 볼 수 있으나. 작품 내용은 너무 진부하다. 
7,애틋한 느낌을 전해주는 영화 리메이크 해준다면 좋겠다 
10,반짝하는 영화가 아니다. 20년이 지나도찾게되고 아련한 추억으로 남아있는영화.최고~ 
10,애틋한 사랑으로 여운을 남기는 명작 
10,어렸을적 한 번보고 너무도 큰 감동을 받았던 영화...친구들도 다 아는 영화 
10,최고였다.. 마지막장면은 정말 ..크... 다시보니 요즘영화와 비교는 안되지만 명작임~ 
10,10년도전에 본건데.. 다시보니깐 예전만은 못하지만 회상에 빠지게만드는영화 
9,다 좋긴 한데 솔직히 연출이 서툴다... 
10,여운이 남는 영원한 사랑을 그린 영화. 대작입니다. 
10,아..평생 잊혀지지 않을 영화... 
10,좋아좋아 
6,남자 주연배우의 탁월한 연기력 하지만 빈약한 구성 제작년도를 고려한다면 8.5점 
10,사랑이란 환상을 심어준영화 
7,공리의 새로운 연기를 볼 수 있다는것만으로 충분한 영화 
10,볼땐지루했는데 보고나서 생각해보니깐 괜히슬픈.. 
10,정말 여운이 오래 남았던 영화...  흠잡을데 없는 완벽한 걸작.... 
10,내가 제일 좋아 했었던 영화.. 너무 아름다운 이야기 
10,고등학교 시절 극장에서 몰래 보던 기억이 아련한 느낌의 영화 
8,언젠가 기회가 되면 다시 한번 음미해보고싶은 작품 
10,한때 제일 좋아한 영화 
10,OOO 전 영화 임에도 불구하고 재미있네요 
10,언제봐도... 
9,"후반의 액션보다는, 사랑이야기에 더 끌린다 "
10,내가28년살면서본 최고의 영화! 
9,볼만 
9,정말 멋졌던 영화!! ㅠ 
10,14년전에보고다시보니참새롭네 해피투게더를처음봤을때그감동과같다.. 
9,내용굿연기굿음악굿 벗 지금보면 좀 촌스러울수도 
10,초등학교때이영화를보고빠져결국진시황릉직접보고왔어요최고! 
9,장이모우감독 멋찌네!!! 
7,개봉했을때는 흥미로웠겠지만..지금보면 뻔한스토리.. 
10,강추.!! 
8,조금 유치하지만 나름 매력있는 영화. 
9,"어릴적 기억을 더듬어 다시본 영화. 주제곡,스토리,배우 모두 좋음. "
10,우영광 간지~ 
7,중국영화의 스케일 ... 말이 필요없다 ... 
10,천생연분의 진수를 보여주는 영화 
10,3000년이 지났다는건 말도 안돼는 소리죠. 2200년 정도. 
10,오랜시간이 지난뒤에도 잊혀지지 않는 명작 
10,"말이필요 업죠, 명작. "
10,"어릴적 딱 한번 봤는데 잊혀지지가 않고 , 아련하게 남아있는 느낌 때문에.. "
10,예전에 티비에서 많이 해줬는데~엄청재밌었어 
10,어릴때 조낸 감동 갚게 보았던 ㅜㅜ 
9,세대 차이인가 저평가를 어떻게 봐야 할 지 참 
10,난 지금도 잼나 ㅋㅋ 
10,어렸을때 tv에서 2번은 봤었던... 공리의 모습이 기억에 남는다. 
10,89년작이라고는 믿기지 않을 정도의 완성도 높은영화 
10,마지막 부분 아주 기억에 남아요... 10년이 지난 지금에도 
10,지금보면약간촌시럽지만..그때당신정말잼썻듯하다.굳 
8,"해동에 있는 삼선산은 금강산, 지리산, 한라산을 말한다고 하네요. "
10,우연히 틀었는데.. 끝날때까지 채널을 돌릴 수가 없었다. 역시 장이모우. 
10,"약간의 유머스러운 면도 잇고,,,감동적인 스토리가 압권!!! "
2,쩝;;할말이 없더라.89년작품이니깐 상상력에만 점수.나머진 아니다 
10, 정말 싱기하게 봤던.. 그리고 또 재미났던 영화 
10,웅장한스케일과 개봉당시에는 획기적인 연출과 스토리~ 대작중에 대작 
7,다시 보니 상당히 어설프지만 그래도 낭만은 남아있으니까... 
10,다시보고픈 영화~~ 
10,여러번 보았던 아름다운 영화. 
10,무슨설명이 필요한가 마지막엔딩까지 가슴벅차다 
10,중학교때 눈을떼지 못하고 봤었죠 아련한 추억이 나네요^^ 
10,15년전 중학교때 진용을보고 장예모감독에게 매료되었었죠..^^ 
10,우연히보게됬던 영화.. 정말 최고의 영화로 기억된다. 
10,어린시절 최고영화 잊을수 없다 
10,정말재미있어요..^^ 장이모우 굿~~ 너무좋음.. 
10,영화내용은 정말 감동적인.. 최고의 영화.. 
9,영화후반 약간 유치한듯 한 장면들 빼고는 좋다 
10,"가슴아픈 이야기, 연출은 미흡했지만 스토리 자체가 다 덮어버림 "
10,저 시대에서 최고였지만 지금도 보면 최고. 
10,정말 잼있네요 완전 강추!! 
10,공리땜에봤는데 웃기고도 애달픈.. 
10,이거 이후 고대에서 현대로 많이들 건너왔죠. 
10,요즘간혹나오는무협보단좀낫네여과거85년이전꺼보단좀못하고 
10,최고의 영화* 
10,dusfyql ☜ 이사람의 평점에 속지 마시길.. 
10,어린소녀였던 나에게 감동적인사랑을 꿈꾸게해준 영화^^ 
5,장이모우 감독이 아니라 주연이였군...아 당황스럽다;; 
10,아주어렸을때티비에서봤는데 15년이지나도감동적이었어요 
9,공리도 코미디를 할 수 있구나 하는 생각이 드는영화 
7,영원한사랑...약간코메디적인게맘에안듦.... 
10,"내나이 24 정말 국민학교때 봤으니까..감상평""이영화 최고다"" "
10,정말... 최고의 영화였지~~ 끝없는 사랑... 
10,최고 
10,10번을 넘게 봐도 질리지 않는다..다세포소녀 쓰레기 
10,공리가 다시환생하여 그앞에 운명인양 선그모습이 너무 멋있었다 
10,"15년만에 다시 본 영화, 다시 봐도 감동 그 자체 "
9,어렸을적 그 감동~ .. 지금도 가슴이 뭉클하네~ 
10,함부로 영화를 평가하지 말길 
10,10년후이들의평점은의미가 없다.그때의감동을쉽게보지마라 
7,장르가 액션? 보는 내내 코미디인줄 알았던 난 뭐지 
10,수천년이 지나도 변함없는 사랑이야기 
10,우연희 본 영화..뭔가 생각하게하는 영화.. 
4,너무 허술한 연출과 허구성을 너무 허구적으로 그린 영화 
7,뭐가 최고의 영화란 건지..-_-;; 공리땜에? 그래.공리가 이뻤다. 
10,내 삶에 가장 기억에 남는 영화 
10,내생애 최고의 영화중 하나 감동그자체 
10,정말 영화다. 
10,내생애 최고의 영화 
9,엉성한연출도있지만 공리와예모의 마지막 장면이 잊혀지질않는다 
10,공리가 너무 예뻣고 재미있었다 
10,김진오가 추천하는 영화입니다. 
10,예전에 봤던 감동 아직도 그대로..공리짱^^ 
10,"어설프다는 밑에 밑에, 제발 제작년도를 보고 헛소리해라.89년! "
8,배우로써의 장예모를 보는 것만의 재미도 쏠쏠하다. 
5,"흥미롭긴 하지만, 어설프고, 빈 틈이 많이 보이는... "
10,어렸을때 봤지만 아직도 기억이. 정말 명작!! 
10,최고 
6,"소재는좋으나,영화가되면서부족.But,남자배우는인상적. "
10,사랑은 진심이란걸 알려주는 솔직한 영화 
10,장예모의 캐스팅 빼곤 모두 완벽한 걸작! 
10,어제 TV에서 봤는데 마지막 장면이 너무 예뻤어요ㅠ乃 초 감동~ 
10,사랑이란걸 다시 일깨워 주는 영화 
10,어제tv에서다시봤는데 여전히재밌어요 환생스토리는진용이최고 
9,천녀유혼이랑 비슷한 느낌 
10,주인공이 너무 카리스마 있어서누굴까했는데 장이모우라니ㄷㄷㄷ 
10,삼천년의 사랑.근데 여자가 너무 ㅃㅅㅇ 처럼 나왔다... 
10,인연이란 과연있는것일까?그럼영원한 사랑이란?둘다믿고싶다 
10,90년대에서 감동의 물결이 몰아치네..진정한 남자의 표상. 
10,16년 전 영화라 과장된 부분은 많지만 16년전 치고는 대작이다! 
10,오늘 KBS에서 하는거 봤는데 결말이 매우 씁쓸하네요 ㅜㅜ 
10,중학교때 단체관람후 다시보게 되도 그때 그감동 그대로닷 
10,로맨스퐌타지영화의 최고봉! DVD는 왜 안나오는겨~~~~!! 
