score,review
10,기묘한 영화네요20년전에 봤는데..아직도 다시 보고픈 영화 일위 입니다.. 
9,20년전의 추억... 그녀가 지금은 옆에 없어... -1 
6,헐리웃 영화만  보는 이들에게   추천.   독특해서 잊혀지지  않는  영화 
7,"독특한 미장센, 기괴한 매력의 프랑스산 블랙코미디. "
7,네이버 가 다 알려줘서 볼 필요가 없겟군 
9,영화정보에 나온 줄거리ㅋㅋ 좀 지나치다 싶은데 수정 좀 해보시면 어떨지..줄거리가 아니고 특정장면을 줄줄이 풀어써주셨네요..너무 웃겨요.초딩 독후감 스타일 
9,분명히 어두운 영화인데 따뜻한 느낌이 남는다 
10,기괴한 세상의 기괴한 이야기..그러나 현실이 더 가볍다 할 수 있는가. 뛰어난 미쟝센이 눈부시다 
10,등장인물하나하나가사랑스럽게표현됬다.소재는어둡지만왠지사랑스러운영화 
10,이런 독특한 미장센과 성인동화라는 측면은 '그랜드 부다페스트 호텔'보다 더 앞선 선구자적인 작품이다. 말하자면 길지만 우리나라의 '아가씨'가 이런 영향을 받은 것이고.. 어쨌든 이런 작품...
10,영화 내용보다 평점이 낮은 거에 더 놀랐다. 
7,스토리는 단순한데...배경이나 분위기가 참 기괴해서 볼만하다... 
10,모든 상황이 실제였다 영화가 아닐지도 모른다는 착각을 준 유일한 프랑스영화였다 
10,"보면서 충격을 받았고, 다보고 나서 여운이 남았다 "
8,야만적인 곳에서 피어난 낭만 
9,잔인한  장면이 많이 나올 줄 알았는데 다행이네요 휴특별하고 코믹하고 재밌었다 
7,절대 단순하지 않으면 특별하고 기괴하다 경쾌한 음악의 연주 소리가 상당히 인상적이었다 
9,"어렴풋 kbs명화극장에서 해줬던걸 봤던 기억이 나네요..  언제인지 기억은 안나지만 20 여년 쯤  ...  잊지않고 있었는데 제목을 몰라서 한참 찾았습니다.인육 바이올린 미래,..이 세 키워드로요 다시 봐야겠어요 "
7,뭔가 단순한 내용에 약간 지루하지만.. 특유의 몽환적인 분위기 때문에 끝까지 계속 보게 된다. 
10,색감이 너무 좋았고  여자주인공도 좋았어요 근데 이영화이후로는 더 촬영을 하지않아서 좀 아쉽습니다 
10,다소 잔인한 소재를 다루지만 푸는 방식이 신박하다. 굿. 
7,정서에 안 맞지만 괜찮다. 
9,"먹을게 없는 미래시대. 머물러있는 그곳이 지옥. 햇볕도, 바람도 없다. 일자리를 찾아 떠도는 루이종은 그곳까지 온다. 알수 없는 것이 그 지옥에서 연인 줄리를 만나게된다. "
8,어두운 배경을 통해 미래도 과거도 아닌 독특한 계급사회의 암울하고 어두운 모습을 잘 보여주는 매우 희한한 영화 
5,내겐 너무 컬트적이야.. 
6,너무나 시간이 지나서 봤지만 이런 컬트도 괜찮네 
9,이렇게 상상력 넘치는 영화가 많이 나왔으면 한다..음악도 좋고~~^^ 
9,뛰어난 영상미와 이 영화 특유의 느낌은 영화사에 길이 남을 것이다. 
8,소름끼친다..이런 세상 상상하기도 싫어ㅠㅠ 
1,특이하지만... 
10,지금 이비에스서 하구잇어요!음악도 너무좋음 너무진보적인 명작! 
10,와 이거 몇년전에 본건데 !! 진짜 집중해서 보았다.!! 되게 흥미로웠다 
8,"짧은 러닝타이만큼 큰 주제는 없다..하지만 이야기를 풀어내는 방식과 미술,음악이 마음에 든다 "
8,기발한 상상력과 개성에 한표 
10,
10,네이버가 결말까지 다 알려줘서 볼 필요도 없겠네. 
10,그 당시에도 그럴수도 있겠다는 내용에  충격적이었는데OOO전에 이미 현재를 예측했다는게 또 한번 놀라게 합니다.다시 보고싶고 추천하고 싶습니다 
10,제 인생영화예요 재미와 예술그리고 계속 생각하게 만드는 영화예요 
10,후회없는 최고의 영화  !!! 
10,독특하고 톡톡 튄다. 재미있는 구림들이 많이 나와서 보는 재미가 넘친다! 
10,기억에서 영원히 잊고싶지 않은영화 
1,예술영화인데 내취향은 아니군. 
6,독특함에 처음에는 매료되어 보다가 중반넘어서는 살짝 지루한 감이 있었지만 그래도 보는 재미가 쏠쏠했다. 
10,블랙코미디를좋아하지만그중에서도정말좋다 
10,기억에 남아서 다시다운받아 보는데... 정말 인상깊은 영화네요... 중년이 되어서 한번 더 보고싶은 영화입니다 
10,내가 장피에르 주네와 도미니크 삐뇽을 좋아하는 이유 
7,블랙 코미디 프랑스 영화치고는 볼만함 
4,프랜치를 이해하기란...;;; 
7,영화만큼이나 해석도 아리송하고 불분명한 영화. 그래서 그 존재감으로 기억에 남을 것 같은 영화. 색감하나만은 20년전이라고 믿지지 않을 정도. 단순하면서 난해한 영화다. 
10,"루이종과 쥘리, 정말 사랑스러운 캐릭터다. 이래서 세상이 아름다운 것일지도. "
10,ㅎ 
9,ㅎㅇㄷ 영화의이해 
3,뿌킨 프렌치 무비! 나에겐 제 8요일도 버거운데 이것까지.. 
7,그로테스크한 옷을 입은 광기 어린 피에로. 
8,델리카트슨 사람들 
10,보고싶네요 
7,7 
8,"?어두운 배경에도 부드러움, 따스함이 베어있는전형적인 프랑스영화. 여주인공이 무척이쁘다! "
8,캐릭터들간의 표현과 싸이코적인내용과 매치되는 묘한음악 
8,91년작이라니! 
8,어딘가 소름끼치는 분위기지만 통통 튀는 매력들 
7,캐릭터들이 독특하구만 ㅎㅎ 
10,주변에서 들을 수 있는 소리를 이용해 참 잘 만든 영화인듯 : ) 
5,재미난 부분도 있긴 하지만... 
10,징그러울 거 같은데 짜증날 정도로 현실적이다. 
7,단순히 보면 코믹하면서도 싸이코틱하고 깊이 이해하려들면 난해하다 한편으론 짜증남 
7,"공포라기보단... 좀 음악같은게 아름답기도 하구,, 근데 지루한감도 없지않다.. "
7,아름다운 선율 + 기발한 상상력 + 기괴함 + 아기자기한 색채 = 프랑스 예술영화 
9,기발하고 기괴하고 톡 쏘는 이 맛.. 십수년이 지나도 잊혀지지 않는 독특한 걸작 
10,푸줏간 고기의 사랑 
10,장 피에르 주네 감독을 기억할 수 밖에 없게 된다. 
10,인육을 먹는 영화지만 사랑스럽다! 
10,재치와 위트가 넘친다 
10,너무 너무 너무 좋아하는 영화 
9,음산하고 기묘한 상상력. 그 이전이 궁금해 지는 영화~ 
10,"""영화"" "
9,탁월한 상상력. 지독히 현실에 가까운 비현실적 세계. 
10,잼있어요... 
6,"흥미롭긴한데,,잃어버린아이들 전이라 그런지 그거에 비해 떨어진다// "
8,"초반에 비해, 중후반을 이어가는 힘은 부족해 보이지만, 충분히 재밌었던 영화 "
8,영화 브라질(1985)과 분위기가 비슷하다. 
8,여러 의미가 있는 영화.. 
9,기묘하고 몽환적인 프랑스판 난쏘공을 보는 느낌... 
10,음악도 좋다 
10,장피에르주네가 누군가 했더니 아멜리에  감독이네요? 
10,91년도라..최근영화들의 독특했던 소재를 모두 담고 있는 신기한 영화 
10,주네 감독이 선사하는 독특한 선물. 재밌게 해 주네...ㅎㅎ 
7,흥미롭긴 하지만 재미는 없는 주네감독 초기작 
7,"특유의 재치와 코믹이 어우러진 초반부는 좋았으나.. 갈수록, 그 맛을 잃는다. "
8,여러가지로 좀 묘하네 .. 모처럼 인상깊은 영화를 봤네요. 
10,시간이 흘러도 남아있는 strong uniqueness.... 
9,"괴짜, 재치 ^ ^ "
2,별로...이것저것연결시키는 사람많은데 감독이 잘표현못했다는데 동감. 
7,색다른 영화보기의 즐거움을 만긱하다 ... 
10,장 피에르 주네 영화를 다 찾아보게 만든영화. 
9,행복할따름이다... 
7,이거 공포가 아니라 로맨스인데요 실망 
10,93년에 친구추천으로 봣는데 그당시 충격이엇는데 
10,상상 초월 전무후무 영화란 이런 것이다 
8,참 재밌게 봤었던 영화.. 
8,종이봉투 틈새 눈부터ㅡㅡ;;..하숙자가 배출한 영화~ 
10,"말이 필요없다, 최고다 최고 "
8,어른을 위한 동화. 
9,제대로 만든 컬트영화. 장피에르 주네 너무 좋다 
8,내가 재미있어 하는 영화들과 너무 다른 영화 
10,가끔식 프랑스영화들이 헐리우드의 식상함에서 나를 건져준다 
10,말이 필요 없다. 
6,시각예술의 결정을 보여주는 주네 
10,역시 주네감독.. 
10,주네 감독 최고의 역작. 놓쳐서는 안될 컬트영화의 원조입니다. 
10,임팩트 큰 영화..! 걸작!! 
10,"어둡고 칙칙한 건물이 영화 배경의 전체, 독특한 분위기와 유머 "
10,풍자적인 메세지와 영화의 재미가 제대로 결합되었다 
10,귀여우면서 귀엽지만은 않은 영화 
7,재미는 있지만 다보고 기대보다 감동이 안들더군 
9,어릴때본 톱연주가 잊혀지지 않는다.. 
10,프랑스 전통적인 분의기 
9,지금도 이해하기어렵다.. 
8,재미도 있고 생각할것도 던져주고 화면도 특이한 독특한영화 
8,"아기자기한 상상력, 빠져들고 싶은 화면, 주네의 마술. "
10,정말 잘 만든 영화 
8,인육을 중심으로 펼쳐지는 주네의 기괴한 즉홍곡 
9,이런 영화 맘에 들어 
10,최고! 몽환적인 영화. 
10,톱연주를 한번 배워 보고픈.. 
10,이 영화를 보고 주네감독에게 폭 빠졌습니다! 
7,기대가 크면 실망도 크다. 전체적으로 너무 밝기가 어둡다 
8,아름다운 화면과 기막힌 편집. 
9,"잔혹하지 않다고는 말할 수 없지만 그래도 기분좋은, "
9,재기발랄~ 
8,첨 봤을 때 정말 신선한 충격..프랑스식 유머에 익숙해지자고! 
10,장 피에르 주네의 모든 것. 
10,독특함의 극치.. 이런 발상은 그 당시 보지도 못했다. 
10,14년전 영화지만 지금봐도 빛나는 주네의 천재적 감각 
10,아주 독특한...벌써15년전이네..헐..코아아트홀.. 아직도 있나? 
9,장삐에르주네 그자체! 
10,TV로도 몇번했죠. 재미있습니다. 독특한 환타지~ 
7,소문을 너무 듣고 봐 버렸따... 
10,같은 감독 잃어버린~~..도 멋있지..암.. 
9,독특하다! 
10,상상력의 완벽한표현. 쥬네만이 할수있는.. 
10,또 다른 영화의 세계를 열다 
10,최고! 
9,무기인 톱으로도 아름다운 악기를 만들수 있다. 하하~ 
10,상상력의 황제다! 
9,"신선한 감각을 주었던영화,,높은점수를 주고싶다,,, "
9,컬트 쪽에 끌린다는 걸 일깨워준 영화 
10,뛰어난 작품과 탁월한 연기가 돋보이는 보기 드문 영화 
10,내가 찾던 영화 
10,난 지루한 영화 못보는데 이건 Good ~ 
10,내생에 최고의 영화..역시 쥬네 & 카로 콤비가 짱이여 
10,재미와 영상미와 해학이 돋보이는 멋진 작품 ^^ 
10,별점 만점 안준애들뭐야.내가 처음 본 엽기 영화라고나할까? 
5,어렸을적에 보고 커서도 보았는데 너무 재밌네요~ 
3,솔직히 무슨말인지 하나도 모르겠어요..ㅠ.ㅠ좋은영화라는데..다시볼까? 
10,이 영화의 재미있음은 어떻게 말로 표현할 수가 없어요~~ 
9,재밌어요 
10,"굉장히 재미있는 영화 , 강추 "
10,예전 그당시에 굉장히 독특하며 엽기적인 내용이라 신선한 충격을 받았던 영화다. 그당시에 이런 영화는 없었다. 참 재밌게본 영화. 
8,모든 소동의 먼지가 가라앉고 난 뒤 옥상에 올라가 각자의 음으로 대화를 나누는 그들의 모습. 뒤틀린 그로테스크의 끝에서 우리는 자그마한 희망과 아름다움을 만나게 된다. 
10,내가10점준영화는여태없다이영화감독작품중 젤좋아하고 독특하고스산한묘한영화와사회풍자모두가10점만점이다 칭찬안하는나로선 이영화에극찬하고싶다 
9,충분히 재미도 있다. 마지막 장면이 되어서야 비로소 하늘색 하늘이 뜬다 
9,세련된 블랙코미디. 세상에 나온지 20년이 넘은 작품이라는 게 믿기지 않는다. 역시 장 피에르 주네! 
10,90년초반에 이런 생각을 ㄷ ㄷ ㄷ 
10,91년작이라니 믿어지지가 않네요. 딱 제 취향이었어요! 
6,이 영화를 지금 보기엔 시간 아깝다. 
8,천재 사이코 장 피에르 주네 
1,병맛나는 영화 
1,죄송합니다 전 비공감 -_-); 아오 내 시간 ㅠㅠ 
1,독특하고 기발하지만 재미는 없다 
1,심오한척은 혼자만의 일기장에서나 할것이지.. 이런 씨나락까먹는 얘기는 왜 영화로 만들어서 여러사람의 시간을 낭비하게 만드나.. 만든사람이나 추천한사람이나 쥐겨버릴수두 없구 진짜... 
8,영화 마지막쯤에 화장실에 물을 채워넣고 탈출하는 장면.. 어릴때 토요명화에서 봤던 기억에 문득문득 떠오르던 장면이었는데 무슨영화인지 몰랐었다가 20년이 넘어서 이제야 알았다. 역시 명작은 명작이구나 싶다. 지금봐도 ...
7,Delicatessen 
10,캐릭터가 많은데 다들 기억나고 놓쳐지지 않았다. 
10,"공포, 코미디, 로맨스가 섞인 프랑스식 영화.. "
10,간만에 예술적인 영화를 본 것 같다. 
10,끝까지 눈을 떼지못했네요. 인간성이란 무엇인가 생각하게 되네요.. 
9,아이러니한 상황의 연속에서 오는 블랙유머들. 델리카트슨이란 극단적인 세계속에 살아가는 뒤틀린 인간들. 사랑스럽다. 표면세계와 지하세계의 갈등을 배경. 그 상황에서도 사랑과 유쾌함을 간직하려는 인물들의 고군분투가 매우...
10,이게 영화의 묘미지~!! 
10,"상상력, 영상미, 음악, 색채감, 독창성... 주네의 천재성이 돋보이는 영화 중 하나 "
10,프랑스교수님이 추천해주셔서 봤는데 정말 재밌게봤습니다. 색채?라고해야하나..이쁨 
9,내가 영화를 좋아하는 이유! 
10,천재 감독의 명작이다. 바보들이 제발 이영화를 함부로 말하지 말길. 
9,아주 감명깊게 재밌게 봤지만 넘 깊게 해석하려 하지 마시길 
9,프랑스 영화의 날카로운 무기라 하고 싶은 영화 
7,avant-garde 
9,위트가 넘치네요^^ 내용은 기괴함에도 계속 웃으며 봤네요. 음악도 좋아요 
9,장 피에르 쥬네! 그의 영상미와 상상력은 가히 천재적이다! 
10,델리카트슨이야 말로 진정한 컬트가 녹아있는 유니크한 작품이지 
10,감동 
10,명작! 
10,진정한 컬트란 장 삐에르 주네의 타고난 능력을 카메라로 담는 것 
9,암울한 현실속에.. 결코 암울하지 않은 미장센.. 
8,온갖 희안하고 더티한 상상력. 그걸 그대로 다 표현해내다니 
9,현실과 다르지 않음 시간이 갈수록 삶의 방향을 잃어가는 사람들 속 두연인 
1,참신한데 재미가 없다... 
1,유럽 사람들은 영화를 이야기로 보지 않는 듯 
8,억압된 조건에서도 삶과 행복을 찾아 나서는 인간의 귀화본능.. 
5,귀엽고 기발하고 의미있지만 재미없다. 
10,영상미가 개쩐다 영상 하나 하나가 마치 유명한 사진 작가의 사진같다. 뿅! 
6,분위기도 이상하고 스토리도 이상하고 전체적으로 요상한 느낌을 준다. 연출도 뭔가 괴상한데 이상한 스토리를 부각하기 위해서 그러한 연출을 쓴것이라면 대단히 성공적이었다고 생각한다. 근데 글쎄  큰 재미나 여운은 없었다...
10,기괴함 속의 惡의 終末과 善의 希望. 기괴하게 갈구하는 삶의 모든 것... 
1,이비에쓰영화로 봤다 재밋따 재미짱 
3,"47분 보다가 껐다. 식인 소재라 재밌을줄 알았는데 진도가 너무 느리고 지루하다. 안경낀 순진하게 생긴 여자는 발정났고, 붉은 옷의 여자는 섹시하다. 근데 프랑스 영화라서 그런지 도무지 재미가 없다. "
10,독특한소재를 재기발랄하고 유쾌하게 풀어낸 영화! 분위기도 좋았고 배우들의 캐릭터도 개성넘치고 좋았다. 
1,난해하고 이해하기 힘들다 
1,장 피에르 주네 감독의 첫 장편영화. 처녀작답게 실험정신이 돋보인다. 하지만 재미는 딱히 없었다. 정신연령 10대미만들에게는 재밌을지도. 관람등급이 왜 청불인지 이해가 안갈정도로 유아틱한 영화. 
1,점수 준 놈들 허세쩔어. 토나와.... 
