score,review
10,그랑블루를 '내 인생의 영화' 중 하나로 꼽는 사람이라면 틀림없이 근사한 인간. 극장에서 볼 기회가 생길 줄은 몰랐네요. 이런 멋진 영화를 극장에서 함께 공감할 만한 감수성을 가진 사람이 없다는 게 쓸...
10,퐁네프의 연들과 함께 누벨 이마쥬의 최고 걸작이자 뤽 베송감독의 제대로된 마지막 영화다.강렬하고 감각적인 색체의 영상은 마치 인상파 화가들의 작품을 보는듯하며 제목 그대로 스크린을 뒤엎는 거대한 푸른색은 신비함마저 ...
10,자크는 떠나지않았다 돌아간것일뿐 
10,전설이 된 두 남자의 우정 그리고 바다 
10,삶을 아는 자라면 10점. 헐리웃 액션만 봐오던 어린애들은 지루해할지도. 
7,영상미는 정말 좋았다. 근데 영화 3분의 2부터 자크의 캐릭터가 급속도로 변하는 느낌이 너무 강하다. 조안나 급 임신에 자크는 갑자기 미친 사람처럼 변하고 너무 극적이라서 좀 거북했다. 그리고 예술 이해못한다고 까대...
2,물고기가 왜 사람으로 태어나가지구서는! 
10,"보통 10점 안주지만 이미 평점이 9를 넘어서, 더 올려주고 싶은 마음에.. 개인적으로는 레옹보다 훨씬 더. 굿. 영상미 내용 다 대박대박 "
2,몽환적인 분위기와 영상미 빼고는 별로. 3시간 러닝타임에 스토리 전개도 지루하고 바다에 대한 동경보다는 이상한 잠수 대회 얘기나 하고 무엇보다 조안나에 대한 무책임한 태도에 보는 내내 화가났음. 
10,일년에 한번씩은 보는거 같아요~ 다시 개봉하네요 ^^ 순수한 꿈에 대한 열정과 너무 아름다운 바다 최고예요 ㅋ 
10,돌고래에 대한 로망은 바로 이영화에서 시작되었다! 
10,끝부분에 천장부터 물이 차오르는 장면은 진짜 압권이죠 
10,참 여운이 많이 남았던 영화임 
10,내 인생 최고의 영화 세 편 중 하나... 
10,CG의 한계를  보여준 아날로그 감성의  위력이다. 사람이 꿈꿀수 있게 만드는 20년이 지나도 센세이션한 작품.. 
10,시대를 뛰어넘는감동의 수작!! 
10,다시보니 자크는 정말 나쁜남자... ㅠㅠ 
10,당신은 진정한 친구나 사랑하는 사람이 원하는건 다시는 못본다해두 저말 그를위해서 그냥 보내줄수있는가.... 
4,객기부리다 용궁간 두 남자와 졸지에 과부된 한 여인이야기 퍽이나 감동스럽소~ 
10,보는 내내 꿈을 꾸는 것 같았다. 여운이 너무 길게 남아서 엔딩 크레딧도 다 보고 나왔다. 최고의 영화다 진짜 
5,"사랑과 책임을 무색하게 할정도의 아픔을 몽환적으로 그려내는데 시원한 바다의 이미지와 대조돼 씁쓸하다. 희망, 모험, 낙원의 바다를 기대한다면 비추. 뉴에이지풍. "
10,인간의 이원적 사고로는 이해할 수 없는 명작이다.우리는 존재 그 자체다. 
9,나쁜남자의 선택 사람보다 바다가 더 좋았더냐!그래 그 줄 내가 당겨주마 
10,깊고 푸른 바다 
10,"보지 않고 이 영화를 논하는 것 자체가 말도 안된다. 10점 만점도 부족한 탄탄한 스토리, 완벽한 표현력을 가진 영화. "
10,더이상 말이 필요가 없는 명작인 영화 남자들끼리 우정 그리고 바다가 저렇게 아름다운 느끼게 해주는 그야말로 명작중에 명작인 영화 뤽베송영화중에 최고의 영화중에 한편이라고 말할수가 있는 최고의 영화 
9,감독은 우리에게 두가지 질문을 하는것같네요 .당신은 바다에서 올라올 이유가 있나요?당신에게 바다는 무엇 인지요? 
10,극장에서 재개봉한거 봤는데.. 진짜 아름다운 영화였음.... 돌고래와 파란 바다가 잊혀지지 않는다ㅠㅠ 
10,바다의 아들들 .....그후로 25년.......7월 재개봉을 손꼽아 기다린다.... 
9,참 오래 전 봤던 영화라 기억나는게 거의 없는 채로 극장을 찾았는데 영화가 시작되고 익숙한 에릭 세라의 음악이 흐르자 가슴이 마구 뛰더군요..이런 멋진 작품을 극장에서 다시 볼 수 있어서 행복했습니다 
8,"영상은 아름답지만, 이해하기 힘든 주인공.. "
10,"아, 이 영화를 다시 극장에서 볼 수 있다니... "
10,마지막 순간 가슴에서 부터 느껴지는 먹먹함에 한 동안 자리에서 일어나질 못했습니다. 영화 추천을 통해 제가 느꼈던 여운을 다른 분들과 함께 공유하고 싶습니다. 
10,분명 내가 좋아하는 장르는 아닌데....이 영화가 왜 최고인지 확실히 설명할수도 없을거 같은데.....그런데도 이 영화를 보면 마음속 한켠이 아련해지고 감동을 받게 되는 영화. 이게 바로 감독의 연출력인가 
10,아버지가 간암 말기로 임종 얼마 안남았을때 둘이서본 영화 입니다. 일년전이네요. 벌써 정말 많은 생각을 하게 해주며 제가 죽을때까지 잊지 못하는 영화입니다. 떠난것인가 돌아간것인가 시기만 다를뿐 
10,영화를 봤는데 시간가는줄모르고 봤네요ㅎ 
1,정서에안맞는듯 
8,88년도 영화라는걸 영화를 다본후 검색을 통해 정확히 알게되었다 정말 영화를 보는내내 내가 바다속에서 함께 있는것 같은 착각을 하게 만든 영화 마지막 장면에서 난 왜그리 가슴이 먹먹했는지 아직도 마지막 장면에 아른거...
7,명작인척하는 영화~~ 
10,작크는 그저 자신으로 돌아간 것일 뿐. 엔조와 함께. 그를 비난할 이유는 없다 인간은 항상 자기 존재를 찾기 위해 방황하니까 
10,다른세계에 잠시동안 머무르게 해주는듯한 매우 특별한 영화 
10,"방금 보고 왔는데.. 와.. 감동 그 자체. 25년전에 이런 영화를 만들었다는 사실만으로도 대단한 뤽 베송 감독입니다. 연기 또한 좋고, 뭣보다 돌고래랑 바다 풍경이... 예술ㅠㅠㅠ "
1,이게 왜 이렇게 평점이 높은지 모르겠다 남자가 철없고 책임감없고 매력도 없다 그럴거면 여잘 만나지 말아야지 짜증만 나다 끝나는 영화 
1,돌고래 성애를 가진 싸이코 패스의 영화 
10,1988년...이런 비쥬얼의 영화가 나올 수 있다니...바다속 장면과 주인공들의 모습은 지금도 아름답네..로잔나 아퀘트도 이렇게 예쁜 시절이 있었구나... 
9,요즘엔 CG없이는 극장을 찾게만드는 영화가 없는거 같다. 옛날에 영화 시나리오 만으로도 감동을 주는 영화가 많았는데... 
8,아름다운 바다속 깊이 만큼 생각케 만드는 영화 
10,오~ 완전 기대....IMAX 로 본다면 참 좋을텐데... 
10,사춘기의 추억속 푸른 심연의 메아리 
8,솔까 지루하긴하나 명작이다. 인생의 많은 것을 담은 영화. 일단 뤽베송+장르노 그리고 웅장한 ost의 조화 
2,내기준 자크 쓰레기.. 
9,한 인간으로 혹 주어진 환경에서 태어나 그들이 택한 삶과 꿈에 미쳐간다는게 어떤것인지를 몽환적이고 아름답게 표현한 영화.. 우정영화라고들 하지만 인간내면에 있는 무서움을 표현한것같아 씁쓸하다... 그들은 각자 자신들...
9,개인적으로 결말은 마음에 안들었지만 영화를 보는 내내 다른 세계 속에 있는 거 같은 기분이 좋았다. 우정과 바다에 관한 영화라기 보다는 자기몰입과 사랑에 관한 영화가 아닌가 싶다. 
10,명작 
7,조안나를 두고 가는 자크! 자크를 이해할 것 같으면서도 이해할 수 없다. 
10,내 생애 최고의 20년전 감동이 혹시 사라지지 않을까...염려 했었지만....더 푸른 바다와  더 큰 감동이 다시금 나를  그 때와 똑같이 펑펑 울게 만들었다.정말 다시 볼 수 있게 되어서....행복했다. 
2,"너희들이 아무리 거품 물고 포장해도 이 영화는 그저, 타인의 감정을 이해 못하고 가족을 돌고래만도 못하게 여기는 싸이코패스 새끼랑 엮여서 인생 망친 한 여자의 이야기를 예쁘게 포장했을 뿐이다. "
10,그랑블루를 아직 보지 않은 사람이 있는가? 11점이 없어 10점을 준다. 다만 자신이 멍청이라고 생각하는 자는 보지말 것. 이해를 못하니까. 
10,아버지와 친구를 잃어버린 바다에서 그는 한없이 순수한 사람이었다. 
10,몇번을 봐도 깊은 여운이 나를 흔들어 놓는 영화. 그랑블루를 보는 날이면 하루종일 바다 속으로 잠수해 있는 상상에 빠진다. 돌고래와 작크와 엔조가 영원히 바다 속에서 살기 바라는 것처럼.. 
10,바다 속에 있는 듯한 먹먹한 여운..상영관이 코발트빛으로 가득할 때는 정말ㅠㅠ저보다 나이도 많은 영화인데 이제라도 만나게되어 기쁘네요 손에 꼽는 영화가 될듯 
10,정말 오래전에 본 영화인데.... 반갑네요.... 시간이 안 맞아서 보기는 힘들겠지만... 이런 영화는 진자 극장에서 봐야  제 맛인데.... 
10,최고!!!!! 
10,그냥 최고 
10,대박! 극장에서 볼 수 있다니 행복하다!!! 
10, 최고ㅠㅠ 
10,시적이고 동화같은 이런 감수성이라니... 
10,아.. 진짜 말로 표현할 수 없는 영화.... 진짜 내가 이런영화 땜시 산보다 바다를 더 사랑할 수 밖에 없당께.! 
8,"별점은 8.5를 주고 싶었어요. 모든 장르를 섭렵하는 인상적인 3시간이었습니다.제가 어린시절 그랑블루 포스터를 가진 사람들이 많았는데, 과연 그들이 이 영화를 다 보았을까 하는 생각도 들었습니다. 장르노도 장마크바도..."
10,이 영화를 보고 깊이 공감할 수 있는 사람은 많지 않을 것이다. 그래서 놀라운 영화다. 
1,"이 영화가 말하고자하는 의미에 분노가느껴진다. 감동의 눈물이아닌 분노의 눈물이 흐른다. 감독, 이것을 원했나? "
10,"장엄한 바다, 압도하는 블루. "
7,긴 러닝타임에도 불구하고 지루하지는 않았다. 하지만 왜 명작인지는 느끼지 못했다. 
10,내가 미쳤나....지루하단애들이 어린가...참 마지막 장 르노 가고 바다로 떠난 주인공에 가슴아려 4번을 봤는데...영상미...잡스럽지않은 스토리....로잔나 아퀘드....사나이영화...참 좋았는데... 
1,돌고래에 대한 애착이 변태처럼 느껴진다. 잔잔한 감동을 의도했으나 짜증만 유발했다. 졸릴때 배경에 깔아놓고 낮잠자기에는 좋겠다. 
10,뤽 베송 최고의 영화★★ 
5,포스터가 너무나 낭만적이라서 아주 오래 전부터 꼭 한번 보고싶었던 영화. 
10,방금 보고왔습니다. 리마스터링으로.. 이상주의자 자크. 어쩜좋을까...아직도 가슴이 먹먹하네요.. 
9,"이 얼마나 아름다운, 이 얼마나 잔혹한...비단 인간을 매혹하는 것이 바다뿐이랴만은. "
10,"지중해 푸른바다에서 펼쳐지는 우정과 사랑의 향연.내 생애최고의  영화.심해의 눈빛을 그대로 빼닮은 쟝 마크 바,심금을 울리는 따뜻한 목소리의 쟝 르노의 매력에  무한정 빠져들게 됨.화룡점정의 OST.뤽베송이 만든 최..."
10,멋진 영화~! 뤽베송 감독과 장 르노를 만나게 해 준 영화.. 다시 개봉한다니... 리마스터링이라... 음.. 반갑다~!! ^^ 
10,아름답고 먹먹해지는. 수작.. 
10,너무 슬퍼서 볼 수가 없다. 
10,외로웠던 그. 어쩌면 현실속 존재하는 우리가 자크일지도. . .큰 깨달음이 깃든 영화. 
9,바다와 같은 양면성을 지닌 세 사람. 아름답지만 무책임한 남자와 알면서도 사랑에 빠진 여자. 나도 저들처럼 내 선택을 감당할수있을까.. 
9,영상미가 아름답지만 조금 지루한 감이 있어요ㅠㅠ 남주인공이 답답하기도 하고 ㅠㅠ 
1,"너무나도 긴 러닝타임, 공감가지않는 캐릭터, 불쌍한 조안나 "
6,바다밖에 모르는 멍청한 작크놈 
10,레옹에 이어 인생영화를 찾았다 
8,그저 파란 바다. 정말 파란 바다. 형형색색의 화려함과는 다른 짙게 화려한 바다. 그런 바다를 사랑해서 최고의 전성기에 바다로 돌아간 사람들. 어두운 결말이지만 어쩌면 오히려 더 밝은 결말일 수도 있다. 돌아와야 할...
10,정말 최고의 영화 맞네요^^제가 이 영화를 지금에서야 봤다는게...참...그래도 이번엔 보았습니다. 
10,너무나 아름답고 신비로운 영화... 
9,바다를 소재로 화려한 CG로 가득한 블록 버스터가 아닌. 바다 그대로의 아름다움과 그 바다를 사랑한 젊은이들의 이야기. 
10,충격적인 결말.. 최고의 영화.. 
10,정말 잘만든영화 
10, 장 마끄바 너무 아름답다 
10,고딩때 보았는데 그여운은 아직 간직하고있다 내생애 최고의 영화 아름답다.. 
10,"3시간 짜리 감독판을 본후, 세사람이 너무나 그립다. "
10,영혼을 울리는 아름답고 슬픈영화.. 진한 감동에잠못드는 주말밤이었습니다. 
10,자고로 영화란 이렇게 만들어야지.. 10점만점에 10점 
5,"영화가 말하려 했던게 뭔지 도저히 모르겠다.. 엔조의 생각도 자크의 생각도, 도저히 헤아릴수가 없다. 엔조의 캐릭터와 자크의 눈빛은 좋다 맘에든다. "
1,이렇게 병맛같을수가! 
7,주인공들의 성격이 너무 극단적이어서 불편하고 유치하고 결국 지루한 면이 있었음. 다 보고나서 곱씹어 보니 죽음에 매달리는 사람과 삶의 이유를 찾고자 노력하는 사람의 괴리가 느껴지는 듯했음. 소문난 영화라 기대하고 봤...
6,168분의 압박.. ㄷㄷㄷ 
1,평점 거품이다. 그저 옛날 명작일 뿐. 
6,멍청한 천재의 현실 도피 
7,책임지지 못할꺼면 시작하지를 말던가... 
8,자크만의 세계에 빠져든다 
10,인생영화 .. 극장에서볼수있어서 너무좋았음 
10,보는 내내 즐거웠다. 처음엔 흑백으로 나와 ''아~ 저 아름다운 장면들을 흑백으로 봐야하나..?'했었지만 결국엔 살아있는 색감 그대로의 자연과 배우를 느낄 수 있었다. 마지막 즈음에 남자주인공의...
10,걸작 걸작 걸작 걸작 걸작 걸작 걸작 걸작 걸작 걸작 걸작 
9,느낌이 묘하다 꿈을 꾼듯 하다 
10,바다의아름다움에 황홀한느낌마저든다. 돌고래가 이렇게사랑스런 동물이었던가..마지막장면이 뇌리에서 떠나지가않는다... 
10,여운이 장난이 아니다.. 
10,요샌 이런 영화가 많이 없고 CG로 가득한 SF만 너무 많다..이 명작의 감성을 느낄 수 있다는 것에 감사한다. 
10,"말로 형언하기 힘든 삶과 사랑,인연이란 것의 깊은 수수께끼를 담고 있다.최근에,아니 10년동안 본 영화 중 최고로 뽑고 싶다. 참으로 진실한 영화다!! "
8,생각 할 수록 좋은영화 . 바다와 돌고래를 보는 것 만으로도 
10,도달할 수 없는 그 곳에 마침내. 
10,에릭세라의 음악도 너무 좋습니다 
10,"뤽 베송의 영화가 속속 재개봉 되는 것이 정말 감사할뿐이다 엔조 엔조 엔조, 그리고 자크 마지막 대사야 말로 조안나가 진정 자크를 사랑한다는 것이 묻어나온다 go my love go and see "
10,경외심... 
10,영상과 그보다 더 압도하는 사운드 쟈끄마욜의 눈빛까지.최고다. 마약같은 영화. 
10,좋다. 
10,어릴때 비디오로 밧던건데 재개봉햇나보네요 .. 아직도기억에남아잇는건 물속에서 포조주 마시기?!? 제인생의 명작중의 하나입니다 
10,"내 인생의 영화.  다운받아보고, 너무 좋아서 다시 볼 엄두가 않나던 영화, 스크린으로 다시 볼 수 있어 행복했습니다. 레옹보다 이 영화를 더 좋아해요. OST가 예술이라고 처음 느낀 영화입니다. "
10,많은 것을 말하는 영화 
10,20년전 미국판에 판타지가 있었다면 추가된 50여분을 통해 더 많은 서사가 부여되었다. 약간 지루했던 것은 더 많은 우리 삶의 단면들을 봤기 때문이겠지. 하지만 그랑블루의 마술은 여전하다.블루가 더 많은 삶 속으로 ...
10,뤽 베송하면 레옹이 떠오르는게 보통이지만 그랑블루도 상당한 역작임에 틀림없다. 아름다운 영화 
10,오호라 다시 나오다니 분명 역작임에는 틀림없는 영화다. 뤽 베송을 경배하라!!! 
10,포스터가 예술이었지 흐르는 강물처럼이랑 그랑블루는 참 멋있었는데 
10,이 영화 최고였지. 
10,여운이 오래남는 멋진영화. 
10,몇 번을 봐도 10점을 주고 싶을 듯.. 
10,음 모든 면에서 그랑! 아름답고 슬픈 걸작 
10,궁극적인 무언가. 
10,"꿈과 현실, 결국은 꿈으로 "
10,영상과 음악의 조화. 인간의 삶. 아름답고 멋진 영화 
10,명작이다 ... 여운쩐다 
10,감독은 영화를 찍지 않았다. 다만 그렸을뿐... 
10,내 생애 최고의 영화 중 하나.. 
10,"특히, 남자에 남자의 남자를 위한 영화. "
2,소문난 잔치에 먹을 것 없다더니 
1,"..뜬금없이 엔조 죽이고, 주인공은 왜 돌고래 성애자로 만들지 결말 개같아서 1점 "
1,책임도 안지고 돌고래한테 갈꺼면 피임을하지 너무캐릭터가 매력이없네.. 
3,"받아들일수 없는 스토리의 개연성,  감성과 여운의 아름다움이라고 평가하기에는 너무 추상적이고현재의 기준으로는 이해되지 않는것이 많다. "
6,감동적이라는사람들은 남주입장만생각하는 이기적인것들이지 ㅋㅋ 아니 자신만의세계가있고 자신만의 꿈이있으면 그 삶에만 충실하던가 왜 현실속의 여자한테 진심에도없는사랑가지고 장난쳐서 가지고놈? 임신했다는데도 쌩까는거 소름이...
2,돌고래가 좋으면 돌고래랑 결혼하지 왜 한여자의 멀쩡한 인생을 망쳐가지구 ㅠㅠ에휴 
8,"잘 만든 영화지만 좋은 영화인지는 모르겠다. 영상도 좋았고 감정선도 좋았고 눈이 즐거웠고 왜 조안나가 자크를 놓아주었는지, 왜 바다로 들어가야만 했는지 알겠다. 그러나 공감되지는 않는다. 이상을 좇는 자크는 아름다웠..."
10,그냥 한편에 영화가 아닌 쉽게 찾아 볼수없는 영화 ~~몇번을 봐도 또보고 싶다~~ 
10,내 생에 최고의 영화중 하나. 그 음악이 계속 생각난다. 
10,내가 평생토록 사랑하고 싶은 영화. 
10,자크 다시 날 바다로 내려줘.... 
10,잠겨 죽어도 좋으니 너는 물처럼 내게 밀려오라.... 
8,돌고래는 원래 육지에 살던 포유류이다. 그러나 바다에 들어간 이후로 나오지 못하고 계속 바다에서 살게 되었다고 한다. 
8,공감하고 가슴저미게 빠져들었다ㅡ근데 상식과 도덕관 무엇? 인간은 타인을 위해 살 수없긴하지만. 비이상적인 자기몰입을 순수라는 이름하에 옹호하고싶진않다. 어머니처럼 미국여자를 사랑하는듯하더니 이내 돌아온 그녀와 아이....
10,현실에서는 무책임한 남자 영화에선 자신의 길을 찾아가는 자유로운 영혼 이해간다 이해할 수 있다 영화 속이니깐 평점 10 
10,정말 아름다운 영화.. 
9,조안나가 너무 안됐다.. 너무 불쌍하다. 하지만 마지막에 잠수기구 줄을 조안나가 당겨줌으로서 주인공을 이해하고 그의 꿈을 응원해주었으므로 조안나 역시 그를 진정으로 사랑했다고 느꼈다. 
7,바다를 사랑하여 바다가 된 남자. 그런 남자를 사랑한 여자. 
10,"사람으로 태어난 인어와 그 인어를 사랑한 여인. 그가 속한 세계로 보낼 수 밖에 없던 마지막 장면.. 진부하지만 사랑, 꿈, 우정에 대한 최고의 영화 "
9,왜이제봤나싶음 소름돋아요bb 
10,아름다운 영화 내 생애 최고의 영화 
9,처음으로 그랑블루를 제대로 끝까지 봤습니다. 오랜 러닝타임만큼이나 오랜 여운이 남는 영화네요. 좋습니다. 
10,역시 여름엔 그랑블루. 
10,끝없는 바다그곳에 두 잠수부의 우정 사랑그리고 에릭 세라의 아름다운 음악왜 뤽 베송은 이런 영화를 다시 만들지 못하는것일까 
10,바다의 푸른 색감과 그 먹먹함이 잊혀지질 않네요 생각해볼 거리가 많은 영화 
10,대양과 돌고래로 상징되는 이상과 조안나로 대변된 현실사이의 쟈크를 통해 진리를 열렬히 추구하는 인간상을 엿볼 수 있었다. 자신의 삶을 잊고 검푸른 심해로 침잠하는 쟈크를 보고 경외를 느꼈다. 나에게도 삶을 잊게 할 ...
7,단조로운 이야기를 흥미롭게 끌고가는 연출이 뛰어나군 
10,영화를 보는 동안 꿈을 꾸었다. 돌고래와 인어가 함께 노는. 영화가 끝나고 꿈에서 깨었다. 
10,드라마 집 방 안 배경에 자주나오던 돌고래포스터영화... 우연히 ebs명작극장서 보고알았습니다... 이영화 포스터인지 
10,돌고래와 자크의 연기가 굿이군요 엔딩의 그 진한 먹먹함이 좋았습니다 
9,눈부시게 아름다운 푸른 바다를 그저 묵묵히 앉아 바라보고 있는것 같다.친구간의 따뜻한 유머 그 모든것이 포근하다.하지만 어두운 해저깊이 혼자서만 들어가 견뎌내야할 고요함..그 고독함.. 
10,감동~~~~~ 
10,인어를 동경한 두 남자의 우정과 돌고래와 교감이 경이롭다. 바다를 사랑한 두 마린보이의 우정과 사랑을 그린 교향시. 여유로운 지중해식 유머와 해양 다큐멘터리 같은 자연미의 하모니가 훌륭하다. 침대 위 주인공의 바닷속...
9,Between what you know and what you wish lies a secret of le grand bleu. 
10,사람마다 틀리겠지만. 내 뇌리에는  장르노 뤽베송 콤비 최고의 영화라 꼽고 싶다. 레옹도 있지만... 난 그랑블루가 더 좋다. 부산에서 영화 상영한지 몰랐네 ㅜㅜ 다시한번 해주면 안되려나... 바빠서 몰랐다 ㅜㅜ 
8,바다의 아름다운 모습과 여운 남는 두 사람의 우정 
10,김동 그자체.... 더 말이 필요없다. 
9,뤽베송 ㅡ장르노  ㅡ 레옹에 이은 또하나의 명작을만듬 ㅡ 물론  이영화 이후  뤽베송도  장르노도  ㅡ 하락기에  접어들지만 레옹과 그랑부르는 느와르 휴머니즘 장르에서 빼놓을수없죠 
8,이런 남자와 결혼할거야? 
7,푸르디 푸르다. 이야기 자체는 특별할 것 없었지만 아날로그적 바닷 속 모습이 평온을 준다.. 영상미가 대박이다 
9,이걸 드디어 극장에서 보게 되는군요 
10,제발 우리동네 개봉 좀 ㅜㅜ꼭 해주길 
10,와 이거 개봉하는구나 
10,포스터가 에술이죠~ 
10,굳 
10,마지막 장면이 인상적인 영화 
10,조앗! 
10,낭만적이다. 
10,자꾸만 슬퍼지네 
10,개인적으로 사랑하는 영화입니다. 아름답고 순수하고 슬픈. 순수에 한번 생각하게 합니다. 
10,20대초에 봤던 기억에 남는 영화.. 
10,최고의 영화! 
10,정말 너무너무 아름다운 영호 
10,최고... 
10,ㅋㅋ긴 여운을주네요 
10,아름답고영화본후에도바다라는환상에빠져들게했어요ㅎ하지만좀슬프고이해가안될때도; 
10,인간과 자연은 하나라는 진리를 깨우쳐주는.. 
10,"몇 번을 봐도 감동주는 영화, 명작입니다. 최고! "
10,세번봤는데 하아 진짜잘만들었음 
10,명작이네요. 여운이 오래 남을것 같아요 
10,항상 생각나는 영화 
10,세계최고가 무었인가를 보여준 영화. 
10,아 엔조....ㅠㅠ 
10,수원 게랑 이새끼들은 왜 난입안했냐?내려가서 알사드 놈들 까버리 반도인답게 살자 
10,내어린시절에 많은 영향을 준 영화 
10,엔조.자크.조안나. 후회없는 영화. 
10,내 생애 최고의 영화 중 하나..^^ 
10,나에겐 극중 인물들의 심리묘사가 너무나 멋졌던 작품 
8,지루한 부분도 있었지만 분명 잘 만든 영화다. 
10,1년마다 다시 보게되는 명작! 
10,최고 
10,별 10개가 모자라는 내인생의 명작! 
10,예전에 어렸을때 맨마지막에서 돌고래랑 같이 심해로... 아직도 기억이 나네요 
10,아름답다 
10,다시 봐도 감동이 밀려오는 영화 오랜만에 정ㅁ라잘 봤습니다. 
10,다시 봐도 감동....ㅜㅜ 
10,후반부 부터 봤지만 아름다운 걸작이네요 이런영화를 좋아해서 
10,10점 ........ 
10,아름다와 
10,음.. 
10,원하는게 많을수록 고통도커진다... 
10,뤽 베송 최고의 영화 
10,10점 주려고 로긴했다. 다시봐도 아름다운 영화 
10,사랑한다 돌고래. 
10,멋진영화 
10, 깊은 감동으로 마음을 잔잔히 적셔준다.... 번잡스럽지 않고 기름기없는 담백한 영화. 
10,감정이입이 제대로 된 영화.... 
10,Good 
10,깊은바다처럼잔잔하고아름다운영화 
10,캐감동... 바다이야기... 
10,쵝오! 바다로 풍덩 빠지고 싶다... 
10,"깊이 깊이, 미끄러지듯 깊게 사랑에 빠지는 영화. "
10,내가 바다를 얼마나 사랑하는지 알게 한 영화 
10,영화인이라면 꼭봐야할 수작 감독의  상상력이 스며든 생각대로 그려진 영화 
10,말로는 표현할 수 없는 깊이.. 바다와 인생을 함께 한 사람들의 이야기... 
10,멋................. 지..................... 다................................ 
10,내가 젤 조아하는 영화^^ ㅋㅋ 
10,마음을 적시는 한편의 영화 
10,아름답고 찬란한 영화... 
