score,review
10,푸른빛이 물결치는 포스터같은 분위기의 웃기면서도 잔잔한영화 
10,지루하다~하지만 감동이 있다~보는내 지루했지만 감동이 밀려오는건 부정할수 없다~~ 
10,내면의 고요한 감동을 일으키는 영화 
10,영화 포토를 보는것 만으로도 행복하고 편안하다 
10,마지막 장면 하나만으로도 쩐다.. 
10,내인생 최고의영화중 한편 잊지못할마지막장면까지쵝오다 
10,자기를 진정 품어주는 바다와 하나가 되고 싶었던 남자 자크 정말 멋지다. 
10,Bleu blue 
10,바다와 우정 그리고 사랑... 열정... 
10,이탈리아를 사랑하게 만드는 최고의 영화...뤽베송의 걸작 
10,옛날 학교끝나고 토요일의 편안한 햇살처럼 느껴지는 영화. 
10,누벨이마주가 무엇이냐 
10,배우장르노가 정말 젊군요 ^^:: 
10,주인공이 돌고래를 미치도록 좋아함 ㅋㅋㅋ 
10,음악도 좋고......... 
10,감정을 끓어 올려 마음을 녹아버리게 하는 아름답고 따듯한 감성적인 영화♥ 
10,이때까지 베송은 최고였다. 
10,최고다...한심한 평론가들은 집에가라 
10,아름답다..장르노 정말 멋있어..영상도 멋지고..끝장면 기억에남는다.돌고래와 쟉크.. 
10,단순한 내용에서 바다와 인간의 조화를 바라보게 해주는 영화... 
10,"삶, 인간, 사랑, 바다. "
10,잠수대회.. 발밑 바다를 바라보며 앉아있던 장면이 생생히.. 
10,너무 좋다 이 바다같은느낌이 
10,"자끄, 세상의 끝에서 무엇을 보았나요? "
10,재밌어 
10,세련됨의 미학. 스타일리스트적인 영화. 뤽베송은 언제나 성실하다.!! 
10,"자크메욜로 나왔던 장마르바가 정말 멋있어요 ㅠ,ㅠ "
9,"함축적인 내용전달에 1점 감점, 뛰어난 영상미엔 10점 플러스... "
2,"내가 본 프랑스 영화중 최악중 하나. 와 진짜 시간버림. 개연성도 없고. 납득도 안되고, 씬 과 씬 툭 툭 끊어지고. 암만 30년전 영화라해도 납득불가 "
10,마음이 따스해지는 영화 
10,왜 좋은지 이유는 설명 못하겠다. 그런데 내 인생 최고의 영화다. 
9,"왜 죽는다고 생각이 들지 않는지...새로운, 본인이 원하는 세계로 들어가는 그의 모습은 아름답다 "
10,"원스어폰어타임인아메리카, 패왕별희, 피아니스트의전설 과 함께 일년에 적어도 세번이상은 보는 인생영화 "
10,이런 명작이 평점 9점도 못넘는다는 사실이 화가 날 정도입니다. 
9,코발트 블루에 빠질것 같다. 근데 현실적으로 임신했다는데 남자가 무책임하다. 여튼 바다에 흠뻑 빠졌다 나온것 같은 느낌을 줘서 좋았음 
10,사랑 열정 우정 인생 꿈 그 모든것. 그랑블루. 십여년전부터 매년 한번씩은 무조건 꼭 본다. 나에겐 대부 도 물론 최고이지만 딱 하나만 꼽으라 하면 이것이 내 인생 최고의 영화. 
10,"어제 리마스터링 버전 보고 왔습니다. 영화의 깊이감이 배경이 되는 바다와 맞닿는 느낌이고, 주인공 자크의 인생이 바다에서 시작하여 바다로 끝나는 모습이 인상깊었습니다. 마지막엔 숭고한 기분까지 들었습니다. 안봤으면 ..."
8,꼭 리마스터링판 감독판이 더 낫다고 볼 수는 없습니다. 결말은 저에겐 다소 충격적이고 긴여운이.... 80년대의 감성을 대표하는 명작임에는 틀림없을 듯 
10,안녕하십니까  엔조 성대 모사를 해보겠습니다 // 아 아~~ 자~앜흐~ 마이 푸랜두~ (내 친구 자크 왔는감?) 
8,정신이 온전한 남자의 아이를 가질 것. 
2,영상만 아름답다. 자크도 아버지의 죽음으로 불행한 유년시절을 보냈으면서 조안나의 임신 소식을 듣고도 현실과 환상 중에 환상이라는 무책임한 되풀이를 선택하다니 한심하다. 
1,난 개랑이 시러 
7,정신병자 미친놈 
6,중학교때 부터 봐야지 봐야지 했떤 영화... 좀더 어릴적에 볼껄.. 이미 나이가 들어서 그런지 임신한 아내까지 포기하는 자크 떄문에 보는 네네 화만 났다..현실을 알아서 그런가... 차라리 중학교떄 봤으면... 아름...
1,감동으로 위장한 사이코패스 영화! 
1,평점사기. 전혀 감동적인 요소도 없고 별로다. 바닷속으로 죽는게 감동이냐??? 
10,
7,"극후반으로 갈수록 실망스러움. 균형감있고 평온했던 관계를 끝까지 이어가지못한 실망감. 메욜의 죽음으로 극적효과를 만들었으나 그 이후 억지스러웠다. 자크의 이기적인 모습, 끝까지 그를 사랑하는 조안나의 모습..옛날영화..."
4,"현실 도피처럼 보이는 자크의 행동은, 자크를 지금까지 버티게 하는 힘이되지 않았을까 생각한다. 상실감과 외로움, 불안감, 아픔은 스스로도 어쩔수가 없어서 이기적일 정도의 광기로 표출도 되지만, 또 다른 내가 생겼으니..."
9,깊은저 바닷속 파인애플 
10,"노킹 온 헤븐스 도어, 메리와 맥스, 선리기연, 빅피쉬, 에이아이 등 을 가끔씩 몰아서 보며 울어서 그 기분과 느낌을 만끽하는데 그 반열에 넣으려구요.. 물론 전 해피엔딩 영화를 좋아합니다. "
8,"그랑블루???? 그냥 별로....너무 80년대 감성 아니냐...잠수 하면서 무슨 주저리주저리 말이 많냐...해삼, 전복이나 따오지... "
8,볼때마다 인생의 깨달음을 얻는  명작 
8,리마스터링 감독판을 보다가 하룻밤을 보내는 자크와 조안나를 본 엄마의 일갈로 나는 포르노를 즐기는 성범죄자가 되어버렸다. 뒷 이야기는 모르나 영상미와 ost는 일품이었다 또 볼 기회가 있겠지 그라치에 
9,"뤽 베송이 만든 인간에 대한, 어쩌면 자신에 대한 가장 순수한 고백. 내용이 필요없을만큼 아름다운 푸른 바다의 심연과 함께 Eric Serra의 신디사이징이 오감을 지나 가슴에 출렁인다. "
10,또 보고싶지만 후유증이 두려워 못봅니다.... 
10,
10,"처음봤을땐 자크가 그저 나쁘게만 보였지만 3, 4번 다시 보니 자크와 엔조는 처음부터 바다를 엄청 사랑하는 모습을 많이 보여주었다.바다에 열망하는 두 청년이 너무나도 멋있었던 작품.자크가 마지막에 본 돌고래는 엔조가..."
6,에고로 시작해서 자학으로 끝남. 
6,그와 그녀의 다른 시선. 그리고 슬픔 
10,여운이 깊이 오래남는 최고의 영화~ 
10,끈끈 우정이 돋보이면서 돌고래와 바다가 넘 아름다웠어요~ 
8,그랑블루만이 주는 영상미와 감성은 무지막지하게 아름답다 바다를 사랑하는 남자들은 참~ 낭만적이란 말이지 
10,영상미가 대단했음. 혼자 다시보고싶은 영화 
10,몇번을 봐도 바다만큼 깊고 짙은 여운이 남았던 영화 
10,
10,"결혼하고 아기가 생기기 전 까지는 쟈크가 바다로 돌아 갈 때 까지의 감정선을 그대로 따라 갔었는데,지금은 쟈크의 감정에 공감은 하지만 현실에서 가족과 함께하는 선택을 하며 행복하게 삽니다.ㅎ "
10,과연 작크는 아래에서 위로 올라와야 할 이유를 찾았을까? 
8,사랑을 하기에는 돌고래를 너무 좋아한 자 
10,좋다 계속 보고 싶을 정도로 
6,"자크에게 바다로 가는건 두렵지만 가야만하는 숙명과도 같은것, 자크에 바다는 또 다른 아버지가 아닐까.. 그런데 조안나는 너무 불쌍하다.. "
10,눈이 부시도록 아름다운 푸른 바다.내가 최초로 본 뤽 베쏭 영화는 니키타였고 가장 재미있게 본 영화는 레옹(감독판)가장 좋아하는 영화는 잔 다르크지만 이 영화는 뤽 베쏭이 감독한 영화중 가장 걸작이다.크리스토퍼 람베...
10,너무나 명상적인 단연 최고의 영화. 
10,인생영화 언제봐도 가슴이 뜨거워짐 
10,최고 영화라기보다는 그냥 가끔 영원히 보고싶은지금05시 채널 돌리다보니 힘들어도 아무 말 없는 친구야 보고싶다 
10,"스틸컷, 영화음악, 스토리 모든게 예술이다 "
6,랄랄랄라 랄랄라 모르겠다 모르겠어 그래도 곱씹게 된다 
10,충격적인 마지막 장면이 십수년이 지났지만 잊혀지지 않는 명작...당시 뇌리를 탕! 하고 치는 듯한 강한 충격을 받았음.. 
10,In the Heart of the Sea 랑 2top인 인생영화 
10,왜 제목이 그랑블루인지 마지막에 알았다. 
10,멋진풍경과 아름다운 바다가 어우러져 완벽한 하모니가 펼쳐졌다 
8,그랑블루...끊임없이 바다와 하나가 되고 싶었던 사람 
8,바다만 사랑하게된 남자를 사랑하게된 여자의 심정등이 후반부에 너무 어설프게 그려진것 같아서 옥에 티..라고 생각되나 스토리와 화면 색체등은 최고다 
8,엔조죽고 자크죽고 조안나 남고 .  고통스러운 결말을 감당할수 없네 
7,푸르른 바다의 깊이와 영상미 
10,내가성장기부터가장많이봐온영화 
10,참... 생각을 많이하게 하는영화 같아요. 못보신분들이 꼭 한번 봤음 좋겠어요 
10,엔조가 데리고 와 잠깐 함께 있던 스페인여배우 보니타는 떠날 때 자크와 조안나의 이별을 예감하고 선물을 준 것일까...88년 작이라는 것이 믿기지 않고 이제야 보게된 내가 바보 같다 최고의 영화다...정말 최고라는 ...
8,조안나의 아픔은 누가 해아려 주나 
10,여름이되면 항상 생각이나는영화 장엄하고 아름다운바다 두남자의우정 그리고 그리스 신비로움 
8,"우리시대에 유명했던 영화 포스터 3대장: 연인, 세가지색 블루, 그리고 그랑블루... "
9,지금 cgv에서 하고있는데 태어나서 처음보는영화 평들이 상당한거 보니까 기대하고 보고있습니다 
8,"8,90년대 뤽베송이 멀쩡했던 중의 명작. 다소 오그라들지만 그 진실된 감성은 지금도 고스란히 전달된다. "
8,아름다운 바다의 영상미가 돋보인다. 
9,잘 만들어진 영화.장르노의 매력이 빛을 발하네. 
10,왜 이제야 봤을까.. 베댓처럼 주위에 같이 공감할 사람이 없다. 
9,진한 남자들의 삶을 넘어선 우정 
10,상선약수.. 최상의 선은 물과 같다 
10,내가 본 바다에 관한 가장 아름다운 영화. 에릭 세라의 음악도 최고죠 
8,정신병의 한 부분으로 보기엔 너무나 선명히 존재하는 심연. 누군가는 그 밑을 탐구해야함에 바치는 헌사 
10,뤽베송 감독의 힐링 영화 
9,"""가장 힘든 것은 바다 맨 밑에 있을 때야. 왜냐하면 다시 올라와야 할 이유를 찾아야 하거든""한동안 이 말이 나를 괴롭혔다. 마지막 장면에서의 여운은 장난이 아니다. 무엇인가를 열정적으로 순수하게 사랑..."
10,내 인생 최고의 영화. 가장 사랑하는 사람과 보고싶은 영화 
9,그리 명작은 아닌듯하다. 근데 가슴이 시리다. 아플만큼 시리다. 파란색 바다와 끝없이 깊게 침잠하는 무언가가 생각난다. 누벨 이마쥬가 뭔 사조인지도 모르지만 그냥 지리게 미적으로 아름다운 영화다. 
10,해양 SF에 어비스가 있다면 해양 드라마에는 그랑블루가 있다. 
10,난 자크를 이해하고싶지않다.이곳을 떠난게아니라 처음부터 여기있지않던 사람같다.그런존재라면 처음부터 그곳에 있었어야될것아닌가?왜이곳에와서 남의인생뒤흔들고 가는건지.계속적응못하고 붕떠있는듯한느낌이었다.갈구하는모습이슬프기...
10,야망을 품어줄 영화다. 
9,턱까지 차오르는 선명한 파랑의 뚜렷한 영상미가 인상적임 다만 러닝타임이 긴 감독판은 내용적으로 지루한감이 있을수있으니 미리주의하시길 
10,",.,.,.,.,.,.,.,.,. "
10,"어찌 보면 여자의 비극, 알고보면 그 끝은 다들 찾은 행복. 그는 모두를 사랑했다. "
7,뤽 베송의 진가가 잘 묻어있는 영화 
10,영상미와 음악이 좋군요 
10, 내인생 최고의영화 중 하나. 대부 타이타닉 그랑블루..이 영화를 타이타닉과 그랑블루를 극장에서 본 나는 참 행운아다 
10,진짜진짜최고입니다♥ 
8,"보고 나서도 한참 동안 바다속에 잠긴  기분을 느낄 수 있는 영화. 프랑스 감성이 마치 바다처럼 정신을 매혹하는 동시에 위협하네요. 짚고 넘어가야 할 것은, 농담처럼 등장하는 일본인 다이버는 웃어넘기기 힘든 역겨운 ..."
10,몇이었지? 700쯤? 
7,넓고 푸르른 바다... 
7,역사가 된 영화.... 
10,무섭도록 아름답다 ㅜㅜ 
8,"우정이라는 라이벌, 사랑이라는 애증, 바다가 가진 공포와 탐미 모든 이중적 교차점 "
10,정말....엄청난 영화다. 복선의 완벽함에도 실제로 벌어지는 그 상황에 정신을 잃어버릴 정도였다. 
10,그냥다 의미있는장면이었다.. 
10,시험 끝나면 보고 싶다. 
10,"지중해 ,바다 , 그곳에 가고 싶다.,.. "
10,난 가서 봐야 할 게 있어. 
10,"뤽베송 전성기 시절의 영화. 카메라 기법, 영상미, 색깔, ost 이 모든것이 26년이 지난 지금도 보는이를 먹먹하게 만든다 "
10,댓글보고 88년도 영화인줄알았음감히 내인생최고의영화편한마음으로 보다가 정좌하고 보게됨그랑블루 최고 
10,"내 인생에 있어 가장 인상깊고, 잊혀지지 않는 영화. 자크의 방안에 푸른 바다가 가득차던 장면은 OO이지난 아직도 잊혀지지 않는다.  깊은 심해에 다녀온 기분. "
8,"몽환적인 노래와 바다를 배경으로 한 해안가나 모든 영상미가 돋보였다.보고있자니 평온해지기도. 현실적으로 바라보면 조안나의 삶이 참 안타깝고, 남자가 너무 비정하지만 큰틀에서 보면 자크가 잠수에 집착하는 이유를 부각시..."
10,"처음부터 끝까지 편안했다. 그럼에도 불구하고 지루함이 없었다. 푸른 색의 낭만, 스크린의 비춰지는 영상미. 흔해빠진 블록버스터물만 보다가 참신하면서 잔잔한 영화를 보니 느낌이 새롭다. "
10,다운받아서 열번넘게보고 스크린으로 보고싶었는데 씨네큐브에서 하길래 보고왔어요~ 내생애최고의 영화!!! 
9,처음부터 끝날때까지  짠하다.  주인공도  주인공을 사랑한 여자도  친구도....연기 다 넘잘해서 몰입도 좋다  매끄럽진않으나  나름 투박한 매력이 있음 
10,세상에  찌들었다고 느낄 때마다 이 영화를 틀어 놓고 보내요. 
9,중반부에서 후반부로 이어질때까지 그냥 정말 11점을 주고 싶을만큼 좋았다. 그런데 마지막 추상적인 결말이 나는 이해가 안되서 9점. 
9,푸른 바다속 그 영원이 된 아름다운 영화. 
8,극장에서 본다는 점이 무엇보다 좋았습니다예전과 같지 않은 생각들이 떠올라서 재미있네요 
10,"바다의아름다움 과 두남자의 우정 , 남녀의사랑 , 가족,인생에 관한 씁슬함 을 손뻗으면 만질수있을만큼 가깝게 느꼇고. 매우아름답게표현된 바다와 매우깜깜하고 우주같은 바다를 통해 상반된 느낌이 생생하다. "
10,누가 나를 이  바다에서 구해줬으면 좋겠다. 나는 자크 매욜인가. 나는 돌고래인가. 그래서 이 수심에서 벗어날 수가 없는 건가. 나는 살고 싶다. 이 바다에서 살아갈 수밖에 없고 이곳에서야 행복할 수 있지만 나는 살...
10,에릭세라의 음악과 함께 조화를 이루는 CG없는 장엄한 바다.. 
10,돌고래가 어쩌다 사람으로 태어났니??? 슬프고 감동적이며 환상적인화면과 중독성쩌는 배경음악까지...시대를 초월한 명작. 
10,바다에서 살다가 바다로 돌아간다. 그들이 가장 행복했던 바다에서의 시간을 같이 느낄 수 있어서 좋았습니다. 
10,바다를 너무 잘 표현한 작품... 바다가 급 보고싶어진다 
10,마지막 장면 진짜 소름 돋았다. 그 장면 보고 3분 동안 멍하니 쳐다봄. 엔조가 바다라면   자크는 돌고래랑 여생을 살겠다는 아름다운 마인드. 영화 자체가 아름다웠다. 
10,20년전에 봤던 기억이 납니다 제 인생의  영화 첫사랑의 아푼 기억과 함께  채널 cgv에서 혼자 술한잔하며 보고 있습니다 절대 놓치지 마시길 
10,어렸을때라 100프로 이해하지는 못했지만 저 포스터는 어딜가도 붙어있었다. 
9,CG이전 시대의 아름다운 미장센 그리고 관객을 집어삼키는 스토리텔링. 거대 자본에 흡수되기 전 시절의 영화들이 그립다. 
10,내 작업으로 쓸만큼 좋은 영화. 돌고래보다 바다라는 자연에서 살수있는 인간 이라는 점과 자신이 좋아하는 어떠한 것에 미쳐버렸다 라는 점이 나를 이 영화로 미친듯이 빠져드게 했다. 
10,내가 늘 상상하던 바다 여기에 
10,"내 인생  최고의 영화. 고2 불어시간,,,그날의 감흥이 아직도 가슴한켠에 남아있다. 지금도 눈물이 고인다. "
9,어린시절 감동을 느끼게 해준 영화. 바다만큼파란 눈동자의 주인공이 참으로 인상 깊었던....... 
10,포스터는 진짜 역대영화중 최고 
9,우와~~나의 청춘에 한 획을 그은 잊을 수 없는!눈이 시린 바다와 그 아름답고 슬픈 젊음~미지에 대한 열망이 있는 어린사람들 꼭 보시게나^^ 
10,어린시절 보았던 아름다운 추억같은 아련함 
8,이 영화 포스터 참 좋아 했었는데... 
10,인생의 대작 
9,8.5점 짜리영화. 10점은 무리고 8-9점사이 영화 좋은영화에요 꼭보세요. 
8,고통이 길어질수록 기쁨은 더욱 커지는것... 여기서는 잠수였고 현실에서는 누군가 저마다 자크와 엔조의 그것을 짊어지고 살아가지.... 사랑도 마찬가지.. 조안나 뿐만 아니라 어떤 이들도 가슴 시리게 아프지만 더욱 아...
10,영화보다 포스터가 더 유명한 영화. 첫 장면에서 부터 에릭세라의 음악과 함께 전율을 느꼈다. 이런 좋은 영화의 재개봉은 자주 있었음 좋겠다. 몇 년 후 쯤 또 한번 재개봉해주길~ 
10,그냥 말이 필요없는 진정한 '명작'이다... 영상미와 스토리에 푹빠져 긴 시간동안 시간가는 줄 모르고 봤다. 너무 좋았다. 
10,하..정말 우울 
10,내 생애에서 5번째 안에 드는 영화. 그 깊이감에 압도. 
10,최고다 
10,스크린을 통해 보는 바다.... 이게 피서다.. 
10,"남자지만 이상하게 여주인공인 조안나에게 감정이입이 되었다.   아무리 원해도, 영영 내 것이 되지 않을 것 같은 ,    날 언제 떠나도 이상하지 않은 .... 너무너무 밉지만 또 너무너무 아름답다..... 불쌍한 ..."
8,아직도 보지 않았나요?  난 3번째봤는데 
10,"재개봉? No doubt, 이건 선평점 후감상, "
10,무언가를 사랑한다는 것의 의미를 보여주는 영화. 결국 우리의 마음이 그랑블루. 
9,"높은 하늘에 도전하는 인간은 깊은 바다에도 호기심을 가집니다. 인간의 한계에 도전하는 모습은 정말 멋지지만 마지막 죽음의 순간일지도 모르는 지금, 우리는현재를  어떻게 맞이하고 가까운 사람들을 어떻게 보내야 할까요?..."
8,가장아름다운바다 
10,"내마음속 영화.. 아름답고 슬프고 복합적인 감정들을느낄 수 있는 명작! 이상과 현실, 우정과 사랑 그 속에서 끊임없이 도전하고 좌절하지만 절망을 의미하는것만은 아니었다. 시간이 지나도 그 벅찬 아름다움과 감각적인 연..."
10,나이가 들어서 보지 않음 어쩜 이해하지 못할 가슴애린... ㅠㅠ 너무 유명한 포스터로 어릴때부터 알고만 있었던 영화. 이렇게 보니 지금 보게되어 다행이라는 생각이 듭니다 
10,영화라는 것이  있다는 것을  감사하게 생각하게  만드는 작품 
10,꿈처럼 아름다운 영화 
10,역시 시간이 지나도 클래스는 영원하다. 명작이란 이런 영화를 두고 하는 말이지. 20년을 뛰어넘는 인간 존재의 본연의 뭉클함이란..... 
10,긴 말이 필요없네요... 감동 그 자체입니다. 
9,미국판 과 유럽판 엔딩 두가지버젼이 잇다....돌고래와 바다를 사랑하는 천재 프리다이버의 인생..그리고 철학적메세지..특히 실존인물을 모델로 한 영화라는점에 매력이 두배 
10,놀랍게도 굉장한 철학적 메세지가 담긴영화아름답게 힐링하고 감동에 적혀져서 영화관은 나오게한 영화아직도 여운이 남는다... 
10,단순하게 살면 몸엔 좋지. 하지만 결국 비만도 올 수 있고 본의 아니게 피해를 볼 수도 있지.  영화는 뭐 크게 복잡하지 않음. 하지만 단순한 거 좋아 하는 사람은 보지 마라. 
10,168분 긴 시간동안 생각하고 또 생각하게 만드는 영화 올 여름 시원하게 볼 수 있는 영화네요 !!!!추천 ㅋ 
9,현실과 타협하는  꿈은  없는걸까?꿈을 쫓는 사람은 행복하지만  현실에남겨진  사람은  아프다?상영시간내내  파랑색에  물들것 같은 돌고래들의  수다소리가 귓가에 멤도는 영화 
10,우정의 결정체 뤽 베송의 장대한 여정에 동행하라! 
9,"이거 봐줘라. 친구와의 우정, 사랑 둘다 나온다. "
10,바다를 너무 사랑한 두남자의 우정 10을 주지 않을 이유가 없다 
10,진짜가 나타났다!! 레옹느님 ㅠㅠㅠㅠㅠㅠ 
10,deep down in your heart 
10,명작 
10,꼭봐야하는영화. 근데 호불호가 좀 갈릴것같음 
9,정말 괜찮게 본 영화였는데 다시 개봉하나보군요 
9,"아름다운 바다, 친구와의 우정, 사랑 이 모든 것이 감독의 훌륭한 연출과 OST로 버무러진다 "
9,오! 뤽베송! 
8,상당히재밌게본기억이난다.아름답기도했고 
8,바다와 함께. 
8,흐르는 강물처럼과 함께 포스터가 최고였다. 
8,꽤재밋다ㅋㅋ 
8,바다에 매력에 빠질 수밖에 없을 걸 
8,"기록에 대한 불굴의 도전, 심연에 대한 동경, Homo Dolphinus 자끄의 삶에 대한 예찬 "
9,감상적인 영화 
9,자크가 돌아왔기를. 돌아왔을거다. 
9,어제 EBS서 2시간20분가량봣는데 무삭제판인가?어쩃든 꽤 슬펏고 좋앗음. 
7,바다하면 그랑블루 포스터가 가장 먼저 떠오른다. 
8,지금봐도 괜찮으니 대단하긴 대단해. 
8,뤽베송은 유치함과 심각함의 중간에 서 있지만 아직은 그 정체를 알지 못할 때의 영화 
9,밑에 아가리 닫아라 
9,넓은 바다만큼 깊은 슬픔 
7,흥미로운 물가 동전줍기로 시작해  결국 단조로운 심연과 같은 결말.. 씁슬한마음만.. 
9,장르노가 없었으면 정말 정말 지루한 영화가 될뻔했다. 
9,최근의 영화들을 보면 과연 그랑블루가 뤽베송의 감성인가에 의문이 생긴다. 
9,꿈과 이상 현실 두려움 사랑 우정 승부 모든것이 공존하는 세상 
9,아름다운 바다의 영상과 음악은 최고인듯. 
9,블루를 이렇게나 순수하게 표현할 수 있을까. 
9,지루하지만 엔딩크레딧 올라가는 순간 감동이 가득해진다. 
8,친구와 함께라면 바다밑도 두렵지 않을지도 모르겠다 
9,바다..그리고 우정..음악 감동을 안겨다 준다 
9,"우정, 도전 그리고 바다 "
9,사람으로 태어나서 고생많았다. 다음 생에는 꼭 어류로 태어나길... 
9,맑고푸른바다/장마크바의맑은눈동자/너무도사랑스러운로잔나아퀘트 
8,이 영화를 꼬집는 말은 많다. 그러나 보면 볼수록 신선한 영화. 
10,정말 감동깊게 본 몇 안되는 영화 영원히 잊기 어려울듯 
10,감동의 대작입니다^^ 
9,정말 멋지게 보았던 영화.. 
10,아름다운 영상과 죽이는 음악과 바다같은 파란 여유로운 분위기 
10,그저 느끼시오... 영상보단 음악에 더 가까운 영화 
10,멋진 영화 
8,이 만한 잠수영화는 없을 것이야 
10,심연의 극한에서 느끼는 고독과 자유! 내가 찾던 바로 그 영화!!! 
10,환상적인 바다와 함께 
10,정말 파랗고 파랗고 파란영화 
10,그가 헤엄치기에 세상은너무좁았다. 
10,세상은 그에게 바다보다 못했을까?... 
10,너무나 아름다워서 슬펐다... 
10,자크는 행복해지기 위해 갔다 
10,뤽베송 최고다 이말을 해주고 싶다 
9,"그 바다는..굉장히 깊고, 푸르렀다. "
8,우선 남자 주인공 ^ ^ 그리고 죽는 장면 대박 멋짐 
10,바다는 싫다. 그런데 노력해 볼까 싶었어 ㅎㅎ 
10,정말 잊혀지지 않는 마지막 장면... 멋지다!!! 
10,모든 예술인을 위한 철학이 담겨져 있는 영화. 
8,"바다를 배경으로 자연을 잘 표현, 보관해도 좋을 듯 "
10,영상미 색채등으로 보면 10점도 모자르다. 느끼면서 보는영화 
10,바다로 가자..우리 어머니의 품속으로.. 
10,최고라는 말밖에 표현할 말이 없다. 아름다운 영화 
10,"인간과 바닷,절대침묵,돌고래,교감,죽음 "
10,포스터보다 아름다운 영화. 
8,그저 영화가 주는 아름다움을 즐기시기를... 
10,아름다움에 미쳐버릴것 같애 정말.. 
10,go and see my love... 
10,아름답고 멋있는 영화다.. 
10,그들의 고향은 바다였다 
9,자크가 바다로 잠수하는 .. 돌고래와.. 
