score,review
10,마지막에 자끄가 바다로 잠수하는 모습 잊혀지지 않는다. 
10,88년도작이 이렇게 세련될 수 있다니? 명작이다.. 
8,"그땐 지루했는데 다시보니 굉장한 여운,,멋진 미소의 자끄 "
10,보고나서천장에서물나오지나않을까섬뜩하게빠져들었던 
10,여운은 있었지만 구성이나 연출이 어설픔 
10,시간이 지났어도 명작은 남으리.. L.S.M 잘 봤어.. 땡큐~~ 
9,사나이의 우정과 사랑의 푸른 영상미.... 
10,너무너무 아름다운 영화..영상도 두 주인공도.. 
9,푸른바다.. 우정..사랑.. 
10,어린시절 감동에 젖었던 기억.... 
10,"자끄의 바다는 인간이 얻고자 하는, 그러나 가질수 없는 안식 "
10,이들이야말로 진정 자유인이다 
10,감동 
10,"가족애,우정,사랑,도전을 잔잔하게 묘사.매우,매우,매우,좋다. "
8,장 르노가 안 죽는 영화는 없나? 
9,"에메랄드빛 바다를 통한 하나됨, 그 위대함 "
9,음... 
10,아름다운 지중해와 그 바다보다 아름다운 남자 이야기... 
7,언젠가는 모두 알게되겠지 이 영화에 대해서 난해하지만 좋다 
10,내 인생 최고의 영화 
9,옛날에봐서 가물가물하지만 인상적이었던 인상이.. 
10,볼때마다 다른 감동을 주는 영화 
10,"로망이란 바로 이런 것! go and see, my love. "
10,엔조우~ 긋! 
10,최고 말이 필요없음..100번을 봐도 감동..ost..아..죽어죽어~ 
10,날 영화로 인해 행복할 수 있다는 것을 알려준 계기가 되는 영화 
10,멋진 세 갈래 인생과 매력적인 바다 
10,168분동안 정말 행복했습니다. 
10,꼭 보세요!!!!!!정말 왜 왜 영화를 보는지 알겁니다 
10,"바다는 끝이없고 장엄했으며,감동은 그것을 훨씬 초월하고 있다 "
9,"아름다운, "
10,"푸른빛 바닷물,,,내가 태어나기전에 만들어진 영화지만 재밌다. "
10,흑백화면과 파란바다가 눈과 마음을 적신 영화. 그리고 여운... 
8,멋찐 장면들 많음 
9,우리가가고자하는방향을보여주는영화.결국은모든것이 같잖아!!! 
10,최고의 해양 영화. 100m 심해에 있는 듯 숨막히는 감동. 
10,2시간의 환상여행!! 
10,"슬라이딩 도어즈, 그리고 그랑블루 최고의 영화! "
10,바다생각하면 떠오르는영화 숨이막힐정도로아름다운영화 
10,어딘가로 가고싶다..자유롭게 
10,바다를 소재로 한 영화중 최고의 감동 영화! 
10,"최고,,아름다운 영화 ♡ "
10,말이필요없다..소장가치 백퍼센트. -ㄷㅎ- 
7,잠수의 한계를 극복하기 위해 끊임없는 도전.. 아름답다. 
10,멋지다... 
10,특히 수중 촬영씬은 숨이 막힐 정도로 아름다웠다.. 
9,너무너무 멋진 영화였다. 정말... 
10,최고죠~ 
10,내 인생 최고의 영화!!!!! 
10,와 왜 뤽베송인지 알것같다 
10,천재들만이 이해할 수 있는 세계 
10,그랑블루 수원삼성 서포터즌데요 
8,위대한 바다와 하나가 된 바다사나이들의 이야기.. 
9,"바다, 그 신비함에 대하여... "
8,우주만큼이나 신비한 바다. 매료되는 것은 당연할지도.. 
10,"다섯번 본 영화 ,  근데 또 보고 싶다.. "
7,잔잔한 감동이 있는 영화 
10,가슴 속에 오래 여운이 남는 영화 
10,우린 주인공이 왜 사랑보다 바다를 택했는지 생각해보아야한다. 
10,여운이 무척 기네요..자크..ㅠ_ㅠ 
10,여운이 많이 남는 영화군요... 
8,저도 오늘 방송으로 보게 되었는데 저도 뿅 갔습니다요 ^_^ㅎㅎㅎ 
9,오늘방송으로 첨보고 아주아주 뿅간..영화..영상이 아직도눈앞에 어른 
10,중학교때 선생님이보여준 기억에남는 최고의 명작! 
10,멋지네요+_+ 볼까말까 망설이다가 봤는데.. 역시 보길 잘했답..ㅋㅋ 
9,"파란바다로 빨려들어갈듯하다,......나좀 잡아줘요~ "
8,"자꾸 생각나게 하는 음악과 맨마지막의 엔딩,, 숨이 막힌다,,,, "
8,뤽 베송이 발산할 수 있던 에너지는 `레옹`과 여기서 다 썼다. 
10,음악도 좋았고..파란 바다...봐도 봐도 질리지 않는 영화. 
10,최고의 영화. 사랑보다 우정. 우정보다 푸른 바다. 
10,푸른빛깔이 묻어날듯한 내생에 최고의 영화~* 
10,아주 좋은 영화죠.. 제가 20번 정도봐도 새로운 영화.. 파란색의 영상 
4,우울과 외로움을 광기와 열정인 듯 예술적으로 포장한 영화. 인생의 어떤 국면에서는 이런게 정신적으로 깊은 파장을 가져올 때도 있겠지만. 뭐 예술과 우울은 한끗차이인 것 같기도 하고. 
9,내평점영상미와 소재에 끌려 처음 열어봤지만 속은 등장 인물 한사람마다 복잡한 가치관이 담긴 입체적인 영화 
7,여캐 다루는 게 맘에 안들었음.. 
7,5분 늦었다고 안 들여보내줌 예매티켓도 출력안됨 완전 비인간적임.... 
10,쓰레기 한쿡영화보다가 눈정화했다! 이 영화는 9점대는 되어야 정상이다! 
5,비쥬얼은 정말 훌륭하나 남자들의 우정을 그린 영화치고는 너무 지루함...영화를 더욱 잘만들 수 있었는데..7년전에 보고 다시 봤지만 나의 스타일은 절대 아닌 영화.. 
10,5년전쯤 처음 봤었던 영화... 인상적인 라스트씬... 
10,중딩시절 영화감상부에서 처음봤던 작품. 심해에 대한 청춘들의 끝없는 갈망이 뭍어난다. 대부분 장 르노의 대표작하면 레옹을 언급하지만 개인적으로 장르노의 인생작은 그랑블루라고 생각함. 
10,갑자기 네이버 검색어..뜨는순간 닭살이 돋는다 어렸을때 저게 영화이구나 싶었는데 다시 꼭 봐야겠다 
10,바다에 빠져버린 감동의 영화 
10,영상이 아주 예쁨 
10,너무길다 그래도 10점밖에 줄점수가없다... 
10,아주 잘 만든 영화   감명깊게 보앗습니다. 
10,20년 만에 본 영화인데도 여전히 좋군요. 긴 여운.... 장 마크 바의 눈빛. 장 르노의 몸짓. 목소리. 그리고 바다.. 바다가 무섭지 않아지는 영화 
10,날 물 밑으로 보내줘. 아래가 훨씬 좋더군. 
10,여운이 많이 남는 영화올해 본 것 중에 가장 영화다운 영화입니다. 
10,전 dvd로 소장하고있는 영화에요~볼때마다 새로운 감동이 밀려오는 좋은영화라고 생각합니다~아직도 못보신분이 있다면 꼭 보시길 강력추천해요!!왜 dvd를 소장하는지 아실테니까요~ 
10,감독판이라  그동안 못봤던 장면이 추가되어서 또 새로웠음... 매년 여름이면 생각나는 영화... 여름마다 상영해 줬으면 좋겠다. 
10,아버지이자 가장친한 친구이자 돌고래였던 바다를 필연적으로 사랑할 수 밖에 없었던 남자..태어나서 처음으로 평점 남겨요 
10,"바다에 몸을 담그는 사람들이라면 한번 즈음 느꼈을 포근함과 두려움 상반된 감정으로 다가오는 경외심, 바다에 푹 빠진 사람에 대해 담백하고 아름답게 만들어 낸 이미지, 때때로 그 것에 압도당한 심리를 표현한 연출. 프..."
10,조안나가 불쌍 ㅜㅜ 전체적으로 너무 아름답고 여운이 남아서 잠못이룸... 
8,후반부는 이해하기 어려웠음 
10,정말 이 영화는 다시 볼수 없는 명작일 것이다. 
10,지금봐도 재밋는영화 명작+_+ 마지막에 수중에서 와인먹는장면은 아직도 명장면 
7,기막힌 영상. 지루한 전개. 감동적인 과정과 전개. 심심한 연출 
7,왜 이리 유명한지 모르겠다. 꿈꾸는 장면만 인상적 
8,과대평가 받는 작품. 
2,뜬금없이 엔조는 왜죽어...예술인척 하지말고 논리좀 갖추자 
6,"어렵고 늘어지고 따분합니다. ㅠㅜ 자크와 엔조의 선택에 가슴이 답답, 고개가 갸웃~ "
6,뭐가 좋다는 건지... 상당히 어설픈 연기와 구성. 지루하다 
3,흔하고  뻔한 내용 꿈을 찾아서 모든 것을 내던지는 형태의 영웅은 이제 질렸다  책임감 없는 이상한 사람에게 영웅의 왕관을 씌워주지 마라 
1,OO같이 아무것도 표현 못한 영화입니다. 
5,바닷속의 몽환적인 분위기는 좋았는데 너무길어서 조금 지루했다. 그리고 우정은 보기좋으나 조안나에 대한 무책임함은 좀 그랬다. 나한테는 그저 그런영화. 
6,뭘 이정도로 평점이 빨리나;;외국리뷰 사이트나 평점도 구리고 외국 평론가 리뷰보니 soso정도인데.. 역대 영화 순위나 여런데도 거론도 없는데 ;이 영화 처음나올당시 칸영화제에 나왔을때 비평가들이 신명나게 깠는데.....
4,키야.. 포스터뽕 지리네. 
3,처음부터 끝까지 잠수대회..또 잠수대회.. 잠수대회가 전부임. 
2,기대가 너무 컸나... 높은 평점을 도무지 이해할 수 없는 영화. 
1,두시간이면 되는 영화를 3시간으로 억지로 늘려놓으니 너무 지루하다. 또 가면 갈수록 이해가 안가는 주인공. 
1,이건 뭐지 쩝쩝 별루 별루 별루다 
6,뭔가 대단히 감동적인 게 있는 척만 
1,여: 돌고래가 좋아? 내가 좋아?남: 돌고래. 여: 꺼져. 
1,흠..?? 왜 명작이라고하는지 이해가 안됨 
10,돌고래새끼 첨벙거리는 거 보는 거에 쾌락느끼는 동(물)성애자들ㅋ 
7,비주얼이나 음악은 푸른 바닷속처럼 몽환적이어서 좋았다. 하지만 답답한 성격 때문에 주인공에게 공감하기는 힘들다. 
5,조르바 처럼 손가락를 자른다고 자유가 되는 것은 아니다. 다만 진짜 바다의 색깔을 필름에 담아낸 스물아홉의 베송에게 찬사를 보낸다. 
8,좋은 영화임은 분명하나 조금 촌스럽다 
7,심오하고도 무서운 세계여 나는 그대를 모르겠소/ 내가 이해하기엔 너무 버거운 세계라서 7점 
10,어렸을때 토요명화로 보던 그랑블루..주인공이 사랑하는 여자를 두고 바다속으로 떠나는게 인상깊었는데 이렇게 다시 영화관에서 볼 수 있어서 넘 좋았어요. 전혀 옛날 영화같지않은.. 세시간 가까운 상영시간이 지루하지가 않...
10,모든 면에서 재미있는 영화라고 생각... 감동적이고.. 
10,굳이 말로 설명해야 하는가? 
10,"이 영화를 이해한다면, 좀 더 깊은 외로움을 가지고 있을 것이다. 남들은 이해할 수 없는,  쟈크가 점점 더 깊은 바다로 잠수를 하듯...또한 표면적 해석이 진부한 아래 영화평론가에 실망하며.. "
10,내 인생 최고의 영화 중 하나!! 포스터만 줄기차게 보다가 볼 기회 생겨서 우연히 보게되었는데 왜 이영화를 이제서야 봤을까 후회했다정말 최고!! 
10,10대에 봤던 그랑블루와 20대에 봤던 그랑블루가 다르다. 아득해지면 다시 꺼내보기 좋은 영화. 바다 가고싶네. 
10,"자극적인 모든 것에 지쳤다면, 푸르고 고요한 바다를 보고 싶다면.. 강력추천! 25년 전 작품이라고는 믿기지 않을 만큼 스토리, 스타일, 배우들의 완벽한 세련됨. 8.14(수)대한극장 7:30분 마지막 상영. 같이 ..."
10,아하 재개봉작이구나 ... 어떤내용일찌.. 
10, ㅅㅅㅅ 
10,"모든 것들이 그렇듯 시대가 흐르고 유행이 바뀌면 그 가치도 변하기 마련이다. 20년 전에 정말 인상깊게 봤던 영화가 재개봉 후, 평점이 떨어지는 건 안타까운 일이다. 개개인마다 취향이 있겠지만 이 영화에 대헤 혹평을..."
7,좀 거북한 느낌이 있었지만.. 괜찮은 영화. 
10,ㅇ 
10,넘 좋아용. 
9,색감부터 음악.여운모든것들이완벽한.. 
9,수영장에서토하던생각이나요.돌고래와나는똑같아지네요. 
10,"10점이젤높아서10점줌  여운이길게남는영화 너무너무좋았던,,,,,그리스로떠나고싶다 "
9,코엑스 메가박스에서 보고옴레옹아저씨 연기 잼나게 잘함 
9,미치광이들의 이야기인가ㅠㅠ너무어렵지만 그만큼 이해는가면서애잔한... 
7,바다를 사랑한 남자 
7,영화에 침잠당하다. 포스터에 매료되다. 
8,상당히 대단한 작품이지만 지금보기에는 약간의 지루함이있다 
7,"뭐지, 2%부족한 이느낌은 ㅋ "
6,감독과 배우 그리고 영화의 그 대단한 명성으로도 도저히 견딜 수 없었던 영화. 
5,왜 이영화만 보면 눈물이 나는지... 
5,당연히 별5개의 최고의 영화이지여...ㅋㅋㅋㅋㅋ 
7,라이프 오브 파이 아류작이 될 것만 같아.. 
1,지루함 
6,"너무 과대 평가 받는 영화. 포스터빨이 90%. 이미지 빼곤 남는게 별로,.. "
1, OO머겅 두번머겅 세번머겅! 이게 영화야 야동! 야동!! 야동!!! 퉤이새1꺄 
1,이렇네 좋은 평점이 나로써는 도저히 이해할 수 없는 영화... 촌스럽고 난해하며 비현실적인 스토리... 
7,리뷰들 에서 말하는 전문가적인 영화 해석들 다 좋은데...그것들을 뛰어넘는 지루함이 점수를 깎게 만들었다. 다 좋은데 지루하다는게 문제다..배경이 평화롭고 아름다운데 그것 때문에 이 영화를 추천할거면 차라리 HD 해...
1,"아름다운 바다이야기인줄 알았는데 아니였고, 책임감 없는 남자가 얼마나 위험하고 거지같은지 알려주는 영화 "
10,인생의 넘버 원 영화입니다대한극장서 네 번을 보았어요곧 스킨스쿠버 자격증도 땄었구요재개봉하면 아이들과 다시 보고 싶네요 
1,"내 인생 최악의 영화자신의 성장과정 속에 있었던 엄마의 부재,추가적인 이빠의 부재에 대한 고찰이 주인공에게는전혀없다. 자신도  똑같이 미래에 태어날 자식에게아빠의 부재라는 선물을 먼저 선사하면서 이 영화는끝이난다. ..."
9,영화 자체가 지루하진 않았는데 러닝타임이 길어서 영화 보고 나니 피곤하긴 했다. 포스터처럼 바다가 파랗게 예쁘게 나올 줄 알았는데 그건 아니여서 좀 아쉬움. 스토리 자체는 끝내줬다. 마음속에 많은  명장면 명대사를 ...
8,말로만 듣던 그랑블루를 드디어 보았는데... 너무 기대를 한 듯ㅠㅠ 
8,지금보기엔 무리가있다.평점이 넘높다.바다영상미 빼곤 별루.160분 넘길게만들었다 
7,"어색한 세상에 다시 가야할 이유를 모르겠다.,장느로의 연기는 기복심한 편이었다. "
2,2시간 20분짜리 영화..지겨웠다.. 
6,"잠수대회,로맨스,돌고래,우정... 내가 머리가 나쁜건가? "
6,168분 짜리 확장판을 보아서인지 쫌 지루한건 사실! 
6,낭만적이긴 한데 넘 길게 느껴지네요 
3,ultimate edition. 화면은 좋으나 좀 늘어짐 
3,165분짜리를 봐서 그런지 엄청 지루하게 느꼈다 
5,주인공에 답답함이 느껴진다. 지루한 영화. 좀 실망했다. 
1,보고 나니까 정신이 멍해짐;; 지루;; 
4,"많이 기대했는데, -_- 파란 바다빼곤 다 엉성한 느낌 "
5,모자란 영화 
1,예매해놓고 못봤다... 
7,"영상미는 빼어나지만, 19금장면이 꽤 되는데다가, 결국 여주인공의 남주인공 자살방조영화. 즉, 자살미화영화 "
1,감동이니 인생 영화니 하는 애들은 자기멋에 도취하고싶은 부류인듯.러닝타임만길고 스토리 개연성도없고 그냥 돌고래 성애자 벙어리 사이코패스새끼 만나서 여주 좆대는 얘기 들려주는 인생 최악의 영화. 
5,재개봉 작품도 보고싶기도 해서 찾아보다가 평점에 쓰여진 편협한 인간들의 글때문에 갑자기 원작의 감동이 줄어들고 보고싶은 마음이 싹 사라졌다. 오글오글; 
5,저는 그냥 그저그렇게본영화 다시개봉했는데..뭔가안끌리네요. 
10,생에 처음 별점? 이런 영화를 만들 수 있는 프랑스인들은정말? 아??  볼 수 있어 그저 감사 ? 
7,많이 지루한건 사실... 뭐 워낙 고전명작이라 7점... 그렇다고 내용이 막장스럽거나 나쁜건 아니고 볼만합니다... 
3,good 
1,아주 잘봤습니다.감동의 극치입니다.제 인생의 최고의 영화였습니다. 
1,그랑블루 
5,"30일 상암에서 봤는데 사람들은 ""80년대의 감성을 대표하는 명작"" 이라고 말하는데 나는 잘 모르겠다. 긴 러닝타임에도 불구하고 지루하지는 않다고 생각하는데 왜 명작인지는 잘 모르겠다 <러스트 앤..."
4,완전별로. 주인공 비호감. 정말 비호감 ㅡㅡ 
2,고지식한 아저씨가보기 적당한 영화.ㅋ 젊은새대가보기엔 내용이 거시기함 ㅋ; 
1,뤼크베송 정말 시러 
5,뭐지.. 수영좋아해서 봤는데 별로다 난.. 뭐 남자가 책임감도 없고 
7,퀵배송 실망이야 
