score,review
10,진짜 원화의 보스 캐릭터는 이대로 묻히기 너무 아깝다 미친듯이 웃기네... 
10,유년시절 성룡영화의 재미를 느끼며 보낸것도 복인듯.... 
10,성룡 원표 홍금보 골든 트리오... 특히 마지막 공장에서의 격투씬이 정말 최고... 
8,액션과 함께 손발이 오그라드는 로맨틱 코메디의 절묘한 조화가 쏠쏠한데? 
10,"액션,로맨스,음악 모두 짱이었다. "
10,"조금더 진지한 삼총사, 원표의 나사풀린 캐릭터가 정말 재미있다. "
8,단순하면서도 잼있는...이게 성룡영화지...;; 
10,"성룡표 코믹액션+ 마지막은 이소룡식 결투장면 ,,80년대 성룡영화가 진국이다~! "
8,역시 성룡과홍금보 원표의 액션은 명불허전이다 이게바로 진정한 영화! 
8,마약공장에서 성룡과 베니 어키데즈의 결투씬은 최고다 
8,"전성기때 골든트리오 성룡, 홍금보, 원표의 마지막 공동 작품... "
10,"성룡, 홍금보, 원표의 골든트리오는 무적이지. "
10,최고에 액션 정말 잼있게 봤었음 어릴때 ㅋ 
7,싸움할때의격투씬볼만함여주인공이별로다킬림타임용 
10,액션씬 입벌리고 봤어요 최고!! 
10,역시 원표형님 
10,그때가 그립다 ㅋㅋ 
10,액션과 코믹 모두를 갖췄다...근데 영화 자료 사진은 하일복성(칠복성)이네^^ 
10,그저신기하다 어떻게 저렇게 액션을 찍었을까. 
9,골든트리오는 아직 안 죽었다. 
10,이 세명이 다시모여 영화를 찍는다면...이라는 생각을 가진다. 
10,다들 너무하는군요..저표지를 보고 비룡맹장이라니..저건 칠복성의 한장면입니다 
10,아~골든트리오....언젠가 한번뭉쳤으면 소원이없겠네 
10,홍금보의적극적인애정공세에빼꼽빠지게웃었다.ㅋㅋ그리고원표액션최고! 
8,딴건 몰라도 액션 하나만은 끝내줌. 
10,원표조아...ㅋㅋㅋ 
10,원표의 환상적인 액션 ㅋ 
9,홍금보는 나름의 독특한 앤딩 크래딧이 있죠. 걍 놔두기 ㅡㅡ; 
9,"공장에서의 격투신이 볼만했다.,,여자와의 사랑 얘기는 그다지.. "
7,언제나 최고의 오락영화를 만드는 3인방 성룡 홍금보 원표 
10,추억의 명작. 
10,성룡 여자친구역 이쁨 그리고 볼만한 영화입니다 
10,쾌찬차에서나왔던 복싱챔피언 베니어키데즈도나오고 황금트리오작품^^ 
10,성룡  홍금보  원표 전설의 트리오 행님들이 가장 빛났던 80년대 그때 그 어린 시절 내 인생에 가장 즐겁고 재미있게 즐겨 봤던 최고의 명작 작품이지 여자의 사랑을 얻으려면 성룡 홍금보 행님처럼 해라고 배웠다 ㅋㅋ ...
8,이런 영화 요즘은 안나오냐 
9,이 정도면 하나의 장르아닐까 
9,세 트리오 마지막 수작... 
8,골든트리오 수작  마지막 긴 시간 액션 굿 
9,타 작품에 비해 과소평가된 작품. 성룡영화 중 액션이 가장 격렬함 
10,엽덕한때문에보는영화 
10,"완벽한 플롯, 끝도 없이 쏟아지는 액션, 성룡 메이져 영화는 아니지만, 비룡맹장이 최고의 작품이라고 생각합니다. "
9,악역이 기억에 많이남는영화~ 
6,포스터가 잘못 올라갔어요. 이건 비룡맹장 포스터가 아니라 유덕화가 같이 있는거 봐서는 칠복성인데... 
10,대박.ㅠㅠㅠㅠㅠㅠ 
8,시원시원한 격투액션! 
2,액션은 볼만 
10,진짜 어릴때 봤었는데 이테잎은 진짜 가지고 싶을 정도로 젬나게 봤었는뎅... 
10,저때가 좋았지.. 
8,성룡 굿!! 
10,골든 트리오는 영원하다 
9,그냥 재밌음... 큰 기대는 하지말고..ㅋㅋ 
10,원표 캐릭터 맘에 안들어~ ㅎㅎㅎ  그래도 재밌는데?? ㅎㅎㅎ 
10,잼써요~!!! 
9,트리오 재 출격 재미있음 
8,다소 유치하지만 삼인방의 액션연기는 일품이다!! 
10,정말 끝내주는영화! 성룡의 사랑연기 볼만하다 
10,홍콩액션 최고의 영화. 액션이 쉴새없이 나온다. 
9,Good~! 라는 말밖엔... 
10,저 3사람 칠복성에 나오는 사람인데...유덕화형 왜 여기나오지 
9,3총사 최고의 영화!!! 
10,캬캬 역시 성룡 원표 황금보 ㅎㅎ 
9,성룡영화의 백미 NG장면이 없어서 아쉽다... 
10,"저 포스터는 1985년작 ""칠복성""이라는 영화 포스터네요...^^ "
9,"성룡,원표,홍금보.. "
10,근데 위 포스터에 유덕화가 왜 있냐? 나오지도 않으면서ㅡㅡ; 
8,성룡 원표 홍금보.. 셋만 되는겨~ 
10,나 초등학교때 비디오로 빌려봤는데 
10,명화 
10,라스트액션씬이 인상적이었던 영화~ 
9,원표라는 배우를 알게되어 좋다 
10,저도 정말 재밋게 비디오로 봣습니다 ㅋㅋ 
10,"재밌게 본 영화입니다 ^^ 성룡, 원표, 홍금보 황금트리오!! "
8,세명의 조합이 아주 좋아 
8,여전히 코믹하지만 조금은 아쉬운 골든 트리오의 마지막 작품 
8,"언제나 흥미로운 성룡,홍금보,원표 트리오의 경이로운 액션, 그때는 몰랐던 염색공장에서의 폐수문제였다니 "
9,"성룡,홍금보,원표 3인방의 마지막 작품이라 더욱 기억에 남는다는~ "
10,"80년대를 주름잡던 트로이카,그 중 제일 궁금했던 원표다! "
10,비룡맹장 12월20일 재개봉 상영관이 어딘지 모르겠습니다. 아시는분 있으시면 알려주세요. 
10,내 추억의 영화.. 극장에서 너무 웃겨서 많이 웃었던 기억이 나네.. 당시 중3 때였나? 참으로 돌아가고 싶은 시절이네 
10,외국인이랑 싸운 마지막 결투장면 레전드다 진짜 
7,추억 속의 액션이 살아 있는 그들을 함께 볼 수 있는 영화.. 
10,"로맨스,액션,코믹 모든것을 다 갖춘 성룡리즈 시절 최고의 영화!.. "
10,말이 필요없는 명작.. 
10,"최고의액션배우 성룡,홍금보,원표가 나오는 영화 정말 재밌게봤엇음 "
7,"20년만에 다시봤음,,스토리는별루지만 성룡영화는 항상기본은한다~~~~ "
10,이 세명이 뭉치면 다 재미있다 
10,이영화를 따지는게 아니라줄거리에는 홍금보님 역할이름이 황비홍이라고 되어있고감독 출연에는 왕비홍이라고 되어있죠?그리고 영화는 정말재미있었어요 
10,최고의 액션. 
10,마지막성룡결투장면에서결정타한방날릴때날라회전돌려차기 자세히보면성룡이아니당 
7,홍콩영화는 확실히 빠르다 
4,마지막 액션을 위한 오글오글 하고 개연성없는 연출  맨몸액션안 흥미거리 
5,홍금보의 연출력 알 만하네. 성룡이 변호사! 
8,전형적인 성룡의 사물을 이용한 액션 영화! 
10,"성룡, 원표,홍금보가 같이 나오는 소중한 영화~ 마지막 나쁜외쿡놈과의 공장 결투씬의 결정적 두장면이 모두 대역인걸 알고 충격에 빠졌지만ㅠㅠ 그래도 성룡, 당신은 최고입니다~!! "
9,원표의 난감한 중2병 연기는 안습이었지만 액션만큼은 맘에 들었다 
10,성룡의 액션은 아무도 따라할 수 없다 
8,다은 영화에 비해 원표의 액션이 인상적이었다 
7,포스터가 하일복성 이네...쾌찬차 포스터 구하기가 힘든가??? 
10,정말 진심으로 존경합니다...성룡 형님!!! 무조건 최고 최고!!! 
10,더이상 이 세사람이 한 영화에 나온수있을까?........없..다... 
10,전설이 된 세 콤비의 마지막 영화 
10,골든트리오의 마지막 작품. 화려한 불꽃을 태우다! 
2,유치했지만 재밌었음 
10,원표빼고 다 러브러브 모드 
9,가화삼보의 마지막 작품 
1,childish 
7,성룡 영화는 하나같이 진지함이 없다 물론 코믹액션이 주 특기라 그렇긴하지만 특히 과거 작품들은 중딩들이 볼만한 유치한 수준이 많다 홍번구나 러시아워 정도라면 높게 평할 수 있다 
