score,review
10,언젠가 더 더 큰 스크린으로 보고싶다 
10,난 희망이 있다는 것을 아직 믿는다. 하지만 희망이 있다는 것을 가끔 잊는다. 
10,우리의 삶이 보인다  그 답을 보고싶은 사람에게 강추 
9,슬프고 아프고 먹먹하다 아이들의 시선르로 그려 더욱 그렇다 나는 두려움을 속이며 어디로 가고 있는가 
10,침묵의 서정시 
9,"한편의 시, 수채화를 보고 있는 것만 같은.. 모든것이 전부 슬프도록 아름답다 "
8,아이들이 찾던 아버지는 누구일까? 
10,잔잔하지만 치명적인 슬픔.......뭐라 설명할 수가 없다. 
10,안개 속에 '내던져진' 아이들. 
10,무덤까지 가져가야할 앙겔로풀로스의 수작 
10,"한편의 시, 한장의 그림, 영원한 안식같은 위로를 받게된다. "
9,비애와 상징으로 보인 현실 연주의 끝에 온기를 채워 품는 공목 
8,"안개속에 맴도는 잃어버린 그리스의 시원(始原), 향수와 애련. "
9,시적이고 아름답고 잔인하기도 한 영화 
10,"절망이란...그 아득히 멀어지는,시리도록 아픈 '회색'의 아름다움... "
10,리얼리티 영화라 표명하는 영화보다 사실적인 은유? 
10,안개 속에 가려져 있는 그게 바로 삶이다. 
9,그들이 찾는 것은 결국 무엇인가. 
10,옅은 푸른색의 차가운 공기같은 영화. 
10,영화전반에 흐르는 아름다운 오보에 선율...영상미... 
7,한치 앞도 내다보기 힘든 안개 속 아이들이 원하는 건 큰 게 아니지만. 
10,애잔하고 애달프고.. 포스터만 봐도 먹먹해져  하하... 
10,잔인한아름다움 
8,우리모두는지금 어디에 서있을까?짧은인생을 긴말로 억지스럽게 풀어쓸필요 있을까.. 
8,미치도록 슬픈 당시 사회적문제를 어린이의 관점으로 그렸지만 지금의 문제도 된다 
10,아름다운 서정시 같은 수작 
10,10년전에 봤던 내 생애명작 중 하나...가슴 깊숙한곳 뜨거운 울림이 오래도록 남았던. 
8,중간중간 나오는 남매의 지친독백(?)이 너무고독하게느껴졌다..ㅠ.ㅠ 
9,제목이 주는 의미가 너무나 깊고 거대하다.나약하고 사악한 인간의 세상. 
10,길은 없고 안타까움은 안개 속 풍경과 같다. 
10,"긴 호흡, 원거리, 풍경, 로드 무비의 최고봉 "
10,그래도 알아주는 이 한명만 있다면야..아직은 희망이 있다. 
10,스산하고습기가득한풍경.가시에찔린 소녀의 아픈 눈망울같은영화 
10,가슴이 찢어질듯한 아름답고 슬픈 영화 
10,존재해야 할 무언가는 존재하지않는 공허함... 
10,암울하지만 남매의 멈추지 않는 여정은 가슴저린 희망이었다. 
10,본질적인 아픔을 건드리는 한편의 시 
10,암울한 느낌이었지만...많은 생각을 하게 만드는 영화 
9,숨이막힐 정도로 슬프고 아련해서...다시 볼수가 없을거 같다... 
8,안개는 우리의 삶속에 일어나는 모든 암울함과 알수없는 미래에 대한 불안감. 살아봐도 안개는 언제 그치는지 알수가없다. 영화에는  끝이 보이더만. 
9,비정한 현실에 가장 먼저 가장 많이 다치는 이들은 아이들이다. 그럼에도 아이들이 있기에 어김없이 희망은 존재한다. 
10,영상이 너무나 아름답다..어릴적 추억이떠오른다..한그루 거목은 무슨나무인가? 
9,2006년이었던가... 만나던사람이 추천해서 광화문서 봤다. 지금 또 본다. 
10,"안개 라는 어둠, 어둠이라는 사악함끝내  다가서는  안개 속 풍경. "
10,좋네요좋아좋네좋아좋아좋아 
9,슬픕니다. 좋습니다. 
8,아이들의 시선을 그대로 담아낸 영화 
10,가장 최근의 베스트 영화.안개 속의 풍경을 보고 싶네요. 
7,"길, 여정, 인생...안개 속의 풍경은 나무였어. 첫사랑... "
10,보는내내 안타깝고 슬픈영화.....결국 아버지를 만난 두아이들. 
9,외롭다. 
7,"화면내내황폐함이 묻어난다.절망적이고 어둔영상과 스토리,남매의 희망은 끝을 모른다 "
9,아이의 성장을 통해 삶을 바라보다 
10,섬세하고 아름다운 슬픈 소설 같은 영화. 
10,그리스 국민감독의 그리스판 오세암 
10,메마른 감성을 촉촉히 적셔줬던 보석같은 영화. 
10,"희뿌연영상,서정적인음악,우울하고어두운현실의풍경들과희망. 섬세한조화 "
7,"그림처럼 점점이 이어지는 영상, 그리고 아름다운 선율... "
7,감독은 그림을 그리고 싶었던 게다 
9,"슬프지만 , 아름다운 "
10,겉은가시 속은솜털 그러나 솜털 마저 검게 물들고 촉감은 그대로 
9,"안개 뒤엔 들판과 하늘이, 그리고 그 안에 나무와 아이들이 있다 "
10,영상의 아름다움과 건조함이 공존하고 있는 화면들 
8,"남매는 끝없이 안개가 걷힌 곳으로 향하는 중..나는 과연 안개속에 있는가, 밖에 있는가.. "
10,"아득한 안개 속.. 두 남매의 길 위의 모습. .잊혀지지않는다. 피하고 싶은 삶의 한축을 직면한 느낌.음악마저 아득한 , 슬프도록 아름다운 영화 "
10,제 점수는 요 안개속의 풍경 
10,미치도록 슬프고도 아름다운... 
9,"가게의 문도 겨우 열고 닫을 만한 덩치의 아이들이 말없이 서로를 껴안았을 때 나는 왜 울컥했을까. 그 아이들을 바다에 데려간 건 경찰도, 삼촌도 아닌 무명의 방랑자였다. 어쩌면 아이들의 목적지는 파리가 아닌 누군가의..."
10,앙겔로풀로스의 영혼은 습하면서 영롱하다. 
8,"영원과하루보다 임팩트가 덜한것같아서.., "
10,이영화볼때마다 박철수감독의 오세암이 생각난다.. 
7,건조하다 
10,고딩때 본것 같은뎅 8년전이군..그냥전체적으로우울모드 
10,안개 속의 풍경... 으... 
8,스산해진 마음을 추스리기 위해 봤다간 더욱 허무해지는...... 
9,차갑고 건조한 영화. 
10,정말 기억에 남는 영화 
7,안개 속에 있는 답답함... 
9,"2006년이었다.. 나역시 광화문에서 사랑하는 이와 함께 관람하였다.. ost를 듣고 있다,그리워한다.. 소미. moon.. "
10,예술하는 사람이라면 조금 더 이해할 수 있는 
1,어렵다.. 
7,왜 하필 독일이지...? 그리스의 시대상을 알면 더욱 많은 것이 보일 것같은  영화 
7,무(霧)를 향해 미끄러지는 달팽이 
4,느린 호흡이라고 해서 예술은 아니다. 
10,"세상의 냉혹함 속, 아이들의 손수함을 굉장히 감각적인 색감과 화면으로 보여주는 영화.. 정지한 듯한 화면과 아이들의 연약함과 순수함을 보여주기 위한 '익스트림 롱샷', 그리고 느릿하게 진행되지만, 힘이..."
7,마치 감독의 큐싸인이 들리는듯 하다....레디 액션....연출의 부주의...짜여진 구성 아쉽지만 예술영화라는 측면에선 괜찮은 영화... 
6,잘 모르겠다. 
1,졸리다 
1,체험은 없다. 오로지 해석을 위한 고루한 상징만 있을 뿐 
1,모두가 삼겹살을 다 좋아하진 않듯 개인취향이 아닌영화를 명작이라고 되새길순 없다. 
2,관객을 가르치려들때 영화는 억지가 된다. 
