score,review
10,포스터가 저질이지만 영화는 진짜 감동이다 
8,포스터가 저게뭐여.......삼류영화처럼 만들어놨네 
10,제임스 스페이더의 매력이 한껏 빛낫던 영화입니다. 수잔의 연기는 말할것도 없고 
10,진짜 흥분되고 야하고...너무 철학적인 영화...최고의 영화중 하나. 
9,내가 조금 이상한건가.. 개인적인 생각이지만 제목이주는 판타지적인 느낌이 이 영화는 사실 판타지야.. 이러는거같음...ㅎ 아름답지만 너무나 판타지스러워서 어쩐지 슬픈느낌 
9,간략한 줄거리만 보고 흔한 '귀여운여인' 풍의 발랄한 신데렐라 스토리를 짐작했지만 조금은 다른 분위기이다. 전체적으로는 짐작가능한 전개와 결말이지만 그 과정의 디테일한 부분들이 좋고 무엇보다 두 배우의...
10,어렸을때..몰래봤던 영화...이제 32살...마지막 장면....너무 아름답다... 
10,이 영화를 좋아한다면 당신은 사랑을 아는 사람이다. 
10,멋진 영화~!  이런 사랑을 기다리며... 
10,이런 연애 하고 싶다 
10,"오, 굿! 사랑할 수 있다면 사랑하라. 마음껏! "
10,포스터갈아주세요...너무너무 멋진영화입니다...이런사랑...부럽네요... 
10,마지막 엔딩 장면만으로도 별 5개도 부족하다 
9,마지막 키스씬...모든 여자들이 꿈꾸지 않을까 
10,포스터찍은 사람 반성해야한다 정말 와닿는 로맨틱영화 
10,"가식,조건,현실을 벗어버린, 사랑에 관한 진실이 담긴 아름다운 영화 "
10,그당시엔 참신하고 아름다운 사랑이야기네요. 지금도 잼있어요~ 
10,매분 매초 빛을 발하는 수잔 서랜든의 존재감. 제임스 스페이더의 풋풋한 매력. 농염하게 깔리는 사운드트랙. Perfect. 
10,너무너무너무 괜찮았음 ㅋ  엔딩에서 완전 침줄줄 제임스오빠 완소 ㅋ 
6,내가 가진 모든 세계를 뒤흔드는 사랑 
6,진짜 사랑이 뭔지 아는 이만이 이 영화를 볼 자격이 있다 
10,10여년전에 10번도더본영화. 비디오밖에없어 다운받아서 다시소장하고픈 영화입니다. 
10,엔딩 씬의 두 사람을 생각하면 항상 흐믓해진다. 부러운 로맨스. 
10,"스무살때 티비에서 봤던 영화, 정말 재밌고 시나리오 연기 편집 음악등 모든 게 대단한 영화, 헐리웃은 애정영화도 재밌게 만든다는 걸 느끼해 해주고 수잔 서랜든, 아주 좋은 배우이다. 그녀의 연기는 내 눈시울을 적시게..."
9,이게 진정한 사랑이다. 
10,괜찮은 로맨틱 드라마 
10,사랑이란... 
10,사랑을 하고싶게 만드는 영화^^ 
10,장난아냐.. 정말 이런사랑 하고싶다..최고ㅜㅜ 
10,시덥잖은 연상커플 로맨스같아도 꽤 괜찮은 작품이다 
10,로맨스영화로는 더할나위없이 최고아니겠는가!!! 
9,제목이 별로지만..의외로 정말 재밌는 멋진 사랑이야기 
9,꽃미모 스페이더 꽃미모 스페이더 
8,옛다!8.5점   수잔서랜든  묵직하고 관록있는 분위기 
10,90년대의 추억이 묻어나는.... 
9,생각도 못한 괜찮은 영화! 눈물 날 뻔 했다. 
10,좋아요~ 
10,루이스만도키?이분 병속에담긴편지감독인가?보석같은멜로의대가! 
10,너무 아름다운 영화....ㅠ 
10,BEST OF BEST였다 아 너무너무......... 최고의 로맨스 
9,아~제임스 스페이더♥ 
10,진정한 사랑의 의미를 보여주는 영화 
10,"둘이 너무 멋짐 , 사랑하고 싶은 영화 "
10,저두 이런 사랑하고 싶네여. 
10,마지막 식당씬이 잊혀지지 않음~~ 
10,"티비에서 봤는데 감동적이고 아름다운영화,,남주인공 완전훈남 "
10,보는 내내 가슴이  아파요.그러다 눈물이 나오네요.정말 최근 본 그어떤 영화보다 감동적이예요.아름다워요~^^ 
10,여운이 남는 영화.수잔 여사 캐 매력적이고 제임스도 매력적이고 여자들 취향영화 
6,포스터가 야하네 
10,그저 눈물이 흐르네요. 
10,재미와 감동이 두루있는 좋은 영화네요. 
10,최고의 로맨스 
10,좋군요... 
9,포스터가 저질이네...영화는 너무 아름답고 스페이더미모는 열일하고 너무너무 사랑스러운영화ㅠㅠ 
10,감동이없다면 당신은 순수0% 
10,뻔한이야기를 비범하게 표현하는 두배우를 보는 재미가 대단했던... 아.. 다시보고싶네요 
8,포스터 뭔... 이건 포스터가 잘못한거임 아무튼 잘못한거임 
10,의외의 명작.. 로맨스영화 좋아하는 사람이라면 안 좋아할 수 없음. 연상연하 로맨스 좋아한다면 이 작품을 사랑하게 될 것임. 
10,잘만들엇네요 사랑의맛 
10,저는 정말 재미있고 감동깊게 봤어요. 특히 남주에게 반했던 영화에요. 다양한 활동을 하는 제임스 스페이더를 좋아했어요. 
8,"수잔 써랜든, 정말 멋지고 섹시합니다.  아름답지만 어쩐지 슬픈 러브스토리... "
10,남자가 사랑할때를 통해 알게 된 감독... 루이스 만도키 감독 로맨스가 내 스타일인가보다... 제대로 취향저격당했어요 
10,제임스스페이더의 리즈시절을 보는것만으로도 충분. 
10,제임스 스패이더를 알게 된 영화. 이젠 그도 늙고 나도 늙고.. 
3,현실적인듯 현실적이지 않은 엔딩 
9,헉..포스터가 꼭 에로비됴 자켓같네..마음이 따뜻해지는 로맨스 
10,여러번 봐도 가슴 두근거리는  로맨스 
5,어제 티비에서 봤는데..둘이 너무 잘어울림^^ 
10,제임스 스페이더가 원조꽃미남이었군요..귀여버요 
9,수잔 서랜든을 너무 좋아하게된영화~ 
10,"무려 25년전 영화를 이렇게 몰입해서 잼나게 볼수있다니. 너무 아름답고, 감동적이고 행복해지는 영화였다. "
10,최고의 로맨스 영화! 스토리도 멋지고 두 주연배우 넘 매력적이예요. 
10,제임스 스페이더. 수잔 서랜든. 그리고 마지막 씬. 이 이상 무얼 더 바라겠는가. 
5,계급 차이가 줄어든 '귀여운 여인'. 90년대에는 이런 신데렐라 스토리가 너무 많아 참신함이 떨어진다. 
9,내 베스트 로맨스 영화중에 하나..  포스터가 내용이랑 별로 안 어울립니다..  제임스..너무 늙어버렸다..ㅠㅠ 내 나이도.. 
10,진짜 재밌게봤어요 기분좋아지게하는 영화 
9,이 영화 보고싶은데.. 찾을 수가 없네요. 어디서 다운받을 수 있을까요? 
8,20년 전 즈음에 보았던 영화. 생각지도 못한 진한 베드신에 놀랐던 기억이 있다. 그 외에도 뭔가 강렬하게 기억에 남는 영화다. 90년대에 대한 향수일까. 
9,"이 포스터는 망사속옷. '편견을 벗어던진 파격의 사랑'이란 알몸이, 보일락 말락~ "
8,잘봤다 . 아주 재미있진 않았지만... 나쁘진 않다. 
9,9점을 줘도 아깝지 않을 ! 청소기 에는 쓰레기가 있어야 정상이지 (사랑스럽고 예쁜영화 영화는 이렇게 만들어야지 과하지도 않고 그렇다고 덜하지도 않고 딱좋아요 인생 영화중 한편 ^^<. 
10,이 영화보고 제임스 스페이더에게 빠졌다 
8,"섬세한 연기와 상황, 대사 그리고 최근 모습만 안다면 도저히 상상히 안되는 섹시한 스페이더.. 영화시작부터 첫 정사 장면까지는 정말 숨 막힐듯 몰입감이 대단했음 "
10,오래전 TV에서 보고 감동그자체였다. 제임스의 순수함과 수잔의 퇴폐적농후함에 푹 빠졌던영화. .개인적으로 더다가왔던게 8년연상의 연인과 뜨거웠던 사랑을 나누어서 더욱 공감이 간다. 그때 제임스와 같은고민을 했었지.현...
10,포스터 멋진데? 서로 상처를 핣아주는 느낌. 영화를 먼저 봐서 그런가? 
8,다분히 영화적..여자들은 좋아하겠네 
7,진짜 사랑한다면 그들처럼 
10,나도 저런 이쁜 아줌마랑 사귀고싶다 여주 이쁘네 너무 재밋다 
10,지금 수잔 서랜든과 제임스 스페이더 봐봐라 어차피 나이 먹으면 같이늙어가는거 
10,그냥그냥 아름다운 로맨스라고 칭하는건 너무 가볍다ㆍ섬세하고 똑똑한 남자와 불행하고 자신감 결여된 하지만 똑똑한 연상녀와의 사랑에서 두사람의 심리를 정말 잘 그려냈다 ㆍ작가가 천재적? 이런 명작 다시 볼수있었으면? 
1,평점들이 대단하길래 봤더니 연상연하라는 점만 제외하면 별 특별할거 없는 클리셰 로맨스였음. 거기에 전혀 공감도 안가는 샤머니즘까지... 어쩐지 다보고나서 imdb 평점 찾아봤더니 6.5 더라 
9,"16살 나이차이가 무슨 대수랴?그녀가 수전 서랜든이라면...이런 영화를 환타지 영화의 최고봉이라고 한다.만약에 상대가 소녀시대 윤아라면,그녀가 나보다 160살 연상이라도 결혼하고야 만다~아,할매(윤아 별명)좋아.나는..."
4,난 별로..지루했음 
6,제임스스페이더에 반해 택한 영화. 영화는 그저.. 평범한 러브스토리? 
1,이 영화가 어떻게 평점이 9점이 넘을 수 있지? 제발 장난으로 평점 주지 맙시다! 
1,정 할 일 없을 때 보세요 
4,그저 그런... 
