score,review
9,삭막하고 추악한 인간의 삶. 현실과 상상을 오가지만 상상마저도 추악하고 기괴하다. 인간의 머리는 지우개가 지우고 남긴 쓰레기처럼 쓸모없는 것인가 
9,데이비드 린치는 천재다. 
9,남의 해괴하고 독특한 악몽을 엿본 느낌...;; 
10,처음엔 역겨웠다 다음날 아침 닭도리탕 먹기가 역겨웠다 근데 지금 또 보고싶다 
10,린치영화를 좋아하는 인간은 기괴하면서 멋있는 인간이 많다. 
9,이해가 아니라 느끼는것이다 
8,이걸 만들려고 5년이나 노력한 노력은 가상함. 그리고 이걸 본 내가 대견함.. 
10,이것이 바로 영화의 힘이다. 
6,독창성은 인정하나 정말 무슨 영화인지 모르겠다. 
10,그로테스크한 기괴함. 악몽과 현실의 모호함. 이해불가. 그냥 느껴라. 
8,충격적이고 소름끼치고 기억에 많이 남는다. 명작의 조건에 이정도면 충분하지 않을까? 
10,마음에든다 
10,상상과현실사이☞ ⓒⓞⓞⓛ 
10,'끔찍한 것'이 뭔지 알게 됐다! 
10,후유증이 대략 일주일정도 간다..대단한영화 
4,"미안하지만 나는 점수를 후하게 못주겠다. 산업사회의 어두운 단면을 끔찍한 이미지로 연출한 것 같긴 하나, 너무 역겹다. "
7,표현의 한계를 넘어 극한의 세계로 이끄는 악몽의 블랙홀 
7,딱히 무서운장면이라거나 혐오스런 장면이 강한것은 아니지만 흑백영상과 들려오는 효과음에서 느껴지는 역겨움은 있다. 사실 그럴싸한 해석들로 사람들이 있는척을 하지만 내가 볼땐 그냥 데이빗린치가 그저 기괴함을 보여주기위해...
8,이거 영화공부할때 봐야한다고 해서 봤는데요 ㅎ 
8,1996년경 소위 '컬트영화'라는 것이 붐이 일었었다. 그때 비디오로 출시 되어서 볼 수 있는 행운을 얻을 수 있었다. 가끔씩 붐이라는 것이 좋을 때도 있다. 
9,이 정도는 되야 컬트라고 할 수 있지!! 
10,꿈과 현실이 만나면 이렇게 되는듯 
10,걸작이다 
10,모호함 자체가 매력인 영화 
10,구역질이났다...한편의 흑백악몽과도 같은 기괴한 연출력! 불쾌함의 대명사 데이빗 린치답다.. 
9,15년전쯤 이영화 첨 봣을때. 난 이영화 정말 무서웠다.... 
7,"이딴 영화를 만드는데 그 많은 노력과 시간을 쏟아부었다고? --; 처음부터 끝까지 스토리라곤 없는 영화. 내가 이해를 못하는게 아니라, 영화 자체가 이해를 불허한다. "
5,솔직히 나도 잘 모르겠음 이거;;;; 
1,이런 혐오동영상을 영화라고...괜한 호기심에 본 내가 잘못이다... 
4,개인의 추상적인 생각을 이해할순 없다 
7,너무 난해해서 도대체 무슨 내용인지 알 수가 없다. 
4,난해하고 어렵다. 불쾌하지만 그것을 다루는 방식이 섬세하고 예술적이다. 
10,몸이 아픈데 갔다가 더 아파져서 오늘 예매 다 취소ㅠㅠ 
10,린치의 데뷔작이자 베이컨의 영향을 받은 작품 
5,보는 내내... '이게 대체 뭐야....'하고 생각했다. 이해 불가능의 영화. 
7,"몇번을 봤지만, 설명하기 힘든 영화, 각자 보고 느낀게 답이겠지, "
2,도대체 린치는 이 영화를 무슨 생각을 가지고 만들었을까 
5,글쎄..잘 모르겠다 
8,계속 생각나게 만든 영화 
10,선택권이 없는 자의 무기력한 죽음이 닿는 곳은 어디일까? 
6,애초 의미 해석따위 할 내용은 없다. 그저 시각적인 부분만 즐기면 되는 영화. 
10, 애새끼 죽이고 싶음 생긴것부터 개빡침 ㄹㅇ 내가 헨리였으면 찍어 죽였을듯 진짜 크로테슼크 하고 기괴함 소리 높여서 보면 무서움 난 일부러 소리줄여서 봄 
6,당시의 천재적 연출은 오늘날엔 철지난 묘사법 
7,"기분 불쾌하지만, 린치팬이라면 볼만함. "
8,스크린으로부터 눈을 돌리게 만드는 순간들  대단하다 
7,흑백에 담긴 데이비드 린치 식 오컬트. 
5,보고나면 제목처럼 머릿 속에서 지우고 싶어질 것 
10,모든 프레임이 아직도 기억난다 
9,"불안과 공포, 린치의 악몽은 이렇게 시작됐다. "
10,이해하려 해봤자 소용이 없는 것인가?(역사적인 영화는 평점의 의미가 없으므로 그냥 10점으로 함) 
8,이해가아니라 느끼는건데 이해하기 포기해서 느낄라고라도 하는것인듯.. ㅎㅎ 마지막음악이맘에드네여 
7,1977년도에 이런 기괴한 영화를 만들었다는게 참 대단하다. 한번쯤 볼만한 영화로 추천! 
10,한시간반 왜케 빨리가지 
10,상상이 꼭 아름다우리라는 법도 없다. 그런 면에서 린치는 상상력의 대가다. 
10,압도적인 이미지의 데이빗 린치 데뷰작!  인생이라는 악몽에 대한 영화! 
7,솔직히 무슨 말을 하는지는 모르겠지만 공포스러움에는 의심의 여지가 없다. 
8,악몽 그자체를 보여주다 
8,역시 린치의 컬트영화 
10,더 말해 무엇하나! 데이빗 린치 작품 중 단연 최고다. 
7,그냥 봤다. 
10,확실히 어렵다.. 역시 린치구나 
10,내가 본 영화 중에 가장 천재적인 영화 같다 
8,너무어렵다.. 데이빗린치영화는.. 
8,어렵다. 데이빗 크로넨버그의 네이키드 런치를 봤을때랑 같은 느낌과 생각.. 
9,이 감독 영화는 한번봐선 안되겠다. 그래서 끌린다. 
7,이해를 구하지 않는 독보적인 그로테스크. 
10,충격과 공포다. 씨발! 
10,아직도 흑백톤의 공장길을 걷는모습이 생생하다 
7,내가 이 영화를 이해하기 위해 다시 볼 수 있을깝쇼.. 
8,여태껏 경험하지 못한 해괴함이다. 강렬하게 흡입하는 스펀지 같은 영화. 
8,공간으로 빨아들이며 체험케 하는 악몽의 시간 
10,이영화는 자신만의 해석밖에없다 
9,"악몽으로의 초대. 심한 감기몸살 상태에서 꾼 꿈. 달리, 베이컨, 그리고 린치. "
10,"""천국은 모든것이 좋아"" 주인공은 현실세계가 싫었던 모양이다. "
7,"기괴한 영상, 그런데 컬트를  모르겠다...... "
10,시종일관 음울한 분위기와 기괴한 사운드. 대작. 역작. 명작. 
8,힘들다. 린치 영화좋아하는 나에게도.마음 편히 볼 컷이 하나도 없다. 
10,재밌어 
9,기괴함과 다른영화엔없는 느낌.대신 감독의정신세계는 여전히 이해하기가어렵다 
10,b급도 이정도면 본좌급 
7,인간의 본질에 대한 이야기 데뷔부터 남다랐던 린치 
10,충격적인 상상력이 발휘된 컬트의 고전 
10,"지루함, 공허함, 좌절감, 그 모든 것을 날려버리는 그 무엇인가. "
10,"극단적인 현대(기술)문명 비판, 죽음충동으로 가득한 끔찍한 악몽. "
9,"허무함, 지루함까지 날려버리는 그로테스크함 "
8,꿈과 현실 그리고 천국과 지옥이 끔직하게 뒤틀린 세상풍경 
8,메세지가 흐릿하다. 이미지는 기괴하다. 문자 그대로 cult. 
10,그래 가끔 하늘이나보자 
9,말그대로 악몽. 그러나 묘하게도 이 영화 마음에 든다. 
9,아이가 태어났다..그리고 내 기억엔 흑백의 추한 마릴린먼로?.. 
9,"반의도적인 지루함, 나와 코드가 너무 잘맞아~ "
9,1/16배속의 답답하고 끈질긴 악몽. 
8,이보다 더 기괴할수 있슴 나와봐...악몽의 90분.. 
10,허무함과 그로테스크.. 
8,보는이에게 끊임없이 질문을 던지는.. 
10,이해 안가는게 너무 재미잇다 
4,'르느와르'가 아들에게 원했던 것이 바로 이런... 
10,역시 오컬트의 교과서!! 
8,깰수 없는 꿈을 보는것 같은 영화. 
9,마지막에 진짜 지우개가 되다니!! -ㅁ-)=b 
8,"혐오스럽고, 심리적으로 불안정하게 만드는 영화이다. "
8,"약간 난해하지만, 시각과 청각을 압도한다. 컬트의 새로운 시작 "
7,이보다더답답한영화는 '희생'과 비견해 보기에. 없다. 다시는 
7,"린치영화는좋아하는데이건좀, 강렬한포스터의유혹 "
7,재미있고 없고를 떠나 독특하다. 
10,지루하지만 영화사에 기억될 작품. 
9,오래전 봤는데 기기묘묘한 노래땜에 잊을 수 없는 영화. 
10,프로이드적 악몽을 너무 생생히 표현한 묘한 매력이 있는 걸작 
9,"린치의 데뷔작을 본 것만으로 만족, 2번 이상 보기는 힘들다. "
9,록키호러픽쳐스쇼와 비견되는 컬트의 명작 
9,역겨움과 지루함. 그러나 흔치 않은. 그게 감독의 의도다! 
9,이해가 안되서 점수 많이 줬네... 
9,중학교시절 봤다.물론이해할수없었다. 그러나다시보고싶다. 이런영화 정말없다 
8,절대 혼자 불꺼진 방안에서 보지 마세요. 가위에 눌릴 듯한 영화입니다. 
7,뭔가 어둡고 답답한 페쇠공간에 갇힌 느낌 의 영화 
10,모호함. 난해함. 역겨움.. 지독스러운 컬트영화 
4,모든 게 괴상하고 이해할 수 없는 세상 속에서 이상하리만치 평범한 남자. 그의 머릿속엔 무슨 생각이 들어있을까? 생각하며 보았다. 주인공 헨리의 머리 속 깊숙한 곳 어딘가. 병들고 아픈 듯이 보이는 남자가 레버를 당...
9,처음부터 끝까지 시종일관 기괴함의로  중무장한 영화..볼수록 사랑스러운 영화.. 그래도 뭔가 개운치 않은 작품 
10,"10분 간격으로 울었다. 모든 샷들이 우울을 대변, 형상화했고 나는 공감하지 않을 수 없었다. "
1,잠이 솔솔솔~ ㅎㅎㅎㅎ 
4,대부분 높은 평점은 이해가 아니라 느끼라고 하던데.. 너무 느낀걸까 마치 나를 보는 것 같아 너무 무섭고 미칠 것 같다 
9,영화를 공부하는 사람이면 꼭봐야하는 작품인데 역시 어려움 
1,소음 때문에 잠조차 잘 수가 없었다. ㅤㅅㅞㅅ!! 
9,기괴하지만 무언가담겨있는것이 충분히 감지됀다..영화내내 웅~소리에 귀가즐겁다 
8,"자본주의 사회에 대한 통렬한 비판,혹은 현대문명에 대한 은유.기괴하다. "
5,그저 불편하고 기괴하게 만들어보려는 철지난 포스트 모더니즘이 낳은 허세. 
1,보고나서 한달은 이유없이 메슥꺼림에 괴로웠음. 다시는 보고싶지 않음. 대체 뭐가 천재의 기준인건지? 
10,70년대 영화라고 믿겨지지가 않는 수작... 
6,원래지루한거 잘보는데..이내용을 굳이90분으로 만들필요는없잖아요?독창성에만점수를 
10,뱉어지는 것과 추악해지는 것들. 순환되는 악몽들. 공포의 유산들. 그 모든 것과 모두들의 우주적 고독에 대해. 
10,재미있다 나중엔 진짜 약간 코미디적인 요소도 보인다는.. 남자 너무 답답 
10,이 영화에 '기대'와 '예상'이란 게 무슨 소용이 있을까 
10,사람이어서 기쁘다. 
7,이미지의 네러티브가 꼭 꿈을 꾸고 있는것 같다 
7,말이 필요없는 쓰레기 영화!!! 
10,날 것 그대로의 악몽. 꿈의 논리가 현실을 지배한다. 
8,아하... 린치미학. 엠비언스가 특히나 마음에 들었다 
8,이건 걍 잼있었음!!^^ 
6,몇 번을 봐도 도무지 이해가 되지 않지만 결코 졸작이라고 치부할 수 없는 영화 
5,이게 뭐야??? 
8,현대 남성의 가장 근원적인 공포를 자극한다. 나는 준비가 하나도 되어 있지 않은데 (그리고 사실 될 마음도 없고 되고 싶지도 않은데) 아비가 되어야 하는 바로 그 공포. 
6,실수로 가지게 된 아기가 괴물로 보일만큼 무서웠던 한 남자에 대한 이야기. 명성은 익히 들었지만 정말 난해하고 징그럽고 혐오스럽기까지 한 표현들을 보며 얼마나 아기가 두려웠으면 그랬을까 하는 측은함까지 들었다. 
3,지루해서 미침. 성스러운피가 100배는 재미있다 
1,"1점이 아까운 영화. 이 감독은 포스트 모더니즘 장르를 얼마나 시청자에게 불쾌감을 줄수 있는지로 파악하는듯함. 동시대에 나온 에일리언, 블레이드러너 등에비해 형편없는 전개와 중2병넘치는 소재... 왜 이런 영화가 요..."
1,흥미도없고 공포도없다 재미라곤 조금도 없는 쓰레기 영상물 
1,외계인의생활을표현한것같은데천재는개뿔 상상력이부족하면만들지를마라 
2,린치의 장편영화 데뷰작. 한마디로 치기 어리고 파격적이고 싶은  작가적 편린으로 가득하다. 린치도 걸음마는 아장아장이었다. 
