score,review
10,포스터만 보고 이 영화를 판단한다면 큰 오산. 
2,소재를 잘 가져다 놓고는 제대로 조리하지를 못한다 
8,"""기억을 잊는 이유는 현재에 충실하기 위해서"" 정말 와닿는 말이다. "
8,정말아기같은표정의남자주인공.포스터만보고 판단하지 마시길 
10,너무 귀여운 영화 .그러나 포스터가 망쳐놨더다 
10,주인공이 아기같이 순수?! 
8,"케이블로 보다가 다시 봤다. 철없을 때 봤을 때와는 사뭇 다른 느낌을 받았다. 배우들 연기도 좋았고, 비쥬얼도 정말 좋았던... 순수한 사랑이 있다면 하고 싶다. "
9,남자가사랑스럽다 ㅋㅋㅋ 
8,poster가 영화를 망치는군요. 
10,프랑스 다운 프랑스적인~ 
10,글쎄... so so 평점 5.0 
8,여주인공 이쁘네~~~ ^^ 
8,"이영화는 대체 왜 포스터를 이렇게 만들었지? 전혀 그런류의 영화가 아닌데, 정말. 순수하고 잘생겼다 남주. 내용도 좋고 "
10,노리에가의 거부할수 없는 매력. 
10,포스터만 보고 영화를 보는거라면 큰 오산. 이 영화는 ‘순수’한 것이 뭔지 보여주는 영화다. 역시 Msg없는 담백한 프랑스 영화는 언제나 옳다. 
7, 이렌느 진짜 예쁘네  ..프랑스영화는 문화적이질감이 있지만 재밌게봄 
10,내스탈임 존나 맘에듦 
7,순수함은 모든것을 끌어당기는 거부할 수 없는 중력과도 같다. 
10,프랑스영화치곤잼난다. 
9,의외로 내 스타일인 영화를 만났다. 
8,그냥 재밌다. 노리에가 역시.. 
8,스토리가 흥미진진 남자배우 굿 
10,노리에가 멋있고 내용보단 표현 방식이 신선하고 좋았다. 
6,Novo 
10,
10,기억이 없는 사람에게 배신이란 없다. 
8,살면서 필요한 기억은 때로는 없는게 좋을 수도 있다. 
1,이게 뭐여? 평점에 낚였네 
9,"카프카의 소설처럼, 혼돈 속에서 정체성의 뿌리를 파헤치는 작품.자아인식과 사랑 사이의 연결점을 다루는것으로 이미 대단한 영화다.드라마틱한 내용도 없고,현실적인 결말 속에 중요한 정답을 제시한다.영상의 색감이나 배우들..."
6,기억과 사랑에 대한 인상적인 이야기. 
10,정말 매력적인 영화. 여운이 오래가고 남자친구가 보고싶다^^ 
6,그럴듯한 대사를 내뱉지만 연출면에선 말하고자한 주제를 제대로 정리못한채 횡설수설하는 느낌. 그럼에도 소재와 이야기 덕분인지 영화가 묘하게 매력적임 
10,프랑스 영부인의 리즈시절을 볼 수 있습니다. 
7,"문화,정서적 이질감이 없잖아 있지만... 조용히 끝까지 몰입하게 된다. "
6,"망각을 이용해 섹스하는 여자, 망각을 치유하기 위해 섹스하는 여자 "
10,순수란 단어 노보-순수한 사람이 매력적인 여자를 잡을수 있다 
10,암튼 사람 이용해먹는건 나쁜짓 
10,아 안개낌 ㅅㄱ 
10,영화 좋은데요.. ㅎ 
3,"몸과 기억, 치유의 하나됨을. "
6,"정확히 3년전에 봤는데, 이런걸 다 보는사람이 있나. "
9,모르는게 약일수도 있다는 생각..재밌게본 영화.. 
6,시간많을때 볼만하다 
1,영화 해설을 보고나서 무슨영화인줄알았따 
10,이영화...생각보다 참 느낌이 좋다~18세영화지만...나름대로 순수해~ 
10,유럽영화를 좋아하신다면 정말 재밌는 영화 
10,한 순간도 놓치고 싶지 않은 소중한 영화! 강추!! 
8,영화 좋다 ㅜㅜ 
10,망각... 순수......?! 
8,자유를 느끼고 싶다면~ 
7,글쎄.. 
9,"기억상실에 관한 또 다른 생각, 진짜 같은 거짓 같은 진짜 "
7,내가 좋아하는 스탈이긴 한데 완성도나 재미면에서 다소 부족 
6,볼거 없을때 보삼~~ 이렌느 짱~ 
8,기대 이상 
8,망각이란거 참.. 씁쓸하네요 
3,배우들은 괜찮다. 지루하다 
7,메멘토의 로맨스버전(?) 가볍다못해 날아갈것같다. 
10,최고!!!!!!!!!!!꼭 감상하세요. 
5,비디오겉표지보고야할줄알았는데황당한영화였다 
10,그래함을 향한 예쁜 이렌느와 앙투완 사랑이 너무 아름다움 
7,프랑스영화는 왜 다 이렇냐-ㅁ- 
6,진정한 자유인이란 이런것이다... 
10,재미나던데... 하나씩 드러나는 진실도.. 
6,주인공의 기억력만큼이나..깝~깝한영화..쓸데없는 노출이 꽤~ 
9,기억을 잡아둘 필연성은 없다. 그러나 자신만의 눈은 필요하다. 
7,순수와 사랑의 방식에 대한영화. 음악도 장면도 등장인물들도 매력적. 
3,빈약하지만 장면만 보면..어느 정도는~ 이렌느 멋지다. 
10,이렌느의 귀여운 음모에 10점 
3,억지덩어리.. 끙~ 
8,과거의 망각은 현재의 사랑에 충실할수있는 수단 
6,기억할수 없다면 뭣을 하건 용서가 된다!? 
9,사랑과 기억에 관한...강추 
9,이뿐 영화~^^ 
2,당췌 뭔 내용인지 모르겠다. 
7,사랑은 시간을 잊는것이면서 언제든 끝날수 있다는 점을 기억하는 것이다. 
6,특이한 유럽애들의 영화.섹스 중독자들 
7,순수한 사람이 참 잘 쑤시고 다니네. 
8,컨셉은 좋았으나 결국 그만큼 아쉬운 
8,메멘토랑 헷갈리지말자. 이 남자가 사는법을 주목하라 
8,과거의 망각은 현재의 사랑에 충실할수있는 수단 
6,기억할수 없다면 뭣을 하건 용서가 된다!? 
9,사랑과 기억에 관한...강추 
9,이뿐 영화~^^ 
2,당췌 뭔 내용인지 모르겠다. 
7,사랑은 시간을 잊는것이면서 언제든 끝날수 있다는 점을 기억하는 것이다. 
6,특이한 유럽애들의 영화.섹스 중독자들 
7,순수한 사람이 참 잘 쑤시고 다니네. 
8,컨셉은 좋았으나 결국 그만큼 아쉬운 
8,메멘토랑 헷갈리지말자. 이 남자가 사는법을 주목하라 
