score,review
10,지난 날의 내 모습을 쏙 빼닮은 베티. 관람 내내 떠오르는 그가 아직 내 기억에 있었다. 보고싶더라. 잘 살고 있는지 이젠 궁금하기까지해. 
9,조그같은 남자 어디 없나..베티는 행복한 여자.. 
1,나만 이해가 안가는거야?어쩜 열광하는 평점밖에 없지?세시간이 너무나 지루했고 답답함. 사랑스런 베티? 아니다. 이기적인만큼 본능에 충실했다 보지만 여자인내가 보기에 그런건지 아님 낼 모레 마흔이 다되가는 내가 예술영...
1,어음....그러니까 아기를 잃어서 미쳐서 눈판거맞죠..? 뭔개연성이;;; 
10,"내 인생 최고의 영화, 그토록 너와 같이 보고싶었던 영화 "
7,"예술가적 감성의 폄범한 여자, 냉정하지만 예술가적 감성을 가진 남자의 비극 "
10,시간이 흐른뒤에도 명작은 명작이었다. 20대에 봤을때와 시간이 흐른 지금 에 본 사랑에 관한 영화는 언제나 색다르 네요 
10,"뜨겁고 황홀한 사랑, 러닝타임을 통틀어서 베티라고 할수있는 3시간이었다. "
10,그들의 사랑 너무 아름답다 여운이 너무나도 깊고 깊다.. 
8,사랑하나만보고달려가는그들 
10,진정한 사랑을 일깨워 준 영화 
10,여자라면 모두 한 번 쯤 꿈꾸는 사랑. 광기에 젖은 사랑 
1,청소에는 일가견이 있는 부담스러운 여주와 너무 벗고다니는 남주.. 눈썩음 
10,"내 앞에 앉아있는 약간 덜떨어지고 순수한 사무직 여직원이 베티같아서 맘에 든다. 비록 사랑하진 않지만, 유교에 찌든 우리들은 어쩌면 이런 여자에게 탈출구를 느끼지 않을까? "
2,미친년이 OO하는 영화 
10,"생명력 넘치는 사랑, 그리고 영화 "
9,베티에게서 나의 모습이 보였다. 온 세상에  내 사랑만 존재한다고 믿는 순수하고도 멍청한 사랑  지금만 할 수 있는 사랑이겠지. 나만의 하얀 도화지에  처음으로 뿌려진 노란색  칠은 영영 지워지지않겠지.. 
10,정말 미쳤다. 나도 미치고 싶다. 
10,미친 영화!! 봐야만 하는 영화. 
10,거의 20년만에 다시 봤다.프랑스인들은 진짜 사랑을 할줄 아는거 같다.조르그의 끝없는 사랑에 마음이 숙연해지고~~장 위그 앙글라드의 최고의 연기!!! 
10,나도 이런 사랑을 할거야 
6,"아기와 함께 둘만의 낙원을 만드는 결말을 워했지만, 결말이 주인공  남자가 베티를 죽일 줄이야... "
