score,review
10,슬픈여운을주지만 이런사랑을 해본 사람은 행운아라고 해야 옳을것이다. 
9,세상엔 두 사람만 있다.. 
9,사랑의 온도를 체험하지 못한 다수의 '36.5'도의 사람들에게 
9,행복해지기에는 너무 뜨거웠던 그녀. 
9,"의미는 각자 몫으로 돌리고 일단 재밌는 부분이 많아서 좋습니다. 그렇게 지루하진 않게 봄. 너절하게 ""사랑은 이게 맞아, 저게 맞아"" 고상한 대사만 주구장창 읊조리는 영화보다 나음. "
10,정말 대단한 영화다.. 정말이지.. 대단하다.... 
7,원제 37. 2는 아이를 낳기(가지기) 가장 좋은 (자궁의) 온도라는 의미를 가지고 있다. 
10,매 순간 순수함과 열정이 느껴지는 영화.. 
10,저렇게 헌신적인 남자의 사랑이 있을까?? 슬프지만 아름답고 따뜻한 사랑. 
10,영화를 본 내내 잊혀지지가 않는다.  베티와 조르그가 함께 친 피아노는 서툴지만 아름다웠다 그들의 순수함으로 가득찼던 사랑처럼... 
10,베티 블루의 블루란 단지 파란 바다나 시원함이 아닌 광기와 열정. 
1,"사랑이라는 이름으로 위태한 남녀가 온갖 민폐,범죄 다저지름. 루프껴놓고 임신안됐다고 미쳐버리는 주인공 케릭터도 전혀 공감이 안됨. "
8,베티의 사랑을 감당할 수 있는 사람은 오직 조르그 뿐일듯.. 
8,여자가 왜 미친건지 모르겠다. 
10,석양을 선물 받고싶다. 
10,숨막히는 영혼의 해방 
10,난 내얼굴에 고추장을 묻힐수 있는가? 
10,말이 필요없는 영화. 무조건 보세요 
10,베티에 대한 조르그의 가슴깊고 아픈 사랑이 느껴지는 영화.볼때마다 눈물남. 
10,계속 여운이 남는 영화....ㅠㅠ 3세간이 절대 지루하지 않은 영화..계속 생각나 베티 
10,남자와 여자가 할 수 있는 가장 미친 짓은 사랑 
5,"살인마 한정민이 이 영화보고 지 판타지를 만들었나보네요. 개 이름은 베티에 지 아이디는 jeju372, 블로그 배경화면도 베티블루 포스트, 인스타 태그도 37.2... "
10,"20OOO 2월 8일 새벽, 대한민국 제주도 쏘쏘 게스트 하우스에서 일어난 살인사건의 용의자 한정민은 이 영화를 모티브로 살인을 계획했다고 함. "
6,둘 다 정신병원 좀 가보라고! 보다가 답답함. 
9,프랑스 영화의 자유로운  사고에  경의 
6,다수가 인정하기엔 난해한 영화. 정열적인 사랑이라는 표현도 좀 안어울리는듯.... 
10,전혀 불가능하지 않은 사랑이다.가슴이 뜨거워지고 메여오고 먹먹하고 너무슬프다 
2,너무 무섭다.. 
10,완전히 미친 나머지 나까지 미쳐버린 최고의 영화. 
10,비극속에 희망이.강렬하지만 부드러운.어렵지만 쉽게와닿는.여운이 아주 긴 멋진 영화 
7,이건 사랑에관한얘기가아니다 그냥 정신병걸린여자와 불쌍한남자의 파멸이야기 여자꿀밤때려주고싶다 남자 답답해죽겠다. 
10,원해도 얻을수 없는 것에 대한... 허락되지 않는 것에 대한... 
10,10점 그 이상.......아주 드물게 마음에 드는 영화네요.. 
1,유명한 영화 포스터에 혹해 봤으나 여자 주인공 때문에 전투력만 상승하는 영화였음. 괜히 감독판 봤음. 진짜 개인적으로 안 맞았음 
1,본능에 충실한 사랑일뿐 그 이상도 아니다.. 전혀 아름답지 않음 
1,타인의 입장은 생각하지 않고 자기 꼴리는대로 행동하고 타인에게 피해주는 민폐들의 사랑. 지나친 감정표현이 불편하고 역겹다. 베티는 경제력없이 부수고 사고나 치는 파괴의 여신. 이런 사람과 엮이면 100% 패가망신. ...
8,이해할수 없다가도 공감가는 베티라는 여자.. 
10,"일종의 위악적 낭만이지만, 좋다! 그 색감과 온도만으로도 - "
10,최고..배우들이 감정표현하는연기를 잘한듯 
10,아담과이브 주인공이 왼손잡이다 
9,"덜렁덜렁 훌훌 벗은 모습이 자연스러운 영화,미친 사랑이 딱 어울림, 서로에게 더없이 그리운 존재. "
10,쥬뗌므... 
10,86년도 영화 난 87년생 ..영화는 그영상안에 내가 들어가잇어야 할정도의 몰입도가 중요하다 생각한다  난 그시대 그들과 함께 행복을 알았으며 슬픔도 같이 했다 최고 !명작품!! 
10,아가페. 이런 사랑이라면 받고싶다 
10,영화 색감이 좋았습니다 
2,자유분방하고 미친 사랑은 공감도 되고 부럽기도 했지만 베티의 광기어린 행동들은 영화를 보는 내내 불편하게 했다. 3시간 가까이 되는 러닝타임동안 나는 끈기가 필요했다. 
6,둘다 정신병원 가야 되는거 아냐 
2,마초 아재가 섹스 판타지와 미소지니와 사랑에 대한 자아도취로 만들어낸 비이성적이고 무논리 영화. 정신병에대한 편견은 덤 ^_^ 
5,제주도 게하살인사건 모티브.. 
9,푸르게 타오른다. 
9,베티의 과거가 궁금하다 
10,"지나칠 정도의 순수, 파멸, 구원. 모든 것에 공감간다. "
10,이해 할수 없는 사랑을 열정적으로 보여준 영화 
10,가슴저밈이 뱃속깊숙히부터 올라온다. 
10,"미친 사랑, 미친 그들을 견뎌내기엔 세상은 너무 속좁을 뿐 "
1,거품중에 이런거품은 없었다. 뻐꾸기둥지위로날아간새는 숭고했는데!! 
1,평점이 좋아 봤지만 정말 짜증나는 영화임~ 
1,또라이련 발광하는 영화 
1,남자친구가 입원한 여자친구를 병원에 잠입해서 암살하는 영화. 내가 본 첩보영화중에 최고였다 
10,두사람에겐 이 세상이 너무 답답한 곳이라는 것이 슬프다. 
10,베티블루.. 정말 오래도록 기억에 남는다. 블루.. 베티블루 
10,아 코메딘줄 ㅋㅋㅋㄱ중간중간에 계속 웃엇다 진짴ㅋㅋ 
10,너무 사랑스러운 베티 그런 베티를 가장 찬란하게해주는 조르그 ㅠㅜ 
1,"남배려모르고,성격포악,나중에는자해하는 게다가지루함 "
1,보는 내내 답답했다.정말 사랑한다면 자기 여자가 이상한걸 알면서도 방치할수 있나?? 
10,"그들이 사는 세상엔 두사람 말고는 아무도 없다. 색감, 연출,소품마저 스랑스럽다.바람부는 언덕에서 함께나누는 대화는 정말이지.. "
9,뜨겁게시작해서 차갑게 식은 운명 
10,"영화가, 대사가 아니라 색과 사물의 배치.배우의 표정과 사물의 배열들을 통해서도 전개될 수 있다는걸 보여준 영화.내 인생의 영화.첫번째. "
8,"베티의 통제,구속되지않는 야생마 같은사랑! 그 사랑을 지키려는 남자! "
10,사랑사랑사랑!! 
10,"샤를 4세, 롤러, 조르그.. 당신의 연기는 최고다, 영원히 함께야 너희 둘.. "
10,무어라 말하기 힘든..사랑이 느껴지다.. 
6,개연성 개나줬는데 너무 자유로운 영혼들이라 신선함을 줌 색감이 괜찮은 영화 
10,아름답고 비극적인 사랑영화 
5,마지막 베티가 침대에 누워 허공을 보는 눈빛은 너무 섬뜩했다. 
10,평생토록 기억에 남을 사랑영화... 
10,"사랑,사랑, 사랑, 그것은 뜨겁다. 하지만 데여도 아름답다. "
9,고흐가 귀를 자른 이유는? 
8,놀랬다 저런 여자... 놀랍다 저런 남자... 
3,처음부터 비극의 끝자락을 향해 달려가는 것 처럼 
3,어렸을 때 봐서 그런가..만든 사람들에게는 미안하지만 더럽다는 기분이 남았다. 
10,불가능해서더매혹적인 미친사랑 
7,휘발성 여인 베티와의 히스테릭한 사랑. 끝까지 헌신한 조르그. 
1,오 예~~ 열라리 지루한데~~ 
1,전체적으로 어설프다. 
6,잘모르겠어요 이것도 사랑이라고 부른다면 각자의 사랑이 있는거니까... 
9,1988년 개봉 당시 무려 85분이 잘려나간 채로 국내 개봉 
10,지독한 사랑이야기.. 
10,취한다 
8,"그들의 사랑도, 보는 관객도 고통스럽다 "
9,베티 나의 베티...내 사랑과 나의 그림자. 
10,"영화도 영화지만, 영화보다 포스터가 더 유명한 영화. "
10,"미움,사랑은같은 감정이다. 미울수있지만사랑할수있는또다른모습 "
7,"혜은이의 열정이란 노래가 떠오르는 작품.가슴터질 듯 열망하는 사랑, 사랑때문에 목숨거는 사랑.같이 있지 못하면 참을 수 없고 보고싶을 때 못보면 눈멀고마는활화산처럼 터져오르는 그런 사랑.. "
7,물흐르는 듯한 전개와 어색하지 않은 과감한 노출연기 아름다운 프랑스 배경은 좋았으나 프랑스 영화 특유의 오버는 여전히 어색하네요..호불호가 갈릴듯 합니다 
10,웬지 이해할수있을것만 같다. 
9,경계성 인격장애... 정신병원에서의 쇼크상태는 약물때문이다베티는 억울하게 타살당한 것이다 . 
9,불같은사랑은 그을림을 남긴다. 
7,두 남녀의 지긋지긋한 광적 사랑 
10,베티를 안아주고 싶었다 ㅠ 
8,다들 그냥 개솔하는데 그냥 매췬뇬이야 이건 다들 정신차려 크크크 
4,이제 와 보니 좀 유치한듯한.. 
10,우리가 지나치는 사실들을 그녀는 하나도 지나치지 않았을 뿐이다. 결국에 남자도 그녀가 원하는대로 해주었다. 
10,내 평생 기억될 영화 베아트리체달 
8,1986년에 이런 영화를 만들다니 프랑스다운게 어떤건지 알 수 있는 영화. 음악과 색감이 좋았음. 
9,어렸을땐 그냥 야한 영화인 줄로만... 
10,정말 뜨거운 사랑은 슬픔과 위험이 따른다 
10,"관능적이고 매혹적인 여자가 아무리 광기를 부려도한없는 사랑으로 커버할수 있는 남자의 의지그게 과연 사랑의 힘인지, 아름다운 여자가 가진 본질적인마력인지... "
10,영화 사이사이 석양과 나른하고 쾌청한 하늘 바로 이게 사랑인듯싶다 
10,보려했는데 못봤음 큰화면으로봣으면좋았을 듯남자가여자를 더사랑한건지 여자가 더 사랑한건지의견이 분분하다 
10,"2000년에 개봉 했을 땐 십대라서 못 봤고, 2007년인가 20 대 중반에  봤었는데 보고 난 다음에 드는 생각은  내 나이 마흔 전에 저런 사랑을 해 볼 수 있을까 하는... 아무튼 묘한 영화 ㅋㅋㅋ "
10,!!!!!!!!!!!!!!!!!!!!!!!!!!!!!!!!!!!!!!!!!!!!!!!!!!!!! 
8,정말 광적인 사랑...조르그에게 박수를.....베티에게도 애도의 박수를..... 
8,이런 방식의 사랑은 나로선 이해하기 힘들지만ㅡㅡ 새롭고 충격적이었다 
8,적지않은 충격...... 
8,안타까운 내용의 영화 
10,Good 
8,불완전한 연인의 완전한 사랑. 
7,난해해요 
10,숨막히는 사랑.. 정말 너무 슬퍼서 아름답다 
7,"37.2도를 넘어 펄펄 끓는 뜨거움, 통제도 이해도 안 되는 베티의 묘한 매력에 빠지다 "
10,사실적인 손... 
10,나에게도 베티같은 여자가 있었다. 그녀가 미치지 않아줘서 정말 고맙다. 
7,베티를 이해할수 없다 그렇기에 아름답겠지만... 
8,"국산 ""그녀에게 잠들다""가 이 영화 어설프게 따라 했다가 망했잖어 "
10,사랑의 온도는 37.2' 
7,7점 ~8점이 적당 10점은 말 안되는 점수 
6,사랑을 표현하기엔 길기도 짧기도 한 세시간 
10,지독한 사랑 
9,포스터의베티는무얼 그리 생각하고있을까? 
10,슬픈 베티블루~~~~~~~~~~~~~~~~~~~ 
10,이 영화 안에서 허우적댄 나의 20대. 
3,좀어렵당 
8,그냥 그저그랬음..;; 
10,사람은 서로의 체온을 느낄 때 가장 행복하다 37.2 
9,사랑하는 서로의 온도 37.2 
9,인생영화!!!! 가슴이 먹먹해진다 
10,사는 것 같이 산다.살아 숨쉬다 
10,광적인 사랑 그 자체를 담은 영화 
10,아프고 아프고 아프다... 
10,"두 사람의 사랑은 말로 표현 할 수 없다. 현대인의 감성에, 특히 한국인의 감성에 큰 반향을 줄 수 있는 영화. "
9,"초중반 스토리 전개가 조금지루한감은 있었지만가족마저 스트레스로 우울증을 만들어버리는 경계성인격장애를 가진 베티,그녀를 끝까지 지켜내는 조르그,,현실성이 좀 떨어지긴하지만 ,,오래기억될것 같다 "
6,"7,8점대 "
9,한남자의 인생을 바꾸어 놓은 베티..결말이 슬프지만 여운이 가시지 않는다. 
10,마음이 먹먹해지는 영화...너무나 매력적이고 광적이게 만든다 
10,Betty Blue 37.2 
9,"연탄재 함부로 발로차지마라, 넌 누구에게 한번이라도 뜨거운 사람이었느냐. "
9,이런 영화가 외설이 아닌 예술이지 
9,충격적입니다.... 베티는 끝까지 행복한 여자군요... 
6,내용이 난해해서그런지 주인공들이 미친것같아 보는내내 이해도안갔어요 결국 정신병걸린 여자를 미친듯 사랑하는 이야기네요 왜 평점이 높은지 모르겠어요 배우들연기는 좋아요 
8,사랑에 미치다 
1,개OOO 커플을 아름답게 포장하네. 포장지로도커버하지못하는 썩은내나는 영화. 베티가 불쌍하다는 사람들은 미숙아다. 미친년 지가 살아온삶을 뒤돌아보면 아기생각은 꿈도못꿀텐데. OOOO 영화는 오물통으로! 
8,저런 사랑을 받아본 베티가 부럽다 
10,베티도 조르그를 너무 사랑해서 그렇게 된듯 경계선 성격장애 특성상 상대가 다른 사람이었으면 좌절하지도 미치지도 않았겠지.. 마지막에 조르그가 베티를 죽인것도 결국 사랑이었다고 생각한다.. 삶의 고통을 줄여주기 위해....
10,미친 사랑이라 강렬했다. 일반적이지 않지만 알게모르게 공감되는 묘한 매력. 마지막 장면을 보고 슬픔이 느껴지지 않았다면 몇년이 더 흘러서 다시한번 보길.아직도 남주의 스파게티씬을 생각하면 마음이 아프다.. 
10,미친여자한테 미친 남자의 사랑이야기 
10,사랑에 관한 진한 여운을 느끼고 싶다면 무조건 봐라 
6,지극히 영화적인 사랑. 이 영화의 진가는 멋스런 스타일을 창조했다는 점이다. 솔직히 공감은 전혀 안 됨 ㅋ 
8,결말이 아쉽긴 한데 이렇게 뜨겁게 사랑이 가능하구나 싶었어요 
9,"나도 저들처럼 불같이 뜨거운 사랑을 할 수 있으면 좋겠다. 열정적인 사랑 그 자체가 뭔지 알려주는 영화. ""전부 너에게 줄거야"" "
8,Gabriel Yared 음악과 함께 생생한 두 남녀의 원초적인 사랑이 아직도 뜨겁다. 
10,
9,
2,다 좋은데   옷좀 입고나와라 여자는 위가 덜렁덜렁 남자는 아래가 덜렁덜렁  섹스 미쳐가는여자의 히스테리 또 섹스 또 히스테리 또 섹스 
10,이 세상에 존재하지 않는 걸 바라고 절망하는 베티가 너무 이해된다. 프랑스 영화의 현실적이고 의식의 흐름대로 따라가는 자유로움이 좋다. 
6,위태로운 정신빠진여자를 사랑하게된 순진남의 이야기.. 
10,인생 한번 사는 것. 지나가는 바람처럼 대수롭지 않은 것. 자유롭게 뜨겁게 
8,볼때마다 숨이 턱 막히고 가슴이 답답할 정도로 힘든 영화임 영화후반부 너무 슬펐음 
10,정말 한편의 영화같은.. 영화보다 더 영화같은 그런 사랑이네요...세상에 그 둘만 있는거 같은 영화슬프고 아름답네요. 
10,
6,마지막 남자도죽는줄알았는데 아니였네? 감성은 느껴지고아프지만 뭔가 희안한 사랑?이야기 
10,
1,",,.,.,.,,... "
10,내 젊은 날의 초상같은 영화 
8,나는짱짱짱이엇다!!! 
3,프랑스영화는내가이해하기에는아직무리인듯.... 
10,여자친구가 예전에 보고 너무 재밌게 봐서 다시본거였는데 재밌었어요! 
10,슬픈 여운이 있는 흡입력 강한 영화. 
9,피아노 소리 오랫동안 기억에 남을듯. 
10,사랑 스런 그녀 베티~♡ 
10,베티블루....!! 
9,사랑과 광기 그리고 감각적인 영상 
8,광기로 인한 사랑인지.사랑으로 인한 광기인지.. 
10,극장에서 3번보고  비디오 구입해서 또 보았던 영화 
10,"아, 결국 영화관레서 보게 되는구나. 내 인생 영화 3편중 1편. "
8,37.2 Le Matin 
7,자유로움을 넘어서버린 광기. 그렇기에 더 아름답다. 
8,Betty Blue.. 
10,..... 
10,하...... 
9,마지막 장면에서 너무 떨리고 무서웠다. 여운이 많이 남는 영화 .. 
8,프랑스 특유의 정서와 감각적인 색채를 곁들인 지독한 사랑이야기. 다시 봐야할 영화. 
8,7점주기엔 미안하고 짜게 주는 것 같아서 8점 주는게 적당할 듯 
10,1986년도 영화라 안 믿긴다. 아름다움과 열정.. 마지막까지 긴장하면서 봤다. 최고다 
10,가슴이 먹먹해진다 
9,이런 사랑.... 
10,사랑하면 떠오르는 영화 
10,아.......... 사랑이란 이름의 여행... 
8,사랑에 끝이 있을까? 이해는? 그 안에 무엇이? 
10,사랑한다면이들처럼.. 
7,Good 
8,그런 사랑을 그린 영화는 많으니까 
8,강렬하고 뜨거웠던 열정과 사랑.  37.2' 
10,사랑하던 여자와 보고 헤어지고 보고 기분이 틀리다 
9,베티가 임신을 했어요! 
7,사랑은 집착이고 집착은 파멸을 불렀다 
10,열혈 러브모드~~ 
9,신파를 비껴가는 치열하고 가슴 시린 사랑 이야기 
10,가만히 생각하게 해주는 영화 
9,본능이 느껴지는 베티의37.2체온 공허한푸른바다 차가운병실... 
10,37.2도의 의미? 
10,사랑의 온도.. 
10,사랑이란?????????????????????? 
10,프랑스 영화다운 베테블루 
9,베티.. 
9,잊혀지지 않는 이미지와 피아노선율 
8,경겨성인격장애 여자와 평범한남자의 37.2도 사랑이야기 
8,서로가 있었기에 존재할 수 있었던 두 사람. 
9,내 인생 가장 강렬한 영화 
8,20년이 지나도 촌스럽지 않은 사랑이야기이다. 
8,헌신적인 사랑. 그 끝. 미친 사람과 살면 같이 사는 이들또한 미쳐간다는걸 보여주는 작품. 중간중간의 유머러스함이 그나마 불안한 마음을 웃게함. 
10,아 이건 다시봐도 감동ㅠㅠ엄청몰입하고ㅜ엄청 울었네요 
10,"우리는 무엇이든지 할 수 있다고 믿는 여자, 베티, 더 이상 슬퍼하지 마. "
10,"크레딧엔딩이 다 끝날때까지내 눈물은 멈추질 못했다..파랗게 정지된 엔딩을 한참 바라보고있었음 며칠이 지나도 주인공 둘이 치던피아노 소리가 자꾸 귀에 맴돈다 내인생 영화로 뽑을 영화 단, 진짜 사랑이란걸 해본 사람들만..."
10,이건 걸작이죠. 몇번을 봐도 매력적인 영화 
10,내 인생 최고의 영화... 
9,"처음본게 고딩때였는데, 그때이미 지독한 사랑에 빠져봐서 미친듯이 사랑하고 행복하고 가슴찢어지는 아픔을 느껴봐서인지 당시 그어린나이 임에도 불구하고 이영화는 나의가슴을 후벼팠다. 그리고 성인이 된후에 다시 봤을때, 영..."
10,"사랑의,  완성은 뭘까? "
1,아나 제일 중요한걸 스포당했네 씨1발 진짜...괜히 어줍잖게 스포하면서 아는척하고 돌아다니지 말고 짜져있어라 개씨1발 새.끼들아 이런거 볼때마다 짜증난다 아주 ㅡㅡ 
10,상황이 좋아졌다 나빴다가를 반복..결국 슬픔에 잠기다.주인공의기분을 잘알것같다 
7,이해할 수 없어도 아름답다면. 
8,지독한 사랑.. 
7,이런게 사랑인걸까......뜨겁고 화난다 
8,비극적 <광란의 사랑>. 섹시하고 독특하고 아름답고 순수하고 몽환적인 37. 2도 감각. 
10,진짜 사랑을 느끼게해준 영화.... 
10,"아름다운 영상, 미학적 구도, 미친 사랑 이야기! 강추!! "
10,"베티블루, 아마 평생 잊을 수 없는 영화가 될 듯 "
10,그들의 사랑이 나를 슬프게했다. 
10,개봉때 보고 실망하고 나중에 다섯번 본~ㅎㅎ;; 
10,무모하고 아름답고 강렬하다. 그래서 비난할 수 없는 것 
10,아름답다. 그리고 애절하다. 이걸론 부족할까? 
10,좋았어요 
10,너무나 뜨거웠던 그들의사랑.. 
9,베티를 안아주기에 세상은 너무 좁다 
10,무능한 남자의 여자는 힘들다. 
10,내가 목졸리는듯 느낀 감동 
3,졸렸는데? 
10,"베티 진짜 너무 예쁘다. 다리 다친 야생마, 365일 열병에 걸려있는 여자... 자유분방한 두사람의 사랑 방식이 너무 사랑스럽고 아름다웠다. 그리고 부럽기도 했음. "
10,"한번쯤 해보고픈 사랑, 한번쯤 받아보고픈 사랑. "
10,색감도 이쁘고 80년대 영화라는게 더 놀랍다 베티처럼 사랑에 미칠수잇는 용기가 부럽다~ 
9,점점 쇠약해져가는 베티와 그것을 지켜볼 수 밖에 없는 조그의 안타까운 사랑..슬프지만 온 몸으로 뜨거운 사랑을 하는 그들의 모습이 너무나 아름다웠다 
10,"아름다운 영상미, 순수한 사랑 이야기 "
1,예전에 공중파인가 케이블서 해준거넉요 지루해서 중간에 나옴 
10,"비록 극으로 치닫는 그들의 사랑이 안타깝기도하지만,   숨막히게 아름답다 "
10,지금까지 내 삶에서 가장 큰 감동을 준 영화. 
10,사랑이란 무엇일까? 
9,햐... 베아트리체 달... 무삭제로 봐야만 하는 영화 
9,"무슨 말이 더 필요할까요?영화보고 이틀지나고 글을 남기지만, 후폭풍이 거세네요. "
9,예술로 불릴만한 사랑. 
3,이해가 안되는 여자 ..예술적인 화면과 음악만 볼만함 
6,옷은 벗었지만 에로틱하지 않고 지루하진 않지만 긴장감도 없는 바다색처럼 푸른영화. 
10,나는 이처럼 열정적이고 순수한 사랑을 본적이 없다. 
10,"중독적사랑의 환상에 빠지고싶을 때가 있다. 위악이라도 좋아, 나의 분신같은 쥬뗌므! "
10,베티랑 술 한잔만 할 수 있다면 악마에게 영혼이라도 팔겠다 
6,러닝 타임 세시간의 지루함을 날려준 한시간의 미친 사랑. 
10,마지막이 넘 슬퍼염 
2,포스터는 예술 내용은 포르노~ 
1,"남는기억은 정신병자 베티라는,다른사람에게도 끔찍하다는거 "
3,"남자가 대단,, 답도없네 "
4,제가 예술 영화쪽에 조예가 얕은건지... 전 보면서 무지 지루했네요. 전개도 마음에 안들고... 
6,이게 왜 대단한지 이해가 안간다. 여자는 암만봐도 정신이상자. 뭐하자는거야 
1,광년이 얘기 3시간.. 그냥 둘다 존나 패고싶다. 보는내내 짜증나고 괴로운 영화. 
10,사랑하고 싶다 나도.그들처럼. 
6,내가  좋아하는 영화음악 중 하나.. 
9,"30분 같았던 3시간. 한동안 여운이 남을 것 같다. 로맨스를 좋아하지 않는 나도 분위기에 취해, 주인공들 특유의 성격과 감성에 취해 깊게 빠져들면서 보았던 영화.. "
10,"....,,.... "
7,"둘 다 제정신은 아니지만, 그래서 더 낭만적인 사랑 이야기. "
7,아름다운사랑이야기~~ 
9,재미있고 구성 탄탄하면서도 야한영화 
10,37.2 Le Matin 
9,"아름답기도, 잔인하기도, 쓸쓸하기도 한 베티의 얼굴 "
9,to love like them for actual life 
5,1985 개봉한 영화답게 바랜 색채가 인상깊었던 영화 
9,광기어린 사랑이란게 바로 이런걸까. 
10,열대야보다 뜨거운 37.2도의 미친 사랑 
9,재미 있지만 프랑스 영화다운 모호한 결말 
9,이해할 수 없을 거 같지만 이해가 되는 사랑영상미와 음악과 주인공들의 연기가 아름다운 영화 
9,거의 30년전 영화 지금생각해도 아찔한 사랑의 광기... 
9,가슴 찡하고 여운이  남는 영화임 
10,감정에충실하고 책임지는 남자의 삶에 애정이가는 영화다 
10,"별 생각 없이 보게되었는데, 머리를 한 대 맞은 것 같은 느낌이 들었다. 정말 명작..  한 번 이상 보게되는 영화, 머리 속에서 계속 그 잔상, 이미지가 맴도는 여운이 진한 영화.. "
10,봐도 봐도 새로움이 보인다. 섬세하고 향기로운 영화. 
9,항상 미열을 띤 채 사랑한 베티 
9,"적나라하다고 도덕적이지 않은 것은 아니다. 이 영화는 서로밖에 모르는, 광기 어린 사랑을 하는 남녀의 이야기를 담고 있다. 아름다운 구도나 소소한 에피소드들도 흥미롭지만, 날 것 그대로의 사랑은 보는 이의 마음까지 ..."
8,지독하고열정적인사랑21살인내가보기에무삭제는인상이찌푸려짐다소이해하기도 어려운 
10,조르그가 대단하다. 
10,"헌신적 사랑,, "
10,내가 본 프랑스 영화중에선 최고다. 
10,two thumps up. 
10,눈물 나는 사랑 
7,정말 무서울 정도로..열정적인 사랑..끝에선 무섭..재미있었음.. 
9,"사랑, 그 지독한 열정과 집착. 그리고 무의미. "
10,베티가 조그르에게 어떤 식으로 사랑을 받았는지.. 
9,이게 사랑인가여 ... 
9,괜찮은 영화~다시금 사랑에대해 생각하게 해주는 
10,사랑하려면 이들처럼..아름다운 음악과 영상이 잊혀지질 않는... 
10,"베티의 발작, 조르그의 사랑. 서로를 감싸주는 사랑이다. "
10,이보다 애틋할 순 없다. 
10,아름다운 프랑스 영화 
10,이거 옛날에 TV에서 봤던거다..감회가 새롭네 ㅋ 
10,나만을 믿고 사랑해주는 남자..만나고 싶다 
1,프랑스판 사랑을 위한 죽음이네. 폴 버호벤 작품이 훨 낫다 
9," 베티, 자기를 찾는 길잡이.. "
10,한번쯤 볼 가치가 있는작품 
9,엽기적인 그녀보다 더 강한 베티!!! 남자들 여자 잘 만납시다~ ㅋㅋㅋ 
10,이 영화는 해피앤딩이다. 
1,그냥 철없고 싸가지없는 여자와의 연애  예쁘면 다냐?ㅋㅋㅋ 
