score,review
10,겨울왕국보고와서 깊은 깨우침을 얻었다.. 디즈니는 예전의 소울이 뭔가 빠져나간 느낌이다. 알라딘이 진리다.. 노래 하나하나가 주옥같은 내인생에 다시없을 10점짜리 애니 
10,오랫만에 어린시절 봤던 것 생각하고 봤는데 다시봐도 역시 명작인듯 
10,3D 재개봉 해주세요 ㅠㅠ 다시 보고 싶어요 ㅠㅠ 
10,"배경, 캐릭터, 스토리, 성우, ost 모두 최고 어렸을 때 봤지만 그 감성은 잊지 못한다 나중에 애낳으면 보여줘야지 "
10,디즈니는 이맘때가 진리가 아닐까 
10,다시 보는데 너무 감동적이고 좋았어요 :) ost도 좋고 주인공도 잘생겼고 ㅋㅋ 
9,진정한 만화 명작이란 바로 이런 것이다 
10,로빈윌리엄스는 신이 내려준 선물이다!! 
9,깔끔한게 돋보이는 애니! 일본 애니랑은 확실히 다른 
8,동화책보다 요 만화가 더 매력적이다. 
10,Genie you are free.... 
10,진짜 요새 나오는 디즈니랑 비교도 안되게 꿀잼 
10,어릴때 더빙 버전으로 다시 원어 버전으로도 봤지만 당시 알라딘역의 강수진과 지니역의 김명곤은 원어를 뛰어넘은 더빙판만의 진수를 보여줬을 정도로 명연기였다.이후의 애니들이 마케팅용으로 일반 연예인들을 너무 가져다써서 ...
9,"정말 디즈니는 로맨틱한 감성을 잘 이끈단말야그리고 그 속에서 진리라고 표현 할 순 없지만 사는데 있어서 가장 중요한 것들을 이끌고말이야가사부터 쥑이지않냐 , 애들아 "
9,디즈니르네상스시절이그립다!!! 
10,어릴때 사촌누나에게 영어판 비디오테이프 선물받고 대사도 모르면서 거짓말 안하고 백번은 넘게 봤을겁니다. 친구들 학원갔을때 난 집이 가난해서 집에 있었는데... 그 시절내 친구였습니다. 평생 잊지 못할거에요. 알라딘....
10,많은 이들이 베스트  디즈니 애니메이션을 뽑으라면 많이들 라이온킹을 뽑는다. 라이온킹도 대단하긴하지만 나에게 이 알라딘이 최고다 20여년전의 그 감동을 아직도 잊을수가 없다.극장에서 봤다면 정말최고도 음악 스토리 전...
10,제게 있어 최고의 만화 입니다. 
10,아아아 로빈윌리엄스 ㅠㅠ 
10,지니는 이제 자유로운 몸이 되었습니다. 
10,확실히 원작이 더 맛깔나는 요소가 많다. 악역도 완벽하고..영화는 동굴부분 앞뒤스토리가 왜 그렇게 많이 생략됐는지 이해안됨..자파캐릭터를 너무 활용못해서 애니 생각이 더 많이 났음 
10,실사보단 원조 2D애니가 역시 훨신 느낌있어 
10,"눈물 한방울 납니다.  지니가 알라딘에게 넌 나에게 왕자님이야 하고 안아줄때,,, "
10,로빈 윌리엄스 형님의 지니역은 정말 살아있는듯 최고였음ㅋㅋㅋ 
10,알라딘 러브 테마곡은 애니 역사상 가장 멋진 러브 테마곡이다. 
10,실사 알라딘을 보고 그리운 마음에  찾아본 원작 알라딘..요번에 나온 알라딘도 괜찮지만 역시 원작만큼은  못 따라오는듯싶다  20년이란 세월이 지나 아재가  돼서  보는 영화인데도  대박이네 
10,와..진짜 거짖말안치고 와..알라딘이 자스민 데리고 마법양탄자 타고 성밖나가면서 알라딘이  아이캔쇼유더월드~ 노래딱 나오는데! 와..ㅋㅋ소름이 ;;; 그리고 사람은 떳떳하고솔직 해야지 떳떳하고 정당하게 행복할수있다는...
10,영화보다 애니메이션이 역시 더 낫다~~ 
10,25년이 지났는데 전혀 촌스럽지 않다 
10,디즈니가 디즈니인 이유. 
10,알라딘 실사영화보고 이 영화 봤는데....와....실사 영화에겐 좀 미안하지만 난 애니메이션이 더 짱인듯 
10,이게 93년도 애니였다니... 
10,디즈니애니중 인어공주다음으로 좋아하는 애니~특히 음악이 훌륭하고 그 음악을 로빈 윌리암이 예술로 승화 시켰다. 베우중 가장 훌륭한 성우였던 그의 목소리를 이제 들을수 없어 무척 슬프다.. 
10,이게 최고지! 원작을 넘을 수 없네!! 
10,로빈윌리엄스를 위한 영화 
10,최고의 명작 애니메이션 
10,진짜 중학교때 이거 보고 밤에 잠못잤던 기억이....어제 실사판 보고왔는데 애니 봤을때의 그 감동은 아니었음. 특히 주옥같은 ost 노래들은 비할바가 아님. 제발 재개봉했으면.... 
10,진짜 역대 뮤지컬 영화중 가장 완벽해요 대박 대애애애애박 
10,실사도 역대급이였지만 난 역시 원작이 더 좋은것 같다..그때나 지금이나 다시 봐도 언제나 최고♥ 오늘 실사로 보고 왔는데 내일 원작 다시한번 보고 시간날때 또 실사로 보러 가야징ㅎㅎ 
10,실사보단 역시 원작이좋다! 
10,"실사영화보다 이 영화가 더 끌린다 .. 개인적으로 최고의 디즈니 영화는 알라딘 , 뮬란 , 스티치 "
10,알라딘은 마치 언젠가 꿨던 꿈인것만같다. 악몽같기도 하고 환상적인 상상력을 자극하기도 하는. 
10,캐릭터들이 왜이렇게 귀여운지.. //// 영화로 본 건 처음인데 재밌네. 시간이 아깝지 않아요 
10,2019년 실사도 재밌는데. 저에겐 그래도 애니 알라딘이 더 좋아요. 왜냐면 알라딘 자스민이 더 사랑스럽고 더 로맨틱해서요. 
10,"지니 : ""누가 뭐라도 넌 내 왕자님이야.."" ㅠㅠ 지니랑 알라딘이랑 꿍짝꿍짝 잘 맞았고... 애니는 기승전결이 너무 완벽했네요.실사영화는 노래도 좋지만 쟈스민 영화같고 개인적으론 원작이 너무너무너무너..."
10,내가 여태까지 본 디즈니영화중에 제일 재밌었던 알라딘 보는것만으로도 힐링된다ㅠㅜ 
10,디즈니 판타지 애니메이션의 정점 
10,언제봐도 좋은 알라딘 ㅜ 
10,"디즈니의 전성기 때 3대장 인어공주, 미녀와 야수, 알라딘 "
10,나중에 아이생기면 꼭보여줄영화ㅎㅎ 
8,스토리와 연출이 너무나 좋다. 각 캐릭터의 매력이 살아숨쉬는 너무나 재기발랄한 애니메이션. 
10,"몇 번을 봐도 안 질리는 지니의 유머, 자스민의 외모, 알라딘의 이야기 "
10,원작 알라딘보니까 실사버전보다 더 재밌다! 짦지만 강렬하고 각 캐릭터들 표현과 개연성등 진짜 하나하나가 리얼 살아있는것 같아 아주 재밌있게 봤다!^^ 
7,자유를 갈망하는 이들의 노래 
10,아주아주아주아주아주아주아주아주아주아주아주아주                재미있다 
9,로빈윌리엄스 죽을때 울었다 
7,군더더기 없는 이야기와 매력적인 캐릭터들의 향연 
9,실사화 보고보니까 얼마나 잘만든 애니인지 알겟음 캐릭터들도 다 매력잇고 ost도 좋음 
10,또 봐도 재밌다.이런게 명작이지 
10,3D 재개봉 해달라는 베댓 그분 성지순례 
10,진심 명작이다... 자스민공주는 너무나도 예쁘다 
10,아..로빈윌리암스..ㅜ 요즘 알라딘때문에 옛날 생각나서 다시 보았다..정말 명작~로빈 윌리암스가 다시 또 그리워진다.. 
10,처음으로 한번 보기 아쉽다는 생각을 한 영화... 
10,In memory of Robin....ㅠㅠ 
9,"원판의 배우들 연기도 좋지만, 국내 성우. 특히 지니역의 배우 김명곤의 연기가 아주 좋았다. "
10,정말 최고의 연기였습니다. 로빈 윌리언스님... 
10,"""Genie, you're free""    Rest in peace "
10,실사영화보고 이거 생각나서 또봄 
10,실사영화 알라딘을 보고 왔는데요. 로빈 윌리암스가 너무 그립습니다. 
10,갓띵작 모든게 완벽한 만화 
10,다시봐도 감동 그자체.. 나도 모르게 흥얼거리는 OST는  알란멘켄의 수작이라 꼽을만 하다. 
10,지금봐도 명작~!!  리메이크로 해도 괜찮을듯. 노래가 정말 최고임♡ 
10,알라딘 강수진성우 자스민 홍영란성우 대박이다~!!!최고의 영화!! 나 어렸을때 자스민하고 자파하고 뽀뽀하는거보고 잠 못잤었는데 갑자기 옛날생각이.. 
10,디즈니 애니중 최고예요 OST는 단연 탑오브탑 
10,뭐하나 부족할게 없다. 그야말로 완벽 
10,실사판에서 윌스미스가 캐리했다면 로빈 윌리엄스가 캐리한 애니메이션 알라딘 
10,몇번을 봐도 재밌음. 
10,이 영화 4D로 봤는데 이만한 영화는 2만원이 안 아까웠다~~ 알라딘은 마법의 양탄자 카메라 워킹 때문에라도 4D가 진리♡ 
9,
10,
10,... Scheherazade... 
10,
10,어릴때 추억도 나고 ost며 배우들 연기며 모두 잘 어우러진 것 같다 
10,그냥 말이 필요없어요 ㅎㅎ 
10,이거 진짜 진리에요 안보신 분들 꼭 보세요ㅠㅠ 
10,꿈과 환상의 세계로 빠져든다. 최고의 애니메이션! 
10,노래도좋고 재미있었다 
10,예스러운 시각적 환상과 황홀한 청각적 경이가 문지른 선명한 감촉 
8,나의 청소년기의 최고의 판타지 영화. 사랑한 애니. 
10,94년도 극장서 라이온킹 보고 난 후 백화점서 알라딘 비디오 구입. 정말 인생 애니였음. 실사도 뛰어나지만 원작도 절대 뒤떨어지지않는다고 생각. 그리고 당시 더빙판 성우들 굉장히 존경함. 완벽한 더빙이었음. 모든 케...
10,다들 알라딘 실사판으로 난리지만 역시 내 마음 속 진정한 알라딘은 원작이에요 음악도 내용도 너무 낭만적이고 훌륭해요 제 어린시절을 채워줘서 고마워요 알라딘 그리고 디즈니 
9,지니가 이렇게 웃긴 캐릭터인줄 생각도 못했다. 모든 게 가능해서 더 재밌다. 주인공 아이템 빨이 부러울정도. 좋은 추억의 영화. 
10,"보고 나면 기분좋아지는 영화 애니로도 10번넘게 봤는데 실사 영화도 극장에서 3번 넘게 볼 기세! 노래 춤 너무 좋고, 잘만든 뮤지컬 한편 보고 나온 기분~ 그냥 내내 기분 좋음! "
10,제게는 최고의  인생영화입니다. 자스민의 장면연출은 더더욱 좋았습니다. 
10,"내 인생영화,, 디즈니의 정점. 애니메이션 버전이 최고딘 "
10,쟈스민.공주 보다가 끝나버렸음.. 너무나 예쁨 ㅠ ㅠ ㅠ  영화는 당연히 너무너무너무 재밌었음 ㅋㅋ 
7,알라딘과 자스민이 왤케 잘생기고 이쁘냐.. 
7,어렴풋한 동심의 세계를 다시금 벅차오르게 하는 환상의 OST 
10,"Genie, You're Free.그 곳에서 더욱 더 자유롭기를 빌게요. "
10,rest in peace Genie 
10,디즈니 작품들 중에 '알라딘' 이 제일 재밌었음 
10,겨울왕국  보고 본 작품..정말 요즈음 나오는 3D애니메이션 보다 깊게 와 닿는 최고의 명작이다..! 특히 중간 중간에 나오는 OST는 환상적이었다. 
10,알라딘 요술램프가 fantastic! 
9,한장면 한장면 부드럽고 지금봐도 요즘것과 비교해도 손색없는 영상이었습니다. 
10,이런걸 명작이라고 하는거임 
10,영상 내용 모든 게끝내주는.. 이게 17년전 거라니 
10,주제가도 너무 좋지만 프린스 알리가 짱 
10,"아름다운 주제가와 적절한 유머, 그리고 주연에서 조연까지 캐릭터의 매력이 넘친다. "
10,디즈니 애니중 가장 좋아한다 ㅋㅋ 애가 생긴다면 꼭 보여줘야지..ㅎㅎ 
7,상당히 미국적이지만 디즈니 애니의 최고봉. 로빈윌리엄스의 목소리 역시 최고! 
10,최고최고 
5,어릴적의 가지고 싶었던 램프의 알라딘..ㅋ 
7,디즈니의 공주중에 자스민 공주가 이쁜거 같아 
6,정신없는 지니역에 로빈의 목소리는 최고로 잘 어울렸다 
10,지니=로빈윌리엄스지. 캐릭터도 로빈을 보고서 디자인함. 실사화에서 윌스미스가 분전했지만 오히려 로빈이 더 그립다. 
9,원작애니의 스토리가 더 촘촘하다는 사실. 어 호울 뉴 월드의 감동.. 
10,역시 디즈니는 90년대가 가장 좋았다 실사화 개봉 기념으로 다시 봐도 명작 
10,"그냥 명작... 어릴땐 재미로, 지금은 감동과 재미 둘다 "
10,인류가 만들어낸 최고의 애니메이션 
10,지니랑 알라딘 케미가 너무 매력적이다....알라딘 목소리랑 ㅠㅠㅠㅠ 
10,알라딘>>겨울왕국임.... 알라딘은 최강임 
10,두말하기가 입이 아프네요 
10,"동식물과 교감하며, 공기를 온 몸으로 느끼고, 달 빛, 햇 빛만 받아도 살 듯한 명작 "
7,어렸을 때 재미있게 보긴 했다만.. 
10,솔직히 디지니 공주시리즈 중에서는 알라딘이 갑. 지금 봐도 내용전개가 손에 땀을 쥐게 한다. 
10,"""날 믿어요?"" 최고의 명대사. 믿고 보는 디즈니st 영화 "
10,"Genie, you`re free. "
10,굿 별점테러 작작해요ㅉ.ㅉ 
10,소장하고 싶은 디지니 시리즈 중 하나! 
10,"지니 너무웃겨ㅋㅋㅋㅋ 라푼젤,타잔,겨울왕국,라이온킹,잠자는숲속에공주,알라딘 너무좋아 "
10,역시 원작이 훨씬재밌다  어제 실사봤는데 별로다 
7,마음을 움직이는 이야기보단 중립이니 올바름이니 하는 정치적 시선으로 채워진 디즈니 리메이크 실사 작품들과 비교가 실례될 정도이다. 표정없는 양탄자까지도 귀여운 모습을 보여주는데 다른 캐릭터들의 매력은 말할 필요가 있...
10,진짜최고. 여주 speechless 부를때 전율쩔고 윌스미스 하드캐리 개쩜 ㅜ 노래 잘하고 춤잘추고 완전 능청능청 연기쩔어 ㅋ?㉪㉪ 덩달?ㅏ 신남 아라비안 나이트~~~~ 
10,
6,디즈니 실사화 영화 중에서는 그나마 선녀. 
10,너무 재미써ㅜㅜ 진짜 인생영화당 흐규ㅡ으ㅡ으 
10,제가 본 영화중에 최고었습니다!그때 예약안 하고 가서 큰일 날 뻔 했습니다.만석이어가지고 다음꺼 볼려니까 그것도 만석이고 하‥‥‥ 어쨌든 대박이었습니다Ost는 영어로 듣는게 더 자연스러워요아직도 장면이 생생하네요저희...
10,()*&(&*&%&$^$#^ 
10,"인생 영화. 2D 두번 보고도 4D 안보면 후회할 것 같아서 4D도 한 번 봤다. 영화관에서 눈이 내린다. 최고다 돈이 안아깝다, 개봉한지 50일 뒤에 봐서 얼마 못봤는데 개봉 하자마자 봤으면 10번은 넘게 봤을 거..."
10,디즈니 전성기는 이맘때가 아닐까 
10,한스와 알라딘 둘 중 누구의 손을 잡을건가? 
10,
10,배우들 연기가 너무 짱! 남주 첫 작품인데도 연기력이 정말 대박이였음bb 노래도 정말 대박 하...정말 디즤 짱이다 
10,OST 하나로도 벅찼습니다! 
10,극장에서 보고 집에서도 보고 다시봐도 좋은 영화. 
10,
10,역시 원작 쟈스민 매력이 넘사다 
10,Ost하나하나 명곡이네 사실상 노래들을라고 영화봄 
10,"어린시절 비디오테이프로 틈만나면 반복시청했던 알라딘이 실사화된다고해서 걱정반 기대반 이었는데 걱정을 싹없애줌. 정말 지니는 지니 그자체, 알라딘도 자스민도 너무좋았음. 자스민이 만화랑 달리 능동적인 사람이라 멋있었고..."
10,신난다 씬나~ 또 보고 싶다 
10,애니메이션 중 TOP5안에 든다 
10,실사보고 어릴때 본거같에서 봤는데 지린다 
10,"알라딘 실사영화 보기 전에 예습한다고 봤는데, 이게 진짜다. 어른이 보기에도 정말 재밌는 만화. 디즈니는 세월이 흘러도 촌스럽지 않구나. "
10,이게 7살때 나온 애니라니 지니랑 알리딘은 익숙한데 정작 애니는 27년만에 처음 봄 
9,난 실사판 세대인데 괜찮음(다만 너무 화려한 색감 때문에 눈이 아팠던...) 
10,알라딘은 나의 최고의 영화이다..너무 재밌게 보았다 
10,대박이제 ㅎㅎ 아주 재밋제 이거만한게 없어라 
10,20번도 더본 영화. 그당시 부모님께서 영어  한글자막판 비디오를 선물해주셨음. 그 어린나이에 노래들으면서 소름돋은게 아직도 생생하게 기억남. 부모님 감사합니다. 
10,아무것도 모르는 초딩때 본 느낌과 다 큰 어른이 된 지금 본 느낌은 비교불가.이야기는 물론이고 애니메이션 속 모든 곡들이 주옥같다. 
10,디즈니 시리지 중 최고인듯 
10,너무재미있어영ㅎㅎ 영화관에서 직접봤는데 너무 재미있더라고욯ㅎ 저희 엄마도 같이 보셨는데 넘 재밋다고 하더라고용ㅎ 저희 언니도 그랬고욤ㅎ 
10,정말 재미있게 잘 보았답니다 
10,다시봐도 좋아 10년전이나 20년이나  언제봐도 그느낌 그대로임 
10,완벽한 애니. 노래도 성우도 모두다.. 
10,내인생 최고의 디즈니애니메이션 환상의세계로 인도해주는 영화 
8,"오늘날과 비교하니, 너무 단순하다. 명쾌함이 좋다. "
10,역시 원작은 원작 실사와 다른 감동과 재미가 있다 
10,나의 영원힌 오빠! 섹시해 잘생겼어 목소리 멋있어 노래잘해 착해 날렵해 다 가진 알라딘. 나만 못가졌네 ㅋㅋㅋ는 농담이고 디즈니 르네상스 끝판왕다운 깔끔한 스토리 화려한 비주얼 매력적 캐릭터의 환상적 결합 
10,말이필요없음 디즈니 최고 
10,솔직히말해서 토이스토리 다음가는 최고의 디즈니 명작이다. 그냥 말이필요없다. 
10,1993년도 작품....  다시봐도 감동적이네요 
10,말이필요없다. 최고의 영화 
10,스무번은본것같다 볼때마다짱짱 
10,"신선하고 유쾌한 아라비안 칼라. 캐릭터, 플롯, 스토리, 사운드트랙 모두 완벽하다. "
10,알라딘보면 맘이 설렘ㅠㅠ특유의 감동...더빙판 강추!! 
10,이거 무지 유명한거 아님 
10,디즈니중에 단연 최고다 나이가 들어서 봐도 또 다른 감동을 준다 
10,어렸을 때 유치원에서 비디오로 틀어준 것을 보던 기억이 난다. 6살때의 나나 22살의 나나 쟈파가 알라딘을 멀리 남극으로 날려버릴 때면 나도모르게 두 손을 모아쥐게 된다..ㅎ 
10,캐릭터 하나하나가 귀여움. ㅋ 
9,전체적으로 괜찮아요. 중간에 나온 듀엣곡이 좋아서 계속 듣고 싶어요. 귀엽고 예쁜 캐릭터들 때문에 후속작도 보고싶어요. 
10,지니가 로빈윌리암스였다니 내 어린 시절의 친구가 되어준 것에 감사를 
10,뮬란보다 더재밋슴ㅋㅋㅋ감초역할이좋앗다 
10,디즈니 꺼 는 다 봐야 겠다. ㅎ 
10,유일하게 10번이상본영화 알라딘성우맘에들고 삽입곡도 
10,어릴때 본건 커서봐도 재밌음ㅋㅋㅋ 로비윌리엄스 이사람은 볼수록 넘사벽이네ㅋㅋㅋㅋ 
10,디즈니 최고의 명작!! 
10,옛날 생각나서 다시 봤습니다. 다시봐도 너무 감동적이네요 ^^ 
10,아 이OO이 넘어서 다시보는데도 정말.감동이 밀려온다 ...정말 명작이다 
10,나이를 무색하게 만드는 추억의 만화 ~ 
10,진짜 잘만들었어..!! 나온지 20년이 다 되가는데 촌스럽지 않다! 
10,어른이 봐도 아름답고 감동적인.. 애니메이션의 수작! 
10,디즈니 영화중 손꼽히는 작품. 
10,모든걸 참 잘만들었다 
7,자유의 메시지도 훌륭하고 OST도 좋다. 
9,"아~ 정말 애니도 짱이고, OST도 짱이었던 영화...너무 좋아 "
10,어렸을때부터 지금까지 몇십번을봐도 볼때마다 설레인다 
10,꿈꾸는 듯한 동화 속 이야기로.. 
10,지금봐도 정말 재미있다. 거기에 ost까지 최고다 
10,"이제는옛일이된국민학교시절..고모랑극장에서관람..그때그감동이란, 정말최고의명작!! "
10,디즈니 최고의 명작.. a whole new world는 역대 ost중 최고임 
10,디즈니 최고의 명작.. a whole new world는 역대 ost중 최고임 
10,문제는.. 보고나서 계속 노래부르고 언어를 못풀었다는것 
10,정말 대단했제! 
9,디즈니전에 이 작품이 안와서 너무 아쉬움..ㅠ.ㅠ 
9,즐길수있는 명작.... 
10,짱 조아해요 ㅋㅋㅋㅋㅋ 
10,좋은 애니 강추 
10,굿~ 
9,따뜻한 영화.. 
10,라이언킹과 양대산맥을 이루는 애니메이션. 그리고 나의 감성을 만들어준 애니메이션. 
10,내 생애 최고의 애니메이션! 보석같은 음악과 아름다운 러브스토리. 
10,진흙 속에 보석같은 영화. 
10,알라딘을 보지않은세대는 불쌍하다고 여겨진다 
8,아... 내 어린시절 추억 속의 명작^^ 
10,최고 
10,다시봐도 신나고 재밌고 흥미진진했다 지니의 익살스러운 코믹스러움 최고 
10,"노래도 너무 좋고,92년도작품인것은처음알았네요!!ㅎㅎ "
10,다 커버린 지금 다시 봐도 황홀하게 아름다운 명작. 매직 카펫 타고 여행하는 느낌. 
10,최고 
10,알라딘 정말 너무너무 잘생겼어요~!ㅋㅋ 마지막 키스장면 앍 ㅜ 너무재밌어요강추! 
10,초딩때 이거보고 너무 잼나서 울었다 ㅋㅋ 
10,최고 
10,내가 6살때 만든 영화네;; 지금 봐도 재미있다. 
10,최고 
10,완전 최고!!!! 
10,디즈니가 최고임! 
10,옛날에보고 정말오래만에봤는데도 역시나 재밌다!!캬핫~나두 지니있음좋겠어 
10,16년만에 다시 봐도 역시 최고.. 
10,와 디즈니 역시 재밌다 
10,잼씀 
10,지니 처음에 등장할때 노래 좋네..... 
10,너무잼있어염 
10,어렸을적 재밌게 봤던 애니 TOP5에 속합니다. 
10,이건뭐 쵝오! 
10,명작은 세월이 흘러도 변하지 않는다 
10,짱!!!!!!!!!!!!!!!!!!!!!!!! 
10,재미있네요 
10,"오늘 보았는데, 흥미 진진해요!! "
10,요즘 최근에 봤는데 엄청 재미있었어요~~ㅋㅋ특히 지니~~ㅋㅋ 
9,지금 봐도 재밌는 만화영화..!!디즈니찬양! 
8,디즈니 애니중 손에 꼽을 수작 
10,전 이게 제일 좋아요 노래도 좋고내용도 재미있었어요 
10,젤 좋아하는 디즈니 애니메이션 중 하나. 13살 내게 사랑의 감정을 알려주었다. 
10,내가 좋아하는 애니 2ㅋㅋㅋㅋㅋㅋㅋㅋㅋㅋㅋ 
7,어릴적에 디즈니 만화를 보면서 꿈과 상상력을 키웠다는...! 
10,굳~~~~~~~~~~~` 
10,"제가 알라딘을 DVD로 봤는데, 재미있었어요. "
10,9살때 영화보고 너무 좋아서 책가지 사서봤던. 벌써 15년 전이네.;;;; 
10,음악 하나하나 모두 명곡이고 10년이 넘은 만화영화인데도 흥미진진하다 
10,하...... 10년전으로 돌아가고싶어... 이걸 즐겨볼때로... 
10,다시 보고싶다.. 그때의 감동을 다시 한번.. 
10,알라딘보단 지니와 자파가 더 기억에 남는다. 
10,어릴 때의 추억이 생각난다...다시 보고 싶은 영화... 
8,재밌어요ㅋㅋ 오랜만에 만화영화보니까 동심의 세계로+_+ 
10,정말 최고의 애니메이션 중 하나.. 
10,어린시절 최고의 추억의 영화~ 지니 목소리가 그립다! 
9,비디오방 처음 생겼을 때 의자 뒤에 걸린 헤드폰 쓰고 봤던 추억의 영화 
10,추억의 영화 
10,a whole new world! 
10,추억의 아라비안 나이트 
10,최고최고 
10,비디오로몇번을반복해서봐도질리지않아최고에요! 
10,미녀와 야수와 함께 월트디즈니 역사상 최고의 애니. 조금 짧다는게 흠 
10,명작.. 
8,사랑스런 위트가이 지니. 
9,아이 캔 쇼 유 더 월~~~~~~~~ 
10,알라딘너무좋아 ㅋㅋㅋ너무재밌었다. 추억 
8,디즈니 작품은 전부 볼만하다.. 
10,알라딘 정말 재밌어요! 
10,어렸을적의 감동 
10,어렸을적 동심으로 돌아간기분. 굉장히 재밌게 봤었음. 
9,노래와 모든 것이 잘 어울린 작품이다 
10,모든 면에서 최고다. 푸르딩딩한 지니 아주 능글맞고 귀엽다. 
10,OST가 지대다 
10,비디오로 또 봐도 너무 재미있어요~ 
10,"정말 재미있게봤었는데 ㅠㅠ;또 보고싶네 386컴퓨터때 알라딘게임,,ㅋ "
10,유쾌한 영화 ~~ 
10,그때 엄마손 잡고 가서보았을떄는 환상적이었다 
10,멋지다.ㅜㅜ! 최고 
10,90년대에 만들었다고 생각되지 않은 영화 !! 
6,로빈 윌리엄스의 목소리만으로 먹고가자나? 
10,명작 명작 명작. 
10,그 어릴때 OST를 살 정도였으니 말 다했지..ㅋㅋ 
10,디즈니가 만들어낸 걸작 중 걸작 
10,일요일 8시에 꼭 했던 추억의 만화 
10,지니~~~~ 이런 소심귀여운 거인. 
10,짜요! 
10,내겐 추억이다... 
10,명작이다 
10,알럽지니 
10,디즈니 애니매이션의 표본 
10,정말 재밌게 봤음니다. 대단한 작품. 
8,지니 초엽기 ㅋㅋㅋㅋㅋㅋ 
8,생명력이 넘치는 명작. 
8,황홀 
10,beautiful...ㅠㅠ 
10,만점은 당연하지만 90년대 디즈니 명작치고 깊이가 떨어짐. 
10,최고~ 
10,환상적인 음악~ 
10,머 말이 필요없는 디즈니 대작 
10,디즈니 영화 중 알라딘을 최고 좋아함 
10,디즈니 영화 중에  제일 재밌고 멋진 영화! 
10,주제가가 너무 아름답다 정말 재밌는 애니 
10,디즈니애니의 전성시대의 명작 주제곡이 무척이나 아름다웠던.. 
9,참 재미있게 보았던 애니메이션 
10,알♡ 사랑해 ㅎㅎ 
10,"어렸을때 집에비디오로 1000번은 넘게봤었던것같은,최고다 "
10,진짜 재밌게봤음♡추억의 만화~ 
10,최고의 애니매이션! 
10,자꾸자꾸 보고싶은 명작 
7,만화였어도 볼만했다 -_- 
10,눈을 땔수가 없어 너무 유쾌한 애니이다 최고~ 
10,어릴때 너무 좋아했음 
10,디즈니중 최고...^^ 
8,지니가 짱이지 ㅋㅋ 
10,로빈 윌리암스 쪼아~! OST도 환상적 
8,"디즈니 2D 전성기일 때의 작품, 꽤나 재미있었다. "
10,a whole new world~ 노래 무지 좋아했는데 
10,음악도 좋고 내용도 재미있었다.. 
