score,review
9,어린 시절 램프에 관심을 가지게 만든 영화. 
7,소원 들어주는 지니~ 양탄자~원숭이..만화 브랜드 디즈니아녀? 
10,"언제봐도 재밌는 영화.. 감동도 있고 로맨스도 있고,, !! "
10,이것도 상당히 재미있따~ 
10, 어렸을때는 마냥 좋기만 했었던 .. 알라딘이기에 10점을 준다. 
8,어릴 저 아침 일찍 일어나서 챙겨본 기억이.. 
7,지니의 귀여운 풍모는 이 때가 가장 빛났다. 
10,명작 에니메이션. 
10,수많은 디즈니만화영화중 가장 기억에 남는작품^^ 
9,미국엔 로빈윌리암스 한국엔 김명곤씨.. 그들이 이 작품의 빛이다 
9,볼만하다 
10,알라딘 참 잘싸운다 
10,알라딘 아주 재미있는 영하같지요??? 
10,음악도 좋고 내용도 재밌고...하여튼 디즈니만화는 끝내준다니께.. 
10,난 알라딘 깔는거 어떻게해? 
10,알라딘이 빛을보게되서기뿌다 
10,어렸을때 제일 좋아했던 디즈니 만화. 어른이 되고 봐도 재미는 여전한거 같고 정말 잘 만들었다. 1~3편까지 적절한 흐름으로 잘 연결되었고 지루하지 않았다. 스토리 가물가물해졌을때 또 봐야겠다. 
9,알라딘은 천재가 맞다. 
8,생각보다 세련됐고 자스민이 넘 당돌하고 섹시해서 놀랐음 확실히 원작은 알라딘 비중이 더 커서 맘에 들었다 
10,디즈니 애니 top3안에 들만하다 
10,너무 감동적이고!! 아름답고!! 마음을 울리는!!그런게 있는 것 같아요♥ 
10,다시 보고 싶어서 지금 보고 있는 중ㅋㅋ역시 디즈니라면 알라딘! 
10,동심으로 돌아갈수있는영화???너무좋아요ㅠ 
10,알라딘을 보던 시절 우리는 정말 꿈과 모험이있는 환상의 세계로 갈 수가 있었다 
10,솔직히 알라딘이 상상력 끝판왕 아닌가누가 양탄자를 타고 날아다닌다 생각했겠으며램프와 지니라는 인물을 설정했을까...그리고 악당을 처리하는 기발한 센스에 놀랐음 
10,"25년전 개봉작이라는게 무색할만큼 너무 멋진 작품이네요 유머포인트도 센스있고 내용,연출 감동까지~ 지루함1도 없이 잘봤어요 "
10,"신데렐라 , 백설공주 보고 알라딘 영화는 처음 보는데 너무 감동적이고노래도 좋고 .. 내용도 재밌고 그냥 사랑합니다 ,,, "
10,"인터넷 보급 직전, 마지막 백과사전 세대의 최고애니메이션~ "
10,디즈니 고전중애 제일 달달한거 같다... 자스민이 젤예뻐 
10,애니메이션계의 알라. 귀로만 봐도 10점 눈으로만 들어도 10점 
10,Disney can show me the world. 
10,"와  최근데 다시 봤는데, 추억 보정때문에 재밌을거라고 생각했었는데, 그냥 매우 재밌음. "
10,내 인생영화다 환상적인 영화 
10,졸잼 처음봤는데 양탄자도 귀엽고 지니도 재밌고 전체적으로 꿀잼♡ 
10,많은 교훈을 얻을 수 있었고 내용 구성도 좋고 줄거리도 아름답고 훌륭해요 
9,디즈니전성기때나온영화 
10,더이상 들을 수 없는 그의 지니 목소리...그래서 이 작품이 더욱 잊혀지지 않습니다.  오 캡틴 마이 캡틴 
10,지금의 디즈니도 좋지만 클래식 디즈니가 더 좋다. 
10,개인적으로 가장 좋아하는 디즈니의 애니. 특히 디즈니 특유의 음악과 애니의 어울림은 최고였다고 생각됩니다. 
9,A Whole New Wolrd♪♬의 감동을 잊을 수 없는 최고의 ost를 탄생시킨 애니매이션♥♥♥고딩시절에 봤을때 설레었었지*** 
10,무슨 말이 필요할까!! 알라딘인데 
10,"처음으로 본 디즈니 영화, 다시는 없을 디즈니 영화 "
9,아름다운 노래와 구성으로 뻔한 이야기를 잘 풀어나가는 것도 디즈니의 능력이다.. 
10,월트 디지니의 전성기와 함께 했던 나의 유년기는 행운이라 말할만큼 행복했었다. 
9,"예전에 극장의 앞줄에서 볼 때는 현란하게 변하는 대형화면, 몸이 울리는 신나는 음악, 로빈 윌리암스의 감칠맛 나는 목소리연기 그야말로 whole new world에 있는 기분이었다. 그런데 EBS에서 다시 보니 &#..."
7,"이국적인 낭만의 정취를 물씬 풍기지만 혁신보다는 안전한 길을 택하여 흥미위주의 감상적인 동화에 머물고 만다.이 와중에도 오래 기억될 정다운 캐릭터, 지니를 창조해냈던 로빈 윌리엄스를 추모하며. "
10,쟈스민 너무 이쁘고 스토리도 탄탄함! 
10,"15년이 훌쩍 지나서 봤더니 어릴 때 본 장면들이 참 무의식 중에 어떤 이미지로 크게 자리 잡고 있었단걸  느꼈다.  아름다운 장면과 음악 그리고  아른아른 생각나는 추억의 게임, 금은보화에 함부로 손을 대면 안된다..."
10,a whole new world~ 중독성 엄청난 영화. 
10,디즈니의 전성기 시절 명작임 어릴때 봤던 기억이 
10,어릴때 비디오를 돌려보고 돌려보고 했었는데...요즘 나오는 디즈니사는 정말 이맘때쯤이 전성기였나보다 
10,귀여운 지니... 지니랑 헤어질 때 얼마나 눈물이 나던지 ㅋㅋ 
10,감동그자체감동그자체 
9,"가족, 모험, 드라마, 멜로/애정/로맨스, 애니메이션, 뮤지컬, 코미디,판타지어느 것 하나 빠지지않는 디즈니 간판 동화 "
10,"알라딘,라이언킹을 디즈니 제일 명작이라 생각하고 ost도 최고. "
10,라이온킹도 좋지만.. 디즈니중엔 알라딘이 최고.. 
10,커서 보면 그닥일수있지만 어릴때 10번 넘게 봤는데 그때의 재미를 잊을수없음 
10,초등학교 1학년때 봤는데 10번 넘게 봤음 너무 재밌다 ㅠㅠ 
10,"처음 본 알라딘. 최고다. 재미도 있을 뿐만 아니라, 인간의 모든 세상사가 다 담겨 있다. 명작 중의 명작. 오랜만에 눈물 흘리는 영화. 진한 감동이다. "
10,"음악, 개그, 내용, 연출 모든 게 완벽한 애니메이션. 로빈 윌리엄스의 지니 목소리 연기는 애니메이션 더빙연기의 전설. "
10,이영화는정말나에게Whole new world 를보여주었던노래다 
10,2D지만 캐릭터가 살아 숨쉰다. 각기 다른 개성을 굉장히 효율적으로 잡아낸. 
10,디즈니를 사랑한다면 알라딘을 뺄 수 없다 
10,10점 주고싶다 어릴때봐도 다 기억남는 장면들 
10,"디즈니 최고의 애니메이션. 영상미, 음악, 스토리 무엇하나 부족한것이 없다. 속편인 알라딘2와 3편을 1편만큼 공들여 제작했다면 어땠을까 하는 큰 아쉬움이 남음. "
10,"정말 전설의 디즈니 작품인데 영화뿐만 아니라 책, 게임, 심지어는 디즈니 만화동산까지 다 접해본 유일한 작품... 그래서 10점 드림요. "
10,어렸을때 고모가 사준 알라딘 비디오테이프 떄문에 영어더빙 노자막 ㅠㅠ 당시 5살이었는데 내용이 기억날정도로 명작 
10,알라딘을 능가하는 애니메이션 OST는 더 이상 나오지 않을것 같다. 
10,언제봐도 좋은 영화.. 
8,겨울왕국과 비교하다니 어거지로 내용을 음악에 맞추는 그런 영화와 비교하다니요.  영혼없이 노래만 까는 그딴 영화에 비교하다뇨 - _-) 디즈니는 역시 이때가 리즈시절인듯 싶습니다. 
7,한국어 더빙은 헬이다  너무 과거같아 
10,다시봐도 너무 재밋고 감동.. 
10,최근 개봉한 실사 영화 알라딘 보다 훨씬 낳네요 이거 처음본 때로 돌아가고싶네요주먹왕랄프2에서 쟈스민 성우 알라딘 쟈스민성우랑 같은배우네요 원작에 충실 할라고 역시 대단한 디즈니 
10,역시 앙증 맞음은 윌스미스지! 
9,넘 다채롭고 재미있습니다. 그런데 뽀뽀 장면이 매우 많이 나옵니다 ㅋ.ㅋ 
10,"6살때 처음 봤는데, 지금 생각해보니 반려자가 될 첫사랑을 만난 기분이었다. "
10,진짜 너무 재밌고 speechless 노래 최곱니다~~ 
10,진짜 대박입니다 아직까지 어깨가 들썩이구요 ost하나하나 주옥같고 깔끔한 리메이크 너무 좋았습니다.. 
10,힙합지니?????????????????? 
10,디즈니 애니메이션 중에서 제일 좋아하는 영화! 최고 중의 최고! 
10,어른이 되서 다시봤어요. 지니가 자유로워진게 참 좋아요. 눈물이 났네요. 
8,"실사영화 보기전에 한번 봤어요. 엄청 어릴때 본 이후로 처음 봤는데, 유명한 명곡들은 말할것도 없었고, 지금 봐도 충분히 재밌었네요 "
9,곧 보러갈 알라딘 예습차 다시 봤는데..역시. 내 기억에 남았던 지니. 다시 봐도 지니 비중이 메인 주연인 알라딘 자스민을 훨씬 넘어설 만큼 매우 크다. 탑급 호감형 사이드킥인 유쾌한 그 캐릭터를 윌 스미스가 어떻게...
10,정말로 아름다운 영화알라딘의 A whole new world에서 살기를 바라면서 
10,중1때 봤었던..볼때마다 여운이 남음.. 그시절이 그립기도하고아련함ㅋ 
10,흠잡을수없는 애니매이션.. 
10,현실을 잠시 잊게해주는 환상적인 영화다... 결코 러브스토리로만 치부될 애니매이션이 아니다 마치 라라랜드의 디즈니버전같다... 그립다 21세기전의 디즈니들..ㅜㅜ 
10,재밌는 애니는 많지만 완벽한 애니는 알라딘뿌운. 
10,진짜 잘 만들었네요..와우 
10,언제봐도 최고야 정말 ㅠㅠ 
9,"지니가 등장할때 마스크에 등장했던 짐캐리가 생각난건 왜일까, 미국 코미디영화에서의 공통적인 그 오두방정 때문이었을까 ? "
10,어른이 되서 다시 봐도 명작 중의 명작이구나~ 
10,디즈니 영화는 역시 최고!!!! 
10,A whole new world~ 
10,87년생 추억의 만화네  어릴때 비디오로  친구들이랑 정말 꿀 재미있게 즐겨 봤는데 디즈니 최고의 명작이지 레전드다 ㅋ 또 봐야쥐 
9,디즈니특유의 부드러운 움직임과 페르시아 복장이 너무 잘 어울린다.. 
10,아직까지도 일년에 한번이상은 꼭보는 명작중에 명작. 
10,지금도 재미있는 우주명작 중의 우주명작 
8,"아랍의 세계관을 매력적으로 표현한 애니메이션이다.상상력의 날개를 마음껏 펼친 동화로, 시종일관 한눈 팔수 없는 재미들로 풍성하다.아름답고 때로는 신나는 음악들을 빼놓을 수 없다. "
10,레아 살롱가와 브레드 케인이 부른 노래가 진리 
8,판타스틱한 영상. 로빈윌리엄스의 지니 연기가 인상적 
10,어릴 때 정말 최고의 판타지와 재미를 안겨주었다. 
10,"명곡의 향연, 깊은 감동, 디즈니 최고의 작품 "
8,동심으로 돌아가는 기분 
10,"오늘, 당신의 꿈이 이루어집니다! 함께 가요! 사랑의 양탄자를 타고 꿈과 모험이 있는 환상의 세계로 "
10,그냥모든게너무좋다 동화같다 
10,옛날생각나서 다시봤음. 최고의 애니메이션!! 
10,역시 디즈니. 역시 알라딘. 
10,내 인생 최고의 영화!!!! 
10,간만에다시봤는데 정말대박..이런애니가 다시나오려나 
10,와 걍 옛날 디즈니의 상징적인영화정도로만알고 제대로본건 첨인데 진짜진짜 잼있다... 
10,I can open Your eyes. Take wonder by wonder~ 가사가 너무 좋고 노래도 좋다. 어렸을적엔 알라딘 거지같고 촌스럽다고 싫었는데 사랑감정 느끼기엔 최고의 애니 
9,알라딘 옛날생각 많이나네.. 
10,짱다시 보고싶어요 ㅠㅠ 
10,알라딘을 이제야 보다니... 
10,이런 명작을 이제야 보다니.. 
10,어렸을때는 마냥 재밌었는데 어른되고 보니까 왜 눈물이 나죠? 
10,유치원때 티비에서 보던기억이 나서 오랜만에 봤는데 여전히 최고다. 개인적으로 디즈니 영화중 알라딘을 가장 좋아함!!! 
10,진짜 최고다 ost 도 정말 최고 
9,내가 죽을때까지 볼 영화 
10,내가 디즈니 진짜 안 좋아하는데 예날 디즈니는 인정할 수밖에 없게 만듬. 겨울왕국? 라푼젤? OO 
10,아이고 로빈 윌리엄스... 
10,"디즈니의 진정한 리즈시절은 20세기하고 2000대 초중반 까지가 진리지 라이온킹,뮬란,미녀와야수,토이스토리,몬스터주식회사,니모를찾아서,벅스라이프,인크레더블 등등 "
10,초등학생 때 매일매일 본 영화. 
9,어릴적 동화책으로 읽던 추억이 새록새록 
10,진짜 재밌어 24살 되어서 또 봤는데도 재밌다 
8,지니는 어디에 있는가... 나에게도 지니가 필요하다 -_- 음악을 어쩜 이리 잘 만드는지 깜짝 놀랬던 영화. 
10,이젠 내 자신이 순수하지 못함을 느꼈다. 나라면 이런저런 소원을 빌었을 텐데..하는 생각이 먼저 들었다. 내용도 영상도 풍부하고 무엇보다 노래가 정말 좋았다. 
10,명작 중의  명작!! 최고의 애니메이션!! 
10,중학교 시절 절 애니메이션의 길로 인도한 영화~!최고~! 
10,내 인생 최고의 영화... 
10,대박 제목은 알라딘이지만 난 지니가 너무 좋았음ㅠㅜ진짜 동화속 지니는 근엄 그 자체인데 이건 지니가 너무너무 귀여워ㅠㅠ더이상 지니의 목소리를 들을 수 없다는게 안타까울뿐 
10,유치할 줄 알았는데 그렇지 않았음. 특히 알라딘이랑 쟈스민이 양탄자 타고 하늘을 나는 장면은 노래와 어우러져서 보는 나도 신났다... 
9,알라딘 행복하게 잘 살길 바래 마법사는 멍청해 
10,역시 명작중의 명작ㅜㅜ 
8,아무리 깊은 밤이 찾아와도 잠들지 않는 아라비안 나이트 
10,어렸을때 너무 좋아해서 비디오로 계속 봤던 영화. 다시 좋은 화질로 보고 싶네요 그 a whole new world 듀엣은 정말 환상적이었습니다. 
10,진짜 좋아. 좋아 정말!! 
10,라이온킹.인어공주.미녀와야수.알라딘까지..적어도 평점 9.5이상은 받아야 하는 레전드 명작애니인데 
10,알라딘 주제곡과 양탄자 그리고 요술램프의 지니~~~는 정말 완벽하고 퍼펙트한 고전문학동화의 최고작을 제대로 표현해준 애니. OO이 지난 지금까지도 난 A Whole New World 이 노래를 듣고 연주하며 지내고 ...
10,개굿 ㅠㅠㅠ진짜 좋아요 
9,ㅋㅋㅋ재밌음 중간에나오는노래도익숙하고 
9,명작. 지니 힘도 지존 캐릭터도 지존 
8,음악덕분에 한편의 뮤지컬을 본 것 같다. 
10,"옛날처럼 엄청 설레이진 않았지만, 그래도 조금이나마 동심이 살아나는 느낌. 잊었던 뭔가를 깨닫게 해주는 느낌- 정말 단연코 명작이고 a whole new world는 두번다시 없을 최고의 곡이다. 이 작품이 20년전..."
10,디즈니 영화 중 최고.... 노래도 영상도 그냥 다 좋았음ㅜㅜㅜ 
10,"『미녀와 야수』, 『라이언 킹』과 더불어 디즈니 르네상스 시대를 대표하는 걸작 애니! "
8,하도 오래전이라 잘 기억이 안 나네 
10,지니와 자스민은 언제 봐도 유쾌하다. 디즈니 영화 중에 가장 신나는 영화. 
10,알라 알라 알라딘~ 추억속으로~ 
10,디즈니 영화중에 제일 좋아하는 영화 
10,어릴때부터 집에 비디오로 있어서 수십번은 본듯이걸 너무 재밋게봐서  다른 디즈니 영화 못보겠음 
10,진짜 많이 봤어요 ㅋㅋ 비디오시절에 나온건데 지금봐도 스토리가 넘넘 재밌어요 
10,i can show you the world ~~~ 
10,OST가 좋은 영화!! 
10,알라딘이 짱이얌^^* 
10,지니를 닮아 시종일관 에너지가 넘쳐흐른다. 정말 신나게 볼 수 있는 명작. 지니와 자스민은 언제봐도 매력적이다. 
10,진짜 지금봐도 걸작임 지니 ㅠㅠ너무웃겨 
10,최고의 영화다. 평점줄라니까 귀찮게하네 
8,디즈니 만화 동산 추억 돋네 
10,정말 명작임 특히 노래ㅁㅋ 
10,진심 남자에게 있어서 사랑이란게  뭔지 보여주는 영화! 
10,a whole new world ㅜㅜ 그장면 보면서 울었다. 
10,"90년대초 고2때 극장서보고 음악에 황홀,지니의 위트에 폭소 ,아름다운 스토리에 꿈을 가질수 있었던 최고의 애니메이션 환타지..그리운 내 청춘 "
10,"이 영화는 나에게 참 많은 추억을 남긴 것 같다.. OST인 A whole new world. 중학교 때 수천번을 듣게 만들었던 노래, 마법의 양탄자를 타고 날 때의 그 장면, 그리고 당시 유행했던 게임 등. 마법같..."
10,애니메이션 답지 않게 스토리가 탄탄하고 OST도 잘 어울러져서 성인이 된 지금도 재밌게 한번씩 본다. 
9,이거 영화관에서 배잡고 웃으면서 본 영화...약간 정신없고 빠른 전개지만 정말 재밌어요. 
10,어릴적 추억.. whole new world 
10,아쉬운것 몇개있지만 그래도 10점! 
10,최고다 두유 트러스트미?ㅎㅎ 
10,봐도봐도 재밌고 어떻게 이렇게 잘만들수가있지? 
10,마지막 OST가 너무 좋다. 
10,애니매이션중 가장 명작스럽다. 
10,진짜 잘 만들고 진짜 재미있는 애니메이션.. 아니 그냥 영화라 부를테야! 
10,별 100개 줄 수 없음? 
10,최고 
10,진리 
10,아름다운애니메이션 92년도 영화관에서 직접봤는데 너무나 감동적이였습니다. 
10,"""내 인생 최고의 명작""이였다고 단연코 말할 수 있다. 보면 행복해진다 "
10,수많은 아름다운 디즈니ost들 중 'a whole new world' 단연 최고! 
10,디즈니 명작 !!! 
10,어제다시봤는데도 재밌슴 ㅠㅠ 
10,디즈니는 개쩔 
9,classic! 
10,"환상적인, 일그러진 얼굴마저도 친근하고 용서되는, "
8,20세기부터 단연 빛났던 디즈니 애니메이션의 저력 
9,I love Disney 
10,재미있네요 
10,어떨지정말궁굼하내요 
10,말이필요없다 
10,진짜 너무 아름다운 애니메이션.ost도 진짜 완젼 짱.!! 
10,15년만에 다시봤는데 알라딘 참 미남임..ㅎㅎ섹시한 이스탄불 싸나이 
10,오늘 다시보고 옛날 생각이 나서 울었다 최고중 하나 
10,이런 작품 보지않는세대는 그저 안타깝다라고 느껴지는 
8,나이 들어서 보니 감흥이 크게 오지 않는게 슬프다. 그 시절에 보지 못한게 아쉽네.. 
10,speechless !!! 
10,"그냥 만화가 아닌, 인생에 길이 남을 추억 "
10,좋은 작품 ㅠㅠ OST도 머싯고 
10,알라딘 ost완전 좋아요~~ 
10,쟈스민하고 알라딘이 양탄자 타고 날떄 같이부른노래 너무최고! 
10,알라딘 겁나 잘생김ㅠㅠ 
10,제가 이것을 뮤지컬로 하는데 흥미진진한 느낌이 확 오네요^^ 
10,알라딘 진짜 잘생겼음 공주도 이쁘고.. 양탄자 입체감난다.. 
10,처음 오프닝 노래 로빈윌리엄스가 부른거 맞죠? ㅋ 
10,한 2천번은 본듯. 지니 너무 좋아 ㅠ.ㅠ 로빈윌리암스목소리연기 최고! 
10,완전 재미있어요 
10,♡ 대작 ♡ 
10,굿 역시 디즈니 
10,내 생의 최고 명작 
10,이런게 명작 !!!! 
10,최고 재미있음 
10,이거슨 남자의 로망 
10,정말 최고에요 
9,생각보단재미있네;;;;; 
10,ㅋㅋ 넘 재미있다~~ 나중에 또 보고싶겠당~은근히 중독  ^-^;; 
10,잼따~~~~ ㅎㅎㅎ 뭐 이런거 볼 나인 아니지만... 나이 먹을수록 이런게 끌려~ 
10,'명작' 
10,아주 좋아요. 
10,매우 재미 있어요. 
10,언제봐도 재밌는 책이다 정말 계속 보고 싶은 유일한 책이다. 꼭 독서를 하고 말 테다 
10,최고의 명작 
9,이때만 해도 디즈니 정말 명작이었지~~ 점점 망해가지만 않았어도~ 
8,어릴때 열광했던~~언제봐도 재밌다 ㅋㅋ 
8,눈과 귀가 즐거운 디즈니 애니 
10,재미있다~ 
10,지금은 아닐지몰라도 90년대 디즈니만화들은 무조건10점 줘도 더주고싶은 명작들 
10,제일 아름답고 재미있었던 영화 
10,내가 본 애니메이션 중 제일 끌린다 
10,월트디즈니 애니메이션 중 最高라 자부한다. 
10,내가본 애니메이션 중에서 최고다 
10,디즈니 만화중에선 인어공주랑 알라딘이 쵝오 
10,어릴때봤던 애니메이션을 다시 
10,아주 감동이 넘쳐요&gt.<(참고로 전 3학년인데두 감동받았답니다^^;) 
10,너무나도 감미로운 A whole new world..너무좋아요 
10,년도에 비해 높은 퀼리티의 영화였다!!!!! 
9,훌륭한 상상력. 빠른 전개. 따뜻한 음악. 단 기독교 적이진 않지 ^^ 
9,재미있었어 볼만했지 
8,좀 희화화 했다는 것은 불편하지만 봐줄만 하다. 
9,동양 환상의 극치를 보여준다. 디즈니만이 만들 수 있는 수작! 
7,참 매력적인 작품. 근데 한국더빙은 정말 이렇게밖에 안되나?-_- 
10,알라딘 spechless가 좋았어요 
7,저때는 날으는 양탄자가 부러웠다 
9,씹인싸 지니랑 자파의 악역 카리스마가 없었으면 B급 동화. 
7,재밌지 그런데 너무 과거 감성 
10,기대도 안했는데.... 대박이네요 ... 모든게 완벽했지만 OST가 대박입니다. 나오미 스캇... 잊지 못하겠네요 
10,어렸을때부터 디즈니공주 시리즈를 몇번씩 봤는데 이번에 실사판 개봉한다고 해서 너무 기대된다 
9,어린시절 추억에 애니로 정말 멋진 작품이라 생각한다. 
8,아 이것이 알라딘의 내용이었던가요? 
8,지니 혼자 하드캐리하는 애니. 마녀와야수의 감동은 없다 
8,정작 주인공인 알라딘보다 와이프가 더 주목받는 불편한 진실...... 
8,"아이들 영화라 그런지 산만하고 시끄럽고,,그래도 노래는 좋음 "
8,<미녀와 야수>보다 못하다. 
4,그런대로 괜찮은 기교가 조금 
8,다 아는..디즈니식 애니.. 
10,어렸을때 엄마랑누나한테 이거말고 영구와공룡쭈쭈보자고 왜졸랐을까 당시 그거안보고 알라딘을선택한 누나한테 감사 영화버전도 옛날생각하며 같이보러가야지 
9,"디즈니 감성의 결정판. 아름다운 영상미와 음악, 매력적인 캐릭터까지 모든 것이 갖춰진 작품. 90년대 디즈니의 르네상스를 증명한 수작이다. "
10,"이 영화를 어떻게 평가할 수 있을까. 2019년에 다시 봐도 수려한 작화, 그리고 재미, 더불어 정치적 올바름까지. 2019년 현재 나와도 경쟁력 있는 영화다. 이걸보며 곧 개봉할 실사화 영화에 대한 기대와 우려스러..."
10,내가제일 좋아하는디즈니 
3,그냥 기대보단 약했다 
8,쟈스민 넘 섹시하다~♡ 
1,재밌게 봄 역시 명작인듯 
7,"딱 하나 흠이 있다면, 큰 교훈이 없다는거? "
8,태어나기도 전의 1993 영화라는게 도저히 믿기지가 않는다 사실 지니역의 로빈 월리엄스가 다한 영화 솔직히 쟈스민 불쌍하고 빻은 부분 많은건 사실이지만 옛날영화니까 넘어간다 ㅉ 생각 이상으로 재밌어서 놀랐다 쟈스민이...
1,
4,재미있어요~재미있어요~재미있어요~ 
1,정말 좋은 애니메이션 이지만 오리엔탈리즘의 정점을 찍었다는 것 때문에....작품 자체는 백점 
1,순수함이 없어서 그런가... 
1,아주 자알... 
1,왜 평점이 이리 높은지 모르겠네 
1,예전에 봤는데 끝까지는 못봤음. 
7,좀 ost가 2019년알라딘보다 좀 떨어지지만 그래도 좀 재미있었음. 
1,그냥 평범 이 정도 점수는 아니지 
1,재밌는  오락영화수준 ㅋㅋ 
1,흥  영화도안보여주면서 이딴걸 왜까라지고 
1,???이게 평점 1등이라니? 
1,",ml.kjlkujhkgyjfg "
1,ouioytgritdyjtyue 
1,다시 보는데 너무 깊은 깨우침을 얻었다 
1,노래말곤 아무것도 없다 겨울왕국처럼 최악이다 
1,절대 보지마세요!!. 
5,너무 경망스럽고 너무 빠르다. 그리고 말을 안하고 노래를 해서 틀렸다. 일단 너무 경망스러워서  38분 보다가 껐다. 
1,"초딩이 봐도 유치가 찬란한 영상,,, 근디 왜 이리 평점이 높아? "
1,"..,,.,.,..,, "
