score,review
10,인간일 때보다 야수일 때가 나은 건 함정 
10,미녀와야수 몇번이나 봐도 질리지않고 재밌다감동의 애니메이션ㅠㅠ 
10,"성인이 되어서도 감동인 애니메이션. 주제가 ""미녀와 야수""는 언제들어도 명곡이다 "
10,이게 1991년에 만들어진 영화라니. 지금봐도 전혀 촌스럽지 않다 세상에. 
10,개인적으로 라이온킹하고 미녀와야수는 언터쳐블이라고 생각함 
9,오직 만화여야만 가능한 이야기. 그래서 더 뭉클한 이야기. 
10,결코 못 잊을 영화. 디즈니 최고의 로맨스. 
10,이게 원조지.......이게 진리야 
9,다른 디즈니의 공주들과는 다른 벨 매력적이다 
8,디즈니만화가 국내 극장가서 인기끌게된 시초가 아닐까 싶다. 
10,"처음부터 끝까지 유쾌,통쾌,상쾌했었습니다.ㅋㅋㅋㅋ "
10,미녀와야수 하인들도 가구로 변한것이 그사람들의 특징을 잘살린것이 좋고 무도회장도 너무 아름답다. 
10,20세기의 유산 
10,본지 10년이 넘었는데...정말 나도 사랑하고 싶어지는 이야기. 오랫만에 감동한다. 
9,거울에 비친 야수를 연인으로 보는 것도 괴물로 보는 것도 당신이다. 
10,마음한구석에 감추어두고 싶은 영화 
10,90년대 디즈니의 소울이 느껴진다 
10,겉모습만 보고 사람을 판단하지 말라는 말이 떠오르네요ㅎㅎ 
10,미녀와 야수는 일단 너무 감동적이고요...정말 여운이 남는 영화랄까???정말 추천입니다^-^ 
10,"여주인공 보내고 왜 보냈냐는 말에 ""그녀를 사랑하니까요"".... 이말이 내생각에는 모든 만화 통틀어서 최고의 명언이다 "
10,"어렸을 때 너무나도 많이 봤던 애니! OO도 더 지난 지금 문득 생각이 나 다시 봤는데... 와, 완전히 다른 느낌의 새로운 명작을 보는 것 같다... 가히 디즈니 전성기 최고의 작품 중 하나라는 타이틀이 손색이 없..."
10,다시 보아도 명작은 명작입니다! 감동적이에요! 
10,아무리 잘 만들어도 구관이 명관이라는 말이 진리다 어릴때는 걍 만화로 봤는데 커서 보니 개 쩌는 명작이였다 
8,아무리 만화영화이지만 이렇게 작품성있는 영화는 거의 첨 
10,어릴 때 두근두근하면서 봤는데ㅠㅠ우와 이건 꼭 봐야돼 두번 봐야해여 엉엉ㅠㅠ 
10,진짜 이게 실사화한것보다 백배천배나음.. 
10,너무 훌륭함 진짜 훌륭한작품 
10,"100번 봐도 감동,, "
10,라이온 킹과 미녀와 야수는 성인이 되어서도 인상적인 디즈니 애니 
10,"시간 속에 흘러온 오래된 이야기, 그렇기에 영원히 기억될 아름다운 사랑의 이야기... "
10, 역대 애니메이션중 최초로 아카데미 작품상후보까지 오른 말이필요없는 명작!! 
10,감동과 여운이 좋아요 
10,디즈니 에니메이션 탑5안에드는 명작 
8,보고나면 가슴이 따뜻해지는 영화~ 
10,벨도 너무 예쁘고 디즈니 작품들 중에서 ost는 가장 좋은 듯해요 개인적으로 라이온킹보다 더 좋네요 ㅋㅋ 
10,이 나이먹도록 계속해서 디즈니를 찾게 되는 이유. 
8,실사판에 비하니 오리지널의 대단함을 또 다시 느끼게 된다 
10,"실사보고 상처받은 마음, 원작보고 치유받는다 "
10,정말 사랑하는 애니입니다 !  예전 디즈니 애니들은 정말 다 잘 만들었어요.. 요새껀...주먹왕랄프만 재미있게 보고 겨울왕국은 지루했네요 
7,3D효과는 그저 그랬음. 성인이 되서 보니 감흥이 없다ㅠㅠ야수는 변신전이 더 좋더라.. 
10,"91년 개봉, 지방의 동시상영 극장에서 처음 봤을 때 그 충격과 감동! 일주일동안 야간자습 땡땡이치고,  동시상영관에서 하루에 2~3번씩 보면서도 볼 때마다 가슴설렜던 기억...영화적 분석이나 평론을 떠나 내 생애 ..."
9,개쩌는영화였다 흠잡을때가없음 
7,크.. 홀에서 춤출 때 너무 멋졌음. 이 때부터 디즈니가 사운드트랙에 열을 올린듯. 
10,"디즈니의 미녀와 야수와 101마리 달마시안은 최고의 스토리텔링작으로 꼽히지(마치 007 3편 골등핑거처럼)감독이 게리 트러스데일과 커크 와이즈~게리 감독은 올리버와 친구들에서 스토리팀을,인어공주에서 스토리팀장을 거친..."
10,안봤으면 반드시 보세요 
10,"어릴적부터 내 마음속에 자리잡은 소중한 보석같은 영화!! 언제봐도 참 아름다운 이야기다. 음악도 참 아름답고..  개성가득한 주변인물들과, 누구보다 아름다운 벨..이걸 보면 그 어떤 누구보다 순수했던 어릴때가 떠오른..."
10,3D로 다시 만들어줬음 좋겠다 아무리 뛰어나도 라푼젤 보너스 영상하고 심하게 비교됨 
10,디즈니는 대단하다 라이온킹과 함게할 디즈니 명작이다 
10,이런 사랑 해보고싶다 ㅠ 
10,원작을 보지않고(있는지도 몰랐음..)2017년에 만든 미녀와 야수를 먼저 봤음에도 옥수수를 통해 우연히 이 영화를 봤는데 보는내내 빠져들게 됨.. 진짜 잘 만든 영화다. 디즈니는 언제나 대박이네.ㅎ심지어 애니메이션인...
8,명작이지만 지금 가치관으로 보면 여주인공 벨의 행동이 상당히 즉흥적이고 민폐스러운 구석이 있음ㅋㅋ 
9,OST 전곡이 레전드. 'Tale as old as time...' 으로 시작하는 주제가만 들어도 눈물이 나와...2017년 실사영화와 비교해보면 애니에서는 벨의 재미있는 표정과 가스톤의 과장된 마초스...
10,디즈니 애니 중 TOP 3 
10,말이 필요없는 디즈니의 명작 
7,기억은 가물가물 해져도 마음속에 영원히 간직될 감동의 OST 
10,『로미오와 줄리엣』과 더불어 연인(戀人)들 사랑이야기의 영원한 고전! 무슨 말이 더 必要韓紙? 
10,"여주인공이 미녀여야만 했다는 부분에서 안좋게 보는 시선도 있던데 ,저는 미녀와 야수 참 예쁘고 감동적이게 봤습니다. 어릴때부터 이작품 보면 마음에 꿈이 부풀어오르는 거 같달까 ㅠVㅠ "
10,추억으로 간직되신 분들은 아실거에요 어릴적 순수한 감동.. 너무 멋진 작품^^ 
10,애니메이션보고 황홀다는느낌은처음인듯ㅠㅠ 
10,야수가 사람으로 변했을 때 정말 슬펐다. 저 야수 정말 내 취향인데. 
10,정말 실사보다 원작이 진리다 
10,디즈니 남주 중에 야수가 제일 외모로는 별로지만 야수가 제일 귀엽고 섹시하고 멋있고 다함... 
9,옛말엔 그렇게 유치하지않을수가없었는데 이제와 다시보니 이렇게 아름다울수가....ㅠㅠ디즈니 애니보면서 이렇게 꺽꺽 운건 처음이네요 ㅠㅠ 
10,슬픈장면이 없는데도 눈물이 난다 
10,이건 영화화해선 안되는 작품이다. 원작의 발끝도 못미침. 이 작품은 과거나 현대에서도 인정되는 동화 문화재급임.. 
10,디즈니가 노래는 진짜 잘 뽑아.. 평생 기악에 남음 
10,최고예요. 몇 번을 다시 구매해서 보는지.. 정말 걸작이예요 
10,92년 제대하고 시커먼 남자 셋이서 그야말로 우연히 봤다가 넋을 잃었다. 집에 오는 길에 LP를 사가지고 와서 그야말로 닳도록 들었다. 수많은 디즈니 명작 중 나에겐 최고의 작품. 
10,역시 디즈니 TOP3 답군요...눈물 찔끔 
10,그냥 최고다. 더 덧불일 내용이 있나. 내 인생 애니메이션 
10,디즈니애니메이션 최고의 명작. 
9,넘 감동 ㅜㅜㅜㅜ근데 어째 야수가 왕자보다 잘생겨보임 ㅋㅋ 
10,이 영화에게 나는 무엇을 바라는가? 존재만으로도 나는 행복하다. 
10,디즈니의 자랑 명실상부 디즈니 원탑 애니 
7,몇번을 봐도 질리지가 않네 
10,"디즈니 명작 3대장 미녀와야수,알라딘,라이온킹 "
10,30대 후반이된 지금어린시절 보았던 그때의 그감동과 전율은잊을수없는거 같다.언제봐도 또 봐도 설레이고 감동가득 한 명작여전히 어린시절 그시간에 멈춰있는거같다 
10,시간과 세대를 뛰어넘어 두루두루 감동과 여운을 주는 예술작품을 우리는 명작이라고 부른다. 
8,디즈니 에니의 고전이자 앞으로 갈길 
10,몇번을 봐도 너무 아름답다 근데왜난 미녀와야수 ost만 들으면 눈물이날까ㅠㅋㅋ 
10,내가 제일 좋아하는 영화 
7,길이 길이 남을 디즈니 명품애니메이션.. 
7,홀에서 벨과 야수가 춤을 추는 그 장면으로도 충분히 아름답다 
10,나 이거 다시 보고 싶은데 어느 사이트에 가서 검색을 해도 안나오네ㅜㅜ 
10,옛날 더빙판에서 야수가 사람으로 돌아올때 당신이었군요!! 하던 벨 목소리 듣고 울컥!!!! ㅜㅜㅜ 
10,울어버렸다 ㅜ.ㅜ 세기의 걸작이다... 
10,딴건 그렇다쳐도 노래가 너무 좋다. 어릴적 보던 디즈니 영화를 다 잊고 살던 때에도 듣던 노래...셀린 디옹 버전의 Beauty and The Beast. 알라딘의 whole new world랑 인어공주의 part ...
10,아주 재밌음. 이거 옛날꺼 맞음? 스토리도 진짜 잘만들었고 ost도 않 좋은게 없음. 좋은 것도 없음. 왜냐하면 다 너무 좋으니까. 캐릭터도 넘나 잘 만들었고 재미가 아주 많음. 성우가 캐릭터와 한몸이 됀 것 같고 ...
10,꽃잎떨어지기전 야수 잠깐 죽을때 눈물흘렸다 ㅠ 
10,사랑하면 포기할 줄 도 알아야 한다는 것을 야수가 보여줌.. 
7,약간 급전개이지만 노래 및 영상미가 좋은 작품 
10,대표곡 뷰티 앤 더 비스트 정말  최고에요ㅠㅠ계속 흥얼거리게 되는..10년 지나고 봐도 재밌네요역시 디즈니! 
10,흠 잡을 때 없는 불후의 명작. 특히 벨은 지금봐도 충분히 능동적이며 매력적인 캐릭터다. 
10,오늘처음봤는데존잼쓰..영화도봐야겟음ㅠ 
10,디즈니 애니중 내 최고..특히 ost가 너무 좋다 ㅠㅠ 
7,Beauty and the Beast는 언제나 나를 눈물나게 한다 
10,이 영화의 모든게 아름답다.. 
8,디즈니 오리지널 만화중 정말 좋은 영화! 사운드트랙은 하나하나 명곡!! 
10,미녀와 야수는 언제나  봐도 너무 감동적인 사랑이에요  Peabo Bryson와 Celine Dion이 부른것도 좋고 내 인생 최고의 디즈니 애니메이션이였습니다  완전  개  끝내주는 핵꿀잼 이런  명작이 또 있을까...
10,"라이온킹,알라딘과 더불어 오랫동안 기억에 남는 주제가..15년이 지나 다시봐도 재밌다 "
10,굉장히 아름답고 순수하다 ㅅㅂ 
9,다시한번  보고싶다.  여운이 남는  영화!~ 
10,진짜 아름다운 사랑이야기... 
10,초등학교 다녔을때 이영화면 10번 넘게 보던 기억... 왠만한 요즘영화보다 훨씬 재밌었던 기억...노래들도 다 좋고... 
10,"디즈니 양대산맥: 미녀와 야수, 라이온킹 "
10, 두번봐라 세번봐라 계속봐라 
10,웃고 울게한 영화  내가 디즈니 공주중 다음 생으로 태언난다면 난 벨 
10,보는내내 즐거운 영화인듯 노래도 정말좋고 내가 미녀와 야수 내용을 잘모르고 봐서그런지ㅋㅋㅋ엄청 흥미진진했음 
10,"내 평생 최고의 애니메이션 세 손가락 안에 드는, 볼 때마다 미소짓게 되는 빛 바래지 않는 보석과 같은 영화. OST를 접하면 아직도 아련하고 가슴 설렌다. "
10,외모보단 마음이 더 중요하다... 행복한 결말 정말 좋다... 
10,노래도 좋고 재밌다 역시 디즈니 
10,너무 재미있어요.. 미녀와야수 옛날 느낌 그대로 예요.. 
10,디즈니 최고의 영화.... 
10,진짜 좋은 애니메이션이다. 몇 번을 봐도 안 질릴것 같다. 내관점에서 말이. 
10,내면의 아름다움을 강조한 애니메이션. 너무 아름답다! 
10,역시 디즈니는 음악이 최고다 
10,어릴적 환상을 꿈꾸게 한 작품. ost도 최고. 
10,완전 재밌다 추억이 새록새록 
9,명작은 영원하리~~ 
8,야수가 왕자로 돌아온게 정말 아쉬울 줄이야.. 
7,뜬금없이 러브스토리가 진행되는 점은 아쉬웠지만 걸작은 걸작 
10,"모네를 좋아한다면 꼭 볼 것. 자연을 너무 아름답게 그려놔서 깜짝 놀램. 이 영화가 90년대 영화라니.. 거기서 더 놀램. 너무 예쁜 영화, 색감때매 감탄하면서 봤다... "
10,매번 볼때마다 기분이 산뜻하고 행복해져요ㅎㅎ 디즈니 공주 시리즈중 제일 좋아해요!!! 
10,어제도 또 봤습니다. 디즈니 영화중 감동적인 면에서 최고 진국이죠. 
10,다시봐도 명작~~~♥.♥ !!!~~ 
10,"슈렉 개봉 10년 전, 디즈니도 외모지상주의를 다루었었고, 심지어 그것은 명작이었다. "
7,동화 속에 녹아있는 사랑의 인문학 
10,국민학교때 보고 40대인 지금도 봐도 뭉클하고 너무 명작이다.. 내 아이랑 함께볼 수 있기에 더욱 감동이다...동심은 사라지지 않는구나... ㅜ 
10,23살에 이 명작을 이제서야 보다니.... 
8,"환상적인 ost, 90년대 그래픽 치고 괜찮은 퀼리티, 그리고 스토리도 나름 각본 잘 짬!^^ "
7,애니로 봐도 가스통이 가장 매력적이네. 허풍.야비.욕정.. 
10,"스토리도 좋고, 노래가 너무 좋넸요~~ "
10,다시 봐도 감동은 그대로네요. 명작입니다. 
9,디즈니 르네상스를 연 전설의 작품 중 하나... 
10,국민학고4학년 때 극장에서 본 이 에니메이션 영화는 내 인생 최고의 영화가 되었다. 
10,미녀와야수는 너무 잘 만들었어ㅠ 봐도봐도 감동임 
9,너무 아름답고 감동적인 이야기입니다^^ 
8,왕자로 안 돌아가도 괜찮았을듯 
10,나만울컥한게 아니였구나... 
10,"디즈니 영화중에서 손꼽히는 명작, 현대작품들에 시도보다 이 영화가 더 우수하게 느껴진다 "
10,아 재미지다.ㅠㅠ 디즈니 애니 황금기 시대가 다시 왔으면 좋겠다. 
8,마음이 따뜻해지는 아름다운 애니메이션 
7,야수가 되어버린 왕자도 잘생겼어 
10,개봉 당시에 극장에서 보고 완전 충격 먹었던 애니 촛대와 접시들이 춤추는 장면에서 그 움직임의 부드러움에 진짜 놀람.기술적으로도 예술적으로도 완벽한 성취다.그뒤에 디즈니는 인종차별적이라 논쟁의 여지가 있지만 상업적으...
9,성인이 되서 생각해보니까 왕자가 인간이되지 못하고 야수로 그대로 남게되고 그래도 벨은 야수모습인 왕자를 사랑하는식으로 끝내도 좋을것 같다 왕자의 내면을 더 사랑한다는 식으로... 사실 인간 모습보다 야수모습일때가 더...
10,너무좋아요 3번이상은 돌려본듯 
10,생각날따마다 다시봐도 재미짐! 
10,역사적인 디즈니 애니메이션 
10,Tale as never old as time. 
10,어릴적책으로도보고 영화로도보고  어른이되서 다시봐도 재미있어요 ^^  옛날생각도나고 
8,내가 왜 이걸 이제야 봤나?? 
10,무슨 말이 더 필요해... 
10,내가 12살때구나.. 벌써 시간이 이리 지났고 난 아줌마가 됐지만 볼때마다 그때 그시절로 돌아간 느낌.. 그립고 그립다 
10,단순하고 장엄하고 숭고하다. 미천하다. 따뜻하다. 부드럽다. 찾아낸다. 알아준다. 다시 찾아낸다.  네 안의 끝이 없는 은하수를 . 
10,서울극장에 홀로가서 봤던 감동적인 애니메이션. 
10,지금 cgv 아이캔디로 봤는데 너무 재밌다 초반에 채널 돌리다 우연히 보기 시작해서 중간에 해장국 먹으러 가야지가야지 하면서 끝까지 다 봤네 마지막에 싸우는 장면 하인들이랑 싸우는 거 너무 재밌게 그려서 웃으며 봤음...
7,아이들과 같이 보면 좋아요. 
9,클래식의 정점인 디즈니의 작품중 하나 인듯 하네요. 시작부터 끝까지 상당히 재미있게 봤습니다 
7,디즈니 애니메이션의 전성기를 연 당시로선 획기적인 작품 
10,내인생최고의로맨스영화 
10,이거이거 야수 완전 츤데레구먼ㅋㅋ 
10,말이 필요없는 영화. 너무 아름답고 순수한영화인듯 
10,더빙판으로 봐도 재밌음^^ 
10,)(*&^%$$#FGHJ 
7,디즈니의 마법이 발동 되었던 순간. 
7,어릴 적 자주 듣던 음악이 춤추며 흘러나오니 감회가 새롭다. 
8,디즈니 전성기 엄청나네 
10,as old as time:시간만큼 오래된 이야기- 이거 하나로 끝이다 
10,야수 완전 츤데레 ㅋㅋ 1991년에 나온 영화지만 전혀 촌스럽지 않고 ost도 좋고~ 
9,어렸을적 할머니와 함께 극장에서 봤던 추억이 떠오르네요. 마지막 장면에서 울었던 기억인데 할머니는 주무셨던 기억 ㅎㅎ 
7,어렸을 때 재미있게 봤었지.. 
10,실망임...왜 1시간20분이야ㅠㅠ 하 진짜 스무살 넘게 처먹고 디즈니 애니보고 울었음...뭔가 교훈도 주고...순위권에 있는 디즈니 애니 다봐야지 
10,25년이 지난 지금봐도 너무 잼있고 아름다운 애니메이션어렸을때봐도 잼있고 성인이 된 지금도 너무 아름다운 미녀와야수~노래도 정말 명곡이다~모든게 아름다운 애니메이션 최고!! 
10,디즈니중 제일 감동적인 스토리 
10,에니메이션 인트로에 나오는 영상과음악이 항상 설레이고 좋습니다. 신비로우면서 어딘지 슬픔이 있는 듯한 느낌으로 시작되는 첫 장면은 정말이지 이야기에 몰입하게되는 중요한 부분인듯합니다. 
10,라이온킹과 더불어 최고의 디즈니 에니 
10,진짜 어릴때 감성 느껴져서 좋고 음악도 하나하나 너무좋아 
10,미녀와야수 몇번이나 봐도 질리지않고 재밌다감동의 애니메이션ㅠㅠ 
10,ㅎㅎ노래 넘 좋아요 ♡♡ 
10,말이 필요없는 최고의 영화 
10,너무너무 좋다 ㅠㅠ 지금봐도 명작임 
10,서브컬쳐게 사람들절대보지마세요 동심을찾아야지그딴소리하면서 보셨다가는 촛대랑시계에 치입니다. 
9,시간이 지나도 변하지 않는 아름다운 사랑 이야기.. 
9,사랑스러운 캐릭터들과 아름다운 화음의 교합 
9,중딩때 본 재미있는 애니메이션.. 
9,어릴때 보지 않은게 너무 아쉽다 
10,벨은 못생긴 야수를 사랑했지만 결국 야수로변한 왕자와 결혼한건 미녀다는 드립이고 미녀와 야수 짱짱맨 
9,디즈니 왕자 캐릭터가 너무 한결같은 것만 빼면 정말 재미있게 볼수 있는 가족 애니~ 
7,무난한 스토리를 감동으로 커버하다. 
10,미세스폿트가 부른 노래 너무 좋아요 그런데 다른 가수가 부르면 느낌이 안 오네요 원작노래만 좋아하는 나..ㅋㅋ 
10,디즈니 2d애니메이션 중 최고의 작품! 
10,동화+공주+음악 ... 디즈니 애니메이션의 가장 영광스러웠던 순간 
10,Just Touching... 
10,"어제 겨울왕국 흥행돌풍! 프린세스 특집 -미녀와 야수 . 디즈니채널에서 하는데 .. 봤는데 이건 3d도 아니고 한글,영어 ,이렇게볼수잇는데 영어보면 자막없어서 더빙보는데 어쨋든 더빙으로봐도 3d로봐도 무슨 .. 장난..."
10,노 코멘트 입니다 이건ㅋㅋㅋ 
10,디즈니에 나오는 악역중에 가장 인성이 드럽다는 개스통이라는 악역이 나오는영화 물론 포스는 라이온킹 스카가 갑이지만 
10,디즈니 꺼는 다 봐야지 ㅎ 
10,고전 중에 고전이지만 그 어떤 신작보다도 진한 감동.... 
10,알라딘과 함께 디즈니 양대 명작!! 
10,"왕자님의 본모습이 나오는 시간이 너무 짧아서 늘 아쉽다고 느껴지는 영화..,, 오랜만에 본 야수님 와일드한 외모가 참 마초적이고도 부드럽고 잘생기고, 멋있다 ㅎ.. 어쨌든 보는 동안 행복감에 젖어들게 만드는 감성을 ..."
10,정말 감동적인 영화네요ㅠㅠ 진짜 재미있어요 
10,봐도봐도 질리지 않는 작품 
10,어린이 필수 코스!!! 
10,VTR로 다시본 미녀와 야수... 뭉클해 
10,보고또봐도 넘 이쁜ㅜㅜ 벨 너무너무이쁘당 
10,뻔하지만 그래도 멋있네요 
7,happily ever  after 
10,촛불 생각남 
10,디즈니는 좋아~ 
5,야수 중국어 더빙판 목소리 성룡이 맡은거였음ㅋㅋㅋㅋㅋㅋㅋㅋㅋㅋ 뮬란에선 샹 장군목소리 맡더니ㅋㅋㅋㅋㅋㅋ 
10,야수목소리가 넘 멋지당... 짱!! 벨이 부럽다 
7,더빙이.... 몰입을 방해했다... X파일에 멀더 목소리.... 
10,영화가 끝난 뒤에도 자리를 뜨고싶지 않았다. ㅠㅠ 
5,아직도 3d타령.... 디즈니 요새 낼 작품이 업니. 
10,완전 만족해용 
9,만족해요~ 3D라 입체감이 사네요 ㅎ~ 
8,엄마와 함께 극장가서 봤던 기억이 새록새록~ 
10,사랑해요 디지니 
10,야수였을때가 훨씬 멋있긴해도 그래도 감동 
10,큰 기대는 하지 않았다(사실 기대많이 했다...)기대이상 진짜 벨과 야수를 보게되다니 
8,존나좋군?! 
9,명작은 남아있고 음악은 계속된다. 왕자로 안 변했으면 만점이었을텐데..... 
9,"뭐가다른지는모르지만, 재밋음! 영화시작전 라푼젤뒷이야기보는재미도쏠쏠 "
10,3D가 좀 거슬렸지만 감동은 여전함 
10,너무감동적이어서 눈물날뻔했음 노래도너무듣기좋아요3D라더실감나고요정말GOOg 
10,참재밋어요^___________^   눈물나려고했어염 
8,더빙의 한계는 여기서도 드러나는가..3D는 잘살렸네요 사랑스럽고 따뜻한애니!전반적으로 굿 
10,"너무 아름답고,감동적이었다~!^^ "
10,3D느느 안봣지만 ㅎ 
10,완전ㅇ쁘네요 
10,너무 재밌네 
10,라푼젤만 따로할수없나.... 
10,라푼젤이 킹왕짱이었음! 완전 스펙타클 대박이었다 
10,역시 말이필요없는 더빙안된거보려고 코엑스까지 다녀온보람이 있음♥ 
10,3D로 보니 더 재미있다! 감성적이다. ㅠㅠ 사랑하고싶다. 
10,meilin33님휴먼어겐은오리지널판에는원래그노래는없어요. 
10,정말 짱 !! ^^~~~~~~~~~~~~~~~~~~ 
7,3D보다는 걍 스토리에 집중하는게 좋을듯...저도 오프닝 라푼젤이 더 재미있었음! 
10,완전 재밌어요 미녀와야수대박~!! 
9,추억의 고전 애니메이션이다 오프닝 라푼젤도 좋았음 
10,"역시, 시간이 지나도 변치 않는 감동! "
10,"명작은 명작이었다. 마치 어린 그때로 돌아간것 처럼, 괜시리 마음이 두근거렸다. "
10,이건그냥말이필요없음ㅠㅠ 
10,"정말 재미있었고,즐거웠어요.야수의 모습 화날때 정말 무서웠어요!!미녀와 야수 짱!! "
10,어릴때 본 내용그대로 바뀐거 없는데도 또봐도 너무 재밋었습니다. 
10,영상에서 눈을 뗄 수 없다. 보석같은 영화. 역시 미녀와 야수다! 
10,감동적이에요 
7,정말 재밌지는 않았지만 3D로 오랜만에 보아서 좋았습니다. 
10,재미있음 
10,어린시절영화를처음본감동그대로! 
10,자꾸자꾸 놀아나고싶은 디즈니식 상술 ㅠㅠ 계속 날 우롱해 줘 ㅠㅜㅜ 
10,마지막 엔딩크레딧에 캐락터 스케치 나오는거 너무 멋있다 ㅠㅠ 
10,오랜만에 본 라푼젤도 좋앗구 미녀와 야수는 그냥 짱이엇수당^^ㅋㅋㅋ 
10,디즈니의 명작중명작!!! 
8,"빠른전개가 아쉽고, 벨이 아름다웠다^^ "
10,아랫분 말씀처럼 이 영화야 말로 클래식 ... 
10,이런 영화야 말로 클래식~ 
10,대박~~~~~~~~~~~!!!!!!!!!! 4월11일보러가야지 ㅎㅎㅎㅎ 
10,3D로 다시 개봉한다니 반갑다. 삽입곡만으로도 감동적이던... 확실히 명작이었다. 
5,"명작이지만 디즈니, 언제부터 이딴 리메이크나 뽑는거지? 다시 업으로 돌아와!! "
10,재미있겠다. 
10,여러분 안보셨는데 어떻게 아시나요 ㅋ 
9,아잉재밌겠당.ㅜ 
10,명작. 명작. 명작. 
10,3D로 돌아온 360도 무도회씬! 감동과 설렘이 2배! 
10,웃음 작렬 '라푼젤' 결혼식! 
10,마음에 듭니다. 
10, 미녀와 야수 추억의애니 국민학교4학년보았던 미녀와 야수 
10,아주 오래된... 옛날 이야기... 
10,"미녀와 야수 완전 불후의 명작, 이제 알라딘, 인어공주 도 나오겠지~ㅋ "
10,우리공주님예쁜 
10,이시기에 나온 디즈니들은 전부 명작. 미녀와야수 인어공주 알라딘 라이온킹 등등 
10,밑에분 말 공감 
10,이건 진심 명작임.. 퀼리티 쩐다 
10,이거보고 내 유년시절이 생각났다.... 아 너무 감동적이다. 
10,최고의영화 
7,아쉬운 점은 많지만 영화 자체는 아름답다. 
10,디즈니느님!! 
9,디즈니의 과거와 디즈니의 미래를 함께 보여준 작품! 
10,최고 
10,만약 3월에 3D로 보게 된다면 더빙은 절대로 보지 말 것. 촌스러워. 
10,제가지금까지본모든것중에최고였습니다. 
10,클래식이즈베스트 
9,겉모습보단 마음이 따듯한 사람이 좋습니다 
10,20살 먹은 지금도 최고.. 
10,딸아이땜에 DVD로 다시 보게된 만화..그 유명한 음악 흐르면서 야수랑 춤출때 정말 최고.. 
10,이건 역시 최고지 ㅠ 노래도 그렇고 내용도 그렇구 ㅠ 
10,디즈니가 왜 디즈니인가? 
10,어렸을 적 가지고 있던 동화의 환상속에 다시금 들어갈 수 있도록 해주는 영화! 
10,OST마저 최고 
10,진짜 밑에님처럼 크리스마스때 봐도 좋을듯ㅋㅋ 
10,최고의 크리스마스 영화 그 이상 
10,역시 디즈니 명작 !!! 
