score,review
10,1993년  그때 여주인공 홀리헌터의 연기력에 반했던 기억이 있는데 세월이 흘러 이제 다시 보니 피아노 선율도 좋고 영상미도 뛰어나서 더욱 감동적이었다.역시 좋은 영화는 다시 봐도 명작이다. 
1,총체적으로 더러웠다협박 성추행이 로맨스가 되는 부분부터???연기는 잘했지만 인물심리가 ???왜 명작인지 모르겠어... 
1,거래같은 소리하네. 완전 성희롱 영화. 
1,남녀의 교감을 중점적으로 보는데. 이부분이 너무 세련되지 못하고 불쾌하던데.; 목덜미 강제 입맞춤으로 시작할 때부터 식겁. 이후 거의 성추행 유사방법으로 여자를 길들이다시피함 
10,"사랑이 무언지 알 수 있는 영화. 하비케이틀의 연기와 내면을 보여주는 영상미, 그리고 음악이 예술의 경지. "
10,이만큼 섬세하고 아름답게 여자의 사랑을 담아낸 영화가 또 있을까. 
9,해변가에서 피아노 치는 장면은 세계 영화사에 길이 남을 명장면이다. 
10,"시사회 다녀왔다. 20년 만에 다시 본 피아노, 보는 내내 감탄이 흘러나왔다. 음악, 연기, 촬영... 어느것 하나 빠지지 않는 명화다. 특히, 네 배우들의 섬세한 감정선은 관람 시간 내내 침조차 조심스레 삼키게 만..."
10,"에이다의 섬세한 심리를 완벽하게 표현한 홀리 헌터, 대단하다. "
1,명작이래서봤는데 이해가 안되네 저딴남자 어디가좋다는건지 
10,피아노의 건반수에 따라 점차 타오르는 두 사람의 사랑이 에로틱하면서도 설레였다. 
1,할말이 없습니다 뭔가 있겠지 하며 끝까지 보다가 모니터 부술뻔했습니다 
1,수업으로 보게해서 본거지만 페미니즘적으로 분석해도 도무지 공감이 안가는 캐릭터.. 
2,시간이 지날수록 이 작품은 작품성이 떨어질듯. 여성의 재산권을 전혀 인정하지않고 여자역시 물건취급당함. 에이다의 피아노의 권리가 지켜졌다면  성희롱에 의한 길들이기 작품이 나올수없었음. 에이다가 바다에 빠져 죽으려고...
10,해변가에서 피아노를 치는 홀리헌터와 그옆에서 춤을추는 안나파킨.잊을수 없는 명장면..최고의 영화 최고의 감독 최고의 배우.. 
5,영화 자체는 좋으나 왜 여자 피아노로 남자 둘이 감놔라 배놔라 하는지 모르겠음 피아노 건반을 대가로 여자에게 성적인 요구를 하는 남자는 특히 최악 그런 남자에게 사랑에 빠진다는 스토리는 더 최악 이것만 빼면 명작은 ...
9,억압된 여성의 성과 사랑 
2,"별점 한개는 영상미때문에 준다. 강제추행, 불륜, 아이양육에 악영향. 내용만 보면 최악ㅡㅡ "
10,섬세한 터치로 그려낸 여성에 관한 걸작 중에 걸작 
8,8 샘닐 기분이 이해가 간다. 정신 멀쩡한건 아이와 원주민만이야.. 
10,두남자의 에이다에 대한 이해와 배려가 비교되면서 왜 그 남자와 사랑에 빠졌을까 쉽게 납득할수 있었다. 마음을 가질수 없는걸 깨닫자 보내주는 남자도 쿨하긴 했지만 왜 결혼을 못했었는지 이해가 ㅋㅋ.... 
1,역겹기만함 어딜봐서아름다움이라는거지 결국 성추행으로이루어진사랑이 아닌가 
8,다 좋았는데... 에이다가 그토록 사랑에 빠지게된 이유들이 공감이 잘안됨.. 불쾌 했을것같은데 
8,남자배우들이 너무 아버지 같아서 몰입이 안되더라구요 별하나 뺐어요 
2,보는 내내 너무 불쾌했음 여자를 뭘로 생각하는건지...차라리 언페이스풀은 로맨스가 아름답기라도 했지ㅠㅠ 
9,피아노가 전부인  여자...그것을 존중하고 있는 그대로 여자를 사랑할줄 아는 남자...진정한 사랑이 무엇인지 깨닫게 해주는 영화였습니다 
1,이영화 도대체 무슨 의도로 만든건지 모르겠습니다 정말 멘붕함 X나 잼없음 진심 
1,불륜 영화를 사랑으로 미화하네ㅋㅋㅋ 
3,저질.....중후반까지보다가 말아서 모르겟다만 별내용없음 
10,에이다는 피아노로 말을 한게 아닐까.. 
7,영상미와 음악은 좋은데..내용은 좀 아닌것 같은.. 
1,끝까지 보는게 고문이다 
9,20년이 지나도 마음을 고동치게 하는 피아노 선율과 그저 대단하다고 밖에 말할 수 없는 홀리 헌터의 연기 
1,늙다리와 젊은여자의 현실성없는 사랑이야기 
9,"성인배우들 연기야 말할것도 없지만, 특히나 안나파킨의 아역연기가 이 영화를 살린것 같다. 연기도 잘하고 어찌 저리 귀여운지ㅋ 홀리헌터의 피아노연주에 맞춰 그옆에서 춤을 추는 안나파킨의 바닷가장면은 영원히 내 기억속에..."
10,대사 한마디 없이 얼굴 표정과 몸짓으로 캐릭터의 힘을 보여준 홀리 헌터님 
9,살아가는 것에 대한 이유를 요구하는 에이다 
9,"내가 태어난 해, 22년 전의 영화를 극장에서 볼 수 있어서 행복했다. 진솔한 사랑과 음악, 순수하고 비밀스러운 영상 모든 것이 아름다운 영화이다. 명작이란 말이 어울린다. "
10,고요하면서 격정적이다. 많은 것을 생각하게 하는 영화.. 
10,"볼수록 매력적인 영화. 스토리, 영상, 음악 무엇하나 완벽하지 않은 것이 없네요. 특히 너무 재밌다는 사실... "
10,20년 전에 본 영화를 그저께 다시 봤는데 다른 감동이 밀려왔습니다. 무삭제라서 더 좋았답니다. 음악도 좋구요!  보세요~~ 
10,잊혀지지 않는 피아노음악과 배우들의 섬세한 감정 연기가 너무 좋았어요 
10,영상미와 음악 그리고 홀리헌터 그녀 최고의 명연기 
7,몸이 통하면 마음이 통하는것인가 마음이 통해야 몸이 통하는 것인가 
9,여우주연상은 너무도 당연하다 
10,정말 하비케이틀 무슨 늙은아저씨가 이랬다가...완죤 반했다는. 참 마음을 울리네요~ 
10,가장 기억남는 영화 중 한편~ 
6,이런 얘기 뻔하다..여자 캐릭터가 마음에 안든다 같은 여자로서. 
10,여감독만이 나타낼수 있는 섬세함이 곳곳에 있는 매력적인영화 
10,자신의 음악을 인정한 사람에게 자신을 바치는건 당연한거다 
4,몰입안되는 남주들 때문인지ㅜ 욕정의 저급 장면들로 혐오ㆍ불쾌감이 남는 사랑 영화도 드물다. (딸도 못말리게 미친)사랑을 그릴거면 납득될 애절함ㆍ감동ㆍ여운이라도 있어야... 애절한 사랑 타령이 삼류로 빠진영화 
10,"93년 개봉했을 때, 지금도 그 때의 감동을 잊을 수가 없다. 그 음악들도 난 여전히 듣고 연주해본다 ^^ 몰랐는데 2014년에 다시 개봉했었나 보네.. "
10,내 인생의 영화. 말로 표현할 수 없다. 
6,홀리헌터의 연기만(!)은 평생잊을수없다 
1,멘붕당하고싶으면봐라 
10,어릴적에 이 영화의 관점이 육체적인것에 중점이였다면 성인이되어 이영화를 다시 보았을땐 진정한 사랑에 대해 알게 되었다 
10,"최고, 지극히 치밀한 인간에대한 묘사 "
10,"중학생때는 피아노선율에 감동하였고, 어른이 되서는 영화의 감동에 빠지게 되었다. "
9,3번연속봤다 하루종일 봤네 
2,교수님이 감상평쓰라해서 봤는데 보기 무척힘들었습니다.. 과제로 안내주셨으면 굳이 찾아서보고 이런평점도 안남겼을텐데 ㅠ 처음부터 안맞아서 두시간내내 보기가 힘들었네요.. 
3,영상미는 좋은 거 같아요.. 
6,나한텐 너무 난해..ㅜ 
9,명화는 세월이 흘러도 명화라는 것을 알게 해준 영화 
10,가슴을 적시는 영화....잔인한 장면이 있지만 오히려 마음아프다 
1,BAD 
1,0점 주고싶은데 아쉽군 
6,영상미도 좋고 연기도좋고 다 좋았으나 제겐 내용이 그다지 와닿지도않고...그렇게 좋은지 모르겠네요 평점높은영화들 대부분 다 공감하는데 이영화는 잘 모르겠어요 
10,영원히 작품성 하나로 길이 남을 영화다 
9,너무나 멋진 아름다운영화...사랑하고싶다..나를 이해해주는사람이라면.. 
6,극장서 본 기억이 나는데.. 주위 평은 당시에도 좋았으나  내겐 맞지 않더라 
10,OO년전 여고생 시절 이영화를 보고 펑펑 울었던 기억. 삽십대 중반 한 남의 아내로 엄마로 다시봐도  가슴 뜨거워지는 감동.  아직도 운전 중 듣는 아름다운 OST 
10,내 인생의 영화. 
10,"정략으로 끌려온 사람한테 패미니즘, 불륜따지는거 웃기다 완벽한 연기, 음악. 최고 "
10,그 바닷가의 피아노.... 
10,마음이 잊지 못 할 명작.. 
10,피아노의 선율과 이야기구성만봐도 가히 10점 줄만한. 영화 
10,인생과  맞서서  두려울게 없는  것처럼 
10,"사랑하는 방법을 알려주고, 여성 자아를 찾아가는 영화, 이렇게 스토리 탄탄하고, 영상미 예쁜 영화가 또 어딨을까 역시 명작이다 "
8,나의 관점에서의 여주의 심리는 이해하기 힘들었다. 소통의 창의 어떻게 열린 것인지... 그 발단이 어떤 것인지 두 남녀가 사랑을 느끼게 되는 과정 자체가 좀 나의 관점에는 이해힘들다. 어쨌건 결론적으로 그녀의 소통의...
10,진정한사랑은 만병통치약이구먼 
10,훌륭하다! 
10,잊을수 없는 영화였다. 지금도 가끔 차안에서 sacrifice를 듣곤한다.. 
10,"음악, 화면, 내용, 연기.... 모두 굿임 "
9,다시 보고 싶은 영화네요... 
1,피아노와 불륜에 미친여자를 아름답게 그리려고 용쓴 영화..볼건 영상미??-주관적 
6,여주인공의 내면 연기와 피아노 연주는 일품이지만 막무가내의 피아노에 대한 집찰 그리고 그것으로 인한 난해하고도부도덕한 사랑을 다 품어주기에는 부족하지 않았나...  평들이 다들 극찬인데 그정도 영화는 아니다. 
10,"다시만난 피아노.   20여년이 지난 지금도 나는 이 영화 앞에서 망설였다. 지난달 세상을 떠난 사촌이  지금 아내가 된 여자 친구와 듣고 싶다고  내게서 가져간 ""피아노""의  ost. TAPE. 스크..."
10,내인생몇안되는감동적인영화~ 
10,평들 땜에 안봤으면 후회할뻔. 이런 감정느끼게 해주는 영화 몇 년 만인지 모른다. 정말 가치있는 영화. 
10,"두번 고민할 것도 없이 명작! 댓글에서 일부 사람들이 여성의 인권, 성추행, 아동교육, 불륜, 페미니즘 등 운운하는데, 미안한 얘기지만 그런 꽉 막힌 관점으로 이런 예술적인 영화를 감상하고자 하는 자세부터가 글러먹은..."
10,말이 필요없다. 처음부터 끝까지 예술영화. 27년전 영화라는게 믿기지 않는다 . 
9,말하지 않아도 알 수 있는... 
10,아이다에 눈빛이 마음에 계속 잔상처럼 남아있음.본 이후 이틀째 잊혀지지않음.너무나 최고!!! 엄마심부름 하다 딴길로 샌 딸내미때문에 많이 열받았음ㅋㅋ 
8,명작! 꼬마가 연기를 잘 한다 생각했는데 조연상수상. 우리나라의 옛날 TV문학관을 보는 느낌. 
10,"패왕별희와 더불어 그 해 가장 빛났던 영화. 아름다운 영상, 마이클 니만의 음악과 더불어 홀리헌터의 연기는 정말 최고였다. "
10,역시 명작은 봐도 또봐도   늘 새롭고 많은걸 느끼게하고 생각하게하네 .. 역시 피아노 
8,베니스??좀싸이코같다...바다에빠지는장면이제일인상깊음.. 
10,딸의 연기는 정말 최고였다 이런 아역배우는 다시 없을 것이다 
10,자칭 페미니스트들이 작품의 시대 배경과 내포한 의미는 생각 못하고 이 위대한 영화에 보내는 더러운 시선이 안타깝다. 제인캠피온이 페미니즘으로 까이는 것 자체가 웃긴 일이란건 그들의 텅빈 대가리론 모르겠지. 
10,영화라는 예술 그 자체의 존재 그리고 피아노.. 
10,아 추억이 돋는 영화 피아노 이네요... 
9,해변에 놓여진 피아노.. 그 풍경만으로도 가슴이 떨린다.  말이 없이 모든 감정을 표정과 몸짓에 담는 홀리헌터의 연기는.. . 정말 대단했다..    특히 비오는날 쓰러지는 장면에선...  여러모로 아름 다웠다.. ...
10,내가 많이좋아하는영화  나에겐 진정아름다운영화였어 
10,바다 그리고 피아노 
10,전율이 쫙~흐르는 영화. 
10,마지막 그 고요함 속의 피아노가 잊혀지지않네 
10,다시  다시 봐도 명작이다.봐도 명작이다 다시 봐도 명작이다. 
10,단언컨데 완벽한 영화다. 
10,재개봉 날짜를 기다리다 이벤트 당첨으로 시사회를 보고 왔는데 몇 번을 본 영화인데 극장 화면으로 다시 보니 새롭고 반갑고 홀리헌터의 피아노치는 손이 자꾸만 아른거린다.  개봉하면 다시봐야 하나? ㅎㅎ 
10,영화 재밌게 봤다 홀리헌터 참 이뻤다 
10,너무나 강렬한 영화!아직도 잊혀지지 않는다. 
10,명작입니다. 
10,매력적인 영화다 
10,음악부터 영상까지 특별한 아름다움이 있는 영화. 
1,난 이런 영화가 싫다. 불륜.....평가만큼 좋은 영화는 아닌듯. 
10,"내가 태어난해에 나온 영화라는 게 믿기지 않는다. 홀리 헌터와 하비케이틀의 연기와 호흡도 최고였지만, 움직임, 표정, 앵글 하나하나가 이야기를 흐르게하는 공기(atmosphere)를 만들어내는데에 완벽했다고 생각한다..."
8,오래전에 본 영화.. 다시 보고 싶다. 
10,"벙어린벙어리답고, 아인아이다운 절제의미가 살아있는영화. 홀리헌터연기력 죽음이다 "
10,이 영화는 여성의 자아를 찾아가는 페미니즘을 잘 보여주는 영화였다 감동적이다 
9,"연출, 연기, 영상미까지 부족함이 없다. 피아노의 의미를 알아채고 접근하는 남자의 사랑표현은 거칠다 못해 폭력적이지만 에이디는 길들여짐이 아닌 선택으로서 그를  받아들이고 탐한다. 자유와 억압, 원초적 쾌락과 서구화..."
10,
10,기묘하고도 신비로운 테마. 사랑의 속성을 날카롭게 파헤치는 고통과 쾌감 
10,영상미 좋고 연기력좋고 
9,친절하진 않았지만 그 감정에는 충분히 공감할 수 있었다. 
10,최곱니다ㅠㅠ쵝오!!! 
10,피아노에 대한 죽음을 넘어서는 집착과 애정은 그랑블루에서 돌고래와 다이빙에 대한 집착과 비교된다.  정상적인 삶이 아니기에 미쳤다고 볼수있지만 누구나 한번쯤 무엇인가에 미쳐보고 싶은 욕망을 대리만족시켜준다 
6,그냥...뭐...ㅎ 
10,"무말이 필요 없는 걸작...매력적인 스토리. 파격적인 정사씬, 아름다운 음악..완벽하네요 "
10,그녀에게 자기 자신이였던 피아노. 
8,I have ten pingers 
8,소시적 봐서 그런지 내용은 잘 모르겠지만 음악은 좋았다. 
10,하비와 샘의 연기력은 놀라웁다... 
10,그녀는 결국 자신을 숨기던 피아노를 벗어난다. 
10,10년만에 다시 본 피아노...이제 좀 이해가 간다. 또다른 감동.. 
8,피아노 없이도 소통이 가능해진 에이다와 그녀를 연주한 베인즈. 
8,  시대와 관념의 억압에 저항에 비록 궤도에서 벗어난 사랑일지라도 스스로 선택하고 애써 온몸으로 지키려는 에이다의 의지에서   더 이상 말 못 하는  미망인의  유약함은 찾아 볼 수 없다. 연출 연기 영상  음악 완...
10,다시 없을 영상과 음악! 
8,홀리헌터의 연기는 신의 경지 
10,보고 또 봐도 몇 개월 후면 또 보고싶어지는 영화입니다. 연기도 음악도 참 좋아요^^ 
10,음악도 영상도 너무나 아름다운 영화 
10,보는 내내 에이다가 행복해지기만을 바랬습니다.. 다행이예요 
10,기존에 비디오테이프로 봤던 피아노에선 편집되어 빠진부분이 있었다는걸 재개봉판을 보고 알았고 이제야 피아노는 내게서 완전해졌다. 
9,다시봐도 감동적임.. 
7,아름다운 피아노 선율 
9,그 감수성.... 정말 오랫만에 보는 명작이다. 
10,넘 감명 깊게 보았던 영화!~음악과 그 애절함이 아직도 귀와 맘에 남아 있는 영화~ 
10,"어렸을때 봤는데,지금도 잊지못할정도로 인상깊은영화!최고예요:-) "
10,명화중에~ 명화! 배우들의 연기가 일품! 
10,감각적이고 감성적인 연출이 뛰어나다. OST도 굳! 
10,홀리헌터의 소름돋는 연기.. 백마디 말보다 눈빛으로 모든걸 설명하는.. 
10,이거 이거 머리털 쭈뼛해지는 영화였습니다. 명작이죠. 
10,"정말이지 나에겐 특별한 영화, 너무 슬펐죠.. "
10,사랑에 있어서 용기있는 선택이 피아노 소리처럼 아름다웠습니다. 
10,말이 필요 없는 영화. 
10,말로설명할수없는무언가가있다.감동찡 
10,"배우들이 너무 멋지고, 안나파킨 이때가 최절정........... "
10,"어릴때 보고 지루하다,이해못한다 했던 영화들을 나이먹어 다시보니 어찌나 좋은지 "
6,영화를이해하기에내가부족한거일수도있으나불륜을살짝미화시키는감이없잖아있는거같다 
1,여자의 미스테리를 미화한 영화 
7,기대를 너무 많이했나... 
9,아.. 내가 여자여서 더 공감할수 있었다..최고!! 
6,여자가 아니라서 지루했던 영화 하지만 이미지는 좋았다 
10,20대 봤을땐 그저 야하구나40대 중반 다시보니 big my secret 피아노 선율이 계속 생각나고베인스의 고백이 이리 가슴을 저밀줄이야베드신 마저 아름다운 명작 
10,미쳤다.. 93년작인거 보고 또 개깜놀. 
8,어릴때 봤다가 잔인한 장면에 충격먹음. 헬레이저 나이트메어 시리즈도 즐겨 봤었지만 걔들은 원래 그런영화니 맘다져먹고 봤지만 이건 무방비속에 당해서 더 끔찍한 기억으로 남음. 다시보기도 겁남 
10,에이다의 피아노에 대한 열정과 애정이 묻어난 영화..세월이 지나 다시 봐도 좋은 영화입니다. 
10,내가 본 영화 중 최고다.  최고의 영화.. 
4,ost 멋져서 보게됬는데 불륜 영화라니...!!! 근데 꼬마얘 이중인격 가진듯?? 꼬마얘보는 재미로봤음... 
8,좋은 작품 
9,10여년 전쯤 학생일 때 우연히 본 것 같은데... 피아노와 바다에 빠지던 그 장면 때문인지 손가락 장면 때문인지 못 잊겠더라구요. 
10,왜 이리 평점이 낮지.. 9점 이상인데.. 
10,감성을 자극하는영화 
10,그 바닷가의 피아노가 영원히 잊혀지지 않는다 
10,"말이 필요없지요!!   보시면 아시겠지만...  "" 최고의 영화~~~! "" "
10,93년에 이런 영화를 만들다니 
6,예술과 외설을 넘나드는 영화입니다. 연기 영상미 음악 너무 좋은데 남녀주인공이 사랑에 빠지는 장면이 영화의 질을 떨어뜨립니다. 
8,손대면 톡하고 터져버린 그녀 
10,바다에서 들려오는 파도 소리..   etude17.. 
6,"스토리가 음악, 영상미에서 얻은 감동을 다 깎아버림 "
5,요즘 많이 볼 수 있는 연출과 묘사가 들어있다. 여주인공의 눈빛이 아름답다. 남주인공의 캐릭터는 그냥 변태캐릭터라 스토리 엉망. 
4,보는 관점따라 다르지만..진정한 사랑을 찾는이들과 아내를 잃은 남자의 스토리 누군 해피엔딩 남은이는 새드인 영화 
10,요즘 왤케 엤날거 재개봉이 많지 
10,The piano is mine. It's mine. 
8,"손가락이 잘린 후, 피아노에서는 여전히 아름다운 선율이 흘러나올까? "
10,할말 없다. 그냥 좋다. 
10,영상미 아름다웠던 영화 
10,여자라면 더 공감할수 있었겠다. 여자의 주체적 삶에 대한 영화 
10,바다에 놓여 있는 피아노의 이미지가 지워지지 않아요. 
9,에이다와 베인스의 사랑보다 에이다와 피아노와의 교감이 
9,재밌게 보았어요^^ 
10,잊혀지질않는영화...영화도ost도. 
9,아름다운 피아노멜로디가 귓가에 남는다 
10,아름답다! 
10,만점~ 
10,그녀의 인생에 전부였던 피아노... 
10,초등학교3학년때봤었어요.9년전에전율이지금도느껴지는영화죠. 
10,홀리 헌트에게 영광을 가져다 준~ 
10,어두운 화면. 음악이 나오자 그건 모든 것을 감미롭게 바꾸었다. 
9,"절제된 욕망,질투,사랑-잔잔하고 서정적이고 여운이 많이남는 "
10,뭔가모르는매력에빨려들어가는영화~사운드트랙의 감동까지 
9,다시보니까 조금 별로인데... 연기력과 영상미는 좋더라. 
9,너무나도 아름다운 뉴질랜드의풍경 또 그녀의 사랑의 삶 
10,음악이 먼저 가슴에 다가온다.. 
10,진짜 영화다 
10,홀리헌터의 눈으로 말하는연기... 
10,피아노=관         이 말이 너무 인상깊었다. 
10,...그녀는 삶을 택했다. 오랜만에 눈물을 쏟은 영화. 
10,충분히 10점.영상미도 끝내주고 사운드도 멋지고 
10,나는 만점을 줄 수 있다. 최고의 영화니까. 
10,엔딩 짱~!! 진짜 피아노 소제로 최고의 영화~!! 
10,너무 감동적이었다... 생각을 마니 하게 만드는 영화... 
10,연출력이 돋보였음.. 좋아하는 영화 마지막 씬 멋있었음 
8,홀리와 하비의 연기는 눈부셨다 제목처럼 잔잔한 드라마 
8,그루미한 분위기와 은근히 야했던..그리고..먼가 남았던.. 
10,감성적인 연출력과 배경을 환상적으로 잡아낸 촬영. 
10,여성의 정체성과 성적 판타지를 잘 표현한 작품이었다. 
9,잔잔한 감동이 머리속에 계속 남는다..멋진연기력도 
9,페미니즘적 요소가 짙은영화... 마지막 장면이 인상적이었다... 
10,피아노 반주가 환상적인 영화 
9,자식도 부모에게 짐이 될 수 있는 걸 깨달았다. 
10,ost하고 스토리하고 꼭 뭔 상관관계가 있어야 하나??-_- 난 좋았음 
9,"가부장적 사회에 대한 침묵의 항변,억눌린 여성의 목소리를 대변하다. "
9,만점은 줄 수 없다. 
9,"여성으로써 미친듯이 좋은 영화,, 이영화와 음악과영상과 배우에 빠지다,, "
10,아름다운 영화 
9,음악이 더욱 좋은영화!! 흔하지 않은 스토리에도 점수를 줍니다. 
10,이 영화에 대해 10점을 준다는것은 턱없이 부족한 점수다. 
10,
10,지금봐도 최고의 영화. 
10,"우아하고 극적인 사랑, 아픔의 삶을 피아노 선율로 표현하는 홀리 헌터의 연기에 극찬을 보낸다. "
2,그닥..그저그런 영화네요 
8,다시 회자하는 명작 영화 중 하나 
10,"요즘 같이 더럽게 볼 영화가 없을때,, 생각나서 다시 보게 되었다 마이클 니만의 음악과 함께..  아름다운 영상과 스토리.  최고 "
10,아직까지도 보고싶은영화 
7,그때는 이 영화를 이해하기에 너무 어렸던 걸까요? 
10,멋진 영화. 긴여운이 남네요. 
9,"애틋하면서도 위험한 느낌, 섬세한 감정의 흐름이 잘 느껴진다. 피아노의 흘러가는 선율 그대로 따라가 보시길 "
10,완전 명작이다 ㅋㅋ 완전 재밌다 
10,매력있는 영화네요. 재밌게 잘 봤습니다. 
9,아 ~~ 요즘 맨날  옛날영화 또 하고 또하고.. 그런데 이영화  요즘 극장 사운드 좋아졌으니 다시봐도 재미 있을려나 
10,오래전에 본 영화인데 아직도 감동이 남아있어요. 명작은 다시 봐도 좋아요 
7,잊혀지지 않는 영화...그러나 좋은 영화인지는 모르겠다... 
10,참오래 전에 본영화인데... 참 좋은 영화 
9,Very good! 
10,15년만에 다시 봐도 밀려오는 감동의 소용돌이는 더 커지는 명작..명작 중 명작... 
9,꼭 봐야할 영화 
8,좋군 
9,이게 20년전 영환가 요즘영화같은데 
9,에이다가 피아노와 함께 바닷 속에 묻어버린 것은 무엇이었을까 
10,"사랑에 대한 지극히 인간적인 접근, "
10,재미보다 감동을 느끼실려는 분께 추천. 애들에겐 무척 지루한 영화다. 
10,10여년전의 감동이 아직도 생생한 영화... 
10,항상간직하고 있는 영화 
10,고등학교 2학년 때 보고 가슴이 아리는 듯한 감동을 느꼈는데 시간이 지나도 여전하네 
9,아름다운 영화 
8,정적인 아름다움의 영화. 
10,최고의 예술영화... 
10,아...the heart asks pleasure first  들을때마다 맘이 편해져.. 
9,최고 
10,예술영화 
10,벙어리에게서 들려오는 소리. 놀라운 영화라고 생각한다. 
10,"섬세한 영상, 감성적인 연기 모든게 완벽했던.... "
10,좋은 영화는 세월이 흘러도 좋은 영화로 남는다.배우들의 눈빛 연기가 압권! 
9,홀리 헌터의 눈길이 나의 마음을 파고든다. 
10,삶과 사랑과 거리감... 그리고 단절과 소통... 벙어리 에이다는 모든걸 말하고 있다 
10,굿굿굿. 
10,기억에 남는 영화중 하나... 
10,"아름답다, 아름답다, 숨차게 아름답다. "
10,100점주고싶다.. 
10,에이다에 매료되다... 
10,관점에 따라 너무 다양하게 읽혀지는 텍스트. 그러나 어떻게 봐도 완벽함. 
9,낭만적인영상...그리고 이기적인 엉덩이... 
10,하비의 누드 섹시함 
7,"그래도미끼는남성이던졌구만무얼,내재된욕망의 재발견 "
