score,review
10,"유일하게 소장하고 있는 명작중의 명작!!  주연,조연,음악,영상,스토리,주제까지 너무 완벽해서 감독에대한 경외심과 이런 작품을 만나게 해준 모든 제작진에게 감사를 보냅니다. 10번을 보아도 또 보고 싶은 .. "
10,개봉때 봤는데 아직도 장면 장면이 잊혀지지않는다 문득 생각나서 다시봤는데 섬세한연출도 좋고 특히나 홀리헌터의 연기는 대박이다 
8,안나 패킨 연기가 오스카 여우조연상 받을정도인지 잘 모르겠네.. 
10,내가 본 가장 아름다운 영화... 
10, 나의 인생영화... 이보다 더 큰 울림을 주는 영화를 아직 만나보지 못했네요 봐도 봐도 질리지 않는 아름다운 영화네요 
10,취향적중 피아노곡들하고 귀여운 안나파킨 ㅋㅋ 
10,"93년, 사귀던 여자친구가 보고 싶다고 해서 끌려가서 봤던 영화.  그 영화가 내 인생에서 손가락에 꼽을  영화였다. "
9,NTR 당한 한 남자의 분노 그리고 용서를 다룬 영화. 
8,재개봉 해서 보러갔어요~마무리가 좋네요 
10,"내 첫사랑이 나한테 알려준 영화, 피아노를 쳐달라고 했던 곡,  8년만에 봤습니다.. "
8,감각이 머문자리보다 사랑의 흔적이 크기에 
8,"평점한번 내기 힘드네.. 네이버 자꾸 오류뜨니..? 여튼 첨에 남편이 잘했어봐~ 불륜했겠나.. 에이다의 행동이 xxx 같긴했지만, 영화음악이 여운에 남네요~말도안되게 해피엔딩으로 끝나서 평점이 높은지 실제로 손이아니..."
7,배우들 연기는 정말 말이 필요없지만 영화자체는 아름답게 만들려고만 해서 강렬함이 별루없어서 지루하게 흘러간다. 
8,여자 어린이의 연기만 기억에 남는다. 
10,지금까지 본 영화 중 최고 
10,"최근 본 영화 중 가장 영상미에 매료되었던 작품, 피아노 선율이 어우러져 더 좋았던 영화 "
5,나쁘지 않으나 좋은 구석도 없다. 
8,여감독의 섬세한 심리묘사가 압권이었으나 이해할 수 없는 서양인의  성개념; 
6,예술적이나 보기에 잔인하고 섬뜩한 영화 ~ 
7,사랑이 모든 것을 용서하는가 
5,피아노도많이안쳐 곡도안좋아 이해안되는불륜은 아름답지도않고 
1,성착취에 협박당하다가 사랑에 빠지고 결국 불륜들켜서 손잘려서 몸져누운 와중에 남편은 강간하려하고 개더러운데 황금종려상 받은 이유좀 알려고 보는데 평점 높게 준 사람들의 생각과 평의 심리를 모르겠다 전혀 아름답지 않다...
10,여자라면 이 영화를 더 잘 이해할 수 있을거에요. 
9,심장이 쪼그라들어서 내내 조마조마하다가 마침내 안도하게 되는 ㅠㅠ 
10,예술은 평범함 너머에 있군요 
10,연기자들의 열연이 기억에 남네요!^^ 
10,나는 희망한다. 나의 꿈을... 영화는 나에게 알게해줬다! 나의 마음속에 담겨져 있는 나의 마음을... 
8,홀리 헌터 기여어. 헌터(+1) 
9,오세아니아의 바람에서 온 정취적 풍경. 
7,엔틱적이군. 
8,anna paquin 보려고 ㅋ 
10,이런 영화가 있어서 행복하다 
10,정말 좋았음 
10,재밋음 
10,에이다와 베인스의 고통스러운사랑 그리고 스튜어트의 질투.... 
10,나도 좋다 닥썩^^ 
10,좋다 
10,이 영화에나오는음악이 너무감미롭고좋아여 제목이피아노라알고있는데... 
10,나의내면속깊이자리하고있는사랑과죽음에대한고찰 
10,음과 색으로 계속된 긴장을 준다 
10,전율 그자체다. 미치도록 아름다운 영상미.. 피아노를 통한 자아표현.. 아름답다. 
10,최고의영화 
10,완벽한 영화. 
10,섬세함.. 이같은 수작은 다시 보기 힘들 게다... 
9,cine feminism.... 
9,최고죠.. 
10,어렸을때 봐서 그런지 아직도 잊혀지지 않는 장면이 기억나는 또렷한 영화 
10,잔잔하게 사랑을 담은 영화 . 
10,아름답고 섬세한 여성의 사랑 
10,굿 
10,음악이 너무 좋았음.. 화려하진않지만 마지막까지 눈을 뗄 수 없었던.. 
10,"최고의 배우, 최고의 감독, 최고의 음악, 고로 최고의 영화 "
10,영화도 좋았지만 다른거 다 빼고 ost만으로도 10점 
9,느낌있다 
10,너무나 멋진 영화 
10,"언제봤는지는 ,..오래전에본 영화가..아직도잊혀지지않습니다. "
10,대중에게 영화라는 매체의 위대함을 증명한 대표적 사례 그리고 완소 안나 파퀸 
9,"절제됀 감정의 대화, 말하지 않아도 느낄 수 있는게 있다. "
10,My BEST 
10,에이다의 표정을 잊을수가없다. 슬펐다. 소름이끼칠정도로. 
10,꽤나 심오한 영화..사랑에 대한..한번쯤 보시라고..10 
10,양말에 난 구멍이 그토록 에로틱할줄은... 
8,음울해 
10,영화속 심리묘사의 정수를 보여준다. 
10,대사는 별로없었지만. .마음으로 느낄수있는 영화 
10,본인의 삶을 되찾기 위한 자신과 타인에 대한 침묵의 항변 
10,오래전에봤지만그감동은아직도여전하다. 
10,그녀의 말이 들렸다. 머리속에 온통.. 정말 사랑을 하면 그렇게 될 수 있을까.. 
10,홀리의 전율적인 연기는 영혼을 휘감는 카타르시스를 선사한다. 
9,피아노선율이 눈과 귀를 타고 전해오다 
10,사운드와어우려져 정말최고엿던 
10,섬세하면서 거침없는 여자의 性에 관한 이야기 
10,절대 지울수 없는 음악과 영화. 
8,10여년이 지난 지금도 기억에 남는 영화 
10,음악은 또다른 커뮤니케이션의 도구임에 틀림없다! 
10,숙명 사랑 욕망 그리고... 잊혀지지 않는 영화.오래남을 영화. 
10,외설이냐 예술이냐는 이 영화로 판별되어져야 한다. 
10,남자들이.부부.연인들이 꼭 봤으면...하는... 
10,지금까지 봤던 영화중 가장 에로틱했다. 
10,오래 기억에 남는 다시 보고 싶은 영화 
10,복합적이야.. 결말로서 참 인상적 
10,가슴속에 날카로운 흉터처럼 남는 영화 
8,안나파퀸의 귀여움만 내게 남아... 
10,아름다운 영상미와 여성감독 특유의 섬세함... 
10,절대잊혀지지않는영화..음악각본연기자감독 모두 최고! 
9,피아노라는 이름의 욕망 
10,살아있음을 느끼게 하는 마법같은 영화 
10,오래전에 보았지만 기억에서 지워지지 않는다. 
10,영화에서 말하는 바는 분명히 있었다. 
10,인간의 사랑을 묘사하고있는영화 
10,뭘 말하는지 모르겠는가? 인간을 말하고 있다. 
10,"바다선율과 슬픔,침묵,그리고 피아노 , 내겐 영원한 최고의영화. "
5,뭘 말하는건가요?예술과사랑?취미와불륜? 
7,걸작 평범한 스토리지만 뭔가 다르다 
7,바람피면 X 되는 걸 시사하는 영화임.. 
4,포스터는 예뻤다... 
5,나도 그리 좋은 영화인지 모르겠음..그런데 안나가 귀여웟음... 
6,내용이 너무 복잡하다;젠장; 
10,영창 피아노 삿습니다 가진돈 다 털엇어요 
2,내가 뭘 기대한거지?? 
9,응?! X발 꼬마야 왼쪽으로가야지.!.!.! 
10,감동적이네요 감사합니다 좋은영화 
9,"설정이 참신한 듯 하다..언어장애와 피아노를 잘석어 언어표현을 최소화함으로써 음악과,장면에 더 집중할수 있는것 같다...정말 최고의 표현인 듯. "
10,I can't say a word. 
10,말이 필요없다. 역시 칸 영화제 대상이다. 우리나라엔 이런 영화 안만드나... 
7,영화를 휘감는 마이클 니먼의 감성적인 멜로디. 
3,칸느를 노린 철저히 계획적인 작품. 진정 제대로된 평가일까? 
9,중학교때 봤던 영화..이런게 사랑이 아닐까 생각했던..수OO동안 보게 되는 영화...연주곡이 너무 아름다웠던 영화 
10,어린이때 봤을때도 가슴속에 남아있던 영화.명작중에 명작 
10,이 영화를 싫어할 수 있다는건 스스로가 생각좀 해봐야 한다.페미니즘어쩌구 저쩌구 하는 놈들말음 듣지마라.이영화는 뛰어난 영상미와 음악을 기본으로 가져가고 3인물의 갈등을 고스란히 관객에게 전해준다. 하긴 어벤져스나 ...
8,제도와 문명으로부터의 속박을 깨고 여성 해방을 외치는 페미니즘 영화 
1,장애도 있고 애 까지 딸린 여자가 결혼한 남자 부터이해불가 .이쁘거나 매력젹인것도 아니고... 
8,예술과 외설은 종이 한장 차이. 
3,홀리헌터와 제인캠피온 부각된 것 말고는 영화적으로는 그렇게 감흥이 와 닿지는 않는다 
8,외국감독과 외국 배우가 찍은 '밀회' 
10,영상미에 대한 교과서.... 
9,마지막 5분은 영화사에 길이 남을 명장면!특히 밧줄에 묶여 바다에 빠지는 장면... 
10,제 생의 최고의 영화였습니다!이작품으로 깐느 여우주연 받을만해요! 홀리헌터 쵝오! 
10,이 여자가 원한건 일탈이였을까... 하지만 남편에게는 잔인한부분..오묘한 작품 
10,내 생애의 최고의 영화 중 하나 
9,시대상을 그린 할리우드 영화사상 또 한 편의 수작 
10,봐도 봐도 또 보고 싶은 영화. 너무 아름다웠다. 
10,메디슨카운티와 다른듯 비슷한 영화.일생에 단 한 번. 확실한 감정이 왔고그 판단은 오직 본인만이. 
7,딸이 나쁜x이넹 그걸 날름 고자질하냐 ! 으이그 자식농사 잘못했엉 
5,남편은 그렇다치고 딸까지 내팽겨칠 정도의 바람이 나기엔 하비케이틀의 외모나 몸매가 너무 매력이 없다;; 
8,착한남자가 그렇게 매력없나? 
8,"있는 그대로 바라봐주고 그 소리를 들어주는 것, 그것이 가장 숭고하며 또한 가장 어려운 사랑. "
3,에이다 베인스  나이차 역겹다 여자를 너무 물건 취급한다 
10,19살에 본 사랑이야기 사랑이 뭔지도 몰랐을때 조차도 한쪽 가슴이 애림 느끼게 해줬던 영화 
8,당췌 정신세계가 이해 안되는 변태 미혼모..미혼모 주제에 남편도 불륜남보다 훨 낫더만..홀리헌터 연기력은 인정 
1,나도 20살 어린 유부녀랑 사랑하고 싶다 
