score,review
10,She was no different from anyone else. 
9,묘하게 기분 나쁘고 묘하게 제레미아이언스에게 끌리고 
10,20년 전 영화임에도 불구하고 촌스러운 구석이 없어요 
10,상처입은 사람들은 위험하다 
10,아름답게 퇴폐적이야ㅜㅜㅜㅜ 
10,"죽음의 문턱까지 가본 사람은 삶에 대한 집착이 강하죠그들에게 중요한것은 오직 살아남는것, 그리고 신에게 차별받았다는 느낌 상처 입은 영혼처럼  위험한 짐승은 없죠 "
10,그녀의무엇이 그다지도 특별했을까? 저런 여자를 진짜 팜므파탈이라고 하는거겠지.미중년의 최고봉 제레미 아이언스 짱짱! 
10,"사랑은 모든 것을 압도하지만, 우리는 그것을 피할 수 없다. 그러나 그 사랑은 사실 평범한 것과 별 다를 바 없는 것.... "
8,사랑에  눈이멀어  자식농사 자기손으로 갈아엎기...그나저나  연출력이  대단하다 
6,1992년도 영화 같지 않다.. 
10,보는내내 생각은 단하나..제레미아이언스 넘 멋잇당 ㅠㅠ 
9,줄거리의 파격과는 별개도 배우들의 연기가 좋았다 각본에서 안나의 감정도 좀더 섬세하게 담았으면 설득력이 있었을텐데 아쉽다 
10,상처받은 사람들은 위험해요 그들은 살아남는 법을 알죠 
8,제레미의 제레미의 의한 제레미를 위한 영화. 
10,안나가 오빠를 죽이고 결혼할 남자를 죽이고결혼할 남자의 아버지를 몰락시켰고 그의 어머니의 가정을 무너뜨렸다.자신은 전남친과 다시 재결합하여 아이도 낳고 평범한 가정 코스프레를 하며 살아가고 있다..그녀는 상처로는 합...
8,모든걸 걸지마 모두 잃기 싫으면! 
7,안나는 나쁜년.... 제레미아이언스의 미모가 출중하다 
6,순전히 제레미 아이언스 때문에 다봤다. 여주는 그냥 인격장애가 있는 환자고 이들의 사랑은 오직 파멸을 불러올 수 밖에 없는 비상식적인 불장난이다. 애초에 사랑이 맞는걸까? 그저 서로의 정신적 흠을 채워주는 이상적 대...
6,보고나면 찝찝한 영화.... 자칫하면 3류막장영화가 될뻔했으나 극중배우들의 열연과 음악이 고급스럽게?? 포장했음 
8,로리타에서도 받았던 느낌 ..이해할수있지만 용서할수없는 선택하지만 이성앞에서 고뇌하며 또 여자를찾는제레미아이언스의 연기는왜 그렇게 안타까울까 
4,가끔은 뛰지 말아야할 심장이 뛰곤한다.... 
7,쥴리엣 비노쉬의 연기 스펙트럼은 어디가 한계인가 ??? 
8,"치명적인 안나,그녀도 결국 행복할까?집안박살,인생박살 "
8,줄리엣비노쉬의 이때포스라면...8점은 너끈하지.. 
8,"다른 감독이 찍었으면,외설...루이 말이 찍으니까,예술...틴토 브라스의 전작들을 봐.예술영화 하나도 없지...영화란 감독의 예술이라는 말 하나도 틀린데 없다 "
5,.....제레미아이언스밖에 볼거없음..=_= 
10,금기에 대한 욕망. 하지만 그렇기에 포기할 수 없는것 
4,보는내내 화가나는건 나뿐인가. 이걸 사랑이라 할수있나. 한낱 인간의 더러운 욕망과 치부일뿐. 
4,기대 이하의 베드신 
4,정말 얄미운 캐릭터를 맡은 줄리엣 비노쉬. 
8,여주인공같이 살면 않되요!! 이건 어디까지나 영화 
1,미친... 
10,20년 전에 완전 충격이었는데..  이 영국배우는 참  남자가 우아해~~~ 
9,요즘 영화들 볼게 없는데 군계일학이네 
10,그 만큼 사랑할 수 있다면 내 인생이 파괴되어도 좋다. 
10,장관의 자리에서 늘 이성적이고 냉정함을 유지하던 제레미가 줄리엣을 만나면서 자신의 열정을 발견하고 모든걸 걸었지만 팜므파탈 오빠의 죽음으로 상처받은 영혼 줄리엣은 부자관계를 오가면서 오빠를 떠올리게 된다. 각자 자신...
9,여자가 나쁜년-_-;; 불륜의 결말은 결국 이런게다! 
7,손끝의 움직임까지도 아름다운 제레미 
8,누구와도 다르지 않은 사람과 우린 그렇게 사랑에 빠진다 
7,모든걸 다 버릴 수 있을 것 같은 사랑 같지만 결국 그도 평범한 한 사람인 것을..  그땐 눈이 멀어 아무것도 보지 못한다.?순간의 욕망과 쾌락의 댓가는 영원한 상처를 남기는 걸 잘 보여주는 것같다. 그래서 데미지인...
8,"제레미 아이언스 보려고 본 작품인데 ,다 보고 난뒤 정말 현기증났던 기억 "
10,거장의 섬세한 손길... 잊혀지지않을 걸작. 
10,외설로보일수잇는소재를감독배우들이만든최고의멋진명영화다 두고두고. 
9,안나.  재수없는  년. 피하는 게 상책. 
3,이끌리는데로 결국에는 모든것을 잃는 파괴적인 영화. 
6,"난 별로던데... 왜 그렇게 안나가 좋은지도 이해가 안가고, 전반적으로 심리적인 부분에서 납득이 안감. 그래도 금지된 욕망이라는 부분을 영화화 했다는데 점수를 주고싶다. "
1,여자가 역대급 악녀인듯..자기 가족 죽인 것도 모자라 남의 가OO지 다 파멸시켰네..결국 결혼은 제 3의 남자랑 하고.. 
8,ㅈ제레미  아저씨는 저때부터 변태영화전문배우엿구나..꼭 저런영화만 나와요.. 롤리타영화에서도 십대소녀를 사랑하게되는 연기를보고 인상깊었는데  1992년에 개봉당시  고등학생이었지만 그때보고  이OO뒤 보고..음..그...
7,글쎄.. 뭐랄까... 왜 그렇게 맹목적으로 빠지는 걸까? 잘 몰겠네 
8,당신밖에 안보여` 평생본게 없잖아요'제레미 여전히 지적이다 
10,거의 20년이 흐른 지금도 치명적. 제레미는 어쩜 그리 아름다울 수 있는지 
5,세련되었으나 구리고찝찝한데 아련하고안타깝고 괘씸한 영화 
6,94년도에 봤으면 별5개. 지금은 소재만 파격적. 그렇지만 제레미아이언스는 좋다 
10,금지된 욕망을 넘어선 집착을 묘사한 명화 
3,첨엔 저런여자에게 빠진 제레미가 안타깝기도했지만 볼수록 둘의관계가 역겨웠다..말도안되는 스토리..아빠뻘인 남친아빠를 유혹하는 미친여자가 세상에 어디있기나할까?ㅋ 
10,제레미 아이언스처럼 나이들고 싶다.. 
9,제레미 아이언스의 팬이 된영화 
10,뭐라해도 제레미의 연기는 압권...그의 팬이 되어버렸다 
5,"마틴과 아내, 아들만 슬프도록 안쓰러워지는 영화. 이건 사랑도 아니고...그래도 영화자체는 세련된 느낌. "
6,상처입은 사람들을 조심하라. 그들은 살아남는 법을 알고있다. 
8,"나는 치명적인 이끌림을 믿지않는다. 이영화보는내내,말도안돼! 이런일이 실제로있다면, 정말 오마이갓!쒜따펔커, 정말,연기들은 훌륭했다. 근데, 꼭 기자평론가들은  일어나서는 안될이야기에서는,,점수를 후하게주드라??ㅗ "
2,아무리 아름답게 포장하려고 해도 더러운 건 더러운 거고 아닌 건 아닌 거다 
10,"누구나 상처는 있다! 하지만 그걸 본인이 특별한 척 하는 데에 이용하는  건 또다른 얘기이지. 나도 여자주인공같은 사람이 스쳐가곤  했다. 다시말하지만, 누구나 상처는 있다. 특별한 척 해봤자, 아는 사람들은 얕은 ..."
9,한 여자땜에 2대가 멸한 불륜 치정극..그러나 멋지고 이쁘네 
6,세상의 어쩔 수 없는..이해할 수 없는...으로 포장하려 하기엔....배우들만 빛났다 
10,인생을 만드는 것들은  깨달을 수 없다  아는 것 그 이상이다   우리가 사랑에 굴복하는건 알 수없는 뭔가를 느끼게해주기 때문이다  그이외의 것들은 무의미하다---모든것을 잃은 후 스티븐의 독백.  사랑이 대체 뭘까...
5,충격적인 스토리인데 내가 더 충격먹은 이유를 알겠다 
8,제레미 아이언스!! 갈수록 매력이 넘치시는군요. 
4,누구든 짜릿한 느낌대로 사랑하면상처. 사랑때문에 모든것이부서지는 파괴적인 
9,첫눈에말이돼 이게도대체 사랑이야욕정이야  내용은 더러운데 이상하게 저질이 아니야 욕하면서 보는데 화는 안나  뭐야 이 영화 
1,"뭘 말하려는지는 알겠는데, 이렇게 밖에 표현할수 없었을까? 주인공 남자 이해안됨 과연 그게 사랑일까? 안나라는 여자 (아들의 여친)가 본인의 모든것을 걸만큼 그렇게 소중할까? 과연? 역시 남자는 젊어 놀아봐야 자신이..."
7,이제는 늙어버린 오도방정 불륜스토리. 그러나 그때였다면 꽤나 충격이었을듯. 
5,"다소 충격적인 소재, 그뿐. "
1,가정 파괴범 안나 멋있다. 
10,완벽한 사람처럼 보이는 한 남자가 차곡 차곡 쌓아온 자신의 인생을 갈아엎는 영화...그래도 그 만남을 후회하지 않는 것은 사랑이기 때문일까? 
10,각인된 상처에서 비롯된 뒤틀린 열망 
7,위험한 욕망과 뒤틀린 감정사이 구원은 없고 파국으로 얼룩진다. 
7,영화제에서 제레미 아이언스 실제로 보니 키크고 미남..이영화 개봉 당시에는 상당히 파격적인 내용이었음. 
8,제레미 아이언스 
7,그녀 또한 다르지 않았다. 여기서 여운.. 상처입은 사람은 위험하다. 이게 그녀를 이해하기위한 이론 
5,금지된욕망에대한표현이 뛰어난영화 하지만 비도덕적인 스토리 
8,샐리가 이뻤는데... 영화 찍은 거 이거밖에 없더라 
7,제레미 아이언스 그 자체. 
6,이미 예고된 결말... 
8,제레미 아이언스땜에 오늘 잠 다 잤네...일찍 일어나야 하는데 데미지 이 영화 나에게 정말 데미지 
1,인간의 추악함을 느끼게 해주는 영화 
1,엽기 
10,아빠뻘 남친아빠를 유혹하는 게 말이 안 되는 것 맞는데 상황이 조금 다르죠. 제레미 아이언스라고!!! ^^;; 분위기 치명치명하고 최고였습니다. 보는 내내 아슬아슬 가슴 떨리고 그래서 더 비극적이고.젊은 레레경감님을...
3,미친 영화 
5,글쎄? 어디를 보고 괜찮다는 건지.. 욕정에 힘껏 휩쓸려라??? 
10,줄리엣비노쉬 너무나 아름답다...이 영화는 이것 하나로 소장할만 하다. 
4,밑도끝도 없다....진짜 
1,자기를 파괴시키는.. 사랑으로 포장된 욕망.. 
10,"제레미 아이언스만 표현할 수 있는 허무한 욕망의 끝.. 충격적인 장면들이 놀라웠지만, 터덜터덜 추리닝입고 아무것도 거리낄 것 없이 아무도 모르는 동네에서 살아가는 마지막 씬이 인상적이다. "
8,사랑이란게 원래 그래 때로는 너무 치명적이고 누구나 알 수 없지. 어쩌면 너무 위험해서 조심하고 피하고 참으며 그렇게 산다 
8,"배우, 연기, 충격적 스토리 모두 볼 만 합니다. "
7,"상당히 매혹적이다. 좋은 대사도 많고... 일단 남주, 여주를 존나 잘 뽑았다. 근데 궁금한게 비노쉬 엄마는 점쟁이인가? 우째 한눈에 알았지? "
8,제레미 아이언스와 줄리엣 비노쉬는 두말할나위없이 매력적이다. 92년작임에도 불구하고 전혀 이질감도 없다.  공허함을 채우려는 욕망은 인정하지만 상대가 너무 나빴다ㅠ 
8,20년도 더  넘은~~~  대박~~~!!!  먼가 의상은 촌시려우나~   스토리는 그시대에 대단-ㅎㅎ 
8,심리묘사...두 남녀는 눈빛 연기 최고 
8,"금기에 대한 욕망을 말하는, 섬세한 연출과 뛰어난 연기의 명품 막장 치정극. "
6,중간부터 봐서 그런가.. 이해할 수 없는 욕망의 종류. 특히 안나; 
10,"당시 개봉때 충격적인 스토리! 근데 영화는 전혀 외설적이지 않았다 , 세련되고 마음한켠으론 요상하게 공감되는 그런 영화. 그리고 제레미아이언스의 힘! "
8,제레미 섹시햏 
6,포스터가 더 야해.. ㅋ 
10,제레미진짜짱임완전잘생겼다..........베드신은좀약하지만그래도위험하고멋진관계였다 
10,그냥좋다 제레미멋짐 
10,학창시절 비디오로 봤던 너무나도 충격적인 소재의 영화였다. 
6,평범한영화 
10, 줄리엣 비노쉬 치명적인 매력 
9,밀양처럼 주제가 잘 살아있는 영화다. 
7,영화와 소설속에 유폐시켜버리고 싶은 스토리. 
10,"누가, 누구에게, 어떻게, 얼마나, 상처를 주었을까 "
8,충격적인 스토리..배우들의 내면연기 
8,배우들을 보자 
10,그들이 사랑할 수 밖에 없었다는 걸 보여준 두 배우에게 영광을 
8,"사랑에는 격정보다는, 노력이 필요하다..... 제레미 최고 "
7,제리미와 줄리엣만으로도 볼만은 하다. 
6,훌륭한 두배우를 가진 영화치고 기대에 못미치는..개연성이 없어 
3,어쩔수없는것이 감정인가? 
7,연출과 각색 그리고 연기 모두 훌륭했으나스토리가 별로. 상처있는 치명적인 여자로인해 한 가정이 파탄나는 총체적 난국  그런데 그 원인제공자인 여주는 잘만사는.. 
8,오래전에 본 영화인데 아직도 이 영화를 생각하면 혼란스럽네요 
1,그냥 기분나쁜영화..보고나서도 찜찜한기분 
9,인간의 이성은 이드에 비하면 너무나도 초라한 존재일 뿐이다. 
5,불씨는 지피는데 끓지 않는다 
8,"쌀쌀해지는 저녁에는 이 영화 속 안나가 생각나게 될거 같다.""상처받은사람은 위험해요 살아남는법을 알고있으니까' 참 이해되면서도 슬픈말이다 "
7,That damage!!! 
1,별로다.. 
5,'상처'란 모티프를 조금 더 놀라운 '불륜'이란 것으로 표현한 것 뿐이지 않은가? 
6,이건... 아니다... 이 캐스팅으로 이렇게 밖에 만들 수 없었나? 
10,상처입은 자들은 남에게 상처를 주면서 자신의 상처를 연민어린 눈길로 바라보는 순간을 즐긴다 
8,
1,스무살때 친구들과 비디오방에서 봤는데 다들 정말 짜증났었던 기억이..멕시코에서 며느리랑 결혼한 사건 보고 이 영화인것 같아서 평점 남김 
10,그냥 보세요... ~! 
7,"금기를 깬 사랑이 불러온 핏빛 비극, 그와 상반되는 아름다운 배경과 미술 "
7,사랑 받음으로 상처를 치유함과 사랑함으로 상처 주는 것. 
8,불안한 시점이 잘 담겨져있음 
10,어느 치명적 감정에 대한 거장의 클래식 
8,치정의 결말은  파멸이다.그걸 예감하며서도 헤어나지 못하는 안타까움. 
10,"안나는 상처입은 걸까, 그런 사람인 걸까? '나을' 수 있을까? "
7,제레미 아이언스의 연기가 돋보이는 영화!베드신 때문에 깍인 영화!베드신 땜문에 특별한 영화! 
9,욕망의끝은결국평범속에묻힌다 
10,.. 
10,찜 
9,모든 감정과 비난을 받아들인 주인공의 공허한 얼굴이 안타깝다. 
8,언제껀대 지금 개봉?? 
10,"노출 수위로만 따지면 외설! 작품성과 같이 보면 진정한 예술, 다시 본 <데미지> 마음 한 켠이 아리네요! 시사회 때 보고 멘붕! "
8,나약한 한 인간이 금지된욕망을 통해 파멸에까지 이르는 내용.간결한 구성력이 좋았다 
10,난 널 갖고 싶어.. 
10,아들의 여자를 탐한 아버지..그 위험한 관계... 
7,상처와 욕망은 서로에게 적대적인 쌍둥이다 
9,상처받은 사람들은 위험해요. 그들은 생존하는 법을 알죠. 
10,"원작보다 더 잘만들어진 영화, 연탄불 발로 차지말자. "
10,"원작보다 더 잘만들어진 영화,연탄불 발로차지마자. "
7,아주 자극적으로 사랑이라는 것이 얼마나 우스운건지 묻는다. 정말 특별했는가? 
7,충격 
9,중년남성과 젊은여성의 이성적으로는 상상할수없는 성애 
7,금기라서 훨씬 치명적으로 다가온 욕망. 
10,진짜 치명적인 데미지 
10,이 영화는 팜므파탈에 관해서 완변하다!!! 
10,사실 5점짜리영화. 그냥 평점올려ㅜ려고 ㅋ 
8,욕망과 본능에 충실한 자의 인과관계 
8,"충격적 이야기지만, 영화는 괜찮았다. "
8,"외로움의 끝은 욕망이며, 욕망의 끝은 외로움일까. "
7,본능에 충실한 자의 최후 
8,예상외로 평점이 낮네.. 
8,인간이란 정말 어쩔 수 없는 것일까... 
7,꽤 괜찮은 구성의..약간은 충격적인 영화.. 
9,"맹목과 순수. 어떤 차이, 광적인 사랑 혹은 아름다운 사랑? "
10,아름답다...영화이기에가능한 사랑얘기!! 
8,충격으로박에 표현안될 작품. 감히 아들의 연인을 유혹한 아버지의 이야기 
10,중독된 사랑 
10,상처받는 사람은 위험하다... 살아 남는 법을 알기때문에... 
10,"지독한 사랑은 운명이며 저주이다  그것을 결코 피할수 없다 파멸을 불러오기전까지는, 배우들 연기와 영상미가 단연 압권 "
7,미중년의 모에모에함... 거기까지... 
10,배우들의 세밀한 연기표현 엄청난 비윤리적 스토리 하지만 정말 빨려들어간다 불륜중위 불륜이지만 역하지않다 엄청난 걸작이다 
7,사랑이라는 명목으로 시작된 욕망이 결국 절망이 되고 비극이 되며 파국이 된다. 
10,"제레미아이언스의 매력을 느낄수 있었던 최고의 수작이아닌가 싶네요""상처받은 사람들을 조심하세요. 그들은 살아남는 방법을 알고 있어요.""마음에와닿는 명대사 "
10,남녀관계를 넘어 인간 본질에 대한 성찰이 바탕이 된 영화라고 생각한다. 
6,동방예의지국 국민으로서 영화속 먼나라 얘기로 믿고싶다. 
6,둘이 만나면 장소불문 섹스만한다 ..이게 사랑인가?욕정이지...적당히 이성동반해야지....결과봐라 아들의 죽음..최악 여주가 치명적인 매력이 하나도 없는데...남자들이 맥을 못추네... 
10,그녀는 특별하지 않았다. 
4,자극적이기에는 배우들이 너무 안매력적이야. 
4,에로티즘을 포장하는 재주가 부족한 루이말 천박해 보인다 
1,늙은 남자 회춘 욕망 같음 
7,그냥그랫어요.... 
8,"마지막에 불륜 들킨 거부터 너무 보기 싫었는데 억지로 다 보게 됐음.. 결말은 불륜에 대한 대가를 치르고 있는 주인공이지만, 이상하게 안쓰럽다. 안나는 좋은 사람 만나서 잘 살아 다행인건가...? 아무튼 주인공이 정..."
9,여자가다리벌리고유혹하는데안넘어가는남자몇이나될까꽃뱀에게제대로걸렸네 
9,Fatal love. 
7,"제레미의 신음소리에 당황, 여자인줄... "
5,결말이 흐지부지하고 아들이 떨어진건 너무 충격적이다 옛날영화치고 끔찍스럽다 근데 남녀주인공빼고 다별로다 정말 배우라고썼나싶다 못생겼으면 개성이나 있게 생기던가 3류영화 배우삘같았다 
1,막장막장개막장동물의왕국 
1,제레미아이언스 때문에 봤는데 와우..진짜 후회했어요 2000원 개아까움...그냥 색에 눈 먼 미친 걸.레같은 여자랑 정신빠진 아저씨 영화임 
10,시아버지와 며느리의정사 이런일이 있음 점말 좋겠네요...강추입니당 
