score,review
10,한국 영화 사상 가장 멀리 나아간 영화. 그 도달 불능의 가치에 대해 언젠가 재평가 받길. 
7,배우들이 뭐라고 하는지만 알아들었어도 ... 
7,알포인트 겨울버젼 
9,이거 까지마  잘만들었어 
10,최고였습니다. 아무도 찾을수 없는곳 으로까지. 그게 설령 남극의 도달불가능 지점일지라도 현실도피를 하고싶었던 미치기 일보직전인 인간의 그모습 그대로 느끼게해주는 정말 좋은영화였습니다. 
10,뜬금없이 이 영화가 생각났다...뭔가 무섭고도 여운이 남는 영화!! 분명 괜찮은 영화인데 오락성과 단순함만 찾는 무지한  관객들로 인해 세상에 5점대가 나왔다...진짜 개탄스럽구만.... 
8,너무나 저평가된 수작 중 하나... 송강호의 광적인 연기는 레옹에서 게리 올드만이 보여줬던 그것과 비슷했다 
10,"진짜 공포네요 폐쇄되지않앗지만 한정된 남극이라는 공간속에 사람들의 분노, 불안이 진정한 공포를자아냅니다 "
8,영상이나 음향도 그렇고 배우들 연기도 그렇고 다 훌륭한데 뭐가 재미없다는건지? 뭐 남극에 구미호라도 나타났어야 스릴러가 되는거냐? 이 영화가 그리려 한 것은 인간의 집착과 그로 인해 생겨나는 망상이고 꽤나 몰입감 있...
10,시대를 잘못타고난 영화....지금 다시 보니 인간심리표현의 끝을보여준다.잘만들었다! 배우들 연기도지림..나까지 공포스러워지는 느낌. 
10,"딱 호불호 갈릴 영화일만하다, 나에게는 정말 특별하고 충격적이였던 영화였다. 특히 마지막 장면은 별 것도 아니면서 계속 기억에 남는다. 배우들의 연기력은 그 누구도 나무랄데 없다. "
7,시도는 괜찮았다만... 조금만 더 다듬었으면 하는 아쉬움이 
10,나는 도대체 이게 왜 5점대인지 이해가 안간다. 이건진짜 개명작인데...인간의 욕망이 낳은 광기가 어디까지 갈수있는지를 산을 통해 잘나타낸 영화라고 생각한다. 
10,초딩들때문에 평점이넘낮네.. 인간심리를잘묘사한 인상적인색다른공포물임.. 
9,멋져부러... 
10,남극에서 귀신소동이나 괴물이라도나와 공포감을주길바란다면 이런 걸작을보고 쓰레기라비난하지말고 그냥 영화를보지말도록 
10,브금과 장면들이 풍기는 독특한 분위기가 인상적이네요. 언젠간 다시 재평가 받을 날이 오겠죠. 우리나라에서 이런 새로운 시도를 한 것 자체로도 굉장한 수작이라고 봅니다. 잘봤습니다. 
10,남극이 나를 부른다..계속가면 지구의끝이 나오겠지.. 
10,가장 미스터리한 부분은 이 영화가 왜 이렇게 저평가 받느냐는 것 
10,조폭 코미디 영화말고 이런 영화가 많이 만들어져야  진정 한국영화가 제대로된 가치를 인정받는다 
7,영하 몇십도의 극한의 추위의 남극에서 아무리 영화라지만 현실적으로 발음이 제대로 되겠냐 .. 발음 가지고 태클은 ㄴㄴ 
9,전혀 제 평가를 받지 못한 비운의 걸작. 
9,평이 이리낮다니..한국영화 통틀어서 10위안에 드는 수작이라생각되는데..참 며칠전 본 그지같은 더테러라이브같은 영화평점이 그정도인데 사람의심리 인간의본성 변화를 아주 탁월하게보여준 수작 남극의시원함과 배우들의 연기몰...
9,초등 5학년 때 이걸 봤다. 자연을 좋아했기 때문에 설마 남극에서 아름답지않은 일이 생길 거라곤 상상도 안 했다. 그런데 그때 뭣도 모르고 느낀 기운이나 무거운감정이 아직도 떠오른다. 오히려 그런 사람에게 힘을 끼친...
10,배우들이 하는 말이 잘들리지 않는것만 빼면 정말 잘 표현한 영화다.. 
10,개인적으로 인상깊게 보았고 상상할수없을 자연의공포를 다시금 되씹는 의미에서보면 상당히 괜찮은 영화라생각합니다. 
1,자막  어디서 다운받죠? 
10,이 영화 평점이 낮은 이유를 모르겠네요.스릴러 영화 중 단연 으뜸! 
9,설경만 봐도 만족스럽다  스토리도 좋고 나온배우들도 모두 좋아하는 배우들 
10,이게왜 평점이 낮은걸까. 모르겠넹 ㅋ\ 
4,"불분명한 발음들.극장 스피커가 불량인가,영화가 잘못된건가. "
10,영화는 대략 7점은 된다고 보는데 평점이 너무 낮아서 10점.. 진짜 엄지 척 영화는 아니지만 평점 5점은 말이 안된다... 요즘 나오는 공장에서 찍어내듯이 나오는 영화보단 천배 낫다고 본다.. 진짜 개티즌들 많네 ...
10,좀 어렵긴해도 저평가받을 영화는 아닌건 확실한거 같아요!!! 언젠간 분명 좋은평가를 받기를!! 
9,두번봤는데  느끼는점이  다르다. 
10,알포인트.남극일기 한국에도 이런 다양한 공포물이 나왔으면함!! 
10,그당시가 지나고 보니 나쁘진 않은 영화였다... 
8,시대를 앞서간 작품이다. 우리나라에 이런 미스테리물이 한번이라도 나온적이 있었다고 생각하는가. 
10,평점이 너무하네 
10,그대가 찾고자한게 한낮 꿈이었고. 나는 그꿈을향햇어 그꿈을 실현하려면 누가 없어지건 다치건 상돤없어 나는..김민재 넌날멈춰줬어야지.. 넌..그리고 뽑는(깃발) 뽑아든 그꿈은 ..기대는.. 
10,나만 그런 게 아니었구나. 평가가 어떻든 나에게는 여전히 무언가 느낌있는 수작 
10,갠춘함 
10,그냥 10점 주고싶다 좋음 
10,도달불능점으로 향하는 누군가에게는 최고의 영화 
10,알포인트와 함께 한국 최고의 공포영화 
7,재밌다. 마음같아서는 10점 줘서 평점 정상화를 꾀하고 싶지만 다들 생각이있었을테니 내가 생각하는 올바른 평점을 적는다. 사람 누구나 갖고있을 어두운 내면의 응어리가 아무것도없는 설원에서 몇날며칠 고행하며 허상을 쫓...
10,극한의 상황에서의 인간의 심리변화... 그 상황에서 미치지 않는다면 오히려 그건 인간이 아닌것... 
10,이 시간에 평점을 주게 하는 좋은 영화다.... 
10,아주 신선하고 스릴감있게 봤던 기억이 있는데5점대라니 ㅋㅋㅋㅋ 뭐지 
10,재평가 되어야할 영화인대 왜 평점이 극과극으로 나뉘냐면은 수준높은 관객도 있지만 흥행공식에 맞춘 양산형 영화가 판을 치는 지금 오히려 옜날보다 수준이 떨어진 사람들이 무지 많기때문 예를들면 7번방의 선물같은 영화 한...
10,재밌는데 평점 왜이럼ㅠㅠ 오점받을 영화는 아님 
10,고3때 영화관서 봤는데 그야말로 지리는 줄... 큰 스크린으로 보니가 분위기에 압도당했어요. 무서워서 그 나이에 한동안 부모님이랑 같이잠 ㅋㅋㅋㅋ  최근에 VOD서비스로 잠깐 봤는데 영화관 만치 집중이 안돼서 보다 ...
10,평점이 너무낮네 내가 기억하기에 아주 충격적이였던 영화 
10,극장에서 봤던 그 감동을 잊지 못하겠다. 다시 보고 싶은 영화 다섯 손가락에 넣고 싶다. 
10,이렇게 수준 높은 영화가 평점이 왜이래........ 
10,히말라야 감성팔이 영화보다 천만배낫다 
10,깔끔하지 못하고 수려하지 못하나 실험적이고 선구적이다. 
7,남극일기 일기장에서 발견된 글자.우리의 욕심이 우리를 죽음으로 인도했다.결국 도달불능점은 인간이 아무리 나아가려해도 손에 잡을 수 없고 얻을 수 없는 무한의 무언가이다. 그 욕심은 끝이 없음을 영화는 시사해주고 있는...
10,방구석 1열 프로그램 보다가 남극일기 나와서 오늘 맘먹고 봤는데 결말을 알고봐도 너무 괜찮은 영화인듯.  평점이 낮아서 놀랐음.  욕심으로 많은이가 희생되고 결국 도달불능점에 도착을 해도 얻는건 허무함뿐.  대장은 ...
10,진짜 인간의 심리를 극한으로 몰아부친다 진짜 수작 평점이 5점대라 놀랐고 우리나라 관객 수준에 두번 놀랐다 
9,"어렵다. 사실 아직 잘 모르겠다. 몇몇 세세한 부분은 아쉽지만 전체적으로 매우 리얼하게 탐험대를 표현한 것 같다. 대사가 잘 안들리는 부분은 아쉽다.결국 맞을것같은놈이 틀렸기도 했다가 미친놈이 맞았기도 했다가, 어찌..."
6,영상미나 심리묘사 너무 세련되고 괜찮은데... 스토리 임펙트가 부족한듯.. 배우들 연기도 너무 좋았고 고생 많이 했을것 같은데.. 아쉽다 
10,"국산 역대급 영환데 눈들이 너무 낮아서 평점이 이따구냐?진짜 택시기사 ,명량 ,해운대,부산행 수준들이참.... "
8,사람목숨보다 중요한 도전은 무의미하다. 
5,뭐가 있지만 발견하고 싶진 않은 영화 
8,다소 지루했지만...그 도전만은 높이 사주고 싶다.. 
9,이런게 진짜 공포영화지 
10,너무 저평가됐다.인간의 이기심이 얼마나 무섭고 인간이 그것어 얼마나 쉽게 무너지는지.. 
10,이게 어떻게 5점이냐 완벽하지 못하긴 했지만 7점정도는 받아야된다 그래도 
10,갑 오브 갑...!!^^ 
10,평점이 왜 이러지... 이거진짜 인생영환데... 
9,꽤 괜찮은 영환데 대중적이지 못한게 흠이였나. 
10,10소름...th5름... 이게 왜 5점입니까.. 연기 연출 분위기 대사 등 모든것이 십소름 
10,평점이 왜 이렇지?  송강호연기하나만으로도 볼만했다 
10,최고의 영화  말이필요 없음.. 연기의 진수.. 
10,괜찮은 영화 
6,한국어 자막이 필요하다. 
10,너무 시대를 앞서간 작품... 개봉당시 평론가 관객 구분없이 대차게 까이고 평점 4점도 채 되지 않았던 영화... 내용으로 보나 분위기로 보나 필자는 참 마음에 들었는데.... 
1,나만 그렇게 느낀게 아니였네. 분위기는 좋은데 배우들이 뭐라하는지 안들린다. 목소리를 깔아서 그런건지 음향 때문인지 뭐라하는지 못알아듣겠다. 한국 영화 중 이런 영화 은근히 많다. 
10,진짜 개쩌는 영화 후유증 장난아님.. 
10,봉준호 감독이 각본 썼네요. 역시 ! '알 포인트' 와 함께 최고의 영화 ! 
10,지금 개봉했으면 8점대 영화 
10,난 어려서 봤는데도 잘 만들었다고 생각했는데?? 나이를 떠나서 영화를 보는 안목과 이해력 차이 아닐까?? 알포인트랑 비슷한 느낌. 서서히 심장을 조여오는 공포가 느껴지는 심리 스릴러였다. 
8,"인간의 심리 군상을 잘 표현해낸 미스터리 스릴러, 작품성에 비해서 평점이 너무 낮은것 같다. "
7,"영화 자체는 취향저격이라 두번 봤는데, 배우분들 제발 발음 발성 좀 똑바로 해주세요 특히 송배우님. 웅얼웅얼 입안에서 맴도는 대사때문에 나오는 영화마다 뭐라는지 진짜 못알아먹겠다. 연기도 좋지만 발음&발성은 기본아닌..."
4,대사들을려다가 공황장애옵니다 그냥 결말후기 쳐서읽는게낳음 
10,한국에 이런영화가 있었던가? 
10,ㅠㅠ 너무 무서웟어요.. 
10,"난 이영화 개봉했을 때 가족들이랑 영화관에서 봤었다.  당시  초6 이었는데, 처음 도입부분에 나오는 음악이 굉장히 무서웠다. 영화관에서 본 거라 소리가  쩌렁쩌렁하게 울려서 무서운 게 아니였다..음악 자체가 무서웠..."
8,12년이 지난 지금도 아직 인상 깊게 남은 영화. 스크린 가득 펼쳐진 하얀 남극이 공포로 와닿던.. 조금은 어려웠지만 잘 없을 영화. 
10,저평가 영화. 8점은 되야한다본다. 송강호 마지막에 종이말아 담배피는 장면은 진짜 압권이다. 
10,아니 이 영화가 대체 왜 평점이...한국이 낳은 수작이다.말이필요없다.시간가는줄 모르고 봤네.... 
10,"pooq에서 대항해시대란 게임을 하면서 반쯤 킬링타임용으로 보았다. 그들의 감정을 망망대해에서 떠다니는 내가 느낄 수가 있었다.... 네비가 있음에도 뭍이 보이지 않는 그런 느낌, 그런 감정으로 온 몸에 두려움과 오..."
9,2005년에 이런 명작을 만들 수 있었다니...- 무엇이 인간을 인간답게 만들 수 있는가에 대한 반성을 마음 속에서 끌어내놓게 만드는 예술작품 
10,10년 전부터 보고 싶었는데 어쩌다 우연히 얼마전에 보게 됐다 그동안 왜 안봤나 싶을 만큼 무섭고 소름돋는 영화였다 보고나서 내 정신까지 ? 몽롱 해지고 이상해 지는 ㅋㅋ 배경 음악도 영화에 걸맞게 잘 만들었다 
10,너무나도 잘 만들어진 영화.. 11년이 지난 오늘에서야 봤지만 정말 명작!!! 
10,이렇게 강렬한 영화가 한국에서 만들어진 것이 놀라울 뿐. 내 인생 최고의 영화 중 하나. 
10,인간의 욕망의 끝이란...그리고 그 욕망의 끝에는 무엇이 있는가.. 송강호 연기만으로도 큰 점수를 주고싶은 영화. 
10,보면서 이불덮고 봤어요. 춥고 쓸쓸한 영화. 이런영화 좋아함! 
10,이 명작이 평점이 이렇게 낮다고?! 
10,올해 찾아본 한국 영화중 제일 좋았다개인적으론 곡성급으로 좋았는데 평점보고 놀람... 
10,무료영화 에 뜨길래 봣는데 재밌던데 왜  평점이 이러지 
10,몇번을 다시봐도 질리지 않은 명작. 
8,비슷한배경으로 SF스릴러소재로 스토리탄탄하거짜면대박일듯 아는거없고 생각의폭이좁은얼라들때문에 평점테러당한영화수두룩하다 
6,뭐라는지 안들려 OO. . . ㅡ 
4,메시 호날두 이니에스타 레전드급 축구선수들 모아놓고 야구경기 시킴 
3,자막을 넣던가... 더빙을 하던가.... 뭐라고 하는거야? 한심하다. 내용을 떠나서 기본이안된.  그리고 영하40도에 피가 흘러나오는게 말이 되냐? 물리적 개연성이 개판이이니 몰입방해되고.... 재미를 떠나서 신경을...
10,솔직히 잘만듬  한국 공포영화중에 이만한 영화  없다고봄 
10,결말을 알고 가도 재미가 있네요 
10,저당시 한국영화가 전성기였지재미도있고 의미도있는 수작 
10,
10,평점이너무낮은거같아서 평균높혀야됨 
9,이건 언젠가 재평가받을 영화. 나한텐 수작 
10,와 이영화가 평점 5점대라니... 소름끼치는 영화였는데 
10,굉장히 재밌게 봤는데 평점이 너무 낮아서 놀랐다. 
10,잠  엄청잘옴 강추~~~ 
10,이 영화의 내용을 이해하지 못했다면 재미없게 느껴지겠지만 내용파악을 했다면 이영화가 엄청나다는것을 느낄것이다. 
10,의미부여는 자신의 몫. 
7,"뜻은 알겠는데, 투자비는 찾아야지. "
8,어렸을때 뭣 모르고 봤을때 충격과 당황스러움에 망한 영화라고 생각했는데 지금 생각해보니 참 잘만든 영화인듯... 
8,결국 도달불능점에는 무엇이 있었을까 
7,난 이 영화가 좋다. 개봉당시때 사람들이 망한영화라고 해도 난 그때도 좋았고 지금도 좋다. 
8,난 재밌게 잘봐서 몇번씩 보고그러는데 스크린만 봐도 추위와 절망이 느껴지지않앗나? 
10,감독 주관이 살아있는 몇안되는 영화. 
10,연기와 연출이 대단했던 영화 이때부터 송강호 유지태씨의 팬이 됐음.. 
9,이런거 좋음 미스터리 꼭 알포인트보는줄~잼씀요 역시 배우들의 연기들이 한몫 크크  10년전영화를 지금봤다니 이런건줄 알았음진작봤을텐데ㅠ 
9,"시대의 현실을 나타내고, 인간의 심리를 보여주는 영화.    오락영화가 나쁜건 아니지만 오락적인요소가 없다하여 무지하게 저평가하다니...그럼 이런장르를 애초에 보질 말던가... "
9,이상하게 평가가 안좋네. 내가 본 수많은 영화중에 가장 평가가 상이한 영화 
10,네이버평점 이상한건알고있었는데 이영화가 5점대인건 너무하다 송강호는 말할것도없고 배우들 연기만으로도 분위기가조성되는데.. 
10,영화 소재 특이하고 배우들 연기 좋던데요 송강호는 물론 윤제문.박희순 연기 압도적 유지태도 괜찮구요 5점대는 절대 아님  극한상황에서 보여지는 인간심리를 잘 표현 한국영화의 다양성을 보여준 수작 
6,"뭔가 재미있게 갈 수 있었을텐데 인간적으로 엄청난 재미까지는 느낄 수 없었다 그냥 특유의 이러한 분위기가 좋았을뿐. 또 하나 이 영화 시나리오 작업에 임필성, 봉준호, 이해성 감독님들이 참여하셨는데 샤이닝 2탄을 목..."
1,대사가 안들리니 갑갑해서 원 
9,위대했습니다. 화려한 액션이 없어도 조여오는 영화. 좋은 영화였습미다. 
10,심리적 공포다 특히 ost가 영화랑 잘맞음 
10,평점 테러가 있었던듯. 이정도 평점까지는 아닌데 
1,망한 데에는 그만한 이유가 있는 법 
1,영알못 무지한것들은 이 대작의 가치를 판단할줄 모른다! 
8,"어떻게보면 지루한 진행인데 개인적으로 배경이 새하얀 눈밖에없어서 그런가 이상하게 분위기, 인물 감정에 몰입이 엄청나게 됐음 조용하게 미쳐가는 느낌이.. "
2,지금 봐도 재미 없는데.... 뭔 재평가... 
10,평점이 5점대라니 말도 안된다  난 그냥 송강호 나온 영화는 다 보기 때문에 봤는데 알포인트 같은 긴장감에 영상미도 좋고 스토리도 좋았는데 
1,의미없는 복선들에 중구난방 단평영화 5개는 합쳐놓은거 같은 영화. 멜로빼고 모든 장르는 다 집어놓은 정체를 알수없는 개밥 
8,대장 최도형은 싸이코패스인가요?아님 정신분열증환자인가요~?  개인적집착땜에 대원들을 죄다 죽게 만들고미션성공한다해도 과연 남는게 뭘까요~? 
10,조용하시고 그냥보세요 
10,이거 소설도 꼭보세요. 저진짜 책잘안읽는데 하루만에 새벽까지 다봤어요.몰입도최고 ..ㅎㅎ 
10,진짜 영화 끝나고 여운 개오진다 ㄷㄷㄷㄷ 개 쟀음 
10,"와 이거  첨 나올때 극장에서 봤는데 그 공포감이란;;, 근데 평점리 이렇게 낮다니...이건 진짜 무섭다 "
10,이영화는 볼때보다 다음날이 더 무서운영화인간의 광기의 끝을 보여 줌10년 전에 본 이게 생각나 2020년에 다시 찾아와 평가를 하고 있다니...재평가시급하다 
10,
10,
8,뭐라는 지 잘 못 알아듣겠어서 8점이 영화 보고 난 직후 침대 위에서미동조차 할 수 없었던 공포감이 다시 떠오른다 
10,평점 진짜 낮네 뭐지.... 
10,
10,이 영화가 가는 길이 향하는 바로 그곳이 도달 불능점. 
10,시대를 너무 앞서간 영화임. 지금 나온다면 최소 500만은 찍을듯 
8,아무정보없이 보면 좋은 영화생각없이티비보다가 명품주연조연몰빵나와서 열연펼치는데 놀람시대를앞서간 영화가 확실함 
10,웃음기 없이 진지한 영화라 좋음 
7,그때.. 어려서 이해 못했음 
10,강추 이 영화는 할리우드에서 재평가받아야될 작품 
10,2005년도 당시 보았을때 굉장히 괜찮은 영화라 생각했는데 의외로 무서웠고 여운있는 영화여서 다시 보고싶은데 무서워서 못보고있음.ㅋ 안보신분들 추천드림! 
10,자연에 대한 공포...좋은 시도고 이런영화가 많이 나왔으면 한다 
6,공간이 주는 영화의 설득력. 
10,난 이거 재미있게 봤는데 평점왜아랴 
10,재밌다!!!취향저격 
10,재미있다. 바람소리 때문에 대사가 잘 안들려서 아쉽다. 자막 있었으면 좋겠네. 암담하여 먹먹하게 만드는 마무리.. 
7,조금만 더 다듬었으면 명작인데 OST는 정말 좋았다. 
8,두번째보앗다...괜찬앗다..어렵긴하지만대장은처음에는도전이엿겟지만..점점두려워지는남극..아들에죽음때문에 포기하지안고 더추운곳을고떠난아들때문에 아무도없는곳갈수없는곳으로혼자간건아닌지... 
10,이런영화 많이만들어주십쇼 
10,어떤사람들은 조금만 안좋아도 0점주니까 5점이 나오지....개인적으로 이거 옛날에 매우 재미있게 봤음 
10,잼나게 봤다. 우리나라에서도 이런 영화를 만들다니 참 한국 영화 많이 발전했다는 걸 알겠다. 
5,이 영화를 봤을 때 느낀 점은 출연진만 믿고 영화를 봐선 후회할 수 있다는 것이다 
10,그래도 5점대는 아니다 8점대 정도가 적당하다 
7,"냐용 지루함과 남극자연의 디테일함은 지금의 시점에서 별루이지만 마지막 장면중 몇장면은  스릴러씬의  공포감을  멋지게 표현, 송강호와 유지태외엔  보이는 케릭터설정이 티,,나머진 이당시의 영화인점을 감안하면 제 점수..."
9,소재참신하고연기력좋은데평점이왤케낮지 
7,"개봉당시에는 몰랐는데, 지금 다시보니깐 나오는 배우들 후덜덜 ㄷㄷ "
1,케스팅덕에그나마1점 
7,나쁘지않음 연기는 좋았음 
4,대사전달 안되고...하나도 안무섭고... 
1,일점 드렸어염 
1,밑에 이 영화 괜찬타는 인간들 욕하고싶다..x발 
1,도데체 왜 이 영화가 재미있다는지 모르겠음.. 
1,남친이랑 보러갔는데-보자고 한게 미안할 정도였음;;; 
1,어이가 없어서 재미있다는분들은 배우능력만본거지 영화보긴봤냐 
1,오랜만에 남친이랑 영화봤는데// ㅡ_.ㅡ돈 배렸다/// 
1,정말 미안하지만 도저히 좋은 점수 못 주겠음. 
1,자~ 힘들내야지??????????ㅋㅋ 
1,임필성 감독님  앞으로 영화 제대루 만드세여 
1,내용이 지루하고 대사도 잘 들리지 않고 보면 돈 아깝다 
7,약간의 루즈한 느낌공포보단 미스터리에 가까움찜찜한 느낌을 받고 싶을 때? 보기 좋다 
8,잼나게 봤는데  이걸 걍 봉준호가 찍지..개그코드가 없는 시나리오는 안찍을려는 건가.. 
10,문득 문득 생각나서 다시 찾아보게 되는 영화. 
10,재평가가 시급하다!!! 
9,예전 티비에서 나오는거 볼려는데 대사가 하나도 안들림..내가 좋아하는 주제같아서 혹시나 재개봉하면 10점주고싶음 
7,불가능한거에 집착하지 말자. 타이틀곡이 진짜 명곡인듯. 
4,"남극을 헤매는 캐릭터들처럼 관객들도 난잡한 영화의 전개에 혼란스럽다. 진행이 너무나 느려서 단 한순간도 긴장감을 느낄 수 없고, 배우들은 모두 다 낭비되었다. "
5,배우들이 모두 거의 같은톤으로 중얼거리듯 말하니 공포인데도 지루하다... 
7,누가 범인 이었을까 
3,한국인도 대사를 못알아듣는 한국영화. 기본 중에 기본도 안되어있는데 무슨 재평가 타령인지... 
6,[ S6 V7 D6 A7 ]　호불호가 갈릴만한 작품. 한정된 공간에서의 긴장감과 흐름은 괜찮았으나 잘 들리지않는 대사와 파악하기 힘든 몇몇 암시는 오히려 몰입을 방해한다. 그리고 마지막 오두막 씬은 현실성이 너무 떨...
10,알포인트와 우리나라 공포물 수작 
7,"초, 중반 까지는 몰입하고 보다가 막판에 갈 수록 이게 뭐지? 하며 본 영화... 시나리오는 참 재미있는 내용으었을텐데 풀어내는데 문제가 있었을까? 편집에 문제가 있었을까? 여하튼 제작비에 배우들 고생 생각하면 참 ..."
3,엉성함 
1,요점이뭐야? 장난하나 
6,물속 외눈박이 괴물만 편집 했어도영화의 완성도가 대폭 상승 했을텐데...단 한컷으로 영화의 개연성을 전복시켜 버리는 있어서는 안될 장면. 
10,소름끼치는 영화!!0 
10,평점이 왜이래.. 7점은 되는영화구만 
8,내 인생 최고의 공포영화..나에겐 공포영화였다 
5,"춥고, 어둡고, 무섭다... "
10,
10,그때당시에는 이런영화를 이해를 못함 
10,낡은 카세트 플레이어를 끄고 키는 싸움을 벌이는 윤제문과 박희순의 텐트 속 괴이한 긴장감 그때부터 영화 내내 불길함이 감돌았다. 꼭 기승전결이 뚜렷한 영화만 좋은 것일까? 이 영화는 자연의 공포와 인간의 광기가 어떤...
10,
10,
10,
10,이거 평점왜이러지?? 
10,
10,
8,솔직히 영화가 뭘 뜻하는지 난해하지만 영상 연출은 정말 최고인 것 같다. 
10,너는... 너만은 날 말려줬어야지 
10,내가 가장 좋아하는 한국 영화. 임필성 감독은 다시는 이런 영화를 만들지 못하겠지. 
10,아들을 죽게까지 만들었던 산악인 도형의 궁극점 혹은 도피처는 애초에 도달불능지역이 아닐 수도 있다는 생각이 든다. 
6,그들은 남극탐험이 아닌 지옥탐험하였다.. 
8,괜찮게 본 걸로 기억하는데 점수가 언제 이 모양 났냐 
9,머리속에 각인되어 수시로 생각나는 공포 
10,저 평가된 영화..네요 너무 재밌는데 
6,좀 더 공포스럽고 스릴있음 좋았을껄...아쉽네 
10,너무 평점이 낮아서.... 8점정도의 영화... 꽤 훌륭한 영화인데 평점 너무 낮아 ㅠㅠ 
10,영알못들때문에 평점올려주곷가낟 
4,"혹한의 공포와 미지의 미스터리, 남극이란 공간 자체가 주는 설득력 "
10,전 나름 괜찮게 봤습니다... 
10,평점이 너무 낮다... 
10,이게왜 평점5점...?누가설명점 
6,뭔가 중후반 가니까  뭔가 유령이나 괴물같은게 나올줄 알았더니... 그냥 그런 미스터리 스릴러 였음.. 근데 남극을 배경으로 한게 참신했음.. 
