score,review
10,로버트테일러 너무 멋짐.. 
10,서로 사랑했지만 전쟁이란 시대적 상황과 운명이 갈라놓은 사랑을 보면서 깊은 슬픔과 감동을 느낌..........고전 영화들중 가장 가슴아프면서도 슬픈 영화 베스트 10에 들어가고도 남을 영화. 
10,70년전에 나온 영화  지금봐도 전혀 촌스럽지 않아 비비안리의 절정의 미모와 연기란 
10,아날로그 영화중 톱10에 들어가는 명작 스토리가 참 슬픈 사랑 
10,오늘 EBS에서 방송 나온거 다시 봤네요..보면서 비비안리 미모에 계속 감탄감탄...미모땜에 더 몰입이 된듯 ㅋ고등학교때 보면서 울었는데 40줄 된 나이에도 불구하고 또 보면서 많이 울었어요ㅠㅠ 
10,20세기 후반기에 '쉘부르의 우산'이 있다면 전반기엔 '애수'가 있었다. 주인공들이 처한 상황과 선택이 너무 애처롭고 슬픈 영화.  마이라만큼 안타까운 친구 키티의 삶도 불쌍하고.. 로이...
10,"진한 여운을 남기는 영화,... "
10,내용은 둘째 치더라도 두주인공들이 너무 예쁘고 멋짐... 
10,너무 슬프고 너무 아픈 그러나 너무 아름다운 영화. 비비안 리 forever~! 
10,글래식이 무엇인지 알려 주는 작품. 
9,난 해피엔딩이 좋은데..ㅠㅠ 너무 슬픈영화다ㅜㅜ 
10,OO만에 다시보고 넘 울었네여 나두 저런 불같은 사랑해보고싶다 생각했어여  특히 첫장면과 마지막장면에서 로버트가 이OO이지나도 비비안리 못잊는장면은 저도모를 희열같은게 느껴지더군여 지 금봐도 군더더기없는 깔끔한 연출...
10,"사람과 사랑의 아름답고 선한 면 만을 동화처럼 그린 사랑이야기. 하지만 너무나 현실적이고 냉정하고 슬프기도 하다. 최고의 명작들 중에 하나로 꼽힐만한, 여운 그윽한 그 시대의 눈물. "
10,슬프다..ㅠㅠ 70년전 영화라고 안믿길정도로 세련되고 예쁜 로맨스영화 
10,마지막 슬퍼하는 로이의 눈빛이 모든걸 말해준다... 
10,졸린 상태였는데 완전히 몰입해서 본 영화. 로이와 그의 어머니는 너무 나이스하고 멋졌다. 우리 나라 그 시절 같으면 상상도 못했을 매너와 모습들..그리고 비비안 리 연기 너무 잘함.  영화 마지막 장면에는찡- 하고 ...
10,고전 최루성멜로의 최고라고 생각함..너무 불쌍 ㅠ_ㅠ 
10,내 귓가엔 아직도 올드 랭 사인이 흐르고 있다. 
9,짙은 안개가 깔린 워털루다리에서 무엇을 회상하는 걸까? 아마 시간을 되돌릴 수 있다면...낭만적인 장면과 남녀주인공의 돋보이는 외모로 인해 국내외적으로 많은 여성팬들의 사랑을 받았던 작품. 
10,아름다운영화 요즘에도 이런영화가 있으면좋겠다 스칼렛도좋지만 마이러도좋다.. 
10,"10대,20대,이젠 40이 되어서 세번째 보지만 역시 최고의 맬로 영화입니다.. "
8,비련의 주인공과 요부 역할을 넘나드는 비비안의 뛰어난 연기 
10,어렸을때 명화극장에서 볼때 이불속에서 너무너무 울었던 영화..그 때 아빠에게 왜 결혼할 수 없어요?라고 물으니 아빠가 말씀을 못해주셨던 영화.... 
10,나온지 80년이 다 되어가는 이 영화가 오히려 요즘 한국의 공영방송에서 하는 억지 공감 유발 사랑 타령 드라마들 보다 더 공감되는 이유는 이유는 뭘까? 140자로 이 영화의 정교함을 표현하기에 내 지식이 부족한 것이...
10,비록 헐리웃 영화지만 출연배우들의 매력과 한국동란의 향수가어우러져  한국인에게 가장  사랑받고 기억에 남는 영화.... 
10,"최루성멜로의 원조격, 내가 가장 많이본영화 "
10,슬프고 애틋하고 아름다운 고전영화..캔들 클럽에서의 낭만적인 한때와 후반부에 격변하는 상황의 격차가 견딜수없이 안타깝다. 주제곡이 머리에 맴돈다. 
10,10대에 처음 보고 40대인 지금 다시또보니 세기의 미녀 비비안리의 외모가 아닌 연기가 눈에 들어오네요. 정말 베스트 오브 베스트이며 클래식의 교본이네요 
10,베스트 오브 베스트무비 
10,이루지 못한 사랑에 아쉬움이남는다 전쟁이 낳은 비극을 나타낸다 전쟁은 역시 결코 없어야한다 But 비비안리 연기만점 and 로버트테일러 같은 남자 어디없을까? 
10,40년대영화라고는도저히믿기지않는영화70년이지났음에도불구하고소통할수있는영화 
9,멜로의 진수.. 오랫동안 사귀었던 정든 내 친구여.. 이 노래.. 
10,"워털루 다리에 가게 된다면,, 이 영화를 떠올릴 것 같아요! "
10,순수한 사랑 
10,레전드급 영화 요즘 영화들보다 재미있음 
10,운명적인 사랑이란... 
10,내 어린시절부터 잊혀질수없는 유일한영화 
8,이 무슨 운명의 장난인가... 
8,안타까운 사랑... 
10,"고전 멜로 영화의 최고 걸작~~~너무 슬퍼,,, "
10,말이 필요없는 명화 
10,완전 기억에 남는 영화.. 
10,이만한 애정영화가 또 있을까? 
10,세기의 미남과 미녀의 만남. 비극이기에 더 기억에 남는 영화 
10,슬프다.......ㅠㅠㅠㅠㅠ 
10,마음아파서 끝까지 보기힘든 영화중 하나.마스터피스 
8,"비 운, 비 련, 가 련. . . 비 비 안 . . . ㅜ ㅠ;;; "
10,너무 아름답고 서글펐던 영화 펑펑울며 봤습니다. 갑자기 god 애수의 노랫말이 난아직도 그대를 잊지못해 오늘도 그댈찾아 이거리를 해매~~~마지막장면 로이의 모습 완전 마이라가 그런 행보를 걷지않고 그 다리에서 만났다...
8,참 애절한 러브 스토리. 비비안 리의 미모와 연기가 너무 놀라움. 연회에서 춤추면서 테라스로 나와서 키스하는 장면 너무 아름다웠음. 발레 단장이 원흉같음. Limited Social Idea. Instinct tel...
9,뭔가 진부한 듯 하면서도 재밌음 ㅎㅎ 비비안 리 연기 오올~ 
10,이런 영화가 완전좋다! 비비안리 연기 대박! 
10,사랑은그런거다..아..내가슴이여 
10,최고의 영화 
10,헐 왜케 슬픔 
10,안타까운 사랑입니다. 
10,오랫동안 사귀었던 정든 내 친구여 작별이란 웬말인가 가야만 하는가 
8,전쟁이 나은 참혹한 현실에서의 사랑이 가슴이 짠하다 
10,명작 .. 그 한마디만 할꼐여 ㅠㅠ 
9,찡하지만 가슴속 깊은 곳까지 개운해지는 영화 
9,지금도 핸섬한 로버트 테일러와 아름다운 요정 비비안 리의 환상커플~! 
8,기억에 남는 명작 
10,비극 맬로의 고전 
10,지금 봐도 역시 잘 만든 영화... 넘 슬포 ㅜㅜ 
10,영화를 처음 본지 20년이 흐른 지금에도 귀에울리는 음악.. 
9,'러브스토리'의 바이블! 
10,"두 남녀주인공....분위기,연기..예술임..짝짝짝 "
10,러브 로맨스의 최고봉 
10,아쉽다... 
9,슬프지만 아름다운 사랑이야기.. 두배우 모두 너무 멋있었다 
10,슬펐다.... 근데 왜 이렇게 그 발레단인가? 단장이 미웠는지.. 
10,‘애수’ 영화 제목에서 부터 여운을 남겨주는 영화 스토리와 주연 배우의 환상의 하모니... 
10,촛불클럽에서의마지막 노래 올드랭샤인이이 영화의 전체 스토리를말해주네요여러번 봐도 처음 보는것 같은 영화♥♥♥ 
10,한번의 사랑 영원한 사랑 
9,자살 하기전 비비안리가 슬픈 애수의 눈빛으로 다리 난간에서 바라보던  그 눈빛. 
10,내 인생 최고의 슬픈로맨스영화!! 21C에선 비비안 리와 로버트 테일러같은 배우얼굴은 찾을 수가 없다. 
8,40년작이라...지금도 이런 영화 못 만든다 
10,너무 멋있는 사랑이었다. 감동 .. 
10,눈물을 흘리면서 본 전쟁속에서의 사랑이야기... 
10,정말 슬프고 아름다운 명작. 
10,더 베스트 오브더 신파. 
10,명작 더이상 말이 필요하겠는가.. 
9,바람과 함께..보다 더 예쁘게 나온 비비안리 
9,영원한슬픈로맨스의주춧돌이되다. 주옥같은영화음악 
10,중2때보구 몇일간 너무 아른거렸다..슬펐다.정말 
10,중2때 이영화를 보고 얼마나 울었는지 아직도 가슴이 찡합니다. 
10,사랑이란 이렇게 하는거.... 
10,정말 좋은영화 
10,수십번 봐도 좋은 명작. 멜로영화의 진수를 느낄 수 있다. 
10,"멋진 두쥔공, 애절한 스토리.마지막에 넘 슬펐어 ㅠㅜ "
9,안타깝다. 아마도 그들은 영원히 사랑했을것. 
9,죄책감이 죽음으로 몰아간 영화. 
9,비비안리의 또 다른 명작 
10,"사랑하지만, 함께 할 수 없었던 비극적 안타까움이 가슴 아프다. "
10,이게 진짜 아름다운 사랑이다.. 
10,최고의 클래식 영화....... 
10,나를 울게한 영화 
10,멋진고전영화 
7,명작중 하나! 전쟁으로 인한 젊은 연인들의 상처를 잘그린영화 
10,비비안 리를 너무나 좋아해서 찾아 본 영화... 제가 태어나기도 한참 전의 영화이지만.. 시대를 추월하는 가슴아픈 순수한 사랑에 눈물이 나네요. 바람과 함께 사라지다의 강인했던 비비안 리는 전혀 다른 사람처럼 느껴질...
10,울엄마 나이80에 감동적인 영화라며 극찬하심.  워털루브릿지.. 
10,사랑에 미안함이 거주했을 때 
10,많은 여운이 있는 영화.  사랑이란 이런거다. 
10,봄이되면 로마의휴일이보고 싶고여름되면 애수가 보고 싶고가을되면 카사블랑카가 보고 싶고겨울되면 쉘부르의우산이 보고 싶어진다. 
8,전혀올드하지않고 리메이크해도 될듯 
10,35년전 다섯살 꼬마때 처음 본 이후로 내 최고의 영화. 내용을 알아도 볼 때마다 슬픔 
8,고전인 흑백영화를 오랜만에 봤는데 영화가 끝난후 긴 여운을 준다.해피엔딩이 아니라서 슬프지만 기억에 많이 남는 영화다.내가 아직 이 영화를 다 이해를 못해서 평점을 10점을 못주지만 전쟁중에 피어난 애틋하고 슬픈 러...
9,와..  지금봐도 너무 슬프네요 보는내내 울었다능..ㅜㅜ 
4,good 
7,그 당시 신파의 공식 
8,전쟁중 겪을 수 있는 사랑..그러나 슬픈 결말.. 
8,짧았지만 길었던 워털루 다리에서의 추억 
7,슬프네요 
10,"남자주인공 너무 잘생겻고 여자주인공도 넘 이쁘고 스토리내내 잼잇께 해피엠딩 되는줄 알았는데 너무 안타깝네요..비비안리가 좀더 이기적이였다면,,너무 순구한 사랑 지키지못해서 그런결정이 아쉽고 ..영화보면서 사랑에대한 ..."
10,볼 때마다 가슴이 메어지는 영화 
7,비비안 리와 로버트 테일러가 어울리는건 사실이지만 참 통속적이다.. 
10,80년전 영화인대도 시나리오 대사 연기가 명작. 
10,너무 안타깝고 맘 아픈 내용 그러나 두 주인공이 넘 멋짐 
10,성 패러다임에 대해 다시 한 번 생각해보게 되는 영화 
10,내인생의 최고의 영화 .백번은 봤을걸.블루레이는 왜 안나오나 
10,"고전 명작. 잘생긴 로버트테일러 님과 예쁘고 연기도 잘하는 비비안리히 님을 볼 수 있음. 가슴 아프지만, 순수한 사랑의 감정과 양심의 갈등을 느낄 수 있는 영화. "
10,볼 때 마다 눈물난다..  마이라와 로이의 엇갈린 사랑의 애절함 때문에..  ㅜㅜ 
10,배우들이 너무 멋지고 슬프고 아름다운 영화 
7,Waterloo Bridge 
10,비비안리 울지 마요.... 
10,잔잔하게 연주되는 올드 랭 사인에 맞춰 춤추는 두 연인의 모습이 언제까지나 기억될 영화 애수...그시절 흑백영화만이 줄 수 있는 여운과 함께 하기에 비극으로 끝난 그들의 사랑이 더욱 아름답고 슬프게 느껴진다. 
10,안녕. 안녕.... 
10,누군가 그랬지~~비비안리만큼 연기를 잘한다면 외모가 필요없고 비비안리처럼 외모가 이쁘다면 연기력이 필요없다고~~영화사상  젤루 예쁘고  카리스마 넘치는 연기력또한 너무매력적인 비비안리~~~너무 좋아하는 배우^^ 
9,지금 리메이크 해도 괜찮은 작품임 
10,고전을 평가하는 게 사실 의미가 없기 때문에 10점을 남깁니다.극 전반에 깔린 긴장감은 스릴러의 그것보다 더하네요. 
10,로버트테일러ㅡ비비안리ㅡ너무이쁜커플그신부가결혼을시켜줘야만했어요ㅜㅜ혼자보면서펑펑울었어요ㅜㅜ 
10,로버트테일러의 눈빛연기와 비비안리의 신들린연기 왜이제서야밨나..가슴이아프다 
10,애절한 연인들의 비극이 오래 여운이 간다. 
10,이 영화 몇번을 다시보고 영국 갔을때 워터루 브릿지 가봤는데.. 
10,너무 슬픔.. 당대 배우중에 비비안리가 연기는 제일 잘하는 것 같음. 
9,비비안 리. 그녀를 위해 존재하는 영화. 신파영화의 교과서 
7,별로 좋아하지 않는 스토리지만 비비안리 땜에 찾아서 봤던 영화. 
9,간사람과 남은사람. 
5,볼만 
9,갠적으로 그다지 재미있지는 않았지만 명작이라고 생각한다 
8,내용은 좀 억지스럽지만 슬프고 감동적이다. 
10,"...성녀와 OO의 비비안리, 청년과 노년의 로버트테일러... "
7,눈부시도록아름답던그녀..이뤄어질수없었던사랑 
9,잊을 수 없는 안개낀 워터루 다리와 마스코트. 
10,그 마스코드 생각만 해도 눈물이 나요.. 
10,설레임과 행복 슬픔이 모두 담겨져 있는 영화. 
10,워터루 브릿지..나도 꼭한번 가고싶다..전설이 되어버린 최고의 멜로영화 
10,초딩때 본 영화로 서른이 가까운 지금도 젤 먼저 떠오르는 영화다.. 
10,반드시 오리지널 흑백으로 봐야 하는 영화. EBS를 통해 오랜만에 애수를 다시 볼 수 있어서 좋았지만 어설픈 컬러 리마스터링 버전이라서 너무 아쉬웠다. 
10,컬러로 보여준 EBS에 감사 여전히 슬프네요 
5,good 
5,"예날엔 10점, 요즘 기준으론 5점 정도 "
7,걍 그러네요~ 
6,"멋진영화이나,전체적으로봐서는비비안리를위한영화로밖에보이지않는다고생각한다 "
1,30년대 영화답다... 
2,솔직히 9점대는 아닌것 같고 7.5~8.5 가 적당한 것 같네요. 
1,여자주인공이이해가안됐다남자여자순수한사람여자는양심때문에죽음을평점높다 
