score,review
4,"캐릭터와 스토리는 진부함의 끝을 달리고, 대사와 상황은 진지해 보이려 하지만 도리어 우스꽝스럽다. "
1,돔강렬했다 
7,딜런의 악역 연기가 일품이긴 하나 아쉬운 연출력.대배우들에 비하여 따라가지 못하는 .. 
7,무난하다고 본다... 
4,넓은 스케일에 얕은 깊이. 
6,"[기][승] 은 괜찮았고, [전] 까지는 봐줄만했는데, [결]이 문제다. [결]이... "
2,수년 전 나온 LA 컨피덴셜과 비교해 보면 답 나옴. 먼가 허접함. 
4,팀버레이크 영화는 대체적으로 
5,초중반까지 재미있게 잘나가다가 후반엔 대충 마무리하는 영화 
1,도입부의 5분여간의 총격씬만 보고 꺼도 된다 
1,배우들이 아깝다 이 양반들아 
5,"...하아, 내가 대체 왜 이 영화를 봤을까 - 장르의 단순 반복은 그저, 슴슴할 따름.. "
5,"질질 끄는 미드의 축소판. 흥미롭지만, 둘러둘러 말하는 스토리텔링. "
5,그럭저럭 
10,기대안하고본다면 걍 b급정도영화 
2,정말 화려한 캐스팅이지만.. 영화의 내용은 별로 였다.. 
10,10점짜린 아니지만 너무 기대가 컸었기에 평점이 낮은거 같네요 
7,캐스팅도 좋고 평점보다 나쁘진 않았음 
5,10점 줄뻔햇네;; 옛다 5점 
1,일본 야동이 더 나을 것 같음. 
2,호화캐스팅이 무색할정도로 영화는 형편없다. 
7,나쁘진 않았어!! 
10,난 괜찬던데 
1,팀버레이크 가수나하지.. 영화 다망쳐놨어.. ㅋㅋㅋㅋㅋㅋ 
2,도입부의 총격씬만 보고 꺼도 된다 
6,헐리우드라고 이런영화 만들지말란법없는듯. 명배우 데려다놓고 삽질하기 
7,캐스팅을떠나서 작품은.. 너무뻔한 해피엔딩 
6,마지막부분에서 총격씬 너무하네 10명정도의 훈련받은요원들이 1명을 못이겨 어이상실 
5,이건뭐.. 
1,이 배우들로 세상에... 감독넘 거의 범죄 수준이다 이건... 
2,발로만들었네 완전 
3,출연진이 아깝다 
4,초반 총격씬 빼곤 하염없이 지루해짐.. 
1,허탈한 영화...배우들이 아깝다. 
7,캐스팅에 비해 액션과 스토리는 약헌데.. 
7,뭐 이딴 영화가...; 모건하고 케빈때문에 그나마 7점 준다 
1,뻔한 스릴러....아니 이게 스릴러야? 
10,나름재밋엇음 
4,감독 대단~~이렇게 화려한 출연진으로 이런영화를 만들다니....ㅉㅉ 
5,예측이 쉽고 내용도 탄탄하지 않고 지루하다 
3,저스틴 팀버레이크가 저렇게 생긴 애였구나 
3,이게 스릴러냐? 정말 뻔해도 너무 뻔하네... 
7,보이는 반전과 예측되는 내용과 결말이 아쉽다. 
1,"익숙한 소재,지루한 전개,뻔한 결말 모든걸 갖추고 있다. "
7,흥미롭게 보았던 스릴러. 
6,출연진에 비해.. 영 맥아리가 없었다 
1,저스틴 영화 고르는 안목 없네.. 모건프리먼나온대서 기대했건만.. 
5,재밌지도 않고 재미 없지도 않아 
1,현대 수면 영상 과학의 결정체. 
1,모건 프리먼과 케빈 스페이시가 아깝다. 
9,나름 괜찮터만뭐. 저스틴 귀엽다 
1,괜찮은 줄거리에 좋은 배우들에도 불구하고 형편없다 
2,스토리 신경 안쓰고 폼잡기에 환장한 영화 
5,뭐...아쉬움만 가득 남겼다... 
6,재미없지도 재미있지도 않네.. 그나저나 총 너무 쏘더라 ㅎㅎㅎ 
4,소재가 식상하면 연출을 잘했어야지..배우빼곤볼게없는영화 
6,좀 더 치밀하고 좀 더 참신했다면.... 
5,캐스팅과 초반/후반 액션은 대단한데 전반적으로 지루하다 
7,밴쿠버에서 촬영 장면 봤을 때는 기대가 컸는데 
6,괜찮기는 했는데 뭔가가 부족한.. 
8,지루하지 않았습니다. 
5,배우진은 빵빵했으나..스토리전개는 영~ 별루..... 
8,깔끔하게 해결된 건가? 묻지 말라네. ㅎ 
4,많이 부족해.뭐가 빠졌어.뭔가 주인공과 일심이 되어야하는데. 
1,이거 말고 바로옆상영관에서 하는 드리머를 봤어야했는데OTL 
5,화려한 배우진에 낚였다ㅡ.ㅡ 
6,배우들의 명성에는 좀 못미침. 줄거리는 괜찮았슴 
1,ㅋㅋㅋ정말 재미없다 ㅋㅋㅋㅋ 
4,"뭔가 있겠지 하고 계속 꾹 참고 봤지만.....허탈함, 짜증남 "
1,장난하냐. 스토리가 개차반이면 액션이라도 받쳐주던지 
10,스릴러류 좋아하는 사람에게는 추천 전 재밌었네요 
6,케스팅은 최고! 내용은 여러 스릴러 영화에서 짜집기. 
7,기대는 금물 
1,스릴러인데 ..너무 지루해 
1,진짜 DVD 1500원도 아까운 영화... 
1,저스틴 그만하셈 
7,나름느낌있었어 
4,정확한클라이막스는어디인지.케빈스페이시는멋있더군. 
8,폼을잡는게흠이나 대체로괜찮은영화 케빈스페이시가멋있게나왔다 
1,"저스틴을 위한, 그에 의한, 완벽한 그 만의 영화ㅠ "
2,너무 기대하고 봐선지 스토리 구성이 짜증. 
6,"그래도,, 착한 사람은 반드시 존재한다는 진리의 영화. "
7,결말이 아쉽지만 긴박감은 있다. 
7,리얼액션 경찰수사 드라마 
4,너무 기대했었나? 진짜 재미없어서 졸았음;; 
2,재밌을거 같아서 봤는데 화만 나는 영화 
5,별로 잼없당 
4,역시 가수가 끼니까 명배우들 연기가 죽는다. 
6,"흔한 이야기거리, 모건프리먼의 비중있는 연기를 볼 수 없었다 "
6,무언가 약간 부족한듯한 킬링타임용영화 
6,비슷한 류의 영화들이 많은데...그에 비해 한수 아래 영화.. 
2,"소음투성이에 한심한 대사들, 모간프리먼만 아니었으면 별한개. "
6,재미없다. 스토리도 별루고... 
5,그냥 볼만했음 
6,"식상한 진행과 결말,그냥 총싸움이나.... "
6,바이퍼타고 장보러가다니.. 
7,"결말이 넘 찜찜함, 중간중간엉성함이보임.. "
7,괜찮던데 평점이 의외로 낮네요.. 
8,잼있음 히히 
1,이런거 또 만들면 알아서 해...경고해써... 
9,볼만하다 
7,배우들의 연기 좋다. 저스틴 합격! 
8,단지액션은 아님.. 하지만 볼만함.. 가슴에 담기는게 있는 영화. 
1,최악이다!! 
8,볼만함 
8,기대안하고 봤는데 재미음.. 젊고  에너제틱한 액션무비 
6,많이 본 스토리. 강한 임팩트가 없어서 더 심심한 결말. 
6,주말에 심심할때 빌려보는 비디오용 
10,극장에서 봤는데 재밌게 봤는데 
1,이것두 영화 집에가서 애나봐라 개재미없음 
4,재미있게 잘 보았다 
10,모건 프리먼..역할은 좋았지만..비중이 낮아서 아쉬움.. 
3,허무해허무해...케빈 때문에 봤는데...허걱~ 
6,요즘 영화들 상당수에서 느낀 뭔가 부족한 2% 영화.. 아쉬워! 
8, 좋은 시나리오에 비해 아쉬운 이야기진행과 결말. 
5,그게.. 그러니까.. 뭐시냐.. 음..~~~~! 
5,중간까지 잘 나가다 이상해 지더니 마지막 람보는 뭘까.... 
6,배우들은 좋은데 이야기를 풀어가는 맛이 없다.. 넘 설렁설렁 
10,옹호는못해주지만 이평점받을영화는아니다...7점이면 딱이다 
5,막판직전까지 어렵게 유지되던 긴장감을 상실케 하는 결말. 
1,별 한개도 아깝다. 
1,헐리 우드의 퇴보.. 
4,"저스틴땜에봤드만,,짜증.지루.시시의압박!! "
6,그냥 볼만은했다.. 그리고.. 역시! 광고는 믿을게 못된다. 
1,그냥 이것저것 다쑤셔놓고 억지로 끼어넣고..쓰레기... 
6,대단한걸 보여줄려고 억지로 짜내는 어수선한 영화 
1,할말없음.. 
5,이른새벽 이리저리 채널돌리다 보면 나올만한 영화 
10,재밋음 
5,마지막에 람보영화로 바뀌는 허무한 결말. 당황스럽다 
10,스피디하고 음악좋고 시간가는 줄 모름. Not bad at all 
1,정말.최강의 배우진과 최악의 제작진이 만난 결과가 에디슨시티 
1,이거 마이너스는 없음??? 
2,"뭐야? 배우이름 값이 아깝다. 구린 시나리오,완전 재미없어. "
5,이런... 
1,싫은 사람들에게 꼭 권하고 싶은 영화. 
3,내가 이걸 왜 봤을까? 
8,나름대로 재미있던데... LL 쿨 J 근육 장난 아니게 멋지다.. 
1,진짜진짜 너무 재미없다! 이건 아니다 정말 
8,전반적으로 재밌다. 끝부분이 좀 아쉬운.. 
3,홍보는 케빈스페이시로했지만 그의비중은 조연급도안되는거같다 
3,돈 내고 봐서 3점이다...이 정도면 말 안해도 일겠지!... 
8,이정도면 재미나지 눈들이 너무 높네 ㅋ 
2,"이2점은_케빈스페이시,모건프리먼의 이름값!그명성에먹칠한영화 "
7,지루했는데.. 이거 안 본 남친은 케빈의 이름값을 믿으라 했다. 
3,"케빈 스페이시, 모간 프리먼.. 돈이 궁했나. "
6,그냥그렇다....액션씬은 봐줄만한데 결말이 정말...... 
6,극장에서 보긴 돈이 좀 아깝네요.. 
5,내용 좀 실망. 출연진만 볼만함 
4,ㅡㅡ^ 쩝.. 별내용없음..비디오로 볼만한 영화 
3,배우들이 아깝다 
3,콩가루 시티다... 뻐커.로 시작해서 뻐커로 끝났다..ㅠ.ㅠ... 
10,난잼있던데 욕하는사람들 저거가 영화한번 만들어보던가~ 
10,"대박잼나던데,,올만에...여자안나오고..이정도면,^0^ "
8,그런데로 재미있었는데... 
3,부족한게 너무 많다..액션이라도 제대로 보여주던지~돈아까움 
6,애들 모아놓고 고작 이정도밖에 못만드나?감독의 자질이 의심 
1,정말재미없습니다...궁금하시면 보시던지..... 
2,-_-제가 돈내고 이 영화를 봤다는 게 후회됩니다. 
7,간지나는총질.......긴장감~~ 
2,인간적으로 너무한다~ 진짜 재미없음~ 
3,오늘봤는데.ㅠㅠ뻔한스토리긴장감도없고에출연진이아깝네요.. 
10,예상못한 결과들. 인물간의 숨막히는 긴장감!매료된 캐릭터들! 
6,모처럼 케빈스페이시를 봤으니까... ^^ .. 하하 
5,크레딧 이상함.. 주연은 폴락과 디드 아닌가. 
5,한국영화가 훨 더 낫다라는 것을 증명한 영화 흐지부지의 결정판 
2,비밀경찰이란 것들이 저리도 요란스런 일처리를... 어이없음 
5,케스팅보고 잔뜩기대했으나 무지 실망했음 
10,긴장감도 있고 볼만함. 저스틴이나온다는것만으로도~ㅋ 
5,혼자 다죽이냐 
7,타협을 배웠어요. 세상이 그렇다면 같이 살자도 괞찮지요? 
7,최고의 케스팅 하지만 각각의 역활에 비중이 가벼움 
5,캐릭터들의 내적인 갈등을 좀더 부각시켰다면 썩 괜찮았을듯... 
8,괜찮은연기.괜찮은액션. 쫌 아닌 엔딩 . 
3,조낸 억지스러움. 어이없는 원맨쇼. 저스틴의 데뷔작~??;;; 
1,티브용을극장가서 보다니..트레이닝데이의tv판을보는듯한 
8,모건 프리먼의 댄스를 잊을수 없다! 
6,너무 뻔한 스토리에 스릴러다운 기미는 전혀~ 
5,글쎄..모랄까요..액션스릴러라는 말이 무색하네요.. 
6,"음..중반까지는 잘 풀었는데, 마지막이 좀..약했던 영화.. "
5,어디가 구리다고 말할순 없지만 미묘하게 재미없는 영화 ;; 
6,전형적인 아메리칸스타일 영화? 
7,지루하지는 않고 보기엔 괜찮은 영화 
6,재밌어요. ㅋㅋ 모건 프리먼의 춤실력 멋지심 
10,"유명 배우들의 연기, 긴장감 있는 작품 "
5,캐스팅이 화려하지만 않았어도 7점은 줄 수 있었을 텐데 
3,유명배우 다나오는데 스토리가 산만하고 엉성함~ 실망했음... 
7,기대에는 못미치는......긴장감 하나는 있다! 
6,"시사후/모건&케빈의 출연에도 불구, 뻔한 스토리와 총질 남발.. "
10,"스릴러를 좋아해서 그런지 ,, 재미있게 봤다. "
7,"소재가 진부하고 개연성이 부족했으나, 연기가 좋았으므로 인정. "
3,"스타들이 나오는 3류 영화, 어이없음 "
4,케빈스페이시.. 때문에 기대했는데.. 정말.. 이건 아니다.. 
4,액션만화려함.케빈스페이시의극중역이 너무적음 
2,아무 느낌없이 총질이다. 살인의 연속이 전혀 공명되지 않음 
10,박진감 짱~~잼있어여~~ 
3,캐스팅 화려하네.. 
3,배우들이 아깝다. 결말이 뻔한 B급 영화 
10,주름까지 섹쉬하신 케빈 오라버니--;; 기대를 저버리지 않는... 
1,빵빵한 출연진 데려다놓고 우습게 만든 영화... 후회할 것임. 
10,출연진만해도대단한스케일이느껴지네요 
10,영화 정말 잘 만든 거 같다. 역시 연기파는 뭘해도 나아^^ 
10,네고시에이터2격이라고 하면 과찬인가? ㅋㅋ 
2,중간에 뛰쳐나가고 싶던 시사회는 이게 처음이다..-_-; 
2,진실을 찾기 위한 한 청년과 거대조직의 위험한 전쟁 
8,개연성이 좀 부족한듯.. 박진감도 있고 액션씬은 괜찮았음~ㅋ 
6,"총격씬은 좋았지만, 사건을 풀어가는 긴장감이 별로 없음. "
10,자막은 언제 나오나..ㅠ.ㅠ 
10,세븐 10년후.. 모건과 케빈의 만남. 과연? 
4,이렇게 쟁쟁한 배우들도 이 영화를 살릴수는 없었다. 
10,이거 꽤 잘만들어진 영환데 컨셉도 훌륭하고... 평점이 이게 뭐니? 
2,영화를 보는 내내 지루함을 견디기 어려워 저녁에 먹는 메뉴와 내일 할일을 생각했다. 
5,단순한 사건의 액션 범죄 영화. 주인공 흑형이 정말 강해 보이고 투철한 기자의 정신이 멋지다. 
7,"레옹과 비견될 정도로 전체적인 내용 구성에 있어서는 딱히 흠잡을게 없을 정도로 균형감이 굉장히 뛰어난 영화다. 다만, 내용컷 하나하나의 진행에 있어서 스릴러,액션박력 등 푹빠지고,각인될만한 이벤트매력씬이 없이 중하정..."
