score,review
10,진짜 옛날에 터미네이터마냥 가슴조리면서 봤다 충격적인 영상도 있었고 
10,나왔는 시기가 있죠 이떄당시 충격적이었음...국딩때 비됴로 빌려본 기억이~ 
7,"아 이거 중학교때는 충격적이었는데,터미네이터 1이 떠오르네... "
10,진짜 이거 다시 리메이크ㅤㄷㅚㅆ으면 하는데 잼나요 
10,어릴적 정말 재미있게 봤던영화 그때도 cg는 어설펐지만 긴박감은 최고 
10,정말 횽아가 어렸을때 이런영화만한건 없었다 !! 쇼킹이었지 덜덜 
10,당시엔 충격이었다!! 
10,초등학교때 봤는데 엄청 쇼킹했음....정말 최고!! 
8,어렸을 때 봤던 그 충격이 아직도 생생하네요. 
10,파격적인영화 ~~~ 다시 리메이크 되길 
8,어릴때 비디오로 빌려서 여러번 반복해서 봤었어요 ㅋㅋ 
9,지금봐도재밌다.그당시비디오로연속3번을봤었다 
10,그때 당시 히트 했는지 안했는지 모르겠지만 89년도 감안하고 보면 참신한 작품이다. 그당시 유행하던 암울한 미래... 근데 여주 예쁘다. 
10,이거 당시에는 엄청 센세이셔널 했겠는데? 
9,B급 영화로는 정말 걸작에 들어가는 재미면에서는 블럭버스터 못지 않은 작품.... 
10,시대를 앞서간 b급 영화의 전설~ 어떻게 보면 터미네이터가 울고갈 정도의 파괴적 쇼크의 영화였음. 
8,헐리우드의 최신 CG 그래픽으로는 흉내도 낼 수 없는 아날로그 시대의 어설픈 고무 인형에서 뿜어져 나오는 극한 공포.. 호러적인 면에선 터미네이터 보다 위다. 
10,학교판 터미네이터잼어요 
10,그냥 볼만했다 나름 볼만했다 
10,이거 죽임 캬.ㅎㅎㅎㅎ 
10,문제아들을 철저하게 응징하는 로봇선생들을 통쾌하게 봤음...로봇선생들이 이겼으면 했음... 
10,최고다~ 영화 '패컬티'와 비교해서 보시기를~ 
8,정말재밋엇음.http://cafe.naver.com/grayd0tbe/321 
10,이 역사적인 걸작을 잊고 살았어....최고!!!! 
8,이제 정식 미국산 DVD로 출시됨. 그간 어정쩡한 어두운 톤의 한국산 DVD는 퇴출. 
9,액션도 좋았지만.. 당시엔 내용이 충격적이었던.. 
8,20년전 센세이션을 일으켰던 작품. 시대를 감안할 때 B급수작이다 
9,터미네이터1과 유사한 효과로서 색다른 스토리까지 입혀진 b급 명작.소품을 이용한 특수 효과와 어두운 분위기로 시간내내 긴장감을 준다 
9,중딩시절 상당히 흥미진진하게 봤었음..그때봐서 그랬던가.. 
10,지금봐도 괜찮은 영화.. 재미있네요.. 
7,추억의 sf영화. 초등6학년때 봤던..관람후 평점 솔직하네 ㅋㅋ 
7,나도 그 당시 나름대로 잼나게 봤었지.. 
7,그 당시 나름대로 재밌었다. 
7,황당하고 충격적인 막장 FX 영화. 하지만 몇번씩 비됴테입을 빌려보게 만들었던 머리속 각인을 만들었다. 
4,학교로간 3대의 터미네이터 
4,학교로간 3대의 터미네이터 
6,"시대를 고려하더라도.. 터미네이터는 지금봐도 훌륭하지만, 이건 그렇지 않다 "
10,학교판 터미네이터잼어요 
10,우연히 봤는데 액션도 괜찮고 꽤 재밌었다. 특히 체육선생이랑 역사선생 표정이 완전 섬찟한게 귀신보다 무서움 
10,옛날에 지금은 없어진 영등포 명화극장에서 봤던 생생한 기억이... ㅎㄷㄷ 꿀잼스~!! 
10,어렸을때 과연 1999. 년은.  저런 세계일까 무서우에 떨면서 봤던 영화. 
3,Partying hard 
10,지금으로서는 도저히 나올수 없는 B급병맛막장 감성 
9,터미네이터의 B급 작품이라고 할까.. 긴박감도 있고 CG도 나름 훌륭했던 꽤 볼만한 영화.. 
10,당시에 진짜 재밌게 본 영화 
10,영화 패컬티랑 뭔가 느낌이 비슷하다 외계인에서 기계... 패컬티가 더 해피엔딩이지만 
8,흥분의 90분 
10,당시 정말 재미있게 봤던 영화. 벌린 입 안에다 대고 서브머신건 갈기는 장면이 압권. 
4,양아치잡는 용병 로봇선생의 대활약을 그린 영화.. 
7,재미는 있었지만 그 뿐이라서... 
9,이걸 본 이유만으로도 반 친구들에겐 동경의 대상이었다. 
8,생각보다 재미있었던 기억 
5,보고 웃겼음. 
9,당시 최고의 영화 
10,기억에 남는 영화.. 
10,내 생에 최고의 영화^^ 강추 
8,89년 당시 대단했던 영화^^ 
5,지금으로서는 굉장히 유치하긴 하지만 그 당시에는 나름 볼만 했다고 생각함. 
10,말이 필요없는 최고의 B급 걸작속편.B급걸작이란 어떤 영화인지 확실하게 보여준다. 
10,개명작!! 
10,터미네이터의 아성을 누른 최고의 SF영화!!! !!!10점만점!!! 
3,꽤..쓸데없이 미리앞서간영화.. 
4,스토리가 개연성이 너무 부실해 보기가 민망하다.그러다고 연기력이 있는 배우도 아니고 연출이나 CG도 보기 민망스러운 수준이다. 
5,살선생3인조가 좀 어이없이 패배 
4,"여러모로 어설프지만, 절정부의 괴기스러운 로봇들 모습은 좀 볼만 "
4,극단적 설정탓에 다소 유치 
4,일본영화 배틀로얄과는 좀 다르지만 큰 줄거리는 아마 일본이 모방한건지도. 
7,goodhttps://cafe.naver.com/grayd0tbe/321 
6,뭐야 이게;; 친구가 폭력써클 추천해줘서 그거 보려다가 검색 미스로 잘못 받아졌길래 그냥 봤더니 하;; 답없다. 그냥 스토리는 있으니까 기본 점수 준다;; 
9,지금보면   유치할수도 있겟지만  어쩜 제목 때문에 더욱 손해볼수있는영화인데 그시절영화로는 수준급 
5,글쎄.. 10대를 위한 영화같은데.. 이제는 못보겠다. 
1,저예산 SF영화의 전형 허접하고 가난한 화면!! 
1,로봇 선생들과 애들이 총들고 전쟁하는 정말 어처구니 없는 스토리.. 
6,B급  병맛   b급 병맛  조선짱깨 
2,시간의 소중함을 알으켜주는 명작 
1,사이보그 선생들이나 양아치학생들이나 둘다 한심 
1,이 영화를 보면 터미네이터가 얼마나 명작인지를 다시한번 느낄 수 있다. 
