score,review
10,사기였던 아니든...중요한 것은 감독의 연출력... 
10,대작. 역시 스필버그! 
10,근래 사기극 논란 이전의 극장에서 봤던 그때 기준으로 평가한다. 재미와 감동의 걸작 
9,잼있네요 
8,인류에게 의미있는 영화 
10,쉰들러가사기꾼이라는걸알고서많이실망햇지만 그래도 영화는 굳 
8,명작인것은 알겠다.. 작품 자체가 고귀하다..근데 너무 지루하다.ㅜㅜ 
10,쉰들러가 사기꾼이라는게.. 서프라이즈에서 증명됨... 하지만감동은... 
10,10점 만점! 굿! 
10,언제나 다시봐도 마지막 장면에서는 눈물을 흘리게 된다. 내 생의 최고의 영화 
10,영화볼때는 정말 오스카쉰들러라는 사람이 위인이라는 생각이 절대적이었는데 
10,쉰들러의 진실은 애매하나 영화는 끝내준다 
10,완벽하고 아름다운영화다. 왜곡된것은 슬프지만.. 몰랐으니 어쩔수없는법. 
10,짱 
10,이것이 진정 스필버그를 최고의 감독이라고 칭할수 있는 증거다...! 
10,아 국가대표 진짜 짜증난다. 쉰들러 리스트 영화 자체만으로는 감동적이었습니다. 
10,한국영화면 10점주고 보는 쓰레기 OOO들이 다 1점줬네 
10,최고다. 
10,다시보기엔 좀 그렇지만 유태인의 비극을담기위해 회색컬러는 굿인듯 감동임 
10,적어도 독일은 과거에 대해서 철저한 반성을 하고 있습니다 -_-;하지만 일본은 .. 
10,10점이 아닌게 아싱한영화 
10,최고 
10,지상파 프로그램에서 뭐라하든 그래도 역사적인 생생한 일을 그려낸 영화인거 같다 
8,그럭저럭..약간 지루한듯 
10,내가 유대인이었다면... 실화라 더욱 공감... 
9,스필버그 드디어 거장으로 자리잡다. 
10,더 이상 무슨 말이 필요하리요.. 
10,보면서  많은생각을 하게해준영화 한사람이 할수있는일은 대단하다는걸 보여준영화 
10,정말 감명깊게 본영화 
10,사람마음이란 어떤 환경속에 처해져 있는가에 따라 달라지는것 같다.. 
9,슬펐다. 그 당시에 오스카 쉰들러 같은 사람이 조금 더 있었더라면 좋았을 텐데 TT 
10,극한의 선.  여태 본 두번째로 많이 울게 한 영화 
10,더 살릴수 있었을텐데 ㅠㅠㅠㅠㅠㅠㅠㅠㅠㅠㅠㅠㅠㅠㅠ 
10,굿 
10,굉장히 사실적인 홀로코스트영화.흑백의 묘미가 있다 
10,국대땜에 평점 남긴다... 도대체 명품영화 왜깎아-_- 
10,이거 10점 안주면 뭐에 주려고? 
10,잔잔한 휴머니즘.. 
10,국대도 좋은 영화이고 이 영화도 훌륭함...왜 1점을 주는거지?? 
10, 유태인들은 홀로코스트지들이 당햇으면서 지금은 팔레스타인들한테 하고잇음 
10,국대국대 거리는 찌질이들 훠이훠이 ㅉㅉ 
10,"가슴 아픈 역사의 잔해, 그 먹먹함 속의 휴머니티 "
9,재미없게 생겼지만 보시면알거에요;; 
10,이런 명작 영화를..... 게다가 실화임 
9,스티븐스필버그 감독님의 이전 작품들과는 달랐지만.. 정말 잘 만들어낸 작품! 
10,평점 그냥 쭉내려버려라 이영화에도 알바가 꼬이다니 ...눈뜨고 못보겠다 
10,누가봐도 국대알바들이 판을치네 ㅡㅡ영화 최곱니다 
10,짱 
10,이 영화를 왜 이제야 봤을까 
10,국가대표라는 영화랑 이영화랑비교하는 사람이 우리나라사람이라는게 안타깝네요 
10,글로 표현할수없는 감동입니다... 
10,왜? 여기서 국가대표를 애기해..? 
4,흑백영화보단....국가대표~~ 
10,시간가는 줄 모르고 봤다. 최고다~ 
10,죽은시체더미속 빨간코트 정말 가슴을 덜컥 주저앉게 했다. 이영화 정말 최고 
10,영화보고 울기는 처음..... 
10,진짜 감동이었습니다 
10,중학교때 학교에서 단체로 보러가게 했던 기억이.. 감동적이었다 
10,감동의 대서사시 
10,진심으로 최고의 영화다.실존인물이라는 것이 더욱더 최고로 만드는것 같다. 
10,이런 인물이 있었다는걸 몰랐다..천사다 
10,타인의 괴로움에 냉담한 자는 인간이라는 이름으로 불릴 자격이 없다. 최고의 영화. 
10,정말 느끼는게 많은 영화... 명작 좋아하시는분들이라면 보세요~~ 
10,94년도에 여친이랑 시간때울겸 갔다가 한시도 눈을 못떼고 지켜본 감동적인영화 
10,사실성과 객관성과 드라마가 조화를 이루었다. 훌륭함. 
10,많은 생각을 하게 하네요 사람의 내면과 섭리 
10,보는 내가 더 미안해 질 정도로... ㅠㅠ 
10,감동입니다.. 넘 재밌어요 
10,최고 
10,소설을 본듯한 영화한편이었습니다 
10,레이프 파인즈의 연기에 몰입...최고임 
10,"유태인이 어쩌고 저쩌고를 떠나서, 명작 "
10,이건 3~4번 우려봐야된다. 그만큼 안질리는 영화. 최고다 
10,쉰들러가.. 테이큰의 리암니슨이었다니.. ㅋ 하지만 이 영화는 최고 ^^ 
10,그 이상의 김동..더 살릴수만 있다면.. 
10,명작중의 명작 
10,명작중의 명작 기억에 오래남을것 같습니다 .. 
10,티비로라도 볼 수 있어서 정말 다행이었다. 진짜 명작 
10,흑백화면에 붉은옷을 입은 소녀를 비추던 장면은..아직도 잊혀 지지 않는다.. 
10,10점 만점에 11점 주고 싶은 영화. 
10,역시 명작이다 하나의 생명을 더 살리지 못해 자책하는 쉰들러를 보니 숙연해진다 
9,아몬의 악마성은 과연 그 개인만의 것일까?? 
10,정말 보기드문 명작이죠 
10,랄프 파인즈의 악역연기는 소름이 돋는다.. 
10,최고의 영화 
10,여기서 일제강점기를 논하는 개념이 궁금할뿐 
10,"내 생애 300편이상의 영화를 봐 왔지만, 최고의 영화라고 자부하고 평가한다. "
10,감동도 감동이지만..독일과 일본...혐오스럽네요. 
10,몇번을 봐도 마지막장면에선 눈물이 난다. 이런게 진짜 영화. 
10,진정한 휴머니즘이 느껴지는 영화! 
10,도중에 지루하다고 꺼버린다면 당신은 아주 큰 실수를 하는 것이다 
10,작품성 인정 
10,"피아니스트,안네의일기,소비버탈출,마지막 한 걸음까지""도 최고의영화^^ "
10,긴 상영시간이 전혀 지루하지 않았음 흑백영화에 배우들의 열연 최고 
10,영화역사상 오래도록 남을 최고의 명작 중 하나..스필버그의 흑백화면이 인상적. 
10,이 영화는 명작영화일수밖에 없다. 사실적이면서 멋진 구성을 보여준다 
9,리암니슨의 포스가멋졌다. 하지만마지막 모습이 슬프면서도 약간아쉬운.. 
8,유태인 학살의 참상을 리얼하게 보여준다. 막판 쉰들러 오열씬에서 울컥했다. 
10,that`s the power 
10,실화이면서도 리암니슨을 좋아하게된 계기가된 영화 
10,마지막 대사들이 너무 주옥같던거 같네요... 
3,일관된 모습을 마지막에서 확 깨게 만드네... 
10,.. 말이 필요없는. 
8,"실화를 주제로한 잔잔한 영화, 작품성은 좋지만 오락성은 없는 감동영화. "
10,꼭 보세요. 볼까 생각지 말고 보고나서 생각해보세요. 
10,마음에 남은 여운이 가시지 않네요 - 최곱니다. 
5,좋은영화나절제하려다오히려뭔가과장된점이아쉽다 
10,부자들은 가난한사람들의 생활을 생각하기 어렵다. 이게 현실... 
10,이 시대에 욕심많은 사람들 반성 좀 했으면 좋겠다. 
10,더이상 이영화에 대해서 평은 필요 없다 말이 필요없는 최고의 영화 
10,정말 아직도 감동의 여운이 남아있는 영화. 빨간외투의 여자아이가 떠오른다 
10,정의로운 사람이 뭔지 보여주는 영화 
10,"진정한 힘은 사람을 죽일수 있는 것이 아니라, 사람을 용서하고 살릴수 있는 것이다. "
10,인종문제에 대한 경각심을 다시 한번 고취시켰던 스필버그의 수작 
9,감동보다는 구성과 연출력의 힘.. 
10,명작..왜 이제서야 봤는지.. 
10,제 생애 최고의 영화입니다.. 
10,"마지막에 눈물이 주르륵,, 이런영화를 왜 이제서야 봤나 "
10,"최고의 영화!!! 우리가 과거의 일을 잊지 않도록, 생명의 소중함을 잊지 않도록 !!! "
10,스필버그의 한계는 어디까지인가.. 역사상 최고의 영화중 하나다 
10,거장의 손길과 배우들의 영혼이 만들어낸 예술 
10,말도 안돼...'아몬'이 랄프 파인즈였다니..와...진짜 헐...대박...;; 와...진짜 헐... 
10,전쟁신만 찾던 내가 이렇게 재밌는건 처음 
10,3시간 하나도 안지겹다 짱 
10,내가왜이걸이제봤지아나ㅋㅋㅋ 
10,거품많이 꼈네. 지나치게 미화된 억지 휴머니즘. 차라리 호텔르완다를 봐라 
10,독일 전쟁 폭리자의 구세주적 출현에 대한 냉혹하면서도 비감상주의적인 초상 
9,재밌는 소재로 잘 살렸네요 
10,닥치고 보자 
10,최고중의 최고의 영화 R.I.P 쉰들러 
10,깊은감동의영화입니다꼭보세요 
10,홀로코스트의 대표적인 영화... 안보신분들은 꼭!! 보시길^^ 
10,'혼돈은 사람을 성숙하게 만든다 
10,이런 대작을 이제서야 봤다..... 
10,작품이라고 한다면 이런영화를 두고 작품이라 하지않을까 
10,3시간이 지겹지 않다.역시 스필버그다 
10,진짜.. 약간 지루하지만 그 지루함을 이겨내는 마지막의 감동.. 
7,그정도인가... 
10,다시 한번 봐야겠다 
9,약간 지루한 면도있었다. 하지만 감독이 스필버그다. 내가감히 평가를...ㅡㅡ 
10,전설로 남을 명작.. 
10,개봉날.. 대한극장에서 봤었던 영화.. 완전 감동.. 
10,이건머 보고 또 봐도 감동에 감동 
10,학교에서 봤는데..아우.. 보는 내내 조마조마.. 마지막에 계속 소름돋고.. 
10,유대인들이 얼마나 고통스러운 삶속에서 살았는가를 꺠우쳐 주는 영화. 
10,감동의 도가니탕. 
10,이걸 왜 이제야봤을까...? 
8,랄프파인즈 연기에 몰입당했다. 
9,유태인만큼 학살당한 울민족도 가만있는데 유태인학살영화 왜케 많냐? 
10,흑백영화여서 그런지 감동이 더 온다 
10,최고............... 
10,말이필요없다 
10,이 영화를 접할 수 있었던 것은 나에겐 행운이었다. 
10,오스카 쉰들러 
9,혹시 오스카 쉰들러는 독일의 패망으로 전쟁이 종식되는 것을 알고 있지 않았을까.. 
10,인간이 왜 인간인지 알려주는 영화 
10,슬픈건 이렇게당한그들이 똑같이 예루살렘에서 아랍인들에게 행하고있다는사실이다 
10,옛날영화보고요즘시대에사는내가느낌이올까했는데어떤걸로도비교할수없는깊은감동 
8,이런 영화를보면 왜 독일이 싫어지는걸까... 마치 일본처럼.... 리암닐슨 굿~~~~~ 
9,정말 명작 중 명작..마음을 뒤흔드는 영화 
10,이래서 스티븐 스필버그 !! 
10,그시대의 진정한 남자는 오스카 쉰들러가 아니엿을까. 
10,굿! 
10,살아가면서 꼭 한 번 쯤은 봐야할 영화. 여태 안 본 걸 후회합니다 
10,굿 
10,재밌네 ㅇㅇㅇㅇㅇㅇㅇㅇㅇㅇㅇㅇㅇㅇㅇㅇㅇㅇㅇㅇㅇㅇㅇㅇㅇㅇㅇㅇ 
9,스토리상으로 매우 훌륭하고 볼만하지만.. 그래도 중간중간 뭔가가 아쉽다.. 
9,3시간이 넘는시간동안 집중하면서 본 영화.. 3시간 투자해서 볼만합니다 
10,인류의 영화 아닌가.. 
10,여러가지를 느끼게 하네..잘 만들어따~~ 
10,그 참혹한 역사에 대해 다시한번 더 생각해 볼 수 있는 영화!! 최고입니다.!! 
10,뜻 깊은 영화였다. 잘 봤다 많은 생각을 해주게 한 영화 
10,진짜 감동.....무개념몇몇이 그 시대의 영화는 지겹다한들 억울히죽은 그들과 세계.. 
10,친일파들이 떵떵거리며 살고 있는 우리나라가 부끄럽다. 
10,또봐도 감동 
10,슬픈 진실 
10,몇번을 다시보아도. 이 영화는 대단합니다. 스필버그에게 찬사를.. 
10,좋은영화입니다... 너무 늦었지만 지금에서야 봐서 다행입니다. 
10,아.... 
10,이 영화를 이제서야 보다니.. 정말 최고의 영화중 하나이다 
10,영화 정말 재미있네요  이런 영화가 많이 나와야 되는데 
10,사람냄새 물씬 나는 영화였다. 
10,↓알바는개뿔이 이것도 알바가있나 내 인생 최고의영화중 하나 
10,내 인생의 목표 내가 되고싶은 사람 하지만 한없이 모자란 나 실화이기에 더욱 감동적 
10,최소한의 인간다움 - 
10,가슴이 미워진다....말할수 없는 여운......정말 최고다 
10,일단 보시길.. 
10,평점 처음 줘본다... 진짜 내 인생의 최고의 영화다!!!! 
10,이건 나이가 들면서 한번씩 봐줘야 하는 영화... 느낌이 달라질 것이다. 
10,아.. 
10,어렸을 때 보았지만 인상깊었다. 
10,"흑백이라 더 매력있는 영화, 한 마디로 great이다!!! "
10,이제서야 본게 너무 아쉽네요 진작 봤어야 했는데... 
10,흑백이라서 그런지 화질이 디게 좋다 ㅎㅎ 
10,이것땜에 병원도못갔네... 
10,감동 감동 
10,ㅠ.ㅠ 감동 
10,긴말이필요없다 10점을 줄수밖에없는 이유는 보면알수있다. 
10,굿 
10,한사람을 살린것이 세상을 살린것이다.. 
10,이런게 최고다 
10,무슨말이 필요하리오~ 
10,스필버그의 위대함을 보여준 영화 
10,ㅠ봐야지봐야지 하다가 이제야 봤는데ㅠㅠㅠ보길 너무잘했네요 
10,정말 감동적인 영화...... 정말 10점만점에 10점 
9,너무 재밌었다. 어딘지 1프로 부족한 느낌. 
10,완전감동.... 
10,이렇게 슬픈 영화는 처음이에요.... ㅠㅠ 
10,삶에대한 고민을 해 본 사람이라면 이 영화에 놀랄 수 밖에 없다. 
10,별 내용 없었던거 같은데 3시간 18분 짜리 영화 였다니 그 만큼 재밌었단 얘기 
10,"여기서 IMF가 왜나오냐, 참 개념없다.. "
10,이젠 영혼의 한 생명을 살릴 자가 나와야 할텐데 
10,굿 
10,당신은 존재의 이유를 무엇이라고 생각하십니까? 
10,명작중에 명작이당 
10,명작 평생에 꼭 봐야할 영화 
10,감히 영화에서 인생의 큰 줄기를 배운다. 
10,역사는 과거를 기억한다.......................... 
10,이건 영화가 아니고 명작이다. 
10,랄프파인즈의 악마같은 눈빛연기.. 정말 최고다 
10,한사람으로서 보여줄 수있는 선의 극치. 
8,기억이 가물가물 하지만 재밌게 본걸로 기억된다 
10,나도 이런 영화 만들고 싶네요 스필버그 따라잡기 
10,명작 
10,노무현이 이 영화를 좋아했던 이유는 아마 쉰들러처럼 살고 싶어서가 아닐까 
10,역시.. 스티븐 스필버그다..! 
10,긴 런타임에도 너무나도 완벽해서 정말 시간이 가는줄 몰랐다는 표현이 정확하다. 
10,유태인 영화 지겹지만... 
10,"한 영혼이 천하보다 귀하다는 문구, 쉰들러는 보여주었다. "
10,강심장인 나를 울린 유일한 영화였다. 
10,인간의 도덕적 갈등을 너무나 잘 그려낸 영화 
10,"""반지팔았으면 2명은 더구했을텐데""....아직도 잊지못하겠다,최고다 "
10,항상 그렇지만 흑인이나 유태인 소재 영화는 가슴이 아프다. 
10,대단하신분~! 
8,"전쟁, 그 가장 참혹한 인류의 만행 "
10,모든사람을 사랑하는 마음이 아름다워요 
9,가슴이 뜨겁다 난 누굴위해 희생해 본적이 있는가 
10,유태인들의 명복을 빕니다 역시 스필버그영화 실화라니 더 감동 ㅠㅠ 
10,아무렇지 않게 클로즈업해 더욱 아프다. 인간은 어디까지 악해지고 선해질 수 있을까. 
10,역시 스티븐스필버그 
7,그냥... 뭐.. 재미는 있음. 
10,정말말이필요엄는듯...명작이네여 이걸보시고피아니스트도한번보시길^^ 
10,영화다시보고싶은대어케봐요? 
10,멋지다...  뭐라말할수 없는  감동~  ㅠㅠ 
10,영화를 다 보고나니 포스터가 무엇을 의미하는지 알게됐다. 
10,최고~ 
10,유태인 만이 아닌 그는 인간 생명의 존엄성을 가진자! 명작 중의 명작!! 
10,와... 할 말이 없다. 
8,괜찮은 독일인에 관한 영화 
10,정말 좋은영화! 특히 마지막에 쉰들러 떠나기 직전장면 진짜 대박 ㅠㅠ 
9,초반빼고는 너무너무좋은영화 
10,정말 최곱니다 감동받았어요ㅠㅠㅠ실화라는게 너무 마음 아프고 괴롭네요.. 
10,최고!최고!최고! 
10,내가 어려서 이걸 봤다면 지금의 감동은 느끼지 못했을테지.. 
10,100점도모자른영화. 
10,무서운 역사도역사지만 16년전 이 영화를 만들었다는자체가 무섭다 스티븐스틸버그 
10,일제강점기를 거친 우리민족의 가슴을 울리는 슬픈영화ㅠㅠㅠㅠ 
10,10점 주고갑니다. 
10,길다. 날잡고 보자. 알수없는 눈물이 줄줄줄... 
10,살면서 이렇게까지 감동적이고 슬프고 흥미있는 영화는 처음이었다.... 
9,스필버그의 역작...감동 슬픔  전잰의 잔인성 
6,"영화는 훌륭하지만, 요새 유태인들이 하는 짓을 보면......... "
10,영화 마지막 부분이 아직도 남는다 
10,굿굿굿 
7,흑백이라 실감났는데 어린애가 보기엔 
10,용서는 하겠다 하지만 잊지는 않겠다 
9,이데올로기보다도 전쟁보다도 항상 사람이 중요하다는걸 보여준영화 
10,우리 안에 무엇을 담아야 하는지를 보여주는 영화 
7,쉴들러가 멋있긴하지만... 그 과정이 너무 지겨웠다... 
10,흑백탓하면서 평점1점주는 밑에 무개념97년생초딩님은 뭥미.정말 이영화 명작입니다. 
10,주님의사랑은 쉰들러보다 더 하시겠죠?주님은 자신의 피를 팔아 우릴 하나씩 사셨죠. 
6,결론을 보여주기 위한 과정이 너무 안타깝다 
10,흑백이지만 내용이좋네요 별5개 
10,최고의 영화! 
10,무슨 말이 필요할까? 쉰들러의 무덤앞에 고개를 숙인다.... 
10,랄프 파인즈 연기가 참 멋졌죠.. 
10,너무 감동이다 ㅠ 
9,센티멘털리즘이 약점이다. 스필버그의 한계와 가능성이 가장 명확하게 드러난 작품. 
10,나라면 그 돈으로 내 사리사욕 챙기기 바빴을텐데... 그에게 경의를표한다. 
10,비록흑백이지만 정말최고이다. 
10,전쟁이만든 아름다운이야기 
8,진짜 멋진 부자네.. 
10,전쟁..... 두번다시일어나선안되는것 
10,굿 
10,나는무엇을 할수있는가...먹먹하다 
10,197분내내 지루하지 안았다...최고의 영화중에 하나 
10,최고의 명작 한사람의 힘을 보여준영화 
10,멋있다! 감동스럽다! 최고다! 말로 형언할수 없는 감동. 
10,정말 보면서 가슴아팠다.. 
10,명작의 감동. 
10,많은 걸 생각하게 하는 영화. 
10,내생의 최고의 영화. 
10,절대 지루하지 않다. 
10,생명리스트.... 전쟁의 참혹함을 여실히 보여주는 감동의 영화. 
10,특별한 이야기다 
10,지루할 줄 알았다.근데 그건 초딩같은 생각이었다. 내 인생 최고의 영화라 해도 좋다. 
9,지루할까봐 안보고있었는데....전혀 지루하지 않네요. 
9,지금 생각하면 마지막장면뿐; 
2,당시엔 이런영화가 없었으니 감동적이었겠지 
10,최고다.. 
4,아 존1나 지루하고 감동도 별로 없고 그냥 쓰래기 3시간버림 
10,남자다움을 떠나서 인간이 살아가야할 분명한 이유를 부여해주는 영화 
8,명작임에는 틀림없지만 더 이상 유태인 학살에 관한 영화는 싫다 
10,지루하다고 말하는사람들을 이해할수없음ㅋ 개쩌는명작임 10점만점에 100점 
10,당시배경을더욱암울하게보이는흑백과그상황에쉰들러를변하게한계기인빨간옷의소녀 
10,그는 1200명만 구원한게 아니다. 그는 모든 '인류'를 구원했다. 
10,오스카의 눈빛 
9,정말대단한명작입니다만내용이너무어려움인생은아름다워피아니스트등대단한감동입니다 
10,다시보고싶은영화 
10,큰 감동 받았음. 
5,3시간이넘게상영너무 지루했다 재미로보신다면 후회할듯 영화가아닌 한편의다큐멘터리 
9,재미있엇다 
10,십여년만에 다신 본영화. 
9,이거보고 울뻔했어 ㅠㅠ 
10,왜 이 영화를 이제야 봤을까... 정말 ㅠ.ㅠ 최고 
10,아직도 안봤냐?개명작이다 
10,명작 
10,엔딩이 맘에 남았던......... 
10,명작은 언제나 이유가 있구나. 
10,굿 
10,감동이에요 ㅠㅠ 
10,영원히 best 
10,스필버그의 힘 
10,다시 봐도 감동입니다. 눈물나네요.. 
10,내 인생을 바꾼 영화 
10,인간이 인간에게 어디까지 할 수 있는가 
10,명작.. 정말 대단하다 
10,내게 유태인의 고통을 알게 해준 영화. 감동적이기도 하지만 그런 현실이 너무슬프다. 
10,mihimi님 실화를 바탕으로 한 영화입니다. ;;; 꼭 봐야할 영화입니다. 
9,실화가 아니라서 아쉽지만 잘 봤습니다. 
10,재밌다 
10,영화를 보면서 이렇게 울어본적은 처음입니다.. 최고의영화입니다 
10,유태인영화의 절정입니다 
10,내생에최고의영화 
10,나를울린 두번째 영화.... 
10,일제 강점기에 우리나라에는 저런 일본인이 없었을까..휴 
10,유태인 영화의 끝입니다. 말문이 막히는군요. 
10,말이필요있을까?최고! 
10,100점은 왜 못주게 하냐 ! ! 리암니슨 좋아하시는분은 필수영화.. ㅠ 
10,다섯손가락 안에 드는 영화 
10,"실화의힘을바탕으로 사실적시대상연출, 균형을잃지않는스토리텔링까지..역시스필버그! "
10,남을 위해 사는 인생.눈물흘릴줄은 몰랐는데... 
10,오스카 쉰들러에게 10점 준다 
10,오스카 쉰들러에게 10점 준다. 
10,오랜만에 10점이 아깝지 않은 영화를 본듯하네요. 
10,생명을 위한 한 남자의 노력.  눈물납니다. 
8,게토 폐쇄 과정이나 수용소의 생활은 인상적이었음 
10,생각을 많이 하게 만들었던 작품. 
10,어떠한 이유로도 살인은 정당화 될 수 없습니다. 
10,흥미롭고 재밌더라. 
7,실제 오스카쉰들러의 마지막 연설문 초고와 영화가 너무 다르다.  과장이 많은듯 
6,심취하여서 봤으나 소재가 좋았다 생각됩니다. 아마 그것역시 의도적이겠지만... 
10,이자동차면 10명을살렸을텐데...... 이 금배지면 한명을 살렸을텐데... ... 
10,이런 영화보고 지루하다니;; 명작인데 불펌해서 그냥 땡겨 보셨나;; 
9,시대의 피스메이커. 세상의 값진 것을 팔아 사람의 생명을 사라. 
10,"""한사람을 구하는것은 세상을 구하는것이다"" "
7,명작치고는 무지 지루하네요. 볼만한 영화라기보다 봐둬야할 영화인듯.. 
10,스필버그.주라기공원보고 하지않은 존경 이영화보고 했다. 
10,역시 스티븐스필버그다 
10,독일인 중에서 가장 대단하다고생각하는 사람.. 
10,내 마음 속 최고의 영화 Best 1이 되어버렸다. 
10,중학교때봤던영화..그때영화관에서느꼈던 그감동은아직도잊혀지지않고 가슴에남아있다 
10,정말 가슴속에 깊은 무언가를 안겨주었던 영화. 
10,꼭 봐야하는 영화 
10,흑백이라서 더 좋았던 영화.. 실화라서 더 감동적인 영화.. 
10,완벽해 
10,너무 많이 울었다. 흑백영화라 안보고 두었던 영화 너무 많은걸 느끼게 해주는 영화 
10,위대한 인물..ㅠㅠ 
9,아...영화 잘만드네...스필버그행님... 
10,좋은영화 
10,오스카 쉰들러 위대한사람이네.... 
10,인간이 제일 무섭고 따듯하다..... 
10,보면서 저절로 눈물이.... 
10,너무 감동적이다..ㅜㅜ 잠도 못자고 본 영화 
8,다 좋았는데 마지막에 억지로 눈물짜낼려고 하는거 같아서 별하나 감점..(묘지씬말고) 
7,"담담한 감동, 담담한 연출. "
10,이렇게 감동적인 영화가 ... 
10,스필버그감독이 영화를 흑백으로해 느낌이 살았고 리암니슨의 연기도 아주 훌륭하였다 
10,이영화를 못봤다는건 불행이다.정말 다른설명이 필요없다. 
10,영화끝나고나서도 여운이 가시지 않네여 안보신분들 꼭 보세여 정말 
10,정말 최고의 감동 후회안할꺼에요 
6,미담은 그냥 미담일 뿐... 
10,아...스필버그 역사에 남을 위대한 감독이다 
10,난 도대체 왜 이런 명작을 여태못봤지?... 
10,명작 그대로 
10,감동적인 대작이네요! 
10,흑백이라고 재미없게 생각하지 마세여 저도 지루할줄 알았는데 정말 재미 있네여 
10,마지막의 그 감동 잊을 수 없다. 
10,상업적인 영화가 아니라는것과 그리고정말 놓쳤으면후회할뻔한 영화에서 점수를 준다! 
10,최고의 명작.. 대작.. 
10,슬프고도 아름다운 영화... 죽음 앞에 당당하라 
10,이보다 더 좋을순 없다~ 
10,"무엇이 나를 로그인하게 만드는가., 인권의 밑바닥을 보여준 영화., "
10,불행한 지난 20세기의 위대한 인물에 대한 슬프고도 감동적인 서사시 
10,정말 좋은 영화.. 하지만 생각할수록 찜찜한 기분이 드는 영화 
10,이런 대작을 이렇게 늦게 보다니.. 아마데우스 이후의 최고의 명작 
10,내 나이 22살 이 영화를 만나서 너무 행복하다... 
10,대작이었다. 정말로. 
10,좀 더 늦기전에 볼수 있어서 다행. 
8,인생은 아름다워가 훨씬 나음. 
10,흑흑..너무 슬펐다..마지막 쉰들러의 자책감에 난 눈물을 흘렸다. 
