score,review
7,약간 지루했어요 내용이 중간에 낀듯 어중간해서.. 원작이 소설인지 전체 소설이 워낙에 잘 쓰여진 작품인듯 
8,다음 편을 기대되게 잘 만듦. 좋음 
9,"결말을 향해 가는 시리즈 영화의 중간다리같은 영화였습니다. 전작들을 재밌게 봐서인지, 재밌게 잘봤습니다. 배우들의 매력이 살아 있는 것이 큰 장점인 듯 합니다. "
7,책 읽고 봐야하는 영화ㅇㅇㅇ 
5,말이필요옵ㄱ다. 짱잼 
8,파트2나오면 그때같이보시길추천...숙제를2가지를 쥐어놓고는 두개다 결론없이 끝나네요..밥먹으려고 찌개끓이고 계란도 반숙으로완벽하게했는데 밥이없는기분..아니이건 쌀도없는기분..다 엎어버리고싶네요...2나오면 그때볼껄....
1,영화 내내 말만 많이 하는 액션 판타지는 지루하단걸 알게 되었다.. 
10,정말 재밌어요^^ 다음편도 너무 기대됩니다. 
2,평점주는것두 아깝다... 너무 재미없다.. 
8,마지막을 위한 기대를 불러일으키기에 충분하다 
5,전편에 비해 볼만한 장면이 없었다. 과연 2편이 나온다고 해서 달라질지 모르겠다. 
3,재미없어요...질질끌어요... 
1,세번이나 자다깼는데도 내용이이해가가네요  재미없어요 
8,앞선 시리즈를 정말 재밌게 봐서 보러갔어요~ 두편으로 나눠서 늘어지는 감이 있지만 다음편까지 봐야 논할 수 있겠어요 
8,헝거게임 시리즈 쭉 보아오셨던 분들이 보시면 좋을 것 같네요. 
8,요즘 트렌드에 맞는 스피디한 연출을 할 수 없는 상황이었겠지.. 그래서 인지 편하게 볼 수 있었다.. 
7,PART 1이네...PART 2 를 또 기다려야 한다니... 
9,꿀잼인데요?? 캣니스의 심리묘사가 좋았고 2탄은 더 재미있을듯!! 
10,내 인생 최고의 영화.. 
10,좋아요~  다른사람한테도 추천하고싶네요! 
10,아무리 2개로 나뉘어서 구성이 조잡하다고 해도 헝거게임 소설부터 시작한 시리즈 팬을 감동시키기는 충분했던거 같습니다 ㅎ 
10,파트 2 빨리 보고싶다 ㅠㅠ 
10,개꿀잼입니다 10자를채워야함 
9,2가 빨리 나왔으면 좋ㄷ겟다.. 
10,재미있어요^^ 빨리 후속편나왔으면 
7,무난무난 킬링타임용인듯해요 
6,로맨스와 함께 피는 혁명의 불꽃. 
3,감독 의도를 모르겠다ㅠㅠ 판엠불꽃 캣칭파이어 다 재밌었는데ㅠㅠ 이건뭐야ㅠㅠ 
6,내가 아직 책으로 안봤는데. 재미떨어질까봐. 설마 스노우하고 여자대통령하고 부부싸움하는거임? 
10,"헝거게임이 처음나왔을떄부터 재미있게 본 사람입니다. 1,2편은 꽤나 재미있게봤지만 이번3-1편은 큰 재미가 없었던거 같네요...하지만 이거다음편은 위한 초석이니 재미가없어도 봐야만하는 그런편이었던거 같습니다.다음편이..."
7,파트1이라는 것도 알았고 기대없이 봐서 무난하게 봄 
8,약간 지루한듯 하지만 파트2를 위한 워밍업이라고 생각함.. 
4,번역 탓이리라. 어쩌면 내 리스닝 탓일지도.. 평점을 이렇게 줄 수 밖에 없어서 미안할 정도... 
9,그래도 재밌던데 죽음의 성물 파트 원투 보단 낫닼ㅋㅋ 
5,예고편을 본 느낌.. 다음편은 좀 더 괜찮을듯 
1,누누히 말하지만 이영화는 판타지영화가 아니다 
8,파트1이라 아쉽긴하지만 첫장면에서 나온 캣니스와 피타의 감정연기가 너무좋았음. 전체적으로 스케일이나 스토리보단 인물들 감정에 더 집중한듯 함. 
9,중간에 끊겨서 너무 아쉽다. 안보고 있다가 내년에 part2랑 한번에 보는게 나은것같다. 갈수록 성장하는 캣니스 너무 좋다.다음편엔 제대로된 전쟁이 기대해본다. 
10,이 영화를 가지고 지루하다 어쩌다 심지어는 15분안에 압축가능하다는 내용이라고 OO하는분들 계시는데 이정도가 적당합니다. 특히 마지막은 정말 충격이였습니다. 이정도면 1편보다 재미있는데요 뭘 그리 지루하다 난린지? 
8,"시리즈물의 특성상 어쩔 수 없지만, 안타까운 것도 사실 "
10,최고에요!스릴잇었어요!! 
8,볼만했음  기대보단 재밌었어요 
7,프로파간다 비디오 클립 제작기. 
7,다음편을위한 장황한 메시지 
10,모킹제이의 아름다운 선율 
8,파트2를 위해 서론이 길지만 확실히 의도한 파트2를 기대하게 잘만들었다 
10,솔직히 영화 2편은 책을 담아내기에 서툴렀다.. 하지만 처음부터 잘 하는 사람이 어디에 있겠는가. 3편인 파트1은 아름다웠다. 파트2도 기대한다. 
7,후속편이 기대된다 올 11월 
9,재미있긴 한데~ 뭔가 부족한???  ㅎ.ㅎ ??? ㅋㅋ무튼 주말에 다운 받아서 봤는데 나름 괜찮하게 봤네요~다음편이 빨리 나왔으면 좋겠어요 ㅋㅋㅋㅋ 그리고 Part 2 나오면 몰아서 보는게 더 나을 수도 있겠네요 
10,풀어 나가는데 튼튼한 돌다리의 역할을 해 주는 영화다 적절히 잘 끊은 느낌 마지막 파트 2가 기대된다. 
8,블록버스터를 기대하면 아무것도 못 건짐. 그래도 나름의 재미가 있어요. 
7,그다지.. 후속작을 두고 만든영화라 이번편은 액션도 그다지 실감나지않았음. 다만 연기력은 아주좋앗다고 생각함. 
10,나만 재밌으면 된거아닌가?? 
5,"1,2 잘 나오다 모킹제이 파트 부분은 너무 노잼이네요.. 파트2는 기대해 보렵니다 "
8,전작에 비하면 아주 약간 루즈한면이 있지만 충분히 긴장감 있고 다음편을 기대하게 만든다. 
10,내년에 part2랑 같이 보는 걸 추천합니다 
8,다음편이 기다려지네요 이번편은 별루 내용은없다는 
7,모든기대는 파트2에 걸것 
9,가볍게 재미진 영화입니다. 
10,첨부터 피타를 보며 캣니스와 함께 울었다.액션신 전투신 이런거안나와도 충분히 재밌었음ㅠㅠ그런데 11월까지 또 어떻게기다리지 
8,part.1 인줄 모르고 보다가 마지막 보고 감질맛을 다셨다.. 아무튼 헝거게임을 좋아하는 사람으로 재미있게 보았다. part.2 r가 무척 기대되는구나! 
6,part 2 언제나오려나 
6,part2를 보기 위해 봐야만 했지만 다시 보는 일은 없을 것이다. 
10,"진짜 재미있다. 재미없다는애들은 무식한 액션만 기대한 애들 조금만 해석해서 본다면 너무 멋진영화다, "
7,소설원작 읽을때도 '헝거게임'이라는 매력적인 소재를 잃은 3편은 재미도 훨씬 떨어지고 임팩트가 부족하다고 생각했는데 영화 역시 다르지 않다.  제니퍼 로렌스의 연기는 좋음. 파트2는 좀 더 나을거라고 ...
7,후속편을 또 기다려야하는 결말씬때문에 허무한 영화였음 ㅠ 
10,전 정말 재밌게 봤어요 !!!! 마지막 장면이 다음편을 심하게 궁금하게 하네요 ... 빨리 보고싶다 ㅠㅠ 
7,얼른 파트 투 나왔으면.. 여튼 완성도 높은 결말을 위해 꼭 필요한 작품이었다고 생각함 
8,시리즈를 보던사람이라면 계속 봐야할~ 
10,역시나 매편매편 기대하게 해주는 헝거게임 시리즈. 마지막 완결영화는 책에 비해서 어떻게 제작될지 기대됩니다 
4,"아, 제니퍼 연기도 이제 질린다. "
6,1시간이면 충분할 내용을 2시간으로 늘린 탓에 지루하지만 안볼수가 없다 
8,"이건 시리즈물 영화임. 3편으로 처음 접하는 사람이 아니라면, 1편부터 쭉 보아온 사람이라면 아무도 실망하지 않을듯. 뭐 그래도 아직 안봤다면 파트2랑 한꺼번에 보는걸 추천. "
6,이거이거 언제기다리나... 
7,마지막을 위한 디딤돌이 길게만 느껴지지만 헝거게임의 마지막은 창대하리라 믿고  나머지 별점을 뒤로 미뤄둔다 
8,마지막편 보고 평가하자 
8,한번에 연결해서 해야 몰입해서 볼수있는데 그건 좀 아쉽지만 평점 대부분이 그저 파트를 나눴다는 이유만으로 까내리고 있네요..그정도까진 아니었던거같은데 
7,박진감이 넘치네요 ~~~ 
6,폭풍전야의 고요함...고요함... 고요함... 
6,봐야지 뭐.. 지금까지 봤으니.. 파트2엔 한 껀 해주삼.. 
5,"파트 1, 2로 나눠서 보다만듯한 기분 들게 하지말고 어차피 파트당 2시간밖에 안되는거 걍 내년에 합쳐서 4시간짜리로  내놨어야지... 벤허, 대부, 반지의제왕 등 진짜 훌륭한 영화는 4시간씩 봐도 하나도 안 지루하..."
7,무난하니 잘봤다..마무리 잘해주길 
6,그냥 파트2 보기전에 다운받아서 보고 가세요.. 
6,헝거게임 시리즈는 내게 만족을 준 적이 없는 영화다 part2가 얼마나 재미있을지 모르겠으나  이런 내용을2편으로 나누어 놓는다는 것은 관객의 시간을 빼앗는 시간 낭비다. 
6,"뻔한 스토리. 억지 설정. 그저그런 엔딩까지 ..  굳이 2편으로 나눠서 제작해야 할 의문이 ....  그래도  1,2,3 편 본 의리로 4편을. . . "
7,"헝거게임 1,2를 모르고 보면..비 추천ㅠ "
5,더 큰내용을 위한  맛보기같음 
7,캣니스가 활을 한 번 밖에 안 쏜다. 기대 이하. 
8,제발 2보고싶다 빨리ㅐㄴ 
7,임팩트가 모자람 전작이 강했음 
6,속편을 위한 준비과정이라고 생각 
8,화려할 마지막을 위한 담담한 서곡. 
7,배우들 연기가 영화를 더 풍성하게 만들어 준다 
6,",.,,.,.,., "
10,2편을 더 실감나게 보여주기 위한 예고편일지라도 예고편대로 재밌다!! 
7,너무 파트2를 위해 아껴서 그닥 
8,다음작품을 기대하게 만드네요 
8,생각보다시시했지만 후편이궁금해용ㅋㅋ 
7,파트2가 빨리 나와줬으면.. 
8,전초과정이라고 생각함 그 다음편이 기대된다 
7,다음편이 기대되네요ㅎㅎ 
7,다음편을위한영화.. 
7,어쩌겠나요 볼 수 밖에. 근데 필요없을 정도로 너무 늘어놨다. 자르고 편집해도 됐었을 부분이 많던데. 굳이 이렇게 까지.늘려야 했었나. 
5,스토리에 추첨 다음편이 보고싶어지네요 
7,노잼이다 스리즈란.... 
6,조금 지루한 면이 없잖아 있었지만 다음 편이 기대됨 
4,그냥 다음편 이어갈려는 디딤돌? 
5,지루한 느낌..전개되는 영화가 아님 질질 끄는 내용 안보심이 조으실듯 
4,시작~~~~언제시작해? 이런 느낌 
6,시리즈의 단편을 대하는 목적과 기준은 각자가 다르겠지만 모킹제이 1편만의 장점은 분명히 존재한다. 
8,1.2편에 비해서 내용이 별로 없어서 좀 아쉽긴했지만 4편을 엄청 기다리게되는 좋은 구성이였어요 ㅎㅎ 
6,시리즈인걸 감안하고 보면 재밌어요~ 
8,"1,2편보다 메세지가 있고 내용도 흥미로웠다 "
7,나눠서 제작이라 그런지 영화의 완성도가 너무 떨어짐 
6,메인을 위한 에피타이져같은 느낌... 주인공의 심리는 잘보여주지만 흥미유발은 조금...마지막편이 기대되네요 
2,영화보자마자 배틀로얄 표절이라는 강한 반발감을 느낄수 밖에 없다 북미에서는 초대박일지 몰라도 이런 표절스토리에 더 이상 신선함이나 자극을 느낄만큼 대중들이 말랑말랑하지 않다는 것을 알게해주는 쫄망졸작이다. 
8,이번이 끝인즐 알았는데 후속편있어서 아쉽...그래도 재미있었음!! 
3,파트1이란걸 모르고 보면 끝나고나서 멍때릴 수가 있음 
10,굿굿아이재밌어~~~ 
10,완전 재밌습니다 우앙~~~~ 
10,짱짱짤짱쫄 진짜재밌움 
6,기대하고봤지만실망감을안겨다주었어요다음편을기대해볼려구요 
5,봤는데 뭘본건지 모르겠당 
5,너무 기대를 했는지 기대한만큼 실망도 크네요 
9,이번엔큰액션씬은없고 흥미롭게잘봤어요 
9,호빗 일년기다렸음 완전기대됨 
7,"좀 유치하기도 하고 아쉬움이 있었지만, 2를 기다려보겠습니다. "
5,파트2기다려야대!!! 그치만재밌었음 
7,확실히 다음편이 너무 기대 되긴 한다. 
3,첫편을 안봐서 뭔말인지...지인이 안봐도 재밋다고 보라했는데 저는 영 모르겠더라고요 꼭 첫편보고 가세요~ 
7,결말을 위한 과정입니다. 재밌다없다를 말하기는 좀 그렇네요 ㅋㅋ 
8,뭔가 분량조절 실패~자꾸 감칠맛만 주는것같지만 어쨌든 다음편이 너무나 기대가되는건 어쩔수없다 
6,내용이 어렵고 진행이 너무 끄는게 많아서 제점수는 6점 
6,딱 적당한 그냥 진짜 다음단계를 위한 영화 
7,그냥 그래요  그냥 미드 한편 본느낌 
7,part2가 기대된다 
6,그냥 긴 예고편 마지막편은 뭔가 다르겠죠. 
6,전편을 보지 않았다면 절대 이해못할 영화... 다음편을 보게할 영화 
7,3편을 위해서이지만 나름 이야기를 만들어가는것도 잼나다. 근데 좀더 흥행에 성공하려면 총3편으로 했어야했다. 
7,전편의 내용을 모르는 사람은 안 보는게 좋을듯... 결말로 가는 중간 과정이라서 사실 그렇게 자극적인 재미가 있지 않아요 
6,이번편은 감정선이 좀 길어요 
8,마지막편인줄 알았는데 아니네요 
7,아니 몰입하다 끝났소... 
7,지루하진 않고 그렇다고 재미있던편도 아닌 파트2를 보기전 봐야할 스토리 
6,역시 원작소설을 읽고 나서 영화를 보니 재미가 떨어지네요.. 
6,기나긴 예고편 2/2는 좀 재미있을려나요 
8,"내년이 기대 대느.,,, "
8,영화 한편이 드라마처럼 중간에 짤려서 그저 그랬음 
8,재미만을 위해서 보곤 파트1이나 파트2네 거리고 뭐하는짓인 솔직히 다음을 위한 서론이 긴 영화지만 이 정도면 대단함 
7,1편 2편에 비해 좀 지루한감이 있지만 파트2를 보게될듯. 
7,이제 막 재미있어지려고 시작할때 끝났버렸다 
2,"너무 다음편 예고식으로만 보여준듯. 1,2 편을 봤다면 지루하고 기대가큰만큼 실망도큼 "
7,제니퍼 로렌스를 위한 영화 더도 덜도 없는 
5,헐리웃 영화답게 스캐일은 크고 볼거리는 많지만 끝이 허무한 영화..마지막 장면 엔딩 부분에서 정신병자 처럼 나오는 것 보고 어이없어서 뻥 터졌음 
8,헝거게임 실망노노 합니다 
5,"볼려면 진심 파트2랑 같이보세요. 같이보자는 친구가 3일 연속 ""죄송합니다""만 말하고 있어요. "
8,part2를위한 디딤판 
7,정치인 캣니스 에버딘 만들기 
4,원작과의 거리가 요원하기만 하다. 
3,배우들의 연기는 좋았지만 스토리는.. 
9,억지로  결말을 휘황찬란하게 끝내지않아서 좋은듯 하지만 에피소드식에 익숙치않으면 뭐야 하고 끝나는 느낌. 
7,다른 사람들은 파트 1이라서 뭔가 어정쩡하다는데 난 파트1 자체만으로도 재밌었는데? 
7,워밍업만 2년째... 
8,생각보다는 별로였네요 
7,"유감스럽게도 1, 2편과 마무리 part.2 의 중간다리 딱 그 정도. 부디 유종의 미를 거두길. "
8,볼땐 재밌어요 ㅂ보고나서 남는게없지만.. 
9,기대했던 전쟁씬들은 거의 안나오지만 혁명군과 캐피톨 사이의 심리전 싸움에서 몰입도와 긴장김 느껴져 그것만으로도 충분히 재밌었다. 그런면에서 감독이 지루하지 않게 적절히 밀고당기며 잘표현한 것 같다. part2가 매우...
7,예고편이 다임 ㅠㅠ1하고 2는 정말 재밌게 보고 몇번이나 다시 봤지만 개봉하자마자 보러갔는데 재미없었음...그냥모킹제이 파트2나올때 같이 보는게나을지도.. 
8,"독재국가 체제에서 일어날 수 있는 모든 상황이 있는 그대로 보여진다. 영웅만을 위한 스토리에서 탈피한 최초의 블록버스터! 무거운 내용이지만, 작품성과 흥행성 둘 다 갖춘 만족스러운 영화. 이제 다음 시리즈에서 OST..."
7,"1,2 편보단 아쉅네요~그럭저럭...4편 보려면 봐야할 것 같아서... "
7,초반 너무 지루해서 보다 그냥 나왔음 
8,우리나라에서 크게 흥행을 못해서 안타까운 영화... Part 2와 함께 봐야하는 영화!! 
9,흥미로웠습니다..전편을 미리 보고 갔으면 더 좋았을텐데...살짝 아쉬움이 있네요...ㅎ 
8,원작에 명성을 생각하면 제니퍼로렌스랑 영화화 만으로도 흥미로운 영화지 캣칭파이어보다 발전됐고 재미없다라고 하는사람들 영화 볼줄 모르는듯 우리나라 사람들 영화볼줄 모름 정상적이면 헝거게임이 예매 1위 달려야 하는데 대...
9,헝거게임 모킹제이 대다수의 평점과 같이 너무 질질 끌었다는것은 맞지만 그 특유의 여운은 그대로인것같다. 
8,파트2를위한 영화인데 난 재미지게 잘봤다 근데 영화 포스터에 모킹제이만 써있어서 아무것도 모르고 본분들은 약간 어이없을것같다 
7,영화가 모킹제이 파트원 부분이라고 치기엔 내용의 완성도가 반밖에 미치지 못한 느낌. 
9,사라옴ㄱㄴㅅ마나마나오 
7,다음편으로 이어지는 것 때문인지 이야기가 좀 늘어지는 것 같네요. 
9,헝거게임시리즈를 즐겨봐서 재미있었는데 안보신분이라면 별로일듯 ㅋㅋ 
7,걍 내년 팟2 나오기 전에 다운 ㄱㄱ 
7,되게 안 지루하고 재밌는데 후속편까지 있는줄은 몰라서 마지막이 당황스러워요ㅜㅠ 
8,역시 실망시키지 않는 헝거게임 
8,시간보내기용으로 좋은듯 
8,너무 찝찝하게 끝이낫음 
8,난 오히려 2편보다 재밋게 봣다. 다음 작이 기대되는군! 
7,"과거 1,2편은 필수로 보셔야 이해하실 수 있으시고 소설먼저 보신분들이라면...큰 기대 안하시고 보시는편이 좋을것이라고 생각됩니다. "
8,헝거게임을 처음부터 본 사람이라며 나처럼 좋아할지몰라도처음본사람한테 딱히 추천하고싶지않음 이번 껀 짤린내용이라 더실망일듯 
8,기대했던  화려한 전쟁씬은 없었습니다. part2를 위한 밑그림이었습니다.그래도 충분히 재밌었습니다. 
9,재미있게 봤음. 다음편도 나오면 보고싶다 
10,몰입도가 아주 높은 작품임. 보다가 눈물날 뻔한 게 여러번.. 
10,"1,2편 모두 챙겨본 사람입니다~ 물론 두파트로 나눠진건 아쉽지만 전 이번것도 너무 재밋게 봤어요! "
8,영화비가 아깝지 않은 드문 영화. 
10,제니퍼로렌스♡ 헝거게임만한 영화첨봤어요 
10,헝거게임 모킹제이! 진짜 후회없다 캐스팅도 좋고 연출도 좋아서 잘만들어진 영화였다 
10,완전 개강추! 어마무시하게 재밌어요! 
10,제가 보고 싶어하던 영화라서  친구 꼬셔가지고 가서  봤는데 친구가 더 재밌다고 좋아라 하네요 
10,또 보고싶을정도~! 보니까 진짜 혁명 막 이런게 실감 나더라~ 제발 2편이 빨리 나왔으면 좋겠음!! 
8,"1,2편 다본사람들에게는 추천. 이야기의 흐름이니깐. 근데 전편안본사람들에겐 비추. 괜히보고 평점 더 깎아먹을듯 "
9,내용 자체는 재밌었는데 액션신이 조금 부족했고 파트2랑 같이 보는게 더 재밌고 좋을듯! 
10,가볍게 보려고 갔는데 생각보다 겁나 재밌게 보고 왔습니당^^ 
10,영화 중반부분부터 진짜 완전 대박대박!! 갈수록 진짜 재밌네욤~! 
9,Part1인 만큼 다음내용을 기대하게 하는 내용 재미는 있지만 빵빵터지는게 없어 지루해 하는 사람도 많을 거라생각. 그래도 난 재미있었음 헝거게임 전편다 보고 보는걸 추천 
10,생각도 못하고 있다가 그냥 시간맞아서 본건데 캐 재밌었다~ 
10,원래 이런 영화를 좋아한다면 꼭 보길 바람! 1편과 2편과는 또다른 색깔이 있다보니 적응 못하는 사람들도 있겠지만 분명한건 헝거게임의 대미를 장식하기 위한 마지막 시리즈이기 때문에 기본바탕은 액션 판타지 지만 메세지...
10,"전편보다 화려하진않지만 각 인물들의 감정처리들을 잘보여줬다고 생각한다, 개봉시기가 별로 안좋았던듯;;; "
10,별기대없이 봤는데 의외로 재미남! 내용도 괜춘해요~ 
10,캐릭터들도 많이 추가되고 이미지가 전편에 비해 바뀐 캐릭터들 덕분에 더 재밌네요 
10,"개인적으로 1편,2편으로 나누어져있어서 실망하였으나 정말 재미있어서 좋았다. "
6,"헝거게임 시리즈 참 좋아하지만, 1,2편의 몰입도를 무색케 하는 형편없는 영화. 피타에 대한 캣니스의 생각도 전혀 공감 안되고 모킹제이를 축으로 하는 반군의 결집 과정같은것도 충분히 재밌게 그려낼 수 있었음에도 보는..."
10,헝거게임 모킹제이 최고 스케일과 스토리에 반했다 진짜 최고야 
8,스토리 중심이라 2편 같은 화려한 액션을 기대하셨다면 실망하실 수 있을듯. 그러나 혁명의 시작이라는 점에서 큰 의의가 있는 영화. 
10,정치 스릴러로써의 가능성을 보여준 흥미로운 파트1이었다고 봅니다 
10,재밌게 봤다 2시간동안 완전 푹 빠져보기 좋은 영화였어요 
10,우리 사회랑 캐피톨이 오버랩 되는거 같아요. 헝거게임은 메시지 있는 판타지 영화네요 
7,"2시간 짜리 예고편, 의리로 봤다 "
8,다음편을 꼭 보겠다고 생각하시면 봐도 무방하시지만 킬링타임으로 보기에는 비추천합니다 다음편에 모든일이 일어나지 이번편은 긴장감도 없고 중요한 사건도 없기 때문이죠 전 책으로 다 읽어서 괜찮았는데 친구들은 별루라 하더...
5,다음편으로 이어지는 것이 좀 황당.. 
10,다음편을 위해서라도 꼭 보시길 뛰어난 연출력과 그래픽의 최상의작품 
10,최고의 영화 안보면 개 후회~ ㅋ ㅑ~~ 
10,드디어 개봉을 해서 보고 왔어요~  역시 제 기대를 저버리지 않더라구요 
8,재미재미  쭉봐야죠ㅅㄷㄱ?ㅎㄱㄴ 
9,이전의 작품을 보왔던 입장에서 이번편도 잼있습니다.다음편에서 계속 됩니다가 좀 아쉽긴합니다 ㅋㅋㅋ 
8,다음편을 위한 긴 예고편 ㅋㅋㅋㅋ 그래도 원투 재밌게 본사람은 재밌음. 
10,판타지 영화 중에 최고인 헝거게임 시리즈라는 말이 맞는것 같다 
10,재밌었어요 돈이 안아까워요 내가 본 판타지 영화 중에 최고였습니다 
10,영화비가 안아까울 정도의 영화?오랜만에 영화값에 걸맞는 작품이었음 
10,헝거게임은 볼거리가 정말 풍성해서 보는 재미가 쏠쏠했던 영화였어요 
10,원작에서 읽고 어떤 멜로디일지 궁금했는데 소름이 돋네요~노래 좋아요~ 
10,헝거게임 모킹제이 추천하겠습니다 꼭 보시길!! 
10,스토리도 괜찮고 이만하면 추천눌러도 될 듯 
3,지루함 다음편을 꼭봐야만하는 그저그런 시리즈물 
10,개인적으로 내용도 알차고  나름 본 보람 있었음 
8,오늘 봤는데 꽤 괜찮은듯... 
8,전체적으로 전편에 비해 몰입도가 낮았다는 점을 뺴고는 영상이나 스터리전개에서는 흠잡을 데가 없는 수작인듯. 
10,이보다 더 좋을 순 없다! 캣칭파이어는 좀 지루한감이 있었는데 모킹제이는 더 흥미진진하고 재밌네요 
10,전개가 길었지만 그래도 재미있었다~ part2가 기대된다~ 
10,영화 구성 괜찮았음..영화 잘빠졌다. 
10,캣니스의 불안정한 심리상태를 잘 표현해낸 제니퍼로렌스~ 모킹제이에서 정말 존재감이 대박! 
10,캣니스의 힘든 여정의 막이 드디어 본격적으로 시작되는듯한 모양새네요^^ 유종의 미를 거두길 바라겠습니다 
10,난 괜찮았음 빨리 파트2 나왔으면.. 
10,졸잼졸잼졸잼졸잼졸잼 
10,이거 최고다 ^^b 캐스팅도 꽤 좋았다고 본다 
10,완전 강추한다 직접 봐야 알게될거다 헝거게임 모킹제이 꼭 보세요~ 
10,정말 재미있었서요! 다음에 기회된다면 또 보고 싶어요~ 
10,지루할 틈이 없음 긴장감과 스토리가 맘에 들었다 헝거게임 모킹제이 추천 
10,캐스팅도 좋고 연출도 좋아서 조화가 잘 이루어진 영화였다! 헝거게임 보는 내내 완전 감탄~! 
8,"파트1 이라고는 하지만,화장실갔다와서 손 안씻은고 나온것 같은 기분이 드는건...뭔가 아쉬워요. "
6,"2편을 위한 초석? 그래도 이 한편으로 영화고 돈을 내고 보는거다.... 이따구로 만들거면 파트1,2 뭐하러 나눠 그냥 파트1 축약하고 러닝타임 3시간 정도로 그냥 한편을 만들지... 쩄든 모킹제이 파트1은 6점도 ..."
10,이번편은 시리즈 본 사람들이 봐야지 않을까싶다. 이 모든것은 파트2를 위한 잘 다져진 초석! 
7,"1은 원작보다 별로였고, 2는 원작이랑 비등비등했고 3은 원작보다 나았다. "
10,재밌다~~ 시작부터 끝까지 완전집중! 
10,제니퍼로렌스 정말 독보적인 여배우다! 캣니스의 카리스마가 폭발하네요! 
10,전혀 유치하지않고 스토리 구성도 괜찮았습니다 사람들이 많이 보는데에는 이유가 다 있는것 같음 
6,한줄분석이 영화를 가장 좋아하는 그룹은 40대 여자 . 나와 같은 평점을 준 그룹은 20대 여자 입니다.알바들 진짜 장난하나 원작 10번 읽은 헝거게임 팬으로서 이번 영화는 진짜 실망이다 
