score,review
1,이게 개빡치는게 뭐냐면 한글로는 파트1이라고 안써있음.전반적으로 상당히 루즈함. 신궁인 주인공 활 딱 한발 쏜다. 영화 시작부터 끝까지 징징 거리면서 선전영상만 찍음 
1,이 영화 보고 배신감에 정말 화가 나네요. 난생 처음 별점 답니다 
3,실망스러운스토리~이에여ㅠ 화려한액션이 잇엇으면 
10,재밌었다완전~! 헝거게임재밌었다 
9,역시 제니퍼의 연기 뛰어납니다.! 내년 Part2도 기대할께요~~!! 
10,"재밌게 봤으니 후하게 점수 드립니다. 1,2점차가 뭔 대수인가요.. "
10,재밌고 몰입감이 최고다 스토리 전개가 탄탄하고 볼거리가 많았다 
5,나때매 같이 보러 간 친구들한테 미안할정도로 지루하고 재미없었어요. 진짜 실망. 
10,재밌고 지루하지 않아서 좋았어요 헝거게임!추천할만합니다 
10,2시간동안 딴짓거리할 수없게 몰입하게 해준다 최고의 영화 
9,"정치공방과 심리전, 선전과 역선전.  총,칼,활 만큼이나 흥미진진함 "
3,전편과는 달리 이야기를 상대적으로 루즈하게 늘린듯 
8,이번편은 넘 스토리 위주... 그래서 좀 지루했다그전편들이 넘재밌어서 기대했는데 좀아쉽 
6,재미없다....초반이라지만 지루하고 배경도 어두우니 더....영화관에서 보는 건 비추 어차피 담편을 위한 거니까 
8,재미있게 잘봤습니다!  내년까지 기다리기 힘드네요 
10,part2가 기대됩니다~ 영화시간내내 안끝났으면 했어요~ 끝까지 보고 싶어서~ 그래도 내년을 기대해보겠습니다 
10,보기 싫으면 안보면 그만. 근데 보려고 생각한거면 평점에 좌지우지되지 말고 보는게 낫다고 본다. 의외로 생각보다 훨씬 잘만들었더라 
10,원작에 충실하며 스토리를 잘 이끌어 나갔다고 생각합니다. 원작을 본 사람으로써 만족스러웠어요 
10,기대없이 봤는데 진짜 재밌게 봤어요 :) 
9,파트2 기대됩니다... 
10,강추 할 수 밖에 없는 매력있는 영화 헝거게임 눈이 즐거웠습니다! 
10,판엠의 불꽃이랑 캣칭파이어도 재밌었는데 그래도 스토리적인 면에서는 모킹제이가 급이 있네요~ 
10,헝거게임모킹제이 봤는데 기대 이상이어서 완전 재밌게 본거 같아요 
10,다음편도 진짜 기대되 그 전과는 다른 매력이 있음!진짜 재밌다 
10,과연 기다린 보람이 충분합니다 ^ ^ 대만족~ 
10,와우~ 저는 무지 재밌게 봤는데~ 지루하지도 않고 짱 재밌음 
10,완전 재밌어요~ 이 시리즈를 좋아해서 그런지 몰라도~재밌게 봤네요^^ 
10,웰메이드 판타지인것 같아요~ 원작을 영화내에서 담고자 하는 이야기가 방대하지만 잘 각색해서 넣은거 같아요^^ 
10,스토리전개라 전작 내용인지가 필수인거 같다! 꼭 보고 가길~ 
10,한번 더 볼생각임! 완전 재밌고 몰입이 잘되는 영화는 오랜만이다 
10,헝거게임 이번편은 혁명이 일어나기전의 그 치밀한 감정들과 물밑작전들을 잘 표현했더라구요 다음편이 완전 기대되요 
10,헝거게임 모킹제이 강력 추천함 진짜! 안보면 나중에 후회함 
9,음 재미 있었어요 워낙 좋아하던 엉화라 재미있게 봤습니다 헝거게임 좋아하시는 분이라면 아실거에요 애매한 마무리 ㅋㅋ 
10,헝거게임은 흥미진진한데 스릴까지있는 판타지 영화에요 강력 추천합ㄴ디ㅏ 
10,이렇게까지 엄청난 CG는 처음이야 긴장의 연속이었던 헝거게임 
10,스토리가 재밌었어요 내용도 괜찮고 무엇보다 볼거리가 가장 많았습니다 
10,기대없이봤지만 너무나 재밌게 보고 온 영화예요~ 
10,개인적으로 올해개봉한 영화 중에 최고였습니다!!! 
10,원작이 정말 양이 엄청난데 생각보다 짧은시간에 이야기를 잘 풀어나간거 같아요~ 맘에들었습니다 
10,제니퍼 로랜스가 연기를 정말 잘하네요!! 두 번봤지만 영화 값이 절대 아깝지 않았어요 
10,헝거게임 모킹제이 최고 화려했던 CG가 인상적이에네요 
10,사람들이 다 재밌다고 볼만하다고 하는데엔 다 이유가 있는법! 
10,흥미진진하고 전편보다 훨씬 커진 스케일~ 그리고 원작을 살리는 디테일이 좋습니다. 
10,컴퓨터 그래픽에 감탄만 나왔다 판타지 영화에 걸맞는 화려함이 인상적이네요 
10,헝거게임은 모킹제이가 확실히 완성도면에서 넘사벽인 것 같아용~ 
10,긴장감 넘치게 재밌게 잘봤습니다~ Part 2도 얼른 보구싶네요! 
10,일반 판타지영화라 하기엔 너무 급이 달라버린 헝거게임!! 
10,헝거게임;모킹제이는 파고들수록 너무 매력적인 영화인것 같아요~ 
10,영화도 완전 꿀잼이예요 집중도가 장난아님! 
10,헝거게임팬으로서즐겁게잘봤습니다 파트2가 기대됨 
10,기대이상으로 재밌네요 흥미진진해서 눈을 뗄수 없었습니다 
10,캣니스 연기존잘! 제니퍼 로렌스는 뭔가 가슴이 뭉클하고 찡한 드라마적 요소에서 더 빛을 내주는것 같네요 
10,CG가 굿!! 스토리가 흥미진진!! 퀄리티가 좋았음 
10,재밌게 봤어요~ 연기들도 잘하고 스토리도 탄탄해서 아무래도 몰입도가 좋아서 몰입해서 봤습니다~ 
10,이번 편은 정말 대박이었다 헝거게임은 보면서 벌써부터 다음편 보고싶음 
10,괜히 제니퍼 로렌스가 아닌거 같아요~ 캣니스 에버딘 존재감 돋습니다~~ 
10,헝거게임 이번편은 전쟁전의 숨막힘을 제대로 표현해준거 같아요.지금까지 헝거게임 시리즈중 가장 재밌고 흥미로웠습니다 
10,이 영화 진짜 괜찮다 진짜 괜찮았다. 나름 빠지는거 없는 거 같다!! 
10,원작을 영화화하는데 제일 괜찮게 된게 이번편인거 같아요. 긴장감도 잘 살렸구요. 
10,스릴넘치고 환상적인 영화였어요 판타지영화만의 매력이 가득했던 영화였어요 
10,정말 즐기기엔 최적인 영화였습니다 헝거게임 모킹제이 추천합니다 
10,헝거게임에서 정치적 싸움으로 넘어선 이번편. 너무재밌었다. 다음편이 기대된다 
10,지루할 틈이 없습니다  헝거게임 모킹제이 보고나니 다음편도 완전 기대 되네요 
10,캣니스의 심정을 잘표현하는것 같네요~ 제니퍼 로렌스 연기력에 상당히 영향을 받는 편이었는데 잘한것같네요 
10,진짜 잼나여! 기대 안했는데 재밌더라구요~ 
10,대박 강추입니다 꼭꼭들~ 챙겨들 보시길~ 
10,제니퍼 로렌스 때문에 보게 되는 헝거게임^^ 어째 더 이뻐진거 같다는~~ 
10,"이건 정말, 말이 필요 없다!! 개강추!!  그냥 헝거게임모킹제이가 답이야 "
10,꼭 보셔도 후회 안할 영화라고 생각합니다~ 
10,예고편도 보고 평점도 찾아봤지만 확실히 영화는 직접 보는게 답인거 같다. 영화 정말 괜찮더라 
10,판타지 영화 보면서 이렇게 재밌다고 느끼긴 처음이에요! 헝거게임 이제부터 챙겨봐야겠어요 
10,대애박 긴 예고편... 
10,헝거게임 강력추천합니다~ 재밌고 별 10점이 아깝지 않은 영화입니다 
10,긴장과 스릴이 계속 가더라 헝거게임 모킹제이 몰임감 최고! 
10,앞으로도 이런 영화 많이 나왔으면 좋겠다 :) 
10,시리즈 안챙겨 봤어도 재밌다 너무 재밌었다 강추 할 만한 영화 
10,판타지 영화를 보는데 울뻔 했어요~모킹제이 다음편을 정말 기대하게 만드네요! 
10,중간 중간 재밌는 부분들도 있고~스토리가 탄탄하니 영화가 재밌을 수 밖에 없어요~ 
8,"원작에 충실하려고 노력했다. 원작 자체가 단선적이기 때문에 덜어내기 보단 오히려 채워넣어야 할 정도인데, 헝거게임 팬들위한 큰재미보다는 잔재미가 있는 작품. 캐피톨과 13구역 어디에도  마음을 두지 않는  캣니스의 ..."
8,피날레를 위한 발판마련정도 기대안하고보면 아이런식의 전개구나정도 느낄수있음.. 다들 알자나 해리포터구 트와일라잇이구 마지막편 파트1은 원래 이런거야 
4,책으로 보세요 내헝거게임 돌려내 
10,제니퍼 로렌스의 연기는 명물허전! 캣니스의 감정을 완벽하게 보여주네요~ 
5,좀 지루하네요  전편에 비해 실망 
3,"이것도 아깝다 ... 1 ,2 편 넘 재미 있게 봤는데 요번건 아무런  내용도 없네   다음편도 기대가 안됨...싸움도 없구  돈아까워  ㅜㅜㅜ "
10,모킹제이 파트1.. 캣니스가 급 우울하고 슬퍼졌어요~ 제니퍼 로렌스가 이런연기를 참 잘하는것 같아요 
10,모킹제이편에서는 특히나 제니퍼로렌스의 연기력이 단연 돋보이네요~ 
10,평점이 좀 낮은거 같아서 기대안하고 봤는데 난 재밌었음.. 
10,재밌네요~^^기대했던거 만큼 영화 볼만하네요 
10,판타지 영화지만 재미로만 승부보는 영화가 아니라는걸 보여주네요! 
10,"지루하다는건 단지 액션이 많지 않아서 일지도~ 액션보다는 캐릭터들의 심정변화와 정치, 미디어를 이용한 전쟁 이런면에 주목해서 보면 재밌을거임~ "
10,헝거게임 매니아라서 그런지 다음 작품이 기다려져요~ 
10,음악도 CG도 최고였구요 스토리가 지루하지않아서 재밌었어요 추천합니다 
10,전편을 보지 않고 간다면 뜬금 없을 장면 다수있을 수 있다. 근데도 첨보는데 재밌다는 친구가 있는걸보면 또 그것도 아닐수도^^ 
10,혁명군의 분열과 두려움이 이번 편을 통해 제대로 표출된거 같다. 지루하다고 하는 사람들은 뭐지; 
6,파트2를 위해 적당히 만들어놓은 예고편 
10,마지막까지 눈을 뗄 수 없었던 헝거게임 모킹제이 완벽한 사운드와 영상! 
6,헝거게임 너무너무 재미있어요미국에서도 무척흥행한다고 해서봤는데재미있네요1편2편ㅇㄷㄴ집에서봤는데 영화로 보니 스케일도 ㅋ고 넘넘 재미있네요.계소계속 ㅇ 후속편이 나왔으면 좋겠어요우리아들도 너무넘? 재미있어합시니다덩 앤...
10,"제니퍼 연기가 살림 내용은 확실히 1,2편보다 떨어지긴함 그래도 파트투 기대중 "
10,사랑해요캣니스 책도사서읽어야겧어요 
10,반응이 안좋아서 기대 안하고 '지금까지 시리즈 본김에 그냥 보자!' 하고 봤는데 의외로 저는 정말 재밌게 보았습니다! part1 이라 '이게 뭐지?' 하고 끝났지만 part2 기다려지네요...
10,"물론 part.2를 이어가기위한 서론적인건 맞는데 난 개인적으로 1편2편 보다 재미있게봤다 평이 안좋아서 안보려다 1,2편 본게아까워서 그냥 속는셈치고 보러갔는데 기대이상이었다. 액션도 거의 없었는데 긴장감있게 봤다..."
10,"최근에 1편,2편을 집에서 보고 갔는데 재밌었습니다 "
10,"스토리상으로만 봐도,파트2가 있는걸로만 봐도 액션은 기대하지 않고 본것이라 충분히 긴장감넘치고 재밌었습니다..휴..빨리 2탄...보고싶다..(현기증 "
10,예고편보고 어찌나 기대되던지~ 보길 잘한것 같아요 추천해요! 
10,Part 2 가 남아있어 조금 아쉅지만 그래도 영화질은 정말 최고다 제니퍼 로렌스의 연기력이 정말 환상이였다 최고다진짜 
10,캐피톨 대 혁명군이 피타와 캣니스를 이용해 미디어로 싸우는게 인상적이었어요~ 
10,"나쁘지 않았는데, 이번편의 가장 큰 실수는 제목 'part.1'이라는 글자를 붙이지 않은겁니다. 그래서 실망한 사람들이 많죠. "
10,시리즈 다 챙겨본 팬으로써 이번편 대박인것 같다 액션은 덜하지만 스토리가 좋아졌음 
10,"내용은 다좋은데 파트1,2나눠서 내년에 또 봐야하는데....고3이여서 어떻해요ㅠ보고싶다 "
7,"뭐야? 끝났어???ㅡ,.ㅜㅋ "
10,이영화를 1.2편을안보고 바로 이영화봤는데 처음엔 무슨내용이지..하다가 계속보는데 점점재밌어져서 제니퍼도 연기진짜잘하는거같아요 4도 기대♥♥ 
9,goodgoodgood 
8,원작 생각하면 이만큼 만든것도 대단. 
2,두시간 삼분동안 예고편 보고왔습니다.책 한 페이지를 보는 느낌과 똑같구요.Part.2를 기대해보죠. 
2,나머지 별8개는 part2 나오면 주겟음. Part2가 아니면 보지않았을 영화. 제목에 part1이라고 써주기라도 하던가ㅡㅡ 
8,기대한 만큼 재밌었습니당 
10,캐피톨 전혀 낯설지 않은건 나뿐인가.. 미디어 쇄뇌도 그렇고!! 우리에게도 모킹제이가 필요한 시점인가.. 
10,내용이 정말 재밌었어요ㅎㅎ 
9,재밋네욥 파트원이라 그런지 보다만느낌이긴 하다만 재밋 
9,다음 편이 기대되네요^^ 
3,기대가 많았던만큼 실망이 컸던 영화 
10,헝거게임을대해서감동받았는데해냈어요^^앞으로또봅시다. 
1,진짜 내생에 최고로 지루하고 뒤통수 맞은 영화. 이건 뭐 내용의 진척도 없고.. 돈만 버렸네 
10,기대를 저버리지 않은 영화~ 흥행은 충분히 할 듯 
10,2편이 기다려진다 너무 재밌다 
10,이 정도면! 충분히 볼만한 영화긴하죠^^ 
10,올해 마지막 블럭버스터 대작인 헝거게임 모킹제이!! 역시나 흥미진진하네요! 
10,시놉시스도 봤는데 흥미로워서 보게된 케이스! 그리고 보고 나서 괜히 평점 남기로 온게 아니죠. 추천할만 하니까.. 
5,그닥 별로.. 딱히 별 내용 없음... 
1,갈수록 떨어지는 평점 열자적으란다. 
2,"진짜 볼게없네요 1,2편을 다봤는데모킹제이는 그냥 방송싸움이예요 음 상당히 지루해요...파트원을 만들필요가 전혀 없었을듯해요,.한마디요약ㅡ임팩트있는 씬이 하나도없음 "
10,더욱 탄탄한 스토리로 무장한 헝거게임:모킹제이 part1~헝거게임 내용을 알고 가면 더 재밌게 볼 수 있을 것 같긴 해요^^ 
10,다음이기대됨 좋았어요 
10,헝거게임에서 벗어나면서 그동안 접할 수 없었던 또다른 긴장감을 느낄 수 있었던 거 같습니다. 다음편이 진짜 기대되네요 
9,노래 해보라는 장면에서 오글거리는줄 알았는데 의외로 캣니스 목소리가 너무 좋아서 깜짝 놀랐음..제니퍼로렌스가 부른걸로 꼭 ost앨범 내주세요!! 
5,장대한 마무리를 위한 지나치게 긴 준비운동의 폐해. 
9,역시 ! 기다린 보람이 있는 영화! 캣니스 성장모습볼때 울컥했응 ㅠ 줄리안무어랑 필립세이모어 호프만 도날드 서덜랜드 연기 카리스마 장난아님 ㅠㅠ 
10,"1, 2편보다 더욱 웅장해진 스케일! 시리즈의 마지막을 향해 달려가는 게 이번영화죠^^ 지루하다고 하는건 좀 아닌듯 "
10,우리네 상황과 그다지 갭이 느껴지지 않을정도로 현실적인 판타지영화네요. 쩌네 
10,판타지 임에도 불구하고 간만에 집중해서 본 영화였어요 헝거게임은 볼거리가 정말 풍성했어요 
10,친구추천으로 봤는데 완전 재밌었다  판타지 영화 아니면 쉽게 볼 수없는 CG가 최고 
10,각각의 인물들의 이야기가 진실되게 다가오는것 같네요. 스토리에 좀더 치중된면이 있어서 이런면이 좋은거 같아요 
10,개대박 재밌습니다~ 돈주고 보는거 아깝지 않을 정도 였던거 같아요 ^-^ 
10,방금 보고 왔어요~~재미가 없다고 하시는 분들은 정말 보고 말하는건지 모르겠네요 전 엄청 재밌게 봤음요~ 
10,캣니스의 섬세한 감정선 연기! 정말 멋졌다. 제니퍼 로렌스가 연기 진짜잘하더라 
10,흥미진진하네요 좀 기대하고 있던 영화였는데..생각보다 훨씬 더 재밌게 나왔네요 
10,캣칭파이어보다 더 재밌네요^^ 아마 담편은 진짜 포텐터질듯!!! 
10,이런 영화를 좋아하기도 하지만 그런 요소를 제외하더라도 진짜 강추할만한 영화였던것 같다 
5,전투신이 안 나와서 재미없는것 이라고? 전투신이 안나와서 재미없는게 아니라 객관적으로 지루하다. 충분히 줄일 수 있는 이야기를 길게 늘리니 당연히 지루 할 수 밖에. 
10,상상했던것 보다 훨씬 재밌었고 기억에 오래남는것 같아요 강추합니다 
10,모킹제이가 혁명의 상징이었네요^^ 저 이번 헝거게임을 보면서 저도 모르게 빠져서 보느라 아무 생각을 할수가 없었어요. 완전 꿀잼이네염 
10,"대작답게 스케일도 크고 탄탄한 연출력이 돋보였던거 같아요, 방대한 서사극같은 느낌도 있습니다. "
10,서사적인 부분이 다소 많지만 지루하지 않아요^^ 배우들 연기들도 좋고 연출도 잘했던데요~ 
10,재미난듯!완벽에 가까운 그래픽에 감탄만 나왔다 꼭 진짜 같았음 
10,재미도 있고.. 거 참 괜찮았어요. 흥행대박일듯! 
10,게임이 아닌 전쟁이 시작되면서 흥미로움도 업되고 CG도 디테일하게 더 멋져졌더라구여 
10,제가 워낙 기대했던 기대작답게! 충실하게 그 기대를 충족시켜준 영화예요^^ 
10,연기 좋고~ 스토리 좋고~ 올해 개봉한 왠만한 영화들보다 훨 재밌는거 같네요~ 무조건 강춥니다! 
10,말이 필요 없어요! 최고네요!! 시간이 넘 후딱 가버림 
7,전작의 기대감을 깨는!! 이 편은 과감히 안보셔도 좋을것 같습니다. 그래도 보고 싶으신 분들은 기대마시고 그냥 의리로 보셨으면.ㅋㅋ 
10,흥미진진한 전개가 좋았어요 실제같은 CG가 단연 최고지만~ 헝거게임 시리즈 중 가장 최고 
6,보는내내 뒤척뒤척..정말 2를 위한 예고편!!! 
10,기발한 스토리와 고퀄리티의 CG들이 인상적이었다 헝거게임 모킹제이 보길 잘했어 
6,초석이 필요없는 영화인데 상업적인 이유로 초석을 깔았다라고밖에 느낄 수 없을정도로 지루하고 재미없음 
10,현란한 액션보다는 미디어 전쟁을 다루는 거라 완전 흥미진진해요!스토리부분이 정말 훨씬 업그레이드 되었군요. 
5,후속편을 위한 .... 
10,필립 세이모어 호프만를 극장에서 다시 만날 수 있다는 사실만으로도 충분히 만족스러운 영화 ! 
10,"볼거리도 풍부하고~ 제니퍼 로렌스, 널드 서덜랜드 등등 배우들도 다 연기 잘하고~! 이정도면 굿!! very good! "
10,제니퍼의 더욱 성숙된 연기력에 감탄했네요 아.. 이제 또 1년을 기다려야 하는가! 
10,헝거게임 모킹제이 추천할께요 영상이 화려해서 제대로 몰입할수있는 영화였어요 
4,파트2가 있는지도 몰랐는데 다한 느낌.. 굳이 2시간이나 되는 러닝타임이 필요한건지 모르겠다.. 뭣보다 주인공의 수동적인 태도가 너무 당황스러웠다.. 파트2는 재밌겠지.. 
10,원작이 있는 만큼 탄탄했던 스토리도 재밌지만 눈도 상당히 즐겁네요 
10,아침에 보고 왔는데 개인적으로 넘 좋았다. 최고 최고!!! 
10,이제는 고인이 된 필립 세이무어 호프먼의 마지막 모습을 볼 수 있어서~ 이번 헝거게임은 더욱 특별한 영화가 될것 같네요 
10,정말 차원이 다른 모킹제이편.. 전편과 전전편은 우스울 정도로 스케일도 커졌고! 이번편 장난 아니네요 
10,첨에는 다른 영화 보러갔는데 시간대가 이것밖에 안맞아서리 봤어요 관람전 정보는 하나도 없었지만 충분히 영화를 즐길 수 있었어요~ 잘봤네요 
10,헝거게임 강추할께요 CG가 굿이었습니다~ 친구가 먼저보고 추천해줘서 보게됐는데 완전 강추 할 만해요 
10,엄청재밋네요 나도 모르게 초 집중해서 본 영화였음 
2,꼭 1편2편 보고가세요 안보고갔다가 토할뻔; 
10,본 사람들마다 추천하던 헝거게임 모킹제이 이유가 다 있었네요 
10,말이 필요없다 대박~ 좀.. 보고 이야기하자~지겹다는 사람들은 멜로나 드라마 보면 자갔네?! 헝거게임에서 캣니스는 정도전급 혁명가라 생각하면 대사 한마디 한마디가 새롭게 들린다 
6,오~~~이제 시작되나 하다가 ....?응???뭐지 하는영화 
7,헝거게임1편부터 기대했던 딱 그만큼은 됬다 마지막편에서는 이 기대를 넘어서길 
10,예고편 보고 꼭 보고싶었던 작품이었는데 예상보다 너무 좋았어요 
10,"이번 모킹제이편은 원작을 읽었든 안읽었든, 전작을 봤든 안봤든 재미나게 즐길수 있는 영화라고 생각이 드네요~ "
10,모킹제이를 보다보니 캣칭파이어는 생각도 안나네요! 전 모킹제이가 제일 재밌네요! 모킹제이 다음편까지 기대만땅! 
10,여운이 오래남는 영화네요~ 한번 더 보고싶을 정도로 재밌었다 
5,part1이라 결말 허무하고 part2 예고편같음이전편보고 가길 안보면 전편얘기가 많이 나와서 별로 
10,캐릭터들도 살아있고 그래서 요새 나오는 영화들이랑 비교해봐도 괜찮더라구요 
8,오롯이 파트 투를 위해 만든 것 같음액션신 거의 없고..근데도 재밌게 봄후반부 소름 ㄷㄷ 
10,짱재미있었어용 짱짱짱 
10,눈 호강 제대로 시켜주는 헝거게임 모킹제이!완전 반했다 재밌더라 
10,왜?엄청나게 몰입해서 봤는데;;;; 
10,내용도 괜찮고 무엇보다 영상미가 가장 훌륭했습니다 정말 최고 수준이었어요 
10,모킹제이 후속작을 정말 기대되게 만드네요. 어떻게 풀어갈지 예상도 안돼요!!! 무엇을 상상하든 상상이상일듯 
10,정말 봐야됨 이런배우들이 떠야되는데ㅋ잼나게 봤어요 
10,단순한 판타지 영화를 넘어 묵직한 메세지와 전율때문에 볼가치 있다고 봅니다. 그리고 그동안의 게임에서 벗어나 제대로된 전쟁을 맞이하는 모킹제이편이라면 더더욱! 
10,스토리가 좋았어요 그래픽도 최고지만 스토리전개가 완전 긴장감 최고였습니다 
10,이제는 게임이 아닌 전쟁의 시작이라 그런지 스토리라인이 풍부해진 것 같더라구요.. 
10,요즘 나오는 시리즈 중에는 헝거게임이 갑인듯! 모킹제이 다음편까지 기대하겠음 
5,기대 많이했는데... 그리웠던 제니퍼 로렌스 얼굴본걸로 만족해야지. 
8,파트원인지 모르고 봤음 그래도 파트투가 기대된다 
9,괜히 어린나이에 아카데이 여우주연상을 탄건 아닌가봐요. 제니퍼 로렌스 연기가 대박이네요. 
9,사이사이에 볼거리가 참 많아요. 이거 보고나니까 모킹제이 파트2도 완전 기대되요~ 
2,"1,2편 보고 이거 이어서 보면 아마 다 실망할듯 "
1,결말이 궁금해서 어거지로 4편이나 봤다. 소설에서 나온부분들이 많이 짤려나간거겠지만 영화로는 사실상 주인공의 존재가 그닥 필요없는 영화임 
1,제니퍼 로렌스 존나 찡찡대네 ㅅㅂ; 
6,"진심 1,2편이 잼고 나머지노잼 "
1,쓰레기영화 내인생최악 
1,아무리 후속편이 있다고 해도 각 편마다의 한 편 다운 작품이어야 하는데..이미 전개 될 때부터 다음 편을 의식한 늘어진 전개가 다 망치고 있다. 이런 태도 때문에 좋은 점수를 주고 샆지가 않다. 
1,"남주가 리암 햄스워스면 이 영화 봤을텐데.... 1,2편 보고 남주가 무매력에다 못생겨서 차마 3편은 안땡기더라. "
1,간만에 사기극 당한 영화 ...ㅡㅡ 
1,많이 지루하네요   중간에  나온  첫 영화 
1,이 영화를 60%가 넘는 40대 분들이 보고나서 평점을 9.38점 이상 주셨다는게 아주 놀랍기 그지없습니다 허허. 
1,진짜 잼없다.걍 여주인공 죽었음 좋겠다.영화보다 뛰쳐나가고싶은적은 첨이다.절대비추 
10,기다린만큼의 보상은 2%부족했지만 역시 제니퍼로랜스의 연기는 인상깊었어요♥ 
10,헝거게임 모킹제이 재밌게 보고왔구요 보고나서 여운이남는것 같아요 
10,영화 재밌게 봤어요! 구성이 좋네요~ 꽤 신경써서 만든듯 
10,전 원작을 읽었는데 모킹제이편은 솔직히 전편들에 비해 재미가 없었거든요~ 근데 영화는 잘 살린듯~ 
10,너무너무 잘 봤어요. 참 괜찮네요 이 영화.. 
10,진짜 보고나서 후회없어요 스토리도 재밌고 볼거리가 풍부했어요 
10,친구가 재밌다고해서 봤는데 보길 잘했네요~재밌었습니다 저도 추천할께요 
10,"헝거게임 이번편은 파트1이라는말이 무색하게 긴장감으로 가득차있다 게임을 벗어나 혁명의시작점에서 겪는 캣니스의내적갈등에 가슴을 조이며 또 울분을 토하며 봤다,, 마지막을 위해 내년을 기다려야하는 아쉬움과 한번더캣니스를..."
10,시작부터 끝까지 몰입해서 볼 수있었던 영화 몰입도와 퀄리티가 굿이었습니다 
10,yo~! 영화 굉장히 잘 만들어진 듯 :) 
10,이전편이었던 캣칭파이어보다 긴장감도 높아지고 스케일도 한층더 커졌네요! 
10,금년들어서 본 영화 중에 가장 만족스러웠던 작품!! 
10,시간가는 줄도 모르고 봤어요 그만큼 재밌었다는거 
10,헝거게임 모킹제이 추천할께요 2시간동안 제대로 몰입할수있는 영화였어요 
5,파트원 파트2로 나뉘어서 그런지 너무 질질끄는 느낌.. 
