score,review
10,평점이 생각보다 낮길래 기대별로 안했는데 엄청 재밌는데요??? 연기 되고 연출 괜찮고! 1점 평점들을 이해를 못하겠어요 
10,모킹제이는 원래 전투보단 정치가 좀 더 부각되는 편이죠~ 그래서 지루하게 느낄사람도 있지만 그렇지 않는 사람도 있는거겠죠 
5,전 편을 안봐선지 무슨내용인지도 모르겠고...실망 
7,1 2편을 안보고 까시는 분들은 나가 뒤지시고 전편을 보신 분들은 너무 상업적이다 이런 생각 하실 거에요. 갠적으로 1 2편 구분 지은건 상업적인 면을 극대화 시킨 전략이라고 밖엔... 
10,"정말 재밌었어요. 책못읽어보신분들은 잘 못느끼겠지만, 책읽은분들에게는 강추! "
10,배우들 연기력은 그냥 갑! 그중에서도 제니퍼 로렌스가..완전 짱!! 왤케 연기를 잘해~ 
10,이제는 게임이 아닌 전쟁이 시작되면서 흥미진진하더라구요~ 
10,원작을 먼저 보고 본거지만 재미도 있고 감동도 있네요~~ 
10,파트2도 기대됩니다 화이팅 
10,잔잔하긴하지만 그렇다고 지루한 그런거는 아니라고 생각해요. 워낙 밑밥을 잘깔아놔서 다음편이 완전 기다려지네요 
10,"싸우길 기대하고 본다면 최악의 영화.. 갈등과 대립, 캣니스와 다른 등장인물들의 심리묘사를 본다면 최고의 영화 "
10,완성도 높더라. 제니퍼 로렌스 연기도 개잘하고 존예! 
9,개인적으로 캣칭파이어보다 재밌었다 
10,이번편은 시리즈의 대미를 장식할 다음편을 위한 교두보같은 역할이랄까요^^ 판타지지만 정지적인 면도 보이고 진짜 재밌네요 
10,파트2를 위한 서론이라 액션은 별로 없지만 몰입도 짱! 매력적인 캣니스와 함께한 두시간은 전혀 지루하지 않았네요 
10,역시 헝거게임이다! 제니퍼 로렌스가 아닌 캣니스는 상상할 수도 없다 
10,이번 헝거게임은 정치적인 면이 많이 부각됬네요~ 선전영상에서 스노우에게 전하는 메세지도 인상깊구.. 재밌게봤어요 
10,다 필요없고 지금봐라 재미있다 
10,판타지 영화는 정말 영화에서 봐줘야되는거 같네요~ 너무 재밌게 잘 보고 왔습니다 
10,솔직히 별 관심없이 본건데 완전 좋았어요 
10,난 이런거 좋던데.. 이런 장르 좋아하는 사람이라면 재밌게 볼 수 있을 것 같아요~ 관심있으면 재밌게 볼수 있을 꺼예요~ 
10,파트1이라서 이번엔 스토리 전개가 주가 되는 편! 그덕분에 몰입도 good!! 
10,파트2를 위한 워밍업이라고도 생각되네요~ 그래도 잼나다~~ 
10,결말을 못본것이 아쉽지만 파트1에 내용중 필요 없는 장면 얘기 요소들은 없었던듯 만약 이걸 파트2랑 합쳐서 한번에 나왔다면 4시간 이상의 긴영화가 되었을듯 여러분도 보세요~ 재미있어요~ 
10,장미 하나에도 의미가 있는. 그래서 알고 보는것과 모르고 보는게 다른건가보다 
10,뭘 2랑같이보는걸추천이야  개인의성향도있겠지만 충분히 2탄보다 더 탄탄하고몰입되게 ㅎㅎ 잘만들었음 강추!! 
10,잘 만들어진 영화!!  강추하고 갑니다! 
10,보고나서 절대 후회 안하는 영화였어요 
10,드라마가 훨씬 강렬하고 탄탄해졌네요. 헝거게임 시리즈 잘 이끌어가고 있다고 생각함 
10,요근래 본 영화중에 가장 재밌던 영화예요 
10,이 영화는 원래 4부작으로 기획된건데;; 왜이리 다들 당황하신건지;; 원작을 보셨다면 영화 잘만든거 완전 느낄텐데.. 
10,"헝거게임 : 판엠의 불꽃, 헝거게임: 캣칭 파이어를 다시 보게 만드네요~ 졸잼~ "
10,원작부터가 워낙 내용이 많아서.. 전 원작을 최대한 많이 담아줘서 좋았어요 
10,캣니스 연기 잘한다~~~다음편을 위해서 꼭 봐야할 시리즈예요!!! 
10,굿!! 나름 스토리도 좋았고 재밌었어요 
10,"솔직히 제니퍼 있는데 10점 줘야지 ㅋㅋㅋ. 정말 파트1,2로나눈게 너무아쉽지만 재미있다. "
10,스토리가 너무 재밌었어요 한번 더 보고싶은 영화였네요 
10,소재도 좋았다고 생각한다. 꽤 잘 만든거 같은 영화. 
10,개인적으로 소설은 1편이 제일 재밌었는데~~ 영화화 시킨거는 모킹제이가 제일 재밌는거 같네요 
10,말이 필요없어요 보시면 알아요 이건 내가 장담! 진짜 괜찮음 
10,진짜 재밌다 .. 전 스토리도 안보고 그냥 봤는데도 진짜 꿀잼 
10,짧은시간이었는데 이렇게 엄청난 양을 잘 풀어냈네요. 제생각이지만 모킹제이는 2편으로 나누는게 최선이죠 안그랬음 이도저도 안됐을꺼같아요 
10,긴장감 넘치고 재밌었어요 
10,아쉬웠음ㅋㅋ 그래도 투 기대 
8,모킹제이2가 빨리 나왔으면 좋겠어요ㅠㅜ 
10,핵잼..그리고 마지막에 진짜소름!!보길잘한듯ㅎㅎ 
10,꿀잼인데...? 재미없다는 사람들은 앞 줄거리 모르고 봐서일듯 2시간 시간가는줄도 모르고 봤네요 추천! 
8,"평론가들의 말이 딱 맞는듯. 철저히 4편을 위한 기반 다지기를 위한 3편이라고 보면 될 것 같습니다. 포커싱이 바뀐 만큼 1,2편의 스타일을 기대하고 보시면 안되요! "
8,다음편이 더 재밌을거같다 이번편은 파트1이라그런가 내용을 질질 끄는느낌이랄까 
10,아무것도 모르고보면 이해가잘안될수도 있지만 최대한 책하고 비슷하게 만들었다. 모킹제이 책을 본후에 영화를 보면 이해가잘된다. 
10,그냥 믿고 봐도 될 것 같습니다. 간만에 정말 재밌는 영화 봤어요~ 
9,기대안하고 봤더니 재밌음 
7,지극히 제개인 느낌입니다 액션은 생각만큼 강하지 않지만 무언가를 생각하게 하는 철학적 느낌과 내면의 소리를 듣게하는 요소가 좋았습니다 
10,캐피톨에 대항할 수 있는 유일한 희망 캣니스가 내면의 갈등을 극복하고 자신의 운명을 받아들이며 성장하는 과정이 무척 감동적이네요. 
10,생각보다 재밌던건 사실! 기대를 안하고 봤는데 진짜 재밌었어요. 
10,전편을 안보신분들은 꼭 전편부터 보시고오시길! 
10,"마지막이 허무하긴 하지만 전 재밌었어요사실 모킹제이 내용자체가 처음부터 끝까지 반란 일으키는 내용이라 1,2편보단 재미없을수있는데 너무 욕하시는듯ㅠㅠ전 책보단 훨씬 몰입해서 재미있게봤어요 "
10,남녀노소 누구나 즐길 수있는 영화였습니다 추천할께요 
10,와...진짜 재밌고 무섭다 
10,"Are you, Are you Coming to the Tree... "
10,이정도면 진짜 영화관에서 봐줘야죠~ 
10,이게 왜 재미없지? 짱잼인데!!! 소름돋으면서 봤다 
10,결말은 원하던 방향은 아니었지만 그래도 꽤 볼만하다 
10,"좋아하는 사람들한테는 재밌을테고, 그래서 나는 재밌었던건가 "
10,확실히 파트 2를 위한 데코레이션 같은 느낌?이랄까요 그래도 재미는 보장합니다 
10,이렇게 잘살려주셔서 감사합니다ㅠㅠ 제가 원작에서 상상하기 어려웠던 장면들이 너무 생생하게 잘표현되있어요!! 파트2 기대되요!! 조쉬 촬영끝나면 많이 먹길바래요ㅠㅠㅠ 제니퍼는 점점 이뻐지네요!! 
10,원작을 영화내에서 담고자 하는 이야기가 방대하네요~ 그래도 차곡차곡 다 넣을 건 넣었다고 봅니다. 
10,"재미는잇는대 타이틀에 part1이 빠져잇어서 평점이 일케된듯, 영어타이틀엔 part1 들어가잇는대 한글엔 왜 뺀건지 "
10,스펙타클함에 빠져서 시간가는 줄도 모르고 봤습니다. 그래픽두 좋았고 간만에 보는 판타지 시리즈 대작이라 재밌었어요~ 
1,로그인 하기 귀찮아도 꼭 쓴다.진짜 재미없어요 보지마세요잠 자다 나온영화는 처음임 
1,1점주는것도 첨이고 여지껏 살면서 영화보다 졸았던건 이게첨 그래서 기억해주고 싶다 관람객들 표정 보니 너무 웃기더라 부들거리며 자리를 못뜨던사람들도.. 냉정하게 사실임 
10,캣칭 파이어에서도 그랬지만 모킹제이에서 더욱 진가를 발휘한 제니퍼 로렌스~ 연기를 잘하는데 연기를 못하는 캣니스를 연기하는 장면에서 완전!! 인정! 
10,감동적이고 흥미진지하며 후속편이 기대되는 모킹제이! 흥해라 
10,"제니퍼 로렌스의 연기가 미치는 영향이 엄청나네요, 캣니스의 두려움과 혼란이 저한테까지 느껴지는거 같았어요 "
10,요즘 개봉하는 영화중에 최고! 올해에 개봉할 영화까지 통틀어도 밀리지 않을듯!! 
10,헝거게임 모킹제이가 올해 최고의 판타지 블록버스터라는데 의의 없음! 
10,캣니스의 여전사로로서 변모되는 과정을 정말 실감나게 보여준 제니퍼 로렌스. 진짜 대박이다~~ 
10,이제 다른 이야기로 막 접어드는 단계죠^^ 이야기가 새로운 국면에 접어들면서 드라마적인 긴장감도 한층 격상된듯 
10,꽤 볼만한거 같다 짱짱! 정말 보길 잘한듯 
10,그냥 기대는 안하고 호기심에 보게된건데 영화가 좋더라구요 재밌습니다^^ 
10,유일하게 헝거게임이 없는 시리즈 모킹제이편이지만 재미있었음 제니퍼로렌스의 연기는 진짜 대단한듯.. 
10,생각했던 기대치보다 훨씬 완성도도 높은 영화였어요. 매력터지는 영화네요.~ 
10,스토리도 좋고  엄청 재미나게 봤어요~~ 
10,시리즈를 거듭할수록 더욱 흥미진진해지네요! 정말 마지막편이 졸 기대되네요 
10,흥미진진~~ 마지막까지 눈을 못떼고 본 영화!! 이러니 어떻게 다음편을 안기다릴수가 있겠어요~ 
10,너~~무GOOD GOGGOG 
10,오오오!! 모킹제이에서 제니퍼로렌스 더 이뻐짐~~ 
10,"한번쯤 봐도 좋을 영화라고 생각합니다, 개연성있는 스토리에 이정도면 괜찮은거 아닌가요?^^ 전 영화 음악도 넘 좋더라구요 "
10,캣니스와 보그스 그리고 크레시디 메살라 폴룩스 캐스토르 등 배우진도 아주 짱짱하죠!!! 
10,이제 마지막 마무리만 잘하면 될것 같아요~ 확실히 더 흥미진진해졌네요~ 
9,2편은 언제 기다리나?? 
8,너무 큰 기대는 금물이네요 
6,솔직히 노래부르는 씬 빼고는 별 흥미도 없고 질질 끄는거에 실망. 내년에 파트2 나오면 같이 보시는게 나아요. 진짜 지루한건 못참겠다. 2편은 진짜 볼만했는데.. 원작도 모킹제이가 별로였는데 영화을 이렇게 해버리면 ...
10,멋진 장면들도 많고 재밌습니다. 캣니스가 매서운 눈빛으로 활을 쏠 때 진짜 최고! 감히 이장면을 최고의 장면이라고 꼽을수 있다! 
10,완전 짱 재밌다. 기대를 하고 봤는데도 재밌었다 완전 
10,스토리 전개가 빨라서 더욱 재밌었다~ 답답함이 없어서 좋았다 헝거게임 강추 
10,스케일에 반했다 진짜 최고야 딴짓거리할 수없게 몰입하게 해준다 
9,평점이안좋은이유가 어느정도는이해가지만 평소헝거게임팬이라면 누구나 좋아할만한!♡ 
10,판타지가 이정도는 되야~!!! 볼거리 만으로도 영화보는 값을 충분히 하는 것 같네요! 헝거게임 흥해랍! 
10,아직 안봤다면 기대해도 좋을 영화입니다~ 충분히 볼만한 영화기도 하죠 
8,역시 최종시리즈1편은 딱 intro 라는 느낌..ㅋㅋ그래도 재미는있었음 
9,이번편도 ost가 좋네요 엔딩크레딧 끝까지 듣고왔습니다 
10,Hunger Game 시리즈의 탄탄한 스토리라인이 어디가나요~게다가 여전사로 각성한 캣니스의 성장까지~ 완성도가 장난 아니예요 
10,역시 헝거게임의 매력은 엄청난 스케일!!! 
10,사람들한테 추천해도 욕 안먹을 영화죠 이런게~ 연출도 잘했고 각본이 탄탄해 보였어요. 
10,원작소설도 다읽은지라 원작과 영화를 비교해서 보는 재미도 있더라구요^^ 전편을 안봤으면 원작을 보고 가는걸 추천합니다 
9,해리포터의 죽음의성물 파트1과 느낌 같다고 보면됨 나중에 한번에 몰아서보는게 나은것같네요ㅠㅠ 
8,파트2의 화려한 장식을 위해서인지 좀 질질끈듯 
8,다음편을 위한 예고편~~ 
10,오~ 모킹제이 재밌네요^^ 생각했던거 보다 훨씬 더 재밌었어요. 판도 더 키우고 그래픽도 더 신경쓴거 같네요^^ 
6,"아... 헝거게임 1, 2  만큼 기대하고  보시면 큰 낭패입니다. 1~2는 액션, 판타지이고 이번 3-part 1 은 드라마입니다. 나중에 랩탑으로 보시길 권합니다. "
9,4편도 보고싶게 만들어지는군 
7,드라마게임. '결'을 화끈하게 터트리기 위한 '전'의 조금은 잔잔한 드라마틱한 전개. 
9,"저는 1,2편을 재밌게 봤고 이번편도 굉장히 재밌게 봤어요! 생각보다 이번 편에 실망한 분들이 많아서 놀랍네요..저만 재밌었나요ㅠ "
6,볼만ㅇㅇ ㅋ 큰기대는 ㅋ 
7,시즌을 다 챙겨본 사람은 어차피 봐야할 내용이지만 전 작들보다는 아쉬운점이 많다는 생각이든다..영화를 보고나면 또 어떻게 기다리지 하는 생각에 머리가 지끈거리긴하는데 그래도 시리즈를 모두 관람해야하는사람으로써 비추는...
10,"한줄로 표현하자면, 헝거게임 시리즈의 절정에 치닫기 위한 서막! 졸멋짐 "
7,1.2편에 비해 아쉬운 느낌 
8,자유에 대한 갈망과 폭압의 고통.. 전진할것인가 머무를것인가 내안의 나를 들여다보게 한다.. 굳이 두편으로 나눌 필요까지 있었을까하는 아쉬움속에서도 어느새 다음편을 기대하게 한다 
6,아무리  part2을  위한  1이라해도  이건...서사가 90%....예산이 없었나 보다.   이야기로  시간을  때우려는걸  보면 
8,책먼저읽은사람은 이쯤에너 끊을줄알고있었을듯 싶은데 
10,"필립 세이무어 호프만의 마지막 모습을 볼 수 있어서 좋았구요, OST도 좋구, 디게 디테일한 부분부터 신경많이 쓴게 보임 "
2,두 편으로 나눌 이유가 없는 꼼수 
4,뭔가 참 part1 이라지만 맥없는 스토리에.... 주인공이 퇴보해가는 느낌? 점점 여전사가 되가는걸 바랬는데 점점 망가지는 느낌 그냥 1탄보고 끝냈어야... 
10,지루하단인간들이 왜 지루하다고하는줄아나? 그런것에 익숙해졌기때문에 참을성이 없기때문이지. 상대를 만족은못시키고 자기만 빨리하면된다..ㅋㅋ.. 한국사회의 고질병이다.. 타자2 쓰렉.. 이나보고. 말하겠지 남자배우졸라멋...
10,존잼...역시 캣니스는 모킹제이 
1,아...존나 이게 뭐냐. 멘탈 제대로 안 선 상태에서 모킹제이 되더니만 캐피탈 폭격에 수많은 사람들이 죽은 걸 바로 앞에서 보고 울분 토하다가 피터만 나오면 존나 애새끼 되서 징징 거림. 그러면서 게일하고 키스 하고...
4,벙커 살면서 완벽한 피부에 셋팅헤어로 나오는게 진짜 실망스러움. 연기마저 별로 
4,세상에 포스터 완전 확대해서 봐야 개미글씨로 PART 1 이라고 써있음 
4,제니퍼 로렌스 연기 못한다고 이 영화보고 처음 느꼈네 왜 예전엔 몰랐지? 
1,재미 없다 근데 평점은 진짜 높네 61퍼가 10점을 줬다는게 이해가 좀 안되네 
1,극장에서 안보길 잘했다. 내 평생 1점주기는 또 처음이네. 
1,보고 화나는...영화... 2편은 괜찮으려나? 
10,볼만했어요.. ㅎㅎㅎㅎ 
9,재미있는 내용 구성.... 
5,정말... 별로다... 
10,진심꿀잼!대박입니다 
9,소설속 장면들을 영상으로 훌륭하게 드러냈다. 2부로 나누지 않고 조금 긴 영화로 만들었으면 좋지않았을까 하는 생각도 들었지만 1인칭 시점인 주인공의 심리묘사를 3인칭으로 거침없이 드러낸 제니퍼 로렌스의 눈빛 연기가 ...
10,너무 재미있고 파트 투 기대되염..짱!!!! 
10,짱짱재밌어요!!!!강추완전강추! 
10,재미있게 봤습니다.다음편이 기대 
10,황홀했습니당 ㅋㅋ 내년에기대할게요 
10,시리즈물은 첨부터 봐야지 중간에 봐놓고 욕하는건 뭐지;;;헝거게임 팬으로써 매우 흥미롭고 재미있게 잘 봤습니다. 완결 빨리 나왔으면~ 
10,솔직히 전편보다는 아니지만 그래도 후속편을 위한 점에 나는 만점을 초반에는 지루했지만 뒤에는 약간 흥미진진했었다 
1,파트나눠진것을몰라서였을까이제껏 관람한 역대 최악의 영화. 
10,멋지다 정말 멋지다. 이런 전개일줄 몰랐다 
1,1.2편때문에 보긴봤다만 돈주고 마지막편의 예고편을 2시간이나 투자하며 볼 필요는없다. 
1,"헝거게임 1,2편 다봤지만, 솔직히 모킹제이는.졸립다.... "
1,와와와 정말 재미 없었어요 
10,이래서 빨리 한벝에 좀 만들이 기다리게 진짜 
10,진짜 많이 기대했는데 좋았음~~ 꿀재미 
6,아무리 part2가 있다고해도 1편 내용이 너무 없었어요...그냥 2편 나오기전에 다운받아보는게 더 나을것 같네요~ 
1,한글제목에 PART1이라고 했으면 않봤다. 배급사들의 치졸한 상술에 화가 난다. 
10,꾸르잼 꾸르잼 꾸르잼 꾸르잼 
1,아무시 상술이래도.. 둘로 쪼개더라도 볼건 넣어줘야지.. 이건 너무 심하자너.... 
10,올해 최고 재밌었던~!!!! 
1,배틀로얄 짝퉁가지고 왜이리 질질끄냐 뭔가 철학적인 내용도 아닌거가지고 화려한 아바타 반지의제왕 해리포터 트랜스포머 등등 그런수준의 화려한작품이면 모르겠는데 걍 배틀로얄 리마스터링수준의 내용가지고 시리즈물로  억지로 ...
10,평정 1점 주는 사람들 다 빅매치 알바인가요? 
10,평점리뷰들 보고 별 기대 안하고 봤는데 전 재미있게 봤어요 지루하지도 않았고요 잼슴 
1,"진짜...4명이서 보고 나와서...이거 보자고 했던 사람...""미안해..ㅠㅠ"" 나머지3명 밥사라... "
10,이 영화를 보고 암이 나았습니다. 
1,Part1 이라고 고지하지 않은 것은 관람객을 기만한 배급사의 치졸한 전략입니다. 2편을 보기위해 필요하다고는 하나 파트1임을 고지했어야 한다고 봅니다 
1,별반개도 아깝다 내돈.. 
1,"기대에 못 미친 영화, 무슨 드라마도 아니고 돈이 아깝다. "
1,"이런것도 영화라고.. 보다가 졸려서 잤음. 스토리, 연기, 긴장감 모두 0점. 평점에 속지마세요. 내 인생 최악의 영화 "
1,"오늘 모킹제이 보고 왔는데 파트 1,2,3으로 나눠있어서 그런지 정말 별로였어요... 차라리 모킹제이는 집에서 보고 파트2를 영화관가서 보는게 낳을듯 ..ㅎㅎㅎ 제발 그러세요 ㅎㅎ "
1,간보다가 끝난영화ㅠㅠ 이전편들보다 훨씬 못하네요.실망가득... 
10,너무 너무 재미잇네요!!백점만점에 십점드립니다- ^^♥♥ 
10,존ㄴ나재미있습니다.이건말로표현할수없을정도로재미있습니다.저part.2개봉하자마자일빠로볼꺼에요.하진짜명작입니다 
3,팜플렛만보시면됩니다 
4,전편이 재미있어서 봤는데 보다 잠이오고 나가고싶었지요 
10,빨리 다음편도 보고 싶네요 
6,전편보다 못한 후속편별로예요 
1,"제작비를 아끼려고 한건지..폭격장면같은건 좀 보여줄수 있잖아? 아무리 파트1 이라도 말야.. 4000원만 받던가 그럼 , 2시간동안 한숨만나옴 "
4,제니퍼로렌스 발연기 쩐다. 
1,이때까지 시리즈를 다봤었지만 정말 재미 없던 시리즈인듯책과 똑같이 재미가 없음 
1,전편 봐서 기대했는데 와 이건 쫌 아닌듯뭐 한것도 없이 얘기만 하다 끝남 끌어도 너무 끌엇음그냥 이번껀 다들 스킵하세여 지루함 
10,말이필요한가 .. 어서빨리 2파트가 나왔으면하는바램 
1,액션을 보러 갔는대 로멘스 비슷한 대화만 보다.. 액션은 비행기 추락 끝... 난 뭘 본거냐? 
1,리뷰를 보고 갈걸... 러닝타임 동안 집중하고 보다가 영화 끝날 때 OO 느낌... 
10,2를 보기 전에 보는 초석치고는 영화되게 잘만들었어요 
10,같이본친구는지루하다는데 난재밌게봤음파트2기다리기힘들어서 책사고있음 파트2나오면그것도볼거임 야호 
10,영화 끝나고 나서 딱 드는생각이 그래도 영화값은 한거 같다는거! 진짜 완전 영화값아까운 영화도 있는데 돈이 아깝지 않았다 
10,스토리도 깊이감 있어지고 특히나 이번편 로렌스 연기보고 완전 감탄했어요~ 
3,영화가 아니라 후속영화 예고편이예요. 작가가 구며쓴 이야기에 이 이유 저 이유 덕지덕지 계속 붙이면서 2시간이 끝났어요. 이 예고편영화는 당연히 전쟁할 분위기 다 잡아놓고 왜 전쟁을 해야하는지 2시간동안 설명만 해주...
10,이번은 part 1일 뿐인데도 몰입감이라던가 재미가 굿~ 
2,중학생 아들하고 일주일에 한번씩 영화를 보는 사람입니다~1.2편 다 봣고요~이영화는 너무 지루해서 액션신 기다리다가 잠들었네요~ 정말 최악의 영화 임돠~ 
6,음.. 몇편까지 나올라그러는거?? ㅋㅋ 이번건 너무 지루했음 흠.. 
2,지루하고 결말 없는 영화 
2,음 정말 보는내내 사방에서 한숨소리만 듣고왔어요 ㅋㅋ 하이틴 무비를 좋아하신다면 말리진 않겠어요 ㅋ 
4,제목에서 파트1은 왜 뺀건지..또 봐야하는..지루해져가네요.긴장감없고 서막에 대한  서술뿐... 지루해서 졸고 또졸고 .. 아쉽네요. 
10,"야 평점 왜이리낮아 재밌더만! ㅋㅋ파트 1인줄 몰라서 재미없고 시리즈물인데 전편안봐서 이해안되고 이런걸 누굴탓하나,, 허허 이건뭐 "
10,정말 기대 이상으로 재밌네요 판타지 좋아하는 분들이 좋아할만한 영화에요 
2,괜히 봤다는생각이 드는영화였다.간만에 가족들이랑 함께였는데 최악의 선택이었음... 
10,"나름대로 재밌게 봤는데 평점이 너무 낮아서...ㅠㅠ역시 part1때문이겠죠. 그래도 1,2에서 캣니스의 심리나 머 그런것을 중점으로 봤었는데 이번편도 그런것을 중점으로 보면 충분히 재밌는 영화라고 생각합니다. 저는 ..."
10,개인적으로는 정말 재밌게 봐서 평점보고 놀랐다. 이번편이야말로 캣니스의 고뇌와 운명에 대해 잘보여주는 편이었던 것 같다. 큰그림을 보면 캣니스는 혁명의 상징인 모킹제이지만 사실은 어린캣니스는 사랑하는 피타를 잃은 휩...
10,갓킹제이 파트투 언제기달려ㅠ 
10,참 느낌있는 거 같음! 영화 전체적으로 조화가 잘 어우러진듯해요~ 
10,"지루하지 않은 영화, 볼만한 영화예요 "
10,캣니스의 심리적인 면을 섬세하게 표현해 내는거 보고 놀랐어요~ 역시 제니피 로렌스~ 
10,헝거게임 모킹제이 꼭 보세요 생각했던것과 기대했던것 만큼 퀄리티가 정말 좋았던 영화였습니다 
10,"아니 솔직히 이거 재미없다는사람들 1,2편 안보고본거아님? 여기 평점보고 재미없을까봐 걱정했는데 존나 재밌기만하더만 "
10,다른 영화들이랑은 비교 불가! 상영시간내내 지루할틈 없이 흘러가서 아주 빠져들어가서 봤네요 
10,"단순한 아이들을 겨냥한 블록버스터라고 생각하면 당황할수 있다. 짜임새있는 드라마와 긴박함, 그리고 정치적 메세지는 블록버스터가 가져야할 이상의 것을 가지고 있다. 스크린에서 펼쳐지는 두시간의 이야기가 분명 심장을 뜨..."
10,차곡차곡 서막의 진행이 잘 되어있어 다음편이 기대가 되는것 같음 
10,재밌는데 진짜 재밌는데 뭐라 더 표현할 방법이 읎네;; 
10,재밌게 봤어요 이정도면 재밌는 거지~ 암요~ 
10,아진짜  대충좀 쓰면 안되녀 
10,전반적인 흐름만 캣치하고 간다면 이번편도 충분히 재밌게 볼 수 있으리라 생각됩니다 
10,제니퍼 로렌스가 아닌 캣니스는 있을 수가 없는것 같아요! 
10,이정도면 잘만든 영화죠 나름 만족만족함 
8,파트 2를 기대하겠습니다.. 
10,캐피톨이랑 우리랑 비슷한 점도 많고 그래서 슬프기도 하고 보면서 울컥했네요~ 
10,"시리즈1,2만큼 몰입도 쩔었어요! 중간중간 웃기기도 하고 소름도 돋고..!! "
7,"흠...1,2편을 안봐서 그런지 딱히 재미있진 않았어요 "
2,이거 볼 시간에 와우를 했으면 2랩은 했겠네...젠장.. 
8,1편 모킹제이 후보 2편 모킹제이 발달 3편 모킹제이의 성장 
8,아무리 2를 위한 초석이라지만.. 볼거리가 너무 적은듯.. 긴장감도 적고 
4,영화를 찍다 말았더구만 
4,긴예고편느낌 안볼수도 보기도 예매한.. 
3,아무리 파트1이라지만 이건 너무 하잖아!! 
10,주인공들의 감정 묘사가 인상깊었고  제니퍼로렌스의 연기력이 독보였던 편이였다 재밌음!! 
6,모킹제이part2를 위한발판 
10,"파트2 볼 거면 파트1 절대 스킵하면 안 됨. 전 시리즈보다 전투씬 적고 잠잠한 건 사실이지만 제니퍼 로렌스의 감정씬, 스토리 때문이라도 스킵하면 안 됨. 그나저나 모킹제이가 파트로 나눠진다는 것도 모르고 보다니. ..."
