score,review
3,한글제목에 part1만 쏙 빼놓은 배급사의 치졸함에 화가난다. 이건 상술정도가 아니라 기만이고 우롱임. 영화자체는 결말을 위한 연결다리라 크게 볼건 없음. 
8,"어쩌겠나. 1,2편을 본 사람들은 안볼수가 없는데. 결말을 위한 준비라고 생각하면 그닥 아쉬울건 없을듯. 전편을 보지 않은 사람들은 전편부터 보고 올것. "
7,내년에 part2랑 같이 보는 걸 추천. 
2,파트1이라도 이건 너무 심햇다.. 
10,전혀 새로운 헝거게임의 서막. 혁명에 대한 준비가 세련되게 그려진다. 다만 처음 접하거나 기대가 큰 분들께는 조금 지루할 수도. 
7,재밌긴한데 뭔가 파트로 나뉘어져서그런지 좀 허무하게 끊기네 다음화가 기대됩니다 
4,기대하시면 큰코다칩니다..파트1은 단지 서막에대한 서술뿐...큰액션 절대없음....저야 좋아하는영화라 내용은괜춘햇지만...보통 지루해서 잘듯 ..진자 내이야기가 딱임.... 
9,"캐피톨의 독재자 스노우를 무너뜨릴 13구역의 혁명이 성공하기를 바라며, 다음 모킹제이를 기다려봅니다!! "
1,노잼 똥싸다가 끊긴느낌이다 2시간동안 프롤로그만 보는느낌 
4,"15분짜리로 압축할 수 있는 내용입니다. 그걸 2시간 장편으로 늘어놨네요. 터져야 할 사건은 터지지도 않고, 있어야 할 갈등들은 비겁하게 꼬리를 감춥니다. 지루합니다. 지루했어요. "
10,"근데 애초에 헝거게임 제작할때부터 파트1,2 나눠서 한다고 했는데 왜들 뒷북이신지...모킹제이는 장편인데 그걸 한번에 만들었다고 생각하는거부터 이상.. "
10,처음부터 캣니스의 감정선이 쭉 끌고 올라가는데 울컥울컥한다 
1,진짜 하나드립니다거짓말 하나 안하고 이번편 스킵하셔두됩니다 
5,다음편을 위한 123분짜리 예고편 그 이상도 이하도 아님 
9,이어지는 느낌이긴한데  저는 괜찮았어요ㅋㅋ 
6,"이 영화는 파트 원,투로 나누지 말고 좀 길더라도 한편으로 개봉했어야 했다. "
5,헝거게임 팬아니면 그냥 안봐도 됩니다 솔직히 돈이 좀 아깝네요 ㅠㅠ 액션은 전투기 격추씬 단 하나.. 2시간짜리 예고편 보고 온것 같습니다 이건 무슨 본것도 아니고 안본것도 아니네요 ㅠㅠ 
1,피곤했는데덕분에잘잤다 
10,난 재밌게 봤다~ 스토리 구성도 좋고~ 연기도 일품! 
10,이걸 중간에 짜른게 유일한 단점 너무 재밌다. 
7,아쉽네요..파트 1이라뇨...ㅠㅠ 파트2를 기다리면 1에대한 실망을 만회할수 있을지.. 
7,아 이거 완결편이 아니었군요 .. 왜이래 질질끄나했더니 모르고봤더니 ㅋㅋㅋ좀 당황; 
1,진짜 기대 완전마니하고갓는데.... 가보니깐 두시간 동안 예고편본줄알앗슴.... 
1,"그동안 1,2편의 비난에도 불구하고 꿋꿋하게 나름 재미있게 보았는데, 지금 보고나온 심정은 마치 '사랑과전쟁' 드라마를 보고나온 기분이네요. 하아.... 액션은 30초 예고편이 정말 전부입니다. 극장가..."
2,긴장감도 반전도 없는 에고편....포스터에서 Part1 표기를 뺀건 사기성이 다분함 
1, 방금 보고 나왔는데 그냥 이런건 따운 받아 보셈~~~!!! 
7,Part2 를 위한 도움닫기 라고 생각하자...근데 포스터 에라도 part 1 이라고 좀 써주지.... 
9,"벌써부터 모킹제이 파트2가 기대됩니다. 기억이 안나서 1편,2편도 복습하고 봤는데 비교불가! 훨씬 재밌습니다 "
10,영화가 진행이 될수록 확실히 재미져요 
5,시리즈중 제일 재미가없었네요전투신이 없어서 그런가 
2,지루함이이루 말할 수 없을만큼. 배우들이 불쌍항정도... 
1,영화를보면서 흥미를못느꼈다.. 
6,ㅠㅠ 9000원 짜리 드라마본줄... ㅠㅠ 투비컨티뉴라니!! 
7, 언플싸움만 하다가 끝나네ㅠ 재밌었지만 좀 아쉽긴 했음 part1이란 말없길래 혹시나하고 기대했는데 역시 프롤로그ㅜ 
1,담배를 부르는 영화입니다 
1,파트1 엥? 해도해도 너무하네 
5,액션신 기대햇는데 안나옴... 
6,2시간 짜리 광고 보고 왔습니다. 
3,제작진이 왜이랬을까요.. 
1,종결편의 2시간짜리 예고편 
1,충격...파트2는 볼만할듯 
7,파트2에기대를... 
1,예고편입니다 저같은피해자가없길바라면서 로그인햇어요 진짜 지루함 1 2편같은 게임내용은 전혀없음 
7,Part.1이라니... 
2,그냥 안보는게 답입니다 
1,그냥충격적으로스토리라인이엉망이었다. 
7,기다리기 힘드시겠지만내년에 파트2랑 같이보세요내용없는 빈 깡통 같아요끝나면서 모킹제이 part1 이라고 나오는데욕하는 사람 봤어요 
8,파트2가 기다려지는...조금은 프롤로그격이라 조금 지루할수도.. 
1,정말 돈 아까운 영화네요. 1 2 편을 본 관객에게 3편은 대충 만들어도 오겠지 뭐. 하면서 만든 영화같습니다. 올해 아니 2-3년동안 극장에 가서 본 영화중 최악입니다. 이걸 내가 뭐하러 개봉일에 봤을까요. 유니세...
10,"진심 재밌음 왜 재미없다는지 몰르겠다..1,2편을 보면 그런 말이안 나올 텐데... "
8,"보통 억지로 1,2부로 나누면  개판되는데,,  개판안됐음 ㅋ  지루하지 않고 재밌다.  단 액션은 없음 "
10,폭풍전야의 분위기를 제대로 보여준듯~ 폭동이 일어나기..전 그 무겁고 뾰족한 느낌. 
7,PART2를 위해 본 거나 다름없다 
7,파트1이라서 그런지 좀 아쉽네요 
5,재미없음 예고편도아니고 
5,너무 밋밋했음... 차기작을 위한 포석? 
6,지겨워요끝도 이상하구 
7,내용전개가 너무 느리고 정적이야.... 담편나올때 그냥 다운받아서 몰아보는거추천 
3,이런 영화도 제작비 절감이 가능하구나~ 지루함. 
10,제니퍼 로렌스의 연기는 명불허전! 대체불가! 
1,보지마세요 보면 안되뇨 
2,너무 기대했나 보다...그냥 파트 2랑 같이 이어서 볼걸... 
5,"1,2편 재밌게 봤는데~~지루했어요 좀~ 전개도 길고 "
1,이것도 영화냐?완전 실망함 다른분들보지마시길...제발 
5,그전것들보다훨신별로였음난 영화가 끝난건지도모르고 멍때리고계속스크린보고있었음 그냥 마지막 파이널영화전에 준비운동만보다가끝난기분 
6,이번 헝거게임 파트 1 기대하고 보시면 실망할수 있습니다. 지루합니다. 
6,후편을  위해 만들어진  느낌이다. 이번편을 건너뛰고 후속작을 봐도 무난할듯 하다. 
6,아직은 전개일뿐이야. 아직도 전개야? 
10,무척 재밌고 마지막에 피타..ㅠㅠㅠㅠ나쁜 캐피톨같으니라고 빨리part 2 가 보고싶어지는데...어떡하죠? 
5,이거모지.. 파트1엔 내용도 없고... 
1,담배보다 발암률 높은영화 
1,진짜 9천원주고 좋은 숙면을 취하기 딱좋은영화다 잘만들었어 잠이 솔솔 오네 이거 보지말고 차라리 내셔널지오그레픽이나 인간극장보는걸 추천드립니다 
7,파트1이라고말좀해주지..ㅎㅎ 팡팡터지는장면없어요 
5,트와일라잇 마지막편전에 둘이 신혼여행 가는걸로 내용다 채운편 있잖아요 딱 그느낌이에요 봐도그만 안봐도그만 그냥 파트투를 위한 밑밥정도 
1,개재미없움ㅡㅡ이게영화임?똥임 
6,"지루하지 않지만, 전투씬이 적어서 전편에 비해 아쉬움이 남는 영화. Part2를 위한 디딤돌이라 생각한다. "
10,헝거게임은 보면서 눈 호강은 제대로하는 느낌을 받았어요 
2,1편을 본후 2편 억지로보고 이번에도 억지로 보고왔다. 
4,중간 중간 너무 흐지부지 했습니다... 
3,재미없음 끝이너무허무함 
3,전편만한 후편 없다는 말을 실감케 하는군... 무슨 드라마도 아니고 결말이 애매모호~ 후속작 진행중이신가...영화보다 잤으면말다했지 뭐~ 
3,파트 1 이해는하겠는데 진짜 개재미없습니다 
1,1점도 아까운 영화...조조로 봐도 돈이 아깝다정말 파트1이라해도 이건 아냐 
1,"헝거게임 1,2편을 보고 약간 기대를 하고 아들놈과 함께 보러 갔는데 완전 최악이다.아들은 옆에서 졸고 있고 난 혹시나 하는 마음에 계속 보고 있으니 걍 끝나버린다.영화 마치고 다른 사람들도 허무한 듯 투덜거리는 소..."
1,여자배우 얼굴만 2시간 보다 나옴 영화가 아니다이건-_-  쓸데없는것만 잔뜩 찍어놓고파트 원투는왜 나누냐? 그렇게 돈이 벌고싶었니?ㅋ 돈레기들 
1,"하...이번편은 그냥 안봐도 되는 편인듯 -.,-;; "
5,별 내용은 없네요ㅠㅠ 다음편을 기다려야겠어요.. 
1,진짜 보지마세요..개오바 
1,영화좋아하는사람입니다.객관적으로 이딴걸영화라고만들었는지의문입니다. 시간이아깝네요 
1,헝거게임은 액션신이 있어야 하는데 전혀 없네요. 영화 내내 잠이 오네요 
3,"아..1,2를 너무 재밌게봐서 그런가이번 모킹제이 파트1은 전 갠적으로 집중 못하면서 봤음요..재밌으면 졸지않는데 졸고.. "
6,PART 1을 빼먹나 아오 배급사에 당한기분이다. 내년에 PART 2랑 같이 보세요. 
1,참내 장난해? 돈 아깝다.피터랑 갑자기 시덥지않은 사랑 멜로가 웬말?진짜 최악의 영화 
1,예고편이 재미있는 장면의 다라고 해도 과언이 아니다. 이렇게 재미없게 만들거면 4부작으로 만들지 말고 3부작으로 하지... 관람객들 반응이 대부분 배신감 느낀듯 
5,유치하다는 느낌이 강해졌다. 왜일까? 
1,헝거게임1정말 재미있게봐서 마지막에 여운남긴거 불평없이 2편나오면 꼭 봐야지하고 봤는데 이건 뭐 똥싸다 끊긴 느낌 . Part1이면 포스터에 써두던가 관객 우롱하는것도 아니고 진짜 상술이 비겁하고 치졸하다. 딱히 클...
4,졸다가 일어나다가 다시 졸다가 영화 끝 
2,장난합니까 ㅠㅠ 장난합니까 
3,2편이 있다곤 하지만 이건 좀 심하잖아. 두시간짜리 옉‥편 본 느낌 
1,어떤 말을해도 극장에서 볼 이유는 전혀 없음. Part 2  보기전에 잠깐 줄거리 읽고 갈정도면 충분한 내용입니다. 어거지로 이렇게 Part 3까지 늘여놨네요. 
5,헝거게임 팬이자 제니퍼 로렌스의 팬이기 때문에 5점.... 걍 3시간 짜리 한 편으로 만들지... 앞부분엔 잤음. 
1,시리즈라도 극장용이면 각 편마다의 재미가 있어야 할텐데 다음 편을 위한 사설 밖에 안되게 만들었음. 그것도 한편 분량이 나올만한 스토리가 아니라서 억지로 늘린 느낌... 지루하고 재미없었음. 
1,아무리 part1이라지만 그래도 이건 좀 심하다...전편 캣칭파이어에 비해 완성도도 너무 떨어지고 지루하다 
1,지루하고 긴장감도 없고 액션도 없고 완전 잼없어요 
7,다음을 위한 징검다리 그 이하도 이상도 아닌 
1,파트1인지도 모르고 극장가서 보는데 영화제목나올때 파트1이라고 뜨더라 난 마지막편인줄 알고갓는데 아직까지도 질질끈다는 느낌을 지울수가 없다 내가 이걸 왜봣지 하는 생각 뿐 파트1안보고 그냥 파트2만 봐도 됨 
1,이건뭐냐  평점 5점넘게 준사람은 알바다 
6,왜 굳이 파트원투 나눠놨는지...안봐도됐을뻔.. 
1,"아놔 이걸 극장가서 보다니 30분이면될내용 모할라고 2시간씩늘려서 파트 나눈건지 피터구하는거라도 좀 잘만들던가 절대 극장가서 볼영화아님 1,2를 완전 재미나게봤는데 이따구로 영화를 만들어 놓다니 ㅡㅡ욕나오게하네 "
1,이딴 영화를 본 돈이아깝다 5만원주고 보래도 안본다 쓰레기 영화 
1,별 그지같은 영화. 평점에 낚이지 마세요 
5,잠만자다 왔네... 파트1이 영화표에 적혀있는 걸 보곤 예상은 했는데.그냥 2개 다 나오면 한 번에 보시는 걸 추천 함. 
1,그냥 안 보는게 나음. 진심임. 
1,전날 늘어지게자고 영화관 와서 영화 보다가 졸아보신분?? 
1,감독이 돈독이올라도 단단히 오른듯... 15분짜리 분량을 2시간으로 늘려놓음.지루하고 여주인공 캐릭터짜증남.. 그리고 무슨 홍보영상을 1시간동안찍어. 
1,1도 아까운 심정. 난생처음 영화리뷰 남겨보는데 많은사람들이 시간낭비 안했으면 좋겠음. 기대한만큼 화가나는 영화. 
1,아 별점1개도아까운데...내가 전쟁다큐물을 돈주고보다니 전쟁을 책으로읽은기분 
1,아 천원 아깝다~ 지루해 죽을뻔. 남주들이 어쩜 그리 하나같이 매력없는 애들로만 캐스팅했을까? 그것도 재주네. 
6,영화가 억지로 늘린 느낌. 액션은 거의 없고 게임도 없음. 주인공의 상징인 활 딱 1번 쏨.영화보다 절기는 처음임. 헝거게임 마비막편인줄 알고 보았던 관객들 모두 part1 이라는 자막과 함께 끝나는 엔딩화면에 어이...
2,허무와 허탈많이 자막과 함께 남아..  심리전만 까득한 
10,스케일도 크고 긴장감도 쩔고~! 박진감 넘치네요~헝거게임 다음편도 진짜진짜 기대되요!! 
4,차라리 파트 둘로 안나누고 이 내용을 영화 앞에 간략하게 넣어서 영화러닝타임을 조금 길게 잡는게 더 나았다 이걸 뭐하려고 영화로 찍은거지 
2,시리즈물 이용해 먹는 대표적인 영화...티비 시리즈도 아니고 이건 심하다..딱보니 죽은 배우 이용해서 대충먹자는 수작..배우한테 미안할 지경..ㅉㅉ 
5,"계속 뒤척뒤척 거리면서 봤음.. 1,2편 너무 재밌게 봐서 더욱 아쉬움... "
5,전반적으로 루즈함.. 
6,파트1이라고 시작되고 나서 말해주다니....군대휴가나온친구랑 봤는데 미안해서 죽는줄알았다 ㅋ 
1,영어듣기하러 영화관 가는 느낌 영화보면서 잠온적은 처음 
2,"상술이 너무 심했다. 아무리 part,1이라 해도 이건 너무 심함 "
4,예고편을 아주 지일질 끌은 느낌....시리즈 1편 2편 보고 본건데도 뭔소린지 모르겠고 지루함....끝나는 것도 갑자기 끝나서 관객들이 다 ??끝난거야???? 뭐야?? 이럼....굳이 파트 투로 나눴어야했나 
2,생각보다 많이 재미 없네요.극 전개를 늘려놓은 듯한 느낌.그래서 지루하고 답답해요.뭔가 큰거 한방을 기대했는데 그냥 끝나네요.완전 실망시키는 영화. 돈이 아까운 영화.ㅠ 
1,"진짜 이영화 1,2편안보고보니까 ㅈㄴ잠옴 30분보고 나머지시간다잠 ㅡㅡ걍 애미없는영화 돈만날림 "
1,역대급 쓰레기 영화 ㅋㅋㅋㅋ 한줄짜리 줄거리 가지고 2시간을 울궈먹다니 클레멘타인을 뛰어넘는 명작이네 
1,이거 영화관에서 보면 진자 개실망해요 돈아끼세요 
1,이제까지 본 영화중 가장 재미 없는 영화 절대 보지마세요. 혹시 잠자고 싶은 분은 괜찬을 거에요 
5,속았다흥행에 힘입어서 짧게 만들어도 될 영화를 괜히 질질늘려서.... 실망했음 
1,파트1이라니 한편인줄알아는데 트와일라잇처럼 파트1이라고 써줘야지 근데 제작자도 재밌없는것 알았나보네 
1,한개도 아까움 볼게 하나도 없음 
1,중간에 보다 나옴... 
1,혁명의서막  부제를 붙여야지?헝거게임 저편들 다보고 온 나로서는 그냥 낚인기분이다여주인공 연기도 못하고 사건 전개도 축 늘어지고?지루하다 끝난영화파트2에 대한  호기심 증폭용 1이라보면됨극장가서 절대 보지말길? 
1,"진짜 지루해요, 화살로 전투기 맞추는 예고편이 전부, 나머지는 반군 통합을 위한 동영상 찍기만 계속.. 괜히 헛돈 쓰지마세요, 뭐가있겠지 기다리다 2시간이 지나감,.다음편 유도만 하고 끝남.나중에 화가남. 그나마 다..."
1,솔까노잼 헝거시리즈는 다재미없음 보고있음그냥정신없음 메이즈러너가 100배는잼있듯 
1,처음으로 영화에 글쓰려고 로그인합니다 무조건 전편 보고 오세요 굳이 영화관에서 안봐도 됩니다 그냥 지루해 죽는줄 알았네요 그냥 재미 없어요 
10,심리묘사가 너무나 감탄스러웠어요 
1,졸려죽는줄알았다참 싸게 영화 만들었다파트를 나눠서  좀이라도 더벌고 싶니ㅡㅡ그러면최소한 파트원에서도 볼거리는 만들어줘야할거 아닌가 이건 뭐    독립영화도 아니고 완전 저예산영화 
1,음2시간동안뭘본건지는잘모르겠고끝남과동시에헛웃음이....정작보고싶은사람은화면속의화면으로만나오고끝에잠깐...돈이좀많이아까웠음파트2기대할게요 
1,별 반 개도 아까움 관람객 농락용 영화 
1,퇴근길에 이영화를 예매하고  혼자 봤습니다. 이젠 저도 운이 다했나 봅니다. 이렇게 재미없는 영화는 정말 몇년만에 처음입니다. 미드 보는게 더 낳을뻔 했습니다. 
1,솔직히 돈  아 깝고  시간 아 깝다 
10,제니퍼 로렌스 연기때문이라도 10점줘야된다 
1,별점 한개도 아깝다~~두시간 짜리 예고편~ 
3,지루했다 이런게 헝거게임이 아닌데 
6,남주는 원래 짜증났다쳐도 여주까지 짜증났음... 
3,실망 엄청 했어요. Part 1인지도 모르고 보았는데 액션 한번 없이 2시간 상영되었네요. 몰입감 없어서 졸렸어요. 
2,20분 분량으로 4편과 합치면 충분할 내용. 
4,영화가끝난순간 남녀노소 구분없이 어뭐야 이게끝이야? 라는말이나왔다... 언제또기다리나... 거의 책으로봐서 의리로보는느낌 
4,2편이 재밌어야 이거 욕안먹는다 
5,너무한다. 아무리 파트2가 기전에 설명이라도 넘 설명만하다 끝나내.... 영웅 만들기 작전?  선거운동 전략본부같다. 
4,내용없다... 할말 없다.. 재미없다.. 
6,이 영화를 볼꺼면 차라리 그돈으로 책을 빌리든 사든하셈 그게 더 이득임  내용도 책이 훨씬 더 좋고.. 
7,2편을위한 해설편!! 지루함을 느낄수있을듯 
7,지루한 내용과 뎌딘 내용전개 
5,파트2를  위해  파트1은  거들뿐..아주 긴  예고편. 
6,마지막을 위한 서론이 너무 길다. 
2,"파트1이건 나발이건 지루함의 모든 요소들을 갖추고 있으며 잡다한 출연진들은 시간 잡아먹기위한 출연이요, 정말 재미없음. 9점 10점 주는 사람, 넌 누구니?;; "
1,저는  이것만봐서그런지기대도안하고 봤는데도너무 재미없게봤이요 
1,자는게나을듯싶다아아아아 
2,뭘 얘기하고 싶은건지. 어쭙잖은 로맨스? 영웅의 진화를 위한 초석? 동감할수 없는 군중 장면과 편가르기는 최악 
3,영화가 혁명을 위한 광고만 찍다가 끝남!!! 
5,영화관에서 돈 주고 보기엔 아까워요... 스토리도 없구요. 
3,액션없이 지루하기만해서 보다 잤네요 긴장감도전혀없고... 
2,억지로 늘린듯한...이야기..그냥 1개로 마무리 했어야  했음..호프만 아저씨..안타깝다 
2,2편 나오면 그때 볼걸---후회하게 됨. 
3,다음편을 이어가기 위한 작품인거 같다는 생각 밖에 안든다.... 
7,뭔가 시작하다가 끝나버린.... 
1,파트1입니다 속지마세요 
1,파트1이라 해도 너무 심하게 늘어지네요. 제니퍼 로렌스는 활 한 번 쏘는 것 말고는 아무 것도 안 합니다. 파트2에 대한 기대감도 뚝 떨어졌어요. 
1,마이너스 별점은 없나? 이건좀 아니네요 절대추천 안하고요 아까운시간 내가며  봣는데 너무하네요 
1,21세기 들어와 최고로 지루한 영화다. 
1,음... 아쉽네...ㅋㅋㅋ 
1,"영화보다가 잠깐 딴 생각했는데, 그게 제일 재밌었음 "
1,"올해 평점 8점 이상의 수작들만 보다가 이걸봐서인지 1점도 아깝다는 생각이든다. 여자친구가 헝거게임 팬이라 1, 2편 안보고 봤는데 돈이랑 시간이 너무 아깝다. "
1,이걸보라고만듳었는지 걍2시간동안 할거없을때 보차한것같고 아무내용없다 진심보지마세요 노잼.노교훈.노감동 
1,진짜지루하고 젬이없네요‥돈아까움 
1,내인생처음으로 평점달아봅니다. 자다가 친구도 자나해서 봤는데 아니나다를까 자고있어서 그냥 안깨웠습니다.  자는게 나을거 같아서요. 
1,아  10자가 아깝구만유 
1,잼도 없고 파트원이고 돈아깝다ㅠㅠ 
1,남들은 어찌 보셨는지.. 개인적으로는 비추예요..ㅜㅜ 
1,"핵노잼.,.,,..., "
1,평점이 너무 과해요.4점정도 되는것같지만 과한평점을 낮춰야 하는 의무가있으니 난 1점.언제 볼만한 장면이 나오는지 기다리고 있는데 영화가 끝났다네.파트를 나눈건 너무 상술이네요~ 
7,전작의 감동과 재미가 다 어디로 갔니. . . 
6,Part.2에서 얼마나 대단한걸 보여주려고 감흥없는 Part.1을 만들었는지 모르겠지만 1년을 앞으로 더 기다려야 한다는 걸 생각하면 가혹하기만 하다. 준비만하다가 결국 시작도 안한 Pzrt.1이지만 그래도 Part...
5,다음 편이랑 같이 봐야 함. 이번 편은 스토리가 늘어진 느낌이다. 
9,저는 나름 재밌었는데.. 평점 높을줄 알고 보니까 정말 낮네요.. 그렇지만 내용 전개가 느린건 사실임 
10,완전 재미있었어요!! 왜 이 영화를 이제서야 봤는지 후회가 되네요ㅠㅜ 
10,결말을 위한 준비라는 말이 딱 맞는듯. 오래 기다렸고 기대도 많이 했는데 난 재밌었음. 내용만 보면 메인을 위한 에피타이저정도 스토리지만 헝거게임만의 긴장감은 빠지지 않음. part2 기대됨!! 
6,남주는 원래 짜증났다쳐도 여주까지 짜증났음... 
2,전개 방식이 마음에 들지 않습니다. 전체적으로 별로.. 
6,도입부라 그런지 재미가 없음 
6,"보실분들은 기대없이 보시기 바라며.1,2편으로 나뉘어 있어서, 굳이 보지 않아도 될듯한 1편입니다.2편만 보셔도 될듯.. 내용이... 1편은.. 그닥... 없는듯... "
6,파트 1이고 2고는 둘째치고 일단 전개가 너무 지루하네요보다가 잘뻔했는데 헝거게임 팬이라 끝까지 참고 봤습니다 
6,보다만느낌 ㅋㅋ... 
5,보다가 cgv의자가 너무 편해서 잤네요 깨니까 미디어 싸움이나 하고 앉아있고 그냥 쭉잘껄 그랬어요 
3,솔찍히 기대이하로 재미없었다....ㅠㅠ완전히 Part 2를 위한 밑밥용영화랄까 ㅋㅋㅋ 
10,걍 평점 보지말고 닥 보세요.그냥 미쳤음.제니퍼로렌스는 그냥 미쳤다.실핏줄 터진걸 연기해.. 
1,캣니스: 모킹제이 하기싫어용..  (주변인 설득) 으헝헝 할께요 (남주랑영상통화 후) 으헝헝 모킹제이 안해ㅠ(남친이 설득) 으헝 알쪄 모킹제이할께 ㅠ (남주랑 영상통화) ㅅㅍ모킹제이 안해  ㅠㅠ (x4번 반복) 알겠...
9,볼만함 파트1인데 끊기신공... 
10,친구랑 영화보면서 감탄하면서 봤다 이런적 첨인데 판타지 영화라 CG가 대박이어서 입이 안다물어짐 
10,"혁명에 별 관심이 없던 캣니스가 혁명의 상징으로 변해가는 과정을 잘 그림. 긴장감이나 감정적인 변화를 중점적으로 그렸기에 1, 2편과 같은 액션을 기대했다면 실망하겠지만 캣니스와 스토리 자체에 몰입한 사람이라면 전혀..."
10,진짜 재미있네요 걔속 보게 되요 
10,짜릿했어요 책으로 본 후 다음 내용을 볼 시간이없어 영화로 대체하려고 본건데 책으로 느끼지못한 쫄깃쫄깃한 긴장감을 느꼈어요. 특히 캐피톨에 진입해 피타와 게일의 생사를 알수없는 그 긴장감이 최고.. 이게 재미없다니 ...
10,니들은 영화볼때 액션신 볼라고보는거냐? 무슨 애들이냐?헝거게임 판엠의 불꽃에서 영화는 4부작 모킹제이는 장편이다 보니 파트로 구성을 나누어서 낸다했는데 대체 뒷북치는애들은 뭐냐 원작이랑 영화랑 비교하면 당연히 영화가...
10,전편을 다 본지라 별로 지루하진 않다 
10,3편은 니들이 기대한 배틀로얄 같은 스토리가 아니라 게임을 시작한 캐피톨에 대항하는 내용이다.단순 액션신만 보지말고 스토리를 봐라. 
6,극장에서 안보길 잘햇다 휴 
9,1편2편 재밌게봐서 전혀 지루하지않게 봤다.파트2랑같이보는것도 좋지만 결말이 어떻게될까 이 조마조마함이 이 영화를 더 사랑하게 만드는것같아요 ㅎ 
10,진짜 영화 안보고 베평때문에 어그로끌린새끼들 평점 낮추려고 OO하는거 보소; 무슨 이게 결말이야 아직 한편더 남았거든; 모르면서 영화도 안 보고 진짜 보다가 화나서 쓴다. 원작 팬인데 1편만 못 만들었지; 진짜 헝거...
10,"여러분, 여행을 가는 것만이 여행은 아닙니다. 여행계획을 세우는 것도 여행의 일부죠. 잘 짜여진 계획은 여행을 더욱 더 풍요롭게 합니다. 저는 계획을 세우는 것만으로도 충분히 즐거웠고 기대감은 더욱 커지고 말았네요...."
3,좀 아쉬운점이 있내요. 
3,지루하네요! 기대이하~ 
10,개인적으로 모킹제이편이 제일 감명깊고 재밌었음. 큰 액션은 없지만 주인공들 감정묘사가  대단하고  반격을 준비하는 모습들이 너무 멋있었음. 
