score,review
3,"배우들의 어색한연기,매끄럽지 못 한 장면전환,재미도 약하고,잔잔한 감동도 없고,야하지도 않고,모든점이 부족한 영화. "
2,진짜 한번도 안하네요 제목처럼 짜증나게 
1,아무내용없는쓰레기같은영화 
5,ㅋㅋ 이 영화 대체 뭘 위한거지 
1,알바들 아부부리지말고 꺼져라 ㅋㅋㅋ 
1,제목자체가 3류ㅋㅋㅋ 
1,나올꺼 같죠.. 안나와요.... 
1,"평생 본 영화중 최악이다,,, "
2,"딱 봐도 섹슈얼 로맨스 코미디 같은데, 야하지도 않고 그렇다고 스토리도 없고, 각 내용마다의 개연성도 부족하고 대체 작품에서 무엇을 말하는지 파악조차 불가능함. 진짜 작품을 만들던가, 아니면 야하기라도 하던가 둘중에..."
1,처음으로 평점을  씁니다.감독 나와!!! 
1,이런걸 찍고 돈내고 보라고 하고 싶냐? 
1,2014년 첫 쓰레기 영화 
1,"맛있는섹스 그리고 사랑,연애의 목적,청춘처럼 화끈하게 야하던가 하녀처럼 그리 야하지않더라도 내용이 있던가 이건 전혀 청불도 아닌데 청불이고 내용도 없고.. "
2,황우슬혜는 발음 연습 안 하나? 혀짧은 걸 매력(?)으로 강하게 어필할 모양? 
1,개쓉노잼 차라리 이시간에 ㅇㄷ보고 ㄸ을 쳐라 황우슬혜 벗지도않음 
1,이건..알바도 반박불가 ㅋㅋ 
1,스토리 엉망. 개연성 엉망. 이런영화는 뭐때문에 만든거에요? 정말 시간이 아까웠습니다. 
1,연기력 어쩌죠 보는내내 불안불안 
1,내가만들어도이거보단.잘만들듯. 
1,제목에 낚여서 봤는데 이건 머... ㅋㅋ 
1,보고잇는거 자체가 시간낭비다. 이러니까 상영관도 없이 개봉ㅂㅂ 햇지. 영상전환 하며 연기하며 스토리하며 걍 독립영화보다도 못함. 대학교 영화동아리가 찍은영화라해도믿을정도로 허접OOO 
1,이게 평점이 3점대? 1점대가 적당하다 
1,유튜브에서 웃긴영상이나 검색할걸 ㅠㅠㅠ 
3,"웃기지도 않고, 야하지도 않고,  그랬다고 의미가 있는것도아니고. "
8,생각없이 보기에 그리 나쁘지 않구만 평점이 넘 낮다 
1,한번도 안해본 여자라는 남자에겐 매우 자극적인 제목에도 불구하고 남자평균 평점이 여자평균 평점보다 더 낮다.  이건 진짜 개 쓰레기 영화라는 것을 증명한다. 
1,감독이나배우나  투자한 제작사나  배급사나  무슨생각인지... 
1,무색 무취(無色無臭) 
1,ㄹ ㅇ 쓰레기 영화 할 말이 없네 아 짜증나 
1,별 반개도 아깝다 도대체 무슨 정신으로 캐스팅한 걸까 한심하네 
10,재미만 있내 평점 어이가 없내!!! 
1,아무리 영화라지만 정서상으로나 말도안되는 스토리네 
1,하시간아까워내눈...내시간... 
1,"돈과 시간이 남아돌아 만든 모양인데, 내 시간이 아까워 못 봐주겠다 "
10,"본인 입맛에 맞는 내용이 아니라서 평점이 낮네;; 사회 비판적 요소도 있고, 여성차별에 대해 드러내 주는 게 좋았습니다. 결말까지 맘에 들었네요. "
10,공감하며 영화 잘 봤어요 
8,아니 뭐 꼭 하는장면이 나와야하나 방금 티비에서 봤는데 재밌더만 조연 배우들 연기가 조금 어색해도 영화관가서 충분히 돈 지불하고 볼만한데 야한거 안나온다고 말이많네 ㅋㅋㅋㅋ 개인적으로 재밌게 봤습니다~ 
7,이건 어쩌면 남자보다 여자를 위한 영화가 아닐까 싶다. 
8,볼만한영화입니다. 꼭 
1,이런걸 영화라고 하냐 걍 쓰레기지 
1,영화 시작 10분이 지나자 응사의 정우가 떠올려진다.... 영화가 끝나면 모든 관객 이 응사의 정우 이름을 되새긴다 
1,배우들이라도 좀 순수하게 생긴 애들을 쓰던가... 
5,제목은 화끈 내용은 민망? 
10,ㅋ평일에 집에서 영화채널에서봤는데 처음부터얼떨결에봣는데 볼만하네요 ㅋㅋ 내용이ㅋ웃긴것도잇구요 
7,난 남자임에도 불구하고 공감도 가고 한번쯤 생각해봐야만 하는 대사들이 많이 나오던데. 연기자들 연기도 나쁘지않고. 제목보고 꼬리한거 기대하고 간놈들 꼬라지 하고는 댓글보니 알겠다. 니들이나 극장 가지마라 3류 양아치...
10,난 기대안하고봐서 그런지 재밋엇음♥♥ 난여잔데도 두여자매력잇다 여자입에서 나오는 성에대해 솔직한 발언 너므재밋엇다 
10,화질이 좀 안습이였지만 타임 킬링 용으로 괜찮은 영화였다 까는 놈들 뭘 보고 까는건지 단 한줌의 오바도 없는 담백하고 엉성한 부분도 드문 나름의 스타일로 꽉 짜여져 잘 만들어진 영화구만 볼 줄 모르네 뭐가 있어야만 ...
8,페미니즘 영화. 완벽하진 않아도 가까운 거리감 
10,여자들의 성에 대한 솔직한 생각으로 표현한 영화로  재밌게 봤네요 ㅋㅋ 
2,비디오대여점이 없으니~~~ 
1,돈내고 보면 땅을 치고 후회함 진심임 
1,아... 47분봤는데 진심 재미없다... 뭘 보여주고 싶은거냐 
1,아놔 영화 영자도 모르는 내가 만들어도 이것보단 낫겠다. ^^; 이런거 만들거면 안 만드니보다 못한거야. 좀 한국 영화 수준 후퇴 시키지 좀 말자... 
1,ㅎㅎ 캐스팅부터가 말이 안 된다. 좌쥐까까?ㅋㅋ 로 유명한 황우슬혜를 한번도 안 해본 여자로 캐스팅하다니ㅎㅎ  이미지가 엉망이잖아. 
10,"평점안좋은이유알겠네 야한거 안나오지, 창놈짓하고 성희롱하고 뇌물주고 스토킹하는 남자들은 죄다 좆되고, 여자중심으로 나오고ㅋㅋ여자들은 노콘노섹 외치고 남자들 ㅂㅅ같은 판타지 욕하고ㅋㅋ못생긴 남자한테 이입좀 해보려니 찐..."
2,성형은 많이 한 여자.. 
10,헐 평점들 다 왜그래?? 다들 어린관객들만 모였나.. 남자들은 다른 관점을보고 환상에 미치지 못하니 평점을 낮게 준거 같음;; 
10,평점 낮은 이유 : 야한 것만 원한 사람들이 평점 낮게줌. 평균적으로 남자들보단 여자들에게 유익하고 재미있을 것 같음. 시대를 앞질러간듯... 지금 나왔으면 좋았을 영화. 
1,이것도 영화라고... 
1,평점 자체가 우습다는 생각 연기도 연기지만.. 스토리도 진부하고 그스토리를 가지고 만든 감독도 한심하다.. 
2,웃기지도 안코 야하지도 안코  3류들이  모여 만든 3류영화 
1,제목만 자극적이고 하나도 안야할것같음 ~~~~ 
5,황우슬혜 팬인데 기대하고 봤더니 그런거 전혀 없다. 
8,뻔한 내용이지만 배우분들이 귀엽고 공감되는 내용도 있어서 킬링타임용으로 잘 봤어요 
8,밤에 보기엔 심심풀이로 괜찮은데.. 
10,황우슬혜님의 연기는 아쉬웠으나 사회에 깔린 미소지니를 표현하여 드러내준 점은 좋았습니다. 정말 하이퍼리얼리즘이 따로 없네요. 현실도 결말과 같았으면. 
1,"고등학생들이 만든 영화보다 못할꺼같은데...야하지도 않고, 재밌지도 않고, 감동도 없고, 무언가 임팩트도 없고...관객을 무시하는 듯한 영화 "
7,사희 팬이라서 봤는데 난 괜찮던데 근데 영화 내내 발음이 부정확해서 뭐라고 하는지 못 알아들었네! 그래도 영화는 그런대로 유쾌하던데 
6,그냥 가볍게 만든거같은데 그래두 재밋던데?!솔직히 극장에서 보기엔 그렇구 구냥 b급과 c급사이?!근데 잼씀!! 
1,ㅋㅋㅋ영화제목이 아다 
10,잼있드만 뭐가 나오길 바라고 쳐 보니까 재미가 없지 저질들 
3,야하기라도 했으면 에휴.... 왜 19금이냐?ㅋㅋㅋㅋ 
8,질투하면 어떻게 되지^^? 
1,뭘얘기하고싶은 영화인가요? 
1,별도아깝움드럽게잼때가리읎음 돈만아까움OOO영화왜만듬?더랏나 아짜증나 
1,무슨말이 더 필요할까나... 
3,시덥잖은 이야기면 웃기기라도 했어야지 
3,황우슬혜의 어수룩한 매력의 캐릭터가 중심을 잡고있지만 맨 처음 콘셉트와는 전혀 무관한 방향으로 흘러가는 애매모호한 전개 
1,왜 한번도 안하냐 19라봤는데 
1,시간버리고 돈아까운 영화 
1,진심으로 전기세가 아까웠다!!! 
10,재미 NO! 감동 NO! 허나 10점을 주는 이유는 사희라는 배우 때문에ㅎ 얼굴 몸매 다 이쁨ㅎ 연기도 연기지만 본인의 몸매를 더욱더 드러내도 좋을 듯 요즘엔 벗는 연기도 하나의 능력이라 생각함 스토리좋고 적당한 노...
1,이따구 영화를 왜 만드는겨? 
1,한마디로 최악입니다. 
2,한마디로 '재미없다' 입니다! 
3,와....이런걸 영화라고 만들었나. 
1,시사회 보고 나온 사람들이 다들 욕한 영화. 10점 주는 알바는 정말 이 영화를 한 번이라도 끝까지 봤다면 양심적으로 못 줄 거임... 영화 보고 이렇게 격하게 분노하기는 처음. 
2,감독이 누군지정말 궁금함 배경이며 캐릭터며 옛날틱하고 시간아깝고 돈 아깝고 제목만자극적이면 다인가 
1,아멘....;;;; 
1,황우슬혜 연기는 절망적 
5,그저 잔잔한 스토리일뿐 
1,한년들 피싸개들 흑인 깜댕이 마냥 흑두 수준이라 가슴도 못까노ㅉ 
8,난 재밌었는데 오락용으로 앵간 근데 김진우는 왜나온건지 모르겠음 살짝 유치한것도있고 여주 두분다 여신 개예쁘다 
2,"학생 단편영화도 아니고, 영화 초반서부터 조리개 노출오버로 허옇게 뜬 촬영을 볼줄이야... "
7,그런데로 시간 때우기 용. 
2,심심하고 별맛도 없고 그저그런 따분한 영화 
3,"발칙하지도 웃기지도 않은,  억지스런 작품이지만 사희의 매력만큼은 넘친다 "
4,"도전적인 19금 코미디가 될 수 있을 소재인데, 영화는 뻔한 내용에 지루한 개그들만 늘어놓는다. "
4,종합 평점은 4점 드립니다. 
1,이런쓰레기는 도대체 왜만든것임 
6,코미디로 볼 만한다... 
8,재밋구만 나만 그런거여 ? ;; 
3,감독 이런 영화로 인기끌줄 알았나 어차피 망할게 뻔히 보이는데 왜 이딴영화만드냐 
4,진짜 그저그렇네요..개봉작인거같은데.ㅋㅋ실망. 
1,알 수 없는 영화....!! 
3,시간 떼우기용으로도 별로였던 영화. 
1,역시 안해본여자보단 해본여자다 
1,10자이상 작성하기도 아까운영화 그러나 1점을주려면 어쩔수없음 
5,아니 재미도없고 감동도 없으면 야하기라도해야지! 이런 쓰레기같은.. 
1,할 말이 없다. 뭔 생각으로 만든거지? 
1,헐랭 .. 한마디하고싶자는~~~~ 
4,지금 말하기에는 너무 낡았어. 
4,전형적인 b급 영화 .. ㅋㅋ 
1,반점 해장국 반점 열자이상 등록 
3,성에 대한 호기심을 자극하는 제목과는 따로 노는 내용과 전개 
1,아버지가 돌아가셨는데....이야~이건뭐   참....이영화  정체를밝켜라!!!! 
1,아.. 평점 1점 드리고 갑니다 아..물론 영화는 안봤습니다 한번도 안해본 여자라는 제목은..SF물보다도 현실성이 없군요..차라리 촉수괴물 나오고 킹콩이나와서 건물을 때려부수는것이 현실성 있겠습니다...그럼이만 
1,스토리라인 자체도 별로 맘에 안드는데다 배우들 연기가 너무개판이라 도저히 볼수가 없어서 꺼버렸다.. 황우슬혜 연기 정말 안느는구나 싶었다. 
2,이야기의 주제랑 너무 많이 벗어난 것 같다. 
1,평점 보고 볼껄~ 시간 아깝 ㅠㅠ 
2,두여배우도 배역에 안맞아 보이고 제목만 자극적인 평범이하 
1,아.... 너무하네요.... 대학생 졸업작품 보는 기분이었습니다.. 
4,충무로의 유망주였던 황우슬혜가 어쩌다...영화 전체적으로 붕 떠 있다. 
1,1점도 아깝습니다.. 공감좀.. 
1,아진짜 시간아깝다 ㅜ.. 
1,오랜만에 와이프랑봤는데 스토리...연기...참 없다 
2,황우슬혜 이뻐서 1점. 사희 섹시해서 1점 
4,황우슬혜 연기는 괜찮은데 발음때문인지 나레이션이 어색함 본인이 발음 안좋은거 잘 아니까 연습 많이해서 담엔 자연슬혜 발음하길 
1,쯧쯧. ..   W..GGGG 
2,난감한영화 낚여서봤는데 내가낚여서봤다니 죄송합니다 
1,조선마술사와 박빙인 영화 
2,재미도 없고 내용도 없는데 100분이나 됩니까.. 사희때문에 2점 줍니다. 
1,재미없다.쓰래기다우리집강아지가똥싸는것봐도 이것보단 재미있고감동있고의미있을듯 
3,진짜 한번을 안하네 한번을. 마지막엔 걍 끝나고 
10,유치하지만 유치한재미가있어요. 
1,"재미없음 주연배우 떡신이라도 많이 나오던가,,엑스트라 벗는거밖에 없네 "
10,그냥올려봤다...긑까지볼수있을까. 
2,슬혜씨.. 벗으려면 제대로.. 
7,생각보단 괜찮은거같다 
3,장르가 먼지도 모르겠구 황우슬혜 몸을 너무 아껴서 아쉽네 
1,제목과 다르게 해본여자 같은데? 
4,괜스레 마음이 무거워진다.. 이 영화 정말 뜬금없다. 
6,그럭저럭 볼만한데 냉정한 노답알바 섀키들 플랜맨에 다몰린듯..황우슬혜 친구 개꼴리게 생겼네 박음직스럽다..근데 이거 솔직히 극장서 돈내고 볼 수준까진 아님 
1,황우슬혜는 안벗고 사희만 가슴노출 있네. 
1,배우들의 어색한연기와.. 미흡한연출력 
1,도대체투자자들이 뭘보고투자한거지미스테리영화다 
7,생각보다 볼만합니다. 남자의 성적판타지와 여자의 사랑받고싶은판타지의 교집합이 ㅅㅅ다. 진부하지만 영화상영시간동안 앉아있을 수 있음 
1,안해보긴ㅋㅋ.  배우를 택할때 부터 잘못 택한듯. 그냥 일반 고등학교에 가서 인문계에 공부만 하는 애들로만 출연시켜라.ㅋㅋ.. 진짜 어의없네요. 
10,염소랑나왔을때보다 더안나오네 조여정은진짜 여신이네 이건뭐라고 슴가도안까고 날로먹을라고 그러니이런영화나찍지 이건뭐 3류 비디오 영화보다도못하네 느낌괜찮은데 왜이런영화찍는지 이해가안가네 
10,너그들이원하는 사희노출 1초정도 상체만 나온다 다운결정하기전에 참고하길 
3,사희를 연애고수 케릭터에 캐스팅한 예고편 보고 아 망하겠구나 바로 감 오더구만. 연애고수 케릭터인데 연기 톤이랑 표정은 롤러코스터에서 착한 여자 연기 할때랑 100% 일치된 연기...ㅠㅠ 연애고수 역 맡을만한 배우 ...
4,제목부터 좀 말이 안되기는 했지만 로맨틱코매디를 생각하고 갔는데 웃음코드도 로맨틱도 에로도 모두 뭔가 부족한 밍밍한 영화였다. 
1,깔끔하게 1점드립니다. 0점없는게 아쉽네요. 
1,단순히 아이디어 만으로 영화를 만든듯 
3,우슬혜의 인조얼굴 만큼이나 어색한 안경이 보는내내 신경쓰였다... 
3,졸작도 이런 졸작이 없다. 
8,적당히 재밌음.. 아주 오랜만에 별 생각없이 유쾌하게 봄~ 
5,감독도 배우들도 고생이 많았다. 채널CGV에서 틀어주는 것 그냥저냥 볼만 했음. 돈주고 보면 아까웠을 듯. 
4,"제목보고 설렜는데.., 안나오네.. "
1,오민석씨. 내일 봅시다. 
6,"황우슬혜너무귀엽고, 자극적이지않고 편하게보기좋았어요. 스토리는 별로~ㅜㅜ 매끄럽지도 않고.. 병맛;;; "
1,내용도 없고 느낌도 없고 공기같은 영화 
1,이런 변태같은 스토리는 흥행하기 힘들다 이딴내용으로 인기끌려고 했나 
6,아다 말희와 OO 세영의  짝짜꿍 찍짓기 프로젝트? 
5,음~음~음~ 뭔 야그를 하고 싶은거쥐? 
1,평점보다 더 구리다... 만든 목적이 뭘까? 한번도 안해본 사람이 언제부터 흉이었지? 
2,촬영 장면등이 싸구려 영화같은 느낌이 난다랄까... 비디오캠으로 찍었나.. 
1,"정말 이러시면 안되는거잖아요.. ─━,,──━ㆀ "
7,꽤 재밋게 봣어요 제 기준에선 쪼끔 야햇엇어요...제가 이런건 거의 안 보거든요...결혼전야보다 덜 야햇던것같아요... 
4,배우가 아까운 영화. 진부할진 모르겠지만 나름 색깔있는 캐릭터들인데 필름이 망쳐놓은 케이스. 웃기지도 야하지도 않은 흐리멍텅 스토리. 정말 말도 안되는 전개는 이 영화를 봐야만 느낄수있다. 올해 최악의 영화로 남을듯...
5,사희보고 목소리나 얼굴이 윤해영이랑 너무 비슷해 놀랐다. 
4,이런류의 로코는 꽤나 흔하지만 잘만만들면 항상 재밌는데.. 이상하게 한국로코는 톤을 잘못잡는것 같다.. 
4,마지막에 그 장면 뭐임? 
4,거시기한 영화다 ..ㅡ 
2,우리 슬혜는 일주일에 대략 두번*50*25년이면 몇번했을까? 
1,영화는 잡탕 같이 만들면 안 좋음. 
1,영화보다 짜증난적 처음 
2,스토리가 매끄럽지 못하고 야한걸로 확 가던지 재미로 확 가던지 이건 뭐 어중간 노야함 노잼 
1,시간의 소중함을 느끼게해주는 영화 
1,너무저질.여자들이보기기분나쁜영화.  연기력저질 
1,어떻게 이런 영화 만드는 사람이 감독을 하지 
6,진짜 한번도 안해본 여자가 있을까?.. 궁금증을 유발시켰던 제목이었다..^^ 여기서 나온 주인공같이 여린 여자에게 진정한 사랑은 언제쯤 다가올까? 섹스와 사랑은 별개인가 여자로써 여러가지 생각하게되는 영화였다 
10,10대 평점 봐봐. ㅋㅋ 
5,1점 주고 그런 애들은 뭐지? 그냥 가볍게 보기 괜찮은데... 
5,90년대 말 2003년 이전에 나왔으면 좋았을 것을 . 
3,그래서 ㅅㄱ가 나옵니까 안 나옵니까? 
1,화가나더라고요...황우슬혜는 귀여워요... 
7,난 재밌게봤음 황우슬예 존예 
10,"여배우들은 괜찮고 매력도 있는데,남배우들의 어색한 연기와 여배우에비해 조금 떨어지는  인지도와 외모가 안타깝다.. "
7,가볍게보기에 나쁘지않았어요. 주인공이 황우슬혜인데 사희가 더 돋보이더라고요. 황우슬혜연기너무 못해서 ㅡㅡ 
6,이 영화가 말하고자 하는건 무엇인가요 ? 살짝 붕떠 있네요 
10,이런류의 로코는 처음이다....그다지 로코를 좋아 하진 않지만...마음 편안히 가벼운 느낌으로 소소하게 미소 지을수 있는 영화 였다 
1,누구를 위해 만든영화? 한번도 안해본 여자가 없는데 
4,제덤수는요 4점입니다 
1,우앙!! 이영화 짱짱맨~!! 
1,엄청잘주는여자가 주연이라 캐릭터에 집중이안됨 
1,내용이 없는 영화입니다. 
1,안벗을거면 신성한 B급영화 모독하지 마라 ㅗ 
10,27분 5초부터 15초까지 보면 됨 
10,황아진바보천재잘생겼다 
10,나름 재밌어여머랄까 솔직히 이런분류의 영화는 처음 인지라~ 신선하기도하구ㅋㅋ 
10,유쾌하게 웃으면서 보기에 좋습니다. 
7,공감되는 내용이었다. 그러나 작품성은 좀 부족한 듯 
8,솔직히 기대안하고 봐서 그런지 볼만 했습니다...사희 너무 이뻐요~! 
8,나이 오십대...예날 생각 나게 만드는 영화..부담없이 볼 만하다... 
10,좋은영화 좋은머리 네이버에 도쿄랜드 놀러오세요`~~ 
10,그럭 저럭 볼만한 성인 로코 
8,기분이 막 좋아지든데 황우슬혜화이팅 
4,30대 중반 아무도 안 찾는 노처녀들의 발악하는 코미디 
1,티비에서 하길래 우연히 봤는데 10년전 영환줄 알았다. 재미가 없으면 화끈하게 야하기 라도 하던가.. 
8,나름 그런대로 괜찮은데?? 보아하니 노출안했다 징징대는것들이 1점주네. 
10,개인적으로 너무 따뜻한 영화였습니다. 잘봤습니다~^^ 
10,99분이 지루하지 않게 사랑과 유머가 있어요. 
9,"로멘틱 코미디   코미디물  이지만   인간의  이중적모습이나,대한민국  의  성 담론을  풍자적으로  재밌게 풀어간 게  좋습니다~배우들의  연기가  더  좋았으면 하고  생각 합니다~아무쪼록  더 많은상영관에서 ..."
10,볼만해요 킬링타임으로 보기에 잼있어요~~~ㅎㅎ 
10,그냥  볼만한느낌..ㅋ..ㅅㅎ 
10,역시 황우슬혜 황우슬혜 허허 귀엽고 깜찍하고 굳이 무언가를 하지 않아도 참 매력적인 배우죠 하하 그리고 사희가 옆에서 굳건하게 섹시미를 뽐내기에 잘 어우러지지 않나 생각됩니다。아주 유쾌하고 코믹한 로맨틱코미디 영화입...
10,영화를 아직 보진 않았다. 하지만 평점무시하고 일단 보련다.. 황우슬혜를 보기 위해서 
8,뭐 킬링 타임으로는 괜찮을듯!나름 웃기기도 하고. 실짝공김도 되고마지막 범인은 정말웃김 ㅋㅋ 
10,내용은 누구나 공감할만한... 저도 한번도 안해본 여자 만나보고 싶네요ㅎㅎ 
8,전 재밋게봣어여 ㅋㅋ 심심할때 볼만해요 
10,종전의 영화의 판도를 깬 영화 참신한 도전 죽여줍니다 
10,창원에서 촬영했다던데 지역색이 잘 나타났으면 더 좋았을거 같네요. 좀 더 다큐 느낌으로 갔으면 어땠을까 싶기도 해요. 여튼 화이팅 하세요~ ^^ 
10,황우슬혜 연기 정말 잘하네요! 근데 영화 주제나 스토리가 너무 진부했던거같아요. 황우슬혜 잘됐으면 좋겠어요!! 
10,여친하고 보고왔는데 잼있게 잘봤네요 
10,즐길수 있는 영화다 기대보단 생각하게 만든영화일까? 
10,좋네요ㅎ  남자들이보면 좋아할만한 영화네요ㅎ 
