score,review
10,세상은 아름답지 않아. 흑백만큼 우울해. 시간이 정지되고 크지 않는 게 좋아. 단절된 피아노 음들이 눈물이 날 때까지 꾹꾹 눌러. 제발 싸우지 말란 말야... 
10,FIN 이 뜨는순간 너무나도 가슴아팠다...어린아이들의 순수함 
10,전쟁속의 아이들의 순수. 너무나 잔인한 아이들의 순수 
10,안타깝고 그리운 아날로그의 강렬한 추억 영화역사상 영원한 명작 
10,지금까지 봤던 영화 중 가장 가슴 저미는 엔딩. 먹먹하다. 아이들의 눈으로 전쟁의 참혹함을 고발. OST 보너스. 
10,지금도 줄거리 읽고 어릴적 이 영화 봤던 생각이 나 눈물이 흘러요. 영화음악으로 더 유명하죠. 여주인공이 커서 라붐에서 소피마르소 엄마역을 했군요.  이제 알고 너무 기쁘네요. 
10,"마지막에 미셀을부르며 인파속으로 사라지는폴레트, 그장면에서 전쟁의참혹함을느꼈다 "
10,내 인생 영화중에 이렇게 감정이입이 된 영화는 이 영화가 처음이다 폴레트의 마지막 장면 정말 걱정이 되서 잠이 안 왔다 
10,"이 꼬마여배우가  나중에 라붐의 소피마르소 엄마역, 시네마천국의 중년의 엘레나역.. 헐.. "
6,그건 사랑이었을까.! 
10,로망스 선율과 함께 순수한 아이들의 사랑이 아름답다. 
10,전쟁과 죽음을 통해 자신들만의 방식으로 이별을 채득하고 배워가는 아이들.. 우리가 순수라고 말하는 아이들의 천진함의 섬짓한 이면을 보여주는 것 같기도 하고... 암튼 기억에 남을 영화다. 헌데 왜 난 자꾸 천공의 성...
10,아이들의 순수함은 전쟁으로도 해칠 수 없다. 엔딩씬은 왤케 적적한거지? 
9,이 모든 아이러니는 뛰쳐나간 OOO로부터 비롯되었다.ㅜ 
9,아..마지막장면 너무 가슴아프고 슬프다. 
10,뽈레뜨를 데리고간후 바뀐장면에서...고양이를 앉은 한여인이 나온다...혼자 상상했었지.. 뽈레뜨가커서  다시  미쉘을 찾는것이길... 그러나... ㅜㅜ 
9,잔인한 전쟁.서로 헐뜯고 싸우는 어른들.그 속에서 피어난 소년과 소녀의 순수한 사랑.어른들이 더 유치해 보이는 아이러니가 재미있다.어른들 눈에는 장난일지는 모르지만 아이들은 진심이었다. 
7,Forbidden Games 
7,순수했기에 씁쓸하고 슬픈 로망스 
8,잔잔하게 마음을 울린다 
8,다소 충격적 이야기 전개가 불편하지만... 
10,아름답고 슬프다 
10,아름다운 첫사랑 
10,예쁘고 슬픈.. 꼭 보시기 바래요. 
10,이 영화 다시 한번 안해주나? 
8,전쟁 속 아이들의 순수함과 이웃간의 불화. 어디든 사람 사는 곳은 다 비슷하구나. 
6,초반부분눈물살짝어린아이들의순수한마음좋았다근데내용이십자가훔치고뽑고허접하다 
10,가슴 한켠에 저린 아픔을 묻은 그대에게 내일은 빛이 있어라 
5,로망스의 원조를 마음껏 감상할수있는 기회 
10,전쟁의 아픔을 시적언어로 승화시킨 명작! 반세기가 지나도 고스란히 전달되는 감동! 
10,지금 비디오 가게로 달려가서 이것을 빌리고 아무도없는 방에서 보아라 
10,진짜좋은영화=U=조르주푸줄리라는 사람이영화에서 귀엽게 나오든데.. 
10,아가들이 불어하면 꼭 옹알이 같다 아무튼... 쉽게 여운이 떨쳐지지 않는 영화네요. 
10,아 이영화를 이제 어디서얻는단말인가!! 
6,자신만의 세계를 만드는 단순한 장난인데.. 단지 기독교의 조금만 따라했을 뿐인데 
10,"'미셸 미셸' 단지 이름을 부르는 것만으로 가장 많은 이의 심금을 울린 영화, "
7,로망스 음률과 아이의 목소리가 애절하게 맴돈다. 
9,귀여운 두아이의 사랑이야기. 환장하다 마지막에 숙연해지는 무엇이 있다. 아 슬퍼라. 
10,어린시절 [미쉘]을 한없이 외치던 모습이 그리 슬프던지..... 
8,전쟁의 비극을 아이들의 순수로.... 
10,뭉클.. 
10,전쟁 속에서도 피어나는 순수한 사랑.. 
8,"소박한 반전영화, 프랑스나 우리 6,25나 전쟁나면 똑같구나 "
7,생각보단 뒤끝있네요 
10,"재밋다, "
10,"결국은 주제가 ""어른들은 못됬다""인것 같습니다많은 여운을 남기는 영화였습니다 "
10,마지막 장면이 영화를 살린다.. 두 아이의 순수한 사랑.. 여운을 남기는 프랑스영화.. 
8,"전쟁을 일으킨 세대, 결국 치유하려는 아이들에게 배신과 이름표를.. "
8,마지막 장면에서 아이의 간절한 외침이 마음을 적신다. 
10,잘 만든 영화...웰메이드란 말 쓰지 마라.. 
10,노래도좋고내용도잔잔해서좋았던영화 
10,어렸을 때 정말 감동적으로 본 영화에요. ost가 진짜 영화와 잘 어울리는듯 
10,미쉘 미쉘... 잊을수없는 긴 여운.. 
8,제목만으로도 가슴이 아려오는 웰메이드 영화 
9,무지 어렸을적에 봤었던.. OST인 '로망스'가 아직도 기억난다. 
10,내가 제일 좋아하는 영화... 기타 소리가 귓가에 맴돈다 
10, 어렸을때 EBS에 전화해서 틀어달라고 했더니 틀어줬었는데 
10,브리지트 포시(소녀 폴레트) -라붐에서 소피 마르소 엄마 역으로 나옴 
10,어릴때봤던 정말 감명깊은 영화 
8,추악한 전쟁속에서 피어난 순수한 소년소녀의 이야기 
8,천진한 것들이 남기는 애잔한 긴 여운. 
10,어릴 때 봤던 최고의 명작. 
10,전쟁의 아픔을 그린 명작중에 명작... 
7,애기때 부터 브리즈트 포시의 연기는 인정 
10,명화의 고전..프랑스 영화다운 결말도 좋고.. 
10,가슴이 너무 아파요...ㅜㅜ 
10,철없는 아이들의 금지된 장난 아쉽고도 슬픈 이별. 
10,마음의 준비가 된상태에서 보길~ 
9,천진함은 얼마나 무서운가? 
10,봐야하는 영화 
10,미셀 미셀 하고 부르던 뽈레뜨의 목소리가 잊혀지지 않는다. 
10,best of the best 음악까지 완벽.. 
10,마지막장면 넘 슬프다. 
10,영화란 긴여운이 남는것 감독은 일찍부터 알고있었나보다. 
10,국민학생때 본이후 4번이상 본 영화입니다.완벽한영화입니다 
10,금지된 장난은 누가 한 건가? 그 서글픈 상황을 만든 전쟁이.. 
7,아이의 순수가 사회의 공포가 되는 시점을 아이의 눈으로 
10,처음 보시는 분은 더빙판으로 보세요 
9,현실 속 실제 감성을 자극하는 영화들이 지금은 없다 
10,"아이들의 장난이 어른들의 전쟁보다 낫다, "
8,아무리 나쁜짓이 였어도 아이들을 비난할수는 없을것이다 
10,예전 영화가 정말 최고의영화가 많다.. 
10,아이들의 순수한 눈동자에 어린 슬픔이 가슴아프다. 
8,전쟁의 아픔이 느껴지는 영화 
9,"신비한 영화. 미움과 사랑, 무지, 가난, 파괴가 함께하는 영화. "
10,dd 
10,"나도 어린 나이에 본 영화라, 더욱 감명 깊었던, "
10,휴지한통을 다썼던 영화..ㅜㅜ 
10,아이들의 순수한 마음이 맘에드네요 
10,사랑을 뛰어넘는 아이들의 순수한 마음. 
8,소년은 소녀를 사랑했으나 소녀는 소년을 사랑했을까? 차라리 떠난 것이.. 
9,미셸~~미셸~~ 
9,미셀을 부르던 뽈레뜨의 목소리가 긴 여운을 남긴다. 
10,가을동화 분명히 여기서 모티브 따왔다 
5,전쟁과는 상관없는 동심을 말하려 한것인지... 귀여운 아이들때문에 그나마 1점 안준다. 
9,이건 꼭 추천 관람이다. 흑백영화시절 기억나는 영화의 진리. 
5,OST 좋지만 너무 남발한다.. 집중도를 떨어뜨릴 정도. 
10,전쟁에 관한 최고의 영화 
10,"전쟁이란 이런 것, 사랑이란 이런 것... 인생이란 이런 것... "
1,흐흐흐흐스흐흐그흐흫그ㅡㄱ흐흐흫 하나도 안슬퍼 
3,여자는 자기 부모의 목숨보다 자기 개의 목숨을 더 소중히여긴? 
1,쉰내 나는 옛날 영화.. 
1,빵점준다. 과대평가된 영화. 
