score,review
10,바람과 함께 사라지다 치면 한국영화가 먼저 뜨는거 짜증난다-_- 
10,이 영화가 과대평가된 영화라는건 뭐지. 1939년 제작 1940년 미국 개봉.인플레이션 감안 역대 압도적 흥행 1위.73년이 지난 지금도 공감가는 명대사들과 확실한 교훈.4시간의 긴 런타임동안 조금의 지루함도 느껴지...
10,오래된 영화인데도 불구하고 몇 번을 다시봐도 재미있고 더 잘 이해하게된다. 장 시간의 영화임에도 몰입되며 완성도가 높다. 시대를 띄어넘는 최고의 걸작. 
10,"미국판 토지라고 보면 됨. 영화역사상 가장 위대할만하다. 지금봐도 4시간동안 지루한 장면이 하나도 없다. 주조연 모두 다 나오는 장면,대사,스케일,연출력. 다 사랑스럽고 이쁘고 재밌다. 역대 1위 영화답다. "
10,태어나기 일년전의영화. 도도한 오하라와 당당한 레트 버틀러의 조화가 아름답다. 버틀러의 구애를 밀어낸다. 그러나 모든것을 잃고 버틀러에게 돌아가려하지만 너무늦은 오하라. 하지만 포기하지않고 내일은내일의태양이뜬다고 말...
10,정말 대단하고 위대한 영화다 절대 패배를 인정 하지않고 내일을 두려워하지 않으며 어떤 상황에서도 희망으로 가득채우는 여주인공 스토리와 연출에서 전혀 진부함을 찾아볼수 없고 고전 명작의 위풍을 제대로보여준 영화 . 
10,내 생에 가장 심난한 영화. 심난한 지금 이렇게 스케일 큰 심난함을 보니 지금 나의 힘듦이 아무것도 아닌 것 처럼 느껴지기도 하고. 너무 많은 인물이 쉽게 죽어나가니 인생이란게 허무하게 느껴지기도 한다. 4시간 내내...
10,"이 작품의 가장 큰 매력은 한치 앞을 볼수 없는 스토리다, 놀랍다75년전 이야기란 사실이... 남자의 오만함도 여자의 당당함도 치명적이다 그들의 내일은 헤피엔딩 이었길 바라면서 ^^ "
10,진짜로 명작인것같다 그리고 비비안리는 놀랍정도로 예쁘다 
10,유모는 향단이와 방자를 합친것보다 강력했다 
10,고전만 보게 되는 계기가 되었다. 
10,고전의 의미란 '겪어야 하는데 바빠서 겪지 못하는 것'이라든데 과연 맞다 싶습니다. 이전부터 봐오고 싶었지만 못본 영화였는데 역시 걸작이더군요. 비비안 리의 아름다운 외모도  단연 돋보이지만 절절한 스...
10,비비안리가 정말 매력적인 영화. 영화에 너무 잘 어울려요^^ 
10,"정말 재밌다... 1930년대에 우리나라는 일제강점기 시절에 이렇게 높은 퀄리티의 영화를 만들다니... 비록 여주인공의 성격이 잔인할정도로 이해타산적이지만,,, 그것도 살아남기 위해서 어쩔수 없는 선택이지 않나? "
10,"비비안 리가 아닌 스칼렛 오하라는 상상이 가지 않고, 또 있어서도 안된다.비비안 리는 그냥 스칼렛 오하라 그 자체였다. "
9,39년도 영화의 여주인공이 2016년 한국 영화들 속 여성 인물들보다 입체적이라니.. 
10,지금 상영하는 영화들 보다 싼 가격에 봤지만 가치는 그 이상이였습니다. 
10,금수저를 물고 태어났지만 격동의 시대를 보내며 평지풍파를 겪은 철없던 소녀가 강철의 여인으로 다시금 태어나는 모습이 매우 흥미롭다. 다소 긴 영화이긴 하지만 등장인물들이 모두 매력적이고 이야기도 훌륭하다 
8,비비안 리는 여배우가 되기 위해 태어난 여자 같다 
10,"이런거 처음쓴다.... 영화가 끝나고,소름이 돋았다 고전영화... 80년대 영화도 구닥다리라고 안봤었는데 부끄럽다 "
10,간혹 꺼내어 볼 소장용 영화임이 분명하다.이미 50년 전 세상을 떠난 게이블을 사랑하게 되었다.스칼렛 이런 매력있는 여자를 보았나.. 긴 시간 동안 보는 내내 귀여워를 연발했다능..내 생애 최고의 영화! 
10,네이버 검색할때 한국영화 졸작들이 대작들 보다 먼저 나오는거 엄청 짜증난다. 
10,"고전영화중 나에게는 사운드오브뮤직, 왕과나와 함께 최고. 의외로 코믹적인 부분도 많고 4시간에 가까운 러닝타임 내내 재미있게 또는 안탑갑게 볼 수 있는 수작. 내일의 태양이 떠오르더라도 후회할 일은 하지말고 옆에 있..."
10,내 십대시절부터 쭈욱 마음한켠에 자리잡고 있는 영화. 스칼렛의 마지막 울부짖음이 내내 마음속에 남아 며칠밤 잠을 못 이뤘던 기억이... 
7,"늦은 깨닳음은 떠난 기차, 레트같이 멋진남자를 제때 알아보지못한 스칼렛의 해태눈깔 "
10,한때 현재 영화 시스템으로 리메이크를 못하는 영화라고 해서 진자로 봤는데 이건 리메이크 하면 큰일난다. 
10,2013년이 코앞인 지금 봐도.. 이 영화 보다 나은 영화가 없다는게 문제다. 발전한거라곤 cg 뿐인게 현실. 리메이크 하나 나오길 바란다. 
10,내가 평가할 수 있는 영환가... 
10,"노래에 거장이 있듯이 (힙합계 대부 스눕독 처럼) 이 영화는 영화계의 거장이 아닐까 생각된다. 영화의 시초는 아니지만, 장르 상관없이 21세기 모든 영화들의 근본이라고 해도 과언이 아닐 정도. "
10,폐허가 된 타라를 다시 일으키기 위해 필사적인 스칼렛 오하라의 모습에 625 전쟁 후 한국인들이 많이 감동했었지. 하지만 그러다 스칼렛이 맛이 가는데 지금 딱 한국이 그 단계인 것 같음. 
10,런닝타임이 긴 영화를 별로 안 좋아하는 편인데 이건 긴 줄도 모르고 봤다.. 정말 최고의 영화 
10,★ 내가 다시 본 횟수만 100번이 넘을 것. 내가 본 영화중에서 지구상 최고의 로맨스 명작 
10,젤 사랑하는영화이자 존경스런 영화 
10,명작이다. 대서사시. 
10,긴 런닝타임임에도 전혀 지루하지 않은 대명작. 그 당시 배우 비비안 리의 아름다운 외모와 질투여린 연기에 한번 빠져보시라. 
10,10번 넘게봤는데도 안질린다벤허와 더불어 세계최고명작 
10,말이 필요없는 명작. 처음엔 비비안리의 외모에 빠져보다 대사 하나하나 참 와닿는 영화. 
10,소설도 영화도 제일 최고.. 
10,한 영화평론가가 얘기한게 생각난다..모든영화는 두가지로 구분된다..바람과함께사라지다와 나머지라고..보고나면 정말 그말에 공감..미국은 80년전 이런영화를 만들었지만 우리나라는 지금도 흉내조차 낼수없는 명작중의 명작이...
10,우와 내생의 최고의 영화당 
10,역사상 가장 훌륭한 영화다! 
10,"내 인생 최고의 영화... 소설에 빠진 뒤 영화에 엄청난 기대를 걸고 봤는데, 그 기대 이상의 것을 내게 전해준 너무나도 훌륭한 영화 "
10,렛 버틀러 같은 남자 없나요. 쪽지주세요. (ㅋㅋㅋ) 
9,초기 할리우드가 보여주는 자신감 
10,1939년 영화라는 걸 알고 충격 먹음. 우리는 그 때 일본놈 밑에 고생하며 숟가락 솥뚜껑까지 전쟁물자로 바치던 시대임. 무려 80년 전에 이런 스케일의 영화를 찍다니 미쳤음. 그러니 노인들이 미국미국 하는 이유를 ...
10,가장 인상 깊었던 영화! 
9,"이 영화가 세운 실질적인 흥행기록은 이제까지 그어떤 영화도 깨지 못했고, 앞으로도 그럴것으로 보임. 국내 천만관객동원도 그기록이 보편타당하다면 최소 국외 백만은 되어야 하지 않을까?  사방이 거울인 방에 갇혀, 제모..."
10,그냥 너무 재밌다. 재개봉하면 돈내고  또 보러갈 것 
10,내 나이 58세 ..이제 60을 바라보는 나이에  중딩때 이 영화를 우연히 봤었고 그  이후로  청년 시절 중년시절에 걸쳐 간간히 거듭하며 수도 없이 봤다..볼 때 마다 감동이 있는...명작이란 바로 이런 것이다.....
9,1939년에 이런 대작을 만들어낼 수 있었다니 놀랍다. 초반부는 조금 지루했으나 중후반부로 가면서 재미가 붙었다. 한 여자의 인생 역정을 잘 풀어낸 영화라고 본다. 
8,"이 작품의 가장 큰 매력은 한치 앞을 볼수 없는 스토리다, 놀랍다75년전 이야기란 사실이... 남자의 오만함도 여자의 당당함도 치명적이다 그들의 내일은 헤피엔딩 이었길 바라면서 ^^ "
10,고전영화인데 진짜 재밌다ㅠㅠ 
8,비비안 리의 도도함과 마초맨의 크락 케이블의 가슴설레는 사랑...캬~ 
10,연출력과 비비안리의 연기력 오짐. 진짜 대명작이다. 222분의 엄청난 긴 상영시간임에도 불과하고 보여줄거 다 보여준 영화다. 특히 저녁노을과 농장을 보여주는 그 장면이 초반 중반 종반에 나오는데 진짜 웅장함. 
10,best of best 10 
9,지루한 면도 있었지만 7점이하 주는 ㅅㄲ들은  자기 뇌를 의심해야 함 
10,"마지막에 ""내일은 내일의 태양이 뜬다""라는 대사를 날리며 다시 일어서는 스칼렛. 이 결말에 저는 밤잠을 설쳤습니다. 레트를 되찾기 위해 얼마나 많은 남정네들의 가정을 골로보낼까요? 잠이안오더군요. 살면..."
10,1930년대에 만들어진 영화라고는 믿기지 않을 정도의 퀄리티. 두 주인공들까지 완벽하다. 
10,대작이예요~! 꼭봐야하는 영화 
10,20년 전에 처음 봤지만 처음 봤을때의 감동이 고스란이 다시 전해지는 전무후무한 걸작. 
10,중학교 1학년때 본 후 10년이 지난 지금까지도 내 인생 최고의 영화. 다시봐도  역시 최고다. 
9,헐리웃 초창기 시절 명작. 비비안리와 클락케이블 둘다 너무 좋다^^~ 막스스타이너의 음악도 그렇고 여러모로 길이남을 걸작 
10,걍 최고 연기며 작품성이며 다 뛰어남 
10,진정한 명화~~~ 정말 진정한 드라마네요 ㅎㅎ 
10,단 한 순간도 지루함이 느껴지지 않는 세기의 명작. 
10,이 영화는 전세계가 인정한! 반드시 봐야하는 대작중에 대작이죠.. 저의 인생영화입니다. 연기 연출 영상 스토리.. 뭐하나 나무랄것이 없는 완벽한 영화이자 명장면 명대사는 가슴에 새겨집니다! 
10,세기의 명화중 하나이다. 
10,"쉬이 꺼지지 않는 불꽃같은 열정, 붉은장미의 화려한 아름다움과 뾰족한 가시를 지닌 여자 스칼렛 오하라. 그녀의 파란만장한 인생사와 러브스토리에 압도되어 긴 러닝타임은 인지조차 되지 않는다. 레드버틀러의 마성의 매력은..."
10,10대 20대 30대 40대 볼때마다 다른감동을주고 또다른깨달음을 알게하는 불후의명작이다 
8,바람과 함께 사라지고 남은 건 오하라의 의지. 
10,13살인데 EBS에서 이 영화를 보게 됐는데 너무 재밌었음! 
9,"4시간영화란걸 믿을수없을 정도. 후반부가 살짝 지루하지만 그래도 몰입가능했다. 예전엔 몰랐는데 스칼렛에게서 토지의 서희를 볼 수 있었다. 비비안의 인크레더블한 매력은 역시! 단, (남부의 백인에게만) 좋았던 옛시절의..."
10,1930년대에 나왔다니 믿기지 않는다 이제껏 너무나도 나약하게 살아왔던 나를 부드럽게 꾸짖었다. 
10,명작은 오랜 세월이 흘러도 역시 명작 
10,내가 명작이라면 명작인거다. 네이버 영화 평론만 500작 이상이다. 
10,내일은 내일의 태양이 떠오를테니까! 
10,비비안리의 전성기의 아름다움과 고혹적인 모습 그 자체를 볼수있는 영화. 그녀의 연기도 단연 독보적. 클라크 케이블 또한 전성기 시절의 매력적인 모습과 당시 흑백 영화 속에서 감독의 칼라 영화를 제작했던 열정과 시대를...
5,그러니까 늘 자기 진심이 뭔지를 늘 스스로에게 물어봐야지~ 사랑하면서 왜 헤어지고 GR 들인지... 보는 내내 스칼렛이 미워 혼났음 
10,그냥 고전중의 고전. 명작중의 명작. 봐도 질리지않는 스칼렛의 욕망과 삶 패션. 
10,괜히 명작은 명작이 아니다. 
10,정말 엄청나다.영화 연도가 믿기지 않는다.주옥같다는 말은 여기에 쓰기 위해 생긴 말이다 
10,명작은 명작이다.비비안 리의 연기에 만점. 
10,영화에 나오는 아기가 지금 78세 ... 
10,넘치는 생명력이란 스칼렛 오하라를 두고 하는 말이겠구나 느낌. 마지막까지 그녀에겐 포기란 없었다. 
10,"사운드 오브 뮤직, 바람과 함께 사라지다, 아마데우스. . .이 세 편은 보물이다. "
10,인생영화. 초딩때 명절에 할머니집에서 손에 땀을쥐고 두근거리며 봤던기억이난다. 
10,전설의 대배우 비비안리가 타계하면서 인류는 100년에 한번 나올까 말까한 큰 별을 잃었다 
10,영화사에 길이 남을 명화 중의 명화. 
10,4시간이 지루하지않고 4번이상 봐도 지루하지 않는 명작 
10,완벽한 영화..비비안리...올리비아드하빌랜드.. 
10,참으로 좋은 영화라 하지 않을 수 없는 것은 아니지 않습니다. 
10,재밌음 마러ㅜ이하ㅓㅇ뤼하ㅓㅇ 
10,진짜..... 명작이다. .... 
10,4시간이 왜 짧은지 이제야 알겠음. 대작중 대작이다 
10,바람과 함께 사라지다. 보는 내내 제목을 입에 맴돌게 한 영화. 렛트 나쁜 놈... 
7,끝에 부분에 2명 급사가 너무 아쉽네 1시간 더늘어나야함 그래도 명작은 인정 평점... 
10,그 긴 런타임동안 영화를 보는 동안 지루할틈 하나 없이 스토리가 탄탄하고 배우들 연기력도 대박이고...그냥 인생작 
10,명품의 가치는 시대와 유행이 아무리 바뀌어도 명품. 영화에 명품이라면 이 작품이 아닐까. 미국인들이 꼽은 최고의 명대사 1위도 이 작품에 있고 정서와 가치관이 우리와 달라도 충분히 공감하게끔 만든 영화의 연출과 연기...
10,처음에 영화로 접했고 너무 재밌어서 책도 다 봤었다. 한동안 바람과함께사라지다 영화에 푹 빠졌고 꽤 시간이 흘러서 내가 성인이 되고나서 다시봐도 너무 재밌다.. 책속에서 스칼렛의 생각같은게 영화에서도 읊어졌다.. 참...
9,할리우드 심벌로 남은 대작 
10,내 인생 최고의 영화  벤허와 더불어 이 영화는 영화사의 기념비적 영화라는데 이의가 없을 듯 
10,레알 재밌으니까 보세요화질도 의외로 괜찮음 
10,내가 알고있는 최고의 영화 
10,1939년영화맞나요...스토리대박 연출대박 연기대박... 
10,아니 멜라니는 왤케 스칼렛 오하라를 좋아해..?거의 남편만큼 믿고 좋아하는거 같아..그만큼 스칼렛이 매력 만땅인것인지..그리고 애슐리 살짝 OO인거 같은게 키스 왜 받아줘 미친놈아 정신차려 저는 스칼렛이 애슐리 키스...
10,시대를 뛰어넘는 영원한 걸작 
10,깔끔한 영화다!!!!군더더기가 없다 ~~~ 
10,"""하나님이 나의 증인이다. 앞으로 나의 가족이 먹을것이 없어 굶거나 가난한 일이 없을것이다."" 이 대사를 듣는순간 울컥했죠. "
10,"방대한 고전  명작 소설을  당시 촬영환경과 기술, 재원으로 단 두어시간의 영화를 만들어낸  것부터가 대단하고 정말 잘 만들어진 고전영화라는 거~!^^ 주인공 역에 클락 게이블과 비비안 리의 절묘하게 잘 맞아떨어지는..."
10,영화사에 길이 남는 거대 명작 
10,내인생 최고의영화~~ 
10,레드버틀러 ㄹㅇ OO시 
10,다시봐도 최고에요.. 명작이라는 단어가 어울리는영화 
9,"11.10.24.내가 당시에 고전에 취할 수 밖에 없던 영화들 중 하나. 그 어떤 배우들보다도 매력적이고 아름다운 주연 둘의 모습은 영상미보다도 눈에 두드러지고, 애틋함에 사무치는 대사들은 영원히 잊혀지지 않으리. "
10,30년 쯤 전에 어느 재개봉관에서 본 감도을 잊을 수 없다 
9,생존한 출연진이 2018.4.29 기준으로 6명뿐인 매우 오래된 영화.. 감회가 새롭구먼.. 
10,나의 인생 영화~~~~ 
10,비비안리  한사람이 다했다. 
10,"무슨 말이 필요 하겠나, 영화 평점 가지고 장난치는 초딩들은 좀 꺼졌으면 한다. "
10,"개꿀잼임. 어떻게 1950년대 영화가 이렇게 재밌고 고퀄일 수가 있음? 볼거리도 풍부하지만 무엇보다도 파란만장한 스칼렛의 삶과, 남자답고(저는 남녀차별하는 사람 아닙니닼ㅋ) 매력적인 레트의 이야기가 너무 좋음. "
10,클라크 게이블 너무 멋지다... 
10,인생 최고의 외국 멜로영화 
10,"불후의 명화, 20세기 최고영화의 한 자리를 차지한다. "
10,넋을 잃고 본 영화 시간 간 줄도 모르고 본 영화..그 와중에 노래 너무 좋다.. 
10,"4시간에 달하는 러닝타임이 전혀 지루하지 않다. After All, Tomorrow Is Another Day .. "
10,책으로 먼저 하루만에 독파 후 영화감상... 역시 그러하다... 단연코 재미있는 영화였다~! 
10,긴 시간이었지만  절대지루하지않고 여운도많이남는영화 
10,내가제일사랑하는영화 
10,내생에 첫 고전영화. 하나도 안지루했음 왜 이제야 봤을까 
10,"다시 봐도, 스무번을 넘게 봐도 명작 중 최고의 명작이다 "
10,벤허니 로마의 휴일이니 오즈의 마법사니 해도 여튼 고전중에는 이게 최고야.재미있고 감동적이고 스케일이 남다르고 좀처럼 잊혀지지가 않는다. 
10,4시간동안 몰입하면서 볼수 있는 영화가 또 있을까. 보고나서도 가슴이 먹먹하다. 
10,제일  사랑하는 영화 
10,그냥 봐요 보면 알아요 
10,봐도 봐도 계속 보게되는 영화 
10,이 영화 보고나서 일년정도는 정신을 못차린듯... 
10,best of best. 
10,가장 좋아하는 작품입니다! 
10,제일 좋아하는 영화 중 하나! 봐도 봐도 질리지 않는다. 
10,어린 사람의 입장에서는 인생(영화)이 지루할지 몰라도 나이가 들면 깨닫게 된다. 
10,이럴수가... 존재만으로도 명작 
10,제일 좋아하는 영화. 제대로 된 명작인듯. 
10,이영화를 접할 수 있는것만으로도 행운 
10,비비안 리 여신 
10,아무리 봐도 질리지 않는 비비안리의 매력에 푹 빠진다. 
8,"시대를 앞서는 멋진 영상과 연기, 매력적인 렛버틀러. 하지만 뜬금없는전개때문에 8점 "
10,222분이나 되었던가? 명작은 명작. 몇번을봐도 지루함을 느껴본적이 없다 
10,이 영화는 처음 봤을 때도 10점이었고.  그 뒤에 봤을 때도 10점이었다.    그리고  EBS 에서 2~3년에 한 번씩 해줄 때 마다 보게 되는게  그때도 역시 10점이었다.   아마 앞으로도 내게는 영원히 10...
10,와 내가 한살때영화..진짜 푹 빠져서 봄 대단하다..요즘 영화랑 비교불가임 괜히 명작이 아니구나 
10,인생에 모든 역경과 반성이 담겨 있는 명작이다몇번을 보고 읽어도 감동과 교훈을 주는 인생 스토리 
10,자매들중 나이는 제일 많지만 사랑을 모르는 철부지 언니면서도 가장으로써 어려운 시대적 상황에 무너진 집안을 일으켜야했다. 그녀의 행동들이 한심하면서도 이해가 안가는건 아니였다. 냉정하게 돌아서는 버틀러도 충분히 이해...
8,모든 등장인물들을 연민하거나 혹은 그 어떤 인물도 연민하지 않거나 
10,올레티비에서 7500원으로 결제해서 봤지만 7500억의 가치처럼 감동이다. 극장에서 다시볼수 있는 영광이 다시 왔으면 좋겠다. 
10,
10,밑에분 말 공감 ㅜㅜ 그런 한국영화 왜만든거임 
10,음.... 이런대작에 이런평을 달기민망하지만 그냥 솔직한 평은 결말은 너무 완벽했는데 여주가 놀랍도록 그시대판 여우같았음.  영화는 너무 대작인데 여주가 꼴보기싫은건 또 처음이었음 ㅎ영화결론은 불여우의 일생이랄까.렛...
10,
10,정말 사랑입니다.. 소장해야겠네요보고 또봐도 질리지않습니다~ 
10,요즘 미국의 PC운동가들이 이 영화 퇴출시키자던데.. 진보가 맹목적이 되면 얼마나 유치해질 수 있는지.1939년의 태양에 대해 함부로 말하지말라! 
10,
10,다시봐도 너무 재밌다. 
10,한번보면 다른 채널 돌릴수가 없는 작품 
10,미국 남북전쟁을 배경으로 한 고전영화라서 봤는데... 3시간 40분 내내 정말 재미있고 감동적입니다^^ 만점이네요. 
10,
8,뒤늦은 후회로 바람처럼 사라져버린. 
8,스칼렛이 계단에서 떨어질때 눈물이 났다. 그리고 모든 대사가 유머가 있으면서 명대사다.코미디라고 해도 손색 없을정도로 대사가 재밌다. 엔딩에서 스칼렛이 울며 불며 매달리면서 사랑한다고 했는데도 떠나는거보고 레트도 똑...
10,영화에세이-바람과함께 사라지다의 불꽃-비비안리의 추억-귀족스런 남부의 진부한 가치가 허망한 구름처럼 바람과 함께 사라지듯-젊은 애슐리를 짝사랑했지만  남북전쟁은 찰스를 떠나보낸 말괄량이 스칼렛을 거센 북풍 휩쓸고 지...
10,요거 보고 싶어서 책 빌려왔는데 채널cgv 트니까 나오는 거 실화냐... 
10,고전의 가치와 배우들의 힘을 느끼게 하는 명작 
10,"어렸을 때부터 1년에 한 번씩은 챙겨보는 영화에요. 여주인공의 적극적인 삶의 태도가 인상적이네요. 성인이 되고, 결혼 후에 더 많은 것을 이해할 수 있어서 좋네요. "
10,Art of disappear... 
10,고등학교때 처음봤는데 그때는 둘 사랑의 어긋남을 이십대때는 전쟁의 참상을 삼십대때는 가족을 위해서 불굴의 의지로 일어서는 스칼렛을 보게  되더라. 나이에 따라 감상이 변화는 영화 
10,내인생최고의영화 
10,
10,스칼렛 성격 진짜... 있을 때 잘하던가 내가 레트였으면 진작에 오만정 다 떨어져서 이혼했을텐데 그만큼 버틴것도 대단함 
10,사춘기 때 최고로 꼽았던 영화 
10,별점과 평이 필요없는 영화 
10,레트도 두 손 들고 GG친 스칼렛! 당신은 대체... 
10,어긋난 사랑결국 이별이로구나.내일은 내일의 태양이 떠오르겠지만오늘 떠나버린 나의 사랑은 어찌할꼬.현실적인 면엔 그다지도 밝은 여자가자기 감정을 그렇게 몰랐다니‥마음을 애리게 하는구나. 
8,바람처럼살다가는구나 
10,"최고의 할리우드 클래식 영화. 별점 10점도 부족하다. 이 세상에서 가장 위대한 찬사가 있다면, 반드시 보내야 할 영화들 중 하나. "
8,마지막의 강렬함의 여운이 아직도 느껴진다 
10,1957년도에 2.2만명이면 지금으로 치면 2천 2백만명 가치는 될듯.. 물론 이 영화의 가치를 돈 같은걸로 평가할 수는 없겠지만... 
8,옛날영화는 뭔가 지루하고 재미없을것 같지만 이 영화는 충분히 재미있고 오히려 클래식한 매력이 영화의 재미를 업 해주는 포인트~ 
10,이 영화를 본 내가 자랑스럽다. 
10,작품성 외에도 영화 제작기술까지 모두 혁신시킨 영화. 
10,이 영화는  영원한 신화입니다!!! 
10,이 좋은 명작을 이제야 보다니 왜 명작인지 알것같다모든 장면들이 예술 그자체다 
10,내 생애 최고의 영화!!! 
10,이 영화는 정말 봐도봐도 새롭다 그 매력에 푹 빠진다 
10,전인생 최고의 완벽한 영화 
10,역시 백번봐도 질리지 않는... 오늘도 보고갑니다 
10,오만한 백인들 이야기 역사는 흐른다 
10,"클라크 게이블의 레트 버틀러, 비비안 리의 스칼렛 오하라는 영화사에 남을만한 위대한 캐릭터였음. 요즘 어떤 배우가 이런 영화에. 이런 역할들을 이 배우들처럼 해낼 수 있을까. 내 인생 최고의 영화 "
8,명작이라는데 잘 어째뜬 명작 
10,내인생 최고의영화. 27년전 첨 접했고... 그때의 환희와 감동이란...!!♥ 오널 cgv에서 3부에 걸쳐서 해주더라. 주옥같은영화. 레트는 떠났지만... 스칼렛에게 다시 돌아오기를 
10,인생영화. 유일하게 소장하는 책들. 볼 때마다 여운이 가시지 않는 최고의 영화. 
8,"역사와 기록이 된 배우들이 다채롭고 형체가 확고한 인물상을 연기하고, 그 인물상들은 시대와 배경에 동화되어 절정을 만든다. "
10,요즘은 왜 이만한 영화가 안나올까명작 중 명작 
10,정말 세계명작 베스트넘버원~~ 새드앤딩이라 더 여운이남음 
10,오랜만에 다시 봤는데도 여운이 대박... 주인공들 진짜 역할 찰떡이고 다시봐도 시간가는줄 모르고 보게된다 
10,내 기준 역대 최고 명작이다 
10,아름다운 영화..!!!! 
10,내 인생 최고의 영화다. 그 시절에 이런 영화를 찍을 수 있다니.. 정말 상상도 못할 일이다. 거기다 미국 역사까지 같이 배울 수 있어 좋다. 
10,20년만에 이 영화를 다시 본다. 어릴때는 그 옛날에 어떻에 이런 영화를 만들었지? 라는 신기함에 몰입이 되었다면 나이가 들어서는 잔인하고도 무섭게 살아나가는  여주인공 스칼렛에  몰입되었다.  클라크게이블과의 키스...
10,네이버 영화 분류 키스신이 인상적??? 영화 안 보고 분류한듯... 
10,"소설읽을 때 드는 기분이 이 영화 볼 때 든다,,,4시간 ㅈㄴ 길어... "
