score,review
10,야자쨀때의 그느낌 그대로다 
10,볼때마다 수도원장 패죽이고 싶다 
10,인생을 낭비한 죄 유죄 제 인생의 모토가 된 명언입니다 
10,이 영화를 보고도 인생을 낭비하는 자.. 그들은 유죄 
10,나는 진정 자유를 누리고 있는게 맞는걸까.. 
10,이런게 바로 영화라는거다 조선영화 알바들아! 
9,"쇼쌩크탈출,대탈출등 영화의 교본... "
10,"이런 영화가 40년전에 만들어졌다는데 놀랄 따름이다. 7년만에 다시 봤는데 , 다시봐도 감동은 여전하다... "
10,난 이렇게 살아있다 이 자식들아 
10,자유를향한수없는도전과반복되는실패결국꿈을이루는스티브맥퀸...현실에안주하며적응하는더스틴호프만...마지막까지섬에안주한다...인생을다시한번돌아보게하는영화...정말명작이다. 
9,"감옥과 절벽으로 극명하게 대조되는, 인간의 한계와 자유를 적나라하게 드러낸다. 이토록 인간을 사실적이면서도 처절하게, 그러나 결국 그 무엇보다도 아름답게 그려낸 영화가 있을까. 오늘도 절벽에서 뛰어내리길 주저하는 우..."
10,살면서 당연히 누리고 있는것에 감사할줄아는 마음과 삶의 의미를 다시한번 생각하게 만드는 명작 
10,와 이영화가 70년대 영화라는거보고 놀랬다.. 
10,"국민학교 6학년때 이 영화 보고, 마지막 장면에서 영화보고 처음으로 울었다. "
9,자유란 무엇인가에 대한 해답 
10,명작 영화 
9,10번을 넘게 봤지만 볼때마다 느낌이 틀린 이유는 뭘까...?  그 이유를 알때 쯤엔 철이 들려나...? 
9,성공하지않아도 자유를 위해  시도하는자. 당근을 키우며 돼지에게 이름을 붙여준 남는 이.  그들의 선택에 대해 가슴잔잔한 파문을 느끼며 
10,"자유에 대한 희망과 인간애의 감동, 그리고 탈출에 대한 긴장을 이토록 잘 연출한 작품이 있을까. 더불어 두 명배우의 연기는 영화를 완전한 명작으로 만든다. "
10,시대가변해도.. 
10,쇼생크탈출과 함께 교도소에서의 자유로의 갈망을 그린 명작...차라리 상어밥이 될지라도 떠나는 모습이... 
10,인간은 자유의 노예 
10,잊을 수 없는 영화. 
10,그냥 채널돌리다가 우연히봤는데 연기라는생각을하니까 소름이돋더라구요..진짜 명작입니다! 
10,이런게 바로 영화지예마지막에 더스틴 호프만은 왜 안따라나갔지 제 인생 최고의 작품 입니다~ 
10,70년대에 히트를 쳤던 영화. 영화관에서 봤지만 스토리를 다 잊었었는데 40여년 다 되어 다시 보아도 명작입니다. 
10,진짜 자유가 뭔지 알려주는 영화 
10,왜 요즘은 이런 명화가 없을까 
10,클래식의 진가를 보여준 영화. 시대가 흘러도 클래식은 그 빛이 바래지 않는다. 
10,영화를 좋아하는 나에겐 이건 인생작이다. 40년도 더된 오래된 고전작이지만 전혀 지루하지않은 전개고 자유의가치가 얼마나소중한지를 깨닫게 해주는 명작이다 
10,영화사상 최고의 명언이다. 인생을 낭비한죄. 
10,인생을 낭비한 죄 유죄. 나는 유죄일까 무죄일까? 
10,밑에 오지탐험 평점 조절한다는 또라이 새끼 ㅋㅋ OO OO하네 
8,이런류는 항상 볼때는 지루한듯하면서도 끌수는 없다 
10,자기는 얻을게 머 있다고 다른 사람의 자유를 뺐는 사람들이 제일 싫어. 
10,옛날 영화들은 날것 그대로의 느낌이라 좋아. 
10,대단하다.  10점이 아니라  100점도 부족하다. 
10,내가  이영화를 이제야 보다니...이럴수가.. 
10,용기를 주는 작품 
9,조금 지루한 전개지만 관람자에게 많은걸 남겨준다. 희망은 열정을 낳는것 같다 
10,드가'의 쪽지를 씹어먹는 그 표정... 
10,마지막에 정말 울었다... 드가와 빠삐용이 후에 같이 탈출하길 바랬는데 ... 둘은 그뒤로 다시는 볼 수 없었겠지.? 
8,고전 명작을 보는 재미. 
10,포기 하지 말고 계속 도전하다보면 언젠가 원하는 것을 이루게 될테니 
8,인간은 생각할때 더 비참해진다 
8,자유와 그것을 행하는 자유의지. 몇년이 지나도 클래식이 지닌 자유날개는 계속 펄럭일 것이다. 
10,자유가 아니면 죽음을.. 
8,각자 해석은 틀리지만 제가 오늘본 빠삐용은 단순한 교도소의 탈옥이 아닌 나의 인생에서의 탈출 다시말해 인간의 욕망과 탐욕에서의 탈출로 받아들였습니다지금 이곳은 어디일까요? 더 나은걸 얻고자함이 아닙니다 그저 이곳은 ...
10,내인생의 최고의 영화중의 하나.명작중의  명작이다. 
7,인생은 헛된 도전의 연속이다 
10,50여년 뒤에 봐도 명작은 명작이다. 어릴때 보고 다시 봤는데 여전히 여운이 있는 영화임.  자유를 위한 몸부림....여담으로 우리나라도 범죄자들을 빠삐용처럼 생존하도록 수감시켜야함 
8,실화를 바탕으로 해서 그런지 중간에 개연성이 떨어지는 장면이 많이 나와도 실제 상황을 안다면 그러려니 할 수 있을듯.주인공 참 독하다..마지막에 탈출하면서 하는 말이 인상적이었다 
10,보고 또 봐도 명작은 명작. 인생을 낭비하는자 유죄 
10,이 영화는 인생을 생각해 본 자만이 그 진가를 알 수 있다. 이 작품이 예술성이 뛰어난 건 인간  본성과 그 극한이 어디까지인가를 탐구했기 때문이다. 지금도 또 보고 싶다. 
10,마지막 장면은 지금 생각해도 소름 돋는다. 진짜 사람 인생이 저 둘로 나눠지는 게 아닐까 할 정도 
10,스티브맥퀸 호프만.. 진짜명작이다 
9,가능과 불가능은 없다. 오직 나의 의지만 있을뿐. 
10,말이 필요없는 명작.진작 더 일찍 보지 못한게 아쉬울 뿐.명작은 언제 몇 번을 다시 봐도 감동을 준다. 
10,지금 나는 자유를 누리고 있는가? 아니 어쩌면 자유가 어떤 것인지 재대로 알고 있기나 한건지 모르겠다. 인생의 꿈이라고 간직해온 내 마음속의 여러 환상들이 역겨워지는 순간이었다.. 
10,30여년만에 케이블서 해줘서 다시 봤는데...'아.. 이건 영화고 배우들이 연기하고 있구나..' 하는 생각이 단 한번도 안들다니.. 죽기 전에 1번은 봐야할 영화 
10,와 쇼생크 탈출이 최고인 줄 알았는데 이건 더 쩌네요. ㄷㄷㄷ 
10,"처음부터 끝까지 포기하지 않는 탈출의 집념, 끊임없는 몸부림 끝에 얻어낸 자유 "
9,처음 써보는 평점입니다만.... 주인공 빠삐용이 지하독방에서 한 회상 중에서 한 남자가 넌 유죄다. 인생을 낭비했으니. 라 한 말이 제일 마음에 와 닿습니다. 올해 23살인데 남은 인생을 더 현명히 살아야겠네요. 
10,영화 500개 봤지만 이거 처음 10점준다.. 
10,인생은 절박해야 한다...이불속에선 아무것도 이룰 수 없다. 이 영화를 보고 인생의 궤도가 바뀌었다. 빠삐용의 정신을 존경합니다. 
10,수도원장 개역겨운년 진짜 뒤졌으면 
10,진정한 자유는 두려움을 넘어서야 얻을 수 있다. 
10,금연중 시청을 금합니다 백퍼 흡연 합니다 
10,1973년도의 영화. 어릴적부터 2~3번은 봤는데도 진짜 명작이다. 타히티같은 원주민 구역은 정말 천국이었는데.. 인간은 결국 끝없는 굴레로부터의 탈출을 꿈꾸는 탈주자인가.. 마지막 탈출지인 섬.. 그 섬엔 1주일만...
10,시대를 초월 공감 할 수 밖에 없는 대역작이다!! 1970년대에 이런 연출과 연기 그리고 메시지 전달이 가능했던 걸 보면 우리나라 영화 수준보다 수세기 앞선 것이 당연하고 인정해야 할 부분이다!! 빠삐용의 역할에 영...
10,잊을만 하면 한번씩 보게 만드는영화.내생애 최고의 남자배우가 나온영화잊을수없는 꿈장면.영화로 만들 이야기를 영화로만들었고 배우들은 그이상을 해낸 영화.원작이 실화라 감동도 변함없는 영화완벽한영화 
10,최고다 탈출영화중 최고봉 
10,이건 무조건 10점이다 
8,처절한 갈망. 삶의 목표가 된 탈옥. 
9,나는 얼마나 더 시련을 겪어야 삶을 낙관적으로 볼수 있을까?.... 
9,야 이놈들아! 나는 아직 살아있다! 자유를 느끼다. 
10,인생이란 무엇일까 
9,"미처 깨닫지 못한 자유,  난 이미 많은 자유를 누리고 있었다. "
9,절벽 다이빙에서 카타리시즘을 느낀다. 일상생활의 일분일초가 소중해지는 명작 
10,명작이니깐 50년후에 봐도 명작.. 
9,감옥 생존물의 불후의 명작. 
10,마지막 눈 감는 순간까지 자유를 갈망하거나 순리에 굴복하며 사는 것 어느 것이든 정답은 없는것 같다... 
10,이게 진짜 레알 슬기로운깜빵생활이지 
9,역시 고전 명작..인생을 허비한 죄는 유죄라는 대사가 맘에 깊이 남는다 
10,'노인과 바다'를 연상시키는 명작. 인간의 존엄성과 불굴의 의지에 대한 아름다운 작품. 
9,아름다운 영화입니다. 자유와 욕망 열망 좌절 속에 희망 등 수 많은 가치들을 녹아낸 영화 같다고 생각합니다. 물론 모든 영화들에도 가치들이 있지만 이 영화는 가치들을 배우들이 너무나도 잘 살려 표현한 영화라고 생각합...
10,"1,2,3,4,5,6 "
10,"자유를 갈망하는 빠삐용의 고뇌는, 어떤 절망 속에서도 끊임없이 탈옥을 시도하는 불굴의 의지와 같다. 드가의 체념 또한 자유인데, 사실 무엇이 자유인지가 중요하지 않다. 선택한 길을 끝까지 포기하지 않는다는 것, 그게..."
10,코코넛 부대로 일곱번째 파도를 타고 절벽에서 뛰어내려 기어코 탈출에 성공하는 노인~~~ 
10,더스틴 호프만(드가)의 마지막 표정... 잊을 수가 없다. 
10,불완전한 자유의 토대로는 이룰 수 없는 휴머니즘 
8,모든 시련과 억압을 이겨내고 자유를 쟁취한 자에게 축복을 
10,"끝없는 탈출시도, 숱한 죽음의 고비, 인간의 정신과 의지를 굴복시키는 침묵의 감옥 그래도 목숨이 붙어 있는한... 왜냐고 우리는 Free as the wind. "
10,쇼생크탈출 보고 나서 바로 본 영화다..인생 최고의영화다.. 
10,어릴때 TV서 해주던 빠삐용을 부모님 어깨 너머로 보고 30중반이 다되서야 제대로 봤네요...말이 필요없는 명작입니다. 스티브맥퀸 형님의 연기는 정말 말이 안되네요. 더 열심히 살아야겠습니다. 
10,빠삐용의 탈주 행위들은 결국 자신의 형량을 늘리는 결과로 돌아왔는데 애초에 억울하게 붙잡혀왔기 때문에 나는 그의 행동들이 어리석다고 생각하지 않는다. 
10,감히 평가를 논하기도ㅠㅠ수만년이 흘러도 이런 명작은 후세에 많은분들이 공감하고즐기리라 믿어 의심치 않아요저 멀리 수평선을 바라보며.... 망망대해 그 깊은 수심으로뛰어들며 헤엄치는 대배우라 의심치 않는 스티브맥퀸의 ...
10,리메이크판을 보고 너무 부족하고 아쉬운 느낌에 바로 이어서 본 원작. 역시 고전명작은 영원하다 
10,지금 새벽에 몰레보고있는데 너무재밌네요^^  흥미진진한다는게 이런기분이들더군요 
10,"아..뭔가 나같은 직장인들 공감간다..회사는 때려치고 탈출하고 싶은데, 탈출했다가는  죽을 까봐  마지막 장면처럼 뛰어내리지 못하고 있다.. "
9,수녀.... 크리스쳔들의 위선이란 
10,눈물난다 최고의 영화. 
10,74년에 만든거 맞아?  머야?  먼데 이렇게 잘만들었어? ㅎ 드가역 하신배우 숸들러리스트에 유태인 역했던 사람이네 !! 
10,마지막 장면은 정말.. 
10,어릴적 정말 재밌게 봤지...최신 빠삐용도 잘만들긴 했는데...보는 내낸 아쉬움이 있었음..예전 작품엔 정말 빠삐용의 처절함과 절실함이 더 잘표현되어 있었는데... 
10,20세기 최고의 영화 벌써44년 한국영화는 아직도44년전 그대로 
10,"It seems so, so desperate  ..  yeahyou think it will work? .. Does it matter?영화계에 길이 남을 명작 "
10,내죄는  왜  이명작을 이제봤을까다!!  진짜  역대최고영화였다!! 
8,와 탈출영화 좋아해서 봤는데 이런 명작을 이제서야 보게 되네 솔직히 2년 독방 생활만 해도 온전한 정신으로 못살텐데 이런 부분은 비현실적이나 대체적으로 현실감있게 그려내서 몰입감 있게 봤다..  자유를 위한 갈망.....
10,내가 아빠한테 빠삐용(개 종류) 키우고싶다고 말했더니 아빠가 몇십 년전에 봤던 영화가 나때문에 떠올랐다면서 우연히 같이보게되었다.ㅎㅎ 쇼생크탈출도 감명깊게 본 나한테는 정말 최고의 영화 
10,나 ~~~유죄              ㅠㅠ 침묵하며  무죄 증명 
10,잘 봤읍니다~~감동명작이네요. 
10,주인공이 자유에 대해 갈망하는 것에 동질감이 느껴지고 낯설지 않은 기분이 들어서 신기했는데 생각해보니 군대 휴가나갈때 ㅋ 그리고 전역할때 ㅋㅋㅋ 군인분들 힘내세요.. 시간금방가요 ㅠ 
10,모두의 인생영화. 두 명배우를 후세는 기억할 것이다. 망할자식들아~나 살아있다! 
8,참으로 어리석도다.. 
8,나도 유죄입니다 ㅠㅠ 그리고 주인공의 끊임없는 도전이 참 놀라운 영화 
10,프리즌브레이크를 능가한다 
10,내 인생 최고의 영화.. 
10,프랭클린 J. 샤프너 감독의 2대 걸작. 
10,와 진짜 몰입했다 저런섬에 갇혀있으면 답답해죽을거같다 하루라도 자유롭게 살고싶을거같다 
10,명작중에 명작 자유를 갈망하는 주인공의 연기는 역대급이다. 
10,손가락으로 꼽는 인생 영화 중 하나 
10,다시는 인생을 낭비하지 않겠습니다 
10,그는 일생을 자유인으로 살았다. 
9,더스틴의 슬픔과 기쁨과 회환의 감정표현 연기 거장의 연기같은 느낌 
9,뛰어난 서사와 눈이 즐거울 정도의 연기 
8,탄탄한 스토리와 지금봐도 전혀 어색하지 않은 연출력 대작이라는 표현보다 명작이라는 표현이 더욱 잘 어울리는영화 
10,너는 이겼다. 친구여 너는 자유롭고 사랑을 받는 네 미래의 주인으로 여기에 있다. by 빠삐용 본명 앙리 샤리에르 
10,두배우의 멋진연기. 정말 명작. 자유란 무엇인가.. 
10,고달픈 인생에 용기를 주는 영화 
9,시간이 어떻게 흐른지 모르겠네요.  빠삐용이라는 영화가 있다는건 알았는데 이런 내용인지는 보고 처음 알았어요.  요즘 세대들은느낄지 모르겠지만 자유를 억압받던 시대를 살던 이들에게 공감과 향수를 불러일으킬영화네요. ...
10,함부로 평가할수없는영화...무서울정도의 연기력이다 
10,정말 어마어마 한 영화입니다...아버지께서 중학교때 보셨다며 오늘 같이 봤는데요..여운이 남습니다...연기 맞나요? 소름소름..정말 죽기전에 꼭 봐야할 영화라 생각 합니다... 
10,독방살이 했을때의 빠삐용연기는잊지못할것이며 평범한 현실속이 최고로 행복한 곳이다. 
10,다시 봐도 대작 
10,불쌍하다...ㅠㅠ 
10,"정말 명작입니다. 우연히 tv에서 보기됬는데, 정말 좋았습니다. "
10,포기할 줄 모르는 자유에 대한 갈망 ㅠㅠ 
10,"어렸을때 참 감명깊게 봤었는데, 정말 좋은 영화다. "
7,단순한 재미와 흥미도는 좀 떨어진다. 하지만 그게 주인 영화는 아니니까! 
10,이야.................................이말밖에 안나와. 온리 자유. 
10,어떤 대가를 치루더라도 자유를 갈망하고 실천하는 모습이 한없이 아름답다. 
10,"탈옥영화의 대부,젊은이들에게 필요하고 모든이의 명화 "
10,"이 자식들아 , 난 이렇게 살아있다 "
10,난 왜 인생을 허비하며 사는가 ? 
9,포기를 모르는 빠삐용처럼 .. 
10,그들은 바다를 버리고 여기로 오려하고 나는 여기를 버리고 바다로 가려하고... 
10,인생이란 무엇인가?? 
10,"스티브맥퀸님 정보를 보니80년도에 돌아가셨더군요,드가분은살아계시던데 "
8,"지금 나에게 필요한 건, 인생을 낭비한 죄를 벗어나기 위한 치열한 몸부림.. "
10,몇번이나 봤는데도 마지막장면보고 ㅄ같이 울면서 주유소손님받았다 
9,대박! 
10,명작입니다. 
10,"심리묘사가 괜찮게 묻어나온다. 스티브맥퀸, 더스틴호프만 ㅋㅋ둘다역시 ㅋㅋ최고 "
10,의심할 바 없는 불후의 ㅁ여작 
10,이게 쇼생크탈출보다 훨씬 좋다 
10,죽기전에봐야할10편의영화중1편영화 
10,살기 위해 벌레를 먹는 모습은 정말 삶에 대한 성찰을 해보게끔 하는 컷이었다. 
10,인생을 낭비한 죄 
10,평생 소장해야 할 가치있는 영화. 
10,끝까지 자유로운 삶을 포기하지 않는 주인공이 인상깊네요. 보느라는 좀 힘들었음. 
10,꼭 보셔야 될 영화입니다 
10,최고다 
10,최고다 
10,걸작이다 
10,명작~! 
8,고전영화 
9,한 편의 삶이 녹아 들어 있는 듯 하다. 긴 러닝타임동안 지루할 틈을 주지 않는 작품. 
10,"진짜 대박명작이다,,,명대사 명배우... "
9,인간은 자유의 노예 
10,쇼생크 탈출보다 더 좋은거 같은 탈옥명작영화 
10,인생을 낭비한죄... 
10,짱 
8,좋은 영화네요 
10,더 할 말이 있을까 완벽한 연기 구성 몰입도까지 빠지는 부분이 하나도 없었다. 인생을 낭비한자 유죄. 얼마나 많은 작품들의 오마쥬가 되었는지 모른다. 자유를 갈망하는 빠삐용은 자유속에서 절망을 찾는 현대인과 대비된다...
10,고딩때 학교가기전에 영화채널에서 이거하길래 좀만 보다가야지 하다가 푹빠져서 결국 학교못가고 엔딩까지 봤던 영화 
10,캬 명작.. 쇼생크하고는 다른느낌이네요 
9,빠비의 집념을     내몸에 주사 할 수는 없을까 ?  참말로 부럽다 
8,자유를 갈망하는 한 남자의 치열한 싸움. 
10,11살때...태어나서 처음으로 영화 보고 울었던 영화... 마지막 헤어지는 장면... 
8,"빠삐용이 처음엔 자유를 위해 탈출을 시도했겠지만, 이후엔 자유의 추구를 위해 탈출을 시도했다는 점이 인상깊었다. 마지막에 파도를 이용해 탈출할 때도 어쩌면 자신이 죽으리란 걸 예상했겠지만 운명에 맞서 자유를 추구했다..."
10,잔잔한데 2시간 30분짜리가 순식간에 지나갑니다. 어릴때 주말의 명화로 본게 전혀 기억이 안나서 어제 봤는데... 처음 보는 영화처럼 모든게 낯설었습니다. 설명이 필요없어요. 무조건 보세요. 
10,더이상의 명작은 없다. 인생이다 이것이 
10,여운이잔잔하군요 재밋네요 
10,이 영화에 대해 말할 필요가 있는가. 
10,
10,오늘에서야 봤는데... 이 영화 그냥 명작.. 다시봐도 명작! 
9,빠삐용 빠삐용 해서 봤는데 명성값하네요 사는것에 대한 의미를 찾는것같음 
10,쇼생크탈출과 더불어 내 인생 명화 중 하나!!자유를 향한 갈망은 빠삐용의 삶의 원천으로 그 어떤 고난과 역경도 그를 굴복시킬 수 없다.보이지 않는 감옥에 갇힌 삶을 살고 있는 현대인들에게 자유를 향해 용기를 갖고 그...
10,보는 내가 극한까지 내몰리는것 같았다. 
10,별빛의 힘으로 항해하는 우주범선 파피용호. 미지의 세계를 향해 힘차게 날아라...  Wer 
10,"평점 1점 주는 사람들은 영화 볼 줄 모르는 바보들임. 댓글알바 언급하는 인간도 있던데, 이 멍청아 70년대 영화에 무슨 댓글알바냐? 지 수준이 낮은 건 생각도 안 하고 ㅉㅉ "
9,자유를 향한 인간의 강한 열망. 
10,대탈출 아니고 대탈주 입니다 밑에 쓰신분 
10,이거는 10점이지.. 
10,이자식들아나는이렇게살아있다 
9,나비는 바다를 건너고 싶었다.. 탈옥영화의 레전드! 
9,자유에 대한 굉장한 갈망이 감명깊었던 영화.  굉장히 가혹하고 끔찍한 죄수생활과 보기만해도 땀나고 찝찝한 느낌을 느낄수 있었던 영화였다. 다른거는 모르겠고 waste of life에 있어 innocent 하게 살고 ...
9,아무리 오래 됬어도 명작은 명작이네요.실화를 바탕으로 만들어졌다는데.. 탈출하기 위해 절벽에서 뛰어내리는 장면이 특히 인상깊네요.이 영화 보면서 '인생을 낭비한 죄 유죄' 아주 멋진 말도 기억하게 될 ...
10,1974년에 개봉된 영화가 20세기와 21세기에 거쳐 재개봉한 이유를 알겠다. 
10,씹명작   씹찢어지게 소름 
10,담백하게 담아낸 인생철학영화 
10,네이버 순위에 없지만 나에겐 빠삐용영화가 검색어 1위다. 
10,인터넷에 다운받아 봤습니당~~~가슴뭉클해지는 그런 영화이네요좋아요 한번씩만 추천해주세용 
10,실화를 바탕으로 했다는게 믿기지가 않네요너무 훌륭한 영화예요. 
10,죽기 전에 꼭 봐야 할 영화 
8,빠삐용 그는 진정한 자유인이 되었다 
10,7번째 파도를 타면 강한 물살을 타고 나아갈수있어. 
10,빠삐용이야말로 자유를 누릴 자격이 있는 사람이라는 생각이 문득 들었다. 
9,무엇인가에서 도망치고 싶을때 벗어나고 싶을때 새로운것을 다시 시작하고싶을때 그기분을 맞이하고싶을때 이영화를 보게된다  쇼생크탈출하고는 다른느낌 그거. 
7,"대단하고 대담한, 잃지않는 용기에 경의를. "
10,새벽세시 까지 졸면서 봐치만 좃은  영화입니다 
10,'Does it matter?' 좀 길지만 뛰어난 영화 
10,"탈옥 영화로서 이 영화와 비견되는것은,쇼생크 탈출과 대탈주뿐이다.그리고 양들의 침묵... "
8,독방씬에서의 연기는 정말 대단했다!! 
8,말이필요없지요http://cafe.naver.com/grayd0tbe/1372 
10,자유. 그것은 목숨과도 바꿀 수 있는 것일까... 
8,자유라는 단어가 이토록 숭고하게 느껴질 수 있음을 
10,이 나비는 얼마죠?... 
10,인생을 허비한 죄... 사형... 
10,명작이란 말 조차 필요 없다. 그냥 살아가면서 반드시 봐야하는 영화다. 
10,이영화는 명작입니다.. 
10,이것도 역시 대단하지.. 
9,영화 마지막 장면에 물 밑에 잠긴 잠수부 다리가 보였던 것 빼곤 거의 클래식에 가까운 영화였다. 
10,몇번을 다시 봐도 명작은 명작이다. 
10,내가 생각하는 최고의 인생영화 
10,어떻게 40년 전에 이런 영화를 만들었을까 유죄는 웁니다 
10,중학생   시절  에 본영화   사OO  지나  다시 유료 채널  보아도  감동이 
10,깨달음과 힘을 준 영화 최고입니다! 
10,우리애겐 자유는 뭡니까 란 질문을 새기고 또 새기는 영화 
10,빠삐용은 여전히 살아있다 
9,지독하고 열정적이다.. 인생을 낭비하는자가 유죄라면 빠삐는 무죄다.. 하지만 망망대해에 혼자 몸을 던지기 까지 많은 대가가 있었고 드로는 그런 빠삐를 보며 울며 돌아선다.. 빠삐에게 감명 받았지만 망망대해속의 빠삐를...
10,자유를 위해 용기낸 그가 정말 부럽다... 
10,내 생애 최고의 영화중 한편!! 인간에게 자유란 어떤것인가? 생각학 해주는 최고의 감동의 영화이다. 
10,40년 전에 만들어진 영화라는게 믿기지 않는다. 이런 영화를 이제서라도 접한게 다행. 자유의 소중함에 대해 한번쯤 생각해보게 해준 명작! 
10,"왜 세기의 명화라고 불리우는지, 왜 사람들의 입에서 자주 회자되는지, 왜 네이버 평점이 10점 만점에 가까운지, 일단 닥치고 보면 이해할 수 있을 것이다. http://blog.naver.com/metalenigma..."
10,걸작이다 1973년도 영화라니....!!! 
10,어렸을떄 너무 충격이었던 영화인데 다시 보고싶다 
10,자유에 대한 갈망 ..명작이다 
9,"시대를 넘어 공감 할 수 있는 한마디의 대사가 이 멋진 영화를 더 빛나게  해준다. ""시간을 낭비한 죄, 유죄!!"" 지금 내 자신을 돌아보게 한다. "
10,굿 
10,명작 
10,내인생 잊혀지지 않은 영화. 지금도 빠삐용 주제를 가끔 듣노라면 내가슴 깊은곳에 고독과 살아야겠다는 서러움이 절절하게 끓어오릅니다. 아마도 내 인생이 슷비슷비하지 않았나 생각됩니다. 물론 빠삐용하고 비교할 수 없지만...
10,정말 좋아하는 영화.. 
10,연기의 신~ 
9,목표를 가진 사람에게 그 어떠한 장애물은 없다 
10,개봉당시 극장에서 봤고 그뒤 집에서도 비디오로 DVD로  TV로 참 많이도 본 세기의 걸작 
10,나는 현시대의 빠삐용이다마지막엔 자유를 얻을것이다 
10,처음봤을땐 내용도 이해안가고 재미없었는데 두번/세번 보니깐 정말 명작이란게 느껴진다.. ost 너무좋고 빠삐용 드가.. 쩌러 ㅠ 
10,인생을 가장 잘 느끼게 해준 영화 
9,절절한 OST가 기억에 남는 영화...더불어 실화에 바탕한 스토리라는 것에 더욱더 인상깊다 
10,이영화... 사랑한다 
10,가혹한 형무소에서 탈출을 시도하여 결국 성공하는 종신수의 실화를 바탕으로 한 프랑스 영화 
10,많은 생각과 성찰을 하게 만드는 명화 
