score,review
10,하마터면 영화 결말을 먼저 볼뻔했네. ㅋㅋㅋㅋㅋ 스포일러주의는 괜히 적은게 아니죠....진짜 우리를 몇번이나 속인 영화네 ㅋㅋㅋㅋㅋ 진짜 타짜의 조상이구먼 
10,이 영화 진짜 좋음. 궁금한 건 로버트 레드포드의  적자라 해도 과언이 아닐 브래드 피트가 왜 좀 더 젊을 때 이걸 리메이크 안하는 지 의문?!!?!?! 이게 다시 만들어진다면 당연히 브래드피트가 그 가운데 있을 것...
10,허허...영화 보기 전에 안들어와본게 천만다행이구만... 여튼 무려 40년 전 영화인데도 이렇게 재밌다니 신기할뿐.ㅎㅎ 
10,낚시의 정석 
10,시간이 어떻게 가는지도 모르게 봤다. 진짜 이 영화는 세기의 명작이다. 
10,와~ 정말최고네요. 요즘영화 억지반전도 없고~ 저 계속 속앗음 ㅋ 
10,"[스팅 OST - 엔터테이너 ] 누구나 한 번 쯤 들어본 멜로디 , 지금 다시 개봉해도 흥행할 명작 "
10,모든 범죄영화의 모태작이라고 생각된다. 치밀하고 유쾌할 정도다 
10,역시 구관이 명관. 명작은 오래 지나도 명작! 
10,계속 속이고 속이는 범죄의 진리인 영화 
10,마지막 순간에 입을 다물질 못했다ㅋㅋㅋ유쾌한명작 반전영화! 
10,저때의 사기극이 왜 지금의 사기극보다 더 고급스러운건지.. 
10,다시 보고싶은 명작중에 손꼽히죠. 예전에  봤는데로버트 레드포드 다른 영화보고 평점남기려 검색하다가 스팅 명작보고 지나칠수없어 평점 남기고 가염^-^ 
9,캬 폴뉴먼 죽여준다 그냥 
10,"과학은 발전할 수 있지만, 문학과 예술은 발전이란 표현을 할수 없다라는 말이 이 영화가 증명한듯!이렇게 멋진 영화일 줄이야!!! 최고!!! "
10,정말최고의영화 지금봐도재밌습니다.안보신분들은 꼭보시길.. 
10,이것이야말로 고전이구나 
10,"음,,굳 "
8,"[아카데미]1974년46회 작품,감독,각본,미술,의상,편집,음악편집 7개부문수상작.제목그대로 마피보스에게사기를치는데 처음엔 포커로사기,두번째엔경마로 또 사기를치면서마피아보스를골탕먹인다.OST The Entertain..."
10,속임수의 예술!  국산 영화는 100년이 지나도 어림없다. 
8,와 진심 ost 'the entertainer' 짱 좋음. 아카데미에서 8개 부문 수상할 만한 영화였다. 
8,반전의 매력에 놀라 각본상을 다투어 넘겨줬던. 
10,노래가좋다 
10,이 오래된 영화가 이렇게 재밌는줄 이제야 알았네요. 평점과 딱 어울리는 멋진 영화임. 반전또한 그들의 각본이었음을 ..하하하.. 기분좋게 영화가 끝났네요. 멋지다.. 
10,이거 어디서봐요? 
10,"스캇 조플린의 명곡 ""The Entertainer""(1902)에 맞춰 착착 진행된 '정의로운' 사기극.  초기 투자금도 너의 돈으로...포커칠때의 폴뉴먼의 연기를 보라 그야말로 오락영화의..."
8,지금  우리가 보고있는 거의 모든 사기꾼 영화의 시초인듯ㅎㅎ 
10,밑에 rede****님 의견에 반박을 재기하자면 브래드피트는 그냥 브래드피투지 로버트레드포드의 적자같은걸로 보심 안되죠 엄연히 다른사람인데 브레드만의 명작도 많고 브레드는 리메이크 안좋아합니다 
10,어린시절 최고의 영화..  1930년대 시카고..  아 레드포드여 
10,최고의 영화겠죠  항상ㅇ 주말밤에 보면 멋지죠 
10,범죄영화의 교과서. 경쾌한 OST는 덤. 
10,지금 다시 개봉해도 될 만큼 탄탄한 시나리오와 배우들의 명품 연기가 일품!! 특히  마지막 반전은.. 그리고 주인공들이 하나같이 백인의 푸른눈을 갖고 있어서 뭔가 이끌리는 영화.. 
10,늦게 태어난게 정말 후회된다고 느낄 때가 바로 스팅과 유주얼 서스펙트가 개봉하던 시대에  태어나지 못해서 뒤늦게  반전을 다 알고 보는것 
10,70년대에 이영화를 봤다면 더 재미있었겠지? 
9,"어릴때 본, 최고의 영화, 노름꾼과 도둑, 사기꾼이 판치는 배경으로 요즘은 흔한 반전...이라는 것이 있는 명작....유쾌한 음악은 덤이다 "
10,클래식! 언제 다시봐도 멋지고 완벽. 
10,이래서 스팅이라고 하는구나 ㅋㅋㅋㅋㅋ 
10,정말 최고의 사기 범죄 영화입니다! 
10,대단한 영화 .. 마지막 압권... 그 옛날에 만든 영환데 ... 
10,유쾌하고 치밀한 범죄 코미디 영화 
8,결말이야 충분히 예상이 갔지만...  38년 전에 이런 영화를 만들었다는게 놀랍다. 
8,탄탄하고 치밀한 구성이 돋보이는 유쾌한 사기꾼들의 이야기. 마지막 반전은 대박~ㅋ 
9,좋은 감독 만나서 리메이크 되었으면 좋겠다는 생각이 드네 ㅎㅎ 
7,요즘 영화보다 더 재미있네 
7,마지막 대반전에 눈을 뗄 수 없다. 마음 속 까지 시원해지는 두 콤비의 연기와 우정! 
6,유쾌한 코메디 
6,첫 만남보다는 못했지만 이정도면 만족스럽다 
8,완전 속았다. 올드 영화에 이렇게 느긋하게 당하다니! 
9,요즘은 이런 영화 정말 보기 힘들다는 것이 문제죠. 
8,처음부터 귀에 익은 멜로디가 이 영화의 OST일줄이야. 네이버 줄거리에 그냥 스포일러 한가득. 절대 읽지말고 그냥 영화 볼것. 네이버 진짜 민폐네 ㅡㅡ 
9,the ntertainer노래 덕분에 한몫한 듯 그런데 재밌다!!! 꼭 봐야돼 
10,"정말 재밌는 영화입니다,,,ㅋ "
10,결말을 이미 알고 봐서 아쉬웠지만  너무나 멋진 스토리~!!! 이런게 걸작이다~!! 
10,당시 이영화를 봤던 관객의 즐거움을 현재의 내가 1/10정도만 누렸다고 해도 만점을 줄것이다 
10,진짜 옛날에 만들어진건지 의심스러울정도에요 
10,"가장 뛰어난, 그야말로 모든 것을 죄다 갖춘 흠잡을데없는 최고의 영화 "
10,영화에 관심있는 누군가가 한편 추천해달라하면 여지없이 1순위로 추천해주는 영화. 
9,유쾌 상쾌 통쾌... 내가 사랑하는 영화.... 
10,Entertainer 이 한마디로 이영화의 모든것이 설명 가능~ 
10,"범죄의 재구성, 타짜, 도둑들이 여기있구나! "
9,ㅇ허ㅑ소ㅓㅎ허ㅑㅛㄹㅊ 
10,스토리 탄탄하고 연기력 받쳐주고 연출 또한 좋네요!! 꼭 보시길...^^ 
8,70년대 영화임에도 굉장히 세련됐다 
10,이게 70년대 영화라고??? 지금 당장 극장에서 개봉해도 전혀 어색하지 않을 영화인데? 너무 재미있게 봤어요! (참고로 낚시질 대단한 영화네요..ㅋㅋㅋ) 
10,"유주얼 서스펙트, 식스 센스를 봤지만 스팅이 최고다.. "
10,고전찬미에서 보고 왔네요. 명작입니다. 
10,국내는 75년 단성사에서 개봉했습니다 
9,고전.  모든 씬이 교과서다. 
8,고전영화라고 별 기대안하고 봤는데 재밌었어요. 
9,요즘 시대 센스터지는 사기 범죄물과 비교해도 손색이 없을 정도의 완성도를 지닌 작품이라 생각함. 
10,"고전 영화지만 진짜 너무나도 사이다 같이 통쾌한  엄청난 대배우들의 멋진 연기~ 중간에 조금 느슨한 내용이 있지만 그래도 폴뉴먼,레드포드  특히 레드포드 아저씨는  젊었을때는 진짜 브래드 패트네요 "
10,배우들의 뛰어난 연기력은 덤 
10,무려 45년전 영화에 OST까지 완벽! 내용 다 알고봐도 또봐도 넘 재밌다 
10,40대 이상은 명절때 티비에서 스팅보고 감탄한 경험 거의 있을듯. 마지막 엔딩은 모두를 속인다 
10,우아 제대로 속았다. 영화 결말 예상 못한 거는 태어나서 처음이다. 반전의 감동이 이런거구나. 
10,흠잡을 곳 하나 없는 최고의 명작 중 하나. 고전명작이라고 불릴만한 이유가 있다. 
10,"컹스.... ,,,, "
10,마지막 그 순간 혹시라고 생각했더니 역시 대단한 유쾌함 
10,어릴때 봤는데 아직도 조금 생생하게 기억하는걸 보면 정말 재밌었나보다 
8,레드포드하고브래드피트 존나 닮았네~! 영화잼씀 
10,젊은 시절의 로버트 레드포드는 브래드 피트와 어찌 저리 똑같냐. 
9,키야.. 고전 명작 제대로 봤다. 현재 범죄영화들의 교과서적인 영화라고 생각되며 결말을 진짜 전혀 예상 못했고 짜임새 매우 좋았던거 같다. 과거식 범죄영화제대로 하나 봤다. 재밌었다.왜 평점이 높은지 알겠네 
10,"the entertainer 음악과 배우들의 연기, 정말 기분 좋습니다. "
10,타짜 볼때마다 생각난다. 여전히 이 방면으로는 최고작 
9,"시나리오, 연출력, 연기력 세박자를 고루 갖춘 명작. 유사 장르의 요즘 영화들보다 더 매력적이다. "
8,이 세상 모든 케이퍼 무비의 원조이자 교과서 같은 영화. 
10,"명작중의 명작.... 말이 필요 없는 영화..   음악,연기,각본  뭐 하나 빠지는게 없다.. "
10,"오랫만의 통쾌, 상쾌함이랄까? "
10,이제 거의다 돌아가셨네... 
10,"때는 2년전, 반전영화 매니아로써 엥간한 이름난 작품은 거의 다봤다고 자부할때쯤 우연히 아무스토리도 모른채 보게된 이 영화는 진짜반전에 목말라있던 나의 뒤통수를 오지게 후려갈겼다. ost부터 구성, 연기력, 스토리,..."
8,전설적인 콤비의 영화. 
9,그 옛날 이정도면 최고다. 요즘 웬만한 작품보다 스릴있음. 
10,와 ㅋㅋㅋ 생각도 못한.. 비극으로 끝나는가 했습니다.웬만한 요즘 범죄영화보다도 훨씬 낫습니다. 
9,와 진짜 이게 40년전 영화면..지금 나오는 영화는 뭐란 말인가..ㄷㄷㄷ 
10,영화 배경음악하며... 정말 최고의 영화네요 :) 
10,탄탄하고 젠틀한 남성들의 전술서. 
10,정석...수학의 정석 ㅎㅎ오션스 시리즈가 먼저 떠올랐다...교과서 같으 영화였군...!!!!OST만 피아노로 쳐봤었지...ㅎㅎㅎ완벽했다 
10,70년대에 이런 완성도 높은 작픔을 찍다니.. 지금처럼 첨단 기술이 발달 되지 않아서 더 쉬울수는 있었어도 영화자체를 이렇게 만들기는 힘듬.. 재미지네 
8,로네건도 낚였고 보는 우리도 낚였다...ㅋㅋ 
10,진짜 재미있게 봤어요! 유쾌상쾌통쾌한 영화~ 노래도 좋고 걸작이네요! 
10,70년대 작품이라는게 믿겨지지 않을 정도의 수작 입니다 꼭 보세요!! 
8,[8점] 배우들의 연기가 아주 하하하하하 
10,도대체 이게 언제쩍인데 이런 영화가! 참 대단함..! 
10,탄탄한 구성과 함께 폴뉴먼의 매력이 잘 드러나네요. 
10,너무 완벽하기에 평가를 할 수 없다 
9,하이스트 무비의 오랜 교과서.. 알면서도 또 보게 되는 매력.. ^^ 
9,이런영화를 이제 알다니 
10,와 EBS에서 처음 봤는데 최고다ㅋㅋ 
10,스팅은 언제 봐도 재미있다 
10,[스포일러 주의]만 아니였으면 더 좋았을듯. 망할 홍성진 
10,연기대단 스토리대단 전부전부 대단 
9,이야 재밌는데. ㅋ 마지막엔 놀랐네. 
10,범죄 영화의 최고봉이다. 
10,78년작이라는게 믿기지않는 최고의 코메디 범죄사기극이엇다.... 
10,나는 아직까지 스팅을 뛰어 넘는 사기극을 본 적이 없다. 
10,통쾌하고 치밀한 스토리와 사람을 끌이들이는 흡인력있는 잊지못할 명작이였음 
10,최고의 각본영화.... 
10,역시 대단하다.. 이 시대 최고의 영화!! 
10,후후 이것이야 말로 영화지 ~ 통쾌한 사기극~!!! 
10,"작품상,감독상,각본상, 미술상, 편집상, 의상디자인상, 편곡상을받은..보시면압니다 "
10,이름이 hooker래 ㅋㅋㅋㅋㅋ. 이 영화가 받은 상 많아서 셀 수 없다고 들었어요. 
10,사기 범죄 영화의 명작. 최고의 명작. 
10,주말의명화를 평정한 명작 
8,사기꾼 콤비의 재미난 사기극 이야기 
10,재밌다 ㅎㅎ 
10,2010년 영화제에 출품해도 사자나 곰 한 마리는 받아올 수 있을 거라고 생각합니다. 
10,ㅋㅋ 나도 속은기분ㅋㅋㅋㅋㅋㅋㅋㅋ진짜 재밌게 봤다. 
10,반전영화의 시초? 
10,어렸을적에 봤던 고전명작.. 이런 영화가 네이버 순위에 올라가야 할텐데.. 
10,이게 37년전 영화라니... 사기반전극의 레전드라 하겠다...ㅋ 
10,대충 알고봤는데 더알게되는 영화~꺄 
8,기막힌 복수극이 너무도 통캐한 영화^^ 
10,뭐 최고지............이 이상은 나올수가 없다 
10,참나 -- 마지막에 나도 속았잖아.... 
10,최고의 재미! 아직도 귓가에 흐르는 메인 테마! 
10,영화에 빠져드는 나를 보면서 행복함을 느꼈다 
9,역시 명작. 
9,현재가 1978년이라고 가정한다면. 
10,폴 뉴먼 그의 멋진영화 지금 개봉해도 손색없을 멋진영화 최고 ^^ 
10,정말 잼있고 유쾌한 영화 세월이흘러도 변함없는명작 
9,명작은 세월앞에도 당당하다 
10,사기극의 교본. 30년도 더됬지만 지금바도 무방할정도의 연출. 역시 뉴먼과 레드포드 
9,명작이란 말이 정말 잘 어울리는 영화.. 
8,세월이 무색할 정도로 완성도가 높다.. 
10,최고! 대부 보다 더! 
9,재미있다 
9,가지고 노네 ㅋㅋㅋㅋㅋ 
10,반전이 쩐다... 고전영화라서 그런거 더 사실성있다 
10,관객마저 속이는 유쾌한 영화. 
10,역시 고전이죠.  이런 유쾌하고 멋있는영화는 없을듯. 
9,대단하다 
7,오션스 시리즈는 이 영화 발끝에도 못 미친다. 
10,주연들의 이름만 보고 선택한 영화. 역시였다. 
8,모든 주조연의 호연으로 빛나는 유쾌한 반전. 
7,영화 내용보다 귓가에 경쾌한 음악이 오래 달랑거린다. 
9,"그냥 속는 것이 너무 재미있는, 70년대 최고의 오락 영화 "
10,유쾌하면서도 긴여운을 주는 명작 
10,존재만으로도 소중한 필름.개념있는 외화의 교과서 
9,간만에 보는 유쾌한 영화~! 
9,최고의 사기극 영화 정말 재미있었다 반전도 좋고 역시 사기치는 영화가 재미있어..ㅋ 
9,타짜 좆ㅋ까ㅋ 
10,요새 영화들보다 훨씬 머리 잘썼다! 
10,최고지! -_-)=b 
10,잼네요 ㅋㅋ 마지막에 알아차리긴 했지만~~ 
10,관객마저 속이기...눈치 빠른 분도 어느 정도까지는 속을 것... 
10,최고의 반전!!! 유쾌한 결말!!! 폴 뉴먼과 로버트 레드포드 최고의 사기영화 
10,재밌다 
10,한 열번은 본거같은데 그래도 재밌다. 
8,이 영화가 원조인 영화가 꽤 돼겠죠? 지금 눈높이로는 10점은 아니네요 
8,오션스의 아버지정도 되는영화 요즘영화보다 경쾌하고 재밌게만듬 폴뉴먼 너무잘생김 
10,와 마지막 반전 개쩐다 ㅋㅋ 
9,30년된 영환대 신작보다 더 잼잇다 
10,언제나 지나친 욕심은 자신을 망치는 법. 반전대박이네 ㅋㅋ 
9,속고속이는 사기영화 웃긴다 ㅋㅋ 
8,음.. 좋았다 근데 기대했던만큼인지는 모르겠다 
10,마지막에 로버트 레드포드가 살았다는게 반전인걸 알고 본게 아쉽지만 그래도 재밌다 
10,이제는 볼 수 없는 폴뉴먼의 눈빛을 잊을수 없다. 
10,탐욕에 대한 경각심을 일깨워주는 영화 
10,이 영화를 왜 이제 봤을까.. 정말 재밌다! 
10,개같은 네이버 네타쩔어. 반전을 적어놓으면 어쩌란거냐;영화 자체는 재밌더라. 
10,최고중에 최고였지. 왜 평점주는 사람이 없지? 
10,개봉 당시 영화관에서 본 기억이 아직도 생생합니다(약 30년이 지났는데도...). 
8,하나부터 열까지 그저 유쾌한 영화 
10,요즘반영화에 물들어 있는 나에개 새로운 반전을 맞보게 해주었다 ㅎ...... 
10,"반전하나는 최고인듯..다른영화들이 반전을 많이 베끼는듯,(네고시에이터) "
10,이런 걸작이 10점이 아니면 그거야 말로 사기다. 
7,마지막엔 달음질이 아닌 여유. 거참 구미에 딱 맞는 사기극일세. 
8,유쾌 경쾌 통쾌 범죄 사기극 ... 사기꾼들이 이리 멋지면 큰일인디 ...ㅋ 
10,TV로만 7번은 봤지만 볼때마다 빠져드는 영화. 
9,유쾌한 사기극 
10,absolutely perfect!!! 
10,퍼펙트!! 
9,역시 중딩시절 폴옹을 사랑해서 본 영화... 
10,정말 정말~~~ 잼있다... 이런 영화가 70년대에 만들어 지다니.... 
10,아 로버트 레드포드 
10,완벽하고 천재적인 오락영화. 모든 범죄공모영화의 교과서이자 모범사례. 
10,very good ! 
9,역대 로버트 레드포드 영화 사상 최고의 걸작 
9,폴 뉴먼 + 로버트 레드포드 흑 ㅠㅠ 
10,둘째가라면 서러운 재미와 완성도.이것도 당당한 불멸의 영화 
10,내인생 최고의 영화중 하나로 등록. 
10,유쾌한 반전영화. 
10,"유쾌한코미디, 완벽한 반전! "
10,스팅 반전은 경찰이고 뭐고 다 짜고 로네간 낚아서 돈 가로챈거임. 최고 
10,범죄영화의 교과서 
10,유쾌하다! 
8,복수를위해한사람을여러사람들이모여서사기를침50만불 
10,"말은 많이 들어봤어도, 본적은 없었는데, 걸작이다. "
9,"전반부는 타짜, 후반부느 오션스? ㅋ 만점아닌건 피곤한 오후때 봐서 "
10,70년대에 이런 명작이라니..정말괜찮은영화... 
10,어린시절 본 영화중 빼놓을수 없는 작품..정말 음악이 좋았었지... 
8,30년 후에 봐도 30년 전의 관객처럼 즐겼던 영화. 유쾌! 
10,걸작. 
10,명작입니다. 
10,이런 명작을 이제서야 보다니.. 
10,스팅의 피아노 선율만큼 경쾌하다 
9,폴 뉴먼과 레드포드. 버디무비의 결정판. 
10,줄거리가 스포네 OO.. 줄거리 누가썼냐? OO다.. 
10,좋은 영화~ㅋ 
10,반전 모르고 보면 이건 10점짜리. 
10,조지로이힐 폴뉴먼 로버트 레드포드 멋지다 
10,고딩때 잼있게 봤던 영화. 반전이 조금 이해가 안갔지만. 
10,이런 영화에 1점 주시는분들 인간 쓰1래1기 아니신가요 ^_^? 
10,마지막에 유쾌하게 웃을수 있는 영화. 
10,스팅보다 더 통쾌하고 유쾌한 영화는 아마 없을 것이다. 
10,최고의 영화 최고의 반전! 
10,"정말 감탄이 절로 나오는, 뒤통수치기! "
10,내가 알고있는 영화중에 가장 통쾌한 영화! 
10,봐도 봐도 재밌는 고전의 명작 
10,영화보다 음악이 더 유명한거 같은데.. 
10,네이버 줄거리 뭐야 아놔!!!~ 
10,반전영화를 반전영환지 모르고 보면 이런기분이군요......ㅋㅋㅋ 
10,반전영화의 극치.... 
10,역시 고전영화는 명작이라도 손꼽힌다 
10,1점 3점 주는놈 네티즌맞나? 앰없나? 재대로봐라 ^_^ 
10,재밌어 
10,쵝오 ㅎㅎㅎ 예상은 했지만 
10,네이버 본문 뭐죠?ㅜㅜ 
10,최고의 범죄영화!! 
10,"고전의 참맛, 반전을 위한 영화만이 아님을 각본이 말해준다 "
10,내가 태어나기 전에 이런 영화가 있었다니... 
10,명석한 머리와 철판같은 연기가 일품 ㅠ 
10,이런 명작을 이제야 보다니 유쾌상쾌통쾌다!!!!!! 
10,반전 다알고 봤어! 네이버 줄거리 미워! 
7,반전 생각하면서 보다보니.좀 그랬다.예측도가능했고^^음악굿! 
10,지금봐도 통쾌하다 
10,이런 걸 보고 명작이라고 하던가? ^^ 
10,다시 봐도 최고의 영화 ㅎㅎㅎ 
10,OST와 함께 70년대의 매력에 젖어들 수 있는 영화 
10,"역사상 가장 유쾌,통쾌,상쾌한 영화! 작품,오락 다있다! "
10,아주 오래전에 본영화 하지만 기억은 아직도.... 
10,아무생각없이 봤다가 기분좋게 웃는다 
9,시작부터누군가를왠지골탕먹일거라는암시의음악은베스트중베스트 
10,한 탕? ? 고고고! ㅋㅋ 
10,치밀한 시나리오와 명배우들의 연기 
10,레드포드가 브래드핏 닮은게 아니라 브래드가 닮았죠^^;; 
9,아... 네이버 기본정보가 정말 원망스럽다....ㅠㅠ 
10,레드포드 너무 브래드 피트 닮았다 
9,명작 중의 하나 
8,스팅의 음악이 인상적 
10,세기의명작 반전영화의대부 정말최고의영화 안보면 진짜후회 
8,네이버 스포일러의 압박..ㅜㅜ 
10,"기본정보,스포일러를 대놓고ㅠ_ㅠ이 시대에도 나오기 힘든 수작! "
10,30년이 지나도 유쾌 상쾌 통쾌한 영화~!! 
10,"심오하지도..잔인하지도 않은 유쾌하고 즐거운 사기,복수극.. "
9,통쾌한 사기 행각극 
9,"스팅의 ""곤돌프""가 반지의 제왕의 ""곤돌프""가 되나요? ㅋㅋ "
10,대단한 반전이더라고요 재밌었네요 ㅋ 
10,네이버에서 반전을 다 써놓다니..재미가 반이상으로 줄었다 
10,zzzz 
8,유쾌한 전복을 지켜보자구요.. 
10,기본정보 진짜 초어이없음~ ㅋㅋㅋ 마지막줄 고거 참내... 
10,결말을 알거나 모르거나 감탄하기는 마찬가지인 영화! 
10,걸작이야!!걸작!! 폴뉴먼의 매력이 흠뻑!!! 
9,진짜 기본정보 저래도 되나.... 
9,역시 마지막 반전이 멋있습니다 
10,내가본 영화중 최고!!! 
8,이것이야말로 최고의 버디영화 유쾌한 결말이 끝내줘요 
7,개봉당시엔 걸작이었겠다..지금봐도 괜찮을정도니.. 
10,순수한오락이아니다. 역사에 남을 최고의 명작 
7,"순수한 오락으로서, 매우 잘 짜여진 영화. "
10,"멋진 배우들의 멋진 연기에, 멋진 시나리오, 멋진 음악까지.. "
10,잼나네요 
10,30년 전 레드포드의 명연기를 볼 수 있었던 영화 
7,모두가 속았다는 마지막 반전을 모두 예상해버려서 실망...그래도 재밌었다 
10,지루하지 않은 옜날영화 
10,20년전에 봤던 영화의 감동이 아직도 생생 
10,goooood~~~~~~ 
10,best of the best!!! 
10,이것이야 말로 진정한 범죄극. 마지막 엄청난 반전은 전율이 온다. 
10,괜찮은 영화... 
10,범죄의 재구성을 능가하는 치밀한 두뇌플레이의 진수! 
8,좋은영화. 
9,결말을 알고보면 더 재밌다 
10,재미있는 고전 
10,지금까지 가장 재미있는 영화 
10,더 이상의 점수는 없어서..10점 - 내일을 향해..보다 훨 낫다 
10,나를 두번 속인 영화-☆ 
10,최고..-_-b 
10,"조지 로이 힐, 로버트 레드포드, 폴뉴먼 너무 멋있는거 아니야?? "
10,음악과 영상의 조화를 볼수 있는 영화 
10,정말 재미있게 봤네요 헤헤 
8,범죄영화의 bible 
8,"예전 명작들은 작위적이지 않아서, 잘난척하지 않아서 좋다. "
10,"와..로버트 레드포드 때문에 본건데  73년에도 이런 반전영화가 있다니..진짜 소름 돋았다 요즘 반전영화 못지않은 유쾌하고 정말 멍하게 만드는 반전, 잘 짜여진 치밀한 각본. 최고다 "
9,아 스포일러 안봤으면 10점인데!!! 
8,70년대 영화에선 최고중에 하나인 영화인데 줄거리를 알아서 그런가 정독해서 다시 보니 별루다. 
10,구라꾼 영화는 여기서 시작했구만 
9,"지금 봐도 촌스럽지 않고,  오히려 저 시대 특유의 군더더기 없는 유머러스함이 재미를 배가시킨다. 왜 명작인 지 알 것 같다. "
10,네이버 OOO 줄거리 보려고 열어ㅛ다가 영화 다본느낌 든다 
7,미친;;; 네이버샊기들 영화결말을 줄거리에 쳐써놓냐 
9,유쾌한 사기극~ 반전 쩔음ㅋㅋㅋ  내일을향해쏴라 봤을땐 로버트가 더 잘생겼다생각했는데 여기서 제대로 보니 폴뉴먼이 더쩐다...아 진짜 조각미남 ..완벽해 ㅠㅠ 하지만 고인이라는거..RIP다음생에는 내남편으로만나요 
6,주제곡이 매우 좋다. 전화로 미리 알려주는것에서 2등이라고 말을 하지않았는데 과연 속아넘어가는건가? 잔혹한 로니건은 어떻게 해서든지 두사람을 죽이려할텐데 두사람은 과연 제 명대로 살수있을까? 
1,mnnmmnmnmnmn 
6,영화 내용보다 음악을 모르는 사람이 없을 정도로 유명한..지금은 대 스타가 된 폴뉴먼과 로버트 레드포드의 멋진 연기도 일품 
9,역시 히틀러가 맞았다. 사람들은 작은 거짓말 보다 큰 거짓말에 더 잘 속는다. 
10,재미진영화 
7,처음에 조금 놓친게 아쉽지만 마지막엔 관객까지 속이는 그들. 
6,"음악과 반전은 두고두고 회자될테지만, 악당이나 의적이나 똑같이 너무 막 산거다. "
6,반전을 알아채서일까 기대만큼은 아니지만 잘 봤다. 
1,"bnm,jnb,jmfg "
6,명성에 비해선 그닥... 
10,"우리나라에서 리메이크하면 딱이겠네 폴뉴먼-김대중, 레드포드-노무현 해서 제목은 '슨팅'  관객들 통수가 얼얼하당께?? "
5,옛날영화여서 그런지 좀 지루한면있고 반전예상가능하지만. 반전이라는 영역 시도에 + 
6,이런 사기꾼이 있으면 나라가 망하지 
5,너무 유명해서 그런지 정말 기대에는 못 미치네요; 
5,몰입감이 없다. 
5,"40년 전, 당시는 대단한 명작이었겠지만 이 영화를 기반으로 많은 발전이 이루어졌기에 현재 시점에서는 단지 고전영화일 뿐. 주연-조연을 총 망라한 쟁쟁한 배우들의 멋진 모습들과, 30년대의 미국을 충실히 재현한 듯한..."
1,네이버본문의점수 
3,이렇게 물렁하고 멍청한 마피아는 난생 처음 이다. 
1,개봉 당시에는 나름 볼만했겠지만 시대를 뛰어넘는 명작과는 거리가 멀다. 
1,ost는 너무 좋았지만 영화는 다소 지루했다 
