score,review
10,""" 우리가 조국을 사랑하는 만큼만 조국이 우리를 사랑해 주는것.. 그게 제가 원하는 것입니다 "" "
9,"에이리언2,터미네이터2 와 더불어서 전편보다 한층 업그레이드된 오락영화 액션 영화로는 전혀 손색이 없다 지금봐도 재미있다 "
10,한시대의 획을 그은영화 스텔론을 지존으로 만든 결정타 울옆집 현아도본그영화 
9,역시전설의람보 액션하나는OO 
9,2편이 제일 마음에 듬 
8,"예매도 없던 그시절, 피카디리에서 아버지하고 2시간 줄서서 표사서 봤던 그영화. 영화 마지막에 극장에서 사람들이 박수쳤던거 아실라나 들 모르것네 ^^ "
10,"1편과 3편과는 비교가 안되는 시나리오와 연출력, 궁금해서 찾아보니,1편에서 끝날 이야기를 2편을 위해 자살하는 람보를 1편에서 감독을 설득해서 살려두었고, 2편을 위해서 제임스 카메론을 찾아가 시나리오를 여러번 수..."
10,미국적이지만 극장에서 이것보면서 정말 신났다 
10,람보2 티셔츠 받을려고 새벽부터 줄서있었던 기억이.ㅋㅋ 
10,마지막 대사를 들으며 눈물이 날뻔... 
8,말도 안되지만 화끈한 액션은 스트레스를 날려준다. 
10,내가 중학생때 아직 대한민국에 멀티플렉스도 도입되기전에 정가의3배 주고 암표 사서 본 영화인데 극장앞에 요즘BTS미국콘서트 티켓 구하는 아미처럼 군중들이 텐트 치고 몇날 며칠 밤을 노숙하면서 표 구해서 보던 사람들 ...
10,람보2 그는 애국자다 
10,삼척동자도 아는 그 이름은 람보..바로 이영화 때문이다!! 
8,우리가 아는 상남자 람보의 화끈한 액션 영화. 단순히 때려부수기만 하는게 아니라 시나리오나 연출도 완성도가 높다. 람보가 여자정보원 코와 미국에서 행복하길 바랬는데 슬프다 
9,액션씬은 다시 봐도 화끈. 스탤론의 절정기. 
8,각본을 무려 제임스 카메론이 썼다죠 
10,30년이상~ 아직도 풀지못한 숙제 !! 람보하고 코만도하고 싸우면 누가 이길것인가??ㅎㅎ 
8,"람보의 분노를 막을 자, 그 누가 있는가 "
9,너무 잘 만들었다 람보1과는 다르지만 ㅎ 
10,세계를 뒤집어 놓은 명작! 
10,고전의 명작 더이상 토달지마라 
10,람보 시리즈중 가장 오락적이고 흥행폭발한 작품 
8,액션으로 분출하는 분노가 인상깊다. 
9,명작 
10,2편이 먼저 나왔으면 1편보다 평점이 높았을거야 
10,10점 만점에 10점 
10,람보라는 캐릭터를 만들어낸 작품 
10,액션영화 역사상 최고의 작품 
10,사나이의영화. 
10,비평을 85년도에 해라 그때 당신들이 이 영화를 관람할  나이였다면 
10,람보2 보고 군대지원해서 갔다. 근데 신체검사에서 방위래~ 
10,마지막 음악까지 너무 재밌고 흥미진진  그시대 최고 걸작 
10,오래지났지만 최고의 액션영화는 분명 
8,원작보다 나은 2탄. 
10,이게영화다 ㅎ ㅎ볼만해요 
10,명작!!! 그때 당시로는 역대급 액션 
9,11.11.27.대부분 람보라 하면 떠올릴 이미지가 제대로 나온 속편. 머도오옥!!! 
10,"레이더스, 터미네이터와 함께 전편도 좋았지만 훨씬 더 업그레이드 된 몇 안되는 속편. 방대한 액션씬, 수많은 총알을 헤쳐나가 많은 적을 상대하는 람보의 모습에 희열을 느낀다 "
9,흔히 알고 있는 람보 이미지에 가장 맞는... 전세계 초대박히트를 한 유명한 2편. 
10,"일당백 전쟁 영화의 전설을 이룩한 명작으로 완벽한 전투 무대에서부터 예술적인 화면들이 즐비하다.시대를 초월한 화려한 액션과 침투, 포로, 배신, 반격에 깔끔한 사랑까지 싸그리 담았다. "
10,"Rambo, you are not expendable. "
10,정말 개꿀잼이였다 80년대  전설이었던 람보 개명작이다 
10,"얼마나 세계적인 히트를 쳤으면 수많은아류작에, 레이건이 람보를 파견한다고 "
9,"영화의 완성도를 떠나 상처받은 용병, 람보라는 캐릭터는 기념비적이다. "
10,대사도 멋지고 그의 카리스마는 전작에 비하면 너무도 많이 강렬해졌다 
8,좋긴하지만 1편이 더좋다 
8,람보영화는 역시 마지막 대사가 모든것을 압축시키네요cg없던시절 실베스터 스텔론의 그 수려한 액션중에서 1~2초가량밖에 안되지만 진흙위장술이 내겐 배스트씬~ 
10,"이거 말이 필요없지! 람보는 이미 코만도 액션을 능가했다.1편은 람보에 대한 정체성을 알려줬다면, 2편은 람보의 액션파워를 알려준다! "
9,건쉽으로 개조된 휴이 타고서 미니건과 로켓으로 적 진지 초토화 시키며 스탤론 형님 포효하는 장면에선 지렸다!!  크아 ~  형님 멋집니다 
10,본격 액션물로 전향한 람보였다. 마지막에 메세지도 있었다니.. 지금 보니 보이네 어릴적엔 그냥 펑펑 터지는 액션물인줄만 알았는데... 람보는 2편이 가장 재미 있음. 
8,람보 1편과는 다른 작품. 다른 재미. 
10,람보란 이름이 액션의 대명사가된 순간 
9,람보1 보다 더 유명한 영화.. 
9,1보다 많이 나아졌다.. 고달픈 군인이였어.. 염세적이고 비관적인.. 
10,최고~ 
10,람보는 CIA의 권모술수에 넘어간것임 보여지는것만 보면 반전영화가 아님. 
10,진짜루 최고엿음 마지막에 대포쏴서 죽이는장면 쩔엇음 
8,뭐 액션은 최고다...특히 람보가 머리띠매는 장면이 최고다~!! 
10,최고다 람보ㅋㅋ 액션영화에 무슨 교훈을 바라는 자는 뭐지? 
9,어릴적 극장에서 재밌게본 영화 
9,국딩 시절 태권도학원에서 토요일 오후에 틀어줘서 다같이 모여서 보던 그 '람보'.. 기억에 남는 명장면 1.거머리 진흙탕 포박씬 2.진흙속 은신 후 눈뜨고 기습씬 3.고폭탄 화살로 적군 바디 폭파씬 4...
10,최고의 액션 멜로영화 여주인공과의 키스신 잊을 수가 없다. 키스후 그녀를 미쿡으로 데려간다는 약속을 지키지 못한채 그녀를 보낸 람보는 일당백의 전쟁의 신이 된다. 이 영화는 액션뒤에 숨은 두 주인공들의 사랑. 이거다...
10,나에겐 전쟁 액션영화가 무엇인지 눈뜨게 해준 걸작이다. 
10,85년도 개봉.... 미국클라스 지린다진짜.... 
9,액션 영화의 전설. 안보면 후회할 영화임! 
10,이것이 일당백 람보 
8,"생각하기 싫어하는 자들에겐, 람보가 만화로만 보이는 법이지. 이용당하며 살지마라! "
10,람보의 최고봉!! 정말 잼있다... 
10,최고다... 
10,아 전설이다 전설 
10,이 정도 영화 절대 다시는 못 찾는다!!!굿!!! 
10,속이다 후련해지는 전투액션의 연속.. 지금은 이런영화가없죠 
10,으악 일당백이다..대단하다~!!굿..이것이 영횐거여 
10,훌륭한 영화.. 
10,20번을 봐도 멋있는 액션의 진수 
10,람보는 전쟁씬 말고도 볼게많음 
9,세월이 지나도 역시 명작이다........ 
10,코만도는 람보의 카리스마에 반도 못 따라간다 
10,"우리가 조국을 사랑한 만큼 조국도 우리를 사랑 해 주는 것 ,그것이 람보가 원하는 것.  고독한 영웅  존 람보 ! "
8,신나는 헬기 전투가 특징 
10,"단 하나의 전쟁액션영화 꼽으면 람보2를 꼽을 수 있을 정도로 초걸작... 1편이 맛배기였다면 2편은 왜 람보인지에 대해 제대로 보여줌. 1편도 괜찮았지만 좀 우울하고 씁쓸했다면 2편은 액션, 연기, 영상미, 스토리,..."
9,으아..이건 폭력 미학이야! 소련군이 불쌍할 정도. 
6,급식일때는 몰랐으나 군필이되고나서 보니 람보는 총조준하나도 안하고 다명중이다ㅋㅋㅋㅋ 
10,각본이 제임스 카메론이라 그런지 민감한 소재를 한쪽에 치우치지 않게 그려놓음~ 역시 인물은 떡잎부터 알아본다고 그저 돈만 쳐바른 액션이 아니고 모든 영화의 기본은 시나리오이기에 액션과 작품성 모두를 아우르는 카메론의...
9,각본이 제임스카메론 시리즈중에 재미있는 이유가 있네요~ 
10,최고다 .. 람보 그는 우리의 영웅이다. 
7,실베스타의 걸작 람보2 
10,액션 감성 스토리 까지 흠잡을데 없는 명작~ 
10,"설명이 필요없는, 초강력 액션의 정점!! "
10,조국이 우리를 사랑해주는 것 그것이 제가 원하는 것입니다 
6,이게 람보지 .  3편 마저 봐야겠다 
7,킬링타임용으로 볼만한 영화인건 맞는데.. 1편의 진지함은 어디로.. 
10,ㅎㄴㅊㄴㆍ 
10,람보와 싸우는 자들은 누구인가여? 
10,터미네이터2와 같이  여러번 본 영화입니다.폭력 미화나 미국 지상주의 라는 말도 있지만 솔직히 미국영화니 당연하지않을까요? 폭력 미화라는 말도 액션영화치고 안 그런 영화는 없을 것 같네요. 근래나온 액션영화보다는 과...
10,몇년에 한번씩봐도 재미 있네요ㅋㅋ 
10,중학교때 비디오로 정말 몇십번도 더본 영화다  정말 스탤론이 좋아지게된 작품 최고의 액션전투영화 람보2... 
10,총알도 피하는 무적의 람보 
8,"람보의 활약상, 국가는 그를 위해 과연을 무얼 해주었을까? "
8,근육 쩌네 ㅋ 
8,액션스타로의 탄생 
10,"스탤론영화 만들어졌다하면 ""전세계"" 흥행챠트 1위먹던시절의 최고작.(람보2 - 록키4) "
9,액션 하나는 20세기를 통틀어 손꼽을거다. 뉴밀레니엄에도 이런 액션은 없다. 
10,역시 스탤론 80년대 액션이 요즘꺼보다 화려하고 멋지다 
9,아 제임스카메론이었구나.. 역시 재밌더라 했어 
10,10점 투자!! 
10,극에 달한 전작과 다른 방향으로 또 극에 달한 영화.... 재밌음...ㅋ 
10,10점 만점에 10점 
10,액션영화의 교과서! 
10,람보3 
10,베트남 참전장병들을 철저희 망신시켜놓은 거지같은영화 
8,역시 람보... 
10,난 2편 재미있게 봤소이다. 
8,팍스아메리카나의 전조가 보이기 시작. 
9,형 군대 갔다와서 람보를 보면서 남자의로망 어쩌구저쩌구 잼씀 
10,잼있어요... 
10,람보1.2.3.4 씨리즈 본적있지만 람보2는 8점이네요 
10,전편에 비해 상업적으로 되긴했지만 적어도 2까지는 액션의 걸작 + 제임스캐머론 각본 
8,단순한 액션영화로 치부하지 말길... 웬만한 한국 조폭 영화보다 철학적인 부분 많음. 
9,"록키, 람보, 그리고 클리프 행어 "
9,2탄부터는 점점 강열해지는 것 같다. 대단하다 
10,혼자서 1000명은 잡은거 같은 람보형 ㄷㄷ 
10,사나이의 영화. 
8,"강한 남자, 강렬한 액션 "
10,람보는 정의감과 의리가 끝내줌. 통쾌한맛이란 바로 이런것! 
10,실베스타스탤론 최고의 작품 마지막 장면은 진짜사나이 
10,100번째다~~ 기념으로.. 10개닷 
10,"마지막 헬기 액션신,그리고 분노를 담은 마지막 사격!역시 진정한 남자의 대명사 람보 "
10,굿.......~ 
10,진짜 남자다 안내녀 너무 불쌍하네 
6,외로운 남자 람보... 오늘따라 왠지 바람이 차다~ 
10,정말 공감하는 대사다. 우리가 조국을 사랑하는만큼 조국이 우리를 사랑해주었으면... 
9,어릴때 봤던 최고의 액션 영화 
10,"넌 지금이나 그때가 최고가 될수 밖에 없는 영화다!! ""람보2"" "
10,람보.정말 멋있다. 
10,내가 본 최고의 영화중 하나~ 
10,마지막헬기액션씬만을 찍은 감독 아는분?ㅎㅎㅎ 놀라실걸? 
8,( ´Д`)b Good!! 
10,내가 볼떈 존나 잼ㅅ는데 
10,개인적으로 람보 시리즈에서 2편이 최고 .. 전쟁 천재 람보 ㅋㅋ 
10,더욱 강해지고 멋있어진 스탤론 
10,Good.................... 
9,모든 총알은 람보를 피해간다! 80년대 액션영화의 진수 
8,무적의 람보 ㅎㅎ 
10,솔직히 어제 코만도 봤는데 코만도랑 맞짱뜨면 질듯.ㅋ 그래도10점 
10,굿 !! 
8,람보2는 우리집에 비디오로 소장 
8,"슈퍼맨,배트맨,스파이더맨,로보캅등등..누가 와도 절대 꿀리지 않는 람보를 보라. "
9,어릴적 최고였지 
10,ㅋㅋㅋㅋ 남자의로망 '람보' 
8,거의 모든 패러디가 이 영화를 놓치지 않는다 
10,람보 시리즈 중 최고아닐까요? 비현실적이더라도 람보는 최고입니다!! ㅋ 
10,액션을 좋아하는 분에겐 강추~~요새액션보다 훨 좋네요 
8,진흙속에 위장하고 활을 쏘는 장면이 압권이다. 
9,시대를 감안하면 정말 훌륭한 액션 영화임에 틀림없다.. 
9,그 화끈한 액션씬은 지금도 뇌리에.. 
10,람보1편보다는더욱화끈하게!!! 
10,아니 이 영화 왜 7점이냐? 람보2 얼마나 잼는데! 람보 울지마! 
9,마지막부분에서 적기지를 초토화시키는건 너무 멋있다 
9,"중딩때 관광버스 안에서 틀어준, 완전 잼있게 본 추억의 영화 "
10,실베스터 스텔론의 원맨쇼! 
8,람보 시리즈 중에 제일 나은 작품 
7,람보는 람보다 
9,이때부터 아놀드와 신경전이 있었지 싶은데.. 
8,람보하면 바로 이영화~ 
8,전형적인 헐리웃액션 후속편의 시초라고 생각함 
10,놀고 있네. 
9,대략 10년전 이영화를 봤을때의 액션의 짜릿함은 최고다. 
9,람보의 마지막대사  진짜 멋있었다. 카리스마 
10,전...잊혀지겠죠? 
10,아니 이게 별점이 겨우 7점? 이 영화는 혁명이었다. 
8,이때부터 전작과는 다른길을.... 
9,그런데로 볼만 함 
10,내 어린 시절 추억에 한 자리를 차지하고 있는 영화! 
7,어눌한 표정으로 기관총을 쏘던 그가 좋다 
9,"전문평에선 대차게까던데, 2편까지 봐야만 람보가 완성된다. 이후부턴 뭐...그냥; 1편에서 평화에찌든인간과 전사간의 충돌로 비극이 일어났다면 2편에선 적재적소, 말없던 람보가 못했던 표현을 몸으로 직접 행사한다. 전..."
9,"람보1은 반전영화로서 명작이지만, 람보2 역시 슈퍼솔저물의 시초격인 명작이다. ""조국도 자신들을 사랑해달라""는 메시지도 담겨있고 특히, (시간관계상 비약이 있지만) 사랑하는 여인을 잃고 등장하는 그 유..."
9,마지막 헬기 개박살 장면은 요즘 영화와 비교해도 손색없고 더 화끈하다 
8,85년 피카디리에서 개봉했을때 줄선 사람들 끝이 안 보일정도였음. 
10,지금은 허술한 특수효과~~하지만 23년전 당시만해도 전설그자체였다.. 
10,결말이 상당히 멋있었던 영화 
10,네버다이 람보 
9,록키와 람보을 병행하는 스텔론.. 액션영화의 신격 
8,1보단 못하다..액션에 좀 더 중점을 둔 영화..그래도 좋긴 하지만.. 
7,영화는 1편이 좋지만 그래도 람보 
9,살인기계의 쑥대밭 액션 
10,목걸이 짧은 거 죵나 신경쓰이네 
10,다시 봐도 멋있는 영화다 
10,무적람보 
8,무적 람보 이미지를 만든 작품. 많은 명장면들을 만들어낸 작품. 하지만 요즘 보기에는 액션이 적었던 전작보다도 지루한 느낌이 살짝 든다. 미국우월주의? 비판을 위한 영화가 있으면 미화를 위한 작품도 있다. 시야를 넓...
5,람보는 호감상이야... 
7,람보의 꼭지는 여기. 
10,80년대의 전설! 실베스터 스탤론... 그당시엔 일당백이었다! 
6,대중적으로 가장 잘 알려진 람보의 이미지가 아마 2탄일듯 
6,스펙터클을 뒤집어 썼지만 나름 성공적인 속편. 장쾌한 액션. 
7,전쟁후유증 군인을 그린 1편에서 액션 요소만 빼와서 흥행물로 만들어낸 솜씨 
7,속편은 원편을 뛰어넘을수 없는건가? 
7,람보 짱! 
6,역시 전작만 못하구나../ 
6,지루한편 
6,초반의 지루함은 후반에 가서 잊어라! 
7,그 시대를 알게 해주는 영화 
6,다 죽여버리겠다!! 
7,당시 시대상이 살아있는 영화 
7,당시 시대상이 살아있는 영화 
6,최고의 걸작 액션물로 기억함 
7,스텔론은 시리즈 영화를 너무 많이 찍는다 
5,보통은 된다 
7,"영웅, 그 한 사람을 만들기 위해 많은 목숨이 사라지느니... "
6,OO 베트남하고 다시 맞짱까든가 
6,월남전의 미국 히어로식 재해석 ... 
7,이때부터 람보는 전쟁의 고통에서 벗어난 초인이 됐다. 
7,람보는 무적이다 
5,현실성이 너무 없으니 패러디를 하지... 
6,전편에 비하여 주제가 흐려지고 고전액션이 되버리다 
4,정말 시원한 초강력액션영화1 
6,스토린 뭐 그렇지만 음향효과가 굉장히 뛰어나다.. 
6,"액션은 멋진데, 스토리전개가 허술해 재미가 없다. "
7,2편까지는 그래도 볼만하네요! 
9,람보.. 2편부터 미제국주의의 심볼아닌 심볼로 이상하게 변질되어 가다 
9,몰입도 최고 ㅋ 전 1편보다 재밌었습니다 ㅎ 
5,당시에는 화끈한 액션이었겠지만 지금 보기엔 그냥 총질에 어설픈 음향효과와 어색한 조연 단역들의 연기 
5,우리가 알고 있는 `일당백 람보`의 탄생. 영화는 어설프.. 코만도가좋아 
6,"액션과 스타일 멋지다. 그런데 제대로 즐기게 하려면 적어도 이렇게 몰상식한 주제는 벗어나야 하는 거 아냐? 고등학교 2학년 때 이런 부류의 영화를 아무 생각 없이 재밌게 볼 수 있었던  기억은, 당시 미성숙했던 나의..."
6,1편에서는 액션 속에 람보의 외로움과 사회비판적 메시지가 어우러진 것이 좋았는데 2편에서는 그냥 액션영화가 되어버린듯 
6,볼만한 구색은 갖췄지만 1편과는 평행세계라고 느껴질만큼 이질적인 게 문제. 
7,볼거리는 풍부해졌는데 뇌가 텅 비어버리는 느낌.. 왜일까? 
3,전편에 보여주었던 명분은 모두 어디로 가고 액션만 남아... 
4,전편보단 좀낫다 그래도 말도안됀다 액션만 있다 
4,무미건조의 정도를 지나친 헛탕질. 
3,스탤론의 전형적인 막무가내파식 오락작품 
1,람보 4를 대비해 봤을뿐 재미없다 
5,35년전 영화라고 하지만 극중 내내 사실감이 너무 떨어져 헛웃음만 나옴. 맨 마지막 람보가 기관총으로 흔들리는 장면 있는데 설비들은 멀쩡하고 책상위의 페이퍼만 요동친다. 매우 실망 
6,가장 대표적인 미국뽕 전쟁 히어로 액션물 
8,이 영화를 모는데에는 눈알과 시신경만 있으면 된다. 요즘엔 쓰레기 영화로 보임. 
2,good 
3,'람보'라는 훌륭한 반전물을 소재로 만든 쓰레기 액션영화! 
6,한시대를 풍미했지만 생각을 많이할수록 평점이 낮아지는 건 어쩔 수 없다. 
1,람보1 과 2를 비교하면 완성도와 흥행 사이에 큰 상관이 없다는걸 알게 된다. 
7,1편보다 액션신만 늘었을뿐 1의 감동을 따라가지못한다.억지로 스토리를 만든느낌과 오글거리는대사가 거슬렸다 
2,전작의 똥칠. 
5,허술하고 어설픈 스토리 전개 
3,람보라는 훌륭한 반전물을 이따위 미국만만세영화로 만들다니 
1,넘 잼이 없다. 
4,시원시원한 액션 외에는 너저분. 
1,람보 혼자 세계통일할 기세네ㄴㅈ 
2,1탄보고 기대한 내가 바보였다 
3,박수칠 때 떠났어야 했다 
1,람보는 1편이 진리. 2편부턴 걍 상업성을 목적으로 만든 액션 아류작이라고 보면된다 
1,참....... 이래서 미국우월주의라는것이 무서운것이구나........에라이 샹 
