score,review
10,지금보면 특수효과가 다소 후져보일지 모르나 그당시에는 정말 연출이라던지프레데터의 스텔스나 프레데터의 시점 다채로운 무기등 꽤나 충격적인 시퀀스였다. 
7,청소년 관람불가인데 비디오가게 주인은 아무말 없이 빌려줬다. 
9,아놀드 슈왈제네거와 프레데터의 숨막히는 대결 장면은.. 아직까지도 명품. 
10,이거 재미없다는 놈은 나사에 신고해라 외계인이니 
10,아놀드 형의 근육 이 땐 정말 대단했지유. 재밌어유. 잔인한 장면이 많으니 임산부나 노약자는 관람 금지에유. 
10,역시 구관이 명관이다. 
10,어릴때 정말 재밌게 봤는데 ㅋㅋ 그 프레데터 헬멧시점에서 특유의 기계음 소리가 아직도 생생하다 긴장감 쩔어줬지 ㅋㅋㅋㅋ 
9,이 얼마나 힘있는 SF영화란말인가ㅜ압도적인 존재에대한 발악.왜 요즘은 이런영화를 못만드는걸까.  맥티어난감독님 좀... 
9,24년전 작품임에도 시리즈 중 이 원작을 뛰어넘는 영화가 없다 특히 마지막 액션씬은 단연 압권 
10,터미네이터와 함께 아놀드 최고의 작품임. 
10,장난 아니다. 지금봐도 재밌네. 요즘 나오는 지루한 양산형 쓰레기영화들과는 비교가 안되는 작품. cg는 엄청나게 발전했는데 왜 영화는 점점 재미없어지는지 모르겠네 
10,"그누가 감히 이영화를 폄하할수 있는가?  지금봐도 구성,음악,연출은 흠잡을때 없다. "
10,"쩌네 ㅡㅡ 말안나온다,. 감독천재니 ? "
10,명작이라 지리고 87년작이라는 거에 한 번 더 개지리고 갑니다 ㅠㅠ 
9,박진감넘치고 87년 영화인데도 전혀 촌스럽지않다.오히려 요즘 영화들보다 스토리는 더 탄탄하고 군더더기가 없어서 더 재밌음.또 봐도 재밌는 SF수작. 
10,할리우드는 80년대에도 이런 완성도 높은 영화를 찍었는데..우리나란 2015년에도 이런 영화를 찍지 못한다.. 
10,대작중의 대작............. 
10,어릴적 친구집에서 아무생각없이 비디오테잎빌려서보고 그 충격의 여파가 오래간 몇안되는영화 걸작중의 걸작 연출부터 음악까지 영화음악은 엘런 실베스트리 정말 미친영화 
10,행님..... 
10,왜 이런 영화를 이젠 만들지 못하는가!? 심지어는 감독 본인 마저도... 
10,개인적으론 그냥괴물인 에일리언보다 신념을 중시하는 프레데터를 더좋아한다 
10,밀림의 왕 프레데터 vs 전성기의 주지사. 
10,이런게영화야 ㅋㅋㅋㅋㅋ 
10,지금까지 살면서 20번도 넘게봤다..  말이필요없음 명작 
10,세월이지나두 내인생 최고의sf영화 한순간두지루하지않구 긴장감최고 
9,빌리형 포스 쩔다가 .. 허무하게 죽었어.. 
10,지금ㅂ 재개봉 되어도 문제 없는 수작중의수작 
10,전설의 명화 ㅋ 다시봐도 재밌다. 프레데터 시리즈는 그냥 딴거는 보지 말고 이것만 봐야 제맛. 
10,이 작품이 무려 87년도 작품이다. 대단하지 않은가?? 
9,"지금 보면 CG가 좀 거슬리긴 하지만 정말 재미있는 공포 액션 영화, 나중에 좋은 감독과 배우로 리메이크 되길 기다려본다 "
10,"맥티어난 형님은 다이하드, 프레데터, 붉은10월... 이 3편만으로도 인류공헌도 평점 10점임. "
10,터미네이터의 아놀드보다 프레더터의 아놀드가 더 강인하고 강력해보인다 
10,다들 개봉 당시 지금처럼 정보가 없던 시절 람보나 코만도같은 부류의 영화인줄 알았지만 정말 이런 시대를 앞서간 걸작이 탄생했다. 몇번을 다시 봐도 SF 액션 호러 스릴러 요소가 모두 멋지게 조합되어있고 쫄깃한 긴장감...
10,이 영화가 걸작인 이유는 파격적인 컨셉의 스토리가 가장크지만 배우들의 연기 또한 일품이라는 거지..가장 신선했던게 프레데터의 시선에서 바라보는 시각과 음성효과들..근데 요새는 이만한 sf물이 안나온다는게 정말 안타까...
10,카우보이 모자쓴 군인 자동화기 발칸포인가 그게 너무 멋져 현실감있고 정글에다 갈기니 들판되버림... 학창시절 이영화 개봉때 극장서 보고 쫄았던 기억이 선하다... 그냥 그속에 몰아일체가 되어 덜덜떨며 온몸에 힘들주며...
10,쉬이익....푸슈숙...쉬이익...후우...크하하하하!! 
10,이건 개명작이다. 진짜.. 존맥티어난의 그야말로 초특급 액션 교과서임.. 
10,개인적으로 에이리언보다 더 재밌는 듯ㅋㅋ긴장감이랑 몰입도가 장난아니고 보는순간 처음부터 빠져듬. 아놀드 진짜 멋있고 결말도 난 맘에듬ㅋㅋ 
10,3류극장에서 이영화랑 실베스타 코브라 둘중뭘볼까 하다 이영화 보고 충격자체 였슴.... 공포영화 보는줄... 존멕티 감독 이작품 후에 다이하드도 개재미었슴~ 
10,티비해줄때마다 본다 캐릭터 모두 멋있다 
10,지금돌이켜보면 80년대 최고의영화다 
10,가끔 생각날때마다 보고또봐도 재밌어서 놀랍고 30년된 영화라서 또 한번 더 놀랍다. 
10,이런 명작을 아직도 안보았는가... 
10,아놀드는 외계인까지 잡네... 
10,아놀드 행님 잘 나갔을때 모습 개쩐다 ㅎ너무 재미 있게 잘 봤다 
9,그시절 어설픈 효과로 이정도 영화를 만드는게 대단하다 
10,그냥 말이필요하나? SF스릴러 크리쳐물 매니아면 이건그냥 최고다 
10,당시 어릴때 봤을때는 센세이션이었음 
10,머드팩이 좋다는걸 알려준작품 
10,지금 봐도 손에 땀을 쥐게 하는 스릴 넘치는 영화!! 
10,"SF물을 이렇게 스릴있게 만들다니.. 이후 수많은 아류작이 나왔지만, 프레데터의 원작을 뛰어넘을 수는 없다 "
10,너무 재미있어서 꿈까지 꿨던영화 
10,"전성기의 존 맥티어난 감독과 아놀드, 그리고 숨겨진 공로자인 스탠윈스턴이 함께 만들어낸 sf 액션영화의 표본. 각종 사운드나 외계 생명체의 디자인 등 흠잡을 곳이 없다.2편을 제외한 ,후에 개봉한 졸작들조차도 뛰어난..."
10,그당시에 프레데터의 성격 관습 문화등을 이 영화한편으로 다표헌한것같다 다단하다 정말 프레데터는 희대의 케릭터다 그걸 지금은 못살리고 B급 영화로 나온다는게 아쉽다 
10,"어릴 때 봤을때는 진짜 최강이었음,,  커서 봐도 대박! "
10,아놀드 대표작중 하나임 ㅋㅋ 
10,"사람이 짐승을 사냥하듯 사람을 추적하고 사냥한 다음 가죽을 벗기고 해골을 전리품으로 챙기는, 먹이사슬 피라미드에서 인류 위에 군림할 수 있는 압도적인 존재가 어딘가에서 살아가고 있다는 상상은 인류의  인구 증가를 억..."
10,그거아냐? 지금봐도 재밌다 효과도 너무 튀지않고 재밌고 스토리도 똥줄탄다 
8,정말 무서웠죠... 명작입니다... 
10,고딩때 공포물에 프레데터2가 있길래 그냥 봤다. 웬걸 처음들어보는 영화가 웰케재밌냐?  근데 1은 없어 못봤는데 20년이지난지금 30년된영화라 손이가질  않았다. 근데 이보다 뛰어난 sf스릴러를 지금까지 본적이 없다...
10,안보면 당신만 후회  봐도봐도 안질리는 이유가 정말 액션물로는 보기드물게 군더더기없는데다 호러를 적당히 가미한 감독의  깔끔한  전개능력 
10,터미네이터2와 함께 내인생 최고의 sf 영화 
10,"이건 지금봐도 역대급이지 당시에 받은 충격은 상상초월 클로킹이라는게 그렇게 막 쓰이던 시절도 아니었는데  아마존밀림에 최첨단 외계인이라니 .. 게다가 싸움은 원초적인 도구들만 사용 .. 그 특이한 야성미, 마초, 고..."
10,나에게 리메이크 1순위다. 
10,나이 30넘어 또봐도 집중하게돼는 몇안돼는 대단한영화 
10,아놔.슈퍼액션ㅋㅋ군인 가죽 벗긴거.몸통 자른게 영화의 압권인데..흐리게 하냐?지우지 말고.원작 그대로 보여줘라. 잔인한건 다 지웠네..프레데터2도 지워서 망쳐서 보여주겠지?ㅋㅋㅋ내가 다운 받아 봐야겠다.이런 영화는 ...
10,액션스릴러영화의 결정판 
10,87년 고3 여름방학때 삼원극장 점심 1시에 들어가서 3번보고 나오니 밤이더라! 역시 아놀드의 비쥬얼은 프레데터! 
10,지금 봐도 전혀 어색하거나 이상하지않고 다시 계속 봐도 정말 재미있는 영화에요 명작임 
10,프레데터 그당시에 왜이렇게 무서웠는지 덜덜 떨면서봤죠 
10,왜 프레데터는 최근나온 에이리언처럼 다시안만들지 ㅠㅠ 진짜 괴수sf영화중에 top1인데 .. 
10,나의 헐리우드영화 첫입문작 레알 충격이었다 
10,에이리언2와 함께 외계인 SF에한 획을 그은 걸작!!더이상 무슨 말이 필요한가 
9,"어릴 때 시체를 봤는데.. 완전히 난도질  당한 모습이었어요.  그걸 보고 할머니들은 이상한 소릴 지껄였죠, 유난히 더울 때면 이래요. 올해는 불덩이 같았죠... -프레데터 안나의 대사중- 이번 여름 처럼 더운 날씨..."
10,청소년관람 불가? 87년 인천 인형극장에서 사촌형 손에 끌려가서 보고 며칠을 악몽에 시달렸던... 
10,그냥 남자 영화임 프레데터도 대단하지만 초반 팔씨름 씬은 남자들의 숨어있는 마초 본능을 자극한다. 
10,아버지와 함께 단성사에서 보고 왔던 당시 최고의 명작 
10,세치혀로.. 무슨 말이 더 필요하냐?? ^^ 존맥티어난 감독의 화려한 등장~! 새로운 캐릭터 프레데터의 등장~!! 에이리언과의 대결은 필연적이였음..ㅋㅋ 
10,교과서... 
10,EBS 고맙다 이런 명작을 이제 보게됐다. 87년도면 한국에선 공룡인형쓰고 만들시절인데 CG가 정말 대단하다 ㅋㅋ 
10,재밋다 옛것이좋은겨ㅎ 
10,영화 프레데터라고 하면 오직 이 영화만이 프레데터다. 
10,오랜만에 케이블로 보는 프레데터 HD로 보니 새롭네~~역시 명작...수십번 보았지만 도저히 중간에 끊지 못하고 엔딩까지... 명작중 명작 
10,세월이 흐른후 봐도 터져나오는 감탄사 
8,제대로 된 명작... 1:1 대결구도를 가진 영화 중 백미 
10,이런 영화 이제 못만드냐 
9,이런 유일무이한 sf최고 소재의 캐릭터를 생기게 했다는것도... 그 캐릭터를 잘살려서 영화와 맛깔나게 잘 버무렸다는것도 꽤 괜찮은 점수를 줄만하다 
10,아놀드 슈왈제네거 할배 카리스마 짱!!!! 25년 지난 지금봐도 명작 
8,마초들의 향연..  그리고 그들을 사냥하는 프레데터! 
10,프레데터 형님이 마지막에 외계장비 벗어던지고 아놀드형님한테 맨손대결 신청할때 온몸에 전율과 소름이 확돋는다. 이게 진짜 남자의영화. 
10,"공포.스릴러 & SF 로  길이남을 명작, 여기에 꼴통 감독 셰인 블랙'이 단역으로 나왔구먼? ㅎㅎ 헌데 어찌 그런 어처구니 없는 망작을 만들었을까 (ㅡ.,ㅡ;)a "
10,에일리언도 두부썰듯이 학살하는 프레데터를 1:1 로 잡으신 아놀드성님 
10,"캐릭터, 디자인, 시각효과, 음향, 음악, 모든 요소가 하나도 빠지는게 없이 완벽하게 조화를 이룬 작품. "
10,아놀드(터미네이터)의 최고의 명작 
10,당시에 정말로 쇼킹했다. 
10,"이게 87년작이라니 말이 안나올 정도다.그냥 모든씬이 다 박진감 넘치고 재밌다! 중간에 소련 고문관들 헬기로 탈출하려다 아놀드 행님의 유탄발사기맞고,헬기 폭팔나는거 웃겼네! "
10,당시 엄청난 몰입감을 가져다 준 액션물이다. 프레데터 외계인은 그냥 지금까지 외계인의 한 종족으로 대명사가 되버린 캐릭터이다. 영화의 홍수시대에 보면 그저 그렇지만 당시 엄청 재미있게 봤다. 
10,얘들아 무수단 보고 눈과 귀가 썩을듯하여 분노를 머금고 아놀드횽이 출연한 프레데터를보고 글을 남긴다..이영화 87년도영화야 보면 믿겨지지가 않을영화다 ㅎㅎㅎ 
9,아놀드의 논스톱 액션 보이지 않는 적을 쏴라 
10,"아 옛날이여,, 정글/ 특수부대/ 근육/ 음모 !!! "
10,이 영화 만든 감독이   다이하드   13번째전사   붉은10월 만든 감독임 ㅎ 
10,긴장감 조성으로는 에이리언과 쌍두마차 
10,"막판 대결이 재밌다.,. "
10,위대한 영화 더이상 말은 필요없다.지금 봐도 쎈세이션 이후부터2부터 프레데터는..그냥 쓰레기 프레데터영화는 1만이 가치가 있다. 
10,신의한수 명불허전 
10,개 꿀잼이네 ㅋㅋㅋ 근데 진짜 핵못생김ㅠㅡㅠ 
10,"극장에서 봤을 때의 그 공포, 벌써 30년 전이구나. "
10,더프레데터를 보니 이 영화가 왜 명작인지 알게 되었다.. 
10,"후속작, 리메이크는 오리지날을 따라갈 수 없다. "
10,프레데터시리즈는 1편이후 나오지말았어야했다! 역시 존 맥티어난감독은 액션영화하난 기가맥히게 만듬! 
10,외계 괴수 영화의 걸작. 
10,지금보기엔 너무 구시대 영화긴하지만 그 점만 벗어난다면 정말 멋진 영화. 아놀드형 리즈시절 프레데터와의 맞짱씬은 진정 최고다. 
6,진흙 바른 아놀드는 멋있었다. 
10,SF.공포.스릴 모두 갖춘 명작이다 후반후 아놀들형의 비장함이 영화의 무게를 더 해준다 
9,잊을 수 없는 사운드와 마초.. 그리고 프레데터의 시야 
10,오늘 tv에서 프레데터스 하길래 문득 생각나서 다시 봤지만 역시 명작...영화를 여러번 봐서 줄거리를 다 알고있는 상황에서도 나도 모르게 빠져드는 몰입감은 명품영화 라고 표현해도  아깝지 않을 정도 정말 재밌는 작품...
10,최고의명작 
10,"터미네이터1도 그렇지만, 저 시대에 참 대단한 시나리오에 대단한 그래픽이야. CG가 난무하는 요즘영화보다 외려 중후하고 핵심적이고말야.요즘 영화는 CG가 너무 난무하고 시나리오도 장난같아서 무슨 애들 애니보는거 같다..."
10,원조를 이제야 본게 아쉽네요.. 
10,진짜 남자의영화다ㅋㅋㅋㅋ 보면서 남자의 브금과 남자 아놀드 형님의 생존은내 심장을 뛰게했다 
10,이거 한 열번은 본듯... 계속봐도봐도재밌어.. 
10,"영화가 이제 27년이나 지났지만, 최근 어떤 영화보다도 더 흥미롭다. "
10,'진짜'외계인이 나타나면 바로 이런 기분일거라고 실감나게 느꼈던 유일한 영화... 
10,긴장감 쩔어 
10,아놀드 너무 멋지죠 ! 프레데터 도 정말 멋져서 볼만했다는.. 
10,최고~~~!!!! 아놀드형님 그때가 그립네요 ^^ 
10,30년이 넘은 영화.의상이나 배경 특성상 지금봐도 전혀 이질감이 없다.줄거리나 연출도 아주 훌륭하다.에이리언 소재의 영화는 오히려 8090 영화들이 작품성이 더 좋은듯...요즘 sf는 걍 cg 관람. 
10,아놀드 머드바르고 일대일 싸우는 마지막 장면은 진짜 대박이다 
10,그당시 80년대에 기술로 이런 이야기와 영화를 만들다니 진짜 감독 천재다 전혀 프레데터 분장이 어색하지도 않고 지금 시대에 똑같이 분장해서 나와도 전혀 꿀리지 않는다 CG만 현대기술로 다시 그대로 이스토리 그대로 만...
10,더프레데터 같은쓰레기영화좀 그만만들고 이런거좀 만들어라 ㅉㅉ 
10,"아무도 없는 정글에서 마지막 사냥감을 죽이기 위해 열감지카메라로 찾아다니는 외계인과 바로 앞에서 진흙범벅된 아놀드가 공포에 질린눈으로 사냥꾼의 모습을 봤을때의  공포, 두려움, 긴장감이 이 영화의 주제입니다. 관객모..."
10,오래된 영화인데도 긴장감쩔어 
10,당시로서는 파격적인 설정과 피냄새 땀냄새 진득하게 긴장감 넘치는 연출은 cg로 범벅하여 화려한 시각효과만 가득한 요즘 영화가 따라가기 힘든 명작 
5,괴물보다 더 괴물같은 아놀드 
9,프레데테의 아이디어는 sf 영화에 큰 영감을 줬다 
10,보고 또 봐도 안질리는 진짜 웰메이드 액션물이란 무엇인지 보여주는 작품 강추 또 강추 
10,아직도 프레데터를 따라 올 외계인 영화는 없다 
10,프레데터의 탄생. 습한 정글속에서 정체를 알 수 없는 존재와 숨막히는 추격전 
10,전설의 시작이다 프레데터의 천적 아놀드형님 
10,캬... 학생 때 참 대단했던 영화다. 10점이 절대 아깝지 않지! 
9,긴장감에 숨이 멎을것 같았다 
10,'명작' 31년전 영화인데도 긴장감이 대단하다 
10,저 인생에 최고의 명작 영화 
8,보이지 않는 적의 무서움.. 
10,프레데터.. 그 전설의 시작 
9,"대단한 긴장감과 음향, 30년전 작품이라고 맏겨지지 않을맡큼 완성도가 높다. 어렸을때 너무 충격적이었고 재밌었던 기억이 난다. "
10,희대의 걸작 SF 영화. 
10,2017.0830 지금도 케이블티비에서 보고있다.. 너무 재밌다.. 최고!@ 
10,지금봐도 여전히 재밌다 역시 옛날 영화들이 명작이 많어 
10,외계인 질럿의 죽탱이를 날린 유일한 인간 아놀드형. 이 영화를 보고 어떻게 존경 안할 수 있겠습니까?^^ 
10,개꿀잼이다.. ㄷㄷ 명작이다.. 
10,진정한 프레데터 시리즈의 진수. 역시 1편을 능가하는 후속작은 없었다.긴장감 스릴 몰입도 최고의 영화 명작이다 말이필요없다 
10,2019년도에 봐도 개쩔 역시 아놀드 
10,아놀드 슈왈츠제네거 주연의 걸작 SF 
10,이거 초딩때 TV에서 하던거 본 이후 그날 잠 못잤음.. '만약에 프레데터가.. 우리 아파트에 나타나면 어떻게 하지..? 그 근육질 아재들도 못이겼는데 경비아찌나 아빠가 이길리가 없잖아ㅠㅠ 넘무성.. 현관문도...
10,긴장감 스릴 몰입도 최고의 영화 이후 시리즈는 발끝도 못 미친다고 하면 과장이려나? 도대체 왜 후속편을 만들었는가?! 개인적으로 프레데터 에일리언2 터미네이터1이 최고의 액션 영화다 
10,넌 정체가 뭐~~~~냐  으하하하 으하하하  이거 명대사임ㅋㅋ 프레데터 웃음소리 어릴때 너무 무서웠는데.. 
10,난 이 영화 8살때 밤에 혼자 보고.. 성인이 된 지금도 가끔 프레데터한테 쫓기는 악몽을 꾼다.. 
10,정글에서의 긴장감 돋는 전투 
10,"마지막에 프레데터의 대사가 기억에 남는다.""그러는 넌 뭐냐?"" "
10,",,아놀드는 대단한 배우.,..마지막대결,추격전은 ,,,숨막히는 긴장을 넘어 경이롭기까지 하다..진흙얼굴 감독과 배우에게 경의를 표한다.. "
10,어제 더프레더터 보고 왔는데 어찌된게 31년전 프레데터보다 잼없었어요 집에서 VOD로  다시봤는데 연출력 음향분장이 이번에 개봉한것보다 훨신 잘만들었다 생각합니다87년도에 어찌 저런 상상력과 연출의 디테일이 살아있는...
9,반쯤 넋이 나간 더치는 어찌되었누... 
9,니덜이 87년도에 살아 보긴 했냐?이런게 명화 라는 거다. 다시는 없을... 
10,저 당시 프레데터란 영화가 내게 준 충격은 엄청났다. 
10,전 세계를 떠들썩하게 했던 스텔스 우주인 사냥꾼의 첫 시작. 
10,가장 아놀드다운 영화! 
5,밀리터리 액션과 SF 크리처의 절묘한 장르 혼합 
10,보이지않는 적과 그 적이 조금씩 숨통을 조여오는 최고의 긴장과 음향에서오는 스릴감은 액션영화의 정석을 보여주는 듯하다 최고의 액션영화다 
10,엄청난 긴장감과 몰입도.... 아놀드형님의 발연기빼고 지금봐도 시대를 초월한 명작이다. 
10,개인적으로 아놀드 최고의 영화라고 생각 
9,신선한 적외선 연출과  슈왈제너거만이 가능한 연기. 프레더터한테 넌 도대체 뭐냐고 들을할만한 그 시절 몸이란. 
10,"2020년 넷플릭스에서 또봅니다 ~ 1987년작, 30년이 훨씬더지난명작이지만, 이영화때문에 선호하는 영화장르가 sf가 됐죠 ~ 슈왈츠제네거와 프레데터와의 명장면은 두고두고 회자될듯합니다 ~ ^^ "
9,"넥플릭스에 올라와 있길래 그냥 봤는데.. 이게 30년 전에 만든 영화 맞냐?? 조잡한 외계인 레이저총 CG 빼고는 연기, 시나리오, 연출 다 쩐다 쩔어 ㄷㄷㄷ "
10,요즘 나오는 프레데터 시리즈가 하도 거지같아서 오랜만에 다시봤는데도 명작이다 1987년 작품이라해도  요즘 나오는 영화랑 별차이 없이  아주 훌륭함. 
10,아직도 프레데터와 아놀드가 최후에 나누었던 대사가 잊혀지질않는 다.아놀드: 넌 대체 뭐냐?프레데터: 그러는 넌 대체 뭐냐? 
10,두번째 베댓 개웃기다 ㅋㅋ 핵공감 나도 비디오만화책방 아주머니가 초딩이였던 우리한테 에일리언 빌리게해주셨었는데 
10,밀리터리 sf의 독보적 
10,더프레데터 보고왔습니다 늪지대에 빠졌을때 그 긴장감이 그립네요 
10,보는 내내 팽팽한 긴장감을 느낀 영화.. 아무리 생각해도 이 영화 말고는 이정도의 고급진 긴장감을 선사한 영화는 없을 듯 
10,벌써 31년전이구나. 지금봐도 촌스럽지않고 꿀잼. 완전 명작 
10,이 영화 대박!!! 처음부터 끝날때까지 숨도 제대로 못 쉬고 본 영화!!! 
10,이 시대에 이 소재로 너무나도 잘 만든 긴장감 대박 넘치는 영화! 10점을 주지 않을 이유가 없다. 
10,"슈왈제네거 위장보고 반성해라 대한육군.본 지 몇 년이 지났는데도, 프레데터 비주얼은 잊혀지지가 않네. 대단한 크리쳐물. "
10,30년전에 이영화라니 잘만든 영화일듯 
7,보이지 않는 적에 대한 공포와 서스펜스 
10,중요한건 이때 아놀드 형님은 벌써 만40...30대로 보였는데 ㄷㄷㄷ 
10,아뇰드 횽님의 영화를 논할때 결코 빠질수 없는 레전드 오브 레전드 
10,"강자의 '약탈'을 넘어선, 약자의 '사냥'을 아놀드 형님께서 보여주신다... "
10,"비디오테이프 빌려보던 시절, 가슴 졸이고 봤던 최고 짱짱 영화. 지금 봐도 넘 재밌음. "
10,SF액션 영화의 교과서 같은 작품 
10,아놀드형님의전성기라서 재미있는영화 
9,아놀드의 근육과 프레데터의 기괴한 설정과 디자인... 지금 봐도 재미있다. 
10,"보세요, 재밌습니다. "
10,세월을 멈춰버린 작품이다. 이 영화가 촌스러워서 못볼지경이 될 시기가 올지 
10,전설적인 영화다 무조건 봐라 
9,아놀드의 80년대 액션 마스터피스 
10,최고!상상력이 이정돈 되야지 
10,첫 관람을 7살때 했는데 간만에 생각나서 다시 시청하니 엊그제 같던때가 27년이 지나버렸네... 31년이 넘은 영화지만 촌스럽지도 않고 작품성 긴장감 몰입도 요즘 영화 울고간다.. 
9,언제나 다시봐도 재밌는 영화 인간과 외계인의 싸투를 다룬영화 
9,진정한 마초들의향연 
7,유치하기도 하지만 안 보이는 데에서 오는 공포감을 잘 이용했다 
10,이때영화들은 노무재밌어 80 90년대 
10,지금도 느끼지만 좋은영화는 80년대에 가장 많이 나왔다고 생각함. 
10,걸작이라는 말밖에 딱히 떠오르지 않는다. 
10,개명작 진짜 그냥 잘만들었다 
10,넘을수 없는 사차원의 벽. 
10,마초들의 향연 마초영화의교과서 
10,고스트쉽보고 이거보는데 87년영환줄모르고 오프닝장면에 20세기폭스가 일부로 복고스럽게해놨네 했는데 1987년 영화..토요명화에서 본 사람들 많네ㅋㅋ 
10,다이상말이필요할까?!!!내가중교때본거지만지금나오는블럭버스터급보다더훨씬잼있지!!지금도너올때마다항상새럽게보신다!!놀드형영화보는거만으로영광이다!!! 
9,"어렸을때 비디오로 보고,케이블방송에서도 보고 2020년에 넷플릭스로 다시 봐도 명작임 "
8,네이버 영화 정보에 “줄거리” 쓴 새끼 나와^^ 
10,
10,다시봐도 웬만한 영화보다 훨 낫다아버지 손잡고 영화관에서 봤었는데추억 돋는다 
10,진짜 역대급 내가 보던 영화중에 재밌엇다 
10,프레데터 멋진 싸움꾼인줄 알았는데 졸렬함 
10,와 이게 87년도 작이라니.. 대단한영화 
10,Dillon!! You son of a bitch!!!! 
10,말이 필요한가 몇번을 봐도 질리지가않는다80년대작품이라는게 믿겨지시는지.. 
10,1987년도 영화인데.. 쩐다.. 
10,지금 ebs에서 보고있는분들ㅋㅋㅋ진짜 재미있네요 정글을 배경으로 이런 액션영화는 두번다시나올수 없을듯 2편도 재미있지만 1편이 최고네요 젊은 아놀드와 칼웨더스의 근육뿜뿜이 킬포인트 
10,"19금 SF스릴러 액션 영화의 명작!! 진짜 정글의 느낌과 군인들의 땀방울 하나하나 까지도 같이 느껴지는거 같다. 액션과 내용 참신함 등등은 말할것도 없고 ㅋ 이런 영화야 말로 9, 10점 받을 영화다 별의별 액션 ..."
10,SF명작중에 탑급임. 
8,아니 양화줄거리 보라왔다가 스포당했네 줄거리에 스포는왜넣은거죠?ㅠㅠ빼주세여!!! 
10,"난 국민학교때 어머니께서 빌려주셨던 영화 그건 명작이었고, 아직까지도 정글만 나무 잎파리만 보면 프레데터가 나올것같다 .... ㄷㄷㄷ "
