score,review
10,ebs에서 보는 중이신 분 세기의 명화 
9,리처드기어의 젊은 시절 매력이 철철 넘치는 명화..감정연기는 정말 최고인 배우다 폴리교관의 탈락종용에 퇴소하면 갈곳이 없다는 울부짖음은 이영화의 백미..이행님은 마지막지막에 여친데리러 가기가 취미네..프리티우먼이나 ...
10,화려하지 않지만 멋진영화였음..데브라윙거가 참 이쁘게 나온영화입니다. 
8,"30년만에 봤네요. 내용은 가물가물 했지만, 감정은 그대로네요. 근데, 그때의 풋풋했던 나의 청춘은........... "
10,리차드 기어... 정말 멋있다.. 주제곡도 최고 ㅎㅎ 
10,요즘은 이런영화가 왜 안나올까 최고 
10,젊은 리처드 기어와 데브라 윙거를 보는 것만으로도 유쾌함. 
10,옛날 생각 나는게 너무 좋았어요. 곡도 친숙하고~ 굿굿굿~ 
9,보고싶었는데... 이제야...ㅎㅎ 
9,"오랜만에 보니 옛날생각나게 하는 영화입니다. 조연들도 몇해전까지 유명했던 인물들이죠. 특히 호라시오반장의 어릴적 ㅋㅋ 탑건, 지아이제인등의 영화에 모티브를 준것 같은 느낌 그시대치고는 내용좋음 "
9,온갖 재미의 요소가 곳곳에 배치된 잘된 시나리오 
10,젊은 리차드 기어의 모습은 정말이지 멋있네요. 보고 나면 가슴이 뜨거워 지는 영화. 
8,"시드와 르넷 커플, 이 대단한 조연들이 아니었다면 빛나지 못 했을 엔딩. 그래서 더 여운이 오래 남는 영화. "
8,귀여운 여인과  투탑으로 리차드 기어 영화중 최고지.. 
7,토관과 신토 ㅋ 원래는 미해군 항공장교후보생학교의 생도를 일컫는 '학사장교'를 뜻하지만 잘못 번역한 제목이 오히려 더 좋은 영화. 리처드 기어에 의한 리처드 기어를 위한... 
10,1982년 작 맞나?! 테일러 핵포드 감독 최고의 마스터 피스! 주제곡 Up Where We Belong과 절묘하게 맞아 떨어지는 엔딩 장면과 사관 학교 졸업 장면의 세련된 미장센이 주는 아찔함과 아련함이란..『칼리...
8,마지막 장면과 주제곡이 인상적 
8,지금에서야  보게되었다 유지하지만  저시대 영화를 봤더라면.....리차드기어 정말  잘생겼네 ㅋ 
9,데브라 윙거의 젊은 시절은 쵝오닷! 
10,방방금 ebs에서 봤습니다.한 남자의 성장과정을 볼 수 있었고 무엇보다도 순수한 사랑이 돋보인 영화입니다. 
9,반지 삼키고 목맨 넘만 불쌍한거야.. 
7,명불허전 라스트씬 지금봐도 멋지다 
9,"견디어라, 과거는 잊고. 이 어려움을 믿고 이겨내면 승리하리라. "
10,역시 명작은 아무리 시간이 흘러 다시봐도 재미있다.. 
10,리처드의 간지.....ㄷㄷ 
10,재밌어요. 잠깐 본다는게 재밌어서 계속 봤어요.시드가 넘 불쌍하고 안타깝고 짠했음. 폴리 교관님도 멋졌음. 리네트가 조종사부인 돼보려고 그만.. 여자주인공 폴라가 역시 주인공이라 모든 운을 다 몰아 가지는듯. 
8,제복이 가장 멋있게 보이는 영화. 
10,가난한 여공들이 박수를 치는 장면이 특이했다. 폴라의 어머니야 당연하지만. 
10,해군 출신이라 관심있게 본 영화~ 
7,멋지게 나온 그리고 음악이 너무 멋진 80년을 대표하는 상징적인 청춘물 
10,테일러 핵포드 감독의 잊지 못할 걸작... 그 이후로는... ㅠㅜ 
8,재밌게 봤던 영화예요~ 
10,10점 만점... 
7,멋있어 리차드기어 마지막장면은 정말 명장면이네 
10,재미있게 봤어요^^ 
10,"인내는 쓰고 열매는 달다. 사랑, 일..모두 "
10,"볼때마다 찡한 감동을 주는 영화, 라스트신 아름다운 명장면이다. "
7,리처드가 군복입고 데브라를 안고 가는 끝장면은 사랑스럽다 
10,젊은 시절 보지 못한 것이 후회되는 영화. 
10,탑건과 비슷하네 역시 오래남을 영화 
10,리처드..옷걸이 한번 끝내주는구만... 
9,"마요 "" 보고 싶을 겁니다."" ㅡ 폴리 상사 "" 썩 꺼져.""  사나이들의 뻐근한 우정. "
10,저렇게 오래된영화 인데도 촌스럽지가않는지...연기도 음악도 스토리도 베리굿!!! 
10,이런 명화를보고도 별점 안주면 그게 예의가 아닌거 같아서 .. 
9,마지막 장면은 저런 남자가 되고싶게 만드는 순간. 
10,"재미와 감동, 슬픔에 야하기까지.. 그리고 나름 해피엔딩 "
10,best! 
10,Good! 
8,[8점] 난 언제 이런 사랑을.. 
10,리차드기어 옷 빼입었는데 너무 멋있다.. 
10,라스트 씬때문에 별10개 이같은 라스트씬 흔치 않아요 
10,장교를 꿈꾼다면 봐야할 영화.20년전영화가어떻게이렇게멋질까.. 
10,세상에나 30년만에 다시봤는데 재밌네요. 근데 기억보다 야하네.. 
10,뼈를 깎는 극기와 역경속에서의 한 남자의 성장을 심도있게 그려냈다. 
10,내나이와 같은 영환데 리차드기어 설렌다. Ebs에서 넘 좋은영화 봤음 
10,"역대급 엔딩..엔딩하나만으로도 길이길이 기억될영화지만,,몆번을봐도 질리지않는영화...소장용으로 강추!!! "
10,저는 25인데.. 명작이네요.. ㅋ 역시 외국영화는 시간이 지난영화일수록 명작인듯 
10,마지막 장면에서 데보라가 리차드의 모자를 쓴건 백미중의 백미..어메이징 할리우드 그레이트 어메리카 
8,마요네즈 생도 ㅋㅋ 예썰~!! 리차드 기어는 진리구나 
10,최근 tv에서 소개해주어서 봤는데 역쉬 쵝오~!! 
9,지금봐도 쿨하고 박진감 넘친다. 교관의 캐릭터는 전형이되었다. 
8,젊은 리차드 기어..그리고 토요명화 타이틀에 등장하는 유명한 라스트씬. 
10,평점10 결코 아깝지 않다. 빛나는 청춘물 
10,리차드기어 연기 진짜 죽이네요... 멋지다!! 
9,음악만 알다 영화는 이제서야~ 리처드의 자아찾기와 로망 멋짐 
10,그동안 안땡기는 영화여서 이제야봤는데.. 굿~ 
10,"엔딩, 음악과함께 잔잔한 감동.... "
8,멋진 영화다.. 
10,역시 리처드 기어.. 그 때도 너무 멋있었어요~ ^^ 
10,"꿈을 위해 악전고투 노력하며 피어난 사랑, 동료애, 명예 "
10,재미와 감동을 동시에. 두 번 봤다. 또 보고 싶다 
9,예전에 TV에 봤는데 정말 멋진영화.....또 보고싶다. 
10,"지금은 뻔하지만, 그래도 여전히 이 방면에서는 최고의 작품 "
10,시드얘긴없네ㅜㅜㅜ 시드 너무 불쌍하고 안타까움...ㅠㅠㅠ 
10,리처드기어 지금도 노년의 멋이 있지만 다시봐도 젊었을때 매력적이고 멋지네요~다시봐도 명작이고 로맨틱하네요!^^  저도 이제 51살이 된지금 어릴때 봤던 옛  명작들 시간나는데로 다시 찾아봐야겠다는 생각이들었습니다~ 
10,폴라를 안고 가는 마지막 씬은 정말 명장면이다 
10,이영화 보고 사관의 꿈을끼웠었지결국 장교(육군)가 되었지만 지금은 전역하여 평새의 장교출신이라는 타이틀은 영원히남으리~~~우리는 젊은 사관 피끊는 장교단♬ 
10,잠깐 본다는게아직까지 시청중요 ㅎㅎ 
10,최고 명작임 요새는 저런영화가 없네 
9,리처드기어 젊은 모습 인상적. 추억돋아서 좋았음. 
10,"테일러 핵포드 감독의 섬세한 연출과 리처드 기어,데브라 윙거,데이비드 키츠, 루이스 고셋 주니어 등의 연기 등등이 멋진 앙상블을 보여준 걸작! "
10,데브라 윙어 누님의 젊은시절 미모에 반했다 
10,obs에서 봤네요 재밌게봤어요 간만에 마음 설레게 하는영화네요 
10,무조건 10점.... 
10,35년전 영화라는게 안믿길뿐... 
10,OOO 마요가 성숙하게 신사가 되고 진정한 사랑을 찾는 영화 
10,리차드기어 는 진짜 멋진 배우 
10,"정말 매력적인 영화... 리차드기어,데브라윙거 "
10,리처드기어 너무 멋있다......... 
10,정말 정말 가슴에 남는 영화.. 이런 남자가 되고 싶다.. 
10,요거 보고 해군장교되기로 결심해 복무하고 있죠 ㅋ 잘만들어진 청춘영화 
10,학창시절 40번 넘게 본 영화....또 보고 싶다.. 
10,사관생도가 꿈이라면 한번쯤 봐줄만한.. 
10,장교를 꿈꾸는 자는 꼭 한번 봐야할 영화! 
10,멋진영화지 
9,20년전의 영화지만 멋지다.. 
10,음악의선률과 조연이 빛나는 영화. 재미있네요 
10,리처드 멋지네///// 
10,굿~ 
9,멋진 영화다. 이리 오래전에 만들어졌을 줄은.. 
10,이 영화를 안보고 사랑을 짓껄이지 말라. 
10,존나 멋있다..꿀잼 그리고 
8,친구 안됐네 불쌍하네ㅠ 
10,이런게 영화지. 조교가 주인공이다 
10,여주 진짜 이쁘네 ^~^ 
10,걸작. 나이먹고 보니 또 다르다. 다른 면에서 또 걸작. 
9,명작인줄 알고있었지만 제목이 너무 딱딱하여 관심이 가지않았는데 넥플릭스 덕분에 이제서라도 보게되어 참 다행이다..젊은 날의 리차드기어는 정말이지.. 숨멎..ㅠ 
7,"내가태어나기도 전 영화 ,, 공순이가 전투기 파일럿과 결혼에 골인 하여 박수 받을 만큼에 지금의 연애, 결혼관 과는 맞지 않은 영화.. 그 당시, 그시대의 영화 ,. "
1,"0점을 줄 수 없다는 게 아쉽다.개연성 제로의 스토리라인.. 차라리 메이어랑 월리랑 사랑한다 그러면 좀 이해 갈 정도. 폴라가 왜 메이어를 사랑하게 되는지 노이해메이어 인생 말아먹으면 가정폭력범, 잘 풀리면 다른 여..."
6,미쳐버린 80년대 헤테로영화 ㅋㅋ 리처드기어가 어리고 예뻐서 볼만했지만 그것 빼고는 전체적으로 좀 나사빠진 내용이었다 .. 처음부터 끝까지 상당히 유성애 중심적인 전개 
10,몇번을 봐도 여운이 남는영화내인생에 명작... 
10,리차드기어와 데브라윙거의 리즈시절. 멋있고 예쁘고. 1983년 1월 1일에 개봉했던 영화라니.. 오래된 영화지만 역시 명작 
10,너무도 열심히 들었던 영화음악.밤10시에 했던 영화음악 라디오에서도 자주 들려줬는데..30년이나 지났네ㅋ 
10,형이 리차드 기어 흉내낸다고 컴온!컴온!하면서 뒤돌려차기 할려고 했던 기억이 새록하네...어깨 문신도 하고. ㅠㅠ 
10,정말 명작이었어요 진짜로 최고였습니다 
10,아껴봐야 할 영화~ 83년작이라는게 믿기지 않음~ 
10,고딩시절 본 최고의 멜로 영화 
10,"리처드 기어의 하얀색 장교복 모습, 파스 붙이고 오토바이  오르며, 영화 제목이 나오는 장면, 마지막 공장씬 ...이런 장면들을 최고로 만들어 준 건, 주제음악(배경음악)이라고 생각해요. 가사 있는 노래가 아니라, ..."
10,리차드 기어에 반하고 데브라 윙거에 반하다 
10,"배우들도 좋았고 음악도 좋지만,무엇보다 스토리를 풀어냄에 있어서 품위가 돋보였다.과한 노출에 욕설과 폭력이난무하는 요즘 영화와는 그 격을 달리한다.이런게 진정한 성인영화지! "
10,인생 최고의 영화 ! 두말할 필요없은 세기의 명작 ! 
10,하앜 
10,나이스 
10,굿 
10,나중이라도 꼭 다시보고 싶은 영화 
9,진짜 멋진 남자 리차드 기어!! 
10,어린시절 나의 심금을 울렸던...매니아라면 꼭 봐야 할 영화! 
9,"완전 멋진 척, 라스트씬, 좋다! "
10,리차드 기어 왤케 .....섹시남인지... 멋있다 
9,개인적으로는 큰 공감을 했다. 현실적인 요소와 극적인 요소가 적절히 녹아있는 영화. 
6,"1982년이라... 젊은 리차드 기어의 열정과 매력, 무리없는 스토리, 멋진 엔딩 "
10,너무너무감동적인영화><특히마지막 장면><굿잡> 
10,꿈을꾸고 또 희망하고 
10,Up where we belong... 사랑과 낭만 그리고 슬픔...데보라 윙어의 명연기 
10,GOOD~!! 
10,very good ! 
10,추억속에서 절대 잊혀질 수 없는 영화 
10,데브라 윙거 너무 보고 싶다... 난 26살이지만.. 
10,기억에 남는 영화 ^^ 이정도? 
10,진정이런영화가 남자의 사랑과인생목표를 담고있다.... 
10,매번 볼때마다 감동이 밀려와 눈물이 나올거 같은 영화. 
10,"양복,제복,,, 요런거 너무 잘어울리는거같어. 리차드~★ "
9,수작 
8,잔잔한... 
10,너무너무 재미있게봤던영화 
10,굿 
1,"와..정말로? 여혐 삼관왕 영화. ~~여자는 전부 OO고 골드디거(digger)로 나오며, 임신에 남자의 책임은 없으며, 여자는 돈많은 남자를 만나야 성공한 인생~~ 이게 이 영화에서 그리는 여자의 전부 아님? 단한..."
10,어릴적 본 느낌과  나이들어서 본 느낌이 다르네. 왜 명작인줄 알겠음. 
10,명작!!!  다른말이 필요없다 
10,예전에 본거라 잠깐 젊은 리차드기어보다가 매력에 또 푹빠져 계속보게되네 
9,리차드기어의 주름없는 얼굴이 낯설지 않은 이유가 젊을적 톰크루즈랑 똑같으네~ 톰아져씨 20년뒤엔 지금의 리차드 기어랑 똑같을듯~ㅎ 
7,"영화자체로는 흠없이 재미있다.현대판 신데렐라 스토리, 귀여운 여인 의 스토리가 살짝 거슬림. 무기력한 여성상, 남자하나 잘 건지자는 자세로 인식됨.. 후반부 격투신 필살의 일격은 전혀 신사답지 않았다 ㅜㅠ "
7,젊은 시절의 리처드 기어가 나오는 성장영화 
7,진부했으나 괜찮은 분위기. 
10,열번 이상은 관람한듯 싶다. 
9,청년들을 군대로 끌어들이려면 이 정도 수준은 만들어줘야. 섹시한 남녀주인공들.뭉클한 음악.감동 스토리. 
10,
10,개명작 생애 최고의 영화급입니다 
10,"우수한 ost,연출,최고의 배우와 스토리, 장교를 준비하는 나에게 있어서는 굉장한 감동이었다. 실력은 좋으나 지나치게 개인주의자 적인 모습을 보인 리차드 기어였지만 교관이 탈락시킨다니 울먹이며 간청하는 모습과 점차 ..."
10,학사장교 임관 전 단체관람 코스였는데 아직도 그런지 모르겠네요불꺼진 강당에서 몇달만에 영화를 보는데 정말 감동이...몇OO이 지난 지금도 그때의 기억이 생생합니다. 
10,다시는 못만날 최고의 영화! 
8,엔딩씬과 ost가 인상적인 영화. 
9,그래도 아직 사랑이 남아있잖아. 
9,유치하고 촌스럽지만 울림이있다 
8,사관과 신사 .. 참으로 멋진 제목이긴 안타깝게도 오역입니다(임관되기전의 ) 장교후보생이라는  뜻입니다.영화내용을 생각하시면 이해가 더욱 쉬울겁니다. 
10,지금 봐야 더 멋진 영화이제서야 봤지만 지금 봐서 더 좋다 
9,테일러 핵포드같은 사람들은 정말 세기의 명감독임 
10,초반엔 그저 그런 로맨스 영화인줄 알았는데 스토리가 진행되면 될수록 뭔가 깊은 감동을 준다.. 
10,초 3때 봐도 데브라 윙거가 아름답고 연기력까지 뛰어나다는 것을 알았다. 
10,정말 멋있고 잘생겼다~~~ 
10,Good cinema! 
9,이어지는 대화가 예술 . . 
8,그 시대 청춘 영화의 아이콘 
8,재밌게 잘봤어요 남자주인공의 젊은 시절 풋풋하네요ㅣ 
10,리차드 기어 너무 설렌다 ㅠㅠ 
10,"동네 건달, 마침내 백마탄 왕자가 되다. "
10,보면 볼수록 멋진 영화네요 
10,방황과 역경을 딛고 순수한 사랑을 찾아가는 최고의 로맨스 영화! 마지막 엔딩 장면은 영원히 잊을 수가 없을 듯 ㅜㅠ 
10,추억.. 빠져드는 영화 
10,다시 보니 굉장한 영화였네...난 80년대 미국의 로맨틱영화가 좋더라.초록 잔디밭하며 
10,멋있는 영화. 약간 이해안가는 문화적 차이가 있지만 
9,리차드기어의 연기....청춘... 
9,존잼♡♡리처드기어 풋풋하네요 
10,군 시절을 생각나게 하는 영화 
8,Pretty woman 에서의 리차드기어는 가라.. 이 영화와 Breathless에서 매력 뿜뿜~~ 
7,사랑얘기는 좀 별로였고 사관생도들의 훈련애기가 더 다가왔음 
6,사랑의 아련함에 대하여... 
9,학군사관후보생으로서 장교의 길을 걷고있는 나로선 공감가는 내용이었다. 
8,꽤 매력적이긴 하지만.. 정서적으로 이해가 않가는 장면이 많다. 
6,그닥 재미없다. 
5,주위의 찬사만이 공허하게 남던 영화.. 
7,지금 보니 가벼운 80년대 청춘 멜로 영화 그 이상은 없었다. 
7,기대를 너무 많이 했나... 
9,귀여운여인과 비슷한 스토리라인 여자들이 좋아할작품 
10,이야기중심을 못잡고 플롯도 형편없지만 주인공이 멋지므로 10점 
8,러닝타임이 좀 길긴 하지만 많이 지루하지 않고 유치하긴 하지만 사랑과 우정을 잘 보여준것 같다. 
6,이걸 보니 군대에서 유격봤던게 생각났다. 공순이들에게 군인에 대한 로망을 너무 심어주는 영화가 아닌가 불편한 생각이 들었다. 남여주인공들의 비주얼이 훈훈했고 엔딩 또한 좋았다. 
9,달콤한 눈깔사탕 같은 영화...이빨 썩어도 좋다 
7,<사관과 신사>와  <프리티 우먼>이    남녀가  연애를 하고  사랑이 이뤄지는게 뭐 대단한거라고  환타지라네 ~~ 버림받고 버리는게 일상이란  반증이 된다 ~~~~   이혼이 흔한세상에서 결...
7,기대보다 진부했던 사관후보생의 사랑과 우정 이야기 
8,어렸을땐 재밌었지만 나이를 먹어서 그런지 지금보니 좀 유치하다 
7,지금 보기엔. 
5,아름다운 노래 빼고는 군대입대 홍보하는 로맨스영화 
6,"오래된 영화라...식상, "
4,윙거는 늘 반갑지만 이 영화의 흥행은 미스테리하다. 
6,그럭저럭 볼만했다. 엔딩씬이 기억이 남는다 
1,휼륭한 영화였다 어려운 역경에서 신사가되어가는 모습이 아주멋젔읍니다 
7,어리숙한 사랑..어리숙한 드라마....어리숙한 감동...어리숙한 훈련.매끄럽지못하다. 
1,두 배우만 남은 영화.. 
1,평정조절용으로 1점~ 
7,멜로로맨스코미디류 안본영화가 없는데 이영화는 아껴뒀다가 봤는데 좀실망스럽네요. 안아껴두고 봤으면 훌륭했을껀데 인생영화에 들줄알았건만 리차드 기어 이새끼만 나오면 영화가 재미가없네 
2,"너무 황당한 영화여서 화가 난 기억밖에,  폴리가 불쌍하고 자살이라도 할까봐 걱정되서 겨우 봤는데 마지막에 아까운 사람만 죽여놓고 주인공만 멋지게 빛내주더라는,ㅠ 사랑은 무조건 밀당이 필요하다는 걸 강조하자는 건지 ..."
