score,review
10,32년전 영화가 어찌 지금시대 한국영화보다 최신작같음. 명불허전 토니스콧 감독 톰크루즈에서 덴젤워싱턴으로 
10,"재개봉이 전혀 의아하지  않은, 명작 "
10,최고의영화 뒤늦게 태어난 세대가 볼수 있는거에 감솨 ^^ 
10,"재개봉을 기다려온 인생영화 중 하나... 조조로 본 뒤 하루가 저물어가는 지금까지도 그 가슴저린 여운에서 헤어나오질 못하고 있다. 미치도록 아름답다! 배경, 음악, 그리고 인물들 모두. "
10,집으로 가는 차안에서 주제곡 신명나게 듣고 무한반복 하는중. 최고네요 
10,너무 잼있게 봤어요~특히 톰크루즈가 복고풍자킷입고 걸어나오는 장면 와아~~~진짜 멋.있.ㅠ^ㅠ비행하는 장면 몰입하다보니 막 제몸두 긴장해났네요!! 
10,그냥..봐야했어요.초딩때 개봉했었는데 tv로만 봐서 평생 극장서 볼일 없을줄 알았는데 이게 왠일입니까???ㅠㅠ 오프닝부터 이미 심장 두근두근..울컥했어요. 
10,톰아저씨의 리즈시절 + 전투기의 공중전극장에서 꼭 보시길~~ 
10,이건 몇 번을 봐도 질리지가 않아ㅋㅋ 
10,33년전 영화가 지금 영화 보다 재밌다는 걸 증명하는 재개봉. 조금은 뻔한 구성과 스토리 지만 배우들만 봐도 흐믓해지며 음악은 덤~ 
10,정말  최고입니다. 탐 오빠!! 
10,80년대 정서.어떤면에서는 지금보다 낫다 
10,"상영관이 집에서 버스 한 정거장 거리라 닥치고 보라는 계시 같아 바로 직행했습니다.완벽한 외모의 톰 크루즈를 보는 것만으로 절반 이상은 먹고 들어갑니다.지금 기준으론 단출할 수 있는 화면 구성일 수도 있겠지만,사운드..."
10,너무 재밌게 봤어요 극장에서 볼 수 있어서 더 좋았네요 
10,재개봉하면 뭐함 ... 상영관이 없네요 
10,젊은이의 열정과 공중전의 매력을 느낄수있습니다. 맥라이언의 연기매력도 함께 하세요~ 
10,영화 배경과 음악이 정말 끝내주네....창공에서의 전투씬은 정말 예술같다^^~ 
10,나에게 탑건은 영화 그 이상의 의미를 주는 영화이다.나의 인생영화다.톰크루즈는 예나 지금이나 멋진 남자다~ 
10,톰 리즈시절 최고의 영화 
10,이 영화가 개봉된 시기를 믿을 수 없을만큼 세련된 영화였다. 낭만이 가득했던 영화. 
10,역시 명불허전 시대가 많이지난많큼 좀 촌스런부분이 있는데 그런것마저 이해하고 볼수 있는영화 굿굿 
10,어린시절 되도 않는 파일럿 꿈을 꾸게 만든 영화...리즈시절의 탐크루즈에 톰캣 무엇보다 가와사키닌자를 타는 모습이 개간지 
8,배우 제작진 사진을 보고 있으니 세월의 무상함만이 느껴진다. 영화는 soso 
6,지금 보니깐  내용이 좀  뻔하긴 한데 그래도 재밌다 . 하이웨이 투더 데인저 존 ~~ 
7,톰 크루즈를 일약 스타덤에 올려 놓고 수많은 아류작들이 줄을 잇게 만든 바로 그 영화. 
9,"출연진 사진 보면... 다른 출연진들은 폭삭 늙었는데, 톰 크루즈는... "
10,어릴적 나의 뇌구조중 95퍼센트이상을 차지하게 했던영화 
7,처음엔 엄청 지루했음 그러나 비행씬은 시원시원했다 
9,비행 장면 촬영 참 잘했다. 제트기 출연 영화 중에 이만한 영화 없는 것 같다. 게다가 톰크루즈의 외모가 참 대단한 영화 !   여주인공 외모가 너무 남성적이라 쫌 아쉬웠다. 그리고 아이스맨의 빈정거림은 너무 억지스...
8,"팔팔한 활어같은 20대에 찍은 영화라 그런지, 얼굴이나 목소리까지 앳띠고 생기넘쳐보였다. 본능적이고, 예측할수 없는 그의 비행과 사고방식은젊음의 패기를 충분히 보여줬다. 시대상 좀 올드한 면이 있지만, 요즘과는 다른..."
5,때론 시대가 명작을 만들수 있다. 
10,1980년대에 이런 명작을 만들어냈다는게 놀라울 따름이다 
8,후까시란 이런것이다 
6,"역시 영화에는, 당시에 보지 못하면 결코 느낄 수 없는 무언가가 있다 "
5,지루한 내용 그 시절에는 좋았었나? 
6,이거 하두 유명하길래 봤더니 재미하나도 없던데..--;; 
7,상당히 고퀄리티의 전투기씬은 86년도에 나온거라곤 믿기 힘든 퀄리티이지만 내용이 촌스러운건 어쩔수 없었다 
6,지루했음 여주인공도 매력없음 
5,"음,,, 난 별로였음. 재미없었음... 톰 크루즈 젊은시절 보는맛에 보긴 봤는데 "
5,작전하나 성공하고 자기들끼리 좋아하는 많이 허전하고 아쉬운.. 틀에 박힌 영화 
2,이거 재밌다는 사람이 제일 이해안감 
3,제스타일은아니네요 여주가 너무늙었고 재미없고 지루하고 어릴때 탐은 엄청 귀엽네 
10,이 영화보고 파일럿의 꿈을 키웠습니다.지금은 비록 비루하게내항사기장으로 근무하고있지만 항상 F14톰캣에 대한 동경이 있습니다.아쉽게나마매버릭이 즐겨타던 포르쉐는 몰지만 삼십대중반에 바빠서 결혼도 못하고 이러다 벌어논...
7,음..명성에 비해서는 좀.. 
10,인생영화30년전 ??? 
10,톰크루즈는 멋있고 음향은 조금 아쉬웠어요 
10,남자라면 꼭 봐야되는 명작중의 멍직 
10,이 영화 대박 재밌다~~!!^^ 
10,탐크루즈의 이미지를 확립시킨 영화 
10,영화를 보고 난 뒤 항공점퍼 구입욕구 솟는 영화 
10,30년전으로의 추억여행 배우들과 움악먼으로도 너무 좋았어요. 
10,진짜 잘만들고 재밌게 봤어요 역쉬 대작은 틀린득 
7,톰 크루즈가 연기하는 청춘 드라마... 무난한 내용이지만 향수를 불러 일으키는 듯한 풋풋한 모습이 참 좋다. 
9,지금 보기엔 뻔한 스토리지만 젊은 톰 크루즈의 명연기만으로도 충분. 
10,말이 필요없는 최고의 명작이제억수록 재미있게 즐기면서 잘 감상했다전투기 조종사가 아주 땡기는구메 
6,"'파일럿' 의 '파일럿' 을 의한 '파일럿' 을 위한 사랑과 고통, 그리고 비상. "
3,톰 카잔스키가 이 영화에 나오는 이름이었구나 
6,톰 크루즈. 화려하게 헐리우드 중심에 자리잡다. 
5,기존액션과 다른 새로운스타일 항공액션영화.. 그러나 진부한 토니스콧 
7,1.마지막전투장면만재미있다2실제로비행한건아니겠지?3전쟁도아닌데비행기가처들어와? 
7,배경음악은 정말최악이다.상황과상관없이게속나오는 둥둥거리는 음악.. 그외는좋았다. 
6,비행기 인식이 좀 어렵네. 여주인공 별로. 일반적 스토리 
6,해군장교들의 이야기를 제법 말 안 되게 만든 영화.. 젠장! 
5,할리우드 공식의 시초 
6,지루.. 톰의 앳된 모습 . 멋진 배경음악 둘의 사랑이 인상적 
5,전투기 날아다니는 것 외에 볼꺼없다 
6,난 발 킬머가 더 좋더라.. 
4,정말 기대한것만큼은 아닌듯.. 지루 음악이 좋고 전투기 액션은 좋았지만 
6,F5를 미그기라고 적기로 부른 사기영화~ 
6,너무 올드했어요ㅡㅡ옛날 영화이긴했지만 
6,얕은 설정은 제쳐 두고 강점을 극대화하는 정공법. 
4,젊고 잘 생긴 톰 크루즈 이외에는 별다른 매력을 느낄 수 없다 
6,군홍보 영화 중 TOP. 
6,톰 크루즈는 정말 멋있군요. 영화적인 재미는 잘 모르겠네요. 
4,시대가 달라서 인지 지금 보면 밋밋하기만 해 
1,재밌다해서 봤는데 아오 먼말인지도 모르겠고 좋나 지루하네 
6,뭐 딱히 내용이 없다.. 사건이 없어 
7,의외로 뮤지컬 영화!ㅋ 
6,그냥 뭐... 젊은 톰보는 재미와 비행기보는정도의 재미 
4,"어렸을 땐 멋있어 보였는데, 생각해보니 헐리우드 영웅주의였네!! "
3,평점이 너무 높아서 봤는데 이건 뭐 액션도 아니고 로맨스도 아니고 이도저도 아닌 영화. 기대감과는 달리 너무나 지루함 
3,"톰크루즈 나오는 영화치고 진짜 노잼이네. 고혹적인 켈리 맥길리스, 귀여운 맥라이언, 그리고 배경음악 때문에 3점 "
4,그냥 시간나서 봤다.. 
10,타란티노가 이 영화 서브텍스트가 게이물이라 하길래..봤드만.ㅋㅋ...짱.게이물.https://www.youtube.com/watch?time_continue=19&v=gSV35A1cQDM 
5,촌스러움과 시대를 앞서간 액션이 공존 
6,정신없이 날아다닌 것에 비하면 차갑게 식은 그들의 엔진 
4,기대가 너무 컸나?;;; 
4,뭔가 허전한 느낌이 드는데... 
4,"학원물, 로맨스물, 우정물 다 때려 넣었지만 이렇다할 이야기의 재미도 찾지 못했고 전투씬에 몰입이 되는 것도 아니다. "
6,전형적인 히어로 각본에 개연성 또한 없다. 82년도를 감안한 전투기 씬만 볼 만하다. 
5,하이틴스타의 탄생 비교적 생생한 고공 촬영 그뿐 
1,kjlkluyikytgui 
6,그만 우려먹어라 보약도 3탕 이상 안해... 
7,볼만한 킬링타임용 영화다 
6,한편의 성장 드라마를 본 느낌... 
8,요즘 CG만으로두 영화를 만드는 세상인데...그때의 감동을 다시 느낄 수 있을지는 의문 
2,영화 외적인 영상미는 탁월하나 110분을 보상할 내적가치는 전무하다. 
2,내게는 2점도 후하다고 생각되니깐 뭐라지 말기 
1,mmmnnmnnmmn 
1,jkuhyjthjtr 
4,멋은 있는데 재미는 없음 
5,음악만 귀에들어오고 내용은 그닥 
8,재미있기는했으나 명작이라고하기에는 
3,오늘 다시보니깐 ... 뭔가 게이물 같은 느낌이.... 
1,재개봉이 머냐 진짜 영화관 갈 생각이었는데 기분 잡쳐버리네 
7,"제트기가 많이 나와서 어지럽고 정신 없었음. 포스터도 살짝 마음에 안 듬. 차라리 구즈와 메브릭을 넣지, 왜 찰리를 넣은 건지. 하늘 날다 사랑 나누는 얘기도 아닌데. 전반부는 지루해서 몇 번이나 끊어봤지만 후반부턴..."
10,날 파일럿으로 만들어준 영화! 말이 필요 없지~ 
1,평점 너무높은데? 
7,알바의  행진은  끝이  보이지  않는구나  수고해 
2,미국을 위한 미국에 의한 미국 영화 
6,당시에는 끝내줬던 작품이었겠지만 기대보다는 못 했던 작품 
1,켈리 맥길리스 보는 재미로 
1,참전을 부추기는 독소같은 영화 
2,good 
1,bad 
4,미뽕이 극에 달하다. 베트남 전 이후 위대한 미국을 생각하던 로널드 레이건과 미군애들 영화적으로 전략 잘 세웠네!! 
1,내가 평점 9.01에서 8점대로 떨어뜨렸다..ㅋㅋ 
1,난 재미없었음 이감독 영화는 내랑안맞나 다재미없네.. 
1,재미없는데지루하고현실성업음 
1,진짜 갠적으로 너무 별로였음..오기로 끝까지 봤어요. 그나마 끝에 가서 진짜 쪼끔 긴장감.. 진짜 그냥 하나부터 열까지 다 맘에 안드는 영화..영화 안좋게는 잘 안다는데 이건 진짜 짜증나서 달아요. 
