score,review
10,왜 미국 최고의 뮤지컬영화라 불리는지 알 것 같아요. 지루할 틈도 없고 너무나 재밌게 잘봤습니다. 무성영화에서 유성영화로 바뀌는때를 재밌게 잘 표현해 만든 영화같아요 Singin in the rain~ 
10,"뮤지컬 역대 1위가 괜히 된게 아니었군요. 이건 정말이지 대부,바람과함께 사라지다 레벨의 영화입니다. 3명의 주인공은 마치 뮤지컬계의 마잭,마돈나,엘비스급의 춤과 노래실력을 보여줌. "
10,영화 역사상 이토록 유쾌하고 사랑스러운 뮤지컬 영화가 다시 나올수 있을까! 
10,35년 전쯤 주말의 영화에서 아버지와 함께 보았던 영화. 70년대 중후반부터 80년대 중반까지 부모님과 함께 보았던 영화들 중 단언컨데 최고의 영화 중 하나이다. 다시 스크린에서 상영해 준다면 꼭 가서 볼 영화 1순...
8,뮤지컬 영화 답다 사랑할 때 보면 더 좋을 거 같아. 싱인인더레인~~~ 
10,보는 내내 아름다운 노래와 환상적인 춤으로 눈과 귀가 즐거운 영화. 무성 영화에서 유성 영화로 넘어가는 과도기를 풍자하며 재밌게 그려낸 영화. 영화를 보고 슬퍼서 울었던적은 많았지만 감동을 넘어 행복해서 운 첫번째 ...
10,"20년대 무성영화에서 유성영화로 넘어가는 시절, 발생하는 다양한 애피소드들을 참 재미있게 엮어 놨다. 화려한 율동과 흥겨운 음악이 좋고, 특히 빗속에서 춤을 추는 장면은 정말 명장면이다. 마지막에는 깊은 감동까지 느..."
10,이토록 즐거운 뮤지컬을 보면서 왜 눈물이 나는 걸까요? 역시 인류는 후세에 이렇게 귀중하고도 위대한 문화유산을 남기고 있음에 세삼 놀랍니다. 
10,처음 본 영화이고 지금까지 최고인 영화! 
9,확실히 고전영화가 연출이 과감하다 
10,뮤지컬 영화 별로 안좋아하는데 이건 잼네요 ㅎㅎ 시간 가는 줄 모르고 봤습니다. 
10,최고중의 최고. 어떻게 10점 안줄수가 있을까요. 몇OO이 지난 지금 봐도 재밌더군요. 저런 위트와 스토리가 저 시대때 나왔다는 것 자체가 박수 안치고는 못배길듯.. 정말 최고의 영화에요. 
10,댄스와 코메디의 진수 
10,진켈리는 천재인듯 노래 춤 연기 못하는 것이없다. 
10,유성영화로 넘어가는 과도기의 모습을 잘 담은 뮤지컬 영화. 러닝타임동안 흠뻑 빠져 볼수 있습니다. 그리고 모두가 잘 아는 노래도 함께. 
9,"케시의 사랑스러움과 ""singing in the rain"" 의 멜로디가 머릿속에서 잊혀지질 않는다! "
9,낭만과 행복이 전해진다. 
10,"지금도 통하는 연기와 유머, 내용! 사랑스러운 영화이다. 최고의 영화 "
10,클래식을 드디어 만나다니....무성에서 유성으로 바뀌는 시점의 고군분투 
10,단 한 편의 뮤지컬 영화를 꼽으라면. 
10,이건 10점이 아니라 100점은 줘야할듯..뮤지컬영화중 탑이지. 
9,정말 시간가는줄 모르고 봣다.. 괜스레 춤추고 싶어지게끔 만드네 
10,매력적인배우들과 아름다운 음악 멋진 배경! 정말 사랑스러운영화! 
10,너무행복하다 
10,최고!!!다만 진 켈리의 느끼함은 좀 거북스러움 
10,이 영화는 뮤지컬 영화이면서도 영화의 변천사를 보여주는 듯 해서 저 같은 학생에게는 참 뜻깊고 좋은 영화라고 느낍니다 그리고! 뮤지컬 영화와 고전 영화 순이로서 저에게 참 좋고 멋있는 작품이였습니다! 가사는 몰라도 ...
10,연기의 일부가 음악인 휴잭맨이 가장 사랑하는 뮤지컬 영화인데는 이유가 있는법!아름다운 영화다! 1950년대 영화가 50년후에도 감동을 준다!춤추는 베니니! 노래하는 채플린! 
10,귀에서 싱잉 인더 레인~이 떠나질 않는다...마지막 카타르시스는 정말 최고였다!!!!! 
10,역시 명작은 오랜 세월이 지나도 감동이 ㄷㄷ 보고나면 정말 기분좋은 영화! 
10,비오는날 생각나는 노래 Singing in the Rain~ 
10,라라랜드의 오마주가 된작품. 지금보니 레트로 스타일의 교과서네요. 50년대에 이런 작품을 만들다니. 미국이 놀랍기만 합니다. 
10,"진짜 최고의 영화. 뮤지컬 형식이라고 해서 노래나 춤만 주구장창 나오는게 아니라 진정한 스토리와 감동이 있었고 올드함은 전혀 찾아볼 수가 없었다. 재치있는 유머와 군더더기 없는 춤선까지, 명작은 세대를 넘고 또 뛰어..."
10,"역사상 가장 유쾌하고 재밌는 뮤지컬. 진 켈리의 자신있는 표정과 발놀림을 보라. 파트너 오코너도 동등한 평가를 받아야함. 무성영화 시절의 해프닝, OST는 보너스. "
9,최고의뮤지컬영화 다만 중간 쓸데없는장면들이나옴 
9,20~30년대 히트넘버들을 리바이벌한 영화. 그 때문에 뮤지컬에 후한 아카데미상을 한 부문도 수상 못함. 그러나 Singin' in the rain를 부르며 보여주는 진 켈리의 뛰어난 performance때문...
8,유쾌한 편이지만 중간 중간 스토리 이외가 너무 길다는...솔직히 지루한 면이 있음 
10,명작의 클래스는 영원하고 명곡은 시대를 관통한다 
10,영화를 보면서 미소가 끊이지 않았어요 ㅎㅎ 가슴을 뭉클하게 만드는 영화! 사랑합시다~ 
10,이토록 보는사람을 행복하게하는 영화가 또있을까~~~♥♥♥♥♥♥♥♥♥♥♥ 
9,영화가 줄 수 있는 즐거운 감동 
10,최고 
10,역시 명작이다 
10,정말 재밌습니다. 직접 보는 걸 추천할게요 
10,이렇게 발랄하고 행복해지는 영화는 요즘에도 잘 없다 
10,무슨 말이 필요 하나? 
9,역시 명작은 그 이유가 있구나. 
9,노래와 춤 그리고 사랑이야기.. 어느 하나 빠지지 않는 명작.. 
10,뮤지컬에 관심없는 사람도 재밌게 볼 수 있는 영화 
10,오 진짜 대박이다...사운드 오브 뮤직만큼 명작임. 
8,영화의 역사를 알 수 잇엇다 근디 이게 50년대 영화라니 놀라울 뿐이다 
10,삼가 고인의 명복을 빕니다.... 
10,무성영화에서 유성영화까지  아우르는 최고의 뮤지컬! 사랑스럽니다! 
10,처음엔 단순히 싱잉인더레인이 명곡이어서 유명해진 영화인 줄 알았는데 무성영화->유성영화 교체의 격변기를 로맨틱코미디 스토리에 담아서 아주 좋았고 그 격변기에 맞추지 못한 자(리나)는 결국 몰락하게 된다는 또다른...
10,걸작중 걸작이자 원형인듯! 
10,최고 더 말할거 없다 그냥 최고음악 스토리 연기 재미 영상미 전부 최고 
10,영화중에서 최고를 꼽자면  이 영화 인거 같군요... 
10,영화사에 남은 아름다운 걸작을 보는 것만으로도 너무 행복해! 
10,감동감동!!!! 넘 재밌다 마지막에 겁나 감동.. 
10,사랑은 비를타고!단연 20세기 최고의 명작입니다  :) 
10,어린시절 비에 대한 생각을 바꿔 준 마술같은 영화.  영화 자체는 재미가 있다거나 인상깊지도 않았지만 남배우의 비 맞는 연기와 노래는 세월이 흘러도 잊혀지질 않는다. '노래가 이런 공감을 불러 일으키는 구나&...
10,What a lovely movie... 
10,정말 잘 만들었다 볼 수 있음에 감사하다소장하면서 두고두고 볼 것이다 
10,"진 켈리 특유의 사랑스럽다는 듯 쳐다보는 눈빛과 표정, 감미로운 목소리와 자연스러운 연기까지... 헤어나올 수가 없다 "
10,뮤지컬 영화의 고전 명작 
10,뮤지컬 영화를 무슨 재미로 보냐는 사람들은 이 영화를 보면 된다. 
9,ㅋㅋ 네이버 줄거리 처음부터 끝까지 스포하네 
8,사랑은비를타고 제목도 좋다 
10,너무나 꿀잼이다. 이 맛에 뮤지컬 영화 보는 거 아닐까. 그리운 진 켈리♡ 
10,영화역사상 가장 유명한 장면! 
10,"20세기의 제대로 된 명작, 뮤지컬,로맨스,코미디까지.. 각 장르를 잘 살려내었다.. 대단함. "
10,오래된 영화이지만 지금 봐도 정말 좋네요! 집에서 ip티비로 1200원 주고 봤는데 이 영화에 1200라니.. 12000원은 줘야할것같습니다. 진켈리는 정말 대단한 배우이자 감독인것 같네요.. 
10,순수했던 시절 같습니다 우리나라 50년대에는 먹고 살기에도 빠듯했던 시절이었을텐데 순수했던 느낌 때문에 요즘 영화보다는 옛날 영화에 더 끌리는거같습니다 
9,제가 지금까지 본 뮤지컬 영화중에서 단연 최고로 꼽는 걸작입니다. 
10,내 인생 최고의 영화 singing in the rain 
10,대단하다1시간40분이지루하지않았다와 진짜 ㅋㅋ 
10,60년이 지나도 부족함이 없는 걸작.. 사랑스러움 그자체  록우드의 빗속의 장면은 앞으로 다시는 나올 수 없는 뮤지컬 최고의 장면 
9,60년 전 영화라는게 믿겨지지 않음 
10,52년 영화인데 어쩜 이렇게 세련됬지? 이때 미남미녀의 기준은 지금과도 다르지 않다... 사운드 오브 뮤직만큼 재밌는 뮤지컬 영화. 배우들이 특히 눈에 띈다 
10,"시대를 초월하는 명작, 그리고 로맨스와 뮤직. 아름답다 아름답다 "
9,세 명의 캐릭터 모두 좋았지만 특히 코스모의 슬랩스틱 연기 정말 짱!귀여웠어요 
9,희망과 빛과 음악으로 각색한 진 켈리의 <선셋 대로> 
9,"노래와 춤~만으로~이렇게 사람들 기분좋게 만들 수 있다니!~이것이 바로 영화라는 매체의 힘!일듯!~진켈리와 많은 다른 멋진 스탭,배우들~감사합니다~이제야 이 명작을 찾아봤네요!~항상 사람들의 뇌리에서 잊혀지지않으시길..."
10,내가 늙은건 정말 맘이 아프지만 이 멋진 작품을 그대들보다 훨씬 오래전부터 보고또보고 있다는걸 생각하니 승리의 미소가 피는구려 
9,비가 오는 날 혼자있을때 뻘짓하고 싶게 만듬 
8,싱잉더레인은 영화사에 영원히 남을 명장면   근데 그거 빼놓고는 그다지 볼거 없는 영화 
9,반세기를 앞서간 뮤지컬 영화 명작 
10,정말 보고싶었던 영화이제야 보게되었다여름이 지나가는 새벽 아름다운 멜로디와 사랑을 노래하는 그들의 아름다운 목소리가지금의 사랑을 나누는 나를 행복하게 만들어준 영화 ♡? 예쁘다 아름답다 
10,정말 최고의 뮤지컬영화...10번을 넘게 봐도 도무지 질리지가 않는다. 앞으로도 계속 보고 싶다.. 
8,"남들이 하도 명작이라하니, 나는 뮤지컬을 잘 모르겠어요 "
8,지금 보면 그냥 소소하게 재밌는 뮤지컬 영화 1952년에 나왔다는 게 신기할 뿐 
10,영화를 보고 있으면 행복하다 
10,지루하지 않고 즐겁고 유쾌하다 
10,뮤지컬의 모든 걸 다 갖춘 영화 
10,몇 안되는 감동받은 영화입니다. 
10,사운드 오브 뮤직과 더불어 최고의 뮤지컬 영화 
10,뮤지컬영화에 길이남을 명작! 
10,진짜직접극장에가서뮤지컬보는느낌꼭봐야됨와... 
9,2015.02.21 진켈리는 못하는게 뭘까. 50년대 뮤지컬이라니.. 최고 
10,"뮤직과 영상들이 너무 유쾌하게 잘 어우러지는 뮤지컬 영화다. 지금 조금 자고 월요일 출근해야 하는데... 영화의 유쾌함과 즐거움, 행복감 때문에 잠이 안 온다.. "
10,"진 캘리 사랑해요ㅜㅜㅜㅜ 파리의 미국인,  It's always a fair weather, 해적들ㅜㅜㅜㅜ "
10,아~ 너무 재밌다. 왜 뮤지컬계 최고의 걸작이라고 하는지 알겠네. 노래도 춤도 너무 신나고 볼거리도 많고. 
10,정말 당대 최고의 뮤지컬영화예요...탭댄스도 정말 멋있고 암투는 정말 재밌어요^^ 
10,가장 미국적인 뮤지컬. 50년대 초에 개봉했다는게 믿기지 않을 그런 영화. 낭만이 넘치는 영화 
10,최고다. 뮤지컬 영화는 따분할 거라는 내 고정관념을 부숴버린 영화 
10,역시 오랫동안 찾았던 만큼 기대를 저버리지 않는 사랑스러운 영화. 아직도 노랫소리가 귀에 들리는 것 같다. 
10,걸작이란 정말 변하지 않는 것이라는 진리를 또다시 깨닫게 해주는 영화. 대단하다는 말로도 부족한 위대한 뮤지컬 영화. 
10,진짜 최고다...이렇게 오래된 영화중 이런 걸작이있었다니 
9,"3박자(노래,춤,연기)의 품격 "
10,세월이 지나도 변하지않는 가치란 이런것 
10,최고의 영화 지루하지도 않고 연출이 정말 최고였습니다 
10,마스터 피스.. 웃다가 울다가 신나가다고 감동에 젖었다가 모든게 녹아있는 뮤지컬 
9,명화로 주저 없이 선택할 수 있다 
9,춤이 역동적이라 에너지소모 최고엿을듯욬ㅋㅋ미녀는괴로워처럼 노래는 다른사람ㅋㅋ 
10,노래하고 춤추고 사랑하고~ Singin' In The Rain~♬ 
10,진켈리의 비오는거리의그장면만으로도 10점줄수있는영화♥ 
10,완죤 대작. 진켈리의 비오면서 노래부르는 그 장면 정말 낭만적ㅠㅠ 
10,"절대 잊을수 없는 명작,,, 특히 빗속에서 노래를 부르는 장면은,,, "
10,"보고나서 계속 생각나는 현란한 탭댄스와 OST,그리고 이 영화로 배꼽을 잡을줄이야ㅋ "
10,nono yesyes는 정말대박이었다.  헐리우드 뮤지컬의 결정판 
10,"뮤지컬영화의 고전이자, 걸작 "
10,Singin' In The Rain을 부르며 춤출때에 감동 최고였다. 
10,진 캘리 최고의 작과 더불어 영화사에 기록 될 명작 
10,뮤지컬 영화의 교과서. 56년전에 만든 작품이라니 믿기지가 않는다. 
10,세상에서 가장 행복하고 위대한 영화 
10,사랑이오니까비가오고된장녀여배우에게마지막복수 
10,이 영화를 보면 40대의 탭댄서를 꿈꾸게 된다. 
9,무성영화시대에서 유성영화시대로 넘어가는 과정을 잘 표현했다 
10,"명작은 명작이라고 불리는 이유가 있는 것, "
8,빗속에서 노래부르는 행복한 남자의 행복한 영화 
8,당시 스튜디오 시스템이 잘드러난 영화. 
10,이명작에딱하나궁금한건 진헤이건의실제목소리...ㅡㅡ 
10,오래된영화가더 좋아지는이유 
10,"들썩이는 흥겨움, 그리고 완전 매력적인 진 켈리의 미소ㅋㅋ "
10,텝댄스조차 간지나게 추는 진켈리. 
10,잊을 수 없는 불후의 명작 
8,아름다운 고전 비오는 날 춤추는 장면은 최고 
9,최고의 뮤직컬 영화다~진켈리의 탭댄스는 죽음이다!! 
10,명작은 이래서 명작임 乃 
8,영화의발자치를볼수있다. 빗속에서의싱인더레인부르는모습은. 
10,여주인공의 패션어블~~ 굿~!! 영화  베뤼 굿!! 
10,내가본 최고의 뮤지컬!! 별5개로 부족 -_-;; 
10,"정말 멋진 최고 의 영화,노래,춤,연기,등등..일품 "
10,주관적인 생각으로 저에게는 뮤지컬 영화중 최고의 영화 같습니다... 
8,이 영화가 걸작인 이유는 뮤지컬을 통해 수 많은 의미를 함축하고 있기 때문이다. 
10,21세기에는 라라랜드가 있으면 20세기엔 이 영화가 있다 
10,옛날 영화가 맞나 싶을정도로 지루한틈 없이 재밌게봤음. 뮤지컬도 별로 좋아하는 장르는 아닌데 역시 괜히 명작이 아님. 주제가 무겁지도 않고 편하게 볼수있어서 좋았음. 
9,유명한 OST들과 배우들의 완벽한 연기가 대단했다. 옛날 영화라 그런지 한 테이크가 긴 편인데 춤추는 씬마다 연습을 매우 많이 했을 것 같다. 남주와 여주가 조금 개연성 없이 사랑에 빠진 감이 없지 않아 있지만 그래...
10,이 영화에 무슨 말이 필요한가 
10,"이 고전 명작을 이제야 보게 되었습니다.연출, 연기, 스토리, 영상미, OST 모두 다 좋습니다.추천합니다!!! "
9,레전드라 불리는데는 다 이유가 있지. 비오면 생각나는 싱잉인더레인~ 
10,희대의 걸작. 지금봐도 손색없다. 
10,노래랑 뮤지컬이랑 어우러지는게 환상적입니다!감동적이에요 ㅎㅎ 
7,우리는 이때 전쟁 중이고 몇년 뒤에야 흑백 후시녹음 영화 시작했는데 헐리우드는 진짜 말그대로 별천지였구나.그런 차이가 있었는데 67년뒤 우리나라 작품이 아카데미 작품상을 받았다니 다시금 신기하다.너무 국뽕 타임이였는...
8,전설이 된 뮤지컬. 
10,너무나도 훌륭한 영화 아카데미가 놓친 최고의 영화 
10,너무 아름다워서 할 말을 잃었다내가 본 영화들중 보는 내내 이토록 행복했던적이 있을까 
10,가만히앉아보기 미안할지경 
10,350 개가 넘는 평점중 1점이 4개인 유일한 영화 
10,위대하단 말로는 200% 부족함을 느낌. 미생물같은 제 어휘력이 짮아 다만 10점을 주고갈뿐... 
10,너무 잘 봤어요 최고의 영화네요 
10,이보다 더 기억에 남는 뮤지컬은 없었음 
10,내 인생 최고의 영화 뮤지컬계의 아버지이자 내가 살아갈 동력원을 제시해준 작품 
9,아그아그아그아니아당 
10,1초도 눈을뗄수없는 즐거움 
9,"뮤지컬 영화로는 정말 최고이다. 보는 내내 귀가 즐거웠고, 탭댄스는 그냥 말이 필요없었다. 메인 노래인 singing in the rain도 중독성 짱이다! 그런데 스토리는 그에 비해 살짝 떨어지는 것 같다. "
9,옛날 영화지만 보는 내내  흥미롭고 멋졌어요 
10,뮤지컬 싫어하는데 이건 재밌게 본듯 
8,품위를 갖기 위한 과정. 
10,황홀경! 그야말로 황홀경!! 
10,최고의뮤지컬영화^^ 
10,봐도봐도  늘 좋고 행복해지는 영화같아요.. 
10,"보고 ㅡ 또 보고, 비디오 구입해서 보고, DVD 구입해서 보고... "
10,오 뮤지컬 너무 좋아재미있게 잘 봤다 
9,즐겁고 흥겹고 사랑스러운 영화! 
10,내가 본 영화 중 최고!!!!!! 
10,왜 이제서야 이 걸작을 봤을까? 
10,말이 필요해? 사랑받아 마땅한 걸작! 
10,너무 애뜻한 영화... 너무좋다... 
10,너무나 멋진 걸작 
10,보는사람 설레게하는영화! 
10,최고의 뮤지컬 영화 
9,옛날 영화 좋아 내가 좋아하는 영화의 몇몇 장면은 이 영화를 보고 연습했을 거야 ! 
10,빗물이 흘려 내려옵니다 주루룩 주루룩 주루룩 주루룩 내려옵니다 
9,오늘 수업시간에 영화봤는데 재밌다. 
10,걸작! 1950년대 미국 쇼비즈가 전세계에 보낸 최고의 종합선물세트. 
10,흥겨움에 몸이 들썩들썩 
10,기분 좋아지는 영화~ 노래가 너무 좋았다 
10,너무나 사랑스러운 고전. 
9,후대에 길이 남을 고전 뮤지컬 영화 
10,암씽잉인더레인~ 저슽씽잉인더레인~ 
10,그런 슬랩스틱이라니 
10,은혜받고 나온기분~~~ 
10,잊지못할 명작 
8,요즘같은 장마에 기분마저 눅눅할 때 보면 좋은 청량감 넘치는 명랑영화 
9,암씽잉인더레인~ 
10,ㅋㅋ너무 웃기고 귀엽고 기분 좋아지게 만드는 영화 >.< 
10,뮤지컬영화의 최고봉 
8,씽잉 인 더 레인~ 
10,최고^_^ 
10,모든장면과 노래가 귀를 즐겁게 해준다 
10,이게 1952년도 뮤지컬 영화라고?! 
9,"화면전환, 훌륭한춤실력연기력 화려환 유머와위트! 통쾌한 복수 뮤직컬 비내려라 "
10,보면 볼수록 행복해지는 영화 ^^ 
10,비오는 날 생각나는 영화 
10,요즘영화들보다 깊은 감동을 준다 유쾌하고 흐뭇한 영화 
10,재밌네 
10,무슨 영화가 50년이 지난 후에 봐도 재밌을 수가 있나!!!! 
10,이 사람들.. 1952년에 무슨 짓을 한거야? 
10,최고! 
10,환상 그 자체..어떻게 1950년대에 이런 영화가 나올수 있었을가?! 
10,완전걸작 
10,50년대에 이런 뮤지컬영화가 나오다니.. 최고다 진짜 와 ; 
10,이만한 영화가 어디있겠는가.. 
10,헐리웃은 수OO 앞서간다는말이 사실인듯. 울나라는 지금만든 뮤지컬영화도 오골오골 
8,지금도 빗속에서 노래부르는 장면 떠올리면 전율이...낭만의 결정판. 
10,시간이 아무리 흘러고 가히 최고!!!!! 
10,깔끔하게 유쾌하고 화려한 영화중 이 영화가 최고 
8,"유쾌하고 즐거운 뮤지컬, 댄스무대의 미장센, but 리나에 대한 관용과 포용이 아쉽다 "
10,요즘 나오는 뮤지컬 영화들보다 훨씬 재밌는 고전 걸작 
10,무성에서 유성으로 넘어가는 단계를 담은 영화. 매우 재미있음!ㅋㅋㅋ 
10,신펠!!! OO !!!!!!!!!!!  환상적  !!!!!!!!!!!!!!!!!!!!!!! 
10,솔직히쵝오 ㅋ 
9,대박ㅋㅋ 
8,비온후 뜨는 무지개같은 사랑스런 뮤지컬영화... 
10,52년에 어떻게 이런영화를! 멋지고 미칠듯이 아름답다 사랑하고싶다 
10,최고 
10,최고임 
10,고전영화중 최고작 
10,뮤지컬 영화 별로 안 좋아 하는데 이 영화는 유쾌하다. 
10,최고의 뮤지컬영화!! 
9,50년 전 영화라 지금 보면 좀 유치하기도 하지만 아직도 잔잔한 추억으로 남음 
10,음악과 댄스장면은 시간이 흘러도 아련한 추억으로 남을것이다. 
10,시대의 명작! 
10,정말 좋네요..♥ 
10,와 -심장이 뛴다. 
10,짱이센 
10,뒷부분조금 쳐진감이 있지만.. 멋진음악에 춤추는 배우들을 볼때면 눈을 뗄수가없었다 
10,음악 시간의 감상 너무 재미있고 쵝오!~ 
10,최고의 영화~ 
8,"비를 타고 화면 너머로, 고스란히 관객에게 전달되는 이 놀라운 기쁨. "
9,"유쾌한 탭 댄스, 그리고 사랑 "
9,재미있어요 
10,헐리웃이 '고결함'을 유지하던 시절에 나온 최고의 뮤지컬. 
10,너무 재밌다. 오래된 영화지만 유머가 절대 OOO 않는다!! 
7,십수년뒤에 다시 봤을때 줄거리는 기억 안나도 노래하고 춤추는 장면은 기억될 듯. 
7,달콤하고 유쾌한 토키로 
9,보고 듣는 것만으로도 행복해 진다 ^.^ 
8,경쾌한 리듬의 탭댄스 
10,인상 깊은 장면들이 많다.... 베리 굿굿 
10,킹왕짱! 
9,"유쾌한 탭 댄스, 그리고 사랑 "
10,그 당시 영화라고 하기엔 정말 재미있었음 
10,I'm happy again..♡ 
10,50년도 더된 영화지만 지금봐도 감각적이고 유쾌한 뮤지컬 영화~~ 
10,볼때마다 탭댄스가 배우고 싶네요 
10,보는 내내행복한영화^^ 너무사랑스러워요~♥ 
10,50년전에 만들어졌다 생각도 못할 만큼 세련된 느낌을 받는 영화 
9,뮤지컬이란 장르를 매력적으로 보게 한 영화. 
10,뮤지컬 영화의 대부 !! 정말 잘만들었다!! ^^ 
10,여름....여느 스릴러보다 더위를 잊게 해주는 영화...^^* 
10,꼭 봐야 한다! 
8,중간 지루한 진 켈리 탭댄스/뮤지컬씬만 빼면 모든게 최고. 
10,그야말로 대단하다는 말 밖에는... 
10,"비오는 거리의 진 켈리,사랑의 설렘을 이렇게 멋지게 표현하다니... "
10,최고의 뮤지컬 !!! 
10,"뮤지컬들을 먼저봤는데, 역시 원작의 포스는... 진켈리 최고!! "
10,이 정도면 본좌급 대열에 오를만하다. 
10,역시 뮤지컬영화는 보는것 만으로도 유쾌해-♥ 
10,명작이라 10점. 하지만 재미는 없었다. 
9,52년작이고 뮤지컬은 첨 보는데도 정말 괜찮은 영화. 
10,52년작이래 52년작.....요즘엔들 이정도 할수 있을까 과연? 
10,뮤직컬 영화의 진수이자 본좌격..... 
9,참~ 좋다 ! 
10,"켈리의 경이로운 경지의 춤실력, 오코너의 위대한 원맨쇼. 뮤지컬 사상 최고의 걸작. "
10,멋저부리는구만! 
8,멋진 영화 
8,우스꽝스러운듯 흥미로운 뮤지컬. 진 켈리와 벤 에플렉 닮았다. 
10,나이가 들어도 꿈꾸게 하는 영화  그 꿈에 난 항상 주인공이다 
10,비가오면 생각나는 그 노래. 
8,유쾌한 영화였다 
9,춤과 노래로 표현한 낙관주의의 경이로운 영화 
9,유쾌한 뮤지컬 로맨스가 조금 싫지만 음악은 최고 
10,재미있음 
10,이건 두말 할 필요가 없지않나요? 이제껏 본 영화중 최고. 
10,불후의 명작이다. 
10,굿 
9,"유쾌지수, 감성지수 200% 충전 대기 중... "
10,음악과노래는 영혼을 행복으로 잠식시킨다.. 
10,이것이야 말로 헐리우드 뮤지컬영화의 진수!! B E A utiful! 
10,정말 혼자보기 아까운 영화. 
10,GOOD!! 이런 영화를 찾고 있었음~! 
10,왜 난 이영화를 이제야 봤을까.... 
8,올드한 것 같지만 전혀 올드하지 않은 영화 
10,잠올때 봤는데 너무 재밌어서 잠이 확~ 깨버린 영화 
10,엄청난 감동....ㅠ 
10,"마음이 포근해지고, 덩달아 사랑에 빠지고 싶어지는 영화. "
10,내 인생 베스트 5위 안에 드는 영화 
10,이걸 지금에서 보는건 죄다! 
10,보고나면 평점이 왜 이런지 알게된다. 
10,명작 
10,"이보다 유쾌할수 있을까, 최고다 "
10,영화 그 이상 
10,보고싶다 
10,그 시대 영화로서는...... 
8,뮤지컬 영화는 '사랑을 비를 타고'부터... 
10,말로 표현이 안되는 훌륭한 영화~~ 
10,눈과 귀가 모두 즐겁다 감동까지 오오오 
10,내가본 최고의 뮤지컬 
10,@@ 환상적인 고전 뮤지컬 
10,뮤지컬의 고전. 훌륭해~~~!!! 
10,거짓이 아니라.본연.. 멋진 음악과 춤에 가슴이 두근거린다. 
9,두고두고 봐도 좋을 영화 
10,한마디로 예술이다. 
10,춤과 노래가 너무 멋지다. 
8,음악과 춤으로 같이 호흡하며 감성까지 움직일수 있음이 놀랍다 
10,어릴때-청소년때-어른이 되어도 계속 보게되는 유쾌한 영화 
10,비 오는 날 저절로 난 이 노래를 흥얼거린다... 
