score,review
10,"30년전이 지난 지금 봐도,,, 전혀 촌스럽지 않고 세련된 느낌은 뭘까? 저당시 저 퀄러티의 영화를 제작할 수 있는 능력은 물론 미쿡의 해군력에 경의를 표한다 "
10,계속 티비로만 보다가 드디어 극장에서 보게 되었네요!!! 감동 그 자체입니다!! 음악이 좋은 영화라 꼭 극장에서 보고 싶었는데 다시 보니 영상미도 상당하네요!!! 추천 100개 드림!!! 
10,개봉전까지 얼마나 기다렸던지 영화 시작전 긴장해서 다리가 떨림...연출.연기.음악 모두 좋았다.n차각~~톰오빠의 리즈시절과 현재의 톰오빠의 모습이 전혀 다르게 느껴지지않아 넘 설렜다. 지금봐도 80년대 작품 같지않고...
10,대체불가란 이런것. 명작 고전을 넘어 여전히 살아 숨쉬는 두근거림. 
10,명작은 시간이 흘러도 명작이네요~^^ 큰 스크린으로 즐겁게 감상했습니다!! 
10,솜털뽀송한 탐아저씨 다시 만나서 반가웠습니다 
6,젊은 날의 탐크루즈를 별로 안 좋아해 개봉 30년만에 드디어 보게됐다. 그는 진정 잘생겼었구나~ 그의 잘생김을 확인해주는 것 외엔 그냥 뭐 비행기랑 오토바이 멋지게 타는 영화 
8,오 탐아저씨 젊구만 ㅋ 맥라이언도 나오네 
10,봐도봐도 이 영화는 개명작이다 
10,1986년에 어떻게 이런걸 찍을 수 있었을까? 영화가 간지 그 자체다. 
7,사람들이 좋아할만한 할리우드 공식은 다 담았다 
10,테스토스테론이 쏟아져나오는군요 
10,87년작이라는 게 믿기지 않을 정도로 너무나 완벽하게 잘 만든 감동적인 영화. 영화 시작부터 엔딩 크레딧까지 끝까지 집중해서 봤다. 영화사에 영원히 언급되어야 될 영화임. 
10,이건 단연코 레전드지. 
10,저때 나는 뱃속에도 없었는데ㅋㅋㅋㅋ 
10,이런영화는 오직 할리우드에서만 나올수 있다 
10,역대급 영화 수십번봐도 안 질린다 
10,이 영화를 왜 이제서야 봤을까? 마지막 공중전은 80년대 영화라는게 믿겨지지가 않는다 
6,Top Gun 
10,뭐 따로 말이 필요한가? 
10,"1987년 겨울 방학에 친구와 함께 도산공원 씨네하우스에서 보았었던... 당시 월간 항공 등에서 각국의 전투기에 관심을 갖던 중 좋아하던 F-14A 톰캣 기종이 나오는 영화라서 고민도 없이 보았던...다만, 아쉬움은..."
10,지금의 톰 크루즈를 만든 영화. 
10,탐크루즈 레전드..보고 또 봐도.. 
8,탑건의 톰크루즈는 진짜 미친듯이 잘생김 ㅓㅜㅑ 
8,스토리부분은 약간 아쉽지만 그당시를 생각해보면 전투기 연출은 대단했다. 
8,매력적인 드라마와 스토리 
10,OST와 영화전개가 합을 맞춘 영화 
8,"지금 봐도 뛰어난 토니 스콧의 명작. 우리가 알고 있는 톰크루즈의 캐릭터는 이 때부터 완성. ""어디 가요?"" ""샤워하러요"" ""(훗, 넘어왔구나)"" ""고마워요, 즐거웠..."
10,이야 이건 해군 홈보영화인데... 지금봐도 멋있잖아. 
10,탑건2가 나온다니 ㄷㄷ 
10,이게 32년전에 나온 영화라니 충격이네 
10,ㅜㅜ 말이필요없는 띵작 
10,Take My Breath Away~ 이 노래만 들으면 가죽잠바입고 오토바이타는 톰 크루즈 생각남 
9,빠른전개 뛰어난 영상미 깔끔한 ost .. 무엇보다 존잘 우리 탐형~ 토니스캇 감독의 연출~ ebs 로 다시 봤는데도 전혀 촌스러움 없는 30년전의 걸작 
10,30년 지난 지금봐도 재밌다. 
6,친구와 추억 살리기 시간 
10,나의로망 프라모델 F14 톰켓 
9,리얼리티 넘치는 톰캣의 비행장면과 톰크루즈의 젊은 시절을 스크린에서 볼 수 있다는 것 만으로 축복 
8,우와~ 저 처음 봤는데 완전 잼낫어용ㅋㅋㅋㅋ 상영하는 곳이 얼마 없다는 점이 좀 아쉽지만.... 역시 명작은 명작이네요!! 톰크루즈는 지금봐도 잘생겼네요ㅎㅎㅎ 
8,80년대에 살고싶어지는... 영화네요. 영상이랑 음악이 너무 좋네요 
10,역시 내용이나 연기나 빠지지 않는 최고의 영화입니다.탑건2도 기다리고 있습니다. 
10,톰크루즈인데 이유가 더 필요한가ㅎ 
10,정말 재미있게봤어요. 
10,톰크루즈 왜이리 잘생겼냐 
8,30년 넘은 영화치고는 볼만함 
10,톰크루즈 얼굴이 다했다. 
10,다시봐도 역시 최고!! 어린시절 본 탐형의 젊은날이 지금봐도 멋지네요 
10,말로만 듣던 탑건  드디어봤다..  간지영화   ost중에 anthem 기타연주  개좋아 
10,몇번째 관람을 한건지 모르겠다ㅠ진심 최고!!!톰크루즈 대박머찜 
7,영상미와 멋스러움으로 눈은 즐겁다. 
9,톰크루즈 와꾸 최고임 열자 
10,이번 재개봉은 하늘이 주신 기회였다 
10,말이 필요없는 명작... 
10,연속된 야근 때문에 미루고 미루다 상영 마지막날 야근 끝나고 심야로 봤습니다.. 광고내내 졸았지만 영화 시작하고 공중전의 멋진 영상미에 홀딱 빠져들었습니다. 정말 그 당시 CG없이 이런 영상을 찍었는지 감탄하며 즐겁...
9,너무 재밌게 잘 봤어요.요즘 이런 영화 보기 힘든데..그리고 탐크르즈 리즈시절 너무 신선하고 멋지더라구여. ost도 넘 좋았어요.^^ 
8,재개봉 했을때 보기 정말~ 잘했다 ! 
9,톰은 지금도 멋있지만..어릴 때도 멋이 있네. 
10,오프닝 BGM으로 끝났다. 재개봉이고  최소 5번은 본 영화라 지루할 줄 알았는데 가슴두근두근.... ㅠㅠ 젊음이 느껴짐 
10,부모님의 젊은 시절을 추억할 수있게 해주셔서 감사합니다 
10,여러번 본 영화인데 다시봐도 재미있네요.^^ 
10,진정한 80년대스타일끝 모든것이 간지난다 그래서 100회이상보았다 
10,진짜.. 요즘영화 반성해야합니다... 
9,큰 스크린으로 다시 봐서 좋았지만 OST 남발은 지금 보니 좀 아쉽더라고요. 디지털 리마스터링을 했다고 해도 노이즈가 심하니 너무 큰 스크린은 오히려 역효과를 주니 참고하세요. 
9,토니 스콧은 정말 어휴스콧 형제를 낳아주셔서감사합니다미스터&미세스 스콧 
9,당시를 반영해주는 음악이 인상적이지만 씬마다 반복되는 게 좀 웃김..!! 그러나 아기같이 보이는 톰크루즈 보는 재미부터해서 9점 콱! 
9,굿 
10,"톰 크루즈의 퍼펙트 리즈 시절 ㅋㅋ 목소리는 좀 애티가 나지만 그가 타는 전투기의 비행장면은 실제와 같은 착각을 불러일으킨다. 감독의 촬영 기법이 대단하다는 생각이든다 동료애,사랑,전우애를 아는 사람이라면 가슴이 뜨..."
9,이정도는 돼야~  멋지고 ~ 배우들 연기도 멋지고~ 굿굿 
10, ☞^_^최고 
10,톰크루즈는 언제봐도 참 섹시해~ take my breath away~ 
10,"태어나서 처음 본 영화, 그리고 지금 현재 가장 마지막에 본 영화. 26년 전에 이런 걸작을 남긴 토니 스코트 감독님, 부디 편히 쉬시길 "
10,비행영화의표본 
10,말이 필요없음. 
10,이게 왜 청소년 관람불가야??? 정말 명작인데 
10,하하 톰캣짜응..본격 해군 홍보영화 ㅋㅋ 
9,재밌다 
10,중학교때보구지금또봐도재밋네 멋지다.여주인공두맘에들고은근매력적임 
8,다시보니 너무 멋을낸 연출이지 않나 싶다 마지막신은 완전 멋지구나 
9,Very good! 
9,지금 보면 밋밋하지만 그래도 이영화만큼 파일럿을 자세히 표현한 영화는 없다고 봄 
9,"영화는 뭐 그럭저럭.. 톰 크루즈, 발 킬머 멋있네.. "
10,내인생최고의 영화 절대로 너의 윙맨을 떠나지마라 독고다이매버릭에게 동료의 자리란 무엇인가 
10,탑 건 1986년작 
10,1986년에 CG가 있었을까 
10,그당시  톰크루즈를 전세계 젊은이들에게 우상으로 만들어준 작품~!! 
9,"중학교시절 본영화인데 지금까지 생생하게 기억에 남는영화, "
8,어릴때의 감수성을 되살려주는 영화.. 편집의 승리를 볼수있다. 
10,어릴적 조종사의 꿈을 다시 되살려주는 영화! 지금 그 꿈을보냈지만 영화는 최고였다. 
10,이제야 봤는데도 재밌고 멋지다 
10,다시봐도 재미있고 멋진영화~! 
10,너무나 멋있는 영화 ! 
9,음악감독에게 경의를 표함. 영화속 음악들은 영화를 한층 더 빛내고 설레게 한다 
10,cg가 없던 시절.. 이지만 나름 잘만든 영화 탐크루즈를 톱스타로 키운영화 
10,이 시대 최고의 배우 톰 크루즈를 만든 명작 
10,탐크루즈 최고! 역시 여기서 제일 빛을 발한다! 
10,최고의..영화죠..전DVD로지금도보고있어요?? 
10,반전비행하는모습이 너무 멋있어요!! 
10,영화 속 캐릭터 만큼이나 패기 만만이었던 톰 크루즈 청년 시절~ 
10,제가 이거 8살떄봤던 기억이 영화도 잼있었지만 영화속 이노래 정말 좋네요 
10,전투기영화중 단연 최고 액션과 재미 감동 모두 다 만족스러움 
9,재미를주는 젊음의 영화 
10,전투기관련 최고의 명화 
9,젊은 톰크루즈의 패기만만한 강력한 매력! 
10,2010년에도 후평은 끊이질 않구나~영원한 나의 히어로! 
9,뜨거운 열정의 영화 HOT! 
10,그냥최고란말뿐이... 
10,"남자의 로망 - Speed, Bike, Jet, Top Gun, 여기까지만.. "
8,"너무나 미국적이지만, 매력적인 비행 씬과 OST엔 빠져들 수밖에 없다 "
10,내 생애 최고의 영화 
9,재밋엇어요ㅋ톰크루즈팬인지라 더^^못말리는비행사만먼저않봣어도5점ㅜㅜ 
10,명작이다 
10,명작중에 명작 
10,말이 필요 없는 영화 
9,비행장면이 너무나 인상깊었던 영화 
8,영화관에서 봤더라면 훨씬 재밌었을텐데 87년생이라-_-;;; 
10,톰크루즈 영화 중 최고는 탑건인것같다. 
10,내가 이거때문에 아직도 전투기에 미쳐산다 ㅋㅋ 
8,흠 괜찮은데 
10,ㅋㅋ 그냥 재미있는 영화지 뭐 
9,"내가 태어날 때 개봉한 영화인데, 지금봐도 참 즐겁게 봤다 역시 토니스콧&톰크루즈 "
8,영화 내용은 잘 기억이 안나지만.. 어릴때 재미있게 봤던 기억은 분명하다. 
10,심심할때마다 보면 재밌는 오락영화 
10,지금 봐도 토니스콧 작품이라는 것을 알 수 있을 정도의 화면과 연출 
10,여러가지 요소들이 잘 조화된 멋진 내용의 영화. 
10,지금의 톰크루즈를 있게한 영화.. 
10,"피카디리 개봉시 3번보고 tape,lp,vcd,dvd소장.. 팜플랫버린거 후회됨 "
8,비행장면이 과연 일품이로다. 
8,젊은 패기로 중무장한 최고의 파일럿 영화 
10,어린 시절 최고의 성장/청춘 영화 중 하나였다 
10,good 
10,오토바이타고질주하는 톰크루즈.. 공중전..  진짜 최고의 영화 
10,개봉당시  젊은 청년의  우상 
10,"지금 다시봐도 멋진영화,멋진음악 "
9,역시멋져톰크루즈 
10,내가 태어나기도 전에 이런 영화가 있었다니! 
10,영화관에서 대형스크린으로 다시 보고싶은 영화 0순위 
10,내가 4살때의 영화.. 21년이 지난 지금 봐도 정말 명작..!! 
8,전투기의 공중전은 언제봐도 멋있다. 그런데 왜 그것을 개싸움이라고 할까? 
10,명작 
10,탐크루즈 와 발킬머 나온건 알고 있었지만 마지막 팀로빈스 모습보고 깜짝 놀랐네 
8,"레이벤 선글라스, 할리데이비슨 오토바이,  멋진 OST  . "
10,상업적 영화로서의 완성도가 실로 놀라웠던 작품. 특히 OST는 정말 압권. 
10,몇몇 안되는 흥미진진한 영화 
8,미그기 똥-5 압박 
10,OST가 가장 영화와 잘 어울리는 작품이라 생각됩니다. 하나같이 멋진 곡들!!! 
10,AVGN때문에 알게 됐다ㅋㅋ 
10,발킬머 톰크루즈 ♥ 20년전 영화 보니 감회가 새롭. 
9,"20년이란 세월은 어쩔수 없지만, 그래도 정말 본연에 충실한 비행영화! "
10,이때의 발킬머는 거의 조각이었네. 지금은 어찌그래변했지.. 
9,손에 땀을쥐는 스릴과 긴박함.. 지금 보기엔 조금 어색하기도;; 
10,평점 객관화 안된놈은 좀 잘랐으면 싶다. 
9,극장에서 안 본 자들에게 무슨 말을 해줄수 있겠나? 
9,최고의 파일럿 영화 
10,이 영화로 톰캣이 절찬리 팔렸지.갠적으로 탐은 이때가 최고 
10,이 영화에 수식어를 붙이겠다고...   bullshit 
10,대작~!! 
9,20년이 지난 지금의 영화와 견주어도 전혀 꿀리지 않는 영화 
10,내 생에 최고의 영화...ㅋㅋ 
10,비디오 두대를 연결해 불법복제 후 100번이상은 본.. 
9,이영화를 보고 열망하고 환호했던 사람들이 생각나.. 
10,마지막 전투장면 숨조리면서 봤다는...최고!! 
8,톰 크루즈를 배출한 감각적인 비행영화.. 
10,이영화 땜시 공사 인기 쵝오~~ 
10,자신의 꿈에의해 심장이 요동치는가.노을지는 붉은태양을 온몸으로 느껴보라. 
9,캬~ 추억의 영화로군. 기억도 가물가물하네. 그래서 -1이다. 
10,세월이 흐른뒤 다시봐도 명작. 최고다. 
10,O.S.T가 영화를 살린 케이스 
10,여러번 봐도 질리지 않는 영화. 
10,"탐 크루즈 키가 넘 작고, 땅딸막하다..하지만 멋있다.. "
8,전형적인걸 알면서도 멋진 마지막 전투장면 
9,70세대남자들의가슴을노래했던낭만무비토니스콧멋진초연^_^ 
10,OST가 너무 좋다 
8,아마 이런영화는 다시는 못찍을듯싶다. 최고의 파일럿영화! 
10,탐크루즈의 진정한 출세작..더불어 눈에띈 조연의 맥라이언 
10,이 영화때문에 얼마나 많은 사람이 파일럿을 꿈꾸었던지 
9,진정한 간지 영화 
10,여름 저녁 석양이 물드는 수평선을 오토바이를 타고 달리며 
7,"지금보면 촌스러울지도 모르지만, 당시의 포스는 대단했다. "
10,몇번을 봐도...빠져드는 영화... 
10,지금 다시봐도 빠져드는 영작~ 
10,멋진영화음악과함께하는파일럿영화~파일럿에대한환상을갖게함... 
9,오토바이타고 비행기 옆을 달리는 장면..캬~ 멋진 영화 
8,클래식/클리셰 그 자체의 영화 
8,여자들이 보면 저녁에 잠못자는 영화! 
10,몇OO이 흐른뒤 다시보니 감회가 새롭네요~아...정말이지 톰크르즈 너무 너무 멋지다는~~~~♡♡♡ 
10,엔딩크레딧 끝날때까지 노래감상했네요굳!! 
10,이보다 더 좋은 항공영화는 당분간 나오기 힘들듯! 요즘 같이 CG떡칠이 아닌 진짜배기 F-14가 날아다니는데 무슨 말이 더 필요한가! 
10,변함없는 감동톰크루즈는 언제봐도 멋있어요 
10,너무 잘생겨서 내용이 기억 안납니다. ㅋ너무 재미있어요. 
10,20OOO 첫 감상 댓글 내가 쓴다이건 꼭 봐라두말 안한다 
10,실화냐 이게 32년전 영화냐톰크루즈 모습 실화냐 뭐? 리턴 미션 알투비투? 옛끼 이사람아 
10,ㅓ무너무 재밌어요!!!톰크루즈의 젊은 시절도 지금도 너무 잘생걌고 연기 잘하세요!! 
10,스무번을 봐도 안질림 남주들 너무 잘생기고 .. 최고의 서양 성장물 
10,탐크루즈의 얼굴이 개연성이요 그 모든 것이다. 자칫 부족해보이는 스토리를 완벽하게 커버치는 탐 크루즈 
10,미국이 1970년대에 쓰는 전투기종이 우리나라에서 이름만 k 더붙혀서 지금에야 나온거일뿐인데;; 저게 요즘시대에 꿀리지않은 비행기외형이아니라... 
10,대에박 스토리 개탄탄아재영화가 아님 공군 지원해야게씀 
8,"각본과 연출은  지극히 단순하지만 소재,  배우, 음악이 너무 매력적인 영화다또 보고싶은데 상영관 구린데서만 함큰화면에 고음질로 틀거아니면뭐하러 재개봉하냐? "
6,OST가훌륭했음..이영화본지가 20년이 지났네..시간이 너무빠르다 
8,기대한거보단 별로였음. 확실히 옛날 영화 티가남.  톰크루즈 존잘에 무스는 죽을지 몰랐는데ㅜ그래도 클래식이라 불리는 이유를 알겠음 
10,와~~우~~! 네이버에 평점 남긴 수많은 영화 중 유일하게 감상포인트 다섯개 다 선택한 영화. 더 이상 무슨 말이 필요하리 !탐 행님. 싸랑합니데이~~ ㅎ 
10,
10,이 영화가 86년에 개봉한 영화라니. 요즘 우주최고 배우 톰 크루즈님 영화 다시 복습중인데 당시에 이렇게 화려한 전투기씬이 있는 영화를 만들다니. 그리고 선글라스 오토바이 항공점퍼로 대표하는 상남자 이미지의 창시자 ...
10,
10,한마디로 전투기 영화의 교과서 지금봐도 최고다 
8,탑 건 !톰의 젊은 시절을 볼 수 있어 좋았습니다30년도 전에 영화라는게 믿기지 않네요 
7,미해군 비행단 모병 홍보영상이자 F-14 위력 시범 영상.이들은 훗날 걸프전의 주역의 됩니다. 처음 봤을 땐 이 영화에 팀로빈스와 멕라이언이 나온 줄 몰랐지. 
10,남자의 로망으로 가득차있는 남자를 위한 감성포르노. 
9,1980년대 작품이라고 하기에는 완성도가 지금 나온 것이라고 해도 믿을 정도. 
10,와.. 태어나기도 전에 나온 영화가 이 정도라니 역시 천조국이구나! 
8,이런 초호화스러운 청춘드라마라니 
8,구스를 꼭 죽였어야만 했냐 
10,
9,"톰아제, 발킬머, 맥라이언, 팀로빈스... 리즈시절 음악과 화면 환상적인 호흡 굿. "
8,시대를 초월하는 톰 크루즈의 미모 
10,1987년도부터 핵 항공모함 운용중인 세계 최강 미군.. 
9,80년대 미국영화 특유의 확실한 기승전결 해피엔딩과 고전적인(?) 로맨스... 정말 즐거웠음.. 
8,실제 전투기를 소재로 한 몇안되는 영화로서 의미가 크네요 
8,"그냥 그래요, 톰크루즈의 풋풋한 목소리. "
8,내용은 뻔한데 왜 재밌나 했더니 톰 크루즈랑 발 킬머 얼굴이 걍 개연성이고 연출임 존멋존섹 둘이 왜이리 가까이서 대화함? 나 좋아죽으라고..뽀뽀하는줄알았네! 여튼 훌륭한 영화였어요 ...^^ 
10,진짜 전투기가 날아다니는 영화 
7,"플롯이 뭔가 엉성하고, 배우들 연기도 가끔 어색하지만, 그걸 다 뒤덮고도 남을 신나는 음악과 비행 장면들, 멋진 남녀 주인공들 덕분에 보는 내내 즐겁습니다. "
7,"그때 그시절에 봤다면 엄청났겠지만, 탑건의 여러 장면들을 이미 수많은 영화에서 어설프게 차용돼서. 지금  처음 보는 사람들은 그닥 인상적이지 않을 듯. < 주의 > 절대 여자친구랑 보러가지 말것. 남자배우..."
8,"중학교때, 인근 씨네하우스에서 본 영화, 유명한 주제곡고 함께 톰 크루즈를 확실히 각인시켰다 "
8,스토리는 평범했지만 F-14의 전투씬과 톰 크루즈의 멋진 연기. 불타는 청춘을 느낄 수 있었던 영화였다. 80년대의 정열이 잘 드러나있는 것 같다. 
7,영화를 봤지만 조종사의 현실은 그렇지 않다는 점...... 마지막 몇분빼고 재미없었음 
7,86년도 영화였다니ㄷㄷ스토리라인을 떠나서 그 시절의 기술력치고는 놀랍군 
7,최고의 파일럿 영화이긴 하지만 너무 사랑이야기에 치우치며 키스남발 
10,"지금보면  어색할 수 있지만, 저 당시 탐은 멋졌고, 영화도 멋졌다. 심지어 o.s.t도.. "
7,뭔가 허전한 느낌이 드는데... 
8,최고중에최고가되려면실수를하고도계속하라고찰리는말했다 
7,줄거리가 저게 다에요~; 너무 아쉬운 영화랍니다~; 감성을 더 채워주세요.. 
8,그당시봤으면 정말재미있엇을텐데.. 
7,남자 영화~ 
7,옛날영화지.. 재미는없지만 멋있는 영화 만12세면 초등학생한테 추천할만한 영화. 
7,전형적인 킬링타임용 영화! 
7,굿 
8,86년에 이런 촬영 기술을.. 대단하다. 쓸데없는 로맨스는 줄였으면! 
7,not bad... 음악은 최고!!! 
7,그저 그런 영웅물에 가까운... 
8,눈요기 잘했다. 
9,톰 크루즈뿐만 아니라 맥 라이언도 나온다는.. 
10,not bad~ 
8,멋지지만 그당시에 봤더라면 더 좋았을듯 
8,영화는 재미없지만; 영화음악 너무 좋다. 
9,쇼파워리어 톰을 상상해서는 안된다!상큼한 톰이 인상적... 
10,"우리동네 비됴가게서 누가 테잎끈어먹었어, 그장면에서 "
10,파일럿에 대한 환상을 심어주는 영화 
10,종종 생각나죠... 
8,비행 파일럿 영화중 이보다 잘 만든 작품이 있을까 ? 
10,탐크루즈가 진짜!! 
10,크루즈의 간지를 보자 
10,아직 수능을 안봤다면.. 이거 보고 공사가고 싶은 마음이 들수도 
8,하늘나는거 멋있다~ 
8,톰 형님 이땐 또 이미지가 틀리네~ㅋ 
10,ost가 생각난다 
10,다시 봐도 진한 감동이 있는 영화 입니다. 
10,파일럿의 꿈을 심어준 영화 
8,어릴때 비디오로 봤다. 미성년자 관람불가 등급이였다고 기억 
10,안 봤다 그냥 9점대로 올리기 위해 
7,주인공 친구의 애인으로 나온 멕 라이언이 인상적이었던. 
9,The Top Of The Stylishes! 
10,감동의 드라마. 멋진 주제가 그리고 톰크루즈 
10,내가 평점 높였다 ㅋ 
10,탑건2가 나오길 기다리며^^ 
9,젊은 날의 탐 크루즈를 볼 수 있다. 
10,어릴때 잼나게 봣던 추억의 영화 
9,"아저씨, 이 때만 해도 굉장한 호남이었는데.. good! "
10,멋있다 
10,최고. 
10,언제바도 넘 멋진영화(내가다시 평점올린다ㅋㄷ) 
10,9.01ㅋ ㅋㅋ  톰쿠르즈....!!! 
10,최고의 영화 
10,오에스티 굳~ 톰크르즈 미모 굳~ 이게 바로 청춘영화 
10,남자의 로망..아..... 
10,톰크루즈를 세계최고 스타로 만든 영화 
9,고딩때 진짜 잼있게 봤는데 
10,이영화 수작인디 왜 평점이 이것 밖에 않돼? 
8,질주하는 청춘 
9,여전히흥미진진. 
10,젋은이들의.. 우정... 
10,정말 말이 필요없는 전설적인 영화... 
10,OST완전 좋아~ 탐크루즈 젊었을때..정말 너무 잘생겼어... 
10,제리 브룩 하이머의 불후의 명작. 
10,"Take my breath away 탐,발킬머,맥라이언.... "
10,탐 크루즈의 포스가 느껴진다. 
10,그 당시에는 정말 최고였을것이다. OST 굿~ 
7,OST명작...내용은 지루하게 봤던 기억.. 
10,"즐겨보는영화, OST도 최고고! 전투기는 여자의 로망!(틀려!) "
10,이 영화 즐겨봐요 ㅋ 저장해놓고 ㅋ 제 꿈이 파일럿이거든요 ㅋ 
8,나 조차도 공사에 입학하고 싶었다는.. ㅡㅡ; 
10,주옥 같은 ost 
8,배구장면에서 언니들 괴성에 짜증났던 기억만 가득.... 
7,이 영화 주제곡 너므 좋타.. 영화는 좀 그렇고..-_-;; 
10,미국우월주의등의 말로 재미없다는 사람 이해가 안감.. 
10,뽀대 영화의 결정판... 
7,박진감있고 지루하지 않는 영화인데 단점은 넘 미국우월주의적 
10,8점 이하로 주는 사람들...이해않감. 
8,당시에는 최고였음. 탐 크루즈도 그렇고. 지금봐도 봐줄만함 
10,우리아빠가 젤 좋아함 
10,"만점을 줄수 밖에 없는 영화. 음악, 탐크루즈, 발킬머도 좋다 "
10,이 영화는 이미 고전이 되었다. 음악이 메이리치는 영화! 
10,보수우익사상만 빼고 모든게 멋있는 영화 
10,take my breath away.. 요즘에도 들으면서 걷는다.. 
9,GOOD 
10,take my brethe away 이 노래 아직도 잊을수가 없다 
10,저비행액션 무지 좋아함 이게 제가본 비행 액션중에서 2위인 영화 
10,10점 만점에 11점이 아깝지 않은 영화.. 한번 더보면 11번 봅니다~ 
10,good 
10,당시 80년대의 싱싱한 분위기와 젊은이의 패기가 느껴진다. Good!!! 
8,음악은 좋았다 
10,최고지 
8,지금 다시봐도 괜찮은 영화 
10,그때나 지금이나 언제나 탑건을 보고 있습니다. *^^* 
10,당시.. 탐크루즈는.. 제게 영웅이었죠^^ 10번 이상을 본영화~ 
10,"지금 다시 봐도 무적 톰캣 멋지군요, "
10,학창시절 나에게 꿈을 주웠던 영화...... 
10,비행기 나는 소리와 톰크루즈의 열정과 사랑이 매력으로 기억된 영화 
10,수많은 아류작을 양산시키며 사나이가슴에 불을 당긴영화! 
7,캘리멕길리스는 요즘 뭘하나 
10,이것때문에 조종장교 지원했었쥐... 
10,하늘을 멋지게나는 영화이며 내게 전투기에 내꿈을 심게해줘서... 
10,내 가슴을 뛰게 했으므로. 
10,만점을 줄 수 밖에 없는 영화. 톰 크루즈 멋있넹.. 
10,전투기공중기술이 정말 압권이었고 톰크루즈의 젊었을때 모습도 멋있고 ... 
9,옜날영화중 최고의 영화 탐크루즈 연기가 대단하고 특히 OST가 엄청 좋음 
9,다양한 비행신이 압권인 영화 
9,진짜 스케일부터가 틀리네 맥라이언신인때도 나오고 
6,12.02.05.역시 난 형보다 동생 쪽이 더 내 취향인 것 같다. 미그기 위에서 반전 비행으로 OO 날린 것만 기억난다. 
9,옛날 갬성 취한다 취해  핵 존잼은 아니고 대유잼 
10,토니 스콧토 센세이 그립읍니다... 
10,32년 전에 만든 영화인데 지금 영화못지 않게 재밌네! 매버릭 진짜 잘생기고 귀여워서 내내 웃으면서 봤다ㅋㅋㅋ 
10,"고전 명화의 감동...!!CG가 아닌 그당시의 실제 비행장면이 압권..!!풋풋하던 톰 크루즈를 보는것은 물론 발킬머를 비롯 맥 라이언, 팀 로빈스의 초창기 모습을 볼 수 있다. "
