score,review
10,오늘 티비에서 봤는데 정말 1984년꺼라도 재밌고 아름답다 >< 톰 행크스가 젊을 때 저렇게 잘생겼는지 몰랐는데 여주도 그렇고 이쁜 영화다 
10,파릇파릇한 시절의 톰행크스 영화는 다 잼있는 것 같다. 현실적으로 풀이하지 않은 엔딩이 맘에 든다♥ 
10,어렸을 때 TV에서 이 영화를 정말 재밌게 봤었는데..  어느새 세월이 흘러서 추억의 영화가 됐네요 또 보고 싶다 
9,디즈니에서 만든 거 같애.. ㅋ 
9,어렸을땐 인어만 기억이 나는데..풋풋했던 젊은 톰행크스도 참 멋지네요..ㅋㅋ 다시 봐도 명작입니다...리메이크해도 괜찮을 것 같아요^^ 
10,어렷을때 명화극장으로 봤던기억이 있는데추억의 영화네요 ^^물에  젖어서 드라이어기로여주가  다리를 말리던  ^▽^어린맘에인어인걸  들킬까봐 조마조마했던기억이 나네요 
10,동화같은 두사람의 사랑이야기. 정말아름답다.. 
10,사춘기 시절 보고 몇일간 가슴앓이 했던 영화 
9,판타지적인 요소가 적절하게 섞인 로맨스. 틀림없는 수작이다! 
10,톰 행크스 전설의 시작! 
10,너무 낭만적이다 
10,정말 재밌고 결말이 좋았다. 
9,어릴때 무한반복 동화같이보던 영화다 옛 영화들이 더 아름답고 순수함ㅎㅎ 오늘 티비에서 하네 커서봐도 좋다 톰행크스는 젊으나 나이드나 넘 멋짐~!!! 
10,언제까지나 두고두고 보고싶은 그런 영화!! 
10,중학교때 극장에서 본 영화내인생 최고의영화 
10,어릴 때 본 영화. 톰 행크스의 젊은 모습을 만나볼 수 있다. 어릴 때 봤지만 지금도 생생한 환상적인 영화. 다릴 해나의 연기가 인상적이어서 인어가 실제로 존재할 것만 같은 영화. 
10,동심을 불러일으킨 인어와의 사랑이야기. 배경음악도 너무좋아 
10,다 필요없다. 젊은 시절의 다릴 한나 그 자체만으로 아깝지 않은 영화. 
10,동화가 아니다 철학적인 영화다. 마지막에 통행크스가 바다에 뛰어드는 것이 무엇을 의미하는지 생각해봐라~ 
10,초등학교 시절 이영화를 보고 36살이되어 다시 보니 새롭네요 어린시절로 타임머신을 타고가는 기분. .정말 내인생에 최고의 영화입니다 
10,지금은너무나늙어버린톰과해나그떈정말선남선녀였네영화도너무아름답다마지막노래도 
10,너무 순수하고 아름다운 인어공주의 사랑얘기.. 
10,지금의 할리우드에서는 나오지 못할 영화 
10,노출이 순수해 보였던건 이영화가 처음이었다. 그리고 데릴 한나의 그 순수한 웃는모습도 좋았다 
10,어렸을적 너무나도 재밌게 봤던 영화. 
10,어렸을 때 봤을 때 영화 속 인어속 꼬리가 너무나 신비롭게 보였던. 
10,1984년 내가 태어난 해에 만들어진 영화  진짜 이렇게 아름다운 영화는 다시 없다 
10,이영화는 빅과 더불어 쵝오 !!~!!!~~@!!~~! 
10,정말 서정적이고 가슴 따뜻한 동화같은 영화였어요... 요즘엔 이런 예쁜 영화가 안나오잖아요. 그래서인지 더 향수를 불러일으키는 것 같았어요. 음악도 그렇고. 너무 좋네요. 
8,어릴적 로맨스를 꿈꾸게햇던ㅋㅋ벌써 이리오래됫군 
10,영화도 아름답고 OST도 훌륭합니다.또 보고싶네요.. 
10,대릴한나가 이렇게 이뻤다니! 
10,"까마득히 어릴 때 tv에서 재밌게 봤던 기억...에 다시 찾아서 봤다. 30년도 더 된 옛 기억들이 너무 새록새록해서 놀랐고, 다시봐도 마음 설레는 명작. ND "
10,현실에 지친 나에게 힐링이 필요할 때마다 보게될 것 같은 영화 :-) 
10,나의 눈시울을 뜨겁게 한 아름다운 이야기..... 
10,이거 진짜 재미있었음... 톰 행크스 완전 어렸네..ㅋㅋ 
8,여주인공이 다릴 해나 였다는 게 놀라울 따름... 
10,그 시대에 이 효과 이 내용이면 상당히 높은점수의 영화다 
10,어렸을때 본 영화. 너무 신비롭고 재밌어서 절대 잊을수 없는 영화~!! 
10,할리우드는 왜 더이상 이런영화를 만들지 못하는걸까.. 
10,어릴적 티비에서 봤던 영화인데 다시 봐도 재미있다 옛날 영화는 이제 흔히 찾아보기 어려운데 이렇게 다시 볼수 있게 되어서 기쁘다 
10,35년전 작품이라는게 믿기지않는다. 정말저런사랑누가해볼까 ~~ 명작 
10,"84년에 봐서 내용은 거의 잊어버렸지만,엄청 이뻤던 대릴 한나ㅡ인어ㅡ는 최고!또보고싶다 "
10,내가 20살때 영화관에서 7번이나 본 영화.... 벌써 내 나이 50!! 세월 참 빠르다. 서글프다.  하지만 나에겐 최고의 영화!! 
10,추억은 방울방울 스플래쉬 
10,물거품이 아닌 사랑이야기 이루어 졌어 너무 조아 
10,아주 어릴때 티비로 본건데 인어가 진짜 있을지도 모른다고 생각했었다 ㅎㅎ 
9,푸른바다의 전설이전의 전설... 
10,넘 아름답고 유쾌한 영화~^^ 
6,동화같은 순수한 마음을 담은 로맨스 영화. 아름답고 슬프다. 
10,왠일이야 인어공주 이야기같다꼭 ㅋ세월참 빠르다 
9,굿~! 
10,재밋어서 또 보고 싶은 영화~ 
10,어른들을 위한 한편의 동화같은 판타지 
10,진짜 너무 다시 보고픈데 어디서볼수있을까.... 너무 맘에 든다 
7,추억의 영화다...이루어질수 없는 인간과 인어의 사랑..옛날이 그립네..ㅎ 
8,세토의 신부가 이영화 패러디한 거였나 
9,인어공주의 훌륭한 현대적 각색 
10,어릴때 본 후 제목을몰라 답답해하다가 우연히 알게되었다. 동화같은영화 다시보고파~ 
9,12살때그날엄마한테혼났었는데울다가토요명화에서나오길래눈물그쳤던기억이;; 
10,어렸을때 토요명화로 재미있게 본 영화. 84년작에 톰행크스라니 놀랍네 -_-; 
10,칵테일 유콜잇러브와 함께 추억의 토요명화에 본 잊지못할 동화같은 양키 로망스 
10,진짜 어렸을 때 봤는데 지금도 기억속에 ㅋㅋㅋ 
9,어릴적에 진짜 재미있게 봤던..^^ 
8,23년전에 이영화가 만들어졌다는 사실이 난 믿기지 않는다... 
10,어렸을 때 보았던 영화 다시 또 보고 싶은 영화. 
8,어릴적에 시간가는 줄 모르게 봤다 
9,어릴적에 너무 재미있게봤다... 
7,부담 없이 볼 수 있는 짧은 동화. 
10,태어나 처음으로 평점을 주기위해 로그인....중학생 때 보고 오늘 또 보았는데도 감동 
10,쉐이프 무슨 워터 인지 그딴 쓰레기 보다 가  빡쳐서 이거 다시 봤다. 이게 진짜 명작이지. 
9,그옛날에 만든 영화인데도 엊그제 본 드라마 푸른바다의전설 보다 훨씬 완성도가 높다.그리고 여주의 분위기있고 우아한 표정과 부드러운마인드가 현재드라마와 비교해 너무 퀄리티가 높다.한마디로 전지현은 연기하면 막가파가 되...
10,중1때인가 극장가서봄 제가 더티댄싱 마네킨 전부 극장에서 본후로 로맨틱코미디영화 매니아되고 (나이트메어본후 공포물도좋아했지만요) 어린맘에 로맨틱영화보며 남주 조아하게되고 설레이고 전 그렇게 몰래 극장가서 사춘기보낸듯...
9,그 시절 가장 아름다웠던 영화 
10,이제 성인 됐으니 스플래쉬 볼 수 있겠다.30년 전에 꼭 보고 싶었었는데. 
7,Splash 
10,정말 예쁜 영화입니다. 
8,내가 대충 예상한대로 끝날 줄 알았는데 아니라서 신선했음. 지금봐도 재밌다 
10,성년이 된 해~ 엄청 재밌게 봤네요^^ 다시보기합니다~~ 
9,"재밌다..  80년대 감성영화 .  마네킹,천사와사랑을,스플래쉬 등등.. "
10,"마네킨1편,2편 ,'천사와 사랑을' 추천해드립니다 ♥♥♥ "
10,그래서 메디슨 본명은 '이~이~에~아~~'라고 부르면 되는건가?ㅋㅋ 
8,이건 정말 옛날인데.. 추억의 영화 
8,어린시절 바다에 빠졌던 알랜'이 인어에 구조되었던? 이거 쓴 양반  영화를 보기나 한 거야? 어린 시절엔 지가  인어를 보고 뛰어 든 것이고 나중에 커서 작은 보트에서 빠진 걸 구해지지... 이 웃기는 양반들...
10,"어린 시절 본 80년대 영화는 아련하고 아름다운 추억들이 서려있다.. 그러나 그 시대 명작 들을 성인이 되어 처음 접하게 되면 이질감이 드는 건 단연 사실, 그럼에도 이 작품은 어릴쩍 운좋게? 보게 되어 아름답게 자..."
10,나의 인어공주님은 어디계신가요 ㅜㅜ 
9,동화같은 이야기에 배우들의 연기도 잘 어울어진 수작. 
10,9점대 만들려고 로그인 
10,재밌네요. 자막 형편없는거 빼곤. 
10,어릴적 tv로 보다가 아버지 씨름 보시느라 끊겼는데 20년도 넘게 만에 보내요 역시 굿 
10,9점대 가자 으랏차차!! 
9,어린 시절 엄마의 품에서 귀기울여 듣던 '인어공주'의 느낌 그대로. 오늘 밤 꿈에는 왠지 인어가 나올 것 같다. 
10,무슨 영화가 평점이 이리 높나했네... ㅋㅋㅋ 이제 생각나네어렸을때재밌게봤던영화. 
10,넘재미있어서 친구 데리고 극장에서만 2번 본 기억이 새록새록^^ 
9,예전에 진자잼잇게봐는데... 지금보면 약간 유치할수도 잇게단생각 그래도좋아여 ㅎㅎ 
9,결말이 아름답고 감동적이기 까지 했다 
10,정말 로망이었던 영화!!! 꼭 다시 보고 싶다!!!ㅠㅠ 
10,추억의 영화. OST도 좋고... 동화같은 느낌. 
10,너무너무 낭만적이고 아름답다 
10,인간이 아닌 다른 존재와 사랑한다는 것은 정말 환상적이고 아름답고 잊혀지지 않는다 
10,어릴적 인어공주만화의 여운을 이어주는 아름다운 영화에요..^^ 
10,여배우가 연기하는게 너무 귀여워서 기분이 좋아진 영화.. 
10,정말어릴때본영화.. 엘리베이터문열리는순간양동이의물을뿌리지만엄한사람이었던 ㅋ 
10,"내가 태어나기 전에 만들어진 영화인데, 지금봐도 재밌으니 명작인 게 분명해! "
10,참 재미었던 이야기...글고 20년이 훨씬 지난 지금도 그리운 영화........... 
9,재밋다 
10,전설적인 영화 T^T 목걸이주고 저 분수대를 집안에 놓은 그 장면이 아직도 선합니다. 
10,넘 재밌어서 기록 찾아보니 세계적으로 엄청 히트했더군요. 1억5천만달러던가. 
8,파닥파닥 
10,흑 부럽다.ㅋㅋ 
10,이 때만 해도 대릴 한나 최고였다능... ㅜㅜ 
10,어른을 위한 한편의 동화 같은 영화 
8,톰행크스의 초기 모습과 다릴하나의 매력.. 그녀는 지금 뭐하는지.. 
9,내가 태어나기도 전의 영화.  나를 꿈꾸게 하다. 
10,"너무 훈훈한 영화, 보고나니 기분이 좋네요~ "
10,이걸보고 난 중1때 잠을설쳐써 
10,어릴때 재밌게 본 영화 굉장히 괜찮다 
8,순수함과 풋풋함의 그리움. 
10,다운받아서  16년만에 다시봤네요  다시보니 감회가 새롭고역시나 잼있군요 감동 ㅡㅠ 
8,아름다운 인어와의 마술같은 사랑이야기 
10,다시보고싶은데 어케 보지 ㅎㅎ 
10,졸 재밌다 
10,짱 
9,내겐 잊지 못한 다릴 한나~! 
10,오래전이나 지금이나 보아도 여전히 아름다운 영화 
7,수조속의 인어는 잘 표현거 같다. 고생 많이 했을 듯. 
10,너무너무예쁜영화~제가7살땐가봤는데 제가 태어난해 만들어졌네요ㅋ 
10,중학교때 보고 완전 기억에 남았어요 다시 보고싶은데 어떻게 보지 
7,풋풋한 톰행크스~!! ^^추억의영화!! ^^ 
7,대릴한나의 매력이 마음껏 분출되었던... 
10,추억의 명작 영화! 
10,"20년이 넘어도 촌스러운건 배우들의 모습뿐, 영화는 10점 만점 "
10,추억의 영화 
10,어릴적에 이거 정말재밌게 봤는데..84년도 영화구나..내가태어나기도전이네 
10,인어를 꿈꾸고 상상하게 한 영화 
10,10점을 안내린사람은 감정이메마른 호구들 
10,그 황홀하고도 신비한 어른을 위한 동화같은 영화 
8,뉴욕 메디슨가를 보고 이 영화를 생각했다. 
8,왜 난 마지막 장면이 슬프지? 
8,아름다운 인어의 모습이 기억에 남지만 감동은 약하다 
10,어릴때 재밌게 봤음 
7,다릴 한나의 매력에 완전히 빠져들었지 
9,정말 인어가 있을까? 잠시 생각에 잠긴다. 
10,난 어릴때 이거보고 진짜 인어가 있는줄 알았는데...ㅠ0ㅠ 
10,"지금은 22살,, 내 나이 열 살에 보았던 다릴한나는 천사였다 "
9,유치할지도 모르나 볼만하다. 
10,동화처럼 아름다운 영화. 
10,.......... 
10,상업영화라도 좋다..충분히 아름답고 매력적이다 
10,포스터 보고도 떠올라지는 영화.. 기억에 남는군요 
9,마무리가 아쉬었다는게... 
10,본지 10년이상 지나서도 다시 생각나게끔 만드는 영화네요. 
10,인어가 너무 불쌍했었는데.악역배우가 어찌나 밉던지.. 
10,판타적 요소있는 인어영화 
10,추억속의 감동의 영화. 다릴한나 강추! 
10,재밋엇어요 ㅋㅋㅋ 
10,아~ 너무 아름답고 멋지다! 동화같은 영화~ 
10,이 영화 DVD좀 빨리 나왔으면 좋겠다 
8,어릴 적 당시에 꽤 흥미있게 봤었죠. 톰 행크스 젊었을적 ㅋㅋ 
10,내 인생을 바꿔놓은 영화 
7,각각의 캐릭터들이 빗어내는 상황은 안 웃을수 없다 
10,다릴 한나의 섹시함... 
10,내 25년의 본영화중에서 처음으로 울었던영화! 
8,흥미로왔삼 어릴때 티비서(여러번)재밌게봤삼 
9,티비서 해줘서 기억남..이 당시 정말 감동적으로 봤는데... 
10,동심의세계로 들어갈수있는 어른을 위한 동화 
10,80년대 분위기와 미녀가 난 너무 좋아 
8,매우 재미있게 본 영화! 
9,한편의 동화같은 영화.. 
10,웃음과 감동. 너무 재밌다. 
10,아름다운 이야기입니다. 마지막에 함께 바다속을 헤엄쳐가는 장면은 감동. 
8,킬빌의 그 사람이 히로인이라니...ㅠㅠ 세월은 너무하다 
9,아름다운 영상과 스토리 만큼 배우들도 아름답다 
8,재미있게 봤다^^ 
10,"마지막부분, 정말 비현실적이지만 기꺼이 용서가 된다!!! "
10,내가 가장 좋아하는 영화. 
10,어릴때 보고 다시보고싶었지만 제목이 기역이 안나서 해메던 도중 드디어 
10,어릴떄보고 오늘또봤는데 영화끝나고도 계속울었습니다. 
10,"어릴때 멋모르고 봤던 영화였는데, 다시보게 되니 감동의 물결입니다ㅠOㅠ "
10,20세기 인어공주와 왕자님 톰 행크스의 사랑!! 
10,내가 본 톰 행크스 최고의 영화 
10,아  ~ 달달해 ~ ㅎㅎㅎㅎ 
8,어릴때 이영화 보고 대릴한나 예쁘다고 생각했는데..  로맨스 영화란 이런거야. 
10,어릴때 봤는데 다시 리메이크작으로 나왔으면해요 잔잔하고 애틋하게 봤어요 인어공주가 있다고 실제로 믿었던 영화 *-_-* 
10,잊지못할 그 바닷속 엔딩씬.. 
10,가슴 설레이게 한영화 
10,"옛날 영화답지 않게 지루하지 않고 스토리도 너무 매력적이다, 하아 나한테도 저런 인어가 찾아왔으면.... "
8,내용은 좋은데 별로 극적인 장면이 없어서 밍밍하네 
10,대릴한나 이때 참 이뻤는데ㅎㅎ 
9,한번쯤 꿈꿔볼만한 아릿다운 인어와으 로맨스 
9,톰 행크스의 연기가 무척 돋보인다 
10,조금 유치할 순 있어도 달달하니 좋았고 엔딩이 내가 생각했던거랑 정 반대라 너무 좋았음 ㅎㅎ 
9,어른들을 위한 풋풋한 동화 
10,너무  재미있어서 몇번을 보았던 영화에요.어려서 스플레쉬를 보며 인어공주를 꿈꾸기도 했었는데..  ^-^다시 보고싶네요.. 
10,너무 좋은데? 동화적이고 환성적이야.. 
10,아직도 기억에 생생한 스플래쉬... 
10,신혜성에 같은생각 뮤비보다가 생각낫다... 
10,오늘티비에해주던데 인어존나이쁘다 나도인어되고싶다ㅋㅋㄱㄲㅋ음악도너무아름답고 옛날영환게믿겨지지안는영화. 
10,너무좋다ㅋㅋ 긴말필요없고 짱 
8,앞서갔던 로맨틱코미디 귀여운톰행크스 
10,"희대의영화 천재감독 쿠엔틴 타란티노가,킬빌의여주인공 블랙맘바(우마 서먼 분)의 라이벌 엘르 드라이버를 어디서 캐스팅했는지,알수 있다.영화의절반은 캐스팅,캐스팅만 제대로 마치면,나머지 절반은 다 이루어진거나 마찬가지...."
7,예상대로 유치하지만 인어는 이쁘네~~ 
6,"옛날꺼라뭔가더아름다워보이는것도있는듯! 따뜻한,동심을자극하는영화.이게왜19금일까 "
6,동화와 현실의 만남. 아직도 꿈틀거리던 지느러미가 선하다. 
6,풋풋한 행크스와 아름다운 한나 감미로운 러브 스토리 
10,유치하지만 귀여운영화 ㅋㅋ 대릴한나의 미모는정말 ㄷㄷ 
6,글쎄.. 하도 많이 해줘서 보긴 했다만. 
6,초등학교때 티비에서 참 재미있게 보곤 하던 영화네요~ 
7,지금까지 본 인어 소재 영화 중 최상 
6,두번째로본톰행크스영화http://cafe.naver.com/grayd0tbe/1041 
7,인간의 환상을 영리하게 다룬다. 
7,왜 여주인공은 지상에 일주일만 있을 수 있었을까?  남주인공은 여주인공과의 키스로 영원히 물 속에서 살 수 있었던 걸까? 이런의문은  제껴두더라도 찰나의 사랑이 인생을 바꿀 수 있다는걸 다시금 상기시켜주는 영화다. ...
10,88년도였나 부평대한극장에 학교서 단체관람했는데 그때는 극장 스크린 크기에 놀라고 앞에 나가 장난도 쳤는데 그리운 기억이다 
8,여주 너무나도 예쁜듯.. 결말이 맘에안들어 
5,"내용은얼라들좋아할..,but어른이보기엔유치,얘가보기엔야하고 "
5,25번님 이영화가 당신인생을 어떻게 바꿔 놓았수?? 
4,톰행크스와 다릴 해나는 볼만하지만 지금은 식상한 스토리다. 
1,나한텐 별로;; 이게 15세라는것도 좀 그렇다... 
1,폐지해라.... 이봉원 안면함몰에 망막 손상까지...재미는 어느정도 있지만 출연자의 안전이 최우선이지 좋아요. 
1,대릴한나 별루;; 안예쁨ㅡㅡ;모가예쁘다는건지?ㅋ얼굴도 너무 네모로 각지고 별로임. 
1,톰 행크스의 풋풋한 젊은 시절을 볼 수 있다는 것 외에는 아무런 장점도 없는 삼류 로맨스 영화. 진짜 그 망할 과학자만 없었어도 영화가 몇 배는 더 나아졌을 텐데... 암튼 제 취향은 아닙니다. 
2,정신연령이 미취학아동이라면 
