score,review
3,에이...2편에서끝냈어야함...이건 영웅본색시리즈에서 빼야함.. 
8,"영웅본색 1,2 처럼 화끈하고 남자의 의리를 자극하는 내용은 없지만 내용자체도 훌륭하고 특히 마지막의 헬기장면은 잊지 못할꺼 같다. 제목때문에 전작과 색안경 끼지 말자 "
8,제목을 영웅본색3로 해서 저평가 받는듯. 차라리 '3' 대신에 '외전'이라고 표기했으면 평점이 1점이상 올라갔을 것 같다. 
7,심히 저평가 되는 영화인듯 가장 큰 이유는 제목 때문일까 
4,영웅본색이란 이름을 망친작품 
9,"오우삼의 총격전에 비해 서극은 작품성과 완성도에 치중하는 감독이란 걸 보여준 영화, 영웅본색 시리즈가 아닌 독립된 제목이었다면 높은 평점을 받았을 것이다 "
8,홍콩반환에대한 두려움과 그곳에남을것인지 아닌지를두고 배트남에 오버랩시켜서 만든 꽤좋은 영화라고생각이되며. 기존이미지와는다른 걷멋만들고 실제 싸움은할줄모르는주윤발을 홍콩에비유해 홍콩이아닌 다른곳으로떠난사람들의 두려움을...
10,전작을 생각하지않고보면 상당히 괜찮은 영화이다. 
7,"나름 괜찮긴 했지만, '영웅본색3'가 아니라 '영웅본색 외전-마크의 과거' 이런식으로 제목을 지었다면 좋았을텐데... "
6,이제는 볼수없는 분이 두분이나 계시다니... 
10,윤발에 형님 영화는 눈으로 보는게 아니라 마음으로 보는것이다!! 
10,왜 이렇게 평점이 낮지? 영화 제대로들 보고 얘기하는건가? 
10,"매염방 때문에, 석양지가 때문에 10점 "
7,영웅본색3가 아닌 다름 제목으로 나왔더라면  평점이 이따구가 되지는 않았을텐데...하지만 나도 제목에 낚였으므로  7점준다 
6,짝퉁 영웅본색이란 이름만 가져다 쓴 졸작 
4,오래전에 봤을 때 대 실망. 하지만 여기 평점 높은 거 공감 댓글 보고 액션은 버리고 봤다. 드라마가 탄탄? 어디가? 영웅본색 이름 빼도 대 실망. 
10,"전작의 프리퀄.1,2의 명성에 가려서 그렇지 이정도 평점은 아니듯.로맨스가 많이 부각되어 있고 주윤발의 모습이 순수해보이기도 하다.여전히 매력적인 주윤발. "
7,작품에선 몰라도 영화 배경음악과 주제가는 기억에 남는 작품이었다!! 
7,시리즈의 연장선상에 놓고 보지말것! 
8,독립적으로 만들었어도 좋은 영화 
2,영웅본색시리즈에서 빼야할 영화. 서극의 쓸데없는 고집 그냥 베트콩 눈치보고 만든영화이기도 함. 
1,오우삼 없는 총격신은 무의미하다 
5,포스터만 보면 1편인데.. 내용이 가히 기막혀서 ㅋㅋ 
1,그냥 2편에서 끝냈어야 됐어 
10,"이거 평점이 왜이리 낮지...  영웅본색1,2가 워낙 뛰어난거지 이것도 제목 빼고 보면 훌륭한 작품 "
1,"그냥 외전이라고 말하고 나오지, 왜 영웅본색이란 이름을 달고나와서... "
5,왜 그곳에 있어야 하는가에 대한 몰이해. 
4,쫌 보다보니  마지막쯤   코미디인가싶을정도ㅡ 
5,영웅본색이 아니라 다른 제목으로 나왔어야 함 
2,이건 본래의 색을 잃어버림 졸작중에졸작. 절때 보지 마세요.그냥 다 죽고 죽이고 주인공 조연 뻘짓 뜬금포에 속터지고 건물도 터지고 탱크도 터지고 마지막엔 헬기까지 터지나 했음... 
2,아쉽지만 2편에서 끝냈어야. . 윤발 형님도 나오질 마셨어야죠... 
5,고마운 추억은 때론 건드리지 않아야 될때도 있다. 극장에서 나오면서 모두 허탈해했었지.. 
5,서극의 공도 큰 것은 알지만 결국 오우삼의 시리즈. 
3,솔직히 이건 영웅본색 시리즈라고 할 수 없다 
10,"나는 이영화 좋던데...영웅본색 1, 2 와 분위기가 많이 다른 건 사실이다. 별개의 영화로 나왔으면 또 하나의 걸작으로 평가 받을 수 있었던 작품인데 많이 아쉽다. 주윤발이야 원래 실력자이고 매염방을 처음 보고 그..."
10,주윤발 영화 넘무넘무 재나게 보고 있습니다 
4,감독이 서극이면 괜찮은거  아닌가? 오우삼보다 2수는 아래인듯~~ 글구 스토리의 연결고리를 맺지 못할꺼면 제목을 따로 지어라... 전작 망치지말고... 
6,서극 감독의 망작인가요? 영웅본색  3는 조금 어설픈 영화 처럼 보입니다. 
6,참.. 안타깝다. 적당히 하다 끝냈어야지 
1,무엇보다 영웅 본색은 조폭들의 의리가 가장 큰 핵심이다 헌데 군인하고 조폭하고 무슨 상관이 있지? 거기다 중반쯤엔 로맨스 분위기로 흘러가네명작에 먹칠을 단단히 했다고 해도 과언이 아니다 이건 영웅 본색이 아니고 멀미...
4,와 진짜 제목이라도 어찌하지 ㅡㅡ 
10,영웅본색이라는 제목을 빼고 보면 정말 잘 만든 영화. 전작하고의 괴리감 때문에 저평가 받는게 안타깝네요. 
5,첩혈가두가 진정한 영웅본색3편이지....  오우삼의 3부작 마지막을 서극이 감독한거냐? 말이 되나? 
8,영화 자체로서는 좋다..하지만 타이틀을 왜 영웅본색으로 달고 나왔는지는 의문 
7,"오우삼의 1,2보다 부족하다. "
9,전편과는 별개로 봐야될 영화... 그래도 괜찮은편.. 
8,매염방의 노래 '석양지가'가 '영웅'의 마음을 촉촉하게 적셔준다 
3,걸작을 만드는 오우삼과 흥미작을 잘만드는 서극의 차이.. 
10,영웅본색 3 가진 영웅본색 주윤발 
8,전작과 많이 다르지만 충분히 이 영화만에 매력이 있다. 
10,생각이없으니 이영화가 자루하겟지 
6,"총싸움 장면은 억지성이 많다. 여자가 돌격소총을 한손으로 반동없이 쏘면서 다 죽이지 않나, 아무리 비현실적인걸 나타내는 영화라고 해도... 배트남, 탱크 광고를 나타내려고 하는건 아닌지 또한 의구심이 든다. 마크 테..."
10,마크의 과거이야기입니다 
6,"12.02.20.솔직히 그렇게 나쁜 영화는 아닌데, 괜히 영웅본색 속편 딱지 달아서 더 욕먹는 영화. 다른 분들 말씀처럼, 그냥 다른 영화로 냈다면. "
7,오우삼과 서극의 스타일 차이. 드라마 위주로 가겠다는 것이 보이지만 깔끔하게 이어지지 않는다는 것이 아쉽다. 주제가는 좋다. 
4,달리기결승점 앞에서 넘어진 영화 
7,영웅본색이란 타이틀만 뺐어도 7~8점은 될 영화인데... 
9,이제는 다시볼수없는 매염방의 주제가만 훌륭햇다 
8,영웅본색이 시대적 메시지를 담고있는지는 몰랐네. 
10,매염방 누님 때문에 십점.... 
8,매연방이 보고 싶을 때 보는 영화. 
8,매염방 너무 매력적이다 
1,영웅본색2와 같은 완성도~ 서극의 베트남 사랑~ 
6,완벽한 누아르에서 3류 러브 스토리가 됐다 
4,그래도 서극인데 이건 너무 심했다. 아님 제목을 다르게 하던가. 
10,이연걸영화보고싶어요 
8,매염방 때문에 8점 
7,"글쎄... 서극감독의 의도를 아직까지 이해하지 못하겠다... 1,2편의 흐름을 어떻게 이렇게 싹둑...ㅠㅜ "
8,"영웅본색1,2의 힘을 빌고싶었던 전혀다른영화.제목을 바꿨다면 평점이 훨씬올라갔을듯 "
10,나와서는 않됬을 영화... 
9,석양지가액션이아닌드라마로봐야재밋다작품성인정기존의느와르완틀린장르의영화 
7,이사람들아 영웅본색은 2편이 제대로 간지다.. 허접하기는.. 
6,아쉽다... ^^ 
7,영웅본색의 속편이 중요한것이 아니고 못 만들었다는게 중요. 
10,매누님 덕에 10점준다. 
3,2편에서 끝냈어야 했어... 2편에서... 
1,참내;; 뭐하자는거? 
3,더이상 나오지 말았어야됐다.. 
4,"나도 좋은 평가 못 하겠음. 서극이 제작한 영화는 성공, 감독한 영화는 망한다는 소리가 한번 다시 입증됐던 영화. "
1,이건 영웅본색의 명성에 흙을 뿌리는.... 
4,적룡없는 영웅본색은 영웅본색이 아니다. 
10,영화자체는 꽤나수작이었다 왜5점대.. 
10,1989년에 이런 영화가? 석양지가는 지금 들어도 명곡이다. 
10,영웅본색 재밌네요 세명이서 다 죽이네요 
10,"영웅본색1,2가 페이트 제로 에미야 키리츠구를 보는 느낌이였다면 영웅본색3는 에미야 회상씬을 보는 느낌이였다. 아아ㅡ. 갓ㅡ작. "
9,영웅본색 시리즈로 생각해 본다면 낯섬에 실망할거다. 영문원제 A better tomorrow로 생각해볼란다. 한치앞도 내다볼 수 없는 월남패망 직전의 위태로운 목숨줄에서 나은 내일을 기약해 보는건 사치였을까?1974...
6,1975년 베트남패망과 1997년으로 예고된 홍콩반환. 위기감으로 통한다. 제목은 억지로 갖다붙인거고. 
10,어린시절 봤을땐 아마1점을 준 영화지만 지금보니 재미있게 봤음 
7,"1,2 편만 알던 우리에겐 3은 정말 쓰레기같은영화, 우연히 나이들어 정독했던 3편 역시 쌍욕을 날렸지만 단한가지 의미로, 명작이라 깨달았다 이유는 < 프리퀄 >!!! "
7,작품성은 좋은데....2랑 서로 바꿨어야함... 
10,3편은 종종 씨리즈의 무덤이 되곤 하지만...영웅본색3라는 이 영화는 전혀 그렇지 않음.감독 서극의 고향이자 조국인 미국과의전쟁에서 승리한 승전국 베트남에서 찍은 영화라 더 각별함 
10,영웅본색이란 이름만 아니면 훌륭한 영화... 
9,아련하고 슬프지만 나름 작품성이나 완성도는 높다. 
8,"영웅본색1,2편보다는 이야기 전개가 지루하게 느껴졌음. "
8,그저그렇다. 단지 스토리가좀....연걔성은 없는듯 
10,재미는 있다. 매염방이 주인공인듯한 느낌?? 
6,수고하셨습니다. 
8,명성에 비해 조금 쳐지는 
7,영웅본색 속편으로만 평가하지 마시길~ 개별적으로 만족 
10,삼각관계만 빼면 괜찮았을 영화 
8,아재들은3점이나 주겟짘  평생추억속에서만 살아라 
7,"무척 엉성하고 촌스럽지만 인간적인 매력이 있는 영화, 영웅본색1과 2에 비해 많이 뒤쳐짐~ 주윤발은 역시 매력적이고 멋있음~ 붕어 매염방도 이 영화에서는 매력있음~ 故 매염방의 명복을 빔~ 그리고 박푱시가 밥은 먹고..."
10,영화관에서 봤는데 감동이었어요. 처음엔 이게 무슨 영웅본색이지?? 역시 속편은 별볼일없는건가.. 했는데 갈수록 보면볼수록 빠져드는 느낌. 베트남의 분위기와 우울한 영화음악이 너무좋았어요. 또 롯데타워시네마라는곳에서 ...
1,0점도 아깝다 서극은 영웅본색이란 이름을 쓰지말았어야했다 
6,등대여명 첩혈가두 아비정전과 같은 분위기의 영화  나름 볼만한 영화임.  보는 사람에 따라 호불호가 갈릴수 있는 그런 영화 서극의 영화는  구분이 확실해서 좋다  장르는 드라마이며 드라마에 약간의 액션을 가미 해서 ...
5,이건 아니지.. 3는 ㅠㅠ 
10,ㅠㅠ 
8,프리퀄로 이정도면 괜찮은거지 ..-_-;; 
9,전편들과 다른 스타일이어서 그렇지 이렇게 욕먹을 영화가 아니다. 상당한 수작 
10,재밌는데 웬지 싫다. 허나 5 점대는 넘했다. 
10,영웅본색을 보고 감동을받은사람이라면 작품에 욕을 못한다 
8,"쾌 재밌었는데? 액션은 1,2편 보다 더 스타일리쉬하다 "
6,최근 다시 봄. 아무래도 홍콩이 아닌 비엣남이고 칙칙해서 저평가되는 듯. 
9,솔직히 1점짜리 영화는아니다 단지 주윤발보다 매염방의 포스가 강렬했을뿐 
1,즈질이야~^^ 
3,"1,2편과의 차이는 포스터에서부터 확연. '3'이란 명칭은 연속성이 있어야 가능한 것~ "
6,"1,2편에 비해 너무나 팥없는 호빵 같지만 나름의 감동은 있다 "
5,완결이라 하기엔 너무 부족하나 서극과 주윤발의 만남도 나쁘지는 않다 
7,그래도 볼만했다. 
1,와.. 전나 쓰래기 내 돈이 아까워요 ㅡㅜ 
2,짝퉁본색! 
6,'홍콩 느와르'가 아니었다.. ㅜㅜ 
7,그래도 볼만 했다. 
5,쌍 기관총 하고 탱크는 빼라...차라리 머신건을 써라.거치식 이라던지. 
1,2편까지는 봐줄만했었다 
5,아예 람보처럼 하던가.. 오우삼이 떠난 영웅본색은 혹독하다. 
5,새로운영화다. 시리즈가 아니다. 실망.. 
3,시리즈의 본색이 빠져버린 3탄 떨어진 윤발이의 간지 
9, 마지막 베트남 탈출씬은 홍콩인들의 불안감을 잘 드러내고있다. 
2,이건 영웅본색이 아니야!!  비장미가 없어.. 
9,정말 대작 대작 스토리도 제일 탄탄하고..시리즈 명성을 잇는다 
2,영웅본색 시리즈 명성에 먹칠을 해버린 졸작!! 왜 만들었니? 
8,감독이 뭘 얘기하려는지 모르는이들은 보지말아라 
10,홍콩 영화의 최고봉 시리즈 
1,서극과 영웅본색의 명성을 깍는 영화 
8,아주어린 나이에 극장에서 보았습니다  내용은 사실 뚜렷하게 기억은 나지 않습니다. 하지만 마지막 후반부 헬기에 겨우탄 주윤발과 일행 그리고 죽어가는 매염방을 쳐다보며 슬퍼하는 주윤발이 기억에 아직도 남네요. 그리고 ...
3,왜 영웅본색인지 왜 주윤발인지 
10,생각이 없으니 영화가 지루하겠지 진짜 공감 역사적배경을 조금이라고 알고 보세요. 
5,적룡과 장국영과 오우삼이 해야했었다. 서극은 영화망치려고 제작한듯 
5,진짜 5점 그이상 그이하도 아님..   매염방이 상당히 매력적임 ㅋㅋ 
6,"1,2의 강한인상은 느끼지못한, 개인적으로 나오지 말았어야 했다 "
8,서극 감독으로 바뀌면서 전반적으로 전편만 못 하지만 그래도 영웅본색의 이름값은 충분히 한다 
8,"1,2는 다 봤지만 3는 한동안 보지 않았다. 앞선 작품들과 별반다를게 없는 복제수준일 것이라는 선입견 때문에.. 그런데 왠걸?! 시리즈중 가장 나았다. 판에박힌 복수극이지만 사랑과 로망을 잘 섞어놓은 전작과는 또다..."
10,이영화의 깊이를 모르면서 함부로 이영화를 모독하지마라.. 
10,너네가  영웅본색을 제대로 봤다면 후속작이 나온것만으로 7점 주윤발이 나온걸로 최소 8점은 가야된다 이유불문하고 
10,에어리언 2020처럼 제목 잘못지어서 망한 숨은 명작중 하나~~ 
1,"요즘 홍콩영화로 재탕 ㅎㅎㅎ, 관람 관객수가 많나요? 무슨 생각으로 재탕? 경재력 없다요 ㅎㅎㅎ 가격을 50%할인요 ㅋㅋㅋ "
3,허접한 발로 만든영화. 그러나 매염방의 포쓰는 최고다. 
6,"전편들과는 전혀 다른 스토리로 가는 것 자체는 괜찮았으나, 마무리가 너무나 아쉽다. "
5,3편은 극장에서 어찌나 실망했던지.. 
6,매염방의 노래만은 마음에 든다 
3,열심히 만들었다만 우리가 원한 것은 이런 게 아니다.. 
4,"집에서- 1,2보고 당연히 3부봤는데 안나왔으면 좋았을 영화 "
5,"망한 요인: 1.장국영,적룡의 죽음 2.감독이 바뀜 등등 "
5,주윤발과 영웅본색의 명성을 함부로 팔지 말지니.. 
6,탱크가 나올 땐 정말이지 그만보고 싶었다 ㅡㅡ; 
1,진짜 이건 아니다..ㅡㅡ; 
1,누가 믿겠는가 이게 3편이라는 것ㅇㄹ... 
6,전작에는 많이 못미친다.. 
4,영웅본색3가 아닌 전혀 다른 제목으로 나왔으면 좋았을것을... 
7,끝임없는 총격신이 압권인 영화! 
1,어느 업계나 하나 잘되면 비슷한것이 줄줄 나오기 마련이다. 이것도 그러한것중 하나다 오리지날 간판을 내걸면서 원조를 욕먹인 영화다. 그냥 이름 하나로 돈좀 벌어 먹고 튀자는 먹튀영화. 
5,"울버린 단독 주인공 영화가 별로 였듯이 마크 단독 주인공 영화는 별로,, 영웅본색은 적룡 장국영이 함께 있어야~~ "
1,이건 영웅본색 아니지 돈아꺼워.. 
1,나왔는줄도 몰랐네... 
3,영웅본색3 이란 이름을 왜 달았는지 모르겠다.. 주윤발의 오토바이 타고 땅크 부수는 씬은 멋졌고 매염방은 안이뻣다 
1,서선생. 뭐하시는가? 
4,나와서도 안됐고 봐서도 안됐다 
1,"영웅본색은1,2편만이다.... 3편은 제목만차용한완전별개!!!! "
5,영웅본색은 주윤발 혼자 나온영화가 아니다!!! 
5,씁쓸한데 
4,1편은 명작.. 2편은 머 그저그런.. 3편은 뭥미.. 막장인가..ㅡ.ㅡ;; 
1,영웅본색 망작. 볼 마음조차생기지않을정도로..영웅본색은 딱 2까지만 만들었어야하는건데 
1,얼추 20년도 더 전에 본거 같은데...한창 홍콩느와르 인기일때...25년정도 됐겠네... 그때봐도 졸라 재미없었다... 
1,노잼이다 보지마라ㅋㅋ 
4,"영웅본색의 조연인 마크를 주인공으로한 프리퀼. 영화자체는 봐도그만, 안봐도 그만. "
6,오우삼은 첩혈가두로 서극은 영웅본색3로..같은소재로 서로 다투었던 영화 
1,"밑에 분 말데로 1,2편만 꼭보시길...정말 최악 "
4,"영웅본색은 1,2편만 봐라. 형 말 믿어라. "
10,영웅본색의 프리퀄작품!! 영웅본색1편 나오기전에 먼저나왔어야했을 작품 
7,영웅본색이라는 타이틀을 떼어놓고 보면 최소한 영웅본색 2보다는 낫다. 
1,영화를 왜이따구로 허접으로 만들었나요? 
6,전편들의 명성을 이어가긴 좀... 
1,오우삼과 싸우고 서극이 분풀이용으로 영화 망치고자 만든 쓰레기. 차라리 첩혈가두를 
