score,review
10,최고...리메이크안하나?  진짜웃겼는데..능글맞은 튜니티 ㅋㅋ.. 
10,"지금은 이 점수를 줄 수 없지만, 당시엔 그 이상이었다. "
8,추억에 남을만한 코믹 서부영화.. 음악도 최고다 
10,"내 이름은 튜니티, 돌아온 튜니티, 튜니티라 불러다오, 내이름은 아직도 튜니티, 그리고 튜니티는 아니지만, 이후 테렌스 힐이 주연으로 나온 무숙자(My name is nobody).. 참 그 당시 최고의 코미디였죠...."
10,DVD구할수있나요?다시보고싶네요 
10,넘 좋아하는영화 ^^^^ 유쾌하다 
10,서부극중 최고의 오락성을 보여준다 
10,추억의 영화 어렸을때 아버지와 같이 tv에서 이  영화를  보며 얼마나  재미있게 봤었던지 정말 그 시절로 돌아가고 싶습니다. 
10,그냥 먹방만으로도 이미 최겅 
9,멋진 사나이 테렌스 힐… 그만 봐도 스트레스 날아감^^ 
8,이제 보니 튜니티가 아니라 트리니티였군. 그걸 어언 30여년이 넘어서야 알게되다니... 
10,기존의 서부영화와는 다르게.. 코미디가 베어있다.. 재밌음 
10,내 기억에 튜니티 시리즈는 KBS에서만 10번은 본듯한데....한 3년전까지만해도  본거 또 봐도 웃겼는데....지금은 좀 질리더라.... 
9,"당시엔 파격적인 코믹서부극,,,정말 재밌게 보았다 ~~~~~~~ "
8,진지함을 과감히 버린 마카로니 웨스턴의 또다른 맛! 
10,이태리서부극인데 배우들이 모두 영어를 쓰는게 좀 신기함(더빙도아니고 원어발음) 
10,파란색 눈....빠져든다. 
10, 액션도 간단히 나오고 코미디도 나오니 재미있다 
10,울엄마가 소녀시절에 봤던영화 청년인 내게도 재밌는영화 
10,오늘날 티브이에 나오는 어떤 이쁘장한 남자연예인들보다 훨씬 멋있고 강렬하다. 
9,웃기지만 마냥 웃을 수는 없는 영화 
10,서부 코믹 최고영화...송어잡는 장면이 생각나는군 ㅎㅎ 
5,칠리 콘 카르네를 엄청 맛있게 먹던 장면은 수OO이 흘러도 미리속에서 떠나지가 않는다.. 
6,꿀잼은 아닌데 웃겨서 볼만하다. 
10,Ten 
9,엣다9점 어릴적 서부영화가 그립다~ 
10,어릴 적 추억이 깃들어 10점준다. 
9,지금 봐도 괜찮네여 ㅋㅋ 
10,잼있어요... 
9,방금 KBS토론 보다가 그냥 봤는데 기대 이상이었음 
10,요즘 새벽에 왜그렇게 웃긴거 만하지...사람 피곤하게.. 
10,닥치고 웃기면 장땡인겨 ㅋㅋㅋ 뭐가 더 필요해 ㅋㅋㅋ 
9,기억난다 어릴적에 보고 정신없이 웃던 기억... 
10,웃긴거임 
10,재미라는 측면에서 사상 최강의 코미디라고 할 만하다 
10,초웃긴데  ㅋㅋㅋ 
7,뚝뚝끊기는 어설픈액션의 매력 ㅋㅋㅋ 
8,매력있는 주인공~ 
10,코믹하고 재밌네요...진작볼걸..2편도 재밌어요.. 
10,원조 마카로니 웨스턴 폭소 
9,어려서 봤을때는 충격적인 코미디~ 재밌었다 
8,오랫만에 들어보는 휘파람 소리 ! 
10,먹방계의 원조. 물까지 시원하게 잡수신다. 
10,최고 코믹서부영화!!보고 또 봐도 재밌어ㅋㅋㅋ 
10,재밌어요 ㅋ . . ..ㅎㅎ 
10,지금 봐도 재밌다.이탈리아 웨스턴무비의 최고봉! 
8,콩볶음 푸파할때의 거지 모습이 매력적인 총잡이 
10,지금 tv로 보다가 검색해봅니다 주연배우 돌 다 이탈리안이네요 옛날 생각납니다 코믹 마카로니 웨스턴의 대표작! 또 봐도 재미나네요 
8,"밤비노와 튜니티의 포복절도 웨스턴,프랑코 미칼리치의 멋진 음악은 풍미를 덧붙인다! "
8,화끈한 액션은 아니지만 유쾌하구만 ㅋㅋ 
8,굿http://cafe.naver.com/grayd0tbe/2009 
10,더빙으로보나 뭐로보나 최고 
9,어렸을때 해묵은 비디오로 삼촌이 보여주셨던기억이 나는데 누더기입은 실려자 기믹이 독특ㅎㅎ 지금봐도 재미있네 
10,식당신이 대박 진정한 먹방스타  *^^* 
9,개인적으로 일본만화 시티헌터의 원조격으로 본다...이런 캐릭터는 거의 최초임.. 
6,"30여년전에 최고의 화두였던... 그러나 지금은 그저그런, 감흥없는, 실망스런... "
7,어렸을적 티비에서 참 잼있게봤던 마카로니 웨스턴...나름 재미가있음 
10,재밌다 
8,작품성 No! 재미 Yeah~~~~~ 
8,유쾌한 이태리식 서부영화. 색다른 해석이 보인다. 
9,일단 재미는 있다 
7,서부영화에코미디를첨가한신선한(?)영화.나중가면더 가관인튜니티가족도나오니 기대들 
10,very good ! 
10,1979년에 극장에서 관람 후 최고였다라고 평했던 영화!! 다시 볼수있어 감개무량~~ 
10,토요로드쇼~~~!!!!!!!!... 지금도 웃길까?...ㅋㅋ 
10,최고의 코믹서부극 튜니티. 양지운씨 음성으로 다시 보고싶다. 
9,어린 내게 서부영화를 재미있게 기억하게 만든 영화 
10,다시봐도 최고~~~네요. 
10,국회방송에서 봤는데 내가 이런 영화를 웃으며 즐길거라고 생각도 못해봤다. 
6,이런 개그코드가 통하던 시절이 있구나.. 그래도 튜니티 먹방만큼은 지금봐도 명장면인듯 
3,황당 개그 코메디가 환영받던 그런 시절도 인간세상에 있었다. 
5,그 당시에만 재미있었던 영화. 지금은 평범한 내용..... 
1,꼭보세요!!ㅋㅋㅋ 웃긴영화 ㅋㅋㅋㅋ감독이름 보세요 바보잖아요 웃기죠? 
6,상당히 코믹한 서부극으로 기억돼던 영화....커서 다시보니 상당히 부족한 서부극이다....전체적으로 엉성함...시작은 좋음~ 
6,인상적인 캐릭터와 음악 반면 뭔가 미지근한 내용물... 완성도와는 상관없는 얘기지만 영화속 악당들이 어딘지 순진무구하다 
2,웃기지도 재밌지도 않은 마카로니 웨스턴 
6,영화의 3류스러움에 막장스러움에 결국 웃는다. 
5,현대의 시각으로 보면 평범한 B급 웨스턴 무비일 뿐. 
1,"진짜 촌스러움.  당시 아시아 영화, 우리 한국 영화와 비교해도 수준이 떨어짐. "
4,"마카로니웨스턴을 말할 때 빠지지 않는 영화. 장총과 과장, 코믹이 있긴 하지만 모두 어중간-소프트 하다. 쟝고처럼 폼생폼사에 스타일리시 하지도 않고 코믹적 요소도 미지근하여  매니아 층이 생기기 어렵겠다. 악당 등장..."
1,평점 너무 높다. 좀 깎자. B급 싸구려 오락물이지만 흥겨운 킬링타임용. 
