score,review
10,이게 바로 명작이지 
10,인류의 문화유산 
10,이 영화는 영화계의 레전드~ 수십번 보고 원어로 영화 대사까지도 외웠던... 
10,여자들은 타이타닉을 보고 운다. 남자들은 터미네이터2를 보고 운다. 
10,말이 필요 없음 
10,엔딩장면 ..이영화만큼 감동적인 영화 있나 ?? 난 없다고 본다 . 
10,의리 드립치지마라 ㅅㅂ 서로 지켜주며 싸웠는데일배들이 뭘아나??      이영화           다시개봉하면   ......개쩐다 
10,카메론 최고의 역작 몇장면 옥의티가 있지만 보기만 화려한 아바타보다 100배 낫다. 
10,11점은 못주나..ㅎㅎ 
10,역대 영화사 최고의 악역..T-1000 
10,20년이 지난 영화지만 아직도 이 영화를 능가할만한 SF 영화는 거의 없다아바타도 제임스 카메룬 작이지만 그래픽과 3D 라는 부분을 빼면 터미네이터2 에 밀린다..그나마 비견될만한게 90년대 초기  터미네이터2 90...
10,i will be back 
10,나 50번이상 봤다.. 더 봤을 수도.. 아놀드 형님 저 때도 44살이였다는.. 헐... 
10,"[아카데미]1992년64회 음향,음향효과,시각효과,분장 4개부문수상작.말이필요없는 SF영화의 교과서.나온지20년이 지났지만 아직도이만한SF영화 못봤다.스토리도탄탄하고 cg도 그시절에 완전죽였고 전편을능가하는 영화는 ..."
10,그때당시에 이런영화를 만들었다는것이 놀랍다... 
10,내 평생 베스트5 안에 들만한 영화!!! 그 당시 쥬라기공원과 필적한 충격을 주었던 명작 중이 명작!!! 
10,쇼생크에 밀리면 되니 넌 일등이어야 해 
10,처음으로 평점 매기네..내 생애 최고의 영화임.. 
10,"유네스코에 등재할 수 있다면, 그렇게 하고 싶은 영화 "
10,전설에는 점수를 매기는것이 아니다. 그냥 전설은 존재자체가 별인것이다 
10,1990년대 초에 만들어진 작임에도 불구하고 스토리와 몰입갑은 역대급이다 
10,20년 전 그 충격이 잊혀지지 않는다. 
10,어릴적 토요명화에서 이영화를 보고 난 후 부터 TV에서 해주는 다른 영화들이 다 B급 영화로 느껴졌었다. 그 정도의 클래스 차이를 느끼게 해준 터미네이터 
10,일베새끼들아 터미네이터는 기계임에도불구하고 끝까지 존코너를 지키고 자기도 죽어버렸다 이것도의리라고봐야된다 
10,불후의 명작. 이란 이런것 
10,깎아내리면 절대 안되는 영화 
10,이게 22년전에 나온 영화라고????????? 
10,"안본 어린것들,,,닥치고 처봐 "
10,이 영화에 10점을 주지 않으면 무엇에 10점을... 
10,아무리 그래도 터미네이터2를 의리타령하면서 1점주는건 좀 아니지 않냐 
10,어렸을때 이걸 보고 집에 터미네이터 쳐들어올까봐 잠을 못잤음.ㅋㅋㅋ 
10,이 영화가 왜 9.34야? 10점 나와야 되는거 아냐? 
10,20년이 넘는 세월이 흘렀지만 아직도 이 영화를 넘어서는 액션영화는 나오지 않았다. 앞으로도 그럴 것 같고. 
10,그렇게 여러번 봐도 또 재밌는건 모지??? 
10,"제임스 카메론의 최고 작품은 아바타도 아니고 타이타닉도 아니다. 아바타,  타이타닉과 비교할 수 있는 영화는 많다.  그러나 <터미네이터 2  : 심판의 날>은 그 어떤 영화를 가지고 와도 비교할 수 없다..."
10,완벽한 구성과 효과 그리고 누구도 대신할 수 없는 킹 아놀드! 다크나이트도 이만 못했다.. 
10,내가 영화보고 처음 울었던 영화 마지막에 엄지손가락은 내눈에서 충분히 눈물을 뽑고도 충분했다 거기다 특유의 음악 빠밥 빰빠밤~ 빠밥 빰빠밤~ 이게 바로 진짜 sf의 바이블이지 ㅜㅜ 
10,"에이리언 2 ,터미네이터 2, ,타이타닉, 아바타  이들 영화를  제임스 카메론 이라는 한 분이 만드셨다니.. 밑에 어떤분이 인류의 문화유산이라하셨는데 저런분은 지구문화재로 지정해야될듯.. 인류가 부여할수있는 최고의..."
10,터미네이터2는 영원히 기억될 역작 
10,펄롱의 성공적인 데뷔  개인적으로 제임스 캐머런 영화중에 제일좋고 90년대에 이런 명작이나오다니 
10,SF 액션의 가장 잘 만들어진 교과서 
10,몇번봤냐고? 100번 이후로는 세어보지도 않았다.수많은 A급영화들이 있고 그 구름위에 있는 영화가 T2 
10,헐리우드 속설을 깼던 영화라고 해도 과언이 아닌 영화죠 전편보다 좋은 속편이 없다고 말하는 헐리우드속설을 보기좋게 꺾었던 영화 전편인 1편보다 훨씬 많은 수익을 내고 또한 지금까지도 터미네이터시리즈중에 최고라고 말하...
10,하스타라비스타 베이비 
10,20년전 작품인데  지금다시봐도 촌스럽지않다..최고의 영화중 하나.. 
10,걍 십점... 단 일점도 낮출수없다 
10,터미네이터1에서 저예산으로 극강의 연출력을 보여주었던 제임스 카메론 감독에게 거액의 제작비가 생긴다면 이런 영화가 탄생한다. 
10,"11점은 무슨, ∞점이지 "
10,역시 명작입니다.아주 재미있어요 
10,터미네이터 2 안본 뇌 삽니다. 
10,완벽 그자체 
10,이건 카메룬의 전설적인 영화... 3편부터 망하긴 했지만 난아직도 용광로 속으로 들어가는 엄지를 생생하게 기억한다 
10,이게 잼없다하는놈은 초딩. 
10,영화란 미래를 만드는 것이다 
10,어떻게 또봐도 또봐도 재밌지? 다른건 명작이라해도 3번이상보면 질리는데말야 
10,내 영화순위서도 1위인 영화~~~ 
10,굿 
10,명작 
10,10점만점에 10점을 다줘도 아쉬운 영화. 당시에 이 영화가 보여줬던 충격과 감동을 넘어설 영화가 더이상 없을꺼라 생각됨. 내 인생 단 하나 최고의 영화를 뽑으라면 망설임없이 이 영화라 말함. 하이라이트가 따로 없음...
10,고3때 나왔는데 학력고사 준비하느라 못보고 비디오 나왔을때 비디오가게 아저씨한테 미리 예약해두고 봤던 영화. 극장에 다른 영화보러 갔다가 터미네이터2가 상영되는걸 알고는 원래 보려던 영화 대신 바로 표 끊고 봤음. ...
10,"SF 영화의 패러다임을 바꾸었던 3대 역작(스타워즈, 터미네이터, 아바타)중 하나. 하지만 감동은 단연 최고!!! "
10,"T1 걸작, T2 불후의 명작, T3 망작 "
10,에드워드펄롱 첫작품치고 심지어어렸는데 연기력너무좋았음 
10,이런게영화지 
10,"아스타 라 비스타, 베이베... ^^ "
10,짱임.. 
10,아~  역시 재밌네요. 추전합니다^^ 
10,이건 진짜 죽기전에 봐야할 영화 TOP5에 든다 
10,전 아직도 소장하고 있답니다..최고에 영화라고 봅니다. 
10,최고다... 말이 필요 없다.... 사실 속편이 전편보다 뛰어나기가 힘든데.. 터미네이터2는 전편을 뛰어넘는 속편이다 
10,유네스코 지정 세계 유산... 말이 필요 없다... 
10,혁명적인 영화 
10,이런 영화는 다시는 안나올꺼 같음 
10,시간이 흘러도 명작은 촌스럽지 않음 
10,명작임 
10,아~  역시 재밌네요. 추전합니다^^ 
10,최고의영화 
10,오늘도 일베충 패거리들은 쓰잘데없이 영화 게시판에 들어와 명작을 오염시킵니다 
10,괜히 와서 평점 테러 하는 잉여인간들은 뭘까.. 이런 명작 중 명작을 그런 잉여들이 범접한다는 것 자체가 모독같이 느껴진다. 
10,내생에 절대 잊지못할 엄지손가락 
7,에드워드 펄롱 이때 인기 장난 아니었는데~~ 
10,아윌비백이 최고지 
10,마지막 명장면 과연 모르는사람 몇이나 될까 ? 
10,이만한 영향과 포스를 풍기는 영화가 또 나올까? 
10,맨처음 봤을때 최근에 개봉한줄 알았는데 ㅋㅋㅋ 진짜 엄청난 영화임 ㅋㅋㅋ 
10,명작 
10,터미네이터2 > 어벤져스 시리즈 
10,마지막에 T-800이 존코너보고 니가왜 우는지 알거같다. 라고 말하고 기계가 인간의 감정을이해한다는게 오묘하고 대게 멋진대처럼느껴짐 마지막에 웅장한브금깔리면서 용암에 들어갈때는 진짜 감동그자체 
10,말이필요없는 20년전 추억 ...아놀드 용광로내려갈때 존코너 우는것보면서안운사람 있을까싶다. 
10,말이 필요없는 최고의 영화. 의리같은 소리로 이런 명작을 깎아내리진 말자 좀.. 
10,최고중에 최고..! 
10,영화도 영화지만 오프닝 음악은 세계문화유산감이다. 
10,82년생입니다 . 처음 이영화보면서 쏟아지는 감정을  아직 다른영화에서 느껴본적이없네요. 
10,90년대의 영화라곤 믿겨지지 않는 
10,난 솔직히 이 영화가 싫다.... 이걸 본 이후로 다른 SF가 재미가 없어져서... 
10,"살면서 날 충격받게 한 영화가 몇가지 있는데 터미네이터, 쥬라기 공원, 에일리언, 백투더퓨쳐임. 갠적으로 이 작품들은 인간이 망할때까지 보존해야할 인류의 유산으로 지정해도 손색이 없음 "
10,과거로 돌아가 터미네이터2를 처음 볼때로 돌아 갔으면 좋겠다 ㅜㅜ 
10,두말할 필요없이 진짜 최고의 영화. 
10,그레이트 
10,이거는 영화가 아니다 예술이다 
9,헐 91년도 영화였다니... 액션 별로 안좋아하는데도 재밌게 봤네. 27년이 지난 현재 돈만 때려박은 영화들 반성해라 
10,제임스카메론이 스티븐스필버그에게 맞짱뜰수 있는 이유 
10,20대초반에본 영화인데 내나이 50이 다되어가도 이영화만큼 걸작은없다고생각한다 그때ㅇ에디워드펄롱의 캐스팅은 신의 한수...다시봐도 그젊은날 손에 땀을쥐고 가슴찡하던 감동을 잊을수없다 
10,이런 감성의 영화가 더 이상은 안 나올 것이라 장담함. 아날로그와 디지털 세대에 낑긴 사람들에게 영원한 명작 
10,무수히 많은 영화를 봐왔지만 어릴 적 이 영화를 처음 접했을 때의 그 충격과 감동은 아직도 잊혀지지 않을 정도... 영화관에서 못 본 것이 너무 아쉽다. 카메론은 정말 천재다. 91년도에 이런 영화를 만들었다니 
10,이영화의 메인테마곡은 어릴적내게 어마어마한 상상력을 심어줬다 지금들어도 설렌다 
10,제발 세상사람들이 이거 다봤음 좋겠다 
10,터미네이터 1은 솔직히 그래픽 딸리는게 눈에 확 보이지만 2는 진짜 외계인 고문해서 만든 그래픽이라고 봐도 무방함아직까지도 국내에선 작정하고 블록버스터 액션영화로 만든게 아닌이상 이런 그래픽도 못만들어냄 진짜 유네스...
10,솔직히 말해서 감동적인 영화는 평점 받기가 더 유리하다 근데 터미네이터2는 액션영화다 
10,역시 터미네이터2는 극장에서 
10,처음 오프닝에 '심판의 날'이라는 자막과 터미네이터의 웅장한 음악이 나오면  아직도 가슴이 뛴다. 
10,"T-800도 기가막혔고, T-1000도 기가막혔고, 샷건도 기가막혔고, 오토바이씬도 기가막혔고, 미니건도 기가막혔고, 용광로도 기가막혔고, 유탄발사기도 기가막혔고, 톱니바퀴도 기가막혔고, 따봉도 기가막혔다. 처음부터..."
10,주변 외국인 만나면 영어 한마디 못하는 인간도  I will be back  이 어떤 영화에서 나온줄은 안다. 말 다한거 아니가? 
10,내가 태어나기도 한참 전에 나온 영화라는 것이 믿기지가 않는다. 내인생 최고의 영화라고 느껴졌던 다크나이트가 초라해지는 기분. 이영화는 평점 10점 가야댐. 말이안나오는 영화임 와 진짜 대박 
10,이거 10점안주는 사람은 진짜 영화못본사람임 
10,다이슨 박사 부인 연기하는 거 봐라  겁에 질린 연기 최고다 
10,시대를 앞서간 SF영화사의 획을 그은 걸작 
10,이 영화는 당시에 재미를 넘어 충격과 놀라움이었다. 
10,전대미문의 대작. 지금봐도 너무 재미있음. 
10,터미네이터2의 개봉이 헐리웃sf액션에 어떤 영향을 끼쳤는지 조금만 검색해봐도 안다. 20세기 sf영화는 터미네이터2의 개봉전과 개봉이후로 나뉜다. 
10,레옹이 이걸 능가한다는 게 말이되냐 
10,그냥 이 말 봤게 안나 온다. 최고의 명작 
10,우리나라는 OO 지나도 이런 영화 못 만들것이라고 장담함 
10,비디오 가게 가면 맨날 뒤집혀져 있었다 ㅜㅜ 
10,제임스 카메론 그는 상품성과 대중의 취향을 아는 명감독이다. 터미네이터는 그 정점에 있는 작품이고 90년대 초반의 작품임을 감안 했을 때 최고로도 그 수식어가 부족하다. 
10,91년도 작품이나 지금봐도 전혀 촌스럽지가 않음. 오히려 더 세련되보임 
10,1991년에 나왔던 영화가 2015년에도 극장에서 현역으로 뛴다는걸로 설명 끝 
10,기억상실증억 걸려 다 잊어버리고 다시 봤으면 좋겠다. 모든 내용을 다알고 있는게 한스럽다~! 
10,이 영화를 보지않고 SF영화를 논하지마라... 
10,100년이 지난후에 박물관에 남아있을 영화필름 5가지를 꼽으라면 반드시 들어가야할 영화. 
10,극장에서 보니 감동이 확실히 다르게 밀려오네요...!!나중에 다시 한번 더 개봉했으면 합니다!He will be back ! 
10,명작~~이게 20년전에 만들어진거라고?!! 대박이다~몇번을 봐도 질리지 않는영화!! 
10,말로 표현못하는 최고의 명작 영화 
10,명불허전이 따로 없음.  22년만이 재개봉이지만 여전히 새롭다. 
10,이게 바로 명작이지ㅎㅏ 
10,10개 이상 못주는게 아쉬운 영화 
10,이 영화 100번은 본듯.... 
10,엄지손가락은 올려달라는 신호임 
10,내 인생 최고의 영화 ost도 들을때마다 소름돋음 
10,신이 내린 걸작. 봐도 봐도 질리지 않는다. 
10,영화라는 단어를 쓸때 이영화를 논하지 않고는 과오를 범하는것이다. 후속작이라는 핸디캡을 무참히 짓밟아버리는  엄청난 영화이다.  영화라는 재미의 끝을 보여주는 작품이 다. 
10,교과서적인 명작.  넘을  수 없는 벽이다. 어떻게 이런 영화를... 
10,제임스카메론의 천재성이 돋보이는 작품 중 하나. 역시 명작은 시대 흐름의 변화와 무관하다. 
10,지상최고의영화다..ㅎㄷ 왜 요즘시대엔 이만한영화를 만들지못하는가 
10,평점란 오늘 첨 봤는데 나만 운거 아니었구나 
10,"터미네이터 T-1000을 어떻게 죽일지 감이 안 잡힐 정도로 끈질기고 소름돋는 캐릭이였다. 20년전 영화라기엔 cg가 수준급이며, 스토리도 탄탄하다. 터미네이터는 2에서 끝났어야했다. 망작인 3,4는 보지말고 우리모..."
10,14년후에 다시보니 감동은 여전했다. 
10,이 영화는 100년 200년이 지나도 길이남을것이다 
10,어릴때 봤던 느낌이랑은 또 다르네요.단언컨대 T2는 이전에도 앞으로도 어떤 블록버스터도 뛰어넘지 못할 걸작입니다. 
10,그당시 영화상영관이 지금 정도면 최소2000만은 거뜬히넘을듯 
10,이거 안본사람은 인생 헛산겨 
10,"OST부터 액션신, SF까지 완벽한 영화. 기계를 소재로 한 영화중 가장 충격적이고 혁신적이며 완벽한 영화 "
10,정말 전설이상급입니다 
10,진짜 지금까지도 마지막 순간이 기억난다 
10,꼬꼬마시절 터미네이터2를 보고 느낀 전율과 감동은....이제 마흔줄이지만 요새나오는 그어떤영화도 단 한번도 그런걸 느끼게한적이 없다.아카데미작품상 my ass 
10,공포영화보다 더 공포스러운. 보는내내 도대체 Tㅡ1000은 끝이란게 있는건지. 
10,영화보고 잘 안우는데 진짜 눈물나게 감동적이었다 평생 잊지못할최고의영화 
10,시대를  아우르는것이란  바로  이런것 
10,10점을 줘도 미안한 영화 
10,"이 영화가 1991년 작품이라니... 감독의 천재성, 영화자본의 집약.. 한국은 오OO 뒤에도 단언컨데 찍을수 없을... 경이로운 작품입니다. "
10,같은 장르의 다른 영화들을 모두 아류로 만들어 버렸다. 
10,최고의 명작~시나리오 영상 지금가지도 깔데가 없다 
10,우연히 오늘 또 봤다..몇번째인지..  볼때마다 너무나 재밌다..자기전에 채널돌리다가 멈칫 했는데..빠져들었다..시간가는줄 모르고..새벽 4시반.. 출근해야되는데..ㅎㅎ 
10,91년도 작품인데 지금 봐도 어색하지않고 오히려 현재 작품보다 더 대단하다 
10,개레전드명작입니다!! 
10,지금 만약 개봉했다면 아바타 기록도 우습게 깰 것이다. 
10,지금까지 한 50번봤나? .. 내가본최고 t2는혁명임... 
10,27년 후에 봐도 여전히 소름끼치게 훌륭해요 
10,어렸을때 보고 충격적이었던 기억이 
10,2편 감독판으로 끝냈어야... 
10,네이버 영화평점 다른건 다 잘못된 정보 같던데이 작품 평가는 그대로 믿으셔도 됩니다10점 만점에 100점짜리에요 
10,1991년에 만들어졋다는게 믿기지않는 작품 
10,초딩때 보고 아무생각없이 아윌비백 뭔뜻인지도 모르고 사용했는데딱 10년 흐른 지금 다시보니 아윌비백의 뜻을 알겠더라몰입도 장난아니고 감동적이다 마지막에 눈물이 주르륵나쁜경찰은 어릴때나 지금이나 무섭다 
10,추억팔이ㄴㄴ 터미네이터2는 찐이다! 
10,오토바이 추격씬은 어릴때 봤었는데 가슴 볼이면서 봤던 기억이 아직도 잊혀지지가 않는다. 악역 터미네이터의 섬뜩함은 이 영화의 화룡점정 
10,말이 필요없음! 닥치고 추천한다. 
10,현존하는 언어로 감히 이 영화를 평가 할 수 있는가.그 것은 교만함이다. 
10,평점 자체가 무의미하다.. 평점을 자체를 매긴다는게 이영화에 대한 무례다 
10,내 인생 최고의 영화 할말이 없다 
10,영화사에 길이남을 명작. 20년전 보았던 그 기억과 전율이 아직도 생생하다. 
10,20년이 지난 지금도 미래를 상상하게 작품이다. 
10,"영화는 대작이었지만, 반대로 에드워드 펄롱은 어린 나이에 무너져 갔던 ..ㅠ 그것만 아니었으면, 레오나르도 디카프리오 같은 사람이었을 텐데, "
10,최고다...정말 명작이다...이런게 명작이지. 
10,또봐도또봐도 지리는 영화 
10,세월을 거꾸로 거스르는 카메론의 명작  이것은 하나의 역사다 
10,그렇게 보기 힘들다는 오리지널을 뛰어넘은 속편! 
10,2018 11월 29일 목 자녁 10:18분 현재 슈퍼액션에서 방영 중에 쓴다.봐도 봐도 질리지 않는 내용과 볼거리다. 
10,10점 밖에 못주는게 너무 아쉽다 다시봐도 최신영화같다 
10,국민학교5학년때인가봤는데 그충격을 아직도 잊지 못한다. 시간이 흘러도 이만한 스토리와 액션가진 명작이 나올까? 최고의 최강의 전설 그자체가 터미네이터2! 
10,"오바가 아니라, 이 영화의 단점을 찾기 위해서인지 너무 재밌어서인지 15번 넘게 본 사람으로써 말하는데 이 영화는 인류 문화 유산 수준을 넘어서 나중에 인간이 죽고 인공지능이 지배한 세상에 고전작품으로 쓰일법 함. "
10,이 영화를 능가하는 영화가 앞으로 나올수 있을까.. 
9,이게 1991년도에 나왔다는게 소름돋는다 
10,다크페이트 때문에 다시 봤는데 지금봐도 너무 재밌다.그냥 갓띵작. 긴말 필요없음. 
10,내 인생은 터미네이터2를 보기 전과 본 후 로 나뉜다. 
10,야야야~~다 때려치우구 내가 92년 말년휴가때 단성사에서 밧거든...영화끈나구 전원기립해서 박수치드라...영화끈나구 전원박수친 영화 있냐..? 나와바 
9,T1000의 나이든 모습을 fox미드 스콜피온에서 봤다. 도대체 언제적영화냐 
10,내 유년시절 봤던 영화 중 가장 기억에 남았던 영화. 그 후 아놀드슈왈제네거  할아버지의 팬이 되었지요 ㅎ 
10,최고최고. 정말 잘만든 영화이다~~~ 
10,진정 어머니가 없는 영화 
10,죽기전 헥헥 거리는 다이슨 때문에라도 10점 
10,방금 ocn으로 또 봤네요ㅋㅋ 진짜 몇번을 봐도 재밌네요ㅋㅋ 터미네이터 시리즈 중 단연 최고의 명작. 어린시절 두려움에 떨며 액체인간을 보던 기억이 납니다. 엔딩 장면은 정말 감동입니다 ㅠㅠ 
10,걸어다니는 sf의 교과서 3번 보았다 
10,액션의 명작 중 명작이지. 
9,봐도 봐도 재밌는 영화 언제쯤 질리게 될까 
10,"내가 가장 좋아하는 영화,  아놀드 슈왈제네거님...사랑하고 존경합니다... "
10,이건 영화가아니고 예술작품이다 
10,내가 본영화중 탑3에 드는 명작 
10,말이필요없는영화 이 영화에대해 무엇을 논할것이없다 그냥 무조건 감상하면 되는영화 
10,집에가서 애나봐 짜샤~~이게 뭔소린지 안다면 토요명화세대~~ 
10,9.4? 장난하냐? 9.8이상 돼야한다 
9,25년전 만든영화가 어찌 지금만든 영화보다 스토리며 상상력이며 100년은 앞선거 같노 
10,아직 못 본 사람은 있어도 한번만 본 사람은 없을 듯 
10,10개줘도모자라진짜 
10,50번은 넘게 봤다. 작년에야 터미네이터 시리즈를 알게 된걸후회하고 있다. 
10,"평점 9.9 나와도 아쉬운 영화인데, sven*** 이런 관종들때문에 9.3점대가 나오네. sven 쇼생크탈출,반지의제왕,터미네이터 1점주고 졸린다면서, 역대급 망작 퍼시픽림,호드,천안함프로젝트 10점만점 주고있네 ..."
10,나 초딩때 집에서 친구랑 같이 보면서 마지막 장면에서 울었던 기억이..ㅋㅋ 
10,초등학교떄 친구랑 목욕탕갔는데 친구놈이 엄지를치켜새우며 탕으로 입수하더라 
10,기계와 인간의 공존 그리고 친구가 되는법. 서로간의 이해와 신뢰가아직은 지구는 희망이 있다는것을 보여준 대표적 영화.이제 왜 우는지는 알겠는데 울수는 없대.최근에 봐도 전혀 이상할거 없는 높은 완성도.이거 1992년...
10,"학창시절 대구 동성로 어느대형극장서 봤었죠그당시엔 대형스크린 달랑하나라서 이건머사람이 넘많이몰려 버스도아니고 입석으로 봤던 기억이 나네요 이 영화는 그냥 전설입니다획기적인 특수효과,탄탄한 시나리오,적절히 섞인유머통쾌..."
10,1위는 쇼생크탈출이아니라 터미네이터입니다 여러분 
10,"마지막 대사가 평생 기억에 남는데 그걸로 끝이였으면 ,,,,,, "
10,올 해 최고의 헐리웃 영화 
10,최고의명작임다.... 
10,22년이 지난 지금봐도 쩐다!!! 명작은 시대를 초월한다!!! 
10,제가 알기로는 추가된건  사라코너와 존코너가 아놀드 머리부분잘라서 두뇌역활하는 기계 꺼내는 장면하고.. 그리고 또 사라코너 무기고에있는 장면에서 존코너가 아놀드한테 사람이 웃는모습 알려주는데 아놀드는 보고 따라하지만...
10,ㅎㅎㅎㅎㅎㅎㅎㅎㅎㅎㅎ 
10,100년에 나올까 하는 명작임 
10,개봉첫날 극장에서 보고 나오자 마자 표 다시 끊어서 또 보고 표 또 끊어서 개봉날만 세번 본 영화 그때의 전율과 흥분 감동은 지금 봐도 이어지네요 ^^ 
10,두둥 둥두둥~이 음향에서 이미 지렸다~~~ 
10,영화평들이 이렇게 압도적인 영화도 없을듯...댓글들만 읽어도 감동이 밀려와 눈물이 날듯하다. 
10,영화계 충격을 넘어서 문화계 충격이자 영화계 혁명이다. 이런 CG를 스토리 라인과 재미와 완벽하게 어울려 최고의 작품을 만들어냈다. T천과의 몇번의 추격씬은 말이 필요없는 영화계 최고의 시간들이다. 명작중에서도 명작...
10,어제 티비에서 나오길래 또 봤다. 50번 넘게 봤는데도 재밌더라.. 
10,영화도 결국 이야기다..  화려한 cg 기술 연출 다 중요하지만 결국 이야기가 안되면 그냥 이쁜 영상집일뿐 제임스카메론은 진짜 천재다 
10,"모든 걸 다 잡은 영화, 영화사에 영원히 기록될 마스터피스 "
10,불멸의 전설. 생각만 해도 전율과 눈물. 
10,10번 넘게 본거 같네. 
10,액션블록버스터는 터미네이터 전과 후로 나뉜다. 
10,대작이란말밖에... 
10,이영화는 무조건 10점 
10,영화 처음부터 마지막까지의 멈출 수 없는 흥미진진함이 느껴졌습니다 
10,SF 영화계의 최고봉. 가히 제임스 카메론이 만든 작품 전체를 논해도 이 영화가 베스트 오브 베스트 
10,언제 다시 봐도 감동이죠... 
10,전설에 두말은 필요없다. 죽기전에 꼭 봐라! 
10,이 시대의 명작을 극장에서보는날이 오는구나 
10,이영화에 10점을안주면 어떤영화에 10점을주랴.. 
10,이유없음 그냥 명작이다 
10,세기의 작품에 1점 OO 오지구요 
10,역대급 전설의 시작Sf의 끝판왕 
10,sf영화의 조상님이자 유산 
10,터미네이터 2는 후대 모든 동일 장르 영화를 평가할 객관적 잣대로 분류해야한다. 문제는 이 기준을 넘길 영화가 아직 없음. 
10,이런 명작은 열손가락에 뽑는다! 
10,11월 14일에 재개봉 한데!!!! 무조건 극장 사수 
10,오유 일베충 세퀴들 냄새가 여기서 까지 진동하네 
10,최고의 영화입니다!! 
10,이건 내가  좋아하는 영화 순위에 없다. 이건 영화가 아니니까. 
