score,review
9,"시대를 앞서간 액션, 그리고 철학 "
10,"평점조절하는 놈들 진짜 이해 안간다...개인적으로 타이타닉보다 이게 더 명작인 것 같은데...오락과 철학을 이렇게 잘 조화시키고, 로보캅의 고뇌를 이만큼 담아내기가 쉬운 줄 아는가? "
7,거의 30년이 지났는데도 되려 지금 현실에 더 적합한 사회풍자 영화 
10,다 좋은데 이거 왜 장르가 코미디임??ㅋㅋㅋㅋ 
9,자본주의 사회가 만들수 있는 미래를 보여주는 영화... 리메이크가 된다면 액션성으로 치우치지 말고 조금은 투박하고 진지하게 그려줬으면 하는 바램... 
10,요즘 영화들 cg 잘살려서 어떻게든 생동감있게 만들 생각하지말고 이 영화를 본받아라 
10,20번 넘게 본듲 하다.2편은 감동은 없지만 폭력과 잔인함이 2배가 됨.80년대 영화에서 cg따지는 똥강아지들 덕분에 80년대 sf영화들 평점 다 깍아먹는다 . 
10,터미네이터와 함께 sf 최고의 영화이다 . 오히려 터미네이터보다 좋다 
10,리메이크 제작과정과 예고편을 보고나서 다시 느꼈다.원작을 넘을수 없다는걸 
10,91년생이다.초딩때 아빠가 빌려온 비디오로몇번 봤었는데..그땐 그냥 로보캅이 멋있었지만10여년이 지나고 다시 보니 너무나 대단한 명작이다!!이거 최하 8점 이하로 주는 놈들은 싸이코패스거나 정신병자다 
10,시니컬한 사회풍자가 돋보이는 명작.  30년 후의 최신 기술로 무장된 리메이크작 조차 씹어 먹는 위엄.... 
10,대중매체에 자주 인용되는 로보캅의 이미지 때문에 막연히 뻔하고 유치한 작품일거라고 생각하고 봤지만 지금은 10점을 주기 위해 로그인하고 글을 쓰고 있다. 
9,폴 버호벤 영화는 몇번이고 다시 봐도 재밌다. 블랙유머속에 녹아있는 시대비판정신이 번득인다. 
8,당시에는 얼마나 획기적이고 진보적인 내용이었을까? 지금 봐도 대박 
10,정말 최고입니다. 20년이 넘은 영화지만 조금도 흠 잡을 데가 없네요. 정말 최고입니다. 
10,1987년도 영화라는걸 감안하면 10점 줘야된다... 이 당시에 컴퓨터도 8비트 시절에 하드가 없이 500kb짜리 디스켓으로 도스 깔아서 부팅하던 시절... 
10,"단언컨데, 폴 버호벤 감독의 최고 걸작. "
10,액션이 다가아닌 철학적인 최고의 영화 
10,차가운 메탈속에 숨겨진 따뜻함과 강렬함이 분출하는 영화!!! 폴버호벤의 역작이며 피터웰러의 로봇경찰 연기가 압권d^_^b 
10,철학을 내재한 엄청난 걸작!! 
10,액션영화가 자연스럽게 철학적 사고를 하게만드는 영화 폴버호벤 영화는 이런부분이 좋더라~ 
10,'마이 네임 이즈 머피' 
8,다 때려 부수는 단순한 액션영화인 줄 알았는데 이렇게 진중한 메시지를 담고 있었다니 
10,"디트로이트가 자동차 산업으로 떠올랐다가 지금은 쫄딱 망한 곳인 아닌가요? 아무튼 메카닉적 요소뿐만 아니라 시리즈 내내 어필하고 있는 자본주의의 폐단과 섹스, 마약, 인간의 폭력성을 블랙코미디로 승화시킨 듯하여 액션영..."
10,말이 필요 없는 명작이다. 
10,폴 버호벤 감독과 피터 웰러 그리고 미술 특수효과 담당들에게 경의를 표한다. 
10,로보캅 진짜멋지다... 
10,어릴적 이 후 다시 봤지만 연출부터 음악까지 모든게 완벽한 영화 
10,수십 번을 봤지만 볼 때마다 가슴 웅~한 영화 SF를 넘어선 SF영화...명작중 최고의 명작... 
10,터미네이터2와 견주어도 밀리지 않을 단 하나의 역작... 
10,폴 버호벤 감독은 천재임에 틀림없다 
9,시대의식+폭력의 미학+철학+OST 4박자가 다 갖춰진 걸작. 
10,이 영화는 어떻게 보면 코미디라는 장르중에 블랙코미디적 요소도 같이 가지고 있죠. 그래서 코미디라고 썼던것같아요. 
10,잔임함을 경지에 올린 폴 버호벤 감독의 액션물이자  현실성이 가장 많은 영화이다. 
10,시대를앞서간 명작이다이건 80년대나왔다고는 믿기지않을정도 
10,얼마전에 디트로이트는 디폴트선언했었는데 영화가 현실로나타남 로보캅빼고는 
10,로보캅이 구시대  추억일 뿐이라고?  영화를 봐라. 최고의 감독과 최고의 배우가 만들어낸 시너지로 아름다운 SF영화가 만들어졌다. 반드시 봐야 하는 영화 
10,지금 봐도 수작이다. 특히 2014년 로보캅이 이 작품만 못하다. 
8,"권력자들의 지시가 아닌, 정의를 따라 판단하고 움직이는 바람직한 경찰의 모습. "
9,그 시대에 이정도 작품을 만들어낸게 놀라움따름이고 의외로  잔인해서 놀랫다 
10,"오랜만에 다시 본다. 로보캅 자체보다, 전지구적인 암울한 미래상에 대한 묘사와 시니컬한 정서가 더 기억에 남고, 어린 마음에 우울했던 기억이 난다. 27년이 지난 지금 보니 오늘날을 정확히 예견한 영화인듯. 재미도 ..."
9,어릴적 비디오로 본 거는 완전삭제본..기계와 인간과의 철학도 들어가있고 피튀기는 장면도 절묘하네 
10,"개봉당시에는 로보캅 모습에만 관심을 가지고 봤었는데, 지금 다시 보니까  머피의 내면을 볼 수 있어서 조금 슬프기도 하다...마지막 자신의 이름을 머피라고 이야기 할 때 뭔가 모를 감동으로 가슴이 갑자기 뜨거워졌다...."
10,사회부패와 부도덕한것들을 로보캅이라는 캐릭터가 깨부쉬는 철학과재미를 한번에 담은 훌륭한 영화 
8,어쩌면 정체성을 찾는모든영화의 모범은 바로이영화인듯싶다 
10,진심 이건 시대의 명작이엿지 니들도생각해봐라 징~치크 징~치크 안하고 놀앗냐 지금의 10대중반과 20대초반 아그들아?? 진심 이거가지고 장난치는년들은 싹다뒤졋으면좋겟다 
10,더이상 설명이 필요없는 완성도 높은 작품이자 최고의 걸작!!!!! 로보캅이던 피터웰러의 로보트 행동과 표정 연기 가히 압권이었지!!! 난 이걸 당시 중학생때 극장에서 충격적으로 재미있게 봤다!!! 
10,"내용아니까 자막없이 다시 봤는데 몰입도 최고, 여러가지 면에서 당시 시대를 압도하는 영화. 지금봐도 스토리 괜찮음, 폭력/잔인한 장면 많음. "
10,"인간의 존엄성을 그누구도 짖밟으면 안되지, 아직도 액션영화로 착각 하는분 많은듯 "
10,"몇 가지가 특출난 걸작은 꽤 있지만, 이 영화처럼 모든 게 완벽한 걸작은 아주 드물다. "
10,속편의 여지를 안남겨준 깔끔한 명작..그리고 거의 30년전 영화인데 그 이후 아직까지 이만한 완성도를 보여준 영화는 드물다 
10,"어렸을적 봤을땐 로보캅의 악당을 잡는 모습에 반했고 나이들어서 보게 되니까 폴 버호벤 감독이 영화 곳곳에 심어놓은 자본주의 사회풍자와 메시지에 반하게 되네요. 블래이드 러너, 에일리언과 더불어 클래식 SF의 교과서적..."
10,리메이크판은 감히 범접할 수 없는 명작 
10,현재보다 먼 미래에 다시한번 주목받을 명화 
9,폭력적인 장면에서 재미를 주고 영화를 보고난뒤에 생각해볼수록 진지한 영화 
10,모든 게 다 담겨 있는 최고의 영화 중 하나라 자신합니다. 시대를 앞서간 걸작!! 
10,자네 이름이 뭔가?  머피 
10,클래식은 클래식이다 진짜... 나 다섯살 여섯살 하던 시절에 영화채널에서 간간히 틀어주던건데 20년 가까이 지나서 봐도 보캅이형은 여전히 멋있다ㅠㅠㅠㅠㅠ 
10,오늘 영화가 현실이 되었다 난 12살때 봤었는데 36살이 되서야 이영화의 내용을 이해하게 되었다 
9,개봉된지 20년도 더 지난 영화지만 정말 재미있다. 하지만 관람등급이 15세 관람가치고는 잔인하고 징그러운 장면들이 많이 나온다 
9,자아를 찾아가는 로보캅의 고뇌. 훌륭한 영화 
10,1편만은 최고. 왓 유어 네임? 머피! ^^ 
9,와 진짜 존나 잔인하네 ㅋㅋㅋ 
10,지금 봐도 엄청나게 잘 만들었다. 당시 어린나이에 초반 주인공이 난사 당하는 장면에서 충격을 받았다. 사람이 어떻게 저렇게 잔인할수 있는지 ... 
7,국가와 정부의 기업화를 우려했던 사회풍자 
10,로보캅도 어벤져스에 합류 시키면 좋을거 같다. 
10,액션에다 느와르에다 인간미까지 감독은 천재 
10,"로봇 기계라고 얕보지 말라는 교훈!인간처럼 생각하고 감성적인 기능이 있다.키야~과거에 자신을 죽이려고한 지능 높은 강도집단을한놈씩 몰살! 마지막엔 강도 두목시키 알고보니 경찰에서짱먹는 놈, 배신자 처단! "
10,"말이 필요없는 최고의 명작영화. 지금은 기술도 발달하였다지만 요즘 만들어지는 영화는 로보캅보다 액션뿐만 아니라 액션과 더분 사회풍자와 철학적인요소, 인간의 감정과 고뇌에 대해 생각하게 하는 장면이 떨어지는 것 같다...."
10,철학을 담으면 액션도 전설이 된다. 
10,"전설이 된 명작임, 아 옛날이여~ "
10,"정말 시대를 앞서간 작품이다, OST도 정말 대단 "
10,초중고시절 비디오녹화된거 수십번 돌려봤었지. 20년지나 다시봤는데 정말 명작이다. 군더더기없는 전개하며 액션영화 중 국보급인듯. 개인적으로 ost가 가장 좋았다 
10,2013년 케이블에서 다시보지만...역시 명작이다~26년전 영화~시대를 앞서간 수작중 최고인거 같다~ 
10,sf영화홍수시대에서도 로보캅만한 sf 찾아보기 정말 힘듬 
10,폴베호먼의 수작중에 하나...이당시에 로보캅이라는 충격적인 비주얼이 압권 ㄷㄷㄷ 
10,평점 조절은 무슨 조절이야. 가벼운 메카닉 액션물을 생각하고 봤다간 전혀 다른 생각이 드는데. 
9,"요즘 중고딩 애들은 이걸 액션 영화라고 착각하면서 보는구나. 이건 '인간성'에 대한 영화란다. 인간도 기계도 아니기에 이쪽에서도 저쪽에서도 철저히 유린, 외면당하는 잔인한 인간성에 대한 폭로. 폴 버호..."
10,최고의 고어 히어로물 입니다. 
10,"시대를 앞서간 명작, 근데 이영화가 15세냐?머피가 죽는 씬만봐도 18세이상 관람가인데.. "
10,시대를 앞서간 명작이지 
10,역시 명작임 믿고봄.. 
10,내 인생 처음으로 영화의 '재미'를 알려주다 
10,눈앞에 서있는듯한 리얼함 
10,컴퓨터그래픽 없던 시절에 어떻게 만들었을까... 많이 어설프지만 참 대단함. 
10,"사회적풍자와 철학적깊이 그리고 폭력의 미학도 단연 최고지만 이 영화의 음악은 거장 바실폴두리스가 담당했다. 코난,스타쉽트루퍼스등 그의 음악은 장중함의 극치다. 모든게 완벽했던 영화. "
8,폴 버호번 감독 영화는 딱 티가 나...재미도 있고 생각도 하게 하고.. 좋아.. 
10,사회 풍자 속에 적절하게 섞인 유머가 때로는 진지한 분위기를 중화시켜 준다. 
9,아무리 리메이크를 잘해도 원작이 최고다! 
10,80년대 천삼백만달러 짜리 블록버스터를 B급 무비 취급 하는 미친.년도 다 있더군 
10,20년전 어릴 적에 봤을 때는 이런 생각까진 안들었는데 요즘 삼성이란 회사를  보고있으면 마치 로보캅의 OCP란 회사가 근 미래 한국에 등장할 것 같은 느낌이 들었다. 
10,지금봐도 전혀 시대에 뒤쳐지고 수준 낮은 영화 결코 아니다. 
10,연출은 기술을 초월함을 30년 넘은 영화가 방증하네요 
10,클래식 액션 영화 80~90년대 영화가 오히려 쟁있어 
10,30년 전 작품이 지금도 재미가 있으면 대단한 거 아님? 
10,시대를 너무나 앞서간 SF의 수작..이 영화가 나온지 30여년이 흘렀음에도 현시대에 너무나 적합한 메시지.. 
10,어린시절 정말 여러번 돌려 봤었지.. 최근 개봉한 로보캅 보다 훨씬 잘 만든 영화 
9,"리메이크를 극장서 보고 오리지널을 다시금 봤는데, 옛날영화 인데도 상당히 몰입해서 봤음. 역시 명작은 영상이 다가 아님. "
10,미국에선 R 등급... 국내에선 15세 
10,시간이 지나도 명작은 영원히 남는다 
10,어릴적에 보고 지금까지 20번도 넘게본 영화..  특히 ost도 명곡에다가 영화가 나온 당시 국내에서 로보캅 돌풍을 일으킨 영화  지금봐도 왠만한 허접한 영화보다 났다. 
9,꼬꼬마였을때 봤던 머피와 어른이 되고 봤던 머피가 이렇게 달랐단 말인가 무삭제판을 봐서 그런가 잔인함이 ㄷㄷ하지만 안보면 후회할 영화임 
10,어릴때 정말 좋아했던 명작 ... 
10,나의 어렷던 시절의 인생영화 
10,시대를 앞서간 영화네요 
10,이영화는 10점을줘도 모자란다 
10,시대가 바꼈으니 리부트의 날렵하고 세련된 로보캅이 나온건  이해함. 그러나 내가 생각하는 로보캅은 둔하고 총알을 엄청나게 맞더라도 묵묵히 걸어가서 악당을 제압하는 영웅이다. 
8,특수분장이 시대를 감안했을 때 지금봐도 그다지 어색하지 않을 정도로 훌륭한 영화. 몰입감 메시지 모두 좋았음. 
10,기계의 육중함을 표현하는 사운드와 카메라워크가 엄청남. 심리묘사가 대단함.sf영화중에 이런 연출을 가진 영화는 유일할듯... 
9,이런 훌륭한 원작을 14년도 안드로메다 버젼으로 만들었으니. 폴횽은 진심 마음이 아팠을듯ㅠ;; 암튼 지금봐도 감히 놀란 감독의 다크나이트와 견주어도 손색없는 연출!! 멋지다!! 
10,해고당하면 목숨까지 위험함.. ㅜㅜ 
10,"1987년 당시 근 미래에서 그들에게 와버린 영화. 액션,캐릭터,유머,풍자,철학,연출 모든 것을 한 영화에 담는 짓은 2014년인 지금도 감히 어떤 감독들도 해내지 못하고 있다. "
8,로보캅 슈트만큼은... 현재도 꿀리지 않음ㅋㅋㅋ 
10,와..이게15세라고? 엄청잔인한데 가벼운영화라고 생각 했다가 큰코다침 
10,"Drop the gun. You are under arrest !You're coming with me !Who,  Are,  You?최고의 SF명작! "
9,어릴때 정말 재밌게 봤는데 참신한거 같음 
10,미친 폴 버호벤과 조금은 덜 미친 롭 보틴이 만났을 때... 
10,최고 
8,머피의 재탄생. 인간과 로봇의 조합 
10,폴버호벤 잘만드네 아바타를 압도 시킨 세기의 명작인것같다 
8,화려하지 않지만 현실적인 영웅인 로보캅은 당시엔 혁명이었지... 
8,어릴때 보고 신선한 충격으로 남아있다가 20년이 지나 다시보니 여전히 철학적이면서도 재밌다. 곧 나올 리메이크작이 기대된다 
10,200번도 더 돌려본 대작!! 최고의 영화!! 
10,"좋은 SF의 모범을 보여 주는 고전 중의 고전. 근데 2탄,,3 탄은 안 보는 게 건강에 좋음. "
10,"1편은 정말 어떤 말로도 표현할 수 없는 철학적인 영화!! 그리고 재미도 있는. ""잘 만든 SF 영화""!!! 2부터는 그닥.. "
10,내인생 최고의 영화중 한편 진짜 30번은 본것 같다 
10,무삭제판을 보고난 후...저렇게 잔인하고 심오한 영화였었던 거구나... 
10,비디오플레이어 샀을때 이 영화를 젤 첨 본듯!! 정말 파격적이고 최고였다!!! 다시 보고싶은 영화!! 로보캅 다시 보니 터미네이터가 로보캅 많이 따라한거네~ 
10,인간적인 고뇌와 가족에 대한 애틋함도 느끼는 명작. 나는 로보캅 > 터미네이터. 
10,뒤로 갈수록 망가진 영화이지만 1편은 시대를 앞선 명작임에 틀림없습니다. 
10,여러번본영화 재미있는 제입문영화 
10,"개봉 당시 극장에서 봤습니다마지막 대사는 아직 기억이 납니다""머피"" "
10,특이하고 기괴한연출력이 30대중반되서도 잊혀지지가 않는다 
9,이게 87년 작이라고? 
10,어렸을 때 봤을 땐 그저 메카닉 액션 히어로물인 줄 알았음. 나이먹고 우연하게 애들과 같이 볼 때 나는 어릴때와 다른 심각한 감동을 느꼈는데 애들은 액션히어로물 보듯 꺄 꺄 거리며 박수치고 재밌게 보더라는. ㅠㅠ 
10,내 인생의 영화입니다! 
10,유치한 이름과는 다른 엄청난 수작. 특히 작중 머피가 기억을 찾아가며 살던 집에 들렀을때의 분노를 씹어내는 표정연기가 최고라고 생각함 
9,중학생때 봤는데 정말 충격이였다 특히 피터월러가 갱들에게 난사 당하고 팔잘려나가는거 보고 너무 놀랬어 그리고 그걸 복수하는데 역시 복수는 차거울때 하는거야 
10,내 생에 로봇SF물중 가장 뛰어난 작품!!!  무삭제로  보니 정말 잔인하더라 
10,"""Come Quietly or there will be....trouble!"" "
10,터미네이터에 비견 될 수 있는 유일한 메카닉 영화. 
10,SF계의 레젼드랑께랑 
8,디스토피아 사회에 서부의 사나이 
9,'터미네이터 1'과 함께 80년대를 대표하는 SF 걸작. 
10,"그 시절 "" 마이네임 이즈 로보캅  "" 대사 쳐보지 않은 이 누가 있으랴... "
9,지금은 보여주기 힘든 소재의 참신함.. SF 영화의 한 축을 담당할 정도로 well made 작품이다.. 
10,cg 없는 sf영화 어떠케 만든건지 천재적이다~~ 
10,정말최고네요 티비로방영해줄때 50번도넘게본영화네요 요즘영화는 이영화본받아야돼요 
10,다시봐도  질 리지  않는  명작... 
9,"시대를 앞서간 액션, 그리고 철학.. 그리고 미국의 '웨스턴 무비에 대한 감독의 오마쥬.. 훌륭하다. "
7,지금봐도 괜찮은 수준의 연출에 감탄했다. 2탄도 나왔을텐데 
10,"물질만능주의에 폐해, 기계인간으로서 느끼는 고뇌, 자극적이고 화끈한 액션 3요소가 잘 조합된 명작 "
8,디트로이트를 이만큼 잘 표현한 영화가 있었을까?...폴버호벤은 어쩌면 시대를 앞서가는 감독 일지도... 
10,내 인생 최고의 영화!!!! 
10,그냥 명작 역대 최고 액션영화 잔인하고 통쾌하다 
10,단순한 sf 액션영화가 아니다. 진지한 철학이 녹아들어간 영화. 
9,왓 츠 유어 넴?? 마이 넴 이즈 머피~! 
10,이 명작을 개봉한지 30년 후에나 봤다는것이 통탄할 일입니다. 
10,로보캅 시리즈 중 이게 제일 좋은 것 같음. 
7,자본주의를 꼬집는 테마와 화끈한 액션. 약간의 고어함은 감수하고 볼만한 영화 
9,자기 자신을 알아가는 스토리가 아주 좋다. 훌륭한 스토리로 특수효과는 있어도 그만 없어도 그만. 
10,안봤으면 말을 하지마!! 
10,"한때를 풍미하기에 더없는 액션영화이자, 사회비판까지 잘 담아낸 버호벤 최고역작 "
10,내초딩시절 정말 어느날 tv에서 하길레무심코 봤던 영화 내가 이영화 덕분에 특수부대액션과 총액션의 매력에빠저 살게됨  정말이지 캐릭터설정도좋고 시대 때문에 cg가 좀 떨어저도이영화는 그부족한cg그 이상을 채울수있음 ...
10,다들 철학 철학하는데 모르겠고 지금봐도 쩌는 디테일이 좋다 
10,어린시절 쇼킹했지  아이엠 머피 
10,어렸을때 강박증 없을때 tv로본 최고의 명작영화 이거봤을때 어렷을때로 돌아가고싶다 내가 태어난 년도에 개봉했네 아 돌아가고싶어 
10,로보캅 보고 왔어요 이런 영화군요 
10,명작 중 명작. 시대를 앞서간 영화 어떤단어를 붙여도 부족하지 않다. pmc더벙커 같은 영화는 로보캅의 발톱의 때만도 못하다 
10,음울한..최고의 영화ㅡ 
10,엄청 잔인하지만 엄청 잘 만든 영화 
10,원작 캐릭터 코스튬을 가장 잘 살린 영화..ㄷㄷ 
10,초딩때 넘 충격적이었음. 
10,"안타깝지만, 기계적인게 가장 원리원칙이고 정의에 근접하다고 보여진다... "
8,인간보다 더 인간적인 사이보그 
10,87년작이라는게 믿겨지지 않는 작품 
10,뭐 ....밑에 극찬의 글 그대로인듯.... 
8,"탄생 배경(OCP사 두 중역의 권력 싸움)의 공감대는 리메이크작보다 약해, 로봇3원칙의 그럴듯함, 악당 중역이 You are fired(해고)와 함께 사격을 당하는(fired) 기발함과 통쾌함, 정체성에 대한 고민,..."
10,자본주의 의 극을향해 달리고 있는 현재와 앞으로의문제점을 너무 잘찝은 영화 경찰까지 민영화한다 
10,진짜 감독 상상력이 풍부하다. 진짜 
10,내 어린 시절 로보캅이 히어로였는데 ㅎㅎ추억이 감돋네 ㅎㅎ너무너무 재미있게 잘 즐겨 봤다 ㅋㅋ 
10,리메이크 보기전 옛날에 본게 기억이안나서 그냥 내용이나 보자히고 봤는데...정신없이 봐버렸다 이게 정녕 20년이 훨씬 지난작품인가??아 괜히 다시봤다.... 리메이크 어케봐ㅜㅜ 
9,"사이보그 히어로의 원조영화. 액션, 철학, 잔혹미까지 완벽한 균형을 유지한다. 폴 버호벤과 피터 웰러 조합의 시너지 효과로서, 다른 SF명작들인 액션지향의 터미네이터, 철학지향의 블레이드러너의 어두운 배경과 달리 밝..."
10,터미네이터와 함께 로봇계의 명작 
10,로보캅 리메이크 된대서 생각나가지고 다시 봤는데 예전엔 몰랐지만 지금보면 좀 촌스러워 보일지 모르겠지만  꽤 훌륭한 명작 
10,닥치고 10점 꼭보세요 
9,"어릴적 나의 영웅 슈퍼히어로,,, "
10,국내개봉시에 상당히 많이 삭제되서 나왔던걸로 아는데 그럼에도 세계관이나 비주얼적으로 너무나 충격받았었음..그뒤로 무삭제버전을 한번봤었는데 머피살해당하는 장면이 너무잔인하더군요.특히그 총맞고 팔이 툭떨어질때 ㅠㅠㅠ 
9,25년전에서 상상한  공공서비스 민영화와 로봇의 미래. 훌륭한. 액션도 멋지고. 수작임. 
10,보고보고 또봐도 역시 최고다 
10,중학교때 용돈 모아 극장가서 두 번봤다.  지금봐도 명작 
10,아 로보캅 어릴때 진짜 너무 재미잇게 봤었는데 말이죠. 지금은...ㅎㅎ추억의 영화입니다.^^ 그래서 추천 
9,20년이 넘은 영화.. 어렸을때 로보캅 봤을때 그 감동이란.. 
10,"화려한 액션말고, 놀란의 배트맨처럼 재탄생한 로보캅을 보고싶다. 마이네임이즈 로.보.캅. (솔직히 어릴때 봤을때, 멋있다기보다 충격적이었음.. 많은 생각이 들었던 작품..시리즈가 나올수록 -_- 망작이 되어가는것 같..."
8,최근에 다시 봤는데 약간 특수효과가 촌시러 보이지만 그래도 내용은 훌륭. 리메이크 기대되는 영화. 이 영화는 리메이크해도 재밌을 거 같음. 
7,볼만하고 옛날 영화라는게 놀랍다. 
9,나이먹고 봐야 이해합니다. 
10,터미네이터시리즈와 더불어 더이상말이 필요없는 영화죠 특히 1편의 저 포스터사진은 정말 잊혀질수없는 포스죠 어렸을적 본 최고의 영화라 생각합니다 
10,이영화짱임 
10,87년 작이라니 시대를 앞서간수작 현 블록버스터 영화랑 비교해도 안꿀림 ㅋㅋ 
9,재밌다 무슨말이 더 필요함 
8,캐릭터가 끝내주는 영화. 액션 씬에서 화력도 저 당시로써는 엄청난 편... 
9,87년에 나온 영화라는게 믿기지 않는 로봇영화 
8,어릴적 충격적으로 봤던.. 지금 보니 조금 허술하긴 하지만... 
7,명작반열에 오른...후속편들이 너무 말아먹었어 
10,"내 인생 최고의 영황, 몇번봐도 SF 로 위장한 철학과 사회풍자가 너무 절절하다. "
10,"시대초월의 각본, 액션, 테마. 그리고 열연. "
10,로보캅1 이후로는 연출도 그렇고 쓰레기 영화죠 2014로보캅 과연 그냥 액션뿐인 영화가 될지...놀란의 배트맨 시리즈처럼 잘 살려줬음 좋겠지만 기대가 안되는건 뭐지?ㅋㅋ 
10,롱테이크 촬영이나 연출 등이 흥미롭지만 스토리는 뻔하고 유치해.. 하지만 그런 흠이 있음에도 10점 줄만 하다. 
10,33년전 극장서 봤지만 지금 봐도 은근히 감동적정말 잘만든 영화10점!!!!이런 영화가 그립다 
10,음주운전 징계받은 경찰관이 여성을 성폭행한후 불법촬영하고 또다른 여성들도 불법촬영한 혐의로 검찰에 구속 송치됐다. 안희정 오거돈 박원순찰차2494716ㅍㅎㅎㅎ 
10,이런영화가1987년작?그당시우리나라영화판은모했냐이영화보고공부라도하지 어휴개명작이다진짜!Murphy!! 
10,걍 짱짱짱 짱10자 짱짱 짱짱 10자ㅜㅜ 어렵다 
10,어릴적 비디오테잎을 몇번씩 봤던 기억이 나네요 이제 40대를 바라보는 나이에 다시보니 정말 훌륭한 작품이였다는걸 알았습니다 
10,"감상자에게 대단히 공격적인 질문을 던지는 이 영화는 40여년이 지난 지금도 그 약빨이 유효하다, 하이테크놀로지의 세계에 던져진 철학적질문에 대답을 어떻게 할것인가는 고스란히 우리에게 남았다. 폴 버호벤이 헐리우드와 ..."
10,연출 기법이 좋아졌을뿐이지 스토리와 감성은 예전 영화들이 전부 압승. 
