score,review
9,수작.....  근데 잉마르  인기의 비결은 무엇일까? 모든 여자들이 다 좋아함. 
10,억지감동이나 말도안되게 어른스러운 애기들이 나오는게 아닌 진짜 애기들이 갖는 생각과 행동 수준을 보여줘서 더 현실적. 그렇기때문에 이 영화는 아무리 시간이 지나도 절대 유행을 타지않는 영화다. 오히려 요즘 성장영화보...
10,마지막 장면의 느낌 너무 좋다 
10,어린시절 무조건 미화하는거 참 싫은데 이 영화는 스웨덴 풍경처럼 자연스레 담담한 시선이 좋다. 
9,"우주로 보낸 개 라이카처럼, 운명 앞에 던져진 소년의 이야기. 그러나 소년의 곁에는 생의 동기를 주는 이성, '샤가'가 있고, 쉼터의 지붕을 수리해 주는 '프란슨'이 있다. 개같은 인생이..."
9,이거 정말 개처럼 울면서 봤는데요 
10,이런 영화를 볼 수 있어서 행복합니다. 
10,깨물어주고싶은 잉마르 ㅋㅋ 웃을때 너무 귀여워 
10," 어느덧 내가 잉마르 만한 아들이 생겼다. 아직 한창 알려줄것이 많은 말썽꾸러기 어린 아들을 두고 가는 잉마르의 엄마 마음이 느껴져  영화를 보기 시작했고, 이후 불행을 이겨내고 성장하는 잉마르의 모습이 내가 느꼈던..."
8,이런 말썽꾸러기를 따뜻하게 품을 수 있는 스웨덴이 부럽다. 
10,추억 돋는 클래식. 30년이 지나도 감동스럽네요 
8,잉그마의 풋풋한 성장영화.. 큰 굴곡없이 잔잔하게 이어지는 스토리.. 
10,엄마는 왜 날 미워했을까.. 그래도 잉마르 옆에 좋은 사람들이 생겨서 좋았음.. 
7,동서고금을 막론하고 아들둘 가진 엄마는 목매달 
10,그냥 따뜻한 야채스프같은 영화 
9,언젠가 나의 아이가 잉마르만큼 자랄때쯤 보여주고싶은 
9,"좋아하던 영화가 재개봉을 하여 극장에서 볼 수 있어 좋았다. 담담하게 하지만 무거운 이야기들에 대해 좀 더 진지하면서도 순수하게 성장을 이야기하는 방식은, 현 세기에 들어와서 봐도 굉장히 훌륭한 방식이다. "
8,"어쩔 수 없는 슬픔, 태어나는 바람에 "
10,명작은 세월이 흘러도 변함 없이 명작이네요. 
10,고즈넉한 스웨덴 풍경에 잉마르와 함께 빠져들었습니다! 
10,추천합니다 장난꾸러기지만 미워할 수없는~~ 
9,좋은 영화다. 
10,"아이들의 성장에 부모 만큼이나 이웃, 친척과 사회의 역할이 중요하고 책임 있다고 할수 있겠다. 결국 그 아이들이 어른이 돼서 또 하나의 사회를 이룬다~남의 아이라고 무심하게 보지말고 우리 모두의 책임이라는 메세지가 ..."
10,여러 번 봐도 좋은 영화. 잉마르가 너무 딱하고 귀엽고 절젏하다 
10,"스웨덴의 정겨운 마을, 사랑스러운 소년 잉마르의 이야기가 참 뭉클하고 따뜻하다. "
8,잔잔한 감흥을 주는 엉화 잘 봤습니다 
10,제목보고 어렵고 진지할까 걱정했지만 왜 이제 알아싶었을까 싶은 행복하고 귀엽고 따스한 영화! 
10,좋은영화 꼭보세요 울고웃고 
10,"""잉마르, 우리가 널 안아줄게"" 포스터의 이 문구를 보았을 때 모든 의문이 풀어졌다. 따듯하게 품어 줄수 있다는 것을...(명작에 별점이 무신 의미) "
7,처음에 잉마르가 너무싫었다 
9,"어렸을 때 봤을 땐 참 지루했는데, 지금다시 보니 가슴이 먹먹해 진다. "
9,내인생도 개같다.. 
9,외로움을 느끼게하는 가족보다 정겨운 이웃들이 잉마르를 성장시켰다 
8,계속 흐믓한 미소를가지고보게된다 
8,어린아이의 호기심과 아픔 그리고 성장 
6,현대 영화에 익숙한 저에게는 살짝 답답했어요 ...ㅠㅠ 
8,수수료를  부담하면서까지 예매를 하였다. 고등학생 아들녀석과 그 친구들 함께 보라고..좀 지루했지만 볼만했다고 한다.표현에 무뚝뚝한 녀석이 볼만했다는건 괜찮았다는 거겠지..ㅎ 
8,안타깝기도 귀엽기도 이상하기도 
10,"인생을 보는 또다른 시각, 우리모두 다 다르다! "
10,잉마르의 성장에 마음이 울컥했다가 잔잔한 감동을 받았어요~ 
10,마음이 따뜻해지는 영화였다... 주인공 잉마르의 1년이란....  우리내 70년대와도 맞다아 있는 느낌이다... 시칸도 행복하길 ... 
10,잘봤어요. 잔잔한 감동! 
8,즐겁게 봤습니다 여운이 있네요 
9,"담담한듯 따듯한 영화, 누구든지 보면 좋을 영화다. "
9,엄마에 대한 기억. 밤하늘 별의 기억. 어릴적 여자친구에 대한 기억. 겨울에 대한 기억. 스웨덴이란 나라에 대한 느낌. 오랜 시간이 흘러도 또 보고싶은 영화중에 하나. 
10,최고의 성장 영화~! 사랑스런 잉마르 사가~ 
9,대사와 감정과 효과를 남발하지 않는 정서적이고 정적인 성장영화다. 신경질적인 엄마로부터 사랑받지 못한 역의 글랜제리어스는 한국의 어린 이재응처럼 연기력보다는 무표정한 인상과 연출이 궁합이 맞을 뿐이다. 
10,최고의 명작어릴때 봣는데 지금까지그감동이 ... 
9,잉마르의 일기를 훔쳐보는 기분. 귀엽다가는 곧 슬퍼지고 잔잔히 웃기다가 이내 마음이 아프고 결국엔 미소 짓게 하는. 
8,따뜻하고 푸근하고 찡하다. 
9,내사랑  그녀와  중앙극장에서  본 첫영화 
10,개인적으로 가장 인상깊게 봤던 영화 
10,"그립고,따뜻하고,뭉클한영화. 가슴한켠에 계속 남아있는 영화 "
9,사랑스러운성장영화. 주인공 소년 너무 귀여웠다! 안아주고싶었음ㅋ 
7,그래도 아이는 자란다.이해 안 되고 불합리한 모든 걸 지나고 겪는 게 인생. 
8,"기대에는 좀 못 미쳤지만, 잉마르와 삼촌 가족 & 동네 사람들의 소박한 삶이 따스하다 "
10,사람은  어떻게 대하는가에 따라 무한하게 변할 수 있는것 같아요.사고뭉치로만 보이던 잉마르~엉뚱하지만 순박하고 따듯한 사랑들을 만나 마음의 상처를 극복해 가는 모습을 보니.나도 누군가에게그런 따듯한 어른이 되어야 겠...
8,1985년 스웨덴. 성장기 한 켠을 스크랩해 매우 자연스럽게 보여준다. 사건과 캐릭터들은 오묘하고 매력적이다. 들썩이는 그 시절 시골냄새가 난다. 주인공 꼬마는 연기천재가 아닐까싶다. 
10,어린시절 향수 자극된다ㅠ 
10,슬프지만 아름다운 힐링영화 
9,"잉마르는 짠한거 반, 쥐어박고싶은거 반이다 "
10,빨강머리앤 소년 버전.. 
10,이불 뒤집어쓰고 우는 모습에 나도 눈물이ㅠㅠㅠ 그동안 얼마나 울고싶었을까.. 울고싶을땐 울어라 아가야.. 참지말고 울어 맘껏! 
10,사가... 첫사랑. 후 
10,오래 전 이 영화를 보고 라세 할스트롬 감독의 팬이 되었다. 보석같은 영화다. 목숨이 끝나기 전 또 다시 보고 싶은 영화다. 
10,
6,성장영환데 너무 늙어서 본것일까. 박하향 소다수(장미빛 계절?)보다 기억에 안남을것 같다. 
7,라이카의 처지를 비교하며 자신을 위로하는 소년의 날것의 성장통. 
10,"나는 사는게 버거울 때마다, 가엾은 개 라이카에 비하면 자기 인생은 운이 좋은 편이라 생각하는 잉마르를 떠올린다. 그래, 개 같아도 살아야지. 안아주는 사람도 없이 홀로 우주를 떠돌다가 외롭게 죽었을 라이카 보다는 ..."
6,"미국, 한국, 일본과는 또 다르게 아이의 성장을 묘사하고 다루는 스웨덴식 영화, 그리고 그들의 정서. 아이가 밤하늘의 별을 보며 하는 대사들은 꽤 곱씹을 만하다. 타이틀의 '개'는 '라이카..."
10,라세 할스트롬을 세계적 명장으로 올려 놓았던 영화~ 
10,Good~따뜻한 영화다 
8,이리 온 잉마르 
10,옛날 주말의 명화에서 해줬던 명작. 잉마르와 사가의 권투를 연습하던 장면과 남자가 되고 싶은 사가의 점점 커지는 가슴을 붕대로 동여매던 장면이 기억난다 
10,이제야 드디어 봤어요.감동입니다. 
7,개같은 내 인생 ㅠ_ㅠ 화이팅 
8,결여를 향해 나아간 용감한 소년 
10,"17일 이대에 있는 아트하우스 모모에서 마지막 상영하는 것을 운 좋게 보게됐다. 어린 아이의 순수함과 엉뚱함, 호기심 등을 가식없이 보여주는 영화. 필름 카메라로 촬영해 지금의 디지털 카메라로 찍은 영화와 다르게 감..."
10,이런 영화 참좋다. 어린시절의 추억은 바로 이런거다! 
7,My Life As A Dog 
10,세월이지나도 명작은 변함없이 깊이있는 감동이 있습니다! 
8,잉마르..ㅜㅜ 좋은 작품이었어요 재상영되서 너무 잘봤네요 
8,"성장의 대가는 고통스럽지만, 성장의 잔인함에는 그 필연성이 차지하는 지분이 더 크다. 아파하고 울자. 참으로 미안하지만 참으로 예쁘다 "
8,아들과 함께 본 영화 너무 재밌다고 한다 
10,"잔잔한 소설 같은 영화, 완전 추천입니다. "
10,가혹한 현실앞에서도 꿋꿋이 사고뭉치로서의 모습과 가족을 사랑하는  천진난만하면서도 사랑스러운 아이의 이야기에서 마냥슬프지만 않고 가슴 따뜻해지는 이야기. 잉마르를 지켜봐주는 주변인들과 친구들과의 우정또한 뭉클하다. 
9,"사고를 많이 치기는 하지만, 어린애답지 않게 조숙하고 적극적인 잉마르의 모습에 제가 다 반성을 하게 되네요 허허 「9살내인생」의 스웨덴 버젼?이라고 생각했는데 참 재밌으면서도 복잡한거같고 그러네요...허허 "
10,처음으로 접한 스웨덴 영화..주인공의 어릴적 삶을 재미있게 표현한것 같아좋음..부담없이 즐길수 있는 영화 
10,인생을 말하는 내 인생영화 
9,조용하고도 무서운.깊고도 얕은 
10,라이카란 단어 때문에 가끔씩 이 영화가 생각날 때가 있다. 그럴 때면 가슴속 따뜻함과 함께 쓸쓸함도 같이 밀려온다. 
10,고등학교다닐때 재밌게 봤던 기억이 있습니다. 
10,89년에 극장에서 본후 28년만에 다시 보는데 왜이리 찡하지. 
8,"애들 나오는 영화긴 하지만, 뭔가 살짝 야릇한 느낌의 영화로 오랫동안 뇌리에 남아있던 영화. 여자친구가슴을 붕대로 감아주는 장면은 지금까지 선명히 기억이 남. "
8,아픈 기억의 어린 시절에 대한 현실적인 시선이 인상깊었던 영화. 
10,갑자기 어릴때 봤던 개같은 내인생이 떠올랐다 어른이 되서 생각해도 참 좋은 영화같다 
7,응원해주고싶은 성장영화 
9,마음이  찡한  영화네요. 
10,"양철북과 쌍벽을 이룰,시대를 넘어선,영원한 고전이다 "
9,강추..추천할수 있는 영화 중 손에 꼽음.. 잔잔하고 잉마르의 감정표현연기도 너무 좋음 
7,잉마르...연기도 너무 좋고 참 잘생겼네요. 걍 소소한 일상. 딱히 기억에 오래 남을 것 같진 않아요. 
10,사람들이 어떻게 살아야 하는건지를 보여주는 영화라는 느낌?  강추합니다. 
9,마음이 따뜻해지고....한편으론 가슴뭉클하고...좋은 교훈을 많이 주는 영화네요..주인공 너무 사랑스러워요...정말 동심을 자극하는 최고의 영화입니다. 
8,성장영화중 단연 최고인듯 
10,너무 개성있게 생겼어요 재밋다 
8,잉마르의 성장이야기.따뜻하고 잔잔했다.아날로그적 감성이 필요하다 
10,왠지 모르게 눈물이 나는 영화. 
10,이 영화는 최고다.. 본지 OO이 넘었는데도 기억에 남는다.. 아리다.. 
9,성장영화계의 명작. 봐도 봐도 질리지 않는다. 
10,슬픈 현실속에서도 잔잔한 일상의 따뜻함과 훈훈함을 잃지않은 명작 
9,전후 스웨덴이 복지국가로 뿌리내려나갈 수 있는 근원을 잘 보여준다 부럽부럽 
8,"행복한 잉마르, 따듯한 사람들. "
9,너무 이쁘고 귀여워요~어렸을땐 몰랐던 감동이 잘 느껴지네요 
8,느낌이 좋았다 분명 해피엔딩인데 왠지 눈물이 난다 
10,현실적인 내눈엔 너무 따뜻한영화. 그래서 더 짠한감이있음... 
6,"과학기술로 세상이 살기가 편해진다지만, 사람냄새나는 저 동네가 더 좋아보인다 "
10,영화 참 좋다... 핸폰 영화로 보아서 좀 아쉬움 ^^ 
8,분명 해피엔딩인데 왜 이렇게 짠할까 
10,오래 전에 본 영화. 다시 한번 꼭 보고 싶은 영화. 
10,최고의 성장영화 
9,평점을 믿고 봤다. 그럴만 했다! 
10,막내 이모 손잡고 극장가서 본 영화. 내용은 기억안나지만 의미가 남다르다 
8,중학교때 본 영화인데 특별히 기억에 남는 장면이 없다. 
8,불우한 아이의 형편을 담담하게 그려나가는 게 인상적이다. 
9,성장영화계의 보석같은 존재. 독어도 아니고 불어도 아닌것 같더라니 스웨덴이었군.. 
10,한 장면 한 장면 내 어릴적을 상기시킨다. 
8,잔잔하고 아름다운 동화.....^^ 
10,나름대로 생각 할 수 있도록 해 주는 영화......ㅎㅎ 
10,잉마르와 사가. 연기인지 실제인지 모르겠다. 대단한 영화... 보는 내내 즐겁다. 
10,보물같은 영화 
10,잊고 있었는데..다시 보니 넘 반가웠다..이젠 잊지 않으려고 dvd주문했다..뿌듯하다 
10,내가 이거 보려고 일부러 않잤다. 좋은 영화다. 
10,주인공 연기 최고!! 
10,20년이 지나 다시 봤는데도 재밌구나 
10,배우한명한명 장면 한개한개가 이렇게 미치도록 사랑스러울수가....행복하다 
9,가슴 따뜻하고 정이있는.... 삶의 소박한 행복을 되새겨보게 하는영화. 
10,내 유년기의 기억에 각인된 영화... 20년 후 다시 봤을때 감동이 배가 되었다. 
10,완전 소중한 영화! 너무 재밋다!! 
10,재미있다. 뭔가 느낌이 있다. 
8,"배경과 소품, 색감이 보기 좋다. "
9,성장기 영화중 단연 돋보이는 작품. 
10,나도 저런 곳에서 살아봤으면... 청소년기때의 심리묘사가 탁월한 작품. 
10,성장과 성숙이라는 것을 배워가는 훈훈한 영화 ^^ 
8,안톤 글랜제리어스.. 어린앤데 연기를 왤케 잘하는지..ㅋ 
10,정말 잘만든 영화입니다 이런게 진짜 영화인듯 싶네요 
10,이게 왜 18세가 되었지? 
10,볼만한 성장기 영화..ㅇㅇ 
7,스크린 앞에서 어린시절을 추억하다 
8,훈훈하고 미소짓게 만드는 휴식같은 영화 
10,어렸을적에 동심으로 마음을 훈훈하게 했던영화 
10,잔잔허니 ... 잉마르 ~~~~ 
9,동심으로 바라 본 그들만의 세상 
10,평온하고 잔잔했던 영화^^ 
10,배경이 영국인줄 알았는데 스웨덴 영화였구나 따뜻한 영화다. 
10,좋은 영화인데 제목을 뭐 이따위로 지었는지... 
10,흥행용 영화가 아니라 작품성영화다 
10,굳 
10,잘봤다~ 
8,그럼에도 나의 인생은 행복하다... 라고 말해주는 듯 하다. 
10,찡하고 따뜻함이 가득 
8,개같이 지맘대로 안되는 인생 ㅋ 
8,순수하고 사랑스럽지만 마냥 웃을수없는 영화 
8,최고까지는 모르게지만 그냥 잔잔한 영화.. 
8,정말 잔잔하게 쇼킹을 주는 영화 
10,라세 할스트롬의 유작과도 같은 작품 
10,가슴찡하게 사랑스러운 영화. 
10,그런 동네 또 잇을까 
8,훈훈함과 잔잔함 
10,영화에서의 스웨덴 말은 아름답게 들렸다.. 내용마저도 
2,good! 
10,본지 십수년이 지났지만 콜라병만 보면 생각나는 영화.. 
8,동화같은 따뜻한 성장영화!! 
10,내 인생 최고의 영화 중 하나... 
10,잉그마 ~ 흔한 이름...... 평범하지만 특별한 이름 ~ 특별한 영화 
10,최고 !! 최고 !! 눈물난다... 으흐 
10,성장영화로서는 최고가 아닐지... 
10,아  귀엽다 귀엽다 너무 귀엽다 
10,내가 이 영화를 오랫동안 잊고 있었구나... 정말 아름다운 영화... 
10,영상으로 표현할 수있는 아름다움이 이 영화 한 편에 모두 담겨있다. 
9,"와, 정말 정감넘치는 영화다. "
8,말썽장이어린소년이집안이어려워격는이야기소년은희망을잃지않는다 
8,우리와 다른 독특한 정서가 묻어남. 북유럽의 여유를 볼수 있는 영화 
10,정말 좋은영화다 
9,이렇게 다정한 영화는 별로 없다. 이상스레...  할스트롬 최고의 영화. 
8,내용 참 좋다. 그냥 생각한 대로 이어지는 줄거리라서 감동은 덜하다. 
8,역시 어린시절이 좋긴 좋구나 
10,저만 의견이 틀린가... 리뷰 좀 봐주세요. 
9,웰컴투동막골처럼 오버된 마을인데 끌리는 분위기~ 
10,지식인 보고 이해했다 
7,제목을 잘못정했군.. 철없던 어린시절이 더 낫겠다 
8,괜히 코끝이 시큰하네여~~^^좋다 
10,몇번을 봐도 기분 좋아지는..... 좋은 영화 
3,"볼만한 것 같은 데, 스웨덴 애들이랑 나랑은 주파수가 안 맞다 "
8,그래도아이는자란다. '사랑해말순씨'는 이영화의어두운편린이아닐까...? 
10,내 인생 최고의 영화... ^^;   강추... 
10,아직 이 영화를 못봤다면 꼭 보시오! 
7,라세 할스트롬의 가족 영화는 정말 탁월하다 
10,20년 쯤 됬을까? 청소년기때 본 영화중 최고의 영화... 
10,한소년의 이야기...추천 추천 
10,굿. 
10,학생때 본 영화중에 가장 기억남는 영화 
10,나도 그곳에 있고 싶었다. 영화보는내내 
10,명작은 죽지않아 ㅋㅋ너무좋은영화ㅋㅋ 
3,좋은 영환거 같긴 한데... 
8,난 머리속에서 많이 지워진걸 볼때 최고는 아니었다 
8,전혀 촌스럽지 않은 이OO전 영화 
9,일상적이나 일상적이지 않은 소년의 성장일기. 따뜻한 영화. 
10,여태본 영화중 머리속에 지워지지 않는다..최고다. 
10,잉마르가본현실에서비춰지는가슴찡하고따뜻한동화같은이야기... 
10,대략 20년 전 쯤 한 초등학생이 한밤중에 부모님 몰래 봤던 영화 
10,잼있다 
10,군말이 필요없을 정도로 좋은 영화 
9,자식들 귀여운데.. 
10,정말 시간가는줄 모르고봤다..100점줘도 아깝지않은.. 
10,14년전 사춘기 시절 본 여운이 아직까지 남아았는 영화 
10,잼나게 보다가 어느새 끝난 영화. 시간 가는 줄 몰랐음. ㅋ 
10,기분 만땅 
10,어린시절의 아련한 추억을 불러 일으키는 영화 
10,공감 100% 
10,내 어릴적 기억들 
10,귀엽고 즐겁고 코믹하고 슬프고 어둡고 순진하고 그런 세계 
9,개같은 내 인생. 그 누구보다도 행복한 내 인생. 
9,우주선이 떨어져 흙탕물에 빠져도 아주 좋은 그 날들. 
10,"자신을 라이카에 빗대는 성숙한 꼬마녀석 , "
10,어른이 될 수 있는 피터팬의 라이카같은 인생 
10,한번은 볼만한 영화 
9,너무 귀여운 넘들..아직도 생생해.. 
10,정말 좋은 영화 잉마의 연기도 멋지고 순수함이 독특하다 
8,순수함이 보여주고 생각하는 세상은?! 
10,따분할 줄 알았는데 참 재밌네요. 아이들이 너무 귀엽습니다. 
9,아이의 시선으로 전개되는 동화같은 영화.(좀어려움) 
10,나도 거기로 가서 같이 살고 싶다. 
10,아련한 내 유년기의 추억을 일으켜 세워줬다. 
10,어렸을쩍 나의 마음을 다시 되돌려준 영화^^ 
9,내가 좋아하는 스타일 
10,좋아........ 
10,"그 해 겨울은 아름다웠다,,,,, "
10,감동 
10,따뜻하다... 
8,재밌다 
10,"슬링샷, 정복자 펠레... 북유럽, 성장영화의 최고봉... "
9,유쾌하면서 가슴찡한 감동이 있는 성장영화 좋타~ 
9,어쩌면 개보다 못할지도 모를 인생..정말 재밌네.. 
10,정말재미있다 이영화을 늦게안 내가미울뿐 
10,재미 감동 모두 굿~ 
10,인간미가 넘치는 성장영화... 
10,스웨덴은 왠지 끌려. 소피의세계 알베르토아저씨가 나오네. 
8,감동적이었다^.^근데 화질이 매우 안좋아서 괴로웠다ㅠ 
10,이영화 정말 재밌어서 미칠지경이다..성장영화계의 최고봉!!! 
7,"지금도 가끔, 아니 자주 ..내 앞에서 귀막고 소리쳐.. "
10,오랜만에 이영화보고 마음의 평정을 찾은것 같아요 
9,"`영택`아~, 나 지금 봤어 ~ : ^^ "
10,잔잔한 감동을 일으키는 최고의 영화. 한편의 아름다운 동화. 
10,어릴적 보았지만 아직도 잊혀지지않는 감동의 여운 
10,최고다.. 왜이제서야 봤을까.  스웨덴영화에 관심이 가네. 
10,다시봐도 감동이 오는 영화..최고!! 
10,저도 중학교1학년때..주말의명화로 혼자보고..펑펑 울었어요.. 
10,아...다시보고싶다... 
10,웅~ 정말 동화같넹..^^ 아름다워요 
10,내인생에 이영화를 봤다는것이 행복합니다 
10,어렸을때 티비에서 보았었는데 아직도 머릿속에 장면하나하나가 기억이나네요. 
10,다운 받으려다 그냥 dvd를 사버렸다. 
9,엄마의 관심과 사랑을 갈구하지만 결국 화답받지 못하는 아이가 너무 가여우면서도 주변사람들로 인해 서서히 치유받는 모습이 눈물이 핑 돌만큼 아름답다. 
6,그냥 잔잔한 어느 소년의 사춘기 시절 이야기입니다. 다 보고 나니.. 뭔가 무미건조한 느낌; 
10,고등학교 2학년 때 주말의 명화인가 .. 토요일에 밤에 보고.. 보는 도중 녹화를 시작해서 시간이 날 때 마다 봤다.. 지금도 1년에 한 번은 보는 것 같다.. 정말 따뜻하고 푸근한 영화이다.. 지금 8살인 내 아이...
10,고등학교때 시골영화관에서 2편상영할때 한참 유행하던 홍콩영화 한편에 꼽사리껴 상영할때 본건데 홍콩영화는 지금 기억도 안나는데  개같은 내인생은 가끔 옜생각날때(가슴이 먹먹  해질때) 생각나는 영화 음악은 황치훈의 추...
9,"비슷한 주제의 성장영화들은 많이 있지만, 이만한 여운을 준 영화를 찾긴 힘들다. "
1,난 왜 이렇게 지루하지? 애들은 귀엽더만... 
1,평점이 좋아서 끝까지 보긴했지만 갠적으로는 공감이 전혀 안가고 지루했다 
1,글쎄요 전 참 지루하게봤어요. 지루한 나머지.. 뭔가 있겠지하며 끝까지 봤는데 결국 난해하더라고요./// 억지로 짜낸 감동이 없고 그냥 그대로 보여주는것은 좋았으나.. 너무 밋밋했어요.. 말그대로 주제의식없이 그냥 ...
1,꺔빵에 있는 박근혜  전기영화 
10,잉마르는 여자가 잘꼬여서 부러움ㅋㅋㅋ 
8,"순박하고 훈훈한 인정, 탁월한 표정 연기, 불행을 꿋꿋이 이겨내는 잉마르에 격려를.. "
10,아이의 눈으로 본 성장 이야기. 
2,내 나이 30..  너무 때가 묻은걸까.. 끝까지 보기 힘들다.. 
7,9점 까지는 아닌듯.. 
5,뭔가를 유추해내긴 싫다. 있는그대로의 영화를 받아들여본다 
4,도대체 뭘 말하려는 건지... 흔해빠진 성장영화 
7,"한국같으면 몇 번을 혼났을 악동, 문화차이를 빨리 인식하고 평정을 찾아야 영화에 몰입 가능하다. 별을 보며 자신의 상황과 유사한 사회현상을 나름 분석하는 꼬마철학자는 현실을 다각도로 인식하고 적응하며 때로 표출하면서..."
1,가슴이 어쩌구 저쩌구 ㅋㅋ 
10,"배우들 연기력 최고, 30년전에 제작된 영화라고 믿기지 않는 영화, 요즘영화에서 사라진 진정한 영화의 맛이 느껴지는 영화 "
4,드르렁 쿨쿨 
2,감동이 아니라 여자 젖가슴 영화겠지ㅋㅋㅋ 학교 극장에서 팔천 원에 상영하길래 봤는데 내 돈 돌려내라 사기꾼들아 
