score,review
8,로버트 레드포드 잘 생겼네 
5,"로이를 쏜 여자의 실체가 궁금...왜? 왜? 왜왜왜 쏸냐고요 -,.ㅡ "
10,"중2 올라가던 해 겨울에 처음으로 대한극장에서 본 영화,아마 할인권으로 본거 같네, "
8,지금 보면 다소 투박하지만 마지막 엔딩 장면은 최고다! 
10,와우 우연히 봤는데 매우 잘봤다 
7,모든 것이 적당하다. 나이든 미남배우의 표본 로버트 레드포드 
10,진정한 감동은 바로 이런 것! 로버트 레드포드의 눈빛 연기 압권 
8,"좋은 영화, 멋진 레드포드, 반가운 얼굴들.. "
10,다시보니 더새로운 
9,Homer at the Bat !!!! 
10,"잼있다 내일을 향해 쏴라, 스팅도 추천함 "
10,이것이 야구고 인생이다! 
10,"야구를사랑한다는레드포드의대사,자신의꿈과가족을사랑한남자.첫씬과마지막씬은최고! "
10,이거 왜 18세죠? 15세나 12세면 몰라도 
10,진짜 인생에서 한번은 봐야할 영화 
10,야구팬이라면 봐야죠.. 
10,야구와 인생의 관계를 가장 잘 표현한 명화 
8,ebs에서봤는데...넘재미있게봤습죠로버트레드포드넘멋져요 므흣 
7,좋은 영환데 좀 늘어지는 경향이 있다 
10,리그챔피언 최종전 감독과의 마지막대화 
10,중딩때 봤는데 굿굿굿... 
10,부모님 손잡고 봤던 영화 스토리는 지금에서야ㅠ거의 잊었지만 마지막 엔딩만큼은 최고였다. 
10,짠한 감동의 영화~주연배우들의 연기가 압권 
7,약간의 지루한 맛이 있다... 
7,사랑도 야구도 희미하게만 드러나는 영화. 레드포드의 멋진 스윙과 조명탑씬만 남는다 
5,흔한 야구영화. 레드포드의 미모. 
8,초중반부터 봤는데 재미있게 봤다. 내용 자체는 큰 이변은 없었지만.. 
10,역시 남자는 여자를 잘 만나야한다. 근데 이 영화 왜 18세임?? 
6,엔딩씬의 불꽃놀이만 기억에 남는다. 이젠 너무 흔한 스포츠 휴먼 드라마. 
10,화려한 볼거리보단 인간적인 감동이 있는 영화 
10,로버트 레드포드가 48살때 찍은 영화구나.. 중후하고 농후한 남자의 향기 
8,좋은 영화에 감동하자^^ 킴베신져 언제봐도 매력적 
10,Good good good 
9,최고의 야구 영화중 하나 
8,따뜻한 정서와 배우의 매력이 숨어있는 클래식한 멜로드라마 
7,1984년작이라 지금보면 좀지루하다. 
7,"미국식 자연스런 야구 감동, 모험 이야기. "
7,휴머니즘 야구 영화의 최고 정점. 전광판이 터질때 눈물 찔끔 한 사람 솔직히 많다 
7,마지막 장면이 꽤인상 깊었던 ~~~~~~~~~~ 
10,야구란 이런거다 하는것... 
10,인생의 진정한 행복이 무엇인지 가르쳐주는 영화죠. 
10,다른 스포츠 영화와 달리 짜릿하기보단 따뜻했다. 
10,재미있게 잘 봤습니다 마지막 홈런한방 정말 멋집니다 야구란 스포츠가 이런것이라... 
10,최고다 
6,"뭐, 이 정도면 괜찮은 거 아닌가? "
10,대박 재밌다 완전 감동이다. 
10,짱이네염 ㅎㅎㅎ 
10,중딩때 토요명화에서 보고...다시 비디오가게가서 빌려본...영화 ㅜㅜ 
9,"역시 야구, 역시 영화 "
10,쵝오임 
10,글렌클로즈의 존재감 만으로도 10점 
10,레드포드옹~~쵝오 
8,9회말이 이렇게 화려한 영화는 없었다 
8,야구 좋아하는 사람들을 위한 영화 대한극장 70mm 당시의 기억 
10,감동적인 영화..꿈을 찾은 프로정신을 갖은 야구선수.. 
10,아놔 이 영화 정말 좋던데.. 
9,감동적인 영화 
10,명작 
10,"최고의명장면,최고의감동,최고의열정 모두담은영화 "
10,멋진 인생을 멋지게 엮어낸 영화. 최고! 
10,잘생긴 레드포드와 최고의 시나리오~엔딩장면은 가히 압권 
10,역시..... 야구는 사나이의 로망이다. 
8,멋드라진 야구 movie 
10,내가 좋아하는 영화를 1점주다니 그래서10점 
9,멋진배우들과 멋진야구영화를.. 
10,이런 영화가 바로 명작! 
10,야구영화의 고전이다. 야구팬이라면 꼭 보라!!! 
10,참 말이 필요없다 
10,강추.. 말이 필요없는 명작.. 
10,OST구하고싶다. 
10,5번을 봤는데 아직도 슬퍼요 정말;;;;;; 
10,10점을 줄만한..내츄럴..인생은..아름다워... 
10,15년전 감동이 다시 올줄이야....대단함^^ 
10,20여년이 지난 지금! 또 다른 재미... 
10,환상의홈런 마하세븐!!!!!!!!!!!!! 
10,야구 영화 하면 떠오르는 영화. 어릴적 아주 재미있게 봐서 지금도 가끔 찾아 봅니다. 
9,괌에서 인천으로 오는 비행기 안에서 멀미도 잊고 본 영화. 
10,인생 영화중 하나.마지막 들판 캐치볼 씬은 뭉클함 
10,진정한 최고의 야구 영화입니다 
6,"남자는 여자를 잘 만나야 한다. 돌은뇬, 재수없는뇬은 걸러라 "
10,이 재밌는 영화가 평점이 이게 뭐냐 
8,"로버트 레드포드, 킴 베이싱어 너무나 빛이난다. 야구를 통한 감동 드라마 "
8,마지막 홈런씬만으로도 볼 가치가 있는 영화. 
8,야구에 대한 고전. 차분한 매력의 로버트 레드포드. 치명적인 매력의 킴 베이싱어. 
7,본지 오래 된 영화인데 마지막 홈런은 확실히 기억남 
9,공짜티켓을 받아서 친구랑 대한극장에서 토욜인가 일요일인가 자그만치 5시간기다려서 본 영화. 기다린시간이 전혀 아깝지 않았던 수작. 킴베이싱어가 중학교1학년이던 내 눈에도 너무 아름다워 보였다. 
9,최고의 야구영화. 천조국은  감동을 자연스럽게 끌어낸단 말야. 
8,"미국야구에 대한 히어로물인가?판타지…인생은 한방, 원샷원킬이라는 걸 알려줌. 느와르와 같은 총질,마지막에 극적인 홈런 그리고 갑자기 생긴 아들... "
2,미국판 외인구단이 여기 있었네 
9,"추가 각색으로 리메이크 됬으면 하는 1순위 영화!  10점 만점이 아깝지 않을 꿈과 나이, 인생의 시련역행을 고스란히 야구로 담아낸 각본과 레드포드의 삶애증이담긴 담담함은 싱크로를 높였다. 10점못준건 각색 필요한 ..."
10,누군가에겐 꿈이자 도전 혹은 아버지와의 추억 그리고 누군가에겐 가쉽과 돈일 뿐이었던 그 시대 야구의 의미. 야구란 스포츠의 가장 극적이고 매력적인 순간을 활용 앞서 말한 여려가지 상징적인 의미들을 담아 주인공을 통해...
10,이 영화를 보고 야구를 좋아했습니다.국민학교때 봄...ㅎㅎ 어떤 포지션이 되든 야구를 하고 싶어하게 만든 영화. 
10,로버트형 이때가  48세쯤~! 36세 야구선수역할을 해도 전혀 무방했던 외모~~브래드 피트보다 더 잘생겼네^^ 여튼 인생영화~정확히 이때부터 야구가 좋아졌지.. 엔딩은 그 당시 상상도 못했던 장관~!! 야구영화의 레...
9,반개 빠진건 초반의 레드포드가 좀...그리고 은총탄에 대한 결론도.. 
10,초등학생때 보고 큰 감동을 받은 영화. 아직도 첫손에 꼽고 싶다. 
8,80년대 영화 특유의 늘어지는 전개. 러닝타임을 줄이고 좀 더 압축적으로 보여줬다면 더 좋았을 것.. 전반적으로 잔잔한 감동을 주는 영화. 
10,내가 응원하는 팀이 한국시리즈 우승하는 기분이었다! 최고다~ 
9,그 어떤 영화보다도 화려하고 감동적인 마지막 장면.. 
8,WONDERBOY § 
6,그저그런~ 
7,"마지막장면은 언제 봐도 명장면,but테드윌리엄스와 전혀 상관없는 이야기 "
10,1점 준 인간들 뇌를 해부해보고 싶다 
10,"전 울고싶으면 이 영화를 보고, 또 웁니다. "
9,소시적 tv에서 꽤 재미있게 본 기억 
10,홈런의 감동... 
10,이영화 볼수있는 싸이트 알려주세요 너무너무 감동 ㅠㅠ 
10,말이필요없음 야구영화의고전 
10,시상에나...이렇게 감동적일수가...25년전의 감동이 그대로 
10,야구를 좋아하게 만든 영화.^^ 
10,내 인생 최고의 영화! 
1,저기여 환불해주시겠어요? 
6,큰 감동을 주지 못 하는 끝내기. 
6,리처드 판스워드 때문에 봤는데.. 26년전 영화라 그런지 연출이 좀.. 책으로 봐야지.. 
8,야구영화라서 좋았다. 예전영화라서그런지 큰재미는 그닥 
10,정말 좋네요 10대로써 10대 0%가 x팔린... 
7,not bad 
7,"9회 투아웃, 끝부분만 지나치게 강조한 늘어지는 야구영화. "
10,사랑하는 여자와 함께 보는 모습이 그려지는 영화 
1,내가왜 보고있나하는생각이들게하는 
1,전 화딱지나고싶으면 이영화를보고 또 화를냅니다 
5,러버트레드포드 나오면 왠지 졸림 
1,테드랑 전혀상관없는 허무맹랑한 스토리라인 
7,"밋밋한 전개와 상황정리는 최악 게다가 야구든 사랑이든 깊게표현되지않고 짤막하게 설명만 하는느낌.굉장히 아쉬웠다.다만,마지막 멋있는 홈런과더불어 조명탑이 깨지는 그씬은 잊을수가없다.배우들 열연도 좋았고.. "
6,완죤 만화네~ 
1,야구소재영화들중 걸작은없네.테마자체가 좁아터졌어. 
6,마지막에 전구 까부시는 장면 하난 건졌다.. 
6,"평점에 속지마시오.다른건 그런대로 봐줄만한데 중요한 총격사건은 밑도 끝도 없고. 마지막엔 억지 영웅 만들어내는 영화.지금으로 치면 비디오로 나와도 안볼 영화.스포츠영화 좋아하는데, 이건 1984년작 감안해도 쓰레기...."
