score,review
10,"리버 피닉스, 어리지만 진짜 멋있더라..... 눈빛이 다름 "
10,리버피닉스가 그립다.. 
10,재수할때 공부 해야 하는데 자꾸 빠져들게 해서 공부를  못힌게  했던영화... 추억이  새록새록... 지금 EBS에서 하는데... 얘들하고  집사람이  점점 빠져드는데... 
9,"친구,  그리고 추억 "
10,"어릴때는 중간 중간 보고 말았는데, 35에 보니 의미가 깊구나.. "
8,뭔 초등학교 졸업반 애들이 인생 절반은 살아야 할수 있는대사들을.. 
10,아쉬운 부분이 있긴 하지만 86년작인걸 감안하고 추억을 떠올리자면 그냥 10점 주고싶다 
10,웃고 울고 향수를 일으키는. .  명배우들의 과거모습 새삼스럽고 역시. . 어리지만 연기력은 진짜 출중. . 감동 그 자체. . 소년들 넘 귀여운 녀석들 나이들어보니 의미가 남다르네요 
9,초등학교 시절 항상 함께했던 친구 두녀석이있다 지금은 뭐하고 사는지 모르겠다 삼십대가 된 난 지금 새로운 친구들과 함께한다 시간이 흐르면 지금 있는 친구들도 뭐하고 사는지 모르겠지 친구란 잠시 스쳐지나가는 인연일뿐....
10,언제나 최고로 뽑는 내인생 영화 
10,어린 리버피닉스의 역할이 어찌나 어른스럽도 듬직하던지...어른인 내가 꼬마애한테 의지가되고 위로를 얻네 참... 살아있었으면 정말 좋은 영화 많이 찍고 있었을 텐데 ㅠㅠ 
10,"열 두 살, 친구가 아니라 인생을 사귀었던 시기.  우리는 미숙하지만  그때 이미  나름의 삶과 죽음을 배웠다.  ""떠난건 3일이지만 돌아왔을때 마을은 이전보다  부쩍 작아져 있었다."" ""그런 ..."
7,'친구란 스쳐가는 인연인 것이다.' 저 어린 나이에 그런 연기가 가능했던 리버 피닉스가 아깝게 죽었다는 것을 강하게 상기시켜 주는 영화다. 별 내용은 없는데 이상하게 울컥하게 만든다. 
9,난 이런 추억 돋는 성장영화가 좋더라.  훈훈하고 가슴 찡하다. 
10,인생영화중 하나...그리고 가슴을 파고드는 엔딩송 
10,영화에 나오는 노래들도 참 좋다 
10,20번도 넘게 돌려본  최고의 영화 
10,86년 당시에 소년들이 시체를 찾는 소재만으로도  대단한 발상이였다.지금은 워낙 쇼킹한 소재들이 나오니 지금 보면  지루할수 있는데 그때시절 소년들만의 감성을 담아낸것과 ost가 나오는 부분은 최고다 
10,성장영화의 대명사 
10,내 곁에 있어 줘 내 곁에 있어 줘 
9,뚜렷해서 더욱 그리운 어린 시절들 
8,인생에 저런 친구 하나 없던 내가 너무 서글프다 ㅜㅜ 
10,다시보구  다시봐도  너무  좋은...~~~^^ 
9,어릴적 이 영화를 보고 기찻길을 따라간적이 있다. 그들보다 멀리가거나 그들과 같이 함께한 이는 없었지만 그날을 잊지 못하고 머리속에 되뇌이다 약 25년만에 이 영화를 다시 보았다. 어릴적때의두근거리는 모험은 온데간데...
10,가슴 속에 많은 여운을 남긴 영화...무슨 이유 인지는 알 수 없지만...자꾸 보고 싶은 영화. 
10,숨은 보석을 찾은 기분이다.  어린시절 많은 추억들이 스쳐지나간다. 
8,"스티븐 킹의 소설을 로브 라이너가 성공시킨 또다른 수작. 리버 피닉스 외에 존 큐색, 키퍼 서덜런드의 10대 모습도 볼 수 있다. 중간에 '비계덩어리"" 얘기는 정말 웃긴다. "
10,그 시절이 그립다. 리버도 그립다. 
10,계속 생각나게 만드는 영화~   아이들 연기는  너무 리얼함~  대사 하나하나가 다 재밌고 감동있는 영화~^ 
9,"동네 형,친구들과 한강다리 건너 백화점가서 놀았던 것이 기억난다. 가는데만 2시간 걸렸었는데. "
10,아름답다! 
10,꼬마들에게서 인생을 배우고 간다... 
10,그때의 시절같은 친구들은 두번 다시 만나지 못했다는 말이 제일 인상 깊었다. 크리스 진짜 좋은 친구야ㅠㅠ 
10,이런 영화가 다시 나올 수 있을까? 
10,십몇년 전 고딩때 우연히 티비에서 봤는데 그때부터 내 인생 영화가 되었다 이 영화를 알게 되서 행복하다 
10,역시 다시봐도 리버 피닉스는 어렸을때도 멋있었다보고싶다 리버.. 
10,왜 리버피닉스를 그리워하는지 알겠어요~~~ ㅜㅜ 영화 자체도 명작이네요 
10,꼬꼬마 시절부터 카리스마 작렬한 리버 피닉스 
10,"리버 피닉스는 이미 크리스라는 옷을 입고 자라온 것 같은 착각이 들게 한다. 고디에게 그랬듯 나에게도 그 어른스러운 면모가 정신 붙들어 매라고, 뭐든 할 수 있다고 말해주는 정신적 지주같다. 아까운 별이 너무 빨리 ..."
10,12살에 만났던 친구들 보다 더 나은 친구들은 없었다 라는 마지막 대사 
10,청소년이봐야할 영화인데 청소년관람불가라는게 아이러니하다. 그리고 리버피닉스...엄청난 배우였다. 
10,내 인생의 최고의 영화다 
10,은근 띵작이네 ;;  그시절 걔네들도 추억을 회상하며 나를 기억해줄까 
9,아련하고 그리운 동내 친구 기억... 
10,지금 보면 아마 신작들은 왜 이렇게 명작을 못만드나 하는 생각이 들면서. 요즘 신작들 참 한심하게 생각들게 만드는 명작. 
10,걸작이에요 걸작 마스터피쓰!!!! 
10,어린시절 저렇게 돌아다니던 때가 그립다.. 그때 친구들은 잘 지내고 있으려나 
10,누구나 마음속에 소년이(소녀가) 있다. 
8,어린시절 눈빛부터가 틀렸구나. 
10,"어떤 사람이라도 가치없는 인생을 살아온 사람은 없다.다만, 각자의 색깔이 다를뿐. "
10,사춘기 아이들의 고민과 순수함이 묻어나는 잔잔한 영화인거 같습니다. Ost가 너무 좋네요. 흥얼거리게 되요^^ 
8,아 좋다. 그냥 다른 말이 필요 없네. 요즘 영화라고 봐도 수작이다. 카메라 영상이 정말 세련되었다. 요즘 디지털 기술은 쨉도 안된다. 아 그냥 잘 만든 영화. 좋네 좋아. 지금 다시 극잔에서 볼 수 있게 해줘서 고...
9,추억의 영화. 리버피닉스. 그리고 멋진 OST 
10,리버피닉스의 어린모습을 볼수있다 .어릴때도 연기는 죽여주게 잘한다.몇번을 봐도 또보고싶은 영화 
10,죽음은 언제나 우리 곁에 있다. 
10,인생영화지만 다시 보지 못했다. 처음 영화를 보며 느낀 감동을 간직하고 싶어서. 
7,지금은 연락 끊긴 초중딩 때 친구들이 생각났음 
10,사람은 추억으로 산다. 
10,명 화 명 화 명 화 명 화 명 화 
10,어릴적 많은 생각을 하게하는 영화수작입니다 
7,어린아이들의 추억이라고 하기에는 묵직한 무게감이... 
10,전형적인 80년대 영화리버 피닉스 오랜만에 봐서 넘 좋았고 존쿠석 어릴적모습도 정말신기 배경도 음악도 스토리도 모두 최고 
9,초딩 때 보고 부모로 부터 빨리 벗어나서 모험 다니고 싶게 만든 영화 현실은 시궁창;;; 
10,명작명작! 추천합니다.. 리버피닉스영화는 거의 다 봤는데 이 영화를 잴 좋아합니다 
10,"""너는 왜 죽어야만 했니..!""그들을 기다리고 있는건 포상금,영웅,등이 아닌 더욱 소중하고 아름다운 그 무언가였습니다..정말 여운이 깊게 남는 작품인거 같아요..어린시절의 추억들이 있는 모든 어른분들이..."
10,너무 슬픈 성장영화다.. 
10,진짜  생각해볼께 많은 영화 
9,누구나 가지고있을 어린시절의 향수... 리버피닉스 어릴때부터 연기 잘했구나 
10,모든 성장영화의 OO점. 리버 피닉스...정말 아까운 배우다 
8,본지 오래됬지만 리버피닉스애 눈빛만은 또렷이 기억나는 영화 
10,리버피닉스에 대한 그리움이 더 커지는 영화 
10,피닉스 연기가.. 정말 작품에 빨려들게 만드네요.. 너무 아까운 사람..ㅜ 
10,리버는 어렸을때부터도 눈빛이 참 아련했던 것 같다. 
10,리버 피닉스 정말 아까운 별이 일찍 지고 말았어 
10,아 정말 오랜만에 가슴 훈훈해지는 이야기였습니다 리버피닉스의 옛모습도 좋네요 
10,우정 영화의 달인 로브 라이너 감독에다가 어린 나이에 섹시하기까지 한 리버 피닉스의 멋진 조화. 아름다운 스토리. 최고의 성장영화라고 할 만함. 로브 라이너 감독의 <플립>도 강추. 
10,"내가 어렸을 적, 테디처럼 기차(도로)에 쳐죽을 거같은 똘끼를 부리던 내 모습, 담장을 넘기 쉬웠던 남의집의 창고를 비밀기지로 삼아 놀았고 가정환경이 불우한 친구까지 주변 환경은 서로가 달랐지만 모여있을때 만큼은 그..."
10,"""내가 이상해?""""응""""내가 진짜 이상해?""""그게 어때서? 다들 이상하잖아"" "
10,하아 드디어 다시 봤다. 감동 ㅠㅠ 
10,R.I.P 리버 피닉스 
9,세월에  의해 잊혀진 명작입니다. 꼭 보세요. 
8,이야! 노래가 너무 좋네 원래 제목은' 더 바디'였는데 '스탠바이미'라는 노래가 너무 좋아서 이 제목으로 바꿨다네요. 
10,리버 피닉스가 나를 회상시켜주기엔 충분하다. 
10,식후에 담배맛은 최고야  애연가라면 심히 공감할만한 부분 
9,뭔가 말로 설명은 안되지만 볼때마다 아련한 영화. 왠지 슬픈 영화. 
8,어려서 걱정없어 좋겠다는 얼마나 어른의 착각인지. '마을은 작아져있었다' 
10,어릴적 그렇게 경험해 본 모험은 분명 삶의 가치관을 형성하는데 큰 밑거름이 될 것이다. 그래야 한다. 어려서 그렇게 많은 경험을 해봐야 하는 것이다. 그렇게 이 영화는 의미있는 성장영화다.  이 영화의 주인공들이 지...
10,정말 인상깊었던 영화. 보고나서 여운이 깊었던... 
9,향수로 범벅된 영화. 내 초등학교 친구들 보고싶다! 
10,내 인생 최고의 영화 중 하나 
8,먀치 동심으로 돌아가는듯한 재미가 있었네요 캐릭터 들도 좋구요... 
8,웬더나잇~ bgm들으면 철길 걷는 꼬마들 생각나는 영화^^ 
9,두번 세번 봐도 아름다운 영화. 
8,이영화 볼때마다 어릴적에 친구 생각나게 만드는 영화 
10,나이를 먹어감에 더욱 그리워 지는영화 어린시절로 돌아가고 싶네요~ 
10,추억돋는다... 어린시절이 너무 그립다... 
9,이들에게는 크고 중요한 여정 
10,가히 성장 영화에 최고봉이라 할 수 있습니다. 항상 소장하고 있어요. 무엇보다 배경이 최고에요.. ^^ 
10,진한  여운이 남는다.12살적  친구들은 지금  뭐할까? 
10,친구들의 우정을 다시 보는 영화.... 
9,"이영화 예전에 봤는데, 정말 감동적인 성장드라마 "
10,내가 본 최고의 모험.성장영화. 많은 것을 생각하게 해 준 고마운 영화다. 
9,B급배우 윌희튼 리즈시절 쩔었구나.. 빅뱅이론보다 뭔가해서봤는데.. 이걸 32에보다니..ㅠㅜ 
10,감성에 젖게하는 영화. 이래서 옛날영화가 좋아 
10,추억. 
10,아이들의 모험영화. 순수한 동심의 세계를 봐서 즐겁다 
9,네이버 영화등급 고치세요.아름다운 성장영화가 19세라니.못본사람은 남녀노소 꼭보세요 그리고 스탠 바이미를 들으세요! 
10,최고다 이영화 ㅠㅠ 
10,최고지 이영화 
10,최고다  어린시절을 돌아보며 추억하게 만든 영화다 
7,리버피닉스의 어린시절 
7,리버 피닉스 보는 맛. 
10,인생에서 다섯손가락 안에 꼽을 영화다 
10,명작이다..ㅠㅠㅠ 
10,또 보구싶다..20년전에 본영화. 아쉽네여~ 그립네여리버피닉스.. 나도그들친구되고파~ 
10,마지막장면이 참.. 
10,리버피닉스였구나 으아 
10,나도 이때로 돌아가고 싶다.. 리버 피닉스도 보고싶고 
10,5번도 넘게 봤어요.. 리버피닉스를 알게된 ... 좋아하는 영화입니다^^ 
10,반항적인 눈빛의 소년 리버 피닉스를 보는재미 
9,리버 피닉스가 그립다.. 
10,감동있게 봤다.. 나중에 주인공남자애가 리버피닉스란걸 알았을때 완전 소름.. 
7,잭 바우어 리얼 깡패네 ㅋㅋ 리버 피닉스 너무 아깝수.. 
10,10점을 줄 수 있는 정말 몇 안되는 영화중 하나!!1 
10,"될 성 부를 나무는 떡잎부터 다르다더니...아... 그런데 리버 피닉스를 생각하면 늘 안타까움과 슬픔이 따라 다닙니다.  리버가 살아 있었다면 헐리우드 수많은 남자배우들의 운명이 달라졌겠죠. 과연 지금의 디카프리오,..."
7,구니스를 연상시키는 모험물. 
8,풋풋했던 어린시절을 회상하게 만드는 성장영화...리버피닉스는 어릴때부터 눈빛이 남달랐구나...4명의 소년들 중에 유독 그에게서 아우라가 느껴졌다... 
10,스티븐킹 의 사계 단편 중 가을을 그 옛날 이야기를 잘 다룰줄 아는 감독 롭라이너거 만들어낸 명화. 산토끼 토끼야 어디로 가느냐---그립고 아름답고 아픈 이야기들이여 
8,원작의 느낌보다는 약하다. 그래도 충분한 영화. 스탠바이 미와 잇은 내게 최고의 소설이다. 
8,서로를 공감하며 우정을 쌓아가는 친구들의 모습이 보기 좋았다 
10,
9,내 12살에도 이런 친구들이 있었다. 방과후는 물론 주말에도 함께한 친구들. 한달동안 입원했을때 매일같이 병실에 찾아와 놀다가던 친구들. '12살 때의 그 애들 같은 친구가 나에겐 다시는 생기지 않았다....
8,"can’t do that “stand by me” forever,and so i miss her. "
9,"친구는 어느새 지나간다지만, 어릴 적 친구들 같은 친구들은 다시는 만날 수 없었다. "
10,언제 봐도 항상 새로운 정말 명작 
10,리버 피닉스 그는 왜 떠났을까 그리고 영화에서 보여준 모습들이 왜이리 쓸쓸할까. 그 시절 그 친구들은 누구에게나 있었던걸까.  그리고 제리 오코넬 진짜 깜놀.. 진짜 잘컸다. 키퍼 서덜랜드도 저렇게 잘생긴 사람이었다...
10,인생영화 
9,원작이 스티븐 킹이였구나.. 
9,짧아서 좋았다고만 하기엔 나머지 요소들이 훌륭했던 영화.  아역들의 로드무비와 처음과 끝의 나레이션들. 다 좋았다. 
10,다섯손가락  들어가는 영화 
10,잔잔하게 흘러가지만 주인공들 연기가 다했다 잔잔히 웃기고 재밌음 좀 공감가는 부분도 있고 ㅠㅠ 그리구 리버 피닉스 진짜 존잘이다 왜죽었어 ㅠㅠㅠ 
9,어른이 보지 못하는 가치를 볼 줄 아는 사람이 친구라고 말하는 영화. 
8,다시 돌아올 수 없는 시절과 아련함 
10,윌 휘튼... 어디서 들어봤는데 누구더라...? 앜ㅋㅋㅋ 쉘든 ㅋㅋㅋ케 
10,"다 보고 나니 한국영화 써니가 생각남. 아마 써니가 모티브로 삼은 영화 중 하나라고 생각됨. 고전 명화답게 주연 배우들의 연기와 연출, 배경음악이 좋음. 다만 스토리는 다음 장면이 뻔히 예상되긴 함. 체호프의 법칙에..."
8,케이블카보다 등산을 선호하는 이유 
10,어린 날의 추억하며 그리운 친구들을 떠올릴 수 있었던. 꼬맹이들 연기가 압권 
8,마을이 작아보였다..그렇게 성장한 것이겠지 
10,나의 12살 그리워진다 
10,"무슨 인생의 반년도 살지 않은 아이들이 인생을 찌르는 얘기를 할 수 있냐지만, 12살의 거름망 없는 순수한 눈으로 본 세상이라 그런것이 아닐까. "
8,지금도 잊혀지지 않을 그때 우리의 성장담. 
7,Stand By Me... 
10,그떄 그 시절같은 친구들을 다시 만날 수 있을까 아마 그렇지 못할것같다 
10,와 영화제목 드뎌 찾았네 ㅋㅋ 
10,초딩때 토요명화로 봤던 기억이 청불이었구나..나이가 들어서도 생각나는 영화.. 
10,"마지막 회상하면서, 이런친구를 다시는 만나지 못했다고 키보드를 두드릴때, 울컥했다. "
10,미칠듯한 몰입도로 정신 없이 봤던 영화. 
8,스릴러 거장 스티븐킹의 성장영화 
8,시체를 보고도 아무것도 할 수 없던 무기력함과 뿔뿔이 흩어져 집으로 가는 순간 끝나버린 일탈  아이들은 자신이 어른이 될 수 없다는 것을 그 때 알아버렸다.단지 과거 회상 영화로 보기엔 아깝다. 이리고  별 것 없는...
7,왠지 주인공 아이들과 함께 여행을 다녀온 듯 한 기분. 
7,학창시절에  기억을 한번쯤 되새기는 영화 철없던 아이가 철없던 친구로서 성장해가는 모습은 이젠 볼수가없다 
8,부담 없이 편안히 볼 수 있는 추억의 세계. 어느 친구 집단이건 동심에선 한번 있을 법한 이야기입니다. 
10,미성년자관불인 킹대인의 미성년자 성년영화. 
10," 나의 성장일기와 비슷한 내용이다. 중학시절 동내 사총사, 말성꾸러기들,30여년이 지났어도 모이면, ㅎㅎ 그때 그시절로 되돌아간다 "
10,친구... 
10,기분이 이상하다 한감정에 오래붙잡히지않고ㅇ무덤덤하게 끌어안을수있는게 추억이란건가 이상한기분이다 
7,어린시절 추억을 떠올려보는데에는 이만한 영화가 없겠지만단편소설인 원작에 충실하려고 애써그런지 모르겠다만.. 앞뒤 플롯이 매끄럽게 이어지지를 못하네요 
10,내  친구는 초등학교 3~4학년 때 이 걸 최고의 영화라고 했다... 나는  20대 후반에  느낀 것을~ 그 놈은 지금 뭐 하고 있을까??.... 
10,영화도 명작이고 책도 베스트셀러 ! 
9,여운이 남는 영화.. 
10,어린시절의 친구들이 그리워진다. 그리움. 추억. 하나만의 이유로  지금이라도 모험을 할수있을까 
10,이거 너무 여운이 심해 ......에고...ㅠ 
10,오늘스크린에서보고있음. 
10,성장의씁쓸함과 시간이지난다는게 아쉽고 외롭게만 느껴졌다 하지만 그건 피해갈수없는 현실이고 그러기에 더소중함을 느끼게해주는 영화였다 단순하지만 진부하지않은 여운이 나를 기분좋게 해준다내가좋아하는 감독 롭 라이너의 연출...
9,좋다. 이제껏 본 성장영화중 최고임. 십여년 만에 연락이 온 오래전 친구가 생각난다. 다시 만나려고 했는데 추억으로 남겨둬야 하나.. 
10,마지막 장면과 OST 의 여운이 깊게 남는 가슴이 따스해지는 영화... 
10,오늘 스크린에서 처음 봤음 
10,다시는 돌아 갈 수 없기에 그토록 아름다운 건 아닐까 ? 추억이란 세월이 
10,삷을 살아간다는것 
8,이제는 추억이 된 어린 시절의 우정을 다룬 최고의 성장 영화 
9,아이들이 성숙하는 과정을 크게 무겁진 않게 그려냈다. 
7,아까비.. 기대엥 못미침 *_ㅜ 
10,역시 어렸을때의 우정이 계속 유지되는것은 불가능한 일인가? 
8,이 영화가 좋다면 국산영화 9살인생도 재밌게 볼듯 
8,호밀밭의 파수꾼 
10,방금 스크린에서 보고왔는데 12살짜리가 담배ㅕ ㅋㅋㅋㅋ 
9,무슨 말이 필요해 
10,잔잔한 영화 입니다. 스티븐킹 최고 
10,내가 제일 좋아하는 영화당 최고 최고 넘좋아 
6,어른들의 최고의 향수자극제 데니스루헤인을 굽어보는듯하다 
8,"리버 피닉스, 존 쿠삭, 키퍼 서덜랜드 ㅋㅋ "
10,굉장한 수작이다. 
10,언제 봐도 다시 봐도 웃음과 눈물이 나게 하는 영화 
10,최고..여운이 남는 좋은 성장영화 
8,친구야...보고싶은 내 친구야...이제는 돌아오지 않겠지... 
10,키야~ 재밌었다 어렸을 때 어렴풋한 기억의 '토'씬이 이 영화였을 줄이야 ㅋㅋ 
10,그냥...조았다..정말....^^ 
8,다 자기살길 다잘살고있겠지 
10,우연히 보게된 영화.. 옛시절을 떠올리게하는 즐거운 영화였다. 
10,"어릴쩍 시골 정경과 아이들과 무지개를 따라 숲과 벌판, 냇가를 건너 탐험을 떠나.. "
9,"세상은 넓었고 궁금한건 많았고 빨리 어른이 되고싶던, 돌이켜보면 너무 좋았던 시절 "
10,"군대가기전 분당까지어릴때친구들 불러넣고 다시본영화, 7년전이나난영원히기억하겠지 "
8,"좋은 영화지만, 원작소설이 90분 영화를 채우기엔 좀 짧은 이야기였다. "
9,나도 모르게 잊어버린 소중한것을 깨우쳐 준다. 주옥같다고나 할까? 
8,스티븐킹의 원작소설을 읽어보고 싶어졌다. 감흥깊은 성장영화 
10,보면서 자꾸만 웃음나는 영화..어린 아이들이지만 멋있는 그들 
10,그옛날 어린시절에 봤던영화.. 지금도 기억속에 뚜렷이 남아있다.. 
9,성장영화들의 OO점이자 모티브가 된 영화인듯.. 애피소드가 좀 짦은게 흠.. 
10,그 애들 같던 친구가 내겐 다시는 생기지 않았다. 그런 사람이 있을까? 
9,퀄리티 있는 이야기와 주제곡 스탠 바이미 만으로도 가치있는 
10,참 좋다~ 
8,"Jesus, does anyone? "
10,단연 최고의 성장 영화! 아 아스라하고도 아련한 ~ 
10,어린시절 추억이 생각나는 영화. 스탠바이미~ 노래도 좋구나 ㅠㅠ 
10,이런 아련한 영화 좋아함. 근데 이거 왜 19세 ?? 
10,원작을 읽고 싶어지는 영화~ 원작을 안 보고 읽어서 최고평점 주고 싶어요 
10,아...리버는 저 어린나이임에도 슴가근육이 참 크네ㅋㅋㅋ 
10,아...좋네요 좋아 
10,고디와 크리시의 우정보다 더 값진건 세상에 존재하지 않겠지 
8,좋은 영화이긴 하지만... 원작소설을 읽는게 더 나을까 
10,친구에 대해 깊게 생각해게 해준 영화 
10,맙소사 
10,사고로 죽은 형이 존 쿠삭 같이 보이던데 여기는 정보가 없군요 옛 추억이 생각납니다 
10,영어수업때문에 봣는데 감동적이었다 
10,스탠바이미~ 노바리노오우~ 웨잇츠 거너비~ ♪ ㅋㅋㅋ 
10,여운이 깊게 남았다.. 
8,달콤했던 유년시절로 추억여행을 떠나다. 
9,"Stand by me, Stand by you "
8,성.장.영.화. 기대보다 조금 심심하다. 
10,20년이 넘게 기억에 남는 영화 
10,좋네요 
7,요즘 영화에 길들여진 저로써는 OST가 가장 기억에 남네요 
10,안녕 리버피닉스 
7,재미있게 봤다 고인이 된 리버의 어릴적 모습을 볼 수 있음 
7,괜찮은 아동용 모험영화.. 음악은 너무 편안했다.. 
10,20년전에 비디오로 보던 기억이... stand by me를 듣다가... 
10,재밌죠.......... 
10,진짜재미있게봤는되...또보고싶네여 
10,추억에 빠져들게 하는 영화... 근데 이게 왜 18금? 
9,아~ 친구가 있어서 행복한 것 같다 
10,좋다 이렇게 좋을 수가 없다 
10,여운이최고 여행가고싶다 
10,재밌었던 영화. 
10,열심히 찾아서 본 보람이 있었습니다^^ 과연 최고의 연기와 연출 
7,그럭저럭 볼만한 영화. 평점9.39는 아닌듯 / 많이 줘야 8점 정도. 
8,내가 너무 커버렸나? 왜 감동이 크지 않지? 
10,어릴적 이영화봤는데... 왜 18세 이상인가요? 다시 보고싶은 영화중 하나예요. 
10,"덤덤하게 성장해가며 덤덤하게 잊어가는데, 가슴은 이리도 아린지 "
10,대체 이 영화가 왜 18세인지 저한테 논리적으로 설명좀 해주실분? 
10,보면서 내내 실실 웃음이 나오는 영화. 내가 본 성장영화 중 단연코 최고. 
10,악수하자 
7,평점때문에 기대가 컸었는데 TT... 리틀맨하탄이 더 나은 것 같네요. 
10,한명쯤은 있을 기억에남을 영원한 친구.. 만점을 안줄수가 없다 
8,어린시절 나를 모험으로 초대했던 영화 
10,살아오면서 최고의 영화를 열가지 꼽는다면 단연 세손가락 안에 든다. 
10,본 사람들은 다 아는 영화. 
10,처음으로 엔딩 크레딧을 끝까지 본 영화.... 여운도 많이 남고...강추 입니다~! 
10,너무 사랑스럽고 쓸쓸하고 귀여운 소년들이여! 
7,무언가 특별함이 없을듯 있다. 그것이 매력있는 영화라는 증거.. 
10,괜시리 친구들이 다시 보고 싶어졌다.. 
10,초ㅣ고 
10,너무 좋아 ㅠㅠ 진짜......최고의 영화!! 그어떤영화보다...이것이 진정한1위영화! 
9,아..나..어이가 없네..이영화정보보려면 19세인증해야된다..네이버야..개념은? 
10,누구나 갖고 있는 어린시절 아득하지만 잊지못할 추억.. 최고의 성장영화. 
9,영화 뒤에 남는 이 쓸쓸함은 뭐지..? 그립다! 소년의 날들이여... 
9,어릴적 친구들과의 추억은 그 어느 것 보다도 값진 선물일 것이다. 
10,아무생각 없이 봤다가 정말 눈물날정도 최고에요 
10,잊혀지질 않을 영화가 될것같다. 가슴이 찡하고 애틋하고.. 아이고 참 묘하다 
10,제목도 주인공은 더 모르고 끝까지 본 영화..먹먹함과 희망이 남았었지.. 
8,지금 장난하냐? 
10,왜 이렇게 가슴이 아픈지. 
10,누구나 그리워하는 어릴적 친구 
10,누구나 그리워하는 어린시절 
10,누구나 꿈꾸는 어린시절. 
10,"어른이 된 지금의 내가 하는 어릴 적 이야기, 지금의 나도 이런 소중한 친구가 있나? "
8,친구들과 추억이 만났을때. 현대인들이 가장 목말라하는. 
8,친구란? 나의 어린시절 추억은? 인생이란? 나이가 많이 들어서 다시한번보고싶다! 
10,어떻게 보면 단순한영환데.. 어릴적친구를 되새겨주는 좋은영화.. 엔딩곡도 좋고!! 
9,그렇게 슬픈 내용은 아닌데.. 가슴이 저린다. 
