score,review
8,불쾌한 감정은 사실이다 
10,카잔차키스 스콜세지 두 사람 모두에게 경의를 
10,굳이 종교적인 생각을 갖지 않고 봐도 된다. 인간적인 드라마로 보면 좋다. 
9,예수모독이 아니라 교회모독이지. 예수의 신성을 니들이 언제 그렇게 생각해줬다고? 
8,'It Is Accomplished' 와 함께 울려퍼지는 피터 가브리엘의 음악만으로도 가치있는 작품. 
10,그리스도  최후의 고통은 단지 인간으로써의 평범한삶이였다. 그분은 세상을 구하셔야했기에... 
10,"모든 이가 성역으로 알고 있는 금기사항을 이렇게 돌려서 생각할 수 있다니! 감독의 기발한 상상력과 천재성, 그리고 독특한 아이디어에 박수를 보낸다. "
10,오해의 소지가 있어서 개봉도 하기 힘들었다고 하는데.. 인간으로써의 고뇌를 보여준 영화라는 점에서 너무 와닿았다. 
10,기독교를 알고 영화를 알면 꼭 봐라. 
10,너무 과소 평가되는 영화.... 
10,띨빵해보이기까지 하는 인간적인 모습.. 흥미로웠다. 
8,처절한 고민끝 사탄의 유혹을 물리치다... 결국 찬양인데 이정도가 파격 or 불관용? 
10,니코스 카잔차키스의 소설을 읽고 영화로도 제작이 되어 있다 해서 보게 되었다. 예수가 실제로 십자가 형을 피해 도망가 유럽에 정착해서 살았다는 이야기는 이미 오래 전부터 유럽에서 떠도는 이야기였다. 그걸 소재로 광야...
9,"완전무결한 신성 예수가 아닌, 지극히 인간적이고 우리네 삶속에 있을만한 한 사람이자 인생을 살아가는 사람으로서 겪을 수 있는 모든 기쁨, 슬픔, 고통, 시련, 도전, 그리고 유혹까지 전부 표현해내었다. 인간적인 시련..."
10,니코스 카잔차키스의 예수 평전 
10,유연한 생각은 언제나 논란을 부르지만 즐겁다. 
7,"니코스 카잔차키스를 읽어야 하는데,,, "
6,나약한 인간이기에 그 나약함을 이겨냈기에 그의 희생은 숭고한 것이다. 
7,나머진 그저 그렇지만 후반부 약30분 동안의 진행이 참 놀랍다. 
8,이걸 반기독교적 영화라고 매도하는 사람이야말로 이단 아니냐 
10,It is accomplished! 나는 무신론자다. 그렇지만 피터 가브리엘은 단한편의 ost로 모든것을 다 이루었다. 다시는 나오지 않을 나올수 없는 가장 완벽한 영화음악. 엔딩곡 It is accomplished...
8,"신앙이란 십자가를 짊어지고 삶이란 골고다 언덕을 기어 오르는, 피와 살로 이루어진 나약한 피조물. 바로 우리들. "
10,"처음부터 전지전능한 예수라면, 사탄은 절대 유혹을 주지 않았을 것이다. "
7,For Whom The Bell Tolls 
1,그냥 3류 판타지 영화일 뿐이네... 
10,기독교인들아 너희들의 스승인 예수처럼 편협되지 않은 시선으로 세상을 바라봐라 
10,별점테러하는 예수쟁이 개독들아 니들이 하는짓이 개신교신자들 욕먹이는거임ㅋㅋ 
8,악마의 유혹은 강렬하다... 
8,"노골적이긴하다. 마지막에 들려오는 섬뜩한 비명까지, "
9,"신화의 인간적 상상, 아름다운 예수의 마음. 과연 사랑이란, 사랑이란.. "
10,좋은 영화. 음악도 멋짐. 
10,인간으로써 행복하구 감사하라 느끼는 무언가가 있다 
10,진정한 예수의 참모습을 기대하면서... 
10,인간적인 면모를 볼 수 있는 영화 
9,카잔차키스의 작품을 그가 어떻게 다시 보여주는가..그런거.. 
9,"예수는 신의 아들이라서가 아니라 ""인간"" 이었기 때문에 더욱 존경할 가치가 있다 "
10,종교를 떠나서 재밌는 영화다. 배우들의 훌륭한 연기도 최고 
10,신성모독을 떠나서.. 영화로서는 참 잘만들어진 영화 
10,나를 천주교 신자로 바꾼 영화. 예수님 당신을 영원히 사랑합니다. 
1,쓰레기!! 너무 인간의 모습에 치중해 원래적의미를 퇴색시킴 
10,울면서 본 영화다. 
1,성경과는 전혀 다른 소설이다... 
8,십자가사건의 평행우주. 
9,소름. 영화 속 예수와 같이 뒷통수한번 제대로 얻어맞았다. 
9,너무 어려운 작품인듯.. 
10,기존의 예수의 표현에 있어서 새로운 지평을 연 파격적인 작품 
10,새로운 생각을 가지고 볼 수 있어서 좋았음 
5,이거 개봉할 당시만 해도 사회적인 반향이 엄청났었는데.. 뭐라고 해야 하나 
6,허~! 
10,초문제작이면서 동시에 초걸작. 예수의 인간적인 고뇌는 가슴깊이 공감 
6,딱 스콜세지의취향이드러나는작품.원죄적욕구와이에대한탐구를상당히즐기는것같다 
10,멋지다. 스콜세지~~ 
6,무엇을 위해. 
10,대단하다는 말밖엔... 생각해볼만한 영화다 
10,이 것보고 울었어.기독교인의 마음이 담긴 영화 
10,잘 봤습니다. 
5,"인간적인 모습의 예수, 신선하기는 하나, OO 마리아와의 정사신은 충격적 "
7,새로운 시각의 `예수` 
10,"예수님 사랑합니다,, "
10,많이 잔인하지만 Q의 진실을 안다면 너무도 가슴벅찬 영화였어요. 
10,정말 good 
8,"철처히 인간으로 바라본 예수의 내면을 상상해보는게 신선했다. 종교 교리를 떠나서 인간으로서의 갈등, 공포, 부담감을  생각해 볼 수 있었다 "
10,하느님의 아들 예수 사람의 아들 그리스도 
3,주제의식만 정확히 전달하면 될것을 말이 너무 많다 
4,마틴 스콜세지의 과감한 시도 
10,"인간은 종교의 자유가 있으며, 어떠한 종교도 깔 수 있는 자유가 있다. 사상의 자유 표현의 자유 "
10,이거 반기독교 영화 아니예요 
10,20년간 교회에 나간 것보다 이 영화 한편이 내 생각을 더크게 변화시켰다 
10,'신성'이 아닌 '인성'으로서의 예수. 그래서 멋있었다 
1,근거 빈약한 영지주의 신학으로 얼버무린 졸작! 
10,부활한 것만 중요하고 왜 그가 성자인지 모르는 우매한 자들에게 반발을 일으킨 명작 
1,왜 만든걸까? 어떠한 의도가 있었던걸까? 이런 생각이 드는 영화 
1,못됐다 이런 나쁜! 
1,할 말 없음 
10,^^ 멋져요 
1,"인간적인 예수가 아닌, 인간화한 예수의 모습. "
8,인간적인 면에 대한 이해가 있으면 신실함도 더 깊어질 수 있다. 
1,이 영화는 몰몬교가 주장하는 예수님이 결혼했다는 결혼설을 이야기 하는 것 입니다. 진정한 크리스쳔들이라면 딱 보면 아시겠지만 문화에 약한분들이 계실 것 같아서 글올려봅니다. 이건 이단 종교의 이념을 바탕으로 한 영화...
6,마틴 스콜세지도 어쩔 수 없는 종교 성인 다루기. 평이한 삶을 사는 후반부 스토리도 예측 가능한 범위. 폰티우스 필라투스 역에 데이빗 보위라니! 
7,결국 인간 일 뿐 
10,"당신이 야한거 보고 간음하는게 신성모독, 영화는 크리스찬이 겪는 모든 유혹아닌가? "
10,인간의 욕망과 감정을 가진 예수. 기독교인들이여 이게 왜 반기독교적 영화인가 
10,예수도 성자 이전에 인간이었더나? 
10,반기독교영화가아니다.오히려신앙에대해돌아볼수있고여러모로생각하게해준다 
10,"못박힌 후 29분을보고 기절하는줄알았지만, 그 후 1분을 보고 무한감동을 느낀 1人 "
9,종교란 신의 존재론으로 누비는 종교인들의 기득권은 아닐지? 
8,한번쯤 생각해 볼만한 
10,대단하다! 
10,휼륭한 영화입니다. 
10,책으로도 읽었지만 예수는 인간이다. 신이 아니다. 
9,눈 앞에서 목격하는 인간미 
10,가히 최고다~! 
8,"같은 예수를 주제로 한 영화 ""패션 오브 크라이스트"" 에 비하여 월등한 작품성을 띈다고 생각한다. "
1,불결한 악마들이 노아의 자손들을 나쁜 길로 인도하여 죽이기 시작했다. - 제2의 창세기 10장 1절 말씀 - 
1,성삼위이신 예수의 측면이 아닌 연약한 인간화를 부각시켜 왜곡의 소지만 남겨두었다. 
1,알지도 못하는 것들이 어디까지 떠들까.?? 
1,저주받을 영화! 
1,감독이 신보다 더 우월하다는 것을 보여주고 싶었던거냐? 무지하긴.... 
1,음.... 예수님을 평범한 인간으로 만들다니 
1,볼 필요 없다 
6,절망에서 끝났더라면 더 와닿았을 것 
9,기독교 교단이 가장 두려워 하는 영화(난 기독교인) 
9,저런 신이라면. 저런 인간이라면. 가슴 벅차게 사랑하고 싶다. 
1,진짜 스토리도 연출도 최악이야 어떻게 이딴 영화를 만들 수 있는거지? 예수님에 대한 발칙한 상상력을 기반으로 만든 영화라고?? 아니 이건 신성 모독이고 기독교 모독이며 예수님을 욕되게 하는 최악의 영화일뿐이다 
4,"예수가 진짜 신의 아들인지 당신들이 말하는 그냥 ""인간"" 인지는 언젠가는 밝혀지겠지 니네들이 죽은후에 "
4,하나님아버지께서는 이세상모든만물을창조하셨고 하나님아버지의 아들 예수그리스도를이땅에 보내셔서 지옥갈우리들의 죄를 대신하여 십자가에 못박혀 장사한지 3일만에 죽은자가운데서다시살아나셔서 부활하셨습니다.예수님은 예전에도살아...
1,지저분한 영화다 재미도 없고 기독교인이면서 예수님을 진실로 믿는 자는 이 영화를 보지 말라. 전혀 기독교적이지도 않고. 마귀의 것이다. 이 영화는. 처음부터 마지막까지 모두 마귀의 것. 예수를 포함한 전원이 마귀를 ...
1,원래 역사를 뜯어놓고 이게 표현의 자유입니까?그리고 마지막에 보면 아예 기독교에 대한 시비가 만연한데? 
1,기독교에서 가장 중요한것이 십자가에서 죽으시고 죄가 없어 부활하신 예수그리스도다 그래서 우리는 예수그리스도를 믿고 따르면 영생을 얻는것이다. 그것을 훼손하고 부인하는 영화가 당연히 신성모독일뿐만 아니라 악마가 만들었...
1,그리스도인들은 이사탄적인 영화를 보지마세요 처음부터 끝까지 예수님이아닌 다른 예수 즉 사탄이 주인공인 사탄 영화입니다. 
10,"씁, 이러니 예수쟁이 소리 듣지(평점회복용) "
1,어릴때 티비서 보고 기분나빴던 이유가 있었군..이건 예수님이 아님 
2,"과소평가되어야 마땅한 삼류쓰레기영화라는 단어조차 사용하기 아까울 정도의 쓰레기영화,  크리스천들은  잘 알겠지만,왜곡된부분이 너무 많으며  영화를 만든 감독의 의도를 묻고 싶어지는 줄거리. "
1,"이 영화는 잘못되었다. 그 이유는 내용 자체도 오류가 있으며, 예수님은 인간의 몸으로 오신 것은 사실이지만 육신만 인간과 같을 뿐이지 예수님은 영적으로 거룩하신 분이시다. 감히 이런 영화를 만든 자는 나중에 하나님께..."
