score,review
10,세 개 술잔 중 독잔이 아닌 것은 하나. 그 중 하나를 골라 마신 후 적진을 빠져나오며 '울지마요. 당신이 울면 보보와 나의 죽음은 아무 것도 아닌 것이 되요'라고 말하며 죽는 장면은 영웅본색의 장국영...
10,의리....하지만 너무 불쌍한 커플 유덕화-관지림 ~ 
10,도신과 더불어 최고의 도박영화였다. 
8,총질영화의 최고작은 영웅본색 도박영화의 최고작은 지존무상 
9,지금 다시 보면 유치 하겠지만 그때는 이 영화가 전설이었다...지금의 한류와는 비교도 안되던 시절... 
10,어렸을때 유덕화가 얼마나 남자다웠던지 ㅋㅋㅋㅋㅋㅋㅋㅋㅋㅋ참 새롭다 
10,이런 기가막힌 반전을 오랜만에 본다. 초반에 친구의 우정을 보는 것도 재밌었는데 마지막의 전개로 인해 명작이 탄생됬다. 
10,예전엔 어려서 몰랐구나.초간지 장면들... 
10,구라를 예술의 경지까지 올렸다.... 
10,홍콩영화의 황금기 그중에서도 빛나는 작품중 하나이자 도박느와르 최고를 다투는 영화...도신보단 도박쪽에 무게를 덜 주는 대신 훨씬 느와르적인 무거움이 있고 스토리 자체도 뛰어나며 남자의 의리뿐 아니라 4명의 남녀 각...
10,카지노 영화 중엔 최고 걸작인듯하나 마지막 포커 로얄플러쉬가 멋지다. 
10,"칼 손으로 잡는 장면, 동전 장면, 피 질질흘리며 죽은여친 눈감아주는 장면 멋집니다 "
10,진정한 홍콩느와르 마지막 반전은 기가막힌다 
8,도박영화의 쌍두마차... 도신. 지존무상 
10,"영웅본색의 주윤발,첩혈쌍웅의 이수현, 그리고...지존무상의 유덕화.그시절 최고의 느와르. "
7,왜 킹페어라고 했는지...생각의 차원이 틀리다는걸 느꼈음..하지만 결말의 의미는 아는 사람만 알거 같아서 별로네요..전 아직 알지 못하겠어요 
10,89년 말 군에 가기전에 본 마지막영화로 최고로 꼽는 중국  느와르영화! 세월이 27년 지난 지금도 다시 관람한다는... 
10,홍콩영화중에 제일 좋아한다 막판카지노 장면이 예술..특히 엔딩이 맘에 든다 
9,도박영화로는 정전자와 더불어 손에 꼽을 걸작.. 
10,요즘 이런 영화 본적 있어!! 
10,"유덕화, 관지림의 팬이 된 영화!! "
10,멋잇다는말이나온다 남자의우정 
10,굿 
9,재밌었다 
10,유덕화 간지난다 ㅋㅅㅋ 
10,열번넘게본영화....당시 극장에서보고 비디오테잎사서 두고두고 본영화^^ 
10,의리를 소재로 한 영화중에서는 최고의 영화 
8,스토리와 연기가 좋았다. 
9,끝부분이 젤 좋았고 간간히 명장면들이 나온다 약간 긴듯하다 
10,도박영화의 교과서나고나 할까? 정전자씨리즈 같은친구에대한의리가정말볼만 절대강추 
10,유덕화 출연 영화중 이걸 탑 으로 꼽는다. 잔을 돌려 섞어 독약을 마시고 나오면서 죽음을 맞이 하는 씬은 최고 였지만 슬펐다. 막판의 작전은 예상도 못했다. 
9,진짜 남자들의 뜨거운 가슴 
10,제 나이 27살. 한 10년후쯤에 꼭 한번 더 봐야 할 영화. 
10,간지나는 사나이들의 진정한 느와르. 기억에 잊혀지지 않는 여러 장면들에 몸을떨었다 
10,"우정,, 의리, 복수. 사나이의, 사나이에 의한, 사나이를 위한 영화!!! "
10,최고유덕화짱 
9,남자라면... 남자들의 우정을 뜨겁고 멋지게 그린 영화 
10,마지막 장면 압권이다...............멋지다 영화 지금봐도 허걱... 
9,알란 탐..ㅋㅋ 이번영화는 덕화형보다 알란형이 캐짱이였음..ㅎ 
10,코피 하나로 아시아를 싸잡은 남자.. 천장지구  지존무상 
10,개쩐다 ㄷㄷㄷ 꿀잼이네요 
10,유덕화  너무  불쌍해  ㅠ ㅠ 
10,89년도에 만들어진 영화라는게 믿어지질 않음. 사나이의 우정 .비운한 커플 최고의 영화 
10,이다은 이혜연 지존무상 
10,추억이~ 재밋게 본 기억이 나네요!! 
10,영화는 집중해서 끝까지 봐야한다. 
10,예전엔 어려서 몰랏는데 장면하나하나가 드라마 였네 인생 최고의영화중 하나! 
10,도박영화 최고지 이영화 마지막 승부 멋지다멋져 
9,영화의 마지막 장면이 잊혀지지 않는 영화.. 왜 끝에 그 엘리베이터를 탔을까 두고 두고 곰씸어 바야하는 장면. 
8,지금 보아도 재미있네요. 스토리 자체만으로도 충분히 재미가 있습니다.  27년 전에 영화죠. 명작입니다 
9,그당시 홍콩 오락영화의 교과서 같은 영화 
10,어렸을때 유덕화가 얼마나 남자다웠던지 참 새롭다 
10,사랑은 영혼속에 숨쉬고 의리는 피속에 살아있다. 지존무상 = 존귀함에 오르기가 끝이없다! 사나이 의리는 이런것^^ 
9,"도신과 더불어 옛날에 가장 잼나게 봤던 홍콩도박영화. 지금 다시 보니 스토리가 약간 엉성한 부분이 있는건 사실이나, 그래도 여전히 잼있고 감동적이다 , 중간중간 나오는 OST도 어디서 들어본듯한 멜로딘데 상당히 좋다..."
10,할말 잃은 영화..............장난아니네요.... 
10,캡~캡~캡~ 이런영화를 이제야 봤다니... 최고 10점 
10,이런 류의 영화가 코믹적인 요소가 많았던데 비해 이 영화는 정말 진지하다... 최고 
9,"80년대 홍콩 느와르의 정점, 아니 그 이상. "
8,우정을 위하여 목숨을 걸다.피를 토하는 유덕화.사나이 로망의 결정체 
10,굳 
10,너무오래되어 가물거렸던 홍콩영화의 내가 반한 이유가 여기서 나온다.. 
10,타짜에는 입에 침이 마르도록 칭찬하고..20년전에 홍콩느와르는 짱꼴라 식이냐?? 
10,멋진 영화 
10,문득 잊고 있었다.. 이런영화 엄청 좋아했던거.. 
10,이런 영화 다시 볼수있을까... 
10,같은 겜블이라도 틀리다. 
10,진한 남자들의 의리 
10,유덕화.. 남자.. 멋진 복수 엇갈린 사랑.. 
9,마지막이 너무 슬픈영화다 
10,명장면이 즐비하다.. 유덕화와 관지림이 빨리 죽는거 같아 아쉽다... 
10,"도신,타짜 보다 이 영화가 진짜다... "
10,좋아하는 영화니깐 평점10 
8,홍콩영화의 추억.. 
10,가장 좋아하는 홍콩영화중 하나 
10,국딩시절본 정전자에서 이어지는 최고의 도박영화 지존무상! 
10,몇번을 봐도 멋지다. 
10,지금 생각해도 어떻게 왕정감독이 이런 명작을 찍었을 때가 있었는지.. 
10,괜히 지존이 아니다.. 
10,"스토리, 음악, 배우 모두 흠잡을때가 없다. "
10,유덕화가 정말 멋지게 나오는 영화. 
10,홍콩느와르의 최전성기 화룡정점의 영화 
10,홍콩 영화의 전성기. 느림의 미학. 
10,"영웅본색,첩혈쌍웅 그리고?? "
10,전설적 홍콩카지노영화. 2가 더 좋았다. 
10,역시 멋진 영화 
10,도박영화의 전설이 되다~ 
10,사랑보단 우정을 택한 
10,도박영화라면 지존무상이 최고 강추 
10,내가본 최고의 도박영화.... 감동이 쓰나미처럼 밀려왔었다.. 
10,홍콩영화팬이라면 봐야될 영화~~ 
10,옛날 영화라서 좀 길군... 
9,친구간의 진정한 의리를 보여준 작품...상당히 비장하다.. 
10,팔다리 목숨을 건 로티플/의리가 무엇인가를 보여주는. 
10,10점미만인 사람들은 대체 머하는 사람? 뇌구조분석 필요... 
10,홍콩영화 몰락의 일등공신 왕정의 유일한 명작 
9,홍콩느와르의 대작 
10,동전 던지기.. 최고지. 
10,추억의 걸작...다시봐도 넘 재미있음.. 
10,16년이 지난 지금에도 기억속에 생생하다.. 
9,이때만 해도 알란탐 볼만했는데... 
10,말이 필요없는....무슨말이.... 
10,"오랜만에 다시 봤다. 유덕화, 천장지구보다 약간약하긴해도.. "
10,추억의 명작이네요 
10,독이 있는 잔을 마신뒤 ..죽어갈때 감동+진정한우정 
10,독이든잔을먹고정신력으로통양을구출했던아해 정말 눈물이났다 
10,알란 탐과 유덕화의 의리..초강추 
10,도박과 느와르를 잘버무린 걸작... 
9,"유덕화의 최고작중 하나. 의리와 우정, 도박, 사랑 기타등등.. "
10,이 영화 추천... 한번 봐보세요 재밌고 감동~ 
10,내용도 유쾌하고 정말 감동적인 홍콩 느와르 영화 
10,친구간의 의리를 확실히 보여준 훌륭한 홍콩영화 
10,절정의.. 홍콩 영화 중 거의 최고가 아닐까 싶다.. 
9,굳 
10,도박영화의 전설이죠 말 그대로....전설 
9,음....유덕화의 포스 절정 
9,조금 비약이 심하지만 홍콩 느와르의 절정판인 것은 사실 
10,명불허전....... 
10,이거 정말 최고입니다. 다시보니까 더 좋네요.이당시 알란탐 나이가 40. 
10,dvd로 다시봤는데 정말 쿨한 영화. 유덕화의 최고작 
8,홍콩느와르의 전성기였지요~정전자와 함께 정말 잼있게 봤던 기역이~ 
8,왕정의 유일(?)한 명작.... 
10,남자들 의리 정말 이런가? 하여간 되게 재밌게 봣따 ㅋㅋㅋ 
10,ㅎㅎ 대단하다고 할 수 밖에... 
10,홍콩영화 최고의 작품이라 말할수있다.. 
10,세기의비주얼 정우성도 그옆에서면 오징어로만들어버리는 유덕화왕정이 이런명화를 연출하다니각본이 요즘봐도 새련된구도내가 당신을 구해내는건 내친구의 아내이기때문이다 유덕화만이 표현해낼수있는 느와르 
10,의리의리한 홍콩 갬블 액션 영화!!시간이 흘러서 봐도 유덕화의 연기는 가슴을 파고든다.찐 배우네~~ 
8,브랜디 마시고 탈출하는 씬은 진짜 존멋이다..마지막 반전도 쩔었음.. 
10,(*)*&(*^&*&*%*&^ 
7,"지금까지도 회자되는 몇 안되는 홍콩판 카지노느와르, 남자로써 울컥하고플때 아직도 꺼내 엿보는 돌아올수 없는 시대의 브로맨스. "
10,
10,사랑하는 사람이 어떤이유로든 상대방을 속였다는건 용서못할짓..결말 넘 슬프 
10,사랑.우정.돈.액션 다있다..그래도 아삼과 아해 우정이 제일부럽다 
9,멋지고 너무 강렬하다. 
10,말이 필요없다.. 연기 액션 스토리 예술적인 반전 뭐 하나 빠지는것 없이 만족스럽다. 영웅본색과 더불어 인생영화로 길이길이 남을듯. 패가 살짝 예상은 갔지만서도 이토록 소름끼치는 구라와 우아한 엔딩은 처음이다. 
10,일단 쪽빠리 패는거라 좋음 . 그나저나 유덕화 알람탐 (?)  잘 생겼다잉. 
10,금방 보고왔는데...진짜 이런게 영화구나 느낍니다..요즘영화랑 비교가안되네.. 
9,지존인영화임유트버에서보고다음날저작권으로삭제됨운명적인홍콩영화다진심 
10,[지존무상...지존의 자리는 영원하지 않다.무상할뿐...그래도 영화는 무상하지 않은 영화.도신(정전자)&도성&도협 씨리즈와 함께 최고의 홍콩영화다.이만큼 좋아해 본 홍콩 영화는 영웅본색 씨리즈와 천녀유혼 씨리즈뿐.....
10,이영화는 9점은 넘어야 된다 
10,연기 와 사운드트랙이 좋습니다 
10,사운드트랙이 존나 개쩐다 
9,의리가 최고라고 생각하던 나의 20대시절이여... 
10,로티플이 사람 잡눼;;;; 
7,"지금 보면 억지스러운 의리 상황이지만 그땐 그랬지 홍콩영화라서 모든게 수긍되는거. 이 영화는 줄거리 , 연출보다 지금은 추억과 향수가 더 남는다. "
8,"이 당시 홍콩 영화를 관통하는 단 하나의 메세지 ""우정과 의리"". 지존무상은 거기에 기막힌 반전까지 더했다. 지금 보면 다소 촌스럽지만 마지막 결말 그리고 진옥련의 눈물은 이 영화를 꼭 봐야하는 이유 "
10,나에청춘다시못올~나의푸른는~날이여 
10,홍콩영화중 TOP 3 안에 속하는 명작중에 명작 특히 유덕화의 우정은 과거 유례없는 수준 
10,덕화 나오는 부분까진 만점 짜리였는데 
7,홍콩 느와르 영화의 전성기...내용은 비슷비슷하지만 재미는 있다. 
10,지존파 새끼들이 이거보고 지존파라고 지어서 방송에서도 안함 명작을 연쇄살인범새끼가 망친 희대의 명작 영회 내용으로 봤음 지존파 새끼들튼 독립운동가 되어야함 이름만 지존파임 사형당할새끼들 
10,최고의 영화~유덕화 완존 멋있음 ♡♡ 
7,잘생겼다 알란 탐 
10,진정한 사나이의 의리란......이영화를 보고 고등학교 친구들끼리 맹세를 한게..어언.. 
10,당연10점 영화 
10,최고 도박영화. 
10,젠장.. 
10,"유덕화, 알람탐 당시 최고 그리고 최고의 영화 "
10,내 생애 최고의 영화....(포카 모르는 사람은 족보 미리 배우고 보실 것ㅋ) 
10,좋아좋아 
10,이런 명작이 또 있으려나 ㅠㅠ 
9,느와르가 뭔지 알 수 있다 
9,엄청옛날에봤던  기억이. .. 최고의 영화 
6,구석구석 보이는 엉성함에도 불구하고 감동드라마로 재밌게 만들어 내다. 
7,순수한 남자는 결국 죽는다. 
7,남자들의 우정때문에 7점 
8,이런 영화는 이제 안 나오겠지 
7,멋있는카지노기술이난무할줄알았는데.오우삼식이잖어... 
8,제목이 너무 마음에 들었었지 영화는 그럭저럭 좋은편 
7,기대를 너무 많이 했던걸까?폼만잡다 허무하게 끝난다 
8,어릴적 보았던^^ 
7,사업자금 준다고 할때 받지 뭐한다고 다른사람피해입히고  마누라하고  자기까지 죽고있냐????????????? 
7,막판에 너무 질질끄는것 같아서 별로.. 도박할돈 킬러들한테 주고 타로 부자 능지처참하는게 더 깔끔했을듯 
5,뭔가 김빠지게 진행되네... 
7,지존파의탄생 
5,다른 홍콩 느와르에 비해 무겁고 그다지 별로였다 밋밋함 
10,이석환 교수님 만세 
1,죄다 10점이군. 이건 아닌데... 
8,영화보다는 40자평이 너무 괜찮은 영화.. 
3,이게 뭔지..-_-;; 해피엔딩도 배드엔딩도..아닌 영 아니다... 
8,조금 내용이 엉성함. 재미는있는데.. 자연스럽지 않는 내용전개.. 
2,확실히 배우들은 GOOD이었다.. 하지만 역시 왕정은 BAD 
3,어르신들의 회상용 성인만화.. 어렸을 때 봤으면 재밌었을듯 
2,확실히 배우들은 GOOD이었다.. 하지만 역시 왕정은 BAD 
2,멜로인지 도박인지 액션인지 갈피를 못 잡는 영화. 그중에 한가지라도 잘했으면... 
6,멜로인지 도박인지 액션인지 갈피를 못 잡는 영화. 그중에 한가지라도 잘했으면... 
1,명성에 비해 턱없었다. 
2,<타짜> 같은 도박 영화에 비하면 너무 떨어진다. 시대가 다르긴 하지만… 
3,정말 미안하지만 중국 영화는 내 감성이 아니다. 
2,개유치하네 관지림이 쌩뚱맞게동가인때문에가는거냐고  하는거 실화냐개뜬금포 지렸다 ㅋㅋㅋㅋ어이없네 
