score,review
7,딱 반만 공감가는 영화였음.방황이라는 두 글자로 양아치짓하고 다니는 애들을 다 감싸줄 수는 없다고 생각함.영화 속 인물 중에서도 동철이라는 인물은 방황이었다고 하기에는 심하게 쓰레기짓을 했지.혼자서는 아무것도 못하고...
10,재밌었음 시간 가는 줄 모르고 본 영화 
6,"예전 학창시절의 향수를 불러일으키기엔 부족함이 없으나 일부 대사에서 독립영화 티가 나고 발음 부정확인지 오디오가 거지같은건지 뭔지 소리가 뭉개져서 영화에 집중할 수가 없음, 주연 일진 두명의 연기는 나쁘지 않았음. "
10,추억이 새록새록 ㅋ 한국적으로 잘 그린 공감대 영화 
8,"재미는 있으나, 솔직히 결말은 별로 맘에 안들었던 영화..작가는 나름 훈훈한 결말로 끝내고 싶은 의도였으나 오히려 역효과였다는.. "
10,시간가는줄모르고 재밌게 봤습니다 
9,영화내내 웃다가 손발이 오그라들었다 긴장도 되었다가 잼있게 잘봄.. 근데 보고나니 예전 생각에 머리가 미묘함.. 아련함일까?.. 다신 떠올리고 싶지 않은 마음일까? 
10,ㅅㅂ 졸라 재밋게봄 참고로 난 77년생 
10,야! 어슬프게 놀거면 시작도 하지마! 저 말은 말이야~ㅎㅎㅎ 고딩들에게만 해당되는 말이아니야. 중고등학교 때 노는 애들처럼 보이고 싶어서 별짓다해 애들한테 막말도 하고 쎈척 비싼척 다해 근데 결국 시간 지나고보니. 
10,"이렇게 공감가는 완성도 기대 안했는데 여운이  깊~~~네요, 최고!! "
8,재미있네요. 배우들 연기가 괜찮았어요. 예전에 방황한 친구들이었으면 더 공감할수도 
7,마지막 장면을 보면서 드는 생각 - 임마 아직 덜 쳐맞았네~ 
10,어릴적 추억을 떠올리게하는 영화 
10,와 재밌데요. 친구 역할 차엽님  미래가 기대되네요. 건승하세요. 
10,배우 이재응을 더 많은 작품에서 보고싶습니다. 좋은 영화 좋은 배우 감사합니다. 
10,야!  어설프게 놀거면 시작도  하지마!  살인의  추억 따라쟁이 꼬마가 많이 컷구나  참 잘 안들었다 너무 이쁘고  고맙고 착하다   이게 영화지 고맙다 
10,마통...이라고불렀었음 여운이 기네요 
10,좋은 영화 감사합니다. 
10,"추억,후회,동경 함축 "
10,오 기대이상이네요  재밌어요 
10,대박 재밌네요ㅎ 공감가기도 하고ㅋ 
10,재밌게봤습니다!!진짜명작인데독립영화때매 빛을못본듯 아쉽네요 ㅠㅠ 
10,양아치는 아니였지만... 이거보고 학창시절 은근 생각 많이 난다는듯 어짜피 한번뿐인 학창시절 공부만 하기엔 솔직히 조금 아까운 고등학교 시절 친구들 생각도 많이 나고 마지막 복잡미묘한 그느낌 옛 향수 느낄수 있어서 ...
10,재밌게잘봤지만..10대 아들들의 방황기가 난 넘 싫다폭력은 더더욱 싫고 
10,"전 특이하게 커플데이트하며 봤습니다. 우리 4명은 다 같은 중학교 친구사이에요. 공감가는 부분도 있고, 이렇게도 되는구나 했던 부분도 있네요. 몇OO이 지나도 학교생활이라는게 맥락 자체는 비슷하게 보내는것 같아요. "
10,폭탄 막 날라다니는 영화보다   영화관에서 이런 영화를 보고 싶네요. 잘 봤습니다. 
10,"현승이 캐릭터 정말 멋지다~ 고독고 있고, 정의감도 있고, 사색도 있고 "
10,잘봤습니다 공감이 많이가네요. 
10,내가 생각했던 느와르는  아닌 드라마와 가까웠네요.  차엽이란 배우 악역으로 봤었는데 여기에선 의리남으로 나왔네요. 영화 스토리 배우 정말 최고입니다. 
8,싸우는 씬 현실적이네 현승이가 생각하는 친구라는 개념이 좋다 
2,"영화내용에서 영화 제목을 계속 강조해서 말합니다. 어설픈 일진 미화 영화이며,  막판 갑자기 훈훈하게 마무리하려는 시도도 어설픕니다. 일진들에게 당한 수많은 약자들이 보면 또한번 멍드는 나쁜 이야기 "
8,야기 새끼들아 제발 음성좀 들리게 만들어라 난 순간 디바이스 문제인줄알고 eq존나게 만지작 거렸다...목욕탕 울림 
4,막때려도처벌도안받고좋은세상이네 
10,배우들이 하나같이 연기를 실감나게하네. 
10,"시간 가는줄 모르고 재미있게 봤고,,, 보는 내내 머리가 찡~하는듯한 소름을 몇번 느꼈네요.. 잘봤습니다 10점 쾅 "
10,"정말좋은 독립영화인것 같고 학교폭력,일진 에대해 가장 사실적으로 보여줬던 영화라고 생각한다. "
10,재미나게 봤어요 :) 굿굿! 
10,우와... 정말 감명 또 감명깊게 봤습니다아직도 그미소를 잊으수가없네요 
10,여운이 길게 남아 영화가 끝났는데도 끝난거 같지 않았다. 
8,"바람을 보는듯 하면서도 뭔가,, 다르다. "
10,동철 역할을 한 이익준 배우.. ㄷㄷㄷ 불우한 가정환경에서의 스트레스가 눈빛과 행동에서 드러나는 캐릭터. 그 신경질적인 태도와 누구라도 한번 걸리면 죽여버리겠다는 눈빛. 팬이 되었습니다. 다른 역할도 너무 보고싶네요...
10,10점 진짜 잘만들었다. 동도의 연기와 생긴거는 아쉽지만 / 현승 연기 지리더라. 이런 유형의 일진 꼭 있더라 ㅋㅋ 
7,손발오그라드는 대사들 바람처럼 유머도없고 영화전설의주먹같은 민망함  이거빼곤괜찬음 
9,정말예전생각나구 배우분들연기가대단해요ㅋ 
7,주인공이 양아치 무리에 끼어서 논다는 설정이 억지스러움. 양아치 무리에는 끼어선 안 된다는 걸 보여줌. 그러나 청소년기 시절에 겪을 법한 갈등을 지루하지 않게 잘 표현함! 
10,재밌음강추재밌음강추재밌음강추 
10,"처음으로 정말 친구들,가족들에게 꼭 보여주고싶은 영화인것 같습니다영화 잘봣습니다^-^ ~!! "
10,너무재밌게 봤어요. 이런영화 만들어주셔서 감사합니다. 사운드는 제가 무료로라도 다시 만져드리고싶네요. 다들 좋은 모니터 환경은 아니다 보니.. 
10,재밌게 봤는데 마지막에 다른친구들 어떻게 지내는지 궁금 ㅜㅜㅜ 
9,"조금 아쉬운부분이 있엇지만, 방황하는 청소년들을 잘 묘사한거같다 "
10,잘봤습니다 진짜 배우분들은 정말 잘뽑으신듯 연기력이 와우 .. 
10,명작이네요 진짜... 
10,옛날 생각 나게 하는 영화 
10,보는내네 공감이너무가서 마지악엔 눈물흘리며봤네요 
9,재밌다ㅋㅋㅋ이야~~  80~90년대를  제일  현실에  맞게 각색한  영화~~ 
10,현승이 멋져부러~동철이 눈빛 무섭다..살아있어 
10,너무 공감되고 왜 추억향수공감하는 영화인지 알겠다 
10,"배우들의 명품연기, 스토리 최고의영화 "
8,good good good 
10,1시간 30분동안 완전 몰입되있었다..!!! 
9,진짜 재밌네요 연기도 잘하고 시간가는줄 모르고봤네요 강츄강츄 
10,꿀잼영화 시간가는줄 모르고 봤네요 
10,간만의 굉장히 와닿는영화 최고다 
10,와 추억 돋네 딱 우리 때네 핸드폰 가지고 다니기시작하고 채팅 노래방 비트 비디오테이프 90년대중후반 거의 후반에 가까운거 같은데 아날로그와 디지털로 넘어가는 공존의 세대 문제아는 아니었지만 그래도 친한친구끼리 놀구...
8,ㅋㅋ 재밌는데 고등학생들이 개삭음 
10,최고다 공감 꼭봐!!! 
10,야 어설프게 놀거면 시작도 하지마 
10,좋은영화다. 정말 지루하지않고 시간가는줄 몰르는 영화 ㅎㅎ 
10,재밌게봤어요 ~맘에듬 
8,영화의 주배경이 인천 동구랑 남구에서 찍었었구만 
9,"동철이가 왜 그런지는 가정상황으로 말미암아 알 수 있었으나, 그럼에도 불구하고 친구들과 좀 더 진하게 지내고 겉돌지 않았으면 더 좋았을 것 같습니다. "
9,9점9점9점9점9점 
8,중학교 추억이 새록새록나네...그당시 놀던애들은 이따구로 놀았겠지? 
8,현실감 쩐다 진짜 이랫는데 
10,"정말 ,,,, 학창시절 영화는 친구, 바람 이상으로 현실적이고, 감정표현과 배우들연기가 최고를 만들어 냈는것 같습니다. 정말 잘봣습니다. "
8,"영화 바람, 파수꾼과 함께 남자 고등학생들 그들만의 세계와 생각과 행동들 그리고 후회. 메시지는 비슷비슷함. 남자들이라면 끌리는 소재와 줄거리. 배우들의 연기가 멋지고 공감되는 부분이 많아서 몰입도가 높았음 "
10,저는 개인적으로 재밌게 보았습니다 ^^ 
9,참 잼있게 잘봤다.. 하지만 마지막 마무리가 부족한듯 싶당 
9,"좋은 영화입니다 ""바람""과는 또다른 재미네요 "
10,와 이거는 극찬을 해야하는 영화다아 잔잔한감동이 물결을치는구만 
10,나의 어릴적을 되돌아 봤음.. 어쩜 그리 똑같은지...훈훈하고 공감가고...마지막 군고구마까지...영화 재밌게봤음.ㅋㅋ 7080년도에 태어난 남자라면 추천!! 
9,꾸미지 않은 시골밥상처럼 구수하고 추억돋는 아련한 맛 
10,시간이 어떻게가는지.. 여태껏 귀찮아서 평점쓴적없지만 이번만큼은 여러사람들과 공감하고싶어 이렇게씁니다. 정말 산업영화에밀리는 독립영화! 끝까지응원합니다! 
10,이영화를 극장에서 보지못해서 아쉽습니다. 지루할 틈 없이 너무 재미있어요. 
8,친구가 최고라고 생각하던 시절이 지나고 이제는 소원해진 친구들이 생각난다. 
10,정말 재밌네 진짜진짜 재밌게봤다 
8,재밌긴한데 파수꾼하고 좀 비슷하다 영화가 마지막에 주인공이 첨으로 괜찮게 나왔다 
10,저예산 영화임에도 몰입감이 정말 대단하네요. 어느순간부터인가 내가 그 현장에 있는듯한 느낌까지 들었고 끝까지 마음 졸이면서 푹빠졌습니다~ 
10,보는내내 가슴이 먹먹하고 정말 공감가는 영화였습니다.. 이런영화가 왜 9점에 못미치지는지 이해가 안되네요.... 
10,제 학창시절과 싱크로율 80%정도 같아서 오싹.    다 큰 지금에서야  영화를 보면서 대리만족 하네요. 
10,킬링타임용 영화같으면서도...흠... 
10,개꿀잼 ㅎㅎㅎ 예전 생각나네요 ㅎㅎ 
9,아쉽지만 재밌게봤습니다 ㅎㅎ 
10,"진짜 리얼하고 현실적으로 연출 잘했네요, 캐스팅도 완벽하다고 생각.. 때리는 연기할때 고생 꽤나 했겠어요.. 정말 재밌게 봤습니다. "
9,진짜 학창시절 많이 생각난다...ㅎ 
5,"어설픈 연출과 어색한 연기들 때문에 도저히 몰입할 수가 없어서, 중간에 꺼버리고 말았다. 진심 별로. 이재응 나와서 기대했는데,, "
7,막 진짜 잼난다는 아니고 그냥 2000년도쯤때의 향수를 불러 일으킨 볼만한 영화.. 보는내내 유년시절을 회상하며 보았음 
10,분명 극장에서 관객보여줄려고 만든 영화일텐데 난 왜 극장에 이영화 하는거 한번도 못본거지? 
10,재밋다.. 흥행했어도될만한작품인데 
10,알려지지 않은게 너무 아쉬운 수작! 
7,ㅇㅇ 나쁘지않았음 나 엄청 까다롭게 영화 드라마 보는데 이건 그냥 뭐 영화스럽지도않고 그렇다고 너무 현실적이지도않지만 그래도 저시대때 어느동네 한동네쯤은 저런애들 있지않을까하는 생각에ㅇㅇ 그냥 괜찮게봄 저렇게 유치하...
10,진짜 개재밌다 돈이안아깝다 ㅋㅋ아 진짜 공감되고 배역하나하나 빠져드네 옛날 생각에 ㅋ진짜 좋은영화 잘봤습니다 
10,향수냄새 찐하게 느끼고 갑니다^^ 
10,간만에 영화같은영화봣다 
10,그냥 옛날 생각많이 난다. 커피숖. 노래방. 그리구 시비붙고. 철없던시절..15년전이내 벌써. . 
6,"감독이 학창시절 무지하게 맞은 탓에 현실감은 뛰어나지만 잘 만든 독립 영화, 그 이상도 이하도 아니다. "
10,"정말 다들 연기를 잘해서, 몰입감이 너무 좋았어요.  어설픈 설정도 없었고, 너무 진지하고 재미있게 본 영화였어요. "
7,나름 잼게봤는데 이재응 생긴게 원래 이랬었나? 생긴게좀 부자연스럽게 생겼다 ㅡㅡ 
10,그때 그시절이 그립네.... 추억을 떠올리게 해준 영화 
8,바람<<<18<<<친구  그렇게 가볍지도 무겁지도 않은 딱 중간 정도의폭셕성 하지만 몰입도는 최고? 
10,맞는연기를 진짜로하니까 ㄷ... 
10,처음에는 뭐 재밌겠어?라고  본영화인데 너무재밌었음!바람도 재밌게봤지만 이게 더 재밌었음ㅋ 교훈도 있고. 이런영화가 흥해야 되는데 현실은 그렇지않은게 슬픔 ㅠ 
9,이런 학원물은 언제나 재미있다. 
10,굳!아주 좋았음ㅋㅋㅋㅋ 
7,7빈틈을 정으로 채우는 친구를 만난 것처럼이란 평론가 평으로 대신함 
10,진짜 리얼하고 재밌네요 ㅋㅋ 시간가는줄 모르고 집중해서 봤습니다. 
10,간만에 괜찮은 영화봤다..오버스럽지도 않고 옛 향수를 불러 일으켰다. 
10,오우 정말 집중해서 보게된 영화에요. 출연진분들 모두 연기를 정말 잘하네요. 감탄감탄..!! ㅋㅋ 다른영화에서 많이들 출연해주셨으면 좋겠습니다. 앞으로 기대할게요~^^ 
10,파수꾼의 디테일을 기대한다면 이 영화도 역시. 
10,마지막 엔딩씬... 좋네요.어설프게 놀거면 놀지도 마.ㅎㅎ 
10,"가볍게 보려고 틀었는데,  두번이나 봐버렸다. 때로는 가슴을 조이면서 불안해하면서 , 우리들의 성장느와르 ~ "
10,옛날 생각하면 정말 재밌게 봤습니다. 철없을때.. 부모님 속썩이는거 생각안하고 우리가 왕!! 이다 라는 식으로 놀았던 ... 살짝 그립기도 하네요.. 1998년 그때를 다시 생각해주는 영화... 최고입니다.. ^^ ...
6,시작은 좋았는데 결말이 좀 약하달까 
10,야~ 어설프 게 놀꺼면 시작두 하지마~ㅋㅋ 옛생각 나는 영화.. 잘봤네~ ^^ 
10,"추억의 향수가 그윽하게 느껴지는 영화,  우정이 뭔지를 보여준다 친구간의 믿음과 이해심이 진짜 중요하다고 다시한번 생각하게 해준다 "
10,요증학창시절드라마영화보면 감독이오글거리게묘사 하는대 이거진짜리얼이다 20살인대 진짜똑같아서소름돋음 개명작 보면 여운남는다 
10,정말 재밌게 보았네요ㅎㅎ 
10,옛날생각에 아름답고도 가슴찡한 영화.. 놀아봤던 사람은 이 영화 강추 
9,각기 다른 삶의 색깔로 나눠지는 영상을잘 담아낸 영화네요 
10,남주인공..괴물에서 마지막 남은 아이의 형역할..국대에서 막내.. 
10,옛생각도나면서...부모님에게 한번더 미안해지네...난 옛기억은 거의창피하다 생각했는데 지금현재 중고등학생들에게 꼭 보여줘야할 영화같다... 
10,오랜만에 추억에 빠져 보네요。특히、이 영화의 포인트는 과격하거나 너무 거칠지 않다는 것입니다。치고 박고 싸우는 장면이 나오지만、그것 마저도 청춘의 한 장면을 떠올릴 수 있도록 자연스럽게 묘사했지요。배우들의 연기도 너...
10,가슴이 먹먹해지고 여운이 남는 영화. 슬퍼서가 아니라 묘한 향수를 불러 일으켜서 사람의 마음을 움직이는 영화다 
10,굿굿굿 이영화가 망한게  이해안간다 
10,오랜만에 집중해서 본 영화네요. 독립영화중엔 똥파리 다음으로 재미있었습니다. 10점 만점 드려요~~ 
10,어설프게 댓글 달거면 달지도 마!!! 
8,도입부부터 끝까지 빠른전개로 흥미진진하고 사춘기시절을 되돌아 볼 수 있는 기회였어요아쉬운점이 있다면 결말에 친구들 각각 어떻게 지내는지 보여줬다면 조금 더 잘봤다라는 생각이 
10,생각난다 학창시절^^ 연기굿 ㅎ 
6,누구나 그럴 것 같지만 누구나 그렇지만은 않은 오래되고 낡은 청소년 이야기 
10,재밋네요 친구들도 생각나고 
10,동도동도동도동도동도동도동 
10,좋네요 그때 그시절 추억 
10,독립영화를 참 좋아하는데요. 말그대로 소재는학창시절의 향수지만 보는동안 리얼하게 참 재밋게잘보았습니다. 영화 바람을 재미있게 보았다면 이또한 정말 재미있게 보실듯합니다 
7,7.5 수준영화 많이 본 사람들은...글쎄같은 세대 얘기지만 좀 가볍네 
9,리얼하게 표현한 수작입니다 
10,친구들  생각나네요... 
7,경복고 교복이 나와니 옛생각이 나네요 74회 경복고 졸업생 
10,오!!재미있게잘봤습니다 
10,난 왜 이런 영화를 보면 가슴이 먹먹할까.. 
10,친구와의 의리 멋졋습니다 영화에 표현된 감정들이 공감가는 부분이 많아 더재밋게본듯 
6,제목이 다인 영화. 그 이상 그 이하도 없다 
10,재밌다 정말 잘 표현 했다. 옛날에 오빠가 날아다니던 모습이 아른거린 영화. 
8,"동물의 왕국 고교시절, 맞아 맞아 그때 그랬었었지 . 품행제로, 바람 계보를 잇는 아 고등학교때 그랬었었지 시리즈 "
10,현승이라는 캐릭터 정말 멋있네요. 남자가 봐도 멋있습니다. 
7,추억의 담배키스☞ ㅎㅎ 
10,스마트폰으론 불편해서 영화같은건 안보는데 내방 침대에 누워 시간가는줄모르고 폰으로 영화다본건 첨이네 학창시절을 보낸 누구나 공감할수있는 수작이다 몇십억 들인 영화보다 훨씬 낫다 
9,평점이 다 조작 아닌가 하면서.. 끝까지 봤는데... ㅎㅎ 정말 재미 있었어요. 이런 영화가 개봉했는지도 몰랐네요. 추억이 돋네요 ㅎㅎ 추천~!! 
7,쪼개는게 아니라 내가 째리면 그냥 맞는거야.. 
7,안될 여자는 포기해야 된다. 
10,이런영화류 좋더라! 강추!! 
6,재미있지만 ...재미가 다 일뿐..다른 학창느와르물보단..떨어진다.. 
10,차엽이랑 이익준이  살린영화. 꽤 볼만했다 
10,진짜 재밌게 봤네요. 파수꾼 다시보는 느낌이네요. 그런데 그것보다 배우들이 연기력이 탄탄해서 더 재밌네요. 
10,최근에 봤던 대형상업영화들보다 훨씬 여운도 깊고 집중도 되었네요. 이런영화가 많이 알려지지않고 빛을 못본다는게 아쉬울뿐.. 학창시절의 추억이 생각났네요  아쉬운 부분은 초반이랑 중반 대사가 잘 안들린다는 점..발음에...
9,정말 진지하게 잘봤습니다. 유치할줄 알았는데 모두의 모습이었어요 
10,어릴때 생각나네 .ㅠ..ㅠ 
10,딱 2~30대 남자들이면 추억 느낄만한 영화네요. 정말 잘 봤습니다. 
10,바람과 말죽거리 잔혹사를 합친느낌수작이다 
8,파수꾼을 잇는 성장 학원물 
10,아따 옛날 놀던 시절 생각나네 ㅋㅋ 
9,기대하고 보진 않았는데 너무 재미있게 잘 봤습니다.싸우거나 때리는 장면이 좀 어설퍼 보여서 아쉽긴 했지만학창시절의 모습을 아주 디테일하게 보여준듯... 
10,값싸고 가벼워 보이는 이영화가 이제 나한테 가장 무겁게 남았다.  뭔지모르겠는데 그냥 재미있고 가슴벅차다 
10,웃음이 절로 나오는 영화네요. 바람의 잔혹판? 여튼 마무리는 훈훈해 좋았습니다~ 
10,어른이 되어버린 사람들에게는 공감 되는 영화네요 
7,재미있음재미있음재미있음 
10,기존 느와르 영화와 달리 색다른 느낌으로 아주 재밋게봣네요!!!!진짜강추또강추 아우근데비니쓴애 시러여ㅠ 
10,진짜 볼만했어요. 배우들가식없이 정말실제같은연기도그렇고 우정에대한 깊은 또다른감정을 느낄수있었네요 
10,너무 과하지 않는 연기 적정선이 좋았음.진짜 현승같은 친구있으면 든든 하겠네 
10,대사가 잘 안 들렸지만. 재밌다ㅋㄱㅋ 
10,음성 사운드만 다시 다듬어서 재개봉 했음 좋겠어요 
10,재미있다 지루할줄 알았는데 몰입감 굿 
10,좋은영화입니다. 추억돋는영화네요 14년에 방영한영화지만 이제알고이제봅니다.. 지금이라도 sns를통해 간접광고로 많은사람들이 봤으면 좋겠습니다. 참고로 저는페이스북에 컷영상보고 보게되었습니다 
10,유튜브에서 씬이 몇개있길래 찾아보니 재밌네요.  요즘 스케일 큰 영화들보다. 오래간만에 마음을 두들겨 주는 영화인듯합니다.  마지막씬역시 인상깊구요. 감독님 좋은 영화 많이만드셔요. 화이팅입니다. ! 
8,녹음 장비가 조금만 더 좋았더라면...배우들의 발음과 음량에 더 신경을 썼더라면...평점 5점인데...내용은 참신한데 단지 오글거리는 장면이 몇몇 있어서.... 
9,이런 소소한 재미와 감동을 주는 독립영화가 흥했으면 
10,이명작을 이제야 봤네 차엽 진짜 연기잘한다 꼭 성공하길 
8,"영화 속 주인공들처럼 친구들끼리 치고 박고 싸우면서 지낸건 아니지만 친구들끼리 우르르 몰려다니고, 몰래 술먹고 담배피고 그냥 '친구' 라는 이유로 같이 있는게 즐거웠던 그때 그 시절을 떠올리게 해주는 ..."
10,강혜경 배우님 화이팅! 
10,이 영화는 매우 잘만들엇다.... 
10,제가 본 한국영화 중에 손에 꼽힐만큼 재밌었습니다. 리얼한 연기. 몰입도가 엄청납니다. 학원물 중 베스트. 
10,개꿀잼이다이기야!! 
9,주인공이 보기 불편한 이유는 공감되기 때문이다. 
9,학창시절 누구나 학교내에서 진정 쎈친구가 아닌 쎈척하는 녀석이라도 되고싶어한다.. 그들을 속으로 욕하지만 결국엔 나도 그렇게 되고싶은 그런 모습을 잘 담은것 같다 
8,숨겨진 수작이네요.. 바람만큼은 아니지만 볼만함. 단 다른분들처럼 대사가 잘 안들리는 부분이 많음 
9,진짜 현실성 개쩌는영화다...10점을 줄수도있었지만 대사가 잘안들림 
8,생각보다 볼만했다. 말죽거리만큼은 아니지만 꽤나 흥미진진한 내용..다만 리뷰에서와 같이 대사가 잘안들리는부분이있음. 
9,아타깝네요 이런영화가 묻혀있는게...멋진영화입니다. 
10,너무너무 재미있고 멋지다...어흥이 심장 폭격 
10,바람보다 더 재미있게보고 훨씬기억에남네요. 마지막장면 굳! 
10,너무나 현실적인 학교영화누구도따라갈수가없다 
9,잼었습니다. 공감할 수 있는 어린시절 기억들(누군가에게 상처 줬거나 상처 받았던) 떠올라서 몰입했네요 
10,동철이도 동철이지만 나는 후배가 선배한테 대드는게 너 열받는다. 
7,바람이라는 영화가 너무도 커서 아쉬움이 조금은 남지만 한번쯤은 볼만한 영화다 
10,너무 현실적으로 만들어서 무서울 정도 
10,"2014년도 개봉..? 이걸 이제 알았다는게 놀랍네요. 배우들 연기도 좋았고, 맞는 배우들 고생 많았네여. 모두에게 공감 받을수 있는  영화는 아니지만 잘 만든 영화임에는 틀림없네요. "
9,무명배우들이지만 연기력이 정말 뛰어났고 실감나서 몰입이 훨씬잘되었고 옛날 남고다닐때의 향수를 일으켜서 너무좋았습니다. 독립영화에 대한 편견을 깰수있는 영화. 몇몇 씬 마다 대사가 잘안들리는것도 있지만 영화내용을 이해...
10,현승이 같은 친구면 일찐이여도 좋을거같다.. 
10,진짜 간만에 본 명작이다.. 별로 기대안하고 봤는데 너무 재미있었음. 리얼하게 잘 만들었고 배우들 연기도 괜찮았음 특히 현승이 역할을 하신 차엽 분의 연기가 리얼하고 현승이라는 캐릭터가 너무 좋았음 
7,돼지가 인성이 참 좋네  나중에는 군고구마같은거도 할줄알고 
8,리얼함을 살린 연출이 돋보였고 인물의 특징을 살린 캐스팅과 배우 연기가 영화에 빠져들게 한다. 
10,댓글 다는 것이 처음인 만큼 생애 역대급 다섯손가락 안에 드는 영화 
10,진짜 재밌게봤고 이익준이란 배우와 차엽이란 배우를 알게되서 좋았고 둘의 개성있는 케릭터에 너무 몰입했네요  요근래본 한국영화중 최고 
10,동철이  진짜 겁내 패고싶다. 그만큼 연기를 잘한거겟죠?  영화 재밌게 잘봤습니다. 
8,파수꾼 보단 가볍지만 바람 보다 무거운 영화 
8,주인공이 알고보니 비트때 생긴 정우성 아들.  아부지 고딩때랑 정반대네 
10,주인공이..어디서 저런 싱크100짜리 찌질이를 구했으까ㅋㅋㅋ 
10,"진짜 시간가는줄 모르고 재밌게 봤다.근데 이 영화에서 제일 맘에 안드는 캐릭터는 동도.명품매장에서 일하는 직원들이 본인들도 재벌이라고 생각하는것 마냥 거의 최고 OO 수준이었던 동도가 대현이한테 ""OO 주제에..."
1,성장통이 있어서 결국 군고구마장사???ㅋ 성장통이라 하기엔 너무 크지 않냐?ㅋ 
9,웰메이드 독립영화. 근데 대사가 잘 안들리는 게 흠. 
8,재밌게 봤습니다 계속보고 싶네요 ~ 
8,"이 영화 주연 3명(동도, 동철, 현승 )연기가 정말 좋았음. 배경이 2001년정도 되는것같은데 그시대 중딩으로서 많이 공감함. 근데 애비자살했다고 한순간에 사람되는 동철형씬은 공감안됨. 사람은 안변함. 양아치는 평..."
1,아무리 그래도 이 정도 폭력은... 
