score,review
1,아니 뭔놈의 영화가 대사가 안들리냐 전부 웅얼울얼 울려서 못알아 듣겠다 
9,예전엔 일진놈들 중에 현승이같은 애들이 많았는디...요새 일진이란 것들은...걍 쓰레기 똥양아치..힘없는 애들 벗겨먹기나 하고.. 
9,"아까운 영화다. 상업영화에 치우쳐져 정작 빛 받아야하는 영화인데  안타까운 독립 영화의 현실!  오랜만에 학원물도 좋았고  집중도도 좋았고, 다만 음악이 조금 아쉬웠다 눈 내리는 배경에 군고구마 파는 엔딩 씬은 아직..."
10,ㅋㅋ 진짜재밌게봤다시간가는줄도모르고예전향수가득 
10,너무 공감되고 저예산으로 이렇게 만들수있다는 점에 높은 평가느립니다 
10,8090세대라면누구나공강할수있는영화추억이새로새록살아나네요 
10,"영화가 전혀 지루하지 않았고, 계속 집중할 수 있도록 해준 배우들의 연기에 박수를 보냅니다. 동철 역을 맡은 이익준씨 연기가 돋보였고, 인상깊었습니다. "
8,유상무 닮은애있닼ㅋㅋㅋ 
10,남주보니까 김봉두에서 소석? 소섭 ? 이 역활할때 라면 끓여먹던거 생각나네 ㅋㅋ 아 ~ 추억이 물씬이구만 
10,우리들이 성장통을 겪은 날들을 실날하게 경험할 수 있습니다. 
10,어설프게 놀거면 시작도 하지마라 
10,마지막대사 인상깊네요. 정말 잘봤습니다 최고의독립영화입니다.! 
8,실제 일진출신인가 너무 리얼한데 연기가... 어쨋든 연기적으로는 너무 리얼하고 했는데 단점은 대사가 잘안들린다는거 대사안들리는거빼면 10점인데 대사안들리는거에서 마이나스2점. 
10,바람 정말 재미게봤지만 솔직히 난 바람보다 이게 더잼있더라 
10,옛날 생각 나네요. 잘 보았습니다. 
9,재밌게봤습니다 다만 극장에관객은 저를포함한 5명뿐이였다는게 안타까울 뿐이였습니다 
8,서툰구석까지 안을수있을정도로 실감나는 영화였습니다 연기도다들굿굿! 
9,다소 오글거리는 부분이많았지만 옛 생각났다 
10,굉장히 재미있다. 아 이런좋은영화가 묻혀버린 안타까운 현실..차엽 이라는 매력적인 배우를 알게되어서 고맙다 
10,그래 형때는 군고구마팔아서 술값만드는 정신이있었는데 으리아니냐 으리 
9,우와~~종니 재미없을줄알았는데..그냥 재미위주로 영화보는저로써는 진심재미있었음 다만 저예산이라 사운드가 뭔가 살짝뭉개져서 뭔소린지 몰랐던부분도있지만 영화에 해를끼칠정돈아니고 가능하면 주인공팀이 다구리안당하고 이겼으면...
4,양아치애들 연기는 잘하더라. 
8,재밌는데 대사가 너무 안들림 
10,내용이 꿀잼이네요!!!@@@@ 
10,"인물들의 심리를 내가 온전히, 경험할 수 있었다 "
10,배우들 연기 정말 너무 리얼하고 옛날 생각에 많이 웃었네요 80년대생 남성이라면 강추! 추억에 빠질 수 있습니다 ㅋㅋ 
10,남자들의 질풍노도의시기!!  추억에 젖어 재밌게 봤어요^^현승의 연기가 인상깊었어요~기대되는 배우에요~^^ 
10,18 : 우리들의 성장 느와르 봐야지 
10,완전 재밌음~ 배우들이 매력넘쳐요~~ 
9,친구'와 '바람'을 잇는 명작 
10,학창시절이 문득 생각나는 좋은 영화네요~잼있게 잘 봤습니다^^ 
8,학교+액션물은 왠만하면 안망한다. 정작 10대들은 잘 보지 않는 영환데 말이다. 아마 나이들면서 가장 그리운 때가 그 시절이기 때문이 아닐까. 
6,연출보단 배우들에게 초점이 맞춰진 영화. 이재응군 차엽군 이익준군 다음작품이 기대되네요 ^^ 
10,현승이  존나 멋지네 이용하고 셔틀시키는지알았는데 진짜친구로 대해주네 
10,7080세대라면 말죽거리를보고 많은공감을했겠지만 90년대-2000년대에 학창시절을 보낸세대라면 이영화만큼 공감하지않을수없다 
1,iuopl;uioyutity 
10,같이간 남자친구가  어렸을때 생각난다고 그러면서 재밌었다구 하네요~저도 시간가는줄 모르고 재밌게봤어요!! 
10,주연..조연..모두 연기력에 감탄.스토리도 너무 좋았어요. 
8,가끔씩 생각난다. 학창시절 일진 애들 지금 어디서 어떻게 살고 있을까하고 말야. 
8,"3년선배중에 현승이랑 똑같은 일진선배가있었다. 체급도 월등하고 몸도 엄청 날래서 이길만한 사람이 없었는데 짱은 아니었지. 항상 웃고만 다녔고 사춘기에 방황하던 후배들한텐 조언많은 든든한 형이었으며, 다른선배들과는 다..."
10,아 OOO색기들 발음 족같네 뭐라하는지 하나도 모르겟네 영화는 잼있게봤다 현승이가 멋지네 
10,와 이건뭐 10대 감성을 포장하나 없이 걍 쓸어 담았네. 생각해야될건 1. 부모님께 잘하자 2. 좋은친구 사귀고 3. 친구한테 잘하자 
6,'찐따들을 위한 영화' 
1,아이러니. 일진들을 정말 싫어하면서 그들처럼 되고싶어하는 사람은 많음. 
9,참 잘 만들긴 했는데 왜케 다 보고 나니까 기분이 꿀꿀 하냐 그냥 인생이 너무 허무 한 것 같아 이거 보고 나니까 말이지 휴.... 답답하다 
10,80년대 초반생 이라면 완전 공감 가능한 추억의 이야기. 
10,기대안하고봣다 득템한 영화 
10,'바람'보다 훨신 현실감이 돋보였다.. 잠시 추억에 잠길수 있는 영화..정말 잘봤다..이런게 진정한 영화아닌가.. 
9,현승이같은 친구가 진짜 친구다 
5,학교 선생은 뭐하는가 한번도 안나오네.. 
9,재밌었어요  현실감이 짱짱하네요 좀 더 자극적이였어도 굿 
10,우리동네 ㅋ감독님이 같은동네이신듯 
9,'바람'과 맞먹는 수작이다.이런 영화를 이제야 봤다는 게 놀랍다. 
7,대사가 너무 안들리는데 내용은 볼만하네요 
10,와 미틴... 영화 왤케 리얼하냐. 배우들 현실에서 하던거 그대로 하는줄 알겠네. 전혀 어색한게 없어 일진짓하는게 ㄷㄷ... 실제상황에서 나올법한 말들이 딱딱 나오는게 소름돋는다. 
10,이건 진짜 최대 명작이며 20대중후반이 소위잘나가는애들 못나가는애들 이 보면 명작이라 이해할영화 
1,대사도 전혀 안들리고...아무리 독립영화가 음질이 안좋다지만 장난하자는건지 그리고 고등학생역에 30대들을 쓰면 어쩌라는거지 다들 너무 삭아서 감정이입이 안됌 
9,아.. 잘봤습니다.. 
7,후반부로 갈 수록 몰입도가 높아지는 영화. 
10,독립영화  특성상 상업영화에 밀려 빛을 못보고 있는게 매우 아쉽지만 다음 작품을 기대할만한 영화라 생각합니다~ 잘봤습니다 ^^ 
1,영화는 진짜 괜찮은데 내가 청각장애가있는줄알정도로 사운드 노답.아무리 저예산이라도그렇지 진짜 최악중의최악. 화가날정도로 대사안들림. 
8,재밌게 잘봣습니다ㅎㅎ 다시한번 느끼지만 학생떄는 학생다워야한다는거 또 다시 한번 더 느낍니다. 
8,우와.76년생도 초공감 하고봤습니다.시간여행 하고온듯.과하지도 부족하지도 않은 연기자들의 명연기. 
8,
8,한심하지만 한때는 동도처럼 ‘그들’의 삶을 살고 싶을때가 있었다. 그럼에도 인생에서 현승이 같은 친구 하나 있는게 얼마나 값진지를 최근에서야 알았다. 
10,
10,재미있네요잔잔하게 현실감있어요 
8,보면서 나만 나 눈가루야 ~ 생각났냐 
7,그 시절이 아름다운 시절은 아니었을지 몰라도 살면서 한번쯤 그리워지게 된다는 건 부정할 수 없다 
8,청소년 드라마라 할지라도 욕설과 폭력이 난무한다면 이렇게 청불로 하는게 맞는거지... 
10,
1,nnmmnmmnmmn 
2,영화라 전체적으로 과장된 표현이 많다는건 이해할수 있는 부분인데 끝마무리가 너무 허술하고 김빠지게 만듬. 
10,살면서 평점 처음쓴다... 학원물느와르 바람만알았지..이런명작을 왜 이제야봤을까.. 동철역 맡으신분 진짜 연기잘하시네요 
7,일진에대한 막연한 동경이 있었었지 
6,교복이야기는 모두에게 흥미로운 소재거리 아니겠는가.. 
10,오랜만에 친구보고싶네... 
10,간만에 재밌는 영화 봅니다 
9,주인공들 다 주변에서 정말 한명씩 본애들 같은 친근함 ㅋㅋ 
10,80년대 초~ 중후반까지 는 개공감할 영화.  하 정말 재미있다. 
8,가슴 아련해지는 영화. 
9,"영화""바람""같은 영화가 그리웠다면 볼만해요!! "
8,재밌다.! 추억가득. 
10,내 고교시절이랑 시기적으로겹쳐서 그런지 향수뿐만 아니라 십대의 먹먹함도  느끼게 해주엇던 영화 
6,딱 내 세대의 이야기 같아서 재밌기는 한데..글세.... 
10,멋진 작품이네요!!! 
10,강추 합니다 강추  합니다 
10,토렌트로 다운받아봤다가... 죄송한마음이 들 정도로 너무 좋은 영화입니다.. 죄송합니다. 
10,리얼리티의 끝이다 . 차엽배우 사랑합니다. 앞으로 이런영화많이 만들어주세요 감독님! 
6,학원느와르의 장점중 잔혹함만을 강조함 
10,흡사 바람을 보는 것 처럼 흥미진진 했습니다.^^ 
9,별로 기대 안하고 봤는데 정말 재밌게 잘 봤습니다. 
10,옛날 생각 나네요 ^^ 잼있게 봤네요 
10,"""야! 어설프게 놀꺼면 시작도 하지마. "" 이 말은 꼭 지금 청소년에게 감독이 해주고 싶었던 말이 아닌가 생각되네요. 좋은 영화입니다. "
10,간만에  꿀잼 영화네  존내 개의리 멋지다 
10,'바람'이라는 영화 이후에 근래에 보기 드문 웰메이드 영화다! 강추강추! 마무리까지 깔끔하다. 
9,간만에 좋은 영화 봤네요~~~ 
10,우우우~~ 정말 잘봤어요 ~~ 잘 만들어 주신 감독님께 감사를 ~ 수고해주신 배우 분들과 조연출분들께 감사를 ~ 꾸벅.! ^^ 
10,"정말 재밌게 본영화스토리도 재밌었고 적당한 웃음과 감동,교훈도 느낄수 있는 영화였음~!!!^^ "
7,그냥 옛날 생각나고 볼만했다 
8,배경이 인천이여서 반가웠고 제 학창시절 같고 친구들 모습 보는거 같아  추억에 잠기게 하는 작품이네요 
9,"10점 만점 주고 싶긴 한데..기,승,전 까진 몰입도도 좋고 스토리도 너무 좋았는데 결에서 너무 아쉬운 부분이 있다. 대체적으로 향수에 젖게 만들고 고딩때 친구들 얼굴이 새록새록 떠올라서 좋았음 "
10,정말 시간가는줄 모르는 영화.학창시절의 추억이 많이 떠오르네요.정말 오랜만에 좋은 영화 봤네요. 
8,"그땐그랫지  !!.,,;;:@^'-?♡?)?-;^^; "
10,재밌게들 보세요시간이 좀 짧네요 
10,옛날 생각 나게하는 영화. 최고~ 
10,고등학교 시절도 떠오르고.. 방황했던 청소년기를 보냈을 청년들은 추억이 새록새록 할듯 할 영화네요 독립영화치고 짜임새도 있고 아주 좋았습니다. 명량과 해적에 치어 개봉관도 없었을텐데 아쉽네요.. 
9,왠만하면 평점 안남기는데 이 영화는 너무재밌고 학창시절 누구나 겪었던 보았던시절을 생생하게 재현해 놓은거 같다 
10,남자친구가 하도 재밌다길래 안땡기는데 봤는데 너무 재밌게 봤네요 마지막 장면 감동적이었고 끝까지지루하지 않았어요 
10,친구들이 보고싶네요 ㅎㅎ 
8,바람 아류작이니 뭐니 하시는데 바람도정말재밋게보고 이것도 정말재밋게봣는데 바람나름 이것나름 재미가있습니다. 물론 내용이 학교 불량바탕애기니 비슷한느낌은있겟지만 정말재밌게봤습니다. 
8,저예산이지만 소년들의 성장통을 이야기한다. 상당히 재미있습니다. 
10,친구들에게 연락하고 싶은 영화!!! 
7,학창시절 생각이 절로 나는구나 
8,왐마. 다구리씬 빼고 진짜로 때려 뿌네..극 중 현승이 같은 존재가 정말 든든하다. 모두 연기가 물흐르듯 작살난다. 차엽이란 분 호감도 팍팍상승! 
6,이재응군 오랜만에 보네요ㅋ. 
10,간만에 재밌게본 한국영화 
10,간만에 시간아깝지않은 영화였습니다. 감사합니다. 
10,"90년대 학창시절 용어였던 노는아이들? 향기가 그대로 느껴지고, 지금까지 봤던 독립영화중에 최고였습니다. "
10,어설프게놀꺼면 시작도하지마 
10,그시절엔 다들 그랬지 . . . 세월이 흘러가면서 자연스럽게 깨우쳐지는걸 그땐몰랐지 진짜 추억이다 
10,영화를 보면서 부끄럽게 살아왔던 저의 청춘 시절을 되돌아보며 후회를 하고 많이 깨닫게 되었던 영화였습니다.  선정성과 폭력성이 순화되어 청소년들에게도 유익한 영화가 되었으면 하는 작은 바램이 있습니다. 
6,학창시절의 공감대 형성과 재미는 바람이란 영활 따라 올 수 있을까?? 
7,영화 바람보단 못하지만 그런대로 킬링타임용은 되는듯 싶다.현승역 맡은 배우처음 보는데 호감가게 연기잘하는 듯 싶다. 
10,진짜 지금 20대 중반 넘는 새대나 30대 8090 시대 분들세대라면 누구나 공감하는 영화 추억의영화내요 친구들과의 추억도 생각나게 만들고 감동적인면이 많았던... 
10,잘 만든 영화다. 주인공도 괜찮고 특히 차엽씨는 정말 괜찮은 배우같다. 어쩜 그런 역할을 그리 잘 소화하는지... 그리고 그 나쁜친구 역할 한 사람도 어떻게 그렇게 나쁜 일진 역할을 잘하는지 진짜 학창시절 나쁜놈이었...
10,"""야, 어설프게 놀거면 시작도 하지마."" .. 감동이다 "
10,영화 (바람) 같은 좋은 작품임 잼나게 봐삼용 
10,아이고 재밌다ㅋㅋㅋㅋ 
10,매력있는 캐릭터들 좋은 연기자들  참 많아서 좋았습니다. 
10,아 엔딩크래딧 올라갈려고 할때 얼마나 아쉽던지.안끝났으면 좋겠다라고 생각한건 처음이다.ㅠㅜ 
10,상업영화에 밀려서 이런 영화들이 극장에서 빛을 못보는게 안타깝다.. 바람도 그랬고.. 
10,다 잘됐으면 좋겠다 현승이도....동도도....동철이도....연희는 내꺼 
8,독립영화는 역시재밌다 
9,현승이 졸라 간지나노. 좋은 친구다. 
7,중고등학교 시절 추억이 새록새록 나는구나~ 지금 돌이켜보면 참 ㅎㅎ 
10,현실감도 넘치고 겁나재밌게봤네요ㅋ현승짱 
10,"추억이 새록 새록 돋는 영화 였다 연출도 괜찮았고, 어설픈듯한연기도 좋았다  아쉬운건 배우들의 음성이 작고 잡음이 많이 들어가서 듣기 어려웠다는거.. "
10,영화 '바람'과 함께  가장  볼만한 ... 학생들에게 추천해주고 싶은 영화다. 감독에게 박수를 보낸다. 
10,바람보다 잼잇다~~강추 ~~~ 
10,친구란게 어떤건지 보여주는 영화 추천합니다. 가슴한켠이 짠하네요 
8,학창시절이 가끔 그리운건 내일에 대한 걱정보단  감정이가는 대로 순수하게  생각없이 주먹을 휘둘르고 늦게까지 친구들과 어울려 놀았던 시절이 그리워서 그런게 아닐까. 
9,청소년이 바야되는데..청소년 관람불가 ?? 
7,학창시절 추억이 떠 오르네요 근데 내용이 너무 없네요 여자 때문에 친구를 배신하고 다른 무리에서 노는 진짜 학창시절 누구나 한번쯤 놀아 봤던 추억만 따온 영화 
10,개인적으로 가슴 뭉클하 
10,연기력 연출 인물구성 관계 모든게 진짜 어디서 본듯한..학창시절 겪어본.. 친구들 이야기 느낀감정 그대로 잘 표현 해냈다... 말죽거리 잔혹사 보다 더 높은평점을 주고 싶네요.. 배우들 연기력이 진짜 최고.. 
7,7점정도. 킬링타임용. 
10,킬링타임용으로 봤다가 빠져듬...옛날생각도 나고 ㅋㅋㅋ  이런걸 학생들이 봐야하는데 청불이라 아쉽네요. 학생이 술담배한다고 청불인가? -0- 
9,"작품속으로 빨려들어가서 보았네요 ,^^ 시나리오 캐스팅 다 좋았습니다 "
10,영화 친구 보다 현실적이고 바람보다 더 느끼게 많이 해주는 청소년기 성장 느와르.. 진짜 재밌게봅니다. 아무리 발버둥치고 설쳐봤자 다들 어설프다는걸 나이먹어서야 깨닫기전 청소년들에게 보여주고 싶네요 
10,누구한테나 현승이 같은 친구를 한명쯤은 가지고 있지 않을까?? 
10,추억잼~ 다들 어렸을땐 똑같았나봐ㅋㅋ 
10,너므즐겁게봣어요. 친구들한테연락하게하는영화! 
10,"가정교육과 환경의 중요성, 그리고 친구의 중요성.. 다시금 느낌. 이 시대의 청소년들이 올바르게 자라났으면 좋겠습니다! "
10,비디오가게 커피숖 일진 우정 고구마리어카 등 학창시절 향수를 느끼게 해준다. 너무 고마운 영화. 유비스의 별의전설 나올땐 향수의 기억이 더더욱 짙어졌다. 좋은 영화니까 빌려주는 거다~ 
10,간만에 재밌는 영화였습니다ㅎ 
10,왠만하면 로그인안하는데 진짜 잼있게 봣습니다. 감사합니다. 
9,나름 잼있게봤네요^^ 
10,한마디로 리얼하돋네요 
10,시간가늣지몰랐어요ㅎㅎ짱재밋었음 
10,재밌네요.. 저도 시간가는줄 몰르고봤어요  서주아 누나 이쁘네요  화이팅해요 
10,와..몇몇연기뺴고는 재밌다 학창시절생각남요 ㄷㄷ; 
4,파수꾼 같은 영화 기대하고 봤는데 주인공 너무 오글거림.. 막판에 차라리 고구마 던져주고 잘지냈냐 밥은먹고다니냐 한마디만 하는게 더 여운있었을듯. 영화보는 내내 동철이랑 주인공때문에 짜증났고 학생들이 전반적으로 너무...
6,군고구마 유망주들의 성장기 
10,"다 처음보는 얼굴이라 기대없이 봤다가 뜻 밖의 발견. 결론'착하게 살자, 어릴적 치기로 인생 망치지 말자' "
7,꽤 괜찮은 학원물. 대사가 잘 안들리는데 뭐 그럭저럭 재밌게 봤음. 배우들이 다 노안이라 살짝 이입하기 힘들지만 전체적으로 다 현실적 
1,와 영화 줄거리고 나발이고 뭐라고 말 하는지를 못알아 먹겠음 
9,녹음이 엉망이라 살짝 감점 
8,아 순간적으로 1000만 돌파한 영화인줄 ㅋㅋㅋ 1100명인데 잘못봄ㅋㅋㅋ 
10,크~내 어릴적을 보는 것 같구먼?? 
7,완성도는 떨어지지만 충분히 깊이있는 영화였다 
6,영화 자체는 독립영화인게 믿기지 않을 정도로 탄탄하고 좋았는데 문제는 음향이 완전 박살났네.. 주인공들이 목소리 깔고 낮게 으르렁대는 목소리를 담아내지 못할정도로 녹음장비가 열악했다는게 느껴지네 몇번돌려봐도 못알아들...
10,★★★★명작★★★★ 
10,전혀 어색하지않고 다들 연기가.. 
10,옛날 생각나네ㅋㅋ내가 딱 고1까지 저랬는데..담임 선생님 잘만나서..죽도록 맞고 정신차렸지..지금은 뉴스에서 체벌이다 뭐다 논란이 많으니 그런 선생님들도 많이 없어졌고 일진들도 양아치들만 있는것 같고 그 시절에만 느...
10,ㅠㅠ재밌다 굳굳굳굳!! 
10,시간 가는지 몰랐소 잘만든 영화고 리얼하다 
9,여운이 남는 영화. 성장하는 친구들이 꼭 봤으면 좋겠네요 
10,진짜 생각없이 봤는데 재밌네요 ㅎㅎ 연기파 배우들이 연기해서 더 잼 
10,재밌게 봤어요 ㅎㅎ어릴때 일진이랍시고 놀던애들. 지금은 편의점마트캐셔 공순이ㅎ 어설프게 놀거면 시작도 마시오~ 너그들한테 맞던애들 너그들이 사모님이라고 부르니까 ㅎ 
9,대사가 좀 안들리는것 빼곤 너무 좋은영화였습니다 
10,"페북 짤통해서 알게되어 봤는데 꿀잼이네요^^ 주무대가 동암역 북광장이어서 예전생각 더 나고요^^차엽, 이익준 배우 응원합니다!대사안들리는건 스투핏! "
10,와우.. 이런 수작이있었다니.. 일단 배우들마다 연기가 너무 실감났고 엔딩도 여운이 깊게남네요 아주 좋은영화였습니다. 
9,어설프게 볼거면 시작도 하지마라!! 
10,별기대안하고봤는데 진짜....시간가는줄모르고봤네요 ! ! 대박 !!!  좀 안들리는 대사도 있긴 했지만 너무 재미있게봤어요 예전의 8090시대 때 추억들도 새록새록 떠올라서 너무 재미있게봤네영 원래이런거안남기는데 너...
10,잘봤어요 소석이... 
6,내용 흐름도 좋았는데 대사가 잘 않들린다ㅠ근데 친구 좋아하는 여자를 왜 건드리지? 
9,"이런 영화가 많이 만들어 졌으면 좋겠습니다.상업적인 영화들 말고, 울림이 있는 영화가 많이 만들어지고, 많은 사람들이 보고 느낄 수 있는 .. "
10,굿뜨 의외로 잼나네 진지한 버전의 바람 느낌? 
10,남자라면 꼭봐야하는 영화 
10,진심으로 짠한 감동입니다 
9,보고있는 중인데 대사가 잘 안들려!!!! 
9,뭔가 아쉽지만 예전 생각나서 심장 쫄깃하게 봤네요 오글은 덤 
10,동도를 죽이면 끝나는 영화 
8,재밌는데 대사가 안들린다;; 
10,우리들의 어린시절 이야기를 다시보는것 같아 행복했습니다. 
10,진짜 재밌어요. 우와 '바람'이랑 비슷한 영환줄 알았는데..훨씬더 재밌고 여운이 남네요...그리고 굉장히 현실적이네요. 좋은 영화감사합니다. 
10,"요즘 비쥬얼배우혼자 영웅놀이하는 학원액션물보다 100배는재밌네요 옷스타일도그렇고 느낌을 잘살린거같습니다 너무집중하고봤네요ㅎ현승,동철역맡은 배우님들 연기너무잘하세요ㅎ "
10,맨날봐도 안질리는 영화 김태준 배우 연기는 정말 잘한다많은영화에 나왔음좋겠다 
10,시간 가는줄모르고봤네요 차엽같은친구가진짜 멋진친구네요 
10,한국영화 잘 안보는데 정말 재밌게봄 
10,재미있게 봤습니다. 10자 
9,자막깔고 재개봉하자. 
9,난 지금 다니고있는 고3으로써 배경보다는 내용이공감된다.. 시대가아무리지나도 저런내용은 변하지않아 내가 저기에 많은입장이되어봤거든 
10,영화 어설프게 볼 꺼면 보지도 마라~ 
10,정말 고딩때 그시절....저랬던기억이.... 참 영화가 여운이 남네요 
4,한마디로 어설프게 찍을거면시작도하지마. 영화였다..성장느와르라고해서 오묘하게 얽힌 사춘기감정들을 바탕한 감성심리를 기대했는데 느와르라 쓰고 드라마를 그려놨다. 다른예로보자면 군대를 예능진짜사나이로 미화시켰다. 그리곤...
10,재밌다 재밌어...  추억에 젖어서.. 시간갔다 
9,"배우들의 리얼리티가 뛰어난 학원물입니다.  '바람', '똥파리' 느낌도 나고 아주 좋았어요. "
10,간만에 시간 가는줄 모르고 본 영화였습니다. 
10,요즘같은 시대에 꼭 봐야 하는 영화가 아닌가 싶다. 마지막에 잔잔히 미소까지 주는 아름다운 영화. 
10,연희 송지효같네ㅋㅋ음.. 
10,그래도 돈으로ㅜ엮이지 말아야합니다 친구끼리.... 
8,배우들 연기가 좋네요. 빠져들어서 봤습니다. 
8,끝부분이 쪼금 아쉽네요.. 독립영화라길래 제휴 신경안쓰고 돈내고 받았습니다...재밌게 봤습니다. 
10,재미있다 .다만 영화속 대사에서 알아듯는 대사는 열마디도 안 된다는게 분하고 원통하다 
10,연기 다들 빠짐없이 잘하시네요 
10,불현듯 옛 추억이 떠오르게 만드는 영화네요 아무것도 무섭지 않았던 고등학교시절.. 사고치고 다녀도 즐거웠던 그때를 추억하게 만드는 영화네요 
10,정말 오랜만에 맡아보는 학창시절 향기를 그대로 재현해주었던 영화.의리만이 세상 전부였던 그 시절이 그립다. 
7,볼만한정도에요 ㅋㅋㅋ 
9,진짜 아까운영화ㅠㅠㅠ 
1,개스례기 조평신영화. 아무것도없고 가오만오지게 잡다 끝남. 
10,기대가없으면 실망도없다. 
10,와 바람 급으로 개 재밌네요 ㅋㅋ 진짜 옛날 생각도나고 너무 몰입감쩜 ㅋㅋ 현승 남자가 봐도 개멋있네 듬직허니 
1,우리들의 흑역사느와르 찌질급식새키들OOO패고. 또패야되 
1,영화 말미에 격한 후회를 느꼈다.이영화가 왜  평점이 이리 높은건지 이해못하는 내가 이상한건가? 
10,잘만들었다 정말 재미있었다 
10,진짜 명작이다어느입장에서봐도 재밌고 마지막씬이 구수하다 
10,청소년 영화라서 기대 안했는데 좋다 
10,학창시절을 생각하고  웃게 만들어주는영화 배우들 모두 연기갑 
10,와 독립 영화 맞나 ㄷㄷㄷ 
4,평점 보고 너무 기대했던 것 같다 
8,이 시대에도 차엽같은 멋진 1진 아재가 많았으면... 
6,재밌게봤어요~ 저예산영화로 똥파리다음으로 재밌는영화인듯 근데 음질이안좋은건지ㅠㅠ 1시간반동안 대사를 제데로 못들었네요 아쉬워요~ 
9,진짜 잘 만들었다... 83년생으로 공감 백퍼네 ㄷ ㄷ 
10,동아전과 같이 필요한 부분만 담았네요. 여운 있어 너무 좋아요^^ 
10,느끼는점이 많습니다 감사합니다~ 
7,현실성이 약간 떨어지지만 파수꾼 몾지 않게 잘한영화 
10,인생영화 ㅎㅎ 추천드립니다. 
10,영화 꿀잼 ㅋㅋ솔직히 동도 존나 엄마속썩이고 지수준 모르고 조나 나대서 개싫음 
9,20년 전이 생각나네요시간 가는 줄 몰랐습니다^^ 
