score,review
4,뜬금없이 나오는 노조절장애에 무슨 정의의사도가 나오는데 도대체 어디가 현실적이고 공감이가는건지.. ;; 주연빼고는 연기력도 지망생수준.. 스토리도 너무 전개가 뜬금없고 어색하다.. 독립영화라 예산부분은 감안하는데.....
5,하루아침에 일진 무리에 들어간다는게 말이 되냐? 
5,네 영화  아주 잘봤구요.  제 점수는요.. 
10,부천국제영화제서 인상깊게 봤습니다 ^^이익준씨 연기가 돋보이네요신인  배우신거 같은데 앞으로도 기대하겠습니다. 
10,재밌음 영화 옛날생각많이 나고ㅋㅋ 파수꾼에 이재훈하고 18엔 이익준이 비슷해보인다 잘하긴하더라 앞날이 기대되네. 
8,이 영화는 느낌이지~ 대사 안들리는 건.. 느낌으로 알 수 있다 ㅋㅋㅋ 
10,캬  숨은 명작이다. 졸잼이다. 
1,어설프게 할꺼면 시작말았어야지 감독님 .  10년전에 나왔으면 좀 괜찮았겠네 
1,포스터 부터가 중2병 스멜이더니 역시나 
1,평점이 왜 높은지 모르겠다 
2,이거 평점이 왜이래? 바람 따라한 3류에도 못끼는 짝퉁 영화?라고 하기도 좀 그렇다 우리나라 영화는 양아치들 얘기밖에 할게없나 
4,어설프게 만들거면 시작도하지마 
1,수준 이하. 
10,배우들의 연기가 훌륭합니다.  영화 보는 동안 학창시절 후달달 했던   실존  패거리들을 데리고  영화 찍은듯 리얼합니다.   그 시절 그때 생각나 지릴뻔 
10,관객수 1024명 ㅋㅋ 불쌍해서 평점이라도 높여줘야겠다 
7,현실성이 그닥 느껴지지 않는다 
3,니네들의 성장 느와르....이런 영화를 통해 추악함과 폭력을 학습시킬 수 있다는 걸 알고 만들길바란다. 
5,차라리 바람을 한번 더본다 
6,왜 그 시절은 다 조폭이고 싸움질이냐고. 
8,"현승이 모습이 그 시절 나의 모습 같아서 너무 공감가고 추억에 젖어 봤다...노는 친구들 안에서 무의식속에 나에게 의지하게 하면서 친구들 화해시키고, 힘없는애들한테 가식이 아닌 진심으로 존중 해주고 다른학교 왈이랑 ..."
4,무슨 메시지를 전달하려는 건지 모르겠다. 일진 미화냐 
10,동철이 연기 존나 찰지게 잘하네 ㅋㅋ 얜 뜰거같다 확실히 
1,주인공이 키가 너무 작아 ㅠㅠ 
1,;이정도평점받을건아니라서 평점낮출게요 
7,영화 바람 같은 느낌을 주고 싶었던 것 같은데 별로 그 느낌이 살지 않는다. 
9,"와~~ 배우들 연기 후덜덜 ,, 오그라드는 학원물 보다가 보니까 이영화 연기는 다큐급이다. "
7,"휴대폰은 90년대이고 길거리에 차들은 2010년대네..아예 셋트장에서 찍던지....영화 ""친구""와 ""바람""을 흉내내기에만 바쁜영화....그나마 좋은 영화를 흉내낸 덕에 평타는 치는정도....."
1,다운받아서봤는데 이게 머임? 아이폰으로 촬영한거임?? 
1,고등학생이 카페에서 담배를 펴도되고 동급생폭행 후배폭행 전형적인 양아치들 보기너무 불편했고 나오는 모든 애들이 불량스럽기 짝이없고 껍데기만있고 알맹이는 하나도 없는 졸작 
1,"이게 무슨 성장 느와르냐, 욕지거리에 개양아치짓 아니면 성장기에 개념이 안서나 보네, 하튼 대체 뭘 문화로 보는 건지 어이없고 코웃음 밖엔 안나는 구만, 도대체 이해할수없는 평점들이네 "
1,"사람이 무서운건 양들에 침묵에 랙터 박사같은 똘끼다,,볼팬한 자루만 있으면 눈깔에 쑤셔넣면 안들어가는넘 없다디질때까지 쳐맞으면서도 순종하는 사람은 없어요 뭐 영화를 이따구로 만들었냐..?지생각엔 똘끼없는 양같은사람만..."
1,영화는 안봤지만 출연진과 스텝의 피를 쪽쪽 빨아먹은 흡혈좀비 감독의 영화다. 이런건 봐주면 안된다. 
1,점수가 비정상으로 높아서 1점. 내 점수는 7.5점. 
1,아따 재미도 없네...에효 
1,어설프게 찍을거면 시작도 하지마 
1,무명을 쓸거면 고등학생역에 10대를 쓰던가 30대 배우가 고딩역활하는데 몰입갑 저하된다-_- 
2,유치한 감정싸움과 진부한 이야기우리들의 성장 느와르라는 부제가 아까운 영화 
1,말쭉거리. 친구1에 비교하면 점수가 너무 높다. 점수 조절좀하자 
1,양아치 짓을 해야 성장하나?? 그딴 성장 개나 줘라..! 
1,청소년들 폭력못쓰게하려고 마지막에 사회진출하는모습 보여줄 때 지나치게 비약이 심했다. 학창시절 한 주먹하던애들 사회나가서도 잘 먹고 잘하는애들 많다. 학창시절 놀지도못하고 덤으로 공부도못하고 그런애들이 저렇게 지지리...
10,이게 ㅈ밥들이 보니까 별 감흥이 없는거지 나는 감탄을 금치 못했다 그냥 할일도 없이 하루종일 고딩 흡연되는아지트같은 까페에 쳐 모여앉아서 왼종일 쌈이나 빨다가 저녁에 한두명 합류하고 소주 노상까고이게 ㄹㅇ 고딩이지 ...
4,바람이란 영화 아류작이군 연기력이나 재미는 바람보다 딸려 
1,난 평점 알바가 있다는걸 알앗다 이평점이 말이되냐? 폭력써클이 7점대인데..이영화는 평점 6점이 딱이야....바람>폭력써클>18...이게 정확하다..극장가서 보면 돈낭비다.. 
1,"냉정하게 평가하겠다. 폭력써클, 바람, 말죽거리 잔혹사 등 학원물의 기본틀에서 벗어나지 못했고 짜임새가 매끄럽지 못하다. 마지막 엔딩에서 그래서 주인공하고 여자애하고 어찌됬는데? 이 생각뿐 "
1,이거 본사람들 진짜. 인내심 대단하신듯 
