score,review
10,태어나서 처음으로 네이버평점줍니다. 정말 하나부터 열까지 섬세하게 부분부분 아주 잘 표현한거같습니다. 디테일한부분까지 정말 향수를 느낍니다 전 개인적으로. 우리나라 영화중 친구 다음으로 또한번 재미있게본 영화입니다....
10,사회나 학교나 비슷한 점이 있다. 약자한텐 막대하고 이용하려 들고 강자한텐 굽신거리기 바쁨.... 무튼 영화 재밌게 잘봤습니다. 
10,어설프게 놀려면 시작도 하지마라 
10,우연히 보게된영화였는데 반항기있는시절같은 영화는 뻔할줄알았는데 보고나니 되게 잘 만든영화라고 생각들었습니다.추천할만한 영화네요 감동과 우울 현실에있을법한 얘기 영화에 나오는 소년들의 마음을 볼수있어서 좋았어요 앞으로...
9,와 진짜 배우분들 연기가 진짜 실감나네요 정말 좋습니다. 진짜 현실 양아치 같았음 차엽인가 그분 너무 듬직하네요 영화 참 잘만든거같습니다 결말이 살짝아쉽지만 
7,아따 잘만들었네 근데 남주가 너무 찌질하게나온다ㅋㅋ 
10,쵝오다 최엽이라는배우를새로알았다 
10,사실적으로 잘 표현된....하지만 상업영화들에 가려 빛을 보지 못한 것이 아쉽다. 
9,몰입감좋았음ㅎㅎㅎㅎ 
10,난생 처음 평저 등록해봅니다 최고에요 너무 재미있었어요 
10,여자 하나때문에 다 파탄남 
7,별 기대안하고 봤는데 볼만하네 
10,독립영화가 이렇게매력있는것이었나요 배우들하나하나가 다주인공이네요 
10,오우야~~~재밌네ㅋㅋㅋ 
4,모꺼 시다바리 한걸 영화로 만든기가~ 
10,잘봤음.지루함없고 공감되고.우리들 그땐 왜그렇게 커피숍에모여 죽때리고있었을까 ㅋㅋ 
9,지금 현재 나이 30~45세정도까지는 다들 공감하고 저렇게 논게 맞긴한것 같네요...스토리 구성자체가 현실에 맞고 정말 재미있네요!! 전 바람보다는 이게 더 재미있게 느껴지네요~약간 좀 길게해서 나머지 친구들도 다 ...
8,여자 문제로 싸우게 되는 일 ㅋㅋ 저도 친구들 사이에서 학창 시절 있었던 일이고 공감이 되네요 ㅋㅋㅋ 그리고 서주아씨 이쁘십니다!! 
10,"마지막 장면과 대사가 인상깊네요.""어설프게 할거면, 시작도 하지마!"" "
8,진짜 재밌다 학교이야긴 다 재밌는듯 아무튼 친구를 잘 사겨야한다 
10,말이필요없다. 이건 그냥 봐야한다. 
3,뭔가 보여주고 싶었으나 시간관계상 좃밥으로 막을 내리는 영화 
9,그냥 많은게 느껴진 영화였다.. 
4,뭐지.. 왜 만들었을까 싶음. 감독의 자전적 이야기를 풀어내고싶었던건가.. 찌질하고 어이없는 시절을 보낸 지금의 우리 중 누군가를 만든 얘기지만.. 걍 별로였음. 파수꾼이 연상됨. 글고 스크린채널에서 욕을 하도 잘라...
10,와..잘봤습니다 어렸을적 기억이 많이 나게 되는 공감되는 영화였습니다 
10,우연히 보게되었는데 정말 기억에 남을 영화인듯 싶네요 좋은작품 감사합니다 
10,몰입감 최고네요~ 이런영화 멋지네요~헐리우드 고예산영화보다 훨씬 낫네요~ 
10,헐....개공감 감독짱 
10,70년대 태어난 나에게 이 영화는 그냥 최고다~~~ 
10,진짜재미있었습니다. 
10,보물같은 영화.그래 80년 초반 생들은 이렇게 살았지 
9,집중해서봤네요 주인공 연기너무잘해요  그러나정신건강엔안좋음ㅋㅋㅋ저게현실인데 실제있는얘기일거라생각하니 마음이아프네요 
10,너무 공감되게 잘봤습니다 그리고 현승역활 차엽님 정말 맛깔나게 때리시네요 ;;저게 연기인가 싶을정도로 .. 보면서 소름 돋았습니다.. 
9,진짜 집중하면서 봤던영화.. 그리고 남자라서 더욱 더 공감갔던 영화 갠적으로 바람보다 재밌다! 
10,재밌게 봤다청소년들이 꼭 봤으면 하는...참 리얼하게 잘만든영화 
10,정말 재밌게 봤어요 이런 장르의 영화를 좋아해서요 바람 폭력써클 등.. 
10,재밌게 보고 갑니다 후 정말간만에 몰입해서봤습니다 
10,최고입니다~ 몰입하면서 봤어요 
10,졸잼빅잼졸잼빅잼 ㅋㅋ 
10,최근 1년 동안 본 영화 중에 최고였어요!! 
10,와아아아....김기덕 영화보다 더 보기 불편하다. 진짜로 거울 보는 것 같았다. 내 중학교 시절이 떠오르네. 동철이 같은 애들이 많지.근데 동도 임마도 나약해서 문제야.나도 저때 나약했었지.아직까지도 저런거 있어요....
10,말이 필요없다 한번 봐라 
10,이런 영화가 정말 개대박 나야 하는데 ㅠㅠㅠ아~~ 슬프다 진짜 
10,마지막씬은 잊을수없을것같습니다. 소중한 학창시절 생각에 눈물이흐르네요. 
9,오랜 만에 시간 가는 줄 모르고 집중해서 보았던 영화였습니다. 공감과 인물의 심정이 되어 보기도 하였고요.. 잘 만든 영화네요.. 
6,"코믹적인 요소가 없으면 강력한 드라마적인 요소라도 있어야 하는거 아닌가.... 친구, 바람 등의 반항기적 드라마. 왜라는 질문보다 어떻게라는 질문이 어울리겠다. 그래 사람은 누구나 그럴수 있다. 마지막 군고구마가 희..."
10,말이 필요 없다... 이건 영웅 스토리가 아니다. 
10,티비 VOD에 싸길래 그냥 봤는데..3일연속 보게만든 영화.향수병돋네.저거슨 논것도아닌디ㅋㅋ아 옛날이여ㅋ 
9,배우들 연기에 몰입이 잘되었던 영화 
9,재미지고 추억 돋는 영화였다 ㅋ 다만 아쉬운 부분은 음향장비에 문제가 있었는지 대사 전달이 많이 안됐다... 
9,화학조미료 쪽 뺀 진국같은 영화.이것 저것 가미가 되지 않아 더욱 푹 빠져들어 볼 수 있었음. 
10,아 원래 리뷰 안다는데 너무 재밌네요 지금보다 90년대 후반이 더 좋았던거 같다 디지털과 아날로그 그 사이에서 나도 학창시절을 보내봤었으면ㅜㅜ 
10,기립박수 보냅니다. 예전 친구를 공감하지 못했지만 이 영화는 공감하고도 남습니다. 
10,아쉬운 착한느와르.. 
10,동철같은 애가 진짜  사회 쓰레기 
10,개쳐울음.. 배개 다젖음 
10,"살면서봤던영화중최고인거같다 바람이랑 느낌이비슷하고 유명하지않은 배우들의 등장과연기력,스토리도좋고 옛생각도많이나게만드는영화다 진짜최고 시간가는줄모르고봣다 "
8,난 별생각없이 돌려봤는데계속생각남 ㅋㅋ그래서 오늘제대로봤는데재미지네요딱 우리때 얘기네 공감가는것도많고ㅋㅋ참고로 80년생ㅋ 
8,그냥 편하게 볼만한 영화....중간중간 엉성한 편이지만 나름 괜찮은 영화 
10,"품행제로,말죽거리잔혹사,바람 그리고  이영화 정말 재밌게본 성장영화. 독립영화 치고 사운드 빼고는 다좋은 감독,배우.내용 쵝오다 "
10,굿굿저런친구가있다면 얼마나좋을까 
9,잘 만든 영화. 현승(차엽)을 포함한 배우들의 연기도 인상적이다. 이런 영화가 많이 흥행했으면 좋겠다. 
5,어설픈 '바람' 보는느 낌 
10,독립영화 처음 본건데 정말 재미있게 봤습니다. 공감되는 부분도 많고 옛날기억도 떠올리며 봐서 더 좋았던 영화인것같습니다. 
10,배우들 발음만 정확했더라면 100점 영환데! 
7,보는내내 정말 답답함 ㅡ ㅡ 왜 계속 맞고있는거야... 그래도 추억에 잠길수있었던 시간 
6,그 시절 놀던 아이들의 허세 리얼리티 
7,마지막이 아쉽네... 받은거 배로 갚아줬어야 아름다운 결말인데 9점 주려다 마이너스 2점... 
6,어설프게할거면 시작도하지말지 
8,킬링타임용으로 적절하였습니다 시대배경디테일부분은 역시 독립영화라 아쉽습니다 그러나 몇장면은 연기자들의 노력하는장면이보이네요.주조연중 몇명은 캐릭터가 눈에 띄는데 좋은작품으로 다시만나야할터인데 힘들겠지만 이한편으로 끝...
6,"동도의 반항기, 동철의 성장통이 포맷인데 이들보다 눈의 띈건 현승의 의리. adr티가 너무 나는 사운드의 아쉬움.지긋지긋한 독립 학원 장편물, 그렇다고 학원물 역사의 획을 긋는 수작도 아니다. "
10,완전 재밌다....킬링타임용으로 보려고 했던 영화인데 한 장면 한 장면이 의미있고 공감돼서 나에게 돌아왔다. 
7,마지막 동도 물레방아에서 느낀 통쾌함 
10,영화가 넘짤아..ㅜㅜ 간만에 재미난 영화 잘 봤습니다 
10,아무기대없이 봤는데 개재밋게봤다.. 바람을 이을 대작급 
10,"이런 게 만점짜리 영화다. 헐리웃처럼 블록버스터는 아니지만 사람이라면 누구나 공감할 수 있고 '아, 나 때도 저런 시절이 있었지'하면서 푹 빠져서 볼수 있는 영화. 주연 조연 배우들 연기가 모두 만점주..."
10,8090세대 사람이라면 충분히 공감 할 내용 그때 고등학교 친구들 그대로 만나 현제 가끔 같이 소주 한잔 마시며 추억팔이 하는 내용 이런 영화가 한편쯤 나오길 바랬는데 만들어 주어서 고맙다는 말 하고 싶네요. 잘 봤...
8,재미있어요. 여자배우 연기가 쬐~끔 거슬렸지만! 
10,아무생각없이 봤는데 너무재밌게 본 영화난 서주아씨만 보이던데 다른작품으로 또 봤으면 좋겠다오늘 난 또 팬이되었다 
10,옛날생각 나구 좋네요 우리 어머님 보여드려두 좋아하실듯... 
10,질풍노도의 시기를 제대로 보여주는군 
10,영화 내내 시간가는줄 몰랐습니다. 이익준씨 신인 같은데 연기가 정말 좋네요. 재밌게 봤습니다. 
10,정말학창시저로마치빠져든거같이착각하게만드는영화!강추합니다끝날때까지지루함이없네요배우들연기도실감나고멋지네요 
7,어리숙하지만 에너지로 꽉찬 18살같은 영화 
10,완전 현실적인 십대들의 이야기를 어린 연출자와 배우들이 멋지게 풀어냈네요..특히 동철 캐릭터를 연기한 이익준이란 신인배우의 눈빛이 예사롭지가 않군요.. 다들 건승하시길 
3,일진 통이 찐따 뭐좋다고 저렇게 데리고노냐   바람에 비하면 리얼리즘이 한참 부족하다 
10,개인적으로 일진물 중에선 작품성을 논할 수 있는 유일한 작품이라고 본다.배우들의 연기도 뛰어나다. 
1,대사가 너무 안들려서 뭐라는지 못알아먹겠음 
8,대현이같은놈이 진정한친구지 
9,대사 웅얼거리게 들리는거 나만 그렇게 들리는줄 
1,"무슨 소리 하는지도 모르겠고, 무엇을 전하고자 하는지도 모르겠고 주인공도 너무 비호감;; "
1,"엄마,현승,영권역을 제외하고 정말 너무나 연기들을못해서 몰입이 어려웠다. 음향처리는 왜그리 개판인지 한국말을 알아들을수가 없었다.미드보는줄. 개연성도 개판이라 흐름이 이야기를 만드는게 아니라 이야기로 억지흐름을 만들..."
10,이익준 악역 쩔어ㄷㄷ 어설프게 놀거면 시작을하지마라 
7,대체 뭔 말인지 웅얼웅얼거리는 대사만 아니었어도 참 좋았을텐데..  내용과 연출은 아주 좋다. 
10,팩폭 영화. 일단 이건 실화다. 모든 중고등학교 실화. 이것만으로 이 분야 영화로 만점 
10,차엽배우 팬됐어영. 멋있다잉!!! 내가 생각하는 진짜 남자. 저런 남자 여자한테 인기 백방 많다. 듬직함의 표본. 앞으로 주연으로써 많은 작품 많이 찍으시길 부랍니다. 응원합니다 아뵤 
10,이거 독립영화였구나. 완성도가 높아서 몰랐네 
10,현승이 역할이 이영화 다살렷다. 
8,내일 출근 해야하는데 새벽까지 봤네 
10,무거운 듯 재미가 있다. 시간을 거슬러간 기분이 들었다. 
8,좋은 친구는 어떤 친구인지 의문이 들었다 
10,에휴... 친구 잘사겨야지요... 
1,시나리오가 머 그리 엉성하냐 이건 머 
10,잠이 오지 않은 밤 무심코 틀어본 영화 엔딩크레딧이 올라가며어느새 새벽3시를 넘었네요여운이 남는 영화 입니다 정말 오랜만에 집중해서본 영화이기도 하구요 독립 영화라 그런지알려지지 않은점이 많이 안타깝네요 
10,좀 놀았던 남자들이라면 완전 공감 
10,첨에 동도엄마한테 좀 야시시한 느낌받아서 기대했는데 전혀 그런장면은 안나왔네 ㅋㅋ 현승이 멋있다 ㅋㅋ 
7,현승이가 후배 와사바리 터는장면이 압권 
10,현실감있게 잘만드셨습니다 
10,학창 시절이 생각나는... 그러나 마지막에 거기서 군고구마 장사하기에는 좀... 
1,평점에 속앗네. 병맛 쥔공에 어설프고 지루한 스토리에... 
1,윤선이 너영화이따구로 만들래? 
5,유머와 로맨스를 잃은채 건조하군 
5,그냥 담배피고 쳐 맞다가 끝나는 영화. 감독 무슨 허세병있어요?? 
5,잘나가다가 끝에가서  왠  환타지? 
6,이런 소재는 억지 감동으로만 안가면 계속 먹힌다. 
10,정말 잘 만든 사춘기시절의 영화 
10,굿.. 시간 가는줄 몰랐음.. 옛날 생각도 나고 ㅎㅎ 별다섯개~ 
10,"이들의 일탈에 대해선 크게 공감할 수는 없었지만 그 속에서 피어나는 다소 거칠지만, 단순하지만 아름다운 우정에 함께 울고 웃었다. 특히 동철이가 많이 울려줬다ㅠㅠ 그리고 여전히 순수한 동도^^ 여운이 남는 작품.. ..."
10,영화 정말 재밌게봤어요 !!특히동철이케릭터가 너무매력있더라구요 나중엔 마음이짠하기도하고 ㅜ ㅜ 이익준배우 다음작품이아주기대되요! 
8,내 학창시절 동철이같은 OOO도 현승이처럼 멋진놈도 있었다. 하지만  가장 애틋한건 동도 옆에서 똑바로 살라고 충고해준 대현이같은 친구라는거 
8,"정말재미있네.연출좋고, 연기들은 더좋고! "
8,진짜 내 어릴적 양아치애들이랑 똑같다 심리묘사도 너무 좋고 말투도 딱 중고딩말투 신기한게 그당시 내가 느꼈던 마음이 그대로 느껴짐 배경이나 날씨도 어쩜 그때 그당시랑 똑같이 만들었지? 
1,뭔가 시작도 없고 결말도 없는 영화 
10,추천해드려요 진짜 재밌어요 ㅎㅎ 옛날 그 느낌 그대로....딱 중학교로 돌아간거같은 느끼 그대로네요 ㅎ 
10,저도진짜재밌게봤어요... 현승이가 넘 멋지네요.ㅋㅋ 
7,영화보다가 고구마 먹고싶어 디지는줄... 
10,♥♥♥=♥♥♥♥=♥♥♥ 
5,아오 병 싄 들이 왜 댓글에 고구마 스포해놨지 ㅡㅡ 볼까말까 대가 리 빡구들ㅡㅡ 
10,뻔한 학원물이겠거니 했는데..생각보다 굉장히 잘만든 독립영화인듯~ 잘보았습니다. 
10,솔직히 기대하나도 안했는데..예전 중 고등학교때 생각 정말 많이 났습니다.. 똑같진않아도 정말 비슷하고 와닿은 부분이 많았네요...시간가는줄 모르고 정말 몰입해서 재밌게봤습니다..정말강추합니다.. 
10,어설프게 놀거면  시작도  하지마 
10,와 정말 대단한 연출이다 
10,"이재응? 너무 어려보임;; 안어울리지만, 내용은 참 알참!! ㅎ "
10,몰입도 있는 영화. 어느순간 등장인물에 빠져드는 
10,마지막에 고구마던져주고 야 담배한대피자  이것도 괜찮았을뜻남자들은 담배한대로모든 대화가 해결되니깐ㅋ 
10,"감독님, 그들의 10여 년 후 모습을 가지고 속편 제작 부탁드립니다!궁금합니다.아마도 지금의 우리 모습과 또 닮아있을것 같아 가슴 한 구석이 아려옵니다...부탁드립니다.28,34. .42,부탁드립니다. "
9,채널돌리다 봣는데 꿀잼이네..근데 19세인데 욕이나 모자이크 진짜 보기 역겹네... 
1,솔직히 배우 연기 어색해서 보다가 끌뻔.. 
10,저런 일을당하고도...남자들의 우정이란게  부럽다... 
10,이익준형!방금 목욕탕 에서 봤는대!실물~존잘!!형 나오신 작품2개나 봤는대ㅎㅎ연기 살아있슴돠!!인사하려 했는대 옆에 아버님?도 계신거 같고!타이밍을 못맞췄네요...ㅜ아쉽..형 대박나세요!!!!^^굿! 
5,개연성이 부족함. 현승이 동도와 친해지는 계기가 없이 억지스러운 전개 
9,정말 아무생각없이 봤다가 득템한기분이다역시 네이버영화의 평점은 나의 평점과 기준이 비슷하다 배우들의 연기가 너무좋았던영화 ! 현승이는 남자인 내가봐도 멋진 짱이다 ^^ 
10,아 말죽거리 이후 십여년만에 제대로 된 학원물 납시오!차엽 이익준 두배우 연기가 아직도 여운에 남네요...정말 잘봤습니다. 
10,지금도 이런 우정이 있을까?? 현승과 동도 우정....와.... 현승이라는 친구가 단 한명이라도 있었으면 좋겠다..진심 시간 가는지 모르고 봤다... 진심 짱이다 
10,"원래 지겨워서 영화를 진득허니 못보는 나, 하지만 이 영화는 순식간에 빠져들었고, 순식간에 끝이났다. "
1,누가 재밌다고 한거야 이게 왜? 진심 주인공 같았던 사람들이나 재밌게 봤나부다 
10,독립 영화의 가능성을 보여준 명작입니다. 배우들의 연기나감독의 연출력이 정말 군더더기 없네요.특히 현승 역의 차엽씨 앞으로가 기대됩니다. 
10,"재밌다..커피숍에서 줄담배 피는거, 친구집 비었을때 과자 부스러기에 소주 마시는거,등 여려가지 부분에서 공감 가는 장면이 많았다.옷 스타일도 비슷했고 "
1,결말부분 ..오랜만에  쳐때린놈한테 고구마던지면서 어떻게 담배를 필수있죠..현실은 저러다 최소사망일듯... 
6,전체적으로는 괜찮았지만... 결말은 도저히 납득이 안간다. 그냥 시간이 지나면 다 용서가 된다는건가... 
10,보기드문 좋은영화가 여기있다. 
9,친구를 정함에 있어 좋고 나쁘고를 가르기 보다는 진정 서로를 위하는가를 생각 하는게 먼저인것 같다. 
1,이거에 공감되고 이게 추억이라면 니들 학창시절 다 양아치 새끼들이였냐? 
5,"초반부는 나름 괜찮지만, 파국으로 가는 과정과 인물의 감정은 진부하고 폭력과 방황을 청소년이라면 누구나 겪을 일반적인 상황으로 치환시킨 것은 받아들이기 어렵다. "
10,진짜 이런게 영화지 !!! 와 현승이 연기 개잘하네 
5,사운드에 신경을 더 써야지 
6,바람 패러디.ㅋ 그 뚱보는 참 성격이 멋있다. 근데 왜 마지막에 혼자가서 다구리를 처맞는지?? 
10,졸업하는 순간 다 똑같아 진다. 참고로 현승이 같은 친구가 진짜 좋은 친구다. 저런 친구가 주변에 없어서 아쉽다. 
10,일단 영화가 현실적이어서 재밌었다. 근데..엄마 연기가 너무 현실적이어서.. 보는 내내 너무 가슴이 아팠다 계속 보기가 힘들정도로 
10,학교다닐때  영웅심에  쌈잘하고  잘나가는애들하고 놀고싶지만   고등학교 졸업하는순간  양아치  백수질시작해서  인생종침니다  그래서 옛 으른들이  하는말이  핵교다닐때   공부혀라  이소릴 맨날했나봅니다  저도지금...
1,OOO기 영화 이영화 평점이 8.5점 이라는데서 한국인들의 수준을 보여준다 
6,재미는 있지만 억지로 끼워 맞춰져 있다마지막 장면이 영화를 훼손시킨다. 
10,?어디서많이 봤다했더니 국가대표에나왔던 봉구네요ㅎㅎ현승역할 배우분 연기가 가장 인상깊었습니다. 중간중간 마동석씨 느낌도살짝 났네요 ㅋㅋ 
8,영화 바람이 생활했던 학생들의 스케일의 영화라면 18은 그보다 아래 1진들의 영화 그래서 공감가는 부분도 많을수도.. 나름 감동도있고.. 포인트는 차있는 남자가 입쁜 여친 만들고 공부안하고 놀면 군고구마 구우니까 다...
1,연기 조오오오온나 못하네 빡친연기가 제일 쉬운데 동철인가저 배역맞은 놈 혀만 볼에 말아넣으면 빡친연긴줄아나 오그라든다 쓰레기연기에..ㅎㄷㄷ 
7,현승이 괜춘하네 ㅎㅎ. 
10,좋은 영화다 청불영화인데 10대가 봐도 좋은 교훈을 줄것같다 
9,젊은 청춘들의 가슴앓이에 마음 아프네요 
10,"오랜만에 끝까지 본 영화는 처음이네요.고등학교때 생각 나는 영화입니다.현승 역활 하신분, 미쳤네요. 흐름을 어떻게 자연스럽게 연기할수있는지.. 다음작품 기대해보겠습니다. "
8,현승이가 진짜 남자다 괜찮게 본 영화 
8,배우들의 리얼한 연기로 몰입감이 상당함.방황하는 사춘기 소년들의 우정과 성장통을 잘 표현. 
10,OO..따까리..양아치일진..멋진일진..현실 연기  굿! 
8,재밋게봄..양아치같이 놀면 결국 성인되서 다 나가리된다는 교훈! 
4,아무리 독립영화라도 다음부턴 음향에 제발 신경좀 쓰길...4점 드림 
6,통메모리즈 바람보다는못하지만 그래도..나머지학원물보다는 
1,착한일진은 죽은 일진뿐이다 
4,"대충 막판에 퉁치고 어물쩡 하는거 너무 챙피,  고2병 은 중2병이랑 다르게 좀 세련있이야 하지 않겠어요? "
2,좋은영화라고 하는 사람들은.. 배우들이 뭐라고 하는지 다 알아먹은 사람들인가..?? 웅얼웅얼 중얼중얼.... 
2,대사 안들림 여러가지 용량 파일 다운받아도  안들림 
10,이영화를보고느낀것 자식 낳아받자 다소용없고 불량학생들하고어울리더니 부모가슴에데못을밖내  역시 결혼은 미친짓이내사랑그거 왜하나 몰라  돈이나 열심히 모아서노후준비 하세 
8,모든 출연진의 딕션이... 음향 문제인가? 
7,동도가 너무 찌질하게나오는데 저렇게 어울리는게 가능햇을까?라는 생각들고 동철이가 연희를 좋아하는걸알면서도 동도가 고백할용기가 있엇을까?? 재미는잇엇다 
10,현승이 멋지다 남자답고 
7,"영화 ""바람""보다는 전체적인 완성도는 떨어지고, 억지스러운 면도 없지않아 보인다 양아치를 그저 ""친구""라는 이름하나로 묵살하려는건 진짜 친구가 아니다. "
8,대사가 너무 웅얼웅얼댐 
8,주인공이 연기가 아니라 진짜 찐따인거 같은데요? 
8,잘그렸다 허나 8점이상의 영화는 아니다. 건들대는 학창 시절의 극히 일부분만을 담아서 오락도 다큐도 둘다 놓쳤다. 네티즌들의 멍청한 평점 보면 박사모들이 ''어린것들이 뭘알아?'' 하는 ...
4,왜 국내 성장 느와르는 죄다 불량배 이야기어야 하는지.... 
6,현실성은 떨어지지만.. 볼만은 합니다 
2,이거보고 향수가득하단 애들은 일진 양아치 확률 아주 높음. 
5,옛날영화....80년대이야기 
5,영화는 영화로 보는게 맞겠지만 마무리는 암만 영화로 볼라해도 말도 안되게 매듭 지어짐. 
9,다 좋은데 너무 리얼리티를 추구한 나머지(?) 대사가 좀 안들리는게 있었습니다 영화가 아니고 그냥 그시절 일상의 학창시절을 보는거 같다는 생각이 들정도로 너무 리얼했습니다. 동철이는 정말 순수 악으로 보일정도로 연기...
10,악역 맡았던 배우 진짜 연기 잘합니다 ..진짜 간혹가다 몇마디가 웅얼웅얼 안들려서 빠꾸해서 사운드 크게 해도 안들려서 포기한때가 있었음..  몇군데 대사전달이 아쉬웠지만 잘 안들렸어도 영화가 재밌어서 괜찮음 
6,그때 그 시절의 추억을 자극시키긴 했지만..약간 무엇인가..부족했던..예전 바람보다 스토리 전계가 제대로 이루어지지 못한 점이 아쉽.. 
7,재밌게봤는데 엔딩이 완전 애러네ㅋ 
10,다시한번 고등학교때 시절이 생각나고 잘노는애들이랑 한번 친해지고 싶다라고 생각한적도있었는데 참 재밌고 시간가는줄몰랐다 
9,그대 그시절의 친구들이 생각나는 영화..차엽의 연기에 박수를 보냅니다 
10,불편하지 않고 편하게 볼수있는영화!!!과장하지 않고 공감할수있는 스토리 
10,날웃게했던 시절에 못봤던 모습들을 기억하게해줬다. 
6,참 재미없게 만들었네요 재밌을줄 알았는데 주인공때문에 봤네요 이재응 워낙 연기를 잘하니 첫 1시간은 지루해 죽는줄 알았고 나중 20분가량만 재밌습니다.  주인공들의 불꽃튀는 연기력 없었음 아예 재미없었을듯 킬링타임용...
8,정우 주연에 바람 보단 못하네....ㅜㅜㅋ 
10,명량보다 훨씬재밌다 이런게 명량은 하.. 진짜 내 스타일 아님 
10,처음 유포한사람이 이상하게 해서 소리가 문제인듯원본은 소리깨끗하고 잘들려요 
5,감독님은 본인이 찍은 이영화 대사 제대로 잘 들리시나요?? 
9,재응배우님 너무 연기가 좋아요!! 
8,크....연기 잘하네 
10,"영화 ""파수꾼""과는 또다른 맛 "
2,리얼한 것 같으면서도 현실성이 없음일진 중에 현승이 같은 애는 실제 없음일진이나 양아치들이 우정을 위해자신을 희생한다? 말도 안 되는 소리실제는 가장 친한 친구라도 배신을 밥 먹듯이 함 한 번 양아치는 양아치일 뿐 
10,오래 걸리는구나 후.... 
4,어설프게 만들거면 시작도 하지마 
