score,review
9,성소수자의 이야기와 액션을 접목한 영화라서 신선했어요 
8,차승원연기가 좋네요~ 
9,차승원의 색다른 모습을 볼 수 있었다.원래 멋있는 차승원이였지만 더 멋있었다.넉놓고 차승원을 본듯 했다. 그치만스토리가 허술했다. 결말도 조금은 뭐지 싶었다. 
10,역시 우리 독고진횽아 멋쪙♥ ^♥ 
9,솔직히오늘개봉작중가장약하다고생각하고별로기대안하고본영환데정말잼났어요 디테일강하신장감독님 연기쩌는차승원님 오정세님 그외다수...올해본한국영화중최고고역시장진감독님진심쩌시는걸로♡ 
7,가볍지 않게 풀고자 한 감독의 의도는 알겠으나 지나치게 잔인하고 신파적이다. 차승원은 최고의 연기를 보여줬지만 장진은 이제 기대감이 없는 감독이 된듯하다 
8,완벽하지 않습니다. 스토리만을 봤을 때 큰 짜임새는 모르겠습니다.  그런데ㅡ 보고나서 오랫동안 가슴이 먹먹합니다. 차승원이라는 배우보다 그저 주인공 지욱이라는 사람이 생각나게 합니다.  평생 전혀 이해할 수 없는 감...
4,장진감독 영화볼때마다 느끼는거지만 영화전체가아닌 일부장면만을 생각하는듯하다. 그 일부가 합쳐지면 산만하기만 하다. 관객들은 이영화가 개그물인지 착각할 것이다. 억지로 넣어버린듯한 후반부 액션...하지만 차승원은 굿....
10,"느와르는 이래야한다. 짜임새를 논하기전에 영화를 본후의 느낌!!! 어둡지만 추하지않고, 슬프지만 싫지않은...누구나 자기안에 하이힐같은 양면성이 있을 것이다. 차승원은 정우성보다 멋지더라. 갑중의 갑! "
9,재밌어요차승원의매력이십분발휘되고다루기힘든주제까지잘담은. 
8,내가 본 차승원의 연기 중 최고가 아니었나 싶다! 남자가 봐도 멋진 배우. 
5,시간에 쫒겨 마무리를 너무 대충했어.. 실망이야.. 차승원은 굿! 장진 감독은 내리막.. 
10,엔딩에서 많이 울었어요. 결국… '지욱'은 자기를 버린거니까 
10,진심아무의심없이봐도되는영화. 차승원최고진짜 와 
9,차승원은 이제 클래스가 다른 배우의 대열에 들어섰다. 이 캐릭터를 누가 하랴… 
10,차승원씨 액션 너무멋있구 아름다운 서정영화를 본느낌이랄까  ㅎ너무재미있어요 ㅎ 
8,배우 차승원의 터닝포인트가 되는 작품이 되지 않을까 
8,영화괜찮았음 강약조절 적당했고 차승원멋졌다!영화줄거리만 보고 가도 어떤 영화인지 알수있을텐데 몇몇씬에서 대놓고 불편한 티내는사람들. 우리나라관객수준에 실망했다. 영화줄거리 꼭보고가시길... 
10,"차승원을 위한, 차승원이기 때문에 가능한 "
9,재미있었습니다 시간이 아깝지않았습니다 
10,액션은 말할 것도 없이 최고. 차승원의 눈빛도 최고. 내용도 너무 좋았어요~ 
10,누구에게나 공존하는 여성성과 남성성! 내면의 은밀한 비밀을 지닌 '지욱'을 따라가다 보면 슬픔과 연민을 느낄 수 있을 것 
7,생각보다 재미있었다. 차승원씨가 너무 예뻤다 
5,남자속의 여자를 이야기할려는 것인지 검사 형사 조폭 비리 액션 버무려서 도통 갈피가 안잡힌다시나리오 평점은 정말 최악 ...감성적인 액션 장르라지만 너무 내용이 뒤죽박죽 엉망차승원 연기빼면 별로다 
9,차승원때문에 점수드림 차승원이 너무섹시함  끝 
9,호불호가갈리는영화다 이역활만큼그어떤누가소화할수있을까 슬프기도하고 애잔한영화였다 
9,여장이라는 거부감은 약간 있었지만그래도 액션 코믹 보는 재미가 있네요무엇보다 차승원씨 너무 멋있어요ㅜ 
9,새로운 느낌의 느와르영화였습니다.차승원의 연기가 정말 좋았습니다. 
10,잔인해서 오히려 좋았다. 그만큼 처절한 이야기였으니까. 
4,아... 포스터믿고봤는데...내용이 영...  여자가되고픈 형사이야기..슬프지도 감동적이지도 않고 잔인한 액션가득에 중간 코믹 살짝... 차승원 연기만 볼만함... 
10,정말재미있었어요 완전 차승원 연기좋았어요 
8,"느와르인걸 알고보시면 만족허실꺼예요 아,정망 차승원님 연기 짱 ㅠㅠ♥♥♥♥주변인들에게 마구마구,추천할꼬예욤(ToT) "
10,간간이 터져주는 오정세 연기 완전 짱! 
5,소재는 좋음 구성은 엉망느와르라기보단 젠더영화에 가까움보실분들 참고하세여 
10,상업적으로 꺼리는 소재를 차승원이란 배우가 연기력으로 잘 풀어간  영화..   그리하여 감정이입과 더불어 아픔까지도 와 닿네요...다시 보고싶은 영화네요... 
10,제가 상상한 그 이상의 영화여서 놀랐어요!! 가벼운 마음으로 보러 가서 많은 생각과 여운을 남기는 영화였네요 
9,차승원씨는 의외로 예쁘다. 
10,재미져요근데조금잔인하다는...ㅎ 
8,올해 기억에 남는 한국영화한공주 하이힐 끝까지간다...정도하이힐 이 영화는 충분히 제 몫을 했다.평론가들 땜에 이 영화 못 볼뻔 했다.절대 믿지 못할 족속이 평론가다. 
8,전 괜찮던데.. 극과 극이 만나 빚어지는 슬픔이 더 크게 다가왔어요.. 차승원 오빠.. 반했어요.. >0< 
7,차승원씨 때문에 보는영화 
10,액션연기도 깔끔하고 차승원연기가 정말좋았다.. 기대이상 dvd출시되면 불법다운 하지말고 극장가서 좀봐라 흥행됬으면 좋겟다 
8,차승원의 연기 완벽~~끝까지 신중하게 관람~~ 
10,차승원 연기 쟝쟝맨... 
10,내가 끝내 가질 수 없었던 다른 '무언가'에 대해 생각해보게 만들어주는 깊은 울림을 선사하는 영화 
9,초반부에 웃겨죽는줄ㅋㅋㅋㅋ그리고 차승원을보는 내내 뭔가 가슴아프더라..하나하나 이해하면서 봤다 
10,와우  짱ㅋㅋㅋ 차승원 연기쩜 액션영화긴한데 매우 잔인하긴함ㅋ 소름돋을정도? 아무튼 10점임 
9,아... 차승원씨 연기 굿굿! 내면연기 너무너무 좋았다. 진짜 진욱이었다.영화의 중간중간 코믹한 내용도 좋았고 ㅋㅋ 
9,왜 재미없다고 하는지 모르겠다. 웃음도 있고 좀 잔인하나 액션도ㅇ멋있고 결정적으로 흡입력이 좋음. 한번도 집중력이 흩어지지 않았다. 
9,차승원이라서 완벽했음너무너무 잘봤어요 개인적으론 최근에 본 영화중에최고!차승원 연기 소름 차승원 액션하는거 첨봤는데 길쭉길쭉해서 그런가 시원시원했어요! 여자분도 너무 예쁘고 오정세씨도 엄청 웃겼음ㅋㅋㅋ 
10,멋진차승원님짱입니댜흐흐 
7,"오정세가 말한다."" 내가 그 양반 팬이거든."" 정말 액션만큼은 화려했다. 액션 강추... "
8,차승원 내면연기를 조금 더 비중있게 다뤘으면 좋았을뻔 그만큼 차승원 연기가 좋았다는 것. 
10,승원형님의 액션 멋있서요 재미도 있음 
8,영화잘봤어요!차승원의 감정선이정말.. ㅠㅜ차승원속에있는여자가상처받을때마다 겉모습은남자지만 여자가상처받는거같은느낌에 너무안쓰러웟어요ㅜ자기자신으로살아갈수가없고 그걸 참으며살아야하는게 정말힘들텐데. 
8,차승원멋있어요!! 재밌었어요. 
9,차승원 아니었으면 아무도 소화하지 못했을 캐릭터 ㅎㅎ 대박 
9,"차승원,오정세,이솜,고경표,박성웅 다 내가 좋아하는 배우들. 그리고 기대 이상의 연기를 보여줬다. "
10,영화의 음악들도 좋았고무엇보다 곱상한 차승원에서부터 추악한모습의 차승원까지정말 다시봤음 눈빛하나로 모든걸 다 소화 
7,차승원의 연기는 역시 최고였다. 대단한 배우인듯... 
8,진짜 차승원은 얼굴 연기력 다 되는 몇안되는 배우 중 하나임. 진짜 이번연기로 남우주연상 기대해도 될듯.. 근데 영화가 산만한 감은 있긴 함. 장진 영화 답게 진중한 장면에도 가벼움이 떨어지지 않은다고나 할까? 그래...
10,평점이 너무 낮다-_- 생각보다 저평가 되어있는건 안타깝네요 
8,큐어 영화라 호불호가 갈리지만 전 재미있게 봤어요 소재도 재밌구 차승원 연기도 넘 잘하고..마음 한 켠이 찡해지는 영화였습니다 앞으로도 한국 영화에 이런 다양한 소재가 다뤄졌으면 좋겠네요 
9,연기를 너무 잘하셔서 같이 슬펐고 안타까워하며 잘 봤습니다 피가 너무 튀겼긴 하지만 액션씬도 너무 멋졌어요 친구랑 저는 영화보고 나오면서 한번 더 보러가자고 약속했네요 만점에서 일점을 뺀건 결말이 조금 아쉬워요 궁금...
5,차승원을위한 차승원만을위한영화 
8,기존에 내가 보았던 느와르 영화와는 확실히 다르다. 여자가 되고 싶은 남자라… 
9,줄거리도 안읽고 가서 내용에 좀 의아했지만 덕분에 더 새롭고 나름 괜찮음 차승원씨 역시 멋있네요 ! 
9,올만에 평점을 쓰네요.. 차승원씨 연기 짱이었구 극중 지욱이가 너무도 짠했습니다.. 
9,재밌게 잘 봤습니다. 차승원씨 연기가 정말 좋았어요. 좀 슬펐습니다. 하이힐 화이팅~~ 
9,차승원 액션과 오정세의 웃픈연기 볼만합니다! 
8,"우리모두 정체성을 잊고 살아가야 하는게 아닐까.내가원하는것,내가하고싶은것,우리를숨긴채.그래서 살다가 때론 나는누군가에 대해서 생각해보지않은 사람들이 있는가?지욱이도 역시 그런 것이다.우리들처럼 우리의 정체성을 잊고 ..."
9,슬픈감성의 르느와르란 말이 딱!!르느와르를 싫어하는 나이지만 이 영화는 추천한다.시종일관 젖어있는 차승원의 디테일한 감성연기!!!!믿고보는 배우답다.장진 감독의 세련된 연출력에도 큰 박수를 보낸다~ 
9,차승원의 내면연기에 찬사를 보냅니다. 
9,역시..차승원이 선택한 영화는 오랜동안 기억에 남는 작품인 듯. 
9,차승원 덕에 영화에 빠져서 봤습니다. 
9,차승원에 다시 한번 홀릭하게 되는 영화였다. 
9,웃으면서 또 액션의 색다름에 취하면서 무관심했던 그들에관해 마음을 열게되는 영화. 
7,차승원이 고군분투하였으나 이프로 부족한 감성느와르... 그러나 차승원의 연기는 백점만점!! 
10,"우는남자대신 하이힐 봤습니다.. 극장나와서도 내내 뭔가 우울했어요.. 눈물은 없지만, 정말 그 특유의 우울한 분위기가 뭍어 나와서 좋았습니다. 차승원씨의연기도 정말 좋구요. 정말 잘어울렸어요.! "
8,차승원이 없었다면....막내렸을 영화...중년섹시매력뽐뿌~ 
9,재기 발랄한 장진. 차승원이 훌륭히 백업하다. 이뿌딘 않아.. 
9,내용을 모르고 보러갔는데 재밌었어용~~~차승원 멋져용!! 
8,새끼 손가락이 그리도 처연해보일 수 있다니 
9,역시 차승원 스토리도 굿. 
8,색다른 영화였음... 
9,차승원의 는빛연기와 김정의 표현 너무 멋져요..평범한사람들이 전혀 생긱해보지 못한 쟝르여서 다시한번 그들의 세계를 느끼게 한 작품인듯 하다.. 
10,Best movie this year so far. 
9,장진 감독만의 영화네요차승원씨 연기 좋아요 
9,조조로 봤는데 가슴이 너무 먹먹하다....역시 믿고보는 차승원 
10,감독 특유의 연출력이 살아있습니다 몰입도가 좋아서 감정이입이 쉽게 되는 영화 
9,나름 충격도있고ㅋㅋ재밋네요 
4,화이팅 팬입니다  좋은작품 부탁요 
1,말할필요도없다 아오진짜 
10,차승원은 진짜 배우다!! 
9,차승원  슬픈 눈빛을  잊을수가없다 아직도  생각나 
10,차승원 정말 멋지네요. 이 역할을 차승원이 아닌 누가 할 수 이쓸까요. 오랫만에 영화보면서 울었어요. 그리고 포스터에 쓰인 사진 다 너무 감각적이고 좋네요.  재미있게 잘 봤습니다. ^^ 
10,솔직히 내가 최근에 개봉한영화중에 리얼액션영화는이게갑인듯 차승원이라 소화햇던역이고 아저씨 뺌칠만큼 심장두근거리면서 액션봣다 우는남자는 걍 처우는남자로 끝!이건진짜액션영화다 
9,차승원아저씨의새로운면모를본것같아신선했어요다시한번생일축하드려요 
9,차승원 잘생겻더라 ㅋㅋ 연기도 잘하고 영화 자체가 감정이입이 잘되더라구여 
9,차승원의연기력이좋았음 
9,Good~~~!!차승원의 연기력에 감탄~ 
3,연기력이 아까운 연출력과 시나리오차승원씨 연기때문에 3점 쏴드립니다. 남친이 너무 후하데요 
3,장진 이제는 기대조차 하지 않으련다. 
1,차승원때문에 1점준다. 장진 이사람은 연예인병 걸려서 영화 자체가 망작 
1,장진 영화가 다 그렇지뭐~ 
3,보면서 왜 봤지 후회했음. 
4,평점이 너무 높네요 신선한 소재를 잘못풀어냈습니다 아쉽네요 
10,차승원연기대박ㅠㅠ...너무재밌고좀징그럽긴...한데...그래도볼만해요 차승원액션연기대박!!최고에요 
9,정말 신선했고 차승원의 색다른 연기에 감탄했습니다. 대부분 코미디연기가 다였는데 이런 진지한 연기 사랑합니다 반했어요 짱짱 다른 배우들이 코미디 부분을 맡아줘서 깨알재미도있었습니다 
9,잔인하지만.차승원연기에 빠져 넘재미있게봤다.눈물연기도 멋졌음 
9,뭔가 안타깝고 짠한~~ 마음 때문에 뭉클 ㅠㅠ 숨은 재미와 차승원표 액션이 기억남는다 
9,시사회 봤던 친구가 너무 괜찮은 영화라길래 믿고 봤는데 역시 장진 감독이네요 
9,진짜 나로 살기 위한 몸부림. 누구에게나 있는 욕망. 
8,오정세랑 차승원 멋지네 
8,소재 독특하네요..나름  괜찮았습니다. 
8,액션도 액션이지만 중간중간에 뜬금없이 코믹스러운 장면에 있어서 재밌네여~ 
10,차승원 역시 연기굿! 액션..정말멋있음 
10,저오늘하이힐영화보고왔는데 굉장히재밌었고 액션신쩔었습니다 몰입을하게되고 스토리도괜찮습니다 강추합니다 
10,성소수자 혐오자들에게는 비추 ! 연기는 정말 일품! 차승원씨에게 또 반하게 되네요 마무리가 조금 엉성하긴 해도 신선한 내용 잘 봤습니다 
8,차승원이라는 배우는 참 대단한 듯 
8,차승원의 새로운 발견~~~ 숨겨진 이면의 연기 너무 멋집니다 
10,차승원 연기가 정말 좋네요~~웃길줄알았는데..정극입니다. 
10,재미있게 잘 보고 왔습니다. 차승원 연기 짱! 
10,봐  보고 논해라 새로운 영화라 
10,완전 꿀잼이엿어요  월드투모로우 . 우는남자봣는데 그것보다 잼이엇어요 중간중간블랙코미디...ㅋㅋ 웃기면서도 르와르를유지하는... 이건차승원배우밖에못할거같아요 
10,"차승원 연기 죽ㅇ니다...재미 있고 슬프게 밧다...즐감 하길 바랍니다. 추천,,ㅎㅎ영화 매니아...후회안한다... "
10,ㅋㅋ멋잇어 개줏멋짱짱 
9,차승원씨 연기 최고! 이솜씨도 영화내에서 분위기랑 잘 어울리네요. 전체적인 내용과 잘 버무려진 코미디도 좋구요!! 그치만 결말이 살짝 아쉽긴 하네요ㅠㅠ 
8,재미있게 보고나오는데 남정네들은 게이영화네 호모영화네 하고욕함 내용을제대로보고 간직한꿈을안고살아가는주인공을안쓰럽게 생각할줄모르나봄 
5,영화의 소재는 좋으나 스토리 풀어가는 과정이 뒤죽박죽 이고 액션의 참신함이 없이 잔인한 폭력만 군데군데 보이네요 
1,허허허....ㅠㅠㅠㅠ 
1,감독이 누군가 했더니 장진이었네 ㅡㅡ 
9,볼게 없어서 시간맞춘다고 봤는데 대박 괜찮은 영화. 추천합니다. 
10,"차승원연기잘하고액션도짱임 우는남자보면 울지만, 하이힐보면 기분이 하이해집니다. 너무 하이해지다가 하얘질찌도... "
8,기대없이 봤는데 넘~재밌네요~차승원얼굴과포스보는것만으로도꿀재미~^^ 
10,신선한 소재! 재미있게 봤어요! 답답함이 없던 영화였어요 
1,별 한개는 차승원에 대한 의리입니다 
7,난 이런 영환줄 몰랐다 ㅠㅠ 
1,이런 막장 영화에 배우들의 연기력이 아깝다.  다음엔 부디 다른 좋은 영화 만나시길. 
6,임팩트 없는 장진 느와르 사양하겠아요.. 
10,장진이기에 믿고 보겠습니다. 
10,장진의 대표작이라고 나는본다. 
10,차승원의눈빛이너무슬프다 
10,여운이 굉장히 남는 영화.칼부림이 난무하지만 여성의 감정을 잘 나타내는 차승원의 연기는 감동적이었다. 평이 왜 안 좋은지 모르겠다. 
10,너무좋던데 관객도안모이고 평점도 낮네끝까지간다는 누구나 재미있게본다라고하면 하이힐은 조금 영화를 진지하게 접할줄 아는사람에게 재밌을거 같은느낌? 그렇다고 제가 그런건아니고 봤을때 장진감독이 나는 이정도의 클라스다. ...
10,차승원이 보이지 않는 배우 차승원의 연기. 정말 최고!대사하나하나에  영화의 본보습이 묻어나는 다른 배우들의 연기..장진감독다운 표현방법.다시한번 극찬. 차승원짱! 
9,나름 소재도신선햇으며 깨알 코믹에 차승원의 연기또한 영화에서 빼놀 수 없는 부분이지만 후반부로 갈수록 약간 허술해지는부분이 아쉽다 그렇지만 영화전체로봣을때는 괜찮앗당! 추천입니당 
8,호불호가 갈릴테지만 나는 재미있게봣습니다 
8,장진 특유의 유머가 중간중간 살아잇는 독특한 발상의 영화~~ 갠춘하네요 ㅎㅎ 
10,차승원.. 내가 제일 좋아하는 배우.오늘 다시 한번 반했다.대한민국에 차승원이라는 배우가있어행복합니다. 
8,배우들연기나 액션씬 너무 멋졌어요 많은 생각을 다시하게된 영화였어요 
9,내평점은 8.9이다.영화 후반부쯤에 윤지욱이 자신의 성적본능마저 짓밟아버린채 자신의첫사랑광의약속(장미를 지키겠다.) 을 지킨것에대해 아련한감정이 강했었던것 같다. 장미를 구하러가는 택시안에서 가발을벗고 하이힐을 만지...
8,내용이 야간 황당하긴했지만 멋진 액션이 눈을 사로 잡았네요ㅋㅋ 
1,장진.감독인데.뻔하다 역시 
1,차승원연기력빼곤 밑도끝도없는3류영화 
1,돈아까움~~~... 
10,사람마다 욕구는 다르고 그걸 절제하기힘든건 다 똑같다. 성소수자들은 나와 거리가 먼 사람들이라 별 생각안하고 살았는데 이 영화의 차승원을 보고 많은걸 느꼈다. 차승원이 연기한 윤지욱?은 내가 본 영화의 어떤 주인공들...
9,이렇게 먹먹할 줄 몰랐다... 이 사회를 살아가는 사람들 중 남들은 알지 못하는 자신만의 아픔을 안고있는 이들이 얼마나 많을까... 반드시 성소수자가 아니라도 말이다... 마지막 차승원의 새끼손가락... 쉽게 잊혀지...
10,차승원의 변신 충격적이고 색달라서 좋다 
10,차승원은 저평가 되고있다.. 연기가 정말 소름돋고 영화보고나서 여운이 엄청 길어요ㅠㅠㅠ 
9,진짜 심쿵... 느와르에 진짜 애잔하게 잘만들었다 싶었다. 진짜 차승원이 아닌 여자가되고싶은 윤지욱으로 보이더라 
9,무거운트렌스젠더이야기를너무 무겁게도 그렇다고 가볍게풀지 않아서 적당했음  영화는 괜찮았으나칼로베고 폭력신은 좀 과함차승원 기럭지에 페이스에 액션이 너무 잘어울림 
7,"생각보다 괜찮았다. 차승원의 내면연기 또한 좋았으며, 냉혈하고도 남자다운 형사 내면에누구보다 여린 여자의 마음. 겉으로 거칠고 잔인해질수록 더욱 아려오는 정체성. 그동안 보여왔던 장진감독의 색깔에서 어느정도 탈피한것..."
8,"차승원의 허한 눈빛연기와 오정세의 악역,장진식의 유머 이솜의 매력....아직우리나라에선성소수자들의 이야기가  제대로 소화될순없겠지만 잔인한부분만 (잔인역시 지욱을 표현하기엔 필요불가분하긴한듯) 빼면 정말 맘에 드는 ..."
8,기대안하고 봤는데 너무 재밌음~~승원오빠 연기&모델 기럭지 짱! 
7,왜 차승원일 수 밖에 없는지 알겠더라 ㅋ 대단한 연기 최고입니다 
9,묘하게 매력적인 영화. 최고로 재밌었어요 요새 나온 영화들중 젤 재밌음 
9,차승원의 터닝포인트가 될 작품이 아닐까 생각합니다 
7,차승원씨의 매력을 만날수있었구요 오정세님 박성웅님 너무좋아요전체적인 영화흐름은 약간 아쉬웠네요 
10,"조금 잔인하긴 하지만, 차승원의 감성과 현실이 너무 극단적이어서 난감한 면도 있지만, 볼만한 영화영화가 끝난 후에도 귓가에 쇳소리가 맴도네 ㅠ "
9,차승원의 섹시함이 물씬. 개인적으로 영화 너무 재밌었어요!! 
8,보는내내 흥미진진했어용 
9,"신선한소재와 영상미, 배우분들 연기가너무좋아요! 차승원씨눈빛연기에 완전슬펐음..ㅜㅜ 내용은 기대하던거보단 다소 실망감이없지않아 0.5점덜드려요~ "
7,재미있내요ㅋ정말잼나요 
10,또 다른 내면을 가지고 있는 사람들의 소재라는 누구든지 가지고 있을수 있지만 표출해 내지않는 그런 마음 거기에 액션 까지 ~!!!정말 또 다른 생각을 하게 만드는 그런 영화 였습니다~! 
10,"더럽거나 추하다는 생각은 전혀 안들었다.슬프고, 아름답게 느껴졌다.... "
10,오랜만에 여운이 가득한 영화였어요 차승원의 매력이 발휘되고 다루기 힘든 주제까지 잘 담겨져 있네요 
2,차승원 연기만 굿 내용은 완전 부실 
1,장진의 인맥챙기기가  영화를 망쳤다. SNL크루들을 억지로 껴놔서 보는내내 불편했다. 장진 감독 으리는 ㅅㅌㅊ. SNL 꽁트에서 원맨쇼하는 차승원이 안쓰러움 
10,장진의 화법은 다르지 않으나. 굉장히 신선했던 컴백작. 깜놀 
1,장진은 감독이 아니다 그냥 더러운 때까 낀 불량감자다 차승원한테 고마워해라 
1,죄다 영화사 알바들이 평점 올려놓은듯진짜 근래 보기드문 쓰레기영화 장진 그만 메가폰잡아라 차승원만 희생양됐음 안타깝다 
1,대중을 버리고 소수를 택한 영화 
8,"영화에서는 성소수자의 이야기를 다루고 있지만, 저에게는 진정으로 원하는 삶을 살고 있냐는 것에 대해 물어보는 것 같았고 그에 대해 고민해볼 수 있었던 시간이었습니다. "
10,"장진 감독은 청불에서 그 본능적인 헛소리가 더욱 돋보인다는 사실을 깨달았다. 더불어 차승원은 더이상 신라의 달밤이나 군수와 이장, 그 외 잡다한 그런 필름의 한계를 넘어 다양성을 증명할 수 있는 잘생기면서 예쁜? 배..."
10,잘봤어요~~내용도신선하고 차승원이야 머 연기원래잘하니까 ㅋㅋㅋ 
10,"별 기대없이 봤는데 연출력,몰입감,스토리,배우들 연기력 전부 기대이상으로 빠져들어서 봤습니다. 특히 흔하지 않은 소재인데 자연스러운 차승원의 연기.. 다시보게 됬구요. 간만에 좋은영화 감상했네요 "
10,소재자체도 한국에서 터부시 되던 소재라서 신선했고. 무엇보다도 차승원의 액션연기는 너무 멋있었다. 
1,많은 걸 보여주려 했으나 산으로 간 영화장진에게 크나큰 실망 
10,이 정도 평점 받을 영화는 아닌 것 같은데 
5,잘...모르겠다...-_-;;;액션씬은 멋있었지만 그외엔 그다지. 뭘 말하고싶은건지도 모르겠고. 마무리는 허술하고. 
10,"대단하다는 말밖엔 할 말이 없네요. 차승원 한 사람이 영화 수준을 이렇게 끌어 올릴 수 있다니, 자칫 했으면 평범해 질 수 있는 영화를 수작으로 바꾸셨네요. 역시 명품 배우 "
9,마지막에 다행인듯 하지만 해피엔딩은 아닌 약간은 서글픈 .. 
10,차승원 너므 멋잇음 ㅎㅎ 드라마도 잘보고있어요! 
8,차승원이라는 배우는 참 대단한 듯 
7,뭔가 쩐다 라는 말밖에는..차승원 아니면 그 캐릭터 아무도 소화 못했을 것 같네요 
9,차승원의 또다른  모습...    섹시하기만한 남자가 아니었다!!! 
10,평점이 너무 낮다-_- 생각보다 저평가 되어있는건 안타깝네요 
8,"차승원의 연기력에 감탄한 영화. 케릭터가 겪어왔던 정체선에 대한 아픔이 첫사랑이란 모습으로 무겁지 않게 풀어진 건 좋았다. 다만, 스토리를 짜임새 없고 섬세하지 못하게 풀어나가는 감독의 연출력이 많이 아쉬웠다. 대중..."
10,또 다른신세계의 속사정 조금이나마 간접적으로 알수있게되 신선하고 차승원의 내면연기는 진짜 볼만했다...액션을 말이 필요없고 
9,끝이약간허무한듯했으나재밌었어요차승원씨액션멋졌습니다오정세씨연기도좋았구요~~^^ 
8,영화답다는 완성도는 떨어지긴 하지만 그런 어색한? 부분이나 뜬금없는부분들도 전 맘에 들었어요 과장되고 잔인한 액션도 ~ 진짜 색다른 시도의 영화여서 참신했네요 뻔한 느와르보단 낫죠 
