score,review
8,이 영화가 주는 교훈 : 줄때 먹어라 
5,방사능 노출로 고자가 된 흑인이 인간의씨를 뿌리기위해 다른 남자와 자는걸 묵임함. 그리고 물레방아 만들다 줄을 일부러 놓아서 죽게함.죽인거 아니라는 글도봤는데 솔직히 자기 개인짐도 버리고 보호복만 입고 갔다는게 말이...
5,"초반엔 흥미롭게 시작했으나, 이건 그냥 짝짓기 영화였네. 재난을 빙자한 3류 삼각관계찌질이러브스토리. "
1,저배우들로 이런영화를 만들다니 ㅡㅡ 
1,마무리가 너무 허무함. 
5,인간의 본능은 한결 같구나 
5,잘 나가다가 이도저도 아닌 결말에 실망함 
2,열린결말은 영화를 볼이유를 퇴색시킨다 
3,배우들 연기는 좋았어요..  내용은 글쎄요..  의미가무슨 아담과이브와뱀이라고하는데 모르겠구요. 물레방아만들고 끝났네요화면은 마음에들었어요 
7,잘생긴놈이 채가기 전에 줄때  먹어라 찬스를 날리노 
10,많은 생각을 하게 되는 영화네요.. 흠.. 
6,진짜 배우 딱 3명나와. 사진뺴고. 
7,그냥 볼만한 영화!! 마을사람들은 왜 나갔는가?ㅎㅎ 
4,블루라군과 비교되는군요역시 셋보단 둘 짝짓기의 느와르 ㅋ 
6,뭘 줄때 먹어 ㅋ안서서 못한건데.. 영화부터 제대로 봐 
10,"단순한 재난영화가 아닌 짧은 시간에 많은걸 담고 있는 완성도 높은 영화네요. 자연과 어우러져있는 인간, 욕망, 신앙, 화합,   존엄성,  시기 질투, 방사능 피폭으로 태어날 2세,  경쟁, 2번의 살인... 아주 ..."
1,1두 주기 싫은데 ... 
1,영화속 숨겨진 의도를 알아챈다고 해도 후하게 점수를 줄수는 없다 왜냐고? 난 인간이니까 
7,"밋밋한듯 하지만 심심하지 않은 괜찮은 연출.치웨텔과 마고의 심화 연기, 두 주연과 한명의 조연으로 별 세트 없이 괜찮은 영화를 만들었다.크리스는 분명 조연인데 배우 소개에 치웨텔 위에 있는 건 아닌듯. "
6,찍다말았다. 찍다말았어 
6,자극적이지 않아 오히려 적나라하게 표현되는 인간의 본성. 
6,영화가 끝날때 내 머리위에 물음표가 막 생겼었다이게 뭐지?!리뷰를 본 다음에야 이해하고 공감할 수 있었다리뷰 보기 전에는 정말 시간낭비라고 생각했었는데그래도 리뷰를 보니 섬세한 영화였다고 생각한다 
4,"비록 영화 러닝타임에 비하면, 위태로운 삼각관계는 일부였지만, 난 이런게 불편하다. 보는 내가 불안하거든. 영화는 전반적으로 따분함. "
7,마지막이 너무 허무하게 끝남... 그러나 난 내 이상형을 찾았다. 
7,큰 그림을 그릴 줄 아는 루미스. 
10,치정극 볼만했다. 인간의 간사함은 어디까질까 
8,디테일한 감정 표현이 뛰어난 영화 
6,배경은 핵전쟁이후지만.. 내용은 핵전쟁보다는 인간관계의 중점을 둔 내용 
7,"결말에 약간의 아쉬움이 있지만,,,나름 여운도 남고, 생각하게 만드는 영화,, 스토리가   잔잔하고  남녀의 심리묘사를 그린영화,,,볼만합니다 "
10,재밌어요 죽였다에 한표..어떻게짐다두고 그옷입고떠낰ㅋㅋ...여주도 예상한듯..ㅠㅠ 
7,인간에 대한 본성을 심리적으로 묘사한 작품 
9,마무리는 허무 했으나 메시지는 충분했다. 
4,결말이 그닥....맘에 안드네요 
1,제작비 천만원 이하 저예산 영화임.. 
2,그냥 본능적 짝짓기 영화 
10,"스토리라인 연출 , 배우연기등 다 좋으나 내용이 찝찝하고 막장이라 평점이 낮은거같습니다. B급영화 수준의 평점을 받고있지만 생각이 많아지는 영화임에는 틀림없습니다. "
5,여운이 길게 남으나 그 여운이 불쾌하다. 이렇게 하니 이런 평가를 듣는 것은 감안해야 할 것 같네. 
8,극한의 상황이면 인간은 본능과 감정에 충실해 진다. 
1,도대체 어떻게 투자를 받은거지? 
8,교회 허물어 수력발전기 만드는 얘기 
4,자적따리 자적따~~ 파이니 등근육 얼굴과 마고로비 얼굴빼곤 뭐 ... ㅎ 
5,심심하다.  그 놈 참 소심하네. 
8,장면 장면이 루미스의 심리 변화를 잘 묘사한 영화였다. 
1,감독이 처돌았나 원작을 아주 말아 드심 
5,개인적으로 책이 더 낫다 
6,멍청이들 죽였잖아마지막에 컴엎는장면 여주도 예상한거 인간에 착함과 악함을 보여준거잖아그리고 짐을 다버리고감?이영화 tv에서 마지막 10분도 못봤지만 
10,은교네 ㅎ 나름 재밋게봤네요.. 
6,극한상황에선 본능적으로 남자들은 씨를 뿌려야 하고 여자는 누가 더 우수한 씨를 가지고 있는지 봐야하고ㅋㅋㅋ 
1,하나님 타령하고 교회가 어쩌구 자기 아버지가 목사네 어쩌네 주장하는 예수쟁이 이면서 남자 없이는 못 사는 발정난 암캐 걸레의 농간에 놀아난 40대와 30대 두 남자의 이야기... ※이 영화의 교훈:줄때 먹어라! 줘도...
10,심리묘사가 탁월한 수작 
8,본능은 이성을 초월한다. 
8,세 배우 모두 좋아하는 배우인데 딱 중간까지만 재미있었음 
10,"그냥, 집에서 커피마시면서 혼자보기엔 좋네요. 핵전쟁이후가 마치 무인도에서 몇몇사람들끼리 살아가는 것처럼 보입니다. "
2,진짜 시간이랑 돈이 아깝다 
5,결말이 너무 허무하다. 근데 흑인의 마음도 이해가 가는게 세상에 3명만 존재하는데 두명은 부부이고 자기만 혼자이면 너무 서글플것같다. 
8,세기말을 빌려와 감독의 날카로운 시선으로 풀어낸 남성과 여성 그리고 본성 
6,재난 후의 생존자들이 다루는 스토리의 영화를 좋아한다. 하지만 음.... 이도저도 아닌 느낌이었고 흑형 성격이 참 ㅋㅋㅋㅋ 
7,멸종위기 순간에도 본능대로 행동하는 인간 
10,나름 철학적인 영화.sf아님 
6,평점이 5.95☆ 재미없겠네.. 안봐도 
8,재밌게 봤다. 생각하게 만드는 영화. 
1,진짜 의미 1도 없는 영화 
3,"인류종말의 탈을 쓴 삼각관계물. 배경이 도는 방사능재해는 미끼일 뿐, 온전히 남녀관계에 관한 이야기. 관계에서 오는 긴장감은 그런대로 살린편. 그런데 어떻게 12세관람 가능? "
7,음~~~ 괜찮은 영화네요. 
7,최고의 영화가 될수 있었지만 결말을 너무 독자 상상에 맞긴듯한 무책임이 느껴진다. 
5,"그냥 막장 그 자체였어,,, "
10,잼나네오 잔잔하고 오오 
8,8이면 약간 후하게 준거라 생각한다 
6,"인간은 선과악이 공존하며, 내면과 외면이 다르고, 생각과 표현이 다르다. 이렇게 복잡한게 인간이다. 그것을 잘 표현했다. 하지만 마무리가 너무 없어서 영화 자체를 망쳤다. "
8,"내가 저입장이라면 방사능에 피폭되서 정상이아닌몸, 여자 주인공과의 관계에서 윤리적 문제 등 심리적으로 갈등이 생길수있겠다며 감정이입하면서 재밌게 봤음!!! "
4,물컵을 떨어뜨리는 순간 아.. 이거 평작도 아니구나 라는 생각이 든다욧 
7,책보다못한다 ㄹㅇ 그생각뿐이다 책참고하려고봤는데 존나게 요약해서 모르겠다 저 흑인 중심으로 돌아가는스토리인데 남자한명이 불쑥 튀어나오네  에효.... 
1,케일럽 등장하는 순간부터 스토리 예상되서 안봄 ㅇㅇ 
6,흑인이 방사능 노출로 2세 낳아서 문제 생길까봐 백인 이용해서 죽인다음에 뒤를 도모하는건가? 
5,"주제는 흥미롭고 좋아서 영화리뷰영상 보고 봤으나,좋은 주제와 좋은 배우들로 결말을 증발시켜 버리다니..개요는 SF, 스릴러 라더니 그냥 드라마..드라마도 결말은 있다.. 왜그러셨어요 "
10,줄떄먹어라 줄때먹어라 
10,ㅋㅋㅋ 그래도 마고로비 크리스파인이 나왔다 ㅋㅋ 
1,아포칼립스 치정극 재미도 없고 감동도 없고 어쩌라고 전개... 
2,영화를 만들려면 만들고 말려면 말아라. 
7,인간에 의한 인간의 최후 
10,김치놈년들한테는 너무 수준 높은 영화 
2,Zㅓ예산 영화인가?  출연자가 스테프보다 적음 
7,볼만 한 영화. 외화 히어로물 보단  생각할 수 있는  영화. 이 영화는 SF도 재난도 모험도 아닌 휴머니즘영화란걸 알아봤음 좋겠습니다 
10,상당히 섬세하게 인간의 모순을  잘  표현한 작품인것 같애요. 많은 생각을 하게 하는 5점 대는 말이 안됨. 재미 있고 말고를 떠나서 후반으로 들어설수록 몰입을 하게 만드는 수작임 
10,이렇게 낮은 평점이기에는 너무 아까운 영화 
8,"저는 재미지게봤는데~흑인아저씨는 자기가 방사능에 피폭되어 애를 못가질수도있으니, 그 남자를 대리부삼아 건강한 2세를  가지게하고, 일 시켜먹고, 여자랑 둘이 알콩달콩살려고 그남자를 제거한거 맞죠?스토리가 기가막히는데..."
6,관객의 생각과해석이 필요한 영화.. 깊은 메세지가 숨어있어 보임.. 
1,허무 
10,배우3.낡은가옥.트랙터1대로 영화를 만들다니..대단..흑인고자 여자를 말려죽이려고작정.. 
2,염병 어렵게 발전기 완성하고 다죽노. . . 
3,기대하고봤는데 이건참.. 무슨얘길하고싶은건지 모르겠고 재미도없다..풍경은 참 예쁨 
10,"신과 인간,  기독교 신자로서의 양심, 불신자로서의 더 양심적. 인간의 고뇌를 다룬 작품.. 원작을 잘 살림. "
8,봐 보세요 재미밌어요 ㅎ 
5,재밌게 잘 보았습니다. 
10,"재밋구만. 낮길래 재미없는줄알았더니..종말의 시기에 살아남은 자들간의 관계속에서 사랑, 정, 갈등을 풀어낸 영화임 집중해서 아주 재미있게 봤어요 "
10,tv 전기세가 전혀 아깝지 않은 작품! 
10,남자는 위험속에서 살려준 댓가로 떠난듯 함 
8,https://www.rottentomatoes.com/m/z_for_zachariah꼭 보시라고 아직 믿을만한 평점 링크 드려요이번 토요일은 라라랜드 보고 일요일엔 이거 다시 보려구요~^^ 
1,핣핣핣 찷찷찷 츄르르릅 
1,ㅋ이건진짜와 재미가1도없오 ㄹㅇ 
10,오빤 줘도 못먹네! ㅠㅠ 
9,신의 선물 백인 남 ㅋ줄뗀 먹고보자 ㅎㅎ 
2,SF 좋아하지만 인간심리의 깊이를 묘사 한다며 억지스럽게 만드는건 별루임. 나홀로 종말은 윌스미스표 좀비물이 쵝오 였는데. 
10,흥행이 왜 안됬는지 모르겠는 배우 각본 감독 삼위일체 수작이네요 
7,댓글보니 영화를 이해못한 사람들이 있는거 같네요 간단하게 처음 만난 남자는 방사능때문인지 성적으로 문제가 발생했고 인류종말을 막기 위한 나름의 선택이었다고 보여집니다 자기는 씨를 뿌릴 수 없으니; 호감순을 보고 몇자...
9,케일럽은 존이 죽였는가?  아님 진짜 떠났는가?   존이 진심으로 자기를 구해주는 모습에 스스로 떠난게 맞는것 같음. 케일럽도 존에 대한 애니의 마음을 알았고.. 
10,"저예산 영화라해도 한국의 저예산 싸구려 싸움,욕만하는 영화랑은 차원이 달라요. 어디서 비교를해요. "
1,별 이상한 해석을 하게 만드는 영화 사실 별거 없는데 죽이긴 뭘 죽이냐 구냥 떠난거지 ㅋ 죽였다면 완전 OOO고 
5,세상의 끝에서도 숨길 수 없는 니그로의 본성 
9,여자 하나와 남자 둘 사이에 생길 수 있는 삼각관계 상황을 생존과 연관시켜 감정과 대립을 극대화시킨 영화연기가 좋아 몰입도 좋습니다백인남자새낀 OO도 싸다.. 역시나 여자들이란..ㅋㅋ 
5,딱 5점. 역시 인간은 둘둘이 짝이 맞아야 된다. 
10,첫별점입니다 후회안해요 다만 크리스분량이.. 
3,인류 종말 위기의 상황에서 벌어지는 치정극 
10,마고 로비  나오니  그냥  안보고도 만점이다 
2,마고로비 왜 안벗음? 장난해? 
1,짝짓기를 향한 그들의 운명은 선입 선출과도 같다. 부제: 최후의 욕정 
10,나였으면 보자마자 따 먹었음 
8,마블에선 볼 수 없는 토르와 할리퀸의 원나잇 
7,그는 착한 깜댕이였습니다 
6,약간 퀄리티 낮을듯한데... 
10,기대보다 재밌었습니다 
1,이걸 재미있다고 보는 사람들은 정서적으로 어떤 자세인지 정말 궁금하다 뭘 말하는거지 물레방아로 전기 만드는 방법 
5,이 영화 상영하는거 맞나요? 어디서해요ㅜㅠㅜ 
10,너무 잼있었어요여주 장난아님 
1,차라리 낭만닥터 김사부를 상영하라. 
1,어디서 볼 수 있나요. 이영화 
1,아따맘마아다거랴탸애 
10,상영관이 적어서 힘들게 찾아가서 봤는데 찾아가서 볼만한 영화였습니다 
