score,review
10,다른 내용도 없이 싸워대는 액션 영화보다는 생각할 거리를 만들어주는 이 영화가 백배 천배는 낫다 
10,장진 감독의 영화는 역시 장진만의 냄새가 풍긴다 믿고 봄 ㅎㅎ 
10,차승원 표정 하나하나에 몰입도 최고였습니다 액션도  숨막히게 좋았구요!먹먹한 슬픔도 마음에 남아요!  배우 차승원을 제대로 느끼고 왔습니다 
9,단순히 재밌고 즐기는 영화가 아니다. 이런 영화가 잘 돼야 한국영화 발전하지…. 맨날 때려부수고 터지고. 스케일만 화려하고 스토리는 없는 영화는 진짜 싫다 -_- 
9,후… 차승원 마지막 얼굴. 가면을 벗고 살아가는 사람들이 얼마나 될까. 
10,차승원의  반전매력과 내면연기도 최고지만 아역배우들  진짜 기대이상임  굿 
10,잘 봤습니다. 진심으로 잘됬으면 하는 영화입니다. 
10,색달랐움!! 흔해빠진 영화가아니라 더 좋았고 ㅋㅋ평점 너무 낮다!! 
10,너무아름답고 맘이아프다  차승원최고 
10,방금  보고왔습니다. 재밌게 잘 봤어요 조금 잔인하긴 해도 간간히 웃음도 있고 차승원씨 눈빛이 너무 좋았어요 소재 때문에 안보는 사람들이 많겠지만 많이 흥행했으면 좋겠어요! 
8,차승원의 식스팩 안에 살아 숨쉬는 여성을 발견. 저런 눈빛이 있었던가 그에게? 
1,ㅏ... 배우 차승원 정말 좋아하는데 영화 자체 스토리가 중간에 짤린 듯한 느낌입니다. 
1,음... 별로네...쩝... 
1,별하나도아까움어떤걸주제로 이야기하는지모르겠다 
1,"차승원씨 너무너무 좋아하는배우인데요  ..  연기는 너무좋았습니다만 영화내용이  너무 아니예요.... ㅠㅠ 헛 웃음만, "
1,멘탈 털리고 싶으면 보세요전 친구가 형사영화라고 해서 봤음친구도 멘탈좉털림제 멘탈 젤리멘탈인데 젤리 응고되서 터짐게이물돋네 
1,와진심 개 재미 없음.. 특히 게이나 레즈 혐오하시는분들 보지 마시길.. 스토리 이해도 안가고 정말.. 갠히 본듯 보지마세요 이거!! 
1,진짜 재미없음 돈아까우니까보지마세요 
9,차저씨 맞냐… 왜케 섹시해 ㅠㅠㅠㅠ 
1,장진님?영화시나리오는요  연극처럼 쓰시고  촬영하시고 그럼요  가벼워져요.하지마요?강철중 시나리오로 우쭐하신거 같은데 시나리오를 그대로 옮겨서 강철중 이미지 완전히 망쳤음요. 
1,어디서 감동과 재미를 느껴야하는지 난해함. 기대안하고봐서 더재미없던영화. 내가감독이라도 이거보단 잘만들수 있겠다. 
1,아저씨+해바라기 기타등등 여러영화 짜집기  내가이걸 왜봤는데 이해를 할수가 없음 스토리자체가 말도안되는 스토리에 조잡함 B- 영화 왠만하면 평점안쓰는데 진짜임;시간남아도는사람만 보시길  .. 영화감독중에 제일 거품낀...
1,뭘 말하고 싶은 걸까~!  전혀 다가오지 않는데 개봉후에도 애 쓰는 장진감독 안스럽다. 이건 아닌데 
1,영화에 내용이없어 아저씨 따라하는거같기도하고별로다 
1,완젼 쓰레기 내돈내놔 내 시간이랑 
10,말이 필요 없었다. 한번 더 보러 간다. 
10,신선한 소재라 기대감이 약간 가지고 봤는데 생각 이상이었다!!역시 차승원.... 
10,"차승원씨가 연기 잘하는건 알지만 평소 제 타입의 배우는 아니라서 별 기대없이 봤는데, 왜 그의 매력과 연기를 진작 알아보지 못했을까 하는 생각이 들었고 트렌스젠더와 게이 등 성소수자에 대한 인식이 많이 변화되었던 시..."
10,"차승원씨 정말 연기죽여줘요~그윽하면서도은은한..강렬한,깔끔한매력남! "
10,차승원연기에 감동  액션연기도 내면연기도 
10,차승원님의 절제된연기ㅠㅠㅠㅠ 완전 반했습니다!!! 정말 멋있는 액션에 또 한번 반했습니다!!!! 완전 만족♡ 
1,감동도없고 조연은 뜬금없이나와서 주연인척하고 차승원말고 딱히  돈아까워ㅡㅡ 
1,괴작... 장진 감독님 제발 한국영화계를 위해 영화 그만 만드세요. 예능에 집중하세요. 파이팅 
1,9000원 주고 영화관에서 보는 snl 차승원편.관람료는 차승원씨 엉덩이관람료. 
1,일점도주기 아까움  보는 내내 헛웃음만 나오고. .  장진특유의 위트가 사라지고 억지웃음을 구걸하는듯 했음  최근 몇년간 본 영화중에 최고의 쓰레기로 꼽겠음 
1,굉장히받아들이기힘든소재의영화입니다. 차승원나오는영상물보고찝찝하기는처음이네요. 
1,완전 지루하다.   액션 이나 조폭 느와르 쪽 기대하고 봤는데 중학교 시절에 소년 두명이서 남자끼리 좋아하는 회상씬 이 전부다.   남자끼리 두명이서 멜로찍은거임ㅡㅡ 
1,차승원볼려고 기대하는 사람도 실망한다 영화보고 명치맞은 느낌이다 
1,예고편만보고 영화를 봤는데 사기당했다는 느낌뿐대중을 포기하고 소수를 택한영화연기력은 정말 좋은데 무엇을 연기하는지도저히 감이 안잡히는 보고나서 뭔가 찝찝한..3시간 전으로 시간을 돌리면 예매안하겠습니다 
1,여지없다. 어떤분야건 정치떡밥 물고빠는건 거장이고레전드고 나발이고 쇠퇴에 대한 자기방어기제다. 굿모닝프레지던트를 보고 기가찼었다. 장진이름보고 옛날 기억 떠올리는사람 이제 있기나할까 
1,말하고싶은 의도가 먼저 틀려버린 영화. 틀린건 틀린것. 미화하는것은 정도껏 해야한다. 
1,살다살다 뭐이런게 영화냐 싶더라 
1,진짜.. 보는영화마다재미있다고하는친구도 중간에나가자고하더이다 내용도없고 산만하고 짜증만나는영화 
1,평점 알바라는게 실제로 존재하긴 했구나... 이거 오늘 보러 간 관객들이 끝나고 다 허탈한 웃음 짓고 나갔다 진짜 우는남자 이것도 노잼이고 하이힐도 개노잼 
1,"다때려치우고,,,, 영화관 입장하는순간 너는 호구다 "
1,....  쓸말이없음 ㅋㅋ 
1,포스터에 속았다. 제엔장. 
1,"트렌스젠더에 대한 진정성있는 고민은 없고, 낯익은 액션씬과 애매한 유머로 유기적인 힘이 없이, 온통 짜깁기된 수준낮은 이야기에 차승원의 연기에만 의존한 형편없는영화. "
1,이거 머야?날씨도 구린데 영화는 더구리네..내용이 집중이안돼네돈만날리고..끝가지간다볼걸 
1,"내용도 재미두없고.. 뜬금없고 맞지않는 엔딩..이게 뭔가요관객들 다 감독 욕함다시간, 돈 아주많이 남아돌지않으면안보시는게 정신건강에 좋을듯.. "
1,평점 조작하는듯 네이버 평점 처음 써봅니다 돈아깝고 시간아깝습니다 예고편은 실제 내용 분위기와는 다른 그냥 짜집기고 화납니다 
10,아니 점수가 왜 이따구야 떫으면 니들이  감독배우 하던지 잘만 만들었구만 
1,액션빼곤 볼게없었다 이야기는 나중에 산으로 간다 
1,장진은 감독할 그릇이 아니다. 
1,큐어느와르네... 다가가기 넘 힘들다~~ 
1,너무 잔인하고 산만하네요기대했는데 너무 아쉬워서 평점 낮게줍니다 
4,차승원 연기는 좋은데뭔가 싶음 
8,말 그대로 감성 액션 느와르. 좋은 영화네요. 
8,차승원씨 연기 너무좋아요 
10,남들은 어찌 봤을지 모르나. 난 너무 재밌었음....차승원 연기 너무 잘함..굵직한 남우주연상 받을법도 한데...흥행이 잘 안되네ㅠ 
10,차승원이라서 재밌었고차승원이라서 봤다재밌엉 
10,재밌어요 중간중간 코믹부분도 있고 결말이 해피엔딩이 아니라서 아쉽 ㅠㅠ 
10,차승원 너무 멋있어ㅠㅠ 
10,연기최고였어요~얼굴만 잘생긴배우가 아니네요. 얼굴이 덜 멋졌으면 오히려 연기가 부각될 배우. 
4,뒹숭 냉숭 한 느낌 실망이 크다 
5,대중적으로 성공할 영화가 목적이었다면 폭망임. 와닿지도 않고 그렇다고 줄거리가 알찬 것도 아니고... 딱 34만명이 볼 영화 수준임. 
9,차승원의 연기 아....진짜 배우구나 싶었습니다. 
7,소재의 독창성과 차승원의 연기는 좋았으나 스토리가 과장되고 필요이상으로 잔인합니다 
9,어 내가 알던 몇프로 부족한 장진 어디갔지?놓쳤으면 후회했을 만한 느와르 그것도 대단한 연기의 차승원과.. 
7,차승원의 섬세한 표현력이 돋보였다. 액션도 나름 볼만. 하지만 참신한 소재에 반해 스토리라인은 매우 진부하다. 
10,예상치 못하게 진짜 영화 잘 만들었어요 
8,잘만들었네 차승원은 다 잘하네 
10,승원오빠 연기 장난아님... 재밌어요ㅋㅋ 
8,어디서 본듯한 그런 영화보단 훨씬 신선했습니다성소수자를 다룬걸 떠나서 차승원씨가 나름 섬세한 감정연기를 잘해서..보는 내내 주인공이 측은해서 마음이 아려올 지경이었습니다 언제 시간내서 다시 보고 싶은 마음입니다 
9,성소수자들의 힘든 현실을 잘 표현한것같아요. 그들의 pursuit of hapiness. 그리고 우리의 시선. 하지만 정답은 없다. 내가 원하는것이 답이다. 차승원의 눈빛연기는 완벽 그 자체였습니다. 
1,이렇게 참담하고 OO같을 줄이야 
8,차승원 연기 짱!! 뭔가 엄청 신선했다 
10,재밌어요 웃긴요소가 많네요 ~~ㅎㅎ 
9,결국 자아를 내려놓을 수 밖에 없었던 현실을 잘 표현해낸 영화네요. 하지만 중간중간 스토리고 뭐고 조금 섞여서 이해하는데 어려움은 조금 있을 수 있겠네요. 그렇지만 성소수자로써 다시 봤던 영화였고 그런 부분은 굉장히...
9,"차배우님 연기 정말 좋습니다ㅜㅜ 영화 자체는 어딘가 모르게 다듬어지지 않은 느낌이 들지만, 소재 특성상 그게 어울리는것 같기도 해요. 먹먹한 여운이 있네요. "
10,개인적으로 정말 재밌게봤음ㅠㅠ 본지 꽤 됐는데 아직도 가끔씩 생각날 정도.. 어릴때랑 컸을때도 매치 잘되고 배우들이 연기를 잘해서 몰입이 잘됐어요!! 하이힐ost 음원도 나왔으면좋겠어요 
6,차승원의 연기변신.이솜 이엘 오정세 송영창 이용녀 등 좋아하는 배우들이 선물보따리처럼 한가득 
10,너무 재밌게 봤습니다. 차승원 정말 멋있어요 
10,액션연기와 진중한연기가좋았습니다 
5,장진의 몰락 을 보았다 ㅠㅠ 
5,핵노잼 ㅎㅎ 재미없음. 
7,"아름다운 영상미, 트젠이라는 독특한 소재의 시도 , 차승원과 오정세의  연기력에 감탄했으나  차승원을 지나치게 먼치킨 캐릭터로 만들고 거기까진 영화라  이해할 수있는데 치는대사까지 수OO전 영화처럼 오글거려서 몰입이..."
4,성소수자 이야기와 핏빛 가득한 잔혹 범죄 느와르 그리고 간간히 삽입된 ‘장진’식 개그는 물과 기름처럼 서로 어울리지 않고 계속 겉돌다가 그 모든 것을 조금씩 실패한다. 
8,성소수자의 입장을 보여준 영화 
9,재밌다... 좁은공간에서... 
10,연기멋져요잘봤습니다 
5,"그해 남우주연상 후보에 안오른게 참으로 아이러니했다. 다른거 다 필요없고, 연기가 너무 좋았다. 눈빛 호흡 표졍. 차승원 화이팅. "
10,넘 좋아용 재밌게잘봤어영!! 
6,낯선 얘기로 다가온 그 ...아니 그녀... 느와르라고 보기에는 부족 함이 많다 
10,야릇하네요.방금 봤는데~~음~~시나리오도 야릇하고 정말!담부터 무조건 차승원 영화는 극장에서 본다 
10,보는 내내 안타까웠어요ㅠ 끝나고 굉장히 먹먹하네요ㅠ 
10,가나다라마바사아자차카 
10,남성적인외면에서 나오는 여성적인귀여움을 발견하는 순간 이것이 입덕과 같다는것을 느끼게된다. 가슴아픈 절절함과 귀여움과 허무가 공존한 영화였다. 무엇보다 배우의 연기가 좋았다. 배우를 사랑하게될수밖에 없는 영화 
6,너무 이것저것 담으려다보니 무엇하나 제대로 담지 못한 느낌이다 
6,장진의 매너리즘 탈찰용무비....사이사이 장진의 수다는 여전하지만 주는 차승원 젠더 느와르....애매모호... 
10,차승원씨 연기 너무 잘하십니다. 흥미있게 봤어요 ^^ 
3,이상해요!!!! 차승원연기때문에 끝까지봤음 
10,배우분들 모두 연기가 좋네용 
8,차승원 최고 배우의 연기가 최고입니다! 
4,여장을 한 차배우를 볼 수 있는 기회 
6,차승원의 내면연기와 배우들의 열연이 만들어낸 멋진 액션씬. 보는 내내 눈은 즐거웠지만 마지막으로 갈 수록 힘이빠지는 듯한 내용전개가 아쉽게 느껴진다. 
8,"감독님께서 선택한 장르가 어려운 부분이였으나,그래도 어려운 소재로 배우들이 최선을다해 소화했음으로 재미있게 봤습니다. "
8,장진 감독 특유의 개그와 과장된 액션이 좋다. 거기에 소수자들이 소수를 외면하는 이 사회를 살아가기 위해서는 결국 자신의 온전한 정체성을 죽여야만 하는 현실이 '윤지욱'을 통해 대변되는 혹 상징화 되는...
9,스토리가 조금 부실한 부분도 있었지만 좋은영화인듯 배우들 연기도 좋고 
7,인간에게 중요한 것은 무엇인가?겉모습은 남자 마인드는 여자그의 선택은? 
5,연출...아쉽다...클럽도 클럽이 아닌것 같고 완성도도 떨어진다. 약간 투자를 덜 받으 는낌? 시간이 촉박해 찍은 느낌. 마지막  오정세 를 죽이는 장면은..정말 아니었다.  하지만 소재는 정말 신선하고 좋았다.차승...
8,약간 어설픈 아저씨 느낌이 났지만 젠더연기는 기대이상 
7,연기가 살아있다. 르느와르 장르도 잘 살렸고. 눈빛이 살아있다. 
10,좋았었습니다ㅎㅎㅎㅎ 
10,꺄!!조으다조으 매우 조으다 
7,장진 특유의.. 더하지는 못하는.. 그치만 차승원의 캐릭터이해는 의외로 좋았다. 
8,내면의 성정체성 연기가 너무 좋았습니다. 
10,아저씨 본 느낌.근데 원빈이 있다면 이건 차승원.다른 매력 다른 감정...시간가는줄 모르게 보게된 영화 
10,좋은영화. 좋은영화. 좋은영화. 
10,최고!! 연기가 눈물날정도 
9,연기력 또한 멋지다.굳 
10,지금 보니 차승원 눈빛이 슬픈 눈빛이었네....늘 코믹한 느낌으로만 봤었는데....여운 오래 갈 듯. 
8,장진감독이 이런 영화를 만들거라 생각지 못했는데 여전히 발전하고 있구나 하는 생각입니다. 차배우는 너무 잘해줘서 정말 고맙습니다. 오래 여운이 남습니다. 좋은영화 네요. 
9,인생영화 삼고싶게 감명깊었던 영화. 보는 내내 불편하고 어색하고 마음이 짠하고 눈물났다. 그 와중에도 개그코드를 끼워넣은건 약간 깼지만 난 재밌게 봤다. 친구한테 전부 추천했다 ㅠ 슬픈 장면에서 나오는 bgm이 너무...
9,역시 차승원이 외모로만 승부하는 배우는 아니더라구요 
10,이 영화로 차승원에 대한 이미지가 확 바뀌었다. 
9,시간가는줄 몰랐습니다. 차승원 연기에 감정이입이 되네요. 
10,평점이 생각보다 낮다 차승원을 위한 영화.. 그의 시선 그대로 쫓아가게 되고 몇장면은 다시 돌려보게 됨 최근 본 영화중 재밌고 긴장되고 여운이 많이 남았다차승원의 앞으로가 더 기대된다 믿고 볼것이다 그나저나 남우주연...
10,와 차승원 연기 대박!!! 
10,패왕별희후 장국영이 누린 명성이왜 더 차원 높은 연기를 한 차승원에겐 비켜긴건지.영화 보는 동안 내내 기뻤습니다. 모든 것의 새로운 발견.배우들. 연출. 대사의 발랄함. 
9,"난 이영화를 예술영화쪽으로 분류하고 싶다.극적구성,연출력,연기,시넙 모두 훌륭했음.스토리면에서 아주 조금만 더  예상되는 뻔한 장면들 몇개만 더 고민했었음 하는 아쉬움은 있지만,정말 훌륭한 영화.차승원이 너무 돋보이..."
10,바로 차승원으로 입덕... 와..진짜 멋있다는 말밖에안나옴 ㅠㅠ 보통 영화 케이블에서 틀어주면 좀 보다 채널바꾸는데.. 이건 진짜 대박 ㅠㅠ 
10,"신선함 속 슬픔, 이질감 속 동질감 "
10,"점수가 왜 낮은지 이해 안감.액션, 연기, 음악 뭐 하나 안빠지는데...소재가 좀 불편해서 그런 듯... "
10,왜 이영화가 안떳지??? 차승원 장진 와우 진짜 최고입니다^^* 
1,그냥 이것도 저것도 아닌 영화~ 재미가 없.. 
5,장진 스타일로 무거울 수 있는 퀴어 영화를 시종일관 유머를 넣어 가볍게 만들어냈다. 액션씬은 전체적으로 강렬하고 강하고 멋있지만 극후반부에선 어설퍼지는건 아쉽다. 성소수자만이 아니라 사회적 소수자에게도 나름 힐링이 ...
10,연기 연출 너무 좋았습니다.... 
10,극장에서 보지않은것이 미안한 영화는 드문데... 이영화가 그렇네요.. 연출도 좋았고 연기도 좋았습니다. 
4,코미디에서 보여줬던 감각이 그립다. 
6,액션은 멋지지만 왠지모를 독립영화같은 느낌 
7,차승원의 내면의 연기가 장난아니다..   영화가 너무 어두워서 마음이 찹작하다. 
10,하이힐이라는 영화와 어울리는 색은 보라색이다 
9,슬픈 인생을 살아가는 역할의 차승원의 연기가 너무 훌륭했다. 다른 배우들의 연기 또한 좋아서 몰입이 잘 됐던 영화. 액션도 화려했고 씁쓸한 여운을 주는 생각하게 만드는 영화다. 
4,"실망이다.느와르라고해서 비열한거리나 창수 같은 종류 생각했는데, 동성애를 모티브로한 영화라니. 보면서 불쾌하고 더러웠다.특히 차승원의 화장씬.아깝다 차승원이라는 배우가. 동성애를 좋게 봐달라하는데 이건 정신병이다. ..."
1,정말 영화는 영화다.뭔가 짬뽕인영화 
10,"성소수자의 삶을 '감성' 느와르로 해석한 것이 신선했고, 다른 시선으로 성소수자들의 삶을 옅볼 수 있어서 좋았습니다. 차승원의 액션과 오정세의 악역이 돋보이는 영화였어요. OST와 두 소년의 회상씬 역..."
7,차승원 연기도 두말할 것 없이 좋았지만 악역에서 빛났던 오정세의 연기도 일품이였다 
6,소재도 독특하고 괜찮은 것 같은데... 조복래?? 이 사람 연기 뭔가 어색하고 오글거려서 못봐주겠네... 전혀 자연스럽지가 않아... 
6,"차승원의 연기가 맘에 들었고..모델기럭지에 탄탄한 몸때문인지..액션연기가 아름다웠지만..이런 영화 너무 잔인하다. 역시 사람 몸으로 싸우는것, 칼부림에 피..이런게 원초적이면서 제일 무섭다. "
10,재밋게 잘봣어요 마지막은 슬픔 
6,과거회상은 너무 늘어지고.. 액션은 너무 적고.. 흠... 
8,아!! 그냥 형사액션물이었다면 더 좋았겠다는 느낌!! 아직은 트랜스잰더란 존재를 부담없이 받아들이기엔 쉽지않네요!! 그래도 너무 재밌게 봤습니다.. 역시 차승원!! 
10,하이힐굳굳베리굳정말굳 
8,의외의 장면도 많았다. 
8,볼만해용 차승원연기가 소름끼침... 
8,차승원은 역시 연기파배우~근데 뭔가 부조화스런 주제들의 만남은 좀 아쉽다~해바라기나 달콤한인생 느낌이 나기는하지만 뭔가 부족한 느낌 
10,생각보다 재밌었네 라고 생각했습니다 
10,재미있고 액션도 좋고 맘에드는구만 왜평점이 이리낮누 ㅋㅋ 
8,무거운 소재지만 중간중간 코믹한 부분도좋고남성성이 강한 차승원의 연기가 돋보였습니다 
10,볼만합니다.   생각보다 차승언의 연기도 좋았고 특히 액션이 잼있었어요 
9,차승원이 연기하고 노래하고 몸짓하며 기승전결 열연하다 차승원이 스스로 끝맺음 하는 영화.  근데 이상하게 나쁘지 않다.. 
10,우리나라에선 이런영화 다 망할것 같은데 차승원 장진이기에 기대할만함. 
10,어떻게 풀어낼지가 궁금했다. 결론적으로 이 영화는 성소수자를 다뤄온 국내영화중 단연 최고의 작품이다. 실제스토리가 아니고선 불가능해 보이는 시나리오와 비현실적인 배경을 통해 그들의 가장 실제적인 내면과 현실을 보여준...
8,재밌네 재밌어... 아저씨 처럼 뭔가 어두운건 아닌데 소소한 재미도있고 새롭네 
9,연기력탄탄하고 시나리오 또는 카메라기법이 휼륭하다 생각듭니다 
9,"마음이 뭔가 찌릿찌릿 했어요.배우들의 연기 가 진짜 좋았고, 성소수자들에대해 다시 생각할수 있었고, 디테일한 행동들이 다 의미가 있어서 감성적이였어요! 너무 잘 봤습니다^^ "
10,최근에 본영화들 중에 젤  좋았습니다  최고 
9,차승원의 연기가 돋보이네요. 주인공 역할을 아주 잘 소화한듯ㅎ 
10,여운있는영화차승원 연기 진짜 진정성느껴저서 소름돋는다최고 
10,차승원이 갑 차승원이 갑 차승원이 갑 
9,"성소수자의 삶, 영화가 전부라고 말할 수 없지만, 보는 내내 마음을 울리는 기분이 들었음. "
3,차승원의 연기는 역시라지만. 트랜스젠더 연기에 집중이 안되고 뭘 이야기할려는 건지도 모르겠고... 
6,본인이 여자가 되고 싶다는 욕망을 억누루기 위해 더 거칠게 살아간다...!! 영화의 핵심인데....핵심을 최대한 빼고 거품만 들어있는듯한 영화! 
6,별 내용은 없지만 액션은 나름 괜찮은 영화 
6,조연들이 너무 좋았습니다차승원씨는 노력많이 하셨는데몬가 더 나왔으면하는 아쉬운 마음이 드네요 
9,"액션,느와르라서 봤는데 액션은 나무랄데 없이 훌륭했지만 좀 주인공이 끝까지 일관성있게 강했으면 하는 바램이 있는데...  우리나라 액션 특성이랄까 후반액션에서는 전과같지않지. 이연걸과같은 액션을 원한다. 영화니까. "
6,무거운 소재를 가볍게 하기에는 장르가 그닥...지나치게 잔인하다는...차승원의 연기는 굿! 
10,하아...  가슴아린 슬픔.... 
6,느와르 장르물로써는 글쎄...그래도 차승원은 살아있다 
10,차승원 연기 많이 좋아졌네. 소재 괜찮고!  해병대선배님 필승ㅋㅋㅋ 
9,탄탄하고좋았다~액션감도좋구연기력도좋구~ 
10,신선하며 재미도 있네요 액션도 좋고 
9,극장에서 안본게 좀 후회됩니다배우보단 장진.. 역시 장진스토리 섬세하고 볼만합니다평점이 7점대가 이상하네요포스터가 아마 별로여서... 흥행실패한것 같습니다 
5,장진 감독임을 감안하더라도 너무 산만하다. 이 영화가 신인감독의 영화였다면 칭찬하고 다음 작품을 기대했겠지만 이젠 바라는 것이 많아져 버렸다. 
10,꽤나 감명깊었던 영화 결말의 한내용이 아쉽다 ㅠㅠ 짱 
9,배우들 다들 연기력도 좋았고.. 가벼운 액션영화가 아닌 진지하고 무거운 주제와 액션이 결합되어서 신선하고 좋았다. 
10,배우들 연기가 좋았습니다. 결말까지 보고나니 기분이 뭔가 찝찝하네요 
10,오늘부터 차승원 팬. 최고의 눈빛연기 
10,잘 만들었다 재미도 있고 다만 19금 영화를 폭력장면만으로 갈 필요가 있었는지... 껄끄러운 주제로 사람들의 거부감을 예상했다면 노출씬으로라도 상쇄시켰으면 좋았을텐데 
7,나름 신선한데...이왕 19금인데 베드씬 좀 넣지 그랬어...장감독이 요즘 트렌드를 모르네...요샌 훌렁벗고 쭉쭉빠는거지 
7,음.. 뭐라고 말해야 할지 모르겠다. 화끈한 액션도 좋고.. 그렇긴 한데... 음... 
10,"차승원 연기가. 최고네요.,, ㅋㅋ "
3,차승원 연기는 10점 그외 나머지는 1점도 아깝다. 
8,연기잘하네 차승원. 젠더에 대해 다시금 생각해보게되었다 
10,아무생각없이 봤다가 보는 내내 잔잔하게 가슴이 찡해졌네요.  연출도 연기도 이솜도ㅎ 
9,"괜찮던데..웃기기도 하고, 차승원 오정세 연기 너무 잘하고.. 느와르답게.. 비현실적인 장면도 좀 있었지만.. 다보고 난 느낌은 소수자들의 삶이랑 차승원의 연기... 여자보다는 그래도 팔뚝에 철심박은 차승원이 짱 멋..."
10,장진 감독 영화 좋아하는디... 진지하면서 코믹한... 역시 재미있네요... 특히 장미노래... 정지신호... 乃 원추 원추 
10,와우  새롭고 음~~  이 느낌  신기하고 맛난거 잘 먹은 느낌!!! 차승원은 새롭지만 새롭지 않은것같이 자연스런 연기!!!  내면의 여자를 누를수록 잔인해지는 차승원...  좀 잔인하긴했지만 더 안타깝고  불쌍했다...
2,"차승원씨만 느와르고, 나머지 액스트라급을 장진이 지 가르치는 어중이떠중이 갖다쓰고 졸작을 만들어버렸네 ㅋㅋ 여튼 웃기지도 않다 코메디언에 재연배우에 발연기 애들 꿀잼~ "
2,실제 트랜스젠더조차 공감하지 못할거 같다. 이런 코드는 이젠 구식이지 않은가... 
5,잘 나가다가 조폭이 검사를 해꼬지한다...이거는 말이 안된다...대한민국의 어느조폭이 몰살 당할라고 검사를 건드려???? 
