score,review
7,차승원의 변신과 연기는 대박 하지만 액션은 쩝쩝 
9,"처음으로 댓글 달게 만드는 영화.  '그녀'가 죽을 때, 나도 울었다- "
8,뭔가 소재 때문에 호불호가 갈릴거 같지만 난 재밌게 잘 봤다 하이힐 대박나길 
10,마지막 차승원 허탈한 표정 하나에 모든게 담겨있었다 역시 장진감독 천재 
10,깨알 개그로 인해 웃으면서 볼수 있었다.  겉으로 보기에는 조금은 거북스러웠던 소재인줄 알았지만 잔잔한 감동에 재미있었다. 정말로 대단한건... 차승원의 연기이다. 진짜 대...박!!!! 
6,소재가 아직 우리나라 사람들에게 살갑게 받아들이지 못할수도 있었는데 참신했지만..스토리부분에서 좀 아쉬웠다. 차승원이라는 배우에 대해서는 정말 다시한번 감탄했던 영화 
10,결국 내 안의 그녀가 죽었다 라는 문구를 다시 보니 왜이리 슬픈지ㅜㅜ.. 영화 정말 최고였습니다. 
10,남친은 속았다고 하는데 ㅎㅎ 포스터랑 예고편 다시 보면 할말 다하고 있는듯?? 
3,아.... 차승원주연이라길래 기대하고봤는데... 아... 돈아깝다.... 차승원연기만큼은 좋았는데 영화 스토리가 쓰래기임... 차승원+액션신때문에 그래도 후하게 3점드림.. 앞으로 장진영화 다신 안본다 ㅡㅡ 
8,마지막이 흐지부지하고 해석하기가어려웟어요ㅎ 
2,로렌스애니웨이 아류작인가요? 세태를 읽고 훌륭한걸 닮으려고 한점만큼은 2점. 
10,이것봐 볼거리 짱짱하지. 재밌지. 잘 웃고 잘가가 아닌. 진심으로 건네려는 감독의 진정이 느껴진 영화 
10,스토리 다 듣고 갔는데도 충격적 ㅋㅋ 그치만 재밌었어요 
10,사람들이 너무 삐뚤어진 시선으로만 보시네; 
1,"한국영화역사상 가장 과대평가된 감독, 장진. 하이힐이라는 제목부터 그의 감성이 얼마나 올드한지 증명함. "
2,"소수성애자 이야기! 평점도 소수점, 관람도 극소수뿐. "
3,"어설픈 웃음코드, 그리고 왜 개그맨들을 조연으로 썼는지 이해 안 됨. "
1,...ㅎㅎ하하하 먼가보고난후정신적혼란이온영화 
1,아러러야우촠ㅎ툐아ㅏ아별로야 
1,노잼진짜재미없어요노잼 
8,장진영화의절정이구나차승원연기절정이구나했는데액션이 좀잔인함그치만멋있음차승원의눈에슬픔이들어있어 
2,난 원래 장진감독 싫어한다.이감독은 보통사람들이 생각하지 못하는 자기만의 개그라던가 생각을 영화에 접목을 시키는데 정말 이상하다.액션이면 액션영화답게 만들어야 하지 않나?트렌스젠더영화는 따로 만들어야지 이것도 아니고...
10,철용형님 출연하셨는데 7점이라니 묻고 더블로가 
10,장진 감독의 영화는 창조적이고 혁신적이다 좋다 
3,노잼. 10자 이상 등록하셔야 
10,소장해서 보고 또 보고 싶다 
10,차승원 여장안어울려서이상함 
10,평점 왜이렇게 낮지? 정말 좋은 영화임 ㅠㅠ 슬프기도 하고 
10,후… 차승원 마지막 얼굴. 가면을 벗고 살아가는 사람들이 얼마나 될까. 
10,it's a great movie 
10,가벼운 마음으로 보러갔는데 많은 생각을 하게 된 영화에요 ㅎㅎ 
10,기존에 봤던 느와르 영화들과는 차원이 달랐다. 
10,아..나 남잔데.. 느와르에 액션이라서 보러간건데.. 마지막에 눈물 흘리면서 나왔다.. 
8,성 정체성에 대해 다시 한번 생각해보게 됨..주변에도 고민이 있지만 말하지 못하는 사람들이있을거라 생각이 드는.. 여운이 남는다 
1,"재미 드럽게 없네요. 장진감독 그래도 팬이였는데 이런식으로 대충 작품 만들고, 상영할 때 양심에 찔리진 않으셨는 지... 딱 장진감독 하나 믿고 온가족 데리고 가서 카드긁어 봤는데 진짜 돈아깝네요.  휴 졸립고 지루..."
2,ㅜㅜ실망 장진감독참좋아하는데 
10,SNL 연기자 개웃김 ㅋ 
10,깊은 내면 연기와 강도 높은 액션.. 다시 한번 보게됐다. 
10,완전재미짐 뭔가심오하면서도 깊이있고 액션도완전죽였음 굿굿굿 
10,차승원 연기쩔고 액션신 초대박 
5,완전졸작. 장진은이제그만은퇴해라.한계다. 차승원은몰입연기는되지만 기본쉬운연기는발연기다. 연기가항상똑같고똑같은표정. 
10,와..차승원 액션 갑ㅋ 완전재밋음ㅋ 
10,잔인하리만큼 너무 현실적이야... 
10,마이너한 소재를 가지고 진부한 장르에 참신함을 준듯 적절한 코믹요소가 너무무겁지않게 잘 들어간듯 
10,영화를 보고 나니까 포스터가 엄청 슬프게 느껴지네요ㅜㅜ 아직도 '지욱'이 생각나서 마음이 찡해요.. 
10,하이힐은 전날 봤는데 우는 남자 보고 와서 그 반발심에 더 10점 주고 싶음. 액션은 하이힐이 더 낫다. 우는 남자 주구창창 총만 남발해대고 진심 돈 아까움. 장진 감독 이번 작품이 대중적이 못한 건 사실이지만 참신...
10,"상업영화에서 금기시되는 소재를 멋지게 다뤘다는 점 8점, 최적의 캐스팅 9점, 뭣보다 재밌고 감정이입 몰입도 짱 잘되서 봤으니 10점 "
10,차배우님이기에 완벽했던 윤지욱!장진감독이기에 완벽했던 하이힐! 
1,역시 장진 영화ㅋㅋ 돈아까워.... 
1,장진 이럴 줄 알았다 장진 이럴 줄 알았다 
1,...음....음....안보는게..ㅎ.... 
2,나 처음으로 친구를 팰 뻔했다 
1,"그닥,,요즘영화볼꺼많은데,,, "
1,넷이서 봤는데.. 뭐랄까.. 답답하고.. 결말도 흐지부지.. 솔직히 돈 아까왔어요.. 
1,"트랜스젠더와 게이의 차이점이 뭔지도 모르는, 이성애자 남성 감독의 저열한 소재팔이. "
1,장레기한테 뭘 바라시는지...  그리고 예능좀 작작나오세요 보기 불편해요.. 영화도 못만들고 예능에서도 재미없고  잘하는게 뭐죠? 밥벌어먹고사는게 신기 
1,순수한 액션영환 줄 알았더니 실망! 
10,웃기고 슬프고 잔인하기도하고...아저씨같은 느낌도 남평점보고  볼까고민했었는데  보길 잘한듯 
1,진짜 너무 합니다.. 와....그냥 보지마세요일주일 안에 상영 내려질듯정말 재미없고 내용없고 뭐라고 표현을 못하겠어요장진 감독님 실망입니다 
1,이런영화를 10점주다니..확실히 평점알바라는게 있긴하는듯 
1,아차승원진짜좋아서봤는데...이건..이게무슨느와르임 게이영화... 
1,내돈시간돌러주삼ㅡㅡ 
1,다알바인가봐여기 진짜 길고 재미없음 
9,차승원땜에 봤는데..후회없음 
1,알바좀 풀지마쇼 타영화에 평점 1점주고 하이힐만 10점 아니 그렇게자신이없어 ?? 트랜스젠더 소재의 영화라고 왜말을못해? 40 대이상 공감대 제로 스토리도 없음 
10,재밋어요슬퍼요차승원짱 
10,정말좋아요!재밌어요 보세요 
1,쓰레기 영화...어처구니가 없었다.. 
7,차승원 연기잘했네.. 감독은 정체성이 좀의심된다. 주위에 차승원 같은 사람이 많던지.. 
9,탄탄한 연기와 연출 이래서 한국 영화가 인정 받는듣하다.. 멜로 코믹 액션 모든게 잘 어우러진.. 포스터만 좀더 확 끌리고 예고편만 잘 홍보 됐으면 대박났을듯.. 작품성은 백점 드리고 싶습니다. 개인적으로 멋진 해피...
10,기대안하고 봤는데  차승원배우님의 액션연기 감정연기 너무 인상깊었습니다. 추천합니다 
7,
10,여운이 오래간다... 
9,너무 좋아요.폭력적이면서 슬프기도 해요 
10,아마 지금도 음지에서 어쩔수 없이 그냥 살아가는 성소수자가 있을듯..그런 내용을 담은거 같아요.  감독님덕에 세상에 안보이던게  조금은 보이는것 같네요.벽이 한칸은 낮아진 느낌! 물론 차승원씨 오정세씨 외 배우자분들...
10,
10,거의 아자씨 수준으로잼잇네 
6,오정세 분조장 연기 졸라웃김 그냥저냥 마니 지루하진 않음 
10,꼭 동성애자가 아니라도 너무 슬프게 여운남게 잘봤습니다 
10,차승원씨 연기가 좋네요ㅠ 
8,"차승원의 성소수자 연기는 좋았지만, 화장해도 너무 남자답게 생겨서 쪼금 오글 ㅎㅎ "
10,감독님이 은근히 코미디 욕심이 있으신듯 ㅋㅋㅋ 
10,차승원 연기 와 소리나옴 
10,차승원 눈빛 감정연기에 영화끝나고도 그 눈빛을 잊을수가 없어요  잼나게 봤어요 내용도 신선하고 디테일까지 
10,배우차승원을 존경하게된영화 
10,오랜만에 보고 몇번을 봐도 개인적으로는 수작이라는결론이변함이없다 평점도 흥행도 좋지않다는게 개인적인차이겠지만 이러한평들이 아쉽게느껴질정도로 짜임새있고 차승원 배우 연기또한편견을날려버릴정도로훌륭하다 
9,차승원이 아니면 소화 못할역활! 거부감없이 잘 봤네요! 3자입장에선 멋있지만 슬픈?? 그런 감정이에요! 멋있지만 슬픈?? 이런 연기는 차승원만 할수있을거 같아요! 그치만 감독이 마음에 안들어 1점빼요 
10,잘만들어진 멋진영화 입니다 
6,차승원 나오는 액션영화인 줄 알았는데. 저리 키 큰 차승원이 힐 신고 치마입은건 신선한 충격이었음ㅋㅋㅋㅋ 
10,정말 다루기 힘든 독특한 느와르 소재신선함 
8,"영화 시작후 10분 까지는 느와르 갬성에 흠뻑 젖어 이 영화가 막을 내릴때 까지 쭈~욱 흘러 갈껏만 같은 기대감에 차 있었다..하지만, 중반부터 이 영화의 또 다른 주제인 트렌스젠더가 물씬 들어가 버렸다..사실 알고..."
10,
10,총 세번쯤 본거같음 처음에는 멋진 차승원이 멋지고 웃기다길래 두번째는 액션이 다시보고싶어서 오늘은 이상하게 눈물이나네요차승원역할이 넘 안쓰러워서 자꾸 눈물을 훔칩니다.차승원님의 눈이 자꾸 안스럽습니다. 
10,차승원씨 연기 너무 좋았어요. 몰입이 잘됬어요. 
8,"무슨 영화인지 모르고 봤다, 깜짝 놀랬던 기억.야위어가는 주인공의 몸과 마음만큼이나 이를 바라보는 관객의 쪼그라든 마음도 액션을 장착한 채 뷴노의 카타르시스를 폭발한다. 장진의 영화 중에 가장 재밌는 영화라 할 수 ..."
10,성별 그런거 모르겄고 음악은 기가맥히게 좋다.. 
10,옛날에 보고 한 번 더 봤어요 역시 좋네요 
10,차승원 이라는 배우를 다시 보게된 영화..연기력너무 좋았고 차승원에 대한이미지가 좋게 남겨짐. 참 괜찮은 배우다라고 생각되게 만들어줌..굿 
10,와우~이 영화를 이제야 보다니...차승원 액션부터 감정선까지 진짜 연기 대박~!! 짱!짱!짱! 
10,쇼킹했다 개인적으로 변장한모습이 상당히 불쾌했지만 영화너무재밌습니다... 
10,
8,오랜만에 봤는데 여전히 재밌네요 
10,
7,차승원의 모노드라마를 본듯한 느낌. 조금은 그들에 대해 생각하는 계기가 되었다. 
8,차승원 연기가 너무 좋았다 
8,넘 잔인한데 또 차승원땜 여운이 남네요끝이 다행이다 싶으면서도 아쉬워요 
6,간간히 빵빵 터지는 장면이 있다. 성소수자의 빈껍데기 같은 눈빛공허함이 영화 내내 이어지는데나는 잘 이해 못하겠다. 과한 설정이 아쉬웠지만 액션신은 느와르다. 
5,차승원이 이런 장르의 영화도 찍었었구나.... 
10,소재. 컬리튀. 훌륭하닼 
10,차승원배우가 아니라면 그런 절제된 감정선을 연기하기는 어려웠다고 생각합니다. 너무나도 남자다운 외모이기에 더 가능했던 거 같아요 
10,모든 면에서 훌륭한 영화였습니다 
8,내용좋고 연기 좋고~~~스토리의 매끄러움이 약간 아쉬움 
8,너무 재밌는데 결말이 심각하게 아쉽다 
9,수작~!!차승원 연기 이장과군수 이후 최고였다 ㅋ 
10,폭주해서 물불 안가리는 악역들의 표현을 잘한듯 합니다. 무자비함에 무서움이 느껴졌으며. 주인공이 강하지만 현실적인 액션을 보여준거 같아서 좋았습니다. 거기에 내면에 잠재된 욕망의 표현방식도 엄청 거부감 없이 표현한게...
8,신선하고 재밌었습니다 느와르가 안잔인하면 뭐가 잔인해야하는지 나참 ㅋ 
9,차승원성님 액숀 굿드~ 
7,음.. 잘 모르게쒀여.. 잔인해여... 
8,장진감독스러운 창의적이고 신선한 소재의 영화. 차승원의 매력 또한 넘쳤으며 액션 또한 볼만했음. 스토리의 개연성이나 짜임새 때문에 평점이 크게 높진 않은것 같지만 재미있긴 했음 
8,짠하다ㅠ더이상 젠더들을 비웃지 않겠다!! 
10,그에겐 그게 아무것도 아닌 것이 될 수 없었던 거야. 그의 기억은 거기에 머물러 있었던 거야. 그는 그것을 쉽게 버릴 수 없었던 거야. 그에겐 그게 모든 것이었던 거야. 그러니까 함부로 평가하지 마. 하지만 결국 돌...
10,재밌어요ㅠㅠ 잘만든영화임.. 
10,자꾸 생각나네 소장하고픈 영화 차승원 연기 정말 좋았다 이런슬픔 오랜만 
10,잼나게 봄ㅎㅎ  차승원 굿 
10,헐퀴 보면서 존나 웃었고 존나 먹먹하다ㅠㅠ 
10,잔인한 장면이 많았으나 여성이되고픈 남자의 몸부림이 표현된듯 하여 별점은 안깍았습니다. 
9,차승원의 눈빛과 내면연기가 빛납니다. 
10,차승원만 할수잇는 영화 
9,줄거리가 살짝 부족한? 살짝 뒤뒤죽박죽였지만 영화 자체는 매우 아름다웠던.. 색감이 너무 좋았습니다 
7,여자로살았다면 조았을걸 하고싶은걸못이뤄서아쉬우네요 
8,장진정도 짬이니까 가능한달콤한 인생과 아저씨의 패러디 
8,아.. 이게 장진 감독이 만든거였구나 ㅋㅋ 그래서 크라임씬에서 트랜스젠더 추리할 수 있었군 
10,심각한데 순간순간 개그가 섞여있어요그게너무 신선하고 재밌네요연기도 내용도 굿입니다 
9,슬퍼요.. 차승원 그 남자답고도 서늘한 눈빛에 눈물이ㅠㅠ 
10,차승원연기♡장진연출굳 
9,나는 아역배우들도 좋았고 이솜의 신호등 노래도 좋았고 차승원도 좋았고 오정세도 볼 수 있어서 너무 좋았다.원래 잘 잊어버리는 편인데..이상하게 오래도록 기억에 남는 대사나 장면들이 몇 있음. 
9,아니 이거 평점이 왜케 낮은거죠? 이해안됨.. 마지막 결론이 정말 슬프고도 먹먹함이 밀려오네요 암튼 차승원씨 연기 정말 멋지다... 
10,"오랜만에 생각이 나서.. 안보신분, 고민하시는분, 강추할게요! "
10,기대안하고 봤었는데 여운이 길게 남는 너무나도 매력적인 영화였다. 시간이 흐른 후에도 다시 찾게 만드는 영화. 
7,마음이 너무 아리다.. 어떡해.. ㅠ. ㅠ 
10,신선한소재 개인적으루 꿀잼..ㅎㅎㅎㅎ멋잇오 
10,차승원 연기가 정말 ㄷㄷㄷ 하다... 이배우 한국에서만 썩기엔 정말 아깝다... 
10,"몽환적인 차승원의 눈빛, 깨고 싶지 않은 꿈처럼 느껴진, 보는 동안 현실을 완전히 잊을 수 있었던. "
10,해피엔딩도 새드엔딩도 아닌 영화 
8,승원무쌍  짜응 짜응짜응 
9,뭔가 부족한 흐름을 차승원이 꽉 채운영화..도대체 왜 흥행을못한건지 
10,  잘 기억은 안나지만  재밌게 봤다는 인상은 있어요. 
8,꽤나 신선하다 차승원은 특히 새로웠다 
9,포스터만 보고 멜로인줄 알았습니다. 모르고 봐서 더 좋네요. 성소수자들에 대해서 좀 더 생각할 수 있는 기회였습니다. 포스터 속 문구를 다시 보니 안타깝고.... 좋은 영화에요. 
10,스토리도 별로고 그냥 너무 잔인하고 그런데 차승원의 연기에 엄청난 충격을 받았습니다. 정말 차승원은 연기 잘하는 배우네요. 
8,차승원 매력 폭발. . 신선했고 액션은 멋있다. 
10,"차승원 연기 갑, 수퍼갑입니다.  완벽하게 이해하고 배역과 하나되심! "
10,차승원 오정세 연기 좋았어요 
10,차승원연기가정말.. 
7,차승원이었기에 가능한 영화였다.. 오정세는 역시 캐릭터와 역할이 묘하게 잘 어우러져서 역할 대사마다 피식했음. 이 영화의 가장 큰 단점은 제목이 아닐까? 
7,스토리가 좀 아쉽네요. 액션은 볼만함~ 약간 일본 만화 같기도 하고~ 
10,느꺄지는게 많앙 희노애락 
7,아니겠지.. 하면서 끝내 맞다는 것을 확인하고는 받아들일 수 밖에 없었다. 모든 성소수자들의 가족과 지인들이 이런 기분이겠지 
6,유치하거나 과했던 장진의 화법이 한꺼풀 벗었다. 
9,차승원 연기가 좋다 영화 분위기도 묘하고.... 
8,차승원연기는 역시 예술이다 정말좋았다하지만 영화내용은 쉽게 이해가 안된다 너무 빨리 끝낼려는 스토리 인거같기도 하고 마무리가 전혀 이해가 안간다... 그래도 시간가는줄몰르고 봤기때문에볼만한 영화다. 
9,자주 접할 수 없는 주제를 다른 영화이지만 차승원의 연기로 감정을 잘 전달 받을 수 있었다. 
9,재밌게 봤다. 차승원 연기 지림 
8,게이 느와르라...ㅎㅎ 
7,마지막은 별로지만 차승원만 보이는 영화인듯 
6,"흔한 조폭영화인 줄 알고 봤는데, 다소 신선한(?) 설정이 거슬리긴 했지만, 액션 시원시원하다. "
8,마지막 결투씬으로 끝났으면 더 좋았을것을 기대 안하고 봤는데 꽤 괜찮은 영화임 다만 영화는 영화일뿐 미화시키면 안될듯 
6,지욱의 아픈 과거와 결국 이루지 못한 꿈이 씁쓸했다. 
7,그냥 무난..큰 감흥은 없었.. 
8,굿굿ㅣ재미이시얏닛ㄱㅈ 
7,"진짜 묘하다. 차승원,이솜에 시나리오도그렇고 묘하게 끌리는영화임. 쓸데없이 인물들막죽이고 조금씩 허술한부분이많이보이긴했는데 배우들연기때문인지 색다른소재때문인진 몰라도 인상깊게 남은영화임. "
10,되게 재미있네요. 차승원의 연기도 그렇고. 다루기 어려운 주제임에도 불구하고 동성애자의 마음을 잘 풀어나간 느낌이 들어요. 
6,처음 보는 신선한 느낌이었다. 
8,"매력적이고 감각적인, 전반적으로 깊지는 않지만 주인공은 깊은 퀴어 영화 "
10,10점10점10점10점10점 
10,기대했던 것보다 훨씬 재미남 ㅎㅎ 
7,흥행실패 이유는 너무 많은것을 담으려고 했다.아저씨와 테이큰처럼 깔끔하게 했다면 개운했을텐데 많이 아쉽다. 
9,장진 감독 깨알재미 좋다 
7,남다른 시도에는 찬사를 보내고싶지만 시도만 좋았을뿐. 액션과 성적감성을 섞는다는게 엄청난 부조화로 느껴지네요. 
10,10점짜리는 아니지만 7점짜리는 아니기에.. 
8,쉽지않은 요소를 이정도로 녹여낸다는게 쉬운게 아닌데 장진영화 특유의 정적인 유머도 잘녹아들면서 과하지않은느와르물이 되었다 스무스하게 연결되는 감정선도 좋아쓰 
6,옛날영화라고생각햇는데 아니었네요. 과거회상씬은 아름답고 섬세하게 잘 표현한거 같은데 그외 전체적인 연출이나 묘사는 옛날영화느낌납니다. 막판에 악당이 폭주하고 차승원한테 집착하는 것도 개연성이 떨어지고. 가벼운건지 무...
10,난 이게  왜  흥행 못했나  싶다 ...진짜  잼있음 
9,어떤 사람이 어떤 장소에 어떻게 있을지 모르겠다. 
8,액션도 좋았고~ 괜찮았어요 
8,마무리가 다소 산만하나 미묘한 감정선이 가슴을 먹먹하게 만든다. 하드보일드 속의 포기해야만 하는 여성성이 어쩐지 더욱 잔인하게 느껴진다. 차승원과 장진이 힘든 소재를 아쉽지만 매력적이게 잘 살렸다. 
10,차승원 연기 좋네요ㅎㅎ재밌었어요몇몇 조연의 비중 안타까웠던게 ....우리 사범님ㅜㅜ 
8,차승원 오정세 둘다 진짜 멋있었다. 특히 마지막에 액션신이 지렸지.. 기대 이상이었음 
8, 먹먹..하네요.. 차승원씨 연기.. 설득력 있었습니다.. 보는 내내 가슴 아팠어요.. 
7,그냥 느와르만. 있었다면... 신선한 소재는 나쁘지않았다 
8,하이힐>우는남자>황제를 위하여 
8,연기좋고 재밌었습니다 
10,몰입해서 잘봤습니다~  시간이 아깝지않음  굿! 
8,역시 집에서 보는게 편하군..SNL크루 회식 + 서울예전 동문회 
9,이거 골때리는 영화네 ㅎㅎ 
10,배우 차승원의 또 다른 모습을 볼수 있었고~ 영화 재밌게 봤습니다~액션씬 하나하나 기억에 남더군요~ 윤지욱이라는 캐릭터~묘한 느낌이 오면서 끌리네요~빠져드는 느낌이 있는 영화! 
10,오늘 집에서 TV로 첫방영해주는거 봤는데 재밌던데여ㅎㅎ 개인차이니까 다르겠지만 중간중간 웃긴포인트도 좋고 재밌어여^^ 
10,재밋게 잘 봤습니다 추천이요 
10,조복래씨 이번엔 조폭역으로 비중있는 역활을 맡으셨군요 멋지십니다!! 
10,와.. 너무 슬픈 이야기 
9,색다른 소재를 비현실적으로 접목했지만 나름대로 재미는 있네요.. 
9,연출이랑 미술도 정말 멋있어요 ㅠㅠ 연기도 너무 좋고 세번째 봐도 재밌네요 음악도 너무 좋아요 
8,소재가 참신하고 좋았어요하지만 잔인한 장면은 제 취향이 아니네요 
9,독특한 소재. 화려한 액션. 허나 아쉬운 마무리. 
10,차승원이라서좋았다♥ 
7,가볍게 접근하지 않은. 나쁘지 않은 시도로 남게 해준 것은 차승원의 힘. 
5,음 글쎄요.. 좀 더 깊이 있으면 좋았을거 같아요 
6,차승원빼면 이게뭐지.... 
9,"달콤한 인생만큼 스타일리쉬하면서, 상상력을 자극하는 영화. 차승원의 남성성이 묘하게 여성성과 어울린다니. "
10,좋다 젠더 이야기 앞으로 최고 배우들이 많이 소개해줬으면 좋겠다 
9,차승원의 또다른 모습 !!! 
10,전재밌었어요 연기최고 
6,차승원이 좋아서 봤지만 개인적으로 이런스토리는 별로인듯 너무무적으로만 나오는 차승원도 별로...캐스팅은 괜찮았지만 실망적인영화... 
10,연기 너무 멋져요 ㅠㅠ 차배우님 최고!! 
5,실망스런 영화...그렇게 칼을맞고도 안죽고...영화라지만 너무하다 ㅠㅜ 
8,잔인한것만 빼면 좋았어요 다양한 장진감독의 영화 좋네요 
10,다른걸 떠나서 굉장히 색다른 영화였어요 박수칠때떠나라 이후 이런 느낌은 첨인듯 굿굿 
8,차승원씨 진짜 좋은 배우네요 
4,차승원이 아까운영화.. 
8,그냥 그럭저럭 볼만은함 
10,신선합니다. 차승원이라는 연기자 다시 보게 되었습니다~ 
6,마무리가 좀 엉성하게 끝나서 아쉽다. 
8,뒤늦게마일리지수거함 
10,성소수자에 대해 연기하기 쉽지 않았을텐데 깊은 내면연기 정말 감동이었습니다. 차승원  연기에 대해 다시 보게되네요. 왜 흥행을 못했는지 의문이네요. 
10,기대이상으로 재미있게 본 영화..차승원의 또 다른모습에 감동감동이요~ 차승원 넘 멋져요~ 
10,진짜 장면 하나하나 감동이였습니다. 액션적인건 나름대로 남자들을 설레이게하고 강인한 모습속에 끌어내리는 격한 감정을 이렇게 보여주다니 우리나라에서 이런 영화가 만들어지는건 정말 감동입니다. 
10,"마음을 충족시켜준 영화. 많이 무겁진않지만, 자판기에 파는 블랙커피처럼 진하다 "
1,재미없다!@#$%^&*( 
9,우와 정말 차승원님의 연기 내공이 최고예요!장진 감독님은 진짜 천재시죠.느와르를 이렇게 비틀어서 사용하시다니!!!! 
10,차승원 연기 좋네요..보면서 짠했어요..내면연기 굿입니다~ 
9,가히 명작이라할만하다고 생각함; 보는내내몰입했고 액션도 꿀리진않았다 애초에 액션보다는 보느내내 마음속에 많은걸 느끼게해줬음.. 차승원이  연기를저렇게깊게하는사람인지도 이걸로처음알게됬고 ㅋ 
9,이런 작품이 흥행 안된 이유는 딱하나겠지. 퀴어영화라서. 근데 그런거 신경 안쓰고 보면 굉장히 강렬한 감성 느와르인데.. 개잼있었다. 
10,진짜 분위기랑 간간히 터지는 개그감 또 봐야지 
10,잔인한 장면을 좀 완화해서 15세 정도로 낮춰도 좋을듯.... 차승원 연기 다시보게 되네요...!! 
10,남성성과 여성성의 갈등. 그로테스크한  표출.  공허한 현실. 극한의 남성적인 느와르 물로 과장하여  표현.다른  퀴어물을 보면 왜 궂이 퀴어로만들어야했는지 개연성을 못찾았는데 이영화는 퀴어라는 장치가  큰작용을 해...
7,생각보다 볼만하다.차승원 몸매가 참 좋네. 
7,신선한 주제네요ㅋㅋ트렌스젠더와 액션이라니 
10,많은 생각을 할 수 있는 영화네요 잘봤습니다. 
10,차승원씨 연기가 좋았습니다ㅎㅎ 
10,가슴이 아프네요ㅠ.ㅜ차승원씨의 섬세한 감정연기에 감동받았어요멋있습니다♥ 
7,좋으네요. 사랑을  표현하는 방법이 다른사람들이야기 
6,소재는 좋았고 부분부분있던 성소수자의 고충묘사도 괜찮았는데 조폭이 얽히면서 이야기가 이상하게 풀어져간게 아쉽다. 차승원연기랑 오정세 캐릭터는 좋았는데.. 
