score,review
10,"위험하고,아찔하고,슬프고,진심어린 파격적인 장진의 영화!하이힐…모두가 관심을 가져야 할 영화가 아닐까 싶다. "
9,급마무리된느낌빼곤다괜찮았어요..첨부터끝까지차승원의슬픈눈동자에...가슴아팠어요.연기넘좋아요.! 
7,참 신선하긴하네ㅋㅋㅋ 이런영화인줄 볼만하다 
8,"너무 멋진 액션, 차승원이기에 가능한 역할이었다. 멋진 영화. "
7,남는건 차승원 연기뿐.... 딱히 소재가 나쁘진 않으니 볼만하지만 그이상도 아니다 
8,잔인하고 웃기고 슬프고.나와서까지 가슴이 먹먹했다.끝이 조금 아쉬웠지만..그래도 역시 차승원이다. 다른 사람이 그 역을 한다는 것이 상상이 안 간다.하나님이 바빠서 잊어버렸단다.하나님 뒤편에 있는 사람을...ㅜ.ㅜ잔...
9,잊을 수 없는 강렬함! 인간의 내면을 아우르는 밀도 있는 이야기 
5,참신한소재 차승원의 연기 까메오들의 등장으로 볼거리는많앗으나 액션물을 본건지 코믹물을 본건지 게이물을 본건지 모르겟음 느와르는어디에 
10,"파격, 섬세, 우아함, 슬픔… 복잡미묘한 영화. "
4,다 떠나서 도대체 무엇을 말하려는지 모르겠다.. 모두 포스터에 낚인 내 잘못 
10,명불허전 차승원! 캐릭터가 지닌 내면의 아픔과 감정 변화를 깊이 있게 표현해 낸 세밀한 감성 연기가 압권이다 
7,포스터 때깔부터 예사롭지 않았는데. 드디어 보게된 하이힐은 여태껏 내가 보지 못한 색깔의 영화였음. 엉엉 울면서 롤리팝 사탕을 먹는 느낌이랄까 
9,영화내용은 뭐 평점봐서 예상했다. 나쁘진 않았네 뭐. 차승원은 진짜. 대체할 배우없음.. 넋놓고 봤다 차저씨 액션ㅠㅠ 
10,차승원 잼ㅋㅋㅋㅋ액션에만 치중되지 않아 괜찮았다. 
9,남성적이면서 여성적이면서~~근데 마지막에 둘이 결혼을한단거야 아니야?잔인한데 너무 여성적.작가주의  장진 
10,차승원의 꿀복근 *-_-*.. 영화의 재미는 물론이지만 차승원씨 보는 재미도 쏠쏠 
7,"액션보단 스토리중심이구피가종종 튀지만 재미집니다 착하고 악하고 확실한경계가아닌 모호한 느낌 전좋아요~오정세,박성웅 사랑합니다~ "
10,여자가 되고 싶은 남자의 어쩔 수 없는 선택.. 보면서 내가 다 마음이 아플 정도로 빠져들어서 봤다. 
5,장진영화 특징 스토리를  쫙 끌어가다 갑자기 느려진다 그러다 끝... 지구력이 딸린가봐? 
4,굳이 어려운요소를 안넣었으면 그냥 액션 보는 맘으로 보는건데..왜넣은거여. 요새 영화보는거 골똘히보는거 시러해.그냥 부실라면 부시지뭘..꽈 
7,재밌었어여~ 반전? 같은건  없었지만 배우님들 연기가 참 좋아서 몰입해서 봤어요!! 다만  찌르고  피 막 나오는 장면들이 불필요하게 너무 많이 나오는것같아서  보기 조금 불편했어요! 
10,후...스토리 엉망 감독 때려쳐라진짜하지만 차승원이좋으니 10점♥ 
5,어쩌면 예민할수있는 퀴어적인 부분을 상업영화로 장진감독님이 만들었다는게 놀라웠구요  처음접하는 사람들에게도 부담되지않는 선인것 같아요 처음시작에 차승원의 액션신이 강하게 압도해서 멋있었던거같아요 결론은  차승원의 적...
8,구성이나 컨셉만으로도 신선하다 
9,차승원의 호흡에 따라서 영화를 보니 너무 슬픈영화였다.다만 성소수자에 대한 선입견이 있는 사람들은 내용을 모르고 갔을때 불편했을것이다. 여하튼 차승원이란 배우는 이제껏 본 작품중에 단연 최고의 연기를 보여준듯. 
10,기운내요 장진... 이걸로는 힘들겠지만 다시 일어나길 바랍니다... 
6,전체적으로 볼만했으니.. 결론이 그게 머냐.. 허겁지겁 마무리.. 
9,"하이힐을 신고 싶어하는 무늬만 마초..두고두고 웃긴 장진식 유머코드에 누구보다 마초같지만 트렌스잰더 형사라는 톡특한 소재그리고 차승원!!!>,<♥♥소재의 특이함에 평가절하되는거 같아 안타깝다 "
9,생각보다 재밌었어요 ㅋㅋ 앞부분은 진짜 웃기고 다 보고나니 슬펐고 ㅠㅠ  느와르는 아닌듯 ㅋㅋ 
9,의외로 코믹한부분이 많아요!! 덕분에 많이 웃고가요~ 강추!! 
9, 장진감독의 비유적 연출 너무 맘에 든다기대하고봤는데도 기대이상임 
5,그냥 이해도안되고 배우들연기만좋음 내용 갈피도못잡겠다 별로 
8,가장 좋아하는 배우 차승원의 명품연기는 역시 명불허전이었다 근데 약간 빈약한 스토리와 필요 이상의 잔인요소는 마이너스 요소... 
7,영화의 소재는 좋았으나..스토리 진행이나..구성이 많이 아쉬웠다~ 초중반 코믹은 재미있었으나..진지한 내용의 흐름을 깨는듯한 느낌은 받았다. 아무리 느와르지만 너무 잔인했다.차승원의 연기는 정말좋았다. 7점중 차승원...
7,"아무리 오락영화라도...조금 화난다...ㅡ,ㅡ 장진감독님 실망;; 연출력이...SNL 하셔서 너무 오락쪽으로만 가신듯...;; 이솜과 차승원만 기억나네요;; "
4,SNL 애들 나오면서 무게감은 떨어지고 코믹함과 진지한 느와르에 조화가 이루어 지지 않았으며 전개가 지루하고 급한 마무리가 아쉽다 
7,잼나네요액션씬은 최고네요 지루하지도 않고 
8,평이 별로 좋지 않네? 난 별로 기대를 안하고 봐서 그런가 액션도 완전 멋지고  통쾌하고 내용도 맘에 들고 진짜 잼있게 봤음요~!^^ 
4,너무 실망ㅠ 퀴즈왕이후로 또 내리막ㅠ 영화 
6,엊그제봤던끝까지간다보단아이러니한감정들이느껴지는영화였어요엔딩은해피엔딩을가장한새드엔딩다만전체적으로장감독님의욕심이드러나보였던좀아쉬움이남네요 
7,차승원의 열연이 돋보이는 영화.. 중반까지는 장진식 코드가 통했지만 후반부터 힘을 잃고 이도저도 아니게 되버림. 
4,감독이 너무 많은것을 담으려고 한듯~~멋진배우를 이상하게 만들어버린거 같음. 
7,'지욱'의 캐릭터는 차승원만이 소화할 수 있는 캐릭터가 아닐까 싶다. 
8,8점정도가 딱 적당한듯일단 차승원 연기와 액션은 정말 굳굳굳마지막에 뭔가 대단한 반전이 있을거 같았지만 뻔한 내용이었다는게 함정이야기가 전체적으로 흔한 내용을 쓴건 아니라서 나름 신선했다ㅋㅋ볼만했음ㅋㅋ 
6,잔인하기만하고 스토리 라인이 매끄럽지못한  코믹 신파  느와르. 
9,"장진 감독 특유의 코믹함 좋았음. 그러나 필요 이상으로 잔인한 부분이 많았다고 생각. 퀴어들의 세계에 약간이라도 관심이 있는 사람에게 결말은 상당히 슬프게 다가옴.. 젖어들 만한,  좋은 영화 "
8,발연기만 안하면… 기본은 주려고 했는데. 연기의 신이 요기 있넹 
9,섬세한 장진만의 감성과 그걸 그대로 표현해낸 차승원  개인적으로 진짜 재밌게봤음 . 
7,이솜이 피아노치면서 부른 노래제목먼가요ㅠㅠㅠ 좋다 
8,배우들의 연기력은 대단했고 젠더에 대해 다시 생각해보게 되는 영화였습니다. 중간중간 작은 반전들도 재밌었어요 
6,베스트댓글이 정확하게 설명한듯.. 주인공의 신파극에 전혀 공감할 수 없었다.. 
7,내용없어도 차승원 캐간지덕에 눈호강하고옴명분주려고 여성이나 아이에게 심한짓하는 장면없어서 좋았음 
9,너포위에서 봤던 차승원의 모습과 비슷하면서도 다른 느낌! 차승원의 연기력을 드디어 인정할 때가 온듯 싶음ㅋ 
6,솔직히...재미없다.재미없을것 같았는데 그래도봣는데 역시나재미없음..뭔가 부족한느낌?차승원이 여장하는데..ㅜㅜ차승원은 너무남자다우니까 그런연기만 햇으면 좋겟어요...ㅠㅠ 
5,배우들의 연기력은 매우 훌륭했으나 감독이 다 망친 것 같습니다. 개봉날 바로 예매해서 봤는데..  글쎄요 초반에 정말 재미있었는데 갈수록 지루해지고  잔인하기만 하고 감동도 없었습니다.마치고 나오는데 다들 기대이하라...
7,조금 충격적이 었지만 신선한 느낌의 영화.  호불호가 갈리겠지만 난 재밌게 봤어요 ~ 
6,난  청불 믿고 봤는데 배드신 하나도 음슴...정상적인 사람이랑 또다른 세상속에서 살고 있는 사람들의 이야기...영화 오늘 봤는데 정말 솔직히 무슨 내용인지 모르겠습니다.차승원 씨만 연기가 좋은듯 하네여 
9,"대체로 만족! 이솜 연기도 나쁘지 않고 다른배우들은 말할것도 없고, 다만 좀 잔인한게 흠 "
7,여러모로 독특한 영화긴 하다. 먹던맛도 아니고 맛없지도 않고 묘하게 매력적인 영화. 
3,마치 싸구려 초콜릿을 먹은 느낌 입안에 썪이지 않은 재료가 입청장이랑 입안에 덕지 덕지 묻어난 느낌... 
4, 차승원 액션씬은 좋았지만.... 작가가 너무 욕심낸듯;;;영화에서 고경표 귀여웠음ㅋㅋ고경표랑 오정세땜에 웃고 나왔닼ㅋㅋ 
9,"거두절미하고,영화관가서볼만하다.한두달기다리면집에서도보겠지만영화비안아깝다! "
10,차승원연기굿이에요ㅎ 
10,차승원은멋지고섹시하기까지하다영화도연기도다좋지만난그냥스토리가ㅜㅜ마초적인남자로만나와주길 
10,좁은 공간에서의 액션이라 더 긴장감 느껴졌어요. 액션 장르에 첫 도전이라지만. 이건 딱 장진 
10,영화 좋던데 평점들 너무 짜다.. 
10,돈이 안아꺼운 영화에요 
9,이런 캐릭터를 하려면 배우에게도 어느 정도의 여성성이 있었어야 했다. 차승원은 완벽 그 자체. 그걸 발견하고 끄집어낸 장진도 대단! 
7,연기가 정말 볼만함. 독특한 소재의 영화인데 후반부로 갈수록 좀 뻔해지는게 아쉬움. 전체적으로는 괜찮은편. 
9,차승원씨 연기 좋았어요~내용도....좋았는데... 스토리 풀어나가는게 좀 약했지 싶어여~연기들은 빵빵했눈데...ㅠ 아주 조금 아쉽내요~ 
10,독창적인 액션 멜로의 느낌? 별 10개 모자라요 ㅎ 
10,차저씨. 중년에 이런 액션 감성 대단해요!!! 
10,차승원 연기~좋았음  그런데 너무 잔인했다ㅠㅠ 
7,디테일에 신경쓴 게 보인다. 다시 보고 싶넹 
10,차승원은 이제 장르필요없이 모든연기가 다 되는듯..간만에 재밋게봣어요 
9,차승원의옷태에영화보는내내흐믓했던영화! 중간중간코믹도있어서재밌게잘봤어요 
8,하이힐 신은 차승원 발이 은근 섹시하더라 
7,SNL영화???? 그래도 액션 존멋.. 
10,투표하고 하이힐 본 나를 칭찬. ㅋㅋ 탁월한 선택이었엉 ㅋ 
10,감성 느와르으리으리. 으리으리한 차승원 연기 잘 봤어요 ㅎㅎ 
10,정말재밌었고  차승원씨 연기 진짜 잘 하시는것 같아요~~이런  역할은 차승원씨만이 할  수 있는 역할인거같아요~~ 
10,배우들 연기가 대단하네요 영화가 주는 감동도 그렇구요 또 보고 싶어요 
10,이런 상업 영화가 많이 개봉해야해요 너무 재밌었음 
9,장진감독의 색다른 시도! 이제껏 본 장진 감독의 영화 중 가장 인상적이다 
10,하이힐은 적어도 스토리가 있었다 기승전결이란게 있자녀~ 
8,차승원 연기는 정말 최고! 근데 이런 연기가 연출 때문에 빛을 덜 발하는 느낌ㅜㅜ 소재도 특이하고 좋았는데... 편집이랑 중간중간 유머코드가 불협화음.. 차배우님 연기 때문에 8점 줍니다ㅜㅜ 
5,느와르 달고나온 영화들은 죄다 이모양이냐..예고편 열번은 더보고 기대작이였는데 영화관에선 빨리 오줌싸러 나오고싶었음 
10,엄청웃기고엄청재밌었는평점오ㅑ이래  오랜만에재밌게봣뉸데ㅠ 
10,요즘 느와르 영화가 대세지만 이렇게 독특한 감성의 느와르 영화는 처음이다… 
10,재밌는거 같군요 같은 한국사람끼리 한국영화 좋아해주면서 즐기면 좋겠네요 
10,5월부터 기다렷던 완죤 섹시♡ 
4,그다지충격적이지않다. 달콤한인생을 기대하고갔다가 실망. 
10,이반들이 보기에 정말 좋은 영화같다  앤이랑  정말 몰입하면서  잘봤다  나도  여장하고  싶을정도로  ㅎㅎ 차승원 짱 
5,중간중간웃음코드있어서좋았어요~차승원여장은좀지못미지만..성정체성잘못타고난사람들이불쌍하단생각이들었음..차승원도좀안되보였고..이럼차승원연기는괜찮았단거아닌가??섹시하다차승원~40대배우중섹시는갑인듯 
8,장진영화는 역시 장진냄새가 물씬 풍긴다. 포스터만 보고 갔는데 영화는 예상과 다르게 흘러갔다. 
2,장진  그동안 그래도 쫌 웃겨서 봐줬는데 이제는 못보긋다 은퇴해라 장진 베이시스 같은색이 
10,생각없이 봤는데 생각하게 만든영화. 
6,이도저도아닌.... 
5,비현실적이고 불편한 치기어린 느와르. 
8,승원형님.. 참남자네 
10,차승원 정말그냥무조건 멋있음.그 여자같은 섬세한 눈빚과 과하지 않은 제스처 캐릭터자체.느와르적인 장면 연출은 장진감독이라 가능한거같기도.스토리는그닥.차승원 액션신 진짜 레전드.차승원 진짜 기럭지 외모 연기 안되는게뭔...
8,좀전에 굿다운로더로 다운받아봤는데 잼있었다차승원 멋짐. 연기연출 다 좋아요. 엔딩만 쫌 아쉬웠다. 걍 여자로 잘 살지 그렇게 힘들었는데 ㅜㅜ 
10,한국영화는 잘 안보지만 이런 영화라면 얼마든지 보고싶다. 
9,회상 장면이 감동적이었습니다. 
9,"개인소장영화. 개봉후 열번도 넘게 본듯. 남자 오정세/남자 안길강과 남자 껍데기를 쓴 여자 차승원의 대치와 대사가 굉장히 흥미로움. 김조광수의 영화는 소녀의 판타지스러운데 비해 현실적이고, 장진식 유머를 넣어서 무겁..."
1,퀴어영화인데 성소수자에 대한 고증이 전혀 맞지 않았습니다 어이가 없네요 
10,두번봐도 안질리냐... 
10,차승원반전매력!!!! 
10,신선하고..스토리 정말 잘만들었어요~!차승원을 다시보게되는 영화.. 
10,왜 이제서야 이 영화를 봤는지... 
9,"장진 감독은 대단한것같다. 연출력도 연출력이지만, 분명 비슷한 내용으로 소재만 바꿧더라면 흥행했을법한 시나리오를 단순히 재밌어서인지 하고싶은말인지는 모르나 표현하였다. 그의 선택과 배우진의 연기력은 정말 일품이었다...."
1,한마디로 이 영화는 차승원이란 배우가 아까울 정도다! 
3,짧은 영화에 여러가지를 한번에 다 넣을려고하니 좀 별로였던거 같아요. 차라리 액션을 없애고 만들었다면 완성도 높은 영화를 만들수 있지 않았나 하는 아쉬움이 있네요 
1,이건 뭐...차승원 연기만 돋보일뿐..느와르면 코믹적인 요소를 최대한 배제하거나아니면 차라리 왕창 웃기던지..차승원은 이제..성숙하다..연기가.. 
1,겁나영화병맛재미없어 
1,영화로 주는 메시지가 무엇인지킬링타임용 수준 
8,아직 우리나라가 오픈마인드가아니라는걸 보여주는 평론들이네요 성적소수자를 다르게 분류할게아니라 나와같다생각한다면 타인을이해하는것에대해 심오하게볼수있지않을까합니다 배우들의 연기에 흡입력있는영화였고 시간제약이아쉽지만 색다...
9,저는 재밌게봤어요ㅎㅎ 
7,승원이 형님이 살린영화 스토리는 구리나 승원이 행님의 액션연기가 일품 
10,"용두사지렁이 장진 영화였는데,  하이힐은 잘 만든것 같다. 다만 코믹은 못버리는지 중간중간 장르가 헷갈릴때가 있지만 소재의 참신함이 마음에 들었다. "
8,성소수자의 현실과 슬픔 아픔도이 좋고 액션도 있어서 좋았어요 감정연기도 좋았어요 
8,소재가 독특하고 신선했습니다. 다만 지나친 칼부림은 좀.. 어색했습니다. 
10,제발 이솜노래ost원해요ㅠ노래들을려고영화다운까지받았어요 ㅜ 
8,"중간 중간 지루하게 느껴지는 부분이 있다. 무겁고 거친 액션씬을 가볍고 경쾌하게 만들었다면 젠더라는 소재를 더 멋지게 부각시킬 수 있었을 텐데... 아쉽다. 그럼에도 색다른 장면, 장진식 유머 등 장진은 누구와도 다..."
10,최고의 영화... 마지막 엔딩까지 최고.... 
4,실망...ocn나오게되면보세요.. 
5,윽..끔찍한영화. 비주얼쇼크 
9,신선  재미있게관람 하였습니다 
8,인상적이었던 차승원이 연기... 
10,신선한 소재에 좋다영화관에서 볼껄ㅜ 
10,진지하면서 가끔나오는 뜬금포 개그...재밋었네요 역시차승원 
8,와아아아아전 재밋서요 
6,나도 가끔씩 한번은 여자가 되고 싶은 욕망이 있다. 
7,제점수는요 7점입니다 
1,"쓰레기 영화, 언제쯤구성이 치밀한 영화가 만들어질까 차승원 너무 안어울려 ㅠㅠㅠ "
1,장진도 맛탱이 갔다... 
3,운명을 가장한.. 성소수자 인권 주장 영화..영화로서의 가치는 없었다..  어째서 이 사회가 인정하지 않는것을 이렇게까지 나타내야하는지..영화보는 내내 거북스러웠다.. 
1,장진에게 감독을 맡기는 제작자가 안쓰러울뿐... 
7,차승원 연기 잘한다고 느낀 첫 영화. 장진 감독이 뭔가 변하고 있다. 재미를 떠나서 장진 감독의 다음 영화가 보고 싶다. 
4,장진은 이제 끝이다 . 더이상 보여줄게 없다 . 자신만의 도그마에 완전히 빠진듯 . 차승원의 연기가 구세주 역할을 하려했지만 영화저체가 너무 엉망이다보니 역부족 
7,장진 감독은 감독에 이름 안올려도 되겠다.  누가봐도 장진 사단 장진 작품 .   영화자체는 좋았는데 스타일이 너무 친숙해서 약간 식상 영화자체는 추천 
7,음....?!! 분명 느와르 액션 물인데..뭐랄까 
9,"신선한 소재에 지루하지 않는 스토리, 액션까지 완벽한 영화 !! "
7,조복래 캐스팅 진짜 안어울린다 같은 소속사라하나 차승원원만 아니면 평점 진짜 ㅋㅋ 
10,차승원여장너무짜증났음 
6,차승원의 액션연기만 기억이남고  영화중반부터는 지루하다 돈내고 보기는 아깝다. 아쉬움이 많이 남는다 . 
5,차승원이 젠더 역은 좀...ㅠㅠ 그래도 액션씬은 죽여줫음~~ 
5,그냥그래요ㅡ 그냥  영화다 
4,흥뭐지이게 좀 이상해 ㅋ 
10,볼만하고 아주 잼있었음. 
10,마지막 장면 넘 뭉쿨ㅠㅠ보는내내 가슴 아팠음ㅠ 
10,"내용도 모르고 본건데..영화끝나고도 오래오래 생각하게 만드는영화였네요...묘하게 슬프기도하고요,,특히 차승원님..이렇게 연기를 잘할줄이야... 엄지 척~들어주고싶습니다!!! 꼭 보세요!!! "
10,"소재, 말하려는 바는 신선하지 않으나 '장진'과 '차승원' 과 차승원의 영화이기에 충분히 새로웠다. "
10,장진 감독 특유의 블랙코미디와 느와르의 결합 그리고 성소수자를 다룬 소재의 어루러짐이 가히 일품이었다. 이 영화는 분명 웰메이드 무비이다. 
10,짜응짜응맨짜응짜응맨 
10,개소름 역시차배우 으악 
10,좋은영화....새로운 영화... 
10,"배드엔딩인지 해피엔딩인지, 보고나니 묘하게 슬펐던 영화 "
3,아웃레이지 치과 장면 ㅋㅋㅋ 창의성도 부족하고 인물간의 긴장감도 부족하고 캐스팅도 실패한 것 같고 전반적으로 소재의 파격성 말고는 재미없는 영화 
10,영화잼있게봤습니다^^ 
10,시간가는줄 모르고 봤어요.. 
5,"너무 칼로 쑤셔대고, 피튀기고,, 남자들은 이런 영화 좋아하려나 나는 끝부분에 나옴,, 연기는 좋았어요~ "
7,후반부에 오정세일당이 정신나가지만 않았어도 ...다시 찍자 
10,?演??是有那??人?醉的眼神！本害???的?材?人看的不舒服，但是看完?影，不由的?主人公心生同情，?他?惜。他把??被上帝?忘的可怜人生?的呈?在我?眼前。 
10,평점왜 ㄴ낮은지 모르곘음 재미있고 신선했다. 
1,무슨내용인지도 모르고 차승원 나온 영화라 어제 심야 영화로 봤다.  처음에 액션씬까지는 아주 재미있게 보았는데.  스토리가 갑자기 산으로 간다.제발 이런 영화 통해서 성소수자라는 개뼈다귀같은 말로 게이나 트렌스잰더 ...
10,너무잘봤어요 차승원씨 ...진짜대박... 
8,차승원연기도좋고간간이 소소한웃음도있고^^ 
10,마지막이  허무하다는그래도  영화는 재밌네 
10,영화 아저씨 보다 훨씬 더 재미있어요! 
3,멘탈이 파괴됨.... 
3,절세미녀를 그려달라고 해서 미녀의 각각의 예쁜 부분을 모아서 그림을 그려놨더니 답 없는 추녀가 나왔다는 고사가 생각나는 영화. 
6,기대를 안해서인지 그냥 볼만했어요 
10,감독 특유의 연출력이 살아있습니다 몰입도가 좋아서 감정이입이 쉽게 되는 영화 
6,연기변신을 시도하려는 차승원...그냥 차승원원 자신이 잘할수 있는 연기를 더 보여주는것이 나을듯... 
1,적당히잔인하게만들어야지 잔인한장면못만들어한맺혔나? 감성느와르가아니고 스릴러한편보고나온듯 차승원에게감사하길 고경표역도 그렇게쓸려면 왜썻는지참 
10,간만에 영화다운 영화를 보았음.. 역시 장진감독!!! 
10,제대로  신고 떠나지 못한  차승원의  하이힐이  아프다 
10,차승원 연기지림  액션쩔고 내용도폴만했음 
9,좋다 ! 이런 류의 영화가 많이 없어서 그런지 이야기를 잘 풀어낸듯 
5,차승원의 연기는 좋으나 그외엔 모든게 어설프다 
10,"내용도 좋고 연기도 좋고 영상도 좋았어요, 특히 저는 엘리베이터 문 열리는 장면... 처음으로 밖에 나갈 때 "
7,소재는 신선하나 젠더 싫어하면 가끔 민망함. 액션은 쩌름. 
8,즐거웠다 불쌍했다 나왔다 
10,여러모로 독특한 영화스타일~? 차승원의 연기 변신 때문에 볼만했네요 ㅋ 
9,몰입이 진짜 잘된다!!에 한 표~~ 짱잼 
10,더 절절하고 잔인해진 거룩한 계보 느낌?? 아 가슴 아프다ㅜㅜ 
10,차승원의 디테일한연기가 돋보이는  영화. 더불어  화려한  액션은  보너스. 
10,자꾸 울컥하네요.... 
7,이 영화의 평점은 7~7.5점정도가 적당합니다이야기 소재는 신선하고 참신합니다만 이야기를 풀어가는 방식이 뭔가 부족합니다 성소수자의 이야기를 다루는데 조금 중성적인 이미지의 배우를 선택해야하는데 차승원배우는너무근육질...
9,섬세하게  윤지욱을 느낄수 있었고상상해본적 없는 아품을  안타까워 할 수 있었음 극도의 잔인함이 아니였다면   감성을 연결 시킬 수 있었을것 같음붉은색 범벅이 아닌  윤지욱의 아름다운 액션신 만으로도  충분 했을거라...
8,여자가 되고 싶은 한 남자의 어쩔 수 없던 선택.. 그의 슬픔과 연민을 느낄 수 있었던 영화 
9,기존의 장진 감독의 영화 스타일과 다른 느낌이라 더욱 신선했던듯 
9,기다려왔던 감독님영화!! 
10,너무재밌게봤어요 기대이상이었음! 
10,재밋음!ㅋㅋ근데 잔인한거 못보는 여자는 보기 힘들듯 내여친이 영화의 반은 눈감고있었음 
10,여장한장면에서 계속 웃는 여자들.. 완전 개념없음. 심오한소재 신선한소재 영화 참 괜찮다 조금더 탄탄하게만들었다면 좋았을거같지만 차승원씨 연기도 일품이고 멋있었다 
10,차승원의 탄탄한 연기력과 장진감독의 스토리는 정말....본 사람만 느낄 수 있는 이 짜릿함 
6,나쁘지 않다. 그런데 소재자체는 좀 거북하긴 하다. 
6,차승원의 연기만 빛을 발한 영화..;;장르에 대한 연구와 소재에 대한 고민이 부족했다는 느낌을 지울수가 없었음.. 
6,이야기 내용은 공감 성소수의 고민은 느낄수있으나  재미는 없음 
2,솔직히 모르겠다. 이영화에서 뭘말하고자하는지. 완전 난해함. 차승원아니였음 안봤을영화... 
10,역시....좋다. 좋은데..흠.. 
8,치명적이게 매력있는 영화네요 ㅋㅋ 
9,뻔한 느와르가 아니라 좋았어요장진감독의 그 유머와 차승원님의 연기오정세님도 좋아요좀 잔인한면이 없지않지만 다시 생각해보게 되는 영화였어요 
9,끝이 뭔가 허접한건 사실이지만 그래도 한번 볼만한 괜찮은 영화다 
7,어정쩡했어요. 끈질긴집중력이없는듯한 
8,자신을 사랑하느냐자신 보단 남을 더 사랑하느냐 이 딜레마를 잘 풀어내었다.힘든결정을 한 후 담배를 피려던 그의 손엔 그녀가 건내준 포도음료수가 쥐어져 있다.그는 이제 새끼손가락을 들지 않고 자제한다. 
9,세련되고 유머있는 한국식 느와르!!!여태 국내 느와르중 단연 손꼽힐수 있음 
6,배우들 연기는 좋았는데... 
10,표현이 좋네요 심도있게 다루고 생각하게 만드는 영화예요 
