score,review
7,영화안에 너무 많은 이야기를 담으려고 한거같다. 차라리 주진모 분량을없애고 전작에 나왔던 서태화나 정운택을 특별출연시켰으면 좀더 깔끔했을뻔했는데 
4,친구1을 너무 재미있게본 1인.. 기대가 너무 컸나..시대를 너무 넘나들어서 몰입도 않되고... 주진모는 그냥 짠하기만하구...스케일크게 한번 붙는장면을 기대했는데 너무 밋밋하게 갈등이 해결... 
6,전작이랑 어떻게 비교를 안하냐? 감독님 이제 됐으니까 친구에 미련 버리세요 
5,"음...쩝..아 ...아쉽다....많이.,. "
5,"곽경택은 부산조폭을 대부 느와르로 만들어 보려했으나 억지스런 설정과 잔흑한 폭력, 겉멋들은 허세와 똘끼 조폭뿐이 없었다. 전작을 등에 업고 양아치만 양성했다. 도대체 주진모 캐릭터는 왜만든건지 이해할수가 없다. 12..."
3,금방보고 왔는데..기대했던것과는 별로..유오성 아버지얘기는 왜 나오는지 몰겠음... 
10,유오성 연기력 정말 최고다. 
5,오늘가서 보고 왔습니다. 기대 이하입니다.극장가서 돈주고 보기 아깝네요 
6,아직두모르겠습니다.이준석하고 같이 출소한 그 사람 이름이 대체 뭡니까..무슨말인지 못알아듣겟어요..고ㅊ머인것같은데.. 
10,알바를방지 합시다. ! 
1,"김우빈대사 ""똔나곱더노솨"" 모라는건지 알수가없네 센척만할뿐 "
1,조폭. 연쇄살인. 유괴.   충무로는 신물 나지 도 않나보다. 갈수록... 잔인함만으로 관객과 쇼부치려는 약장수들. 
4,영화는 친구인데 친구가 없다. 남은 건 폭력과 잔혹성뿐 
1,역시 2탄은 재밌는걸 못봤음 
1,한국영화인데 대사를 못알아듣는 신기한 경험을 하게 될 것임. 
1,친구3는 절대 나오지 않을 영화다. 연기는 좋았으나 내용은 개판!!개봉전 제작진들도 하면서 느끼는게 없는가.. 6점은 줄수있으나 어이없는 10점 알바때문에 1점이닷!!! 
1,뭘 말하려고 만든건지....내용이 두서가 없어...ㅡㅡ;; 
5,"노력은 보입니다만  헐거운 나사를 억지로 억지로 돌려 넣으려는 느낌의 영화라고 생각됩니다, 신선할 수 있으나 역시 역부족인 시나리오 였네요 그냥 단순 깡패영화좋아하시는 분들은 강추 "
1,오랜만에 이런 최악의 영화를 보네요 
1,진짜 객관적으로  봣을때 김우빈 띠어주기 영화가 아니였나 생각된다.소스는 좋앗는데 내용은  형편없네요 
1,한국영화는 조폭.연쇄살인이 아니면 소재가 없는가??? 
1,피카츄만 인상깊었네요.. 참... 휴...--;할말이 없네요.... 
5,8천원내고 봤으니까 몇마디하자면 유오성 연기는 진짜 멋잇었다 김우빈 나올때는 어쩔땐 보다가 어쩔땐 졸았다 굳이 이런장면을 넣어도되나 싶을정도? 그리고 마지막이 왜이리 허무하냐 친구1은 이러지 않았는데 그냥 유오성 연...
6,"네이버 평점 믿지말고 볼사람만 보시오..전작에 비해 어두운 느낌은 덜 나는거 같기도 하고,,  아무튼 난 김우빈이 연기를 엄청잘한다고 생각하지는 않는다. "
1,이 쓰레기같은걸 영화라고 만들어 놓았다니 원작에 폐 끼치지 말고 빨리 접으시길... 나오는것 찌르고 죽이는것 뿐이 없고 청소년들이 볼까... 대사도 연기도 정말 형평없는 최악의 영화. 
1,알바방지는 얼어죽을 이 영화  5점 이상주는 사람들은 3가지 유형뿐이야 1. 진짜 알바2. 영화는 초딩때 크리스마스에 나홀로 집에 이후로 본적 없는 사람3. 마음이 정말 넓어서 아닌걸 알지만 응원차 주는 사람여운도 ...
3,1탄을 따라갈수 없다는 내생각이 변하지않았다.잦은 내용변화에 없어도 될 내용이 너무지루하게 만들었다. 
1,"주진모 왜나왔을까? 잔인한 장면만 띠엄띠엄 흐름이 뚝뚝 보는내내 에휴 에휴 곽감독이 너무 많은 욕심을 냈나봅니다. 5부작 드라마를 1,3, 보고 2,4보고 5편은 못본 본느낌 "
10,굿잡..역시 유오성 칼카슘마 
7,1편보다는 뭔가 우정에 대해 생각해볼기회가 덜했던것같습니다. 준석아버지에 관한 내용보다는 동수를 죽이는 결정을 하는 과정같은 것을 기대했는데 그런부분이 없어서 아쉬웠습니다. 또한 상택이와 중호(?)의 부재도 아쉽구요...
1,양아치들 나오는 영화 지겹지도 않나.. 
6,전작에못미치는속편.대부시리즈를따라가는느낌.유오성은예나지금이나 굿캐스팅.김우빈멋있게포장되긴했으나임펙트약함 
1,ㅜㅜ 다시 만들어주세요. 
2,하 참... 친구1을 그냥 다시보는게.... 친구 1을 두번보는게 베스트네요.. 
1,곽경택은 친구하나로 언제까지 우려먹을지... 
4,영화는 박평식씨 별점이 진리 
1,5점이상 준사람들 영화안본사람들이다 ㅡㅡ 주진모부분은 개쓸모없고 사투리도 어색하고 스토리란게 없다 그냥 1편 후기 같은영화 
4,친구 타이틀에 먹칠하는 작품인거같네요 
1,1점도 아깝다.영화가 너무 산만하고 코믹적인요소도 없다.액션또한 진부한 10년전 액션이며 스토리는 개연성도없고 결말또한 흐지부지.돈아까운영화.나중에시간날때 다운받아볼만한 영화. 
1,주진모 왜나온거냐 역시 2탄은 별로다ㅡㅡ 
8,근데 나 아직도 피카츄 이름 뭔지 모르겠음 ㅡㅡ 
1,곽경택 감독은 평생 친구1에서 못 벗어날듯 
1,돈도 좋지만 전기톱으로 사람을 자르고 목을 칼로 수회 찌르는등 조금의 여과작업 없이 그대로 보여 줘요 이런 영화를 정말 이제 갓 고등학교 졸업생들이 보아도 될까요 한국영화심의를 하시는 분들도 좀 걱정해야 하지 않을까...
1,뭐래는건지 말소리 하나도 안들리고 친구1처럼 감동과 전율도 없고 전개는 대부3 전개 따라하는 티가 나고 어수선하고 기대했던것보다 날 실망시켰다. 
5,친구1에대한 옛생각만 날 뿐재미도 없고...감동도 없고...뭐라해야할지 참... 
1,이런 쓰레기로 자기 머리 쓰레기만들지 말고 차라리 그돈으로 영양가있는 밥이나 한 끼 사먹읍시다 
3,기대를 해서가 아니라...실망이다.선글 광고하는것도 너무 지나치고... 
1,솔직히 진짜 재미없다 무엇을 의미하는지도 모르겠다 우빈이 사투리도 이야 그렇게 어색할수가 없다 
1,대실망.. 정말 기대 많이했는데 
1,쓰레기 내용도 없고 뭘 얘기하고자하는건지... 
1,개졸작 허세영화  진짜 가오그만잡아라 재미없음 레알 
1,저 알바아닙니다.. 평점 처음남겨보는데 진짜 제작비 아낄라고 줄거리 존나 쭐이구 과거로 틈만나면 넘어가구 폭력영화인데 폭력도 스펙탸클하게 표현못하구.. 이번거 너무 실망입니다 
2,"ㅋㅋ엔딤을좀,,, 차라리 전혀관계없는 조폭영화를 만들든가,,친구에 얽매여서 스토리가 산으로~~ 김우빈 키워줄려고 만든영화그이상 그이하도 아님 ~ "
1,별 반개도아깝다 진짜 쓰레기 
1,깡패를 미화한 쓰래기 영화ㅑ 
1,"알바 금지, 양아치 쇼 금지. 족보도 업는 삼류 양아치 깡패새끼들로 영화가 되냐? 곽경택이 그동안 친구라는 호흡기로 연명한 영화판인생 친구2로 드디어 호흡기를 떼는구나. 감독님 수고 많으셨습니다 ^^ "
10,나름 재밌게봤는데... 
1,보지마요  후회합니다  감동도  없고 재미도 없고 카라멜팝콘이 더 감동이네 
1,유오성밖에 안보임 영화는 개망작임 망작도 이런망작이 없을거임 꽁짜로 보여줘도 시간아까워서 안볼영화수준임 
10,곽경택 감독의 무덤이 될 영화다~~~ 재기하지 못할 것이다. 
1,넥타이부대 울면서 돌아간다...대사처럼 모든 건달은 후회하고 아련한 옛추억에 온 사람들도 후회하고..주위 친구들한테 절대 보지말라고 말하고 싶다..이런 젠장 
1,제발 이런 3류 건달 양아치 영화좀 그만나와라 
1,배우나 영화관계자분들께는 죄송하지만 재미도 없고 감동도 없고 단지 사람 죽이는것만 나오는것 같아요 어린 청소년들이 볼까봐 무섭네요 이영화를 청소년들에게 보여주는것은 범죄 같아요 
4,졸렸슴돠. 사투리 못알아먹겠는 부분은 한국말이었지만 이해못했음돠;; 씬 넘어가는 장면 이야기 전개가 뒤죽박죽 ㅜㅜ 너무 많은 이야기를 한 영화에 담으려니 조잡했던 것 같슴돠. 
1,평점만보고 보기싫다... 
1,곽경택의 몰락은 어디까지인가.... 
3,기대하고봤는데.... 유오성의 비하인드스토리 
1,곽경택은 이제 감이 죽었어. 70년대 추억의 주먹영화를 보는 느낌.... 
1,이걸 영화라고....?혹시려도보려는사람들보지마셈 한국영화는 발전이없어 ㅉ죽이고때리고하다끝남 
4,아 무슨 조폭영화라그런지 칼만들고 설치고 재미없게봤네요감동도없고 
1,조폭영화 고만 만들자 미화하지말자 
1,완존 기대 이하~~~ 대박... 기다린 보람이 없음... 
1,쯧쯧쯧..   아깝다 내8천원..돌리도.. 
1,정말 시간이 아깝네요 이런걸 보러 극장에 가다니 빵점짜리입니다. 
2,영화 댓글 처음 달아봄. 재미없음 
2,리자드맨 닮은 사람만 멋있게 나온듯.... 
6,전작을 못따라가는군~전작 해설판 걍 다 아쉽다~ 
10,유오성 김우빈 연기 쩌네 
10,"장동건 아들, 할 것 많은 아이. "
6,곽경택은 친구를 죽어서도 우려먹을듯 
6,곽경택 감독님이 시사회에서 이런 말씀을 하셨죠. 준석이가 동수를 죽였는가에 대한 해답을 주기 위해 만들었다... 이것이 이 영화의 전부입니다. 몇 몇군데에서 시나리오의 헛점이 보이고 기억에 남는건 숫놈들의 냄새뿐 말...
1,아 진짜 뭐하자는건지... 
1,내돈내놔라내돈내놔라 
1,김우빈이 영화 다 조져놨네 
5,"김우빈..짧은 대사는 잘했지만, 조금만 길면 어색해지는 사투리..부산 사람인 나마저도 알아듣기 힘들었던 대사들...임펙트가 부족했던 액션..그냥 나와바리 되찾는 내용에 집중했으면 더 재밋었을듯...이야기가 너무 뻗침..."
1,이게 영화임...개봉운빨만 아니었음 완죤 OOO영화~~ 
3,아.. 돈 주고 볼 영화는 아니었다..후회..ㅜㅜ 
1,우.. 스우뤠기 영화...ㅋㅋㅋㅋ 
1,연기는 유오성빼고 볼사람없었다 특히 주진모뭐냐 대사칠때 내손발이 다짤려나가는기분 
1,노잼. 신라의 달밤급 어설픈 사투리에서 느껴지는 허술한 퀄리티와 정신. 
1,장동건 따라하는 김우빈 진짜 뭐냐? 다시봐도 엿같네 
8,댓글처럼 글케쓰레긴아니던데...  근데..대사못알아듣겠음.. 
5,난잡하다 너무 많은 이야기를 풀었어 
1,사투리 어색하고 대사전달 안되고 뜬금없는 아버지 스토리에 전편에 먹칠하고 폼만잡다 끝나는 쓰레기영화 
1,주진모의  형편없는  연기력과 김우빈의 심각한 오버의 앙상블이 곽경택을 만나 쓰레기로 완성되다.. 
10,진짜 재밌던데 평점보고 기대안하고 봤는데 더 파이브보다 훨씬낫고 재밌음 
1,삐삐삐 대체무슨  생각으로 만든거야 
5,김우빈의 오버 연기를 감독은 왜 안말렸나.사투리 어색함. 
1,진짜티비보다가 ㅋㅋ어이가없어서 남긴다어떻게 그명작으로 2에서 이렇게 말아먹냐 ㅋ 
1,전작의 명성에 똥칠하는 망작 
1,조폭미화영화 딱 그 정도 수준 
1,개구리같이 생긴새/끼는 영화내내 띠꺼운 표정만 짓다 끝나고 조폭 쓰레기 영화 이제 그만.... 
1,깡패를 미화하는 쓸데없는 영화 
5,인간적으로 전기톱은 너무 오버아닌가?...공포 영화도 아니고~ 
1,완전 기대하고 나온날 심야로까지 무리해서 봤는데 졸다가 중간에 나옴 머라는지도 모르겠고 뭘전달하는지도 모르겠고 혹시 까먹엇을까봐 보기전에 집에서 1편봤는데 차라리1편 세번보는게 더 감동일듯 
1,곽경택 친구하나로 드럽게 우려먹네.ㅉㅉ 
1,뭐 이딴 영화가 다 있노? 이렇게 만들거면 만들지 말지? 
7,끝이 좀 허무했지만 그럭저럭 재밌게 봤어요!ㅎㅎ 
10,진한 여운이 남는 영화네요 
10,재밋어용 !! 추천합니당.. 역시 유오성 살아있네요!! 
10,재밌게 잘 봤다. 재미있었음.연기도 좋았고 ㅋㅋㅋ 
9,기대이상으로 재밌게 본 친구2! 전작을 재밌게 보셧다면 기대하셔도 좋을거 같아여~ 
9,남자친구 때문에 본 영환데 남자친구보다 내가 더 재밌게 보고옴ㅋㅋ 
9,기대 많이 했던 영환데 기대이상으로 넘넘 재밌었어용 
9,"기대안쿠 봤는데 참 재미있게봤습니다.1편과 스토리가 잘이어지는 편이구  김우빈 건달역 잘소화하구 잘어울리네요이영하의 하일라이트라고 할수있는 마지막 장면,,ㅇ으은ㄱ은기를 찌르면서 떨거지들 처다보는 눈빛은 정말 압권이였..."
10,기대안하고 보니 재미있었음~ 
8,"전 재밌게 봤습니다. 남친도 그렇구요.  김우빈 관심없었는데 친구2보니까 매력있더라구요. 내용이 좀없다는 느낌, 잔인한장면이 많아서 보기힘든것도 있었어요. 그래도 김우빈이등장하면서 새롭게 이어지는 것 자체가 흥미로웠..."
10,재밌어요ㅎㅎ유오성완전멋있음 친구3도나와라 
10,중간에 대사쪼금 못알아먹는건 인정 그러나 개굿 
10,"상택이,중호랑 진숙이도 좀 나올줄 알았는데... 뜬금없이 레인보우에 진숙이친구 중에서 못생긴애가 뜬금없이...ㅠㅠ 주진모는 왜 넣었으며 행두행님이 준석아버지 구두 닦아주다 발탁됬다는 설정도 좀 이상하고... 근대도 ..."
10,개인 의견차가 있는거지 뭘 알바네 마네 OO들많네나름 괜찮게 봤구만 평점 보고 나도 고민때리다가 봤네 
8,내평점 친구 1이 엄청난 흥행을 하고 12년이 지나도 잊을수 없는 명언과 감동을 남겻으니 기대를 많이 해서 실망도 컷겟지만 비교하지말고 단순히 2만의 내용으로 보면 재밋는데...유오성 내면의 외로움도 잘표현하고 .....
9,3대에걸친얘기 큰기대없이 보면 추억에잠길수있는볼만한 영화 
8,그냥 친구니까~~ 중간 중간 옛 향수에 젖게 만드는..  살짝 억지스러운 설정도 있지만.. 그래두 친구니깐..ㅋㅋ 화이팅~!! 
10,남들이 뭐라하든간에 나는 재밋게봤습니다. 
8,난 재밌었다솔직히유오성형님 아우라 죽이더라..진심..3편에서 제대로 오성형님 에피소드 만 나왔으면 정말재밌겠다 
10,진짜 잼있게 봤어요 한국말 잘하던데요...겁나 재미있어요..은기 양아치 
10,그냥완벽하다. 굿. 최고 
8,볼만했음 물론 전작보단 못함 
8,호불호가 갈리는 영화지만  개인적으로는 재미있게 본 영화이다.유호성의 건달연기는 무섭도록 잘 표현해 영화에 빠져들어 끝까지 흥미진진하게 보았던 영화이다 
10,김우빈 진짜 매력덩어리…너므 멋이써~.~ 
10,다른 배우분들도 다 좋았지만 유오성씨의 연기가 특히 돋보이네요 
10,영화관에 사람들 장난아님ㅡㅡ 예매하기도 힘들었다 
10,유오성씨는 여전히 포스가ㄷㄷ.. 
10,예매률 대박ㅎㅎ친구2도 쭉쭉 흥하길 
10,왜 사람들이 친구 친구 하는지 알겠다 이 영화는 본 사람들만 앎 
10,남자인 내가봐도 김우빈? 진짜 멋있더라ㅋㅋ 
10,댓글평이 너무 나빠서 모든기대 내려놓고 보았는데유치하지도않고 가슴답답하게 끝나지도않고 난 좋았다.김우빈멋있다.그리고 유오성 연기 굳이다. 가슴을 먹먹하게 하는 연기력~~역시.. 
10,진짜 말이 필요없는 영화 친구2 
10,액션신도 좋고 연기도 잘한다 
10,옛 추억도 새록새록..마지막이 쬐금 아쉽긴 했지만 그래도 재밌게 봐서 만족~ 
10,평점이 쓰레기라 별 기대안하고 봤는데 이거 평점 왜이래?? 나만 재밌게봤나? 
10,왜연기력좋다는말은 하나도없고  사소한트집하나씩 잡아서 재밌는영화깎아내리는지 이해가 안될뿐 느와르라는 장르를 깡패미화라고생각하는건  우리나라뿐? 다른건둘째치고 친구1봤으면 이건봤으면하는바램 
10,재미있구만 뭘 ㅋㅋ기대안하고 보면 재미있는 영화 
7,유오성 연기 정말 잘하고 재밌긴하지만 친구라는 제목의 틀에서 어느정도 벗어난 느낌 
8,조질때는 기회가 오면 확실히 밟는다. 
7,"유오성의 카리스마, 주진모의 어색하지 않는 제스쳐와  연기, 김우빈의 새로운 발견. 깡패미화 폭력미화.. 그래도 나의 가슴은 충분히 불탔다. "
10,2시간 동안 지루할 틈이 없다. 
8,친구2볼려고 친구1보고갓는데 1이너무임팩트가강해서그런지 2는기대에못믿치네요ㅋ 근데 연기자분들카리스마는최고네요ㅋㅋ 
8,나는 하도 생각보다별로래서 보지말까하다가 딱히볼거업어서봣는데 볼만햇음 ㄷ근데 짘짜결말은 허무 ㅡㅡ 
8,1편을 안봐서 비교를 못하겠지만 재밌게 봤다. 배우들의 연기가 대박. 특히 김우빈은  첫영화라고하던데 정말 잘해서 놀랐음. 
10,친구1의 아쉬움과 그리움을 조금이라도 달랬습니다. 
7,전작이 너무 흥행해서 그런지 시나리오를 복잡하게 전개하였고 내용이 심오해서 보는 입장으로서 불편했었다.캐스팅이랑 소재는 괜찮았다 
8,담배떨가가....우리아부지 
10,기다린 보람이 있었던 친구 2!!! 출연진도 대박~~ 
10,완전재밌게 봤음.. 김우빈 쩐다. 3편도 기대되는데요 
10,너무 기대했던 영환데요 기다린 보람이 있더라구요 
10,지루함을 느낄 새가 없었던 영화 왠지 친구인 남자끼리 보면 좋을 듯 
10,12년만에 밝혀진 진실 이제야 알게되었음 
10,재밌어용 ㅋ 히히히히하하 
7,몰입도나 여운이 친구1에 비해서 좀 떨어진듯해요. 그래도 배우 연기력은 모두 괜찮았네요. 
10,스토리는 재밌어 배우들 연기도 뛰어나다 
10,유오성 연기 실력은 언제봐도 미친듯한 연기 
10,이건 아는사람들만 재밌는 영화인가 ㅎㅎ 기대이상이네요 
8,만약 10년전 친구 감성을 다시 한번 그려내려 했다면 진부함을 벗어나지 못했을 듯. 그런데 감성팔이가 아니라 느와르영화로서 정체성을 가진 듯. 그런 점에서 확실히 B급 느와르는 아님. 그렇다고 A급도 아니라 느낌. ...
7,1만큼은 아니지만.. 친구라는 대작의 잔잔한 뒷 이야기.. 
10,진짜재밋는데.... 
10,"남자라면 친구,,,,친구아이가 "
10,뭐가 되었든 친구2 가 좋다. 
10,저는 볼만했네요..^^ 
7,원보다 실망할 수 있지만 전 나름 괜찮던데요~~볼만해요 근데 마지막에 대사 먼뭔말인지도통 모르겠어요 멀 쳐박아다나?? 
10,"원래 대작뒤에 2,3는 거의 망작이라는 평이 많아서 일부러 줄거리도 안보고 봤는데 기대이상이다 "
9,1편 기대하고 보면 당연 아쉬울수도 있는데.. 2편은 그만한 다른 특징이 있다는 생각이 들었습니다. 스토리 전개 이해 안되신분은 영화에 집중 못하시는듯.. ㅈㅅ유오성이 영화 살렸습니다. 알바들이 1점 주니까 8점줄꺼...
9,"유오성에 대한 믿음, 김우빈의 발견! "
10,울깜이랑찐이랑 친구2보고 왔는뎅~ 김우빈연기도 잘하고 잔인한 장면이 너무심하지만 그래도 볼만했어요  친구2보고 친구1 기억이 가물가물해서 다시 봤는데 우정에 대해서 다시한번 돌아보게 되는 ㅎㅎ 영화인가같당!! 친구1...
9,전멋졌습니다.특히 까마귀였을지철새였을지모를 그장면 ...내면의 연기와 그 복잡한 심경이 장면으로 연출된듯했습니다.유오성씨의 연기는 말할수도 없었고.김우빈의 재발견이네요.조연은.개목걸이 빨간빤스 악날한표정이기억에남네요...
10,"영화  2편 꼬리 달고 나온 것 치곤  괜찮았는데~~ 영화 보는 내내 지루 하진 않고 재미있고, 연기도 잘하고. "
10,그닥기대없이봤는데 지루한거없이쭉잘봤다 유오성 우빈연기작렬ㅋ 
10,그냥 즐기면서 보기엔 좋았습니다 옛  추억도 생각나고ㅎ 
10,이런 영화 너무 재밌다ㅋㅋ친구3도 기대해봄 
10,반전이나 그런건 없었지만 그래도 감동과 여운을 준 영화였다 
10,기대한 만큼재밌었던 친구2 
10,친구3도 나올거 같은 기분이ㅎㅎ 
10,"영화관에 이렇게 사람 많은거 처음봄,, "
10,시간과 돈이 아깝지 않았던 영화 
10,굿굿ㅋ굿...ㅋ.굿 
10,"간만에 제대로된 한국영화를 봤다,,요즘 나온 영화들 다 별로 였는데 친구2가 나와서 다행이다 "
10,기대한 보람이 느껴졌던 친구2 
10,친구1 어릴때본거라서 생소할줄알았는데 이번영화잘보고왔다. 유오성의 눈빛연기는 가슴을 짓누른다.. 특히 마지막장면 차안에서의 연기는 뭉클했다. 돌아갈수없는 과거..그리고 친구.. 충분했다 
10,두 시간 동안 지루하지도 않고 볼만했어요 조폭영화라 그런지 흥미롭고 재밌게 잘봤습니다~ 
10,재밋다..다들 연기너무잘함 
10,김우빈연기짱임!! 유오성은 말할것도없고 굿굿 
9,평점이 안 좋아 걱정하며 봤는데 생각보다 재미있게 봤습니다. 전편보단 기대에 못 미치지만 혹평받을 정돈 아닙니다. 
10,이정도면되지 얼마나더..?? 
10,준서기 큰행님 참 멋있고 카리스마 있는 것 같심니더. 글고 성후니 동상 마지막에 여운이 남는게 3편 기대해도 되것습니까? 
9,친구가 쫄라서 본 영환데 내가 친구보다 더 재밌게 몰입해서 봤당 진짜 친구2 흥해할듯 
10,결말이 아쉬운것만 빼면 다 좋았어요 스토리도 흥미롭고 
10,평점이넘안조아 남편이친구1 광팬이라 욕해도보자라는생각에영화를봤습니다 솔직히남편아니였음저사람 누구지 이랬을건데 옆에서 친구1의누구다 알려주니 너무잼나게잘봤습니다 저도친구1 잼나게봤지만 도루코정도만잘기억했지  잘모르겠드...
10,결말이 아쉬워…그래도 전체적으로 보면 볼만하고 재밌네용 
10,1편 안보고 봤는데도 재밌네여ㅎㅎ 이해하기도 쉽고! 
10,12년동안 궁금했던게 드디어 풀렸네..속 시원하다 
9,생각보단잼있던데요?너무기대안하고봐서그런지 
9,솔직히 이정도면 꽤 괜찮은거 아닌가..? 
6,주진모의 연기는 대단했다  하지만 꼭 이영화에필요했을까 과거의 분량을빼고 세력간의 갈등과 아니면 김우빈의 친구의 분량에 집중했으면 좋지않았을까 이영화는 친구2 이다단순한 깡패영화가된것에 깊은 슬픔을느낀다 
10,알바아닙니다 진짜 친구 전작에 명성에 누를끼치지않을정도는했다고본다 
9,오늘 봤음당! 최악도. 최고도아닌. 그냥 보면됨. 친구1본사람이면 보고나서 후회는없음 
10,최근에 나온 영화중엔 갑 
8,시간이 갈수록 유오성씨에게 풍겨져 나오는연기력 참 좋네요김우빈은 물건! 
10,김우빈님 연기진짜잘해용ㅋ짱짱멋져 
10,친구2라고보지말고!친구라는영화을처음본다고생각하고보면!!멋짐!!! 
9,이 정도 영화면 꽤 괜찮은 영화인거 같은딩 
10,유오성의 연기가 대박 멋있었다.근데 부산사투리가 너무 심해서.. 마지막에 김우빈이 차에서 뭐라 한건지 못들음ㅡㅡ.. 
10,배우들의 연기도 감독의 연출도 영화의 스토리도 기대이상이였음 
9,평점 워낙 낮아 기대 안했는데...친구 1을 두번 이상 본 사람에게는 재미 없을수가 없는 영화...친구1을 안 봤다면 그저 건달들 세력싸움으로만 보이니 재미가 없지~10점까진 못 주는건 도대체 주진모와 그 스토리는 ...
10,중간중간 약간의 웃음 요소들까지 깨알같이 들어가 있어서 더 재밌었던거 같습니다~ 
10,인간으 ㅣ본 모습을 볼 수 있었던 영화..진한 여운이 남는다 
10,스토리도 탄탄하고 전개나 구성도 깔끔하니 볼만하네여 
9,영화 의외로 괜찮습니다. 단편적으로만 보고 판단하시는 분들이 있는거같아 안타깝네요. 청불인데 성인이라면 조폭미화건 뭐건 알아서 필터링 하실거고.. 평점 거의 안매기는데  꽤나 괜찮은 속편이라 한번 찍어보고 갑니다. 
9,생각보다 감동도 있고 여운도 있고..재밌었다 
9,아 진짜 안봤으면 후회할뻔ㅠㅠ 
10,오랫동안 기다린 보람이 있네요 너무 재밌게 잘봤습어요ㅎㅎ 
8,한여국에서 갱스터무비라고 말할만한 영화는 그래도 친구밖에 없음.그쪽세계 조금이라도 아는 사람은 영화 디테일에 놀라지 않기 힘듬.신세계니 비열한거리니 감독이 상상으로 만든 조폭영화랑은 차원은 틀림 한국관객수준은 딱신세...
10,"연기나 연출,소재,스토리 뭐 하나 흠 잡을데가 없네여 "
10,너무너무 재미잇고 현실감이느껴지는 영화 
