score,review
6,일부 내용은 3로 넘겼어야..너무 많은 내용 담을려다보니 전체적으로 아쉬운 부분이 많았다..주진모같은 주연급도 나온 내용이 허술했다 
10,영화에서 많은 이야기들이 나와서 깔끔하진 않았는데 그래도 지루하지 않고 재밌었다 
9,유오성의 카리스마 연기는 역시 갑!! 
10,이 정도면 솔직히 별 다섯개도 모질란당.. 
10,배우들 연기 덕분인가 영화에 몰입도 잘되고 돈이 아깝지 않았다 
10,속편이라서 재미없을까봐 걱정 많이 했는데 괜한 걱정을 했넹 
10,역시 기대를 저버리지 않네요 
10,오랜만에 제대로된 느와르 영화 한편 봤네여 
10,"연기,연출,스토리 다 완벽했음 "
10,올해 최고의 영화. 조금더 일찍 나왔으ㅓ면 청룡 영화제에서 뭐하나 탓을텐데잉 
10,한국 느와르 영화의 역사는 친구로 시작된다 ㅋㅋ 
9,한국 최고의 전설 친구 이번에 또 다른 전설의 영화가 탄생한듯 
10,남친이랑 둘이 보고 나오면서 가슴 설레서 혼나써요 ㅋㅋㅋ 
10,헐 김우빈.. 동수의 아들로 나오는 김우빈에 대한 기대를 전혀하지 않았음에도 불구하고 완벽한 연기를 보여줬다. 앞으로의 연기가 기대되는 배우 
10,내가 친구2 나온다는 소리듣고 어찌나 설레던지.. 유오성 형님은 역시나 카리스마 작렬이더라 
9,기대한 만큼 역시나 싶은 느낌이 든다 곽경택 감독이 신경쓴게 눈에 보이네 
10,한국형 느와르 영화의 전설인 친구!! 전편 보다 액션신도 화려해지고 대박이에요ㅠㅠ 
9,괜찮았는데 너무 기대가 컸나봅니다... 
10,올해 본 영화 중에 최고에요 김우빈 진짜 연기 잘하는거 같아요 
9,주진모의 분량이 약간 적어서 아쉽긴 햇지만 유오성 김우빈만으로도 빛난다 
10,올 겨울 대한민국 남자들의 가슴을 흔들 작품 
9,"더 진하고, 더 강렬하게 돌아왔다!! "
10,12년전 봤던 친구1 지금은 30대 후반이 되었지만 여전히 가장 좋아하는 영화중 하나입니다 
9,아쉬운 부분들도 있었지만 전체적으로 보면 참 괜찮은 영화였다 
10,다 좋았는데 마지막이 좀 아쉬웠음.. 
10,영화 내용도 흥미롭고 재밌었구 전개도 빨라서 지루할 틈 없이 보고왔네용 
10,1편도 너무 재밌게 본 기억이 있는데 2편도 재밌네여ㅎㅎ 
10,기대를 많이 했던 영환데 기대를 저버리지 않았네요 
9,난 재밌게 봤는데 같이 본 친구는 별루라구..호불호가 많이 갈리는것 같당 
10,잼나다졸라 마니 진짜로짱잼나다 
10,올해 최고의 영화가 탄생한듯 
10,보면서 뭉클하기도 하고 웃기기도 하고 섬뜩하기도 하고 되게 재밌게 봤당 
10,12년이나 지났는데도 친구1에서 느꼇던 그 감동이.. 
10,러닝타임 동안 푹 빠져서 봤음..진짜 짱 눈을 뗄 수가 없었다 
10,솔직히 걱정도 많이 했는데 괜한 걱정을 한듯!! 
10,지루하지도 않고 보면 볼수록 빠져든다 
10,영화속 캐릭터들이 살아있다ㅋㅋ간만에 이런 느와르 영화 봐서 그런지 너무 재밌었음 
10,남자친구 때문에 본 영환데 남자친구보다 내가 더 재밌게 보고옴ㅋㅋ 
10,기대 많이 했던 영환데 기대이상으로 넘넘 재밌었어용 
10,간만에 제대로된 느와르 영화 한편 탄생한듯 
10,"요즘 진짜 김우빈이 나오는 작품들 보면 깜짝깜짝 놀란다,,어쩜 저렇게 열연을 하는지 "
10,전 괜찮은데 친구는 1편만 못하다고 ㅋㅋ 재밋기만 하구만ㅋㅋ 
10,헐 김우빈 진짜 매력덩어리 비쥬얼 최고 
10,남자들끼리 보러 가도 전혀 쪽팔리지 않았음 ㅋㅋ으하하 영화 진짜 잘봤습니다! 올해 안봤으면 큰일날 뻔했어요 
10,장동건 테마 나올때 솔까 눈물남 ㅠㅠ 
10,연기에 푹 빠져서 봤어요 눈을 뗄 수 없었다능.. 
10,고마해라.. 전작 많이 봤다 아이가.... 
10,"아래▼분들때문에 볼까말까 망설이다가 봤는데 보길잘했다 싶었음!! 보면서 웃기고 재밌고 지루하지도않고, 완전 밤에봐서 잘까봐 걱정했는데 재밌어서 끝까지 졸지않고봤어요^──^ 친구1은 신나고생동감넘쳤다면 2는 생각하게되..."
10,말이 필요 없는 영화였다 느와르 장르중 최고 
10,아쉬운 부분도 있었지만 그래도 대한민국 대표 수작 아니겠습니까? 
10,진한 여운을 다시 한번... 
10,김우빈 연기에 반했어요 진짜 잘생겼는데 연기까지 잘하다니 스크린 데뷔작 맞아? 
10,올 해 마무리는 친구2와함께 ㅠㅠ 최고재밌음 
10,재미를 떠나서 친구2는 무조건 봐야했던 영화였다 
10,김우빈은 진짜 물건이다. 확실하다. 
10,거칠고 투박한 매력 그 맛에 친구2 보고왔어요~! 
8,그럭저럭 멋있기만함 내용은 잘~~;; 
9,재미있는데요? 근데 대사를 조금 못 알아들었음 ㅎ; 
10,"친구2 확실히 부산이 배경이 되어 장소들을 볼 재미와 배우들도 열연을 펼쳐서 좋았다:구성이 좀 너무 보여주고자하는 내용들이 그닥 연관성은 없어보였지만, 친구1과는 또 다른 재미가 있었다. "
10,아 진짜 영화를 보면서 몇번 눈물흘린영화 
9,"평일 하도 안 좋아서 조조로 보고 오는 길 입니다.영화에대해 평론할 입장은 아니지만, 재미있게 잘 봤습니다. 유오성은 정말 이준석 잘 소화하네요.성훈이도 동수 특유의 눈 치켜 뜨는것도 잘 관찰한 것 같고.나도 건달인..."
10,꼭 봐라 진짜 최고당당좋다 
9,숨겨진 명대사: 필요이상으로  반갑네~~ 
6,너무많은 기대는 더 큰 실망만 불러올뿐... 친구는 없고 전기톱은 있었다. 제일 크게 기억에 남는건 전기톱정도 
3,1편완성도가 좋았지만 속편이의 정설로 큰기대를 안했다 역시 허무하네요 시라리오가 약하면 액션많던가 해야하는데 이도저도 아니게 심심하네요 친구시리즈는 여기까지 하시는게 좋을듯 
9,재밌어요~ 1본사람은 꼭보세요! 
5,깍두기들이 연장들고텍사스전기톱연쇄살인사건 따라하며 담그는 영화!조폭영화는 한물 갔자나~볼껀 김우빈의 비주얼밖에 없자나~경상도 사투리 잘 못알아듣겠자나 
9,기대안하구봐서근가갠츈했는데~ㅡㅡ 
7,"기대하지말고 봐서 그렇나 나는 그럭저럭봤는데,,,사람들이 얘기하는 얘기도 무슨얘기인지 알겠고감독님이 담고자하는 얘기도 무슨얘기인지 알겠는데그냥 제 주관적으로는 쓰레기물 취급받을정도는 아닌거같아요다만 세상이 변했을뿐이..."
9,어영화는 참 좋은영화 새록새록 
7,시대가 바뀌는 것들로 이야기구성이 짜임새가 부족한 듯..조금 잔인하게 싸우는 장면들만 보다  나옴..갈등과 해소도 적극적이지 않고.. 
7,10년전 친구를 보신 분들은 재밌음 
2,내가 기대를 너무하고 갔음 김우빈하나보고 갔는데 쩝 끝도 이상하고 내용도 뒤죽박죽 답없다.. 
5,외국인이 한국영화보면 한국에는 폭력과 살인이 남무하는 나라인줄 알듯~!(소재들의 식상함) 
5,말그대로친구면 김우빈성장과정을넣던가옛날친구처럼 그후유오성출소한후가돼씀좋앗을뻔햇는데 주진모 나온이유대체알수없고집중도떨어지고말이안되는전개정말실망이다 양아치한테부산접수하잔내용이나 
2,"액션도 거의 없고, 주인공 3명의 과거, 현재를 왔다리갔다리...잔인한 깡패영화에 불과한 3류!! "
5,끝나고 한참을멍하니있었다.후속편에 대한 실망감... 
2,실망인영화~그래도 주진모 김우빈 연기는잘해서 1점씩준다엉 망~~ 
5,맨 욕설 폭력난무하는 한국영화싫다..특히 조직폭력배들 미화..우빈이 밖에 안보이더라는..내용도 별루고 감동도없고..이번영화는 실패작이다.. 
5,"영화에 대해서 관대한 편이지만, 가문의 영광 4를 봤을때 실망감과 맞먹을정도  기대이하였다. 곽경택 감독님에게 실망입니다. "
10,친구랑 봤는데 친구는 별로라구 하더라구요 전 재밌게 봤구~호불호가 많이 갈리는것 같아여 
1,1점도 아까운 영화 감동도 재미도 교훈도없이 지루해서 잠이 솔솔오더라 역시 원작의 후속작은 형편없구나 김우빈은 반항아 연기라기보단 과도한모습에 소아마비장애인같을 정도였음 진짜 최악 주진모는 왜나오는건지..ㅋㅋ 
10,솔직히 남자의영화다 평점이 너무 구리게나와서 또 김우빈이 나와서 걱정했는데.. 김우빈최고 유오성 당연최고 ..주진모가 좀 ...문제지만 꽤 괸찮게 잘봤다 한번은 봐야한다 친구1을 봤다면 
9,배우들 사투리 연기도 잘하구 내면 연기까지 짱짱 
10,이렇게 욕먹어도 박스오피스 1위ㅋㅋ 
9,배우들의 연기력도 좋았고 마지막까지 흥미롭게 잘 보고왔다 
4,원래 친구2는 만들기로 예정되있던거 아니죠? 급하게 한번 만들어보신거같아요 친구1은 영화제목이 왜 '친구' 인지를 완벽하게 보여줫는데친구2는 그냥 조폭이 하는일만 고스란히 넘겨온거같네요김우빈이 막(?)...
2,평론가뭥미 ㅋ  토르랑 같은점수주네 감독이랑 친구가? 
4,학교 동생들과 부산 접수하러 가자 라는 장난스러운 말을 듣고 영화를 보러 갔다왔는데.. 왠걸... 재미없었어여 헝헝.. 뭐. 딱히 짤방 할만한것두 없고... 명대사도... 힝.. 전 작품이 너무 재밋었나 
5,"안쓰럽다..배우들이. .그리고,김우빈은 너무어색하다.사투리가ㅜㅜ "
9,그냥 가볍게 즐기기엔 좋은 영화? 
2,"제가 평론가도 아니고 지극히 개인적인 생각을 한마디로 말한다면..."" 정말 돈이 아까웠습니다."" 진심 "
1,의욕은 보이는데...능력이 안따라줘...상속자들 재방송 보는게 낫다...김우빈이 귀엽기는 하잖아... 
7,김우빈이없었더라면 망했을듯.... 
3,김우빈에 대한 선입견 있었는데 연기 나름 잘해서 놀랐다. 영화는 쓰레기였다. 
5,친구2는  나오지 말아야 되는데..곽경택 아저씨 설빙 팔빙수 하신다고 하던데..설빙 광고 할려고 하시는건지??영화 참이상하게 만드시네..올해 한국영화 최고의 졸작 당첨..축하합니다. 조폭 느와르 영화가 아니라 고딩학...
6,친구1이 워낙 대작이라 그에 걸맞는건 기대 안 해서인지 나름 선방했다. 김우빈은 자기가 맡은 역할을 완벽하게 소화해줬다. 하지만 주진모를 통해서 무엇을 보여주려 했는지 이해는 하지만 굳이 그럴 필요가 있었나싶다. 
3,부산토박인데 못알아들음 
1,첨으로 돈아깝단 생각했음 
2,<명제>  1편만한   2편은  없다. 
10,이거이거 봐야해?? 말아야해?? 고민이네 
9,대한민국 남자들의 가슴을 흔들 작품 
9,유오성과 김우빈의 카리스마 연기가 돋보임.  곽경택 감독님 그 특유의 마쵸적 남성들의 세계가  잘 나타남.  외로운 남자들의 내면세계가 느껴지는 영화 
1,자막이 절실히 필요함 경상도사람이 아니라 그런가 친구1을 안봐서 그런가 대사를 도통 못알아먹으니 뭐든 반감됨 
8,평점을 봤을때 볼까 말까 망설였는데 조금은 아쉬운 부분은 있지만 재미었습니다. 유오성의 연기와 과거와 현재를 절묘하게 만들어 계속해서 흥미진진했습니다. 
6,그냥그냥그냥 김우빈만 잘갱김 
1,우리 곽감독이 돈이궁햇나?  시덥지않은 어거지 스토리  부회장 칠때 그딴식으로 칠려고 애들 그렇게 모앗나? 그냥 같이잇던 그 부하랑 둘이 치면 대지ㅋㅋ그리고 동수아들?  이게 왠 짜집기..주진모는모고 그분량으로 애들...
8,김우빈만 믿고 보러간건데 재밌었어요~!!!! 유오성 아저씨 포스폭발! 
4,그냥  친구 에서 끝내지 왜 2를 찍어서 이미지 다운시키나~~욕심이 과했다~~~ 
4,딱 이정도 연기자들은 연기 완벽!  하지만 3가지 영화를 편집해서 짜집기한느낌  세명의 주연은 자기편을 따로만들어서 찍는게 좋을듯하다 
4,김우빈과 유오성의 긴장감있는 갈등을 많은 사람들이 기대했을거라 생각이 드는데 유오성의 위치가 워낙 강력하다보니 김우빈이 잘 못 살아난 느낌입니다. 극적 구성에 대한 아쉬움이 남았습니다. 
6,한국판 대부가 되려 했으나 실패한 영화 
7,별내용없다김우빈이 사투리를 그렇게 잘쓸줄은 몰랐다대구 사람인 내가봐도 현지인 느낌근데 경남 이야긴데 경북사투리 쓰는게 에러담그다 이런표현은 제대로 사투리를 배웠다는 증거다주진모는 왜나온거 
3,쓸데없는 장면이 너무 많음. 김우빈을 위한 영화임. 시대를 너무 뛰어다녀서 정신이 산만함. 잔인하기만 하고 완전 시간 아까운 영화 
5,실망스러웠습니다.ㅜ 
4,보다가 잘뻔했다;;.. 
10,연기는 잘한다. 1편안보고 보니까 재밋더라.1편본사람들은 2편을 너무기대한듯. 2편은...1편에서 이어지는 스토리긴하지만....번외느낌임 
6,"기대했던만큼 실망도큰법, 너무 오래전 옛회상까지하면서 작품의 완성도가 조금 낮았던건 아닐까 싶은 실망스럽다. 배우들의 연기력은 좋았으나, 먼가 아쉬운느낌은 어쩔수없는듯, "
10,마지막에 김우빈이랑 유오성이 우는 장면은 슬프더라.. 
10,친구1처럼 임팩트 있는 대사들이나 장면들은 없었지만 그래도 재밌었던 친구2 
9,너무 시대를 넘나들어서 헷갈리기도 했지만 전개나 흐름은 좋았던 영화! 
10,김우빈 진짜 연기 잘하더라..멋있기도 하공 
10,중간중간에 코믹한 장면들도 많았고 유오성씨와 김우빈씨의 연기 덕분에 두 시간 동안 지루하지 않게 본 것 같네요~ 
9,호불호가 많이 갈리는거 같지만 난 재밌게 봄!! 
10,다 좋았지만 그 중에 유오성씨의 연기 끝내줌 
10,러닝타임이 120분이 넘는데도 시계한번 안보고 본 듯.. 
10,"연기,연출,스토리 뭐 하나 흠 잡을 곳이 없었어요 친구2 파이팅 "
7,지루하지 않게 킬링타임용 굿 
10, 이정도 영화면 8 점은 되 야 
10,전편의 준석이 동수 상택이 중호에게 빠져 10편이상 재탕하면서 본사람들은 꼭봐야할 영화이다. 평점이 왜이리 낮은지 모르겠지만 아무래도 세대차이가 느껴진다. 지금 30대들에겐 최고의 한국느와르영화인듯하다. 전편을  본...
10,난 원래 조폭영화는 싫어하는 친구2는 재밌더라ㅋㅋ친구1도 찾아 봐야지 
9,이 정도면 꽤 괜찮은 영화 아닌가; 
1,그닥 그닥 그닥 그닥 그닥 
1,...에휴 거참 한숨뿐이다 
1,디금 보소 나옴.... 시대가 너무 컸나? 
1,"양아치 미화영화. 재미,감동,스토리 모든게 병맛. "
1,재미도 없고 감동도 없고...엄청 기대하였으나..실망만...내년 추석특집으로 TV로 보세요~ 
1,감독님이 아직도 2001년에 계세요. 
1,대실망 대실망 대실망....!!!! 
3,정말 엄청 실망스런영화 입니다. 
6,나쁘진  않았지만  기대에  못미쳤다는  아쉬움이...그럭저럭  볼만하긴했어요제가  여자라서  그랬는진  몰라도  잔인한  장면들이  많았어요ㅠ 
7,재밋지도재미없지도않다ㅋㅋ그리고대사는중간중간 뭐라는지모르겟다ㅋㅋ그냥볼만하다정도 
4,너무 기대감이 컸나? 너무 산만한 느낌과 주진모는 왜 나왔는지 이해가 안되고 내용 진행 과정이 너무 복잡해서 집중을 못했음 
5,100만  이해가  안가네  친구1을보고  기대해서  밧건만 평점 5점도  후하다  사실  과거 현재 스토리가  영 
4,친구1의 무게감이없다 유오성똘마니 개그컨셉 김우빈 친구 스님...영화내에서 몇개의 장르가 따로논다 감동도 웃음도 내용도 없음 신라의달밤 혹은 달마야놀자 후속작같음 타짜2는 이러지말자 
3,전반적으로 내용 없음?액션무 
6,담배불붙이가 시허줏다믄서예 
5,담배피고 ...담그고작업하다욕만하고끝나는영화...스토리는나름있으나 김우빈대사못알아듣겠고 욕만들림ㅡㅡ남자들은이런영화보면피가끓는다는데...쩝 
3,급하게 만든듯오랜시간  친구투  제작을 위해 과연  고민은 해본건가 
4,다큐멘터리영화.... 
1,건달 영화는 아웃...777 
1,ㄷ ㄷ화가난다.... 
3,스토리는 없고 폭력만 있는 영화.. 
1,쓰레기 영화 곽감독. 이영화로 차세대 일진쉐리들 몇배는 많아지겠다. 대사에 감동받았다는 깡패 똘마니 새끼들도 많고.. 양아치들아 정신차려라 니 선배들 보면 니들 말년인생 뻔히 보이지? 돈은없고 가오는잡고싶고. ㅄ들 
6,기대하고 볼만한 내용은 아니고..그냥..친구끼리 보는정도... 
4,기다렸던만큼 너무 기대가 컸나봐요.... ㅜ.ㅜ그 대작을 왜 이렇게 만드셨는지.... 진정 안타깝네요... 대사가 무슨말인지도 모르게 후다닥 지나가버리는것도 많고 영화의 흐름도 뭔가 매끄럽지 못하다는느낌? 
9,중간중간 웃긴 장면들도 있고 가슴 찡한 장면들도 있었고 액션신도 있었고 너무 재밌게 봤다 
10,엔딩장면 왤케 찡하냐..3편도 나왔으면 좋겠다 
8,친구1 을안봐서 이해가잘안가기도하고대사뭐라는겨ㅋㅋ 
10,전작만한 후속은 없다구 하던데 전작만한 속편이 나온듯~ 
10,난 나름 재밌게 즐기면서 봤는뎈ㅋ 
10,기대한 만큼은 아니였지만 그래도 꽤 볼만했음 
10,러닝 타임 내내 지루하지도 않고 푹 빠져서 봤습니다^^ 
10,오랜만에 이런 영화 봐서 그런지 넘 재밌었으무 
10,난 진짜 재밌게 봤는데ㅎ김우빈 연기 너므 잘함 
8,별  기대를 안하고봐서 그런가 재밌었어요.. 
10,오랫만에 재미있는 영화 
10,난개안튼대....유오성카리스마짱 
8,평이 별로 안좋길래 별로인가했더니 재미있게봤어요...남자들끼리의 의리나 감동도 좀 있는거같고 유오성님도 멋지고 김우빈님도 멋집니다~카리스마 짱!!!저는 재미있게 봤어용~주진모님이 나오시는 장면이 나오는 이유가 조금 ...
10,재밋다진심세번봐야만족할영화 
7,친구2를 끝으로 나쁜영화 이제 안 만들어지길 
2,방금 보고왔다 솔직히 재미없다...주진모는 왜나온거지?ㅡㅡ;;그냥느낌이 예능프로에 유오성 혼자나와서 추억곱씹는것같음...기대안하고봤는데 솔직히 이건 너무하다고본다 이걸ㅊ볼바에 짐승을 보겠다 
10,서울아들이 보면 이해몬하제이 부산사람들은 전부다 재밋다고 했을끼야 
6,좀 잔인하지만 끝판에는 조금 시시하게 끝났더라고요 좀 밋밋하게 
5,몰입도가 너무 떨어졌음.. 기대이하로 
7,모든 사람이 거의다 친구1 향수때문에 보는것같은데 명작은 명작그대로 나둘때 멋있을수도 있습니다. 
5,전작을 뛰어넘는 후속작은 없는듯 그리고 대사 못알아들어서 옆에 친구한테 머라했는데? 만 3~4번 물어봄 
2,정라는 정말 재미없던영화 영화이름이 친구인 이유도 모르겠던 영화 단지 친구의 후속작이라 친구2라는 이름이 붙은거 같고 친구1 과같은 감동은 전혀 없었다. 이야기 하고자 하는 바도 모르겠다. 머래는거야 ? 라며 주의 ...
10,노무현이 생각낫음.. 영화보다가. 운지! 영화 꿀허니잼ㅋ 
6,솔직히 영화친구는 장동건때문에 뜬 영화인데 그 후속작  역시 그벽을 넘지 못한듯 
8,평점에 비해 재미있게 봤습니다 3편은 주진모편으로도 나와도 될듯 하네요 
3,친구1을한번더보는게 더나을꺼같다 
8,잔인해서 그렇지 따져보면 그리 잘 만든 영화가 얼마나 된다고...생각없이 보기엔 괜찮네요평점1점 주는사람들 아무리 개인취향이라지만 이해안가 
9,그냥 집에서 다운받아서 보시길..이 영화는 곽경택 감독이 그냥 돈 벌라고 만든 막 영화임 ㅋㅋ 
8,전편에서 못다한 이야기를 풀어놓은 느낌. 간결하게 매듭지지 않은 부분이 아쉽다. 김우빈의 무한한 가능성을 보게 됨. 
10,잼나자나자나자나자나자나자나 
8,많은 이야기를 담으려 시대적이로 왔다 갔다를 너무 많이 한것 같네요.. 전박적으로 재미있었습니다.. 요즘 영화는 한번 봐서는 잘 모르겠어요.. 한번더 봐야겠어요.. ^^ 
10,2번볼 영화는 아니지만 나름 재밋었다. 
7,나름 재미있게 봤어요~ 유오성이라는 배우 여전하네요^^ 
7,유오성과 김우빈의 친구였다..친구가 생각 나는게 연락한번 해봐야할듯.. 
8,"대사는 못알아들었지만, 김우빈의 연기만으로도 충분히 볼만했음. 지루하진 않았지만 끝나고 나니 뭔가 허전함, "
10,"친구1을 먼저 보신 후 감상하세요. 그럼 들리고, 보이고, 12년 흐른 친구의 모습이 느껴집니다. 추천. "
10,평점 10점!! 이 평점은 순수 유오성의 연기력만을 얘기한 것입니다~~ 영화 자체는...2.8점?! --;; 
10,저는 1편을 보지못해서ㅜㅜ 대충줄거리만찾아보고 간거라 기대를 별로 하지 않았어요 근데 너무 재밌게 봤네요 ㅎㅎ 1편나중에찾아보려구요ㅋㅋㅋ 
4,딱곽경택감독 영화다 곽경택이랑유오성이랑 이영화를계기로 다시주목받고싶어하는듯 하지만 김우빈연기는괜찮은것같다 뜬금없이주진모는 왜?아무튼 이영화 별루다 
8,"'친구'를 본 사람들이라면 꼭 봐야 할 영화 같았습니다. 그 날의 숨겨진 이야기들이 재미있었고, 김우빈의 연기에 소름이 돋았습니다. 집사람과 재미있게 봤습니다. "
8,7.5 정도 주고 싶군요... 8점까지 가기에 전편의 영향이 너무 큰듯 싶습니다. 전편을 배제하고 평하더라도 주진모씨의 분량은 없어도 되는 편보다도 괜히 나와서 아까운 편이었고 대신 다른 스토리들을 보완하는 게 어땠...
2,"무슨내용인지도 무슨말인지도 못알아먹게 만든 망작... 1편과 2편을 잇기위해 무리수를 던진... 재미도 감동도 내용도 없는,,, ㅠㅠ "
2,아 실망스러워요 걍 김우빈이 멋지다는것만 확인하고 왔네요ㅠㅠ 
7,시간을 너무 왔다갔다하는 편집이 NG... 부산사람이 못알아듣는 부산 사투리는 아이다 아이가~ 
6,영화가 군데군데 잘린 듯한 느낌이 든다면 편집을 잘못했거나 제대로 못 찍어거나 둘 중 하나다. 이 영화는 매력적인 이야기가 될 수 있었으나 그러지 못했다. 
7,"연기는완벽 연출별로고 스토리별로다. 분명 친구1에는못미치지만 깡패를 미화시킨것도 아니며 한국영화,깡패영화라고해서 깎아내릴필욘 없는영화.이영화보고 욕하는사람들은 영화에 꼭 메세지가 담겨있기를 바라는사람이거나 기대를 많..."
1,영화 재목을 그냥 깡패라 하지 
2,내용이 너무 와따가따해서 몰입도안대고... 정신없음...기대한것보다 너무 별루였음 
2,"진짜  친구 1은 열번넘게 볼 정도로 찡한 느낌이엇다면 2는 완전 말아 먹은 영화..준석이 아버지 얘기가 흐름상 맞지 않고,친구라는 제목에 맞지 않게 깡패 얘기(배신 처단)만 다루고 있음..도데체 왜 이렇게 만드셨어..."
8,친구 1보다 못하지만 2도 볼만했ㅈ다 
7,친구1흥행으로 친구 2를 봤는데~그다지 스토리는 없네요~~ 
9,평점탓에 안볼까하다가 볼만한게없어서 봤는데 기대치를 낮춰서인지 저는 재밌게봤네요? 
1,최근에 본 영화중에 제일 재미없었음ㅠㅠ 원래 액션같은거 좋아하는편인데 이렇게 지루한 액션영화는 또 처음;; 예술영화도 아닌데 내용도 뒤죽박죽 이해도 안되고..ㅠㅠ게다가 대사못알아들어서 더 답답함 
4,친구라는 타이틀빼면 아무것도없는 조폭영화 이딴영화가흥행하는 한국영화의 수준이 짐작간다 
6,전편에서  하고  싶던  말들을  2편에서  모두  쏟아내려햇던게  좀  과한.. 굳이  관객들에게  모든것을  알려줄필요가  잇엇을까  싶은.. 
1,이해할수없는 과거와 현재를 너무 왔다갔다하며 지루함 
10,난재밋든데 ?그냥 남들다재미없다해서그런가 기대안해서그런지몰라도볼만하던데 
10,친구2 아이가 ?   평점이 너무 작다 아이가   고마 내가 만점줄께.. 니가 봐라 
10,"모든사람들의 연기만으로 충분히 멋졌던,,,,영화 "
9,올해본  한국영화중에서는 최고다 
10,기대만큼은 아니지만 좋았다 
10,난좋던데 김우빈 다시보게됨 
10,원보단 못하지만 나름 잼있었다.  유오성 연기도 조았는데 아쉬운건야한 장면이 조금만 더있었으면... 
10,평점테러 너무너무 심한듯....괜찮은 영화이다. 
4,고마해라 마이우려묵었다 아이가 
4,"인간적으로 자막 넣어줘야 하는거 아닌가? 완벽한 사투리 구사인건지, 아니면 발음이 후진건지. "
1,돈이아까울정도  아오  빡친다 
