score,review
3,한개반짜리영화인거 같습니다 친구1에 대한  강력함도없고 기대감이 컷엇는지 끝맺음도 그렇고... 
7,기대가 큰 망큼 실망도 크다. 나쁘지 않지만 부족한 영화. 
5,리얼리티가 좀 떨어짐 사투리가 어색해서 
6,진석이 인간시대. 영화로서의 드라마는 실종. 
5,속편의 공식을 못깬건가..? 
7,처음에재미있을것같아서긴장하고있는데주진모회상씬~흐름을끊어놓네요~야쿠자이런거필요없었을거같아요~그냥이준석아버지가대단했다~요정도끝내고현재흐름에충실했음더재미있을듯~친구영화회상도되고나쁘진않은데~더파이브가더잼나요~ 
8,"경상도 살지만 발음때문인지 내귀때문인지 못알아듣는대사가 꽤나  있었습니다. 영화보고 나오면서 생각한게 '아 서울사람들은 알아듣도 몬하긋네' -.,- "
7,과거얘기는안나왔어도 됐을텐데..뭔가가 조금 아쉽다~기대안하고보면 괜찮았을텐데...친구1을 본 사람은친구2는 조금 실망스럽다는..차라리 1탄에 상택(서태화)이나중우(정운택)가 나왔었으면좀더 재밌었을텐데... 
2,영화보고 느낀건..곽경택 감독의 연출력은 2001년에서 멈춘듯...그간 영화에 대한 깊은 고민이나 공부가 없었던거 아닐지...민망하리만큼 3류 조폭영화 보는거 같았다...그나마 건질수 있었던건 김우빈이란 배우의 매력...
4,재미도감동도액션도 명대샤도없고 
7,이야기는 다소 억지스럽게 엮었으나 OST는 그때 그감동을 다시느낄수있었음 
2,영화 기대이하임  소문만 무성한 영화였군요.. 
2,정말 왜 이렇게 영화를 만들었는지 너무 안타깝다.... 
5,글쎄 좀 아쉬운 느낌이랄까 
3,대부 따라하려다 이도저도 안된 작품.. 
6,대사 80프로만 알아들음 
3,기대를안하고 봤는데도 이정도라니 
5,그놈의 조폭 깡패영화 그만 좀 만들면 안 되나. 이런 영화들을 만들어놓고 스크린 독점시키는 게너무 싫다 
5,진짜 스토리 집중이 안 됨. 뭔 그리 에피소드가 많야... 
5,유오성눈빛? 유일하게소름돋는.알수없는배우.개인적으로 우리나라배우들중탑이라고 생각한다 아진짜 소름돋는다니까..ㅋ 
5,베플을 장악하지 못했네ㅋ 배급사가 대형이 아니라서 그런가. 베플부터 장악했어야 흥행하지 
7,1의 기대감을 장삿속으로 우려먹은 재탕일뿐다만 볼만한게 없으니 상대적으론 약갼 떠주는 
6,"명대사 , 명장면 이라기보단 유오성의 친구 1에서 2로온 중후함 김우빈의 연기력 . 빼고는 딱히 매길게 없습니다. 시청하면서 아.쉽.다 라는 단어가 계속 떠오를정도로 ... "
5,뭐지 역시 후속작은 전작을 뛰어넘을 수 없는 건가ㅠㅠ완전 기대하고 봤는데... 영화 끝나고 나오는 한숨은... 
7,ㅎㅎ 대사를 못 알아듣는 사람들이 나만 있는게 아니었음 ..내가 잘못된건줄 알았는데..친구1 보다 못할거라고 예상했는데 진짜네 ..그래도 반가웠어 친구2 ~~ 유오성 땜에 
4,대사전달도 안되고 내용전달도 안되고 지루잔인유치... 조푝미화영화안좋아하는데 진짜 그냥 잔인한 애들영화같음 중간중간에 사람들 웃는 장면에서도 난 못웃게더라 유치해서... 진짜 최악중에최악 
3,ㅅ햐솔직히정말실망적인....ㅜㅜ아오뻔한스토리에왕창기대하고봤는데ㅜㅜ 
6,"전편과같은감흥은좀없네요. 스토리가 부드럽게이어지는면이 좀떨어지는것 같기도하고~ 정말 많이기대했는데, 좀아숩다~ "
6,ㄱ김우빈 너무 무섭게생김ㄷㄷㄷ 
3,설마..걍 이대로 끝? 이런 생각이 들었다. 절레절레 
3,생각보다 김우빈 연기에 관한말이 없네~너무어색해서 못볼정도던데.. 
4,기대가 넘컷나  연기도 별로고... 쩝...지루햇음 
8,자막좀쳐요ㅡㅡ배우발음도뭣같고 아효 해석하는데시간다뺏김 영화집중안됨 
8,제작기간 길게잡고 차분히만들었으면좋았을거같다 하지만 과거현재 움직이는거 이게어지러운거는 상당한이해부족 사투리못알아듣는거는 뒷문장 들으며 해석못하는 결국이해부족 1편과비교하면 당연히부족하나 2편자체만놓고보면 욕먹을수준...
6,철주의 이야기는 스핀오프로 만들고 준석과 성훈의 이야기로 풀어나갔으면 더 좋았을듯 
10,김우빈..이상하게계속생각나.. 
6,음   그냥 뭐 볼만은 한데... 글쎄... 보는 사람에 따라서 한 4~7점 사이에서 왔다갔다 할듯 
3,음..10대의 눈으로 바라본 불우한 불량청소년의 충돌기 
10,그냥그냥  별 생각없이 보면 나름 볼만해요 
2,정말 무지하게 안타까워요;; 
3,ㅡㅡ 주진모 왜 나왔냐 친구 3명인데 한명어디갔어 전문대 다니는 애 
7,주진모내용 넣을꺼였으면 친구3으로 기획에서 2를 만들었어야지 그리고 주진모 위주로 가던가  그리고 김우빈을 3으로 가던가 해야지 이랬다가 저랬다가 ㅡㅡ;;;; 괜찮긴한데 몰입 이렇게 떨구나   느와르 창수나 기대해야...
5,전작으로 인해 기대치가 너무 높았나보다..전체적인 영화의 흡입력도 떨어지고 스토리 자체도 부실한거 같다뭐랄까..두시간 동안 영화의 긴 예고편만 본듯한 느낌?? 
6,1편에 비교하면 정말 재미없게 봤네요. 어제 보고 밤에 악몽꿨음.. 너무 잔인함 ㅜㅜ 
10,무슨 혹평을 들었던 일단보면 재미는 있다..!! 
4,이건 좀 아니라고 봅니다. 억지로 쥐어짜내서 스토리 만든 느낌 티남. 
3,"친구라서 혹시나하고봤지만,,아직 김우빈의 다듬어지지않은 연기력,,, 보고나서 기억에남는장면이없네요 "
6,잡스럽다. 시도때도 없이 등장하는 웅장한 음악이 눈물을 뱉어내라고 명령하는 것 같다. 
5,정말로 기대하고 봐서 그런지... 일단 스토리 전개가... 왜 주진모 아버지 회상씬이 나왔는지.... 이해가 가지않는다... 아쉽다. 정말 ㅠㅠ 
4,아 기대를 너무많이한탓일까...내용도 별로고 잡스럽다 
10,좀 전작에 비해 아쉬웠는데 볼만하다잉 속편이니까  너무   기대하지 말고 봐라이이이이잉ㅇㅇㅇ 
10,친구1을 안본 저는 재밌게 봤어요전편을 본친구는 저랑느낌이다른 것 같았았어요 
9,기대 하는 작는품영화  ㅋ 
2,뭐하나 얻을게 없다. 그냥 잔인함. 시간이 아까움 
5,나는 울산 토박이인데 뭔얘기인지못알아듣는부분이많턴...  그리고친구1안봐서그런지 무슨내용인지하나도모르고봄 
4,1편을 너무 많이 재미 있어 2번 봤는데 2편은 보다가 잤다...뭐 이래...헐~~~정말 기대하고 봤는데 2편은 아닌것 같다사나이들의 의리도 없고 주인공으로 우빈 그친구는 그냥 정신병자인 사이코인것 같고 정말 돈이 ...
4,"나오지 말아야 했어, 예고편에서 부산 접수하자고 할때 눈치챘다. "
6,저는 대사  다 알아듣겠던데 ㅎㅎ김우빈연기나  사투리도 생각보다 갠찮았는데 주진모는 좀 ...사랑도 찍었음서 사투리가 퇴화한듯;;;글구 포스터에도 주진모대신..정호빈아저씨가 들어가야지 맞는것같음....암튼 개연성있게...
5,조폭영화 좋아하는데.. 보기는 했는데 ?.. 몬가가 아쉬워요...보통입니다...그래도 연기자분들 연기는 볼만했어요.. 
4,좀 실말스럽네요.감동이...안생겨요~~~ 
7,주진모...친구3 준비 하나요?  일본에서 노래 부르던 가수는 유오성 엄마 인가요? ㅋ ... 주진모 분량은 정말...실망.   기차놀이 검은차 맨앞서 세우고.. 작업 하는 장면!!! 그장면 하난 제대로 건진듯......
3,영화 자체를 이해하기 힘들다 친구1에서는 내용에 이해가 쉬웠는데 여기서는 대사도 제대로 못알아들을 뿐더러 흐름 중간에 주진모 나오는 의도자체도 이해하기 힘들다 더러 건달연기가 이렇게까지 과할필요가 있나 싶다.. 그냥...
3,박수칠 때 떠났어야 했다. 
5,친구1이 너무재미있어서 기대하고 봤는데 실망이크다... 
6,그냥 무난한영화 지루하진 않음. 
5,정우가 주인공이었으면 분위기 많이 달라졌겠다... 
5,우려먹을 시기가 지나서 우려먹을려고 하니 쉰네는 나는데 각종 양념으로 냄새를 덮은 느낌이다. 
10,1편에 비하면  많이 뒤쳐지고 우정에대한 이야기도적지만  유오성  김우빈 연기로 재밌게 봤어요1편 안보고 보면 무슨이야기인지  모를것 같네요 전 아무튼 지루하기 않게봤네용 평점은 7점인데  너무 막깍은 분들이 계셔서...
8,2편이 재미없기보단 1편이 너무 재미있었음 
6,중간부터 모든 내용에서 갈길을 잃었다. 주진모부분은 쓸데 없이 길었다. 아마 감독이 표현하고자했던 유오성-장동건 간의 짠한 그어떤 마음을 관객에게 느끼게 하기엔 부분 부분 부족했다. 더중요한건 김우빈-유오성 갈등을 ...
10,솔직히 김우빈 볼라고 본 영환데 영화 자체에 빠져서 나옴ㅋ친구1도 아직 못봤는데 빨리 찾아봐야지!! 
2,극장서 나오자마자 글남깁니다영화보고 글남기는거 평생 첨해보네요 영화보고 기분나쁜것도 첨인드싶고 아 정말기분이 나쁘네요 재미고 뭐고 짜증나는영홥니다 스토리도 흐름도 죽어도 꼭 이쁜구석하나는 꼽아야한다면 피카츄문신에 차...
10,마지막이 좀 아쉽긴 하지만 그래도 꽤 재밌게 잘봤네여~ 
4,주진모이야기빼고 세력싸움에 좀더 신경썼으면 좋았을듯.느닷없이 전기톱나올때 혼자 빵터짐 
9,"느와르라는 장르를 잘 살린 영화,감독의 연출이 돋보인다 "
9,섬뜩하기도 했는데 감동도 있고 다 보고나선 진한 여운도 주네요 
9,러닝타임 내내 푹 빠져서 보고 왔네요ㅋㅋ 
10,"너무 많이 기대를해서 그러가,,전작보단 별로지만 그래도 재미없진 않았음 "
10,친구2를 통해 김우빈을 다시 봤다! 
10,ㅋㅋㅋ그래두볼만햇어용 
2, 연기만 좋음. 과거 회상 장면은 대체 왜 넣은건지. 진짜 뭘 얘기하려고 하는지 모르겠는..우왕좌왕 하다 끝나는 영화. 시간 아까움. 
10,연기 넘들 잘하시니 멋지고 완벽하게 전편을 이어가는 탄탄한스토리 
10,알바방지요 이정도면 재밌구만 뭐이렇게난리들이신지ㅡㅡ 
3,어수선하고 불필요한 장면이 많았다고 느꼈음. 재미없음.. 
4,되다 만 이야기를 보는 느낌.. 
7,대부2의 향기가 솔솔 ㅋㅋ 영화도 10년 지나니 추억되네 
3,오늘보고왔는데 대사가 안들림.. 또 3전개라서 왔다갔다가 너무 심함.. 그리고 기대했던것 보다 이하.. 
5,기대하지 않고 봤는데도 실망스럽다. 사나이 말고 싸나이 좋아하는 전형적인 부산 마초에서 이제는 좀 벗어나셔도 괜찮을 듯 싶다. 아님 그냥 부산홍보대사 같은 걸 하시던지. 
5,대사도 못알아 듣겠지만 너무 많은 시대를 넘나들어 시제에도 혼란이 온다. 열심히 저지르고 반성하는 것도 역시 영화를 맥빠지게 하는 하나의 요소.  눈빛 하나로 연기하는 성훈역 정말 짜증스러워.... 
7,니가 가라 마닐라... 
6,그냥 딱 한 줄... 큰형님은 강하다영화 황후화랑 같은 뜻이다.. 왕권은 강하다랑같은.. 
8,대사도잘안들리는부분이있었고..결말도어떻게된건지..아리송하고그래도재밋게봤어요 
6,너무... 기대는 하지 말자 
9,음...  뭔가 아쉽쟈나ㅜㅜ 
5,스토리를 많이끼워마춘듯 해여 원작에 비해 너무실망이 큽니다 
10,개잼개잼 개잼개잼 개재밋어요 걍재밋음 긍께 걍보셈 걍재밋음 제발 집중해서 이해력딸리시는분들이 재미없어보이시는데 개잼임 근데 솔직히 좀 안타까운부분도 많았음 아쉽고 ㅜ근데개잼 
5,느와르.깡패영화종류 좋아하는데 진짜 별로...이야이가 너무난잡하고 도대체 준석이아빠는 뭐냐 왜나온겨? 유오성이랑 김우빈 특히 유오성의 연기는 어마어마했음에도 영화가 너무안타깝다 잔인하기만하고 
3,내가 이걸 왜 봤을까... 
6,확실히 김우빈은 물건이다. 연기 며 몰입도가 충분하다. 뭐랄까... 깡패 미화도 아니고 그냥 저냥 본거같은 느낌 뒤끝이 없다 여운이없다고 해야하나.한국말인데 한국말을 못알아듣는 내 귀는 귓밥을 파야겠고.뭔가 군데군데...
5,"정말 조직깡패영화 하고싶으면 신세계,범죄와의 전쟁처럼만들어라~ 막판에만 볼만했지 정말 지루함ㅡㅡ 주진모는 카메오일정도로 분량이 적었고 성훈이는 사투리를 옹알이처럼 해서 답답했음~ 진짜 이 영화는 유오성,장영남,정호빈..."
8,중호   상택이가 나왔음 좋았을꺼 같았어요  1편에선 비중이 컷는데  조금 아쉬웠네요 
7,친구1을 넘재밌게 봐서 . . .기대가 넘컸나보다 배우들연기는 좋았지만 스토리가 넘  엉성하고 쓸데없이 잔인 
5,"정말 냉정하게 평가해드림... 진짜 친구1 좋아했는데. 미국에 대부, 홍콩에 무간도, 일본에 의리없는 정쟁... 한국은 친구가 있었는데 친구2가 다 말아먹음.. 별점은 2개가 가문에 영광급 영화라고 봤을때 두개반 입..."
5,무슨말이 더 필요합니까! 재미가 없습니다. 
7,친구1의 못다한 얘기를 하려고 한것 같다. 솔직히 볼만 하지만 아쉽다. 
4,개봉전과 틀리게 평점 폭락이네..아직 안봤는데...더 파이브나 봐야겠다.ㅋ 
3,넘 기대한 내 잘못이다.. 
5,"개봉전 상당히 기대감을 주던 영화 하지만, 감상후 많은 아쉬움을 남기고 갑작스러운 주진모의 출현으로 흐름의 전개를 자꾸 깨면서 몰입도를 상실시킨다. 전체적으로 너무 허무하면서 아쉬운 내용 돈주고 본 다면 비추천 해주..."
4,사투리가 강해 대사의 20%는 못알아먹은거 같다.. 주진모 분량...ㅠㅠ / 이건 친구1의 그냥 에필로그일 뿐... 배우의 연기는 좋으나 전체적으로 개연성도 없고... 쫌 돈주고 보기 아까웠음; 
2,음 진짜 대사전달이 안됨ㅋㅋ주진모는 왜 나왔나? 3만들려는 의도였나라고 생각이들음너무 기대하지 마세요.. 
4,곽경택은 친구로 시작해서 친구로 이제 끝장나는구나 변하지않는 유오성연기 이제는 식상하고 우빈이의 설익은 연기 성질만 내고 눈에 힘만준다고 고 카리스마가 생기는게 아냐...그냥 안만든게 나았을 영화...ㅋㅋㅋ 
7,전편에비하면 많이 떨어진다. 하지만 1편을 5번이상 불법다운로드해서 본사람이라면 그냥 닥치고보자.이~기 으린기라.. 
10,유오성이 도로위에서 은기를 칼로 작업할땨 카리스마는 마치 신세계의 엘리베이터 씬을 보는듯했다 
3,기대가 너무 컸다. 최소한 요즘 영화들보단 낫겠지 했는데 너무 별로였음. 
3,곽감독님 실망입니다 차라리2편 만들지 마시지... 
2,주진모 쫌 영화는 안어울려 
6,주진모이야기인지김인모이야기인지중심이했갈렸다.마지막은유요성이야기인거 애뜻한추억을바탕으로 한 친구의갈등보다는어린시절의불안으로 시작해서성인이될때까지불안과좌절의반복이속에싸움으로시작해 싸움으로끝난다친구라는제목이어울리는영화라기...
5,그다지..쫌 가벼워진느낌 
6,그냥 친구란 이름때문에 봤음. 시간 왔다갔다해서 이해못하신분들도 많은듯 
4,친구2 아니져 원탁의 기사2 
4,확실한건 친구3는 나오지 않을거라는거다 
5,스토리가 과거와 현재를 너무 자주 넘나들어 어수선하다 
5,1편에서는 등장인물 하나하나가 모두 카리스마를 발산하며 대결구도에서 긴장감을 주었지만... 이번엔 뭐 상대편 조폭들은 죄다 뽀로로삘 ㅋ 새파란 김우빈이 빠따하나 들고있으니 전통조폭 중간보스란 것이 에이 때리지마세요....
3,명작을 남긴 실화 가지고 돈벌이 하는 OO같은 놈들 ㅉㅉ 
3,기대가 너무 많았는데... 실망이 너무 크다. 그나마 3점은 전작때문에 주는 별점임.. 실제는 별 1개 언저리 작품. 
5,2편에서는 너무 억지로 많은 이야기를 담을려고 하니깐 왓다갓다 이도저도아니게 스케일만 크게 잡을려고  시대변경도 정신없고중반부터 몰입이 안되더라 거기다가 사투리도 어눌하고 한국말인데 무슨말하는건지 못알아듣는건 또처음...
2,"고작 이런 이야기를 하려고 그 세월, 법썩을..아쉽네요.갈등구조도 어설프고 아쉬웠던건 캐릭터마다 성격을 부여해놓고 이도저도아닌 진행으로 역할이 무색해짐.용두사미랄까.. 친구1은 뭔가 묵직함이 있었는데 이건그냥 유행따..."
7,"친구1을너무오래전에 봐서 가물가물한기억으로 친구2보면서 연관지어 봤네요 김유빈이 유오성에게 차안에서한 마지막대사가 무슨뜻인지모르겠고, 기대를너무했는지라 그닥 평점을 놓게주진못하겠네요 "
4,친구1 해설집같은 영화 
5,초중반은괜찮은데 마지막에 싸우지도않고 허무하게끝나네 
7,친구1의 대박을쳣던지라기대에 못미쳣습니당ㅜㅜ 
4,"요즘뜬 김우빈을 이용한 관객,원작친구1을이용한관객,영화의 스토리 플롯 주려는메시지보단 관객동원이 급했던영화네요보는내내 이게뭐하는 짓들인지 모를만큼 형편없는 영화였습니다우리기억속에 남아있는 명작,원작을이용한 돈벌이영화..."
5,"시작부터 끝까지 김우빈만을 위한 느와르도 아닌,액션물이었다. "
7,기대감이너무커서 아쉬웠던영화... 
4,ㅇ아 정말 1편 기대하고 보면 안될듯  많이  아쉬움이 남았습니다.3편은 만들지 않았으면 좋겠다.... 
8,방긍 보고왔어요근데 먼가 부족하고아쉽네요 근데 그게먼지모르겠음ㅠㅠ대사전달이 좀안되서 애인이 머라했어? 요말만 남발..그리구 유호성 초반 운전해주는 퇴소가치한사람 너무허무하게 죽음ㄷ 
7,"딱  그냥 7점짜리 영화라 생각하이소 ,  전작을 넘을수없다는 공식은 계속~ "
6,보다가 잠듬. 배우들의 열연이 아까운 졸작. 
5,"보고나서 머리 아픕니다 .친구1의..소중한 추억을 잃어버린것같아서 ㅡ,ㅡ "
6,시간이 너무 왔다갔다해서 집중이 잘 안되는건 있지만 전편에서 못했던 이야기들 마무리 한것이 좋았다. 유오성의 카리스마만으로도 충분하다 
5,최고로 중요한 갈등이.. 아주 순식간에 그리고 허무하게 해결이된다.. 주진모부분은 그렇게 큰 의미가 없고.. 친구1에서 느꼈던 그런건 없고 그냥 조폭들의 대갸리되려는 욕망.. 그 외엔 없음.. 친구1은.. 조폭이 나...
6,"스토리가 넘 약해여  그나마 유오성 김우빈때문에 별3개.   헉  결말이  어째서  그렇케,,   감독님생각이 뭔지 넘 궁금?? "
4,기대가 크면 실망도 큰법!!!이건 해도해도 너무해ㅠㅠ 
5,대부를 넘보다 범부가 된 영화.  제발 친구2로 만족하시길...코폴라 감독도 대부3는 망했음 
2,기대를 너무 많이해서 그런가... 평점 낮출려고 올립니다.. 
6,먼가아쉬웠습니다 잘봤습니다 
4,주인공3명?  주진모 얘기는 뭐냐? 없어도 되는데 .. 몰입할만 하면 갑자기 1960년대  또  2001년 다시 2010   기대했는디 실망.ㅠ 신세계같은 대규모 액션씬도없고 음악도 실망 
4,한동수 추모 영화!! 전작의 아우라가 너무나 컸던 탓일까? 아니면 곽경택 감독의 감이 죽은 것일까? 차라리 전작 '친구'를 재상영하는게 훨씬 나았을듯! 
2,나오지말았어야했음 기대치가너무 높았었나 
9,스토리가 좀 아쉽긴 했지만...여운은 남더라.. 
4,비트도 아니고 유오성이 바이크사주고 김우빈이 따라다니는 또레는 머리가 노랗고 엔딩도  완전3류다.기대가 넘 컸나? 역시 2편은 망작이다. 왜 만든건지...차라리 친구로 끝났으면... 스토리가 진작 에효다.걍 ㄱㅣ다렸...
2,기대를 너무많이한거같아요‥ 
6,뭔가 너무 아쉽네요 딱히 반전도 없고 감동도 없음주진모는 왜나왔는지? 혹시 유오성 아버지 이야기로 친구3만들려고 출연시켰나? 
3,잔인한 살해 장면에 깔리는음악에 조금 억지스럽게 끄집어낸 동수아들 그리고 조폭미화라는 것도 그렇고 주진모의 이야기와 전달 하고자 한 의도도잘 모르겠더군요 
5,유오성이 장동건을 죽이라 시킨거고 그 와이프는 돈벌이용으로 쓴거고 아들은 건달에 살인자 만든건가 결국. 
7,대부2가 지나치게 생각나는 오마쥬가 없었더라면 더 좋았을 거 같다. 
6,감독님 보여줄려고 하시는게 너무 뻔해서 좀 그렇네요. 1편처럼 담담하게 만드시지. 가수는 노래를 담담하게 불러야 하지 않을까요? 
5,많이 아쉬운 영화입니다. 3대 걸친 얘기를 하고 싶었던 모양인데 쓸데없는 곁가지가 많았고 음악이 과잉되다 보니 거슬리더군요. 주진모 분량보다는 준석이 조직을 되찾는 클라이막스에 공을 더 들였더라면 좋았을텐데..무엇보...
3,할 이야기가 우찌 그리많은지. . .대부2를 기대하고 만들었으나. . 친구1의 추억도 못 제대로 못 살림. . . 그나마 동수아들 연기했던 그 배우만 인상에 남음 
6,대부2가 될수는 없었다. 딱 평작이다. 
3,"이제시작인가했더니 끝났네, 이영화뭐지? 뭔내용인지 주진모쌩뚱맞고, 배우들의 감정선이 뭔지 이해도안되고,ㅠㅠ "
6,흥미로 보기엔 넘 섬찟하고 1편의  후속작이려니  편하게  볼려했으나  그것도 편치 않고?연기만 따진다면  볼만한데 ? 쩝 아쉽네요? 
6,1편과는 비교불가이고 너무 많은 이야기를 하려다 오히려복잡해진듯 
6,방금보고왔다 역시1편보다 나은속편없다는걸 다시한번증명했다1편이완성도면에서 너무좋아서 2편은많이아쉽다 마무리부분도... 
3,뭐지....  기대가 컸나요... 
7,신세계와 비교를하면안되죠... 친구라는 이름을 달고나왔으면 이름값을 해야하는건데 전작에 비해 개연성이 많이떨어지는 느낌짧은시간안에 너무많은내용을 포함하려하신것같네요 이해하기 힘들었음하지만 배우들 연기가나쁘단소린아님....
5,2시간이란 짧은 시간동안 너무 많은걸 보려주려다 삼류영화가 되어버려 너무 아쉽다.. 
5,연기자들모두 연기는좋았으나 스토리가좀..뭐랄까..엉성한기분.. 
6,"기대감을 안고 양념통닭을 시켰다, 후라이드 치킨이 배달됐다. 양념통닭이 먹고 싶다고 말했더니,. 양념치킨 소스를 주었다. 반반치킨이라고 한다. 양념치킨은 없었으나. 소스를 뿌리니. 후라이드 반에  반반 치킨이 되었다..."
5,뭔가아쉬움이 남는영화..너무큰 기대를하고 보면 안될듯합니다역시 1편을 능가하는 2편은 거의없는듯합니다 
6,역시 전편보다 나은 속편을 만들기란 어려운 것 같다 
8,솔직히 요즘 영화랑 비교해보니까 엄청난데요. 맺고 끊는게 영화안에 다 들어있고 의아한것들 한 두세번정도 보면 이해가게끔 다 넣어놔서.. 저는 영화관에서 한번 넷플에서 한번보고 감탄했네요. 요즘영화보다 훨씬 재밌음 
10,김우빈 볼라고 보는영환데 알바 OO 풀어놨네ㅋㅋ.ㅋㅋㅋㅋ.ㅋㅋㅋㅋ.ㅋㅋ 
4,분명 한국 영화인데 자막이 필요한 영화 
7,다시보니 연기좋고 생각보다 볼만함 
10,"한국의 느와르. 친구, 강남 1970, 미스터 소크라테스, 비열한 거리, 독전, 해바라기, 약속, 범죄와의 전쟁, 내부자들, 신세계, 타짜, 차이나 타운, 신의 한수, 아저씨, 도망자, 살인의 추억, 공공의 적, (..."
10,후작들이 많아서 보다가...타짜 3가 망치고 보다(솔직히 너무했음) 타짜2를 다시보니 볼만하고 마찬가지로 친구2를보니 볼만한거같음.. 6점대는 아닌거같음...원작 이라는거에 치여서 그 당시는 그랫지만. 우리나라만큼 ...
10,1편보단  완성도가 떨어지지만 그랴도 볼만은허다 ㅋ 
2,이거 정말 곽경택감독이 만든 영화가 맞나 싶었음ㅠㅠ  OOO기영화임! 
10,난 재미있게 보았습니다. 
1,동생이 다른걸본다는걸 이거보자고.. 동생한테 미안했습니다 
8,솔직히 나쁘지 않은 영화였음 '친구2'란 타이틀을 걸고나왔으니 전작의 임팩트가 너무강해서 실망하는건 어쩔수 없지만 요즘 흥행하는 다른 영화들처럼 이 영화가 '친구2'가아니라 그냥  새로운...
7,영화 좀 맘에 안든다고 1점 주는 OO새끼들이 항상 문제다. 여튼 전체적으로 재미는 있는데 주진모 씬은 아예 빼버리는게 좋았을듯.. 
10,영화가 좀 산만하긴 하지만 그래도 괜찮다 
