score,review
10,좋다 이런감동 오랜만인거 같네요 감독님 감사합니다♥ 연기도 엄청 멋짐 연기자분들도 다멋짐 피카츄 귀여움 유오성♥ 누가 위에엔딩노래 물으시네여 라이크 -돌아갈래 먹먹한데 이노래까지나와서 바로 네이버로 찾아봄 ㅠ 좋음♥...
10,김우빈어쩔꺼야ㅠㅠ 사투리까지멋있네 
10,OO기다린 의문점 뻥뚫린기분  1편느낌 안버리구 느낌아니깐ㅋㅋ 다소 잔인했던거 빼면은 시간가는거모르거 잼게잘봤음 
10,"잼있어요...유오성,김우빈 연기 쩔어요! "
8,조금더 깊은 내용을 담았으면 10점 줬을텐데~~ 
7,간만에 유오성의 카리스마를 볼수있었던... 그래서 좋았던... 김우빈?? 연기 잘하네... 내용은 그닦... 
9,개봉작중에는 최고네요 
5,감독은 무슨생각으로 김우빈 주연으로 꽂았냐 ㅎㅎㅎ 나름 괜찮은 스토리였는데 이걸 무슨 시트콤을 만들어버리네. 영화가 무슨 연영과 기말과제냐 
8,1편이랑 대충 연결해서 보면 8점은 받을 만한데... 너무 기대치가 높아서 평점이 낮게 나온 케이스 같다. 
1,조폭미화 이젠 그만 합시다.. 
1,경상도는 우리나라가 아닌가보네..사투리가 무슨말인지 알아들을수가 없으니..내내 보면서 짜증만.. 
1,이영화 이후로 김우빈 영화는 보지 않게 되어음.. 
1,경상도 사투리에 조폭 양아치나오는 영화는 그만좀 만들어라 친구로 재미보더니 아주 맛들렸나 
1,경상도사투리는 어려워요. 토박이만 씁시다ㅎㅎ 
1,눈물 날뻔했다재미없어서...보지말걸..친구1원 정말좋은 작품인데.. 
10,1편은 안 봐서 연계성 같은 건 전혀 생각 안하고 본 영화. 나름 괜찮았다. 김우빈의 첫 영화 치고 생각보다 연기가 괜찮았다. 노력하는 티가 난다. 김우빈의 데뷔작으로서 의미가 큰 영화. 김우빈씨 멋있음~ 
9,난 너무 잼있었음 ㅎㅎ 세번이나 봤지만 김우빈 하는이유 알꺼같았음 
9,ㅎㅎㅎ이영화보고... 사투리쓰는남자가넘좋아졌다는ㅎㅎ사투리가그렇게멋있을줄몰랐어요ㅎㅎ연기들도넘좋았어요ㅎ 친구1을 안보고봤는데ㅎㅎ큰문제는없더라구요ㅎ뭐이거보고 친구1빌려다봤지만ㅎㅎ 
1,핸폰으로 봐도 이렇게 별로인데... 극장에서 돈주고 본 사람은 진짜 짜증났을 듯... 곽경택씨 친구 이후 계속 망하다 결국 다시 친구 꺼내든 거 같은데 그나마 있던 친구란 작품에도 먹칠을 하시네요... 
1,"유오성과 김우빈을 제외한 모든연기자들 어색하고. 특히 뚱땡이,은기,스님. 은기는 전화할떄마다 입에 댔다가 귀에 댔다가 눈에 거슬리고 사투리 개어색하고. 내용없고 주진모장면 도대체 왜넣은지 모르겠고 친구1은 학창시절추..."
10,재밋던데..유오성연기굿 김우빈도 연기 굿굿 ~~재밋게 본영화 
1,시대가 변했다.. 조폭영화가 언제까지 통할 줄 알았나 
1,"이게 뭥미?? 이 감독분, 다신 영화 만들지 마시길... "
1,감독혼자 추억팔이-가 아니고 왜곡과 미화일뿐 
1,곰플레이어 켜놓고 인터넷 서핑만 했음. 
10,♥♥♥♥짱재밌음김우빈연기도좋고 
10,1편에 대한 한조각.. 전 낮은 평점 반대로 궁금했던 뒷내용으로 이해할수 있어 재밌게 봤습니다 
1,대사를 못알아듣겠어요. 
1,김우빈 마지막대사 못알아들어서 검색까지 하게만들다니-_-;;;이건뭐 김우빈 수트빨만 보다끝나는 영화네 깡패영화좀 그만만들어라 이제좀 
1,김우빈만 빼면 별 10개 김우빈이 영화 다배렸다 
1,쓰레기 영화 진짜 시간이 아깝다 
6,진짜못알아먹는대사 몇개있었음  ㅋㅋ김우빈사투리좀 어색하긴한데 멋지네 1이훨낫네  내용은.... 전기톱존나잔인 
1,완전 전작에 비해 졸망인 영화네요 감동도없고 진한액션도 없고 내용질질끌기만하고 재미도 없고 김우빈없었으면 완전망할뻔한 영화. 스토리도 억지 끼워맞추기 정말 기대이하 시간아까운영화 
2,그냥 쓰레기 조폭영화다 
7,전편을 말아먹은 전형적인 속편 
10,연기도잘하고재밌는데.. 
1,친구1의 명성을 깍아먹는 영화.. 
6,준석이 아버지(주진모)는 부산에서 잘나가는 깡패였다. 그의 아들 준석(유오성)도 깡패가 됐다 그의 친구 동수 살인죄로 깜빵에 들어갔다. 깜빵에 나와서 동수 아들(김우빈)하고 같이 깡패짓을 했다. 영화는 깡패짓으로 시...
10,그래도봐라 사나이라면 
10,배우들이 전달하는 감정들이 몰입을 제대로 할 수 있게 만들어 주었으나 사투리의 어려움도 겪은 건 분명하다. 하지만 여자들에게는 없는 남자들의 우정을 느낄 수 있어서 좋게 본 영화였던 것 같다. 
10,"이 영화 역시 평점이 안 좋아서, 기대를 안하고 봐서 그런지 예상보다 훨씬 재밌었음. 조직과 권력, 인간 군상에 대한 모습을 건달의 세계에서 재현한 영화. 낮은 평점에 대한 반감으로 만점 줍니다. "
10,기대는 컸지만 그래도 그렇게 재미없지도않았음!! 
1,한국 영화 산업 도태시키는 쓰레기 영화 
1,정말  곽경택 감독님...정말 대단하십니다...아니 어떻게 주진모씨를 데려다가  이정도밖에 활용을 못하세요...정말...대체 왜 주진모씨를 포스터에 넣셔는지 그냥 차라리 우정출연이라고 하지...아마 주진모씨도.. 시...
7,주진모 왜나오는거죠?ㅋ 
10,좀..그냥 아쉬운 부분은 너무 많은 내용을 담으려 한것? 
9,뭔가 김우빈만 보인거같아.. 
1,아나 아는분 하고  같이 봤는데  욕 엄청먹음  아진짜 기대했다가 저는 하루종일자고 아는분한테 잼있다고 했는데 욕처먹고 ㅡㅡ 에~~레 
10,연기랑배우들다멋져요 
10,배우들 연기력에 높은 점수를^^ 
10,통쾌하고 즐거운 영화!! 
10,나혼자 이영화볼레 비밀 
9,영화 재미있구만 평점들 아주 OO들을 하세요. 지들이 무슨 전문가라고..ㅋㅋㅋ 
10,재밌어요 왜 재미없다는지 모르겟네 
9,재밌기만 하구만 이런 썩을것들... 평점글 속지들 마삼.. 
10,마지막 장면 친구에 대한 미안함과 애틋함이 좋았다...어쩌면 친구3를 기대하게 한다고 할까! 
7,이 별 일곱개는 모두 유오성에게 주는 별이다. 
10,그래도 평타는 치는 영화다~~ 표값이 안아까움 ㅋ 
5,기대를많이해서그런지  실망도컷던영화인듯 오히려 아버지적 조직이만들어지고 동료들이야기를 스토리있게 만들었다면 더잼있었을듯싶다  그리고 주진모왜  경상도말쓰다가 싸울때전라도말쓰나요?나만그렇게들은거? 
8,다소 일반인 평들이 나쁘긴 하지만 저는 준석과 성훈의 관계에 대해 심층적으로 보았어요. 과거 동수가 살해당한 곳에서의 준석의눈빛 유오성님과 김우빈님의 연기로지루 하지 않았어요 많이들 지적하시는 점중 너무 많은걸 담으...
9,재밌어요 유오성님 정말 멋있구요 김우빈님 앞으로 연기 기대돼요~짱짱맨들♥ 
9,김우빈의연기력이돋보입니다. 대박 
9,재밋다 평점1점3점5점 이건좀아닌거같음 1편보면2편은꼭봐야함 
10,김우빈 연기력 최고다. 
10,사투리알아듣기힘든것도사실이지만 재밌었다진짜 
7,원래 속편은 전편보다는 재미가 없으니까요. 볼때도 그건 감안했고 그래서인지 그냥 그냥 볼만 햇던거 같네요. 
8,"부산 건달 세계의 탄생을 삽입시킴으로써 전체적으로 스토리가 산만한  것은 사실이나, 영화 자체는 긴장감있게 연출한 것은 틀림없습니다. 소재 면에서 한계는 있었지만, 앞선 한국 영화들에 비해 전혀 손색없는 영화입니다...."
10,역시 친구의 매력은 진한 여운 남는거 아니냐며 ㅎㅎ 
9,"친구1을 위한 부록 같은 느낌... 재밌게 봤다. 유오성, 김우빈  멋져부러~ "
9,제가 좀 이상한건가  전  재미있었음^^ 
9,전작에 비해 모자라는 부분도 있었지만 이정도면 훌륭하다고 봅니다^^ 
10,볼만한 영화입니다 유오성은 조폭연기가 갑이구나 하는 느낌적인 느낌 ㅋ 
10,엔딩음악나오는데 짠했다 ㅠㅠ 
10,전작에 남아있던 여운을 이렇게 해소시켜 주다니^^ 
10,개봉하자마자 봣던 친구가 이건 꼭보라고 물건이라고해서 봤는데 김우빈씨 정말 물건이네요 
9,쭉 흥행해서 벌써 200만 넘었다고 하던데 롱런 했으면 좋겠네요 
8,나름재미잇게봤다..유오성 김우빈 너무멋져ㅋㄷ 
8,10여전에 친구을 보고 어제 친구2를 보면서 유오성배우를 통해 세월에 흐름을 느꼈습니다.유오성배우의 깊이 있는 연기와 카르스마를 영화를 통해 보는 순간 왠지 모를 전률이 느껴지네요. 연기 정말 잘하네요~ 
10,오늘 친구랑 보고 왓는데 제밋게 보고 왓어요 
10,ㅈㄴ 재밌다 김우빈 개간지 
10,1보다는 잼 없었지만도 최근영화중에는 꾀 괜찮은 영화 
9,평점이 왜 저모냥인지 이해가 안가지만 ㅜㅜ 저는 너무 만족스럽게 봤습니다 
10,아쉬움이 분명있지만 너무재밌게봤으므로 10점줄래ㅋ 평점첨써보네ㅋ 난이런 남자들의 겉멋물씬한 느낌이 다른어떤 한국영화보다 진하게그려져서 좋다. 부산의느낌과 전작과는다른 세월이묻은준석 캐릭터와 양아치스럽지만 슬픔과 깡이...
10,사실 다들 1편 비해 못하다해서 기대 안하고 봤는데 진짜 1편보다 아쉬운게 사실이지만 어떠한 조폭 누아르 영화보다 나았으면 나았지 부족함 없이 조직의 생태를 담은 영화입니다.. 추천합니다. 
5,그냥저냥 시간때우기로 볼만함~우빈이 영화~~ 
1,하아... 해변씬에서 나잡아봐라~ 니 잡히면 죽이뿐다 조연들.. 보고. 진짜 집에가고 싶었던 영화. 간만에 나온 외출이라 꾹참고 봤음... 감독이 웃기고 싶어하는 욕망이 컷던것 같음. 
10,재미없다해서 기대 안하고 봣는데 재밋고 유오성 김우빈 연기쪄네요 
9,괜찮더라  볼만 하더라~~~ 
2,뭔가 많이 얘기할려고 장황하게 풀어놨는데 제대로 마무리가 않된듯하고 이제 조폭미화 영화는 그만봤으면 함. 
4,기대했던 원작보다 뛰어넘질 못한것 같네요! 내 개인적으로 .. 차라리 2를 찍지말것을 너무 허전하네요~ 
5,결말도 없고.. 과거와 현재를 너무 았다갔다 해서 정신이 없었다.. 
1,왜 만들었을까‥ 나오지 말았어야 할 영화 
3,이거 볼바에 그냥 그래비티 한번 더보세요 .. 
4,친구1을본사람으로써 원작보다 퀄리티 정 말 떨어짐내용도 모르겄고   휴....기대했는데 
1,진짜 재미 없고  넘  폭력적임 
1,걍 쓰레기 영화. 왜 만들었냐 
1,기대이하의 영화입니다 
10,너무 재미있게 봤어요...우빈이 짱~!! 
9,유오성이 하는말 다 의미있는말임ㅋㅋ 그거 이해하면 잼는듯ㅋㅋ 근데 중간중간 뭐라하는지 잘 안들리는 부분도 있긴함ㅋㅋ 돼지같은애 개귀욤ㅋ.ㅋ 
4,내가본 영화중 최악이라 해도 될정도... 
1,곽경택이 감독이가? 치아라 마 
1,감독이 착각을 하는게.  친구의 포인트는 우정이었다. 조폭들의 만행과 액션때문에 관객들에게 사랑받은게 아니라. 밑바닥 인생인 조폭이 된 친구와 평범한 친구간의 우정에 대해 그린 영화가 친구가 아니었나. 2편은 그냥 ...
10,성훈..준석~그들의 서글픔이 이해되는..정이 가는 캐릭터..김우빈~유오성~인상적이었던. 
5,곽 감독님 이제는 그만 친구 우려먹읍시다 친구가 전설이었는데 드라마에 친구2에 더 이상 친구는 전설이 아닙니다 당연히 친구2를 찍으면 300이상은 할테고 이익은 보겠지만 이건 좀 아닌듯 
10,친구1과 비교하는 생각을 버리고 영화자체로만 보면 잘만든 영화임. 
10,난 느와르 좋아해서 그냥 재밌드라  한국 느와르 좋아한다면 충분히 재밌게 볼만하다 생각 
9,친구2 나온다는 소리듣고 기다렸는데 드디어 보게됬네요 출연진들도 빵빵하고ㅋㅋ 
10,기대한 만큼 역시나 싶은 느낌이 든다 곽경택 감독이 신경쓴게 눈에 보이네 
6,기대 안 하고 가면 나름 시간 잘감. 1편만큼의 스릴을 기대한다면 그냥 친구는 1편으로 가슴에 묻어두는게... 
1,친구1의 환상을 가지고 보는 사람이 많은것 같다크게 실망하고 영화비가 아까울거다 
10,배우들의 연기만으로도 충분하다 
10,유오성과 김우빈 두분 다 너무 멋있음! 
10,이 정도면 꽤 훌륭한 영화라는 생각이 든다 
10,처음에 몰랐는데 점점 뒤로 갈수록 재밌었짐ㅋㅋ 
10,옛 생각도 새록새록 나궁 잼나게 봄 ! 
10,솔직히 재밌긴 재밌었다ㅋㅋ 
1,"친구라는 제목이 무색하다... 전편은 제목처럼 친구라는 주제가 있었지만, 이번엔 제목만 친구일뿐, 그냥 단순 조폭영화라는 생각밖에... "
1,친구라는 본편영화에 먹칠을한 돈아까운 b급도 안되는영화 기억나는게 전기톱밖에없네ㅉ 
1,진짜 이걸 돈주고 본 내 자신이 싫다 
1,이건아니잖아..기대는안하고봤지만 참 
1,언제까지 삼류 건달영화가 인기있을거같냐-_- 돈아깝게 이딴 거지같은거 만들지마라. 진짜 이걸 1000원주고 보기도 아깝네 이딴 쓰레기를 만들어. 
10,주진모의 분량이 약간 적어서 아쉽긴 햇지만 유오성 김우빈만으로도 빛난다 
1,완전 별로 마케팅으로 승부보려는데 참 한심하다 
5,친구로 흥한자 친구로 망하다. 
5,밑도끝도없고 지루하고 인제시작인거같은데 끝나버리고 주연배우들연기만좋고 감동도공감도없었음 첨부터끝까지뜬금없는영화임 배우들연기에5점이라도... 
1,1편에 나왔던 유오성 표정 계속 그대로 재현만하고 내용 전개가 안이어진다. 주진모 왜 나오는거냐? ㅠ.ㅠ 예전 두목 일 알아서 머하게? 같은 감독 작품이라고하는데 정말 신기할 따름이다. 
1,하 후속작은 망한다더니 친구2역시나 ㅋㅋㅋ 
7,장동건 아들이 나온다는 스토리에 너무 마니 기대를 하고 봤는대..너무 많은걸 보여주느라 결정적인 무언가가 빠진 느낌 
1,진짜 최악임...길긴 무쟈게 김. 
1,"대부2 짝퉁 김우빈 사투리 빼고 연기 괜찮음, 유오성 여전히 카리스마 있음, 주진모 살로몬! 이제 살로몬!! "
1,어라 평점이 다시 올라가고 있네;;  발악한다 
1,아 돈아깝다 노잼이다.. 
5,전 작에비해 스토리가 매우 약하다 김우빈 연기 참 잘하더라. 
5,중간에 지루해서 잘뻔함. 근데  유오성 김우빈  졸라 멌있음. 
7,곽경택 감독이 가장 잘하는것. 하지만 정통 느와르는 자칫 조폭미화로 받아들여질수 있는 태생적 한계. 
1,아 ~~ 완전 쓰레기 영화.. 올해 최악의 영화였음. 곽경태 감독은 원래 역량없는 감독이라는걸 여실히 보여줌.. 친구는 실화를 바탕으로 해서 우연히 잘 뽑인 영화고 그 뒤 영화들 다 망한 이유를 친구 2에서 제대로 ...
10,여전히 일베들이 날뛰는 현실이 안타까움...친구2보기전에 1보고 갔는데...역시나 진한 향수를 느낄 수 있었던 작품입니다.특히나 2000년초반의 친구를 보여준모습도 신선했구요^^토르 다음으로 꼭 봐야하는 작품입니다....
1,와 왜봤는지모를..ㅋ할말이없네.. 
10,평이 별로라서 별로 기대 안하고 갔는데 엄청 재미있음 중간중간 코믹도 있고 친구1을 재미있게 본 사람은 기대해도 됨 극장에서 보는 거 강추~친구 3도 나와라~ 
8,"1편을 완전히 이해 하시면 좀더 재밌게 보실수 있어요~뼈대있는 조폭이다, 양아치가 아니다, 조직을 배신하고 욕심이 많은 조폭은 처참히 종결된다는 이야기, 1편 도루코가 등장 하여 준석의 오른팔로써 활동해주고 각 중간..."
5,조폭흉내내는 철없는아이가 어른들의 놀이에 흥을 깨버린 영화 억지설정과 주입식 내용으로 관객들을 혼란만 일이킨 영화 왐마 분위기 창출되네~ 
10,잼있어요!!~^^ 많이보세요/// 
3,전체적으로 내용이 기억나지 않네요. 3은 안나왔으면 하는 바람에서 3점드리께요. 
8,너무 기대를 하고봐서 그런지 조금 아쉬운면이 잇으며 혹시 친구3만드려고 마지막부분을 이렇게 만들엇는지... 
7,"7.5점. 1편의 감동에는 비할바 안되지만, 이정도면 친구의 속편으로써 잘만들었다고 본다. "
8,이렇게  욕먹을만한 영화는 아닌거 같은데 두시간 집중해서 봤는데 
1,쓰레기 조폭영화는 이제 그만 찍어라~ 
8,친구 3편 까지는 기대해 본다. 
10,기대 많이 했던 영환데 기대이상으로 넘넘 재밌었어용 
10,"너무 재미있어가 토,일 두번 본 영화.. 김우빈도 유오성도 다 좋았다^^ 친구 2 흥행라~~~^^ "
10,기다린 보람이 있네여~ 
10,김우빈은 갈수록 연기가 느는것 같다ㅎㅎ매력있덩 
10,간만에 볼만한 한국영화 나왔네ㅋㅋ 
10,친구1을 보면서 느꼈던 감동과 여운이 그대로 있네요 
7,주진모를 넣치 말고~ 차라리 전작에 다른 애들관련된 애기를 더 풀어 갓으면 좋았을텐데~그냥 딱 7점대 영화~ 
10,재밌네요 한번 보세요 ㅎㅎ 
10,생각보단  볼만했고   내용이나  연기도  괜찮았습니다...좋아요 
10,재밌는데 .. 왜 평점이 낮은지 모르겠다..ㅋ 1을 조금이라도 이해 했다면 정말 재밌었을 것이다 난 시간 가는줄 몰랐음 
7,"멜랑꼴리한 결말과 통쾌한 액션덕분에 나쁘진 않았다. 헌데 중간중간 나오는 주진모 씬은 멋지긴 했지만 딱히 개연성이 느껴지지 않았고, 대부2를 따라하려 한듯한 느낌도 받았다. 여튼 전작의 후광이 강할 뿐 독립적인 느낌..."
2,제작자의뜻을생각하여별하나는주지만 진짜 뭔말인지하나도못알아먹겠고영화절반은담배태우는거고 절반은짜르고쭈시는영화 
10,시대를 오가는 부분에서 조금은 혼란스럽지만 나름 볼만했고 투탑의 카리스마 또한 대단했다 본작과 비교해서 까는 건 괜찮지만 조폭미화했다고 1점주는 것들은 뭐냐? 
9,첫 장면 조오련과 바다코끼리 추억이 나오는 거 보니... 친구들과의 재회도 나올꺼라고 예상했지만... 아예 없었음.... 단지 김우빈이 동수 아들로 나와서 그 친구들의 우정을 쌓는 모습은 좋았습니다... 그리고 끝이...
8,평점을 대충보니 사람들이 기대하고 봣다가 실망햇단소리가 잇어서일부로 그냥 기대안하고 봣는데 영화보는 눈이 없는지는 몰라도 그냥 시간가는줄모르고봣음 
8,마무리는 친구 3 나올 삘 
10,스토리가 살짝 아쉽지만 연기들 잘하더만.. 
10,친구랑 보고 나서 진짜 재밌었다고 극찬을ㅋㅋ시계 한번 안보고 본 영화는 오랜만이에요 
10,잘만들어진 영화인듯. 보지도 않고 욕하는 사람들이 이상하다 
10,굿 앞편 내용모르고봐도 재밋어요 
10,친구1편에 애매하고 가려졌던 사실들이 친구 2편 보면 다 알게 됩니다. 개인적으로 너무 재밌게 봤습니다 2편 보기전에 1편부터 보고 보세요 꼭!! 
9,좆재밌다.(1편을 꼭보고보시길..) 
10,친구2  짱입니다. 대박 응원 하겠습니다. 
9,"'친구'는 '살인의 추억'과 함께 내 마음속 최고의 한국영화.이 영화, 중후한 분위기와 다시 불러온 감성만으로 만족한다. "
10,아직까지도 많은 사람들이 꼽는 한국 최고의 영화 
10,유오성의 포스는 대박 ㅋㅋ시작부터  포스가 후덜덜 하더니 마지막 까지 포스작렬 
10,김우빈이 장동건의 빈자리를 제대로 채워준듯.. 아 나 남잔데 김우빈한테 반하고 나왔어 ㅡㅡ 
10,여자들이 김우빈 좋아하는지 이해 안갔는데 친구2 보고 확실히 이해했다ㅠㅠ 존멋이잖아 
10,김우빈이 나온대서 별 기대 안했는데 이분 매력이 상당한듯 상하나 탈거같아요 
10,드디어 국민들의 가슴을 시원하게 뻥 뚫어 주시는군요 ㅋㅋㅋ 
10,와 흥행 대박 예감!! 과연 이번엔 몇만 찍을까?? 
10,친구2는 남자끼리 보러 오신분들이 많더라구요 ㅋㅋ 
10,오 ㅐ사람들이 친구2를 이렇게 기다렸는지 알겠더라.. 
10,말이 필요없는 영화가 아닐까 
10,친구2 오랜 기다림 끝에 봤네요 재미를 떠나 무작정 좋아요 
10,우리 아버지가 극장에 티켓 예매 해달라고 한건 처음이다. 
10,올해 마무리는 친구2로 합시다 
10,역시 유오성 형님!! 한국 액션 영화 최고의 배우!! 
10,김우빈 카리스마 쩌는데?ㅋㅋ동수의 아들이 이렇게 멋있다니 ㅋㅋ 그아비에 그자식 ㅋㅋ 
10,나 김우빈 짱팬 된듯..아직도 머리속에 김우빈이 둥둥 떠다녀.. 
10,재밌게잘봤음.유오성카리스마는 여전함.김우빈 연기 죽임. 
10,"너무 재밌게 봄^^  성훈이 연기 대박 반해 버렸음 ~,, ㅋ "
8,별기대않하고봤는데 그래도 기대이상 
10,"오랫만에 명작. 대사도 좋고, 여러가지를 생각하게 하는듯.특히 마지막의 대사  아직도 기억속에. 감독이 정말 고심해서  만든것 같음. 강추!!! "
10,아쉬운 부분은 많지만 오랜만의 정통 느와르!배우들 연기가 영화를 살렸네 
10,연기력 대박 스토리도 너무 재미있어여중간중간 빵빵.터져요 
8,김우빈 기럭지 비쥬얼 감상하다 영화끝남ㅋㅋ액션좋아하는 사람은 꼭 보세요. 코메디 요소도 있고 절대 안지루합니다. 
10,"친구2 영화를 보 기전에는 김우빈의 연기력에 의문점이 있었지만, 괜찮았고 최고의 시나리오로 영화를 구상했다고 평가됨. 전작에 대한 부담감이 켰겠으나 드라마, 느와르 형식의 스토리로 잘 이야기를 풀어나갔다고 봄. 요약..."
9,전 재밌게 잘봤습니다우빈씨 카리스마 쩔어요~^ 
10,2시간 넘는 러닝타임 내내 푹 빠져서 보고 왔네요ㅋㅋ 
8,볼만하던데ㅋㅋ친구1 보다는 가벼운느낌ㅋㅋ 
7,한국의 대부가 되고싶었던 것일까 마치 대부 2와 대부 3을 섞어논 느낌 
10,",전작보단 별로지만 그래도 재미없진 않았음 그래도 최근 나온 한국 영화중엔 최고 "
10,이번에 친구2를 보면서 김우빈을 다시 보게 된듯 
10,배우들의 내면연기까지 돋보였당 
10,재밌네요ㅎ김우빈 연기 좀 창출되네 
10,최고 기대주는 김우빈이 아닐까? 친구에서도 포텐 터지네 
10,영화는 영화일뿐입니다 그저 재밌게 보면 되는듯 
8,전작 대충 스토리만 알고 티비에서 하면 중간중간 보고 2봐서 그런가 크게 전작이랑 비교를 못 하겠지만 조금 버겁게 2시간에 많은걸 채우려고 한게 아쉽.. 하지만 흡입력은 있었던 괜찮은 영화 
9,재밌네요 1편 봤던 기억이 떠오르네요 유오성 멋져요^^ 
9,사투리가 쎄서 못알아듣겠다고 하도 들어서 어쩌나하고 갔는데....나만 기똥차게 다 알아들은건가....ㅋㅋㅋ 재밋다 그냥 아무생각안하고 보니ㅋㅋ 친구1이나 다시 봐야지 
7,나름 재밌게봤다. 아쉬운건 주진모가 왜나왔을까다. 
10,영화끝나고사서 이게 뭐밍...했지만...집에돌아와서도 여운이남는듯..평점이 10까지는아니공7정도지만 평균업↑을위해ㅎㅎ김우빈쨩♡ 
9,영화의 작품성이나 스토리전개는 그냥 노말하지만 그래도 유오성이라는 배우의 몰입도는 친구2를 끌어가기 충분했다. 
10,난 개인적으로 생각지못한 연기력에 깜짝 놀라고 전기톱이란 임펙트에 놀람..재미지게 잘봤습니다 
8,볼만함 유오성연기!!좋음 
10,나는재밌었는데~호불호가가리네요.. 
10,재미없다 재미없다 해서 봤는데 생각보다 재미있네요ㅋ 
9,솔직히 내용 유치한건 다 알고 보잖아.. 근데 진짜 연기력이며 연출은 괜찮았다 
10,골때리네. .. 평점 까내리는알바도하네. .잼있게 본사람인데 . . .약간실망했다면몰라도 1점짜린. 너무한걸.  . .평균8.5이상은된다에 한표! 
10,친구 보고왔다ㅎ김우빈 진짜 개쩐다 ♥♥♥ 
10,좀아쉽다 ㅠㅠ 주진모 분량보단 전작 배우들을 섭외 했는게 좋았을 텐데 
9,1편보다 별로다 재미없다는 말들을 듣고 보러갔지만 전 정말재밌었습니다 친구1에서의 궁금증도 풀렸고 결말도 여운남고 마음에 들었구요 
5,친구2보고나서 느낀점은 친구1을 다시 보고싶은 생각 드는건 나뿐인가??많이 아쉬웠던거같다..그래도 유오성포스만큼은 쏴라있네~~ 
9,다 좋은데 엔딩이 조금아쉽네요 
9,"무엇보다, 사투리가안어색해서좋았고(주진모는 약갸어색했지만..) 잔잔하면서도 몰입이 잘 되는 영화였던것같네요. 솔직히 보러가기전에 네이버댓글보고갔거든요 .. 기대를 안하고봐서 그런지, 저는 9점을 주고싶네요^^ "
