score,review
9,무슨 매력인지 모르겠다근데 매력은 분명히 있다 잊혀질 쯤 이 영화를 다시 보고싶다 
8,
7,"참으로 비겁한 삶이 아닌가. 2,30대 여자들이 좋아할만한 영화. "
8,남주가 너무 착해보여서 여주가 배신할까봐 조마조마했네 
8,"영화는 재미있게 보긴 했는데 결말이 괴상하다고 해야 하나... 연애만 했다면 그저 청춘의 혼란 정도로 생각할 수 있지만, 결혼이란건 약속이고 책임인데 뭐 하는 짓인지... 들통나자 부랴부랴 도망치듯 떠나면서 뭐 갑자..."
8,"이민자 이야기는 흥미로웠지만, 연애 이야기는 별로... 이탈리안 남자 토이와 아이리쉬 짐. 의뭉스런 여주. 뒤끝이 별로임 "
8,여주가 바람핀게너무 화가나면서 감동이 사라짐... 
6,몸이 멀어지면 마음도 멀어진다. 
8,
8,마지막부분 빼면 9점.  한폭의 인생을 담아낸영화 
8,재밌게 보다가 마지막 엔딩은 무엇이죠.... 찝찝한 결말이네ㅋㅋㅋ 다르게 보면 너무 영화스럽게 끝나지 않아서 신선하긴 하네 
9,"결정의이유를 많이들 얘기하는데 , 단순히 못난할매에게 결혼을 들켜서가 아니라 이곳이 나의집이라고 느껴지지않던,새로운곳을 갈망하던,  그 때 를 잠시 잊었던것이다.나의자리 집 사랑 ,그곳은 아일랜드가 아니라는것 "
9,솔직히... 남주 캐릭터 아니였으면 이런 고 평가를 받았을지... 
10,남주 눈빛이 아주 섹시합니다♡ 
10,남주 눈빛이랑 말투 개설레네 진짜 
10,낯선 곳에서의 홀로서기 힘이되어 주는 영화 
8,세상의 모든 이민자들이 반드시 봐야하는 영화 
10,예쁜 블라우스가 사고싶어지는 영화 ㅎㅎ 
10,영화다운 영화 조미료를 가미하지않은 순수 천연의 맛이 느껴지는 영화다.주인공의 감정선과 그 당시의 의상과 풍경을 사실성있게 그려낸 많은 투자가 느껴졌다.색감이 아름다운 인간의 본성이 잔잔하게 그려진 명품 영화다 
8,짧고 풍부한 동화속 던전에서 출발해  익숙한 자연의 빛으로 번져가며 나아간다. 
9,이민과  사랑과 현실을 잘 그렸습니다. 
8,고약한 할머니의 허를 찌르는 팩트폭력에 아맞다 나 유부녀였지 서둘러 짐싸서 토니에게로 돌아가는 게 조금 찜찜하지만 돌아간 건 다행이다. 남자가 기어코 결혼하고나서 여행보낸 게 신의 한수였다고 해야할까... 주인공들 ...
10,남주 여주 넘 좋았네요. 다만 네이버에서 남주 조연이라고 나오는데 보시고 쓰신건지... 
10,네이버 보고 뭐라 할게 아닌거 같은데.. 영화엔딩에도 두번째로 도널 글리슨이 올라옴 
5,There ain't 'pure' beauty coming out of human's mind. 
10,아니 네이버 빨리 안바꾸냐? 영화보고나서 검색해보고 토니가 조연으로 가있는게 너무 어이없다 빨리 우리 남주 토니 주연으로 올려라 인지도 순으로 주연 조연 해놓은거 아니지 
9,착하고 성실한 남자와 똑똑하고 성실한 여자의 사랑이 이루어져 행복한 영화. 최소한 성실하게 살아야겠다... 
8,인생의 한 부분을 담담히 전하는 연기가 좋습니다.^^한 사람을 만나 변하는 모습 또한 굿굿 !! 
7,눈물을 닦고 버티기. 선택에 비난받더라도 참아내기. 하루하루 견뎌내 살기. 
7,부정적으로 본다면 이사가서 딴남자랑 썸타다가 들키니까 도망가듯 떠나는 영화. 긍정적으로 본다면 바뀌는 상황속에서도 진짜 내 사람을 찾아가는 영화.  에일리스는 과연 토니에게 짐과의 일들을  말했을까? 
7,선악과 호오과 너무 쉽게 구별되는 퇴행적인 성장기 
9,모든 배우들의 연기와 대사가 훌륭하다. 과함도 부족함도 없어서 흔한 이야기지만 아주 쉽게 공감할 수 있었다. 재밌게 잘봤습니다. 
8,90년대 초 뉴욕이 꿈의 이주자들로 넘칠 무렵 시대극으로 사랑과 뉴욕을 택한 아가씨의 로맨틱스토리.고향으로 돌아와 뉴욕남을 배신하면 나쁜년이라고 욕할라고 했는데 다행히 욕먹을 짓은 하지 않았다.만약 실제였다면 이야기...
8,잔잔하면서도 일렁거리는 파도가 있는 영화 
8,영상미 하나는 예쁜 영화. 향수병을 겪은 사람이라면 어느정도 공감할 수 있는 감정선이 드러나 있어서 좋았다. 
9,브루클린으로  향하는  두 번의 배-  에일리스의  눈빛이 잊혀지지 않는다. 
7,슬픈 반면에 기쁨이 교차되는 영화. 근데 현실에서는 여자주인공처럼 다시 돌아오는 여자는 절대없음. 
7,"여주인공은 이 모든 일을 경험한 후, 본인도 럭비클럽 멤버들과 같은 속물임을 느꼈을 것이다.  혼자 고고한 척을 벗어나게 된  계기는 누구에게나 올 것이다~ "
9,영화가 색감이 좋네요. 과거 여행하는 거 같기도하고.. 느긋이 보다보니 어느새 영화 끝이고 아쉬웠어요. 
8,"향수병이 걸릴 정도로 그리워했던 고향, 그리고 그곳에서 만난 남자. 어쩌면 사랑이라 착각했을 익숙함을 깨트려준 고약한 켈리에게 고맙다. 단순히 토니와 짐 사이에서 갈등하는 불륜 영화 취급하기엔 영화가 전달하려는 의미..."
9,나와 어울리는 길이 아닌 내가 산택한 그 길을 믿고 나아가길 
8,The movie reminds me when I was there.. 
8,멋진 성장 스토리. 옛날 뉴욕의 모습이 아름답다 
8,스토리는 조금 부족한면이 있었지만 그녀가 나온다는것 만으로도 보고싶은 영화였고 어느정도 만족스러운 영화였다.  젊은 시얼샤는 아름답고 나이가 들어도 멋질것이다. 
7,결혼과 성장이라는 테마가 이민이라는 매개로 극대화되서 표현된 느낌이에요 아일랜드 이민사회를 엿볼 수 있어서 흥미로웠어요~ 
8,흔들린 사랑. 토니 불쌍할 뻔했다. 아닌가 이제부터 불행 시작이려나? 
9,정말 재밌게 본 영화~코니아일랜드도 가고싶네 다시~^^ 
9,간만에 잘 본 영화^^새로운 환경과 선택에  대한 두려움 . 
8,달달한 로맨스 잘 봤습니다~ 
9,간만에 접한 보는 내내 기분 좋은 영화였습니다. 
9,타지 생활을 하다보니 공감 되는게 많았음. 
7,색감이 너무 예쁜 영화. 스토리는 그럭저럭 
9,여주의 옷 하나 소품 하나 너무 맘에 들었다. 근데 언니는 어떻게 그럼 ㅠㅠ 
7,남주 키가... 어깨동무할때 넘 어색하자나~!! 
6,익숙한 안식처가 가지는 유혹을 뿌리치고 자신의 결정에따라 개척해나가는 모습이라고만 하기에는 주변의 상처받는 사람들에 대한 배려가 부족한게 아닐까. 
8,정직하고 섬세하고 현실적으로 쌓아올린 시대의 외침. 
8,"서늘하고 푸른 눈동자가 내게 물었다. 너의 아일랜드는 무엇이고, 브루클린은 어디냐고... "
7,그런대로 괜찮다고 생각하능 1인 
8,누구나 돌아갈 집이 있다 
9,모처럼 익숙하기도 하고 새로운 재즈의 향연 
8,한 여자가 변해가는 과정. 좋은 것 같기도 아닌것 같기도. 
7,"책이 읽어보고 싶어졌다. 잔잔한, 색감이 예쁜. "
9,사람과 생각이 교차되는 브루클린 
7,"공기의 무게까지 느껴지게 하는 연출과 선택의 결연함과 동시에 두려움까지 표현해낸 시얼샤는 역활에 잘 녹아들었다. 그녀의 선택은 스스로의 깊은 고민의 결과였고, 선택하지 않은 것에 대한 희생까지 담담히 감수한 것이다...."
7,귀여웠던 영화...^^ 추천합니다~ 
9,희미하게 다가왔다가 희미하게 사라지기도 하겠죠 
6,잠깐의 방황을 거쳐 자신이 있어야할 곳으로 돌아갔네요. 
9,타이밍의 중요성 짠하고 가슴아픈 
7,시얼샤 로넌.. 누나인줄 알았는데 동생이다. ㅋㅋ 그만큼 연기를 잘했다. 약간 좀 지루한 감이 있다. 만약지금 졸리다면 이 영화를 보면 잠이 올 것이다. 밤에보면 안된다. 
8,로맨스보다는 성장영화 
10,최고다!!! ^^ 또 보고 싶다!! ^^ 
10,너무 재미있었오요 또 보고 싶어요 
10,간만에 다시 찾아보게 만드는 영화였어요 여주의 감정선이 인상적이에요 
4,성장드라마 두개의사란 
9,닉 혼비 작가를 좋아하신다면 더더욱 재밌게 즐길 수 있는 영화.. 1950년대 초반의 순수한 감성과 잔잔한 스토리 전개 너무 맘에 들었어요! 
10,오 꽤 재밌었음 굿굿!굿굿@굿$굿^굿굿 
10,상업영화로도 흥행 가능 
8,"다시 나의 청춘시절로 돌아갔으연 하는 마음이.., "
8,와우...와우...와우! 
8,남주 캐스팅 최고입니다. 
9,마지막 선택이  마음에 든다... 
10,welcome to America 
10,재밌었다 엄마아빠도 좋아하심 
10,최고입니다 정말 보길 잘한거같어요 
10,고국을 떠나 새로운 나라에서 새로운 시작을 할때 그 감정.고국으로 돌아왔지만 나의 집(새로운나라)를 찾게 되는 그 마음.정말 잘 그려주셨네요.. 보는 내내 가슴이 먹먹했습니다. 
10,본지 오래되어서 기억도 안남.. 
10,웃음도 나고 감동도 있는 멋진 영화입니당 
7,두개의 사랑일수 있나요- 처음부터 한개의 사랑인듯 한데. 
7,"초중반까지 정말 재미있었으나, 결말의 개연성은 어디로? 응답하라 1994 의 칠봉이가 생각났다는,,, "
9,연기와 시나리오 모두 완벽한 작품 
10,너무 예쁘고 재미있어요!!!! 
9,향수병을 이길 수 있는건 상사병이다 !맞는말인데 참으로 위험한 병입니다 :) 
10,서정적인 흐름과 50년대 의상이 너무 좋았다 
9,따뜻하고 사랑스러운 영화 
7,열심히 살겠습니다. 다짐하게 만드는 잔잔한 감동이 있는 영화. 
7,아트관에서 겨우 봤네요.. 1940년대? 배경으로 잔잔하게 잘 봤습니다. ^^ 
9,지금까지 본 올해 영화 중 가장 좋았다. 여성으로서 타국에서 당당하게 삶을 개척한 에일리스가 앞으로도 행복하기를 ... 
8,나쁘지는 않습니다. 디테일 면이 조금 아쉬웠지만 큰 메시지는 괜찮았던 것 같아요. 
10,두근두근 설레면 본- 영화 
6,솔직히진짜재미없었다여자주인공의감정도몰입이안되서답답했다 
6,어떤 내용을 말하는건지 잘 모르겠어요 
8,"잠깐 흔들렸지만, 행복한 사람 곁으로. "
10,요근래 본 영화 중 가장 몰입도가 좋았던 작품.영화는 섬세하고 차분하게 하지만 결코 지루하지 않게 감정을 풀어나간다. 감독이 남자였다는 것에 놀랐을 정도로. 
9,몰입도 좋은 영화. 좋은 스토리전개와 배우들의 명품연기. 하지만 조금 아쉬운 엔딩. 토니에게 잘하자 에일리스!! 
8,잔잔하고 아름다운 영화 
9,인생의 선택에 따른 결과가 어떻게 달라질지 생각하게 되는 영화~ 영상미 너무 좋아요 패션보는재미도 굿!! 
10,요사이 극장가에 보기 힘들었던 아름다운 이야기. 잘 읽히는 연애 소설 한 권을 읽은 기분이다. 제인 버킨 소설 속 여인들처럼 주인공은 옳게 행복하고 성취한다. 너무나 기다리던 매력적인 영화였다. 
9,섬세한 감정표현 탄탄한 스토리 좋았습니다 
10,"이민자의고향에대한그리움,가족을두고온다는것에대해감정선을잘그린영화,토니와의첫사랑도아름답게그려냈지만,고향에다시돌아온이후토니와의사랑을져버린것이너무나현실적이어서안타까운영화,그후그녀가어떻게살았을지궁금해지는영화임,,또보고싶네요 "
10,은은한 여운이 있었습니다. 재밌게봤어요 
9,매력적인 남주와 오랫동안 기억에 남을 것 같은 영화주제였습니다..! 
9,가슴이 먹먹해지는 좋은 영화네요~사랑이 있는곳이 고햐임을 되새기게 해준 영화~~^^ 
7,생각보다 지루했지만 공감이 많이 되는 영화였움 
8,성별이 뒤바뀐 친숙하고 귀여운 로맨스 
8,여주인공의 연기가 극전반의 긴장감을 끌고가네요. 별다른 반전은 없지만 화면에서 눈을 땔수가 없었어요.여주인공의 눈빛이 너무 매혹적이에요 
8,"잔잔하고너무과하지않고담백하니좋았다.그리고시얼샤로넌의 연기가훌륭하다.시대에 맞게,배역나이에 맞게,향수병에 걸린연기를아주 잘해냈다.나는향수병에걸려본적은없지만보는내내감정이입이되서눈물을흘렸다.끝이좀미미하게끝나서아쉬었지만연기..."
8,설명적이지 않아 좋았습니다. 
10,타지생활의 외로움과 한 여인의 진정한 홀로서기를 아기자기하고 매력적으로 그려낸 멋진 영화. 복고풍 의상도 너무 이쁘고 만족스러운 문화생활이었습니다. 
10,연기가 좋아요 ㅎㅎㅎㅎ 
8,오랜만에 너무 힐링되는 영화였습니다.. 정말 좋았어요 
10,분위기 색감 다 좋았고 편안하게 볼 수 있는 로맨스영화 
8,여자의 삶에서 겪을 수 있는 모든 세세한 순간들에 대한 포착 
8,사랑스럽고 많은 의미를 주는 영화 
8,여자가 나쁘네..잔잔하게 흘러가다가 바람피는거 보고 집중됨버려진 남자는 불쌍ㅋㅋ당시 시대 분위기나 배경이 잘 재현되긴 했지만 크게 감동적이진 않음 
10,여주의 마음이 흔들리는 장면이 내심 불편하기도 했지만 이해가 가기도 했어요. 제 상황과 비슷해서 공감이 많이 되고 울게 되는 영화였습니다. 
10,재기 넘치고 의외로 달달하고 선택에 대해 생각하게 함 
10,재밋습니다 오랜만에 영화다운 영화네요 
10,영화의 분위기와 색채들이 너무 좋았습니다와닿는 부분도 많아 재미있게봤네요 
8,빈티지패션과 사랑이야기 잼있었어요 딱 내취향 
10,작품성 있는영화에용 굳굳굳굳 
6,"잔잔한 영상미, 보기좋은 영화지만 공감은 되지않음 "
7,색감도 예쁘고 내용도 기대하지않고 봣는데 의외로 좋았다 
10,사랑과 성장에 대한 공감가는 메세지와 넘 매력적인 캐릭터들 
8,서울극장에서 관람하기 좋은 영화. 고전적인 매력 
6,"좋게 생각하면, 좋게 해석되고 담백한데 삐딱하게 생각하면 여주인공의 행동이 한없이 가벼워지는....그런 영화 "
10,이런 좋은영화 보려고 해도 쉽게 볼 수가 없네요롯데시네마랑 씨지브는 대체 무슨 기준으로 영화상영을 결정하는거야? 
7,촘촘히 짜여지거나 흡입력이 대단한 스토리는 아니지만.그야말로 서정적인 흐름. 미숭맹숭한듯... 부드러운 맛이 나는 영화. 여주인공.남주인공 선택이 탁월했음.돈이 아깝지 않았던 기분 좋은 영화.추천합니다 
8,좋은영화여씀~~~ㅎㅎ 
8,로맨스라기보단 여자가 어떤 생물체인지 알게 해주는 영화이다. 여자의 심리묘사가 인상깊었음 
8,나름만족해요 재미있어요~~ 
7,나름 흥미롭고 재미있었습니다. 호흡이 꽤 길어 지루해하는 관객도 있었지만요. 전 괜찮았어요. 배우들 연기도 좋네요. 
10,아무런 정보도없이 씨네큐브에서 하는영화라는 믿음으로 본영화.. 기대를 저바리지 않네요..에일리스의 성장이 나의 성장인거처럼 기분좋아지게  만들어주네요 
8,갈등 끝에 내린 고난의 선택에 박수를 
6,음... 브루클린 엄... 부르클린 
10,"현실적인 사랑이란게 이런거 같아요. 물론 우리 모두는 영원한 사랑을 꿈꾸고,한사람과의 로맨스를 꿈꾸지만. 지구의 모든것은 항상 변하고 움직여요. 그래도 어찌됐건, (꼭빵집아줌마에의해선아니더라도) 나의의지로 사랑을 지..."
9,이 시대 여성을 위한 성장이야기!  모든 면에서 탁월한 작품. 
8,여주 언니가 가장 불쌍...왠지 여주 어머니는 별로 .... 성인이면 자신의 삶은 자신이 책임져야하고 가족들이 붙잡으면 안된다고봄.... 
7,"초,중반 전개는 매우 훌륭하였으나 결론 부분이 좀 허약하게 끝난 것이 아쉬윘음 "
8,"영화의 분위기가 좋았고,  주인공의 감정을 따라가면서 볼 수 있어서 좋았어요 ^^ "
9,그녀에게 적극적으로 다가가는 그를 보면서 나까지도 행복해지는 기분이였다 
10,와.. 굿.!!!!굿굿 
7,영상자체는 이쁘고 아름다웠네요 여성들이 더 좋아할만한 ㅎㅎㅎ 스토리가 살짝 아쉽긴 하지만 잘 봤습니다 ㅎ 
10,기대 안했는데 재미있었다...시빌워보다 낫더라 
5,재미있다.볼만하다. 
10,"상영관을 늘렸으면 좋으련만, 주위에 추천해줬지만..볼데가 별루 없다는...ㅡ.ㅡ;;; 저에게는 올해 최고의 영화가 될듯...다시한번 보게될듯. "
9,결혼이라는 의미를 다시한번 생각해보게 만드는 영화엿어요 
9,토니가 왜 조연이냐구!! 네이버야 
10,"어머니와 방금 관람했는데, 20대 남자인저도 감격한 영화, 대박추천 이구요, 상영수좀 늘려주세요 ㅠㅠ "
10,GOOD!!!  영화의 색채가 너무 아름다워요 
6,다 좋았는데 끝에 깨닫고 돌아가는 결정적 계기가 전체를 엉망으로 만드네요ㅎ 교훈도 아름다움도 순수함도 없는듯. 영상미와 잔잔함만 있는듯.ㅈ 
10,블루클럽 잘봤습니다. 
7,주인공이 그리워했던 Home은 아일랜드가 아니라 언니 로즈가 아니었을까 :) 주인공이 행복했으면 좋겠다 
7,이 영화는 돔놀 글리슨에게 사과해라! 난 돔놀 글리슨 때문에 봤는데 돔놀 글리슨이 몇 분 나왔는지 셀 수 있었다. 하지만 영화 자체는 굉장히 좋았다. 돔놀 적게 나온거 빼고 빡침 ㅜㅜ 
10,최고다 내가 걸어온 혹은 걸어야할 스토리인것 마냥 공감이 되었다 
7,재밌었음색감너무예쁨 
10,선택에 관한 이야기. 닉혼비 극본과 시얼샤 로넌의 연기. 
9,여자의 마음은 갈대... 
10,근래에 보기드문 좋은영화였어요스토리도 탄탄하고여주인공연기가 압권이었죠 
8,"오랜만에 포근한 느낌의 사랑 영화를 봐서 너무 좋았다. 시얼샤 로넌의 연기 훌륭함. 고향을 떠나는 심정, 다시 떠나는 이유, 다시 만나서 사랑을 시작하는 장면이 참 인상적이었음. "
10,마음이 따뜻해지고 좋은인연을 만나고싶어지는 영화네요 주인공의 의상도 색감이 너무예쁩니다 
8,좋은영화입니다.공감할만한 이야기 
8,잔잔하면서도 잘 만들어진 영화. 인구의 반이 이민을 떠났다던 아일랜드의 한 여인이 이국에서의 낯섦과 외로움을 극복하고 자신의 정체성을 찾아가는 과정을  요란하지 않으면서도 잘 그려놓았다. 
10,한번쯤 겪게되는 갈등. 주인공의 선택은... 
6,시얼샤 로넌의 훌륭한 연기 
8,브룩클린에 아일랜드 사람이 왜 많은지 궁금해집니다 
8,자신의 인생을 만들어가는 여성의 아름다운 영화 
10,뭐 하나 빠지는 거 없던 영화. 또 볼 것 
10,정말 좋게 봤어요 연기도 과장되지않고 이해될수밖에 없는 스토리 !!! 
8,"로맨스 영화인 줄 알았는데 다 보고 나니 도전과 진취를 향해 성장해나가는 모습이 아름다웠다.(그 시대배경을 생각하면 저정도면 매우 독립적이고 자립심강한 여성상이 아닐까) 영화 속 옛날 미국의 풍광, 그 복고적인 색감..."
10,보는내내 입가를 떠나지 않는 웃음..이유없이 흐르는 눈물..결혼하면서 잃어버렸던 제꿈에 대해 다시한번 생각하게 하는 영화였습니다. 
10,"마지막 대사가 영화 한편의 긴 이야기를 정리해주는 것 같아 엔딩크레딧이 올라가는 동안 눈감고 느꼈네요.  원더풀한 색감의 옷들, 나올 때마다 다른 느낌으로 예쁜 아일랜드와 브루클린의 비치컷, 긴 듯하지만 탄탄히 전개..."
10,최근 본 영화 중에 최고!꼭보세요 
9,"아카데미 3개부문 노미네이트될만하다..영상,음악,각본까지 모두 훌륭하다~ "
8,여러가지 생각도 해보고 남녀 같이 관람하시기 좋은 영화입니다 
10,정말 좋았어요. 영상과 색감도 정말 예뻐요. 
8,에일리스의 반짝이는 눈동자가 생각난다. 자신을 믿는 사람이 갖을 수 있는 눈빛이다. 사랑하는 사람이 있고 꿈을 갖고 희망을 만들 수 있는 곳이 고향이라는 생각도 했다. 도널 그리스가 짧게 나와서 아쉬웠지만 에모리 코...
9,잔잔하지만 2시간이 지루하지않고 깊이 빠져서 봤습니다..약간 실망스런 결말인 듯 하지만현실적인 결론이라 공감이되는 부분입니다 
7,잔잔하고 소소한 재미가 있는 영화. 
9,영상미가 넘 좋은영화영화좋았어요 
9,"언니가 넘나 예쁘더란ㅋ 변화하는 주인공의 모습과 달라졌다고 느꼈지만 그대로였던 home, 그리고 새로운 home "
8,"왜 하필 브루클린, 그리고 왜 하필 50년대 였을까? 생각했지만, 그런건 별 의미가 없는 것 같다. 세상으로 뛰어드는 과정에 있다면 누구나 공감 할 수 있을 거 같다! "
9,좋았습니다 코엑스  아늑하고 좋네요! 
8,결말은 해피엔딩인가? 
10,오늘보러간다기다려라 
8,김새론  분위기나는  여주...예전에 영화 한나에서 충격적이면서 신비스러운 비쥬얼때문에 잊지못했던  소녀가  이분이었네요.  러블리본즈에서도 나왔었네요. 팬이될것같아요  여주와 남주의  몰입도높은 연기에 박수보내고싶...
10,"감독의 연출, 배우들 연기! 아주 훌륭한 영화! "
10,"마음 한켠이 그냥 너무 먹먹하다. 예뻐서 더 먹먹했고, 먹먹해서 더 아름다웠던 영화.. "
7,2시간이 언제 지나갔는지도 모를만큼 자연스러운 흐름. 낯선 곳에서 새로운 삶을 시작하고자 하는 사람이라면 에일리스의 모습으로부터 격려와 용기를 얻을 수 있을 것이다. '사랑'이라는 주제에 생각했던 것보...
9,담백하고예쁜영화예요 
10,"너무 공감되고마치 영화가 아니라 그냥 친구 이야기, 내 이야기 같아서드라마틱한 장면이나 연출이 없이도계속 집중되고 재미있게 봤다. "
8,나의 힘들었던 타지역 생활들을 구해준건 사랑이었다. 그 시간들을 위로받고 공감받을 수 있는 영화 브루클린 
8,영상이뿜 브리티쉬이뿜 여주눈동자넘나이뿜 
10,아니 주연 조연이 바뀐거같은데 네이버야? 
8,현실적 너무나 현실적이어서 생각이 많아진다 
7,유학경험이 있거나 이민가서 살고 있다면 더 공감할 스토리. 좋았어요 
8,영상미는 여전히 예쁘다 
8,"먼 나라 이민자의 삶이지만, 우리들이 삶의 모습...그리움과 다르지 않았다. "
10,"디테일한 구성이 좋았고, 여주인공 의상은 정말 취향저격이었다!!^^ "
9,"형식과 내용의 조화, 게다가 결말부 내레이션은 최고! "
9,영상미와 배우들위 연기가 좋았습니다. 
8,남주선정이 탁월했다. 
7,누구에게나 있었을 알에서 깨고 나오는 순간들... 
10,엄마와 함께 봤는데 좋아하셨어요. 마음이 따뜻해지는 영화! 
9,"1950-60년대 뉴욕에 존재했던 여성들은 자기를 정성스럽게 가꿀 줄 알았다. 살을 째고 지방과 뼈를 옮기는 대신 풍만한 몸을 돋보이게 하는노란 원피스, 빨간 힐과 빨간 입술, 정갈하게 올린 머리가 정말 아름다웠다...."
8,좋은영화... 단지 아쉬운건 내 앞자리 어떤 아저씨가 상체 세우고 봐서 그 아저씨 머리때문에 자막이 잘 안보였다는것.. 자막 제대로 보구 감상했으면 더 감명깊었을 영화. 
8,멜로라기보다는 성장영화. 
7,"보기는 좋으나, 무슨 이야기를 하려는지는 잘 모르겠음 "
8,토니가 참 귀엽더군요....같은 백인인데도 저러니.. 
9,잔잔한 로맨스영화 극적인 큰 긴장감은 없었지만 그래도 너무 좋았습니다. 
10,토니 남동생 너무 귀엽다 ㅋ 
8,1950년대 여성의 잔잔한 성장영화 
10,잔잔하다. 큰 갈등없는 결말이 행복한 영화~ 
8,성장과 사랑이야기. 위트있으면서도 진심이 담긴 감동을 주는 영화 
10,여주인공에서 완전히 몰입해서 보는 영화 
7,그 입장 충분히 이해할수 있을거같아요.. 
9,오랜만에 만난 이쁜 영화... 씨빌워보다 낫다... 여운이 많이 남는 영화 
10,"너무 사랑스러운 소설과 같은 영화.♡꼭 소녀가 아니라더라도, 모든 인간이 독립하는 과정을 풀어낸 스토리가 아닐까싶다. 다양한 색감의 예쁜 의상들도 보는 재미가 쏠쏠 "
8,"여주인공이 자신의 정체성, 인생, 결국은 사랑을 깨닫는 순간이 인상적이었다. 조금 방황하긴 했지반 그녀는 역시 sensible했다! "
7,뉴욕은 많이 나오진 않지만 뉴욕응 많이 생각나게하네요. 
8,"재밌게 잘 봤습니다 많은 해석이 가능한 영화라서, 이곳저곳 비어있는 곳마다 많은 생각이 들게 했습니다. 착한 영화로 기분이 좋아졌습니다 :) "
8,유쾌하게 봤오요. 뭔가 진정성있는. 
7,잔잔한 로맨스가 인상깊은 영화! 
10,영상 좋구요 ~ 배우 연기는 물론 영화에 몰입하여 주인공의 상황에서 100%공감하며 함께 고민하게 되었습니다. 여운이 많이 남았어요 ~~^^ 추천~~ 
