score,review
8,내 인생의 어떤 한 시기를 그대로 카피앤페이스트 한 것 같았다.... 아니 근데 이탈리안 이민자 가정 출신의 액센트에 너무나 스윗한 말투까지 완벽 소화한 토니가 왜 조연이라고 네이버는 주장하는 것일까? 
9,"""잊고 있었네요. 이 마을이 어떤지 잊고 있었어요."" 에일리스가 다시 돌아간 고향에서 혼자 남겨진 어머니, 자신을 필요로하는 사람들로부터 마음의 갈피를 못 잡을때 떠나온 이유를 알 수 있게 해준 마녀할..."
10,토니가 너무 사랑스러워ㅠㅠ 
9,남주 선정이 탁월했다. 
7,새로운도전 두고온것에대한 향수를 참 아름답게 그렸는데 돌아가자마자 새 사랑에 빠지고 점포주인한테 협박당해서 바로 돌아가는게 너무 이상했음..자기마음을 몰라서 편지도 못쓰던 애가 너결혼했지?이 추궁에 갑자기 남편이랑 ...
10,확실히 결말이 좀 이상함. 갑자기 새로운 남자한테 넘어갔다가 결혼한거 들통나니까 줏대있는 여성인양 나는 누구의 부인이다. 내 이름을 똑바로 들어라 그러면서 떠나다니 
9,"인생이란 변화와 성장의 연속. 그것을 힘있게 지속시키고, 중심을 잡아주는 건 인생에서 내가 오롯이 소유할 수 있는 단 한사람과의 만남이다. "
8,이래서 동창회는 안 된다 하는구나 
10,인생영화등극...남주가어쩜그렇게스윗하고잘생겼는지    그미소가잊혀지지않음     여자들은이영화보고나면백퍼남주한테푹빠짐       그리고진짜후회안할정도로영화정말재밌음! 
10,왜 네이버엔 주연이 돔놀 글리슨인겨..그것땜에 영화보면서 조마조마ㅠㅠ 
7,에일리스의 home은 로즈였다가 토니가 된게 아닐까? 아일랜드였다가 브루클린이 된 게 아니라- 
8,언듯보면 기회주의자 같이 보이는 면도 없지않아 있지만 같은 여자로 현실이라생각하면 이해가는 면도 있다.하지만 만약에 고향에 결혼 사실이 전해지지 않았다면 에일리스는 어떤 선택을 하였을까..어쨌든 돌아갈 남편의 품이 ...
9,인생은 선택의 연속. 마지막 엔딩은 왜이리 마음이 찡하던지. 
9,여주인공의 선택이 아쉬웠다 하지만공감은간다 선택의 결정적인 원인이 타인에의한것이라는게 아쉽다 
8,결혼했으면 반지는 꼭 끼고다니자 
10,왜 전에 있던 댓글들이 사라졌는.. 의문. 상영관좀 늘려주세요. 오늘 개봉인데 볼 수 잇는곳 없네요 -_- 죄다 거지같은 한국ㅇ영화만 
2,점빵 아줌마 아니었다면 그냥 눌러앉았을거자나. 결국 들통날까봐 다시 돌아간거 아냐. 대체 어떤점이 아름다운 영화고 성장영화라는것인지 잘 이해가 안됨. 영상미는 조금 받쳐주지만 '불륜에 빠졌다가 들통날까봐 돌아...
10,참 보면서 눈물이 많이 났습니다. 이러려고 본 영화는 아닌데 ㅜㅜ 인생에는 정답이 없지요 선택은 자신이 하는 것이고 모든것에는 양가감정이란것이 생길 수 밖에 없고 어느 한쪽을 참고 감내해야하는 것은 우리모두의 굴레인...
10,집 떠나서 서울와서 살고 있는데 매우 공감되는 영화였네요 근데 왜 제 인생에는 저런 사랑이 없는지 큽.. 
3,흔들렸던 여주의 상황은 충분히 이해되나 결정하게 된 계기가 매우 찝찝하고 보고 난 이후에도 여운이 남는 게 아니라 불편한 마음이 남아서 괜찮을 뻔 한 영화가 나에게는 망작이 되었음 
8,좋은 영화입니다. 그리고 사랑에 대해 솔직한 영화라고 생각해요. 마음은 늘 흔들리죠. 마지막에 미국생활과 인생에 대한 주인공의 독백이 너무 좋았어요. 
9,"여자주인공은 두 남자사이에서 갈등한게 아니라, 안정적인 생활과 내가 원하지만 도전적인 생활 사이에서 고민한 거라고 생각함... 지극히 현실적이고 이해 가능한 상황임... 어떤 평점처럼 이제 에일리시의 고향이 로즈에서..."
10,두 사랑 사이에 갈등하는 여자 이야기로만 본다면 이 영화는 0점이 될 수 있다. '집'이라 여길 수 있는 요소들을 여주인공이 스스로 찾아내고 선택하고 포기하는 모든 과정이 영화에 고스란히 녹아있다. 
9,타국을 고향으로 만들어버리는 포근함을 주는 남자라면 당연히 돌아가야지. 그 결정이 고마웠고 벅찼다. 누군가는 불륜이라 할 수 있겠지만 배에서 만난 폭풍우처럼 살면서 그런 흔들림 한 번 없이 살아갈 사람이 누가 있을까...
10,완전히 다른 곳에서 자신의 삶을 꿋꿋하게  살아낸다는 사실이 얼마나 아름다운지. 시얼샤 로넌은 특유의 신비로운 눈으로 낯선 도시가 '내 집' 이 되는 과정을 표현해낸다. 
10,"모든 사람들이 살아가면서 제2의 고향이 생기기 마련일 것입니다. 고향과 제2의 고향, 그 사이에서 선택하고, 포기해야하는 것들. 담담하고 자연스러운 스토리가 참 좋았습니다. "
5,몸이 멀어지면 마음도 멀어진다는걸 뚜렷이 보여준영화.. 바람필때 지인한테 들켰다면 원래남친에게 빠르게 돌아가야한다는걸 보여준 영화.. 
10,색감이 좋은 영화. 공감도 되고 여자같은 경우는 가디건 쇼핑하고 싶어진다... 
9,영화 중간중간 괜시리 불쑥 눈물이 나는 그런 영화. 가끔 우리의 인생은 마치 사랑이 전부인 것만 같다. 
7,착한 아이리쉬 처녀가 더이상 예쁘지 않게 되는 과정. 
9,"어느덧 남아있는 것은 성장한 자신. 어느 순간 태양은 뜰 것이다. 과거엔 없었던 새로운 사람과 함께.., "
7,굳이 짐이 나왔어야 했나.. 끝이 너무 안 좋군 
8,흔들리지 않고 피는 꽃이 어디 있으랴 
10,여자주인공의 눈빛이 너무 좋았습니다.그리고 꼭 초록 코트를 이번 해에는 사야겠어요 ㅎㅎ 
9,영상도 아름답고 내용도 깔끔했다. 다만 중반 이후 주인공의 감정선을 더 자세히 그려줬더라면 하는 아쉬움이 있다. 
8,조용하게 주인공의 인생을 따라가며 감상할수 있어서 몰입도가 큰것 같았어요. 중가중간 위트감도 있고 진실한 사랑을 찾아가는 과정이 좋았어요. 
9,과거의 나의 생활과 전혀 관련없는 사람과 만난다는것 
8,"예쁜 색감의 옷들과 시원한 배경, 오만과 편견이 떠오르는  우아한 대사들. 재미있었다. 아일랜드 할아버지가 노래 부르는 장면에서 가사가 무슨 말인지는 알 수 없었으나 정지용의 향수가 떠올라 조금 코끝이 찡해졌다. "
10,오늘. 한국 개봉 하루 뒤. 아일랜드 출장 갔다가 귀국하는 비행기 안에서 봤다. 도착하고보니 아직 영화가 30분 남았는데 전개상 하이라이트 부분이라서 귀국하자마자 CGV예매했다. 8시까지 어케 기다리지... 
10,딱 내스타일!! 두번봐도 좋을것같아요~ 
10,섬세하고 아름다운 멜로드라마. 집 떠난 이들이라면 모두 공감할 수 있는 성장 스토리까지 완벽! 아... 정말 인생영화입니다ㅠ_ㅠ 
10,고향을 떠난 사람들을 향한 따뜻한 응원의 메세지같은 영화. Home is home이라는 대사가 지니는 역설. 
7,시간이 공간에 차곡차곡 쌓이면 그것은 home... 
9,토니가 왜 조연이고 짐이 주연인가요?이것이 반전...! 
7,"아주 인상적이거나 참신하진 않지만 만듦새가 샤워할때 딱 맞는 온도처럼 뜨겁지도 차갑지도 않게 적당하다. 그러나, 주인공이 가장 중요한 결정에 이르게되는 과정이 조금 이해가 되질 않는다. 너무 이기적이라는 생각이랄까...."
10,"이걸 연애물로만 보면 조금 이상할것같고, 때론 힘들어하고 흔들리기도 하는 지극히 평범한 주인공을 통해 집을떠나온 사람들에게 당신의 삶이 있고 살아가야할곳이 바로 고향이다 라는 메세지를 주는것같다 "
1,고향에 와서 바람피다가 재수없게 아는 아줌마한테 들켜서 급빡치더니 다시 미국으로 돌아가는 이상한 내용 
10,에모리코헨(토니)의 사랑스러운 눈빛이 시얼샤로넌(에일리스)를 생기를 불어넣은 꽃으로 만들어준 것 같다! 토니가 주인공 
1,잠만 안잤지 마음까지 다주고 들키니까 줄행랑 
8,"브루클린에서 그녀의 성장과 그걸 가능케한 토니몇해 전 나와 내 남자친구 같다다만 고향,어머니,익숙한 것들에 대한 유혹과 흔들림을굳이 고향 남자애가 없이 표현할 순 없었을까 아쉬움근데 영화니까 뭐..토니 쨔응 "
3,여주가 바람피다 걸리니깐 튀는영화.나름 재미는있는데 여주가 쓰레기. 
1,이제 네이버평점 못믿겠네 예전엔 믿을만했는데.. 이거 진짜 별로임 내용 이것저것 다 합쳐놈 감독이 말하고자하는걸 모르겠음 남자를 배신하지말라는건지? 바람을 펴보라는건지? 고향을 떠나라는건지?  급 사랑에 급 떠나고 ...
5,"불륜영화가 아름답다니, 중반까진 정말 좋았지만 중반 이후로는 스토리에 대한 의문과 막장드라마와 다를게 없는데...물론 영화 전반에 깔린 영상미나 색감, 그 당시의 분위기는 잘 살려냈다고 생각하는데.... 어느 스토리..."
5,영상의 완성도나 느낌은 참 좋으나 영화 중반 부턴 사랑에 대한 믿음과 신뢰를 져버리고 또다른 삶을 꿈꾸는 모습은 아름다움이라는 단어와 거리가 멀어보인다. 아무것도 모르는 토니만 불쌍할뿐 
3,"밉상 아줌마 아니었으면 배신으로 끝날, 캐나다 특유의 막돼먹은 스토리, 막장드라마. 로맨스 영화라기보단, 주인공의 굉장히 주관적인 스토리를 풀어가는 시대극이 맞는 듯. "
10,주인공의 연기가 너무 좋다 
1,뭐 이런 영화가 다있지;;여자들 바람피는 과정을 미화한 영화네;;여주 남친 있는 상태에서 사정상 잠시 롱디 했는데 롱디하는 동안 여주는 다른 남자한테 흔들리고ㅉㅉ..결국 원래 남친한테 돌아가긴 했지만 고향에 있을 때...
9,"진짜 그지같은 시간이탈자 상영관 수좀 줄이고 이런것좀 늘여라.... 적당한 푸쉬만있으면 어느정도 흥행할 수 있는 잘만든 작품을...헤유,, "
8,시골 처녀 자아 생장 그라마. 
9,흔들리는 마음을 바로잡아 주는 것은 언제나 다른 사람 
4,바람을 잠깐의 흔들림이라고 합리화시키는영화... 최악이다.  결혼한거들켜서 다시 미국으로 돌아간건가..? 토니랑 짐은 무슨죄...; 이러지도 저러지도 못하는 주인공이 문제 ㅡㅡ 
10,"있어야 할 곳 은, 진정한 행복을 느끼게 해주는 곳 , 이라고 생각된 영화. 잔잔하면서 기분좋아지는 영화였다 "
8,집에가기전에 결혼을 하지 말았어야. 
1,아무리 생각해도 여주 나쁜년.. 그 아줌마 아니었으면 영국남자랑 사살앗을듯. 그 영국남자한테 너무 잔인하잖아 진작에 말했어야지 
8,이민자들의 인간관계 교과서라 할만함. 여주인공의 선택에 대해선 억지스러운 면이 있다고 봄. 성급한 결혼식과 빵짐 마녀의 독설만 아니었다면  아이랜드에 어머니를 모시고 안정적으로 사는게 더 행복한 선택이 아니었을까?....
7,그냥 다 지나갈거야. 죽진 않아 
8,인생은 선택으로 인해 만들어 가는 것 같다. 나 같으면 현실에 안주하는 면이 강해 고향에 머물어 좀 더 편안한 삶을 선택할것같은데. 여주는 도전적이고 적극적으로 자기 삶을 개척하려는 모습이  강한것같다. 
3,좋았다가 후반부에 여주 왜 저려냐.. 갑자기 암 캐릭터로 전환 
1,왜 이렇게 평점이 높은지 궁금할 뿐입니다. 
9,고향에서는예나지금이나자기자신이아니라남들의보이지않는시선이나요구에떠밀리듯선택이이루어졌다면브루클린에서는사랑도일도모두자기자신의선택에의한거였다는걸마지막에서야깨달은것같아요.익숙한환경에서안정감을느끼면흔들릴수있죠. 
1,진짜 평점 개거품이네뭐 이딴 영화를 미화하는지 
9,영화는 그런 이야기를 하고싶었던 것이아닐까. 애써 현실에서 벗어났지만 달콤한 현실에 안주하고 싶기도 하고 미래를 개척해서 나만의 홈을 만들어하고 싶어하는 인간의 욕구. 어쩌면 이런 인간의 불완전한 욕구를 여주에 초점...
7,네이버에서 남주주연과 조연을 바꾼것같다 나오는 비중과 역할을 감안해도 후반부에 나오는 사람이 주연일 순 없다 
10,별기대안하고 봤는데 연기를 잘해서 지루하지않게 보고왔어요 남자주인공 매력 있어요 
7,마지막에 켈리여사가  그녀의 결혼에 대해 언급하지 않았다면 어떻게 됐을까. 불쾌하다 불쾌해... 
7,잘 흘러가다가 방귀뀐 놈이 성냄 
8,"푸대접받던 고향, 그리고 돌아온 고향의 환대. 그 대조를 얼떨떨하게 받아들이던 주인공이 다시 깨닫게 되는 사실은 좋게 변한 것은 고향이 아니라 나 자신 하나라는 것. 고생도 하며 성장의 맛도 함께 본 미국이 더 고향..."
9,"영상 색감이랑 분위기, 여배우의 목소리와 발음,  얼굴 표정. 그런 것들이 전부 어우러져서 이야기가 억지스럽게 다가오지 않았던 것 같다. 어찌보면 뻔한 이야기지만 보고 나면 이런 저런 생각 할 거리들이 많아진다. 특..."
2,최악의 애정결핍 합리화 영화. 
8,우리는 가끔 나를 너무 잘 아는 사람보다 나에 대해 아무것도 모르는 사람을 더 편안하게 생각하곤 한다.그리움을 느끼는가? 그럼 왜 떠나왔는지 생각해보아야 한다.그곳의 무엇이 나를 떠나게했는지...나를 진정으로 사랑해...
5,감독이 하려는 말이 뭔지...앞부분은 전형적인 캔디로맨스인가했는데 중반이후로 변해버린 여주와 남에게 등떠밀려 첫남자에게 돌아 가는 상황은 공감이 잘안된다 
8,고향을 떠나 새로운 인생을 만들어가는 에일리스의 이야기가 흥미로웠다. 새로운 환경에 적응하고 새로운 사람을 만나 사랑에 빠지고 현실적인 거리에 직면하게 되었을 때 갈등까지.. 한번 떠난 자리는 돌아보지말것 ! 
10,심야에 나 포함 총5명 봤지만 인생영화 등극. 집에오는길에 차안에서 영화장면생각하다가 눈물이 다 났음ㅠ 이 영화 놓쳤으면 어쩔뻔ㅠ 
8,어떻게 살 것인가를 고민하게 하는 영화 
1,주인공이 남자였다면.. 여자들은 모두 이영화에 1점을 줬을거다. 
6,평점에 속았다. 별 내용도 없고.. 잔잔한 영화를 좋아하는 나이지만 이건 별 영화적 가치가 없다. 
2,"아 초 중반까지 눈물찔끔흘리면서 진짜 잼있게 보고있었는데; 자기 마음도 갈피를 못잡아서 남편한테 편지도 못쓰고, 새로운남자에 흔들렸던애가, 가게주인의 협박아닌 협박에 갑작스레 남편을 사랑하고, 눈물뚝뚝흘린다는게 너무..."
9,배신 때리는 거 아닐까 하고 혼자 마음 졸이면서 봄.... 
10,"에일리스의 연기가 영화를 정말 잘 이끌었고, 아일랜드풍의 음악이 감정을 극대화시켜준 느낌이 들었습니다. 색감도 정말 좋았네요. 굳이 아쉬운 점을 고르자면 결말이 조금 설득력이 부족했던 것 같지만 전체적으로 좋았습니다..."
8,되도록 빨리 벗어나고 싶기도하고...지독한(?) 향수병에 힘들어지기도하고...후회없는 선택을 하기전 발목을 잡는 것도 많고고향에 남겨진 사람들의 심정도...소중한이들을 자주 볼 수 없다는...현실도 참 많이 공감이 ...
10,나는 운명적이 사랑이 있다는 것을 이 영화를 보고 다시 한번 확신했다...  영화의 모든 것이 디테일하다 인생영화!! 
10,"모두를 만족시킬 수도 없고, 다 가질 수도 없다. 어디서나 펼쳐질 수 있는 잔잔한 사랑 이야기. 당신과 나 우리가 했던 선택, 떠나온 곳, 놓쳐야 했던 놓아줘야했던 좋고 아픈 기억에 관한 이야기. "
10,할망구가 말 안했으면 여주는 어떤 선택을 했을지 궁금 처음에 짐이랑 꽁냥꽁냥 하는거 보고 나쁜년 이랬는데 여유있고 시월드도 없고 엄마랑도 가깝게 볼수 있는 조건이 나까지 갈등하게 만들더군 뭐 그나저나 남주는 키가 좀...
10,디테일하면서 아름다웠다 
1,언니가 죽어서 돌아온 고향 땅에서 바람이나 피고ㅉㅉ 저여잔 뉴옥에서 결혼생활 하다가 잠깐 친정에 들러도 바람 날것같네 금사빠 를 미화한 이상한 스토리의 병맛 영화 
5,네이버 줄거리가 내용의 전부네 그냥 버러지같은 여주랑 불쌍한 토니 
3,평론가평점을 절대 신뢰하면 안된다는 예를 보여주는 최고의 영화. 진부한 구성에 어디 하나 감정이입할 데 없는 대사처리...그리고 어이없는 마무리까지..미국판 국제시장이다. 
10,이 영화를 단순히 로맨스 영화로 단정짓는다는 것이 안타깝다. 주인공 에일리스가 사랑을 찾아 가기 이전에 나아갈 힘을 찾는 과정을 더 깊이 그린 영화인데. 너무 설렜고 우뚝 설 수 있게된 에일리스가 부러워지는 영화. 
8,날 웃게 하는 이가 있고 날 성장하게 하는 곳이 바로 내 삶의 터전이다. 
10,잔잔하고 좋았어요 50년대를 배경으로해서 배우들의 스타일과 당시 삶을 볼 수 있어서 재밌었고 배경도 좋아요! 
8,누군가에겐 이해안가는 나쁜x이야기일수도 있지만 언젠가 집을 떠나 본 사람은 공감할 이야기. 
9,"여자 주인공의 마음을 이해했다가, 백 번 천 번 이해했다가-그러다 어느 순간 내 처지와 비교 해 보고, 나를 대입하면서 보다가- 갑자기 미친건가 싶을 정도로 이해하지 못했다가-이 부분은 모두가 알 거라 믿는다- 결국..."
3,높은 평점에 속았습니다. 
4,소신없이 남에게 끌려다니고 기회만생기면 한눈파는 여자로 사는게 왜 뉴요커하고 비교를할까? 
10,에일리스를 이민자로 바로 서고 여자로 만든건 토니였다. 그가 아니었다면 타국에서의 고국에 대한 향수를 감당하기 힘들었을 것이다. 사랑의 힘은 위대하다. 에일리스의 흔들리는 마음은 이해하지만 결말은 그랬어야 했다. 사...
9,"미국으로 이민간 아일랜드 여자의 현실적인 이민 체험기. 향수병이 나고 과로워하던 모습이 옛날 기억이 떠오르게 만들었다. 어디든 내가 사랑하는 사람들이 있는 곳, 그 곳이 '집'에 아닐까. "
7,개연성 없고 뜬금없는 스토리 전개와 결말에도 불구하고..에일리스는 아름다웠고.. 타향 생활의 외로움을 조금은 위로받는 느낌이었음 
7,그냥 뭐 갈대같은 여자의 마음? 그걸 상쇄할 만큼 재밌는 것도 아니고 
6,다좋은데 결말이 왜이래 ;; 여주는 마지막에 왜 저렇게 떳떳해 ㅡㅡ행동보니 밉상아줌마가 아니었으면 계속 속였을듯... 
3,주인공이 남자였으면 불륜 바람둥이 영화라는 평이 대부분이었을것을.. 주인공이 여자에 영상미까지 예쁘니까 그냥 성장기이자 흔들림이라고 평가하네.. ㅋㅋㅋ 
8,irish bitch의 참신한 향연 
10,"여자의 결정을 단순히 협박과 들통에 의한 것으로 치부한다면 영화의 본질을 전혀 이해하지 못한 것. 늘 의지하고 동경하던 언니의 잔재와 누구보다 공감될 어머니의 외로움, 그리고 '고향'이라는 것이 주는 ..."
9,참 고풍스럽다. 오즈 야스지로 영화의 정서가 느껴진다. 그립도록 사무치지만 떠나 보내야 할 것들. 
10,"너무 좋았던 영화여주인공의 새로운 도전, 낯선곳에서의 외로움, 고향에 대한 향수 그리고 선택이 우리들 누군가의 삶과 같을 수 있기에 더욱 공감이 되었던 영화특히 남자 주인공 토니의 순수한 사랑이 아름다웠던 영화 "
6,"결말에서 여주가 ""이 마을이 어떤 곳이었는지를 잊고 있었어요.""했을 때 그 대사가 마음에 확 와 닿을 정도로 마을에 대한 묘사가 충분치 않았던 점이 한없이 아쉽다. 그랬다면 영화에 대한 호응이 훨씬 높..."
5,휴...일단 평쓸려니 한숨나오는데.. 스윗한 남주 힘들때 기쁠때 옆에 있어준 사람 새사람 만나니 좋다고 넘어갈뻔하다니..떠나기전 남자가 결혼 밀어붙이지 않았어봐..결말은 아마 영화계의 막장ㅋㅋ 이 새벽에 찝찝한 짜증...
4,너무 기대했는데 주인공이 전혀 이해되지 않아서 공감할 수 없었네요 
8,"시얼샤의 목소리가 차분애서 듣기 좋고,,그 시대 배경,,음악,,의상이 눈길을 끌어서 좋았다..토니가 여주인공의 심리변화를 많이 이끌어가는데... 조연으로 나와서 당황,,,,이름을 기억해둘만한 배우가 확실하다..사랑에..."
9,결혼한거 안걸렷으면..아일랜드에서 엄마랑 행복하게 살수도 있었을까요? 혼자남은 어머니가 걱정됩니다.ㅜㅜ 
9,인간의 삶이란 얼마나 불완전하고 흔들리는지. 그 속에서 내리는 결정과 선택들에 이끌려 걸어가고 살아가는게 인생이구나 싶었다. 주인공의 반짝이는 눈빛이 기억에 남는다. 내가 떠나온곳과 살아갈곳을 반추하게 만드는 영화....
9,잔잔하지만 깊은영화. 여자주인공의 깊은 연기력이 시간가는 줄 모르고 깊게 빠져들게  만들었다. 여러가지 감정들을 섬세하게 표현한 장면들이 눈시울을 붉어지게 해준다.  여주 시얼샤 로넌과 남주 에모리코헨의 매력을 마음...
9,"보는 장면마다 예쁘고 사랑스럽고, 영화이고 옛날을 배경으로 했지만 지금 살아가는 삶고ㅏ 비슷하다고 느끼는 영화. 서울로 올라와 직장을 잡고 새로운 사람을 만나고 , 그러다가 고향에 가면 그리웠던 고향에 발목잡히고. ..."
9,"현재의 나까지 오는데 많은 선택의 순간이 있었고, 그것을 선택한 것에 대해 후회하지 않는다. "
7,"아일랜드 판 서울 이곳은. 나도 지금 외롭구나, 새삼 깨달아서 보는 내내 추웠다. "
10,남녀라면 누구나 경험하고 회상할법한 아련한 이야기. 시대와 국적을 가리지 않는다 
10,"평범한 위인, 선택이 사람의 본질을 좌우한다는 배움.. 몰입도, 배우, 내용 다 훌륭 "
9,이민자의 이야기가 아니라 따뜻하고 유쾌한 사람 사는 이야기. 
5,영화 후반부 여주인공의 행동이 보기 불편했던 영화. 아일랜드로 다시 돌아가기까지는 그냥저냥 볼만했다. 
2,심심 지루 주제의식 결여 
7,향수병보다 강한 것이 사랑일지니 
1,고향에 대한 향수로 근사하게 포장한 이중혼 결혼사기 미수사건 
10,완벽한웰메이드.몰입감완벽.섬세한연기력과 주인공캐스팅최고. 
8,그러던 어느 날 태양이 뜰거에요.바로 알아차리지 못 할 수도 있어요.그렇게 희미하게 다가와요.당신의 과거와 아무 관련도 없는누군가를만나게 될거에요.오로지 당신만의 사람을... 
7,"슬픈 진실, 자신을 포장하지마라. 진실한 사랑이었을지 의문 "
9,"여주가 이해가 안갈듯, 갔던 영화.. 여주의 성장과정에서 마음에서 일어날 수 있는 갈등을 잘 그려낸것 같다. 근데 왜 남자주연 배우가 왜 저분으로 등록됨...?ㅋㅋㅋㅋ 조연아님??  조연과 주연이 뒤바뀐것 같은데....."
7,"전체적으로는 분명히 좋은데, 아일랜드로 돌아와서 부터 심리적 갈등을 조금만 더 손봤다던가 다른방법으로 표현했다면 더 좋았겠다는 생각이 들었음 "
7,그리움은 판단을 흐려지게도 하는법 
10,잔잔하고 예쁜 순정 1950 년대 아일랜드와 미국의 정서가 지금 현재에도 낯설지 않았어요 예쁜영화 꼭 다시보고싶습니다 
8,누구나 삶에도 드라마가 존재한다. 
7,돌아갈 곳을 잊지 말아야하는 포인트를 잊지말아야할 듯 
7,"영화의 색감이나 분위기는 무척 좋았는데, 급 결말이 맺어지는 부분에선 고개가 저어졌음. 그저 그런 영화. "
9,"두 장면에서 조금 이해안가는 곳이 있긴했었지만, 외국생활도 했었고, 지금은 외국인 아내를 맞이하고 있는 상황에서 뭔가 공감가는 부분도 있고, 감동도 애잔함도 있습니다. 주연배우도 매력적이고 무엇보다 배우들 연기가 좋..."
10,"러블리 토니와 러블리 에일리스, 변화하는 시대의 흐름속에서 어떻게 살아가야 할지 고민하게 되는 영화. 시간은 지나고 어떤 식으로든 삶은 살아진다. 모두의 행복을 위하여! "
8,"행복하게 자신을 지킬 수 있는 곳, 정답이 있을까. 여운이 깊게 남는 영화! "
8,"잘 성장해준 시얼사 로넌, 어렸을 때 당차고 예뻤던 모습 그대로..지금 사는 곳이 당신의 집이다. 영국 아카데미 작품상의 위엄. "
