score,review
8,나는 개인적으로 전개도좋았고 결말도 나쁘지않았는데 
9,나름  괜찮은 스릴러  집에서 보기 괜찮음 p.i.s  사랑한다 
10,콜린퍼스와 니콜키드먼 둘다 연기잘하고 몸 케미도 넘 좋음. 둘이 영화 또 같이 하면 좋겠다. 
10,볼만하네요. 시작부터 스릴감 넘치는 영화.... 진짜 사랑이 뭔지에 대해 고민해볼만 합니다 
7,2014년 당시에는 신선했었던 반전인 듯. 
9,오우 반전 !!!! 아무튼 해피엔딩 
10,벤 너무 범죄자스러워서 다른 공범인가 계속 의심하고 봄~너무 재밌게 손에 땀을 쥐고 봤네요~ 정말 강추합니다 꼭 보세요^^ 
8,여전히 아름다운 니콜. 생각보다 좋았던 반전. 아무리 반전영화 많이 봤지만 예상치못햇네 이럴땐 머리 나쁜게 도움되는구나 ㅋㅋ 
8,재밌어요! 캐스팅 지적하시는 분들이 많은데 개인적으로는 배역에 맞는 마스크들로 잘 뽑았다고 생각 ㅋㅋㅋ 
6,그럭저럭 팝콘영화...끝으로 갈수록 소재가 아쉽다.. 
6,이런 장르는 반전이 가장 중요한데 나름 괜찮은 것 같아요. 현실적으로 생각했을 때 스토리상 빈틈이 있긴 하나 치명적인 정도는 아니고. 그냥 볼 만하다 정도의 스릴러 영화네요. 
7,불륜남의 끝없는 집착...반전의 반전이 있었다면... 
8,소름끼치는 플롯과 반전으로 관객을 흡입하는 스릴러. 
10,배우들 연기 진짜 개대박 
10,재밌당ㅋㅋㅋㅋ너무몰입하고봤음 
8,기억상실증은 무서운 병이다 그리고 생각보다 무서워서 중간에 못봄..헤헤 친구가 벤 얼굴은 기억하냐 한 거 진짜 그거 밖에 기억 안나고 무서워 죽겠다.. 
8,신선한 전개예요기억상실증에 따른 생각지못한 반전 재밌어요 
8,평레기들은 잼있는 영화 깎아내리는 맛에 밥 쳐먹고 사는 애들임. 다리미의 절묘한 등장에 잠깐 웃었음 
6,엄청 재밌게 보고있었는데 갑자기 허무하게 끝남.... 
8,초중반 스릴이 쩔었다... ㄷ ㄷ ㄷ 결말이 아쉽긴 하지만 니콜 키드먼은 매우 예뻤다 
10,해리형님이 범죄자라니 
6,전체적으로 다 시시했다. 나이 든 니콜키드먼 연기는 좋다. 
6,흥미는있으나 내용은 최악이다ㅋ 정직하게살아라 
1,스토리가 더럽게 재미없네.. 
10,진실에 가까워 질수록 이야기는 전개 된다 
10,콜린퍼스...무섭...ㅎㄷㄷ. 내용도 긴장감 있어서 좋았음 
8,니콜키드먼. 항상 볼만하다 
10,너무 재밌게 봤음. 평점 더 올라도 될 듯. 마지막에 벤이 캐스팅 미스이긴 함 
5,"소중한 것들을 떠올리기, 바람피우지 않기 "
8,어느정도 예상은 되었지만 몰입도가 좋았음 
7,스릴있음. 볼만하고 연기가 좋다 
10, 90분동안 다른생각 안하게 되는 영화네요~ 
8,1시간까지는 미스테리요소. 지루할수 있음. 1시간이후부터 스릴반전시작. 기억력이란 요소를 이용해 부분부분 정보를 제공하는 영화. 짜임새도 괜찮고 7~8점사이가 적당하다고 생각됩니다. 흥미위주의 영화는 아니지만 잔잔한...
7,"긴장감과 스릴도 있고 반전도 나름 괜찮으나, 극초반 보여줬던 팽팽한 긴장감이 극후반에 가서 너무 쉽게 풀어져버린 느낌. "
5,"메멘토가 떠오르는 기억상실과 기록의 기제는 초반부 반짝 참신함을 보여준다. 그러나 후반부 턱없이 부족한 뒷심, 어설픈 전개, 낮은 완성도는 최고의 배우를 셋이나 쓰고도 실패하게 되는 감독의 연출력 한계를 여실히 드러..."
6,잔잔하고 뻔히 예상되는 스토리가 아쉽다. 
10,굉장히 스릴 넘치게 잘 봤어요! 배우들의 연기도 완벽했어요. 우리의 인생도 심겨지는 생각에 따라 크게 달라질 수 있음을 시사하는 것 같네요. 
10,꽤 괜찮은 잔잔한 심리스릴러. 
8,아주 잔잔하게 이어지는 심리 스릴러에서 막판에 반전이 훅 치고들어왔는데!!!!  마지막 신파에서 별하나 뺍니다. 
5,가면 갈수록 엉성해지며 예상가능해지네. 
5,평점이 생각보다 좋네  내스타일은아님...그냥저냥.. 
4,이런 류가 워낙 많다보니 중간중간 단서들에서 가능한 모든 상상과 가정을 해본다. 그리고 빗나가지 않는다. 
8,괜찮은 반전영화 소재도 신선하고 스릴도 있네요. 
9,무료로 봤는데 잘봤어요ㅎ 심심할때 보세요^^ 
9,신선한반전!!집중해서봣어요재밋네요~~ 
10,몰입도좋고 재미도잇음 
8,으슬으슬하고 무섭네요. 마지막에 멜로로 빠지는게 아쉽지만.. 
9,결론은 바람피지맙시다 인생 더럽게 꼬일수 있습니당. 
9,재밌다 근데 막판에 조금 엉성 
5,소재는 좋았으나 결말흐지부지 
6,조금 더 세세하게 만들고 결말을 조금 더 신경 썻더라면 아쉬운영화. 
10,재밌네요 반전도 있고 스토리구성도 좋았어요 
6,"몰입할 수 밖에 없는 구조를 가지고 있지만, 조나단 모스토우의 브레이크 다운, 로만 폴란스키의 실종자등, 여러 유명 영화의 짜깁기 기운이 강하고, 끝맺음이 좀 허탈하네요 "
5,예상가능한 전개에 반전도 너무 뻔했다 그래서 결론이 바람피지말자 이거냐? 
6,좋은 배우들 가지고 영화를 너무 못살렸네요~ 감독 문제인듯 
8,결말이 아쉬웠지만 나름 전개가 괜찮게 잘 짜여졋고 몰입도 있게 잘 보았다 
10,반전이 있네요! 막바지에는 공포영화 같았어요.. 보면서 소름 돋았네요. 진짜 베스트댓글처럼 진짜 벤이 악당같이 생긴거ㅋㅋㅋ 
6,Before I Go to Sleep 
7,콜린 퍼스를 보며 나를 보았다. 
1,평점깍기 에이 재미없어~~~ 
9,"기억을 잃은 여자, 기억을 찾아주려는 두 남자, 내가 누구인지 알아야 한다 "
10,몰입도 좋고 상당히 재미있어요. 
10,스릴러 반전 영화를 찾으보는 사람입니다. 우연히 발견한 영화였고 평점이 7점이 넘는것을 확인후 그냥 바로봤습니다. 반전이 뭘까 계속 생각하며 보았고 여자의 기억을 같이 찾기위해 몰입하며 봤는데 전 오랜만에 기억에 남...
8,잘 만들어진 스릴러물~ 
10,재밌게 봤음 쫄깃쫄깃~~ 
7,니콜이  잘못했네~~~ 
8,그렇저렇 볼만해여. 진짜 반전은 마지막 진짜 남편이 등장할 때임.... 
10,"스토리, 연출력, 연기력 모두 흥한다 "
7,그놈의 기억가지고 장난하는영화는 더이상 궁금하지않다 
10,가나다라마바사아자차카 
5,병주고 약주는 놈과의 허무한 사랑의 시작과 끝. 중반부까지만 해도 전개가 어떻게 될지 궁금했으나 급전개와 함께 허술해지고 허무해지는 후반부가 영.. 
10,너무너무너무너무 재밋어요!!!이런 느낌의 영화나를 찾아줘 이후로 느껴서 너무 좋았습니다. 
7,흥미 진진 긴장을 놓을수 없다. 
9,더비지트에 비하면 걸작이군. 이정도면 훌륭하지. 
10,막장을 좋아해서긍가 난재밌구만 반전두괘않고 
9,보는내내 미치는줄... 소오름... 
7,배우들 연기 좋고 연출 좋은데 결말이 정리안된채 급하게 끝나는 느낌... 
9,의사놈에게 뭔가 있다 하고 봤는데 의외네요 결말 부분은 용역 업체가 만들었나 봅니다 
5,딱 중반까지만이다. 이후에는 대충 어떻게 된건지 다 드러나고 마지막은 너무 쉽게 허무하게 해결되는게 아쉽다. 
8,콜린 퍼스의 또 다른 모습..기억을 잃은 니콜 키드먼의 연기가 매우 인상적이었다. 
8,니콜 키드먼 콜린 퍼스 마크 스트롱 이 셋의 연기가 정말 끝내주는 작품 중 하나라고 생각함. 다만 아쉬운 점이 있다면 조금 더 스릴 있게 마지막까지 쭉 조여줬으면 좋았을텐데 하는 점...스릴러 맛은 나는데  긴장감이...
10,긴장감 있고 짱잼이여요!!>< 
8,"오, 콜린 퍼스의 악당 변신! 좋아요! "
10,재미있고  몰입도 좋았어요근데 마지막에 뭔가 허무맹랑.... ㅠㅠ벤이 나쁜건지 크리스틴이 나쁜건지결국 둘다 나쁜거? ㅋㅋ ㅋㅋ 
9,"하루하루 주인공 잠에서 일어날때마다 반전이 일어나 잼있게 봤다, "
4,기대를 너무 많이했다. 
9,재밌어요 시간 가는줄모름! 
6,반전이 마음에 안들지만 전체적으로 신선해서 볼만함 
7,뻔한 전개지만 전반적으로 무난하다... 
8,킹스맨 남자들... 니콜키드먼은 그대로 이쁘다 
5,그냥 막장 드라마. 니콜 아줌마 연기 맘에 안듬. 불륜의 끝은??? 
9,기대안하고 보면 나름 감동적임 
6,간통죄 폐지로 뒤숭숭 하건만 불륜녀 소재라니... 그래도 해피엔딩이고만 
10,너무 휼륭한 스릴러였음 반전도 내가 예상하지못했던것같아서 신선한것같았음 
9,한국영화는 왜 이렇게 만들지 못 할까? 신선하고 잼있었다.. 
8,"기억을 되찾아 간다는 소재 자체는 신선하지 않았지만 반전의 요소가 돋보였고, 연출도 스릴러라는 장르적 색깔을 잘 살렸다. 후반에 급히 전개되는  성긴 스토리텔링이 아쉽다만 니콜키드먼의 연기로 커버한다. 콜린퍼스의  ..."
8,괜찮네야 ㅋㅋㅋ 재밌게 잘봤음 
9,간만에 심장이 쫄깃한 영화 
9,마지막이 좀 아쉽네요. 그런데 킹스맨 보고 봤더니 집중이 안됩니다. ㅠㅠ 
8,콜린 퍼스의 연기가 소름 돋았어요 
6,중반까지 정말 흥미 진진하고 좋았다. 하지만 후반에는 좀 실망스럽게 마무리 
7,긴장감. 반전이 있던영화. 
5,개인적으로론 별점이 맞는것 같으면서도 좀더 내려갔어도괜찮을듯하다 
10,퍼즐 조각이 하나 하나씩 맞춰 나가지는 느낌 수작 
10,"발리에서 오는 비행기에서 봤는데, 그럭저럭 킬링카임으론 제격 "
8,"8점이상 주는 영화는 볼만하단뜻이죠 몰입감, 스토리, 연기 모두 다 괜찮네요 볼만합니다 ㅎ "
8,큰반전도없었고뻔하디뻔하게끝났지만지루하지않고몰입도가높았음 
8,요즘은 너무 자극적인 것들만 찾으려고 함.. 가끔 이렇게 잔잔한(?) 영화도 괜찮은 듯.. 근데 굳이 청불일 것까진 없지 않나.. 
6,스토리가 재미있어지다가 중간이후부터 맥빠진다.스릴러로 아쉽다. 
7,그냥저냥 akdljhaldvbnlk 
7,재밌음. 반전도 있고. 
5,자극적인 조미료만 첨가한 끔찍한 맛 
8,"이건 숨기는 스릴러니, 절대 리뷰를 보지 말고 영화를 볼 것ㅎ 함정을 많이 파 놨네 ㅎㅎ "
7,기대한거에 비하면 실망스러움 임팩트가 없네 
7,"우연히 영화 프로에서 나온거 보고 재밌어보여서 봤는데, 나온 내용이 전부임 ㅠㅠ 그래도 볼만했음. 끝이 좀 허무하긴 함. 니콜키드먼 이쁨! "
6,일주일간 프렌드!!! 
8,무난하게 볼만합니다 괜찮은 스릴러 
6,"메OO사를 마이크라고 해놔서 결과에 그것과 관련된 얘기도 나올 줄 알았는데 좀 마지막이 허무하게 끝나지 않았나 싶네요, 그런 부분들을 한번 더 비꽈서 내용을 만들었으면 더 뒷통수 때리는 반전 영화가 될 수 있었을 거..."
7,많은 분들 지적대로 후반부가 좀 아쉽지만그래도 재밌게 봤습니다.관객으로 하여금 등장인물들을 불신하게 만들어서 몰입도를 높이네요. 
8,중요한 기억을 잃는다는건 그사람의 인간으로서의 존엄성을 보장할수 없는 무척이나 위험한 일일수도 있다 
8,엔딩도 좋은데요... 재밌음~ 
9,"반전도있고, 볼만했어요~! "
6,중반부터의 몰입감은 수준급 
6,진짜 쇼킹한 반전 영화를 만들고 싶었으면 콜린 퍼스를 선택하기 전에 한 번 더 생각 했어야 했다.. 
10,불꽃남자님 무개념 스포일러네요. 
10,누가 추천해서 봤는데 의외로 괜찮다 
9,꽤 스릴넘쳤음...반전도 있고 볼만함 
6,"분명 배우들의 연기는 좋은데, 뭔가 모르게 식상하다는 생각.. "
10,좋습니다. 재미있네요. 
8,끝이조금아쉽지만 재밋엇음 
7,그냥 평범;; 난 또 뭐 대단한 일인줄 ㅇ.ㅇ 
7,I remember Adam! 무슨말이 더 필요할까? 
9,오랜만에 재밌는 스릴러 여주인공 연기짱 그외에도결말이 해피엔딩 조금 지루하지만 재밌는영화 
7,특이한 것은 없는 무난한 스릴러와 밝은 종결 
7,메멘토랑 여러 영화가 합쳐진것 같지만 긴장감있었고 반전도 괜찮았다 
6,"지인의 추천으로 큰 반전이 있다고해서 보게되었는데, 내가 기대했던 큰 반전이란것은 없었다. 그냥 약간의 반전이 가미된 평범한 영화같은 느낌. 10년전에 나왔으면 좀더 좋은 평가를 받는 영화가 됐을수도.. "
8,흥미로운 소재. 예상치 못한 반전. 
9,난 좋았음ㅎㅎㅎㅎ 결말도좋고 재밌던데 나름 반전영화 
9,"매일 리셋되는데 누구는 믿고 누구는 안믿는다는 설정 -1, 반전 잘 예측 못하는 나도 쉽게 예측해서 -1, 친구의 연락 두절 원인에 좀 더 그럴싸한 이유를 붙이면 좋지 않았을까 생각해서 -1, 그럼에도 불구하고 몰입..."
5,소재를 갖고 놀다가 보기 좋게 초쳐버림... 
9,초중반은 완전 흥미진지....끝이 뭔가~ㅜㅜ 아쉽네요~ 
7,나름 괜찮은 반전 하지만 역시나 마무리가.. 
7,첫키스만 50번째 이후의 이야기인듯. 중반부부터는 결말이 예상이 되어서 긴장감이 좀 떨어졌지만 나름 잘 만든 스릴러. 
7,니콜이는 이쁜데 내용은 갈수록 .. 
5,초반 몰입도 좋았는데 아쉽네... 
6,기억상실은 매적적이면서도 흔한소재라 탄탄하면서 생각지도 못한 반전의 카타르시스가 있어야 하는데.... 진부함. 그래도 니콜의 연기로 겨우 망작은 면함 
7,난크리스틴루카스40세기억상실증환자야오늘밤잠들고나면모든기억이사라지고오늘일들도잊게될꺼야그리고내일아침에도오늘처럼일어나서내가20대라고생각하게될꺼야그리고앞으로는다신누구에게도내인생을뺏끼지않겠어 
8,"지루하지 않고,,,, 몰입도 8점 이상 "
8,개인적으로 좋아하는 소재와 줄거리이기에 꽤 몰입해서 봤음. 개인적으로 배우 콜린 퍼스와 마크 스트롱에 대해 가지고 있는 이미지 혹은 편견이 이 영화를 더 재미있게 만들어 줬음. 나쁘지 않은 스릴러. 니콜 키드먼과 스...
5,좀 식상한... 이랬다 저랬다 왔다 갔다 하는 느낌... 범인을 빌미로 관객을 놀리는 것 같다는 생각이... 
5,임팩트가 부족 좀 루즈하네요 
5,"기억상실, 불륜 등을 소재로 한 91년작 가면의 정사에 메멘토의 요소를 짜깁기해서 다운그레이드 버전으로 내놓은 작품.  이 정도 원작이 베스트셀러라고?  OMG "
7,괜찮은 소재인데 짜임새가 부족한듯. 좀 엉성하다고 할까.니콜도 많이 늙었구나 ㅡㅜ 
10,재밌음.... 근데 어떻게 된게 베댓이 스포냐 ㅡ.ㅡ 
8,좀 엉성한데 그냥저냥 볼만함. 진짜 벤이 더 악당같다는 아래 댓글에 공감ㅋㅋ 
9,심장쫄깃!! 바람피면 인생종침. 남편은정말 캐스팅미스 
7,예고편보고 너무 보고 싶었는데 막상보니 그닥였음 
6,니콜키드먼 좋아해서 팬심으로 본영화.초반부터 관객들로 하여금 몰입하고 추리하게 만들어 중후반까지 흥미진진하게 이끌다 마지막에 아쉬운.. 
7,니콜키드먼 누님 재미있게봄 
6,마무리가 너무 허접하네 .... 
7,"그냥 저냥 볼만했던 스릴러, 니콜 키드먼 존예-_- "
10,잼남반전이 끝내줌바람핀 남자는 무서움 
7,결말이 전개할 때의 긴장감을 클라이막스로 이끌지 못하고 김빠지는 편. 
7,"영화는 치밀하지 못하다. 유행하는 반전도 예상되고, 생각보다 , 긴장감을 주지는 못했다. 킬링타임용 "
9,싱거운 후반부를 제외하곤 흠잡을 데가 없는 명품 스릴러. 
9,"스릴 만점, 마무리가 약간 2프로 부족한것 같기도 하지만, 해피엔딩이라 마음에들고... 정말 완전 몰입해서 봄 "
9,어떻게 니콜 키그먼은 이런 소재의 영화를 잘할까?디 아더스의 신선했던 충격이 다시 느껴진다. 
5,나름  반전 있는 영화..무난하다.. 
8,나름 볼만한 영화네요~ ㅎ 
5,재미가....없네예 앞부분~중간까지는 긴장감있고 좋았는데 뒷심이약함 
3,원작소설을 읽기 전에 영화를 봤으면 7점정도 됐으려나 
8,"몰입도 좋은 스릴러니콜키드먼과 콜린퍼스 두 명배우의 연기 포함, 리들리스콧 제작인데 안 볼 수 없었다.보고 나니, 이런게 스릴러더라..근데 마지막에 벤의 눈빛이 좀 미심쩍음.연기인건지 진짜 미스캐스팅인건지..거슬림...."
8,간만에 재밌게 본 스릴러.  기승전결이 매우 좋고 배우들의 연기도 좋았다.  니콜 키드먼은 나이가 들었지만 여전히 매력적... 
7,나름 재밌지만 뭔가 2% 부족한 스릴러. 
9,새로운소재고 보는 내내지루하지않았어요끝은...좋왔어요!재밌어요~~~~ 
6,반복되는 일상과 서서히 기억의 조각을 찾는 영화 치고 결말이 한방에 싱겁게 끝나버린다. 
5,내가 잠들기 전에 본 영화 
8,"보고싶었던 영화라서 기대하고 봤는데, 결말을 알고 봤어도 영화가 관객으로 하여금 끊임없이 의심하게 만들었다내가 네 남편으로 보이니ㅠ 인듯 결말에 소름 ㅠㅠ스릴러 안좋아하지만 기대한만큼 괜찮았다 "
8,인과응보 .    궁굼증을 계속 유발하며 잘끌고간다 볼만한 스릴러. 
9,보는내내 기장감도 좋고 나름반전도있고 스릴러로써는 재밌는영화 
8,오랜만에 반전영화  잼있게 잘봤어요~ 
7,니콜키드먼 연기 쩐다. 의외의 반전 있는 영화. 시간 아깝지 않게 봤다. 
9,불꽃남자(kj55****)  왜 스포 올리냐 진짜 짜증난다 이런넘 
6,출연배우 소개에 스포가 있네..ㅋ 
6,긴장탄다~~긴장탄다.. 어 뭐여?? 끝이야?? 이런 젠장.. 
10,아....오래랜만에 숨죽이면서봣다 ㅋㅋㅋ 
5,딱 5점 수준이다   그냥그래 
8,시작 전개는 신선해보였음 주인공외 박사 가짜남편 클레어 까지는 좋았으나 결말이 너무 허무함 한마디로 허무개그임^^  보는과정은 나쁘지않음 니콜의 아름다움이 단점을 가리는. 영화임 
10,완전 재밋고 책으로도 보고싶네요 
8,개인적으로 나를 찾아줘 보다 낳은 거같음 하지만 초 중반은 엄청 몰입감으로 결말이 기대되었는데 결말이 너무 허무하게 끝나는 경향이 있네욥;; 
8,뻔하지만 괜찮은 몰입감. 니콜키드먼은 여전히 너무 이쁨... 
6,너무 뻔한 반전... 중간보다 알겠더라 그래도 6점주는건 여전히 이쁘신 니콜키드먼 누님때문.. 
10,재밌어요 시간가는줄모르고 봤어요 
5,그나마 짧은 러닝타임이 중간 중간 지루해지는 것을 막은 듯하다.. 반전은 별로 놀랍지 않았고 결말이 허무하다 
7,댓글보고 큰기대는 금물. 유주얼서스펙트나 식스센스정도의 반전을 기대하면 큰코다침. 어느정도 후반부엔 예상가능한 반전이었고 예전에 주연을 맡았던 디 아더스가 좀더 나은듯함. 
4,소설의 긴장감과 미스터리를 너무 못살렸다. 특히 마지막 모텔씬의 긴장감을 이렇게 허무하게 대충찍다니..게다가 콜린퍼슨연기중 가장 최악이다. 배역과 너무 안 어울린다. 소설과 같이 니콜을 48세로 하고 깨어날때마다 늙...
7,뭐가 있겠지 하면서 궁금증을 가지고 끝까지 봤더니 뭐가 없었다.. 
10,그러니까 불륜을 왜해 벌받는거야. 
6,"글쎄...쉰 다되가지만 저 아직 피부,몸매 잘 관리중이에요~ 그냥 니콜키드먼을 위한 영화로 느껴짐.... "
10,재밌었다. 이런분위기 영화를  봐서 좋다 
6,"억지로 끼워 붙인다고 아름다운 모성애가 완성 되는가,,,? "
10,여자가 벌받았다고 생각했음 
6,조금은 아쉬운 걍 시간때우기.. 
7,메멘토가 연상되는 소재에 사건의 비밀과 범인의 정체가 밝혀지는 과정이 허무하고 미리 예상 가능했던 반전인지라 생각보다 허를 찔리진 않았다. 하지만 니콜 키드먼의 녹슬지 않은 연기가 빛을 발한 건 분명하다. 
8,벤 반전인줄알았음.. 
10,정말 흥미진진 합니다. 재밌네요 ~ 
5,원작도 평이한 느낌인지라 영화도 그닥... 
7,뭐래.. 초중반에 엄청난 지루함에 보다가 마지막에 살짝 흥하나 싶더니 허무하게 끝났고만... 
6,솔직히 니콜키드먼때문에 보긴했느네..;;나쁘진 않았지만 그닥 좋지만은 않았다..; 
8,볼만하네ㅋㅋㅋ열자열자 
7,이런류의 영화가 너무 많아서 충격적인 반전은 아니었다. 마지막이 좀 허무하게 끝나는 느낌? 킬링용영화로는 추천~~ ^^; 
8,반전 예상못했음 그것만으로 몰입이잘된거같아요 
9,니콜키드먼 믿고 보는 영화. 굳. 
10,아이고 의미없다...보슬아치의 최후 두배우의 연기는 역시 봐줄만한 기자평점 간만에 동감 
7,비슷한영화를 어디선가본것같은데... 암튼 짧은 런닝타임에 권선징악! 
9,"니콜 키드먼.. 이쁘네요. 인간의 욕정으로 말미암아 발생하게된 돌이킬 수 없는 하나의 사건을 다뤄, 보는이들로 하여금 느끼는게 많을 꽤 유익한 시간이였습니다. 그리고 궁금한 점이 생기게 됩니다, 사랑은 아름답지만, ..."
8,간만에 심장이 쫄깃해진 영화! 
7,그냥 볼만반전은 뻔한데 못맞출수도있다 
7,마무리가 허무함... 이야기가 먼가 되어가듯하다가..맥없이 풀린듯! 
7,범인을 맞출 수 있었는데.. 
9,직접 여친과 봤습니다. 기대하고 본건 아닌데요. 스릴러가 어떤 장르인지 충분히 느낀 영화입니다. 끝부분에서 반전이 있네요. 오..생각만해도..오싹합니당 ㅋㅋ 저랑 여친 둘다 재미있게 봤어요 밤에 보세요~^^ 
10,무서워죽는줄알앗어요ㅠㅠ 
8,내가 잠들기전에 핸드폰을 안 잡으면 숙면을 취할 수 있을텐데 
5,"일 년에 대작 한 개만 볼수 있어도 대박인데 올핸 아직... 인터스텔라에 기대하고 있슴. 나도 ""나를 찾아줘"" 보고 나니 제목이 헷갈려. 5점 드립니댜. 본의 아니게 제 평점이 전문가 평점이란 거짐 비..."
7,어노인팅_나를찾아줘의 기대감을 갖고 관람_무난한 시나리오_적절한 긴장감 있음_주연배우들의 연기력 좋음_무난하지만 나를찾아줘에 비해서는 상대적으로 약간부족_평점 7.7 정도... 
7,"전형적인 용두사미, 초중반까지의 긴장감을 끝까지 가져가지 못했다. "
6,결말이 아쉽지만 그냥 무난한 영화 
6,'여주 남주 다 잘못있네 
5,초중반 긴장감 있게 잘끌고 가다며 기대감을 부풀리더니 중후반부에 힘을 잃고 대충 마무리 하는게 상당히 아쉽네요 
6,초중반은 엄청난 긴장감과 몰입감이 스토리를 끌고갔는데 결말이 정말 잉? 스럽고 허무 .. 
2,주연들 보고 기대했는데 별로네요;; 
4,그럭저럭 볼만한 내용이였다.  결말은 좀 허무함. 
10,평점이 생각보다 낮네요 전 재밌게봤어요 
7,근데 초반에 폭행 당하는 장면 회상할 때 남자 뺨에 상처있지않았나 잘못본건가 
8,ㅅㅂ무슨 베스트 댓글에 스포밖에없어 ?? 
4,"먹다 만 느낌,,, 콜린 펴스 연기하나는 일품, "
3,별거 없는데 뭐가 반전이고 스릴러야 
10,사전 정보 전무한 상태서 보면 충분히 볼만합니다. 원래 영화란게 그렇긴 하지만.ㅎ 
6,반전 스릴러. 좋은 배우들이라 합이 잘 맞는다. 표정연기 눈빛연기가 흥미롭다. 시나리오도 좋고 전개도 나쁘지 않다. 다만 스릴러 답게 화면에 좀 더 긴장감이 있었다면 좋을뻔. 처음부터 끝까지 품위를 잃지 않는 분위기...
6,초반부를 놓쳐서 ...내용이  좀 어려웠지만.. 괜찮은 영화 같았어요 ㅎ 
9,다른 사람들 상관 없이 난 재밌게 봤다. 끝까지 긴장하며 봤고 콜린 퍼스 소오름! 
9,마지막이 너무 허무하넹... 
6,이영화를 보고 기억에 남는것 2가지 : 1. 클레어가 같이 사는 남자가 벤이 아니라고 말했을때 소름 2. 진짜 벤의 인상이 의외로 썩 좋지 않음 
7,범죄자가 콜린퍼스 나한테 그렇게 집착하는 콜린퍼스를 내치다니 ㅋㅋ 
10,재미있습니다 평가점수 입력하라고 끊임없이 떠서 입력합니다 
8,초반하고 중반은 긴장감 있다가 마지막에 허무하게?ㅋㅋ 박사가 나쁜놈인줄ㅋㅋ 
8,나름 긴장감과 스릴감이 괜찮았음. 막판에 약간 허무한다고 느낀건 나도 마찬가지 
7,좀 더 후반부에 반전이 등장했어야.. 그리고 좀 더 헷갈리게 연출했더라면 더 좋았을텐데 아쉽다 
7,몰입감은 괜찮으나... 반전이 없어 아쉽다! 
7,컨셉부터 반전까지 흔한거 줏어모은영화 
6,소재 자체는 재밌습니다. 오늘의 기억이 내일이 되면 사라진다.몰입도도 나름 괜찮습니다만 예상되는 결과와 뻔한 반전..스릴러 장르치고는 약한듯 합니다. 
9,콜린 퍼스-니콜-스트롱 케미 지렸다하지만 리얼 벤이 더 악랄해보여 
