score,review
8,아름다운 영화. 뭉클하다 
9,여주인공의 연기가  좋았고  스토리가 단순하지만  관객들을 몰입하게하는  지루하지않은  영화였다그 당시  사회적  지리적  환경을 볼 수 있어  좋았다 
10,아름다운 영화입니다. 
8,시얼샤 로넌의 섬세한 연기 덕분에 두시간 내내 내가 에일리스가 된 기분이었다. 마지막 장면이 무척 마음에 든다. 
9,이야기 전체가 잘 녹아 마지막 장면에서 가슴이 따뜻했다여주인공의 매력과 짦았지만 남자주인공의 매력은 마음을 빼앗아 가는데는 충분했다~~^^ 
10,그저 너무 좋았던 영화!! 
10,"완벽한 영상미, 아름다운 연인 에일리시와 토니...토니의  착하고 지고지순하고 귀여운 모습을 바라보고있노니 입가에 웃음이 떠나질않음..ㅠ조조로 보고와서 하루종일 덕분에 행복했던 고마운영화다.. 시얼샤로넌은 동년배 연..."
7,누구나 한번 쯤 있었을 법한 시기를 보여주며 회상하게 만든다. 한편의 드라마를 본 듯한. 따듯해지는 영화. 
10,진짜 시간이 가는줄 모르고 본 영화에요. 
10,너무 좋았어요...!!!  (ㅠㅅㅠ) 
8,배우들 연기도 좋고 재밌게 봤어요! 
9,시얼샤 로넌의 눈빛에 빠져든 영화 
8,마지막 그녀가 선택한 삶을 응원하게 될 수 밖에없는 영화~ 
10,마음 따뜻한 달달한 영화 
10,브루클린 브루클린 브루클린 
8,잘 만든 성장영화. 연기력과 연출의 탄탄함때문인지 지루하지 않은 평범한 하지만 빛나는 순간들이 있었다. 순수한 젊음과 사랑덕분에 마지막이 뻔하지 않아서 좋았다 
10,어렵게 만들지 않았네요  브루클린 다저스 
9,잼나요~  보여지는 옷들 자연의 색감들이 너무 예뻐요~ 좀 더 디테일한 인물 분석했으면 더 재미있었을것같아요 ~ 오늘같이 비오는 차분한날 보기 좋은 영화인것같네요~타지로 떠난다는 설레임은 옛날이나 지금이나 같나봐요~...
8,미니멀한 구성만으로도 훌륭했다 
9,주인공과 함께 외롭기도 설레기도 흔들리기도 하며 미소짓는 영화! 
8,향수병을 느끼는 주인공의 아픔을 공감하게되며감정이입이 되엇습니다 
8,영상이 예쁜 영화입니다. 
10,색감 예쁘고 재밌었어요 
8,"아일랜드에서 브루클린으로, 여기서 저기로, 이랬다가 저랬다가. 가장 일상적인 새로움에 관한 기분좋은 고찰. "
7,여주가 향수로 울 때 공감돼서 같이 울고 난 뒤로 남주랑 깊어지는 것도 미국생활 적응해나가는 것도 전부 흐뭇하고 즐겁게 지켜봤는데 아일랜드는...ㅋㅋㅋ그렇게 좋아하는 야구 경기 보는 중에도 집중 못하고 여주 생각했다...
8,당시를 재현한 디테일한 코디와 소품들이 묘하게 세련되게 느껴졌어요. 돋보이는 원색들이 애잔한 작품 배경과 묘하게 어울리며 작품을 더욱 풍성하게 만들어주는 것 같아요무엇보다 이주여성으로서의 감정선을 탁월하게 표현한 여...
9,너무현실적으로보이지만...이해가고공감가는스토리.시얼샤로넌은넘이쁘다... 
10,멜로의 정석!! 잔잔하고 기억에 남는 영화 
8,잔잔하고 예전의 뉴욕을  느낄 수 있어서 좋았다 
9,젊은 날의 혼란..그리고 사랑 
7,아주 재밌어요~소소하지만 처음부터 끝까지 집중해서 보게 되네요 
10,억지스러운 드라마도 악역도 없는데 지루하지 않고 재미있어요. 모든 캐릭터들이 현실속 인물처럼 자연스럽고 묘사가 섬세하네요. 
10,주인공의 복잡한 심리상태에 완전 몰입됨! 
10,기대만큼 좋았던 영화 
10,"인간적이고 진실한 사랑을 말해 주는 영화, 다져스 짱 "
10,시얼샤 로넌의 연기가 탁월하다. 갈등보단 아픔 그리고 심정변화 등을 잘 살렸다. 눈빛이 너무 이쁘고 사랑스럽다. 이 영화는 시얼샤 로넌을 위한 영화다. 
10,여주인공의성장 과정을 볼 수 있는 잔잔하고 좋은 영화였어요 
8,이민 드라마를 가장한 성장 드라마 
8,설레임 풋풋함 복고 아주 아름답다 
9,넘나  꿀잼이ㅏㄴ거ㅓㅅ~! 
10,오랜만에 마음이 저려오는 기분 좋은 감동을 느낀 영화 
8,여성성장소설 한편을 읽는듯 했습니다 
7,"차분한 분위기에 잠시 그 시대에 빠졌다가 나온기분물흐르듯한 전개 나쁘진 않았고 , 부드러운 영화랄까 그래서그런지 중간중간 졸음이 왔다 . ^ㅠ^ "
10,사랑에 빠지고 사랑에 확신하지못하고 사랑에 불안해하고 사랑에 미안해질때 등- 모든 사랑 요소들을 이 영화는 성공적으로 해내버려서 영화를 보고나면 더욱더 사랑을 하고싶어진다. 
6,잔잔하게 볼만하네요 ㅋㅋㅋㅋ여주도 이쁘고 
8,아일랜드에서부터 브루클린까지 소녀에서 숙녀로의 여정 
10,스토리도 영상도 좋아요 
8,아일랜드판 지금 우리들 이야기 
10,절묘한 캐스팅이 돋보이는 뉴욕의 동화아름다운 영화 
8,"잔잔하게 보기 좋은 영화, 새로운 도전을 꿈꾸는 사람이 보기에 좋은 성장드라마,, "
10,내용구성이 종고 완벽함. 강추 
10,과거의 수많은 일들이 오버랩되어 슬픔과 설렘 기쁨 고민 나의 2030대의 수많은 감정의 일기장을 본기분 . 추천 
9,"멜로영화로도, 성장영화로도 수작인듯... 누구나 자신의 이야기처럼 느껴지실거에요. 오랜만에 주인공에게 몰입해서 봤네욤 "
10,기대하지 않고 급예매후 본영화. 너무 예쁘고 차분한 색감과 비쥬얼. 특별한 에피소드 없이 청춘의 짧은 단편을 잘 포착해낸 영화. 너무 예쁜 젊음과 사랑. 내 이십대와 겹쳐보고 비교해보며 돌아보게 되는 수작!!! 
8,이민자의 고민과 갈등을 잘 담아냈다. 시얼샤 로넌이 인물의 감정을 풍성하게 잘 표현했다. 
10,굳굿궂궃굳굿궃궅굿Good 
9,아름다운 사랑의 영화입니다. 
5,분위기가 정말 예뻤어요 
9,잔잔하지만 곳곳에 위트가 섞어있어 생각하며 즐길 수 있는 영화다.   여운이 오래가는 영화가 될 것이다.  약간의 미국 미화가 느껴지는 영화. 
10,토니가 주연이다~!!!! 
7,돔놀은 내가 데려가는걸로 
10,너무 좋았어요~~~~꼭 보세요 
8,"""잊고 있었어요' 그  장면이 제일 기억에 남는다. "
10,오랜만에 완소영화.  상영관 좀 늘려주세요. 한번 더보게요. 
10,정말 자연스럽고도 자연스럽게 잘 찍은 영화. 여자 주인공 연기 정말 좋음. 
10,대사 연기 편집 모두 좋았습니다. 여자를 보는 시각이 긍정적인면도 기분좋게 관람하게합니다 
8,so sososososososo 
9,순수한 사랑을 연상케하고 시대적 배경을 볼수 있는 영화 
8,"사랑스럽기 그지없는 남녀주인공. 오랜만에 한 영화에서 만나는 슬러그혼 교수, 빌 위즐리, 몰리 위즐리 "
10,옛날에 돌아온다고 했던 그녀가 생각난다. 아니 그녀가 돌아왔다. 하지만 내 마음은 이미 떠났었지. 뉴욕으로 돌아온 그녀를 과연 진심으로 포옹하였을꺼라 생각하시나? 너무 늦어버렸지. 
9,사랑하는 연인들에게 추천하고픈영화 
8,브루클린에서 새로운 삶을 꿈꾸는 소녀의 사랑이야기. 영화를 보면 애틋한 첫사랑을 만나는 듯한 느낌이다. 
8,나쁘지않았다. 배우들이 다 예쁘고 잘생김;;; 
10,보는내내 미소가 얼굴에서 떠나지 않았던 영화 ㅠㅠㅠ최고임 
9,색감이 너무 예쁘다. 아름다운 영상미.감정선에 따라서 자연스럽게 흐르는 스토리.  잠시도 지루할 틈이 없었다. 
8,착한 영화. 행복을 찾아서. 
10,여성의 삶과 일 사랑을 다룬 로멘틱한 영화였습니다.아일랜드에서 미국에 정착하는 과정을 섬세하고 잔잔하게 전개되는 것이 좋았습니다. 
10,최고예요 한 번 더 보고싶을정도! 
8,삶의 순간 순간이 선택의 연속이네요.재밋게 잘 봤어요 
6,가볍게 보려 예매한 영화치고 괜찮았던 영화 
8,"익숙했던 집을 떠나 새 집을 찾게 되는, 혹은 만나게 되는 일련의 이 과정. 무수한 선택지 앞에 결국은 어떻게든 흘러가는 시간, 결국 우리네 인생. "
9,두고 온 곳에 대한 마음이 잘 표현된 것 같다 
10,마음의 고향에 대한 이야기가 제일 기억에 남음.. 인물 감정을 너무 잘 살린듯 ㅠㅠ 
7,요즘의 나에 대해 생각해본 시간 
8,좋았습니다. 감독이 잘 표현한것 같습니다 
10,"살아오면서 어느 때엔가  내가 겪었던 쓸데없는 자만과 우월감 등이 떠오르면서 부끄러워지기도 했고, 배우들의 연기도 참 좋았다. "
9,잘 봤습니다~~~~^^ 
9,따뜻하고 좋은 영화!! 
10,사랑을 넘어선 한 인간의 성장영화. 감동적이었다. 
10,"생각지 못했지만 정말 너무 좋았던 영화. 리뷰 생전 처음으로 쓰고 싶게 만듬! 영화 초반에서 중반이 너무 좋았다..정말. 남주 눈빛이 정말 좋고, 여주 눈빛 또한 , 다시 영화관 가서 한번 더 보고싶을 정도로 좋았다..."
9,어느 여자의 성장기. 여운이 진하게 남아요 
8,공감가는 스토리와 연기로 감동적 
10,이런 좋은 영화가 왜 개봉 안하나 했는데 드디어 하는군요. 감정묘사가 정말 감성을 울립니다! 완전추천! 
9,"좋았습니다50년대 배경영화는 참 볼 만하네요.빠르지 않고, 깨끗하고.. "
9,재미있는 영화! 의상도 조았고용 
9,타향도 정붙이고 살아야 고향되느니..인습에 굴하지않고 갲덕하는 삶내인생은 나의것 아일랸드 이민기 ! 
8,인생은 유혹과 결정의 연속. 
8,좋아요아주넘넘재밋어요 ㅎ 
8,영화 괜찮은데...인간적으로 상영관 너무한거 아닙니까ㅜㅜㅜㅜ 
8,선택의 순간. 그때 우리는 성장 되어지고 꽃 피어진다.시얼샤 로넌. 스크린 속에서 꽃을 피웠다. 오랫동안 지지않을 꽃을. 
10,군더더기 없는 깔끔함 그 느낌이네요 
8,아름다운 세련미를 갖춘 우아한 클래식 
8,"1950년대의 애란은 불쌍하고,그들 이주자의 미국 정착 과정을 아름답게 그리고.  여자의 처신을 도덕 교과서적으로 전개하고 자년에 가본 아일란드 아름답습니다. "
10,여주의 연기가 아주 좋았고 스토리도 재밌었습니다. 
9,큰 기대 안하고 봤는데 재밋었어요 
9,살짝 지루한 전개지만 영화 색감과 분위기 모두 좋았습니다! 잔잔하고 담백한 드라마에요:) 
9,넘좋았음다 사랑의  참맛을 느끼고 갑니다 
8,요즘 같은 황사 짙은 계절에 내린 단비같은 영화 
10,평범한데 격조있는 영화 
8,지금까지와는 다른 삶을 꿈꾸는 사람들을 위한 영화 
9,오랜만에 좋은 영화 보고 나온 기분 
9,착하고 순수한 영화입니다. 향수병을 여주를 통해서 디테일하게 묘사했어요.. 
9,잔잔하고 편하게 보기 좋아요. 어느순간 미소짓고 있는 내 모습 ㅎ 남주 여주 다 이쁘고 잘생겼어매일 쏟아져 나오는 막장드라마에 오염된 정서가 정화되는 기분 
10,영상미가 아름다운 영화입니다. 
9,다행입니다 이렇게 끝나는 영화라서 
9,볼만합니다 고향 떠나 생활해본 사람들 공감할듯 
10,"위트있고 잔잔하게, 여주인공의 감정변화를 잘 담아낸 영화 "
8,시얼샤 로넌 어른이 다 됐네~결말이 의외라 생각했지만 또 충분히 공감갔다는 
9,시골 촌뜨기 여성의 성장과정을 담백하고 진솔하게 풀어낸 작품. 구닥다리 철지난 향수나 불러일으키는 현상이 범람하는 이때 진취적으로 자아를 찾아가는 인물을 그린 이 영화는 청량감마저 준다. 시얼샤 로넌의 연기는 화룡점...
10,시간 가는 줄 모르게 넘 잼있었어요 
9,주인공 마음이 이해가 되면서도...마음에 안들었지만 결말은 만족스럽다 
9,아름다운 하지만 운명적인 사랑의 세레나데! 
3,이 영화가 높은 평을 받은게 많다는 뜻은 영화속 여주인공 처럼 비슷한 상황을 겪은 여성들이 많기 때문이라는 증거란 건가요 ?ㅋㅋ 유부녀인거 숨기고 알콩달콩 연애하다가 동네주민한테 들통 나니깐 다음날 바로 기차표 예약...
9,"나를 빛나게 해준, 내가 빛날 수 있던 유일한 곳, 브루클린. "
8,영상 의상 색감 너무 좋은데ㅋ 동창회는 가면 안됨ㅋ 보는내내ㅋ 나쁜ㄴㅕㄴ 이라는 생각만ㅋ 
8,정갈하게 풀어놓는 사랑의 복잡함. 
7,아일랜드와 브루클린은 너무나 먼 곳이었다. 한 번 빠지면헤어나올 수 없을 만큼. 그 모든 소용돌이 속에서 자신을 지키는 것만이 할 수 있는 최소한의 몫이 아닐까 
9,나를 위로했던 영화. 아름답고 섬세하다. 그리고 토니는 스윗함. 
10,에모리코헨 입덕 영화.. 
7,어장관리하다가 들통나서 쫓기듯 달아난 여자이야기 그이상 그이하도 아닌것 같음 
10,사랑스러운 영화이었던것 같다 
8,애미나이들 잘들 보래이. 간보다가 빵집 아줌마한테 뒤통수 맞는데이. 
10,"인생영화 등극했습니다.ㅠ 진짜 인생의 갈림길에서 고민하는 모습을 잘 담았어요ㅠ.남주도 너무 스윗하고, 여주가 자아 찾아가는 것도 좋아요!! 왜 네이버는 남주를 돔놀 글리슨으로 해놨는지가 의문이네 진짜.. "
10,"주인공의 용감한 마지막선택에  박수를 보낸다. 최고의 각본, 연기..보는 내내 감탄을 자아냈다. "
10,최근 몇년간 본 영화 중 가장 만족스러운 영화였다. 너무 지루하지도 너무 자극적이지도 않은 클래식한 연출과 반짝반짝 빛나는 배우들의 연기가 더 없이 만족스러웠덨 영화였다. 
10,은은한 영화 좋았습니다 
8,다소 여주의 이해가 되지 않는 행동이 있어서 불편하지만 메시지가 참 좋은 영화. 
6, 당시 시대를 옮겨놓은듯한 풍경과 배우들의 연기는 훌륭했지만 중후반에서의 여주를 보고나니 여성에 대한 경각심만이 남는다. 이게 아름다운 성장스토리인지??? 
7,"그냥 뻔하디 뻔한 그런 이야기. 성장물 덕후인 나는 하도 많이 보아왔던 그런 이야기. 남자 혼자 커플들 사이에서 보기엔 그저 그런 그랬던 이야기. 다만, 이 영화의 가장 치명적이었던 건  매력없는 등장인물들에게 생명..."
7,밝게 채색된 유리구슬같이 맑은 색채의 영화. 삶이란 이렇지만은 않을텐데 말이다. 사랑하는 이가 있는 곳이 바로 스윗 홈 
9,사랑을 포함한 성장영화. 여주인공이 무척 매력적이다. 
10,아름답고 재미있는 영화 
6,살짝 아쉬웠다. 감동? 사랑? 로맨스.? 모두... 
10,갈대처럼 흔들리는 사람의 마음을 어쩌면 이렇게 잘 표현할 수 있을까싶다. 어장관리녀의 흔한 작업 스토리라고 너무 뭐라고 하지 말자. 그대가 그 상황이면 어떨지 아무도 모른다. 어쨌든 그녀는 깨달음을 얻고 현명한 선택...
8,영상도 좋고 감동적이었습니다- 끝이 조금은 아쉬웠습니다^^ 하지만 한번씩은 보셨으면 좋겠네요- 
7,우아하고 매혹적인 영화 
9,우왕넘재밌었다열자열자 
1,클리셰의 연속.. 재미도 감동도 교훈도 전혀 없다. 지루하고 한심한 영화. 
6,평점 되게 좋네요. 아름다운 내용일거라 기대했는데 뒤로 갈수록 고구마 먹는 느낌. 맛있는 새 떡 간보다가 궁지에 몰려 어쩔수 없이 먹던 떡 먹으러 가는 기분이랄까.. 성장드라마라고 평하는 평론가들이 있지만 현실적으로...
1,"에일리스가 아일랜드로 돌아가기 전까지는 이렇게까지 몰입되고 좋은 영화는 오랜만이다라는 생각이었는데, 아일랜드로 돌아간 후의 상황은 솔직히 화가 나고 욕이 나올 정도. 사귀던 여자친구가 내가 타지로 간 후 바람난 경험..."
2,에일리스 도무지 이해가 안가네ㅡㅡ토니하고 결혼약속까지 했는데 고향 오자마자바로 갈아타네. 이게 먼 평점이 왜좋아토니가 잘못한 점이라도 있어야 이해를하지 ㅅㅂ기분 드럽네 에일리스 개간ㄴ 
9,우아한 그녀의 글로벌 어장관리 
5,뭔가 나올듯 나올듯 하다가 안나오고 급마무리... 
5,중반까지 정말 괜찮았는데 마지막 결말이 무엇인지... 어처구니가 없습니다. 결말만 괜찮으면 정말 좋은 영화 봤을텐데 안타깝네요. 
2,"뜬금없이 사랑에 빠져서 결혼하고, 뜬금없이 언니가 죽고, 뜬금없이 다른 남자와 사랑에 빠지고, 뜬금없이 다시 돌아가는 뜬금없는 내용들. 별점이 8점대인 게 이해가 안가는 영화 "
7,영상도 아름답고 여주인공의 열연이 인상적인영화.  근데 영화가 뭘 말하려는지 모르겠어 
4,결말은 괜찮은데 중간부분이 너무 찝찝함;; 갑자기 왜 결혼한남자 냅두고 딴놈이랑 사랑에 빠지는짘ㅋㅋ 
7,스토리가 조금 아쉽다. 
10,새벽에 보길 잘한듯하다 너무너무 좋았던 영화 
10,몇번을 봤는지 ... ㅎ 여주인공의 성장기에 맞춰서 보기보단 남주와의 로맨스에 치중해서 봤네요.... 남주 목소리 굿...^^ 
10,보는 내내 가슴이 터져버리는 줄 알았다. 토니의 눈빛이 사랑에 빠진 남자의 모든 것을 대변하는 것 같다. 그녀가 어떤 선택을 했더라도 지지했을 것. 
9,완벽한 로맨스다. 이거다. 
8,재밌고 감동적으로봤습니다 
10,아직도 안봤다면..꼭 보시길 
10,"여주인공 선택의 계기가 완전히 이해가되진않지만, 사람으로서 그 감정을 이해 못하진않는다. 일리스가 브루클린에서 자신의 삶을 행복하게 살아가길 "
10,"What if 떠나기전에 괜찮은 직업, 남자친구, 강인함을 가졌더라면 떠나지 않았을 것이다. 하지만 돌아와서 가지게 되었다고 한들 가장 싫어하는 부분 때문에 포기할 수 있고 더 나은 삶을 선택할 수 있는 능력과 또 ..."
10,온전한 나의 고향을 과정 
10,"진짜 모처럼 영화다운영화를 봤네요드러내놓지않은 감정에 선이 참 좋았어요""향수""같은 영화에요 감정은 다양하고 변하지만자신만이 알고있는 진짜 마음에 향수를 찿게되는영화 추천합니다당신이 사랑하거나 받을자격이..."
10,에일리스의 심리적 전개가 백프로 와닿았다토니라는 남자 참 마음이 가게 하는 스타일!배우들 다 멋지네요 
10,넘 따뜻하고 훈훈한 그러면서도 재밌는 영화였다 
10,"오랜만에만나는 좋은 영화다 그시절을  느낄수있는 . . 디테일함도 좋고,, 연기도좋고 "
4,호불호가 갈릴 수 있는 영화 
7,요즘 세상에 여성영화란 게 따로 있지는 않겠지만 여자들이 더 잘 공감할 수 있는 영화란 건 있을 거임. 각자 사정이란 게 있겠지만 여주가 너무 민폐캐임. 소소한 재미도 있고 무엇보다 그림이 아름답지만 그래도 너무 민...
9,"아름다운, 그러나 신화적인. "
10,마음에  참 와 닿는 영화입니다. 
10,올해 최고의 영화였어요 
9,오랜만에 만나는 걸작이네요~ 영화가끝나자 대서양을 한바퀴 가로지른 느낌이에요^^ 
9,야무진 소녀의 너무나 완벽한 성장담. 
8,좋은 성장기 영화네요 재밌습니다 
10,주인공 남녀가 더할 수 없이 건실해서 보기 좋네요. 똑똑하고 현명한 여주인공의 갈등이 충분히 이해가 되나 흔들림 속에서도 끝내는 바른 결정을 해서 기분이 좋네요. 
7,드라마틱한 이야기는 아니다. 아주 재미있지도 않았다. 하지만 여주인공의 고민과 성장기가 현실적으로 느껴졌다. 
8,이쁜사랑이야기..충분히 그럴수있는 
8,아직 더 생각 정리 좀 하고 쓰고싶었는데..아름다운 영화임은 분명하다. 
10,시얼샤 로넌  엄청 이뻐졌네요! 못알아볼뻔 !아저씨의 김새롬 닮았아요 
8,지긋 지긋한 곳을 벗어나고자 했던 주인공. 잠시 그 곳이 어떤 곳인지 잊었을 때의 느낌이란 
8,설레고도나름스토리있는로맨스영화한편입니다~~추천이요~~^^ 
9,때론 안락함과 익숨함에 취해 꿈을 잊게된다 에일리스가 고향을 떠난 이유를 알게되는 장면이 가장 명장면. 꿈을 찾아떠나는 그녀가 멋졌다 에일리스는 토니를 통해 자신을 찾았다 이게 진짜 사랑만이 가지고있는 힘이 아닐까싶...
2,타향살이에서 뭔가 성장해서 자기주도적으로 변한척하는 여주에 속을뻔. 
2,아무리 봐도 불륜 미화 이야기임. 이해는 가지만 막판에 자신이 희생자인양 이런마을인지 몰랐었다며 피해자코스프레하는건 너무 웃겼음. 착한애도 쌍.년이 될 수 있다는 이야기를 보며 반대로 이게 남자의 상황이었다면 이렇게...
10,타향살이 하는 나로썬 이해가 감. 타지에서 항상 고향 그리워하고 그곳에 가면 다 해결될거 같고 환상을 갖고 타지에서 살다가 막상 고향에 가면 잊고있던 고향에서의 힘들었던 삶이 다시 재현되는 경험. 경험해보지 않은 사...
9,인생은 나 자신의 선택의 연속이다. 하지만 시청에 결혼하러 가는 날 아일랜드 고향 마을 사람과 마주친건 우연이 아니라 어쩌면 운명인 것 같다. 보이지 않는 힘들로 이미 정해져 있는 것 또한 인생인 것 같다. 영화 괜...
8,앞으로 나아가려는 이들을 위로하며 이미 시작한 이들에겐 공감을 불러일으킨다. 
9,감성을 자극시키는 언어의 향연. 니주는 부드럽게~ 오도시는 강렬하게~  물 흐르듯 부드럽게 캐릭터를 살리니 극에 몰입될 수 밖에.. 이게 정석이다. 콜럼 토빈을 기억하라.그리고 존 크로울리를 기억하라. 
8,"토니가 다 해먹은 영화이민이나 유학의 경험이 있는 사람이라면,, 공감이 클 영화 "
10,최고다..사랑해요♡ 
10,남친과 정말 재밌게 봤다. 대사도 재치가 넘치고 주인공 주변인들이 정말 유쾌해서 웃느라 눈물을 주륵주륵 흘렸다. 여배우의 현명해보이는 눈빛과 얼굴을 잊을수가 없다. 아름다웠다. 또 보러 갈거다. 이민자와 향수병에 대...
9,여주의 매력이 돋보였음 역시난 아카데미 후보라는 ... 남주는 개인적으로 별로였음  나머지 조연들 무난. 
6,여기 나랑 생각이 비슷한 사람이 꽤 많네요. 1.괜찮은 영화가 될뻔 했는데 뭐지 라는 한숨이 나오는 영화결국 결혼한거 들통나니까 브루클린으로 다시 내뺀거잖아 무슨 아름다운 영화냐 
4,본격 바람난 여자 정당화시키기. 시얼사 로넌은 여기서도 비치. 비치 전문역 
2,개노잼 돈만버렷다 샹. 
10,내 인생 손꼽는 영화 중 하나.그냥 이 영화 속에 들어가고 싶다. 
8,그럼에도 불구하고  그들이 이민을 온 이유. 너무나 이해간다. 처음 배에서 만났던 그 금발 여자도 그런 이유로 주인공에게 이야기 했겠지. 토니와 패럴을 브루클린과 아일랜드 고향으로 비유해 러브 스토리로 풀어가는 방식...
10,진짜 최고예요.제인생영화 입니다 
10,영상미가 정말 아름다운 영화....남자 주인공이 너무 스윗하고 저런 남자라면 진짜 사랑에 빠질 수 있겠다 싶었음...에일리스가 고향으로 다시 돌아가서는 이해할 수 없는 행동을 하지만 어머니도 있고 언니일도 있고 해서...
1,바람피다 걸려서 도망친 여자이야기..자기인생을 착실하게 개척해 나가는 멋진여성을 그리다가 후반부에는 바람난 여자로 만들어버린 영화. 
8,내 인생엔 왜 토미나 짐 같은 멋진 남자가 없을까 한탄하는 여자들은 거울을 보면 답이 나올것이다. 영화 자체는 수작. 
10,집 떠나 혼자 산 적이 있고 더불어 그 곳에서 사랑하는 사람을 만났던 경험이 있는 사람이라면 누구라도 이 영화를 보는 내내 먹먹할듯하네요 
10,영상미이쁘고 여주인공 눈동자또한 아름다워 눈길이갔다 시작부터 엔딩까지 잔잔하게흘러가서 지루하게생각이들수도있는데 나도 집을떠나 살고있기애 몰입해서보았다  아쉬운게있다면 남주 키가 조금컸더라면좋았을텐데. 
1,"버스타고 길이 막혀서 늦게도착했더니, 늦었다고 영화관입장 안된다해서 못봤습니다. "
1,2개월 전에 이 영화 인터넷으로 봤는데 로딩도 길고 자꾸 끊겨서실망했던 영화다 1점도 아깝고 보다가 로딩이 길어서 그냥 껐다 
