score,review
9,영화 몰입도 및 스토리 전개 괜찮았음....다만...진짜 벤이 더 범죄자 같음...캐스팅 미스...ㅋ 
6,"콜린퍼스 연기 드드드. 딴 건 모르겠고, ""벤 어떻게 생겼어?"" 에서 소름.. "
9,벤 얼굴과 인상때문에 마지막까지 또 반전인가 하고 보고있었다는... 
7,진짜 벤이 너무 무섭게 생김.. 
8,나의 기억을 잃으면 나의 인생도 도둑맞을 수 있다.역사를 잊은 민족에겐 망국이 있는 것처럼.... 
7,초중반 엄청난 긴장감에 영화를 보다가 마지막에 너무 허무하게 끝나는 느낌... 새로운 소재의 영화라 신선하긴 했네요. 
6,"용두사미네요. 초중반은 흥미롭게 전개되다가, 막판은 너무 엉성합디다. "
6,마지막을 한번 더 비틀었다면 명작이 될뻔 
5,불륜 방지 캠페인 영화로 써도 되겠음. 바람 한번 잘못 폈다가 뭔꼴이여ㅋㅋㅋㅋ 반전도 그저 그렇고 그냥저냥 평작. 
5,스릴있고 괜찮았는데 마무리가 너무허무하다.. 
10,니콜키드먼은 왜저리 이쁜가 
8,결론: 바람피우면 이렇게 된다는.. 교훈 
5,4년전에 요양원에서 납치당했는데 가족들이 엄마 면회도 안 가고 방치한 건가? 실종신고도 안했고 갑자기 결말에 나타나서 여전히 사랑한다고 말하는 끝이라니. 
10,혼자 보다 심장 오그라드는줄 알았네. 니콜. 팬이다. 물론 한국 니콜도 팬이고. 
8,혼자보러갔는데 벗어둔외투 두손으로 부여잡고맘 졸이며 봤네요몰입도 최고...스릴넘치고!90분이 마치 20분인 듯 순식간에 지나갔네요 
6,아담 샌들러와 드류 베리모어가 출연한 첫키스만 50번째의 극단적 버전...?? 니콜 키드먼과 콜린 퍼스의 조합이 의외로 잘  맞았다는게 유일한 즐거움이랄까.  어느 순간부터 니콜 키드먼은 이제 스릴러의 여왕이 되어버...
8,중반까지 완전 초 스릴러다가 진짜 벤 나타나면서 부터 좀 깨면서 아들나올때 신파로 흘렀던거만 빼면 괜찮았음솔직히 가족이 나몰라라 하고 떠난거 스토커가 맘고쳐먹었으면 끝까지 잘 돌보던지 왜 패고 난리임 
6,어쩌라고 설마 이게 끝이야? 이런 느낌 
7,볼 수록 여주인공이 처한 환경이 메멘토와 흡사하다는 생각이 들었고 장애가 있는 아내를 버리고 떠나간 남편이 돌아오는 장면은 매우 실망.... 게다가 가짜 벤이 더 이상하게 호감... 그래도 긴장감 넘치는 연출과 잘 ...
8,보러가기 전에 전문가평 봤더니 왜 이렇게 스포야? 예고편 본 사람들은 너무 쉽게 예상 되잖아...아 짜증나네ㅡㅡ블라인드 처리좀요...뭐가 전문인지 모르겠네 짜증나 
10,콜린퍼스가 정상이면 난 콜린퍼스랑 살래 ㅋ 
1,애들아...감상을...써...스포를 하지말고...그 정도는 생각하고 평해...니들은..스포를 하는지도 모르고 쓰는것 같아서 쓰는말이야.. 
10,개봉첫날봤는데 정말 무서워서 움직이지도 않고 본듯.배우들의 연기도 좋았고 반전이 주는 스릴이 너무 재미있었다. 
7,재밌어요 반전도생각못햇던거고.끝이좀다급히끝난건빼고 
10,그나마 니콜 키드먼이 살려 준 영화... 
10,시사회에서 봤는데 진짜 스릴 장난아님.. 마지막 반전 대박!! 연기도 최고고 암튼 오랜만에 제대로 건졌음 
10,개인적으로 너무재밌게봄 전화로 벤이어떻게생겻냐고 물을때소름 ㄷㄷ 그리고 니콜키드먼 아직너무예쁨 왤캐안늙어 좀사기인듯 
7,생각보다 괜찮았어요 배우들연기좋았음 
10,비행기에서 봤는데 지루한지 모르고 봤네요물론 전남편이 더 범인같이 생겼다는거... 빼고; 
9,역시 믿고 보는 배우 니콜누님이네요. 초중반에는 사실 그리 쪼이는 맛이  없지만 후반에 쪼이는 맛이 괜찮더라고요.. 스릴러란 장르치고 과격하지도 않고.. 흥미있게 볼만한 영화더군요 
9,재밌네요^^!나를 찾아서와 비교되지만 그래도 잘만들어진 웰메이드 스릴러 
5,끝이 너무 싱거웠지만 배우들을 보는 맛은 좋았던 영화 
10,여론상 욕먹을 것 같지만 현실성없는 나를찾아줘 보다 재미있게 봤던 영화. 
7,시속 150키로로 달리다가 차가 퍼져버린 느낌 
10,괜찮은 반전 스릴러라고 생각되네요~ 
8,이정도면 재밌네... 
8,기억상실증 이라는 진부한 소재임에도 나름 참신했음 
5,먼가 안됬고 불쌍하고 마지막에 잘됬으면 좋겠고 그래야되는데 마지막까지보면 그냥 마누라가 바람피다 X땐영화. 몰입은 잘되지만 막판 남는게 없는 그런영화 그리고 친구가 벤과 사는게 행운이라했는데 범죄형 얼굴 ㅋㅋ 깜놀 
10,니콜 키드먼에 콜린 퍼스까지 대박 캐스팅! 나를 찾아줘랑 맞먹는 반전 대박! 
9,막판의 감성팔이는 빼는게 나을뻔 했다. 괜찮은 스릴러에서 홈드라마로 끝난게 에러. 
10,나를찾아줘와 비교하면서 평이 안좋은 리뷰도 더러 있던데요~ 저는 책을 안읽어서 그런지 의외로 괜찮았어요ㅎ 점점 주인공한테 감정이입되면서 정말 끝까지 마음 졸이면서 봤어요. 아마지막 반전 생각만해도 참 끔찍하네요- 
7,마지막에 뭔가 더 있을줄  알았어.. 
1,니가 잠들기 전에 내가 잠들었다.. 
9,우선 몰입도가 굉장했고 갠적으론 반전 예상못했기 때문에...ㅋㅋㅋ거기다 오랜만에 보는 니콜키드먼의 쩌는 연기라 9점드려요ㅋㅋ 다만 저도 끝에 결말이 좀 아쉽네요ㅠ 허무한느낌... 
10,"영화 ""나를 찾아줘""도 그렇고 요즘 스릴러 풍년이네 ㅋ 나같은 스릴러 덕후로서는 이런 영화들 좋음 ㅎ "
8,콜린퍼스가 사랑한다면서 너무 개패듯이 여자를 패네요 좀더 자상한 남자였다면 가짜 남편과 사는것도 좋았을 텐데 너무 폭력적이라 아웃이고 진짜 남편 벤은 인상더러운 버전의 권해효씨 닮으셨네요 ㅋ 
3,니콜 누나 연기력은 정말 인정. 공포앞에 떨며 요구를 받아들일때의 연기력이 정말 인상적이다. 하지만 영화는 여러므로 부족한 부분이 느껴졌음 
6,남편이 4년간 버렸나봄..핑계 오짐 
10,닥터 내쉬 너무 멋있어...의심스러운데 보는 내내 눈호강 귀호강시켜주심.. 
10,니콜 키드먼은 왜 이리 이쁜건지 이뻐도 너무 이쁨 
9,이 영화를 보고나서 니콜 키드먼의 연기가 그녀의 아름다운 외모 때문에 오히려 저평가 받고 있다는 것을 다시 한 번 느꼈다 너무나도 섬세한 그녀의 연기가 감탄스러웠다 영화의 반전도 신선했고 진부할 것 같았던 영화의 결...
10,몰입도 진짜 쩔어요... 
4,스릴러가 아니라  가족드라마다  허무 그자체 !  그게  감독의  의도 인듯 
8,나는 내쉬. 박사가 내취향이더라...목소리 대박 
6,초중반힘은 대단했지만 후반에 너무 힘없이끝나버린다 
6,6점정도. 킬링타임용. 소재 좋음. 
10,나만당할수없지 ^^ 사랑하는 사람과 꼭 보세요! 돈둑한 관계를 만들어줄겁니다!^^!!! 
7,초반에 타이트하던 구성과 전개들이 결말에 가서 모성애로 무마되는 느낌 
8,몰입도 좋고 재밌었는데 끝이 너무 허무했다.그리고 이 영화의 교훈은 인과응보불륜 저지르고 그 벌을 받는군 ㅡㅜ 
10,반전대박 완전 재밋게 봤음 
5,원작과 씽크로율80프로정도. 원작소설도 썩 훌륭하진 못했는데..영화도 그닥이었네요. 상영관도 거의 없네요- -;; 
5,차라리 열린결말으로 하지 결말이 정말 최악이다. 
8,마지막 벤의 모습에 끝까지 긴장의 끈을 늦출 수 없었다. 
8,니콜키드먼 너무미인이다..콜린 변할때가 소름돋는연기..의외로 볼만한영화네요~마무리가 아쉽.. 
7,뭔가 범작이 되려다 평작이 된듯한... 무튼간에 마크 스트롱 참 멋있다. 
9,ㄷㄷㄷ재밌게 봤어욥. 콜린퍼스 사랑해용ㅋㅋㅋㅋ!!ㅋㅋㅋㅋ 
6,궁금궁금하다가 너무 빨리 맥이 풀림 
6,나를 찾아줘 후에 봐서 그런지 감흥이 덜 하다.... 그냥 집착극 
4,내 다시는 로완조페의 영화는 안보리~ 
6,씨네21 이용철님 글에 공감... 보는내내 지루했음. 
7,아진짜 스포하는애들 뇌가 없는건지 개념이 없는건지; 
5,강력한 이중반전이 있어야 하는 영화. 
10,솔직히 가짜 벤이 더 나은듯. 콜린퍼스 나쁘지만 멋있음. 진짜 벤 나타났을때 뭔가 더 반전이 있을 줄 알았음. 무서워서 
10,스포좀 하지마요 보기전에 영화 어떤가 평점보려고 온 사람들 김새게. 
8,연기파배우들이라 역시 몰입도 좋음 
8,강에 돌하나를 던지면 물결이 퍼져나가듯 영화의 흐름이 너무나 좋았음 
8,스릴있고 볼만 함.... 
8,난 이런 게 좋더라... 조잡하지 않고 깔끔한 스릴러 
10,미친 영화 몰입이 될까 말까 하다가 끝나서 10점준다간보는 영화다ㅋㅋㅋ 
9,내용이 좋은 것 같아요.. 좋아요 
8,매일밤 자고 일어나면 기억을 잃는 주인공에게 벌어지는 일을 그린 스릴러물. 시종일관 잔잔하고 서정적인 분위기를 보여준다. 그래서 살짝 지루하기도 하지만 반전도 깔끔하고 마지막 장면도 감동적이고 딱히 스토리상 미흡했던...
8,불륜녀의 최후ㅋㅋㅋ 인과응보다 
6,서양 영화 특유의 느릿느릿한 전개때문에 좋은 소재임에도 불구하고 지루했음 
10,오우 걍 새벽에 폰 하면서 bgm으로 보려고 틀었다가 몰입감 쩔고 반전에서 한번 지리고 진짜 벤 보고 또지렸네 아담은 왜 마이크를 더 닮고 난리ㅋㅋㅋㅋ 
10,재밌게 봄. 다들 바람피지 맙시다! 
1,아니... 10점 짜리  영화라고 생각하고 있었는데 마이아담 하고 끝....? ㅡㅡ 
10,진짜 몰입감 쩔고 주연 배우들 연기 대단함. 스토리 이상하다는 평점 많은데 영화의 흐름과 톤이 이렇게 자연스럽기도 힘듦. 
7,비람피우지말자. 너무 무섭다ㅠ 
9,얼마나 많은 반전을 기대하는 건지는 몰라도 이 정도면 굿~! 
8,여자가 멍청하내 그러니 인생이 그렇지 자기 입으로 믿지말라고 해놓고는 다말하고 의지하내 결국은 주변 모든 사람의 인생을 망친거 아니야 
10,평점이 왜낮은지 모르겠네요 이정도의 점수를 받기에는 웰메이드인데.. 제가 제일싫어하는게 삼류인데 이 영화는 모든 배우의 연기가 정말 뛰어납니다. 마지막 결말까지 숨도 못돌리고 보며 매우 몰입하게 합니다.엔딩이 좋네요...
9,"잔잔하게 재밌어요. 잔인한 장면이 많이나오는 것도 아니고, 묘한 긴장감을 계속 가지고 보게되는 영화네요 "
8,뭐 그냥 무난한 스릴러물...마지막 진짜ㅣ 벤 인물이 등장할때 악인같아보여서 마지막으로 추가반전이 있는게 아닌가 순간 긴장하면서 봤는데 그게아니였음 ㅋ 
10,평점이 왜 낮은지 모르겠네요. 아주 잘만든 영환데. 저는 정말 가슴졸이며 봤고 마지막엔 눈물이 흐르더군요. 주인공 마음을 따라가는 몰입감이 정말 최고이구요 그리고 모성은 이세상에서 가장 강력한 신비인것같습니다. 
8,몰입도좋고 재미도잇음 
9,니콜키드먼 이쁘다.. 
9,니콜키드먼 연기너무좋아요 결말부분은조금 아쉬움 
7,전개 속도가 어느정도 생기는 지점까지는 지루하다. 그래도 스릴러물로서 갖추어야 할 것들은 갖추고 있다. 
6,"진실이 밝혀지는 순간, 공든 탑이 와르르 무너져버린다... "
7,"영화가 너무 밋밋하다. 짧은 런닝타임에도 불구하고 지루함이 살짝 느껴졌으며, 반전이 잇어도 스토리가 진부하다...참 아쉬운 작품 "
10,역시 배우들이 좋네요! 
7,혹독하게 치른 불륜의 대가 
7,배우들이 돋보였다. 4년간 아무도 찾지 않았다는게 미스터리이자 공포. 
3,난 지루하던데... 불륜을 미화한 기억상실증... 
10,재밌었어요 연기도 잘하고 재밌게 봤음 
5,드류 베리모어는 이렇게 되지 말기를.. 
5,"몇번의 반전으로 재미를 꾀했으나... 의외로 식상해져 버린 영화. 니콜키드먼, 콜린퍼스의 연기는 매우 훌륭했다. 근데 왜 재미는 별로 없지? "
8,"소위 평론가라는 저질넘들 국산 저질영화 ""나의 독재자""보다 평점을 낮게 주었다. "
1,이거 재밌다는 사람은 스릴러 처음 봤음? 너무 엉성한 시나리오. 맥 빠지는 연출력. 개연성 없는 전후관계. 시간 정말 아까움. 
5,이젠 별로 독특할 것도 없는데 스릴도 없다 
7,베테랑 배우들의 열연이 주는 팽팽한 긴장감 
8,마지막에 사실 난 남편이 아니야... 했으면 더 재밌었겠지만ㅋㅋㅋㅋ 그래도 재밌었어요    벤은 어떻게 생겼냐고ㅋㅋㅋㅋ 뻔한 내용이긴 하지만 재밌었어요 
10,진짜 남편이 더무섭게 생김...ㅠㅠ 
6,18 진짜 벤은 저렇게 납치감금및 폭행 학대 당하는 아내를 두고 아담만 쏙 빼서 살다가 나타났다고? 말이되냐? 
6,첫키스만 50번째 매운맛 버전 
8,예상의외의 반전이 신선했다 
6,"벤, 아담 소환 필요성이...?;;; "
10,인과응보 니콜 연기 넘잘함 
10,"생각보다 높은 완성도, 니콜키드먼의 섬세한 감정선에 몰입도가 높아졌다. 콜린퍼스의 악역 연기변신도 신선한 볼거리!! 그의 팬으로써 좀 더 이야기를 넣어주지 ㅠㅠㅠ 아쉽다 "
8,기대 안했는데 재미있었던 영화. 스토리도 괜찮고 반전도  적당히 있어 좋았습니다. 
8,메멘토를 다시보는 느낌이네요. 니콜키드먼 예쁘고 연기도 잘해서 좋았습니다. 
6,몰입해서 보았는데결말 너무 허무하네요. 
8,독특한 소재라서 그런지 초반부터 집중해서 보게되었는데 과연 벤이 진짜 벤인가? 하는 마음으로 보기 시작했지만 내쉬 박사가 범인인 것 같다는 생각도 들고.. 이후 범인의 윤곽이 잡혀가면서 점점 화가 치밀어오르는 나를 ...
5,물흐르듯 흘러가는 익숙치않은 진부함 
7,히이즈낫벤---헉!!!! 
6,영화자체의 스릴감은 있으나 여주가 너무 불륜에 빠진다 가짜벤도 그렇고 중간에 내OO사와의 썸씽장면 왜넣은건지 감독이 이상함 불륜에 취향있는듯 
8,콜린퍼스가 너무 좋아서 미칠것같을때 보면 효과좋습니다 너무OOO라 애정이 식음 
5,다른 생각 말고 현재에 충실하며 삽시다 
10,와 왜 8점이 안넘지jQuery22405196647972555033_1518535352888? 몰입감대박.. 
8,인간을 외모로 판단 할 수 없는 것. 밤에 보기 좀 무섭다는 
7,배우들 연기 좋음. 무서워서 뒈질 뻔했음 
8,누구도 믿을 수 없는 모두가 범인같은... 재밌었어요 
8,기억을 찾아가는 내내 같이 맘졸였다 ㅎㅎ 
7,관객 낚을라고 너무 인위적으로 몰아가서 별로... 
10,콜린 퍼스 개무섭네ㄷㄷ 
8,초중반까지는 연출도 연기도 모두 좋았는데..후반부에 갑자기 이해하기 힘든 전개를 만들어 급 마무리~뒷부분이 너무 아쉽다.우리나라에서 이걸 드라마화 한다면  성공할텐데. 
7,누가 진실을 말하고 있는지 마지막까지 헷갈리게 해주네요. 다만 마지막이 조금 아쉽네요. 
6,헐 모야 반전 어쩌구하더니 그게 반전이야? 반전이다그러면 어느정도는 예감하지않나ㅎ 마지막장면이 마지막인지 몰랐던 1인ㅋㅋ 에게 이게 끝이야? 이럼 
6,"그럭저럭 스릴러를 즐길수있고 반전도 쓸만하지만 영화에 채워져있는게 별로없다,,,연출부족 각본부족... "
8,생각하다가 또 생각하다가 마는 조금은 아쉬운 영화 
8,니콜키드먼 아직 예쁘네. 나이가 아주 많진 않았군. 영화는 용두사미로 끝남 
5,용두사미 왜 뒷심이 없어 
7,원작에 비해 아쉽... 베스트평중에 진짜벤이 더 범죄자 같다고 캐스팅미스라는데... 오히려 그러니 바람빈거 아닐까??? 
6,닉네임 피구왕슛돌. 이게 어떻게 새로운 소재의 영화? 영화 보는 폭을 좀 넓혀야 겠네요. 유럽으로 가면 이보다 더 신선한 소재 영화 많습니다 
8,중간쯤 반전이 예상가능했음.. 근데 마이크는.. 4년동안 잘살아노쿠 왜 또때림..원래 폭행하는사람은아닌데 한번때리면 끝을보네ㅡ.ㅡ 스토커.... 
9,몰입도 굳... 반전도 ㅎㄷㄷ하고 결말도 맘에 듬니콜키드먼은 이런역할에 딱인것 같다 
9,"진짜 역대급 긴장감에 스토리였는데 결말이 너무 후다닥 급 훈훈하게 끝나는 바람에... 그 전까지의 연출력도 좀 희석된 느낌 ㅠ, 악역 전투력 역대 최악인듯... "
8,콜린퍼스 연기에 소름ㅠ소재도 괜찮구 지루하지않게 보았네요~ 
7,뭔가 끝이 밋밋했지만 초중반부의 긴장감은 진짜 장난 아니었다. 소재도 나름 재밌었고요. 그나저나 니콜 키드먼은 40대 후반인데도 왜 이렇게 늙지도 않고 예쁨?ㅋㅋ 
6,꼭 싸워서 이겨야만 했나 
6,"잘 달리다 어? 벌써? , 어 ? 어느 정돈 예상은 했었는데 , 어? 설마 , 어? 이렇게 쉽게 ? , 어? 끝인거야? 하고 끝나버렸다. 잘 만들었고 키드먼 연기도 좋은데, 아쉬움이 많이 차고 넘친다. "
7,누가 주인공을 위한 사람이고 누가 진실된 기억인지 모른채로 있다가 진실이 드러나게 되는 스릴러. 니콜키드먼은 언제부터인가 스릴러 인상과 표정의 달인이 되었다. 
7,소재는 좋으나 한편에 담아내긴 버거웠나부다. 급하게 끝나는듯한 느낌이 아쉽다. 
8,후반가면서 김이 약간 새는게 단점이긴 하지만 몰입도는 좋았다. 
9,"짧은 영화이기도 했지만, 몰입도가 높아서 금방 끝난 것 같은 느낌.  스릴러 영화는 이래서 굿~ "
9,이런비슷한내용많았던거같은데 배우가 내가 좋아하는사람들이 나와서 잼있었던거 같음 몰입도도 좋앗음 지루하지않고 재밌고 마지막 아들 꽃소년 엄마닮아서 ㅋㅋ 
7,"정확히 58분까지는 좋다ㅋㅋㅋ그 뒤로 싸지른거 어떻게 치울까.. 하다가 마지막에만 울었네ㅠ 진짜 벤을 보면서 저 배우 출연료  얼마일까.. 신인일까? 어디서 캐스팅했지? 니콜키드먼, 콜린퍼스, 마크스트롱, 진짜 벤 ..."
10,사람들이 나를 찾아줘 랑 엄청 비교하면서 까내리는데 전 오히려 이 영화가 더 재미있었습니다. 처음부터 굉장히 집중하면서 끝까지 본 거 같아요. 몰입력이 장난 아닙니다.. 특히나 엔딩 장면이 정말 인상 깊었어요.. 잔...
9,역시 니콜키드먼~상상도 못한 반전이 대박!!!마지막에 또 아무것도 모른체 일어나면서 끝났다면 리모컨 던질뻔!!! 훈훈한 마무리 눈물났음ㅜㅜ 
5,아침마다 새로운 세상이 펼쳐지지만 기억 때문에 새로운 세상이 아니다. 
9,소름돋는 반전입니다. 대박 
7,재밌네요. 잘 봤습니다. ^^ 결말 부분이 조금 싱겁기는 했던 거 같아요. 
10,몰입도 짱이네요! 꼭 보세요.^^* 
7,서스펜스를 만드는 데만 성공 
7,2014.10.31 
1,원래평점은 3이나 평균평점 조절을 위해 1드림. 스릴러영화 광팬인데 절반가까이 지루했다. 기대하고봐서 더 최악이었던. 
1,별로 너무 시시해 뻔히 보임 
1,바람 핀 여자의 인과응보. 감옥 간 가짜 벤의 집착 정도면 출소 후에도 언젠간 다시 나타나서 괴롭힐듯. 
7,중반부까지 몰입도가 좋은 영화입니다. 후반부에 좀 아쉽긴 하지만 러닝타임도 짧고 꽤 집중해서 볼 수 있는 영화입니다. 
7,큰  기대를 하지 않고보면 볼만한 영화^^ 
5,마무리가 너무 빈약함- 
7,캐스팅으로 장난친 영화..^^ 
7,"영화소재는 첫키스만50번째, 영화내용은 메멘토를 그대로 흉내낸 아류작. 출발은 흥미로웠으나, 뒤로 갈수록 지루함. 결말이 궁금해서 끝까지 보긴했다만, 기대에는 못미침. 킬링타임용으로 가볍게 보시길. "
10,반전있고 정말 볼만한 영화. 
1,"연출은 멍청하고, 각본은 비실하니 "
9,"저는 개인적으로 메멘토보다는 훨씬괜찮았던거같아요. 메멘토는 내용을 너무 꼬고 반복되는 장면이 많아서그런지(스토리상) 지루한면이 있었는데, 이영화는 전개도 빠르고 중간에 계속 흥미로운 인물이 하나씩 등장하면서 또다른 ..."
4,"오히려 너무 뻔했음.스토리가 예상과 같았고, 마이크였던 벤은 처음부터 범인 같았고, 무언가 알려줄 것 같았던 박사는 할 일을 다 하지 못한 느낌에, 마지막 장면으로 진짜 남편이었던 벤과 아들 애덤에 대한 감동은 현저..."
10,누가 마지막에 엉성하고 허무하대!!!! 잘 끝냈구만!!!! 처음부터 후반 전까지 몰입도 장난아니고 긴장감 대박이었습니다... 엔딩도 굉장히 마음에 듬.. 정말 재미있게 봤어요.. 평보고 B급영환가 싶어 안보려했는데 ...
6,지루하지 않을정도의 반전.... 
4,"어디선가 본듯한,  아지만 재미없는 "
8,적당한 반전. 적당한길이. 굿. 
3,좋은 출발에서 나쁜 추락으로 끝나는 영화. 그런게 무슨 베스트셀러가 되엇는지 노이해 
5,충분히 예상가능한 결말. 그게 나쁘다는 건 아니다만 너무 허무했다.차라리 의사가 불법사육딜러고 기억 못할는 크리스틴에게 다음 벤을 소개하고 클레어와 수익분배하는 장면으로 끝났다면 어땠을까 
8,
2,좀억지다.. 어차피 기억못하는거 굳은 벤으로 살필요가 없자나? 중반까지 스릴있었는데 완성도가 매우떨어지네 
6,여주가 늙은 것만 빼면 볼 만했음 
7,킹스맨 요원비긴즈 .. 
8,무엇보다 지루하지않게 반전도 예상 못했습니다. 괜찮았어요 
6,스포) 심오하게 시작하다가 치정으로 너무 허무하게 끝나내요 
7,몰입도를 한껏 끌어올리는 연출 
7,예상가능한 반전에 밋밋한 전개 
8,결말이 뭐가 허무하단건지 1도 모르겠고 난 좋았음. 소재가 매우 신박하고 재밌다 
8,불륜이 이렇게 위험한것이다 
6,후반부 반전을 보고 매우 실망스럽다. 결론은 바람을 피지 말자. 
2,망할만 했다 아무리 영화라지만 굳이 ..점점점 
4,원래 스릴러를 눈가려가며 보는데..인비져블맨(2020)을 너무 놀라면서 봐서 그런지..심장한번 덜컹한다거나 쫄깃쫄깃한 긴장감이 없어요..러닝타임이 짧아서 그런가? 끝까지 허무한 느낌이에요.배우들도 좋고 기억상실이란 ...
8,내용을 다 알고봤는데도 연출이 뛰어나 긴장감이 높았다. 기억상실에 걸리고 궁지에 몰렸어도 자식을 만나겠다는 모성애로 이겨낸듯. 마이크 앞에서 벌벌떨던 크리스틴이 아들 이름을 듣자마자 기억해내고 돌변했고 결말에서도 아...
10,연기도 훌륭하고 추리하며 봤네요ㅋㅋㅋ대머리 의사 의심도 하고ㅋㅋㅋ 스토리 흔치않은데 잘짜여져 있어 아주 잘봤어요ㅎ 하긴 제목부터 독특하니까용ㅎㅡㅎ 
6,2020년에 이걸 봤는데... 같은 배우들 나와서 그런자....자꾸 킹스맨 생각이...ㅋ니콜 딱 눈떴을때부터 아 남편인척 하는구나... 느꼈음.... 
6,반전에 반전에 반전반전 
4,니콜 키드먼이야 자기가 주연이니까 그렇다 쳐도 콜린퍼스는 대체 이 영화를 왜 찍은건지 의문이다. 니콜이랑 같이 작업이 하고 싶었던걸까? 
7,흠~그렇다고~~~~ 
8,반전영화라 계속 의심하고 추리하면서 봤는데도 반전에 소름.. 일부 억지스러운면이 있긴했는데 상당히 긴장감있으면서 재밌었다.사실 눈치 빠른 사람들은 이미 크리스틴이 친구와 대화할때 어느정도 예상할 수도 있는데 저처럼 ...
10,진짜 너무 재밌게 봤어요! 반전 !! 역시 외국영화가 스토리가 좋음 
10,
10,"좋아하는 배우 콜린퍼스,마크스트롱 주연이라 봤는데 역시 재밌네ㅋ마크스트롱 짱 "
8,기본적으로 몰입도가 좋은 스릴러. 
8,주연 배우들의 연기가 압권. 엉성한 마무리가 아쉽다. 
6,첫키스만 50번째 매운맛 버전 
8,몰입도 좋아요!! 배우들 연기가 좋아서^^ 마지막으로 가면서 이야기가 좀 허술한 느낌이지만 재밌게 봤어요 
7,킬링타임용으로 좋아여 볼만했음ㅋ 
10,누가 결말이 안좋데 결말 기대안하고 있었는데 난 갠적으로 넘 좋았음 띵작한번도 이런거 남긴적 없었는데열받아서 남김 
10,스릴있고 잼나게 봤어요내인생을 잘  챙기면서 살아야겠다는 생각~~ 
9,잘 봤습니다^-^ 재밌어요 ㅎㅎ 
8,여주인공이 너무 이쁘다 연기들도  훌륭하고 반전스토리도 좋다. 몰입도가 깊다. 
8,소재가 진짜 괜찮았는데 그걸 살리지 못해서 아쉬움.... 2% 부족한 느낌 
8,올레 티비에 있길래 봤는데 스토리독특하고 막판도 나쁘진 않앗어요 개적으론 잼있네요~ 
10,처음에는 좀 지루했지만 마지막 반전 충격적이었어요 
6,그냥 저냥 재미없진 않아요 
