score,review
9,반전반전 긴장감장난아닌뎅 마지막에 반전이지만 좀 허무하게끝이낫다 흠 
1,이런 영화 좋아 하지만 너무 재미 없음 
5,"매일 일어날 때마다 기억을 잃는 주인공의 설정은 흥미롭지만, 생각만큼 놀랍지 않은 비밀과 반전 때문에 조금씩 쌓이던 긴장감은 끝날 땐 사라지고 만다. "
6,너무 짧아서 오히려 좋았네~~ 그 사건의 댓가로 혹독한 벌을 받는구만... 바르게살자~ 
9,해피엔딩인게 반전이다 
10,짱짱재밋게봣습니다굳 
8,원작인 소설의 지루한 부분을 살짝 없애줬달까? 
7,스릴은 있다.시점이 약할 뿐! 
7,보는내내 긴장..재밌어요 
10,잘 자여진 한편의 연극을 보는 듯. 니콜의 연기가 돋보임. 
9,기대안하고봤는데 재밌었음 중간에 약간 처지는것같아 9점 
10,니콜의  연기력이란..ㅜㅜ)b 스릴감 넘치고 재밌었어요 
10,꿀잼 요 근래 니콜 영화중 제일 흥미진진했다 
9,평론가님들이 알바인가.. 
5,아쉽다.. 기승전망이었다 
9,스릴잇고. 연기잘하고. 반전좋고. 강추!! 근데. 마지막 5분 등장남 캐스팅 미스. 몰입 안됨. ㅋ 
10,긴장감 쩌는 영화...끝까지 잼나게 봤어요!! 
10,오~ 니콜키드먼과  콜린퍼스의 만남!!! 대박!! 완전 심장이 쫄깃쫄깃! 
10,솔직히 8점 이상의 영화 극장에서 보세요. 
9,이런게 진짜 스릴러 영화가 아닌가 하는 생각이...올해 개봉한 스릴러물중에 가장 완성도가 높은 작품이라 생각합니다.반전의 반전을 거듭하는 스토리가 굉장히 흥미롭네요. 
7,누구나 예상 가능한 범인. 하지만 마지막 반전은 ....모성애는 모든걸 뛰어넘는다. 
4,벤보다 마이크가 너무 잘 생김 ㅋㅋㅋㅋ 마지막...뭔가 아쉬움 ㅠㅠ 
8,몰입도 전개 반전 다좋았다ㅎㅎㅎ 오랜만의 괜찮은 영화 
8,스릴도 있고 반전이 꽤 괜찮았음 
1,알바 풀었냐? 점수 작업 작작해라... 딱 기자 평점이 맞는 영화네 
7,평점이 너무 낮다. 처음부터 긴장감을 잃지 않게 잘 만들었다. 미리 내용을 알고가면 재미없겠지만.  주연배우 둘 다 연기를 잘 하니 더욱 볼만했다. 
8,처음에 좀 지루한면이 없지 않아 있지만 근래 본 영화중 가장 쩌는 반전이 담긴 영화... 
10,스릴러판 첫키스만 50번째 
9,"오늘 봤어요! 개봉전부터 기대하고 있었는데, 초반에는 살짝 지루한 부분이 없잖아 있었어요 와 근데 중반넘어가면서 스릴대박..ㅋㅋㅋㅋ제가 은근반전을 좋아하나봐요 반전도 있어서 좋았습니다 니콜키드먼팬이라 9점 드리고 갑..."
2,범인이 남편 (콜린퍼스) 이라니.ㄷ 
1,알바평점때메 1점 줍니다. 딱 7.6점 수준정도에 영화로서 봐줄 만은 하지만 그닥 재밌는건 아님 이딴 영화에 10점주는 인간은 99.99 알바다. 오히려 영화에 대한 신뢰도를 깍는 행위다 쓰레기같은놈들아 영화 한편에...
10,무서워서 가슴졸이며 봤네요ㅠ 니콜키드먼 정말 이런 스릴러영화에 특화된 배우인듯여 목소리 외모 연기력 뭐하나 빠지는게 없이 매력터짐! 스크린 크고 사운드 빵빵한 영화관 가셔서 보셈 꿀잼! 반전 뻔하지 않구 좋았아여 
9,메멘토의 아류작인가 싶었으나 어느 새 이 영화는 자신만의 길을 간다. 후반부로 갈수록 주인공이 전화 받을 때 온몸에 전율이 쫙 돋았다. 
8,평점보다는 재밌음. 반전 좋았음. 
9,평점 이렇게 높게 안주는데 진짜 재밌었음근데 진짜 벤이...ㅋㅋㅋㅋ 
10,이렇게 완벽한 영화가 있는데 이제 보다니... 엄마랑 정말 재밌게 봤네요~ 후회안할 영화입니다 
5,무리수가 너무 많아 아쉬웠던 작품 
5,전개가 자연스럽지 않자 과격함을 fx로 쓰기로 했다 
6,초반부터 몰입도가 좋았다 하나씩 실마리를 풀었다 마지막 실타래가 남았으나 그걸 풀지않고 급결론을 내버림.결론에서 평점을 다 깍아버림 
8,용두사미. 확실한 절반의 성공! 
3,스릴러의 기본은 잘 짜여진 각본인데 이건 기본이 안되어 있는 영화다. 
4,결말이이게뭐야난또막 마이크랑막싸우면서 막그런무서운씬기대햇는데... 
6,메멘토 다운그레이드 버전. 만약 니콜 키드만이 문신을 했다면 업그레이드 버전이 될 수도 있었다. 
7,"소설책은 대박 재미있었는데,원작소설처럼 반전은 옥의티 수준.OOO은 결국 몸으로 때우게 된다?너무 독자(관객)을 가르치려 든달까?주제가 너무 설교조로 흐르는게 흠이라면 흠...하긴 원작을 읽어봤는데 무슨 대학생 습작..."
8,{속보} 내연녀 폭행후 기억상실되자 남편행세. || 그래도 재미는 있음. 중간쯤에 옛친구랑 통화할떄 긴장감이 장난아님. 
2,'메멘토'와 비교되는 독창성 부재와 너무 뻔한 반전. 그리고 '더비지트'는 이 영화를 따라했나 싶기까지 했다. 반전 부분이 너무 비슷 
10,니콜 졸 예쁘 ... 영화 짧지만 임팩트 강한 꿀잼임 
6,"기억상실, 폭행, 불륜, 집착, 우정, 사랑, 모성애, 사건하나에 너무나 많은 퍼즐조각을 만들어 놓았다. 그래도 극의긴장감을 끝까지 놓지 않으려는 노력의 흔적이 보였다. "
7,초중반까지 약간 지루하지만 뭔가 계속 있을것 같은 기대감과 여주인공에 빙의되어 하나씩 단서 찾는 맛이 좋아 나름 재미있게 봤다. 그치만 결말 부분이 약하다고 할까. 좀더 소름 끼치게~미처 몰랐던것을 막 깨달아서 후덜...
7,그냥 볼만함. 좀 더 공포스러웠으면 좋았을텐데.. 항상 범인을 못맞춰서 아쉬움ㅋㅋ 
8,첫키스만 50번째 15년후 이야기 ㅋㅋㅋ 
8,무음으로 봐도 스릴있는..미스 캐스팅이 아니라 반전을 위한 적절한 캐스팅인 거 같아요ㅎㅎ 주인공 외의 모두를 의심하고 추측해가면서 재밌게 봤어요 
10,보는 내내 긴장감 몰입도 최고였음!! 
9,와씨 영화보면서 소름돋은적없는데.. 전화로 클레어가 크리스티한테 벤 생김새 말해보라는데ㅡㅡ 벤이 아니였어 와ㅡㅡ 
6,너무 기대해서 그런가.... 
10,U+비디오에 무료로 떠서 봤는데 정말 잘봤어요 정말 몰입도 있고 좋아요마지막에 왠 석유재벌이 나와서 당황했지만 재미있네요 
7,니콜키드먼과 콜린퍼스의 연기 일품. 긴장감 팽팽함. 잘 만들었다. 
8,흡입력이 대단합니다. 
9,나 완전재밌든데 막판에 소름... 근데 벤 캐스팅은 진짜 미스.. 그래서 1점빼기 
9,영상영화와 활자소설이 같은 이야기 똑 같은 인물을 가지고얼마나 다르게 요리되는지를 너무도 잘 보여주는 작품.. 
1,정말 개쒸레기 영화 ㅋㅋㅋ 
1,니콜키드먼 최악의 영화 인듯 
9,몰입하면서 끝까지 잘 봤습니다 반전도 있고 잼있습니다 
7,반전영화라고 생각하고 본다면 한번 생각할 수 있는 반전이였다. 진짜 벤이 범죄자같이 생겨 마지막에 먼가 다른 반전이 있는게 아닌가 기대를 하기도 했다. 
6,후반으로 갈 수록 진이 빠짐.. 딱히 반전이라고 생각되는 것도 없었음 
6,시작부터 몰입하게 만들었지만 서서히지루함 할망구 니콜 섹시하지도 않다 
3,식상한 스릴러물 ....진짜 빨리돌려서 봤습니다 
7,그렇게까지 재밌고 그렇지는 않다. 그래도 볼만 함. 
9,"기억에 과거에 한 일들이 가족에게 죄를 짓고 현재 연인에게 죄를 짓지만, 과거를 잊은 자아는 자신을 피해자로 여긴다.  그러면서도 자신을 바람따위 안필 인물이라면서도 박사를 유혹하며 잘못된 일을 저지르지. 기억이라는..."
10,"영화처음부터끝이보일때까지,잔잔함은 없다. 비로서 찾아온 잔잔함에 지루함보다 평온을 느껴보시길 "
8,반전은뻔하나몰입도좋았다 이런내용을 짧은시간안에만든것도대단 
8,반전에 반전. 기대에 비해 상당히 재미있었다. 
9,평점이 낮네요 8점은 되는거같은데연출력도 좋고 확 몰입되는 영화에요 
7,충격적인 따귀. ㅋ 그 외엔...반복의 실상이 너무 잔잔해  보는 이로 하여금 여러 가능성을 생각할 수 있게 허용함. 
9,생각지도 못한 반전소재에 소름끼쳤다 
10,"전개가 너무 좋았음.  처음부터 몰입해서 내내 빠져들었고, 긴장감이 끝난 후에 맞은 엔딩은 뭉클하게 만들었음. 또 한 번 니콜키드먼에게 빠져버린 영화. "
10,아니 이거 평점 왤케 낮음? 끝까지 엄청 몰입해서 봤음.. 다정한 이미지의 콜린퍼스 소오름~~~ 끝이 조금 허무하긴 함ㅋㅋ 
9,캬.. 이런 결말이.. 초반부터 추리를 하며 바뀌는 상황에 따라 계속 추리를 해봤지만 이런 결말이라면 맞출 수가 없다.. 다수의 인물이 나오지도않으면서 시청자의 추측을 완전 무너뜨리는 영화.. 
8,"기억과시간을도둑맞은한여자,모든것을되찾기위한하나의 여정.내용이 정말로신선해서 좋았고 초,중반까지우리를극도의 긴장감으로 몰아넣고 후반에서 빨리끝내버린 느낌이 들어 다소 아쉽다는 점.소중한기억들을잊고산다는것은다른사람에게기..."
8,평점 안좋아서 기대 안했는데 긴장감 있고 재밌었음. 갠적으로 콜린 퍼스 아저씨 색다른 모습 굿굿 
8,몰입도 최강이에요 눈을 떼지 못할 긴장감! 초중반에는 벤이 불쌍했어요 기억잃은 아내를 14년간 헌신하며 보살피고 사랑해줬는데 아내는 의심하고 닥달하고...근데 반전이 있더라구요! 역시 사람은 너무 긍정적인것보다 약간...
7,평점 7점이 적당하다..진짜 니콜키드먼 연기는 인정해야 한다후반부 다소 지루한 면이 있지만 볼만한 영화다보는걸 후회하지 않는다. 
7,기억상실을 긴장감 있게 잘  써먹었다 
7,반전이 약했지만 전반적인 분위기가 좋다결말은 예감했던대로 좀 시시함 
8,니콜의 연기는 역시 스릴러의 여왕급이다. 반전의 내용도 좋았다. 
8,좋은 연기와 소제지만 결말이 너무 서두르는듯한 빈약한 결말 
8,이정도 영화면 중상타임. 개인적으론 결말을 좀더 줄여서 임팩트있게 끝냈다면 더 좋았을듯 싶음 
7,난해하지 않는 선에서 보는 재미를 적당히 제공해준 재밌는 영화다. 매일 기억을 잊고 사는 크리스틴의 연기 정말 좋다. 
8,"스릴 넘치고 흥미진진하네요.. 진짜 재밌어요. 근데 다들 마지막 결말이 허무하고 엉성하다고 그러는데 그런말하는  님들이  생각했던, 원하는 결말은 무엇인지?  그게 궁금하네요. 저에겐 나쁘지않었어요. "
7,긴장감 있고 흥미롭다 어떻게 전개해나갈지 기대하며봤다 마지막이 아쉬운부분인것이 많았다 
7,큰 임팩트는 없지만 가족간의 사랑이 세상무엇보다 소중하다는 것을 느끼게해준 영화 
6,초반 흥미끌기는 좋았으나 마무리가 엉성함.  어떤 반전이 있을까 혼자 궁리한게 뻘짓일 정도로 .. 장르는 다르지만 차라리 첫키스만 50번째를 한번 더 보는게 좋았을것 같다. 
10,"어제의 사실은 오늘의 거짓이 될 수도 있고, 때론 사실이라고 기억하는 것들이 상황에 따라 감정에 의해 재구성된 단편들의 조합에 지나지 않을 수도 있다. "
8,거의 뒷부분에서 클레어랑 통화할때 소름끼쳤음. 간만에 괜찮은 영화 봤음. 다만 뒷부분이 살짝 엉성..ㅋ 
10,이거 보여줬더니 와이프가 영화 잘 골랐다고 칭찬해줬다 ㅎㅎ 
9,몰입도 있는 잔잔한 스릴러. 마지막 아담과의 재회장면에서는 눈물이 핑 도네요 
8,솔직히 나를찾아줘 보다 재밌게 봤어요.나를 찾아줘말고 이게 흥행하는게 좋았을 듯 
6,넘버3에서 송강호가 하늘색깔 빨간색이라하면 그때부터 빨간색이란 대사가 생각나게 하는 영화. 
6,초반부터 누가 범인인지 짐작할 수 있었음 
7,아들이 살아있다는 소리에 전투력 급상승 ㄷㄷ 
9,와 정말 소름 돋네. 긴장감 굿 
9,정말 영화처럼 니콜키드먼 같은 여자 데리고살면 얼마나 좋을까 철저히 기억못하게 만들면 되는데 
7,사람의 기억은 불완전함을 잘 보여주는 영화. 아쉬운 점이 있다면 늙은 니콜키드먼. 
10,니콜 키드먼이라... 
1,스릴러를 이렇게 지루하고 뻔하게 만드는것도 감독 재주인듯..정말 짧은 러닝타임동안 지루해서리..진짜 남편이 더 나쁜놈같이 생겼네 ;; 
3,음 막판이 좀 아쉽네요 10점 만점에 3점 정도 영화 
5,재미없음ㅇ가나다라라 
1,엣지오브투모로우에 대응되는 전 와이프표 기억상실증 영화... 
7,스릴러는 아니고... 악숀도 아니고... 모르겠다 노앤설 
10,결말을 제외하고는 스릴있엉ㅅ 
6,나를찾아줘를 보고 봐서 그런가.. 큰재미는못느꼈다. 적당히볼만함 
10,진짜  스릴대박  완전 강추!!! 
1,그냥 예상 가능한 지후한 영화였음.... 
8,진짜 장난아님... 반전 스릴러의 바람직한 예를 오랜만에 본것 같네요 원작소설도 재미있게 봤는데 영화도 배우들이 워낙 연기를 잘해서 정말정말 심장이 쫄깃했어요 
5,니콜 몸이 젊을때 몸이 아니군... 나이들어 처지는거 보다 살을 빼는걸 선택한듯!? 
3,"단언코 올해 본 스릴러,미스터리 영화 중 최악. 진짜 구림. 그냥 뭐라 할 말이 없다. 설마 했는데 설마 하고 끝나서 기분까지 나쁘다. "
8,여자 때리면서 당당한 한남충이 나오는 스릴러 
1,뻔한 반전에 지루하게 전개되다가 소리로만 깜짝깜짝 놀라게 하는 재미없는 저질 스릴러. 돈과 시간이 매우 아까움 ㅜㅜ 
1,지루하고 느리고 답답함. 절대보지마 
8,죄를 지었기에 좀 더 지독한 벌을 받았다 
4,아.. 이미 처음부터 콜린퍼스가 나쁜넘일 거라고 예상해 버렸다. 캐스팅 참 못했네. 안어울려.. 키드먼 혼자 열연하셨으나 지루하고 뻔한 스릴러. 90분조차 지루하게 느껴지게 만들다니... 원작소설이 나을듯 
2,처음부터 끝까지 취향에 안 맞았음. 스토리 전개야 괜찮은 것 같긴 한데 딱히 공감 안 갔음 
1,"1 점도 아까운 이 영화의 평점이 왜 그렇냐면, 처음 연출 1, 중간 연출 2, 마지막 연출 3 이 쓰레기이기 때문이다. 합해서 쓰레기.  관객이 기대한 것을 반전으로 삼아야 하는데 삼지 않고 욕먹기 딱 좋지. "
1,"평점을 깍아야겟기에...죄송, 우선 재미면으로는 5점 정도로 딱 중간인데, 반면 이런류의 작품들이 흔하고 이미 대박친 영화들의 짜집기 같은 느낌과 결말까지 평범해 그냥 역시 평범한 영화가 되어버린 영화 "
8,벤의 캐스팅이 정말 안타깝네요 반대로 했음 더 나았을듯. 암튼 스릴은 최고인 영화 
6,기대가  너무 커서인지 보통정도~ 
1,이거 첫키스만50번째랑 똑같은 내용 아님???? 자고 일어나면 기억 다 잃는다는 소재가 완전 똑같은데 
6,그러게 바람을 왜 펴~~ 당해도 싸다...반전은 좋은데 주인공이 안불쌍해서 6점! 
6,"상영시간이짧아서 아쉬움, 밴 에플렉의 나를찾아줘 가 더재밌음 "
9,"시사회로 봤다. 내가 좋아하는 스릴러. 기대치를 충족시켜주었고,  진짜 소름돋았음. 완전강추 "
1,바람핀 시레기 니욘 쌤통이다. 
10,간만에 심장 과 염통이 동시에 쫄깃해지는 영화였응 ㅋㅋㅋㅋ배우들 연기 황홀함!! 
6,마크스트롱과 잘되길 바란건 나뿐인가.. 
1,스릴러는 얼어죽을 폼만졸라게 잡다가 다예상하는결말로 끝 아 시간아까워 
5,누가재밋데재미없다퓨추 
6,마지막 아들 존잘. 불륜 벌받은 여자 
10,처음부터 끝까지 스릴넘치고 재밌었음 
5,김치들 댓글 스포질 지겹다. 댓글 보지 마세요 절대로. 이것 좀 올라가게 추천 부탁해요 ㅡㅡ 좀 영화좀 편하게 봅시다 
1,어디서 본듯한 스토리.. 뻔한 전개;; 
7,사고로 하루치 기억밖에 하지 못하는 크리스틴은 닥터 내쉬의 도움으로 옛기억을 찾던중 자신를 보살피는 남편 벤이 사실은 과거 불륜상대이자 자신을 폭행해 기억상실로 만든 범인임을 알게 된다. 결국 그는 체포되고 4년전 ...
5,벤(콜린퍼스) 는 사실 남편이 아니고 니콜키드먼(크리스티)을 감금하고 폭행하는 전 불륜남. 기억상실증을 이용해 감금하고 있다. 
