score,review
8,이민자들의 향수를 잘 담아낸 영화. 웃다가 울다가 하는 그런 영화. 50년대의 향수도 잔잔히 느낄수 있었다. 
10,여운이 가시실 않네요.. 
8,배경과 음악과 여주의 연기가 좋았다 
8,잔잔한 감정표현이 잘된 영화 
9,마음이 편한 곳 마음이 편한 사람 그곳이 내 고향이고 내 사람이다 
10,익숙한 곳에서 가족과 함께 할 수 있고 부와 인성까지 갖춘 사람이 날 사랑해준다면...흔들릴수도 있을거 같다.하지만 결국은 내가 힘들때 내곁을 지켜준 사람...그래 그 사람이라면 평생 행복할거같다. 사람은 사랑으로 ...
9,엔딩부분이 다 만족스러운건 아니지만 그마저도 인생을 나아가는 것의 한 부분이라 생각이드는 영화여주인공이 고향에서 느낀 감정과 먼 곳에서 느끼는  외로운행복도 다 잘 그려냈다.그리고 남자 주인공은 항상  멋졌다. 토니...
5,"주인공이 나은 삶을 위해 타지에서 느끼는 외로움과 어려움, 극복하게 하는 사랑이라는 부분까지는 좋았다..근데 고향에서 새로운 사랑에 흔들림과 다시 원래 사랑으로 돌아가는 과정이 개연성도 없고  찝찝하다. 영상미나 배..."
1,여자의 마음은 갈대라서 쯔쯔쯔 
10,사랑하는 사람이 있는 곳이 제 2의 고향이라는 교훈을 주네요. 저처럼 타향살이 하는 여성분은 눈물 줄줄줄 공감하면서 볼거에요 
10,최근에 본 영화중 최고다. 삶에 있어서 언젠가는 하게되는 선택과 주변환경이 미치는 영향에 대해 깊이 생각하게 하는 영화다. 
10,중간중간 눈물이 많이 났네요. 
10,"영상미가 좋았고, 배우의 연기도 ost도 연출도 좋았어요. 한가지 아쉬운 건 상영관이 얼마 없는 거? "
10,주인공 캐스팅도 좋고 줄거리도 좋고 
1,"정형적인 여성향 영화 불륜조장, 내로남불의 정석 최악의 영화였다. "
1,불륜만 안 넣었으면 진짜 명작이었을텐데 
4,"신분 상승을 꿈꾸는 아일랜드계 이민 여성의 삼류 불륜 로맨스 드라마. 사랑으로 포장되었을뿐 여자의 이기심을 보여주는 영화, 바람피다 걸리니 바로 통수치고 도주시전 ㄷㄷㄷ "
1,이게 뭐니 걸리지만 않았으면 딴놈에게 가랑이 벌리는 영화아냐 진짜 욕나온다 
10,새로운 삶에 적응해나가는것 공감되어졌네요 
10,로맨스영화라기 보다 성장영화같다뉴욕까지가서 새로 시작하고 공부하고...도전정신이 부럽다 
10,시얼샤로넌 의 풋풋한 연기와 스타일이 예쁘다.자식 앞에서 의연한 모습을 보이는고향에 홀로 남겨진 엄마도 안타깝고내 취향 영화라 좋았다! 
10,"왜 그녀는 아일랜드를 떠나 왔는가,켈리 여사와의 말 다툼에서 그 이유를 다시 한번 상기 시키는 엘리스의 모습은 진취 적이었다 "
8,전후 아일랜드 상황을 모르니 개인의 행동 탓만 하죠 승전국 영국도 장기 실업에 밥 굶고 살던 시기가 딱 저때입니다 미국으로 부가 넘어가던 큰흐름이였거든요 아일랜드 시골에 실업자가 일자리 잡으려고 뉴욕 건너가 힘들게 ...
4,초반부 내용은 좋았는데 여주가 좀.. ㅎ 빡쳐서 보다가 끌 뻔했네요 
9,남자주인공의 눈빛만으로도 볼 가치가 있는 영화 
10,"과거,도전,그리고 현재.새로운 도전은 늘 과거로 인해 혼란을 주는것같아요.안주하지 않는 성향을 가진 여주의 선택이 이해됩니다. "
10,나를 반짝이게 만들어주는 곳이 집이다 아일랜드에서 그녀는 아무도 아니었지만 브루클린은 그녀를 빛나게 만들었다 이제 그녀는 다시 돌아간 아일랜드에서도 빛이나고 누구나 알아봐주는 슈퍼스타가 되었다 
8,낯선곳에서의 편견을 넘어서는 자유로운 만남과 사랑... 고향의 좁은 사회의 특유의 꽉막힌 숨막히는 삶.. 자유를 찾아서 사랑을 찾아서 브루클린으로.. 
10,꼭보세요 두번보세요 영화정말좋아요 
10,어떻게 저런 눈빛이 나올수가 있죠...마지막 장면은 죽은 시인의 사회. 페인티드베일 이후.수십번 보고.또 보고. 또 돌려본 내 인생작.내 삶에 큰 영향력을 미치는 영화.삶 
10,이건 로맨스영화가 아니다 
8,사랑은 타이밍. 어려울 때 위로해주는 사랑. 결정의 시기에 만나게되는 사랑. 그 사랑을 선택하고 책임지며 그렇게 성장한다. 
10,"대부분의 관람객이 불륜이라고 그러는 것은 이해가 감. 근데 이 영화를 단지 로맨스, 남/여 사랑얘기 라고 보는건 너무 단편적임.. 고향으로 돌아갔을때 여주의 심리변화를 좀 더 자세히 연출했다면ㅠㅠ 갑자기 여주가 맘이..."
8,"아이리쉬 미국정착사와 한여인의 운명적 연애, 켈리 2018해 "
8,여주는 착한듯 하지만 약간  bitch.. 초반에 은따 말라깽이 하숙녀한테 한 짓도 좀 읭 스러웠고 남주들도 불쌍. 의상은 빈티지하면서 너무 예뻤다 
6,들통나지 않았어도 돌아갔을까? 그게 진정한 사랑일까? 
7,약간 진부가하고   지루함 영화의 요소가 부족함  책을 읽는게 나음 
9,결국 유부녀인거 들통나서 돌아간거자네 ㅋ 돌아가서 난 널 버리지않앗어 ㅋ 여깃지롱 ㅋ하고 끝남. 근데 재미짐 
8,고향을 떠나 타지에서 생활하는 사람이라면 한 번 쯤 겪어봤을 이야기. 그나저나 토니가 왜 조연이니? 네이버 영화 안봤니? 
10,토니랑 일리스 너무 잘어울림 
5,단조롭고 졸립네요 많이 
7,멜로영화를 보면서 여주가 싫어진건 처음이야 
8,대학 진학과 동시에 고향 떠나 산지도 어언 10여 년. 나는 영화를 보는 동안 에일리스가 되어있었다. 
8,재밌었고 설레이고 귀여운 영화근데 만약 미스 켈리가 말을 안했다면 어떻게 됐을까..? 
8,고향에 대한 향수에 젖어 잠시 잊을 뻔한 새로운 삶에 대한 그녀의 선택이 행복하길. 
7,후반부 진부한 로맨스연출 유혹을 극복하고 진정한 사랑에게 돌아가는 여주인공으로 포장된 이기적 불륜녀 
6,평점오바됐다. .네이버의심스럽다. 마지막 브루클린으로 돌아가는 과정이 개연성이 너무떨어지고 뜬금없다. 파리폴리라는 영화처럼 설득력이있어야지.. 
7,"어바웃 타임의 생강머리가 짐 패럴이었다니? 스토리는 집을 떠나온 사람이 겪는 점을 표현 하는 것은 좋았으나 중반 이후로 폐쇄적이고 어쩔수 없이 작은 사회에 엮이게 되는, 결국 고향에 머무르고 싶은건 알겠지만...? ..."
10,에일리스 역의 '시얼샤 로넌'과 토니 역의 '에모리 코헨'의 연기가 매우 인상적이다. 두고두고 소장해놓고 꺼내보고 싶은 영화... 
9,잔잔하면서도 집중하게되는 그런 영화 
6,재밌게 잘 보고있다가 마지막 20분정도는 기분이 좀 좋지 않았다 
9,배우의 연기 음악 모든 것이 다 아름다웠다 
8,캐스팅잘됐다 그리고 스토리도 좋다 다만 지루한부분이 있었던거는 사실 
9,좋은 영화네요 생각하게 만드는 
9,수도권 토박이인데도 흥미진진하게 공감하면서 봤네요~ 추천합니다^^ 
10,시얼샤 로넌 연기가 엄청나더군요. 스토리도 짜임새가 있고. 
8,서로에게 단한마디도 왜냐고?  왜그랬나고? 무엇때문이냐고? 묻지않음. 우리는 사소한 것에도 이유를 너무 알고싶어함 
1,평점이 심히 높구나. 무슨 이런 영화가. 
10,지금의 내가살고있는 집도 언젠가는 하나둘 생을마치고 홀로남아 공허함만이 있을지도 모른다. 진정한 삶의 안식처는 행복과 사랑이있는 곳이 아닐까? 
8,바람녀들은 사실 매우 감성적이라능.. 
4,영상은 참 멋있지만 스토리가 의외로군요. 의외로 의외였지만 종합하면 실망 
8,우아함을 잃지 않으면서 주체적인 여성영화. 
10,바보들.. 여주가 안락함을 뒤로 하고 다시금 자기인생 개척하게된다는거잖어 그리구 그게 인생이구 자신을 찾는 길이구 성장이구 나쁜 할머니가 협박한건 자신이 왜 아일랜드를 떠났는지에대해 각성하게 한거구 왜 떠났겠어 노답...
1,난 재미 없던데. 주인공의 마음이 흔들리는거도 이해 못하겠더라. 
8,집에 있는데도 집에 가고싶을꺼야~♪ 
10,남자인데 거의 몇년만에 영화보고 울었다....나와 다른사람들의 삶에서 어렵지않게 찾아볼수있는 공감되는 이야기. 
10,아름답고 잔잔한 드라마 
10,
10,
10,타지에서의 삶과 감정을 잘 그려낸 영화 
8,"토니를 선택한것이 아닌 브룩클린에서의 ""삶""을 선택한 것. 본인 행복 선택 성장 다 좋은데 고향의 그남자는 뭐란 말인가...선택은 이해되나, 너무 매너가 없어서 응원하지 못하겠다. "
10,
6,"촛점은 극히 가장하지 않은 현실에 대한 우리들의 자세인것 같다. 예전에 사귀던 사람에게 연락이 와서 반가운 마음에 다시 만났는데, 그래...그사람의 그모습을 잊고 있었어..다시 헤어졌다.시간이 흐를수록 사람은 환경에..."
10,휴..다행이다.토니에게 돌아가서. 
10,한국은 이해 못하는 스토리 
10,여주의 선택이 어찌됐든 현실에서 있을 법한 얘기마지막 자기합리화까지도 나에게는 너무 현실같았던 영화였다 
10,한국 정서에는 맞지않는 영화다과거에 연관이 없는 사람 다른나라에서 온 사람과 주인공또한 새로운삶을 시작하는 나라에서 생기는 그 애틋함은 조국에서의 같은 인종끼리 나누는 사랑과는 확실히 차이가잇다 미국 캐나다 주로 영...
10,여배우가 너무 좋았고 사랑스러웠다 
10,사람은 너그러움이 있어야 하고  사람은 자신의 삶을 잘 꾸려 갈 줄 아는 현명함이 있어야  남보다 값진 삶을 살 수 있다는깨달음이 있는 영화였다. 
10,응 그래 니 인생이야  8.5점정도 하는데 평정 올리려고 10점 주고 간다 
8,재밌다 주인공이 점점 당당하고 주체적으로 변화해가는 모습이 좋았다 만약 주인공이 아일랜드에서 살기로 결심하는 이야기였다면 실망하고 찝찝했을것이다 하지만 주인공은 새로운 삶을 위해 걸어나갔다 타지에서. 너무 멋있다 남...
7,여주의 세세한 심리적 묘사가 조금 부족한 거 같음. 
8,"마치 고전을 읽는 듯한 느낌을 받을 정도로, 소설을 스크린으로 훌륭하게 이식했다. "
10,사람 마음이 다 그렇지. 최근 여배우 중 단연 원탑. 
7,나를 사랑해주는 사람들이 있는 곳이 바로 고향이란 것을 
8,시대와 인물이 잘 반영되면서도 뻔하지 않은 스토리로 갈증을 주지 않는_ 조용하고 섬세하면서도 마지막까지도 집중해서 보게 만드는 작품. 시얼사 로넌의 성장 영화. 
10,특별하지 않은 듯 하면서도 굉장히 흡입력있는 영화. 
10,왜 주연이 토니가 아닌지 이상하다. 토니 넘 사랑스러워 
10,"남주가 너무 사랑스러운거 아니가... 여주가 좀 나쁜 여자이긴 햇지만 남주가 너무,,, 진짜 남주가 살렷다 ㅠㅠㅠ넘나 사랑스러운 남편 "
6,같은 여자로서 여주의 갈팡질팡한 마음을 전혀 이해하지 못하는 것은 아니지만 다시 브루클린으로 돌아가는 그녀에겐 이미 벌어진 상황에 대한 의무감이 커보였는데 점주의 말에 잊었던 또하나의 마음이 떠올랐나요?아일랜드에 두...
3,"고향을 떠나 새로운 곳의 새로운 삶, 향수병 이런것 들을 이영화는 잘 표현하였다. 그러나 여주인공이 아일랜드로 돌아가 하는 행동에 적잖이 실망했다. 마지막부분은 잘표현하였으나 굳이 짐을 넣었어야했나 싶고 불륜은 어떤..."
9,"잔잔한 색감과 음악이 너무 마음에 들었고브루클린 생활 초반, 에일리스의 모습에 감정이입이 잘 되어잠 안 오는 밤 취향적 영화라 기억에 남을 것 같다.우연히 보게 된 영화에 짙은 감동과 여운이 느껴질때,그때마다 힘을 ..."
8,남주는 토니가 맞다! 원작을  보더라도! 
9,"it's a well-made film if you had felt a homesickness in the past, it should invoke the feeling of the very time.. en..."
5,그냥 전개가 조금 지루했어요.. 
7,로맨스는 반찬모드였다. 그래서 토니는 조연이다. 잠시 연예인병에 걸린 여자는 고향의 향수를 살포시 뿌리고 자신의 인생을 위해 뉴욕으로 돌아간다. 이 영화는 그런 내용이다. 그래서 로맨스가 반찬모드였다. 
7,시골뜨기의 도시 적응기 
6,"이 영화는 에일리스가 토니를 배신을 하느냐 안하느냐, 나쁜년이냐 아니냐가 중점이아니라 누구에게나 존재하는 에일리스의 편안함에 혹하고 흔들리는 연약한 인간적인 모습들이여.  순수했던 에일리스의 아름다움이 성숙해질수록 ..."
6,무난한... 향수병이 저런 걸까 싶었다. 
4,물체가 움직이거나 어떤 일이 진행되는 빠르기 
10,아니 대체 어떻게 토니가 조연이냐 이 멍청한 네이버야토니가 어떻게 조연이냐고 
9,오래시간 유학을 다녀왔던 나로써는 그냥 겹쳐지는게 많아보였던 영화.. 삶과 사랑  잔잔했음 
7,영화보다 옷 보는 재미가 더 
10,토니가 왜 조연입니까~~~!!?? 고쳐주세요 
10,돔놀 글리슨이 주연이라면 에모리 코헨도 당연히 주연입니다. 저렇게 사랑스러운 남주를 왜 조연이라고 하시는지!! 
8,네이버 뭐냐? 왜 남주를 주연에 놓지? 포스터 안보이나? ㅋㅋㅋ 유명해서 조연을 주연에 나뒀나..어쨌든 마무리가 좀 서두른거 같기는함...다시 안돌아갈까봐 내가 다 조마조마 함. 그리고 남주 캐스팅이 신의한수 
8,"남자 주인공이 이렇게 사랑스러울 수가 있는지ㅠ 보는 내내 입가에 미소 지어지는, 설탕 100포대 뿌린 영화. 1950년대의 뉴욕! 특히 코니 아일랜드가 너무 달라서 놀랐지만, 그만큼 그 시대의 뉴욕을 잘 재현했다는 ..."
6,후 진짜여주ㅡㅡ극혐이다 넘나사랑스러운 토니를두고 바람을 펴?? 
9,그 마녀아줌마로 알게되든 어떻게되든 그녀는 미국으로 갔을꺼같다... 
8,네 미래를 사줄 수 없다니.... 맞는 말입니다 진심 
9,최고의 여성 성장 영화!! 여주인공 연기도 좋아요 
10,대부분 고향을 떠나서 일하는 우리들의 삶을 보여주네주연이 토니인데 왜 조연인지 모르겠다. 
10,기대않고 봤는데 괜춘네요~ 
8,일리스가 행복했으면 좋겠다 
10,그래도좋았다. 남주가한목한듯 
9,아름답고도 씁쓸한 영화네요 재밌었습니다 
10,"아일랜드에 대해 막연한동경으로 시작된 영화보기는 너무좋았다.  눈을 뗄수 없을정도로   출연자들의 의상은 너무 예쁘고,  볼만한 영화였다 "
7,색감과의상모두완벽!! 미묘한여주인공의표정변화를아름답게클로즈업으로잡은장면이 두고두고 기억에 남는다 
9,진한 영화의 향기와 컬러에 취하다  여운이 남는 작품 
8,기대안했는데 잔잔하게 볼만했다여자는 어느정도 공감할만한 내용 
8,예쁜 영화였어요.. 충분히 공감할 수 있는 장면들이 많았네요 
9,"오래간만에 영화관에서 ""감상""한 영화. 사람과 사랑, 고향은 떠난 타지 생활...더하지도 덜하지도 않은 섬세한 연출이 정말 마음에 와 닿네요. "
6,나의 삶이 시작되던 그 순간이 떠올랐다. 
10,"오늘 두번째 관람이네요. 1950년대 뉴욕 브루클린배경, 빈티지의상..연기는 말할것도 없구요..두번보니 더욱 많은게 들어와 후회없는 관람이었습니다. 상영관이 턱없이 부족한게 진심 안타깝습니다. "
9,매우 낭만적이고 품위있는 영화. 감정을 잘 절제하여 군더더기 없게 만든 성장영화. 오래 국화같은 잔향을 남기게 될 잘 만든 예쁜 영화입니다. ^^ 
8,막연하게 서정적인 영하라고 생각했는데 주인공에 몰입되어 마음이 아팠다가 쓰렸다가 기쁘기도 하고 여러감정이 겹치는 영화였다. 가을에 로맨스영화 많이보지만 지금 이 계절과도 참 잘어울리는 영화인듯!!! 
8,"사랑스러운 색감과 패션, 흐뭇한 웃음을 짓게만드는 영화 "
7,과제때문에 관람했어요. 이 영화를 보니 미국에 가고싶습니다. 
9,그녀의 푸른 눈에 빠져들다 
9,여자로서 공감도 많이 되고 화면도 참 예뻐요! 
9,평범한 내용일 수 도 있는데... 멀리 다른 세상에 사는 사람들이나 우리들이나.. 다들 비슷한 고민 생각을 하는 구나 싶어 공감이 갑니다. 잔잔히.. 편안한 영화네요.. 
5,가족이든 사랑이든 둘 중 하나만 선택하자.. 이도저도 아니게 만든 밋밋한 영화. 아일랜드 영화라고 해서 너무 큰 기대를 한게 잘못. 
6,"인간은 나약하고, 흔들리다가 자리를 찾는다. "
8,마지막에 개연성이 떨어진 것이 약간~ 아쉬웠으나. 전반적으로 부드러운 분위기의 영상이 좋았고. 가장 인상적인 건 역시 여주인공의 연기.. 
4,글쎄 차분한 감정과 스토리전달의 장점외에 별느낌이... 마지막 주인공의 선택이 꼭 더 낫거나 감동적인 결말이라고 생각이 안들어서... 
8,시얼샤 로넌의 파란 눈이 돋보였던 영화. 아일랜드 시골 처녀의 성장기이자 귀여운 로맨스물이기도 했다.네이버에 낚여 도널 글리슨 언제 나오나만 기다렸음-_-인간적으로 주연은 아니잖아요. 
9,마지막이 약간 아쉽지만 대체적으로 너무 좋았어요 
9,정말 인생은 선택의 연속. 인생에서 누굴만나느냐는 정말 중요하다는걸 다시금 느끼게되는 뭔가 보고나서 으쌰으쌰 힘을 받게되는 영화였다  힘들때 찾게되는 영화가 될거같음! 
8,솔직하게 다가오는 성장영화 
9,과거와는 상관없는 당신만의 한 사람. 
7,다 좋은데 마지막부분이 별로..ㅜ 이해가 안간다 
8,주체적인  인생을  살게되는 성장영화라고 볼 수 있는 면이 80% 그러나 선택의 이유가  정말 주체적인가는  약간 갸우뚱. 
8,사랑하는 사람이 있는 곳. 새로운 내 고향. 마지막에 빛나던 그녀의 핑크색빛 입술처럼 앞으로 그녀의 날들은 수줍게 찬란하겠지 그곳에서. 
6,어떤 상황이 와도 난 홀로 버텨낼 수 있을까. 누군가의 손길과 따뜻한 말한마디가 필요할까. 
9,"home is home....이지만...익숙한것들이 주는 편안함에서 더 넓은 곳으로의 독립,모험,성장을 위한 선택이 옳은것이겠지? "
8,여주 욕하는거 이해는 되지만 나도 서울에서 타향살이하면서 공감되는 부분이 많았다... 
7,향수라는 주제로 한 인간의 성숙을 다루나 했더니....결말이 많이 아쉬웠음 
10,'어디에 머무를 것인가'를 결정하는데 직업은 큰 영향을 미친다. 이것은 영화의 주인공 에일리스에게도 현대 여성에게도 마찬가지이다. 여성에게 있어 결혼은 부모보다 중요하다는 것을 느끼게 해 준 영화. 
10,머물던 곳을 등지고 고향을 한 번 이라도 떠나본 사람이라면 누구나 코가 찡해질(그러나 기쁘게) 그런 영화. 내 삶이 시작된 곳이 아닌 내 삶을 만들어갈 그 어딘가가 고향이라는 말에 동감... 어디에서나 마음을 나눌 ...
9,서로에게 익숙해졌을때 보기 좋은영화 
10,인생이란 참 뭉클한 것 같다. 
7,일자리가 많지 않은 소도시에서 젊은 여자가 처할 수 있는 상황에 공감이 갔다. 시대와 공간이 다른데도 말이다 . 가족들과 멀리 떨어져서 자신의 미래를 찾아야 하는 생이라는 것이 슬프고 냉혹하지만 보고나니 어쩐지 앞으...
10,예기치못한곳에서 마주치는 진심 
7,여주가 너무하다ㅠ 나빳다ㅠ 
8, 누구나 한번 씩의 겪을 법한 이야기에요~! 마음을 정리하고 싶은 분한테 강추입니다^^ 
10,혼자보기 좋은영화 많은걸 생각해주는 여운이남는듯. 그리고 남자주인공들 선택은 정말 탁월했음 
9,내 인생이 있는 곳...  누군가와의 만남이 삶에 얼마나 큰 영향을 주는지 보여주는 영화 
7,사랑과 결혼 가족에 관한 영화 
1,"영화 자체가 나쁘진 않은데, 스토리는 참...이 영화의 교훈은 와이프를 절대 타지에 보내지 말자임. 어쩜그리 손쉽게 유부녀의 신분을 감추고 다른남자와 교제를하는게 미화될수있는지 의문. 정말 남편만 불쌍한 영화.. "
8,"여배우의 눈빛이 열일하는 영화. 그녀는 그때의 선택을 한참 후, 부모가된 후,  어떻게 기억할까?... "
9,"고향을 그리워하는 내용인줄 알았는데 마지막 미스켈리와의 대화가 계속 머릿속에 떠오릅니다. ""잊었어요... 이 마을이 어떤곳인지 잊고 있었어요"" "
9,네이버는 도널이 더 유명해서 주인공을 도널로 해놨나? 덕분에 마음조리며 보긴 했어요(도널역 맡은 배우가 왜 이걸 골랐지?싶긴해요) 우리 인생엔 사랑이 있어도 시련은 많다는 걸 보여줘서..여운이 남는 영화예요. 어머니...
10,엘리스의 눈빛이 대사를 읖는듣한 섬세한 아름다운 영화. 지금내가있는곳이 홈인거지. 
10,오랜만에 괜찮은 영화봤다. 양다리는 안된다라는것을 깨우쳐 주는 영화다 
8,잔잔하고 애절하다. 여주인공의 특별한 눈빛이 인상적. 짐한때 끌리게된 과정의 디테일함이 반영되지 않은것이 아쉽다. 또 아일랜드관련된 소재네ㅎ. 좋은 영화. 
8,그런데 일리스가 가장 아름다워 보이는 순간은 짐과 춤을 출 때였다. 
1,여자들말 공감할수있는이야기 
8,격동하는 시대의 흐름을 한 소녀의 성장담을 통해 우아하게 그려냈다. 변화와 안정 사이의 선택은 시대를 지나 지금에도 유효한 문제. 
10, 어톤먼트의 어린소녀가 브루클린으로 이렇게 멋지게 돌아오다니 에일리스를 연기한 로넌의 연기에 빠져들어 시간가는줄 모르게 보았다. 토니와 짐 사이에서 갈등하는 에일리스. 영화를 보고나면 배우들과 감독의 필모를 찾아보게...
10,변태 살인마 자극적인 영화에 질린 사람에게 추천 특히 여주의 마인드가 너무 좋다. 역시 서양여자들은 김치녀와 다르게 밀땅이 없네 
7,씨네큐브 상영작들은 항상 일정 수준이상이다. 이 작품은 그 평균에서 못미치는 느낌...동남아에서 한국으로 시집온 여자들이 생각나는 영화... 
8,"적응과 홀로서기, 성장과 사랑을 다룬 영화 "
10,성장한다는 것은 어떤 중요한 선택의 결과물.근데 난 성장한 걸까?모르겠다. 
6,왜 이렇게 평점이 좋은지가 솔직히 모르겠다. 이렇다할 무언가는 없었다 
5,잔잔하게 흐르는 영화의 흐름은 좋았다. 하지만 이런 잔잔함 속에서 내가 뭘 생각해야는지도 모르게 그냥 2시간이 흘러간 것 같다. 아이리쉬 걸의 아메리칸 드림이라는 1부 드라마를 보고 아일랜드로 넘어가 2부 불륜드라마...
4,머리좋고 이기적인 여주가 인복만 좋은 스토리 
2,길게 설명 안한다. 보지마라 
10,처음에 너무설레이고 재밌다가 고향가서 하는거보고 막화났었는데 깨달아서 다행이네요...흠 당연한거알면서도 화났었네요..ㅎㅎㅎ여친생기게 해주세요 
2,변퇴년. 결혼사실 속이고 연애질하다 들켜서 토시고 다시 남편한테 돌아가서는 사랑해요 자기뿐이예요 무섭다 양키년 ㄷㄷㄷ 
6,토니배역이 쫌 매력 모르겠음. 
8,"향수병이 걸리면 죽고 싶겠지만, 견디는 수 밖에 어쩔 도리가 없어요. 하지만 지나갈 거예요. 죽지는 않아요. 그러던 어느 날 갑자기 태양이 뜰 거예요. 바로 알아차리지 못할 수도 있어요. 그렇게 희미하게 다가와요. ..."
7,그렇게. 현실로부터 도망치듯 떠난 곳에 뿌리를 내리는 어린 나무들이지요.. 
5,중반까지는 잘나가다가 후반부 어이없는 행동에 실망 
7,나는 보면서 불편했다. 나쁘다 생각했던 사람들은 괜찮았고 성공을 위해서 배를 타고 며칠 몇달을 갔을텐데..끝이 암턴 아름답지 않았다. 
8,에이...좋다가 말았네. 난 후원자에 얽힌 비밀스토리라도 있는 줄 알고 한참 빠져있었는데 갑자기 끝나버림. 그것도 자의가 아니라 타의로 마음을 바꾸는 주인공의 모습은 내 감정을 다 망쳐버렸다ㅠㅠ 순수한 토니는 평생 ...
9,
9,"사랑하는 사람을 만나는 것에 관하여,인생의 변화에 관하여 "
7,고향은 추억과 관계들로 헷갈리게 만든다.그러나 언젠가 내가 스스로 결정했을때 기꺼이 가장 큰 증언이자 지지자가 되어줄것이다. 
8,토니 버리려는 줄 알고 놀랐잖아... 
9,친구가 재밌다고 해서 재밌는 줄 알고 봤다가 혼자 보면서 엄청 울었는데ㅠ뭔가 너무 슬프다... 
