score,review
1,한국인이라면 이딴 애니 보고 감동받아선 안됩니다 ㅡㅡ 역사왜곡 애니매이션 
1,하. 
1,OOO기 보다 나올뻔 
1,너무 재미없다. 
4,이건뭐 일본을 위한영화인지 사랑을위한 영화인지 
7,굳이 전쟁에 관한 요소를 찾기위해서 보지만 않으면 될듯 
7,"오랜 시간을 두고 잔잔히 치는 파도같은 영화. 추억은 미화되기 마련이고 감독 특유의 정서가 묻어난 영화의 내용도, 영상도 아름답지만 전범자까지 미화한 것은 자기 위안을 위한 변명같다. "
1,"일본의 자위질에 질린다.전쟁 범죄를 단지 열정, 꿈, 사랑, 이상등의 단어로 얼버무려 면죄부를 주려는 저질영화.하야오의 주장대로라면 히틀러도 이슬람 테러범도 단지 열정적으로 본인의 꿈을 향해 달려갔을뿐 아닌가?상식적..."
1,정신나간 하야오의 정신나간작품 
1,"일본인은 반성과 자기성찰, 배려심을 모른다. 하루빨리 방사능과 지진으로 가라앉아 줬으면 하는 바렘이다... "
1,골치아픈 얘기는 잠시 접어두더라도 전반적인 재미는 거의 없다는 것.... 그냥 들어 줄 만한 배경음악은 깔리지만 이를 채워줄 내용은 어디에도 없다는 거... 이 양반도 자기만의 세상에 빠진 듯 
1,이걸 보러가는 사람은 정말 제정신이냐? 
10,한국인들 발작스위치 눌렸네ㅋㅋ 
10,엔지니어를 꿈꾸는 이들에게 꿈을 불어넣어주는 영화 
1,"OOO 오히려 일본 비판했다는 댓글 뭐냐 ㅋㅋㅋ 머가리 김밥 싸서 소풍 갔냐?? 영화 한두번 보나 ㅋㅋ 일본 비판이라면 오해가 있었다는건데, 영화는 마치 커뮤니케이션이랑 똑같아. 지 꼴리는대로 지껄이면 어떻게 되지?..."
10,"재미있었다,문학적으로봐라,일본인이 아니라 지로의 꿈과사랑얘기가 담긴 애니메이션 영화로 봐줬음 좋겠다,쓸때없이 여기서 애국심 발동해서 한 사람의 작품 망친다 "
10,그럼에도 불구하고 재미있다 
10,평점조절용으로  이정도면 6정이  적당함 . 솔직히 그림체좋았고 내용은 재미없어서 보다가 여러번 잠자서 나눠서 봤음  남녀의 사랑 이야기가 잔잔하고 슬펐지만 담담하게 꿈과 뒤석어 표현이 좋았음. 
8,오늘도 좀비들은 그렇게 세뇌되어 반일 스테로이드 각성을 한 상태로 보지도 않고 까고 봅니다 
1,니뽄징들은 이영화를 진정한 역사가 반영된 일본역사상 최고의 애니메이션 환상의세계와 진정한 역사가 결합된 신비로울듯한 사랑!!이라며 떠들겠지이건 러시아에서 타이거를 만든 포르쉐박사의 희생과 사랑과...하는영화상영하는꼴...
8,어제 봤는데 오히려 일본이 일으킨 전쟁에 대해서 견제하는 대사나 연출들이 곳곳에 배치되어 있더군요전쟁을 미화하거나 역사를 왜곡하는 부분들은 찾기 힘들었습니다단지 전쟁에 사용된다는걸 알면서도 비행기 제작에 몰두한?주인...
9,"모든 비난을 감수하고 만들었다고 여겨지는 노장의 ""죽기전에 꼭 해보고 싶었던 이야기"" 스튜디오를 먹여살리기 위해  평생 돈되는 이야기만 만들어야했던 그가 마지막으로 자신을 위한 이야기를 창조했다. 아...."
1,이 영화는 센과 치히로의 행방불명과 비교됬어요. 처음엔 기대감이 컸는데 지금은 정말 실망이에요. 어떻게 미야자키 감독에게서 이런 작품이 나왔을 까요? 일본에서는 어떤 평점이 나올까 궁금하네요. 일본에서도 이런 평점이...
9,아름다운 영화.. 하지만 지브리 답지않은 결말 
1,실망 
1,"역사를 모르고 보면 아름다워 보일 수 있겠지만...이면에는 일본이 예전에 한 행동들을 얼마나 미화시키고 있는건 지 알 수있다.주인공이 실존인물이고 미쓰시비는 전쟁용 비행기를 만들었고 카미카제, 정신대등등그리고 두 남..."
1,우리가 알던 미야자키 하야오는 죽었다.더이상 지브리를 보지 않겠다. 
1,이게영화임? 영화보다가 마블함 
1,일단 1점 
1,"역사왜곡이고, 전쟁미화고 떠나서노잼 시쟐 하품몇번햇냐 ㅅㅂ마지막이라고 막가는 건가.... "
1,이전작품에 비해 흡입력도 부족 지루해지고 눈살을 찌푸리게 하는곳도 있었습니다 밑에분 처럼 현실과 동떨어진 세계 처럼 둘의세곈 전쟁중 에도 평화롭네요 사랑이야기만 집중했었더라면 더나았을건데 뜬금없이 전쟁이야기 지루한 ...
8,미야자키 영화가 센과 치히로 이후 힘이 빠진건 사실인듯 하다. 역사적인 관점을 떠나서 영화의 재미를 봤을때 포뇨정도 일뿐... 센과 치히로 같은 영화를 이젠 볼수 없다는건 슬픈일이다. 하지만 그래도 미야자키 영화때문...
7,"조금 지루해서 그렇지 잔잔하고 슬프고 괜찮던데 너무 여론이 안좋은 시각으로 몰아가는듯. 실제 애니 스토리는 아픈 마누라도 제쳐놓고 혼신을 다하는 비행기설계자 스토린데,,, "
1,ㅎㅎ 평점내리기 이런 영화를 우리국민이 보게 할수는 없지 
1,OOO기 영화. 전쟁이 일어난게 아니고 일본이 일으킨거지 착한 평화주의인척 코스프레하더니 결국 드러운 일본인의 속내를 드러내는구나. 영상미?  음악? 우리나라 역사인식 개 바닥이네. 죽어가며 독립시켜놓았더니 이딴거나...
5,반딧불이의묘같이 작품성은 정말좋지만 2차대전 피해자코스프레 하는영화가또나왔구나. 진짜 스토리같은건좋은데 피해자코스프레좀 그만하지.그냥 딴세상영화라고생각하면서 봐야할뜻 
1,내가 미야자키 하야오의 대팬이고오늘 개봉당일날 봤는데.정말 최악의 기대이하였다 보는내내 재미도 없고 감동도 없고 교훈도 없었고그냥 비행기만드는 한남자의 이야기일뿐이었다.. 
5,"지브리만의 그림체 및 색체와 배경음은 역시 실망시키지 않네요.꿈을 위한 소년의 노력 과정을 다루어 교훈은 잘 전달되었습니다.하지만, 전달을 위해 모티브한 인물이 굳이 호리코시 지로여야만 했는지 많은 생각이들고 아쉽습..."
1,호리코시 지로라는 제로센 개발자를 미화시키고 일본은 전쟁을 일으킨게 아니라 '돌입'했고 그로 피해본 일본만을 그린 역사왜곡 작품. 일빠들이 우리나라도 힘이 있었음 그랬을 꺼라는 둥 헛소리하며 쉴드를 치...
8,ㅋㅋㅋㅋ 수준 떨어진다전쟁 미화 영화라고 피해망상 하는거 수준 떨어진다 
10,"미야지키 은퇴작, 비운의 명작 "
10,"뉴욕과,시카고의 비평가협회상 수상작.한국인은 감히 쳐다보지도 못하는  수준의 "
10,|쓸데없ㄱ는 애국자들.. 왜 일본영화를 보냐? 
1,"논란을 떠나서 너무 재미없다. 영화관가서  반즘 졸면서 봤다, "
1,"미야자키 감독에 많은 실망을 했습니다 , 우리나라에 개봉되는 첫날 보러갔는데 도대체 무슨내용인지 이해도 잘안가는것 같습니다 너무 기대를 했나 하지만 애니메이션은 잘그렸어요 "
1,"나름대로 한 남자의 아름다운 꿈과 사랑의 이름으로 제로센과 전쟁을 미화시켜보려 한 모양인데, 보는 내내 불편하기만 했다. 세월이 흐르며 하야오가 가지고 있던 웅장한 판타지와 만화적 색채는 사라지고, 이데올로기와 자신..."
1,포스터나 예고편만 보고 러브스토리인줄 낚이고 간 1인ㅋㅋㅋㅋㅋ 주된 내용은 비행기로 미화시킨 폭격기를 만드는 내용..무슨 교훈을 주려고 한걸까..절대 러브스토리 아님!! 
9,"역시 지브라였고, 미야자키였다. 그러나 스토리면에서 조금은 아쉬운 ,그 속에서 개인은 국가라는 틀에서 벗어날 수 없는 구조 주의와 가해자이면서 피해자인 모순적 개인을 담고 있는 것 같다. "
9,"센과 치히로나 하울 같은 판타지가 아니라서 기대 많이 접고 갔는데, 오히려 담담하게 풀어내니 더 여운이 남네요. 한국 관객에겐 불편할 수 밖에 없는 영화지만, 하야오 감독 은퇴작으로는 부족함이 없는 듯 합니다... "
1,일본 극우 작품 
7,영화을 본분들이라면....내용역시 보는사람마다 큰차이가있을뜻합니다. 영화중에 반전 메세지 그리고 전쟁무기에 미화 둘다 함게 가지고있다고생각됩니다.. 영화을 끝까지 본분이라면 반전 메세지가 더강하다는걸 알수있을뜻 .영...
1,존1나 드래곤볼 같은 애니는 진리여서 10점인데  이건 걍 개 ㅈ같아서 1점 공감돼면 추천 ㄱㄱ 
1,역사공부 하고 싶어지게 만드는 영화. 화가 난다. 문화라는 탈을 쓰고 이럴 수는 없다. 
1,"네이버!!! 알바좀 차단해주세요,,제대로 된 영화평을 보고싶습니다. "
1,이영화결말은 여주인공 성폭행당하고 장기 세계곳곳으로 흩어짐 남주는 충격으로 제로센끌고 한국으로 돌진하다가 알고보니 존나못만들어서 편서풍타서 독도에 떨어짐 결론은 독도는우리땅 남주는 사지가 독도에흩어져 거름이되고 물고...
1,어디 몇명이나 보나 보자!  나라 안이나 밖이나 다들 나라팔아서 등쳐먹을넘들밖에 없지 정말! 역사 왜곡이나 하는 녀석들..정말 
10,전쟁때문에 한 사람의 꿈을 망쳤다는 이야기에요. 
10,다들 역사학자들이시네요. 대단한 애국자들 나셨네. 좀 순수하게좀 봐라;; 
10,"나를 무아로 빠트리는 영화였다. 영화는 영화다. 영화만보자 제발, 역사 과거 일본이니까 작품을 폄하하는 미성숙한 새끼들은 제발 평가내리거나 잣대질하지말았으면 좋겠다. 1점주는새끼들 태반이 영화를 보면서 역사를 보고 ..."
8,"역사 거들먹거리며 선비정신으로 풀발기 하고 있는데보다보면 이런대사도 나온다...세계연맹에서 나온것세계를 적으로 돌린것잊어요일본은 파멸할 겁니다.뭐, ...영화는 보셨나... "
6,"""나는 전쟁도 모르고 일본이 망하는 것도 몰라요. 내가 좋아하는 비행기를 만들었을 뿐이에요"" 안노 히데아키의 발연기와 더불어 주인공의 이기적인 스탠스는 보는 사람을 짜증나게 한다. 군국주의 비판적 대사..."
1,역사왜곡 영화를 국내에서 당당히 상영한다니 부끄럽지도 않습니까? 
10,은퇴작..남자주인공이야기실화 
9,"제발 영화를 보고 까시길. 같은 한국인으로써 불편한건 당연한거겟지만, 이 영화는 일본과 독일의 군국주의를 비판하고 전쟁을 반대하는 영화입니다... ㅉ 무식하다진짜 http://aciiacpark.blog.me/100..."
10,한국인의 일본에 대한 감정은 정상이라기보단 일종의 강박과 같은 정신병에 가깝다. 
10,전범영화라는 이유만으로 작품성을 떨어트리는 발언은 하면 안 될 것 같습니다. 지브리 스튜디오 사상 가장 아름다운 여주인공의 이유 있는 죽음만으로도 감히 최고라고  말하고 싶습니다. 
10,평점이 너무낮다 ㅋㅋㅋ 
10,미야자키 하야오씨 작품 정말 재미있었습니다. 이번에 은퇴라니 좀 아쉽고 그리고 남녀간 사랑도 꽤 감동적이기도 했습니다. 
10,그렇게 전범전범 거리면서 막상 BMW나 벤츠는 잘만빨아주네 실로 가식적인 새끼들 
10,"여운이 깊고도 기네요, 아직 못보셨다면 꼭 추천하는 영화입니다. 에반게리온 감독분이지로 역 하셨단 것도 신선했고 스토리도 완벽하고 오히려 전쟁미화가 아닌 전쟁의 심각성을 말하는 것같은데요 "
10,전쟁미화니 우익이니 말 참 많았던 영화.직접 보니 그런 얘기는 입에 담기도 미안할 정도로 전쟁에 대한 담담한 비판에 감동을 받았다.아쉬운건 에바감독의 국어책읽는 연기뿐 나머진 완벽했던것같다.전범기가 쫙 깔려서 보기거...
9,당신들은 꿈을 잃고 살아가는 사람이 아닌지 자문해보길 바랍니다. 
9,"우와. 별점낮다.많은 이야기가 있지만 어제 시사회에 참여한 저는 좋았어요. 역사의 왜곡이라는 화두를 제외하면 뭐랄까- 그림으로 된 영화를 본 느낌. 그림도 보는 내내 너무 예쁘고, 그 마음들이 잘 전해지던데.. 킁킁..."
10,미야자키 하야오는 애니메이션작가입니다.애니메이션작가에게 역사를 요구하는 것이 과연 맞는 행동일까요?미야자키는 한 청년의 꿈이라는 모티브를 묘사하고 있습니다. 비록 그 꿈이 모순이 있을지라도 미야자키는 정치가가 아닌 ...
10,"역사에역자도 제대로 못배운 사람들이 더 난리라죠. 솔직히 그 시대 배경 가지고 전범이니 뭐니하는 건 아니라고 생각합니다. 영화는 그냥 영화일 뿐입니다. 주위 사람들이 하는 말에 신경쓰지 말고, 예술성에 초점을 두고 ..."
10,내적인영화의의미를알아하는데 겉으로들어나는 평으로 물타기식으로 욕하는것은 아니라고본다. 이영화를보면서 전쟁적인미화와 우익적인시선으로 보기때문에 그의미자체가 평에서 더안좋게나타나는것같다. 전쟁의미화하고자랑스럽게하기위해예...
10,"도대체 전쟁을 찬미하고 군국주의를 정당화한 장면, 대사가 어디나오는지? 오히려 전쟁에 의한 파괴와 전쟁이 가져다 준 폐혜를 고발하고 있더만. 괜한 반일감정에 치우쳐 색안경 끼고 보지 말고, 작품으로서 감상한다면 미야..."
10,좋아요~~~ 
10,장담하는데 저 호감순에 상위권에 있는 놈들 영화 단 1초도 안 보고 평가하는 존문가 새11끼들이다 제발 영화 좀 보고 찍어라 이 머저리들아 
10,미야자키 하야오답게 좌파적 시각으로 일본을 비판하고 있는 작품. 지금 일본이 너무나도 싫어서 1점 테러 하시는 분들 계시는데 솔찍히 그거 팀킬임 멍청이들 
10,아날로그적인 감성에 꾸밈없는 그림 너무 기다리던 미야자키 하야오!!! 
10,영화에서말하는내용이 현재일본한테하는소리다 30년대 일본과지금의일본은 상당히 유사하다 경제적으로도 대공황과 잃어버린 10년 거품경제 그런사이에 점점민족주의가강해지고 다시 군국주의처럼되려는 일본에게던지는 감독의뜻이다 다...
1,
10,
6,마호코가 제일 안타까웠어 
9,평소 반전과 평화에 대한 메세지를 꾸준히 보여준 미야자키의 작품다운 모습입니다. 꿈과 현실을 오가면서 아름다운 영상미와 음악으로 개인의 꿈이 어떻게 파멸에 이르렀는지 잘 보여주는 작품입니다. 
2,마사카..토왜급식충들이 평점까지 진출했노ㅋㅋㅋ 
1,진짜 기대안하고 봐도 재미없다 
1,에휴123456789 
3,로맨스가 아니라 비행기제작 영화넹..ㅉ 전쟁에 필요하다나.. 
1,인상 좋은 호호 할아버지는 절대 아님 
5,전쟁에 대한 미화 같은건 없어보이나 저는 지루하게 보았네요 
1,지극히 일본인을 위한 영화. 비추천 
8,응~ 팩트는 아카데미 시상식 애니매이션 상 후보까지 올라갔어 ^^ 
9,"역사적 사실을 구지 비벼서 본다면 한국인 입장에서는 불편할 수 있는 작품...내눈에는 감독 특유의 따뜻하고 편안한 감성을 볼수 있어서 단지 그것만으로 좋았다, 애국심이 없어서 그런가... "
1,1점이 아까운 영화이다 
1,역사적인 의미를 떠나 재미자체가 없음.킬링용도 안됨. 
8,이영화를 제작하는 다큐를 본 적이있는데 미야자키 하야오 감독이 한 말 중에 과거 일본이 전쟁까지 흘러간 방향을 경계하자는 말이 있었다. 우경화시키려는 아베를 비판하는 뜻이었음을 비춰볼때 영화 자체에 순수한 사랑 이야...
9,어차피 무조건 욕하는 사람은 뭐라고 해도 욕한다. 
8,역사적 배경 뒤로하고 사랑의 끝이 너무 가슴아프고 여운이 남는다 .. 
8,이건 한 사람의 '노망'이 아니라 '로망'아니냐 
6,[ IMDB 7.9 ] 그 시절 꿈과 사랑을 노래할 수 있었네 그곳은. 대한민국 참 못났다. 
5,"이 영화의 문제는 전쟁을 미화했다는 점에 있는 것이 아니라, 재미가 없다는 것이다. 미야자기 하야오 특유의 감성이 군데군데 묻어나기는 하지만, 스토리가 너무 잔잔하고 메세지는 약하다. "
1,"미야자키 한테 뒷통수 맞은 기분.차마 다 볼수 없었다.이게 일본인의 역사 의식이란건가. 미츠비시는 일제 시대에 우리 조상들 강제 징용한 대표적 기업이 아니던가.그런 강도 놈들이 ""단순히"" 열심히 살았다..."
1,보다가 꺼버림 역겨워서 
7,걍재밌게보면안돼나.. 
4,역사왜곡의 발단이된 당시상황은 확실히 제국주의의진행이활발했죠 허나 이영화는 그당시의 잘못된 관점으로 보여진것입니다 직관적으로 보고 무조건 우익이다그런것은 아니다봅니다 
5,"미야자키 하야오 감독의 은퇴작이다. 그래서 더, 더 아쉽다. "
8,영화는 뛰어났으나 우리에게는 실망스러운 작품이었다. 
5,아레타치누..는 나만 생각나겠지. 
5,아쉬움은 남지만 서정적이고 소박한 마무리. 2002년 센과 치히로를 본 뒤로 미야자키 감독은 누가 뭐래도 내맘속 영원한 거장이세요. 부디 만수무강하시길! 
1,아무리 시대극이라지만 너무 시대착오적이다. 전작의 미야자키 감독이 맞나 싶을 정도. 
1,지브리 미야자키하야오 실망 
4,일본 미화는 둘째치고 지브리 제발 안되는 프랑스어나 이탈리아어 대사 좀 안 넣었으면 좋겠다. 잘 보던 것도 그 발음 듣다가 깨버림. 
10,"우익영화같지는 않은데..평점테러.. 제대로안본사람들인가봐요만주국창설 잊어요국제연합탈퇴잊어요일본은파멸해요독일은파멸해요 대사가 얼핏기억나는데..시대,배경때문에 헷갈릴수있는데전쟁미화, 일본미화 영화는 아니였던것 같습니다...."
10,넥플릭스떠서 보고왔는데 중간에 지루한부분은쪼끔있었으나 여운이 남는애니입니다.평점1점이니 감독 실망했다느니 하신분들은 아마 영화제대로  안보신듯.. 
1,방금 다 보고 왔습니다. 긴말 안하겠습니다. 
8,솔직히 역사거르고 작품만으로보면 수작인데.. 지로의 비행기에 대한 열정과 어린시절 만난 그녀에 대한 애틋한 사랑을 너무 잘표현함.. 여주이름은 기억안나지만 너무불쌍.. 죽을때가 된걸알고 스스로 떠난건가..?ㅠㅠ 
10,사람에게 괜히 전성기란게 있는게 아님.... 젊은 나이엔 타의 추종을 불허할만큼의 상상력으로 작품을 그려냈고 나이가 드니 그릇된 신념이 그 상상력을 방해한다... 한마디로 꼰대가 되었다는것.... 나이는 인간의 모든...
9,"이 영화가 왜 이정도 평점인지는 주인공이 만들고했던 비행기가 전투기가 목적이여서 그랬겠죠 그 전투기가 수많은 살상자를 냈지만, 주인공 지로는 전쟁을 원하지도, 전투기를 만들고자 하지도 않았습니다. 오히려 영화에서는 ..."
1,음 ...끝까지 봤다. 어이없다 
1,일본 자국내에서도 군국주의로 까이는 영환데 쉴드치는 새끼들은 머가리가 없냐? 
1,미야자키 하야오 씨 왜 이딴 쓰레기를 마지막 영화로 만든겁니까. 0점은 못주나.? 
1,그동안의 미야자키 하야오의 명성을 와르르 무너뜨린 작품... ^^ 에라이 정말 팬이였는데 씁쓸하다 
1,역사를 배워야 하는 이유 
1,딱 9분 31초까지 보다가 뭔가 이상함을 느껴 스탑하고 네이버 영화를 봤더니 역시나. 실망이 크네요. 
1,이게 감독의 은퇴작이다.  이게 본심이었다. 
1,피해자 코스프레에다 미화를 조작까지 / 일본은 우리나에게 인간 마루타 고문 강제노역이나 자원탈취 위안부 기타등등 인간으로서 못할 짓거리도 많이 했지만 제로센 전투기로 카미카제 자폭 하도록 강요받아 일본원숭이 대신 돌...
9,난 사랑밖에 보이지 않던데 ...감동입니다 
5,내용10점 일본미화 -5점 ㅡㅡ 
7,리플들 참 가관이다 제로센 나온다 역사 왜곡한다 하는 주위 소리만 듣고1점 박고 가는거 참 ... 수준 이하다 영화 진지하게 보면 솔직히 일본을 깟으면 더 깟지 그렇게 미화 시킨 부분은 보이지도 않는구먼 영화도 않보...
6,"근대사를  전공하는 학생으로 영화는 그냥 그랬습니다.분노를 느낄만한 장면, 자극적인 장면도 없었구요. 미야자키는 어찌되었건 일본사람입니다. 그걸 감안하면서 봐서 그런지 막 아우 배신감느껴 이런건 별로.다만, 지로 목..."
1,에효............ 
1,할말을 잃게 만든다. 
8,소년의 아름다운 꿈을 그리다. 그러나 한국인이 보기에는.. 
4,음 미야자키 감독...ㄱ교차 상영하길래 별루 인기가 없나 싶어서내눈으로 확인했더니 두시간동안 멍때림...그냥 비행기의 발전을 본느낌...그래도 음악 스톨리 그림채는 역시...갠적으론 실망이라는... 
5,도대체 이런 영화 누가 수입 해 왔나요? 워낙 좋아하는 작가의 만화라 애들 데리고 극장갔는데 좀 화가 나더군요. 영화는 그냥 영화라고 말할 수 도 있겠지만 글쎄요~ 굳이 이런 영화를 한국에서 상영 해야 하는지 묻고 ...
1,노망났네. 
1,노망이 들었으면 빨리 가는게 상책.. 미야쟈키도 이젠 쓰레기만 만드는구나... 
1,나는 핵연구를 핵폭탄에 처맞을 일본이되라고 연구하는게 아니다. 과학이란 위대한 꿈을 위해 연구하는것 뿐이다.(일본.. 그래서 핵폭탄에 쳐맞았구나 ~ 한번더 핵폭탄 처맞아야할듯.. ㅋㅋ) 
1,1점도 아깝당 우익이 분다 ~_~ 
7,"한 명의 엔지니어 이야기...  과거사를 떠나, 영화 자체로 평가합니다. "
7,전쟁을 그렇게많이 미화시키진만은 않은것같습니다 분명한건 전작품들과좀다른것같아요  그래도  전체관람가는 아닌것같네요 
1,에휴 ㅋㅋ 
7,"바람이 분다, 이제 살아 보아야 하지 않겠는가. "
4,"진지한 주제 의식, 그러나 너무 잔잔한 스토리 "
7,누가 뭐라든 오직 애니만 봣을때 킬링타임용으로 갠찬게 봣다.딱 여기까지ㅋㅋㅋ 
1,살인무기 제조가의 오리발 미화영화. 발뺌국의 이쁘게 만든 애니. 역시는 역시다. 파멸이란 단어에 꽂혀서 미화한거 아니라네.. 실제주인공 지로 자체도 이미 미화가 됐네. 적군과 아군의 목숨따위는 안중에도 없는게 저 원...
9,좌파가 이 영화를 싫어하길래 아 그럼 명작인가 보다 했는데 어디서도 볼 방법은 없더라. 이번에 넷플릭스에 떴길래 상영금지당하기 전에 얼른 봤다. 전쟁 옹호 영화가 아니더라. 세련된 영화다. 이젠 '반일종족주의...
1,에효 비행기를 폭탄으로 쓰는 사람들이 문제다란 말을 전쟁중 비행기 팔면서 하면 뭐하노 전쟁에 이바지햇다고 인정하는것보다 구질구질함 그리고 연애사도 구질구질 으 내가 여주엿으면 걍 죽엇음;; 뭣보다 개노잼 븕은돼지도 ...
1,실망스런 내용이었습니다. 
8,순수했던 소년의 '비행'  이를 짓밟는 폭력의 사회. 역사는 무엇을 기록하며 우리는 무엇을 바라 볼 것인가 
1,이곳에 명예 일본인이 넘 많네요. 미야자키가 반전주의자던 이 영화가 일본을 비판하는 내용이건 사람들의 분노와는 상관이 없습니다. 중요한건 작중에서 제로센을 만든 호리코시를 호감상으로 그려놓았다는거죠. 이게 전범미화라...
1,일본은 정말 답이없는 나라구나.. 
1,"지로의 직장, 미쓰비시... 한국인을 학대한 일본 최대의 전범기업. "
1,말이.필요없다 걍 1점정도 
1,결국 미야자키 하야오 감독은 일본인이고 일본인의 시각으로 영화를 만드는구나.. 그동안 그의 작품을 좋아했던 내가 부끄러워진다.. 
1,이 영화 이후로 지브리가 망했다. 찾아봐. 지브리 진짜 망했어. ㅋ OO들 지들이 저지른 역사 무시하고 아름답게 포장하려다 들통나니까 망하지. ㅋ 
10,Another 10 for Miyazaki 
1,러브스토리는 좋았으나 책임회피 전쟁미화 
1,장애인이 만든  장애인을 위한 만화 ㅋㅋㅋ 
9,"전쟁미화 혹은 일본군이 멋지게 묘사된다든가하는 극우요소는 단 한군데도 없습니다. 오히려 일본디스했구요, 이런 재밌고 좋은 작품을 덜떨어진 어그로꾼들에게 현혹되서 지나쳐버리는 우는 범하지 않았으면 한다. "
10,울나라에 친일파도 많은데뭐 만화는 걍 만화지.. 
10,"원래 7점 주려고했는데 평점 너무 낮아서 10점 넣어요. 논란이 되는 제로센 비행기는 왜 끼워넣어가지고 이렇게까지 극과 극으로 의견대립이 일어나게 하는지 모르겠네요... 비행기라는 소재는 최악이였고, 운명적인 사랑이..."
