score,review
1,"일본에 떨어뜨린 핵폭탄을 만든 오팬하이머의 열정과 사랑을 다룬'핵폭탄이 터진다' 국내에서 시급히 제작해서 일본에서 상영하였으면 좋겠습니다. 낭만적이고, 서사적이고, 오펜하이머의 열정을 아름답게 그려서 ..."
1,일본에 전쟁이 났다(X) 일본이 전쟁을 냈다.(O) 
1,미야자키도 결국은  뒷통수치는  일본놈이었다는거..  이걸  우리나라 아이들에게 보여주고 싶지 않다!  수많은 한국인을 죽인  전범기업 미쓰비시의 엔지니어 를 꿈이라는 가면으로 미화시키는  애니를 한국에서... 헐....
1,오펜하이머는 승전국 사람인데도 자신이 무기를 만든 것을 자책하면서 반전운동가로 살기라도 했지. 호리코시 지로 따위는... 
1,미야자키 감독에 많은 실망을 했습니다.이번 작품 말고 인터뷰에서 했던말이 더욱 실망이였어요반일감정이 반한감정을 만든다고 했는데  그 반일감정이 왜 만들어지겠 습니까?과거의 잘못을 사죄도 안하고 반성도 안하며 그저 미...
1,이제 미국도 B29랑 리틀보이 영화 만들면 되겠다 그치?^^ 
1,영화가 끝날때즘  주인공 친구와 주인공의 대사가 확  짜증난다... 대사가 정확히 기억은 안 나지만  대충 우린 단지 꿈을 위해 달려갔을뿐이야 라는 메세지 인거 같은데 빡친다...살인 무기를 만드는걸 알고 있었으면서...
1,박수칠 때 떠났더라면... 
1,결국 이딴 영화가 국내에 전체관람가로 개봉되는 비극이 일어나고 말았네요.. 
1,그래도 미야자키하야오님 영화를 제가 엄청좋아했고 존경했는데 이번영화는 정말실망스럽네요 저도 1점주기도너무아까울정도로  이걸 국내에서 상영하나는자체가 부끄럽지도않나싶네요 아무리 좋은말해도 역시일본은일본이네요 
1,저 인물이 비행기를 만든 때는 벌써부터 한국 강점하고 조선인들 수탈하고 관동대지진의 탓을 조선인으로 돌리고 학살을 한뒤였다. 뻔히 중국도 침략하고 동남아로 진출하려고 하던 때에 만든 비행기가 꿈과 미래를 위해 만들었...
1,은퇴작이라해서 아쉬워했는데 가관이네요; 어려서부터 정말 존경하고 미야자키의 작품은 빼놓지않고 봤는데 실망이너무 크네요 1점도 아까움. 
1,만든놈  배급한놈  보러가는놈    셋다 OOOO 삼위일체 
1,딱 거기까지인듯... 하야오의 숨겨진 가치관을 알수 있을듯..잘 가라 토토로 
1,"전쟁은 군인이 했고, 나는 꿈을 쫓았을 뿐이고, 일반 국민은 희생하며 지원해 줬을 뿐이고, 이 모든 것이 아름다울 뿐이고... 뻔뻔하기 이를데 없는 영화. "
1,평가할 가치가 없는영화.0점은 없나? 
1,영화의 완성도는 모르겠습니다. 다만 이런영화가 아무런 문제의식없이 국내에 버젓이 개봉할 수 있다는게 놀라울따름입니다. 
1,내부모를 누가 과실치사로 죽였다 치자.그사람이 열심히 살았던 인간이든 위인이든 존경받는 인물이든그 인간의 삶을 보기는 거북한거다. 
1,미국인이 주인공으로 나와서 히로시마나 나가사키에 원폭을 투하하면 일본인들이 낭만적이라고 생각하겠네요. 재밌겠다 ㅋㅋㅋㅋ 
1,역사적 사실을 사랑으로 왜곡한 만화~~ 
10,제가봤을땐오히려 일본 비판으로보였습니다만 
10,다들 미야자키하야오 작가님 욕하시는데 미야자키하야오는일본에 몇 안 되는 대놓고 과거의전쟁은 일본이 잘못했으니 한국에 사과해야한다고 당당히말하시는 작가님이세요 저번에 위안부 개념발언도 하시고 일본내에서 그런 걸로 욕도...
10,"마의 산. 잊기에 좋은 곳입니다.중국과의 전쟁, 잊습니다.만주국을 만들고, 잊습니다.국제연맹 탈퇴, 잊습니다.세계를 적으로 돌리고, 잊습니다. 일본은 멸망할겁니다.-영화 중 대사. "
10,어디서 들은 얘기 하지말고 영화를 보고 평점을 주세요. 영화에서 전쟁을 미화한적 없구요. 오히려 전쟁을 반대하는 내용이예요. 잔잔하고 슬픈 사랑이야기도 좋았구요. 평소에 갖고있던 반일감정 땜에 평점을 1점준다는건 문...
10,미야자키  감독은 아베 내각의  일본헌법 개정에 맹비난 하신 분이다. 굳이 전투기엔지니어로 설정한건 비행이라는 꿈에 매료된채 현실을 망각하는 소년의 모습을 보여주려 한 것이아닐까 
10,"오늘 보고왔는데 ""일본은 파멸한다."" 이 대사도 그렇고 마지막에 잿더미가 된 도시며 파괴된 전투기가 아무렇게나 널부러져 있는 장면도 그렇고... 군국주의적인 냄세가 난다고 보긴 어러울거 같은데요.. (알바아님다......"
2,1점 더 준것은 지금껏 미야자키 하야오 만화를 보며 큰 내 순수했던 어린시절의 감성에 주는 하나의 앓이다.. 
1,마이너스 점수 없나? 
1,점수를 줘선 안되는영화 
10,전쟁을 미화했다기보단 청년들이 열정으로 만들어낸 비행기를 전쟁을 목적으로 사용했다는걸 비판한거같은데 
2,일본에서 3주연속1위길래 기대했는데 역사왜곡하고있었네  야스쿠니다니는 일본인들이팍팍민듯  멍청하게 이런민감한부분에 실존인물로 왜곡하냐;;그냥 새로운인물을 만들어서 쫌 하지 
10,이영화에서 일본의전쟁에대한정당성을말하고자하는바는없었다.감상을한사람들은알겠지만일본의전쟁에대한것을 비판적으로말하는대사가몇몇있었다.이영화에서주인공은 사회적으로자신의재능이어떻게왜곡되는바를말해주었다.전쟁비행기를만든전범을낭만으...
10,보기는 봤는지 의문. 결국 남이 까니까 까는놈들이 대부분 아님? 전혀 우익적 내용이 없었고 비판적으로 바라보고있다. 정신차려라 국뽕들아 
1,역사를 외곡한 자에게 1점도 아깝다 
10,이영화 왜케 평점이낮지 영화를 보고나서 혹은 보는내내 다른사람의 리뷰처럼 화나지않았습니다 영화내내 일본은 멸망한다라는 말과 일본폭격기 다 부서지는 장면만 나왔고 오히려 전쟁을 치른 일본을 우회적으로 비판햇다고 봅니다...
10,제발 미야자키 하아오의 시각을 이해하고 비판해주세요. 그는 대표적인 반전주의자고 개인의 권리를 중요시 하는 사람이고 자연주의에 가까운 사람입니다. 일본의 전쟁을 돌려까는거에요.. 국가가 개인의 억압하면 개인의 꿈이 ...
1,가해자가 예술이라는 탈을 뒤집어쓰면 피해자로 둔갑해린다. 참 쉽지? 
1,우익 노장 미야자키 할배의 푸짐한 똥 노망이 들어도 단단히 들었지 벽에다 똥칠 클라스는 저리가라 이제 전세계적으로 일본 피해자 코스프레 똥칠을 구경하라. 미국 애들이 이걸 봤으면 아주 웃겨 죽을듯 
10,"붉은돼지, 하울의 움직이는 성 등 작품속에서 반전, 반파시즘을 내세웠던 미야자키 하야오 감독이 갑자기 극우영화를 만든다는게 말이되냐? 영화속 배경, 소재만 보고 단순히 까면서 선동질 하지말고 영화를 직접좀 봐라. "
1,전쟁과 아픈 역사를 미화하는 것에 동의할 수 없습니다. 예술작품이 아무리 예쁘고 감성적이라 해도. 
10,ㅋㅋㅋ  일본에선 매국노작품이라고 까이고 한국에선 극우작품이라고 까이고. ㅋㅋㅋ 야 이놈들아 니들 영화 제대로 본거 맞냐?  이게 어딜봐서 극우작품이야.  우익들 까는 작품이고만;; 
10,"제발 영화 한번이라도 본 인간들만 평가하자. 아니 이게 어떻게 일본미화영화냐 대사며 연출이며 일본의 제국주의를 비판하고 있는데 너네는 상식적으로 일본미화영화에 ""일본은 곧 멸망할 것이다.""같은대사를 넣..."
1,어휴  카미가제나 살인무기 등을 미화시키고.. 우리나라사람 이라면 분노해야할 영화 
10,제발 생각좀 하고 댓글을 다세요 좀 이 영화 어디에도 한국을 침략한 일본을 미화하는 내용은 없습니다. 오히려 일본을 비판하고 한국을 동정하고 미화하고 있단 말입니다. 님들이 이러시니깐 일본인들이 역시 조선놈들 무식하...
1,연령별 평점 보소 40대 알바 쩌네 
1,제로센나와서 1점드릴게요 
1,아무리 생각해도 알바를 풀었다고밖에 볼 수 없다 
1,대단하다 일빠충들아 개봉도 안한 영화에 10점주고 자빠졌네 ㅋㅋㅋㅋ 
10,이게 미화라고 하는 사람들은 죄다 머리가 어떻게 되어버린 사람들이다 
10,일단 영화본사람들이 1점준거라면..ㅋㅋㅋㅋ노답..누가봐도 전쟁을 미화한건 나와있지않고 오히려 일본을 비판한건데..일본인들은 이 영화를 보고 매국노라고욕하던데..이게 일본인과 한국인의 영화 속 내용까지 파악하는 클라스...
10,일본이 피해자라는 내용이 어디있지? 일본이 멸망한건 일본이 자초한 일이라는 내용 밖에 안보인다. 또 대체 어떤 생각으로 핵폭탄이랑 비교하는건지 작중대사에도 일본이 선빵친거 다 표현했는데 일부러 오역된 자막으로 봤나?...
10,영화를 안본사람들에게는 극우주의의 작품으로 보이거나뼛속까지 반일감정이있는 사람들에게는 그저 제국주의미화영화로 보이겠지만사실은 제국주의를 비판하고 그저 아름다운 비행기를 만들고 싶어하던 주인공의 가슴아픈 사랑이야기를 ...
10,"상대적으로 보면 일본 스스로에 대한 비판도 될뿐더러, '미야자키 하야오 무슨생각이냐, 바람이분다 쓰레기영화' 이런식으로 군국주의 부활이니 미야자키하야오가 우익이라는 식으로 선동하는 것이 더 추합니다. "
10,일본의 잘못된 과거를 반성하는 걸로 보였습니다. 다들 선입견을 갖고 너무 부정적으로 바라보시는듯.. 
10,"이 영화 별점테러당한거 보면 한국인들이 얼마나 무식하고 피해의식이 강한지 알 수 있음. 딱 단편적인 부분만 보면서 자기들 보고 싶은 부분에만 초점을 곤두세우며 졸작이라고깎아내리지만 현실은 다수의 영화제 수상작, 아카..."
10,전쟁미화다해거 꺼려하다 이제야봤는데 이게 진짜 미화인가? 비행기에 대한 열정과 사랑이 주가된다보는데. 전쟁미화다란 색안경으로 평가말고 보고 평가하자 그리고 지루한건 개인차겠지만 난 지루하지않게 봤다.미야자키 그의 은...
10,영화에 한 장면도 전쟁을 정당화 하는 내용은 없습니다. 
10,미야자키 하야오 영화중 가장 아름답다. 하늘을 나는 붉은 돼지가 아니라 땅을 날고 있는 지로에게 중력은 얼마나 무거운가. 
10,하야오 선생님께서 전쟁을 미화했다고 보기는 어려운것 같은데 보면은 영화 중간에서도 일본이 제국주의 침략으로 저지른 만행들을 읊을때도 하늘은 모든것을 삼켜버린다 등등 전쟁을 비판적으로 보고 참혹함을 보여주려고 하는것 ...
10,제로센을 옹호했다는 사람은 뭐지 나중에 다 부서져서 벌판에 시체가 되어 널려있고 일본은 망합니다라는 것을 몇번이나 언급했는데 
10,좋은 영화이다.  독일의 나치를 깡패집단이라고 말하고 일본의 전쟁준비를 이야기하며 독일과 일본은 패망할것이라는 말을 3번씩이나 하게 된다. 좋은 비행기를 만들기 위한 열정을 보여주기에는 2시간 분량이 너무 짧은 아쉬...
10,진짜 영화본 사람이면 전쟁을 비판하는 내용이라는거 알텐데.. 
10,첨보기전 평점보고갔다 반신반의하며 봤는데 일본제국주의는 느껴지지않음.. 댓글적는사람 영화보고 얘기하시길...어서 줏어들은 얘기로 적지말고 ..눈가리고 귀막고 우르르 쫓아다니며 까는거 좋아하는사람들.. 영화를 영화로만...
1,오른쪽 리뷰 추천수1위글 보시고 오세요. 위 작품은 제2차세계대전의 주 가해자인 일본이 피해자인척 왜곡된 역사로 만든 작품이라고 하네요. 모두 바른 역사관을 가집시다 
10,이거 영화본사람은 알텐데..제국주의에 대한 조롱과 풍자 그리고 일본은 곧 망할것이다 라고 나왔는데 이게왜 일제강점기 미화라는거임? 
10,재평가 받아야 마땅한 작품 
10,"후반부에 적잖은 반전주의 발언이 나옴. 독일, 일본은 망할것이라는 언급도 나오고 돌아오지 않을 비행기라며 탄식하는 모습도 보이는데 영화를 본적도 없으면서 무작정 까기바쁜놈들은 뭐냐 진짜 ㅡㅡ;; "
10,여러분 일장기가 나온다고 해서 제로센이 나온다고 해서 일본군이 나온다고 해서 전쟁미화 영화가 아니에요. 제발 등장인물들의 대사와 그 속에 묻어나는 전쟁에대한 한탄을 들어보세요.그저 주인공은사랑과비행기를 만들고 싶었던...
10,진짜 답답해서 그런데 님들 미야자키 하야오 감독은 오히려 일본 우익을 비판하시는 분이에요 ㅠㅠㅠ 이 영화도 일본을 돌려 까고 비판하는 거임 ㅠㅠㅠ 제발 영화의 속뜻을 좀 알아주시길 바람 미야자키 감독 제대로 아는사람...
10,저는 이 영화가 왜 평점이낮은지 모르겠네요.다들 영화는보고 하시는말씀이신지?예고편에서는 정말 전쟁미화같이나오지만실제영화에서는 전쟁을비판하는장면들이많이나옵니다. http://m.blog.naver.com/aciiacp...
10,재평가 받아야하는 작품 
10,미화한게아니라모순을표현한거예요미야자키는전쟁을반대하지만미야자키의아버지가비행기부품을파는사람이였는데꽤돈을 많이 벌었데요. 미야자키는전쟁을 반대하지만 전쟁에 사용되었던 비행기를 동경하는걸 자기 스스로 알기때문에 이 작품을 ...
1,결핵환자 옆에서 담배피우고.. 전범기에 진짜 이상한 영화다 하야오 노망난듯 
10,"이새1끼들이 보고싶은거 듣고싶은거 믿고싶은거만 봤네ㅋㅋㅋ ""중국에게한 전쟁을 잊어요, 만주국건설을 잊어요, 세계를 적으로돌린것도 잊어요, 국제연맹 탈퇴를 잊어요, 일본은 파멸합니다 독일도 파멸합니다.""..."
10,반일 문제로 평점을 깎는 한심한 새끼들 같으니 
10,"희대의 명작이 쓰레기 같은 아는 척하는 애들 때문에 극장 상영 조기 종영되고, DVD나 VOD로도 안 나오는 현실. 해외 평단과 관객들을 정신나간 놈들이냐? "
10,어떻게 이걸 전쟁 미화 영화라고 주장할 수 있는지....쓰레기같은 놈들 진짜 두 눈 가리고 두 귀 닫고 아무것도 보지도 듣지도 않고 '무조건 2차대전 배경이면 악!'이라고 하는 것들 진짜...에휴......
10,http://rlaqjarl16.blog.me/60196316899 위안부에대한 개념발언도 했던 사람입니다. 절대로 그런의식을 가지고 만들었을리가 없습니다. 
10,진짜 음악도 좋고 너무 좋았음! 역시 하야오 감독님! 
10,"독일인이 그냥 풀을 뜯어먹는 장면만 해도 이 영화의 주제를 잘 보여줄 것 입니다. 자연을 파괴하고 생명을 파괴하는 주체라는 것이죠. 지로는 사랑하는 여인과 아군과 적군의 죽음을 뒤로한 채, 살아가며 그 죄의 댓가를 ..."
8,미야자키는 확실히 우익은 아닌듯.영화 중간에 나오는  외국남자가 독일과 일본은 곧 멸망할거라는 메세지를 남기는 것으로 봐서는.. 
10,미야자키 하야오의 팬이라면 그가 서사하는 공통적인 메세지를 간파할수있을텐데 그 관점에서 보면 이건 제국주의 찬양영화가 아니지.. 
10,"일본 현지에선 매국노 작품이라 까이는거 아세요? 영화를 봐도 우리는 20년은 뒤떨어져 있다는 말과, 세계를 적으로 돌리는 일본은 패망할것 이라는 대사, 연합국에 적을 맺었으니 패망일거란 대사 등등 결국 제국주의 비판..."
10,감동인건 감동인거죠... 음악도 너무 좋고 마지막에 너무 짠했네요.. 주인공에게 있어 10년은 어떤 의미였을까요... 
10,"1점 준 놈들은 독일의 나치소재영화 '몰락' 에도 ""역시 전범국""이란 말과 함께 1점을 줄 놈들이다.일본 우익들이 지브리애니중 가장 쌍욕을 퍼붓는 작품을 한국인이 똑같이 욕하고 있다는게 ..."
10,군중심리에 쏠려 이 영화를 회피했던 과거의 내 모습을 반성한다. 
10,이 애니 역사외곡아님.. 그 예고에서 갑자기 집들 다 올라오는거 지진이고 일본 처참히발리고 지로도 비행기는 타는 수단으로 만들고 싶었을 뿐. 자기네도 이런 일본을 싫어한다고 나옴. 안보고 외곡드라마 논리 드립 ㄴㄴ ...
10,이건 한국애니인가요? 분명 일본 애니 일텐데.. 그러면 당연히 일본의 정서가 담겨져 있을테고 싫든 좋든 우리나라 애니가 아닌데 꼭 한국사람이 좋아할만한 소재로 만들 필요가 있을까요? 배신? 개소리들 많이하시네.. ㅎ...
10,국뽕들 참 이상하다. 이건 그냥 허구의 작품이다. 허구의 작품에서는 마법을 쓰든 한국이 통일되있든 미국이 약소국이든 그냥 그 세계속을 가정한 것이다. 그걸보고 좌익이내 전쟁미화내 하는 사람들이 이상한거다. 색안경끼고...
1,0점은 못주나요? 이놈들한테 돈주기 싫어서 다른 루트로 봤습니다. 정말 기분이 뭣 같네요 
1,1점도 아깝다. 가만히 있으면 중간이라도 간다. 역시 일본이다. 
1,"단언컨대,바람이분다는 가장 완벽한 쓰레기 영화입니다. "
1,살인무기 만든걸 미화하다니 정말 대단하네요 
10,"8점인데 평점이 낮아 10점 줌. 역시 한국은 정치로 본다. 일본을.. 미야자키도 그냥 일본사람일뿐, 일본 정치인이 아닌데. "
10,마지막에 나라가 망했다는 대사도 나오는 구만~ 이정도면 자기나라 소극적으로라도 비판은 한거다. 
8,안 본 사람만 비난하는 이상한 애니메이션 뭐든 직접 보자.이 작품은 미야자키 하야오의 자기모순을 다룬 자서전에 가깝다. 
10,"미야자키  감독의 뜻은 그런 것이 아닙니다. 아무래도 한국 자체가 일제강점기, 전쟁 등으로 많이 예민한 부분이 아직 남아있기에 한국에서 상영과 판매를 금지한 것 같습니다. "
10,일본에서는 매국노작품이라고 생각. 한국에서는 “미야자키하야오는 우익이다”거리면서 일제미화작품이라고 생각. 역시 멍청한 한국인다워. 이러니 생각수준이 유치원수준이니 이런 수준높은 작품만 봐도 저게 무슨 뜻인지를 잘 파...
10,이영화를 보고 미야자키 씨가 영화를 만든 이유를 알고 욕을 해라..과거 일제 강 정기에 전쟁 때문에 꿈을 향해 달려가던 20세들이 전쟁에 강요 당해 자신의 꿈이 전쟁 때문에 무너진다는 의미가 담겨있다. 이 영화는 일...
10,역대 미야자키 하야오 감독중 제일 색달라서 좋았던 영화. 영화를 그렇게 만든것도 이해가 간다 왜냐하면 전쟁에 반대하는 그런 숨겨진 교훈이 있기 때문이다. 영상미와 더불어서 미야자키 하야오 감독의 특유의 숨겨진 교훈까...
10,극우나 극좌는 이념에 대가리 박고 한쪽의 비난만 대응하면 되지만 아나키스트는 모두의 비난을 감내해야 하기에 더욱 고통스러운 길이다. 그런 점에서 이 작품을 은퇴작으로 정한 그의 선택은 그의 철학을 스스로 체화시켰고 ...
10,8점정도는 받아야 되는데 무조건 1점 준 사람들때문에 10점 줍니다.~!!  적어도 보고나서 평가들 합니다 ;; 적어도 보고 난다면 전쟁미화 작품이라는 헛소리는 안하게 될겁니다 ;; 
10,"원래는 9점을 주려했으나, 1점 주면서 애국자인양 으스대는 개돼지들을 보니 10점을 주지 않을 수 없다, 이 영화가 전범미화하는 극우라고 진심으로 생각하는 사람들은 가까운 정신의학과를 방문해서 본인이 피해망상을 앓는..."
10,아니 보지도 않은것들이 리뷰보고 물타기 지리시네요; 제가 보기엔 일본을 비판하는쪽으로 보였습니다만? 그리고 꼭 평소엔 애국하지도 않으면서 이런곳에서 애국심이 넘쳐흐르시네 다들? 
10,전혀 전쟁미화 없는데 영화 쳐보지도 않은 틀딱노땅들이외서 평테한거 보니까 어이가 없다 오히려 영화는 전쟁을 비핀합니다.청년들이 공들여 시간들여만든 비행기를 전쟁에 이용한다는 듯한 내용으로 느껴졌구요 영화 봤으면 전쟁...
1,방사능은 사람에게도 영향을 준다 
1,미야자키 하야오가 인터뷰에서 그랬죠. '반일감정은 반한감정도 발생시킨다' 라고.  극우가 아니라고해도  똑같은 일본인일뿐.. 
1,우리나라에서 뻔뻔히 역사 외곡 친일 영화가 상영 되고 있다는거 자체가 믿기지 않음 
1,대원은 더빙도 쓰레기 배급수준도 쓰레기씨발 이딴 전범만화를 수입하다니.......이 애니 더빙되면 가만 안 둔다. 
10,딱히 우익 성향이 보인거 같지는 않았다... 
10,"어떻게 봐야 이게 전쟁미화로 볼수있지 ""비행기가  좀 무거워질거야 기관총을 싣지 않으면  어떻게 되지만"" 이런 말이 나온다  바람이분다 에서 나오는 비행기는 전쟁도구가 아니라  단지 비행기일뿐이란거다제..."
10,"일제 미화와는 전혀 상관 없고 오히려 반전 성향인 작품입니다만, 영화도 안 본 인간들이 선동당해서 우루루 몰려 와 별점테러하는 게 참 부끄럽습니다ㅜㅜ "
10,한국인들의 의식 진짜.... 
10,미야자키 하야오 감독이 하신 말쓴을 보아라. 아베정권을 신랄하게 비판하고 은퇴하셨다. 국뽕을 비판하려는 건 아니지만 일단 사람을 깔 때에는 제대로 인과관계를 파악해야 한다. 
10,아는만큼보인다라는말이어울리는영화 
4,솔직히 추천하지 않습니다. 역사왜곡을 떠나 저는 사적인감정없이 영화를 관람햇는데 영화자체가 너무 지루합니다; 도대체 감독님이 뭘말하려고 하는지도 모르겟고 내용이 너무 산으로 가는느낌이들어요ㅜㅜㅜ 
10,저도 오히려 일본 비판한 영화로 봣ㄴ느데 .. 미야자키 감독은 아베내각에 대해 비판도 서슴치 않으시는 분인데 .. 
1,"너희는 끝까지 그래도 우린 '사람'이었다고 말하고 싶은게냐? 너희가 인간이었으면 우리는 개, 돼지, 쓰레기, 성노리개, 실험용 통나무, 시합용 재료, 장난감, 한 마디로 사람 취급조차 못받았었다. "
10,"평점을 이해할수 없다. 영화를 보고도, 미야자키의 평생의 신조와 인터뷰 등을 보고도 이 영화를 일본의 피해의식과 극우사상에 쩌들어있다고 생각할수 있다니? 이 영화가 일본의 개찌질이 극우파들에겐 매국노 영화라며 까이고..."
10,세계대전 당시의 일본에 대한 주제를 다루는 것만으로 군국주의 발상으로 단정짓는건 어이 없는 처사다. 영화 제대로 보고서나 말해라. 오히려전쟁을 냉소적으로 보고 있는 영화다. 
10,아쉽네요...... 더 칭찬받는 스토리가 될 수 있었을텐데...... 
10,그릇된 민족주의가 여실하게 드러나는 평점이다... 국민정서를 고려한다면 이해 못할 것도 아니지만 이 영화 한편으로 미야자키 하야오를 '정체를 드러낸 일제' 정도로 치부해 버리는 천박한 이분법이 너무 슬...
6,작품만 보면 역시 미야자키 하야오라는 말이 나온다. 한 청년의 꿈과 열정 그리고 사랑을 아름답게 그려냈다. 하지만 한국인이기에 영화에 나온 미츠비시나 전범기 등에 대해서 비판적으로 볼 수 밖에 없다. 미야자키 하야오...
10,어디에도 전쟁을 미화하고 있지 않다. 오히려 전쟁으로부터 오는 파멸을 강조한다. 한국인으로서 우리의 고통은 어디에서 위로받을 수 있냐고 생각할 수 도 있겠지만.. 하야오의 모순을 인정하고 바라보면.. 진심으로 아름다...
10,잘못 이해하신 분들이 많은 것 같아 정말로 안타깝습니다. 영화를 보지도 않고 잘못된 정보를 듣고 온 분들도 있겠죠. 이 영화는 명백하게 미화가 아닌 ‘비판’에 초점을 두고 있습니다. 영화를 왜곡하지 않았으면 좋겠네요...
10,오히려 전쟁을 까던데 심지어 마지막에는 일장기를 한 전투기가 다 부숴진 장면이 고스란히 나옴. 
8,전쟁이 대충 아름답게 나와보이니 미화로 착각하는 것 같은데 애초에 잘못된 포커스. 우리는 지로의 꿈을 공감할게 아니라 모순된 상황 그 자체를 봐야함. 더불어 미야자키 감독은 전쟁을 매우 싫어하나 가족과 관련되어 이걸...
7,"미야자키 하야오,당신은 반전을 외쳤군요.            다만 당신의 꿈이 우리에겐 광기로 보였군요. "
