score,review
9,미화라기보다는 주인공 지로의 순수한 꿈을 이용하고 밟아버리는 일본정부를 비판하는게 보였어요 그래서 전쟁일으키는 정부를 광기의 일본이라고 한것이고 지로가 살고있는 곳은 마음이 편해지는곳 순수한곳이라며 지향하는게 보였습...
1,붉은돼지에선 이탈리아 파시스트랑 무솔리니 까더니 정작 일본제국은 못까겠다? 완전 내로남불. 지브리 옛날엔 정말 좋았는데... 
4,우익논란이고 뭐고 우선 영화가 지루하다. 
1,그동안의 며 ㅇ성이 있기에 최대한 편견 없이 있는 그대로 보려고 노력했습니다.보는내내 주인공이 좋아하는 비행기때문에 자신이 초래하게 될 재앙에 대해서는 부정하려들고 외면하려 드는 모습이더군요 나오코와의 사랑에서도 마...
5,전쟁할때 반대했던사람 엄천 많았다 역사는똑같다 라는 말이있다 우리나라도 일본처럼 했을꺼라는 말이다 우리 뭐가 틀리다고 저런냐 우리도 미친짓 많이했는데 이 주인공은 비행기를 만들고 싶어지 사람을죽이는 비행기는 만들고싶...
8,한심한 조선국민들. 아직도 '조선'이라는 단어에도 열등감을 느끼는 것 부터 비롯되는 허접한 시각.. 문화인이라면 문화를 문화적인 시각으로 봐야하는데 뇌가 생식기에 달린 수준.일본미화가 아니라면 한국에서...
1,"전범 미화, 국민 정서 다 떠나서 지루하고 재미없음. "
1, 저는 미야자키 하야오 감독을 무척 좋아하는데 이번 영화는 매우 실망스러웠습니다 일본의 제국주의 옹호하는 영화내용은 당황스럽고 불쾌한 영화였습니다 
9,몇OO 동안 그 힘든 손그림 고집하면서 많은 것을 보여준 감독의 은퇴작을 1점씩 주면서 욕을하는게 참.. 영화를 보고 댓글 달긴 하는건가.. 일본 미화하거나 면죄부를 하려는 의도는 보이지도 않는데 주제하나 보고 욕과...
1,"완전 개쓰렉 영화네. 이런건 인터넷으로 봐도 시간 아까운 영화다..진짜 노망난 노인네 구닥달이식 러브스토리에 미친 욱일승천기에...라퓨타니, 토토로니, 빨간돼지 등...결국 죄다 요거 풀려고 밑밥깐거였구만...하긴 ..."
5,이 댓글들을 보면 반일감정이 얼마나 극에 달아있는지 볼수있다 우리나라 교육부터가 잘못됐다 어릴때부터' 일본은 무조건 까야한다!' 가 아니라 '일본의 까야할것만 까자'란 교육을 했어야되는데...
1,실망이다 사람이 다르게 보이네 
8,이런 작품들을 위해 언제나 중립의 시선으로 감상평을 하는 '평론가'들이 있는 거다. 내가 보기론 전쟁의 참혹함과 자국이 저지른 무자비한 역사를 비판하는 장면들만 보이던데 
1,왜 1점이 최하인거지 1점도 아깝다 
1,정말 실망입니다.  이때까지의 명작들이 안타깝네요. 
1,역사적 사실을 왜곡하며 그림을 그리는 순간 그는 더이상 나의 우상이 아니다 
1,얄루아아아아야나아압 
1,걍 보지마요 왜보는거야 
1,직접 보고까라는 사람은 직접 살인해보고 강간해봐야 강간범 살인범 깔수있다고 생각하는건가?    그렇겠지?   안에 내용이 어떤지 어떻게알아? 
1,개인적으로 미야자키감독에게 실망함 
1,이딴 쓰레기같은 걸 영화랍시고 만들었네 
1,불쾌한 영화 
1,왜 이걸 은퇴작으로 하셨는지 .오랜 팬으로써 아쉽네요 ... ㅎ 영상미는 여전히 멋졌어요 
3,........내글에  공감/비공감  왜받아야  하는거지............................................................................................
5,왜 하필이면 호리코시 지로인가... 
1,음...... 미야자키 하야오씨의 ㅈ같은 열정은 대단하시지만 제발 이런 영화만은..... 
1,정말 마케팅 너무하네요. 포스터와 영화 소개글만 보고 봤다가 제대로 뒤통수 맞은 기분 들었습니다. 
1,별반개도아깝다.. 
1,그놈의로망과청춘때문에전쟁을미화시키는본격일본영화미야자키하야오는지금까지잘해오다가왜은퇴작에서이렇게욕을먹는짓을하냐 
2,좋아하는감독인데도 전범기업 미쓰비시에 강제 징용된 분들때문에 보기가 부끄러울정도 ㅇㅅㅇ; 
5,아직 안봤는데 평점보니까 보기가 두렵다 미야자키 하야오 완전 팬이였는데 마지막 작품으로 큰 실망을 할까봐 
6,작품 자체를 떠나 평점과 리플에서 반일감정이 어느정도인지 알수있는 영화. 저는 잘 봤어요. 특히 음악. 
1,ㅠㅠ 
3,내가 미야자키 하야오의 작품을 매우 좋아하지만. 솔직히 이번 작품은 실망이다. 자신의 아내가  폐결핵에 걸린걸 뻔히 알면서도.  그 앞에서 담배를 피우는  모습도  화가 나고. 자신이 지금 무슨 짓을 저지르는 지도 ...
4,"미야자키 감독님,  마지막작품이라고 들었는데... 실망했습니다. 돈이 아깝다고 생각이 들었습니다. "
1,??? 
1,일본영화 
5,옹호하진 않지만 제대로 반성하지도 않는다.  미야자키 할배...이딴게 마지막 작품이라니. 
1,소재... 
1,쓰레기 
9,ㄹㅇ 조선인들한테 민주주의랑 자유는 사치다. 일본 소리만 나오면 발광을 떨면서 동물의숲 200개 푼다고하면  3천명이 줄서는 반일 정신병나라. 명심해라 반일은 정신병이다 
9,"와우! 거장의 명작품!평점 1점 알바들의 선동에 넘어가지 마시길. 평양영화관에서 상영해도 이 점수보다는 높게 나올것 같음. 영화 음악이 문학 모든것을  국뽕 으로 재단해 버리는, 이 나라 왼쪽의 저급한 문화수준을 드..."
9,이걸 전쟁 미화라고 해석하는 사람들에게 왜 그렇게 느끼는지 물어보고 싶다. 영화 내내 일본의 잘못을 얘기하고 마지막엔 패망한 일본을 보여주고 있는데도. 오히려 일본의 극우들이 반일영화라며 비난하고 있다고 한다. 너무...
8,누가봐도 반전메시지를 담고있구만 무뇌센징들 발작하는거봐 
8,"사실 이 영화는 저주받은 꿈에 대한 이야기이다. 좀 더 들여다 보면 이 영화가 비행기의 아름다움과 파괴성에 대해, 전쟁의 결과에 대해 어떻게 말하는 지 알 수 있을텐데... "
1,"전범국가 일본이 침략용 전투기를 아~주~ 열심히 만들었다는 거지같은 내용입니다. 그 전투기들로 저지른 만행은 1% 안나오며, 어떤일이 일어날지 뻔히 알면서도 침략 행위에 기여한 주인공에 대한 어거지성 변론까지...황..."
1,국가가 저지른 일일 뿐 개인은 피해자다.? 재미있는 생각이네요 
1,노망난 만화가의 클래스 
10,정말정말 재미있습니다. 
1,"결국은 제로센미화, 7점 준 평론가들은 과연 역사의식이 있는가 싶다... "
1,0점은 못주나?보고있는데 참 욕이 나오는 영화네요. 이걸 은퇴작으로 하다니..역시 일본인이네요. 
1,이 영화 옹호하는 인간들은 무슨 생각일까. 일본인들은 제로센을 자랑으로 생각한다. 물론 최고 성능이었으니 자랑할 만 한데.. 그걸 방어가 아닌 침략에 이용했다는게 문제다. 
10,"정치적인 면을 제외하면 좋은 만화라고 생각함. 그들이 그들의 역사를 보는 정치적 시각을 제외하고 보면, 스토리, 연출 모두 훌륭하네요. 하지만 이것이 우리나라 애니이고, 이렇게 우리나라의 역사를 무조껀 아름답게만 표..."
1,국사를배우고있는사람으로서 한국인으로서 웃으면서볼수있는영화는아니다 
1,솔직히 많이 몰라도 티 날정도로군요. 방금 보고 왔는 데 예고편도 없이 초등학생을 심야 시간에 댓고온 어머니 보고 혀가 끌끌 차기 까지하내요. 호텔에서 담배피다 만나버린 독일사람이 전쟁을 다 잊어라할때.  일부러 혐...
1,낭만이 덕지덕지 묻은 왜곡과 오류의 결정체 
1,기대했던거에비해별로였다 
1,ㅇㅇㅇ 
1,한없이 착한 마음씨와 선한 얼굴을 한 살인기계(전투기) 설계자를 위하여.. 
1,니들이 사람이냐 
1,적어도  사람이 생각이 있으면 이딴 거지같은걸 한국에 들여오면 안되죠.미친 원숭이들이나 감상에 빠져서 볼 영화네요. 
1,진심 미야자키가 이럴줄은 몰랐다. 
1,일본 전쟁 미화영화 
1,"중세시대에서 근대국가로 변모하기 까지 일본은 독일의 기술력, 정치를 많이 카피했다. 현대에 와서도 독일에게 배울점 많은 일본 아닌가? 일본도 독일이 서구국가들에 그런 것 처럼 아시아권 국가들에 용서를 구해야 한다. "
1,미야자키감독의 영화는 참으로 좋아했는데 이런영화를...실망스럽네요 . 제가 워낙 소심해서 그런지몰라도 그동안 봤던 영화들도 싫어지네요. 잊고싶을정도로. 
6,애니메이션치곤 상영시간이 길어서 좀 지루했음. 잔잔한 영화. 결말은 별로였지만 영상미가 좋았네요. 만화같지않고 실사처럼 보인 장면들도 인상적이었구요. 
1,ㅜㄴ 
1,역사왜곡은 둘째치고. 은퇴작이라해서 기대했는데 보다가 졸았다. 임펙트도없고 뭐냐 이게. 대충만들었네 그림체도 질질흐르고. 
1,꿈? 어디서 꿈이라는 단어를 갖다 붙여? 더럽다. 가미카제 제로센의 그를 꿈으로 포장해가며 역사에게서 도망가는 일본인의 개수작 수작은 수작이네 개수작 
7,역사왜곡도 분명히 있다.하지만 한 인간으로서 바라 보았을때 평생의 꿈을 위해 달려가는 지로의 모습은 어쩌면 모든 남자들의 모습일것이다. 미야자키의 메세지는 결국 전쟁이 아닌 평화다. 그래도 한국인으로서 열받는건 어쩔...
1,한국 메이저 영화 감독들은 뭐하는거냐? 하나같이 쓰잘대기 없는 자극적 소재만 만들고 미국이나 유럽봐라 독일이 꼼짝도 못하게 영화로 나치의 잔혹함을 다보여주는데 일본은 적반하장의 작품을 만드는데 한국은 로맨스나 스릴러...
1,ㅡㅡ 
1,꿈을 위해 열심히 사는 사람을 그리고싶었으면 2차대전 전범인 도죠히데키를 주인공으로 하지. 그사람만큼 꿈을 위해 열심히 산 사람이 있을까. 수많은 아시아'인을 죽여서 꿈을 이루고자한 사람인데...평소처럼 자연...
1,"이 영화는 그 당시 시대상을 미화하고  자신들이 일으킨 전쟁에 대해서 자신들의 관점만을 드러내는 영화이고 감독은 제로센 부품공장 자식으로써 일본의 전쟁을 위해 끌려가서 희생당한  사람들에 대한 배려가 전무, 일본판에..."
1,반일을 떠나서 더럽게재미없어서 보다나옴 사람들 다잠 
1,추한 늙은이 같으니 일본놈들은 다 한통속이냐? 그러니까 천벌이 내리는거다. 
1,이건아니지 
1,처음부터 끝까지 거짓이기에 이건 사기극이라 생각하고 안보고 1점 이건 봐야 사기극임 판타지를 만들더니 역사도 판타지로 배운듯 역사적인 사실을 부정하고 막판에 오점을 남기시네요 
1,전쟁 미화에 대해서 절대로 관대해져서는 안됩니다.한국의 얼을 빼놓고 만든 쓰레기같은 작품 
1,재미없어요 
4,꿈을 쫓는답시고 전쟁에 쓰일 비행기를 만든 것도 문제가 되지만 영화 자체도 지루하다... 
1,"쪽바리들 영화나 애니는 무조건 1점이다. 이런 애니를 만들어서 쪽바리들 아이들에게 보여주면서 꿈을 위해 다른나라를 식민지로 만들고 위안부 수용소를 만들었다고 하고, 그렇게 알면서 살겠지? 대단하다 정말..ㅉㅉㅉ "
4,"볼건 아니지만 미야자키한테 매우 실망했다. 그 동안 그 많은 명작들을 이 영화 하나로 실망하게 됬다.  에효 결국 이 인간도 우익 일본인이엿다,. "
4,나우시카의 그런 감동을 바란건 아닌데..내용도 그렇고 자국민이 아닌이상 공감하기 힘들다. 히사이시조의 음악도 이번엔 별로 매력적으로 다가오지못하고..이정도 작품이 감독의 마지막 작품이라는 것이 참안타깝다. 
1,쓰레기같은 마야자키 일본은 정신을 차리게 폭탄 좀 더 맞아야된다. 
1,군국주의 미화!!! 
4,미야자키 특유의 재치나 창의성이 보이지 않았던 영화. 처음으로 두 번 보고 싶다는 생각이 들지 않는 하야오의 작품 
1,이걸 보는 봉지들은 일본자위대 위안부로 입대하라. 
2,하필 왜 마지막작품으로 이런걸.... 
1,전쟁 반대 메세지를 외쳤다 하는데 실제로 본 바로 전혀 그런거 없고 군국주의 전투기 제작자와 군인들 미화한 만화임.미야자키 이새기가 노망이 들어도 단단히  들었구나OOOO 
10,디테일이 살아있다. 이런 애니는 처음. 
10,"영화 보는 수준이 아직 그정도밖에 안됬다는 거지, 무식하다는거 알아달라는건가 "
10,미야자키는 영화를 통해 본인과 관객에게 계속해서 질의하고 있다 하지만 그 물음을 던지기엔 아직 우린 전쟁의 고통이 낯설지 않기에 거부감이 드는 것 아닐까 하지만 미야자키 본인도 인지하고 있다는걸 영화에서 느낄 수 있...
10,국뽕들 평점 낮게 준다고 신났네 역사공부는 역사책으로 
10,보는 시각에 따라 오해 할수도 있다만 잘못된 부분을  이야기를 하는걸로 보이는데 다들  이상하게 보신거 같네요. 이런.. 
10,"어떤 시각으로 이 영화를 보느냐를 떠나서, 미야자키의 어쩌면 자학적으로 보이기까지 하는 반전적이고 반성적인 메시지를 제대로 받지 못하고 비난일색인 사람들이 있다는건 한국에서만 일어날 수 있는 일이 아닐까 "
10,되게 재미있어요 1점 준 분들 대체 무슨 생각으로 영화를 보고 평점 했는지 모르겠네요 
10,좀 보고 평점먹이고싶다. 왜 릴 안뜨는거냐 내린지 얼마나지났는데 ㅡㅡ 
10,이감독 다음작품을 기대하는일이 이젠 없으니 슬프다ㅠ 
10,감동적 이예요.그리고 재미있어요 
1,상영중지해라 
1,무 리 수 
1,안봐도비디오다 기대했는데 그냥안봐야겠다 
1,나라감정은 둘째치고 재미가 없다. 
1,은퇴작 이라면서 엉망 
1,일본아 반성해라 
5,포스터에 낚이면 안됀다. 그리고 아이를 동반해도 안됀다. 미야자키 하야오 이러면 안됀다. 
1,욕 밖에 안나오는 작품. 독일에서는 2차대전에 대한 작품을 어떻게 만드는지 'Der Untergang' (몰락) 을 꼭 보고 비교해보세요. 
1,에휴..  어린학생들이 뭣모르고 보지말기를 
1,"예전 작품에선 전쟁을 가혹하게 묘사하더니 노망 났나?은퇴작이라 다행이다.안노 히데아키가 나우시카2만들고 싶다고 했는데,그거나 기다려야 할꺼같다.영감 정신차려. "
1,뭐야;; 이 쓰레기는;; 
1,이제 리틀보이 제작자의 고뇌와 열정을 담은 영화만 나오면 되겠네요. 
1,"주인공 지로와 친구인 혼죠의 ""우리는 무기를 만드는게 아냐, 좋은 비행기를 만들려는 거지"" 라는 대사에 피가 싹 빠져나가는 기분을 느꼈음. 이건 아니지... 이 영화는 정말 아니야. "
1,진짜 실망했습니다 
1,하아...진짜 답없네 
1,지루했어.. 전작들의 명성이 무색했다. 
6,전쟁 미화 
1,역사 문제를 빼더라도 이전 지브리 작품보다 재미가 없습니다. 
1,"개봉전부터 역사의식때문에 많은 논란이 되었던 작품. 그러나 막상 뚜껑을 열어보니 역사의식은 별 문제도 아니라는 것을깨달았다. 초딩이 써도 더 잘쓸법한 스토리 텔링 기법, 도데체 무엇을 말하려는지 모르겠는 전체의 테마..."
1,우리나라사람에게 피해를 준 전범을 미화한것도 짜증나지만 내용적인 면에서도 재미가없었고 지루하기만 했어요 전범을 미화한점과 스토리가 재미가 없었던 면에서 0점을 주고싶지만 0점은 안되서 1점 드립니다 미야자키 감독님 
1,"""일본이 한 만행""을  잊을 수 앖어요 "
1,0점 줄수는 없나 참 쓰레기같다.. 
1,저도 참 좋아하는 감독이지만 이번건 진짜 아니라고 봅니다.  전쟁을 미화하고 사실을 왜곡하여 과대 광고하다니.. 살인자가 실컷 살인다하고 자기 꿈을위해 살인했다고하면 정당화됩니까? 
1,............................. 
1,완전 기대이하 ..영상은 이쁘지만..무슨내용인지도 모르겠고 괜히봤다 
1,나도 한 때 일본애니 좋아했는데 이러한 뒷배경을 알고나면 볼래도 정내미 떨어져서 보기가 싫다.특히 이런건 정말 조심해야한다. 전쟁미화. 외국인이 그냥 일본 문화에 빠져서 욱일승천기가 전쟁기인지도 모른체 패션인양 그려...
1,"baks**** 이작품에, 평점 10점 주면, 지는 뭔가 되는지 아는 모양이네 "
10,꿈을 꾸고 그걸 좇는 것이 잘못인가요. 그 꿈을 전쟁에 이용한 이의 잘못이 아닌가요. 
1,미야자키 하야오가 이런사람이었다니 정말 실망이 크다 정말 하울이나 치히로까지 싫어짐 
10,거장은 죽지 않는다...실력을 보여주다!! 
10,이 영화가 미화 영화라는 사람들의 단편적사고 일본의 제국 주의 앞에 영화 주인공의 아름다운 꿈이 사람을 죽이게만들고 자신까지 파멸로 이끄는 모습만 보아도 이영화가 전쟁 미화 영화가 아니라는걸 알수 있다 아름다운 미장...
10,전교 일등한 아이에게 반에서 일등한 아이가 너 이게 잘못됬어 고쳐라고 한다면 그것을 받아들일 사람은 거의 없다 국제정세도 마찬가지다 일본이 국력이 강한것은 그들이 우리보다 훨씬 노력했기 때문이기도 하다 노벨상등 많은...
10,"이영화를 역사적으로가 아닌 마음으로, 가슴으로 느껴보았다면 결코 잘못된 영화가 아니다. 영화 끝부분에 영화는 말한다. ""돌아온 비행기는 없어요.. 비행기란 꿈은 저주받은 꿈이라고"" "
10,"우회적비판..그저 객관적으로 한 소년의 꿈을 냉소적표현으로 그리고 있다고 생각합니다.과거의 역사를 정당화 시킨 장면도 없었던거 같고,일본은 결국 파멸한다라는 내용이 사실 여러번 등장합니다.여튼 전  재미있었습니다.&..."
10,"저는 이 만화를 전쟁미화물이라고 보냐면, 보지 않습니다입니다.이 영화의 주인공 지로는 '빠르고, 안전한' 비행기를 만들고자 했습니다.'빠르고 안전한'비행기이지, '많은 사상자를 배..."
6,과연 우리가 미야자키처럼 일본 제국주의시대의것들을 들쳣듯이 우리가 베트남전/돈을위해 참전했지만요/ 에 우리가 저질럿던 잔혹한짓을 그린 애니를 우리가 상영이나 할수있을까요 라고 별한개반을 주신 분들에게 말해보고싶네요 
1,영화를 보면 감독이 은퇴할때가 된걸 자연스럽게 알게된다. 무엇하나 호기심을 자극하지 못했고 로맨스도 지루했으며 담배는 왜이리도 많이 피는건지.. 감독이름이 아까운 영화다.. 10점은 정말 알바가 아니고야 줄수 없는 ...
1,지브리의 작화와 연출력에서는 좋았으나 수시 때때로 담배피는 장면이라든가 욱일승천기 등 자극만할 소재가 많았다.. 언제까지 애니에 정치적의미 까지 담을려고 하는가? 
1,일본 정말... 
7,"역사적인 요소로 얼굴 붉히고 그럴건 없었는데... 솔직히 많이 지루하긴 했습니다. 그리고 왠지 모르겠지만, 엔딩 다 보고나니까 갑자기 말로 표현못할 답답함이 생기더군요... 다 괜찮은데 재미 요소때문에 점수 많이는 ..."
3,"마지막  작품이고 뭐고 없다... 딱 일본에서만 상영되어야 할 영화,, "
1,이걸 일본 미화 영화가 아니라고 하는 놈은 학교 역사시간때 디비 잔 새키다 
1,"별 내용 없는 비행기 오타쿠 영화. 독일 나치스 히틀러는 비난해도, 일본은 단지 전쟁에 졌을 뿐이고, 비행기는 전쟁 무기로 동원됐을 뿐이라며 자기 합리화를 한다. 미야자키 감독님, 이런 영화 왜 만드셨어요? 감동도 ..."
1,하......진짜ㅋㅋㅋㅋㅋㅋ 더 이상의 자세한 설명은 생략한다 
1,으휴 차~암 낭만적이다 
1,에라이 OO 
1,이거 보러가는 사람있나 ㅋㅋㅋ 
1,최악의영화. 우리나라 조상님들을 무참히 학살하고 살해한 일본인들의 행위를 말도 안되게 포장하고 왜곡하는 더러운 영화 
1,역사왜곡 
1,덴노 헤이카 반자이쓰레기 영화 
1,일점도 많다 
1,한심하다 
8,"하도 비판글이 많아서 영화를 보는 내내 그런 부분이 언제 나올까 싶었는데, 다 보고 나니 미화를 했다는 생각은 안들더군요. 오히려 전쟁을 비판하고 이렇게 전쟁을 해서 일본이 망한다, 망했다 라는 일본 전쟁에 대한 부..."
10,왜.. 정치적으로 해석하는지... 저도 역사 공부를 했지만 전혀 생각 없이 봤는데요.. 평점 낮아서 10점 줍니다.  . 동화같은 배경 너무나 좋아요 
10,허...다들 수박 겉핥기  하고 계시는구만 
10,전쟁이라는 시대를 살아가는 천재는 결국에 이런 취급을 당하게 됩니다. 
8,부정할수없지만 코난 붉은돼지 마녀키키 나오시카 라퓨타 하울은 전쟁과 비행기속에서 자연과 인간의 모습을그려냈다 노년의미야자키는 언제나어릴적추억그대로이다 보지않아도 머리에그려지는 영상미는 평점이나 불편한한역사아는무관하지...
1,전범국가에 던지는 당당한 위로와 희망. 일본국기로치장된 꿈의 비행기에 마음이 답답해지는 것은 비단한국인 뿐만은 아닐것이다. 비행기의 잔해를 걸으며 결핵으로 죽은 마누라의 꿈을 꾸기 보다는 당신의 폭탄비행기에 희생된 ...
1,졸립니다 보지마세요 
10,일본에 피해의식 쩌는 루저들이 평점 테러한 비운의 작품 
10,한국에서만 욕먹음 ㅋㅋ 해외에선 이미 다 호평~상까지 받았죠~ㅋㅋㅋ 더빙으로 조셉고든레빗.반지의제왕 프로도 역 일라이저 우드. 엣지오브 투모로우 여주인공 에밀리 블런트도 욕해라 이런 영화 더빙했으니까 ㅋㅋ ㅉㅉ 
10,"전국민이 꼭 반드시 봐야 할 영화, 만화 한 스틸마다 감동 그자체, 음악또한 하이클라스 "
1,전에 미야자키 하야오가 데즈카 오사무 까더니 그 발끝에도 못미침. 
9,전쟁미화 영화가 아닙니다. 학창시절에 읽던 지루하지만  찡한 ?문학책같은 느낌이랄까요? 잔잔한 분위기를 좋아하는 분들에게 추천합니다. 그리고 중간에 나오는 이태리백작은 미야자키 감독을  뜻한다고 생각합니다. 주제넘지...
8,자신이 원하는 일을 하지만 현실에서는 자신의 일이 나쁜 곳에 쓰이는 모순 속에서 일하는 걸 그린 작품. 다만 좀 떨어지는 스토리 개연성 때문에 실망 
10,미야자키 하야오감독의 작품은 아름답다.우린 단지 꿈을 향해 달려갓을 뿐이야..맞다. 이걸 또 이상하게 오해하는 건.. 
10,"미야자키 하야오 감독은 ""동아시아의 평화를 바라는 마음에서 만든 것""이라고 반박했지만, 한국과 일본 양국에서 여전히 논란의 불씨는 남아있다.보지도 않고서 내용 이해도 못하는 무뇌들이 넘치는구나 "
9,"내가 지브리스튜디오 작품들을 볼 때 점수주는것.색채,음악,주인공의 성장,자연.자신이 만족했던 부분들의 점수조차 주지않고 그저 전쟁미화 라는 주제 하나만으로 1점을 주는 사람들을 보니 안타깝다.내가평가하는 지브리애니메..."
9,전쟁을 미화시킨건 맞지만 주인공이 한말중 아마 일본이 미국에게덤벼봤자 결국 일본은 전쟁때문에 망할거다 라는의미를담은 대사가있었죠 즉 어느나라던 정부가 뭔짓을하던 말로만떠들뿐 큰관심은없고 그로인에 피해보는사람(여주인공...
10,"KIA! 국뽕에 취한다! 이걸 만든게 일본인이니까 욕하는거 아냐. 미야자키 감독님이 많이 일본이 전쟁을 냈고, 일본의 행위는 잘못됬다라고 몇번을 어필했는데 무시해 버리고 아주 이것의 내용은 제로센이고 주인공이 지로니..."
10,걱정했던 것만큼은 아니여서 다행이다 
10,하야오가 만든 가장 슬픈 영화. 
10,다시보고싶을정도다 
10,영화 자체를 보고 평가해야지 역사를 영화에 이입하여 이렇게 나쁜 평점을 주는 것은 옳지 않다고 본다 이 영화는 볼 가치가 충분하다 
10,일본 전쟁관련이라면 다 싫어하네? 6.25전쟁은 우리쪽 보기 좋게 미화시켜놓으면 '크으 역시 북한놈들이 ㅉㅉ.. 우리들은 정의! 이 영화 좋아요!' 같은 반응이나 보일 인간들이? 전쟁관련 요소를 미화시...
10,은퇴작이라니 아쉽다 
10,지금껏 본 만화영화중 가장 감명깊었던 영화..엔딩크레딧이 올라갈때 나도 모르게 안구가 뜨거워지게 만든 영화였음.시대를 초월해서 개인의 인생의 꿈과 희망을 국가라는 사회 안에서 구현할때 어떤 아이러니가 빚어지는지 잘 ...
