score,review
1,제미없어요 
1,이새끼도 우익이엇어?ㅋㅋㅋㅋㅋ 
1,미야자키하야오도 어쩔수 없는 일본인?내 추억이 송두리째 없어지는 기분::;; 
1,1점도 아깝고 미야자키 하야오 감독한테 뒷통수를 후려맞은것 같아배신감을 느낀다;; 
1,최악 
1,은퇴작을 굳이 이거로 했어야하냐;; 
1,역사를 왜곡하는 쓰레기같은 애니 볼가치도없고 이게 우리나라에서 상영되는곳이있다는게  안타깝다 
1,"미야자키 하야오 감독의 섬세한 표현과, 영상은 예쁘지만 정말 한국인으로서 화가나는 영화네요 정말 이 배급사는 무슨생각을... 한국에 개봉하게 한건지.. 쩝 "
1,부디 망하세요 
1,"영상은 훌륭하나, 일본의 국수주의와 전체주의가 묻어나는 영화입니다. 특히 개인이 국가를 위해 희생하는 모습에서는 '사쿠라' 철학이 풍겨나며, 중간 중간 세밀한 영상에도 묘한 의도가 짙습니다.(제복, 승..."
1,이영화를 보고 이해를 못하겠어요. 이 영화는 어른을 위한 영화지 어린이를 위한 영화는 아닌것 같아요. 미야자키 감독님 다시 봤어요. 실망스럽네요. 
2,"역사적 문제를 떠나 스토리와 복선만 따지더라도 최악.. 라퓨타+귀를 귀울이며+하울의 움직이는성+이웃집 토토로등 어디서 봄직한  캐릭터들만 등장, 한 인물의 조명과 러브스토리 둘다 잡으려고 하다 어느 한군데에 포커스를..."
2,난 진짜 이해안감 이감독이 센과치히로 감독이라고???? 
1,역사왜곡이고 다 제껴두고서도 영화 어지간해선 다 잘보는데 진짜 심하게 오그라들고 오질나게 재미없어요 
1,뭐어쩌자는거지이거ㅋㅋㅋㅋ진짜 보는내내 언제끝나나 이러고 감동도 없고 재미도없고 아정말 시간낭비 돈낭비ㅋㅋㅋㅋㅋㅋ욱일승천기때문에 또 빡치고ㅋㅋㅋ아정말 1점도 아까유ㅗ 
1,미야자키 하야오가 노망이 든 듯... 
1,정말 우리나라에 한심한 사람들 엄청 많네. 만약 너희들이 싫어하는 전두환 전기영화를 있지도 않은 내용 붙이면서 아름답게 만들었어 그런데 작품성이 좋아..그때도 너희들은 높은 점수 줄수 있냐?  이번 건 이전 하야오 ...
1,어이없네진짜 
1,일본이 경제가 점점 어려워지고 방사능이 전국으로 점점 퍼저가니까 이제 본색을 들어내는건가...앞에선 사랑을 내세우는듯 하면서 뒤로는 침략을 옹호하고있군요...하야오감독에게 배신감이 큽니다...이렇게 마지막에 뒤통수를...
1,"정말 말도 안되는 쓰레기 영화입니다.일본 가미가제 비행기 제작을 한 쓰레기의 사랑이야기라니...아름다운 음악과 말도안되는 대사들로 덮으려 했으나,그 쓰레기 냄새가 전혀 가려지지 않아 역겨워서 죽을 뻔 했습니다. "
3,"아..보면서 약간 기분나빴습니다.이유는 다들 아실테고..미야자키 하야오 감독의 은퇴작이기에 더욱 기대했던바,실망이 매우큽니다. "
2,미야자키 은퇴작이라 해서 조조로 봤는데 전 작품과 달리 실망했다. 영상과 노래는 좋았으나 툭툭 끊기는 장면과 지루하게 꿈과 사랑이야기를 하는것 같다.무엇보다 보는 내내 전쟁에서 큰 활약을 한 전투기 제로센을 설계한 ...
1,아오 
1,이런 
1,"혹시나 했는데, ㅉㅉ. 쓰레기 영화. "
1,할부지~ 마이 실망했어요~ 어쩌다 그렇게 된거에요.. 하하하 
3,소재도 소재이지만 재미가없음...ㅠㅠ 보는 내내 팝콘만 냅다 먹었다-- 
1,"미야자키하야오 친할아버지 = 태평양전쟁때 일본폭격기 만들던 공장장 A급전범. 미야자키하야오 왈 ""그땐 어쩔수없었다. 뭐가 옳고 뭐가그른지 알수없던 혼란의 시기다"" 이게 변명이라고 하는건가 "
10,미야자키 하야오님 다큐를 보고 그런 소리들을 하세요 의도를 제대로 알려고도 하지도 않는 사람들은 댓글을 쓸 자격이 없습니다 
10,영화도 안보고 1점주는 인간들 뭐냐 대체;; 우익요소 찾아볼수가없구만...전범국 주력전투기를 만든사람 다루는게 맘에 안드는건 나도 마찬가지긴한데 최소한 영화는 보고 평가하자... 
10,"저는 그저  한 남자의 꿈과 야망이 아름다워 보였네요, 인생은 다양한 역설과 모순이 존재한다는것, 자신의 열정과 꿈앞에서 공허함의 눈물을 흘려야했던 그 청년의 모습은 그 당시 시대의 배경과 전쟁의 참혹함을 설명해주기..."
10,이 영화 안봤지만 네티즌보다 평론가들 점수가 더 높다는데서 진짜작품이라는 생각이 든다. 한국인이 얼마나 세뇌당한 인종인지도. 
10,미야자키하야오 감독의 작품을 다시 볼 수 없다는게 너무 아쉽다... 
1,지브리 매니아인 나에게 큰 실망을 안겨준 작품. 거의 자위대 홍보영상물 수준이다. 그동안의 사랑스러운 지브리 작품들까지 미워질정도.. 
1,미야자키 하야오 작품에 대한 무한 사랑을 과감하게 끊을수 있게만든 작품. 
1,아는언니가 이런류 영화 좋아해서 이영화보고싶다고 영화관에 끌려와서 봤는데 태어나서 이렇게 재미없는영화 처음본다... 처음으로 멍때리면서 봄 
10,은퇴전 일본정부를 비판하기 위해서 만드신 영화라고 직접 기사 발표하시고 영화내셧습니다 기사 한번만 읽어보시길바래요  영화에대한 느낌 장면하나하나가 비판적이라는걸 알수있어요 
10,"과거에 대한 잘못을 변명하는듯한 작품이지만, 과거의 잘못을 알고 반성한다는거라면 작품면에서는 좋았다고 생각한다. "
1,희대의 망작 
1,그냥 쓰렉.... 
1,미야자키 하야오 정말 좋앗는데...... 
1,왜이런 작품을 만들었지? 미야쟈키 그의 본모습이 이런거였나?? 
1,헐...말이 안나온다.. 
1,일본 만화만드는 애들은 상상력이 좋아서 그런가? 예수도 일본인이라고 하는 만화도 있더니 이제는 군에서 의뢰해 만든 비행기를 무슨 개인의 꿈으로 승화 ㅋㅋㅋ 그냥 쓰래기 상상극장 
1,"딱히 전쟁을 미화했다는 생각은 안들었다. 내용 자체가 전쟁에 중점을 둔것같지 않았고, 오히려 중간중간 일본비판적인 대사들은 있었다. 오히려 작품 자체에 실망했다. 정말 하야오감독 작품인가? 싶을 정도로 스토리 구조나..."
2,"미야자키 하야오는 헌법개정반대, 종군위안부문제에 대해 일본의 사과를 촉구하고있지만 이 영화에선 2차 세계대전을 일으킨 일본, 이탈리아, 독일인만 나올뿐 피해입은 국가들은?등장조차 않는다. 작품과 현실의 다른 모습을 ..."
1,0점이 없네 
1,영화 보고 평점쓰는데 알바? 이 영화 팔아먹으려고 10점 주는게 알바겠지 답답하다. 
1,진짜 지루했다. 
1,많이 실망했다. 
5,일단..지루하고 재미없다는거 
1,실망이다 
1,내가 이걸 돈주고보다니ㅠㅠ  영화에대한 최소한의 정보만 있었어도~  내용도 질할맞은게 재미도 없다. 
1,왜곡된 영화. 결말조차 아니였다. 
1,ㅋㅋㅋㅋㅋㅋㅋㅋㅋㅋㅋㅋㅋㅋㅋㅋㅋㅋㅋㅋㅋㅋㅋㅋㅋㅋㅋㅋㅋㅋㅋㅋㅋㅋㅋ 
1,미야자키 당신덕에 일본만화의 환상에서 깨어났다. 고맙다.그냥 쓰레기애니. 
1,사람기빼는영화ㅋ 
1,안경 빼놓고 시나리오 검토한듯. 
1,ㅉㅉ 
10,일제시대 배경이라고 영화도 안봐놓고 욕하지마라 영화보는내내 당시 상황을 미화하는 장면은 보지 못했다. 오히려 주인공이 군입대후 일본이라는 나라에 실망하는 장면이 대부분이다. 그리고 간부들 앞에서 근대화된 일본 이라고...
10,"이 영화로 많은 사람들이 미야자키 하야오 감독님을 별로 안좋아하게 됬을지도 모르겠지만, 감독님은 단지 비행기가 나오는 영화를 만들고 싶어서 만든거로 알고 있습니다. 그 모델이 단지 호리코시 지로였을 뿐이고요. 감독님..."
10,누가 우익영화라는가? 우익의 성향은 전혀 들어있지 않았다. 호리시코 지로는 지극히 자기 인생을 살아갔을 뿐.총체적인 책임은 본 일본국에 있지 호리시코의 로맨스와 꿈에대한 열망에는 아무런 그 무엇도 없다. 
10,미야자키 하야오는 2차세계대전에 태어나 전쟁의 아픔과 공포를 누구보다 잘알고 있습니다.그리고 전쟁과 폭력을 싫어하고 자연과 동물을 사랑하는 미야자키 하야오는 여라작품으로 어린이들의 눈을 즐겁게 어른들에게는 어린시잘을...
10,작품은 보고 까는건가? 한 위대한 애니메이터의 자신의 삶을 돌이킨 멋진 작품이라고 생각한다 
10,미야자키 하야오 감독중 오랜만의 명작일듯.. 10점이 아깝지 않은 영화다. 
10,전 둘의사랑과 주인공의 꿈에 중점을 두고 봐서 재미있었어요!! 지브리 애니 다 정말 재밋고 팬인데 ㅠㅠ 미야자키하야오감독님 은퇴하신다고 해서 너무 아쉬워욮ㅜㅜㅠ그리고 표현이 너무 감동적인것같아요 모자가날아가서 인연이...
1,그도 어쩔수 없는 전범국가의 일원이였구나... 원령공주에 감동받고 다른 작품도 다 찾아봤었는데... 천사가면 쓴 악마에게 속은 느낌이다 
1,"영화보다 뛰쳐나가고 싶었던 적은 처음이다. 사전에 아무것도 모르고 그냥 개봉날에 미야자키 하야오네 봐야지 하고 봤는데 불쾌했다. 엔딩에서 자살특공대 잔뜩 날아가면서 ""아름다워....""라는 대사날림???..."
1,최근 유일무이하게 내돈내고 중간에 나온 영화.고양이버스를 처음 봤을때 감동을 기대한 내잘못. 
1,뭐같은 영화 
1,어쩔수없는 일본인.. 
1,제로센을 만든사람과 회사를 미화는 좀?솔직히... 전쟁을 하는 일본이 패망이라고 말하긴 했지만... 대체 미야자키 하야오가 하고 싶었던 말이 뭐죠.. 일단 비행기회사 미화는 열받아요 살인무기나 만들었던 주제에 아름다...
1,역사적 왜곡? 좋다 이해한다. 전쟁미화? 좋다. 일단 들어본다. 살인 병기로 많은 희생자를 낳았다? 뭐 다 좋다. 일단 보고 이야기 하겠다.  그래서 봤다. ........... 뭐 재미가 있어야 앉아서 보지.......
2,"역사적 왜곡, 일본미화등은 눈에 보이지 않았지만 재미없다.이전작까지 미야자키 영화를 무척 좋아했던 나로서는 정말 실망이 크다.영화보기전에는 '아 미야자키 은퇴작이라니 아쉽다.'영화본후 '아 미야..."
1,진짜 정말 기대하고 봤습니다 웬만하면 이런 별점도 올리지않구요 정말 재미없습니다. 이렇게 지루한영화도 처음이네요 전개도 이상하고 감독믿고 본 영화였는데 최악입니다 
1,꿈과 사랑으로 교묘히 포장질을 하다니...그 좋은 능력이 마지막까지 지구 최대 살인국의 국민임을 입증하는군.일본인의 간사하고 파렴치함을 최고절정으로 포장질한 애니.길이길이 그 철면피함이 치욕스러움으로 남는다 
1,감독의 명성에 낚였다. 여친도 졸고 나도 졸았다. 재미와 감동이 있을줄 알았는데 둘다 없다. 다시는 일본 애니메이션 극장에서 안본다. 
1,"이거 안봤는데, 한국에서 이런 영화를 상영한다는게 마음이 안좋다. 작품성이 좋든 어떻든 전쟁과 전범들을 미화시키는 영화는 쓰레기 일뿐...과거를 되돌아보지 않는자는 앞을 볼수없다고 역사를 잊은 민족에겐 미래란 없다...."
1,원작소설 바람이 분다는 주인공이 비행기 설계자도 아니고 비행기나 전투기와는 동떨어진 사랑얘기입니다. 거기에 왜 제로센과 호리코시지로 같은 인물을 끼워넣었을까? 미야자키 하야오는 역사의식이 있는듯 쇼를 하지만 철저히 ...
1,아니 이걸 다시보면 난 인간이 아니다내 인생 처음으로 영화관애서 영화보다 나왓네ㅋㅋ진짜 돈만날린 영화 친구들이랑 4명에서 보다 나오면서 욕만 했다. 정말 볼게 안된다 
1,왜만든건지 모르겠다 
1,"보고 나서 한줄 평가 ""남주 못말리는 꼴초네."" "
1,이자식들 아직 정신을못 차린거지 본인들의 잘못을 인정치 못하고 정당화해보이려는 개수작 영화가끝나고 울화가치밀엇다 
1,파시스트가 되느니 차라리 돼지가 되겠다고 했던 돼지는 어디로 갔나?... 
1,1점도 아까운 
1,은퇴작을 왜 이딴식으로 만들었지?? 의문이 드는 영화 
1,아 쓰레기영화 
1,"방사능을 먹더니, 노망이 난 미야자키 하야오 "
1,미야자기 하야오 감독의 작품은  좋아하지만 이건 멍청하지 않는 이상 볼 수 없는 작품~ =_=+ 
1,영감이 극우도 아니고 군국주의자도 아니지만 이 영감의 역사 의식은 딱 일본인 수준이라서 안됨. 전쟁이 지들 잘못이라는 생각이 없고 우리도 휘말린 입장이라는 OOO 마인드를 가진 인간이니.. 
1,돈아까움.  은퇴전 마지막작품인데 완젼지루하고 자다가옴ㅡㅡ 
1,왜곡된 역사가 짙게 깔린 영화를 수입하는 수입사와 한국에서 이런 영화가 상영된다는 사실에 얼굴이 뜨거워진다. 
1,대실망일세....에휴~ 
1,감독님... 
1,소재가 역시나... 
1,정말 실망입니다. 
9,일본에대한 광적인피해의식으로 점철된 민족주의적 리뷰가영화보다 배는 역겹다. 
1,미야자키도 결국은 뒷통수치는 일본놈이었다는거.. 이걸 우리나라 아이들에게 보여주고 싶지 않다! 수많은 한국인을 죽인 전범기업 미쓰비시의 엔지니어 를 꿈이라는 가면으로 미화시키는 애니를 한국에서... 헐... 굳이 수...
1,좋아하는 애니메이션감독이 싫어하는 일본인이 된 경우.지극히 실망스럽고 그의작품들을좋아했던 내 감정소모에 사의를 표할뿐. 
5,미야자키가 어떤 생각을 가지고 어떤 영화를 만들었건 문제되는것보다 국내 수입되고 극장상영자체가 거짓된 모순이라고 생각하네요. 영화는 보는사람의 기준이지만 국내에서 상영된이상 거짓포장된 예고편과 찌라시는 문제가 있다고...
1,"자칭 평론가들 수준 보소 ㅋㅋㅋㅋㅋ  역사와 현실을 회피한채 꿈과 낭만, 사랑과 청춘으로 포장질한다고 진실이 달라지랴?  멋모르는 아이들과  외쿡인들이 이런 작품을 보고 시대적 아픔을 인식못하고 날조, 포장된 한 늙..."
1,전범 미화 감성팔이 쓰레기애니 
1,수많은 사람을 죽인 제로센이... 이렇게 만들어젔다....ㅋ 결국 만든 주인공도 해피앤딩은 아니네요... 해피앤딩이였으면 정말 화났을껍니다. 
1,관동대학살이 떠올라서 
1,늙은 할배 노망난듯 .. 토나온다 
1,호리코시 지로와 호리 타쓰오에게 경의를 담아..? 젊은이의 열정?  결국 그들 자신들의 이익이고 그에 의해 희생된 사람들에겐 눈 하나 깜빡 안하면서 저가 사랑하는 사람이 각혈했다는 소식엔 눈물 흘리고. 
1,고맙다. 이 작품이 아니었으면 평생 미야자키 하야오를 아나키스트로 착각하며 살뻔했다. 그도 이제 역사의 전범이 되었다고 생각하며 이전 작품들의 그의 성향은 그저 고생 안한 철부지 도련님의 철딱서니 없는 망상으로 영원...
1,한마디만하고싶네 영화내려라 카악퉤 
1,미야자키하야오실망 
1,여태까지 그려온 평화를 상징하는 작품은 밑밥인가? 대실망 
1,미야자키 하야오 난 왜  그동안 한국에서 이렇게 과대 평가받는지 모르겠다.. 이젠 그냥 노망이지.. 
1,ㅡㅡ미야자키노망한할아범은퇴작이랍시고 일본인들 마니보겟지 ? 애들도많이볼텐데 이딴게사실이라고 알테니 후..수입한새끼가젤나쁘다ㅅㅂ 
1,뭐이딴....ㅡㅡ 
1,일본에 전쟁이 일어났다... 라는 말을 보면 알수 있지 이 작품이 얼마나 어처구니없는 내용을 담고있는지 
1,반대하는 사람은 역사논란땜에 반대하는건가??본 사람으로서 역사논란을 떠나서도 좀 지루하고 재미없다!! 그전의 작품들처럼 순수한 느낌도 없고~미야자키하야오 감독 작품이라 기대한만큼 실망한 영화!!그리고 홍보가 잘못됐어...
1,코난 극장판부터 이거나 저거나 좋게보이질않네요. 그리고 이거 보는 사람이 이해안가는것도 사실이긴한데 들여온 제작사는 미친거?? 
1,최악의 영화 
1,ㅉ 
2,이름값 2점이요... 애국자구만... 우리나라 영화인들 희롱하는 영화같음 
1,곱게 늙어라. 
1,다늙어서 노망난듯... 
1,1점도 후한 애니.. 전범자 미화의 끝을 본 영화 
1,"일본을 석기시대로 만들겠다 - 커티스 르 메이 : 태평양전 항공전대 사령관으로써 한명의 미군 생명을 더 구하려 제국일본 무차별 폭격, 쿠바 핵 위기때도 용감하게 소련과 맞선 그의 열정과 용기를 일대기를 만화화하여 일..."
1,지브리 스튜디오 작품 참 좋아했는데 ㅎㅎ 
1,이게 마지막 작품이라니.. 
10,미화가 어딧는 거냐???? 
10,영화나 보고 까는지 의문 한평생 반전이란 주제로작품 만들던 사람이다 
10,미야자키의 마지막 작품. 엇갈린 평도 알고 있지만 그걸 떠나서 본 이 작품은 한 사람의 꿈과 사랑. 바람과 같이 흘러가는 인생을 그린 감동적인 작품이었다. 바람이 분다..살아야겠다. 
10,역시  미야자키 하야오의 세계는 굉장하다! 
1,"한국인이라면 이걸 ""작품이니까"" 라는 말로 포장하여선 안됀다고 본다. "
1,바람이 분다 평점 자세히 봐봐. 연령별 평점에서 10대가 4.9점으로 가장 높고 성별에서는 남자가 63%나 차지하면서 점수도 더 높지. 10대 초중고딩들이 평점 올리고 있다는 이야기다. 실제로 보지도 않고 국뽕국뽕 ...
1,예고편만 보고 단순히 비행기를 좋아하는 엔지니어의 사랑이야기인줄 알고 보았다 보는내내 마음이 불편했다 
1,제정신으로만든영화는아닌거같다 
1,1점도 아깝다 역사인식도 못하고 미화 하는 것을 우리나라에 왜 도대체 상영하는건지 모르겟다 . 미야자키 하야오 감독의 팬이지만 아닌건 아닌거다 
1,"괜찮은 작품만들다가  왜 하필 이렇게 만든건지 대실망,,,, "
1,미야쟈키하야오를 통해 일본에니 좋아하게 됐는데 ... 완전 실망 
1,신대한국 독립군의 백만용사야 조국의 부르심을 네가 아느냐 삼천리 삼천만의 우리동포들 건질 이 너와 나로다 나가 나가 싸우러 나가! 나가 나가 싸우러 나가! 독립문의 자유종이 울릴 때까지 싸우러 나가세 
10,그냥  한 영화로써 보면 안되는 겁니까? 
3,"열라 재미 없다. 이웃집토토로, 센과칳로의 행방불명 같은 거 생각하면안된다. 군국주의 시절 엔지니어의 애환을 그린 영화로 성인, 일본인을 위한, 특히50대 이상 일 극우파에게 노스텔지어 자극을 위한 영화랄까~죳망....."
1,"일빠년들 몇몇은 맞춤법이나 배우고 오지? 다 틀렸네 다 틀렸어, 그래놓고 전 인류의 해악. 방사능국가의 얼토당토않은 내용을 찬양하는 모양새는 참 우습기 그지없다. "
1,노장의 제국주의 감성팔이가 역겹다. 
1,재미도 없고 재미 없다 
1,에휴 
10,이 영화는 절대 전쟁을 옹호하는 영화가 아니다. 절대.아름다운 한편의 시 같은 영화다. 
10,"그래도 평점이 너무 낮아,,, "
10,1점 주는 분들은 알바생으로 간주! 직접 보지 않는걸로 간주! 전문가 평점은 7점인데 이런 한심한 악플이나 달고 있을건가? 역사왜곡타령 그만하고 이건 애니메이션일뿐.. 킬링타입용으로 적합함. 
10,난 갠적으로 재밋던데 평이 넘 안 좋네 
10,영화는 보고 평가함?한국 관련 내용이 도대체 어디나옴?그냥 일본이 싫은 거냐?걍 비행기덕후가 만든 애니인데제로센 그거 하나가지고 난리그리고 저 감독 애초에 좌익성향임일본인들 저사람 싫어함 
10,지난 17년간 많은 감명과 영감을 주었던 거장의 마지막 작품으로 손색이 없었다. 고마워요. 그리고 안녕 
10,그에게는 아름다운 꿈이었지만 전쟁이 그의 꿈을 끔찍하게 짓밟았다.. 왜 나에게는 반전 영화 같았지.. 결과는 너덜너덜했지만 그의 꿈이 아름다웠다. 
10,다들 영화는 보시고 평이나 리뷰쓴건지...결국 욕하더라도 한번은 볼거면서. 이번에도 지브리답게 작화는 아름답고은은했다. 내용은 왜 다들 부정적인 측면으로만 보나싶다. 전쟁을 미화했다는생각밖에 없는건가 과연 그게 이 ...
10,영화를 보고 비판을 하는건지영화 이곳 저곳에 일본우익을 까는 대사가 널려있는데 이해력이 딸려도 이렇게 딸리냐 진짜 
10,"영화를 보고 리뷰를 봤는데 지브리를 참 좋아했던 저이지만 이게 마지막 작품인 것도 모르고 봤습니다.영화 초반부터 영상 내의 사람들 패션이나 시대풍경, 시대상으로 제국주의, 태평양전쟁 일으키기 전인걸 눈치챗지만 영화에..."
10,이 영화를 제대로 보시려면 미야자키 하야오 감독의 제작 다큐멘터리를 보시고 오시면 더더욱 이해가 잘 가실 겁니다. 이것이 일본은 파멸한다. 라는 대사가 왜 나오고 다 부숴진 제로센이 왜 나올까요? 이것은 일본 미화가...
8,바람이 분다. 살아야겠다. 
6,꿈에 매진했으나 끝은 비참함. 
10,영상미도 좋고 두시간동안 몰입할 수 있었다 
4," 미야자키 하야오 감독의 성향과 행보를 봤을 때, 그가 이 영화를 제국주의와 전쟁을 비판하기 위해 제작했다는 것은 의심할 여지가 없다. 하지만 역사를 다룰 때에는 보다 더 섬세한 시각과 방식을 필요로 한다. '..."
1,다른 작품 잘 봤었는데 이거는 보고 평가할 가치가 없어 보여요 ㅋㅋ 0점이 없으니 1점 드림 
5,내가 우리나라 방산 기술자고 우리나라가 제국주의에 물들어도 난 내일을 했을 것이다 
10,잘 봤습니다 인상깊네요 
5,역사적 상황을 무시하고 볼 순 없기에 소재 자체에 대한 비판은 피할 수 없다. 하지만 영화 내적으로 보았을 때도 이전 지브리 애니메이션 영화들에 비해 인상적인 요소는 덜하다. 
8,역사왜곡에 대한 논란을 부인할 수 없는 것처럼 미야쟈키 하야오의 연출력  또한 부인할 수 없다. 
7,이영화는 미야자키 하야오 씨가 전투기를 좋아하게돼는 자신이 싫어서 경고하는 작품입니다 단순히 역사를 미화 했다곤 볼수없죠 
5,꿈을 따라 가는 마음은 이해되지만 너무 많은 사람이 죽었다 
1,"평점 더 깎여야 한다 이거랑 반딧불이의 묘, 코쿠리코 언덕에서 모두 피해자 코스프레 중 "
4,1점은 넘 아닌거 같고 솔직히 4점이다.. 가장 결정적인 단점은 재미가 없다는 것이다... 그냥 잠이 오고 재미가 없어서 보기가 싫다. 
6,"아름다운 영상, 스토리.. 하지만 개인의 꿈만을 표현한 추악한 애니. 아무리 아름다운 비행기일지라도 전쟁에 쓰인 도구일 뿐. 사죄나 죄책감이 전혀 없는 전쟁 미화 애니이다. 보고나서 미야자키에 대해 혐오감이 일어난다..."
1,"미야자키 하야오 팬이라서, 애니메이션 몰아서 보고 있는데 이 영화를 보고 정신이 번쩍 듭니다. 주인공이  전쟁보단 자신의 꿈을 위해서비행기를 만들어냈다는 .. 미화 시킬게 따로 있지. 소름돋는 찝찝함을 안겨준 영화...."
6,일본의 응흉을 정당화 하고 미화하려는 영화가 아니다.다큐멘터리에서 보면 알겠지만 하야오는 지로에 대해 이상과 현실의 괴리에 빠진 인물로 해석하고 있다. 비행기를 좋아하는 사람이 전쟁시대에 태어났을 뿐이고 자연스레 전...
1,이건 아니다 이건 정말.. 
1,굿바이 지브리..하야오.. 
1,실제 호리코시 지로가 어떻게 생긴지 안사람이라면 평점을 줄수가 없을 것이다 일본애들은 자기네들이 어떻게 생겼는지 충분히 알고 있으면서도 애니로는 졸라 예쁘고 잘생기게 그리는 성향이 있어 애니를 현실도피의 수단으로볼수...
1,전쟁비판이라는 소재를 전범국이 쓸 자격이 있나 
1,미국에 원폭 맞고 쪽바리를 이따이이따이병 걸려 깝치는 애니보고싶네 
8,이 영화의 영상미와 플롯이 갖는 힘은 인정할 수 밖에 없다. 짧게 스쳐간 사랑의 아련함이 잘 표현되어 있다. 하지만 역시 주인공의 의협심과 모든 행동에 당위를 부여하는 묘사에 거부감이 드는 건 어쩔 수 없는듯... 
9,오래간만에 좋은 분위기의 작품을 보아서 즐거웠습니다. 
9,재미없다 !   흑백논리 따위 거들먹 거리지말자 !그들도 암울한 시대를 살아가야했던 사람들일뿐 . . . 
