score,review
1,"일본은 아직도 피해자 코스프레하고,과거를반성하지않는모습이 영화에 그대로 나오네요. 전세계에 방사능 유출을  하여 미안함보다는 방사능유출없다고 거짓말만 일삼는 일본...영화속주인공 할배는 미국의 원폭때문에 죽었다고 ,..."
1,솔직이..디워가 20배는잼잇다..아오진짜 이건어른이보기엔 웃겨서못본다..완존유딩용... 
1,"이런 삼류영화에 평점이 높다니 믿을수가 없군요... 도저히 끝까지 볼수 없었고 시간낭비했네요 비추합니다..,,,, 휴 "
1,지루하고 재미없었어요....돈아까웠음!! 
1,히로시마 니네가 잘못한건데 뻔뻔하다 
1,OOO란 말이 절로 나옴...  돈환불받고 싶음... 눈 버림... 
1,영화보다 잠들었네요....잼이도 없고 화질이 너무 실망입니다... 
1,전범기...실망입니다. 
1,"이거 평점이 왜이리 높죠? 저한테 진짜 저 제작비 그대루 주면 실컷 놀고 할거 다하고, 저거보다 1.5배는 재밌게 만들 수 있을듯... "
1,생에 두번째 영화관에서 잠잔 영화 
1,돈과 시간을 낭비하고 싶거나 공룡의 영웅놀이를 보고 싶으신분께 추천 
1,맥주사들고가면 숙면취하고 올수있는 영화 
1,돈 날렸다. 질문못받는다. 
1,?? 10점주는건 딴영화보시고옴?? 
1,"보는 내내 하품만...  그냥 도시 파괴 영화. 스토리는 완전 어거지,,, "
1,"초반30분이 그나마 재밌어서 1점준거다, 나머지 무토 깨어난후부터는 진짜 내 시간과 돈이 아깝더라 ,,, 진짜 본사람은 이글에 공감을 누를수밖에 없어 "
1,음  많은걸생각하게  하는영화 
1,영화 보고 왔습니다. 가메라 vs 고질라 뭐 이런식의 특촬물 좋아하는 사람 아니면 절대 보지 마세요. 후배들이랑 보러 갔다가 쪽팔려서 머리카락 쥐어뜯다가 나왔습니다. 중간에 나왔으면 돈은 버렸어도 시간은 좀 덜 버렸...
1,"몹시 지루하다 ,고질라는 왜 인간은 공격하지않으며  왜 무토만을 공격하는지에 대한 명확한 답이 나오지않는다 . 간혹 최고의 포식자, 자연의섭리 이야기하는데 무토를 먹이로생각하고 공격하는줄알았지만 쓰러트리고 먹진않고 ..."
7, 일본판 고질라를 봐왔던 사람들이라면 환호 할 만하다!(야호!)그렇지 않은 사람들이라면 글쎄? 전개가 아쉬웠고 고질라와무토에 대한 설정을 자세하게 설명 해줬으면 모두가 즐길 수 있었을텐데라는 아쉬움이 든다 
5,"옛날 디워를 보면서 느낀 기분을 그대로 느꼈음.. 스토리는 말할것도 없고 내가이걸 왜 아이맥스3D로 봤는지.,... 나오면서 기분엄청 드러움...  중간중간에 놀래키는 장면있는데 그때 팝콘 던질뻔했음....  트랜스..."
4,솔직한 심정으로 어린애들을 위한 흔한 스토리를 확장한 것이라고 밖에는 못느꼈음 
8,후회없음 꼭보삼요~~~!!잼슴 
7,어렸을 적에 본 용가리와 다를게 없었다.. 그래도 최악의 영화는 아님 다만극장에서 볼 영화는 아닌 것 같음. 
2,스토리도없고  감동도없고 메세지도없고내용도 뒤죽박죽씨지 만드는데에 들어간돈이아깝네씨지만 보실분들만 보시길 
3,조금스케일이 커진것외에는 긴장감도 떨어지고 억지설정에 마지막에 고질라 싸울때 입에서 광선나오는것보고 멘붕  전에 고질라1편이 훨나음 이건 일본고질라시리즈물에  cg만조금더 입힌것 
9,고잘라를 처음 봤는데 돈이 아깝지 안았다.영화관에서 소리를 너무키워 귀가 아팠으나 사운드가 긴장감을 고조시켰고 사운드의 분위기가 영화를 좌우하는거것 같다. 약간 2012와 같은 인류멸망도 함께 있던것 같다. 포이드가...
1,평점이넘높다  갠적으로지루하고  화끈한액션과 볼거리가거의없으며 블록버스터라하기엔 넘부족한거같다 난~ 
3,98년 고질라 보다 액션신이없음  .너무지루했음 기대하고보면 큰오산.  결론. 재미없었다 
1,"괴수에 의한 재난영화라는 시점으로 보자는 분들....재난영화에서 재난 장면이 안나오는데 왜 후한 평점을 주는지 이해가 안가네요....같이 죽자 이건가?...영화 보시면 알지만, 마지막 20분까지 액션은 안나오고, 소..."
1,아....내돈아까워 
9,cg랑퀄리티가완전대박!!하지만스토리가좀뻔함 
10,인간중독보다는 3배정도 재밌게 봤음 
5,뭐랄까..스토리가 고질라 처럼 혼자 춤추다가 끝나는데 이게 매우 지루함. 
10,우엉 충전식 방사능 내뱉는 고질라 잼 인간 이 벌레만도 못해지는것처럼 되는게넘 좋구만요킬링타임애 좋은 영화 전 너무 이런게 좋아서 십점 굉장히 주관젹인졈수 
6,3d로 봤는데 내용은 없고 그냥 멍하니보기만했네요 마지막쯤 무토인가 그 괴물이 고질라 내려찍는게아니라 백허그한게 꽤나 웃겼음 
10,진짜 보는내내 숨죽이면서 봤다.. 블록버스터 급이라 확연이 차이가 난다 
2,조잡한 장난감보다 CG로 영화를 만들지 너무 허접해서 말이 안나오네 에휴 
1,빵점주고싶다 1점도 아까운데 왜 0점 없는거야 
1,진짜 고질라라는 좋은소재가지고 어떻게 이딴 영화를만들어놧나 궁금하다....진심 한숨쉬면서 보는영화 
1,내 평생 첨으로 평점쓰게한 영화..포드의 대모험(특별출연 고질라) 
1,최고의 반전영화 고질라가 최고예요 무토 시1발재난영화인줄 알고 봤는데 히어로영화 
1,개노잼  10자10자10자 
1,고질라를 볼때 왠지 합법적으로 삥뜯기는것 같은 느낌이들었다. 그리고 너무CG에 신경써서 스토리 개판에다가고질라를 통통한 크롱처럼 만들어서 보는내내 무섭지않고오히려귀여웠다. 결말은 더 가관. CG만들다 지쳤나보다. 
5,전체적으로 액션이 나쁘진 않은데 예고편에서 보고 기대했던 것보단 부족해요 
6,초반부에 지루해서 졸려 죽는줄 알았음; 전투씬은 그럭저럭 봐줄만 함. 돈주고 보기엔 아까운 영화. 같이 본 친구는 재밌다고 했으니 호불호가 갈리는듯 
9,소리가 아주 무섭네요재밌게 봤는데그냥 평점 믿고 보지마시고각자 스타일이 틀리니.. 개인적으로 너무 재밌게 봤구요또한번 보고싶네요내용  알고 보는것보다 모르고보는게 낫네요 
1,용가리는 명작이였구나... 
1,1점도 아까운 영화 1점이상 주는 사람은 알바 또는 나혼자 죽을 주 없다고 줬을듯... 
1,내 기준으로 졸작이었음.스토리가 엉성하고 긴박감이 전혀 느껴지지 않음.화려한 볼거리 또한 많이 부족하다.웅장함은 있지만 아무런 감흥이 없다. 
1,"완전 실망 돈 아까움,,,, 본국이 일본이라 그런가 꼭 나라처럼 별로임.... "
1,이런 개 쓰레기를 봤네.... 썅.... 
2,보고나서 진짜 어휴....너무 중구난방이다 차라리 고질라만 등장했으면 집중이 더 잘되었을듯 암수괴물때문에 집중도가 분산된다 
5,웬만하면 추천하고싶은데 솔직히  저는 괴물의 파워를 느끼고 싶어서 갔는데 중간중간 지루한 대화장면들이 너무 많아서 대체적으로 지루했던 기억밖에없네요;; 물론 마지막부분은 그나마 볼만했는데 결말은 고질라가 도시를 구하...
1,와~ 내가 만들어도 이것보다 나음...고질라 용트림해서 도시구하고 끝나요.. 
7,예전 원작 고질라 생각하며 봤는데뭔가 밋밋한 느낌...마지막 고질라가 도시를 구했다....ㅋㅋㅋ 
1,정말 돈주고 보기 아까운 영화에요 심형래가 만든 디워가 더 잘만든듯 정말 보지마세요 ! 
2,디워2. 고질라를 어벤져스로!!!! 
1,일본 스타일의 주제를 헐리우드영화랑 합칠때의 병패가 너무 잘드러나는 영화임 착한괴물은 인간의 친구 + 고질라는 짱짱 인간은 아무것도 못하고 고질라가 다해결 + 헐리우드의 인간영웅 이런 스토리 플롯이 다 섞여서 죽도밥...
1,"조조보고 왔는데 진짜 재미없더라,걍 엑스맨이나 나옴 볼걸,조조인데도 돈아깝다는 생각이 들정도 "
1,고질라가 엑스트라인 고질라 영화 
1,시간이 남아도시는분 아니면 보지 마세요  존나 자다가 일어나도 스토리에 지장 없었을듯. 묵시록이고 스토리고 새로운 시도고 뭐고 영화의 흐름도 개연성 다 말아먹었고 미칠듯이 지루했음. 결국은 미국군대가 나와서 삽질하고...
1,10점이 웰케 많음?? 나만 이해 안되는거임 아.. 이렇게 재미없는 영화 오랜만인듯 마지막부분에서는 개그하는것도 아니고 진짜 돈 버리는 영화임 차라리 역린을 두번 보겠음 
1,진심 개노잼..완전 유치하고 어이없어...돈아깝고 오글거린다. 다시는 보고싶지않은 영화 
1,와ㅋ진짜 뭔영화임; 돈괜히썻네 ㅡㅡ 
9,재미있는 괴수영화. 조금은 유치하게 느껴질 수도 있는 부분이 있었지만 그렇게 깎아내리며 투덜대는 분은 차라리 다큐멘터리를 보시기를 권함.적당한 액션과 적당한 상상속의 괴수등장으로 그간 보기 힘들었던 재미를 충족시켜줬...
1,노잼(10자이상채우래서더씀) 
1,이거 동물의 왕국임 그냥 도마뱀 싸움에건물 아작나는 영화 
1,0점은 못주나요?언제 재밌을까 참고참고 봤는데 점점 유치해서 못봐주...마지막에 전광판에 도시를 구하다!... 그거보고 마지막 정까지 떨어짐 당해보라고 10점 주고 싶지만 진짜 양심이 제발 다른거 보세요..얼마전에 ...
9,지구를 건드리면 고질라가 뚜까 팬다는걸 이 영화 보고 깨달았다. 
10,인간이한거라곤 미니언끼리 억제기 부순 느낌정도? 괴수들이 워낙 스케일이 커서 난 재밌었음 킬링타임용으로ㅎㅎ  티비에 나오는거 봤는데 돈주고 봐도 괜찮았을듯~ 
10,cg배우는 과정인데 참잘만들었디는생각근데 예고편에는 바퀴벌레 두마리 안나오누 
8,생각보다 재밌다.콩 보다는 더 낫다. 
4,넥플릭스에 올라와서 봤는데 괴수 전투씬 비중이 너무 적네요. 퍼시픽림 1편 처럼 초반부터 기선재압 하면서 이야기 풀었으면 덜 지루할텐데 졸면서 보느라 초중반은 자동 스킵되버릴 정도 지루합니다. 이후 주인공 부부는 에...
8,대낮에.남들 다 보는데서 음란행위하려는 무토 커플.그것을 응징하는 순결 솔로 고질라! 
6,남주 뭔가 맘에 안드네 
10,왠지 모르겠지만 방사능 화염 처음 쏘는 장면 에서 눈물이 나왔다 
7,커플로부터 샌프란시스코를 구하는 솔로의 이야기 
7,가끔은 생각없이 영화를 봐야할 때가 있다. 그래서 재밌게 봤다. 
6,Godzilla 
7,킹오브몬스터 보고 전작보러왔는데 역시 고질라는 아군이였네요! 2편보고 오니 스케일이 작긴 했네요! 그래도 스토리는 그나마 괜찮아서 볼만하네요! 
10,고질라 화이팅입니다  ㅎㅎ 
8,무토에 맞서서 샌프란시스코를 수호한 고질라. 재밌었어요! 
8,지금봐도 잼꾼ㅋㅋㅋㅋ 
4,큰돈써서 쓰레기를 만드네 
8,"[가장 현실적인 평점] 1~3점:쓰레기 / 4~5점:살면서 모르고 살아도 무방 / 6점:뭔가 나사빠진듯 2% 부족 / 7점:그런데로 평타 / 8점:이정도면 남에게 추천가능한 수작 / 9점:소름, 전율이 느껴지는걸작 ..."
10,번역가만 아니었다면 명작으로 알려질텐데.. 
6,딱 킬링타임용 괴수영화 
7,이 영화 아쉬운게 초중반이 괴수도 별로 안나오고 넘 지루... 잠들정도였음 ㅋㅋ 하지만 중후반 부터 괴수들 많이나오면서 재밌었음 비쥬얼도 좋고 
7,이번신작보다 2014년작이 완성도가 낫습니다. 2014년 극장서 볼때는  별루라고 혹평햇으나  다시 감상하니 이작품이 훨낫네요. 그렇다고 이작품이 재밋다는건 아닙니다. 원조 고질라시리즈도 그렇고 고질라는 무언가  마...
8,질라야 ㅋㅋㅋ고마워 고질라는 우리의친구 
8,액션보다는 괴수의 위압감이 정말 잘 느껴지는 영화였습니다! 인물들이 생각보다 사건들에 끼치는 영향이 크지 않는다는 점이 신선하다면 신선해요. 
10,재밌어요 이걸 영화관에서 봣다면 ㅠㅠ하ㅠㅠ 너무 아쉽고 감독님 배우님들 사랑합니다 
10,갓갓갓질라 고오질라 ~! 
10,우리 고질라가 달라졌어요. 
8,고질라에게 애정을 느끼다. 
8,"8.마블의MCU에이어서 킹콩과고질라의 몬스터버스도 기대만빵 모르고2탄인콩먼저보고역순으로감상함 재미지다퍼시픽림도 세계관에넣었으면하는,미이라로곧시작하는 유니버셜몬스터유니버스와 프메-커버넌트 세계도 기대중 DC의 확장유니..."
10,마지막에 환호속에 일어서는 고질라 볼만했음 
8,자본이 낳은 괴물. 이제는 괴물도 캐릭터성으로 승부한다! 괴수물은 이래야지 
8,볼만하다. 곰같은 고질라~ 
6,여느 재난영화 처럼 뜸들이다 뜸들이다 씨지 투척 파봐방! 괴수가 주인공이라 인정된 연기자는 일찌감치... 
7,칸 예고편 부문 상주는거 있으면 007스키이폴이랑 고질라랑 경쟁 붙을듯 
6,고질라 박수 받았어 ㅎㅎㅎ 
3,일본에 신고질라보단 훨났다 하지만 조금 지루햇다 
6,고질라. 거대괴수. 그 거대함을 표현하는 연출. 우수하다! 
7,초반에 매우 지루해서 잠이온다... 그래도 후반에는 볼거리가 많아서 눈이 즐겁내 딱 킬링타임용 영화 
8,솔로천국 커플지옥을 몸소 실천하신 고질라 선생. 
10,고질라는 칭구칭구 그래도 쫄깃하니 볼맛은 난다 
10,아름다운 고질라와 인간의 우정이야기가슴이 따뜻해지네요ㅎㅎ 
10,볼만하던데요? 인류가 제3자의 관망자 가까이라서 더 맘에 듭니다. 
10,나만볼수없다 같이죽자~~~~ 
8,솔직히 6점대의 평점은 아닌 영화. 인간의 폭력성.이기심과 자연의 조화란 제일 중요한 스토리가 잇다. 고질라 일본 괴수라 안좋아했는데 이 영화를 계기로 팬이 되었다. 안봤으면 보고 대충 봤으면 다시 내용을 잘보길^^...
10,고질라가 이렇게 귀여운지 첨알았다... 고질라때문에 10점이다 
10,조폭 형사 살인범들 쳐나오는 한국영화 따위 보다 평점이 낮다는게 말이되는가? 그대들에게 자신있게 추천한다!! 
6,괴물 등장하면 겁나 어두워짐 뭐 보이는게 없어서 겁나 땁땁함..볼만은 했는데..빡쳐 
9,예고편은 정말 명작이다... 영화도 재밌구요 물론 
6,그럭저럭 볼만해요.. 
7,그냥 무난히 볼만하다... 고질라는 누구 편? 자연이냐? 사람이냐? 
10,오랜만에 진짜 괴수영화를 본 기분이다. 
10,고질라를 세계평화 유지군으로 
10,핵꿀잼이다(10자이상) 
5,좋음좋음좋음좋으쫗음 
10,보고싶다보고싶넼ㅋㅋ 
10,저기님들고질라에서하늘의괴수라돈이나오던대 
7,옛날에 봣던게 기억이나서 보앗는데 재밋었습니다 
8,고공낙하씬은 예술이었다. 아쉬운 부분들이 많긴하지만.. 그래도 나름 재미있게 본 영화 
10,괴수 영화 중엔 단연 최고. 스토리도 기존처럼 진부하지 않고 
5,도데체 무토랑고질라랑 싸우는걸보고싶은데 너무 어두 컴컴해서 보이지도 않고 그냥 미사일 몇대 맞고죽은 98년작 고질라를 보거나 흑백영화인 원작 고질라를 보거나 해야겠네 
7,"가장 기대감을 갖게 만들었던 비주얼 특히, CG 부분에서 기대 이하였던 게 사실. 자꾸 디워와 비교하게 되었던 영화. "
10,갓질라. 고질라 조금 밖에 안나온다고 징징거리는 거 이해안됨 
8,고전느낌이 물씬 풍기지만 즐겁게 보았습니다. 
10,젛아용 ㅎㅎㅎ다들보래용 
9,it was so funny 
8,영화관에서 봤는데 고질라소리지를때마다 소름이 쫙..근데 살짝아쉬운부분이 몇군데있었다 
4,그냥그냥볼만함.... 
8,God 질라 돈 내고 꼭 보세요 
9,스케일과 비주얼이 대박 시크한 고질라도 대박 
9,고질라에 대한 선입견이 바뀌게된 영화네요. 3D로 봐서그런지 더실감나고 디지털보단 재미있게 봤습니다. 한번 꼭 볼 영화입니다~ 
9,기대한것 만큼은 아니지만 나름 재미있게 본것같습니다 
9,1998년의 악몽을 잊게 해줬다 
7,갓질라는 잊고 고지라다운 고질라 
6,"재미가 끝네죠요, 아이들과봐도 좋을것같아요. "
9,스릴러.... 여자 무섭... 
10,갓-질라. 재밌게봄  잼잼 
10,꺄으어우아으아아으어앙 
7,옛다! 7점 그래도 눈은 적당히 즐거웠다 
7,괴수영화의 정석에 충실하려했다. 재난상황의 좀더 디테일 한 묘사가 아쉽다. 
10,괴수영화가 괴수의 입장에서 해피엔딩으로 끝나는 유일한 영화인듯 
8,배우들의 연기력은 그저그렇다치더라도 생각보다 잘 만들어진 영화... CG도 완벽하고 왠지 그 다음편도 나올듯한 기대도 드는 영화... 
8,걍 볼만함~ 킬링타임용 ㅋㅋ 
7,고질라 팬인 저로써는 잼있게봤습니다 ㅎㅎ 
9,고질라가 악당인줄 알았는데 그게 아니였네요 착하네 고질라 
10,멋진고질라 평점이해안가네 
8,"고공낙하 할 때 남주 시점으로 나오는 장면은 좀 짜릿했다. 괴수들의 모습이 속 시원하게 나오질 않아 나름 답답했는데, 그것도 그것 나름대로의 묘미가 있는 듯하다. 적당히 재밌게 잘 봤다. "
10,와 역시 미국군사력을 자랑하는 괴수영화가 아닌 진짜 괴수영화를 본 기분이다. 영상미가 멋져서 넋놓고 본 영화! 
10,고질라가 참..은근 잘생겨보임.ㅋㅋ 재밋게봣음.마지막 장면쯤에 고질라 푸른 불꽃쓰는거 보고 빵!터짐!ㅋㅁㅋ 
9,스릴이 넘치고 긴장되면서 엄창재밌어요 시간대시면 꼭보세요! 
8,고지라의 환갑을 기념한 수작!! 
10,이런 영화좀 많이 나와라~~허구언날 깡패나와서 배때지쑤시지말고 ㅋㅋ 
10,우리의 친구 고질라 짱짱맨 
4,한가하게 킬링타임용으로는 좋을것 같네요.. 
10, 진짜 잘만듬 저런 존재가 잇다고 믿는다 민간인은모르는 어느곳에 국가가 숨기고잇는 존재가 잇다고 생각함 
6,귀여운 고질라 ㅋㅋㅋㅋ 
9,고질라 영화는 무수히많다. 그중 이번고질라는 원작에가까운 고질라의 모습이좋았고충실함으로 괴수영화란 이런거야~라고 보여준케이스무작정 헐리우드식 액션과 감수성이아닌 원작의 감수성이 좋았다 
10,존나재밋는데 왜 과소평가되는지모르겟음 진짜 개재밋음 
9,잘 짜여진 영화 극장에서만 느낄 수 있는 느낌 돈이 안아깝다는 느낌 
7,고질라가 아군이었내~;;미녀까지 나왔으면 킹콩 공룡판이었는데;;나름 스케일 크고 시종일관 어두운 시가전이 클로버필드의 괴수 분위기나서 긴장감 넘치게 보았어요~ 
5,싸우는장면만 볼만햇다.. 
7,우리아이가 넘 잼있게봐서 7점^^ 
7,"용가리에 비하면  잼있네요, "
7,내용만으로 본다면 0점짜리 영화다 그러나 CG 기술에 눈이 즐거운 영화다 약간의 긴장감이 조성되는 스릴도 있었기 때문에 7점 정도는 된다고 본다 
7,고질라에 초점이 맞추었다고 해도 남주가 너무 밋밋하고 스토리도 단순하지만 CG기술력만큼은 대단. 
7,G플렉스..yf소나타 
8,이것 괴수대괴수라는것을 알고 보니깐 재미있는데 만약 예고편처럼 보여주고 극장가서 봤으면 욕나올뻔 그때 다른영화 보기를 잘했다 생각함. 
5,고질라~ 너 이자슥.  좋은 놈이었구나~너!!! 
3,고질라를 보여줘~~~ 차라리 고질라의 상대가 킹키도라였으면 더 나았을것 같다. 
8,기대이상.. 생각보다 볼만했음. 
8,볼만하다 겁을내던 괴물이 지구를 수고하네 
7,눈은 좀 즐거웠지만... 
10,bbb재밌어요bbb 
10,평점 너무 낮다 10점 주고간다. 
8,스토리나 그래픽이나 구성요소 나름 오락영화로 충분하다 근데 왜? 평점이 이렇게 낮은거지? 
10,비쥬얼 이펙트만으로도 만점! 
10,고질라 한 마리 키우고 싶다. 
7,내평점괴수영화치고 상당히 잘만들었다 그래픽 면에서도 딱히 흠잡을데가 없다 고질라는 우리칭구 / 아 그리고 월터화이트 오랜만에봐서 좋았음 
9,거미 때려잡는 힘쎄고 용맹한 고질라 
10,잼난다. 몰입도 최고. 괴수영화중엔 여태나온것중엔 최고다. 이정도면 최고지. 뭘더 바라냐 
7,"무토 : 방사능 맛있쪙, 고질라 : 내가 진정한 불 뿜는 용가리 ! 갓 블레스 ~ "
10,단순 오락영화가 아닌 깊은 철학을 가지고 있는 작품. 마지막 인간들에게 남긴 고질라의 포효.. 인간이 자연을 지배한다 생각하면 착각이다 
8,재미있어요고질라도 귀엽고요 
8,"말이 많아서 잼없는줄 알았는데 잼있구만, 원작이 뭔 내용인지도 모르고 재미없다고 하면 다임? 원래 괴수랑 고질라가 싸우는게 원작임, 나름 의미도 있고, 원작 현실성있게 잘 살렸는데 왜 난리인지, 원작 있는 영화는 원..."
7,유치하지는않어 고질라의  의리의리!! 
10,재미있을거같다~이번엔 고질라가 옛날꺼거보단 다르지 않을까?그렇게 생각합니다 
8,중간까진 볼만한데 아쉬움... 역시 괴수영화에는 치고박고 싸워야제맛 
7,예고편만한 포스는 기대하기 힘들지만 복어같은 고질라 리턴즈에 만족 
7,고질라가 너무 귀여운데 볼만함 
7,약간 지루한 부분도 있지만 볼만하다 고질라가 멋있게 나온다 재미있다. 
8,마지막 고질라. 강했다 차세대 괴수를 기대해본다 
9,일본 원판의 고질라를 미국 영화의 현대식으로 잘 접목시켜 멋지게 뽑아냈다..근데 너무 어둡고 고질라의 화끈한 전투 장면의 밤씬이 몰입을 방해하는 장면으로 나온다..그것 빼고는 다 괜찮은것 같다 
5,이젠 고질라도 지구를 지키는구나... ㅋㅋㅋ 
8,대체로 볼만했어요. 평점보고 별론가 했는데 개인적으론 킬링타임 이상이네요. 
5,그냥한번 볼만한 영화 갓질라보다는 확실히 더 낫다 아쉬운점은 괴수씬이 잠깐나오고 파괴된 모습보여주고 이런식이많은것. 또 인간이 아무것도 할수없다는것에대해 얘기하는데 글쎄 고질라가 지켜준다는 면이 더 강해서 별로 그런...
8,어마어마한 자본러쉬로 내가 상상했던 꿈을 실현시켰다! 
9,아니 이게왜 명량보다 평론가평점더 높은지 설명좀... 
8,http://blog.naver.com/mn041477/220009308912고질라가 진짜 나타날수 있을까요? 
8,초등학생인 아들이 추천한영화!별기대안하고 조카들과 함께 관람~~생각보다 잼나게봤네요^.^ 
10,이게 괴수영화다!! 액션이 둔해서 지루하다느니 하는 놈들은 보지도 마라. 이 영화는 거대한 스케일과 현실감을 잘 살린 수작이다. 고질라는 늠름하게 잘 생겼드만.ㅋㅋ 
7,"약간은 늘어지는 전개, 그러나 새로운 컨셉과 영상이 좋았음 ^^ "
7,그냥 그래 킬링타임용이면 봐도됨 큰기대는 마시고 
10,디워와 7광구를보고 봤습니다정말 대단한작품인것같네요 
10,보지않고 말하지 마라... 생각보다 꿀잼.. 고질라 귀요미 
8,멋진 괴수영화였다. 스토리는 솔직히 별로였으나 고질라의 파워는 확실히 느껴졌다. 
7,ㄱ큰기대는 안했는데 꽤 볼만하네요 킬링타임용 으론 수준급 
10,고질라는 우리들의 영웅이었다. 충분히 볼만했음 
9,아들이 넘 재밌다네요보여주길 잘 했어요 
10,괴수영화의 눈부신 클리셰 '고질라' 놀라운 표현력으로 진일보한 스케일. 미야자키 하야오 작품을 실사로 옮겨놓은듯한 메세지가 놀랍다. 
10,고질라의 오리지널리티에 한발 다가선 영화 
7,기대이상. 고질라 멋쟁이 !! 
7,그렇게.재미없진 않았네요. 디워보다 재미없단 사람은 뭐징 ... 디워보다 20분 잤지만 고질라는.그래도 눈 뜨고 다 볼정도....근데 고질라가 정작 5분도 안나오는 영화인건 사실....그래도 나름 볼만했음. 3D론 ...
7,연기를 하는 건 배우가 아닌 괴물들... 
8,꽤 재미있었어요. 8점 정도. 초등5학년 정도부터 중.고등학생과 대학생들이 좋아할 영화. 스펙터클해서 눈이 즐거운 영화. 
10,모바일 네이버 진짜 무슨 페이지 이동 처할때마다 등록하라고 뜨네 썅것들진짜 고질라 재밋다 됫냐 
7,이전까지의 고질라중 잴나은듯... 하지만 역쉬 기대만은 못함. 킬링타임용으로 
10,CG 완벽 스토리 좋음 인간이자연앞에선 무능력한존재라는걸 알려줌 영화가우리들에게 전해줄려고하는이유인듯 
7,뒷 부분이 뭔가 부족한.. 뭐 내용은 그럴싸한데.. 제 2의 디워도 아니고.. 그래픽은 9점이나.. 스토리 전개는 6점.. 
