score,review
10,꼬맹이들과 연말에 볼만한 가족영화~ ㅎ 
10,내용은  비슷하지만 흥미진진하고 빠른 전개로 애들보다 어른이 더 재밌게 봤어요. 음악도 신나구요 
8,어린 애들이 참 좋아하더군요 ~ 나름 재밋게 봣습니다. 
10,조카 보여주려고 같이 봤는데 기대이상으로 재밌다. <토이 스토리> 존 라세터 제작이었군. 어쩐지... 
10,더스티처럼 친구를 도와주고 노력하는 자세를 배워야겠다 
10,완전 재밌게 봤어요 ㅎㅎ 시사회 진짜 좋았고 아들내미가 너무 좋아해서 저도 기분좋아지더라고요 디즈니애니는 항상 좋아서 이번에도 대만족입니다 
10,전알바입니다.그냥10점헤헤 
9,항공마니아로서 대만족. 항공/군사에 대해 알면 알수록 더 많은 게 보이는 깨알같은 작품. 
10,"역시 디즈니라는 말 밖엔.... 오늘 저는 2번 봤습니다. 2D 디지털로 한 번 3D 안경끼고 3D로 한 번... 기대 이상입니다. 스토리는 단순하지만, 집중하면서 재미있게 볼 수 있었네요... 간만에 좋은 애니메이..."
10,귀여워ㅠㅠ 카도 재밌게 봣는뎅 이번에는 비행기?ㅎㅎ 
10,조카  이거 보고 비행기 사달라고 난리 ㅋ 
8,미국 성우가 탑건의 조연이었던 발킬머 인것부터 대놓고 항공 덕후를 노린 영화. 스키퍼의 원기체인 커세어와 미해군 항공대 졸리라저스에대한 깨알같은 오마쥬와 각종 항덕을 위한잔치가... 
10,단순애들영화라 기대안하구봣는데..정말재밋메요..내용  그래픽  음악  전개  등등  모든게  좋앗습니다.저처럼  애들데리고는 물론이고  일반인들이봐도  재미잇을겁니다.추천드립니다 
7,하하하하''''재미잇죠뫃ㅎㅎ 
10,동생이랑 같이 봤는데ㅋ카랑 캐릭터가 겹치더라구요ㅎ전 잘 몰르겟는데 동생이 영화를 그렇게 좋아하는 놈도 아닌데 되게 흥분하면서 보길래 저도 은근 즐기면서 봤습니다ㅎ 강추까진 아니어도 추천합니다ㅋㅋ 10살 이하의 어린이...
4,"어른이 된 내가 카1.2 는 정말 재미지게 봐서 소장하고 있는데,,, planes 는 그명성을 이어가기에 유아적이다,,, "
9,진짜 재밌어서 반복해서 보게됨ㅋㅋㅋㅋ 
10,정말 최고에요~~보았는데 너무 재미있어요.겨우 시골농약살포기가 세계최고의 레이싱챔피언 비행기가 되다니!!!모든지 도전을 해야겠습니다.보고 봐도 다시보고 싶은 영화에요!!정말정말 최고에요!보고 울뻔했어요.(감동적) 
7,영화카의비행기버전이자 연령을 더 낮춘버전 
9,이렇게 귀여운 얼굴로 이렇게 감동주기냐. 
10,나  이  영화  봤는데ㅠㅠ  아기들  너무많아  재대로  못보았어  시끄러워 잘  볼수가  없었어하지만  좀  재미있네요 
6,"짧은 상영시간처럼 빠른 전개, 캐릭터들이 사랑스럽긴 하나 애니메이션의 그 감동이 없다 "
9,아들이 넘 멋진 비행을 했다고 하네요.. 
8,카의 비행기판인데 재밌게 애하고 보기 좋습니다 
8,그럭저럭.. 그럭저럭... 
10,"아이들눈높이에서재미있게잘봤어요,집중도잘하고! "
10,너무 귀엽고 캐릭터들이 되게 멋있음 ㅋㅋㅋ 
3,어.. 왜 더빙이냐고 다...ㅠㅜ 
9,6세 딸이랑 아주재미있게봤어요^^꿈은이루어진다~~~♡ 
10,크리스마스에 딱 맞는 영화에요 ㅋㅋ 조카들이 즐거워하네요 캐릭터가 너무 귀여워요!♥ 
7,비행기!!!! 제목도 뭔가 아쉬움이 남았는데 내용도 무지 아쉬움이... 할이야기가 많았던 탓...소재도 생소했던 것이 문제....글쎄 레이싱 대회가 그리 중요한 문제인가? 중간중간 에피소드도 꾸역꾸역... 5살 아들...
4,너무 비슷한 이야기가 많아서.. 농약비행기라는 이름을 빼고는 울궈먹기스토리 
5,"완전한 어린이용 영화, "
10,나도 챔피언이 되거야!! 
5,거의 영화 '카'랑 비슷하다. 
8,시원하고 힘있는 음악과 비행 
5,트라우마를 가진 주인공의 평범한 성장극 
10,영화에 나오는 뱅기 타고 리우 가서 올림픽 즉관 보고 싶다 ㅋ 
10,다시봐도  정말 재미  있네요  비행기 3 도  빨리 개봉 했으면  좋겠네요 음악이   너무너무  좋아요!!! 
10,대단하군요! 아이들에게는 희망을 주고 어른들에게는 힐링이 되네요! 
7,픽사답지 않은 영화다. 소소하게 재밌으나 픽사만의 독특함은 현저히 떨어지는듯하다. 
9,카2는 스릴넘치는 막장 첩보 영화 느낌이었는데 비행기는 편하게 즐길 수 있었습니다 노래도 씬나고요 ㅎㅎ 한 가지 아쉬운 게 있다면 90분에 전 세계를 도는 걸 넣으려다 보니 스토리가 재촉하는 느낌을 받은 겁니다 좋았...
4,애들 용? 어른 용?? 카 재탕???;;; 
10, 친구들과 함께 도와가는 내용이 넘 좋았다그리고 농약살포기라고 못할꺼라고 하는 주변의 말보다 자기 능력을 믿고 친구들가 해내는 모습이 넘 멋있었다 
8,다들 오해하시는데 디즈니 작품이지만 디즈니애니메이션 스튜디오나 픽사 애니메이션 스튜디오 제작이 아닙니다. 조금 2부격인 디즈니 카툰스튜디오작품. 원래 속편 비디오시리즈같은거 만드는 곳에서 제작한거에요. 공략층이 애초...
10,꽤 괜찮은 작품이었습니다 ㅋㅋ 
9,내용 전개도 빠르고 생각보다 너무 괜찮았네요.^^카에 비하면 모자라지만 그래도 이 정도면 잘 만든 애니라고 생각합니다.^^ 2편 소방구조대도 기대해보겠습니다.^^ 더스티의 인생역전 애니메이션 잘 봤습니다.ㅎ 
8,아이와의 첫영화. 기대만큼은 아니었지만 재미있게 관람했네요. 
10,6살 아들이 직접 평점 주네요^^  아~~~주 많이 재밌었데요ㅋ 
10,애들도 잘보고 잼있네요 
9,카보다 더 재밌고 스릴있음^^ 
8,어른눈엔 별내용없이 지루하고 단순했지만 영화보기 무서워하는 아들 수준에 딱 맞았어요.~ 
10,왜 제목을 카처럼 플레인이라고 안하고 비행기라고 했을까 
10,아이가 참 좋아했어요 가족과 함케 보기좋은 영화^^ 
7,카를 너무도 재밌게 봐서큰기대하고 봤는데..조금은 실망했어요. 
7,딱 볼만한 수준~~  만족~ 
10,조아욤 재미이써요 아이가조아해여 
7,그림이 참 예쁘네요~~~^^ 
9,다양한 비행기들 보는재미가 쏠쏠... 
10,아이들도 좋아했지만 제가  더 재미나게 본영화 
9,재미와 감동이 함께 있어요~ 
5,아이가 마니 좋아합니다 
10,너무 신나고 재밌어요.  아이들과 재밌게봤습니다 
7,3d를 봤으면 더좋았을 아쉬움   너무 카와 같은 느낌의 아쉬움    그치만 애들이 보기엔 참좋은 밝은영화 
10,와우! 애들이 보기에  딱좋은 영화인것같아요~ 저희도 재밌는데ㅋ 
8,와우~~정말 카2보다 훨 잼있어요. 
9,항상  스릴있고 더욱 기대감을 가지고보게하는 대사처리와 멋진 비행기모양과 실감나게  날아가는모습이 좋았다고 9세아들이 말하네요 
10,최고 최고 정말 재밌었어요 
7,카 시리즈를 아이도 저도 좋아해서 보러갔습니다자동차에서 비행기로 바뀌었을뿐 거의 같은 포맷이구요 아이는 좋아했을지 몰라도 카 시리즈엔 못미치네요 
6,무언가를 말할수 없는 밋밋한 영화입나다 
10,그냥재밋는데..말이필요없는데..ㅎ 
7,카(맥퀸)우려먹기 맞긴한데..그래도 볼만하고 우리 아들이 얼마나 좋아하는지 주말마다 본다는. 난 한 5번봤음 앞으로 더 볼듯. 
3,아무런 감흥없는 어설픈 우려먹기 
10,굿  만족  재미있엉~~~~ 
10,나이 15에 봐씨만 평점 7까진아니고 한 8.5?정도 재밌게 봤는데 카보다 재밌음 ㅇㅇ 
1,ㅋㅋㅋ 3류영화네 유딩전용 
5,자동차에서 비행기로 진화한 생각이 조금 흥미로웠는데 카를 따라가기엔 역부족인듯한 ㅇㅅㅇ 
6,카의 명성을 이어가기엔 다소 부족... 기발한 아이디어가 곳곳에 보이긴 했지만 조금은 지루... 
10,되게재밌게봤어요ㅎㅎ 
7,ㅋㅋ 카는  재목  자동차 라고  하지 그랫냐 
4,보다 말았다.. 뭐랄까.. 딱 보자마자 자동차를 비행기로만 바꾼느낌.. 
10,이건 연예인 더빙이 단 1명도 없어서 만족한다!!! 
10,저... 정말 재.. 밌습니다. 아.. 알바아니예여; 
1,만화영화에서는느낄수없는 
6,개인적으론 별로입니다. 경주가 스릴 넘쳐야 하는데 경주하다가 쉬고 다음날 또 경주하고 하다보니까 애들 집중력이 사라지네요. 영화관에서 애들이 모두 딴짓하는걸로 봐선 아이들에게 흡입력 있는 영화는 아닌것 같습니다. 
8,볼만하내용 그래도 카2 가 더잼있디는 
10,영화엄청좋고 강추입ㄴ다 
8,"디즈니판 '뽀로로 극장판 슈퍼썰매 대모험'. 스토리 라인은다소 평탄하지만, 시원한 화면 전개와 항공기(캐릭터)들의 디테일과 설정은 매우 좋았음. 다시한번 졸리로져스 미해군 비행대의 유명세를 이어갈 작품..."
8,더빙처리 않해서 우리 막내 보여주긴 힘들겠네요...그래도 카 씨리즈를 너무 좋아해서 평점은 무 더빙때문에 8점 줍니다. 
8,"스토리는 뻔(?)합니다..언제나 그렇듯 꿈을 이룬 해피엔딩으로 끝나요...그러나, 역시 할리우드산 CG와 캐릭터의 조합은 좋네요... "
10,애기들과 보기 딱좋아요 ㅎㅎ 
6,CAR를 보고 그리고 요즘 에니메이션들을 봤을때 빈약하게 느껴지는게 사실이다. 
7,초딩4학년 아들과 봤는데 그럭저럭 볼만했습니다~ 
5,카의 팬으로서  기대했었는데  감동도 스릴도 없고 중간중간 짤라먹은듯한 스토리 좀 실망스럽네요  또 더스티의 목소리가 토이스토리의 우디와 똑같아 집중이 안되네요 
7,"무스탕,콜세어,bf-109,XP-55 "
10,"너무 재미잇어요. 카 영화 본것처럼,더 재미있는 것 같아요. "
10,아~ 멋져 너무 멋져 노력하면 저렇게 되는 거여 
6,아이들의 눈높이에 정확히 맞춘영화.하지만 너무나도 정확한 눈높이에 어른들은 당황할 영화.연말인데 가족끼리 관람하면 좋을듯.... 
10,더스티는  레이스에서 우승하기위해 아픈 과거가 있는 훌륭한 지도자를 만나게 되고 맘이 착한 주인공은 어려움을 이겨내지요. 비행기가 보여주는 스릴과 하늘을 나는 벅찬 즐거움을 보여줍니다. 원어로 들을 수 없어아쉽지만 ...
4,Cars 카를 기대하지 마라. 비슷하지만 훨씬 평면적인 스토리에 훨씬 재미없는 캐릭터들. 매우 실망스럽다. 
6,중간에 너무 지루하고 집중력도 떨어지는 아이한테는 조금 힘들었던 영화. 
1,쓰레잌ㅋㅋㅋ 영화 알바 좇되랔ㅋ 
10,역시 픽사가  최고죠 !!! 
6,13년 12월 25일 14시30분 CGV 왕십리 1관    카보다 못하네... 
10,말할것도 없이 잘만들었다 
6,아이들과 나름 흥미진진하게 봤음. 
8,디즈니 영화는 꼭 아이들만 보는 영화는 아닌 것 같네요...그리고 어른 입장에선 자막으로 못 봐 아쉽고 아이들은 더빙이 이해하기 좀 어려운 듯.. 디즈니 다음 영화 프로즌은 정말 기대되네요.. 
9,짱~ 재밌어요~~~완전대박임 
6,카에 비해 못해요~ 스토리 부재 
8,재밌네요 ㅋㅋ 기대안해서 그런가? 와웅 
10,귀요미 캐릭터들 ~ 짱잼~ 허니잼~!!!'-'d 
10,애들이랑 같이 재미있는 관람하였습니다. 같이 아이는 너무 잼있다고 집에오는 내내  쓩쓩쓩~하네요..ㅎ 
10,이런귀여운영화 너무좋음~! 
8,아쉬움도 없지않아 있지만 더빙 성우진들이 너무 빵빵해서 더 재미있었습니다~ 
7,잼있어요남자애들 무진장 좋아하네요 
10,보지는않았지만 디즈니니까 
1,픽사 애니메이션을 매우 사랑하지만 이 작품은 글쎄. 이건 어른들이 보기에는 좀. 카의 번외편 수준도 안 되는 느낌. 픽사 애니메이션 중 흔하지 않은 실패작 
8,꿈과야망이있고노력이있으니결과가있네요....애들이보면배울점이아주많은애니..애니만세.. 
7,아이들이 보기에 좋은 가족영화지만솔직히 느낌이  아무리 모티브라지만 카와 비슷하고스토리 전개도 뻔하다이것보다 1월에 나오는  frozen 겨울왕국이 훨씬 기대된다 
1,"네이버 평점/리뷰는 정말 알바들이 쓰는건가 ? 여기 있는 평점/리뷰 보고  봤는데 정말 영화 별로더라. 미도, 감동도 아무것도 없는 영화 그냥 그림만 괜찮게 그려놓은 영화. 보실 분들 참고하세요. 왜 빵점은 없는거야..."
10,캐릭터가 너무 귀여움 ㅋㅋ 조카들에게 꼭 보여주고 싶어요 ㅎㅎ 
10,비행기 추천합니다! 더스티  힘내! 
5,그냥 홈비디오정도에서 남았어야 할 영화다... 이거 이 시기에 개봉할바엔 차라리 프로즌을 바로 개봉해라 1월까지 미루지말고! 
1,자동차는 카 비행기는 비행기.. 제목이 이따구? 
7,"조카때문에 예약했는데, 가족들도 재밌게 봤네요~ "
8,아이들이 잼있어하고 너무 즐거워 했습니다 
1,애들이 보는거여서 별로 재미는 없었다. 
9,최고최고최고최고최고 
6,"카의 명성을 이어 가긴 부족했지만, 찰나의 전투씬에서 가능성을 봤다. "
7,카 시리즈를 꼬마가 좋아해서 그 연장선상에서 보았습니다~ 개인적으로는 카 만큼 재밌지는 못했던것같습니다 
5,평소 수준높은 영화들 보고오셧다면 정말 비추 어린이와 함께 볼거라면 추천 
3,멋진 그래픽과 깜찍한 캐릭터들이 흔해빠진 스토리를 만나 결국 어린이 전용 애니메이션으로 전락하고야 만다! 
4,그저그런 킬링타임용 디즈니 방식에 카영화의 복제본 
5,웬지 모를 카 영화하고 비슷한 느낌이 나는 이유가 뭘까? 
6,음...차라리 크리스마스때 가족이랑 보게 프로즌(겨울왕국)이나 개봉하는게 나을것같은데... 나만그런가? 
5,두리둥실 뭉게공항.. 
4,카의 명성에 먹칠하는 졸작. 비행의 짜릿함도 캐릭터의 매력도 재미난 대사도 느낄수가 없는 하품 나오는 수준. 저연령 꼬꼬마용 
10,노짱에게 없던  양력으로 중력과 싸워 이기는 내용입니다. 부엉이 바위의 사악한 중력도 이기는 친노들이 보면 울만한 영화임 
4,지루해서...어휴지루해서...어휴지루해서...어휴지루해서...어휴지루해서...어휴지루해서...어휴지루해서...어휴지루해서...어휴지루해서...어휴 
1,..1...1..1..1... 
1,재밌다고 하는 사람들은 머지? ㅡㅡ 우리 가족이 이상한가.. 애니를 정말 좋아하지만.. 이건 정말 감동도 없고 재미도없고.. 애는 보다가 자고.. 돈아까비... 
8,카에 비해서는 ~ 짜릿함이 덜했지만... (조금 지루했던거 같아요)그래도 디즈니사꺼라 ~ 재밌게 봤어요 아이들은 재미있어 하는듯 ㅋㅋ 
10,와우 진짜 재밌게 봤어요!!! 어린이도 아닌데....ㅋㅋㅋㅋ 
5,지루하고 졸려죽는줄  알았다  네살아들은 자꾸가자구 하고 옆에 애는 자고있고  어른도 지루한데 애들은 얼마나 지루했을까? 
9,"원래 애니메이션 좋아해서 자주보는데, 비행기도 기대만큼 재밌었어용! "
1,애니를 좋아하던 내가 나이가 너무 먹었나.. 
1,아우.. 1점도 아깝네요. 우리 애는 영화보다가 집중 못하고 자꾸 나가자고 하고.... 그래도 명색이 만화인데 애가 재미없다하니... 아무튼 돈만 버렸네요... 아우.. 짜증나.... 
