score,review
3,평론가들은 영화를 머리로 보나? 눈과 가슴으로봐라. 소재가 어쩌고 해석이 저쨋네 OO ㅋㅋㅋㅌ존나 노잼이다. 98년 고질라가 존나 재밌는 거였다. 예고편에 낚였고 존나 지루했다. 리얼한분위기의 아동용 특촬물 
1,0점을 줄 수 없다는게 너무 화나고 서럽다도대체 뭘 믿고 이딴 스토리로 영화를 만들었는지 모르겠다와나 쌍욕나옴일본식 특촬물 마니아가 아니면 누구나 잘 수밖에 없는 쓰레기영화 
10,더러운 국뽕넘들 평점 다는거봐라 ㅋㅋ 극장서 봐라 개 지린다한국 국뽕디워따위한테 열광하니까 이나라 영화가 발전이 안되는거다 
10,고질라가 무토라는 괴물잡고 지구의 수호자가 됨. 역시 멋진 고질라. bb 
10,ㅋㅋㅋ전범기썻다고 보지도 않은 영화 까내리는거보소 전범기도 제작사에서 자신들 잘못이라고 사과했구만 개티즌들 수준 ㅋㅋㅋ괜히 국민정서가 미개한게 아니지 
10,숨막히는 긴장감과 물흐르듯 흐르는 스토리 내 인생 최고의 영화 
1,고질라(뉴욕)기 더 재밋음 스토리 자체가 부실. 내용도 별로. 배우들 연기력도 별로. 박사는 중간에 dead. 그렇다고 아들이 주인공 치곤 허접. 와이프는 좀 갑갑한 캐릭터. 막판에 고질라가 박수받고 떠나는 씬은 정...
4,파괴광선은 쎄다... 
1,예고편보고 보고왔는데 겁나 재미없어요보다가 마지막엔 어이없어서 웃음이나오고 이렇게 돈이아까운 영화는 오랜만에보는것같네요 
5,"초중반이 너무 지루합니다.배경 설명에 너무 많은 시간을 들이는 것 같고, 도심 파괴나 괴수들의 충돌도 후반이나 되야 제대로 나오더군요.긴 러닝 타임에 비해 후반외에 별로 볼만한 부분이 없습니다. "
2,방금 조조로 봤는데 내용도 없고 솔직히 별로다 
5,40대 이상 분들은 무슨 영화든지 다 재밌대 허허 
3,골빈 영화..  메세지도없고 고질라도없다. 
1,재미없다완전재미없다. 
2,영화 보는내내 클로버필드랑 퍼시픽림이 떠오름. 자꾸 비교가 되니원. 기대 않하고보면 재미있을려나? 
1,히어로물의 괴수버젼새롭거나 긴박하거나 재미지거나.. 이 중 하나는 있어야하지않니??글구 3D로 보지마세요!고질라의 부활과 함께 자막만 3D도 부활했습니다. 
5,고질라가 도시를 구하다는 개뿔 건물 날리고 다리 부숴서 민간인 군인들 가루내버린건 그새 까먹었냐? 남주는 대체 왜 있는지 모르겠다 군인 대위란 놈이 계속 꼽사리끼고 멍때리고 얼타면서 제대로 하는 일이 하나도 없네 
6,지루....하다가 괴수들이 나오는 장면들은 흥미진진~ 고질라가 왜 도와주는지도 궁금하지만 줄리엣 비노쉬가 왜 나왔는지도 궁금하다 
6,"주인공이 장군도 아닌데... 자기 맘대로네요. 행동에 개연성도 없고... 하지만, 고질라이니까 그걸로 봤네요. "
3,고질라 레이저 빔 슈슈슈슛 
1,별 1개가 아깝다 ...시작부터 끝까지 어수선... 
7,원래 고질라의 이미지를 살린건 좋은데 극적인 재미가 없다. 
7,내가 알던 고질라는 괴수였는데...쩝! 
6,시도는 좋았으나 너무 어정쩡하다고질라 귀여웡 
7,고질라는 우리의 친구!!! 
7,억지 가족애 감동팔이만 아니었어도 더 재밌게 봤을텐데 
6,30년 간의 오해가 풀렸다 미안하다그리고 무토 너희도 부모가 맞구나 
6,고질라는 우리편이었다. 끝에 가서 알았다 
5,고질라가세상을구하는병맛 
6,퍼시픽림 부터아주 씨쥐 제작비 아끼려고 밤배경으로만쳐찍네 뭐하는질 보이지가 않아...다좋다치자 근데 마지막 뉴스자막 하고 감동스러워 하는 사람들 표정은 뭔데?? 왜갑자기고질라가 어벤져스가 되야함????마지막땜에 입맛...
5,친절한 고지라 찡 ㅜㅜ 잘가요 
3,그리 재밋지는않음.... 
4,평점과 예고편이 더 재밌는 영화 
5,주연은 람머스와 카직스 + 엄마렉사이  어? 뭐지? 허허 웃다가 끝나는 고질라가아닌 D질라 
7,"배우들 좀 어색하고 고질라는 배도 사람도 일부러 피해다닐만큼 친인간적이라는 설정이 좀 우습지만, 꽤 긴장감 있다. 보는 게 낫다. "
4,고질라를 악역으로 했으면 훨신 인기좋았을거같은데..아쉬움 
4,"줄리엣비노쉬  요.러. 케  변하고  요런 영화에 (ㅠ .,ㅠ)...세월의 무상함...영화의 무상함...장난하냐? ㅋㅋ "
6,우리의 영웅 고질라. 초반의 진지함은 후반에서 멋지게 퇴장. 
4,재미가없어요. ㅠㅠ; 너무 뜬금없고; 
4,....재미가 너무 없다 
7,후반부만 아니면 그래도 ...나름 좋았는데.. 후반부는 아이들 만화영화인줄... 
5,더 이상 새로울게 없을 고질라 
2,어디선가 누군가에 무슨 일이 생기면~♩ 
6,샌프란시스코는 갓질라 지킨다 
5,생각하는 고질라지만 너무 고뇌만 하다. 
1,헐 내 댓글 지웠냐? 졸라 어이없음 ㅋㅋㅋㅋ 여론 조작이네이거 
1,ㅋㅋㅋ나만 돈주고 볼순없다 라고 하셨는데 이런 대재앙은 다들 피해야한다고 생각한다 
5,가장 훌륭한 고질라. 
4,고질라는 배가 고파서 깨어났다. 
5,잠온다 보다가 자다가 보다가 자다가 
2,원작을 안봐서 그런지 왜봤는지 모르겠다. 그냥 시간아까운 영화. SF만 아니었으면 눈도 안돌렸을텐데 에휴. 주인공 잘생겼다. 
2,왜키 지루하냐;;;; 
7,지루한듯 지루하지 않은 너 
5,무토부부 신혼여행의 훼방꾼 심술꾸러기 고질라. 편집(-1) 
7,잿빛 도시에 원폭 대신 투하된 인간은 무엇을 했나. 
4,2014.08.28 
6,액션이나 비쥬얼은 그렇다치더라도 고질라가 너무 나빴다. 자정작용을 핑계로 몇 만년 만에 만나는 커플을 가차없이 물어 뜯다니 ㅠㅠ 
8,미국국민하나 작지만 힘을 합치면/// 작지만 핵을 보유한 무서운 나라건/// 크지만 힘없는 대신 성장이 무서운 나라건 이겨낼수 있다는거????///하필이면 차이나타운 ㅋㅋㅋ 
6,저는 고질라는 어렸을때부터 참 좋아라 했습니다.. 그런데 이번 고질라를 보면서.. 방사능의 경각심이 아니라 오히려 방사능에 대한 불감증을 느낄 수 있게 하는 영화더군요 
4,화려한 화면에 비해서 초라하고 산만한 내용~!!화려하고 퀄리티 좋은 SF매니아들만 볼만한 영화...이런사람들은 용가리보다 못한내용에 이영화가 더 작품성 좋다고 우길듯!!!7번방에 선물을 폄하하는거보면 답나옴... 
4,고질라가 왕귀한 카직스잡고 명적받고 영화 끝남. 
5,요즘 히어로 물이 대세인데 .. 고질라도 우리의 히어로 였다니  고로 이영화는 히어로 물 3편까지 나온다고 하네요 ~ 
6,지루한 전개와 스토리를 보여준다 
4,솔직히 이런 스토리를 2시간씩이나 채울 필요가 있었나싶다. 지루해. 
8,내용이 읎는 영화 볼만함 
6,한시간은 보다가 자버렸다 
4,좋은배우들 가져다가 이렇게 망작을 만들어놓네ㅋㅋㅋ 
6,스케일은 큰데 싱겁네. 재미도 없다. 
4,고질라는 자연의 균형을 맞추는 지구의 수호자라는 주제를 정해놓고 전체적인 내용을 끼워 맞춰나가는 그런 느낌?보면서 감독 참 영화 못 만든다 딱 느껴짐:: 
5,"크리쳐물의 원조라 할수있는 고질라!  원작을 살려냈다는 평가는 좋지만,  이제 미국식 크리쳐물은 넘쳐난다. 그리고 원작의 영향으로 항상 같은패턴이다. 지겨울때도 되었다. "
1,제목이 고질라가 아니었으면 관심조차 없었을 영화.. 
1,괴수영화에 괴수가 없다.요즘 시대에도 오직 어두울때에만 나오는 어두워 보이지 않는 괴수영화라니 
5,대단한 스케일치고는 참 재미 없는편이다. 딱히 인간이 하는게 없다. 그냥 괴수들의 싸움. 고래싸움에 새우등 터진 영화. 진지한 흥미꺼리를 제공하고 인간으로 인해 뭔가 줄거리에 변화가 존재 했어야 했다. 
6,코스믹 호러를 원했는데... 기존팬들은 만족했을지 몰라도 나는 별로였다. 그렇다고 도시를 때려부수는 장면이 많은 것도 아니고;; 
8,영상미에 8점 드립니다. 마지막 드래곤브레스는 좀 웃겼음 ㅋㅋ 
7,예전 쫒기던 고질라에서 이번엔 무적급의 방사능포를 뿜는 괴수로 묘사하고 괴수끼리의 전투가 있는 것도 맘에 든다. 하지만 스토리의 개연성이나 짜임새는 그냥 단순오락물 수준이고 일본원작이라고 억지로 와타나베켄을 끼워넣었...
7,비주얼 8점/스토리4점/연기7.5점/재미(긴장감)7점 = 6.5점 반올림 7점 // 괴수영화답게 괴물이 주로 등장하는데 공포스러운 느낌은 거의 없음 CG는 화려하긴한데 비교적 무난한 전투씬과 밋밋한 스토리 
1,역대 최악의 괴수영화잠오고 임펙트  전혀 없음 
6,보다가 잤다. 아직도졸리다 
4,이 영화보고 궁금한건..  왜 제목이 고질라인데 용가리같은 것이나오냐...  왜 예고편에서는 고질라만 나오는데 용가리는 예고편에 안보여주나..  왜 고질라하고 용가리하고 싸우냐..  왜 고질라가 우리의 영웅이된거냐....
6,잘가다가 마지막에 ㅋㅋㅋ 
1,고질라가 아니고 디워다 
5,영화가 존나 쌔까매... 아무것도 안보여.... 
1,지겨워서 죽는줄 알았네 ... 
7,"시리즈로 만들기에는 무리가 있지만.. 어느정도 클래식 유저들에게는 좋은 어필 그러나 고질라를 처음 접한 관객들에겐 ""?"" 남기게 되는 이도 저도 아닌 영화임에는 분명하다. 채도가 낮아 영화 전체의 분위..."
1,정말 답없다.3류 쓰레기영화보는내내 손발이 오글거린다 
1,고질라가 무토커플 처치후 낮잠때리다가 갑자기 집에가는영화 
8,다좋은데 너무 어둡다... ㅡㅡ;;  그래서 졸리운것 같다 
6,왜이렇게 유치한거지... 
6,장난도 아니고.... 
1,노잼. 킬링타임용도 안됨. 
1,맛있는  고기먹고 싶다. 
10,"지구를 지킨 고질라,  어벤저스 팀에 들어가길 원한다. "
5,나만 재미없게 본게 아니구나. 
1,20분 남기고 보다 끔  재미 존나없네 
1,디워 재밌게 본 사람만 보세요 
4,제작비가 아깝다... 
5,4~5점이 딱맞다. 미국 군대 홍보영화다 그냥 ㅋㅋㅋ 
1,히로시마 드립으로 미국에게 디스를 날린 일본의 패깈ㅋㅋ 박사와 제독의 얘기 참고 
6,"결국 해결사는 고질라, 진작에 입속으로 불쇼하지, 2편이 나올듯 미니라랑 "
2,그래픽 빼고 볼게없네요... 스토리가 너무 빈약하고 배우들 연기에도 몰입이 안되고... 무엇보다 긴박감도 없어서 긴장도 안됨... ㅠㅠ 
5,고질라가 살아 돌아갔어.. 3탄 나오면 어떡하지? 
8,그럭저럭이었음지겸긴함 
8,솔직히졸아서 먼내용인지 
6,전혀 예상치 못햏다....멍하다 
5,괴수영화가아니라 슈퍼히어로영화아님? 
6,이 영화 ㅎㅎ 일본이 미국에 병주고 약주고 하는 이야기 ㅎ 굳건한 미일동맹을 자랑하는 이야기~ 자위대로 안되니 고질라를 키운 일본이야기 ㅋ 
5,제작비에 비해 형편없는 영화임  한국인이 봐도 형편없는 미국배우의 연기에 억지로 끼어맞춘 스토리  8살  아들은 재미있다는데 올해 내가본 최악의 영화  신이여 제가 정녕 이 영화를 보았단 말입니까 ㅠㅠ 
3,스토리가 별로 없어연.... 
3,영화보면서 잠자긴 처음.. 
5,일본색이 너무 묻어나고  전작에 비해  별로 였음 
4,고질라가 박쥐 입 벌리고  레이져 쏘면서 마무리되는 이야기 
4,방사능 흡수가 꼭 핵미사일이여야했냐.. 다른곳도 많차나...CG...글새...렌더링 작업 시간이 얼마나 촉박했느지 전투씬이 너무짧았어..초반지루함 에서 중반 대사한번놓치면 고질라 갑자기 튀어 나온걸이해불가 마지막 전...
5,평점밭을 고질라가 밟고 지나갔나 6.81이라니 초토화됬네 
6,고질라와 인간의 싸움이 아닌고질라와 방사능 바퀴벌레 한쌍의 싸움..황당해요!인간은 그냥 거들 뿐~ 어수선만 하고.에혀~ 울 딸네미 잠만 자네요 ㅜㅜ 
6,진정 무토가 악 인가? 지구를 생각한다면 고질라는 인간을 쓸어버려야  할 것을... 
5,깜짝놀라는장면들이있어서임산부나심장약하신분들은보지않는게 ㅎ그래픽은진짜최고.내용은글쎄ㅎ 
8,아숴워라 조금더 스토리가 좋앗다면 
6,후반에 개뿜은건 나뿐인가 
3,설명만있고 하이라이트는 없다. 한 마디로 지루하다. 올해들어 처음느낀 지루함. 
2,막장이라생각한건나뿐인가 
6,결말이 아쉽네요 나름 기대하고 보러왔는데 
8,약간 개연성이 떨어지는 것 같긴 하지만재난영화가 아니라 옛날처럼 만화 같은 분위기일거라고생각하고 보니 괜찮았다. 
8,대괴수와 미군영웅 조합은 왠지 어색했다. 
6,"뭐랄까. 클레식한 맛이 없고, 너무 고질라가 착하네~악당이었는데 아기 고질라가 죽고 착해지는 줄거리였으면 대박인데... "
6,먼가 아쉬워 ㅋㅋ 마지막 장면에서 고질라 찬양할때.. 쩝... 볼만은햇어 그런데 용가리 생각나냐... 자꾸 ㅋㅋ 
7,고질라의 트림으로 끝. 
9,용가리가  미국을 지키는 이야기~~ 나름 ~~ 
8,몰입도 쩜. 근데 스토리는 ... 
7,음 내가 알던 고질라가 아니군 .. 또 다른 반전이 있을 줄 몰랐다 
4,고질라가 지구 구하는 영화 이 한마디면 끝 ㅡㅡ고질라 분량보다 미군 분량이 많은게 함정 
5,영화를 보면서 스케일은 대단하다고 생각했지만...어째 스토리가... 
5,일본 괴수물의 유치한 멋짐을 원하시분들은 필관람 입니다.대형 블록버스터 스펙터클을 원하시는 분들도 볼만 합니다.다만.. 이야기의 헛점이나 '이게 말이돼?' 같은 개연성부분은 엉망입니다. 
4,ㅋㅋㅋ재미업다 영상은 볼만한듯 
7,훈훈하네요...;;내용이 ㅋ ㅋ볼만은한데ㅎㅎ 영화가 어린이들용같다는 ㅎ 
8,괜찮았음 괴수 놈년들이 커퀴짓하는게 존나 짜증났지만 
6,"46남_호물호가 갈리겠지만 개인적으로 실망_그래픽은 뛰어남_영화관에 왔으면 영화만 봅시다. 모바일폰 만지작거려서 불빛때문에 아주 거슬림, 왜 극장에 왔니? 예의없는 자들 참 많어~ "
6,"예고편에서의 그 살벌한 분위기,, 기존의 유치한 액션괴수영화와는 전혀 다르다며? 아포칼립스(대재앙)적 분위기를 넘어 거의 묵시록적 분위기를 풍기겠다던 제작진의 호언장담은 어디갔냐? 영상미와 연기는 뛰어났으나 그 모든..."
6,초반간단한시나리오 후반 살짝몰입 
6,지루한면이 없지않아 있고 3d로 봤지만 돈이 아깝다는 생각만 든다 아쉽다 
6,나는 이 영화를 본 소감을 뭐라 적어야 할지 모르겠다. 
2,정말 뒤로 보면 볼 수록 울트라맨 보는 느낌 들어.... 
6,산으로 간 고질라.  바다에서 이제 안나와도 될듯. 
6,일다했으니 물침대가서 쉬어야지 
7,"[노잼][ 영화 스포 ]1. 존나큰 날개 괴물 2마리 나옴2. 나중에 고질라 바닷가에서 기어나옴3. 고질라가 날개 괴물 두마리 학살함 (레이져빔,꼬리치기)4. 고질라가 평화를 구하고 끝남. "
6,고질라를 어벤져스에 껴줘야 할듯 
5,괴물의 출현 전엔 설명만 구구절절! 출현 후부터는 임팩트 부족!! 
5,그렇게 재밌지도 그렇게 지루하지도 않아요 그런데 왜 미국인은 이렇게 안죽고 동양인은 많이 죽이죠? 이게 바로 미국 우월 주읜가 
6,난이영화보면서 너무큰스케일을 기대햇던걸까 고질라와 괴수가 싸우려고할때 자꾸 장면이넘어감 결국마지막에 그나마 길게싸웠지 .... 난지루했다 .. 
8,나름 괜찮네. 감독이 자포니즘 
6,고질라 귀요미로 끝.... 
6,솔로천국~!!!! 커플지옥~!!!! 
9,볼때 사람많은 영화관에서 애훈육하는 어머님 빼고 나쁘지않았던것같다.바퀴벌레같은 괴물도 막막 심하게 CG 티나지않았고 재미있던영화? 자연보다 위대한거는 없다는것을 느낄수있는영화 
8,"매니아들한테는 최고의 선물이다만, 일반관객에겐 글쎄....? 고질라를 수호신말고 파괴의 신처럼 묘사하지...인터뷰에 낚였습니다. 그래도 개봉후 미국에서는 엄청난 수익을 벌여들이고 있습니다 "
8,제목을 고질라라고 하지말고 고질라VS무토로 하는게 더 나을 듯. 마지막 고질라 영웅화는 좀 웃겼지만 전체적으로 재미는 있더만. 
3,솔직히 보다가 잠들었다.... 
7,설마설마했는데 입에서 불이 나올줄 몰랐음... 아놔.ㅠ 
5,괴수가 나오고 여차저차 싸워서 인간들이 괴수를 이겨서 뭔가 와~~! 하고 그런 장면 나올 줄 알았는데 고질라가 암컷 무트에게 맘마 먹이는 장면을 보고 어이없었다. 급 고질라 영웅화가 참.. 
7,예고편에 낚인만큼 실망이 크다 
7,엄청난 스케일. 완성도높은 CG.  여기까지인듯.  스토리몰입안됨. 스토리에 녹아들지못하는 가족애. 괜찮은듯하면서도 2% 아니 4-5%부족한듯한 연출력. 분명 블록버스터인데 3류티가 나게 만든 연출력. 전문가가 아니...
6,잘 만들긴 했는데 차라리 전작이 낫다는 생각이 들은... 
2,이영화이후로 고질라는더이상리메이크하지않앗으면한다.초반내용은지루하고 결말은 너무 뻔하고시시한감이잇엇고 내용구성도 별로그닥이엿다. 
3,일본식특촬물+헐리우드식전개로 인해 대부분의 사람들이 유치하게 생각되도록 했다고 생각하고 내용전개의 개연성이 많이 부족해서 그런지 뭔가 엉성한 느낌이 많이 듬 팬보이들에겐 좋은 영화일수도 있지만 일반인들에게 좋은 영화...
5,전투씬 왜 자꾸 끊어 먹는지 이해 불가ㅋ 게다가 3디 효과는 어디로 간거요... 
4,입에서 불 뿜고... 고질라 인류를 구하다 자막 봤을때 유치해서 소름 돋더라... 차라리90년대 장르노 나왔던 고질라가 헐씬 괜찮았다..괴수 영화인데 쪼이는맛이 전혀 없어서놀랄 정도... 
6,보고 난 후 남는게 없는 영화... 
5,애들용 괴수영화 그 이상 그 이하도 아니다. 고질라판 디워. 
6,초반이는 기대! 중반에는 살짝 졸림! 후반에는 좀 허무! 다보고 나오는데 커플이 이 영화때문에 싸움...  '이거 니가 보자고 했잖아!' ㅡ_ㅡ;;;; 
3,유치지루성인정서에맞지않는유치함 
7,팔을 잘 쓰는 티라노사우르스밖에 생각이 안난다. 
4,...히어로물인줄모르고봤네....왜이렇게 만든줄이해가안간다..파란불을 내뿜을때 알아차렸어야했는데..cg때문에 보기엔 내용이 어이없어서 피식댈정도... 
2,고질라는 우리의친구 영웅 그런이야기끝으로갈수록 어찌나웃음이나든지 ㅋㅋ 
5,"이건뭐, 영웅 고질라라니! 뭐 다 떠나서 별로 재미가 없다! "
4,생각보다 실망이큰영화..고질라의 액션은..후덜덜 
5,굉장히 정신사나운 고질라. 
10,잼잇네요엄청나게마지막유치 
5,아..괜찮았는데.마지막에 브레스를 뙇!! 이건 아니쟈나 
5,허술한 스토리 일본 박사는 첨부터 끝까지 멍때리고 시가지에서 싸우는거 나 어릴적 봤던 아이젠버그에서 나온 괴물을 나이먹어서 또보게 되었다. 어이가 없네... 누가 댓글에 적어 놨더라 나만 당할수 없다고.... 젠장 
5,고질라 필살기! 토치로 지질줄은 몰랐어~ 돈은 좀 들인거 같은데 왜이리 하품이 나오는지..ㅠ 
5,미국미화+일본미화+중국까는 영화들인돈이 아까봐서 5점 
2,정말 시간이 남아서 모든영화봐서 더이상볼게 없으면 정말 편안한마음으로 미칠듯이 시간이 보내고 싶다면 보시오. 영화보면서 졸렸음 몰입감은 없음. 다른희생자가 안오길.. 
5,"괴수물의 정통성은 살렸을지 모르나, 완성도를 날렸다. "
6,마지막장면의 뉴스자막에서 실소를 터트릴 수 밖에 없었다. 
5,"모두가 뭐가 나올지 안다해도 너무한 것 같다.알에서 괴물이 나올 때 무슨 안개도 없이 바로 적나라하게 나와버리니 한번에 재미가 없어졌다. 하지만 음향, CG 가 모든 것을 커버한다. "
4,스토리기 아쉽다. 감정에 공감하기가 ㅠㅠ 
3,타깃 관객층을 초등생에 맞춘 가족이 같이 보는 고질라... 딱 이 수준이라서... 클로버필드를 기대했던 관객에겐 한심스러운 영화... 
6,CG는 정말 좋네요 근데스토리전개가...하....나만돈주고볼순없고...예고편만보면 고질라가 나쁜놈인데 우리친규엿쟈나? 근데쫌 많이 우스운부분이있어서 별점은많이줄순없겟네요 
6,돈 많이 쏟아부은 미국 3류 괴물영화를 보고온 기분이다. 
3,엄청 재미없었음 별로이다 
6,영화관에서 영화보다졸기는 처음.. 
4,기본에 충실한? 고질라 매니아들이라면 충분히 좋아할 영화. 하지만 퍼시픽림의 스펙타클을 경험한 관객에게 딱히 어필한 무언가가 있진 않은듯. 3D도 글쎄... 
9,커플지옥 솔로만세갓질라 만세 
8,동생과 재미있게보았습니다. 지루한 부분도 있지만 몰입도가 좋았습니다 
8,아다공룡의 커플 브레이킹 스토리 
7,고질라 귀여운 맛에 봅니다 
8,오리지날 고질라에 대한 오마쥬..이것은 괴물영화가 아니라 재난영화. 
8,장르영화로서의 '괴수영화'로서는 만족스럽다 
7,마지막 마무리만 아니면 전체적으로 평타는 치는거같은데... 마무리가 너무 아쉽네.. 
8,과수vs괴수 제밋다하지만 중간에 무능한 일본인박사같은 놈이미국이 핵쓴다니까함장보고 히로시마 거리는거 랑박사조수같은 아줌마 드럽개 못생겨다제밋는작품 
10,악당이 무슨 카직스닮아서. 람머스VS카직스 보는줄 
8,재미있었고 고질라에 대한 원작은 훼손 시키지 않았지만 뭔가 부족한 느낌이 드는 작품 
9,고질라와 다른괴물들의 싸움들도 볼만했고 지루하지않았던 영화! 강츄!!재밋따! 
8,재미잇네요  재미잇네요 
9,재밌습니다!! 근대 뭔가좀나올라하면 다른화면넘어가고 뭔가터질라하면 화면바뀌구 그래서 들었다놨다합니다 ㅋㅋ 
8,흠..내가 전에 본 고질라는 도시 파괴하고 군대하고 싸우는 거였는데 이번 고질라는 내가 아는 그 고질라가 아닌 내가 아는 용가리였네요ㅋㅋ갑자기 옛날 용가리영화생각나네요 외계인하고 용가리하고 싸워서 지구지키는 장면이....
8,고질라입에서 불나올때부터 뭐지하고 아무생각없이봤씀 초반에재밋는데 후반갈수록 재미가없어짐 
5,기대보단 별로였다 나이가 먹어서 그런가 쿠프로메테우스는 상당히 재밌게 본 나로서는 고질라는 뭔가 좀 유치했던느낌 
5,미국애들은 왤케 고질라를 좋아해 ㅋㅋ 리메이크를 두번이나 하고 있넼ㅋㅋ 스토리가 나오는건 불가능한 소잰데 
3,제 아무리  포장해도 이 영화를 본 관객은 식상했다. 상업영화면 상업영화 답게 관객이 원하는 것을 철저하게 만족시켜주는 게 당연한 것 아닐까? 
5,뭔가 잔뜩 있는 척 하더니 결국 스토리는 앞뒤가 안 맞고..  하나는 인정함. 불 뿜을때 소름돋음 ㅎ 
10,볼거리는 짱짱~ 이런 식의 재난영화도 괜찮네 하지만 롤렌드 고질라가  더 나은 듯... 
6,재밌기도 재미없기도 하고 내용전개가 괜찮은 듯 부족한 듯 하네요본 사람들은 알겠지만 근본적인 불균형의 원인이 모순인 영화 
7,약간 b급의 냄새가 나는 거랑 주연급 배우들을 초반에 죽이는 만행을 제외하면 봐줄만한 영화라고 생각되네요. 
6,재미없다 진짜.. 초반부에 몰입도 좀 있나 했는데 점점 루즈해져가고 심지어 고질라와 무토둘이 싸우는 상면조차 졸면서봄 
7,"눈은 어느정도 즐거웠습니다만 뭐랄까..조금 유치한 요소가 있더군요..괴물,증오의 대상이던 고질라가 갑자기 영웅화 되는 과정이 굉장히 어색합니다 재난영화에서 갑자기 판타지가 되는 느낌입니다. "
6,군인들도 멋있고 그래픽이 좋아서 보는 맛이 있었지만 보는 도중 간간히 졸음이 밀려왔다. 
6,그래픽 음향효과 연출은 뛰어나다하지만 그 이상은 없다 유치하며 지루하다 
8,볼거리가 많은 영화. 장관에 이어 장관이 펼쳐짐. 유치한 스토리 등을 볼거리가 메우고도 남음 
7,기대하고 봤는데 그냥 킬링타임용으로 ㅊㅊ나는 사운드 좀 촌스러운 느낌이였음.. 괴수영화라 어쩔 수 없나?내용은 괜찮다 생각했는데 ?.. 
8,내용은 더럽지만 그래픽이 좋아서 
7,고질라 미화영화 무토같은 남친 사귀고 싶게 뽐뿌시키는 영화 
8,지루하진 않았는데 스토리가없다 
