score,review
1,들인 돈에 비해 사상 최악의 재미를 보장해줌. 난 그래도 워터월드는 잼나게 봣는대 이건 아니라고 본다. 이걸 재미있다는건 유치원이나 초딩학생 수준의 마인드로 영화를 감상하는 분들외엔 없을듯 
1,몰입이 안되는 겉도는 영화! 그렇다고 액션씬이 좋지도 않은.... 뛰쳐 나올뻔했어요 -_- 
1,최--악  6명 갔는데 6명 다 중간중간 잤음ㅋㅋㅋ 
1,갈리오+날개없는 메카카직스  vs 초가스의 느낌이랄까?   라이엇에서 만들었냐???  ㅋㅋㅋ 
1,디워디워디워디워디워 
1,주말에 조카들이랑 가서 봤는데.. 완전 쓰레기..ㅠㅠ 인간은 한게 아무것도 없고 괴수들끼리 싸우네..ㅜㅜ 
1,유치함을 떠나서 내용상 개연성 부족 영화는 명작 명장면 짜깁기 식상하고 유치한 장면들의 나열 시각효과볼거면 차라리 포르노를봐라 
1,하아.... 정말 충격적인영화 
1,주인공 대위 걘 도대체 왜 나온거야? 나와서 도대체 뭘 한 거야? 끈질기게 살아남은 거 외엔 한 게 뭐가 있지?  생존왕 베어그릴스인가? 
1,최악...진짜보지마세요 ㅠㅠ 
1,기대를 많이 하고 봤는데 그닥 재미는 없네요 
1,아무생각없이  봤다가 ㅜㅜ극유치 최악에 영화 
5,재미없음 전개가너무김 
1,저질라..고질라를 인류의 영웅만드는 거 보고 실소를 금치못했음. 스토리 저질. 몇년만에 첨으로 보다가 졸았음. 이게 스파이더맨보다 재밌다고 한사람 그믄은든드 즌쯔.. 
8,기대했던거와 다르다. 오락물로 보려고 했는데 이런 괜찮은 연출과 스토리로도 갓질라를 만들어내주다니 놀랍다. 
1,영화관에서 본 몇안되는 졸린 영화 
3,기대하고 봤는데 가면갈수록 질리고 결국 고질라는 영웅이된다는 영화...  솔직히 스토리도 기대했는데 cg도 영... 용가리가 더 재밌다는 소리도 들림 
2,세상에 이렇게 재미없는 영화는 몇안된다.정작 고질라는 그 긴 상영시간 동안 10분정도 나오고 스토리 또한 아주 엉성하기 짝이없다. 다시는 다시는 보고싶지않다. 평점 잘주는 사람들은 알바생이 분명하다. 
1,"욕나온다 개지루하다 무토 고질라 싸울때만 아주 약간 재밌고 스토리 전개  최악, 주인공은 뭐하는 놈인지..에혀 "
3,파워레인저의 괴물과의 싸움이연상되었음. 디워를 다시 보는것을 권해요. 정말 궁금하다면 보고 그게 아니면 보지 마시길. . . 
1,진심재미없어요 ㅋㅋㅋㅋ아 재미없진않다. 황당해서 빵터짐 ㅋㅋ 
1,진심으로 댓글알바생들 얼마받는지궁금하다 
9,괜찮았어요.고질라 소리지를때 스트레스풀림 
10,와우! 이런건 나만볼순없지! 다들가서 꼭보세요! 
1,이거보고 여친이랑 싸울 뻔했음. 너무 재미 없어서...ㅡㅡ;; 이건뭐 시나리오도 그렇고 스토리 전개 속도도 그렇고 괴물성정도 다 엉성해요. 차라리 심형래의 디워를 보세요. 
1,배경만 볼만해요ㅋㅋ 왠바퀴벌레가... 
10,고질라류 영화중에 제일 잼났었던같아여 ㅋㅋ 내가알던 고질라랑 비쥬얼은 젤 비슷했음 
1,고질라가 레이져빔을 뿜는순간 나도 뿜었다... 
1,고질라 안보길잘했닽 엑스맨: 데이즈 오브 퓨처 패스트 봐야징 헤헷 
1,디워가 생각나.. 심감독은 디워2.. 푸훗... 
1,123분동안 단 한순간도 재미있는 순간이 없음 처음부터 끝까지 이상하게 전개되는 스토리 개연성없는 구성  그리고 도대체 이유를 말하지 않는 내용들 그렇다고 화끈한 액션따위 전혀없고 실질적으로 고질라가 나오는건 15분...
1,주관전 평점은 3점.. 잘쳐봐야 4점이지만 현 평점이 너무 높으니 1점.아.. 오랜만에 영화관서 탄식했다 
1,아 진짜 오바입니다.  이거 칠광구이후로 개쩌는 통수네요. 비둘기가 가장무서웟어요. 
1,갑자기 왜 고질라가 우리편이 되는건데??? 작가가 망쳤다 
10,난 고질라를 보자마자 짱구의 장난감이 생각낫다 ...주인공이  알 태울때완전 멋있음 
10,새로운 고질라!! 멋지다!! 
7,스토리나 볼거리 둘다괜찬았는데  먼가빠진듯한기분 보면서  예거생각이자꾸남 
8,방금 왕십리 CGV에서 아이맥스 3D 조조 관람을 마쳤습니다. 괴수들이 생각보다 훨씬 강력합니다. 클라이막스 액션의 배경이 너무 어두웠던 점을 제외하면 상당히 재미있었습니다. 고질라의 아토믹 브레스도 정말 멋졌고요 
1,심형래 감독의 디 워 가 더 낫다 차라리 
1,고질라가 무서운 괴수가 되어야 하는데 그냥 동글동글 해달임하는짓도 착하고 귀엽고울부짓는거도 적괴수가 더 멋있음스토리 포기하고 볼거리만 기대하고 갔는데 그쪽도 실망 ㅡㅡ 
10,완전 재밌음 ㅋㅋㅋㅋ긴장감 최고짱짱맨! 
9,개쩌러  액션 워  새끼들이 부활좀 했으면  좋겠다 
3,3개중 2개는 고질라를 위한별 나머지 1개는 무토를 위한별....작가새끼 좀 맞자 
1,방금 보고 나왔는데.... 무슨 만화영화 보고 나온 느낌. 무슨 고질라가 세상을 구해~!!! 
1,아 진짜 이게 뭐야....괜히 봤다싶다 
10,가렛에드워즈 몬스터 보고서부터 알아봤다. 
1,재미없다정말 7세이하관람가? 용*리치킨? 
1,너무 기대했나봐.... 
1,롤랜드 에머리히 고질라 1 이 정말 재미있었던 영화구나하고 느꼈다...그리고 제목이 왜 고질라 인지 정말이해안된다 한 10분 나오나... 
1,1998년에 나온게 더 낫다 
1,98년도 고질라가 잘 만든 영화라는 걸 알게된다. 
6,재미없다. 그냥.. 내가 생각한 고질라가 아니다... 
1,옛날 고질라만 못하다 왜 다시 만들었나 
10,원작 고질라를 좋아했던 사람으로써 기대하는 영화입니다. 
4,결말엉성 ..너무 스토리가 없음  ...아이들이 보면 괜찬을듲 ... 
10,대박입니다 진짜 꿀잼!!! 
5,"이런 류의 영화가 다 그렇지만 스토리가 매우 빈약한데다가 감독이 가족애와 미국군사력 자랑을 제대로 버무리지못했고, 괴수의 등장씬도 그렇게 크지 않고 괴수끼리의 전투씬도 볼께 없어서 매우 실망입니다. 딱 비디오용 영화..."
1,미국 리메이크작 이지만  일본소재라 싫다 
1,누굴 위해 만든 영화인가 
10,100프로 보고난 후 재미있다 소리 나올거임 안나오면 그건 인생이 우울한 사람일듯 
10,
2,영화 초반에 히로시마 원폭 얘기 나오고요 그리고 미군 지휘자가 잘못된걸로 나오는데 이는 곧 자기들이 피해자라는 의도가 바탕임....역겨움.  하여간 일본인들 음습한건 알아줘야 함.걸러야 될 영화임 
8,"전편 보러 갑니다., 그나저나 주인공이 킥애스 찌질이였다니 "
5,고질라가 착한 동물이란느낌이드는건왜일까요?? 
8,예고편으로 피해본 영화일것이다. 내용이 전혀 다른 예고편을 내놓았다. 영상은 볼만하고 등장할때 웅장했으나 신비주의로 가는 것도 좋았다. 갑자기 지구를 지키다니 하지만 어느세 그것이 진실로 된것 같았다. 갑자기 공포적...
9,이정도면 잘 만든거 아닌가? 카메라 시점이 인상적이다.. 
7,고질라와 무토 앞에 인간의 이야기는 한낱 사족에 불과하다는 게 장점이자 단점. 
5,재미없고 따분해요 진찐 
5,엘리자베스 올슨이 많이 안나와서 아쉬웠다... 
5,남자 주인공 머리 짜르니 첨에 못알아봄..알고 보니 킥애스에 나와던 남자였네;;;; 
9,착한친구 고질라 무토 잡는건지 이해 불가 ㅋ 
7,전 고질라 영화보다 스토리 디테일은 좋아졌네요 고질라는 내친구 
4,디워가 괴수영화에 외국배우들 물타기해 한국끼워팔기였다면 고질라는 괴수영화에 헐리웃 물타기해 일본끼워팔기. 스토리 연결 허술 남주 원맨쇼 그외 연기자들 캐릭터 모호 디워의 귀환인줄 
6,그냥 봤어요~158128658 
4,"돈주고 보긴 아까운 영화, 하지만 돈주고 봐야하는 거대함의 아이러니 "
4,너무 너무 지루했어요. 
6,아이들이 정말 좋아할영화^^ 
3,초반에는 정말로 느낌이 좋았는대 가면 갈수록 뭔가 툭툭 끊기는 기분이들고 이제 싸우는 장면이구나  하면  다른장면으로 전개 되고 그게 몇번이나 반복 되다보니 아 이번에도 안싸우고 넘어 가겠구나 라고 생각할정도로짜증을...
7,초딩이라믄 재밌을 영화 
10,간만에 추억이 새록새록 
9,"다들 이런 괴수영화에 무슨기대를 그렇게 크게했는지 모르겠지만 볼거리와 적당한 내러티브를 갖춘 '꼭' 극장에서 봐야하는 스케일에 '팝콘'영화 입니다. 압도적인 CG, 어마어마한 물량촬영, ..."
8,저번주에 본 표적보다 나음 
8,오랜만에 동심으로 돌아간 기분이었다.심오한 척하는 영화 속에서 이런 영화도 한번쯤 괜찮다. 
7,고질라 싸이즈가 생각보다  무쟈게 크다는걸 알았음.. 
7,"예전 고질라 시리즈를 계승하여  잘 만들었지만, 계속해서 재난이 터지고, 사건이 터져서 지루하게 느껴졌다.   약 강 약 강 강 약 강 ... 이런느낌이라 중은없고, 서스펜스 부족. 이게 이프로 아쉽다. "
2,OO 이거 돈주고 보지마라 
10,오..최근에 나온다길래 이거 한번봤는데 너무 재밌었음 다만 괴수영화라 보기엔 재난영화 거의 그자체고 개연성이 전투이던 뭐던 너무 딱 맞춰서 엄청 유치해보이긴하는데 상황연출이나 상황의 긴장감 클리셰등등은 개인적으로 엄...
6,괴수영화에 이렇게 위기감이 없을 수가?! 
4,1시간50분중에 싸우는거 10분 그 10분중에서도 인간-괴수싸움 화면 왓다갓다 이번에 나온것도 이 ㅈㄹ 이면 안봄 
6,괴수는 뒷전이고 미군맨이 똥싸고 그 똥 수습하는게 주 내용. 화끈함이 부족했다 
6,"전개가 고질라계의 디워, 용가리, 장 르노의 1998년 작에 먹칠을 했다. 2019년에는 삽질하지 마라. "
4,퀵실버랑 스칼렛위치가 소코비아에서 눈맞아서 결혼함 잠깐...남매자나..? 
4,ㅈㄴ 지루하다 새로 나온 고질라 보려고 전편 보는 중인데 너무 재미없고 지루함 주인공들도 도대체개 하는 일이 전혀 없음 ㅋㅋㅋ 
6,고질라 이 호구같은 칭구야! 과거에 그랬던 것처럼 사이즈가 문제가 아니란 사실을 아직도 깨닫지 못했더군! 
6,화면 만드는 건 예술인데 이야기는 엉성하기 짝이 없네. 
6,"관념에서 실체로, 악당에서 영웅으로... "
7,스시 위에 치즈 올리기! 맛은 그럭저럭~ 
7,고질라새기 빨리 죽여라 . 
7,"독특한 발상이네요,인간을 위해 괴물과 싸우는 괴물이라...신선했음ㅋㅋ "
8,재미는 있습니다. 좀 길다 싶더니 2시간짜리 군요. 98년뉴욕에 출몰한 고질라는 핵오염으로 인해 탄생한 파충류 아니였나요? 핵공격이였다니?!  일본인도 나오고 고질라 대 무토 / 사다코 대 카야코 느낌적인 느낌~ 딱...
6,한 시간 참으면 나머지 한 시간은 볼만 함... 
4,감독님 요즘 괴수들도 커플이 유행인가 봐요 
10,꿀꿀쩀꿀꿀쩀쩀꿀쩀쩀 
6,재밌긴 한데 일본인박사 연기가 혼자 동떨어져서 안어울려서 거슬려죽는줄알았음. 몰입방해... 
9,상남자 독고다이 갓질라... 
10,30QHKDTHD ? 
7,그냥뭐... 그렇다요?? 
5,언제 봤는지 이젠 기억도 가물거리는데 뭔 뜬금없이 관람평을 쓰라는 건지? 
5,가서 찢어버리고 와 -블랙넛- 
7,딱  이점수 만큼은 된다. 
7,뭔가 난데없이 휘익 나타나서 무슨 내용인지  크레딧 후에도 기억이 안난다. 
7,생각보다 괜찮았 ㅋㅋ 스케일도 크고 지루하지도 않았다.. 엘리자베스 올슨은 역시 이쁘군 
10,고질라 재미있게 보기 위해 참고! http://movie.naver.com/movie/bi/mi/reviewread.nhn?code=100987&nid=3431254#tab 추천하기! 꼭 눌러주세요. 
3,Zzz 날 잠재우는 고질라 
2,스토리도 개판 그래픽도 개판  2014년 영화맞나여? 
6,정말로 그냥 괴수 영화... 
8,마지막 지구의 자정을 지키기 위한 괴물의 본능.감동적이었습니다... 배우들의 연기가 아까운 영화입니다...  아쉽네요. 
8,까기전에 원작이나 보고와라 
8,이게 진짜 고질라지. 롤랜드가 망쳐놓은 B급 재미를 다시 살려놓았다! 
4,옛날 고질라는 쥬라기 공원 보는 느낌이라서 재밋게 봤는데 이건 뭐하자는건지 모르겠다.. 고질라가 핵무기 먹는 공룡들이랑 싸워서 인간을 지킨다? 뭐 그런 내용 같은데 공감도 안가고 감동도 없고 CG만 보다가 끝나는 느...
10,예상외로 재미있네요 ㅋㅋ 
5,"개연성 없는 스토리에... 자꾸 맥이 끊기는 전개... 등장인물들이 전혀 역할들을 못하고, 뭔가 인상에 남는 몇몇 멋진 장면들에 치중하다보니 예고편이 다가 된 영화. "
10,재미없다는 사람들은 보기나 한건지. 스케일이 크고 특수효과도 뛰어나며 무엇보다 내용이 유치하지 않고 스토리가 탄탄합니다. 결코 허무맹랑 울트라맨 같지 않습니다. 볼만한 영화로 추천합니다. 
7,고질라 말 그대로 고질라 
6,"아쉬움이 많이 남는 영화.그래픽은 압권이나, 다소 유치한 스토리라인과 짧은 주인공의 등장 장면들이 단점 포인트. "
7,너무 재미없다가메라시리즈보는게 낫겠다 
5,1998년 제작된 고질라보다 잘만들었다는 영화평론가의 평론을 도저히 이해할수가 없다. 그냥 돈 많이들인 B+급영화다. 그 이상도 그 이하도 아닌... 
10,잠안와서 봤는데 생각보다 졸잼인듯??마치 울트라맨 극장판에서 울트라맨 없는 졸라현실적인 뭐 그정도인듯? 하튼 잼잼 
9,솔직히 평점 낮아서 안보려고 했는데 꽤 재밌네요ㅋ고질라가 끝쪽에 입으로 불뿜는것도 멋있고 볼만했네요~ 
6,제작비 얼마나 아낀다고 뮤토와 고질라의 첫조우 를 싸구려 뉴스화면으로 때우냐 ㅡㅡ 이감독이 어떤영화른 찍던 앞으로 기대할일 없을듯.. 제작비 절감 전문임 
10,예상했던 내용과 틀려서 나름 재밌게 봤네요... 근데 고질라보단 바퀴벌레 부부가 더 많이 나오네;;; 
10,고질라 괴물 귀엽다 ㅋㅋ재미있음 
7,이런 장르를 좋아하는분들에겐 볼만한 영화! 
7,집에서봐서 그런가 볼거리마저 그냥 그렇네... 
10,방사열선 발사재미있었습니다 
8,솔직히 미국이 한국보다는 어느모로보나 낫다는생각을 하게만들었고.. CG도 엄청났으며 연기또한 괜찮았다 단지 내가 2점을 깎은 이유는 스토리가 다소 진부하다 
6,초반은 10점. 무토 나올때부터 어리둥절잼ㅋㅋㅋㅋ 스케일에 반해 스토리 구성이 뒤로 갈수록 막장드라마라서 결국은 6점을.. 
8,잘만들어진 괴수영화 느낌을 받았음 이렇게 평점이 낮다니 아무래도 알바 푼듯 물론 예고편에 낚인 1인지만 재미 있게 봤고 고질라 뒷모습이 너무 귀엽게 보였던 결말이 다소 유치했지만 상당한 퀄리티 괴수 영화~~~ 
10,"강하고 , 묵직하고 , 심오한 영화다. 가렛 에반스만의 특유의 향기가 느끼는 2014 고질라가 제일 잘 만들어졌다고 본다. "
9,개개인마다 차이가 있겠지만 난 이영화 정말 기대안하고봤는데 볼만하다 재밌엇다  긴장감도있고 내가 뭐라 좋게표현을 잘못하는데 정말 한번보세요 추천함 시간아까울거같다는 사람들은 시간남아돌때보세요 진짜 볼만합니다 !! 
9,가족들과 보러갔는데 이영화는 cg영화치곤 정말몰입있게 봤다 
5,고지라영화에 왜 이렇게 고지라를 아끼고 안보여주냐?! 
7,오랜만에 보는 '썩 나쁘지 않은' 괴수영화 
7,음...걍....볼만한것같아여~ 
8,고질라의 내면의 모습에감동.. 
6,"많은 제작비,괜찮은 CG,그러나 후반까지 너무 지루한 상황전개.어설픈 편집도 문제.많은 돈 들이고 감독이 망친 영화. "
7,볼거리는 충분하지만 스토리가 아쉬운 영화; 
10,뉴옥은어벤져스 센프라시스코는 고질라 정녕 미국에쳐들어갈방법은없나 
7,그냥 저냥... 잠은오지않음.. 
8,B급 무비 CG수준보소! ㅋㅋ 대박이네.. 고질라가 지구를 지키는 황당한 내용이지만.. 씨지는 거의 트랜스포머급이네..ㅎㄷㄷ... 머여.. 이 고퀄 B급 괴수무비는..ㅋㅋㅋ 
6,최고급 식재료를 늘어 놓기만 한 듯한 ....  실망스러운 영화 
10,재밌기만 하구만 하도 까서 기대안하고 봤는데 잼있네 ㅋㅋ 
10,스케일도 꽤나 괜찮았고 재밌었습니다. 
10,명량 혹성탍출2 고질라 모두 극한의 카리스마에 대한 영화 ㄷㄷ 의외로 그 중에 제일은 고질라였다니 
5,괴수영화에 대한 관객들의 기본적인 기대치를 충족시키지 못했다. 
4,고질라~ 우리의 친구 우리 우리 고질라~ 
10,추억의 고질라가 돌아왔다. 일본판의 조악함을 할리웃스럽게 잘포장한 괴수영화 
9,와.. 액션신이랑 뭐랑 다 최고네요;; 킬링타임용으로 좋아요~ 
10,결말에는 고질라가 그렇게 이뻐보일 수 가 없다. 
5,"웅장한 스케일에 보이지 않는 괴수들의 혈투, 어쨌든 지루한건 견디기 힘들다... "
9,난 이거 훌륭하다본다. 뭐 다만 조금 아쉬운건 있지만~ 지금껏 괴수영화에서 아쉬웠던 스케일만큼은 확실히 충족해줬다. 다만 원작 고지라에 충실했던건지 인간과 고질라의 우호적인관계설정은 훈훈하면서도 왠지 낯간지럽네 
8,"꽤 재밌는데,그리고 불나가는건 현실을 너무 중시해서 유치하게 보이는거다 이건 고질라 영화라는걸 잊지말자 "
8,이 정도면 충분히 재밌다.. 
8,평점이 7점대 이면 뭐 이해는 한다만 사람들 후기글들이 너무 재미없다는 식으로 해놨네..난 줜나 우와우와 거리면서 재밌게봄 존나 싱기방기함 무토랑 고질라마지막에 무토 주댕빡에 용트림 쏟는거보고 감탄함 
10,어? 난 베리굿! 히어로 고질라 멋져~ㅋ 
7,킬링타임용영화!! 예고편너무괜찮았는데... 
4,보다좀(열글자를채우자) 
10,평점이 이상하네요 8정도 
8,난재밋는데 긍대 마지막에 고질라 도시를 구하다 뉴스랑 사람들 성님 퇴근할때 환호지르는거보고 오그라들어서 소름끼침 
1,천수나한 로그 퇴마 인파 메탈 좀 상향시켜주세요 ... 얘네들 다 모여도 고질라 피부한조각도 못벗겨낼꺼같아요 
10,아들하고 같이 보았는데 저는 나이가 들어서 영화내용은 이해가 잘 안되었지만 액션장면에 아들은 정말 재밌어하더군요♡(아들이 영하볼때마다 액션장면만 좋아해서 문제지만....) 
10,고질라가 나쁜역할로 나오는줄 알았는데 무토가 나쁜애로 나오는  반전이 ㄷㄷ 
5,시간때우기용 영화...기대가 컸는데..실수한것 같다. 
6,살좀빼야겠어 고질라씨 ㅋ 
3,고질라가 빔쏘고 무토가 EMP쏘고 정말 스펙타클함 
7,그냥 괴물 3명이서 열심히싸움 고질라 짱짱 끝 
5,소두 고질라 ㅋㅋㅋ 알리스타 오브레임 인줄 ㅋㅋㅋ 
7,지루했다.   고질라  샤우팅만 기억에남네...   기대만큼은  아님..  일본박사는  왜 나온거지.. 
6,"주인공들은 걍 있으나 마나한 들러리 들이고, 퍼시픽림처럼 화끈한 액션을 기대했는데 이건뭐 이도저도 아닌듯 "
1,너무 어두워서 ㅎㅎ 뭐가 뭔지 모르겠네요 
7,마지막 전투 이전까지는 지루하다. 마지막 전투 십여분은 재밌었음. 
2,개 노잼 진짜 지루해죽을뻔 그 중요한 고질라는 등장도 많지도 않고 다른 괴수랑 싸울때도 편집함 이런 예고편만 보고 뒷통수 처맞은 영화 일본은 왜캐 드럽게 나오는지 극혐 
6,그냥 괴물이 나와서 건물 부수고 사람들이 많이 죽어나가는 그 이상도 이하도 아니다. 
7,아쉬운부분이많은데 그래도볼만함 
7,주인공이랑 마누라나 애가 죽던살던 전혀 관심없었음.오히려 중간중간 보여주는게 짜증날정도.영화의 주인공은 고질라vs괴수 이기 때문에.. 
1,CG는 만들다 말았고 대체 연출감독이나 스토리작가는 존재하는지 의문인 영화 
10,감동적이였음ㅜㅜ 고질라가 착한괴물로 나오는데 굳이 죽여야만했나... 몸뚱이가 크니까 쓰나미는 어쩔수없는데 작가 너무해... 
9,잔인한 영화보다는 좋네요 
10,7점대는 될만한 것 같은데 평점이 너무 낮아서 10점준다. 
3,트랜트포머는 볼거리라도 많지... 
2,뭐같이 재미없음 괜한 시간낭비 마시고 딴영화 추천드립니다 
9,"일본 고질라 시리즈를 본 세대라면, 미국 극징판 고질라 첫판이 정말 이질적이고 형편없음을 알것이다.하지만 고질라 2014는 원작의 회귀라고 할정도로 충실하려했고, 역시 고질라는 괴수 대 괴수의 대결이 정답이다. 반갑..."
5,영화 보다가 접은건 개오랜만이네ㅎㅎ 
1,CG의 어설픈 것을 감추기 위해 캄캄한 밤장면만 나오는 영화. 영화내내 엄청나게 졸립다. 
10,지구용사 고질라!!인간따위는 들러리일뿐 
8,오홍~고질라 팬댔음~ 
3,괴수영화팬들은 재밌을지 몰라도 일반인들은 글쎄.. 
3,"무토는 조연, 고질라는 까메오... "
1,"""내친구 코모도""로 제목바꿔라! "
8,극장에서 봤었는데 재미있게봤다 
3,어제저녁에 올레티비 결제하고 후기올립니다진심으로...고질라1은 정말 재미있게 봤는데2014고질라는 기대이하네여지루하고 따분하고평점낮은 이유가 공감되네여 
7,"어마어마한 그래픽은 물론, 더욱 재밌고 탄탄해진 스토리까지. 뉴 고질라 2014! "
8,"지루하지않고.뭐 어렸을때 본거랑 좀 틀린감이 있어서..그래도 재미는 있었다. Godzilla,  이게 명작이긴 하지..1998년 고질라 "
7,그냥 저냥 볼만함... 
8,그럭저럭ㅍ퓨ㅠㅠㅠㅜ 
8,앞에는재밌지만 뒤로갈수록 조금 실망함 
8,내용은없지만조금볼만하네여 
5,"미국군인,고질라 - 미일동맹 / 핵폰탄먹는 괴물들 날 개달린 숫놈 러시아 덩치큰암놈 중국 - 러중동맹 이라고 생 각하고 보시면될것같아요 아이맥스 꽤 재밌었어요~^^ "
6,"실제로 고질라의 전신이 나오는 장면은 기대보다 실망입니다. 장난감 공룡이 왔다갔다 하는 느낌. 영화의 마지막도 별로 였고요. 전 보고 웃었습니다. 오히려 영화의 초반부가 더 집중력있고, 흥미로웠는데요, 그래도 극장에..."
10,고질라경장히멋있네요ㅋㅋㅋㅋ훈질라 
9,개쩜 고질라 짱짱맨 다들 돈니ㅣ고 봐라 
4,디워 ≒ 고질라 . 그나마 고질라가 낫다면 CG가 볼만 하단거 
10,재미있고 재난이란 참무섭네요 
8,3D로 관람   별로일거라 생각했는데 좋았음  긴장감도 좋았고 CG도 좋았고     사실 엑스맨보다  더 괜찮았음 
9,원작에 충실한 볼만한 영화입니다. 
9,괴수영화라기 보다는 재난영화에 가깝다.난 재밌게 봤다 특히 cg와 함께 영상미는 굿!!! 
10,인간이 자연앞에 무력하다는것 간접적으로 알려준 영화 재미있었음 ㅋㅋ 시리즈대로 더 나왔을면 바램. 
5,"옆에 가족4명이와서 영화본분들을보고 스스로 위로합니다. 나는 그래도 9,000원만 지불했다고... "
4,여주인공이 이쁨! 영화는별로 ㅠ 
6,솔직히 몇달전부터 기대한 영화인데 나에게 똥을줬음ㅡㅡ진심 본다고하는사람 싸대기때려서 말리고싶다 
9,올해  최고의 영화입니다돈이 안아까워요  최고의 영화 
10,최근에 본 영화중 가장 핫한영화.그냥 막부수고 부서지는 생각없이 화면에 몰입하여 즐길수 있는 오락영화. 
4,오랜만에 아들과 본 영화였는데~~엑스맨볼껄 
5,별로에요..특히 마지막에 도시를 구한 고질라? ....어이ㅠㅠ 
6,[극장] 중반 이후 지루했음. 
4,스토리가 너무 지루하고 긴장감도 없었다 
10,중반이후부터는잼남 솔직히 7점대 후반평점은 되야하는데 평점 너무낮아서 10점드림 내평점은8 
10,재미잇어요 고질라 넘귀여워 
8,고래싸움에 새우등 터지는 영화... 제가 생각하기에는 고질라가 영웅은 아닌거 같습니다. 우리의 친구도 아니고 적도 아니고 그냥 그 이상 그 이하도 아닌듯... 
9,고질라부활에성공하다 
10,대박이네 우리나라는 언제쯤 ㅋ 
4,"원작을 모르는 사람이 보면 낚인 기분, 내가 그렇다. '고질라' 보단 '무토'를 보고온 기분, 심지어 재미없었다 "
10,"히어로물에 하도 익숙해져있어서 초중반이 좀 지루할 수도 있겠지만 개꿀잼, 대사가 거의 없어지는 후반부가 압권 "
9,귀요미 고질라ㅎ 재밌었어요ㅎㅎㅎ 
2,너무기대하시면아니아니아니되요 
6,끝이....너무...허무한가?!^^;; 
5,98년에나온 고질라가 차라리 더 볼만하더군요 이건 그냥 예고편만 좋은 영화! 
