score,review
7,뉴욕은 어벤져스가 지키고 샌프란시스코는 고질라가 지키네 
10,나만 돈주고 볼순없다!! 
8,고질라는 우리의 친구였군요 
10,방금 조조로 본 관람객입니다. 우선 이 영화에는 흔히 괴수 영화에서 등장하는 '미국 짱짱맨'이 없습니다. 공격은 커녕 계속 무토한테 털리는것밖에 없죠.이건 괴수 영화라기보다는 인간이 자연 앞에 얼마나 ...
10,괴수영화는 이래야 제맛이지 예고편에 속지말자 
8,고질라가 박쥐 두마리 씹어먹고 세계를 구하는 이야기. 
5,이거 예고편 만든사람 상 줘야될듯 
5,고질라가 정성스레~ 가꾸고 보살피던 개미마을에 바퀴벌레 한마리가 들어와~ 우리들의 친구 고질라가 매우 화가났어욤~ 뿌우!! 
10,고질라 ㄹㅇ 상남자;; 
10,괴수 나오는 영화에 뭔 내용을 바라는지 이해를 못하겠네. 무슨 무거운 메시지가 담아 있길 바랬나?? 거대한 괴수들의 싸움 스케일 크고 킬링 타임용으로 제격별점테러 때문에 10점줌ㅋㅋ 고질라 푸른불꽃 존멋 
7,기대보다 실망했지만 좋은 시도들이 보였다. 전개가 좀 아쉬웠다 
8,"곰질라 성님 방사능 브레스 뿜을땐 전율이! 눈빛연기를 보여줄땐 ""무토 처리하러 횽이 간다!""라는 느낌이었다. "
7,CG 굿원래 이런 영화는 스토리 따위 신경쓰지 않고 보는거다고질라가 무토 입 부여잡고 브레스 쏠때 ㅎㄷㄷ 했음.. 
6,뮤토의 짝짓기를 방해하는 고질라가 영웅이 되는 솔로천국 커플지옥을 제대로 보여준 안티로맨스영화 
6,크아앙 투명 고질라가 울부지져따. 고질라는 매우 쎄고 강력해서 아무도 쓰러트릴수업따 
10,진짜 우리나라 수준봐;;; 보지도 않고 미친듯이 1점만다는거봐 감상문쓰라하면 한글자도 못쓸놈들이;;; 
9,마지막 고질라 키스씬은 내생에 가장 열정적이고 뜨거운 키스씬. 
9,고래싸움에 새우등 터진다 
7,커플vs솔로  인생은 독고다이 
10,모르는사람들이 많은것같은데... 고질라는 인간편이 아닙니다. 지구의편이지요. 그증거로 고질라는 뮤토랑싸울때 인간의안위따위는 별신경쓰지도않고 인간이만들어놓은걸 무진장많이뿌숩니다. 인간을지켜주는 괴수히어로라는 건 아주 ...
7,볼만하지만 약간 지루했습니다 
9,스케일이 크고 흥미진진하다.마지막 뉴스속보 엔딩만 빼고 
7,"한줄요약 : 고질라, 그는 착했습니다. 끝. "
9,완잼 남자라면 고질라지 
10,입벌려 ssibal아 불들어간다 
8,예 볼만했다 세리자와박사가 하는일 없이 심각한 표정짓기만 하는게 좀 별로 
8,"지금 역린,표적,인간중독 알바들이 열심히 평점깎고 있는중 "
10,역린 보느니 이거 봐라 비교가 안된다 
10,보통 예고편은 과대포장이라면 이 영화는 과소포장 
9,도데체 아무이유없이 졸았다~ 돈주기아깝다하면서 1점주고 평점깎는건뭐지 개인차가 있다고쳐도 아무리봐도 1점수준의영화는아니다. 
9,"우리 알던 괴수 영화가 아닌, 괴수히어로(?)물. 포스터에 속지 마라. "
7,이 멍청한 것들아 제작자가 입아프게 얘길했잔냐...이 영화는 묵시록적 성향이 강하다고..근데 이 영화에서 퍼시픽림이나 98년도 고질라를 비교하는 꼴통색히들은 뭐냐 
10,볼줄 아는 사람만 재밌게 보는 영화. 우주전쟁 결말 반응 생각하면 된다 
10,핵폭탄 먹는 괴물 얘기는 듣도보도 못했지만 그래도 참치나 처먹는 이구아나 영화보다는 백배천배 낫구만요. 고무옷 입고 뛰는  일본산 원조 고지라보다 더 괜찮으려나 ㅎㅎㅎ 
5,"화면 멋지고 연기 좋은데 유치한건 어쩔 수 없다.. 마지막 장면 여자박사? 표정부터 해서 오글오글 ㅋㅋ 그런거 즐길 수 있다면 오오 하면서 볼 수 있긴함, 지인 왈 : 졸라 잘 만든 파워레인져 같았어..;; "
9,예전에 영화로 나왔던 고질라와는 달리이번에는 우리의 친구 고질라생긴것도 순해졌어 ㅋㅋㅋ 
5,굉장히 강력한 슈퍼 괴물 조연 고질라 뭔가 감질맛 나게 싸울려고 할때마다 사람들 얘기 나오고 결국 후반부에 고질라랑 박쥐 커플 신나게 싸움; 2시간 영화에서 고질라 및 박쥐부부 등장씬은 한 20분 될려나; 
10,나만 당할순없다ㅋㅋㅋㅋ 
8,평점이 안좋을 수 밖에 없다. 관객들은 괴수들이 뻥뻥 싸우는걸 기대했을테니. 하지만 의도적으로 압도적인 스케일 아래에서 무력한 인간의 입장에서 바라보도록 해놓은 편집이 마음에 든다. 그게 괴수영화다. 마지막에 ...
10,괴수영화에 목몰랐던분들 추천합니다.이영화를 보고나니 인간은 나약한존재라는걸 깨닫게되네여. 
8,고질라 토실토실 귀여움ㅎ마지막에 이구역의 대가리는 나다!  이느낌? 
5,알고보니 고질라는 히어로물이었다 
7,고질라 끼여엉!!! 고질라 끼여엉!!! 
8,고질라 너무 귀여워 ㅋㅋ  나만그런가으리도잇음! ㅋㅋㅋ 
5,"군더더기들이 주제인 척 하는 영화.재난영화, 묵시록이라 하기엔 비극과 고통이 전혀 느껴지지 않고괴수영화, 오락영화라고 하기엔 지루하다.에일리언,다크나이트 등의 세기말적 블록버스터를 만들고 싶었던 거 같은데 그건 그냥..."
1,번식을 위해 힘쓰다가 속수무책으로 파이어브레스를 받고 죽은 무토가 불쌍하다. 고질라가 나중에 바다로 들어가면서 엄지손가락을 치켜들며 I'll be back이라고 외쳤으면 기립박수를 쳤을텐데. 기왕 12세 관람...
5,드디어 싸우나 했더니 TV행 ㅋㅋㅋ 
6,일본산 고질라 원작을 좋아하는 팬들에겐 호응 받고 유치하다고 까는 분들께는 불만을 들을 영화일 수도 있지만 비중없이 질질끄는 지루한 부분이 적은 가족용 오락 영화로서 썩 나쁜 영화는 아니라고 생각합니다 다만 3D는 ...
9,"이 영화는 괴수들끼리 싸우는 것보단 재난영화가 맞음. 러닝타임내내 주로 고질라와 괴수들의 충돌보단 왜 어떻게 스토리가 흘러가고 결론지어져가는지를 보는게 중요하며 그래픽, 스토리가 매우 훌륭하다. 트랜스포머, 2012..."
10,난 정말 재밋게 잘봣다. 전범기니 뭐니 돈주기 아깝따느니 난 재밋었다. 
10,완전 재밌게 보고왔는데 생각보다 평점이 낮네요ㅜㅜ볼거리도 많고 오글거리는 억지감동같은거도 없고 짱짱!! 고질라귀엽당 
10,진짜 볼만한데 경쟁 국산영화사에서 알바풀었나? 보지도 않고 별점테러하는 것들은 대체 뭐래? 
8,재미따 근데 볼거리만 많은 영화! 고질라가 악역이아니였다니...ㅋㅋㅋ 
9,"아쉽게도 극장에서 보지 못하고 오늘에서야 봤는데 최근에 본 영화중 가장 나은거같네, 극장에서 안본게 아쉽군 극장에서 본 쓰레기영화들보다 훨씬 나은영화 "
10,스케일 굳 괴물의 탈을 쓴 히어로 영화 
8,싸움장면이 별로 없어서 아쉽..극적인 분위기는 괴물들간의 싸움으로 인한 주변피해로 끝... 옛날 영화들과의 패턴이 비슷함. 허나 배경이라던지 방사능이 먹이라는 것에 가산점을 줌. 나쁘지만은 않았음 
7,재밋는데 후반에 졸림 ㅎ 
6,디워의 추억. 물론 디워가 딸리긴 한다. 
6,고질라 무토 격투씬이 많았으면 좋겠는데ㅋㅋ스토리 상에서도 좀 아쉬움이 있긴 하고 근데 그래픽에서 위압감이 느껴지는 고질라의 크기ㅋㅋ 
9,괴수물에서 괴수가 압도적으로 잘뽑혔으면 8할은 끝난거라 생각함ㅋㅋ 
8,액션은좋으나전갸되는이야기가급하고빠르며이해도가좀부족햇다 
6,그냥 내용없고 cg보러감 
7,오프닝 죽임 중반부 케지루 후반부 고질라 도시를 구하다 이 자막 빼면 볼만함 
10,솔로족 고질라가 커플족 무토 말살하는 착한 이야기??? 
7,스토리의 유치함을 잊게하는 고질라의 사이즈와 볼거리 
8,인간이 개미굴 앞에서 치고받고 싸우면 저런 느낌일까? 지구의 주인은 인간이 아닐수도 
10,고질라 핵브레쓰 나오는거보고 감동 먹었다 ㅠㅠ 
8,세상에... 고질라를 네셔널 지오그라피 스타일로 찍었어... 
8,기대했던 대로 스케일은 압도적 스토리전개는 조금 아쉽지만 고질라가 압도하여 커버함. 뮤토와 고질라싸움에 도시는 풍비박산 
10,미국짱짱맨을 버린 영화 미군 완전 개털림 
10,전 할리우드의 고질라보다 훨씬 나은모습을 보여줘서 보는내내 즐거웠습니다. 뭣보다 그때는 전혀살리지 않았던 고질라의 원래 요소들을 살려준것이 너무 좋았어요 
10,미국 짱짱맨이  안 나온것만으로도  만족 
4,생각했던것보다 너무 유치찬란했네요. 
10,헐리우드 그래픽으로 만든 50년대스토리 스케일과 그래픽을 따라오지 못하는 스토리 전개 
7,"개인적으로는 트랜스포머,어벤져스,아이언맨같은 먼가 밝은히어로 영화 별로 안좋아하고 퍼시픽림같은 영화를 좋아하는데 고질라가 그런분위가가 나서 좋긴한데..긴장감 넘치던 초중반에 비해 후반이 좀.. 고질라가 영웅이라니 ㅋ..."
5,고질라를 많이 보지못하여 아주 아쉬움 ㅠ 
10,"미국은 이제 어느 나라도 못 건드리는 국가가 됐네요. 어벤저스영웅, 고질라까지 합세했으니 군대가 따로 필요 없을 듯~!! "
6, 스토리를 조금만 더 탄탄하게 만들었으면 훨씬 재미가 있었을 텐데의 아쉬움. 하지만 괴수들끼리 싸우는 것은 그나마 볼만했고 브레스 파이어에서 조금 웃겼다. 
7,정의의 괴수 고질라찡ㅠㅠ 나름 볼만한 킬링타임으로 적절한 영화다 퍼시픽림급 정도는 된다 최근 영화랑 비교하자면 스파이더맨보다 낫고 캡아보단 낮은 정도? 
7,중간까진 볼만한데 아쉬움...전투신도 생각보다 없고...그냥 한...6천원정도 적당할듯 ㅋ 
9,"토실토실 귀엽네요 ㅎ, 마지막 장면에서 뒷태가 아주 ㅋㅋ "
9,커플은 솔로가 찢어야 제맛 
10,영화도 잼있고 가렛 에드워즈 연출력 괜찮네요 기대되는감독 
5,사회 풍자 영화임 . 무자비한 핵발전 원자력 발전이 무토라는 괴수를 만들어낸거고 선오브갓 신이 고질라를 보내 인간에게 기회를 한번 더 준거임...인간이 자연신 앞에 얼마나ㅇ무력한 존재인지 깨닫고 지속가능하고 안전한 ...
10,카직스2마리와 레넥톤이 싸우면 레넥톤이 이긴다 레넥짱짱맨 
8,에머리히의 고질라를 드디어 뛰어넘다! 
5,지금emp한방먹고옴... 
10,이 영화촤근tv로봣는데 망한이유알겟다 배경이거의 밤이고 너무 캄캄해 전혀 물체구분이 안감배경은 밤이래도 고질라나 다른괴물 사람들 형태는 잘 보이게끔해야 하는데 온통캄캄해 물체구분이없음 1998년 나온 고잘라가 훨씬 ...
7,정체가뭐지 고질라는 ㅋㅋㅋ 
6,심형래의 용가리? 디워? 느낌나는 영화였음. 고질라는 우리의 영웅이였고...엄청난 능력의 소유자였음... 
7,인간보다 괴수에 집중하는게 좋지 않았을까 
10,엤 추억으로 10점 드립니다 
10,재난영화인줄 알고 봣더니 완전 트랜스포머급 SF영화다..트랜스포머 이상이다.. 
10,평점이 왜 이따구지 ㅋㅋㅋㅋ 이 정도면 수작 아닌가? 고질라와 무토라는 두 괴수 앞에 무력한 인간들의 모습들을 정말 잘 표현했는데...최소 8점 이상은 먹어야 되는 영화라고 생각함. 
7,고질라가 나쁜놈인줄 알았는데....ㅋㅋ 자연지키미 
8,"내용 모르고 봤는데, 솔로 고질라가 괘씸한 커플 몬스터들을 퇴치하려는 스토리였군요. "
10,"좋았어요 나름, 느낌있었어요 "
7,아무생각없이보세요^^ 
7,초반에는 흥미진진했으나 중후반부터 질질 끄는 감이 있는 듯 싶네요.. 
7,최소한 괴수영화를 보고 느끼고 싶었던 욕구는 제대로 해소! 
5,"스케일이 좀 더 커졌다뿐, 안이하고 전형적인 괴수영화에 머무른다 "
10,새로운 스타일의 격투영화 
6,일반관람객은 보다가 뭐지...?어리둥절 할수있는 영화 하지만 매니아들에겐 전율이 올수있는 영화전 매니아편에 손을 들었으므로 6점 주겠음 
10,대한민국에서는 절대 못만들 영화다.  1점주는 년들아 
8,퍼시픽림에서 보였던 오글을 뺐다. 그걸로 만족. 
10,개 꿀잼 꼭한번 봐야함. 
7,고질라 싸우는 장면에서 화면들이 왜 이렇케 어두워요? 많이 아쉬움.. 
10,디워보다 훨씬 잼있음ㄹㅇ 
10,아이들이 재미있다고 하네요 
10,괴수물에서 뭘 기대한거야? 이정도면 잘뽑은건데 
10,"단순히 스케일만 기대하고 갔는데 생각거리가 많은 영화다 단순 괴수영화, 재난영화가 아니다 "
8,옛날 어릴때 봤었던 '가메라'라는 영화가 보는순간 생각남; 옛날 2000년대의 고질라 리메이크가 아닌 1960년대 영화를 리메이크한거라니... 그래도 무토덕분에 재밌게는 본듯... 원래 괴물영화를 좋아...
5,거대한것만 보고싶으면 강추! 더 많은걸 보고 싶으면 비추! 
9,아 .고질라가 영웅이구나 ㅋㅋㅋ 
5,나의 생각 뭐 어쩌라고 -ㅁ-;결국 다시 무토 나타날겨? 2탄 만들거임?고질라랑 교감했누? 
10,이런 괴수영화는 앞으로 마이클베이한테 맡겼음 좋겠다 
8,이거보러가자고 애들 설득해서 갔는디 애들이 나보고 조질라 라고함 ㄷㄷ 난 잼있엇는디 쩝 
4,98년 개봉한 고질라가 훨씬 잼있음.. 처음부터 끝까지 지루하다.. 
1,"고질라는 시작하고 40분넘어서야 등껍질만 보여주고. 배우들은 시종일관 놀란표정에, 허접한 cg감추느라 낮에는 인간들얘기, 밤에 괴수들 출연, 그리고 사람 놀리나 밤에 껌껌하게 보여주고 뉴스로 간접적으로보여주고 망원경..."
9,"간만에 재밌게봄, 평점 1점대는 뭐냐??? "
1,음..별로임 좀 뻔함ㅋ 
1,그냥 애들영화 그이상 그이하도 아님 괜히 예고편처럼 혹은 클로버필드 생각하고 가시면 개실망하실꺼임 
1,"그냥 개빡치는영화,,,,; 내 2시간을 날려버리고 영화관에서 처음으로 나가고싶다는 생각을 하게해준 영화 내가 왜 봤을까 예고편에 속지말자라는 큰교훈을 준 영화 "
4,"스토리도 별로고 편집을 너무 많이 해서 그런지 개연성도 떨어지고, 메시지도 애매하고 약했다. 히로시마원폭이 괴물 죽이기 위해서라는 암시도 나오지만 의미성도 이해하기 힘들다. 잔잔한 괴물영화. 예술영화인줄.... "
1,노잼진심ㅡㅡ;;;; 
1,실망한영화다. 평점도그렇지만 봤는데 그닥 트랜센던스가 더 재밌는듯.. 사람들나름 취향이겠지만 
1,흠... 초반시작할떄는 흥미 진진 하겠구나 했는데 ..가면갈수록 지루해지고 잠이와요 ..옆자리 제친구는 고질라 소리지를떄마다 잠에서 깼어요 ...조조로 봣지만 너무 아깝다는 생각이.. 
2,보다가 나옴 보다가 나옴 보다가 나옴 
10,감독이 '몬스터즈'  만든 감독이네. 몬스터즈는 미스트 이후로 가장 재밌게 본 괴수영화였는데 역시 이 작품도 꽤 괜찮았다. 일본판 오리지널을 훼손시키지 않고 미국버전으로 잘 만든듯. 괴수영화로써 만족스...
7,괴수싸움에 인간은 끼어들지 말것 
9,용가리와 내용도 비슷하며 먼가다른...ㅋ  아이맥스로 보고싶었는데 조기종영된게  아쉬울따름... 
8,원작에 대한 충실하고 섬세한 해석. 
9,밸런스파괴영화네  애꿎은 인간만 죽어ㅋ 
7,껄껄 괴수영화에 너무 스토리를 기대하는것도 그렇지만 초반의 그 긴장감 그대로 이어가지 쩝 ㅋ 
10,이 영화는 전설적(legendary)입니다 
7,재밌게잘봣어요ㅎㅎㅎ 
5,오동통통 고질라 ㅋㅋ 착한 친구였음 ㅋㅋ 
7,바퀴벌레랑 싸우는 둘리 
10,고질라는 슈퍼히어로~~~이번에 개봉된 엑스맨보다 고질라가 훨씬 재밌네요 ㅎㅎ 
10,고질라의 사랑과 정의 으리. 
10,볼만했어요.CG도 괜첞고 엘르가 예뻤거든요. 
10,고질라가 솔로들의 마음을 대표하는거 같았어 존나 무토커플이 핵미사일 키스 할때 그때 나와서 포효한번 하고 살! 
6,생각보다 스토리전개가 뻔하고 어수선함 주인공의 임팩트가 떨어졌음ㅋㅋ. 하지만 스릴러는 나름 갠찬은것같네요ㅋㅋ. 고질라 이제 어벤져스 함류하나?? 
10,야 이 양반들아 그래도 볼만해 
7,아 훌륭하다... 괴수 영화에 이런 엄청난 연출을 볼줄은 몰랐다. 예술이다 이건... 감독 천재다. 어느 변신로봇영화마냥 미국 짱짱이 아니다. 우수수 떨어지는 전투기에서 예전 스필버그의 우주전쟁이 떠올랐다. 자연앞에...
8,착한 고질라?지구를 지키려 돌아온거였군. 
10,평점이 6점대는 아닌듯... 은근히 볼만한 작품이고 작품이 내포하는 의미도 있어서 7점대는 되는영화... 전범이 어쩌고 깎아내리지 말고 제대로된 평점을 주자. 
10,이정도 평점은 아니다 적어도 8점이상은 충분히 한다. 
9,"고질라만 기대한다면 9점, 영화의 완성도를 기대한다면 4.5 "
5,내가 알던 고질라의 본질은 어디갔지만..ㅎ긴 시간이지만 나름 볼만합니다. 
7,그냥저냥 볼만해요~~~ 
2,이것도영화라고처만들엇냐 
1,무슨 야맹증 테스트 영화인줄 뭐가 보여야지 
1,진짜 재미없었습니다. 영화관 가서 볼라했었는데 갔었으면 큰일날뻔했네요.. 개실망 .. 고질라는 별로 비중없고 이상한  나방 두마리한테 만 비중을 뒀음 .. 소리만 꽥꽥질러대고 ;; 
10,짱짱짱!!!스릴스릴 스릴넘쳐요~!! 
10,재밌음ㅎ보러가세요좋습니다 
10,젠장 내 돈만 날릴 수 없지 
9,재및던데 제작비 많이들었겠다는 생각이 들더라. 
9,무토가 너무 허무하게 죽었음.. 고질라 첨엔 나쁜얘인줄 알았는데 알고보니 착한얘ㅋㅋ 
8,역시 솔로가 커플보다 강하네요 
1,알바들인지 아님 바보들인지.. 이런걸 영화라고..투디영화를 CG작업해서 3D인냥 사기친 영화.아이들은 자고..ㅡㅡ 나는 열받고!!! 
1,"엄마랑동생이랑 보러감.. 기대안하고 봤는데 이건 뭐 심형래 디워를 능가하는 영화,,20분봤는데 너무지루해서 죽는줄 계속지루하고 재미없고 내가 살다살다 영화보다가 졸린건 처음임 보는데 돈아깝고 CG티 마니나고.. 영화..."
1,고질라2 만들면 죽여버린다 
1,한심스러운 영화입니다 
1,시대의 졸작. 절대 보지마세요. 지금 이 영화때문에 잠이 안올 것 같네요. 분해서. 
1,평점은무슨전범기영화 
4,"난 글쎄... 초반에 너무 지루해서 자다  친구 전화 받고 걍 나옴... 뭐라 단정짓기 힘들지만.. 암튼, 흔히 망한 영화의 한 편이 될 거 같음. 관객이 동화되어 보기엔 뭔가 부실해 보임, "
1,소문난잔치에 먹을게없네요.. 후반부가아쉬워요... 다들 기진맥진 
1,진짜 영화보다가 아그냥 나갈까 빨리끝나길바란영화는첨이다 진짜 3류영화의끝이다 하품10번이상하게된다 무조건 스토리엉망진창에 뭘이야기하고싶은거야 댓글알바에속지말고 여자친구지루해서 화나게만들지마라 진짜보지마라 진짜다 
1,"왜 자꾸 댓글 지우지 ,,,쪽발국 알바풀엇나?? "
1,그냥 보지 마세요! 진짜 완전 쓰 레 기 입 니다. 진짜 진짜 믿어요 진짜. 1년에 20편은 보는데 진짜 와... 이정도 영화 흔하지 않아요 
2,개그하냐? 이걸 보느니 인간중독을 보지...용가라와 다른게 뭐냐? ㅋㅋ 
2,퍼시픽림 하위호환입니다. 
1,고질라가 그렇게 귀가 찢어지도록 소리를 질러 대는 대도 잠이 온다. 인물들은 매우 수동적이며 주된 스토리에 아무런 영향도 없는 그저 관람객이 됐고 고질라를 어떻게 보고있는지 (두려움의 대상인지 뭔지) 끝나거 나서야 ...
3,"전범기를 떠나서 ㅈㄴ 유치하고 오글거린다.도시박살내고 ""고질라  도시를 구하다ㅡㅡ""  아 내돈 "
1,"아 너무 기대햇나봅니다,, 휴먼드라마에 가까운 영화, 고질라는 불과 십분나오나요? ㅋㅋ 영화제목을 차라리 모토로 하지그랫나요,,하긴 모토도 얼마안나오네요,,액션 화려한 CG기대하시는 분들은 실망크실듯1998년작 더 ..."
1,영화관에서 보기에 돈아깝다 
8,등장이 많지 않아도 제대로 구현한 괴수의 위엄 
10,일본판 신고질라보고 미국판고질라 봣다 눈이정화되는구나;;;  닥치고 괴수들 싸움에 인간찌끄레기좀 끼어들지마라 
9,밝은 곳에서 이 영화를 보면 영화의 절반 이상이 보이지않는 마법. 
10,방사능 염장 커플 무토를 무찌르는 무적 솔로 고질라의 치열한 사투! 
10,쏠로는 강하다  벌레커플도 용서할수없지 
7,인간은 언제나 스스로를 자연의 주인이라 착각하지. 
9,현실로 끌어다놓은 동심 
10,난 재밌었다고 생각함 . 하지만 약간 유치한면은 그정도는 고질라에 대한 미덕이라고봄 
6,엄청난 괴수들의 파괴력. 
7,크아아앙 나는 킹왕 짱 쎄다 라는 환청이 들린 듯 했다 
9,다같이 봅시다^^ 진짜 내인생 최*의 영화 
8,고질라 옛날부터 봐왓지만 ㅋㅋㅋ 재밋네요 
10,우왕굳쩔어요쩧어ㅋㅋㅋ 
10,더이상의 자세한설명은 생략합니다지금바로 보세요 
5,샌프란시스코에 닥친 재난과도 같은 영화 
8,90년대 고질라 영화보다 훨씬 나은것 같습니다발전한 특수효과에 스토리도 적당했던 것 같아다른 분들께도 추천드립니다 
10,퀵실버랑 스칼렛 위치 둘 다 나오네ㅋ 
1,살면서 영화보다가 잔게 처음입니다스토리도 없고 그렇다고 액션이 화려한것도 아니고그냥 보이는거 다 때려부수네요그리고 정말 어마무지하게 유치합니다3d로봤는데 그냥 만원을 땅에던지고 아무것도 안하면서 사람들 구경하는게 더...
6,고질라보다 비둘기가 더무서웠어 
1,샵노잼 체르노잼. 하지만 괴수만큼은 인정 
8,스토리는 이해좀..근데액션장면이랑 시지는 굿 
1,후반에 좀 그랬음.... 
5,완젼 괴물싸움.ㅡㅡ컹 
10,하체비만 몬스터 원작과 똑같은 생김새 
10,아이들과 재밌게 봤습니다~ 
2,억지로 짜여진 시나리오.... 기대하고 봤는데 이정도 밖에 안되나 실망했습니다 
3,조조에 카드할인받고 딱3천원짜리영화. 
1,무엇을 상상하던 그 이하를 맛볼 것이다 
3,제목이 말한다. 이 영화 곧 질라. 
6,고질라 1편보다 더 지루함내용없고 쓸데없이 긴 영화처음으로 영화보다 졸았당 ㅠㅠ 
4,답답하다 어두워서 보이질않아.. 고질라랑 곤충같은 괴수랑 맞짱뜨는 장면은 소리만 들리는 수준.. 
2,재미 전개 반전 모든걸 다떠나서 뭐가 보여야 평점을주지이렇게 어둡게 촬영해놓고 제작사 지들만보고 이해하려고 영화찍은건지..? 아무것도안보인다 고질라입에서 불쏘는 두장면빼고 뭐가 괴수고 뭐가건물인지조차 분간힘들다. 2...
8,재밌다. 너무너무 재밋다 꼭 보시길 
10,고질라 킹왕짱 멋있음!!!애완으로 삼고싶음ㅡㅡ... 
1,아 나 백터맨인줄고질라 입에서 용나가는 순간 영화관에서 빵 터졌네 
1,하.... 중간까진 괜찮았다.. cg도 볼만했고.. 근데 결론은 참.. 뭔 고질라가 불뿜고 누구는 이걸 에네르기파?라고 하더라;; 아 개어이없는 영화. 마지막에 고질라가 도시를 구했데...고질라가 영웅이냐 나만 돈내...
9,기존 고질라는 잊어라이제는 God(갓) 질라라고 불러다오 
1,우리 집 강아지 두 마리가 뛰어 노는게 더 재미있다 
1,그냥 돈아끼고 집에서 갓질라나 보자.. 
1,고질라는 우리에 영웅??아놔~저까라그래~ 
9,괴수영화...뭘기대하심?  꼭 imax 3d로 보세요...몰입감 죽이고....최근 본 영화중 제일 재밌음...내용은 만화수준이나...긴장감 높네요~ 
1,뭐 용가리야? 우리들의 구세주 고질라라니 
1,재미 좃아 없음...그냥 일본 광고를 위한 영화.. 
1,"일단 이영화, 고질라가 그닥 많이 등장하지 않는다.초반에 감정이입되지 않는 감정연기 후, 중후반부터 등장하는데 그닥 임팩트는 없다. 긴장감도 너무 길어져서 하나도 없고...솔직히 감독이 진짜 형편없는것같다. 최악의 ..."
1,진심 개노잼 애들이랑보셈 
1,이건 뭐 일본산 3류영화야? 완전 거지다 ㅡㅡ 
1,진짜 실망 고질라너무착하다?~~~~ 
10,별로기대안하고봤는데 재밌긔 
4,시부레 어두워서 잘 보이지도 않고 괴수 히어로 물이여 ? 
8,고질라 재밌게봤다.  볼만함 
6,역대급 뚱땡이 고질라 실화 
