score,review
6,초중반까지는 그럭저럭 볼만한데 갈수록 지루해진다. 별로 와닿지 않는 행복여행 
10,우린 다 행복할 의무가 있다. 
6,책 읽고 바로 봤다. 영화를 먼저 보았다면 재밌었을까..? 책이 더 재밌었다. 
7,결국 사랑이다. 영화가 노래가 시가 소설이 그리고 현실이 사랑에 행복이 있다고 전한다. 
8,꾸뻬가 헥터인거죠? 계속 꾸뻬가누군지생각ㅋㅋ 
6,평범하지만 새겨들어야 할 말들. 
8,"같은 시간, 같은 장소에 있어도 행복은 있기도 하고 없기도 한다. 행복은 나누는 것이라고도 하지만 본래 다분히 개인적인게 아닌가? "
7,행보이란 무엇일까.. 미래의 밝은 희망이 있어야하며 현재를 소중히 사랑하는 사람들과 즐기는것이 아닐까? 
9,현실과는 다르겠지만 그래도 공감한다.. 
8,중국여자 다시찾아가는건 없앤듯...ㅎ 
10,많은 여운을 남기는 영화 
10,행복은 사랑하는 사람과 함께하는것이다. 그게무엇이든...^^ 
8,"행복은 용기와 행운, ...자극? "
10,우린 모두 행복할 의무가 있다. 
10,행복이라는 것에 의미를 알게 해주는 영화 
10,오 기대안햇는데 잼잇다 지루하지않다 내가 좋아하는 로자먼드 파이크가 나온다 추천합니다 
10,행복해지는 영화네요~ 
10,행복한 정말 행복한 영화 
10,"지루함 없었고. 대리만족과 내게 와 닿는 부분도 있었고.. 부럽고, 어려운 영화같은 이야기 "
10,바쁘게 사는 삶에서 소소한 행복이 멀지 않게 있음을 느끼게 해주는군요 
10,기대이상 !! 최고였다.. 
8,상당한 설정 꿈꾸는 중년 
9,찜해뒀다가 오늘에야 봤네요 행복에 대해서 그리고 지금의 나의 삶에 대해서 다시 생각해보는 좋은 시간이 됐어요 
10,행복하려면 오늘을 감사하고 아직 일어나지 않은일에 너무 많이 걱정하지 말라고 어디서 본듯~~목표는 짧게 자잘한 성취감에도 행복을 느낀다면~~ 
8,"주인공의 행동과 말들이 재밌지만, 여행을 가고 나서 느낀 것이 뻔하다. 좀 더 마음에 와닿을 줄 알았다. "
9,행복은 가까이에 있다. 다만 느끼지 못할뿐 
10,보는 내내 울었네요. 행복이란 무엇인가에 대해 다시한번 생각하게 해 준 영화! 좋습니당^^! 
7,좋았어요 네이버 짱이예요 
10,영화 한줄평 잘 안남기는데 오랜만에 명작을 봤네요 행복해지고 싶은 사람은 한번쯤 보면 좋을 영화라고 생각합니다^^ 
9,사이먼 페그와 함께하여 영광이었고 행복한 여행이 되었다 
10,취향저격 영화였습니다 
8,연말에 한해를 정리하며 행복에 대해 고민해보는 좋은 시간이었다^0^ 
8,정상적인 상태가 아니얍 뭔가에 억눌리고있업;;..이건몬가욤? 이거슨 모든감정의 오로라임. 그의 내면아이는 어른이되었다. 
7,해외여행가면 고생 한다는 내용의 영화네요 
10,행복에대해 찾아가는 과정에서 나또한 행복이란 무엇일까라는 생각을 갖게되고 현재사랑하는 사랑을 떠올리게되는영화! 
10,이 영화보면 행복해지는 기분이에요 ㅋㅋ 
7,조금은 인위적이고 직접적인 그렇지만 의미있는 헥터씨의 행복 강의 
9,꾸뻬씨와 함께 행복여행한 기분? 
9,재밌다 나에대해 돌아보게하는 영화 
9,영화를 보는 내내 함께 여행하는 듯한 기분이 들게 하는 영화! 
8,좋아하던 책이 영화화되어 반가웠던 작품.  행복한 추억도 있어 개인적으로 의미가 있는 영화. 
10,영화 시작과 끝의 꾸뻬의 얼굴만 보아도 이 영화는 엄청나다 
8,진부한 스토리 but 한번쯤 볼만한 영화. 감독의 행복에 대한 의견에 대해 참고할 사람만 
10,흐뭇한영화였다... 
9,행복은    현재   살아있다는것 
8,당신은 행복이 뭐라고 생각해요? 
9,행복이란 목적을 위해 보여지는 여정이 매력적인 영화 
8,그냥..다시 한번 더 생각해보게 만드는 영화였습니다.ㅎㅎ 
9,항상 궁금해 했던 것. 이미 알고 있지만 잘 되지 않는 것. 잘 되지 않는 이유는.. 지금은 그게 더 궁금하다는 것. 
10,행복에 관한 각사람의 생각을 하나의 스토리로 재미있게 풀어낸 영화.. 꾸뻬씨의 여행이 이해되지 않는 사람도 많지만 그의 인생에 있어 그 여행이 인생을 바꾼것처럼..나도 죽기전에 그런 위미를 찾아떠나는 진정한 여행을 ...
10,행복을 찾는다면 이영화를 꼭보기를 
9,이 영화를 보고 당신은   누군가를 떠올라 행복했다면 당신은 행복한 사람입니다 
9,영화를 보기만 했는데 마음의 편안함을 찾았다!좋은 영화이다 
10,나는 행복해지고 싶다. 또한 다른 사람을 행복하게 만드는 사람이고 싶다. 
7,"사이먼 페그는 사랑스럽지만, 영화의 깊이는 글쎄 "
10,내용이 마음에 듭니다. 
9,여행을 떠나고 싶게 만드는 영화. 행복에 관한 주옥같은 글귀들은 그닥 와닿지 않았다. 
10,책도 좋고 영화도 좋다. 그것 뿐이다. 
10,"수많은 영화를 봤음에도 평점 한 번 등록 한적 없지만, 이번 영화만큼은 꼭 등록하고싶네요. 주변사람들에게 꼭 추천하고싶습니다. 이 평을 보셨다면 이 영화  꼭 봐주세요. 행복에 더 가까워질 거라 확신합니다! "
8,진하다. 마음의 깊이가 진하게 다가오는 영화! 
9,담백하고 간결하지만 잘못된 인생의 방향을 잡아줄지도 모르는 그런 영화 
7,재밌었는데..뭔가 어바웃타임같은걸 원했는뎅 그건아닌거같기도하면서 걍 잘봄 
9,영화 내용은 사실 뻔하지만 그속에서 주는 메세지는 분명하다. 행복은 현실 밖에서 찾는 것이 아니라 바로 여기에 있다는 것 
8,핵터의 행복은  그저  영화이지만 부럽다. 나도  내 행복을 찾아서 열심히 해야지 ! 
9,기대하지 않고 봤는데 의외로 괜찮았던 영화. 여러가지 자신이 처한 상황에서 각자의 행복을 누리는 사람들. 행복해보이는 줄 알았으나 뒷면은 씁쓸하고 죽다살아나니 똑같은 삶이 무지 행복할 수 있다는것 깨달은 꾸뻬씨. 책...
9,책보단 별루인데  그래도 볼만했슴 좀 있으면 우정여행도 나오겠네ㅋ 
10,즐겁게 볼만한 영화 ^^ 
9,너무 재미있네요 행복은가까이에있다는 
8,깨달음과 도전정신을 가질 수 있게 해주는.. 
10,잼낫어요 아주 유익한 영화 
8,어쩌면 뻔한 스토리일지도 모른다 하지만 여화를 보는 동안 힐링이 되고 행복에 대해서 다시금 생각해보고 각자만의 행복에 대한 생각을 한번 해주게한다 지루하지도 않으면서도 생각할 꺼리를 툭 던져주는 영화 
9,행복을 밖에서찾아보는 시간도 진정한 행복찾기에꼭 필요.매순간 곁에있는것에대해 감사하기로~~유익한 시간이었어요. 
10,행복이 지금 내가 느낄수있는 기쁨과 즐거움 그 자체 
10,"책도 재밌게 읽었고, 영화도 재밌게 봤습니다. 책도 좋아서 더 보게되고 영화도 또 보게되네요. "
10,너무 유쾌하고 한편으로 감동적인 영화! 나는 과연 행복한가 생각을 많이 해봤다. 
10,최고~~~의 영화였어용 
10,잔잔한데 재밌고 많은걸 생각하게하네요 
10,"재밌는 여행을 다녀온기분, 변화 "
10,행복을 찾는 과정이 참 재밌네요~~ ㅋㅋㅋ 불행과 슬픔 행복 이런 것들이 복합적으로 표현된 뇌의 색깔은 참 인상적이었어요. 이 영화 보길 잘했다는 생각이 듭니다! 다들 행복하세요~ 
9,행복은 가까운 곳에 있다. 
8,진부하되 정답을 알려주는 여행기: 솔직해지기. 
9,배울 점이 많은 영화입니다. 
8,행복해지는 영화네요요 
9,머리에 썻던 기계부분은 별로.. 그밖에 내용들은 모두 재미있었어요~ 
8,기분 좋아지는 엉터리 영화 
10,"가벼운 마음으로 본 영화인데, 무언가 얻어가는 느낌이 들었다. 행복해지는 방법을 알아내려고 공부하려고 한 내가 바보같아 졌다. "
10,나에게도 행복할 의무가 있단걸 알게 되었다 
9,"새해를 기분좋게 열게 된 영화, 현실이 답답한 이들에게 던지는 질문, 인생은 무한한 여행의 과정인것을, "
8,유머러스하면서도 감동적인 영화 
8,마음이 푸근해졌다좋았다 
8,굿굿! 꾸뻬씨와 여행 한 번 다녀왔더니 답답하고 어두운 내 인생이 좀 밝게 느껴지네. 
10,느끼는바가 많은 영화. 많은 좋은 영화를보았지만 꾸뻬씨의 행복여행은 평정을 줘서 보라고 말하고싶은 영화이다. 
9,재미난 에피소드와 행복에 대한 정의가 마음에 확 와닿네요 
10,오우 ~ 굿! 이런영화좋다 
10,이제부턴 웃고 살아야 겠다 
7,파랑새는 멀리있지 않다고 했지. 행복은 바로 내 옆에서 숨어 있지. 찾아라. 
9,행복은 마음먹기 다른것. 행복한 영화. 
10,바로바로 이런걸 원했다...시덥잖은걸로 심오한척만 잔뜩하면서 평점만 높은 똥같은 영화보느라 내 시간 버리는게 정말 눈물나게 아까웠거든. 
7,이정도면 잘 만들었지? 라고 과시하는 듯한 느낌이 강하게 든다. 
7,영화를 통한 행복여행~ 
7,행복을 찾아서 떠나고 싶어라 
7,애매모호한 자기소개서 읽다만 느낌이 들 수 있다 
8,행복?! 좋은 영화다. 
10,여행이 떠나지고 싶어지는 영화였어요.책도 읽어보게 되었고요./ 
9,여행이하고싶어지는영화네요..하지만꾸뻬씨의여행보단덜파란만장했으면..ㅎㅎ 
9,영화를 보고나니 마음이 참 따뜻해집니다. 
7,책의 내용을 더 닮았더라면... 
10,"돈과 권력 , 무력이 없었다면 주인공은 아무것도 생각해볼 여유 없이 죽었겠네요. 이쁘고 착한 여자가 행복준다. "
10,행복해지는 느낌입니다. ^^ 영화좋아하는 사람들은 꼭 보세요. 개인적으로 제목보고 불어 아닌가 했는데 영어라 다행이네요ㅋㅋ 
9,대부분의 사람들이 행복을 목표로 삼으면서 지금 이 순간 행복해야 한다는 사실을 잊는다는 것. 
10,최고임 진짜 개재밌어 또 보고싶네 소장가치용 100! 
9,실화에 기반 햇음에도 불구하고 영화속 스토리는 동화같음.. 무거운 주제를 보다 가볍게 동화같이 풀어냈다고나 랄까. 영화라고 꼭 심오한 주제 의식이 잇어야 하는건 아니니까 ^^. 여행 가고 싶게 만드는 한편의 동화 같...
10,몇번이고 다시 보고 싶은 힐링이 되는 영화. 
8,먼저 좋은 펜을 지니고 다녀야 한다. 그리고 영화가 끝날 때까지 의심했다. '나를 찾아서'를 먼저 본 내 탓이 크다. 
10,정말 너무 권해드리고 싶은 영화입니다. 
9,누구나 다 행복해질 의무가 있다 
9,현재를 살아가는 방법에 대한 영화. 신선하지 않은 익숙한 내용을 가지고 이야기하는 영화지만 꾸뻬씨의 여정을 통해  부담없이 소화할 수 있는 영화 
7,행복에대한 다양한 사각을 재미있게 감상하였음. 
9,행복해지는 영화. 우리는 모두 행복해야할 의무가 있다! 
10,자극적인 내용이 있는 것도 아닌데 행복에 대한 해답을 제시해 줄 것만 같아서 끝까지 집중을 안할 수가 없었던 영화. 행복에 대해 한번 생각해 볼 수 있는 좋은 계기가 된 영화 
9,행복을 찾고자 하면 내 내면의 소리부터 들어야한다는 생각이 들었던 영화 
9,너무너무 잘봤습니다. 행복의 의미에 대해 다시한번 생각하게됬어요^^ 
10,지금의 삶이 행복한지 다시 느끼게 해 주네요.. 가장 큰 행복은 나의 행복과 주위 사람들을 행복하게 해 주는 것 
10,많은 배움을 느꼈다.이런 좋은 영화를 보는것도 행복이라고 생각했다.그리고 앞으로 사소한것에도 감사하며 살다보면 행복해질거라고 생각했다. 
10,영화가 시작은 생각보다 평범했지만 갈수록 내용이 흥미진지해짐 약간 통속적인 부분도 적지않으나 여행영화로서는 상당히 교훈적인 측면이 후반부로 갈 수록 강해짐 소설이 원작이라 1부터 16까지인가 그것들의 내용이 너무 좋...
8,여러 모로 의미있는 영화. 준비가 된 사람이 즐길수있고 행복할수있다. 
8,"이미 내 곁에, 내 안에 있는 행복을 찾지 못해서 행복여행까지 떠나야 했단 말인가?영화에서처럼 우린 살아온 생활환경이 다르고, 행복의 가치관도 모두 다르다.마음이 진심으로 원하고 기뻐할 수 있는 욕망을 이루는 것이 ..."
7,유쾌한 영화 굿 굿 굿..연인과 보세요 
9,모두 행복해야 할 의무가 있다.내가 행복하고자 하면 우린 사실 언제든지 행복하게 살 수 있음을 알려주는 영화 '-' 굳! 
9,누구나 행복할  의무가 있다는 말... 권리가 아닌 의무라...삶을 다시한번 돌아보게 하네요 
10,안봤다면 한번보세요 두번보세요 걍 계속봐 
10,황당한 외계인 폴에서 엉뚱하고 다소 오타쿠적 기질을 코믹하게 그려서 참 좋은 배우라고 생각했는데、이번에 그 기대를 200% 충족 시켜 주네요 허허 기대 이상입니다。부모님과 함께 감상했는데、가족영화로도 손색이 전혀~없...
8,"영화적인 측면에 맞춰 다소 과장된 설정들이 있지만, 전반적으로 볼만하네요. 8.5점이면 딱.. "
7,아무리 돈많아도 처음보는 사람한테 여자비용지불하는사람이있을까..볼펜에 이름써갖고다니는 마약상이라니...책상에 앉아 찾은 행복여행..근데..여자는 이뻤어.뇌단층촬영은 좋은 정보 
8,대사도 장면도 괜찮았지만 스토리는 조금 아쉬워 
9,"행복에 대해서 다시한번 생각해보게 되는 계기를 제공한 영화. 무엇보다 행복이 무엇이다 규정해서 그걸 쫓기 보다는, 결국 인생에서 느껴지는 부가적인 감정이라는 부분이 공감갔던 부분. 그러나 누구나 한번쯤 상상했을 만한..."
10,요즘  행복에 대해 많은 생각을 하던 중이었는데 큰 도움이 되었습니다. 너무 좋은 영화입니다. 
10,힐링이 되는듯한 이 기분 
9,재밌는영화였습니다. 
9,사펙 얼굴보면 힐링되기때문에 내용은 이미 상관이없다 
9,좋았어요~~~~^^ 
10,보는 내내 자연스럽게 미소가 지어지는 영화...영화 자체가 행복함. 
10,최고였어요. 행복의 가치를 알았어요 
7,항상 옆에 있어주는 사람이 얼마나 소중한 사람인지를 알아야 한다. 중간중간 나오는 문구 하나하나가 와닿을줄 알았는데 별로 그렇지 못했다. 영상이 입혀진 영화보다는 나에 맞게 상상할 수 있는 책으로 읽는게 훨씬 괜찮을...
9,사람마다 행복의 기준이 다르다는 것을 알게 해준다. 물론 공감가는 것도 있다. 
10,행복에 대해 생각해볼수있었다!곁에 있는 사람에 대한 소중함을 당연시하지말길! 
10,행복... 합니다... 
7,뻔하지만 잔잔히 볼만했다. 행복을 찾아서 떠나는 여행.. 
10,나는 행복하다. 고로 존재한다. 
10,간만에 훈훈한 영화를 관람했습니다. 
9,내용이 은근괜찮았네요 여행은 어떤걸 얻게해줍니다 
9,아....너무좋다.... 
10,요즘 사람들이 한번쯤 꼭 봤으면 하는 영화 같다 
10,와 정말 같이 여행을 한듯한 기분이네요 행복을 찾는 사람이라면 꼭 봐야할 영화! 
10,모두 행복해질 의무가 있다 
8,존재하는것만으로 행복했던 어린 시절 
10,보는내내웃음짓게만들엇던영화 
9,보내 동안 나는 행복했다 .당신도 행복했으면 좋겠다.. 
8,행복은 부수적인 것이란 말을 되새겨봅니다 
10,또 보고싶다!대사가 굿! 
8,앞부분에서 좀 이해안되는 부분도 있었고 중간에 과한 설정과 전개가 아쉬웠지만 원작소설처럼 취지는 좋은 작품인듯. ^^ 재밌었어요. 
10,음...행복해요^^지금이 
9,행복은 감정이 아니라 삶에 대한 태도이다. 
10,행복은 목적이 아닌 부수적인것이다.... 정말  새겨들어야할 말인것같습니다.^^ 
10,ㅜ눈물이또르르 ㅎㅎ 모든사람은 행복할 의무가 있다!! 
8,시간 아깝진 않았어요~후반부가 아쉬워서 8점이요 
10,아무 기대없이 우연히 튼 영화에.. 폭풍감동 중~남자 주인공이 좀 멋없긴 했지만 ㅎㅎ 넘 멋진 영화네요~^^♥♥ 
10,"영화는 힐린 그 자체다. 다만 영화 제목 같다 붙인놈은  혼나야지. 원소설은 프랑스인 이지만,영화 배경은 영국이다. 꾸빼씨가 아니라 핵터라고 !!!!핵터의 행복여행 이렇게 바꿔라 영화는  정말 100점 "
8,책내용을 그대로 옮겨놓은 재미난 영화 
9,보면서 함께 행복해지는 영화 
9,Very nice very nice 
10,행복은 가까이에 있다. 
10,10점만점에 10점 드립니당소장할래요 
9,"10년전 책으로 읽었을때도 감동적이었는데.. 영화화되어 다시 만나니 감회가 새롭습니다. 나에게 주어진 시간과 주변 사람들, 그리고 일상적인 삶에 감사하게 됩니다. "
10,아아.. 정말 행복한 마음으로 봤습니다. 제 인생영화 한편 더 늘었네요 
8,보는 동안 같이 행복했어요~ 그런데 영화가 끝나니 다시 마음이 쓸쓸해져요..햇빛 받으며 낮에 운동하고 여행 다니고 여유로운 시간 보낼 땐?저도 참 행복했는데.. 요즘은 하루종일 건물 안에 갇혀쳇바퀴 돌리는 삶을 다시...
10,더 늦기전에 행복해지고 싶어졌습니다.여운이 남는 그런 영화네요~^^강추!! 
10,"훈훈한 영화, 힐링되는 영화 "
10,힐링 무비! 세계여행과 함께 행복의 나라로~ 
9,대사 한마디 한마디에도 힐링이 느껴진다 
10,정말 재미있게 봤어요 ♥? 
10,좋아요. 좋아요. 좋아요. 
10,영화보는동안 영화를 보고나서도한참 기분 좋았습니다 
9,결국 지금 이순간이 제일 행복하다는 생각. 하지만 영화처럼 한번 쯤 떠나야 알 수 있으니. 
8,하필 오늘이 생일이었어요. 그래서인지 더욱 스스로에게 질문을 던져보는 영화가 아니었나싶네요-! 
9,사이먼페그의 연기가 매력적인 영화어째 보면 뻔하다고 느낄 수도 있지만 참신한 내용이다.진정한 행복이 무엇인지 차근차근히 알아가는 과정을 보여주기에 마음에 드는 영화다. 
9,"유쾌하게 진지하게, 행복에 관해 생각하게 해주네요 "
10,마음이 충만해지는 영화. 2년 전 꾸뻬씨와 비슷한 마음으로 떠나 한달간 제주도 여행할 당시의 기억이 새록새록. 
10,사이먼페그 대갈치기 잘 봤습니다. 
9,연기 내용 모두 다 좋아요 
8,원작보다 좀  교훈적인 내용으로 바꾸었다는 느낌이 들었다.개인의 행복에 관한 이야기인데 굳이 그렇게하지 않아도 되지 않았을까하는 생각이 살짝들기도. 주인공과 캐릭터와 매치는 훌륭했다. 
10,막혀있던 나에게 길을 보여주는 영화들이 있는데 이 영화는 몇 안되는 그런 영화였다. 영화를 보는 내내 행복한 딴생각을 했다. 행복을 상상하면서 나도 모르게 코끝이 찡해졌다. 
9,매사가 행복할 수 있음을 이야기 해주는 영화인 것 같아요. 
8,공감되는 내용입니다 
9,나룰 행복하게한 올해의 강추영화 
10,많은것을 느끼고 배운 두시간... 행복!!!! 
8,영화적인 장치들이 환상적이었다. 
8,보는 내내 나도 떠나고 싶다-라는 생각이 들었던! 
9,행복의 능력 권리 의무 
8,기분 좋은 느낌이 들게 해 주는 영화였어요 ~그래도 이런 류의 영화로는 월터미티가 짱 !! ㅎㅎ 
10,행복한 영화를 보고  행복해졌다 
9,좋은 영화였습니다~ 
9,좋은 영화 입니다. 추천드립니다. 
10,아무생각없이 보러갔는데 재미있네요 나에게 행복이 무엇일까라는 생각을 해보게 됐어요 
9,재밌어요재밌어요재밌어요 
9,소소하게 재미잉ㅎ는 영화였습니다 
8,좋아요     good good 
10,생각을 하고 마음을 다독이는 시간 
9,행복해지고싶다!!! 
10,"행복은 멀리 있는것이 아니다. 다만, 그걸 깨닫기 까지는 오랜 시간이 걸린다. "
10,여운이 남는 영화였어요 
10,잘봤네요 감동적인 영화! 
8,산책하는 느낌ㅎㅎㅎㅎ 
9,스펙터클한 영화만 보고나면뿌듯한게 아닙니다! 
10,힐링영화~행복해지고싶네요 
10,핵터의 진정한 행복을 느낄수 있어서 정말 좋았던것 같습니다.그동안 저는 삶에 흥미가 사라졌었습니다. 등급에 따라서 나누어지는계급에 대해서 상당히 해이감을 느꼈습니다. 근데 이 영화를 본이후내자신이 지금은 이렇지만 자...
8,행복해지는 노력을 더 해야겠다. 귀여운 영화 
9,행복해지는 행복한 영화 
10,너무 좋았어요 행복해지는 느낌 
8,"식상하고 진부하지만 유쾌하고 따듯하다. 결국 파랑새는 멀리있는게 아니고 곁에 있다는 오래된 동화스토리지만, 바쁜 현실에서 잊고(혹은 잃고)사는건 없는지 돌이켜보게한다. "
10,능력도 권리도 아닌 의무다. 
8,대체적으로 좋았으나 너무 하고 싶은 말을 많이 전달하려는 느낌이었어요 
9,재밌어요~ 나는지금행복한 사람인가 생각도해보고 
10,행복에대해생각해보게되었습니다. 
7,좋은영화인데 저에겐 평범했어요 제겐 너무 뻔했던 영화였네요.. 
10,우연히 별기대없이 다운받아 보게됐는데~~  흔한듯하면서도 울림이있는 영화예요!!굿~!!대만족입니다! 
9,행복을 찾고 싶다면 한번쯤 봐야하는 영화! 
8,문화영화로서의 기치가 있는것으로본다 
10,행복을 찾아 떠나는 여행! 어른자아와 아이자아가 통합되는 과정~ 정말 추천하는 영화입니다. 특히 20-30대에게^^ 
8,누구나 행복할 의무가 있다는누구나 다 알지만 깨닫기 어려운 진리를 다시 한번 전해주는 영화^^다만 편집하면서 많은 여행장면이 빠진듯해서 아쉬웠다는....배우들의 연기도 좋고 중간중간 나오는 BGM도 여행지와 잘 어우...
8,좋았다. 하지만 뭔가 부족한 느낌은 지울 수가 없다. 
10,자신을 돌아볼수 있는 뜻깊은 시간^^ 
8,한번쯤 자신을 돌아볼수있는 좋은작품이네요~ 
10,책으로 먼저 봤는데 감동 적입니다. 
10,너무 감동적이고 힐링되는 영화였습니다. 
8,"유치해 보일수 있지만,  행복의 의미를 다시금 새기겨 해주는  교훈같은 영화였습니다. 워낙 배우들도 빵빵해서 결코 가볍지 않은 영화였고요. 한해 마지막 날 사랑하는 사람과 마무리를 하기엔 적절했던 영화같아요:) 좋은..."
8,마무리가 조금 아쉽긴했지만.. 전체적으로 삶에 대해서 생각을 많이 하게 해준 영화였습니다. 
9,내게 2015 첫 영화가 이 영화여서 행복하다. 
10,계속보고싶엇던건데 재밋게봤어요 추천 
8,행복은 가까이에 있는거 같네요. 
9,기대안하고 가서봤는데 재미있었고 느낀바를많게하였습니다. 
10,12/31일 한해를 마무리하면서 봤는데 정말 좋은 느낌으로 극장을 나왔네요. 
10,좋음 좋은영화임ㅎㅎㅎ 
8,부모님께서 만족스럽게 보셧다합니다 ㅎㅎ 
8,넘재밌었어요 즐거운여행과 의미있는감동 
10,영화보는내내 지루하지않았어요 2014년 한해동안본 영화 베스트 3안에들만큼 좋은영화랍니다 
10,행복은 일부러 찾는 행복보단. 무언가의 일에 집중할때 부수적으로 얻어지는 행복이 더 큰 행복으로 다가온다 
10,행복해 지는 영화 입니다 
10,남자친구와 같이 봤는데 마음속부터 영화제목 그대로 행복이 되는 영화다. 내 삶에서 행복이 무엇인지 생각해보게 하는 영화.... '여행'이라는 그 자체가 아니라 자신이 찾고자 한다면 볼 수 있는게 행복이...
10,나중에 한번 더 보고 싶다 
9,새해에 보기엔 좋은 영화 
7,가볍지도 무겁지도 않은 적당한 무게의 영화. 
8,행복에 대해 잘 표현한 작품! 하지만 중간중간? (중국의 산에서 바람불때라던지..)과한 연출이 아쉬웠음.. 그리고 너무 다양한 행복을 보여주기위해 노력한듯한 모습이 보여 다소 정보?가 많았다! 그래도 영화의 흐름을 ...
7,여행에서 마주하는 순간들이 주는 교훈이 마음에 와닿는다. 
9,책을읽고 봤는데 책의 상상력을 충족시켜줬다. 스토리의 차이가약간있었지만 오히려 영화를 풍성하고 단단하게만들어준듯하다. 행복했다 
10,대사 하나하나 외우고 싶어요 
10,행복해질 의무가 있다 . . 
7,"보통의 영화. 소설 원작을 옮겼지만 영화적 특성이 돋보이지는 않은 것 같다. 하지만 삶, 행복, 사랑 이런 주제에 대해 평소에 생각이 없었다면 괜찮은 힌트가 될지도 모르겠다. "
8,꾸뻬씨 정도만 되어도 행복할 것 같은데 행복울 탐구하러 가시다니 덕분에 간접여행 실컷^^ 
