score,review
8,자칫 지루할 수 있는 분위기임에도 뛰어난 연출력으로 몰입을 지속시킨다. 다만 감독의 의중이지만 호프만스러운 결말이 다소 아쉽다. 
8,수작입니다. 우리나라에서 흥행하긴 어렵겠지만. 
8,고요함과 스릴이 동시에 다뤄지는 멋진 영화입니다. 재미있게 잘 봤습니다. 
6,리얼리티가 살아있는 스파이 스릴러 
7,호프만을 더이상 볼수없기에 엔딩이 더 슬프고 쓸쓸하다. 
8,현실적인 스파이스릴러 액션을 원한다면 비추천. 너무 현실적으로 보여서인지 여운조차 느낄 겨를이 없다. 
8,호프만의 마지막. 그의 거친 호흡마저 그리워졌다. 
8,재밌네. 재밌다고. . 
7,처음부터 끝까지 침착하던 그들의 첩보는 마지막에 한순간에 더욱 고요하게 무너진다. 
7,길지만 의미깊게 들어가려는 내용에 한표... 근데 진짜 길다 
9,[167번째 후기] 군터에게 경의를 표한다. 대단한 연기력과 과하지 않은 리얼한 연출력에도 박수를 보낸다. 
10,이런 수작이 뭍힐뻔했다니... 진정한 스파이 영화의 냄새가 물씬 풍기네요. 제 평점은요~~ 
9,통수에 통수 그리고 기다림.. 또 기다림. 잘만든 스파이 영화 
8,첩보물이란게 이런거구나 세삼 쉽게 알게 해준 영화. 각자의 위치에서의 물고 물리는 관계설정이 흥미롭고 긴박할수 있는 첩보물에서 쉼표를 찍을수 있는 곳이 많아 안정감있고 편하게 관람. 주연급들의 연기도 눈요기. 스릴러...
10,"호프만 주관된 관점으로 영화는 끝나고 여운이 남지만, 그들이 잠재된 테러리스트 라는것은 영화 중간중간 계속나옴.'신의뜻' 아랍인들의 인권은 이미 911사건이후로 끝난것임.혼자만의 아집이 결국은 주위사람..."
8,마지막 10분의  긴장을 위해 긴 시간 기다린 보람이 있다.독일에서 독일사람이 영어만 쓰는 이상함은. 
8,재주는 곰이 부리고 댓가는 딴놈이 챙긴다. 
10,"필립 셔이모어호프만의 유작이고, 레이첼 맥아담스 등등 연기파 배우들이  스파이 스릴러 치고는 조용한 분위기의 영화이고 자칫 지루 할 수도 있었으나 집중 하게 만들었다.  리얼리즘이 살아 있는  스파이 영화~~ "
7,내용은 없지만 주제는 확실하고 끝을 흐렸지만 결말은 확실했다. 
7,연기 굿 스릴 굿 다 조은데 조금만 런닝타임을 줄였으면.. 
9,재밌어요~ 배우들도 매력있고 연기잘하고.. 
8,차분하면서도 긴장감 넘치는 명연기 
7,화려하지는 않치만 나름볼만했다 
8,재미는 없지만 기분이라도 내라고. 
8,필립 세이모어 호프만의 죽음이 더 안타까워지는 영화.. 
7,느리지만 잘 만든 작품이네.. 
8,은은하게 끝까지 보게 만드는 매력있는 영화다..  사실 확! 재미있지는 않다. 다만 좀만 보다보면 끝까지 안 볼 수 없게 된다.  고인이된 주인공 필립 세이모어와 화려한 배우들의 연기가 탁월하다.. 마지막에 아쉽네~...
10,영화도 연기도 매우 좋네요. 
10,지루할틈이 없이 긴장감 넘치는 영화. 마지막 결말은 씁쓸하다.. 
10,실적가로채기 더큰 건을 잡을 수 있는 기회를 날리는 못난 윗선새퀴들 참 직장이나 첩보세계나 똑같구만 
8,"유작까지 뛰어난 모습, 감탄과 측은함이. "
10,날카롭고 날카롭다... 
10,묵직한 작품. 시리아나와 팅커테일로가  문득 생각났다. 
9,"부조리한 세계 속 존재들이 겪는 자기부조리의 경험. 그리고 세계는 결코 그것을 극복하게 놔두지 않는다는걸 스파이물을 통해서, 인간의 불완전을 그려 완전한 연기를 만드는 호프먼을 통해서 보여준다. "
9,쓸쓸하고 정적이기 짝이 없는 스파이 영화. 그러면서도 동시에 잔혹하기 이를 데 없다. 필립세이무어호프만의 유작으로서 부족함이 없는 영화다. 
9,총격씬 하나도 없이 훌륭한 첩보영화를 만들수 있다는 것을 보여준다. 
8,지루한 감이 없잖아 있지만 배우들이 연기하는 출중한 연기력으로도 영화의 몰입도가 살아있어 극이 전개되는 긴장감을 느끼기엔 충분했던 영화였습니다. 필립 세이모어 호프만이 마지막에 절규하는 장면은 정말 소름이 돋더군요....
10,설명이 필요 없다 다시 보고픈   최고작 
8,끝난줄 알았는데 질긴생명력으로 9.12 오리cgv에서봄.  세이모어 호프만을 그리며 
7,총싸움 없고 격투신도 얼마 없지만 긴장감있음.하지만..결말이 너무 허무하네요.무얼 의미하는지도 모르겠음 
8,리얼 스파이영화를 호프먼의 연기로 본다 
9,액션없이 스파이의 감정선과 긴장감 
2,재밌다고 평점 만점 준 새끼 누구냐? 
9,이런 수작을 보면서 지루하고 재미없다는 사람들은 앞으로 영화 보지 마라. 
9,"우연하게 본 영화인데, 고인된 필립의 좋은 연기를 보았습니다. 내용은 굿~~~!! "
3,"그럴듯한 스토리를 만드는 것, 영화사나 정보기관의 핵심역할이다. "
10,애들은 봐도 이해를 못하기에 관람불가인 영화... 아... 잔상이 아주 오래남을 듯... 호프만... 
5,흥미롭지만 사실 지루하다. 화려한 액션도 총격전도 없이 극을 진행하니 인물들의 심리상태만으로 영화를 끌어가니 지루한것은 어쩔수없다. 하지만 영화자체는 좋다 
10,어째서 이런영화를 이제야 알게되었을까. 오늘부터라도 영화좀 더 OO봐야겠다. 마지막 로빈라이트가 잠깐 쳐다보는데 살짝 소름돋았다..하우스오브카드 볼때도 맘에 안들었는데...역시 영화는 배우를 보고 봐야하나보다. 
9,이게 진정 정통 스파이영화라고 생각됨 
8,"이 영화의 교훈, ""진정한 악인은 선한 모습을 한다. 정치인, 종교인, 사기꾼."" "
7,"폭탄테러범 연관자와 무고한 망명자를 국가기관이 의심대상 설정해 감시,판별해가는 과정을 메크로놈의 규칙적인 박자 처럼 천천히 연이었다. 납득되게 이어지는 쉬운 대사와 자연스러운 연기는 뻔한내용에 진지한 흡입력 줬으나,..."
8,청소년관람불가인데 10대의 평점은 제외 시키는게 맞지 않나? 
10,강추^^ 꼭 봐야할 영화 중 하나. 
8,고인의 타고난자연스런 배역소화능력만으로도 가치있는 영화. 잔인한 폭력없이도 몰입도를 유지하게 하는 첩보영화. 국가정보요원위에 세계정보요원이 존재하는 냉정한 스파이세계 단면을 보여줌.디터와의 갈등전개가 작품의 밀착도를...
8,"존 르 카레의 역작을 영화로..<팅커, 테일러, 솔저, 스파이>보다는 덜 반전이 있지만 훨씬 친절한 영화. 필립 세이모어 호프만의 마스터 같은 연기를 볼 수 있는 유작. 따뜻하다. "
8,소설로보는게 더 재밌겠다. 
10,"호프만의 영화니까, 그립다. "
5,지루하고 재미없음 ㅎㅎ 
6,지루하던데 평점 높네..  레이첼 때문에 억지로 끝까지 봤다. 
10,두 달 간 본 영화들 중 일등. 장면장면이 아름답고 음악에 따른 자연스러운 편집 덕에 몰입도가 좋았고요. 마지막 신에서 호프만 형의 연기도 너무 좋았네요. 어서 굿다운로드로 다시 천천히 보고 싶어요. 
10,"원작의 매력을 성공적으로 구현해 낸 수작. 플롯, 연기, 만듦새 모두 훌륭함. 수준높다는 말이 어울릴 몇 안 되는 작품. "
8,잔잔하지만 몰입력있는 영화 인물관계가 밝혀짐에 따라 흥미진진 
7,무겁다...스파이 세계를 적나라하게 보여준다 
8,"스파이의 세계를 잘그리고. 배신이 기본인 사람들인데, 우리는 좀 서툴고. 원작이 번역되었다네요. "
1,지루하게 지속되다 허무하게 끝이 난다. 별표 평점에 속지마라.. 대부분의 별 10개가 개봉당시 올라간거 생각하면 이건 속임수임 
1,완전 짜증?내 두시간이 너무 아깝다. 평점을 믿었던 내가 더 바보. 영화보다 짜증나는게 평점임. 사색하려면 철학책이나 보지 뭐하러 영화를  보는지. 평점잘주는 사람들의 가식이 짜증 
10,정말 짜임새 있고 플롯이 훌륭하다. 적절한 캐릭터들의 조화도 가치를 살렸다. 
10,레이첼도 나오네.. ㄷㄷ 진짜 기대 됨 
7,"스티븐 시걸의 영화처럼 안심하고 보게되는 영화, 임무, 술 담배에 집중하여 다른 생각을 할 여유가 없어보이는 주인공과 그 시간에 주인공을 옥죌 방법을 생각하는 한 무리 "
5,원작에 폐끼친 한심한 감독 
6,연기파 배우들 대거 출연 
7,나의 뮤즈 레이첼 너무 이쁘다...얼굴에 뾰루지 짜주고 싶다 
8,다 된 밥에 재가 뿌려지는 분노와 허탈 
10,얼마나 남았는지 확인할려고 마우스를 내림과 동시에 끝이 나버린 영화 
2,"좋아하는 배우라 일부러 찾아서 본건데 코드가 안맞는지,, 재미없네요 "
8,(파리행 비행기 안에서 시청함) 액션장면이 거의 없는 조용한 스릴러물. 그러나 끝까지 긴장감을 놓을수는 없었음. 특히 마지막 사인장면 숨죽이면서 봤네~~ 필립세이무어호프만의 명연기 잘봤습니다. 삼가 고인의 명복을 빕...
7,매끄러운 플롯과 압도적인 배우의 존재감. 
9,리얼리즘 스파이 영화라는 게 이런거군요. 과장을 걸러내면 이런 첩보가 나온다니!  그리고 호프만의 연기 칭찬 일색이신데... 공감합니다. 
8,"세계을 구하기위해 나의 다리털이 필요하다해도 절대 내어줄 수 없다. 하지만 인간은 다리털만도 못한 스스로 신념의 도구가 되길 주저하지 않으며, 신념의 테두리에서 벗어나면 폭력의 사용을 주저하지 않는다. "
6,필립의 연기를 보는것만 좋았을뿐... 
6,모르겠다 약간 지루한감이 느껴졌고 연기들만 볼만한듯 
8,"과장 없이 쿨한 스토리 전개. 강약이 확실하나, 강이 너무짧아서 아쉬운 마음이 남을 수도.. "
8,초반의 느슨한 긴장감에 녹아드는 사이 군터가....마음에 남는다... 마지막이라니.... 아쉽다... 
10,마지막 장면이 너무 씁쓸하네요 
9,최근 본 영화중 가장 탄탄한 영화같습니다.화려한 액션과 cg는 없지만 처음부터. 마지막까지끌고 나가는 긴장감과 배우들의 연기가 좋았습니다 
8,뭔가 찝찝한 결말끝났지만 끝난 거 같지 않은 
6,지루.지루.지루.지루 
1,중반부터 너무 지루하다. 
6,내가 영화보는 눈이 낮은가..?연기들은 참 좋고 어느정도의 긴장감은 있는것 같지만 전체적인 재미적인 요소는 없던것같은데..평점이 생각보다 높아서 당황스럽군.. 
3,평점 너무 높은거 아닌가? 일반 우리가 생각하는 007 시리즈나 본 시리즈 같은 첩보 영화라고 생각하면 정말 크게 후회할듯 나처럼.. 첩보영화인데 보면서 졸았던건 이번이 처음인듯;; 액션도 없고 결말도 어정쩡하고.....
1,이건 영화가 아니라 씨네21 평론가를 평론한 점수임. 
6,필립 세이무어 호프만의 연기는   명불허전이라 할만하지만 첩보스릴러 특유의 긴박감이 없다보니 그럭저럭킬링타임용에 그치는군 
7,기대만큼 스릴있지 않은 결말이 너무 허무... 
10,원작을 잘 살렸습니다. 연출의 흡입력도 좋고 무엇보다 호프만의 연기가 대단합니디. 
3,나한테는 왜 이리 네이버 평점이 높은지 모를 너무 지루한 영화였다. 
1,작품성이나 완성도는 모르겠고 재미만으로 따지자면 진짜 시간 아깝다 
1,지루한 전개 ... 평점이 너무 높다.. 
1,아 **** 네이버 평점 리얼 똥이네.. 나라도 평점을 낮춰야지.. 아 왠만하면 귀찮은짓 안하는데.. 이 영화가 날 로그인하게 만들었어. 
1,정말 재미없음 이 평점 애해할 수 없음... 
6,피곤해서그런지모르겠는데 졸면서봤네요 ㅠㅠ 
1,레이철만 예쁘다. 레이철만 예쁘다. 
2,"보는 내내 졸릴 뿐, 매 장면마다 나오는 끽연 씬에 보는 사람도 폐암 걸릴 지경‥ 고뇌의 표현이라고? 러시아, 체첸, 알카에다 따위 우리와 먼 이야기일 뿐. 평점에 속지 말기. 마지막 장면처럼 보고 나면 허무함과 후..."
1,더럽게 재미없다. 텐션감 제로. 평점에 속아 허비한 시간을 돌려라. 
1,이게 재밌냐? 난 진짜 재미 더럽게 없던데.... 짐심 지루했음 
1,시작부터 끝까지 조용하게 흘러갑니다. 저는 굉장히 지루하게 느껴졌습니다. 
7,우리 국정원도 이런 정도 일은 하고 있는거겠지? 이제 자택에서 댓글 같은 작업 말고. 
5,테러리스트를 무작정 잡아다 족칠 수 없는 복잡한 일 
2,원작을 잘살리려는 의도는 이해한다만 이렇게까지 지루하게 만들어야했을까 
7,영어를 사용하는 독일인들 이라니... 아쉽다. 어쩔 수 없는 헐리웃 영화라고는 하지만. 정작 독일인들은 이 영화를 어떻게 봤을까? 우리가 헐리웃에서 일본인 배역을 하는 한국인 배우를 보는 심정보다 더욱 참담 할 듯....
5,평론가들이 좋아할영화다 폭스캐처와 버금가는 지루함 
2,줄거리 별로. 내려앉은 분위기는 재미 반감. 몰입감 없는 느슨함. 이게 어떻게 5점 이상이 될수 있는가. 
6,안톤코르빈. 집중안된다. 
6,글쎄 호프만 추모의미로 평점이 높은데.. 영화자체로 보면 한창흥미로워질 때쯤 끝나버린다.. 제작은 그냥 드라마수준.. 
1,미치인넘 배우 죽었다고 걍 10점 던지고 가는 새끼들은 제정신인거냐? 
4,끝이 뭐야이거!? 이게 끝이야? 라는 말을 해주게하는 영화.뒷통수를 조심하자! 
2,머지 이거 보다가 3번이나 졸았다.. 
5,"스릴도 없고, 액션도 없고, 반전도 없고.. 그냥 호프만이 고인이 되어 평가를 높게 받고 있는 영화로 밖에 안보인다. "
1,평점에 속아서 봤더니 내용도 별거없고 지루하기만...대따 지루하고 마지막 장면은 지금까지 인내심을 가지고 본걸 후회하게 만드는 올해 최악의 킬링타임용도 못되는 영화구만... 
4,솔까...별로임. 뭐때문에 이렇게. 평점이높은지 이해가안감 
10,혼자서 하는일이 한계가 있단거 잘 안다.혼자 못하면 다같이 힘을 뭉쳐야지.신이 우리에게 믿음을 가르친 이유가 무엇인지생각해봐.강요는 안해.한번뿐인 인생 어떻게 살껀지.영화 강추!^^♡ 
7,재미도 없고만 뭔 평가에 그렇게 있어보기에  꾸며주고있냐  흥행 못하는데에는 다 이유가 있는거다. 뭘 말하려는 지는 알겠는데 상업영화로써의 재미가 부족하다. 이를테면 스토리라던지. 숨겨진 명작이라길래 봤다가 시간만 ...
5,이게 왜 스릴러지? 드라마에 가깝다. 능력없는 정보원이 담배피는 장면만 나오는 영화다. 질질 끄는 편집은 보는이가 정보원의 감정상태를 이해하라는건지? 그럴거면 스릴러말고 드라마로 하던가...드라마+스릴러 라고 이해하...
5,팅커 테일러도 그랬지만 이런 정적인 스파이물은 내가 느끼기에 (자극적인걸 원하는건 아닐지라도)지루하고 너무 심심하다 
4,충분히 거품이 낀 영화. 
3,평점왜이러냐 진짜 더럽게지루하고 더럽게재미없다딱 절반보다가 관뒀다. 절반시간도아까움 
1,더럽게 재미없고 지루한 영화! 1점도 아깝다.. 
8,마지막이 약간 아쉽네요 
1,7점정도가 적당한데 지나치게 평점이 높아서 조절용스릴러로는 긴장감도없고 결말도 별로... 
1,네이버 평점 아르바이트가 진짜로있나봅니다...이건 긴장감도없고 내용도 지루하고      보지마세요 시간아깝습니다. 0점주고싶다. 
1,알고보니 약물중독 뻥쟁이 영화네 알았으면 보지도 않았을거다 너거들도 국내 연예인에 죽자살자 덤비면서타인종한테 이중잣대 하지말고 까려면 일관성있게 까고인이라고 감싸는것도 이해가안되 ㅋ어때 코리안 네티즌 생각머리대로 글...
1,마지막에 퍽 밖에 기억안난다 진심 
2,내만 당할순없다. 꼬오옥 보시길... 쳐죽일 알바들 
1,최근에본영화중가장지루햇다 재미 감동 흥미 .전혀없다.시간이깝다 영화보는동안하품하는소리가 여기저기서들렷음;; 
1,내가 개빡쳐서 로그인하고 댓글남긴다. 이게 재밌다고??? 참 18 재미 있어서 내가 로그인했겠냐??? 어디서 재미도 감동도 없는 영화를  에라이.. 댓글 알바 총출동했다. 18  진짜 바바 내말이 거짓말 인가.. ㅋ...
8,레이첼 맥아담스뺴고 아는 배우가 
1,기대 하고 싶지 않은 영화 
6,죽쒀서 개준꼴...그리고 왜 이게 청불이지? 
3,정말재미없어서보는내내졸앗어요 
6,"너무 지루했어요.. 스파이얘기인데도 총이나 칼도 볼수없고, 추격장면도 한 5분정도? 그리고 개인적으로 왜 청소년관람불가 판정받았는지 궁금함 "
1,알고보니 약물중독 뻥쟁이 영화네 알았으면 보지도 않았을거다 너거들도 국내 연예인에 죽자살자 덤비면서타인종한테 이중잣대 하지말고 까려면 일관성있게 까고인이라고 감싸는것도 이해가안되 ㅋ어때 코리안 네티즌 생각머리대로 글...
1,마지막에 퍽 밖에 기억안난다 진심 
2,내만 당할순없다. 꼬오옥 보시길... 쳐죽일 알바들 
1,최근에본영화중가장지루햇다 재미 감동 흥미 .전혀없다.시간이깝다 영화보는동안하품하는소리가 여기저기서들렷음;; 
1,내가 개빡쳐서 로그인하고 댓글남긴다. 이게 재밌다고??? 참 18 재미 있어서 내가 로그인했겠냐??? 어디서 재미도 감동도 없는 영화를  에라이.. 댓글 알바 총출동했다. 18  진짜 바바 내말이 거짓말 인가.. ㅋ...
8,레이첼 맥아담스뺴고 아는 배우가 
1,기대 하고 싶지 않은 영화 
6,죽쒀서 개준꼴...그리고 왜 이게 청불이지? 
3,정말재미없어서보는내내졸앗어요 
6,"너무 지루했어요.. 스파이얘기인데도 총이나 칼도 볼수없고, 추격장면도 한 5분정도? 그리고 개인적으로 왜 청소년관람불가 판정받았는지 궁금함 "
