score,review
7,"모루겠더 . .  그냥 ""죽음을 겁내는사람은 삶도 겁낸다""이말이 제일 박혔는데... "
10,핵터가 중국여자나 전 여친한테 흔들리는거 여자로서는 보기 그랫지만 그저 현실적인 부분이라고 생각한다. 솔직히 그렇지않은가. 매력적인 중국여자랑 첫사랑이니깐. 그냥 이 영화는 행복에 대해 현실적인 메세지를 전달해주는데...
10,무조건 추천.. 별 생각없이 열어본 상자에.. 가장 소중한 기억이 가득한 추억들이 가득 들어있는 듯한 느낌.. 난 리뷰를 믿지 않지만.. 이 영화는 진짜였다는..  멋진 영화.. 보는 내내 맥주와 함께 행복했다는.....
10,행복해지고 싶다면 이 영화를 꼭 보세요  답은 안니더라도 힌트는 될 것입니다~^^ 
1,나는 행복하지 않다. 나는 행복하고 싶다. 나는 행복을 찾고 싶다. 
7,힐링이 하고싶어서 본영화...책이주는 교훈과느낌을 흉내도 못냈다 그저 킬링타임용으로 좋은영화 
9,"ost 찾으려면 원제로, 헥터가 아프리카에서 잡혀 있다가 풀려나 자유롭게 달려갈 때 나온 자막이 참 상투적이지만 진리라는 걸 새삼 느낌, 행복한 영화 "
10,난 행복을위해 사는데 왜 한번도 그러지 못할까 생각해왓는데 이 영화를 보고 이제는 행복을 위해 살면 안되겟다라는걸 깨달앗다. 그냥 잇는대로를 느끼고 즐기고 싶다 
10,너무나 지친삶을 좋게행복하게 바꿔줬던 영화이다. 
10,결국 행복은 늘 곁에 있는 건데 내가 준비가 안되서 알아차리지 못하는 것뿐이네요.. 그 준비를 하려면 여행도 좋고 잠시 혼자 있는 시간을 갖는 것도 좋은 것같지 않나요? 
9,파이크가 이렇게 사랑스러운 여자였나? 
6,행복을 왜 일회성 여행에서 찾누? 
10,행복에 대한 진지한 고민 
10,"지금 순간이 행복하다면  순간순간이 모여 행복한 인생이 됩니다.오늘 행복한 당신 , 내일도 행복할 수 있습니다. "
8,삶에 지친 그대들에게 권한다. 행복이란 타인의 시선에서 부러움을 느낄 수 있는 외적인 것들이 아니라 오로지 나만의 것임을. 내가 가진 최고의 사치는 행복을 남용하는 것임을. 그것으로 삶이 채워지는 막강한 무기. 
10,좋은 화면에 좋은 내용입니다 
10,너무 좋았어요 많은것을 배우며 
9,전개가 무지 빠르게 진행되었지만 내 삶을 돌아보게 만들었고 진정한 행복은 과정이 행복해야 한다는 것을 깨달았다. 
9,영화 한편으로도 힐링할 수 있다니! 
6,가볍게 보기좋은 영화.  원작 내용그대로라 크게실망하지 않았던듯. 
8,삶의의미를생각하게하는영화입니다 
5,감독이 원작의 행복 원칙을 이해하지 못하고 시나리오를 각색해서 만들었다. 그래서 실망스럽다. 
7,어찌보면 단순한 삶의 진리 
10,새삼스러운 깨달음이 주는 유쾌함 
9,좋은 영화임에는 틀림없다 
2,나를 찾아줘 여주인공 기억이나서 몰입이 안됨. 스토리두 별루.. 
8,꾸뻬씨 같이 장기간  여로곳을 여행하긴현실적으로 어렵지만저도 여행을 통해 삶의 균형을 잡고자하고희망을 품고 살고 있어서 공감 되었어요~^^ 
8,최고의 영화입니다. 이것때문에 여친생겼네요 흐흐 
5,좋은 취지인 건 맞지만 너무 지루한 전개가 흠이다. 
6,그래서 행복이 뭔데?? 
7,여행가고 싶어지게 만드는 영화! 
6,지인의 강추를 받고 기대 한가득  가지고봐서인지 실망감이 없지 않아 있었어요. 꾸뻬씨와 같은 고민상황이고 해결책또한 비슷했는데... 결국은 나의 고민이 다 부질없는것이고 행복은 내안에 내옆에 있다? ㅠㅠ. 나름 유쾌...
10,"유럽얘기후출근때섬지전화안온게아녔는데도나를풀어주고,병원갔다호빵먹다점심얘기에아이씨한나를이해해주신아빠.어떻게행복할수가있죠? 많은걸겪었으니까. 10.고구마스튜!영어잘해서헥터씨처럼세계인들과행복을교감하는게부럽소.6.불행을 피하..."
10,"진짜 제 취향이었어요. 행복이 뭔지, 내가 지금 행복이라고 느끼는 게 행복이 맞는지 다시 한 번 생각하게 해주는 영화였고, 마치 한 편의 긴 인생 다큐를 본 기분이었어요. 잔잔하고 뭔가 의미있는 영화 좋아하시는 분들..."
7,마음 편하게 볼만한 영화! 
7,행복은  늘 가가이에 있다는것.. 
7,주제는 괜찮은데 전체적으로 산만한 느낌이다 
8,"재밌었어요 월터의상상은현실이된다와 비슷한 면이 많았고, 새해 시작하기 전에 동기를 부여해주는 영화였어요 상영관을 더 늘렸으면 좋겠다는 아쉬움이 있지만 영화 내용은 좋았습니다 "
8,저절로 미소가 지어지는 기분좋은 영화였습니다 :D 
6,애인과 행복을찾으라면... 난 행복을 못찾는걸까ㅠ 
4,상영관이 적어 아쉬웠을뿐! 
6,뻬꾸씨의 행복여행으로 검색하고 관람한 1인 
10,좋은 영화 잘 봤습니다. 추천합니다. 
10,정말 재밌음 시간이아깝지않음 
10,의미가있는 영화였다. 
6,파랑새를 찾을 만큼 호감가는 배우들.. 
10,행복을 얻기 위해 영화를 봤는데영화를 보는 내내 행복하네요 
10,강추~~강추 안보면 후회~ 보고 후회하면 감정미숙~ 
10,중국 티베트 쪽에서의 장면들 하나하나가 다 평화로워 보였다. 하지만 행복은 우리 가까이에 있다는 사실이 더 인상적이었다. 
10,저는 이런 영화가 정말 좋습니당.ㅠㅠㅎㅎ영화를보면서나도모르게미소가지어지는영화...스스로에 대해 뒤돌ㅇ아보게하는 영화임. 행복한지.? 하고싶은일을하며 잘 살고 있는지.a.!! 
10,행복의 오로라~ 기대 이상 
6,역시 세상은 위험하다는 교훈을 주는 영화 
10,재밌게 봤습니다 헥터와 같이 여행하는 듯한 느낌이 들었습니다소소하지만 행복한 영화 전 정말 좋았습니다 
10,영화 보는 내내 너무 행복했습니다 너무 좋았어요! 
10,아랫분 현실성이 없다하셨는데 이거 실화입니다 
6,생각보다 별로 감동 없었다ㅠㅠ 기대해서그른가 
4,자폐증을 가진 장애인이 일인 다역하면서 모노드라마를 찍고 있는걸 보는 기분. 순수하고 질리는 자폐아 ㄲ헥터 
9,풋풋한게 딱 제스타일~ 
6,영상과 음악이 아름다운 영화. 
1,fuck 이다 자기 자신은 매너리즘에 빠져 스스로는 할 줄 아는 것도 없는 주제에. 
5,메세지가 전혀 와닿지가않는 스토리.. 여행은 왜 한걸까.. 행복의 의미를 찾아서? 글쎄요..클라라와 갈등도 없었는데 억지로 갈등조장 그리고 깨달음? 초딩도 이정도 깨달음은 알고산다.. 
10,이영화는 들뜬맘으로 보는건 난비추한다. 조금 유치하지만 난 위로 받았다. 요즘 심적으로 매우 우울하고 내가 하는 일이 잘안되고있는 상황에서 이영화를 보고 난 위로받았다. 마치 내가 여행을 떠난 것같이 
9,오래오래 생각날것 같은 영화어느날 삶이 의미가 없다고 느껴지거나행복하지 않다고 느껴질 질 때 생각날것 같은 영화입니다.'들어주는것이 사랑하는것이다'우리를 행복하게 만드는 영화입니다 
10,내자신에게도 묻고싶다. 행복이란 무엇인가? 
7,산발적인 그러나 조용한 
1,극장에서 내 돈주고 안보길 천만다행.. 억지코미디 억지교훈 느낌을 지울 수가 없다.. 
10,소소한 이야기로 따뜻한 감동 주는 영화네요. 
10,행복은 멀리 있지 않아요. 내 가까이... 
1,지금까지 재미없는 영화를 본적이 단 한번도 없었다 사람들이 재미없다고 했던 영화들도 난 재미있었다 근데 처음으로 찾았다 재미없는 영화 영화관에서 영화보면서 잔적도 처음이다 진짜.. 너무 시시하고 연결도 잘 안되고 나...
1,재미없다~ 극장가서 볼 영화는 아니다... 
2,할말없다 그냥 별로다 괜히 봣음 
1,본격 <꾸뻬씨만 행복한 여행>. 결국 행복은 연인한테 언제 돌아올지 기약도 없이 떠난다고 통보하고 떠나자마자 외도하면 얻을 수 있는건가요? 요즘 일도 잘 안풀리고 미래도 안보여서 답답함좀 해소해볼까 하고 ...
7,"행복이 뭘까에 대한 질문을 던지고 다른사람의 답을 듣는것도, 평생 볼일없을지도 모를 풍경을 방구석에서 이불덮고 본다는것도 흥미로웠습니다. 안좋은 평도 다 보고 본거라 기대안했는데 생각보다 괜찮네요. 책으로도 봐야겠어..."
10,살아있음에 행복을 느꼈다에서 많이 감동적이였습니다. 당연하게 여겨온것부터 감사해한다면 더 행복 속에 살거같아요!! 
10,행복이란 무엇인가 생각해보며 봤는데 인상적이네요 
10,생각만 많았던 내 인생영화가 되었다 
10,다좋아요..영상 배우 음악 줄거리 
9,행복은 절대 오글거림의 주범이 아니다. 
10,"행복 그 자체를 추구하려고 하기보다는, 모든 것 그 과정에서 느껴지는 행복에 더 집중해라. 행복의 패러다임을 바꾸는 영화. "
9,행복을 찾아가는 과정 누구나 꼭 겪어야 하는 일 같습니다. 잘 보았습니다! 
8,내가 걸어서 여행하는 이유 라는 책을 읽고 영화도 함께 보고 글을 남겨여 책보단 내용이 전체를 담는것은 한계가 있다고 느껴지네요.. 그래도 전반적 핵심 내용은 들어간것 같아 영화인이라면 한번쯤은 꼭봐야 하는 영화라고...
10,행복을 찾아 여행을 떠난 것 같았다 
10,행복이란  그리 먼곳에 있지않지.. 
9,간만에 좋은영화봤네  ㅋㅋㅋ 
10,시간과 돈이 아깝지 않은 영화 
8,인생이뭔지 행복이뭔지 다시금 생각하게 해주는 영화보는 내내 나를 찾는 여행을 떠나고 싶더라 
8,설레는 여행을 잘 마친기분. 좋은영화 
10,인생의 터닝포인트를 알려준영화 
8,재밌었어요 ㅎㅎ~~!! 
10,행복은 멀리있는게 아니다. 다 생각하기 나름 
10,보는 내내 행복했어요 인생을 다시 되 돌아보게 하는 영화 
9,좋은영화.미소나오는 영화.행복에대해 얘기하는 영화에 왜이렇게 비난을하나요.가벼운마음으로 관대하게 좀 봅시다 
10,내 행복.내삶에대해 생각해본 영화!마지막에 뇌진단할때 나도 같이울었다 비록 난 중3이지만 많은걸느꼈다인생영화!! 
10,죽음을 두려워하는 사람은 삶을 두려워한다 
9,좋습니다 볼만한 영화에요 
10,꾸뻬씨의 행복여행이라는 영화를 이제야 보게 된 내가 정말 불행했다고 할 만큼 나에게 행복이란 정의를 내려 준 최고의 영화라고 생각한다. 
8,마지막에 뇌 영상으로 꾸뻬가 행복을 찾았다! 라고 보여주는 게 좀 유치하게 느껴져서 7점 주고 싶었지만. 좋은 명대사 하나 건져서 8점 입니다. ㅎㅎ 
10,행복하지 않은분들 모두 보세요행복을 벅차게 느끼세요 
8,늘 하던대로 기계처럼 살며 순간순간 감각만 채워서는 행복해질 수 없다. 
9,뭔지는모르겠는데 눈물이난다 난행복한가에의문을던지게되었는데 지금이행복한거구나 어렴풋이느낄수있었다! 
10,치킨과  맥주  그리고  영화잠들기전  담배 한개비 
10,행복하게 만드는 영화다 
10,남과 차별하며 자신이 불행하다고 느끼는 순간 행복은 멀어져 간다는 것이 와닿네요. 헥터가 아프리카에서 본 사람들은 다친곳 없이 가족과 사는것만으로도 행복해 하는데 우리는 어떤가 생각해보니 남과 비교하고 문명은 발전 ...
9,기분좋은 영화. 행복하고 싶은 사람들은 행복할 수 있는 영화입니다. 
10,꼭 보세요! 행복해집니다 
8,이 영화 한국 제목 대체 누가 지었을까? 분명 주인공 이름은 헥터인데 뜬금없이 꾸뻬? 영화 다 좋지만 행복을 찾는 것도 또한 돈이라는 거.. 그리고 마지막에 뜬금없이 뇌 실험 하는 것은 좀 아니었음.. 
10,"큰 기대하고 보진 않았지만, 행복의 진정한 의미를 알게되어 정말 뜻있었습니다. "
10,아..  이건 진짜 봐야하는 영화네요 책으로 먼저 접해서 영화까지 보게됬는데 정말 재밌고 뭔가 인생을 뒤돌아보게되네요 
10,색다른 영화.... 
10,이건 단순하고 뻔한 로맨스물이 아니다.. 
9,보는동안 입가에 미소짓게만들던 영화 
9,슬픔과 고통을 거치지않고는 행복의 진정한의미를 알수없고 떠나보지않고는 가까이에있는 행복의 존재를 알수없다고 말해주는것같았음.. 
9,다 연기잘하는 배우들이네... 
10,살아있음에 행복을 느낀다. 누구나 행복할 권리가 있다. 
10,우리에겐 행복할 의무가 있다. 정말 행복해 지고 싶어지는 영화 
10,보고나서도 계속 생각나는 영화 시간이 나서 가벼운 마음으로 봤는데 너무 좋았어요 
10,Goodgoodgoodgood 
8,가슴이 따뜻해지는 행복한 영화 
9,우리의 잃어버린 꿈은 무엇일까? 
10,감동적이면서 유쾌한-이야기 
10,너무좋은 영화였습니다 
10,좋은 내용이에요 꼭 보시길 
10,정말 좋은 영화다! 여러가지로.. 
10,힐링 제대로 하고갑니다 모든 사람이 행복할 의무가 있다!! 
10,역시! 다시봐도 좋은영화 
8,막 행복하진 않았어요 소소하게 재밌었던 영화입니다 
10,즐거운 설날에 행복했던 이유는  두둑한 세배돈과 이 영화가 아니었을까 싶다! 
10,낄깔낄낄깔낄깔낄깔낄 
6,2016 년 에는 꼭 행복을 찾아 떠나리... 
10,이런 영화를 10점 주지 않으면 어떤 영화에 별을 주겠는가 
5,요즘 유행인 힐링 스토리라 좀 뻔한 내용이라 볼 수도 있지만 사이먼페그의 연기를 보는 것은 언제나 유쾌하다 
7,영화도 잔잔하고 재밌었지만 책이 더 좋았어요~! 
6,"사람이 여행을 해가며 서서히 변해야 하는데, 출국할 때부터 조증처럼 오버하는게 영 부자연스럽다.  힐링이 필요한 사람이 아닌 것 같던데? "
7,쉬운데 어려운 행복을 찾아서 
4,"별루, 갑자기 결론이 결혼으로 "
6,"그저그런데.. 월터, 꾸뻬 .. 사람들 이런 영화 되게 좋아하는듯 "
5,같은 주제 영화에서 봤던 좋은 장면들 다 모아논것 같았다. 모아노으니 그닥. 식상함.. 
1,긍정적인 영화 좋아하는데 완전지루  내취향은 아닌듯 호불호인 영화니깐 볼사람은 잘 선택하고 보시길 씹노잼 
4,결국 행복해진 헥터씨 .. 남겨진 우리는 헥터씨의 의문을 이어받는다.. 당신은 지금 행복합니까? 
6,잔잔하고  괜찮은 영화였습니다 
1,행복을 아메바같이 단순화시킴.  또한 여행도 작위적~ 
10,당신은 지금 행복하시나요? 
6,왜 제목이 꾸뻬씨의 행복여행이지? 헥터의 행복여행 아닌가? 
3,Just do it ! ok? 
6,"시간떼우기로 봤는데, 오그라듭니다. "
10,볼수록 저도 행복해지네요 
6,살아있는 것 자체가 행복임을 일깨워 주는 심리 클리닉 
5,사이먼 페그의 목소리가 좋다는 걸 알려준 영화. 
6,풍광은 다채로우나 예상 가능한 전개. 
6,가르치듯 자꾸 활자로 정의를 내리는 방식. 평범한게 진리겠지만 그럼에도 뭔가 안일한 결론. 무엇보다 그 과정이 여유로운자의 도락같은 느낌이 맘에 안들지만 이건 원작자체의 한계일듯. 내용보단 제목에 걸맞는 분위기를 살...
5,생각보다 훙미진진하진 않앗지만 소소한 영화 
10,행복이 무엇인지에 대해 곰곰히 생각하게 되는 영화!행복을 찾아가는 헥터의 시선이 사랑스럽다 
6,생각보다 그닥..그냥 여행다니고 친구만나면 힐링이 되나? 행복을 어떻게 찾는지가 중요한거지. 
6,우리 모두는 행복할 의무가 있다... 
5,월터 > 꾸뻬. 좋으나 아쉽다 
6,Happiness is being loved for who you are.- 행복은 있는 그대로의 자신을 사랑하는 것이다.. 굳이 영화로 보지않아도 다 아는 내용을 억지로 만든 것 같은 영화.. 어제밤 요금은 다른손...
6,철학적인 주제를 유머감 풍부하게 그려냈군 
6,r잔잔한 영화.그의 여행은 행복한 순간이었지만 나에게 행복을 가져다 주진 못했던 것 같다 
5,행복의 결론은 결혼? 제목과 포스터가 영화를 말아먹었다 
8,정신과 의사인 헥터가 행복이 뭔지 고민한다는 설정이 흥미로웠다 그리고 여행을 떠나면서 행복에 대한 다양한 정의들을 보면서 행복이 뭔지 같이 고민하게 된다. 아쉬운 점이 있다면 마지막에 갑자기 마무리짓는 느낌이 든다는...
10,행복은 수많은 방식으로 정의될 수 있습니다. 
8,로자먼드파이크가 왠지 누군가를 죽일지도 모른다는 생각이  영화내내 스릴넘치게했다....;;;  누군가에게 추천해줄 만한 영화임은 분명하다 
10,보는내내 즐겁고 행복한기분 
9,행복은 '특별'한 권리가 아니다. 이 모든 삶이 다 행복이다. 
10,귀요미 남주인공. 으헤헤 
10,보면서 계속 입가에 미소를 띄우면서 봤어요저도 행복여행을 떠나고싶은 마음이 생기게되었어요ㅋㅋ 
6,원작에 비해 디테일하지 않은 부분이 아쉬웠습니다:) 
7,결국 행복은  여자야 여자 
6,솔직히 별 내용 없음 10자 
6,그냥 가볍고 무난하게 볼만한 영화 ㅋㅋ 
6,영상이 참 예쁘고 책 보단 덜 지루하고 아주 조금 덜 유치함. 그래도 여전히 유치함. 
6,마지막에 행복을 한번에 풀어냈지만 뭔가 아쉬웠다 그래도 기분좋은 영화 
6,행복의 조건.좋았으나 급마무리 느낌..ㅠㅠ 
6,2% 부족한영화 아쉽다. 약간의 조금만 더 길어도 괜찮은데 시간 맞추려고 억지로 만든 느낌이든다. 
6,초중반까지는 톡톡 튀는 재미와 구성으로 괜찮았는데 후반부로 가면서 재미가 사라지고 축 늘어지는 것이 아쉽다... 영화가 점점 클라이막스로 가야하는데 거꾸로 지루해 지니.... 연출력의 문제인지 
6,행복은 가까이에 있다는 파랑새를 떠올리게하는 박품이네요 
10,느끼는게 많은 영화였어요내용적 측면말고도영상미도 참 좋네요마음이 따뜻해지는 영화입니다 
6,별로임... 걍 떠났더니 일상의 소중함을 느꼈다 이게 끝 
10,한번더 보라면 보고싶은영화  느낀것도 많았지만 진부하지 않고 유쾌해서 더 좋앗다... 
10,"대박. 인생의 최고의 영화중 하나가 될 듯, 버킷리스트 처럼 두번 보고싶은 훈훈한 영화입니다. 상영관이 적은게 아쉬울뿐... "
10,행복은 과연 무얼까 생각하게 되는 영화 
9,참 재미있엇어요많이 이용바람 
9,내면 속에 갇쳐 있는 두렵음을 떨치고 행복을 찾는 감정여행기~ 
8,"깨알웃음 선사와 여주의 기분좋아지는 미소, 무엇보다 행복이 결여된 요즘시대에 행복에 대한 물음으로 떠나는 여행을 바라보면서 행복에관해 생각해보게 만든것만으로도 의미가 깊었던 영화 "
10,내가좋아하는 사이먼페그. 그가 아니면 이렇게 유쾌하게 풀어낼수 있었을까? 가고싶다 나의 행복여행 
7,어썸합니다 kkkㅌfjdj 
10,"약간 허전한 스토리텔링, 그러나 책보다는 훨씬 좋았다. 무엇보다 풍경과 배우들의 연기가 영화를 지루하지 않게 끌고간다. "
9,적어도 이 영화를 보는 2시간 동안의 행복은 완벽하게 보장된다. 
10,알고는 있었지만 잊고있었던걸 하나씩 하나씩 되찾은 맛이있다랄까 
9,행복해지는 영화입니다. 
9,"an47_행복이란 무엇인가에 대해서 다시 생각하게 하는 영화_행복해야 하는 것은 의무이다? 좋다 그렇지만 그 의무는 건강하게 이행되어야 한다_내 삶의 행복은 나에게 책임이 있다, 주변때문에 내가 불행하다 핑계대지 말..."
7,무난하지만 생각할거리를 많임주는 영화 
10,"누구나한번쯤 혹은 사는동안 종종 고민해보는 고민해봤을법한 질문에 대해, 누구말대로 조금 뻔한 이야기같지만, 뻔하다는건 그만큼 모두에게 익숙한 질문이고 고민이고 성찰인것 같아서, 문득 다시 깨닫게 해준 시간이였어요 두..."
7,굿  좋은 영화입니다  만족합니다 
10,오랜만에 마음이 따뜻해지는 영화였어요^^ 
10,보는내내 행복에관해 다시한번 생각하게만드는 영화... 
10,너무 좋았습니다.. 많은생각하게해주는.. 
10,책만큼 재밌어요 억지로 시간내서 봤는데 후회 없음 
10,행복이란 무엇인가라는 생각을 다시한번 해보면서 행복하게살아야겠다를 느끼게해준영화 
10,기대한것보다.훨씬 볼만하고 생각을 하게 하는 엔딩이 즐거운 영화네요 ㅎㅎ 기분전환으로 추천! 
10,"살아가면서 한번쯤은 느끼고 경험하게되는 바로우리의일상이아닐까? 행복, 더불어 오는게분명맞다.  쫓아서는 절대갖지못한다.참좋은영화다. "
8,가볍게 보러갔지만 그저 가볍지만은 않더라 
10,좋은 영화를 보고있다는 생각에 좋았습니다. 좋은 영화를 보고있다는 생각에 행복했습니다. ♥행복찾기의 방향을 알려주는 영화가 아닐까 싶어요.꼭 보세요.^^! 
10,인생은 아름다워 이후 비슷한 영감을 주는 명작 
10,이 영화를 보게되어서 너무감사합니다.. 
10,정말 오랜만에 맛있는 ..행복한 영화를 봤다보고나면.누구나 행복해지는 영화.. 
9,괜찮은 영화네요! 책이랑은 뒷부분 약간 다릅니다 ㅋ 
10,원작을 읽지 않았지만 보고 나서 행복해졌다 
8,괜찬은 영화네요ㅡ그나마 
8,고1 사회책에 실려있음 
10,인생의 참뜻을 느끼는 영화.. 
10,오랫동안 번아웃되어 있던 상태에서 이 영화를 보고 극복되기 시작했다. 
10,아.. . 마지막 뇌검사 장면 말이필요없음 ㅠㅠ 
10,사람들은 온통 한장면에 멈춰 한면만 보고 생각을 다룬다 답답하다. 이런 세상에 가장 필요하다 . 이 영화 가장중요한건 곁에 남은 사람과 삶을 많이 체험하고 경험하는 것 . 더많은 말을 하고싶지만 더욱 하고싶지않다. ...
6,"서구도 종교가 몰락하면서 개인의 삶에 점점 주목해가는 추세..영화가 좋긴 했는데, 실업자와 비정규직이 넘쳐나는 한국에서 안정된 생활이 무료해 행복찾기를 나선 정신과 의사의 모험에 공감할 사람이 얼마나 될까 싶었다. "
5,책이랑 비교할 때 느낌이 너무 다르다..ㅡㅡ 역시 사람은 생각하는 이미지가 다 다르구나.. 그리고 잉리.. 그렇게까지 아름답지않음.. 
10,책에서 본 것도 좋지만 영화로의 전달도 멋졌다행복이란? 당신은 행복한가요?질문에 대한 답들을 찾아보는 재미도ㅎ 
10,진짜재밌어요ㅜㅜ초감동♡ 
9,꿀잼 혼자보기좋은영화! 
10,주변에 힘들어 하는 이들과 다시 보러 가고 싶다.책 내용에 충실한것도 맘에 들었다. 
7,"책을 읽어보지는 않았지만, 역시 책 한권->2시간 영화 뭔가 어색하다. 그냥 편~~하게 2시간 볼 영화 "
10,온 마음으로 영화를 본 것 같다 혼자 봤는데 사랑하는 사람과 보면 더 좋을듯 
10,오랜만에 좋은 영화였네요. 60대초반인데요.행복은 찾아야하는게 아니라 내안에 충만되어 있다는요. 월월호월 일일호일. 마음 먹기 달렸다는것.멀리 있지 않다는것요. 감동이였습니다. 
10,올해 본 영화 중 단연 최고의 힐링 영화였습니다. 
10,꾸뻬씨의행복여행 책은 재밌었지만 와이프로 나오는 저 여자는 여전히 무서워... 
1,사이먼과 풍경 아니었음.. 
10,행복해지는영화 굿굿. 
9,?생각없이 편안하게 보면 좋을영화 발상이 특이하지않은가? 행복을 찾아서 여행을 간다는게돈으로 행복을 살수없다고하지만 돈으로 행복을 사는사람도있고 소소한삶에서 행복을 찾을수도 있지~ 편안하게 보세요 ~! 
10,꼭 한 번쯤 봐야 하는 영화. 
9,행복을 알게해주는 영화 ^^ 
9,현실감 없이 너무 영화같은 설정만 빼면 인생영화로 불려도 괜찮을 힐링영화. 간만에 행복하게 본 영화. 사이먼 페그 특유의 연기는 정말 능청스럽고 멋지다. 
10,완전 재밌어요ㅠ행복이 어떤건지 생각하게 만들기도 해주고요 평소 내 잘못된 집착도 돌아볼 기회를 만들어준 영화같아요 
10,불행이 있기에 행복이 있다. 그리고 지금 살아가는 삶 자체가 행복이다. 어떤 상황이든 기꺼이 받아들이고 가볍게 즐기자! 기분 좋아지는 영화. 보는 내내 미소 지을 수 있어서 좋았다~ 
10,"그래, 좀 더 솔직해질게. "
10,자신의 있는 그대로의 모습을 솔직하게 보여주고 사랑하는 사람들에게 진심으로 귀기울여 처음 사랑하는 것처럼 대한다면 나의 삶은 행복할꺼야 
8,행복은 여러가지 있지만 가장 중요한 행복은 매일 가까이 누리는 일상이다. 
9,진정한 행복을 찾는 모험기. 
10,다시 한 번 보고싶은 영화다. 
