score,review
10,행복은 목적이 아니라 과정이 되어야 한다. 목적이되버리면 집착하게되고 집착하게되면 불안하게 되니까... 
9,나는 그저 영화를 보았을뿐인데행복을 느꼈다 
10,행복은 미래의 목표가 아니라 현재의 선택입니다.지금 이 순간 당신이 행복해지기로 선택한다면 당신은 얼마든지 행복할 수 있습니다.참 기분 좋은 영화입니다. 
7,떠난다고 다 힐링이 되는 건 아니다 
4,꾸뻬가아니라 헥터네? 
8,개봉하자마자 새벽에 영화관에서 봤는데  이번년도 많은일도있었고 많이힘들었는데 이영화보고 정말좋다 추천 너에게 행복주고싶어  모두들 행복하세여 한달남았는데 내년에는 좋은일있을거에요 ~^^ 
5,"헥터에게 너무 아까운 그녀, 클라라. "
8,"""나를 찾아서""에서의 로자먼드 파이크 잔상이 남은 상태로는 예고편도 무섭다 "
10,2시간 동안 여행을 다녀온 기분. 보는것만으로도 행복해지는 영화. 
8,어쩌면 행복은 항상 곁에 있었던 것일지도 모른다. 다만 익숙해져있다는 사실에 나 자신이 알아차지리 못했던 것은 아닐까 
1,기대하고 봤는데 음..좀 유치하고 작위적인 스토리에 여행첫 날부터 딴여자랑 바람피고 보기 안좋았음 행복이란 하면서 수첩에 쓰는게 귀에걸면귀걸이 코에걸면코걸이 같은 느낌ㅇ 
9,내 아늑한 자취방에서 늦잠을 잘때맛있는 칵테일을 먹을때 행복하다♡ 
1,백인우월주의에제대로꼳친 영국아자씨의 세계를돌며 바람피는일대기ㅡㅡ 여자들이보긴별로인듯~부인있는헥터의 행동들도이해안가고 
4,그냥 헥터의 행복만 본 것같은 느낌. 덩달아 나도 행복해지고 무언가 얻을 수 있기를 기대했는 데 허전하다. 
10,행복과 사랑에 대해 생각해보게되는 잔잔한 재미가있어요 
1,찌질남 핵터의 행복을 가장한 외도여행이다. 여친클라라는 일도 하고 핵터의 뒷바라지도 다 한다. 고마운줄은 여행 가는데마다 외도에 첫사랑 못잃어까지 ㅋ 찌질남의 극치. 클라라 진작에 헤어졌어야하는데. 그냥 남자의 판타...
1,꾸베씨만 행복하고 관객은 불행 
10,좋은영화의기준은끈나고난뒤에영화가주는여운이깊은영화가좋은영화라고생각하는데이것도그중하나보고나오면행복해짐행복은만족에서시작하고 만족은감사로부터나옴살아잇음에감사하고두귀가들리는것에감사주변에사랑하는사람들이잇단걸감사해서불행이쉽게찾아...
7,작년엔 월터가 떠나고 싶게 하더니 올해엔 헥터가 떠나고 싶게한다 진정한 행복은 자신에게 물어봐 
1,여자인데 보는 내내 불편하네요. 여행첫날부터 바람이라니... 기분 안좋을 때봐서 기분이 더 나빠졌습니다. 남성우월주의와 백인우월주의가 절절이 베어있는 영화. 
1,진부하고 지루하고 작위적이고 공감이 안 감. 
6,책보다 별루...ㅠㅠ 
1,보는내내 욕나오는영화 주인공 패고싶다. 
5,자기개발서를 영화로 봤다뻔하고 뻔하고 어디서 본 레파토리내용은 좋은데 마지막에 너무 몰아서 풀어쓰려고 한걸까 등장인물들의 감정이 해소될때 난 오히려 행복에 대해서 의문이 생겨서 주인공 대신 의문을 떠안아버림행복에 대...
4,이런 주입식 교훈 영화는 이제 넌더리가 난다. 
5,행복에  대해  뭔가  있어보이는듯이  얘기하려  하지만..받는건  작위적인  느낌뿐... 
1,실망스럽다 뜬금없이 어린중국여자 나와서  그여자랑 어떻게 잘해볼려고 하는 꼬라지하며 뺨 맞을때 3류스러움 제대로 느꼈다.  뭔가 가르치려 하는데 하나도 안와닿고 반감만 가지게 된다;;;평점 오바;;; 
7,헥터는 행복을 찾았지만 나는 그다지 행복을 느끼지 못했다...그래도 중간은 가는 영화 
4,생각없는 감독이 행복에대해 이야기 하고 싶어한다... 책이 백배는 재미있다... 이건 그냥 무례하고 생각없고 자존감도 없는 사람이 여행갔다오는 이야기... 
8,재밌어요.. 근데 개봉관이 너무 없어요. 
1,"요새 우울해서 힐링영화 검색해서 , 이거 평점 믿고 봤더니 더럽게 재미없음 ㅡㅡ 진부하고 유치한 뻔한 ... 교훈 같지 않은 교훈 ... 괜히 4000원 낭비했음... "
4,뻔한데다 스토리에 개연성도 황당하고 그냥 지루하다. 
3,정말 이기적인 주인공 헥터 
6,끝까지 빠지지 않는 중국여자....차라리 초반에만 나오고 말았으면 잠깐 흔들렸을 수도 있다고 이해할텐데 막판까지 중국여자를 떠올리는건 어떻게 받아들여야할지 모르겠다. 이래서 연인이 혼자 여행가는걸 반대하나 싶고......
6,"이런 류의 영화를 거리낌없이 잘 보는 편이나 , 이 영화는 조금 지루했다. "
2,"행복은 여행을 통해 산전수전 다 경험한 바, 몸과 마음을 둥글둥글 여유롭게 하는데서 찾을 수 있다는 것을 말하는 영화. 스토리텔링의 수준이 낮아 계속 졸면서 겨우 봤다. 기대치 대비 실망. "
7,헥터의 행복여행은 좋지만 과정이 맘에안듭니다 헥터는 이기적이고 어린애같은 인물인듯 사랑하는 여자 혼자두고 기약없는 여행을 떠나 처음본 여자와 바람피고 옛사랑을 만나러 가고 그부분은 너무 스트레스받네요 영화보고 찝찝한...
1,찌질한 헥터의 외도여행. 불쌍한 클라라 
9,아름다운 이야기..행복이란 무엇인가? 난 행복은...함께 하고 싶은 사람과 있는 것이라고 생각한다..그러면 함께 하고 싶은 사람과 여행을 가거나 맛있는 음식을 먹는다던가 집에서 영화를 보더라도 그건 행복한 삶이다.....
10,훈훈한 영화입니다. 마지막 씬에서 나도 모르게 눈물이 ㅠ.ㅠ 
1,평점에 속아서 보지마세요... ㅠㅠㅠ제발 오리엔탈리즘 토나옴 철저히 백인남자기득권자의 시각 
8,바람피면서 무슨 행복이야; 어딜가든 다른 여자랑 설렘 느끼는게 꼭 있네 여자친구있으면서;; 소름... 안사랑한것도 아니면서 그거 빼면 다 좋은데 OO같아서 별점뺌 ㅠ 
1,이런 영화는 무슨 재미로 보나? 
8,귀기울여주는것이 사랑이다 라는 말이기억에남네요~잔잔하게 잘봤습니다 
9,"지금 이 순간 내 옆에 있는 누군가를 더욱 사랑하게 만드는 영화.슬펐던 순간들이 희망으로 뒤바뀌는 순간. 지금 사랑하는 사람과 더 사랑하고 싶다면 꼭 보시길 . 책도 좋았지만, 영화는 또다른 재미를 느끼게 하네요. ..."
1,제목이 말해주듯 핵터만 찾은 외도와 행복..ㅋㅋ 이딴것도 영화라고 ;;; 
1,별점 0은 왜 선택이 안되는 걸까 
4,평점에 속았다.대놓고 희극적인 연기에 이미 극초반부터 영화가 가는 길이 빤히 보여 몰입은 반감되고. 결국 2/3지점까지 겨우보고 포기. 
1,노잼임 보ㅡ지마셈.. 
7,관객으로서는 행복이 무엇인지 안 와닿더라.. 헥터만 찾은 듯 
1,스토리가 중요한 주제인것 같은데 스토리가 억지스럽고 유치하다. 시간이 아까운 영화 
2,최악으로 만들어놨네.. 
1,"공감도 안가고, 새롭지도 않고 "
5,틀었으니 보긴 봤는데 남는건 people who afraid of death afraid of life가 다임. 행복은 헥터 지 혼자 찾는거. 행복에 대한 상투적 얘기들 + 외도 + 뜬금 뇌과학 나오며 감정의 오로라...
2,보는 내내 뭔가 찜찜했는데 아그네스가 폭발해서 소리 지르는 것 보고 깨달았다. 헥터는 행복에 대해서만 모르는 게 아니었다. 본인은 끝내 행복해졌지만 관객인 나는... 영화니까 저런 헥터 곁에도 좋은 사람들이 있던 거...
1,양남충 제기해~ 한남들을 위한 영화~~~ 
5,책이 나아요. 좀 더 진지한 분위기로 찍었으면 어떨까싶네요. 행복에 대해 진지한 성찰을 하는 것이 원작 분위긴데. 각색을 잘 못한거같아요. 이상한 웃음코드 넣어서... 망으로 만들었어요. 원작이 아깝습니다. 
1,"행복을 찾아 떠난다더니, 결국 딴여자 품고 싶었더거???? 글고, 영화가 현실성이 단 일도없는게 진짜 지루해 OOO줄 알았음,, "
5,평점보고 봤다가 와이프랑 둘이 실망했다...영화관에서 돈주고 볼영화는 아닌듯... 
3,월터 나 인투더와일드수준을 예상했는데 전혀 아닙니다...샌들러의 클릭이 훨씬 나을듯하네요. 월터의 상상은 현실이된다.안보신분은 꼭 보시길. 
2,영화 진짜이상한데?주인공 헥터 기주의 쩌네요 미친 .제목에 낚였다 일점주기도아깝다 
6,역시나 이번에도 원작소설이 더 좋았다. 소설에서의 디테일한감정과 깊이있는깨달음을 잘 녹여냈어야했는데 영화는 그저 사건을 나열하기 급급했다. 헥터가 가벼운생각으로 다른여자나 꼬시러 떠난여행으로밖에 해석이안되니  관객은...
5,책을 읽어본 저에게는 아쉬운 연출과 중요부분을 많이 제거한데에 대한 아쉬움만이 남는 영화 그리고 평점이 이렇게 높은것에 대해 몹시 의아했다. 
8,그냥 살아있는 것만으로도 모든 시간이 충만하고 행복했던 내 어린시절... 아직도 그때의 기억은 생생하건만 지금의 난 그때의 나와 너무도 멀어져있다 
2,보다가 그냥 나와습니다 
7,흠... 나태해지는 듯한 기분이 들어서  나 자신에게 행복에 대한 의지(?)를 주기위해 본영화지만  끝나고 나서 책을 읽을껄....하는 생각이 드네요.... 
1,책은 읽지 않아 원작에 대해 판단할 수는 없지만 영화자체는 실망이 크다. 백인우월주위적인 연출은 서양영화의 특징이니 차치하더라도 불친절한 설명과 후반부의 급격한 전개로 영화는 관객과는 유리되고 헥터 개인을 위한 행복...
6,진정한 행복은 성령님이 함께 하실 때다. 
6,지겨움과 무료함은 행복에 가깝다 
2,딱 중 2 수준의 행복의 대한 고찰.. 아기자기하고 아름답지만  내용에 깊이도 없고  스토리도 시시하고 작위적이다 
9,행복을 찾아서 떠나는 여행있을법한 영화지만 새롭고 도전받고많이 깨닫고 느끼게해준 그리고 보는 내내행복을 준 좋은영화 감사합니다 행복하게해주셔서 
10,"우울할때 보면 좋을 것 같은 영화, 영화가 다 끝나고 나면 동화를 읽은 것 같은 느낌이 든다. "
8,평상시 알았을법도한 답들 
4,행복에 대한 몇가지 이야기는 공감가지만 전반적인 내용도 결말도 별로 
6,흔한 헐리우드 영화가 아니라 좋았다만 왜 이런 류의 이야기는 꼭 가족의 행복으로 내용이 귀결 되는 거냐? 이거 디즈니 사에서 만든 영화냐? 
7,재밌지도 않고 감동적이지도 않고 
4,"인생의 울림은 써글...적당히 사건 만들어주고 기승전결만들어 주고 교훈없이 그냥 끝나면 아쉬우니까, 마지막 적절한 순간에 실용서에 나올 법한 내용 몇 줄 넣어주면 무지 좋아하겠지? 라고 생각한 제작진들이 관객 우습게..."
7,행복을 찾으러 전세계를 돌아다녔지만 정작 행복은 내가 있었던 곳에 있었다 
2,영화보다 중간에 나올뻔함.. 너무 지루.. 비현실적 설정..ㅠ 
1,이게 정신나간여행 이지 행복여행 이냐~ 
5,억지로 찾는 2시간의 행복. 관객은 지루하다 
9,행복은 그다지 먼 존재가 아니었다. 
5,"관객이 영화를 보며 꼭 감독을 이해하려 노력해야할까?  그런 고민을 하게 만든 영화! 그냥 마음 속에 흡수되지는 않는다. 왜?왜? 라고 묻게 만드는 영화~ 즉 ""굳이 저렇게 돌려가며 말해야 하나?"" 라..."
2,"참나!! 진정한 행복에 대해 1도 모르는 감독, 작가가행복을 가르치는 영화. ㅠㅠ "
7,행복은 자기 마음먹기에 달려있는 것이다. 
9,"영화를 보면서 생각했다. 우리 모두 행복한 삶을 살아갔으면 좋겠다. 전 인류가 서로에게 힘이 되고, 때로는 지치고 힘든 자에게 조건없는 친구가 되어주는 날이 오지 않을까? "
8,내가 살아있음이 감사하네요. 영화를 보면서 더 사랑하고 더 진실하게 살아야겠다는 생각을 했습니다~^^* 
10,인간의 최대 장점은 다른 동물들에 비해 행복했던 추억들을 완전하게 기억해낼 수 있는 것이다. 
3,기대했던 느낌의 영화가 아니었다. 월터의 상상은 현실이 된다//가 차라리 훨씬 힐리이 된다. 이건 아니다. 딱 보니깐 베스트 댓글 알바가 많네. 갈 수록 네이버 댓글들은 꼴보기 싫구나 
9,행복이라는것에 대해 다시생각해보게되네요.내가 생각하는 행복이란? 
4,내용은 좋아요 그런데 내용만 좋네요.다큐를 보는듯한 느낌이랄까? 
4,별루 뻔한 내용들인듯. 
3,너무 기대했어여 잉리는 왜 나오는지더 모르겠고 다 전개도 막판에 너무 이상했고 그냥 감독이 고정관념 가진것 처럼 이상.. 
5,솔직후기 난 괜찮게 봤는데 호불호가 좀 갈릴듯싶음 소소하고 상대를 이해해야만 답답함을 안느낄만한영화 큰 영감이나 감동 속 뻥뚫림 그런걸 바라는 사람은 비추 
7,마음 속 못난이 꼬마와 작별을 고하자! 모두의 행복한 성인식을 위해! 
2,원래 이런류의 영화 좋아하는데 이영화는 결론이 뭘까 진짜로 
8,건강하고 돈걱정없으면 장땡아님? 
2,주인공 이미 행복해보이는데....뭔지 모르겠는 영화 
7,행복은 미래의 목표가 아니라 현재의 선택입니다.지금 이 순간 당신이 행복해지기로 선택한다면 당신은 얼마든지 행복할 수 있습니다.참 기분 좋은 영화입니다. 
6,"미성숙하고 이기적인들, 각자의 삶과 인생은 모두 소중하고 모두들 행복해질 권리가 있으므로 "
6,정신과의사가 정신이 더 이상해보이는데? 선입견 갖고 환자 보고...정신과의사가 더 또라이같네 
8,저에게 여행이란 새로운 환경에서의 묘한 흥분과 즐거움을 느끼는것 뿐이었는데 꾸뻬씨의 행복여행을 보면서 내가 잊고 있었던 것이 무엇이였는지를 깨닫게 됬어요. 또한 일상생활의 소중함을 느끼게 된 것 같아요 
9,편하게 볼수 있는 영화로 추천이요~~꾸뻬씨의 코믹 발랄 드라마틱한 여행 재밌네요! 
9,행복은 다만 좋기만 한 순간들을 일컫는 단어는 아니다.삶을 살아가며 마주하는 모든 순간의 기억들은 아마 눈 감는 날행복했던 삶으로 기억될 것이다.포기하지 말고 열심히 살아가야지.우리는 모두 행복할 의무가 있다. 
9,행복이 뭔지 알아내려다 무의식속의 자신의 그림자를 만난 헥터는 그를 끌어안음으로 진정한 어른이 된다. 헥터는 바로 내 모습! 
5,"심오하면서 재밌으려고 노력한 영화지만, 심오하지도 재미있지도 않음. 너무 많이 보여주려해서 연결이 억지스러움. "
8,중국인 여자랑 바람핀거 빼고 다 좋았던 영화여행으로서 헥터만의 행복을 찾았꾸나 나도 찾고싶다 ~~ 
6,뭔가 남기고 싶어하지만 그닥 남는게 없는 영화 
4,아... 뭐지? 집 떠남 개고생?!?;;; 
1,그럴뜻한 단어를 포장하기 위한 진부한 설정들.. 
1,무언가를 얻기위해 기대를했던 내 잘못이었다 
5,행복에 대해 생각하게 하지만 내용이 산발적인 영화. 결말은 그럭저럭 괜찮은 
1,19금 판타지ㅇㅇㅇㅇ 
1,개인적으로 별로던데ㅋㅋ 뭔 내용인지도 모르겠음 
1,이렇게 어이없었던 영화는 처음이다.소아성애자에 바람까지펴. 클라라 존나 불쌍해 
8,이 아저씨  주연 영화는 다 꿀잼 
8,난 재밌었다. 그냥 무난하게 잔잔하고 소소한 자미 보고 싶을 때 괜찮다. 시간 오래 지나고 또 봤는데도 괜찮았다. 
3,전개가 신선했어요! 아그네스 언니ㅠㅠ 넘멋져요 박력에반했어요 말솜씨닮고싶어용ㅠㅠ 언니때메 원래 별점에서 +3점 했어요! 그리고 영화에서 자꾸 '아주 먼 옛날 ^젊은^ 정신과의사가...' 이러는데 좀 잘...
10,"지금 이 순간 내 인생 최고의 영화,후반 모든 감정을 떠올리는 장면에서 울었다.이런 류의 영화 보다가 울어보긴 처음이네..스스로에게 확신없는 내모습 쩝 "
10,제목을 보면 내용이 상상이 가는 영화지만 볼만한 가치가 있다.울적하고 나에 대한 확신이 없는 사람에게 추천하고싶다. 
10,집에서 밥먹으면서 가볍게 보려고 틀었는데 시계 한번 보지 않았던 영화. 
7,살아있는것만으로 행복한것. 
1,mmnnmmnmnmnmnnn 
10,저는 그를 통해 많은 행복을 얻었다 
8,“불행을 피하는게 행복의 길이 아니다” 이십대 초반의 저에게 가장 와닿습니다 불행을 피하는게 당영하다 생각했거든요ㅎ 
10,살아가고싶다고생각하게한다 
10,딱 맞는 타이밍에 보게 된 이 영화는내게 인생영화가 되었다 :-) 
6,"말하고자 하는 메시지는 좋은데 그 메시지를 담는 스토리가 공감이 되지 않는다. 개연성 없는 부분이 상당히 많고, 특히 후반부의 갈등 해결 과정은 이해가 되지 않는다. "
4,"결국 작가도 어떻게해야 행복한지 모르는구나, 라는 것만 알겠는 영화.  뒤로 갈수록 진부 그 자체,,.‘창문 넘어 도망친 100세 노인’과 비슷한 느낌. 차라리 덜 노골적인 그 작품에서 행복의 의미를 어렴풋하게나마 ..."
8,그냥 행복해지는 영화..  명작까지는 아니지만 수작까지는 충분히 된다고 생각한다. 
10,진짜 인생 영화를 찾았다.... 두고두고 또 봐야지 
6,행복이란 지금 살아있음을 온전히 느끼는 것! 
6,솔직히 좀 진부하네요. '행복은 멀리있는게 아니라 가까이에 있다.' 뭐 이정도로 받아들이면 될꺼 같네요 
7,생각해보니 나는 지금 행복하네 
6,다국적 해외로케 촬영 볼 거리가 상당할 것이란 기대를 했으나 볼거리도 감동도 원하는 수준에 미달.다소 코믹하게 연출하려고 애는 썻으나 왠지 번잡스럽기만 하다. 결국엔 러브가 주제였던 영화로 인생의행복이란 질문에 은근...
7,흠 결론은 기승전사랑? 나도 사랑을 해야되는데... 
6,볼거리가 많은영화... 주인공이 연기를 참 잘했다 
9,행복이 무엇인가에대해서 한번더 생각해보고 더 넓은 생각을 할 수 있게하는 영화! 
9,영화를보고난뒤 내가 행복해하는 순간이 언제인지 생긱해보게된다 
9,행복해지는 영화!일에 지친 일상 속에  오아시스 같은. 잘 가지고 있다가 나중에 또다시 꺼내보고 싶은 영화 
7,뻔한듯하지만 생각해봐야할 것들 
8,'나는 어떨때 행복한가' 를 안다는 것은 어쩌면 크나큰 축복일지도 모른다는 생각이 들었습니다. 
8,자신이 행복하지 않음을 인정하고 모든 것을 뒤로 한 채 떠날 수 있는 결단력을 닮고 싶다. 
10,사랑은 들어주는것!!엄마와 아아들의 얘기를 더 들어줘야겠다!보는 내내 행복했습니다 !! 
7,여행다니다가 결국 사랑찾아 돌아오는 이야기... 그래도 그 여정 속에서 행복에 대해 생각하게 만들어 준다. 
10,행복이라는게 뭔지 생각하게되는 영화.... 그리고 내안의 상처받은 어린 나를 토닥여주어서 영화를 보는 내내 훌쩍이게했던.. 
9,적어도 무언가는 남는영화다한번쯤 다시 생각해보게 하는영화 
10,인생을 다시 생각해보게 되는 영화네요 
10,영화를보며 같이여행했다는 기분ㅎ 
7,"결론은 집떠나면 개고생입니다, 행복은 멀리서 찾는게 아니라 주변에 있는것 "
9,정말 영화 보는 내내 사이먼 페그 형님 따라 인생을 뒤돌아보는 힐링 여행한 느낌??ㅋ 옆에 꼭 안아줄 애인이나 와이프가 없어서 아쉽 
5,꾸뻬씨는 잘 나가는 정신과 의사라서 행복을 찾았으나 대게 평민들은 해당사항 없다는 영화 
7,행복 여행은 아프리카나 중국을 안 가는 것?? 
7,어찌보면 뻔한 힐링물. 
10,행복하고 싶어서 아등바등 살다가 보게된 영화. 
9,"영화를 보고  좋은 점수를 주고 싶었다. 그래서 많은  이들이 행복에 대해 생각하고, 또 행복해지는 시간을 갖게 되길 바란다. "
10,마음이 따뜻하고 행복해지는 영화 ♥ 
10,짱재밌다능짱재밌다능 
10,재미있게봤고 다음에또보싶네요 
8,책도영화도힐링힐링~ㅎ 
1,"여자친구가 있음에도 다른 여자와 자고, 그것을 행복이라고 정당화하는 전형적인 남성 중심의 영화. 행복을 찾는 과정에서 개연성과 특유의 오글거림. 최악이었다. "
4,그냥 뻔한 영화. 신파 아닌 신파 
6,이거 보면서 안행복했음 
7,사람의 행복은 뻔한거지 
1,이렇게 시간 아까웠던 영화는 처음.. 
10,"순수함을 잃어야만 성장하는 것은 아니다,사랑할줄 알고 사랑받을 줄 알면 성장하는 것이다.그 것이 바로 행복.세상 모든 헥터의 여행을 응원합니다.그리고 그 끝엔 반드시 무언가 하나 채워서 돌아오길to 행복이 있는 그곳..."
9,
10,살아있는 것만으로도 행복이라는 걸 느끼게 해준 영화. 
10,사랑해요 헥터형행복해졌어요 
10,
10,행복을 찾는 여행이 아니라 진짜 행복여행임 ㅋㅋ 약간 제목낚시 당한 느낌이지만 재밌게 봤음 
7,나도 여행다니면서 행복 찾고 싶다 - 회사에서 쓰는 감상평 
10,지금 전 세계가 코로나 바이러스 때문에 난리인데~ 건강하면 그게 행복한거다. 
10,
10,"사람을 행복하게 만들어주는 영화입니다.지루한 일상을 떠나?행복을 찾아 떠난 여정에서 다양한 군상들을 접하는데, 결론은 '사람은 누구나 행복할  의무가  있다'가 핵심입니다! 좋은영화 고맙습니다~♡♡ "
7,
10,이게 바로 어메리칸스톼일이지 
10,행복은 애써 찾는게 아니고 지금 그 순간이 행복하다고 느끼는것 
9,결말부를 제외하면 너무 행복한영화 
10,귀에 걸면 귀걸이 코에 걸면 코걸이 행복은 그런것이라는 이야기 거창하고 근본적인 것을 찾으려 한다면 시간낭비 
8,아무 생각없이 보면 기분이 좋아진다. 오히려 약간의 어색한 연출이 아무생각 없이 보라고 부추기는듯 하다. 
10,행복. 책읽는대한민국착한민국... 
10,
10,동생이랑 봤는데 많은 것들을 생각하게 해주는 영화라며 칭찬했어요 
10,행복은 바로 내 옆에 있다는거때론 무모한 여행이 나에게 큰 변화를 줄 수있다는것 
8,
8,
8,"행복은 부차적인 것이다.삶의 기쁨,슬픔,두려움 속 모든 곳에 있다 "
9,힐링영화!! 헥터가 여행을갈때 첫사랑 사진을 들고간것만 좀 불편했고;;  나머지는 다 유익하면서도 철학적인면이 돋보이는 영화였다 
10,좋은영화다  매우 재밌었다 
10,감동이 큽니다 행복이 목적이 되어서는 안됩니다 슬픔속에도 행복이 있고 우리 인생 전체에 모든 것이 다 들어있어요 환희 경멸 공포 쾌락. 살아있음에 감사하며 살기로 햐요 
10,행복을 찾아서 떠나는 이야기가 우리 모두를 대신해서 찾아나서는 것 같은 느낌을 받았다.결국 행복은 가까운 곳에 그리고 내가 마음먹기 나름이다..!! 참 좋은 영화 
6,인생은 불행과 행복의 연속이자 필연적이다.우리가 할 수 있는 것은 불행한 때에 언젠가 다시 행복해진다는 사실을 잊지 않고 행복한 순간 그 행복에만 집중하는 것이다. 
10,나는 행복을 존재하는 것 이라고 정의하겠다. 
8,로자먼드 파이크 우숩게 보면 안됑~~ 
10,너무 감동적인 영화 마지막장면이 멋졌어요 
10,요즘 자꾸 우울해져서 힐링영화 찾아보다 보게 되엇는데 너무 보길 잘햇다 
10,우리는 삶을 온전히 느낄 의무가 있다. 오로라처럼 
7,아주 화려한 선물상자에 담긴  모나미볼펜 
10,전 너무 좋았네요. 엔딩크래딧 올라갈땐 제가 웃고 있더라고요책에 손이 안가서 영화로 먼저 접했는데보고나니 책을 빨리 읽고 싶어 졌습니다. 
8,헥터와 함께 행복을 찾는 여정에 동참하게 되는 영화. 모든 사람에게는 행복할 권리가 있다. 
10,여자내용만 싹 다 뺐다 생각하고 보려 노력함무튼 ..그렇게 보니깐 힐링이 충분히 되는 영화? 였다 
1,jkhluykyutjytgj 
10,10. 고구마 스튜 !!! 
5,왜 나 쫘찌쭈는 햄보칼 수가 업서 
10,왜 넌 핵터가 아니라 꾸뻬야?? 
7,여행내용은 흥미로웠는데 결말이 좀 아쉽다..사랑이야기로 행복이 마무리되는건 좀 뻔한 결말이 아니었나 싶음 
10,"많은 사람들이 힘든 삶을 살고 있지만 행복이 다가올 날이 있을거에요. 꼭 슬픈 일만 있는것이 아닌것처럼 곁에있는 사람들로 인하여 웃게되고, 노래를 부르고 춤을추고 대화를 나누며 함께 즐겁게 놀고.. 생각만해도 미소짓..."
