score,review
7,"꾸뻬씨와 함께  행복을  찾아보려 했지만,  조금  상투적인  부분이  많았던거  같고,  월터보단  진지하였고  많은  이야기들이  있었지만,  무언가  조금  부족했던거  같다. "
9,기분좋았던 여행! 이었습니다~! 
8,"유쾌, 상쾌, 코믹하면서도 진지하게 행복이란것을 생각하게 하는 영화~ 영화적으로도 깔끔하게 잘 만들어진 한해를 마무리하기에 더없이 좋았던 영화. 소장하고 싶은 영화, 친한사람에게 권해주고 싶은 영화^^ "
10,가슴벅찬 감동이 있었습니당 
9,행복의의미를새삼일깨우는행복한영화신년에보기에최고! 
10,좋은영화 입니다~ 인생을 돌아볼 수 있는 잔잔한 감동 
8,저는 좋았는데 동생은 싫답니다. 
10,재밌게 봤습니다. 또 보고싶네요. 
10,헥터의 여행을 통해서 스크린을 통해서나마 다양한 사람들을 만나 여러 경험과 추억을 쌓고 행복의 의미를 찾을 수 있어서 좋았어요♥ 책보다 여자친구의 비중이 높아서 연인들끼리 보면 더 좋을 것 같아요ㅎㅎ 
9,여행하는 느낌의기분좋은 느낌을 주면서도그리 가볍지는 않은 괜찮은 영화 
9,딱 맞는 말이다... 찾으려할 수록 멀어지고 잊고지내야 찾아오는 것이 행복. 
10,"기분좋아지려고 본 영화! 정말 그대로 기분이좋아졌던, 행복은 정말가까이에 있다는것! "
10,중요한 시험을 앞두고 너무 답답하고 불안했었는데 영화를 보고나서 마음이 한결 나아졌습니다. 다시 한번 보고싶은 영화네요. 책도 읽어봐야겠어요 
10,내게 지금 가장 필요로 했던영화^^ 
8,꾸뻬씨역의 사이먼페그의 연기가 돋보이는 영화 
9,꾸뻬씨 행복여행 정말재밌어요추천합니다연말 가족이 같이보기에도 좋아요 
10,행복에 대해 생각해보고 인생을 다시 되돌아 본 영화. 보고 난 후 엄청난 행복을 느끼게 되었다. 
9,행복에 대해서 내가 가졌던 생각을 바꿔준 영화 
10,그땐 미처 알지 못했지 라는 노래 제목이 
9,꾸뻬씨 처럼 나의 인생도 행복을 
7,"메뉴얼 반복상담뿐인 정신과의사 꾸베씨의 유년시절 트라우마를 안고 떠나는 행복치료제 찿기여행. 수수한 분위기는 좋았으나, 우여곡절없이 끊어붙인듯한 이슈연결과 행복정의를 찿아 떠난 여행이 꾸베씨 러브스토리와 행복권유 형..."
9,행복은 지금 이순간에 깨어 있는것.늘 가까이~~^^ 
8,결국 행복은 가까이에.있다는 것 
10,책을 먼저 보고 난 후 영화를 보았는데 책과는 또  다른 감동을 느꼈어요 
10,너무감동적이고재밌어요 
10,진찐마으이 따뜻해지고 생각이 많아지는 영화! 
9,재밌네요월터의 상상은 현실이된다랑 비슷 
7,행복에 대한 자기 자신만의 정의는 무엇인지를 알게 해주는 영화 
10,가족과 함께 보기 좋은 영화였어요 
9,꼭 한번 보세요 추천합니다 
7,뭔가 난잡함을 풀어놓고 행복을 갖다 붙이는것같지만 행복해야할 의무가있다는 말은 어렵고 힘든 누군가에겐 희망이 되는 말이다. 
8,좋은 교훈의 메세지가 담긴 영화였습니다 
10,"월터도 생각나고, 창문넘어 도망친 100세 노인도 생각나고.이런 류 영화 정말 좋아하는데,영화보는 동안 함께 행복여행을 한 듯한 느낌이었어요!^^ "
10,최고의 영화입니다!! 
9,평범한 꾸뻬 씨의 평범하지 않은 여행 
7,"재밌게 봤어요,ㅎㅎ 추천!!ㅋ "
10,우리모두 행복할 의무가 있다 
8,한해를 마무리하고 새로운 해을 맞이하는 이 시기에 꼭 알맞는 영화입니다 
8,"세상살이에 짖눌려 돌아보지 못했던, 삶의 본질에 대해, 행복에 대해 다시 한번 생각해보게끔 해주는 영화. "
10,생각할게 참 많았던 여행입니다 
7,현실과는 저멀리 떨어져있지만... 대리만족형 영화. 
9,그럭저럭.. 볼만하네용.. 
10,소소하게 잔잔하게 하지만 의미있게 전달하는 메시지가분명한 영화 ♥ 볼거리 음악 생각할거리 모두다좋았음 최고 
10,행복이 어려운 사람 모두에게 강추 합니다 
9,so gooood. so nice. We all have obligation to be happy. 
8,간간히 찾아오는 유쾌한 웃음!!:D 
8,남의 인생을 훔쳐보는 기분인데 묘하게  행복하다. 
9,항상 난 행복하게 살고있는건지 궁금해하며 행복을 추구하고 목표로하며 살아왔는데 행복이란거에 대해 다시한번 생각해보고 제 인생을 돌아볼수있게 해주었네요 ㅡ 스펙타클하진않지만 잔잔훈훈 
7,나로 인해 누군가가 행복을 느낄 수도 있고 살면서 끊임없이 발견하고 스스로 만들어가는 것이 진정한 행복이 아닐런지...정신과 의사 헥터의 조금 엉뚱하지만 유쾌했던 진정한 행복 찾기... 
10,뭉클뭉클.행복의의미.#행복은 있는 그대로 사랑받는것.#사랑은 귀 기울여 주는것. #행복은 목적이 아니라 과정이야야한다. #우리는 모두 행복할 의무가 있다. 
9,편안한 마음으로 볼 수 있어 좋았습니다. 
10,건설적인 힐링타임 이었다. 과거를 돌아보기 보다는 앞으로를 대하는 마음가짐을 다잡게하는 
9,재밌게 잘 봤네요. 공감가는 것도 많고요 
7,"알아도 할 수 없고, 몰라도 할 수 있는 행복 "
10,어려운 질문을 유쾌하게 설득시켜준다 
10,"행복은 생각보다 가까이 있지만, 그것을 찾기에는 수많은 과정이 필요하다. "
8,행복을 찾아줘  .... 
10,"행복이란 무엇인가, 나는 지금 행복한가 생각하게 하면서 영화 보는 내내 매우 유쾌한 영화 "
7,불행 없이는 행복도 없지 
10,우울했는데 행복에 대해서 물어봐주니 직접체험하지않아서 다행이에요 주인공 이름이 왜 꾸뻬인지는 잘모르겠지만 주인공의 행복정의가 끝이 아닐수도 있다고 생각할수도 있네요 
8,생각하게 만드는 영화. No more pretending. 
8,기분좋게 잘 봤습니다^^~~ 
9,진정핫 행복이 뭔지 많이 느끼게한 영화나의 가족 나의 일  나의 친구들 모두 소중합니다 
8,행복이란.. 생각이많아지던영화 
9,꾸베씨와 함께 여행할 수 있다는 것도 좋았다. 행복에 관해 생각해볼 수 있는 영화였다. 
8,온전히 살아있음을 느끼는 것 그것이 행복이다. 
9,연기대박... 영원한 나의 영울 Simon Pegg 
8,행복은 살아있음을 느낄 때 비로소 느끼는것이다. 
7,가볍게 보기 좋은 따뜻한 겨울영화 
10,진짜행복이란 나를찾고 나를인정하는것이네요ㅎㅎ 
8,다 좋은데 너무 영ㅎ하같은 영화라 별로엿당 
10,깨알 재미와 잔잔한 감동을 주는 영화 
8,보면 미소지어지는 영화. 행복에 관하여. 
8,모든정답은 내안에 있었다.단지 보지못했을뿐 
9,나또한 행복에 대해어 순간순간 고민햇엇다  이 영화를 보고 얻은 결론은 행복은 순간이란 것이다 순간의 행복을 위해 우리는 노력하고 몰입하고 집중한다는 것이다 그리고 행복이란 온전히 자신에게 달려있다. 
7,힐링?치고는 별로였다 
10,영화보는내내 너무행복했어요^^ 
9,행복의 기준을 생각해 볼 수 있는 영화 
10,대사 하나하나가 주옥같아서 곱씹어 보게 되더군요.우리는 행복할 의무가 있다...!^^♡ 
9,추천합니다츠허어넝초로ㅕ 
10,행복. 늘 찾고싶어하지만 우선순위에 두지 못하는데 다시금 행복을 누리고 싶단 생각을 들게 한 영화. 어디 멀리있는 행복이 아니라 삶에서 소소히 느낄 수 ㅇㅆ는 행복을 찾고 누리고 싶게 만드는 영화. 
8,너무너무 재밌엏어요.... 
8,마지막에 너무갑작스런 전개를 제외한 나머지는 훌륭했음 보는내내 여행다녀온 기분이었음 
9,영화 보는 지금 이순간 ..극장 문을 나선 이후로..그동안 난..앞으로도 난..행복합니다! 
10,많은걸 생각하게 해준 영화였습니다. 
7,재미있었음 내용이 짜임새있진 않지만 근데 여주가 에이미라서 섬뜩 
9,친구와 둘이 영화 재미있게 잘 보구 나옵니다^^ 
10,최근에 무미건조한 생활에서 나자신을 되돌아  보는  계기되고  주위에 환경이나  사람들이 나에게 많은  행복을 주는것을  깨닫게  해주었다. 
9,"모두들 행복한 삶을 원하지요. 행복은 우리들의 삶 속에 있지만 사람들은 먼 곳에 있을 것이라고 생각만 하지요. 내가 행복하다고 느끼면 그것이 행복의 열쇠이고 재산의 유무, 지위의 고하는 행복의 조건이 아닙니다. "
10,영화를 보면서 내 행복은 어떤 것인가 되돌아 보게 되네요. 뜻깊은 영화였어요. 
10,내가 가진 의무를 알려준??? 
10,나의 인생을 다시한번 돌아볼수 있는 영화 
8,용기를 조금 내고 이 영화를 보았습니다 행복을 찾으려 애쓰는 것 보다 일상 속 현재 모습의 나를 좀 더 솔직하게 바라보고 표현하면서 행복을 느끼는 모습이 주인공이 느끼고 찾게 된 행복의 참모습이었습니다~ㅎ 
7,행복에 관해 이런저런 정의를..접했네요. 세상 다양한 삶의 모습을 본 것에 만족합니다. 
9,요즘 고민하고 있다..나도 행복이 뭘까?그래서 생각할 여유를 갖게되는 좋은 기회..그래서 영화는 간접 경험.. 
8,현재의 상황속에서 행복에 대해 생각해보게하는 영화 
10,행복해.행복해!행복해? 
10,교훈을 떠나서 내용만 보고 그저 지루할것 같았지만 전혀 지루하지 않았습니다. 
9,"얼마전 유럽여행에서 돌아온나에게 많은생각을 정리하고 되내이게 해주는내용이엿음삶의의미 행복, 다음여행을꿈꾸고잇는 나에게 따뜻한 햇살을주는영화 "
9,"내용도 연기도 괜찮은, 차분하면서 신나는 영화. "
9,좋다~ 힐링 무비 웃고 울고 행복하고 사랑하고 아프다 
9,그냥 사이먼 페그만 봐도 웃음이 나온다 
9,슬프고 기쁘고 행복한 영화 
10,정말 행복한 영화에요♡♡♡감사합니다. 
9,귀엽고 따뜻한 영화!!! 
9,책은 좀 딱딱한 면이 있었는데 기대 않고 봤는데 완전 빵 터지면서 즐겁게 봤습니다. 각색이 참 잘되어서 좋았던듯합니다.^^ 
9,영화를 보는 내내 행복했어요!!! 
9,생각보다 재밌어요.. 
8,약간 뻔하고 잔잔하지만 그런 방향 안에서 굳굳 
10,보는내내 미소가 지어지는! 모두에게 행복할 의무가 있다는거ㅓㅓ행복햇으면좋겟다!! 
10,넘재미있고 유쾌한영화입니다 
10,보면서도 보고나서도 행복해지는 영화 
10,뭔가 많을걸 느낄 수 있었던 ... !! 
10,좋아요좋아요좋아요좋아요 
9,행복할의무가있는내인생!^^ 
7,주인공 행복했을지언정 영화 자체가 행복한 영화인지는 글쎄... 
10,두근 두근 귀여운 영화 ㅋ 
9,우와 보는것만으로 행복해졋다 !! 행복은 추구할 대상이 아니라 부수적으로 따라온다는것 정말 공감된다..! 우울할때 특효약이 될 영화. 난 지금 너무너무행복하다 고마웡 
9,굿굿굿 저는 재밋게 봤네요 ^^ 
10,행복에 대해 생각해보는 좋은 계기가 되었던거 같네요 책을 읽고 영화로 개봉되었다고 해서 꼭 보고싶었는데상영하는 영화관 찾느라 힘들었어요 ㅠㅠ 하지만 후회없는선택이라 생각합니당!!굿굿 
10,행복은 무얼까? 나 지금 행복한가? 영화를 보고 난뒤에의 풀리는 궁금증들~ 나 지금 행복하다! 추운 겨울날 마음까지 따뜻하게 해주는 영화! 행복은 구걸하지 않아도 나에겐 행복이 있다. 
8,나쁘진 않았는데 아주 좋지도 않았다. <월터의 상상은 현실이 된다>는 더욱 코믹하고 과장되기는 했지만 마음을 후벼파는게 있어서 완전 끌렸는데 이 영화는 깊이 파고드는 건 없었다. 
10,행복이란....자꾸만 되뇌이게 하는영화 
7,그냥저냥 예상가능한 그대로 흘러가는 힐링무비 
10,이토록 행복한 감정을 느껴본 적이 있는가 진지하게 내 자신을 돌아볼 수 있어서 감사하다 :) 
8,재미있었어요 필름포럼좋아요 
8,행복은 찾는게 아니고 불행이 안오길 바라는기 행복이 아니다행복은 어떤 답이 없고 모두가 느끼는 방법과 내용이 다르다다른 사람과 느끼는 행복이 다르다고그게 행복이 아닌게 아니다 그것도 행복이다 
10,"행복은 사랑하는 사람과 함께일때., "
9,"처음부터 중간까지 재밌었는데, 비행기타고 올때 뇌종양여자만날때부터 좀 진부해졌습니다. 무튼 힐링영화임 "
10,너무너무 잼있었어요. 
7,행복은 멀리서 찾지 말고 가까이서 찾는 것이라는 교훈을 주는 갠춘한 영화 
8,보고 나니 왠지 행복해지는 영화. 중간에 울음 ㅠㅠ 
8,윌터의 상상은 현실이 된다와 비슷한 감동이지 않을까 했는데 후반부로 갈수록 다른 재미가 있었네요. 저뿐만 아니라 모든 분들도 행복을 찾게 되길... ^^ 
9,조조로 보기엔 재밌는 영화네요 
10,책으로 보며 상상했던 영상들로 꾸며져있네요. 개봉관이 많디 않아 아쉬워요. 다른 사람들에게도 보라고 권하고 싶어요. 
10,백수 겸 취준생입니다. 오늘 너무 마음이 복잡해서 봤는데 최고ㅠㅠ 웃고 울고 생각도 정리하고 나왔어요. 평이 애매해서 볼까말까 망설였는데 오늘 보길 잘했단 생각들어요 굳굳 
10,긴여운이남는영화 고로난행복한사람 
10,짱. 여행가고싶어요.... 잔잔하고 좋아요 
7,현실과의 거리감은 있었지만 보는것만으로 행복했던... 
10,올해 본 영화 중 가장 좋았다! 
10,삶에 대해 한번쯤 생각하게 해주는  힐링 무비 
8,"적당히 따스하고 적당히 익살스러운, 쌀쌀한 날씨에 참 적당한 영화. "
10,흐뭇했다. ㅎㅎ무섭기도했음! 배우 ㅇ ㅣ미지때문에ㅎ 로자먼드 파이크ㅎㅎ 사랑스러웠음 이영화에선 
10,울컥울컥 하면서도 힐링된 영화 
9,"행복을 찾는, 여행! 이라는 자체가  좋았다. 여행하면서 핵터가  기록한 내용들을  끄덕끄덕이며 재미있게봤습니다! "
8,"기대했던것보단 확 와닿지 않았던 영화, 하지만 삶을 다시 한 번 돌아보게 된다 "
10,중간중간 나왔던 행복의 정의를 따라 나도 나만의 행복을 정의 할 수 있는 기회가 주어졌다! 
10,이 영화는 진짜 봐야된다 안보면 후회한다 책을 읽지않았으면 영화라도 꼭 봐야한다 
10,행복을 생각하고 행복을 느끼고 행복을 찾는다. 그리고 기록한다. 
9,이런 뻔힌 주제를 이렇게 다채롭고 감동적으로 담아낼 수 있을까??여운이 많이 남는 영화 
9,책보다는 살짜쿵 섭섭하지만 그래도 살아감에 있어서 행복함을 생각하고 느낄 수 있는 영화입니다 
8,어느 정도 생활이 안정적인 헥터같은 사람들이 봤을 때는 이 영화는 감동적인 영화지만 하루하루 먹고살기 힘든 보통 사람들에게 있어 이 영화는 사치스러운 영화다. 하지만 이 영화를 보는 동안만은 재밌고 행복했다. 
10,모든 행복은 그 과정 속에 있는 것이다. 그 과정들 안에서 발견하고 찾아내는 것이라는 것을 잘 얘기해주는 영화였습니다. 모든 행복은 내 마음 속에 있는 것. 
7,불행을 피하는것만이 행복이 아니다 6번!! 맘에 들어용! 
9,기분이 좋아지는 영화예요 
8,영화를 보는 동안 행복해지는 느낌. 행복이란 먼곳에 있지않다. 
8,소설을 보지는 않았지만...소소한 재미를 느끼면서 감동을 받았던 영화!주말의 마지막을 기분좋게 마무리 했네요 
9,행복해지는 영화입니다. 
9,"차근 차근 행복의 목적을 찾아나가는 헥터(사이먼 페그)의 여정을 통해 행복을 의미를 잘전했다고 볼 수 있군요, 그동안 이런 영화들이 많이 있었지만 이렇게 차근차근 행복을 의미를 정리한 영화는 이뿐이라고 봅니다. "
8,잔잔한 감동이 좋았습니다. 
8,"행복이란 무엇인가, 다시 생각하게 해주는 좋은 영화네요.^^ "
8,대체적으로 만족스러웠습니다. 전 끝부분이 인상적이었습니다. 
8,잔잔하게 볼수있는 영화 
7,돈을 벌어라.  좋은 집 사고 결혼할 만큼.  그러면 행복은 니 가족에게 있다... 한국에선 ? 좀 웃어도 되냐 
10,소중한게 뭘까? 많이 고민됬던 순간.. 
10,꾸뻬씨의 행복여행보고행복찾았네요행복찾으세요그럼 20000 
8,"오히려 저는 책내용을 그대로 답습하지 않아서 더 좋았던것 같아요. 맥락은 비슷하지만 살짝살짝 변형을 가미한....헥터의 수첩내용도 재밌고 그림도 귀엽고 훈훈하게 웃음지으며 본영화네요~!근데 상영관이 너어무 없어서,,..."
10,고구마스튜 만세 ! 헥터도 만세! 
10,행복함을 계속 묻지만결국 행복을 느끼게 해주는 영화 
10,나에게도 행복할의무가 있다~^^* 
9,난 그냥 인터스텔라보다 좋더라 
10,영화가 좋다는 말이 맞을것같다책도보고싶다한글자한글자 너무 좋은책일것같다 
8,오랜만에 좋은 영화! 잔잔한 여운 
9,행복해지는 영화부모님도 보여드릴 예정! 
8,구성이 좀 억지스러운것도 있었지만 대체적으로 재미있었음.. 특히 마지막 장면은.. 누구나 행복할 의무가 있다^^ 
10,"행복은 멀리 있지 않다는 진부한 내용일 수 있지만, 그 과정을 재미있게 잘 보여준 것 같다. "
10,2014년 나의 최고의 영화! 
8,훈훈합니다 감동입니다 
7,깊은여운을 남기는건 아니지만 가벼우면서도 유쾌한 따스함을 주는 영화~! 추천합니다~ 
10,정말 따뜻해서 행복한 영화였습니다. 
8,급 마무리한 느낌이 있지만 괜찮은 영화 
10,2014년이 지나가기전에 꼭보세요! 
9,제게 딱 필요한 영화였습니다 
7,받아들이는 사람에 따라 다르겠지만정신과  간화사로 일하는 사람으로써많은 경험을 쌓아야 겠다는 생각과역시 잃어야 얻는다는 교훈을 새삼 되새기게해준따뜻한 영화였네요~~^^ 
7,나의 행복은 무엇인지를 생각해 볼 수 있는 영화! 
10,"'영화관에서 돈주고 볼 영화'는 도데체 어떤 영화인가. 나는 그저 8000원에 행복함을 느끼게 해준 이 영화에게 감사하다. 요즘 같은 세상, 살아남기위해 사는 우리에게 좋은 영화였다. 돈주고 볼 영화 ..."
10,"보통 책을 기반으로 한 영화들은 원작에 못미치는 경우가 더러 있는데,이 영화는 책과는 색다른 재미를 느낄 수 있게 해주네요. 처음부터 끝까지 행복한 영화에요. "
8,내자신에게 행복은 무엇인가릏 묻게되는 영화 
10,잔말말고 10점.  OO내에 이런 영화는 나오기 힘들거다. 
10,"많은 생각을 하게 만드는 영화, 유머도 있어서 지겹지 않았음 "
8,아프리카 드넓은 평원을 거닐던 코끼리 가족.. 가슴 벅찼다 
9,행복이 멀까 생각하게 만든다 
10,행복여행 책도 꼭 보고 시프네요~ 
10,너무 좋았습니다. 가슴이 복차오르고 헥터가 점점 행복해질수록 같이 행복하고 미소짓는 내 모습을 느끼며 더 행복해지는 두시간이었습니다. 많은 사람들이 제가 느낀 이 행복을 느꼈으면 좋겠습니다. 
10,혼자보세요! 마음에 와닿는영화 
7,쳐지지만 뚝심있는 행복론 
8,어떻게 하면 행복해질수있는지 고민하게 만드는 영화! 
9,좋은데이영화?진짜로 
9,좋아요 보세용 인터스텔라보다 더 나음 
9,행복에 대해 생각하게 되는 행복한 영화!! 
10,꿀잼꿀잼꿀잼꿀잼꿀잼꿀잼꿀잼 
9,새글자로 개굿임.개인적인 생각으론심야로 혼자가서 보면 더좋을것 같네요 
9,다소 진부한 스토리지만 삶의 의미 행복의 의미를 다시금 깨닫게 해주는 영화. 
10,책을 보고 영화를 봐서 그런가 좋았네요 
9,"그동안 잊고지냈던, 궁금해하던것들이 다 담겨있는 영화네요. 난생첨으로 평점도 올리게 만드는 힘이에요.. "
10,"내생애 최고 영화다!! 살아있음을 온전히 느끼는것이 행복,, "
10,정말...최고의 영화였어요. 감동적이고 잠깐 두시간동안이라도 행복한 시간이었어요~ 
9,보는 사람에 따라 지루할 수도 있지만 볼 수록 잔잔한 미소를 짓게 하는 마력이 있는 영화. 난 행복해질 의무가 있으니까^^ 
9,인생은 오로라 칼라죠.희노애락이 골고루 섞여야 빛나는 삶이라는걸보여주네요. 
10,보고보고 또 보고 싶은 영화 
10,좋은 영화. 행복에 대해서 한번 더 생각해보게 해준다 :) 
7,"조연들의 세상을 다 안다는 듯한 오버연기와 감동을 강요하는 오글거리는 대사, 뭔가 중간중간 떼어먹은 것 같은 편집 때문에 지루함도 느꼈던 영화. 중국에 도착할 때까지랑 영화의 큰 흐름은 나쁘지 않았던 것 같은데 말이..."
9,연출이 조금 아쉽긴했지만 좋은 힐링영화였어요. 영화를 보는 내내 많은 생각을 해주게 하는 영화. 찍은 사람들도 행복했을거 같아요 ^^ 
10,그냥 있어보여서 10점드림 
9,행복은 멀리있지않다. 
10,좋아요 여행가고싶네요.. 
10,여친이랑 상영관에 2명이서 봐서 행복한 시간 가졌습니다. 행복한 120분이었습니다. 
10,생각하면서 즐기면서 봤어요 자신에 삶을 돌아보고 힐링이 필요하시다면 꼭 보세요 강력 추천합니다 
10,또보고싶어♥힐링영화 여배우발음너무섹시하구ㅎㅎ 
10,난올해개봉작중에제일좋더라 
10,개인적으로 최고였어요 all of them!! 정말 인생도 행복도 한가지 감정으로 규정지을수없는것같아요ㅋㅌ 
10,간만에느끼는 진한감동 
10,이번년도 영화중에 제일 좋았네요!! 인터스텔라보다 더요 ㅋㅋ 감동적이었고 중간에 괜히 눈물이 날것같았어요 
9,"행복한  영화, 저도 떠나고 싶네요 "
8,행복을 찾는 여행 과정에서 정서의 성장을 겪고 오다. 
9,당신은 행복하신가요? 
9,"책으로 읽을 때도 좋았고, 영화로도 잘 표현된것 같아서 만족했어요, "
10,납치된 헥터가 공포에 울며 한 말이 와닿는다. '내가 정말 행복한 사람이 될 수 있을까.' 행복이 궁금하다며 만나는 사람마다 행복을 물으며 리스트를 만들고다니던 헥터는 알고보니 행복을 대상으로 방황하던...
9,좋은 영화입니다ㅠㅠ 행복에 대해 생각하게되는 영화네요.. 
9,행복을 찾는 통합사전이네요우리는 언제나 인생을 외줄타듯이 하루하루를보내는데...이 영화는 인생의 방향을 잘 잡아주네요 
7,결말이 조금 아쉬웠지만 그래도 행복에 대해 생각하는 계기가 된 것 같다 
9,슬프지 않은데 자꾸 눈물이 났다? 
10,이 순간의 스쳐지나가는 행복을 놓치지 않기 위해서 우리는 이 영화를 보아야 한다. 
9,불행을 피하는게 행복은 아니다.. 찡했네요. 소장하고 볼 만한 영화 같습니다. 딱히 보고픈 영화가 없어서 선택했었는데 굿 초이스였네요. 
10,너무너무 아름다웠던 영화 
10,잔잔하게 다시 자신을 돌아보게 만드는 영화네요. 책도 읽어봐야 겠습니다 ^^ 
10,정말정말 좋은 영화입니다!!! 
10,"기대 전혀 안하고 봤는데, 좋았습니다 정말. 저도 많은 기분을 느끼게 된 것 같습니다 "
10,뻔한 스토리지만 다시 한 번 나위 삶을 되짚어볼 수 있게 해준 영화 
10,진짜 좋아요. 하나 하나 버릴 게 없는 에피소드. 연출도 연기도 스토리도 완벽! 행복해지는 영화입니다 
8,소소함의 행복의 의미를 느낄수있는 자잔한영화입니다.. 
9,행복에 대해 알려주는 영화. 
7,책을 읽었을때는 오히려 식상한 주제라고 여겼었는데..영화로 보고나니 나의 행복한 순간들을 떠올려보며 행복해짐을 느꼈다. 
10,엄마랑 봤는데 푹 빠져서 봤어용책의 내용을 잘만든듯ㅋㅋ♥ 
9,이거 원작 책 맞죠?? 저번에 이보영에 예능에 나와서 추천해준 책이였던거 같은데 
9,각각 서로의 여러가지 행복을 정의한 말 중 ‘불행함을 피하는것이 행복은 아니다’ 내게는 이 말이 가장 기억에 남는다 
10,사회 수행평가때문에 보게되었는데 잠시나마 학업은 잊고 행복했었습니다 
9,행복은 항상 가까이에 있었다. 
10,죽음을 두려워하는 사람이 삶도 겁낸다.. 
6,너무 큰 기대를 한 탓인지 생각보다  재미는 없었다. 그냥 뻔한 코믹한 드라마... 
7,볼만했다. 초반에 로자먼드 파이크가 무서워서 좀 집중이안됨  나를 찾아줘에서 워낙 강렬했던지라..ㅋㅋ죽음을 겁내는 사람이 삶도 겁낸다는 대사가 기억에 남는다. 원작도 읽어봐야지 
9,러닝타임 내내 행복에 대해 말하지만 보고나면 오히려 행복에 대한 생각을 멈추게 되는 영화 좋았던 대사를 다시한번 곱씹어본다. 행복을 추구하지 말고 추구하는 것에 행복을 느껴라 
