score,review
8,이거 실화 아녀? 저런 범인은 이근안에게 3096일동안 고문당해야 하는데. 
8,이영화 왜 개봉한 영화관이 없죠??? 더 못한영화들도 개봉많이 했던데 
8,크게 자극적인 장면은 없고 실제보다 약하게 다뤘겠지만 심약한 나는 오늘 하루종일 이영화만 생각나서 괴로웠다 실화라는 사실때문에 더더욱 그런듯 마음 약한 분들에겐 비추합니다 
7,마지막에 탈출하여 부모에게 돌아갔음에도 느껴지는 이 허무함과 씁쓸함...그 여자아이 인생에서 잃어버린 8년의 세월은 누구에게 보상받나... 
7,제발 이거보고 따라하는 ㅁㅊ사람없었으면좋것다 
8,"뼈만 남은 나타샤는 최고의 캐스팅.. 영화가 거의 주인공 둘로만 진행되는 만큼, 둘의 연기도 아주 좋았다.. 어린이를 향한 범죄는 정말 없어져야한다 "
10,3096일 후덜덜;;; 
10,극적으로 탈출에 성공햇을때 가슴이 팡팡 뛰었다.주인공의 지난 악몽은 결코 지울순 없겠지만 앞으로 행복했으면 좋겟다 
10,세상엔미친넘천지다...그피해자가다들여자라는데서경악을금치못한다..무슨생각으로 납치사육을할까?도끼로처주기고싶다..혀도자르고눈도빼고.. 
6,설마 이시간에도 이런일이 세계곳곳에 일어나고 있을까...끔직하다.... 
10,지금도 어딘가에선 납치된 아이들이 있을텐데...먹먹하다. 
10,열려있는 문을 향해 달려갈때 왜 그렇게 시간이 느리게 흘러가는것처럼 느껴졌을까 
9,실화라고해서 검색어에 떠서 영화를 보게됐는데..차라리 허구였으면하는 참담한 현실에 마음이 참 그렇네요...책도 꼭 읽어봐야겠습니다 그 누구보다 강한 멘탈을 가지고있는나타샤 캄푸쉬양이 행복하기를 
8,다행이다. 이 말밖엔 못하겠다. 쓰레기같은 놈. 
9,영화끝나고 박수를 쳤다. 편집의 묘미. 소품도 최대한 사실적으로 표현하려한듯 깨알같은 디테일이있다. 
10,굳 볼만한듯 ㅋㅋ!!@@ 
8,이것이 실화라는것에 억누를수 없는 분노가 느껴진다 
8,매우 리얼하다 배우들 연기도 좋았다 
8,매범 탈출할 기회가 있음에도 주저하며 그렇게 하지 못한 주인공의 마음은 어땠을까? 가슴이 아프다 연기가 매우 좋았다 
6,배우들의 연기가 좋았다. 영화 흐름상 납치범과 나타샤가 서로를 점점 인간적으로 받아들이고... (선물을 준비하거나 하는 ) 실제로 남자가 자살한 사실을 안 나타샤가 울면서 경찰을 향해 살인자라고 소리쳤다고 하던데.....
10,어떻게 버텨쓸까... 
7,나타샤 캄푸시.. 8년하고도 반이라니.. 확실한 것은 둘중 하나는 죽어야 끝난다는 것이고.. 살아난 남은 것은 나였다.. 그노마는 걍 자살한 것두 넘 편하게 죽은듯하다 
8,범죄자가 자살한것이 마치 똥싸고 휴지로 안닦은 느낌이네요 하지만  실화라니 어쩔수없는 일이라 생각하고 영화잘봤습니다 
10,송지효닮지않음??? 
8,이게 실화라니?! 세상엔 미친넘들이 참많다. 이유없이 8년동안 사육되다니..잃어버린 8년은 누가 보상해줄까?. 마지막 장면에서 참 먹먹했다. 
10,와 어린아이 납치해서 키워서 자기 부인 만들려고 했네 
7,애들교육에안좋다고글올린분 말하는거참골까네.당연히 교육에 안좋으니청불인건데애들교육이오ㅐ나오지? 그걸보게만든부모탓이지.그것도평점이라고 1점주면서 깍아먹어야되겠음? 
9,자살한게 너무 안타깝다...잡았어야 했는데... 
10,"주인공이 탈출시도햇을때 가슴이 콩닥콩닥. 정말 다행입니다. she survived, not him... 부모님을 다시만나는 장면에서는 정말 울음이떠지는데...요란하지않이서 더 몰입할수있었던 영화. 추천합니다 "
10,주연배우들 연기가 정말 실감나고 여주인공은 역을 위해체중까지 줄였다니 참 대단하다 실화라는게 너무 소름끼친다 끝까지 탈출하겠다는 희망의 끈을 놓지 않은 나타샤 캄푸쉬...그 어떤 상황에서도 희망을 가지고 꿈을 가져야...
10,첨부터 끝까지 핵 암이다  이미 길들여져버려 기회가 여러번있었을때도 도망못가는 자신을 차책하는모습이 너무 마음아프고 범인놈이 어린아이를 건드리고 마지막엔 법의 심판을 받지않는모습도 암이었다 그래도 살아나와서 정말 다...
7,"두 주인공, 특히 여주의 깡마른 몸매와 초췌한 몰골은 배역 몰입에 탁월했다. "
9,영화를 위해서 살을뺀건가 ? 진짜면 크리스찬 베일급이네 
10,재밌는데 재밌을수없음 
10,오스트리아 비엔나 동쪽 지역에서 일어났던 실화.. 
7,실화를 바탕으로한 소재는 흥미로웠고 두 주연배우들의 연기도 좋았다. 다만 전개와 연출은 좀더 극적이고 몰입도 있게 할수 있었을텐데 하는 아쉬움도 남는다. 
8,영화 보는 내내 투레 린트하르트 볼프강 역을 맡은 이 사람 죽이고 싶었다 진심 그 정도로 그 사람에게 몰입되는영화였다.그리고 이 영화 실화면 3096일 동안 대체 어떻게 보상한단 말이냐 
10,정말 강한 여운이 남는 영화 ....너무 마음이 아파요 꼭 보세요 
8,"당사자는 얼마나 끔찍한 시간들이었을지 짐작도안된다. 왜하필나냐고했을때, 어린나타샤를 기억하며 날보고웃어줘서 그랬다고.. 편하게죽은 납치범이 너무밉다.. 그래도 마지막에 탈출하여 너무 다행.. "
7,볼만합니다.  보는 내내 안타까움이 드는 영화 
9,진짜 소름돋고 보는내내 너무 안타까웟다..ㅠㅠ 범인새끼 똑같이당해야되는대 
8,배우들 연기력이며 몰입도도 좋았다잼있게본듯 ~ 
10,오베이..오베이.. 
8,재미는 없는데 몰입은 하게되는 영화 
10,충격  그자체....사람이  어떻게 그런짓을 
9,다신 이런일이 없도록 해야합니다. 
10,범인은 정말 인간 취급하기가 아까울 정도로 인간의 탈을쓴 악마 같고 찢어 죽여도 모자를 판이다. 반면 3096일 동안 포기하지 않고 버텨낸 나타샤 캄푸쉬가 정말 대단하다. 
9,"이게 실화라니.. 세상에 이 같은 일이 두 번은 없어야 할던데... 볼프강을 멀끔하게 표현했다는 것과, 많은 씬들이 너무 밝게(비극 속 익숙해진 생활 공간 속의 소소한 즐거움?) 표현된게 아쉽긴 하지만, 엔딩까지 보..."
9,"와....,...이런일이실화라는게미껴ㅈㅣ지 가안앙  대박 "
9,"긴장감넘치는 스릴러물이 아니라, 보통사람의 일상처럼 차분하고 평온한 드라마구성으로 보여준다. 그것이 결국 새벽 물안개같은 긴여운을 남게한다. 남녀 주연배우들의 연기가 큰 몫을 해주어..두번은 못볼것같다. 그저 나타샤..."
8,이거 책으로 읽었었는데.. 앉은 자리에서 다 읽은 기억이... 마지막이 잠잠해서 더 소름끼쳤던 소설이였는데 영화로도 나왔네... 나중에 봐야지. 
6,실화의 무게감이 그대로 전해지는 절박함과 막막함 
8,여자 배우의 연기가 정말..대단했다 정말 모든게 완벽했다 가끔씩 여주인공이 떨면서 숨을 내쉴땐 나 또한 같이 숨이 차는 듯한 느낌을 받았다 고작 140자로 다 말할수 없을만한 영화.. 다만 한가지 아쉬운점은 실화라는...
9,잔잔한 스릴러이자 긴박한 드라마. 
10,배우들의 연기가 좋네요. 특히 꼬마 아역배우의 연기를 보면서 아려오기까지 하더군요. 
8,멋모르고 뛰어놀 나이에.... 에휴... 맘아퍼... 
8,보는 내내 가슴 답답한 영화ㅠ 
8,남자 자살하지말지 미친 
10,정말이지 치가 떨리는 이야기라 짜증난다.  인간이란게 어떻게 이렇게 욕망적인 동물인지 보여준다. 조물주가 있다는면 당신의 가장 큰실수는 인간이란 동물 만든것이다. 
10,저 감금되고 폭행당하고 복종하고 사는 주인공은 미치 우리들이 키우는 강아지들 같아서 보는 내내 마음이 아팠다 
10,이게 실화라니. 정말 징하다. 밴으로 시작해서 밴으로 끝나는구나. 자극적이고 강렬한 장면은 없으나 너무 마음 아픈 영화. 흥미보단 주인공감정에 이입되서 보다보면 시간이 훌쩍 갈 겁니다. 평점 8점은 된다고 생각하는 ...
8,"'룸'도 재밌게 봤지만 이게 더 몰입감 있다. 여배우들의 연기가 정말 빛난다. 피해자의 심경변화를 큰 설명없이도 캐치할수 있다.   몇부분에서는 공포영화를 보는 듯 했고, 이것이 실화라는게 너무 안타깝..."
10,우연히 티비에서 보게 되었는데 여주인공 다이어트 하느라 정말 고생했겠다 영화와 상관없는 리뷰지만 안토니아 켐벨 고생 많이 했어요 
7,실화라는 사실에 굉장히 충격이었다...소름끼친다. 
9,이 영화가 실화라니;; 충격적이다..사람들이 보고 꼭 알아야할 이야기 인것 같다...우리가 알지 못하는 곳에서 벌어질수도 있다..; 세상이 얼마나 무서운지 다시 한번 깨닫게 된 영화이다... 
7,"영화가 전반적으로 지루하긴 한데;; 창작물이 아니라 실화를 있는 그대로 옮기고 고증하다보니 그런건가...? 제작팀의 노력과, 배우들 열연이 돋보인 영화. 특히 여주인공은 가끔 기절할 정도로 다이어트 했다는데 ㅎㄷㄷ "
5,실화라니 믿기지가 않네 참 세상 이상한새키들많아 
10,탈출하는 장면을 볼때 나도 모르게 숨죽이고 긴장하고 봤다 
10,몰입도도있었고 긴장감도있다. 어떻게 저렇게 납치해서 사육할생각을했는지 끔직하다 . 거기다가 실화라니 더 놀라울따름. 
6,영화보는데 서세원이 생각나네. 
10,영화의 나타샤 캄푸쉬에게도 현실의 나타샤 캄푸쉬에게도 그 용기에 박수를 보내고 싶다. 
10,유괴한 이놈 정말 미친놈... 
9,일단 너무 가혹한 장면이 없어서 괜찮았고 재미있었다. 주인공 남자가 훨씬 찌질하게 나왔으면 더 현실성있었을거같다. 너무 정상적으로 보였다. 또라이 같은 느낌이 안듦. 후반부로 갈수록 걍 짜증났음  볼프강 
10,끝이좀허무하긴한데 진짜소름돋고 진짜보는내내조마조마햇음실화라니깐더슬픔... 
9,몰입이 잘되는영화였음.. 실화라는게 참.. 
10,무서워요 ㅠㅠ 이런일 없었으면 
10,실화라니 영화에선 약하게 다뤘겠지만 연기가 좋아서 몰입도도 있고 이래서 CCTV가 필요한거 같다 
10,"지금 실화인지 아닌지 검색하러 들어오게 되었네요. 그만큼 보면서 연기력, 작품성스토리에 감탄하면서 보았습니다. 추천합니다. "
7,[7점] 3096일 대단합니다. 
7,영화적으로 따지고 자시고 할필요가 없는 영화다.그냥 상상만으로 끔직한 실화애 관한 다큐 한편 보았다고 생각하면 된다.갈아먹어도 시원치 않을 범인놈! 
10,자극적인 장면 없이 강렬한 충격...여운이 너무 오래가서 힘들정도로 소녀에게 이입이 잘된다... 정말 무서운 건 '보이지않는 포박'이라는 점... 한국에서 이런 범죄가 나타난다면 피해자를 탓할게 불보듯...
8,가슴 아픈 납치사건을 다룬 실화 ! 
8,갑갑함을 뒤로하고 현실을 직시하면 이 영화는 바로 현실이 된다. 
9,이게 인기검색어에 올라오다니 페이스북 피키케스트의 위엄인가 
9,픽션이 아닌 실화인지라 보는내내 감정이입되고 잼있게 잘봤음. 
10,영화 잘 만들었네~추천보는내내 시간이 어찌지나갔는지도 모르겠다책으로다시보고싶다 
10,어찌해서 살아남아서 무조건 뒤를 쳐라 그리고 죽여라. 그래야 한이 없다. 
10,모든게 디테일함. 세부적인 내용도 실제와 같음. 사건은 너무 안타까운 일이지만 영화 자체는 좋아함. 표현방식이 좋음. 
7,세상엔 정신병자도 가지가지 다양하게도 참 많네. 
8,실제 장소랑 많이 흡사하고 배우들 연기력도 뛰어나고 고퀄영화네요 추천합니다 
8,실화라는것이 넘 끔찍하다. 빨리 3096일이 되길 바라며 비참한 마음으로 본듯. 범인... 끝까지 아주 쓰레기.. 
9,보는 내내 숨막혀서 죽는줄 알았다. 당사자는 얼마나 두렵고 답답하고 고통스러웠을꼬~ 
10,납치사건은 많지만 이 영화를보니 내 미래의 애기들이 두렵다 ㅠㅠ 이런 미친사람들은 세상에 없어졌으면좋겠다.. 
6,책을 읽고 봐서 그런지 조금 아쉽네요. 나타샤가 범인에게 8년동안 도망칠수 없었다거나 어떠한 인간관계?를 구축할 수 밖에 없었던 심리묘사가 덜 표현된것 같습니다. 시간이 제한된 영화라는 특성이라 이해하지만 자극적인 ...
6,실화지만 솔직히 스킵하면서 봄.. 영화로써의 매력은 지루하다는 점에서 확실히 떨어짐. 3096일을 그대로 표현하면 당연히 그럴수 밖에 없다고 이해가됨. 한 여자아이의 안타까움을 그대로 보여준 영화라고 생각. 
10,너무 화난다.진짜 납치범 때려 죽이고싶다 
10,여 주.정말역활잘한다.몰입도.완전짱.실화이기엔넘잔인한영화.완전쩐다.캡! 
8,오베이 미 하는거 진짜 소름돋는다;; 다시는 저런일이 안일어나기를.. 
7,순간의 공포보단 곱씹어보는 공포의 엄습 
10,잃어버린 3096일.. 볼프강같은 사이코들은 지구상에 많다는게 무서운 현실 
10,진짜 세상은 넓고 미친x은 많다. 
9,보면서 마음이 너무너무 아팠다. 진짜 고통스러웠겠지... 
8,ㄷㄷㄷ 거부감 들수 있는데 사실바탕으로 자연스런 연출에 만족. 다시금 ㄷ.ㄷ.ㄷ 
10,실화라니 소오름.. 주인공 여자 포기하지않고 살고자하는 정신력이 대단함. 
9,계속 몰입하면서 볼 수 밖에 없던 영화. 
8,이게 레알이라니 레알 충격적이네. 
9,추천합니다. 꼬옥 보세요!! 아주 볼만한 영화..흥미 진진함 
9,실화인것만으로도 이 영화는 가치가 있다.. 담담해서 더 답답하다. 
8,잔잔한 스릴러... 섬세한 연출력. 
7,실화 생각만 해도 끔찍하다 
7,장르가 정확히 뭔지? 드라마라고 써있긴한데.. 
9,"감독이 시사하는 바를 배우와 연출, 그리도 적절한 표현이 잘된 .전개는 느린듯 하지만 몰입도 .. 그리고 영화를 감상하는 이에게 ..  많은걸 생각하게   하는 영화라 ...  생각합니다  !!  저는 이 영화가  ..."
7,극한까지의처절함까지 표현못한 아쉬운 연출력 
10,한여자의 몇년을 송두리째 뺏어갔다는일이 한탄스럽고 안타까운일이다 .. 미성년자 강간 .. 미친노..ㅁ 
10,결단코 신은없다... 
8,인간의 잔혹함은 과연 어디까지인가. 
10,대박..마트에서 헤어나오지 못하는 장면이.나타샤가 사라진 차안을 보며 지은 표정이. 일단 주인공들의 감정 연기가 제일이다. 표현한 감독도 대단하시고.보통 슬픈데 이건 좀 다르다.영화가 재미있진 않다.하지만 끝까지 살...
10,지루한건사실.하지만 실화이니만큼 마지막에 탈출하는장면은 누구나불안하고심장이뛰지않았을지루한건사실.하지만 실화이니만큼 마지막에 탈출하는장면은 누구나불안하고심장이뛰지않았을까까 
5,좀 더 심리묘사에 신경 썼더라면 좋았을걸... 너무 밋밋하다. 
2,모든게 다 끔찍하다 영화도 실화란 점도 
6,여배우의 연기가 정말 좋았다. 이게 실화였다니. 정말 고통스러웠을 듯. 
7,"범인이 자살해버린 것이 뭔가 더 열받긴하지만... 실화기반 영화중 연기, 연출이 깔끔하고 연기도 어색하지 않다. "
7,다른 의미로 영화가 보기 힘들고 끔찍했다. 주인공의 행동이 답답해 보일 수 있겠지만 실화인들 어찌하리. 남은 삶 자유롭게 잘 보냈으면. 
1,"평가가좋고 스토리가 쏠깃 보았더니 아~ 이렇게 영화가 실제사건적인수,,, "
8,복종해 라는 대사가 제일 기억에 남았다복종이라는 단어로 사람을 복종시켰고마트에서 페인트를 살때도 충분히 도움을 받을수 있었을텐대 결국 복종 굴복.. 
7,
7,이게 어떻게 실화지...정말 대단하다는 말밖엔 
6,그래도 참고 버티고 청소하다가 빠져나온 것은 대단하다. 지옥같던 시간을 견뎌냈다니. 
10,더 지저분하거나 질이 안 좋은 것으로 하자면  살인마보다  사기꾼! 과 납치범! 
10,잘봣던 기억이 생각나서 ㅎ 
5,너무 사실에 매몰되어 극적연출이 없어서 심심하다 
10,액션을 취하진 않지만 실화 영화라서 더 집중할 수 있었던 영화. 
10,가끔  납친덴 일수가 나오는데빨리 3096일이라는  숫자가 보이길바랬다실화라고하는데 너무 가슴아팠다 
10,재밌게 봤습니다. 이런일이 없는 사회를 만들어야겠네요 
4,"실화이기에 충격적이지만, 영화는 자서전을 대충 훑어보는 느낌이다 "
10,ㅠㅠ무서워요 엉엉기모치이 
8,한국 쓰랙영화는 맨날 천날 개봉하먄서 스크린쿼터 외치고. 이런영화는 왜 상영안하냐 ㅋㅋ 
10,무섭다 정말 슬프고 화가 난다 
10,"앚  좋았다...근데 아쉬운건 극장에서 봤으면 더 좋았을텐데...그날바다, 1987같은 작품도 개봉을하는데...참 아쉽다... "
7,이 이야기는 실화라는 게 워낙 충격이어서 다른 자극적인 요소 없이도 관객들에게 충분히 큰 자극을 준다. 하지만 지나치게 사건을 나열하는 식으로 전개하며 인물들은 평면적이다. 
10,긴장감 넘치게 봤습니다ㅠ 여배우 여우주연상 탔어도 손색없는연기였는데.. 상을 못탄건가요? 너무 아쉽네요.. 남배우도 소름끼치게 연기 잘하구요ㅠ 실화라니.. 범인 잡혀서 똑같이 감옥에 평생 갇혀 살아봐야 하는건데ㅠ 
5,3096일 이라는 책을 먼저 읽고 영화를 보았다. Tv에서 볼 수 있는 역사 스페셜 같이 시간 순서대로 사건을 보여준다. 주인공의 내면이 보여지지 않아 너무 아쉬웠다. 
6,감금생활 사실감있게 묘사해서 실감나긴 했지만 재미는 별루인듯 싶다.실화바탕으로 만들었지만 납치범이 이해가 안되서 그런듯 싶다. 
9,실화라는 사실이 충격적이네요.. 납치 당한 심정이 어땠을지 실감나게 연출한것 같습니다 
8,죽음으로도 되갚는 수 없는 것이 있다 
8,중압감과 무력감. 범인 캐스팅 정말 잘한듯. 
7,실제 주인공을 보고 있는 것처럼 감정표현이 나쁘지 않았다. 
10,어떤 무지항것들이 싸구려 평점을 남겨 놓는단 말인가? 8점대는 충분히 넘어야 정상인 영화다!! 
8,평소 영화를보면 평론가 평점이이해가갔는데 이번에는 좀낮은 점수인듯하다. 영화장면에 여주인공의 현실적인태도가 더구체적으로 표현되지않아서일까? 
7,재밌게 잘 보았습니다. 
7,3096 Days... 
9,와 진짜 남자 죽일뻔;;;; 
7,한사람의 인생을 파멸로 끌고간 댓가는 죽음 
9,납치사건은 영화로 만들어져야 
9,남자 어쩌다 저렇게 삐뚫어진거냐...아무리 욕망이 있기로서니하...정신 잘챙겨라... 
10,아역부터 여주.남주..배우들 연기력이 아주 좋았다. 보는내내 맘아펐던 영화.. 
10,영화가 사실적이고 담담해서 시청자 입장에서 생각하게 하네요~ 
7,끔찍하고 잔인하고 준노가 치민다 
7,남주 여주의 탁월한 연기력이 압권 
7,너무 충격적인 내용. 이런 거 보면 괜히 며칠 동안 찜찜한데...연기자들이 연기까지 너무 잘 해서 더욱 몰입 할 수밖에 없음. 아... 역시 인간이 젤 무섭고 사악 해 질 수 있는 동물이다. 
10,마음아파요ㅠ 보는내내가슴이 아팠어요 
8,8년 176일 오스트리아 납치 실화 
9,obey me obey me obey me obey me...꿈에 나올까봐 무서움.. 
10,이게실화라니...지금도 납치당한아이들이 수많을텐데.. 
7,다시는 이런일이 있어서는 안된다. 우리가 지켜주자! 
7,예리하고 편집증 적인얼굴인 남자배우여배우는 이 역활을 위해 저렇게 마르게 유지한건가?? 안쓰럽다... 
10,사실 묘사가 잘된 작품 끔직한 하루하루를 견뎌  3096일 만에 탈출 
8,독일판 완전한 사육 'ㅅ' 
10,군대 3번 갔다와도 안돼는대; 
7,한국에서도 점점늘어갈 범죄의 데자뷰 
7,어후.. 실화라니.. 너무 불쌍하다. 
8,그 상황에서 안 미치고 살아남은 주인공 너무 대단하다. 사실적인 묘사와 배우들의 열연. 
10,이 영화보고 실화 찾아보고 그랬었는데.. 사실적으로 그려놔서 더 소름끼친다. 
8,3096일 하루하루 얼마나 고생스러웠을까... 
10,"여주인공의 연기가 훌륭했고, 실제 주인공의 정신력에 놀라울 따름이다. "
10,"왜안봐지으 난영화볼,,,, "
10,"사실 영화는 더 담아야 할 부분을 놓쳤기에 수작이라고 생각되지는 않지만, 몰입이 되었고, 마지막에 탈출할 때는 내가 다 숨이 막혔다. 8년동안 딸이 죽었는지 살았는지도 모른 채 부모가 살았던 시간은 얼마나 지옥이었을..."
10,놀라운 실화로구만...그 범인은 결국 자살한건가 
7,스키장씬 못잊겠다. 나 납치당했어요 라고 도움을 요청했는데... .외국인이라니 ㅎ 
10,실화주인공때문에 10점 난이거 반정도보고 지루해서껐다 그냥 책사서볼까함 지루해도 너무지루ㅠㅠ 
10,여자배우 돈치들 닮았음 
9,실제 피해자 너무 불쌍해요~~ 
10,실화인게 너무끔직했다... 
10,이거실화고..책으로도 있죠  책은 읽으면 분노로 찢을수있으니..조심.. 
10,이런일이 실제로 있는게ㅜ 
10,네이니아나이아누카나누누 
2,마트에서 답답해서 껏다 
10,보는 내내 빡침 범죄자새기 줘패고싶은데 디짐 ㅡㅡ 
7,남자 주인공이 깔끔해서 몰입이 안된다는 분이 있다니;; 국내개봉을 안한것은 잘한 결정이라고 생각한다. 모방범죄라도 일어나면 ㄷㄷ 
10,보는내내 내가 화가 다너더라 실화라고 해서그때당시 관련 뉴스 그때당시떳던 뉴스 검색해서보니댓글들 가관아니더라. 일베들만 모인줄..같은여자인데도 여자가 주절대는거보고 더화나더라. 
6,오스트리아판 완전한 사육이라고나 할까.  범인이 죗값을 받아야 하는데 그렇지 못해서 열받는다. 
9,영화 자체만으로는 충격적이었지만 심리의 디테일이 좀 부족한듯한... 여튼 어린 배우의 노출연기와 삭발연기에 박수를... 멋진 배우가 되기를 
6,굉장히 사실적인 표현이 좋았던것 같다 
10,보면서 몰입도가 장난이아니다... 
8,러샤 여성이 독일어를 못한다 러샤말로 하는 와중에 대사가 전부 영어이니 좀 현실감이 떨어져 2점 감점. 세계적으로 유명한 실화 소설 (작가가 나타샤)이니 영어로 한거 같지만. 독일어 였으면 더 볼만했을듯. 전개는 느...
7,우울해... 현실을 잊지 말자는 의미에선 웰메이드 영화임 
8,음...보고나서 말로 표현 안되는 갑갑함.. 
8,독일판 리얼리티 쇼크 완전한사육! 
10,보는내내 집중하면서 볼수있었어요좋은영화네요 감독님이 잘만드신듯 
7,나로선 이영화가 이해가안된다 
9,영화광이라 자부하는 내가 몰랐던게 이상할정도로 잘만든 영화. 
10,영화끝난뒤에 충격적여운이 가시질않는다.. 
6,감정을 표현하는 연기력이 돋보인다.. 실화 바탕이라 살짝 밋밋하긴 하지만.. 영화에 몰입하게 만드는 연출도 좋았고. 다만 좀더 복잡한 두 인물의 심리가 덜 표현된 듯해서 아쉬운. 
10,투어 린드하르트 잘생겼다 
8,청소년기 여자역할 연기잘했던데...수치심 느끼지않았을까... 
6,그냥그랬다... 좀 기분 나쁜 영화... 
6,워낙 어릴때 납치되어 길들여져서 그랬을까?  체격이 어느정도 커진후 라면 공격해서 탈출할 수 있지 않았을까... 
9,정말 몰입해서 봤다.obey me.  가 '올빼미' 라고 들린 부분 빼곤.. 
7,시간 때우기 좋음... 실제로 있었던 사건이라기에 궁금해서 봄 
5,독일판 완전한사육. 어느 나라든 이런 일이 일어나는구나 
8,스톡홀름 증후군?! 아니.. 이것은 인간이 살고자 하는 본능과 인간이 자유를 갈망하는 욕구에서 비록된 것이다 
6,뉴스를 보면 실화라지만 이보다 더한 끔직한 일이 생기고 있는 현실의 작금이 더 한심하다.. 음흉한 살인마들이 당신들을 노리고 있다 . 주인공이 생존했기에 이런 이야기가 만들어졌지 더한 놈이었다면 이 섬뜩한 이야기조차...
8,ㅋㅋㅋ생존을해야 인간내면도 생각할 수 있지 ㅋㅋ 
2,"범인의 범죄가 너무 구역질이 나서 쳐다보기만해도 속이 울렁거리는 영화.처음 감금당했을때 동화를 읽어주다 나가는 범인에게 엄마처럼 굿나잇 키스를 해달라고 요구하는 나타샤 캄푸쉬때문에 마음이 아팠다,학대받은 자가 또 다..."
