score,review
6,중반 이후 부터 좀 답답하다..도망치거나 후려갈기거나 어찌 할수 있는 기회가 많았는데..마트에서 답답하더라..ㅡㅡ;; 
4,그냥.... 사실을 보여준 듯한 느낌? 그냥 실화 그대로 담으려고 해서 그런지 극적이고 이런건 없네요... 제타입은 아닌듯 
5,꼭 이걸 제작 해야 했는지... 보는 내내 속상했던... 
5,아주 좁은 창고같은 공간에서 계속 사육당하며...오랜세월동안 길들여지는 것이 아니고 어떻게든 생존하기위해 길들여지는 척...한 것일 뿐...영화 '체인드 (2012)'와 비슷... 
5,애들 교육상에 좋은 영화만 개봉해야한단 소린가 그럼 ㅋㅋ 개소리 짱이네 ㅋㅋ 전체관람가도 아니고 별 희안한 놈들 많다 
8,볼프강은 사랑을 했는데 그 방법은 분명 보통과 많이 달랐죠; 나타샤도 조금은 그런 맘이 있지않았나 싶고..실제 인터뷰에서도 범인과 있었던 며칠은 둘만의 비밀로 남기고 싶다고..아마 앤딩에서 볼프강이 그런 선택을한건 ...
5,"8년동안 갖혀있었다는 사실은 안타깝지만, 영화 자체는 별로임. 그냥 브리라슨 주연의 ""ROOM"" 보세요. "
4,놀라운 사건이지만 영화에서는 뉴스에서 본것 이상을 보여주지 못했다 
7,다좋앗다고는 할순없지만서도 스릴러 특성상 호불호가  갈리는건 사실인듯 이런 스타일의 영화 좋아하시는분은 좋아하실듯 한데 애들교육상 안좋다는말은 대체 뭘까요 극히 개인적인얘기를 왜 여기다 쓰는지 이해가 안가네황당하다 ...
6,완전한사육이란 이런거다  부모만나는 장면을 감동잇게 그렷으년 좋으련만 
6,한정된 공간만 나와서 답답함과 스토리 진행에 약간 지루한감이 있지만 그래도 나름 몰입감있게 만들었음. 
5,3096일인데도 몰입할 수 없이 그냥 흘러간다. 
5,매력적인 소재에 시종일관 차가운 맛 
9,여자의 실제나이보고 놀램.. 그리고 32살이 어떻게 저런 동안이 될수가 있음..나보다 언니인데..와나.. 그래서 0.5점 감점..열받아서..부럽심.. 
9,"둘다 불쌍하군. 남자의 그 억압적이고 지배적인 성격은 결국 사랑하는 여자를 얻은 게 아니고 자유를 찾기 위한 노예 같은 여자를 만들어버렸고, 그것은 비극적 결말을 불러왔다. 누가 사람들을 이렇게 만든것인가 "
6,이런 스토리를 가지고  허접하게 만들다니.. 
6,2시간안에 모든걸 담아내긴 힘들다. 
4,실화라는게 놀랍지만 스토리는 너무 단순하다 
5,당당하게 찾아가서 상대 부모에게 승낙을 받았어야지. 
2,5점줬었는데 생각해보니 더 찝찝한영화인듯 2점 
3,유괴당한 사람의 심리와 유괴한 사람의 심리가 아니라 일기에 기반한 사건만 중심으로 연출했다. 당연히 굉장히 지루할 수 밖에. 심리묘사가 바닥을 치니까 어쩔수 없이 육체묘사에 치중한다. 좋은 스토리를 망친 삼류영화. ...
4,* 보는 내내 힘든 감정감정들..   영화로서의 재미는 그닥.. 
6,기기기결. 좀 밋밋하다. 
7,영화가 너무 길게 느껴진다... 스릴러도 아니고 걍 생존물 삘이 더 강함. 
5,"정신적으로 미성숙한 소녀를 8년 동안이나 감금했다는 것 만으로도 충분히 폭력적이다. 다만 유사부류의 영화처럼 긴박감과 충격을 더하기 위해서 상황을 과장하지 않고, 집착과 광기를 현실적으로 표현한다. 현실감을 얻는 대..."
6,실화라니 너무 안타깝다... 
4,표현이부족했던영화네요 맘속깊이 와닿지도않구요.주인공의 모든게 제대로 보여주질 않아서 보는내내 범인에게만 화날뿐이네요한마디로 별로. 보지마세요 쓸데없네요책으로나 읽는게 나을듯' 
1,진짜 무지하게 재미 없다. 스킵하면서 본 몇 안되는 영화. 
6,실화란게 놀랍지만 영화 자체는 좀 지루하다 
6,"가슴 아픈 사연인건 알겠는데, 임팩트 없는 영화였다. "
5,잔인한 이야기지만 영화는 밋밋하네 
6,좀 더 깊이 파고들었어야 했다 
9,영화보는 내내 두가지 감정이 공존. 안타까운 마음 그리고 납치범이 부러운 마음. 내가 여자였어도 남자를 사육하는 영화를 봐도 다르지 않았을것이다. 매삶에 위선자같은 삶을 사는 99%의 사람과 달리 난 감정에 솔직한 ...
3,핵노잼만 적고싶은데 10자를 적으라네요 
5,"영화 자체는 별 재미는없는데 놀란건, 여주인공 실제나이가82년생이네..열라 동안이네~~ "
5,정신건강에 매우 해로운 영화 
6,그저 그래요~ 좀 지루해요~ 
2,"전반적으로 평점을 후하게 쳐준 영화.지루했다. 반전도 스릴도 없었다. 단지 그녀의 고통이 실제했던 실화라는 점은 화나고 가슴아팠지만, 아니 그렇기에 지루하면서 짜증나는 영화였던거 같다. 스릴러를 기대하고 볼거라면 비..."
1,실화인 건 아는데 기왕 만드는 거 재미있게 좀 만들자 
8,안죽이고 살려준ㄴ게 어디여... 그나마 착한놈이네 
5,완전한 사육의 유럽 버전이야?? 
10,안알랴쥼안알랴쥼안알랴쥼 
4,솔직하게 실화라는거 빼고는... 내용이 너무없다~~~ 
1,이게 실화라고?? 뻥치지마 
5,납치 강금 ... 흠  괜찮긴한데 좀 지루하네요 
1,관객의 감정이입에 실패한 영화. 이 영화는 스릴러도 아닌 것이 드라마도 아닌 어정쩡한 영화가 되고 말았다. 
1,실화라는 점 말고는 그 어떤 장점도 없다 영화로써의  가치는  제로... 
10,또라인가 남주가 잘생겨서 빠져버림 여기분들과는 취향이 다른가보다 나 
1,"장난까나...,,,, "
7,남배우 잘생겨서 좀 몰입도 떨어짐. 어떻게 보면 러브스토리네요. 비뚤어진 사랑이긴하지만..남자가 여자진짜좋아한듯. 여자도 정을 느끼긴한거같아요. 여튼 저런범죄가 하루빨리 사라지길.. 
1,남자 깨끗하게자살해버리네 
1,피해자가 겪었을 고통만큼이나 지루했다 
2,내평점이 영화 20대 남자들이 좋아합니다 이렇게 되있는데 ㅡㅡ 남자들이 따라할까봐 겁난다 
1,"정말 쓰레기같은 영화다. 납치,감금,성폭행 이라는 소재를 활용해 소녀의 복잡한 내면과 범죄의 잔혹함을 드러내려는 영화가 아닌 남성의 추악한 성적 판타지를 충족시키기에 급급하다. "
1,ㅈㄴ쓰레기ㅋㅋㅋㅋ시간아까움 
10,남자 주인공 개멋짐. 완전 상남자. 멋짐폭팔 ㅋㅋ 역시 여자 다루는 기술이 카리스마 넘침.이게ㅡ진정한 나쁜남자컨셉 개멋짐 ㅎㅎ 여자 다루는 기술을 알고 싶어 하는 남자에게 완전 추천 
1,분명 이 영화보고 부럽다. 나도 해보고 싶다고 따라하고 싶은 남자들 분명히 있을거다. 분명히. 윤리도덕이 없는 남자들은 있으니까. 
1,별루 재미없는듯 스릴없음 
2,아깝다 야한장면이 없어 그래서 이영화가 못뜬거임 
