score,review
10,딱봐도 이 영화 재밌을 것 같더라니 역시 제 스탈이었나 봅니다 
10,"언제나처럼 담백한 연기를 보여준 이종석! 대사톤과 목소리도 넘 좋고, 서인국을 받쳐주는 배역이었지만 전보다 조금더 발전한거 같아 좋았다. "
10,모델출신들이라 그런지 기럭지가 다들 길쭉하니 보는 맛이..^^ 간만에 눈정화! 
10,보고온 언니가 강추하길래 본건데 역시 언니랑 코드 완전 잘 맞았음 
10,감동도있고 재미도있고 별생각없이 봤는데 재미있게 본거같아요~수영진짜 잘하시던데..ㅎㅎ 
10,영화 잘만들었네요 완전 놀랐어요 
10,대박!! 영화 재밌는데?? 
5,진짜 손발이 녹아드는 정도의 오그리즘을 느꼇습니다 코믹영화였다면 정말 고차원적으로 웃기는 코미디 영화의 혁명이었을겁니다 ㅋㅋ 
10,서인국 먹방 잼있어요!! 
10,손발이 없어질..거라고 그래서 각오하고 갔는데 의외로 생각보다 약하던데요 훗 
10,캐스팅이 진짜 대박! 서인국이 아닌 원일이는 생각할 수없을 듯 
10,이거 볼까 말까 고민하는 사람들에게 안보면 후회할꺼라고 말해주고 싶네요! 나름 볼만한 영화였어요 
9,박철민하고 서인국이 살린영화 같다. 코믹적인 요소가 많아서 좀 놀랐다. 
10,마지막까지 기분좋게 웃다나온 영화라 ^^ 
10,나름 꽤 재밌게 본 영화였어요 
2,와  전문가 평점 대박인데... 
10,서인국의 본격 먹방ㅋㅋㅋㅋ삼겹살이 땡기네요 .. 
10,금메달이 다가 아니라는걸 보여주는 영화가 아닌가해요. 너무 성적지상주의로 물들 우리네 모습이 그대로 그려져서^^ 특히 종석군 아버지로 나온 선우재덕님. 서로의 아픔을 보다가며 발전하는 모습이 보기 좋았습니다. 
10,은은하게 긴장감 넘치는 대결장면과 그 속에서 피어나는 정 때문에 따뜻한 영화 
10,영화를 보고 나서도 훈훈돋았던 분위기~! 
10,부담없이 보기 재밌는 영화~ 
10,안봤으면 후회할뻔했어요 아름다운 우정들이 담긴 영화였습니다 
10,예고편부터 나의 마음을 설레게 하더니 영화보는 내내 마음을 졸였어요 
10,유일하게 40자평을 쓰게한 영화 
10,감동뿐만아니라 웃음까지 전해줬던 매력넘치는 영화 
10,배우들의 열연이 돋보이네요. 약간의 오글거림따위야!! 
10,평점보고 망설였다가 결국 볼꺼 없어서 본건데 보길 잘했네요  재밌더구만~~~ 
10,이 영화 보니까 어릴때 생각나요. 풋사랑 생각도 나고. 
10,역시굳굳짱짱대박대박 
10,청춘스포츠 노브레싱  잼나요  굿굿 
10,40자 평 남기는건 첨이다~ 보고나서도 관심이 생긴 영화는 처음 
3,진짜 보다가 지루해서 핸드폰하게 만든다. 이종석 서인국 개인적으로 넘 좋아해서 참고보려고했는데 한계가있다진짜. 
10,남녀노소 모두가 즐길수있는 스포츠 영화 
10,실망할수 없는 영화 정말 연기자들의 땀방울이 다 담긴듯한 영화였어요 
9,내용이나 배우들의 연기는 좋았는데 살짝 오글거렷던거 빼고는 괜찮았음단지 오글거린게 쫌 그럼.. 
10,영화보면서 시간가는 줄 모르고 봤네 
10,이거 전혀 기대 안했는데 괜찮았어요 
8,가을이라 우울했는데 유쾌하고 희망적인 메세지 좋아요~가볍게 보기에 괜찮고 서인국 넘 좋아요~~~^^ 
10,서인국이 살라는 영화네 ㅋㅋ 
10,추천할 수밖에 없다 보면 알게 되실거임 
10,서인국이라는 배우가 연기를 꽤 한다고는 생각했지만 믿음직스럽다고 생각하진 않았는데 노브레싱 보고 나서 이제는 믿고 봐도 되겠다고 생각함 
10,완전 짱짱짱입니다!! 보셔도 후회 없을꺼에요! 
10,서인국 다시 봤다는...완전 원일이 그 자체~간만에 맘에 드는 신인배우 발견^^앞으로 관심있게 지켜봐야지!!! 
10,신인에 가까운 배우들..이질감이 들지않고 맥이 끊기지 않아 편하게 봄 
9,조원일은 서인국이 아니면 소화하지 못했을것같네요  눈빛연기가 너무 좋았어요  스포츠 영화라서 흐름이 보이는부분이 아쉽긴하지만 즐겁게 웃으면서 볼수있는 영화네요 ^^ 
10,진짜 재밌었어요! 이정도로 재밌을 줄은 몰랐는데 완전 대박! 
10,나는 뭐 할말이 없을 정도로 좋게 봐서 
10,완성도에 아쉬움이 남지 않은 영화 
10,너무 재미지다잉 꼭보세요 
9,기대안하고 봐서그런지 가볍게 볼만한 영화라 생각됩니다웃다가 울다가^^ 
10,눈물까진 안 흘렸지만 감동 만큼은 한 껏 받고 왔다 
10,흥미진진한 스토리 전개가 좋았어요 
5,노브레싱을 보러갔다가 오바라싱만 보고옴 박철민 선생님의개그연기는 볼만함 
10,오랜만에 청춘영화인거 같아서 설렘설렘~ 중간중간 수영내기도 하고 긴장되게 만드는 그런게 있네요 
9,모델출신이 많아서 그런지 남자배우들 수영하는 모습이 진짜 멋지더라구요. 수영하는 장면 나올때마다 다들 숨죽이고 봄 
10,잉국씨우는연기에같이여기저기에서흐느끼는사람들. 감동도있고재미도있는신선한영화인것같아요~ 
9,개인적으로 어둡고 폭력적인 영화를 싫어하는지라 오랜만에 이런 상큼한 영화를 보니 기분이 좋네요다소 아쉬운 부분도 있었지만 배우들의 열연으로 보는 내내 웃음과 감동이 있었어요   첨예한 대립구도나 갈등이 없어 오히려 ...
9,"배우들 연기력 볼만했고 스토리도 재밌고 재밌는부분, 좀 슬픈부분 있어서 기대안했는데 괜찮았다. "
10,수영장면 긴장감 굿이네용 특히 마지막에 둘이 같이 노브레싱할때 완전 심장떨림 
10,영화내용은잘모르겠는데요 지루하지않그 수영좋아하는사람들이봤으면개인적으로좋겠습니당제평점은 서인국씨 수영점수에 연기력에 드립니당!굿 
10,서인국 너란 남자.. 매력 돋는다 진짜.. 
9,"괜찮은 영화 , 다소오글거리는  장면도 있지만 청춘물이니까 ㅋ그리고 그것마저 커버하는 젊은배우들의 연기. 수영대회씬은 생각보다 퀄리티도 좋았다 수영배우고 싶어졌네 ㅋ "
10,이런 영화를 봤다는게 그냥 좋네요 요즘 딱 땡기는 영화였는데 
10,서인국의 자연스러운연기에 놀람 
10,아주 눈호강을 제대로 하고 왔어요 이게 바로 눈보신이랄까?? ^^V 
10,왜 이게 재미가 없음? 이해할수가 없네 
4,클리셰 남발은 요즘 재패니메이션이 한창 답습중인 노답 현상인데 말이지 
1,무뇌아 영화. 이종석 아깝다. 
1,딱봐도 어린여자애들이나 빠순이과들만 보게 생겻네 ㅉㅉ 
1,보다가 숨막힐 듯한  오글거림에 중간에 영화관을 뛰쳐나왔음. 12살 때 봤으면 재미있었을지도 모르지만 20대 중반인 내가 보기에는 발연기와 오글거리는 대사 때문에 노브레싱 
10,그냥 이종석이 이쁘려니하고봤는데 감동적이고잼있음!ㅋ 서인국연기도잘하고 너무귀엽고 다시봄..유리연기는 내가다민망할정도.... 
2,"진짜 점수잘주는편인데 서인국 먹방말고는 볼게 없는영화 유리는 혼자 하이틴영화 주인공같고, 내용은 뚝뚝 끊기고 줄거리도 이상하고 여러가지 영화 짜집기해서 만든느낌, 감동적인 부분 끌어낼려고 했는데 내용은 뻔하고 3점 ..."
4,배우들 연기는 괜찮았는데 스토리가 너무 오글거리고 지루했다 
5,걍 손발오글ㅋㅋ 순정만화 뭐그런거 생각나네요ㅋ 
6,이야기가 산만하고 어수선하다... 우상의 오그라드는 일방적인 접근과 원일 친구들의 개그에 뜬금없이 중간중간 나오는 유리의 오디션... 제목 노브레싱과 사람들의 이야기가 하나로 모아지지 않는 느낌? 
3,좋은 배우들로 이렇게밖에 못만들었다는게 안타까움 
2,그냥 그럭저럭이엿는데 제발 꺅꺅 대지마요 
7,장면의전환이금매끄럽지못한점이아쉬움 
5,그냥 나머지는 다 그렇다고 치고 권유리 연기가 좀 어색함 러브라인 빼고 그냥 둘이 가도 괜춘했을듯... 
1,기자평점도 좋게 준편. 편집도 엉망 스토리도 엉망. 배우만보고 봤다가 크게 당했다.  초반에 서인국과 코치의 깨알웃음 조금있고. 절대적으로 비추한다. 다 엉성한 짜깁기. 배경음악들어가는 꼬라지하며. 배우들은 무슨 죄...
1,이거 좋은평 하나도 없던데 평점이 왜이리 높지? 
10,재밌는데;; 전 웃다가 찡하다가 그랬거든요.. 
10,"뻔한 결말이 예상됐지만 그 뻔함을 뛰어넘는 뭔가가 있다는거, 단언컨데 서인국은 진정 충무로의 샛별로 거듭났다는거. "
10,남주들의 케릭터와 연기 좋습니다. 서인국씨 너무 자연스러워요 웃겨요 딱 이미지에 걸맞는듯 중간중간에 약간 맥을 끊기게 하는건 조연들의 연기가 아주~약간 어색한느낌? 그거 말고는 웃기고 재미나요 볼만한 영화 입니다 
1,"-10 점 주고 싶지만, 배우 때문에 2점이라도 준다. "
10,국가대표 우생순 코리아 킹콩을들다 나는갈매기 보다 더 재미있었어요 굿. 
10,자극적인 영화들속에 혼자 깨끗한 영화라서 묻은게 잘 보이는건가요? 평론가들의 평점이 안좋아서 염려하며 봤는데 기대 이상으로 재미와 감동이 있었고 모처럼 즐겁게 웃으면서 볼수 있는 영화라서 전 울적한날 다시 한번 보려...
2,있느니만못하는 러브라인.. 유리의 어색한 연기.. 지나친 오글거림.. 뜬근없는 전개.. 환불욕구가 일어나네요 
10,난 재밌었는데... 좀 어설프고 오그라들긴 했었어요 
10,배우들 연기가 오글거림을 좀 줄여주더라구요. 중간중간 코믹적인 부분은 나랑 코드가 맞아서 그런지 아주 빵빵 터졌어요 
3,딱 은위급이다 그이싱그이하도아니다 그냥 빠순이용 중간중간에 유리가 노래부를때가있는데 흐름 ㅈㄴ끊긴다 ㅡㅡ 눈물은 억지로짜내는거같고 그래도 조금웃겨서3점준다 
7,으아 진짜 오글거려 죽는줄.... 서인국 보는 재미로 봤어요.. 
10,킄..대박사건은 좀 그랬지만 암튼 서인국한테는 대박사건이 맞음@ 원일이 연기한게 신의 한수 
10,단연 조연에서 최대 공헌자를 꼽으라면 박철민.. 덕분에 더 재밌게 나온듯 
2,"보는 내가 민망했다.  친구따라서 보게됐지만, 나갈땐 친구도 민망해하고 미안해했다.서인국은 오바연기, 이종석은 너목들의 모습 그대로였다.  둘다 드라마를 잘봐서 잘되길 바랬지만 실망이크다. 살면서 본영화중 최고로 재..."
9,서인국은 연예인하기위해태어난건가..이종석도 역시 !  유리가 영화흐름을 뚝뚝끊긴했지만조연들과 주연 두명이 90프로 카바쳐서 영화살렷다. 
8,서인국과 박철민씨 연기덕에 영화가 더욱 재미있었습니다.하지만 내용구성등 부족한것 같습니다. 
9,"좀 더 박진감있는 경기를 못 봤다는 점, 권유리씨의 연기를 너무 노래로 커버했다는 점 등이 아쉽다. 또한?수영을 소재로 했는데 그에 대한 전문적인 느낌은 받지 못 했다. 하지만 중간중간의 개그요소들과 배우들의 멋진 ..."
10,노브레싱 500만 돌파해서 공약실행했으면 좋겠어요~^^ 노브레싱 파이팅! 
10,"별 기대없이 들어갔는데.. 어쩜.. 웃다가 울다가... 웃음 포인트 좋았고 감동이도 있었다. 서인국이란 배우.. 가수로만 알았었는데, 연기 진짜 잘하더라. 배우란 타이틀 줘도 될 것 같다. "
10,이 영화를 한번 더 보고 싶게 만드는건 우상과 원일이라는 캐릭터가 뿜어내는 청춘의 반짝반짝함인거 같다 
10,전 되게 기대 안하고 있었는데 약간 감동적인것도 있고 좋더라는! 음. 남자분들은 안좋으실수도.. 
10,단언컨데 요즘 대세는 서인국 입니다. 
10,서인국이랑 이종석의 케미가 굳~~ 둘다 연기도 쩔고 눈도 상큼하게 해줌^^ 
10,재미를 안겨줬던 조연들 그리고 완벽한 연기를 보여준 주연들 최고의 조화 
10,"미칠거같아.. 뭐 이런 설레는 영화가 다있노..ㅠ 서인국 완전 짱...;;  긴장감 최고, 달달함 최고...!!!  그냥 이 영화는 ---> 진짜... 기.대.이.상.이.다.  제발  흥해라!! "
10,코믹요소도 적당하고 웃다울다 봤다능.서인국 영화든데 서인국 다시봤음bbb 
8,이정도면 수영이라는 생소한 타이틀로 나름 재미있게 표현한듯 서인국 연기도 날로 좋아지고  다만 우리 여성주인공분은 좀 .. 
10,흔한 키스신 하나 없지만 정말 설레었어요. 너무 ㅈ극적이지도 않고 재밌고. 
10,보지않았으면 판단할 수 없다 너무 재밌게 봤고 기억에 오래남을 영화 
10,대박칠것 같은 노브레싱~ 
10,배우들의 호연이 뒷받침되니 오글거림도 순화되고 상큼 유쾌한 영화라고 생각함 
3,도대체 왜 이런 영화를 만들까 싶네요....조기종영 확실. 
1,"오글거리는 하이틴드라마 보는 느낌;;전체적인 전개가 너무 허술하네요,,,감동적인 장면도 억지로 짜내는 듯해서 전혀 와닿지도 안았구요...뭐...그냥  별로;;; "
1,10점만점인 평들은 어떻게 시간대가 같을까? 알바생을 잘못 쓰셨네 
1,실패하고 싶은 작품들은 이 영화를 참고하라 
10,영화를 보는 내내 눈을 떼질 못하게하는 몰입감! 
10,인위적인 느낌이 없는 연기랄까? 이종석과 서인국의 연기가 빛이 나는것 같아요 둘다 흥해랏! 
10,"정말재밌게 보았습니다^^이종석 서인국 정말 풋풋하고,재미있고,때로는 감동까지...노브레싱 대박나시길...이종석,서인국,노블레싱 아자아자 화이팅...요즘대세 이종석,서인국 꼭  대박나세요~~노브레싱 500백만 꼭 달성..."
10,무지 무지 재밌습니다~~ 이런류 좋아하시면 꼭꼭 보세용~ 
10,난 이런 스타일의 영화가 좋아서 잘 봤다고 밖에.. 
3,텅 빈 껍데기만 있는 영화 
3,올해본영화중 가장 별로엿엇음... 
10,스토리는조금아쉽지만 눈이호강하네요^^ 
1,알바들 다 뮈쳤나 진짜 이게 평점 8점? 아 진짜 너무한다 양심좀 있어라 
10,연기력....물 올랐네요  정말  기대 안했는데...정말재밌어요 
1,기자 평점이 공감간다... 알바들이 넘치는 한국영화 
7,"베스트  댓글에 공감은 가지만 5점 정돈 아닌거같고, 중간중간 맥을 끊는듯한 개연성이라고 보기에는 많이 부족해보이는 러브라인이 좀... 보기 불편했다. 차라리 순수 하게 남자들의 스포츠 이야기로만 다뤘다면 하는 안타..."
1,"연출 허접하고, 중간중간에 흐름 끊는 전개 때매 진짜 못볼꼴이였다. 감독은 정말 배우를 잘골랐다는 생각이 들었고, 요근래본 영화중 최악이였다. 괜히 싸게 만든 영화 봤네. 토르나 볼껄 "
10,김원효 나와서 깜놀~ 근데 여기서는 박철민 아저씨가 훨 더 웃김 
10,친구가 재밌대서 본건데 역시! 친구가 괜히 보라고 한게 아니었더라구요 
10,꿀잼! 영화보다 배우들 보고 폭풍감동 ^^; 다들 넘 멋져서 
10,줄거리를 어떻게 이렇게 썼을까! 와우~ 영화 괜춘하네 
1,지금까지 영화보고 평점 처음남기는데..영화보는중간에 남긴다.이건 진짜  아니네ㅡㅡ 
10,시크하고 무심한척하더니 챙겨주는 우상이~~ 쫑이랑 좀 비슷하면서도 다른~ 
10,예상가는 하기도 했지만 그럼에도 불구하고 재밌다. 
10,제가 보고 싶어하던 영화라서  친구 꼬셔가지고 가서  봤는데 친구가 더 재밌다고 좋아라 하네요 
4,서인국이종석땜에 4점준다..암만 만화원작이라도 어떻게 이 좋은배우들을데리고 이따위 연출을??보는데 눙물나드라..망할거같아서ㅜㅜ 그리고 유리 머임???  왜 목소리가 붕뜨지? ㄷㄷㄷ 
2,이거 10점주는 사람들은 뭐지....평점은 객관적으로 남기자 제발. 스토리 진행 엉망에 그냥 보는내내 답없는 영화라고만 느낌. 서인국 이종석이 이런 영화에 출연한것 자체가 놀라움. 시나리오 보는 눈이 없나 
10,재밋어요♥♥♥^^^^ 
9,재밌게 봤네요 간만에 시간가는줄 몰랐음 
10,요근래 본 영화중에 가장 재밌던 영화 
10,멋찐연기  !!!!더이상 무엇이 필요할까요!!^^* 
10,정말 별기대 없었는데 이거 물건일세 
10,영화 시작부터 끝나는 순간까지 다른 생각은 노노노 
10,노브레싱.. 보면서 왠지 박태환 선수 생각이 나기도 하고.. 
9,감독이 천재인가봐~지루 할 시간이 없었어요! 
10,10점을 주는건. 연출도 대본도 편집의 구림을이종석과 서인국만의 색깔로 오롯이 청춘느낌을 보여줬기때문이다 
5,"도대체 10점 평점들은 무슨생각이죠?어제 기대없이 봤는데, 킬링타임용도 아님. 그냥 서인국 보고싶으면 보는영화.나 평점 정말 안다는데 궁금해서 들와었더니 8점인거보고 기막혀서 글남김.유리는 제발 노래만했으면.. 노래..."
1,No AnswerNo AnswerNo Answer 
1,OOO영화 남자들아 여친따라보지마라 
1,2013 최악의영화.. 초딩이 봐도 손이 오그라들듯.... 
10,와우~ 서인국 연기 솰아있네~~ 특히 박철민씨랑 붙을때 케미터짐 
1,스토리 나올게 있는 포멧인가? 
3,이런 오글거림. 오랜만이군 
5,유리의 오그라드는멘트와연기....ㅜㅜ 서인국의재발견영화. 설날에티비서 왠지 볼거같은..ㅋㅋ 뭔가 큰 매력은없다.. 평점에 속지말자. 
3,10점은 알바인가? 진심인가? 
3,생각외로 유리 연기가 괜찮았다는게 이 영화의 반전이군요. 영화 분위기가 중구난방 합니다. 처음의 분위기로 유쾌발랄한 청소년들의 건강한 경쟁이야기로 가는게 좋았을텐데 왜 신파를 굳이 넣었는지.. 유리가 맡은 배역은 굳...
3,멸치같은 몸으로 수영 유망주?? 
1,잘 나가는 요즘 대세 배우들을 한풀꺽게 할 영화 
1,진짜 내생애 이렇게 오글거리는영화는첨봣읍니다ㅋ..완전 권유리는 웃는연기할때마다 오글오글 90년대영화보는줄ㅡㅡ개봉전부터 이종석서인국때매기대햇던영화엿는데 완전 재미없음 
3,뭔가 오글거림이 절정에 다달았을때! 유리가 나와 오글거림을 폭발시키는 노레를.. 
10,전 내가 좋아하는 배우 이종석씨를 보러갔구요. 기대는 많이 않해서 나름 재미있게봤어요.  두분배우  더운여름 수고 많으셨어요. 돈 아깝고 시간 아까울 정도는 아닌듯....전 두번 봤어요. 글구 금욜날 또 가기로 했어...
6,"이종석, 서인국  둘의 역량을 반도 담지않은 작품은 처음이다. 한창 주가세를 올리는 두배우가 나오는 작품이 이렇게 심심해서야..결론적으로 배우가 아까운 영화. "
1,진심 돈아깝다 이도저도 아닌영화장면뚝뚝끊어다 이어붙힌느낌현실성제로옛날영화같음온갖것들 다 가져다놓음개인적으로 내생에 최악의영화 
1,이영화 망할줄 알았다 ㅉㅉ 또 빠순이 김치년들은 좋다고 10점 주겠지 
1,1점별점 삭제하는 나쁜짓 하지마세요 ^오^ 
1,이것도영화?진심으로 
1,5천원 막쓰지마라부모님이 힘들게번거다.. 
9,중간중간살짝오글거리는게있긴했지만 서인국이랑박철민개재밌고이종석대박멋있구 감동적이었어요 꼭보세요 ㅋㅋㅋ기대안하고봤는데재미씀 
6,처음부터 끝까지 오글거리는 영화. 진부한 스토리와 연출이 보는 내내 거슬렸음. 배경음악도 계속 드림하이같은거만 갖다 쓰고  이종석 서인국 얼굴빼면 딱히 말할 게 없다. 중간에 권유리 콘서트;; 서인국 OST는 하나도...
10,우왕~ 굿~ 풋풋하기도 하고 감동적인부분도 있구~ 
9,이종석 진짜 멋있다...날이렇게설레게하다니 
10,확실하게 타깃 잘잡은거 같은 영화다. 이거 고3애들 수능끝나고 나면 진심 빵터질듯 
4,귀여니 소설을 영화로 보는 기분입니다ㅋㅋ 서인국이나 이종석이 연기력이 좋아서 망정이지.... 손발 다 없어짐ㅠㅠㅋ..ㅋㅋ...ㅋ 유맄ㅋ 유리 음악하는 컨셉이 제일 웃겨 
10,난 이종석 좋아해서 팬심으로10점. 근데 ㅋㅋ 밑에 알바들 너무 티나요...; 
1,돈내고 이 영화 보는건 미친짓이란걸 아시길 
1,킬링타임용도못되는.. 
2,한국 하이틴 영화는 죽었다. 
1,1점도 아깝다... 서인국 연기 귀여웠는데 거기서 끝...참... 손발 없애기에 딱 좋다 
2,전형적인 빠순이들의 영화이자 토렌트전용영화~빠순이들아 평점조작하니까 좋지?ㅋㅋ 
1,내생에 최악의 오글거림 유치뽕짝영화 
2,"우정, 사랑, 성공, 청춘, 주인공들은 다 잡았는지 모르겠는데 난 다 놓쳤다ㅡㅡ; 뚝뚝 끊어지는 편집도 아쉽고, 억지로 끼워넣은 감동 코드는 공감이 안 되고, 줄거리 요약이 불가능한 스토리도 아쉽고. "
4,다된밥에 유리뿌리기 개웃기네 ㅋ 
1,뻔한캐릭터 뻔한내용 보면서 이렇게 지루하긴 처음입니다. 이종석 서인국 유리 팬 아닌 이상 보기힘든 영화손발이 오글거려 없어지는줄... 
10,진짜 이 영화 안보면 후회할꺼!! 
1,유치뽕짝..아..무슨 80년대 청소년드라마보는듯. 
3,전문가와 같이 평점 3점...영화도 아니다.차라리 공범이나 소원을 한번 더 보는것이 탁월한 선택이다.. 
1,딱 1점짜리 영화.... 10점주는분들 ..영화는 보셨죠?? 오글거리다가 장까지 꼬여버릴뻔 
1,이종석나와서괜찮겠다 싶었는데 유리..발연기..패션왕때랑달라진게없어 ....진짜실망..또 이상한러브라인에 그 오디션?프로..아니 유리노래잘하면 말을안하겠는데.. 진짜 오글거렸음 스토리도 급전개에 다끼워맞출려고 한거같고...
1,평점너무높다 7점대가딱이다 
1,ㅏ보면서 핸드폰봤다 시간안가서...ㅎ...대박사건 
1,알바가 판을 치네요 정말 
1,1점도 주기 싫은 영화. 1시간만에 보다가 나왔네요. 진짜.. ㅋㅋㅋ대박이다.. 돈아까워 
1,보다가 오글거려서 중간에 나온 첫영화... 영화가 주는 교훈과 주제는 뭔지도 모르겠고 진짜 얼굴보러 가는 기분인 영화 .... 진짜... 영화보고 후회함...이런영화 흔치 않았는데.. 진짜 홍보잘해서 뜨는 영화같음 ...
1,저평가 되어있다고??  진짜 영화에서 뭘 표현하고자 한지 모르겠다... 
1,"팬심으로도 어쩔 수 없는 영화 스토리는 중구 난방에 감정선은 뚝뚝 끊기고 십대 은어라곤 대박 사건밖에 모르시는지 듣는내내 거슬리고 갈등,갈등해결부분은 국회 날치기 수준 A급 배우들 데려다가 D급 영화 만드는 재주가 ..."
7,재밌긴했는데 스토리가 말이안됨ㅋㅋ 7년을 수영을 안한 조원일이 세계신기록을 세우면서 정우상을 이긴다..운동이 장난인가.. 
2,도대체 무슨 영화인가.. 이도 아니고 저도 아니다 
10,ㅋㅋㅋ 몇점 줘야할지 몰라서 그냥 10점으로 해요... 집에서 봤는데 상당히 오글거리는 대사라던지 연출때문에 피식피식 웃음이... 근데 뭔가 재밌음 ㅋㅋㅋ 보기싫은 오글거림이 아니라 뭐랄까... 여하튼... ㅋㅋㅋㅋ...
10,"이런 청춘물 아주 좋아 ^^, 참고로 대학교 체육수업때 수영실기평가에서 노브레싱 까진 아니고 5~6번 팔질에 호흡은 한번하고 수영했는데, 자기가 가르친데로 안했다고 C받았음 , 기집애들은 물에 발만 담그면 기본 A주..."
1,"처음으로 영화보다가 영화관을 나오게 만든 영화. 스토리 전개도 두서없고, 쌩뚱맞고 연관성이 없었다. 그리고 노브리딩이에요, 브레싱이 아니라 "
1,"스토리가 최악인거냐, 연출이 최악인건지... "
10,"이 영화를 지금까지도 안봤다면,지금 당장 달려가서 보아야 할 영화라고 말하고 싶다!웃음가득,눈물가득,감동가득,희망가득한 밥을 배부르게 먹은 기분이라고 할만큼,영화가 끝나는 순간까지 입가에 머금은 미소를 떨칠래야 떨칠..."
1,내 아까운 두 시간 돌려주소 
2,이런거 만들지 말자. 시간이 아깝다 
9,아 왜? 난 재밌었는데.. 짱!! 살짝 아쉽긴 하다만 ..굳 
7,유리도 안 보이더라.. 삼겹살 앞에선ㅠ.. 아 배고파.. 삼겹살 먹고싶다. 
4,허술함을 채울 요소가 보이지 않는다 좋은재료가 있어도요리사에 재량이 부족하면 맛이없듯이..유리는 왜 출연했는지 모르겠지만 흐름을 뚝뚝 끊어 먹고 영화를 부산스럽게 만들었다 조연이 억지로 영화에 깊숙이 관여한 느낌유행...
10,중간중간 재미요소도 많고 여러모로 재밌게 봐서 기분이 좋아요♥ 
8,할말없으면 보지마 니안봐도볼사람많으니 
7,초반 10분 동안은 정말 1000만 영화 같았다. 후반부를 이끄는 힘이 부족하다. 캐릭터들도 사라지고. 
