score,review
1,이민호 김래원 팬인데... 흑... 정말최악이네요 . 감독님 미워요 
1,거리 3부작이라던데...제일 형편없음. 김래원은 뭔가 부족하고 이민호는 영화에 비해 너무 세련됐음.. 
1,알바들이 너무 설친다. 낚이지 마세요. 이딴 영화 보느니 국제시장 안 본 사람 국제시장이나 보시길. 
1,앞으로 유감독이름으로 스크린에서 안봤으면해요미천 떨어진 쓰레기 보고 나온 느낌이네요 
6,그냥 항상같은 우리나라 조폭영화 
1,좋아하는그룹이 40대 여자면 졸작이라고 생각해라 ...관객들 다 재미없다는데 알바들만 평점조작으로 평점만 올리는구나.. 
1,댓글 알바란게 있긴 있구나.. 이딴 영화를 7점 8점 주다니 ㅋㅋㅋ 최근 몇년 간 영화관에서 본 영화 중 가장 최악이었음.?연출.시나리오.구성 다 최악 ㅡㅡ 근데 결말은 맘에 들었음. 
1,알바생들이 판을치는구.이런 쓰레기같고 난잡한영화는 이제 그만만들자. 
1,완전돈아까움. . .그저그런조폭영화. .칼로찌르고 느닷없는 베드신으로 자극적이기만함 
1,보지마세요OO노잼...너무잔인해여 
1,어제 보고왔습니다...쓰레기...(기획광고에 속음) 
1,기대도 안하고 내용도 모른체 본 영화인데 돈이 아깝다는 생각이 들게 합니다 이민호배우분의 연기력이...  드라마로만 봤으면 좋겟네요 
10,난재밋엇음 세네번봐도재밋던데 
10,"진짜 김래원, 이민호 둘다 연기 개쩔었음. 내용도 재밌었고. 어떻게 보면 결말이 조금 슬펐다... 이민호랑 김래원 둘다 살기위해 발버둥 쳤지만, 결국은.... 그리고 마지막에 나왔던 김래원과 이민호의 거지시절 회상 ..."
8,이민호의 재발견아 비참한 현실이여정치를 하는 사람만이 설현은 이쁘다 
10,민호 연기 너무 잘해요 (엄지척) 너무너무 멋있어요(*^^)//~★ 
10,깽 영화로 보지말고 그당시 사회 역사로 보세요.참 슬픈 우리 역사입니다. 참 슬프고 아픈 영화... 
10,어제 2번째 시청했는데개인적으로  유하 감독 작품이 참 좋다1위 말죽거리~2위 결혼은~3위 비열~4위 강남~ 
10,구준표의 전생인 것이다 
10,이민호큰손될줄알았는데.. 
10,소장하고 싶은 영화에요 넘 멋져요. 
8,제3한강교 노래랑 딱 일치하는 그 장소 그 분위기 
7,전체적으로 크게 모난 곳은 없지만 오래되고 진부하다. 드라마 요소를 많이 넣어 끈적한 누아르를 보여주려했지만 오히려 지루했다. 
8,먼가 루즈하다... 19금 연출은 훌륭 
7,영화는 잘만들었으나 결과가 아쉽다.두번은봐야할정도 이해해야할상황들도 많았는데  이해하기전에 이미다른이야기로바뀌는것도아쉽고..그렇게머리좋고 쌈잘하는 두주인공이 가장현실적이지못했던게 마지막의죽음이었다.굳이왜?앞으로도써먹...
10,남자들의 아드레날린 영화 
8,"평점이 생각보다 낮네, 연기도 괜찮고 설현도 귀엽고 역시 김래원 양아치연기는 일품이지 울 아부지도 저때 땅을 샀어야했는대. "
6,"예나 지금이나 공무원(정무직,임기직,일반직)은 국민들 등쳐 묵으면서 잘 들 사는구나! 씨발! 이라는 1970년이나 지금이나 좃또 바뀐게 없음! "
10,인물값 한다 정말 잘봤어요 
10,"보통은 영화보고 평점 안남기는데  영화가 끝나고 큰 여운이 남아서 이번영화는 남긴다. 처음에는 그냥 조폭영화인줄 알았는데, 진정성있는 메세지가 있는 영화였다. 생각해볼 게 많은 영화였다. 덤으로 배우들 연기도 짱 "
7,하 이번에도 주인공들을 불쌍하게만드는구나 조폭의 현실은 보상이 죽음인가 비열한거리가 생각나서 좀 화가났다 그래도 연기는 지렸음 
10,영화  재밋다는 소문은 많이 들어서 이제서야 보게 됏는데 진짜 재밋네요. 시간 가는줄 모르고 봣습니다. 마지막 너무 슬프네요 사냥개들은 사냥이 끝나면 잡아 먹히듯이 ㅠㅠ 
8,한국영화가 맞는지 의심이된작품 
10,화려했다  멋있다  두남자 
10,재밌구만 배우들 연기도 좋고 
8,평론가들은 외국영화에는 관대한데  국내영화는 조금 야박한면이 있네요.. 그래야 조금 있어보이나??ㅋㅋ 가볍게 다가가는 영화입니다.. 근데 마지막이 조금 아쉽고....비열한거리 마지막이 똑같습니다... ㅋㅋ 스포인가 ...
5,"이제 더 이상 위기상황, 극적인 상황에서 비가 안 왔으면 좋겠다. "
10,멋잇음    후회안함요  졸섹시행 ㅠㅠㅠ 
8,재밌게 잘 봤어요!!!! 
10,평론가 평점을 봤다. 강남이 뭔지도 모르고 판자촌이 날린 이유도 모르는20대 평론가가 날리는 평론....꺼꾸로 그들에게 뭍고 싶다.  당신이 놀러오는 강남이 어떻게 만들어 졌는지....이영화는 그 사실에 10%만현실...
9,"조연들도 연기 훌륭하고, 갬래원이야 뭐 OOO 짭밥이니깐 인정. 하지만 꽃남자 같은 쓰렉물에서 허우대 빼곤 검증된적 없는 이민호..난 그를 인정하지도 좋아하지도 않았다. 하지만 여기에서 그의 대사와 눈빛은..조금의 ..."
9,결핍에 의한 욕망과  '정'의 연약함 인간의 양면적인 모습.. 그리고 너무 쓸쓸한 눈빛 
10,간만에 재밌는 영화봤습니닷 
8,오랜만에 잘 나온 한국영화 근데 음악이랑 연출이 80년대 홍콩느와르인게 몇신있음 
10,재밌어요~재밌어요~재밌어요~ 
8,배우들의 열연으로 70년대의 과거의 아픔을 잘 표현했다고 생각하네요. 
4,초반 30분정도까긴 흥미롭게 보다가 비숫한 장면들의 반복 언제 끝날까만 생각나더라 
10,굿굿굿아주재밌음이연두굿 
8,깡패영화의 진화이자 우리나라의 역사~신선한듯 식상한 내용이였던것 같다. 
7,저러다 세상사람들 다 죽는줄 알았음.... 
10,배우들 연기 굿ㅎㅎ 결말이 아쉽네요 
8,꽤 볼만했는데 볼만해요 ! 
10,"해바라기의 오태식이야 두말할것없고,이민호 연기의 재발견이다땅종대 돈용기. .두젊은이가  열심히살고자픈 야망이가슴을 끝내 먹먹하게만든다상당히 긴여운이 남고 소주가 생각난다. . "
8,배역들연기조아요그러나스토리가먼가모를?완성미는좀부족요 
7,초반엔 좀 그렇고 후반부볼만 결말은ㅠㅠ 
6,"?@!.-♡'""#-()@: "
2,누가 누구편인거냐..진짜 개어지러움 
10,배신의 배신의 배신...각본 좋고 연기좋고 음악좋다. 
8,70년대를 배경으로 한 영화 .이민호.김래원 둘의 연기가 신들린듯한 괜찮은 영화 
10,말이 필요없다! 레전드 오브 레전드! 
8,조폭 미화 영화가 아닌 뭔가 사실 적으로 보여서 좋았다.약한놈들 등쳐 먹쳐먹고 쓰레기같이 버림당하는 말로를제대로 보여주는 영화 
10,꼭보세요 문닫고 이어폰끼고요 
9,이민호 처럼 찐하게 생긴 스탈은 별론데 희안하게 이민호는 연기를 잘해서 그런지 연기할때만 빠져들게 되네... 우는연기도 잘해 액션도 잘하고 더 큰 배우가 됐으면 좋겠다. 
5,평론가새끼들 약먹었냐. 역량은 쥐뿔도 없는 주제에 맨날 더러운 섹스신 집어넣고 삼류영화나 만드는 감독놈 뭐하러 빨아주냐. 평점 존나 관대하게 주네. 뭐받아먹었냐? 
1,영화는 킬링타임용이고...이민호 연기 노답...김래원 그나마 선방... 
1,노잼 김래원 연기만 봐줄만 했다 
8,쟘있게 잘 봤어요  최고 짱 
9,재미있게 잘 봤습니다. 아쉬운점은 여동생의 결혼 이야기를 빼는 것이 더 좋지 않았나. 영화 줄거리와 크게 관계 없는 것 같기고 하고... 여동생과 종대와의 가족애를 느낄만한 다른 스토리를 집어 넣었으면 더 좋지 않았...
8,단순한 양아치영화라고 보기엔 의미가 있는 영화네...이민호는 유덕화보다 더 멋있게보이네.... 
9,위트잇는 깨알개그 . 보는내내 빠져들엇음 
8,즐기기에 좋은영화... 
8,영화재밌게잘봤습니다 
9,잼있긴헌데 김래원 비중이 넘없음 
10,재밌는  영화이네요 잘봤습니다 
8,반전도 잇고 재미잇엇어요 
10,굿입니당 으하하하하햐아 
10,반전의 반전ㅋ기대가 컸던만큼 잘 봤습니다 
10,굿이였습니다ㅋ추천해요ㅋ 
10,감성적인 연기가 눈물샘을 자극함 
9,그래도 나름 재미있게 봤던영화 이민호 다시봄 ㄷㄷ 
9,이민호를 새롭게 볼 수 있었어요~ 
7,"액션물을 좋아하진 않아서.. 이민호팬인 친구와 본거라, 친군 만족ㅎ "
8,재밋짓안앗지만흥미도있슴 
7,폭력적이긴 했으나 볼만함~ 
7,기대가 넘 컸나...그래도 뭐 이정도면 
7,배신의배신거듭 ㅋㅋㅋㅋ 볼만했어요 
7,재밌긴한데 잔인하네요 
7,폭력성이   많이  보엿어요 
7,지금의 강남이 되기까지의 이야기를 하다가 갱스터 무비가 되버린다 
8,너무 잔인하고 너무 야해요...ㅋㅋ 
10,이거 평점 왜케 낮냐 조작아님? 배우들 연기력 훌륭하고 중간중간 몰입도도 최고에 스토리도 탄탄하고 뻔하지 않은 결말에 중간중간 베드신 눈요기거리까지 ㅋㅋ 한국영화치고 보기 드문 수작이다 
10,영화를 만들려면 이렇게. 
1,조폭.깡패영화 정말싫다배우들 연기는잘하더라 
1,쓰래기영화네... 평정1점도 아깝다 
1,영화가 딱 70년대수준 
10,이민호의 진지한연기가 돋보임 
9,와 재밌다 정말정말 재밌네 
8,볼만해요!! 생각보다 
8,나름 간만 액션제대로본듯요~멋남들 눈에 확~~ㅋㅋ 
8,오랜만에 괜찮은 느와르 엿어요 
10,이민호가 너무 사기캐인듯 
8,시간은  래원도 오징어로 ㅠ 
7,그시대의 스토리가 담겨져있는 영화 
7,여자친구랑 같이봤는데 액션장면이 많아서그런지 저는 재밌었는데 여자친구는 그저그랬다네요^^ 동성친구들과 같이보는것은 추천합니다. 
8,이민호 김래원이 멋있었던..♡ 그러나 조폭영화 
8,이민호만보이는영화 김래원은나쁜역할도 멋짐 
9,더도말고 딱 유하감독 작품이네요 
8,시대상황표현이너무약한거같아요?80 
7,나름볼만하네유눈호강흐흐 
8,그럭저럭볼만함닉다 나중에좀지루함 
10,청소년관람불가 영화에 10대 평점이 높은 이유는 뭘까 
9,네이버마일리지짱짱맨 
8,부모님이랑은보지마요ㅎㅎ나머진개잼^^ 
7,부동산 영화라고 듣고 봤는데 조폭영화. 김래원이 정말 멋있어졌네요. 피튀기는 영화 
8,나름 괜찮았네요 마무리 내용 열폭ㅠㅠ 
8,배드신감사합니다그럭저럭볼만함 
8,기대에는 못미쳤지만 액션신이 볼만하네요 
6,이민호 김래원 연기는 좋았는데 스토리가 중후반 갈수록 약한게 아쉬웠습니다 
7,한국 느와르의 부활을 봅니다.재미잇게 봣지만 뭔가 약간은 부족하달까. 
7,"이민호 눈빛 연기 같은건 좋았어도, 대사할때는 확실히 별로였네요...김래원은 역시 믿고볼만하고...러닝 타임이 좀 너무 긴듯;;; "
6,이민호라서 그나마 6점... 뜬금없는 베드신에 까임 내용도 그냥 저냥 그냥 김래원 이민호니깐 평균 
6,볼만은 했으나 완성도가 떨어진다.. .그냥 예전 조폭들이 주를 이루던 떄만 보는것 같다. 
5,영화 보면서 이렇게 감흥이 없었던 적이 있었나? 내용도 너무 뻔했고 그냥  전형적인 상업 영화라는 생각 밖에 안듬 이민호는 멋있게 나옴 그냥 그게  다 인듯 
5,개인적으론 재미 없었음. 땅투기에 관점에서 접근한건 괜찮았는데 투기 과정 보는게 좀 지루했네요. 
7,이민호 생각보다 연기잘하네요볼만하다 그이상도 이하도 아닌듯.. 
5,배우를 떠나서 영화 내용 구성이 이상함. 제 스타일은 정말 아니네요. ㅡ.ㅡ 
6,"70년대 어두운 뒷면을 표현했네요...사람을 너무 많이 죽여서 액션좋아하시는 분은 좋아하실듯.., 전 별로였지만... "
10,방금보구왔음 생생후기김래원은해바리기때보다더잘생겨짐..영화는전반적으로재밌음 지루한부분이전혀없었음범죄와의전쟁보단 이게더재밌었던듯 
10,진흙탕 싸움신 대박이네요.이민호 눈빛에 치인다 
1,이 감독이 연출한 영화 보면 하나 깥이 한심해...이 감독이 원하는 건? ...글세 일단 인물들의 감정 표현이 그저 그래...상황설정도 그저 그래...도체 항상 왜그래?... 
8,같은 남자지만 이민호 너무 멋있고 연기력이 너무 좋았다!! 
6,이민호가 멋있다는 기억이...가장 많이 남네요.. 
10,민호펜이기에  보았고 눈빛이 좋았고시대가 1970년대긴 하지만 그래도 좋았다또보고싶었고 잔인하지만 잔인할만했고마지막 죽는 모습이 죽지않고 살아성공쪽이 더 좋았을것같다 왜냐면 민호펜이니깐~~^^ 
10,잼잇음 근데 끝이좀 허무 ㅠ 
10,좋아요 쾌적하네요 열자 이상 적으레요ㅡ ㅋ 
7,생각보단 나쁘지 않았던 
9,ㅈ재미는 있었지만 보면서 고개돌리게 하는 요소가 몇가지 있던게 아쉬쉈다 
8,기억남는건..이민호 얼굴과 김래원 연기력..좀 잔인해서 애인끼리보는건 비추 
4,두분의 멋진연기 멋있었습니다. 
7,재미있게 잘 봤습니다. 
10,actionmovie good!!! 
7,내용은 괜찮으나 너무잔인한폭력성이  힘들다 
7,뻔한 얘기지만 그래도 재미있었다 
7,영화는 재미있게 봤는데 청소년 관람불가라 그럼지 조금 잔인하더라구요~ 
6,김래원부분이 뭔가 아쉬워요.왜 베드신이 들어간거죠??배우들 연기는 짱 
8,유하 감독의 커리어를 한데 집대성한 느낌을 주는 작품.김래원과 정진영의 연기가 너무나 생생해서 이민호가 묻히는 감이 없지 않아 있다. 하지만 이런 것쯤 깊이 생각할 겨를 없이 몰아치고 때려대는 장면 장면 하나하나가 ...
5,너무 보여주고자한게 많으셨는지 영화가 참 기네요 차라리 드라마로 제작하는게 더 나을거같은 영화네요.(사랑해요이민호~) 
8,배신 배신 배신 쿵떡 배신 배신 통수 통수 뒤통수 탕! 탕! 강남의 아들 박의원! 이러면 끝남. 
6,잔인한 장면이 너무 많다 
7,그냥 저냥...soso... 
6,이 영화 돈 많이 썼네..10점 9점 나올 영화가 절대 아니다..보고 너무 후회...집에서도 너무 잔인해서 보지 못할 영화..돈 낭비인 영화다. 
4,칼로 찌르고 찌르고 찌르다가 눈빛 함 쏴주고 간간히 배드신...끝. 재미없음 
6,하...실망스럽습니다... 
5,깡패들끼리  싸울때  도끼를 사용하는 영화라면 안봤을겁니다  꼭 도끼를 사용했어야 했는지 쇠몽둥이 뭐 이런거라면 좀 이해가지만 너무 잔인해서 보고 난후에도  머리에 남는건 깡패들끼리 도끼로 사웠던거만 기억에 남네요 
6,초반에는지루하고끝에는허무하다 영화를한창만들다가 제한시간이있어서끈어야되는느낌이랄까 뒤에는만들다만거같다 
5,캐릭터 설명도 부족하고..좀 지루함.. 
7,떡치고 찔르고 죽이고 죽고! 
10,"여러 번 볼수록 많이 보이고 많이 느껴지는 영화임. 스토리 전개에 따라 다르게 보여지는 종대의 눈빛과 비주얼 변화,  조연 배우들의 열연이 좋았고 영상과 스토리와 잘 어우러지는 음악이 돋보임. "
10,짧지만 강한 포스를 남긴 영화 ㅋㅋ 
7,비혈한거리가 훨씬재미있었음 김래원펀치에서 멋있어서좋았는데 이거보고 양아치같아서싫어졌음..그만큼 연기를 잘했다는건데 ㅜㅜ혼자김래원좋아하다 혼자 싫어졌음  가족이랑 봤는데 낮뜨거워서 혼줄났음 19금많고 잔인해여 ㅠㅠ가족...
7,"그냥 스토리도, 영상미도 그저 그래요..말죽거리, 비열한거리, 강남1970.. 아직 틀을 못깨네요..다 비슷한 느낌의 영화임.. "
1,너무산만한 전개에 내용은없고 가오만 개 많이 잡다가 끝남. 
10,여러번 봐도 재밌다. 이민호 정말 멋있구나~ 
10,굳굳굳  김래원 너무좋아용 
10,생각보다 내용이 있었다 생각보다 잔인했고 아빠랑 단둘이서 보기엔 ... 서먹해졌다 
9,졸잼ㅎㅎ진짜졸잼 개졸잼 이민호개짱 
9,극장에서 볼 가치는 있음 
10,이민호와 김래원 두 사람의  감정연기와 액션 연기가 너무너무 멋있습니다. 
10,해피앤딩이었으면 좋았을걸 하는 바램이 있지만 정말 재밌게 봤어요! 배우분들 정말 고생하셨을듯!! 덕분에 재밌게 잘 봤습니다~ 이민호짱!>< 
9,하도 안좋은 소리 듣고 가서 그런가....볼만했음~ 
10,강남 졸부색히 들~ 다 쓸어버려야 하는데 ... 
10,김래원!!!땅종대돈용기! 
9,연기력도 연기력이지만 연출이 감탄스러웠음. 특히 극장에서 멀리 떠나라며 총 겨누는 장면에선 투박한데 너무 멋져가지고 와와 거리면서 봄. 남자들이 많이들 갖고있는 조폭 로망 같은것도 충분히 충족시켜줄 수 있을것같고. ...
9, 70년대에 살아 보지 않은 사람이 그 당시 사회 배경을 잘 이해 할 수 있게 설정을 잘 해 둔 것 같다. 특히 도입부에 나온 배경들은 정말 기똥차다. 마을 건물들 또한 그렇다. 배우가 좋아서 무턱 대고 선택한 영화...
10,생각의외로 기대 안하고 봤는데 처음부터 끝까지 긴장감 있고 스릴있는 영화였습니다~ 연기자들 역시 연기력두 너무 좋았구요!! 잔인하기도한 영화였지만 의미가 있는 내용의 스토리였기에 멋진 영화라 생각합니다~^^ 끝나고 ...
10,따봉....^^ 함 보세요.... 
10,재미있게 잘봤어요 약간 친구 보는느낌 
10,이렇게 재밋는 영화를 누가 자꾸 깍아먹는거야! 
9,기대이상 이민호역시짱! 
8,흥미진지햇으나 막장이엿다 
8,이민호를 위한 영화인듯 
8,좋은 영화지만 영화가 전반적으로 너무 어둡다. 보고나면 마음이 가라앉는다. 
6,이민호 영화임. 뻔한 스토리라 관객이 대충 이해할꺼라고 생각했나 편집이 많이 된 듯.인물관계 복선 심리묘사가 너무 아쉬움 김래원은 그 인물이 왜 그렇게 됐나 이유가 없어 더 허무 설현은 꼭 들어가야했나 하나만하지 뭘...
8,이민호는 역시 멋지다ㅎㅎ 
8,잔인하지만 재밌는영화였습니다 
6,너무 폭력적인장면이. ㅠㅠㅠ 
5,"베스트공감 왜이렇게 조작이 많아 ㅡㅡ 다 평점 10개네? 솔직히 액션이며 배우연기며 나는 다 좋았는데, 최근에 봤던 영화 '신세계'와 비교하면, 스토리를 풀어나가는 과정자체가 너무많이 아쉽다. 평점조작..."
10,긴 러닝타임에도 불구하고 정말 시간가는 줄 모르고 봤다.  진흙탕 액션씬은 정말 눈을 뗄 수 없었다. 잔인해서 망설이는 사람들도 거부감 없이 볼 수 있을 정도로 많이 잔인하지 않았다. 마지막 엔딩 종대의 눈빛이 여운...
8,"간만에 남자다운 영화인가 생각됩니다. 이민호, 김래원 여기 좋고... 어찌 되었든  결론은  현실의 굴레를 벗어나보러고 발버둥치다가 정치인들에게 쓰고 버려지는 안타까운 삶에 대한 이야기입니다. "
5,유치하고 뻔한영화 신선함도없고 뻔한설정에 손발이 오그라듬 
6,"알바 많네. 솔직히 지루할것까지는 없었지만 내용의 짜임새도, 그렇다고 캐릭터의 색깔도 드러나지 않은, 피와 섹스가 난무하는 영화 "
2,댓글알바 쩔어요.. 이정도 영화는 아님... 신세게와 범죄와의전쟁 뛰어넘을수없음.. 나도 시간아깝.. 진심 다 알바인듯 ㅋㅋㅋㅋ 평점 10이 줄줄이;;; 
2,최악인영화 재미없고 뻔한 내용.베드신만많고 재미없는영화 
4,"김래원 위주로 가야지... 왜 전개가 이민호 위주로 가냐? 연기도 어색해, 배역도 안어울려, 보는내내 꽃보다 남자 생각나서 몰입이 안되더라 ...참나 ㅋㅋㅋ 이민호가 애들모아, 부하들은 형님! 하는데 진짜 웃음밖에 ..."
10,보통 이런 느와르 영화들은 보고나면 찝찝하던데 강남1970은 그런게 없더라구요 재밌었어요! 
10,영화가 끝나고 나니까 먹먹한 여운이 남더라..진짜 사람의 욕심은 끝도 없나보다 
10,두남자 연기대박 화이팅. 
10,완전잘봣어여ㅎㅎ젊은두남자의 강남..ㅋㅋ 
10,개잼존잼꿀잼잘봣다마일리지줘 
10,정말제미있게봤습니다 
10,"아주 재미있게 잘 봤어요,  김래원 너무 멋졌어! "
10,김래원도 이민호도 멋있어요~ㅎㅎ 액션이라서 볼거리는 많네용ㅎㅎ 
10,연기도 좋고 액션이 멋짐ㅎㅎㅎ 
10,재미쪙멋시쪙.최고얌나원래저배우들안좋아하는데 볼거없어서봤는데 빠져들었음보는내내 대박하며봄 
10,굿이요 정말 좋아요 또보고싶어요 
10,호우 좋아요! 재미있어요 굉장히 
10,진짜재미잇게봣어요!ㅎ 
9,김래원이 조직에 같은편을 죽이는 신에서는눈빛연기가 절정이였습니다. 
5,넘 잔인한 장면이 많아 ㅠ이젠 폭력영화 다시 보지는 않을것 같네요..이민호김래원 연기땜시 끝까지 볼수있었음~ 
6,뭘얘기하려는지는알겟는데 인물구성이이해가잘안갓다 
9,내 개인적 평점은 8점에서 8.5점정도이다. 배우들의 연기 특히 김래원.이민호씨의 연기력은 이번 영화의 몰입도를 높이기에 충분했다. 스토리쪽에서 약간 아쉽긴 하더라도 통쾌한 액션은 영화로써의 값을 제대로 했다. 
9,이민호 다시 봤어요. 재미있음! 
9,나름 볼만했음. 2014년에 나왔던 느와르 영화들보단 훨씬 좋았다. 
4,내가 오늘 로또 1등에 당첨되어서 하늘을 나는 기분이라고 가정 했을때 줄수있는 최대치다. 진짜 유하감독 실망했고 김래원 연기 말고는 스토리 연출 인물간의 관계 그 어떤것도 납득이 안된다 
4,"이민호 얼굴, 김래원 복근, 여자들 몸매 구경만 하다왔네요. 얻은건 베드씬뿐임. 스토리전개도 억지스럽고  이상한 포인트에서 억지감동까지. 베드씬이랑 액션씬은 근데 잘찍었더라고요 어쨌든 영화자체는 별로였습니다. "
7,그닥 별로인듯 이민호만 양호하고 
10,볼만합니다. 결말도 나쁘지 않구요 
8,이민호에 연기변신에 놀랍고 김래원연기는  다시한번 놀랍다이민호에 다른영화가 기다려지는... 조폭영화라고 치기에는 아련함이 많이남는듯.... 
10,없이살아도 사람답게 살았으면 좋겠다 -중국팬들 날리나것네... 
10,한국형 감성 느와르!! 
10,"연기자들의 연기력은 매우 매력적이었으나, 이민호와 김래원의 부인은 뭔가 시대적배경에 어울리지 않는 마스크라는 생각이 들었다. 진짜 김래원이 명불허전의 포스를 내뿜었던 영화. "
8,박진감 넘치는 전개와 구성 재미있네요. 
9,보는 내내 지루하지 않았고 디게 재밌게 봤습니다!!남자라면 봐야할 영화라고 생각합니다. 배우들 연기도 굿이구요..!! 
9,정말 배우들도 스토리도 탄탄하고좋앗습니다.마지막이 좀아쉬웟던것만 빼면요 
4,돈아깝다 쓸데없이 찌르고 ㅅ ㅅ 하고 편집 개같이 하고 이게 영화냐 이딴 영화 만들고 영화값 받다니 
10,"정치판 놀음에 피로 세워진 강남땅, 지금도 돌고도는 권력과 야욕의 땅! "
7,이민호 팬들에게는 좋을거 같네요. 
10,겁나 몰입해서 봤음...굿~ 
5,그냥 그렇네요~~영화가 어둡고 잔인하구 너무 길어요 
3,여기서 내가 달리는만큼 모두 내땅이다 ㄷㄷㄷㄷ 
8,"시대배경도 잘 표현하고 김래원 연기 잘하고, 재밌네요 "
8,그럭저럭볼만해요ㅎㅎㅎ 
9,재미있게잘보았습니다 
10,그냥 시간맞춰서 봤는데 개꿀잼ㅋㅋ 
10,극장가면 자주 자는 나로서는 밤 10시30분 영화임에도 불구하고 자지 않게 만들었던 영화~배우들 연기일품~!! 
10,역시 유하 감독! 영화를 멋들어지게 만들어놓으셨네! ^^ 
10,"유하감독님의 거리3부작 완결편 기대이상입니다.  이민호, 김래원 액션연기 기대하세요 "
10,끝나고 자꾸 생각나게하는 영화 
10,그냥 잔인한것만빼면 볼만햇어여 이민호 김래원 짱멋 ㅠㅜ 
9,모든 내용이 다 맘에 드는데 엔딩이 너무 뻔하고 허뭏하게 됐네요 
9,너무 재미있네요^^두배우들 연기도 최고에요!!아쉬운게 있다면 내용을 잘 이해 못하겠네요..ㅎㅎ이민호 너무 멋있어요^^마지막에..흑흑 
4,섻.스는 나올 이유가 없었다ㅡㅡ 
10,이민호 대박.나이도어린데 연기쩐다. 
10,"이런 스토리 싫어하는 편인데, 되게 지루하지않고 잘 봤어요^^ "
2,유하감독에게 완전히 싸다구 맞은 느낌의 영화 .. 양념배지 않은 갈비찜 같은 영화 !! 
2,"처음으로 로긴해서 평점 남겨요.개인적으론 6점이지만, 조절위해 낮춥니다.이게 정말 재미있다구요....?소재와 연기는 좋았으나,, 무모한스토리 압축과 구성,불필요한 등장배우 살리기, 쓸데없는 정사씬과 잔인함으로 보는내..."
