score,review
7,연기는 좋으나 영화가 전달하고자하는 내용을 너무반복해서 보여줘서. 칼부림나는대도 살짝지루해짐.적당히끊었다면 훨씬좋지않았을까. 
10,1970년대의 시대에 맞춰 소품들도 다양하고 그 시대의 강남 모습이라는데 신기했음ㅋㅋ 
5,명심해라!  연인끼린 보지마라!!!보구나서 후회하면 늦는다 
10,김래원 이거 찍을라고 15키로나 뺐다는데 정말 대단하신듯..요즘 펀치도 재밌게 보고 있는데 김래원한테 푹 빠질거 같다 
10,이민호 김래원 둘 다 너무 멋있어요!지루하지않고 집중해서 봤습니다~~!배신의 배신을 거듭하는 반전도 흥미진진했어요^^ 
7,배우는 멋졌고 이야기는 개연성이 떨어져요. 
10,ost음악도 좋고 러닝타임 2시간이 모자르게 느껴졌을 정도로 좋았다 
8,범죄와의 전쟁을 떠올리는 영화네요 괜찮은 영화였습니다 
6,기대한 것에 비해 좀 약한 듯.. 넝마주이가 너무 멀쑥해.. 헤어스타일도 넝마주으러 출근하면서 머리 만지고 나오나... 전체적으로 늘어지고 후반부로 갈수록 힘이 떨어지는 듯... 말뛰는 여자들 몸매 가슴은 볼만한 듯...
9,사운드 대박...잔잔한노래부터 경쾌한것까지 영상미보다는 소리가 도 좋았다. 김래원은 그냥 울먹울먹한표정으로 그표정 굿인것같고 마지막 터널을 입구앞에서 나가지 못한게 제일 좋은 한장면같다 
10,액션신들도 멋있고 배우들의 연기도 좋네요. 오랜만에 보는 김지수씨도 이뻣습니다 
10,재맛게작보고왓습니다 흥할수잇겟네요 신세계보다재밋는듯 
8,"김래원이 너무나 기억에 남는 영화... 김래원의 연기란...ㅠ19금도강렬....끝나고 김래원을 잊을 수 없는 영화 엄청 잔인하지 않고, 서로를 배신하는 그때의 혼란 ,싸움을 잘 다뤄낸 듯하다 다만 불 필요한 장면이 ..."
10,마지막 장면ㅠㅠost도 좋고 이미노 기대이상♥ 
10,초반에는 그냥 그랬는데 후반으로 갈수록 몰입도도 상당하고 더 재밌더라 
8,여러 배우 고루 쓰려다보니까 인물관계도가 지나치게 산만한 느낌? 영화는 재밌는데 
10,한치도 알 수 없는 인간들의 속마음과 그 욕망의 끝을 보여주는.. 
8,"해바라기,미스터소크라테스처럼 김래원은 이런역활이 어울리는 듯 하지만 이영화는 이민호를 위해 김래원이 희생된 느낌이 크네요 충분히 볼만합니다. "
7,음 초중반에는 집중있게봣었는데 후반정도가보니 계속 똑같은 스토리에 좀 지루햇었다 액션 배신 때랴뿌시는거 좋아하는사람이면 재미잇을듯 액션씬 과 스토리는 좋앗는데 풀어나가는 전개과정이 넘 똑같은장면만나온게아닌가함 
8,스토리 전반 잘만든 영화이다 다만 70년도가 무법천지는 아니었다 장지에서의 조폭간 전쟁은 글래디에이터 만큼 잔인한데 아무래도 과한 장면이다 
7,이민호 김래원 너무 멋있음..  1970년대 배경 잘꾸며낸거 같고 스토리도 잘만들어진거 같은데 해피앤딩 아니여서 쫌 아쉬움 ㅠㅠ 
2,꼭 그렇게 다가져야만 속이 후련했냐~!!! 
1,불필요한 베드신이 쓸데없이 많아서 보는 내내 불편하네요 조폭들 욕하는게 좀 웃기네요 유치했음 
5,재미는 드럽게 없는편이고 다들 연기가 어색하다. 스토리는 개연성이 없고 배우들이 온갖 폼은 다잡는데 가벼워보이고 연기같아보임. 한마디로 5점짜리 한국영화 
1,매우 기대 이하 입니다. 
1,"감독 배우 다 좋아하는데, 기대가 커서 그런지 좀 별로네요. 런닝타임을 좀 줄였다면 좋았을 듯. 이민호의 연기 변신이 있었다면 하는 아쉬움이.. 전체적으로 7점 초반이 맞는 것 같아서 1점 줍니다. "
4,이민호를 좋아하는 사람들만 볼것 비오면 패고 비오면 패고 아주 식상하다 
4,스토리도 엉성하고 연기도 별로... 너무 아쉬운 영화였네요. 
10,시나서 시간가는 줄모르고 보앗어요 
3,핵노잼 입니다 어휴 ㅎㅎ 
10,재미있음  좋았음  최고임 
8,재미있어요재미있어요 
10,나는 재미있게 본 영화임 
5,왜 봤는지 모르겠다ㅜㅜ 
9,강남 최고의 영화네요  모두들 오셔서 꼭 보세요 
8,내용이 풍부하고재밌었어요 
8,시대의 흐름을 간접적이나마 파악할수있어서 잘봤습니다 
10,재밋는데 하도 죽여대니까 영화보는내내 긴장하다가 피로도 쌓여서 나옴 
9,여자라서 그런지 싸우는 부분이 너무 많아서 조금 지루하기도 하고김래원과 이민호의 끈끈한 형과 동생 사이였던 과거 내용이조금 부족한 느낌이 드네요끝날때도 조금 아쉬웠습니다 
10,크크크흐흐크크크흐흐흐 
5,"내용전개가 좀 그랬음..,,김래원은 존잘 존섹시 "
7,생각보다 괜찮았던 영화입니다 
9,결말이아쉬운..하자먼과정이짠한.. 
7,비열한 거리보단 내용면에서 몬가 부족함 
3,별로예요.. 이미노잘생김 
7,다들연기잘함 김래원 연기 굿 
8,나쁘진 않은데 막 그렇게 재밌지도 않음 
8,음~~~역쉬 김래원 눈빛이 짱 
10,가아아아애에니ㅜ거래레 
6,볼만했다. ost가 좋았음 
6,그냥저냥 볼만했던 영화. 
7,그냥 볼만합디다 하허 공백이라니 
6,위 평점들은  오버다.  몇 페이지 분량의 내용을  그냥  길게 늘여놓은 느낌. 지루하지는 않았지만 내용의 전개도 툭툭 끊겨져 있는 것을 억지로 이어 붙여놓은 느낌. 
9,개인적으로 폭력성이 과다하다는 점만 빼면 좋았다  폭력성에서 -1점 
6,기대했던 것 보다는 조금 지루한 감이 있네요 
2,쌍화점 감독인거 미리 알았으면 안봤을텐데... 
9,스토리는 나름 괜찮은데... 너무 잔인하네요...도끼로 찌르고 낫으로 할퀴고 함마로 내려치고ㅋㅋㅋ 
8,재밌는 내용도 있지만 뻔한 스토리가 연상됨 
6,재미있엇어요 ㅎㅎㅎ ^^ 
5,노출 보다는 그 노출 한 두개 빼고 이야기 구성이랑보는 재미가 좀더 했으면 아쉽다 
7,쓸데없이배드신은 왜넣은거지? 
7,극보다 이면을 보아야 한다고 했지만 이면이 너무 묻혀졌다. 단순한 극으로서 보기에는 평범한 듯 보이지만 적어도 시계를 쳐다 보지는 않을 영화. 
5,일단 결말이 예상됨  액션도 나름 잔인하게 전개 됨 복고풍인데 복고적인 묘사가 다소 부족  복고풍과 70년대에 순수함이느껴지지 않음 뭔가 복고풍인데 아니듯한 느낌 그때 그시절이 아닌듯한 느낌 
6,1945년쯤 서울에 태어나서 1970년대에 강남 땅사고 싶게 만드는 영화. 내가 김래원 이민호라면 건달안하고 제비하련다. 죽으면 만고 소용없다. 
6,개인적으로 좋아하는 취향 장르가 아니어서 좀 지루한면이 있었다. 뭔가 그냥 느낌엔 긴 드라마 한편을 보는것 같았고 19금이다보니 사람죽이는게 ㄷㄷ.. 자극적이었다  하지만 영화를 본후 꼭 자극적인것말고도 다른 여운이...
6,신세계 복고판.... 
7,여친 때문에 보러갔다. 
4,미역굿 맛잇네 이민호 연기보고 지렸습니다 
7,재밌긴하지만 뭔가 모를 아쉬움 
5,너무 잔인한 장면이 많아서 눈을 감게 되네요 
7,개인적으로 강남보단 빅히어로6. 왜? 요즘같은 사회 분위기에 암울함보단 따스하고 친근함이 필요하니깐. 
5,시나리오 연기 좀 오버가 심하다.  와닿질 않아서 평점 낮게줌 
7,배우의 연기는 좋았다고 생각합니다... 다만 영화를 보는 내내 뭔가 자꾸  장면마다 끊기는 느낌이 있는데  편집의 문제인가요?? 긴 런닝타임은 그리 길게 느껴지진 않았지만  오히려 시간이 부족하다 느꼈습니다... 감...
6,소재는 좋은데 뭔가 긴장감도 없고 폭발적인 느낌도 없어서 아쉬운.... 연기는 좋았다. 그리고 베드씬도 ㅋㅋ 
8,볼만합니다정말로한번쯤만 
10,보면알아요. 이슬기 문채웡.거랑 바교가안됨 
3,별로 였어요..싸우는것만 보고 나왔네요. 
7,구럭저럭 볼만한듯 싶어요 
2,스토리 무리하게 맞추느라 머리굴린 값만드림. 
8,유하감독 시리즈 3탄^^  그래도 이민호가 나와 좋다 
6,지루하진 않았으나 전개가 매우 산만해서 내용을 이해하기 힘들다. 
6,스토리가 뻔했습니다 비열한거리랑 비슷하고 액션씬도 넘난장판인듯~~ 
8,임팩트가 좀 약하고 전반적인 스토리는   뭔가  10프로 부족한 듯...  어째든  잘 봤읍니다. ^^:;;;; 
4,너무폭력적이고.공감대전혀없고.뒤돌아서면찌르고죽이고.짜증나고너무지루했음.보고나서화나요. 
6,"어떤 메시지를 전하려고 한 건지는 알겠는데, 편집을 이상하게 한 건지 시나리오가 엉성한 건지; 아무튼 2% 부족한 전개. 배우들 연기도 따로 놀고.. 음악은 괜찮았다. 바람이 있다면 조폭 영화는 이제 그만~!!! ㅠ..."
10,잼씀 갠적으로 이민호보다 김래원이 돋보였음 
7,잼께봤어욘 넘 야해... 
6,배우는 훈훈했지만 영화는 그닥에 지루했음 
4,일단 스토리가 잘 안 들어온다. 필요 없는 섹스신과 폭력적 장면들이 있고... 유하 감독님이라는 기대치에 비해 실망스런 작품 
6,"짜집기 영화의 결정체..이민호, 김래원은 기대이상, 전반적으로 배우들의 열연은 돋보였지만 스토리는 진부하고 산만함. 액션신의 잔혹성은 극에 달하지만 리얼리티는 많이 떨어짐. 남는건 이연두의 재발견... "
7,남자가 보면 재미있는영화 절대로 여자랑같이 가지마세요임신한 와이프랑 보러갔다가 욕 엄청먹었음 
7,배우들의연기는정말좋았다 근데 잔인하기도진인한데 영화가처음부터끝까지싸움만하다끝나는것같아 큰여운은남지않아서조금아쉬웠다 
9,꿀잼...시간가는줄 모르고 재밌게봤네요..이민호.강래원조합도 괜찮고..AOA설현 넘이쁘당~ 
10,엔딩의 여운이 길게 남아있어요.. 현실을 돌아보게 하는 메세지가 담긴 영화였습니다. 
6,말죽거리 비열한거리 잘봤습니다만 이번건..제가 기대를하고 봐서인지.. 노잼입니다. 안타깝습니다. 
10,무조건추천 눈도즐겁고 배우들연기력도짱 스토리도짱이민호 김래원..연기최고ㅋ생각없이봣는데 졸잼ㅋ 
8,끊어진 선로를 질주하는 롤러코스터란 
8,간만에 빠져들어 본 영화네요 
6,봐도 그만 안 봐도 그만...so so...알바들 좀 쉬세요 이제 
10,"스토리,배우,액션 뭐 하나 빠지는게 없네요 거친 수컷 냄새가 제대로 나는 영화 탄생. "
9,한마디로 토사구팽 당한거네 
10,해바라기 이후로 김래원의 진한 남자 향기가 그리웠는데 강남1970가 그리움을 한방에 날려주네요~ 
10,선평점 주고 보겠습니다. 
10,미성년자들이 못보는게 안타깝다 ㅋㅋ영화 존잼 
10,요즘 김래원 아주 날라다니네용!ㅋㅋ 펀치에서도 상남자 스탈인데 1970에서는 진짜 대박..♡ 
5,개봉 미루면서 너무 기대감만 커진 영화 정리가 안되는땅 강남 1970 
8,현실감 있고   내용이  좋았던 영화 였습니다.  다만  여러 극적인 부분에서  다른 영화들처럼  특별한 음악이  흘러나오지 않아서  대체적으로 분위기가  숙으러 들어  영화의 좋은  내용이 잘  표현되지 못했던것 ...
9,유하감독님의 강남 집착은 ㅋㅋ 제대로 된 느와르 영화를 본 것 같습니다! 
10,무거운 영화지만 거부감이 없고 오히려 더 빠져들어서 봤다 
10,느와르적 쾌감이 장난 아님 ㅋㅋ 스토리도 괜찮고 이민호 김래원 때문에 최고 
10,감독의 의도가 가슴속에 와닿더라... 배우들 연기도 기대 이상 
10,대박..좀긴데도 시간가는줄모르고봤어요내용도있고 연기도 묵직하고. 짱 추천! 
10,70년대 그 시대 속에 자연스레 녹아든 배우들! 맡은 캐릭터의 특징을 잘 표현해준거 같아요~^^ 
10,아주  볼만합니다..ㅋㄷ 그리고 닥그네가 이영화 보면 아주 싫어합니다..ㅋㄷ 
10,진흙탕 액션신은 진짜 명장면!! 이민호는 다리가 길어서 좀만 움직여도 멋지드라..짱짱 
10,보고 난 후에 생각이 많아지는 영화..사람의 욕심은 어디까지일까 
8,유하감독의 느와르는 그러하다 
7,비열한거리랑 말죽거리잔혹사 이두편보다는 못한거 같다. 신세계보다도 못한것 같다. 느와르면 느와르답게 가야되는데 장르 에로 인줄.. 너무적나라함 하지만 눈뜨니 남자엿던건 반전 잼은 있었다. 어쨋든 아쉽다. 감동이없다 ...
6,이정도가 딱 좋은거 같습니다. 6점. 너무 진흙탕 싸움이였음. 실제로도 진흙탕에서 싸우기도 함. 그걸 표현하려고 그랬나 
10,이민호 재벌남 이미지는 이제 빠빠이~~~ 이런 강렬한 수컷 역할도 어울리는구나 
10,2시간이 금방 지나가네요 남자라면 한번쯤 볼만한 화끈한 액션 느와르영화!! 
10,오랜만에 정말 재밋게 본 영화다 이 영화 대박날 것 같아요~ 
5,액션도 화려하고 배우들 연기도 정말 멋있었는데....조폭 영화중에 제일 하급인듯한 느낌을 받았다.내용은 그저 그런 영화 
8,"익숙한 클리셰의 향연이지만, 재미있다 "
10,이민호의 연기 짱!김래원의 악역 연기도 짱짱짱!!! 
8,이민호의 눈빛이 여운이 남는 영화!!  최소한 돈이 아깝진 않다 
10,이민호 첫주연작인데 브라운관보다 스크린이 더 멋짐 눈빛 연기 아우라 빠지는게 없다 느와르물은 별로 본적이 없는데 이민호의 액션도 정말 멋짐 영화를 보고나니 씁쓸하고 슬프다 
8,이민호씨 시원으런 액션연기 좋았습니다!! 
10,유하 감독만의 연출력으로 살려낸 영화에요 거리 영화의 완결판! 
10,거친 영화라서 남자분들이 되게 좋아하실 것 같아요~~ 
10,이민호가 이렇게 연기를 잘했었나? 
10,액션이 시원시원하네요 보기드문 액션영화. 
10,잔인한거 싫어하는 사람은 도끼만 조심해! 
8,주인공들도 단지 게임의 말이였어... 
10,역시 유하 감독..다소 잔인하기도 했지만 그래도 영화 자체는 완전 재밌다 
7,전작에 비하면 떨어지는건 맞는거 같음 
10,배우들 연기력이 장난 없네요 영화는 리얼함 그 자체~ 
7,그냥 7점정도  이민호가 이 영화에 좀 부족한것같은데 
9,현실의 씁쓸함을 느끼게 한 영화였습니다. 언제나 끝까지 살아남는건 권력인가봅니다. 액션도 리얼리티가 살아있어 박진감있게 느껴졌고 저에겐 괜찮게 본 영화였습니다. 마지막 터널안에서의 종대 눈빛이 현실을 대변하는것 같아...
10,끌젬 졸잼 핵잼!!!ㅋ증말 재밋음 액션신은 최고 
10,"김래원최고ㄷㄷ 김래원때문에봤고, 김래원진짜최고였다. "
8,볼  만 했는데 등장인물들  이름이 너무 헷갈렸음 
7,그냥 마니 본듯한 영화...흥행작이 될만한 영화는 아닌듯 
10,한시도 눈을 떼지못하고봤다ㅡ역시 유하감독~이민호에 빠졌어 재미굿~~~ 
10,한번 보고 두번 봐도 몰입도 짱인 영홥니다~이민호의 액션과 눈빛이 이 시대상을 담고 있는듯  아련합니다  강력 추천~ 
6,딱 6점짜리;; 사람마다 취향은 다르다지만 김래원 빼고는 잘 모르겠다 김래원은 진짜 연기 존니 잘함 
9,김래원 점 멋지다~~~다 좋앗긴한데 여자인 내가보기엔 너무 잔인한면 이... 
9,눈으로 아트하는 두 배우의 연기가 압권 
9,"이민호의 연기력 기대이상이고, 김래원은 역시 최고네요액션씬은 이전작들보다 최고예요인물관계도가 다소 복잡하지만 재밌어요연기자들의 고생이 고스란히 느껴져요 "
10,굿잼굿잼굿잼굿잼굿잼 
10,김래원은 연기 잘한다생각했는데 이민호는 진짜 이미지변신 한듯  기대 이상으로 연기 잘했음. 영화 놓치면 후회할 것 같은 영화임. 
10,다 보고 나니까 멍..묵직한 여운을 준다 
10,"힘내,,..,,.. "
10,영화가 주는 긴박감은 아직도 잊을 수가 없네요 너무 재밌게 보고 왔습니당 
4,너무 재미가 없어요ㅠㅠ 
1,니들진짜 너무한거아니냐 
1,영화 신세계 정도의 수준을 기대하고 봤지만...내용도 별 거 없고 야하고 잔인하기만 함...과연 이민호 김래원이 나오지 않았어도 흥행했을까? 시간의 소중함을 알게 해주는 영화 
10,종대가  그리워  자꾸 영화관을  찿게  되네요 
8, 액션씬들은 기대만큼 시원하고 멋짐! 그때나 지금이나 쓰이고 버려지는 민초들. 앤딩은 진짜...강남땅에 국한되지 않는 씁쓸한 현실을 보여주는듯. 이거 메세지 무지 쎈 영화던데 일부러 베드씬을 이슈화 했나싶을 정도. ...
9,느와르 좋아하는 사람이 보면 재밋게 볼수 있어요~ 
10,기대하지 않고 봣는데 재미있네요 
4,싸우기만하고 끝난영화... 
8,재밋게봣어요ㅎㅎ엄마가 이민호씨 팬이라 좋아하시네요! 김래원씨 연기력은 역시 짱 
6,고기 썰기에만 여념이 없다. 피비린내는 진동하는데 왜 무엇이 그들을 거기에 묶어두는지 알맹이는 부족하다. 
9,관객과 끝까지 타협하지 않은 점이 이 영화의 단점이자 장점.배우와 감독의 배짱에 박수를. 
10,저혼자만의 시간이자 첨보는 영화입니다.뜻깊은 하루 
8,영화가 재미는 있으나 감동은 없네요? 
6,김래원이 너무 비급이미지다 
10,당신영화 정말 잘보고있습니다. 오늘 강남 보고왔습니다. 남들 x나 재미없다길래 보고왔더니 x나 잼있게 봤습니다. 역시 당신은 내 스퇄.. 근데 항상 당신 영화 많이 챙겨본 사람이지만 당신 영화 비평할 생각없는데 진짜...
9,오늘잘보았는데  다만아쉬운점이  도끼액션이면 신체일부가떨어저 나가는 액션이 없어서 조금아쉽내요 
8,재밌습니다.김래원연기는정말..최고네요 
8, 김래원 연기 넘 잘하고~~좋은 비쥬얼로 눈까지 호강하는 영화네요~~ 
8,"믿고보는 김래원, 이민호의 재발견이었으나글쎄요? 뭔가 훅.지나간 느낌. "
10,"베드신도 좋았지만, 설현 완전 사랑합니다.. "
7,결말이 너무 현실적임. 그래서 맘에 안듬 
8,좀잔인하기도 하고 야하기도 하지만 볼만함.. 
6,중간에 지루한 부분 있었지만 볼만한 영화였습니다 잔인한장면이 너무 많아요ㅜㅜ 
4,글쎄요...씀쓸함만 남기는영화같았어요.5일만에 100만 관객이선택했다니.약간 아이러니하네요. 
4,스토리 너무 진부하고 지루... 깡패 영화 재미있게 만드는게 참 어려운가봐요. ㅠㅠ 전작이 훨 나아요. 느와르라고 하기에 별로 잔인하지도 않은. 야한 장면도 그냥 그럼 그냥 다 어중간. 이민호 연기도 그냥 그럼. 영...
2,재미없어요그래도 살다보면 더 재미없는 영화도 있을테니 1점은 아껴둡니다. 
9,스릴만점...ㅎㅎㅎ 
6,이민호 멋짐 근데 좀 잔인 
8, 재밌게봤어요. 엔딩이 아쉽네요. 
6,참 잼있게 봤습니다 .짱이에요 
7,"관객에 대한 배려가 부족한 영화, 복잡한 것 같지만 매우 단순한 스토리 ㅋㅋㅋㅋ "
9,쫌만덜잔인했다면 백점이었을껄 
7,재미있게 잘봤네요 마지막이 결말이 조금 허무하네여 
6,너무 많은걸 담으려다보니 정작 중요한 흐름은 놓친느낌 초반부 흥미진진 중반부부터 전개가 답답하고 중간중간 빠진느낌 맥빠진다 
8,잼나게봤습니다 역쉬 김래원 
10,너무잔인하고 야해서 재미있었습니다 
7,"피칠갑의 칼질영화이지만, 뭔가 아릿한...가슴을 후벼파는 아픔도 있는... "
7,"그저 그런 액션영화, 김래원의 농익은 하류인생 연기와 조금은 어색한 이민호의 착한 조폭?연기....나쁘지않지만 좋은 점도 그리 없었던 영화...그리고 런닝타임이  너무 길다...별로 의미없는 장면 30분만 잘라냈으면..."
5,등장인물이 너무많아 헷갈림 액션은 좋아 
9,다 연기잘함.. 김래원이랑 이민호 쩔 ㅜ 
9,끝이 조금 아쉬웠지만 재밌게봤습니다.^^ 배우들 연기 조아요~~~~!!! 
9,양반은 죽어서도 양반이지만 OO은 양반발밑까지 오면 언제든 다시 추락하거나 죽죠 이게 영원한 진리 따라서 분수를 알라는 말 있뜻이 나대지 말고 항상 중간만 하면 양반은 못되도 OO으로 살수 있겠지  이민호 엔딩샷을보...
9,여자 감성은 아니고 남자들은 볼만한 영화 
7,김래원 연기정말 잘하네요그것외에는 머..진부한스토리 
8,이민호띄워주기??하지만 재밋엇다는 베드신 장난아니넼ㅋㅋㅋㅋ 
10,김래원믿고보는데 역 시 대단ㅋㅎ 
10,이민호의 연기가 무지 좋았어요... 선한 모습에서 강한 깡패 역까지... 영화 보는 내내 지루하지 않았어요... 
7,어제 봤는데...전 몰입도 좋았네요....조폭영화에 큰기대 안하고 보니까...특히 오랜만에 들어본 anak 노래가 좋았어요.. 
6,기대를햇는지 실망스러움ㅡ영화친구랑 줄거리가 조금비슷한느낌ㅡㅡ;;이런영화좋아하는데 그냥볼만햇어요1시간동안넘지루햇는데 뒤에는좀괜찬음ㅡ재밋는부분이잇긴한데 많이나왓더라면 초반에 질리지않고 재밋게밧엇을듯해요ㅡ액션보다 섹스장면...
6,갑툭나오는베드신과그냥저냥폭력 
10,여자친구랑 같이가서 보면 딱 좋다 
6,기억에 남는건 떡치는거랑 피가 난자한다는거 
2,너무 뻔한 스토리 전개랄까... 
8,잔상이 아련히 남는 영화. 두 배우 연기력 좋아요. 특히 이민호생각보다 연기력 좋더라구요 
5,스토리도  연출도  배우만 다를뿐 진부하며 지루했습니다나름 나간단  배우들로 이런 허접한... 
9,볼만은 한데 야한장면이 좀 너무 리얼하게 나와서...친구나 부부끼리 보면은 겐찮아요^^최근에 본 국제시장이 더 잼잇는거같아서요~ 
7,생각했던것보단 재밌어요 ㅋㅋ 
5,댓글들만큼정돈 아니던데...그냥 김래원 이민호 잘생겼음.. 
8,초반엔 흐름이 좀 끊기는듯 하지만 중반부턴 몰입도가 좋았습니다. 너무 잔인해ㅜ 
8,결말이좀 아쉽지만 영회 내내 긴장감있고 느와르영화의 특색을 잘살린거같다 
9,킬링타임갠춘... 
9,재미있네요 마지막이 허무한 감도 있지만 연기 좋았어요 
7,러닝 타임이 초큼 긴 느낌.. 이민호 연기 좋네 
6,불 필요한 정사씬 자제 했으면 더욱 좋았을듯!이민호가 건달에 안어울린다고 생각했는데여친은 이민호보는 맛에 봤다는.. 
8,이민호 김래원때문에 8점은 준다 
7,연기는 좋지만 전체적으로 지루함;;;; 
8,이민호 연기는 기대이상이며 전형적인 한국식 느와르네요~ 
8,호불호갈릴듯 남자들이좋아할만한 
5,아! 좀 지루 했었다. 쓸데 없이 폭력땜에.. 
5,솔직히 기대많이 했으나 돈주고 보긴 좀 아까움이벤트 당첨돼서 그나마 5점줌김래원 영화라 믿고 봤으나 영화 전체적적으로 부족함 ㅠ 
7,비열한거리가 더 나음. 이민호 연기도 약간 어색하고.. 
9,기대 안하고 봤는데 좋아요이민호도 다시 봤어요 음악도 인상적이네요 
7,"땅이야기, 정치이야기만 많고 중요한 캐릭터인 종대와 용기에 대한 이야기는 적고 불친절함. 그들의 과거사를 좀 더 보여줬으면 좋았을텐데 아쉽다. 액션씬은 좋았지만 베드씬은 과한 느낌. 그래도 배우들 연기와 김래원-이민..."
7,정말좋았음 이민호 짱 김래원 몸짱 ㅋㅋ 
6,"뭐가 쩔고 최고의 느와르라는건지..배우들의 연기는 좋지만 영화의 사이사이에 연결고리가 부족해 이해가 잘되질않았습니다.그냥 국제시장,오늘의연애 다 보시고 볼 거 없으면 보십쇼 "
9,르와르  볼만함  김민호가너무범생  김래원은양아치  승자는정부 
8,잔인하지만 재밌어요. 
7,전반적으로 평범합니다. 
5,쓸데없이 야하고 쓸데없이  잔인하고 쓸데없이 산만한...보기 힘들었던 영화! 멋진 두 배우를 데리고 왜 영화를 저리 만들었나 궁금했음. 정치권이나 땅이 개입되었다는 거 말고 비열한 거리와 뭔 차이가 있을까? 
9,연기 너무 잘함! 볼만합니당~~♡-♡ 
10,아~좋네요 굿 아쉽고 여운남고 
4,1970년의 느낌은 전혀 없었다. 옛날 사람인척 하려는 현대인들이 촌스런 옷입고 연기하고 있을뿐. 액션과 베드신빼곤 기억도 안나는 망작. 시대극 생각하고 왔다면 큰 낭패를 보게 될 것. 
10,삼십대 여자입니다. 십수년간 영화봐오면서 평점 남기는게 처음입니다. 이민호 김래원 그외 건달들까지 모두 다 연기 좋았어요. 유하 감독 각본 정말 예술이네요. 다시 보고 싶단 생각이 들었던 강렬하고 하지만 뭔가 씁쓸한...
10,액션도 끝내주고 재밌더라구요 
10,별기대안하고봣는데..재밋네요! 
