score,review
8,스토리 전개도 지루하지 않고  재밌게 봤는데 생각보다 좀 잔인한 영화..ㅡㅡ 
8,음. 옛날 기억하는건좋은디 완전 결말이 아쉬워요 ㅠㅠ 
6,너무 스토리를 압축해서 전달하려하다가 망한듯조잡하다 하지만 액션은 굳불필요한 베드신 ㄱㅅ 
7,과러를 회상하는 킬링타임용 
8,이민호 첫주연이라서본건데 예전에본 젊은남자 이정재랑 정우성나오는는영화가생가난다범죄와의전쟁과다른 깡패영화해바라기도 찍은 김래원거가서좀더 강한깡패인긴한데 이민호를보려고갔는데너무기댜를했어 다음작품은 연가력이남는걸로하길 
7,김래원 연기는 잘하지만 전체적인 내용을 봤을 땐 너무 뻔한 결말 조폭건달영화의 단골반전 배신의배신배신배신 결말이 개허무 연기력은 정말 대단하고 스토리고 좋지만 결말에서 -3점! 
7,배우들의 연기와 빠른전개 덕에 긴 러닝타임에도 불구하고 지루하지 않게 보고왔습니다. 그렇지만 너무 빠른전개때문에 아쉽기도하네요ㅠㅠ 
10,李敏?大?！！祝江南票房大?！fighting~~ Waiting for Lee minho's 1st film in which he acts as an aggressive role! 
5,액션씬은 진짜 쫄깃했으나 19금 장면과 끔직한 피 터지는 장면등 잔인한 액션물이라 심장 약한분들에겐 비추천 드린다! 
2,역시 그 나물의 그밥. 다 똑같은 얘기 
1,ㄴㅈㄴㅈ 내가 이걸 왜봤을까 
2,"영화별로 노잼  이민호발연기  그나마 김래원선방,,,  아낙의 음악만이  생각나네요,,, "
1,들인 돈이 아까운 영화.. 
10,평론가들 모야 재미만 있구만 
10,추석특선으로 금방봤는데 영화 좋은데 의외로 평점이 낮아서 놀람.. 
10,볼  때 마다  깊이  보게  되는  영화 
1,세탁소가 벗었어도 1천만은 넘겼을 것을!!! 
1,진부한 스토리. 결국엔 주인공 둘이 그렇게 될줄알았다. 그리고 역시 조폭영화. 배우들 연기는 볼만한데 반해 스토리는 너무 빈약. 한마디로 남는것없는영화. 킬링타임용으론 괜찮겠네요ㅡㅡ 
6,이민호 간만에 영화에서 보는 발연기였다. 
3,내용이고 뭐고... 김래원만 보인다... 이민호는 연기가 별로인지... 영화랑 안어울리고...영화자체도 구식 
1,"이영화주제에서 주인공분들이 너무 아까워요.ㅠㅠ허무하고 감동이 썩.,..워낙 주인공분들께서 연기를 너무 잘하셨는데ㅠ영화내용이  음... "
6,"배우들이 아깝네..화려하게 판을 벌리지만, 다른 조폭영화보단 많이 아쉽네 "
6,영화를 다 봤지만 아직 주인공들의 내면을 본 적이 없다... 가장 중요한 것을 빼먹고 난장판이니 감정이입이 안되지.... 
4,"주인공들의 우정이 빛나지도, 그렇다고 누군가 몹시 비열하지도 않는 서로 겉도는듯한 너무 옛스러운 영화... "
5,이민호 연기...먼가 아쉽다 
1,그만 만들자 이런거 언제까지 할레 
8,이민호 잘생겼구나.결말이 아쉬웠지만 잼있어요 
4,진부한 스토리..뻔한 결말 
6,딱히 볼만한 부분도 없었다 
1,아..별루에요. 최근 본 영화 중 최고 별로. 댓글 달기 처음이에요ㅠㅠ 배우의 연기력이 아까워요 ㅠ 
5,저는 별로 재미없게 봤네요 
1,진짜 거져 영화 만드는구나 
5,솔직히 연기 별로던데 김래원은 눈에만 힘주고 이민호는 그냥 평타 연기는 이병헌 하정우 따라갈려면 멀었다 
1,알바들 난리났네 ㅉㅉㅉ 
8,볼만함 근데 이민호비중이 너무높음 
7,그냥 … 볼만한영화김래원씨가연기는 잘하죠~ㅋ 
10,향후 행보에 대해 다시 연락 주세요 
6,감독이 이제 감성을 잃은듯 
7,별로...생각보다 별로 
6,쓸데없이 잔인했고 잔혹함에 눈이 찌푸려졌다 
6,생각보다 스토리와 배우의 카리스마 부족! 
6,그냥저냥 배우들땜에봄 
7,조금지루했음욕하고 싸우는장면이너무 만었다 
8,잼있어요 아무생각 없이보면 좋인요 
6,조금 잔인한 장면들이 많아서 불편하긴 했으나내용은  재미있었다. 
7,기대없이 봤던 영화라 재밌었어요..그냥 생각없이 봐야할듯하네요.. 
7,그냥 그저냥 그랬네.. 
10,최고다 김래원 연기 정말 쩐다 중대시절부터 아직도 낚시좋아하는지 궁금 
8,부산은 국제시장 강남은 영동개발 
7,이민호와 김래원만 멋진영화인듯 
10,이민호보다는 김래원연기가 좋더라이민호는 역시 꽃남임 
7,그냥 잔인하고...야하고...그냥..뭐...그냥 
8,슥ㅇㄷ긋ㄷ그와으으ㅏ으ㅏㅡㅅ 
6,오래전 서울의 주먹계와 정계의 암투를 엿볼수 있어서 좋았다.  로맨스를 겻들였음 어땠을까하는 생각도 해본다. 
7,진부한내용이지만 땅이라는 소재와 김래원을 좋아해서 칠점 ㄱ 
5,"무진장 잔인하면서 영화보는내내 몸을 비틀게 만들 정도로 힘들었지만, 쓰잘데기없는 베드신 장면을 삽입할 필요가 있었나 싶었다. 영화는 마지막 장면에서 강한 가슴 찡한 여운을 남겼다. "
5,난이민호가엄청난갑부가될줄알았드만다죽어버리네 
6,예매해놓고 못봤엉 ㅠㅠ 
7,역쉬~~거리시리즈가실망시키지않네요..근데이민호의욕연기가살짝은어색보입니당..잼있어요 
7,조폭영화는 항상 마지막이 아쉬움....반전없는 배신만 있을 뿐... 
7,스토리가 뻔히보이는데 그래도 느와르는 bad엔딩이 제맛 
6,백조의 두발이 되어 물밑에서 열심히 휘져었더니 다리를 띄고 하늘로 날아가네. 결국 승자는 가진자의 것. 거리의 3부가 다리만 남은 진흙탕. 
7,그럭저럭 볼만한 오락영화입니다 
8,강남의역사가‥넘폭력적이라아직도 어질~~ 
10,재미도재밌지만베드신이워낙 ㅋㅋ 
5,약간 지루하면서 무엇인가 허전한느낌??이민호 상남자향기 물신풍기고 역시 김래원~~배우들연긴 잘했는데 그래도 뭐라 말할수없는 이 아쉬움은 뭐지?? 
8,이영화를 명작으로 바꾸려면 정진영씨와 유승목씨의 배역체인지 또 이민호씨와 김래원씨의 배역을 체인지했다면 정말정말 볼만한 영화가 나왓을 것 같다. 서의원의 비중이 더 큰만큼 정진영씨의 악역연기가 절묘하게 어울렸을 것이...
7,지루하지는않았는데 약간의 허무함이밀려오는영화네요. 
7,역시 영화는 기대를 하고 보면 안되. 볼만함 베드신은 
9,러닝타임이 좀 길어서 지루하긴했지만지루할때쯤 재미있는 장면이 나와서 생각보단 괜찮았구 전체적으로 배역 캐스팅이 잘된 것 같아요. 특히 제비 오빠 넘 웃겨여 ㅋㅋㅋ 
8,서의원이랑 마담만잘된꼴이네...아쉬운건 용기 아이가태어나는걸 엔딩으로 끝냇으면좋앗을걸 
9,이민호가 배우가되었어요~~~~ 
8,다 좋았는대 그 여주 누구야ㅡㅡ 몰입이좀 
10,"이민호 김래원의 액션케미는 캬~~ 기럭지, 비쥬얼도 장난아님 ㅎㄷㄷ "
10,비쥬얼과 스토리는 단연 최고 ㅎㅎ 김래원이 나오는데 말이 필요해? 
10,진한 연기력이 장난아닌 연기파배우들이 총출동! 
10,두 배우 조합이 상상 안갓는데 대박이다 액션 케미가 눈을 뗄 수 없더라 
10,영화 보고나서 이런 감탄이 나오긴 처음이다 
10,뜨겁고 처절한 욕망을 진하게 담은 영화에요 
10,땅이라는 소재가 무척 흥미로웠어요 이런 비화가 숨겨져잇을 줄이야...?? 
10,김래원은 이런 남성적 캐릭터가 제대로 어울린다!ㅎㅎ 
10,기대 안하고 가서 그런가 진짜 너무 재밌었음 ㅎㅎ 
10,여운이 있는 남자다운 영화입니다. 
7,김래원 때문에 7점 드립니다 불필요한 애정씬이 좀 많은듯 굳이 넣을 필요가 있었을까 했던 애정씬이 한 2번정도 있던듯 
8,두주연배우의  슬픈사연과   권력자의 진면모를보여주는  암흑속에  해서는안되는 잔인한영화  크가는청소년들이 보고배울까바 걱정됩니다  악의속에 잘못살고있는 성인포함 앞으로는 감독에게좋은영화  부탁드립니다 두주연배우가 ...
10,서사적인 부분이 아쉽긴 했지만 그래도 배우들의 열연만으로도 스크린을 장악한다 
10,거리3부작 완결판이라는 말이 딱 맞다!! 
10,깡패영화  중에서  제일  발만든것  같네요남영동.황제을위하여  별루던데모처럼  잘만든영화 
10,이민호의 억제된 종대 내면 연기와 김래원과 케미가 너무 멋지고 좀 무겁지만 메세지가 강한 영화 
7,기대한 것 만큼은 아니지만 그냥 볼만했다 
10,김래원 연기 잘하는 배우가 나오는 영화니 무조건 봅니당 
10,남자라면 한번쯤 볼만한 화끈한 액션 느와르....강추 
10,흥미로운 소재와 스토리 그리고 잘 짜여진 구성까지 확실히 보고 즐길만하당 
10,남자들 영화라 큰 기대는 안 했는데...탄탄한 내용과 배우들의 연기에 상영시간 내내 몰입하면서 봤습니다.볼 만한 영화라 강추하고 싶네요~~ 
10,처절하고 슬프고 먹먹하지만 스토리 자체는 흥미진진!! 
10,남자들의 강한 욕망이 담겨있는 강남1970. 
10,역시 기대를 저버리지 않은 영화ㅋ이거 찍는다고 했을때부터 캐스팅 보고 기대만빵이였는데 
6,솔직히 재미없음 
2,쓰레기 영화 줄거리는 개판으로 전개하고 포르노만 즐비 에이 쓰레기 
1,췟 비열한 거리 따라 해볼라고 했는데 좃망 
5,알바OO들 이민호 김래원이 정말 배우하지마라 국어책읽냐 대사칠때마다 기력없고 졸린목소리 니들이 깡패연기를 해?  조연 엑스트라연기가 더낫다 
1,왜 망했는지 알겠끔 해주는 영화현실도 시궁창인데 영화라도 잘되게 해주지 뭐 그냥 있어 보이고 싶어서 그리 찍은건가  부조리 권력남용.. 그런거 다 느끼고 안다고 .. 그래서 해소할려고 보는게 영화인데 참 진짜 만드는...
1,메인 배우 캐스팅  실패의 표본 
10,땅값 올리려고 애쓰는 영화(왜? 내가 틀린 말 했니?) 
1,연출이 스토리의 맥을 마구 끊어놓는다 평점알바는 진짜있다 
1,완전 알바들만있고만... 이런 배우들데리고 쓰레기영화만듬.ㅋ진짜 이렇게 초점없는영화 처음봄. 전혀기대하지말고 시간때우기용입니다.. 
4,별로재미없다.. 씬이 그나마 볼만했다 
9,주인공들이 죽어서 약간 아쉬웠음 
10,완전 재밌습니다 역시 깡패 연기는 김래원! 
6,정신 없는 스토리였던거 같음 
7,래원이 때문에 7점.  유하는  좋은 영화를 만들뻔 하다 포르노를 만든다. 
5,그냥 적당한 영화 많이 잔인하지만이야기 개연성이 약해요 
8,"분명 재밌었는데, 신세계나 범죄와의 전쟁에는 있는게 이 영화에는 없는것 같다. 살아있네, 라던가 드루와,,, 라던가.... "
5,뻔한 얘기가 너무 길다~ 
9,강남의 옛모습이라니 ㅋㅋㅋ내용은 그냥 그냥 하지만 김래원 이민호 비주얼도 괜찮고 ㅋㅋ 너무 김래원만 이미지관리안해준거같기도하고 
7,우정과 배신의 이면적 모습 
10,중국시장을 겨냥해 투자를 받은만큼 편집본이 2개라던데.. 그 영향일까요.. 아쉽네요.. 그리고 폭력성과 선정성이 말이 많았는데.. 글세요.. 차라리 더 강하거나 아미녀 15세이상가로 만드는게 더 나앗을듯.. 이도저도...
7,좋은건지 어쩐건지 모르겠네요 
7,생각만큼 딱 그만큼 잼있어요^^ 
8,역시 깡패는 주인공이 개죽음.. 
5,볼만은하지만... 엄청 잔인하고.. 건달들이라 그런가 의리가 없다.. 
6,재미는있는데 약간지루해요 
7,까비 까비 까비 까비 까비 
7,생각보다 볼만했는데 이민호가 캐릭터가 잘 안어울림 김래원은 선방했고 
6,그냥 전반적으로 잼났데 ?끝마무리가 좀 그렇네요? 
10,"김래원이 너무 멋있었다, 진짜 정사신이 저렇게 아름다울수있다니 "
10,결말 ㅅㅂ....아쉽 
8,예상외로 볼만해요 결말도좋고 
8,그냥 깡패영화...친구의 또다른버전?액션은 볼만한데 내용은 뭐...그닥...ㅋ 그래도 재밌음 
8,도끼질을 너무해서 잔인하고 그냥 볼만해요 
7,지금의강남은그냥이루어진게아니라는거?를알기에는 좋은얘기거리였으나 온통싸우는장면?기억나는건별로없어좀안타깝다는? 
6,김래원 이민호 두 배우의 각자의 욕망이나 심리변화가 좀 더 세밀히 들어났으면 훨씬 재밌었을 것 같음 여기저기 뜬금없는 장면들이 있어서 집중도가 떨어짐 
7,그냥 무난무난 추천은 하지않음 
9,"너무 많이 기대를 해서 그런지 기대에는 못미쳤던 것 같다. 또한 자극적인 장면에 대한 감각이 무뎌져서 그런지 그다지 잔인하고 야하다는 생각이 들지는 않았다. 그래도 제일 좋아하는 남녀 연예인 이민호, 설현을 스크린에..."
3,테스토스테론만 강하게 느껴지는 영화.. 재미도 감동도 없었다 
5,김래원 나와서 기대많이햇는데 개노잼이다..비열한거리에 발톱때만큼 재밋더라 ㅡㅡ연기는 잘하는데 내용이 난잡하고 재미없다ㅡㅡ10점준 인간들은 영화보긴봣냐? 
7,너무과격하고감동없음 
8,민호.래원 연기 짱이예요 
7,재미있게봤어요  잔인하고 섹시한 장면이 많음 ㅠㅠ 
5,그저그럼 김래원짱임!! 
8,주인공들도 멋지고 재밌네요 
7,결말에서아 아아 한 영화 
10,이게 영화지~간만에 시간가는줄 모르고.ㅎㅎㅎ역시 절대불멸..김래원..ㄷ 
8,볼만은했지만 우리나라의 현실을 잘 보여주는영화. 뭔가 끝나고보니 씁슬한 기분. 
6,신세계는 10점 강남 1970은 6점 조폭 영화 좋아하는데 많이 아쉽네요. 내용 연결이 좀 어설푸고 임팩트가 없어요. 이민호 연기도 살짝 아쉽네요. 이연두 슴가 나오네요 ㅎㅎ 
4,많이 아쉽네요. 뭔가 새로움이 없는 .. 
6,캐스팅은 참 좋았는데 스토리가 복잡하고 이야기 전개도 끊어지는 부분이 있어요.이민호의 선량한 이미지가 그대로라 연기를 잘 했음에도 전체 영화분위기엔 어울리지 않는다는 생각이 드는구요. 이민호 좀 더 나쁘게 나와야 하...
8,김래원 이민호땜에 이영화봤다  혼자서 재밌게 보고왔음~ 
9,뿌린대로 거둔다는 속담을 주제로 한듯한 느낌..전부다 필요없고 이 영화에 나오는 배우들은 다들 좋다~~ 특히 여배우들은  흠~~~ 
9,와.. 떡칠때 완전 꼴림...   굿~~ 
5,친구 +비열한거리  유하 감독 특유의 영화 
10,유하 감독님의 거리3부작의 끝판왕!! 
10,장르가 액션이라 거칠기만 할줄 알았는데 마음을 적시는 감성도 있고 이민호씨 큰키가 이번 영화에서 제대로 빛이났네요 연기도 브라운관에서 보는거하고는 또다른 매력에 놀랐어요 김래원씨도 굿~~ 
10,김...래...원...굿이다 
7,기대하고 봤지만 그다지.... 
9,평소 잔인한 영화를 못보는 편이라... 큰맘먹고 봤는데.. 기대이상 이네요.  스토리 탄탄하고 메세지도 있어서.. 좋았습니다.. 종대 용기 그들의 운명이...마음을 먹먹하게 했어요 ㅜㅜ 
9,"폭력을 계획하는 자와 폭력을 행사하는 자, 가장 무서운 폭력은 권력일 수 있다...영화를 보고난 후에도 계속 여운이 남네요. 더우기,이민호의 연기는 매우 묵직합니다. "
7,소재는 좋으나 스토리텔링이 산만하고 아무런 감동을 느낄 수 없다. 
5,음 sbs드라마 자이언트가 더 재밌다는 생각을 함.. 
7,별로 재미없더라 범죄와의 전쟁 미만잡 
10,남자 영화라지만 여자인 제가 봐도 재밌었어여!! 
10,정말 재밌게 봤습니다. 4탄 도 꼭 부탁해요 감독님. 4탄은 이민호가 살아나서 복수하는걸로.부하들이 찾으러 와서 구하는 걸로 
10,"진짜 재밋어요 배우들의 화면 장악력도 좋고, 남자냄새 나는 영화 오랜만에 잘봤습니다 "
10,유하 감독 하면 당연히 액션영화지^^ 
10,이야 이런 정치 영화 처음봄.. 우리나라 최초아닌가 싶네요... 감독님 짱 근데 몰입도는 약간.. 
10,시원한 액션과 눈빛연기 잊을 수 없을거다^^ 이 영화 대박날듯~~ 
10,엔딩이 맘에드네요.. 찐한 감동이 들어있습니다 눈물이 그냥 마구 흐름 ㅠㅠ 
10,"믿고보는 이민호,김래원의 연기^^ 스토리도 재밌었어요 소재도 흥미롭고 ㅎㅎ "
10,오랫만에 정말 멋진 영화 잘 봤습니다. 이민호씨의 멋진 연기 훌륭합니다.응원합니다. 강남 1970 화이팅 
10,강남이 어떻게 생겼는지 스토리가 담긴 영화 리얼 아닌 진실이었다 
10,재밌고 먹먹하다. 시원 통쾌하기도 합니다 
10,영화가 다 끝나고 계속 여운이 남는 영화 ㅠㅠ 
6,"향수보다는 재미로, 설득력보다는 직진성으로 "
10,끝나고 한참 먹먹.. 종대눈빛..! 이민호 연기 진짜 깜놀.. 몰입감 제대로..! 진짜 배우였네.첨으로 다시 봐야겠단 마음 드는 영화. 대박..! 
10,무거워보이는 영화지만 다시 곱씹고 싶은 영화!! 
10,"시간 가는 줄 모르고 보다보니. 엔딩크레딧이 올라가고 있더군요.  액션이 시원하고 사실적입니다,  폼 잡고 그러지 않아 좋았어요. "
10,진한 남자들의 이야기. 여자들은 눈호강하고 남자들은 재미에 빠져들고~ 
10,남자가 봐도 이민호 캐릭터는 진짜 멋있었음 
10,거리 3부작 이게 끝인건가 ㅠ.. 계속 하면 앙대나여 
10,김래원은 선 굵은 연기가 잘어울리드라 ㅎㅎ 해바라기 이후로 기다렸어요 이런역할을!!! 
10,시대에 자연스럽게 녹아든 배우들의 연기도 좋고 재밌었다 
9,"김래원 연기 갑. 이민호는 아직 멀었고, 잔인,깡패 영화 좋아하는 분들은 잼있게 보실껍니다. 아니신분들은 지루하실수도... "
10,"강남이 어떻게 생겨난 곳인지 알 수 있었던, 소재가 흥미로웠던 영화에요 "
10,김래원의 펀치와는 다른 비열한연기 그냥 대박이예요!!이민호 역시 이런 상남자 이미지가 맞겠나..싶었는데 액션이며 눈빛 버릴장면이 하나도 없어서 보는내내 몰입도 대박! 
7,"유하감독 팬이라 기대를 많이 하고 봤네요. 말죽거리,비열한거리 모두 만족했지만 마지막 강남1970은 좀 미흡했습니다. 뭔가 부족하다는 느낌입니다. 아쉬운 영화라는 생각이  드네요. "
10,청불답게 자극적인 장면들이 많기는 하다..그래도 영화는 재밌었으니 만족! 
10,기대 이상으로 정말 재밋네요 역시 
9,비열한 거리 보다 업그레이드 됐네요. 재밌어요. 
10,"스토리부터 연출,배우까지 3박자가 완벽했던 영화! "
10,오늘 보고 왔어요 여운이 남는 영화!!! 
10,이민호 작품 꼭보고싶다.. 
10,남심을 잡는 영화임이 틀림없다ㅋ남자들이 딱 좋아할만한 영화인듯 
10,김종대역을 제대로 소화해낸 이민호의 재발견 
10,배우들의 실감나는 연기력은 진짜 말이 필요없다 덕분에 영화에 더 몰입 할 수 있었던거 같다 
9,잔인한것도있지만 그것도 나름대로 좋은듯 
10,역시 유하 감독님이라는 말밖엔... 
10,시간가는 줄 모르고 봄 김래원의 연기가 있어 더욱 돋보였던 영화였던것 같음 
10,영화가 주는 메시지의 여운이 남아 있어서 보고온지 좀 됬는데도 계속 생각이 나네요ㅎㅎ 
10,잔인한 폭력신들도 많이 나왔지만 충분히 개연성도 있어 보이고 시대상황을 제대로 반영해서 보여주는게 좋았습니다 
10,이건 계속 봐도 재밌을거 같음ㅋㅋ주말에 한번 더 보러 가야지 
10,개인적으로 친구 신세계 이후 가장 괜찮은 조폭영화다. 조폭미화도 없고 . . . 배신의 배신 배신을 거듭하는거는 비열한 거리랑 오버랩되는게 조금 아쉬웠지만 김래원 이민호 연기로 가려지고 . . . 김지수와나 설현과의...
10,보고나서 잔잔한 감상에 오늘까지 힘들다...가슴에서 뭔가 뭉클한것이 올라오는것 같다. 
7,그냥 재미로만따지자면 신세계랑 범죄와의전쟁보다 못함 친구2정도라보면 될듯 ㅎㅎ 
10,드뎌 오늘 종대 보고 왔어요~~이렇게 글 남기는 것도 처음이네요..이민호의 눈빛 때문에 오늘 잠 못 잘듯요...김래원 연기도 정말 좋아요~~ 
10,이민호는 스크린에 참 잘어울리는 배우같음 앞으로 영화 많이 찍었음 좋겠고 재밌게 잘 봤음. 영화 초반에 나오는 캐릭터로 쭉 나왔어도 웃기면서 새로운 느낌일것 같음ㅋㅋ 
10,넘재미있게봤다  이민호김래원연기도좋았다또보고싶당 
8,비열한거리 2  결국 젤 나쁜놈만 
7,"알바아님,,오늘낮에 봤는데 완전19세 영화고 10점주는사람들은 완전오바거나 알바들인것 같고..7.5점이 적당함.주.조연배우들..스케일은 큰데 좀아쉬움...결말이 넘뻔해서 맘에안듬..좀지루하고 "
6,새롭지도 않은데 멋지지도 않다. 배우들의 노력하는 모습만 보인다. 
10,재밌게 봤어요~~  마지막엔딩이 너무 좋았어요^_^ 
10,"배우들의 눈빛연기가 돋보였던, 역시 실망시키지않았던 작품입니다. 몇시간동안 영화의 여운이 남네요... "
10,그냥 치고 박고 싸우는 영화가 아닌 스토리가 있는 영화임 ㅋㅋ 
10,묵직한게 여운이 남는 영화였다 배우들의 연기도 그렇고 인상깊었던 강남1970. 
1,재미없대잖아 이거 뭐야 
1,별 1도 아까움 평점 알바 쓰지마라 신고한다 
1,바람 부는 날엔 강남가시나? 사이비 감독. 
10,잔인하지만 재미있는 영화 
5,첨부터끝까지 피 싸움 죽음 피 그리고 피 ㅠㅠ 제가보기엔 좀 잔인 ㅠㅠ 
5,역시...한국영화임당 초반에 조금 재미없다가 중간에 바짝하고 마지막에 허무하게 끝남!! 너무 기대하고 보면 안될뜻! 
8,길가다가 칼맞을거같아짐... 
10,김래원.이민호? 암튼 연기짱!!! 김래원연기대박이네요 
6,너무 기대를 많이 했네요 
4,잼나요ㅎㅎㅎ이민호멋찜 
10,섹스 장면겁나많음  특히 김래원 핡 
6,애로 장면이 너무 야하다. 
8,좀 아쉽다.말죽거리 잔혹사처럼 그때그시절에 녹아들기엔 2%부족하지만 그런대로 볼만했습니다. 
6,깡패를 건달로 미화...허나 멋있긴 하다. 
6,지루한듯지루하지아니함 
5,이 영화보고 헤어졌기에.. 
9,김래원 연기 쩔었다 진짜 너무너무멋있당~~ 
5,강남개발의 뒷예기 알게되었슴니다 
8,"비열한거리 + 죽거나 혹은 나쁘거나 = 강남 1970, but  앞에 나열한  두작품에 비해서 한컷이 부족한듯...  5년이지나도 10년이 지나도 두 작품은 뇌리에 박힌 한장면이 떠오르나... 강남 1970은 마지막..."
6,자극적이기만한 강남이~ 
9,우선 내용은 역시 액션신이 좋았습니다 둘째는 마지막이 좀 아쉬웠어요 
9,혹시나하는 마음에 봤지만 역시나하는 마무리입니다.배우들 연기가 좋아서 보고싶었던 영화였는데배우들 연기도 역시나하는 말이 나오네요.특별한 내용을 바라지않으시면 한번 보세요! 
7,그냥 그래요.. 폭력성이 좀 짙어보이네요 
8,내용도 볼만하고 연기력들도 괜안고..특히 김래원 쩐다.. 
4,기대가 있어 그런지 무척 아쉬운 영화..유하 감독님의 역량이 점점 줄어드는게 아닌지 심히 걱정스런.. 두 배우를 제외한 대부분의 캐스팅이 미스가 아닌가 하는 생각도.. 암튼 다음 작품에선 좀 더 높은 완성도를 기대합...
10,재밋네요좀잔인해요김래웑멋잇음 
8,베드씬이 많아서 좀 그랬지만... 이민호의 연기변신은 굿. 김래원의 눈빛연기까지 더해서 굿굿. 씬스틸러는 이석(눈여겨볼 배우인듯). 
7,지리했지만 교훈이 있는 영화. 
10,이민호때문에 본 영화 역시 이민호 대박!!! 시간가는줄도 모르겟더라능;;; 근데앤딩이 너무찝찝했어요 해피앤딩도 좋앗을텐데 .. 
7,기대를 최대한 하지 않으면 만족스런 얼굴로 나올 수 있다 남자영화인데 왜 40대여성 만족이높은건지?? 조금공감가네요ㅋㅋ 
5,해바라기.친구 를 적절히 믹스한 영화 그냥 시간 때우기용으로 볼만함 지루할만하면 떡신 나오고 지루할만하면 떄리고 뿌수는 씬 나옴 내용은 시작하자 마자 뻔함 줄거리가 다 보임 
7,그렇게 재미있지도 없지도 않은 영화 12월에 개봉했으면작살났을거 갔네 개봉미룬게 천만다행 ㅋ 
9,이민호의 한층 성숙된 연기력과 모든 배우와의 케미가 훌륭함. 김래원의 연기력은 정점인듯함. 영화의 진행이 매끄럽지 못한점은 다소 아쉬움. 
7,이민호에게서 간간히 유덕화와장국영이 보이지만 김래원은 아직도 해바라기다 
5,역시 건달영화는 마무리가 비슷해하지만 오랜만에 스크린복귀한 김래원 멎졌습니다.비오늘 토요일 좋은영화한편.. 
8,재미있는데너무폭력적이고... 
