score,review
10,진짜 웃다울다ㅋㅋ오글거릴수있다는얘기도 있던데 딱히모르겟어요ㅋㅋ암튼 재밌고  ㅋ서인국 다시보는ㅎㅎ 꼭보세용ㅋ 
10,재밌기만 하구만.. 평점 테러 넘한데~ 
9,솔직히 기대안하고 눈호강할겸해서 봤는데 괜차늠 !영화 공범은 보고나서 완전돈아까웠는데~차라리 노브레싱추천함♥서인국연기물오름~대박났음조케똬♥ 
1,기자 평론가 평점 보면 답 나온다. 알바 적당히 풀어라 개쎔이랑 멍청한 놈들아. 영화 볼 거 없나 찾아보다 평점8이라 나쁘지 않다 생각햇는데 이건 머.. 돈이 아깝드라. 진짜 쓰레기 삼류 영화 
10,저는 너무 재미있게 봤습니다. 조연들 연기가 너무 좋았어요~ 
6,권유리 발연기 때문에 몰입이 떨어졌다 그리고 스토리전개가 약간 어색한 부분이 있었지만 볼만했다 약간 오글거리는 대사가 너무 많음 
10,재밌습니다. 전체적인 내용은 조금은 뻔하다고 생각할 수 있지만 커버할 수 있는 뭔가가 있는 영화예요 
10,본 사람들마다 재밌다고 할 만한 영화였어요 
1,한치의 예상도 빗나가지 않는 
1,그냥 여고생들 눈요기용 영화 그이상은 아님 
1,평점 왜이러세요....? 토르나 볼 걸 
1,내인생최악의영화 평점도처음올려본다!국가대표아류작 
10,서인국 먹방이 장난 없음 T0T 다이어트 중인데 식욕 제대로 자극당함 
10,내 생각보다 평점이 높아서 긴가민가 했는데 영화 정말 좋던데요? 완전 시간가는줄도 모르고 봤어요 
7,노블리싱이라는 소재는 참 신선했다고 생각함. 그런데 캐스팅이 좀.. 그리고 체고 수영부 컨셉도 별로였고 그냥.. 소재만 좋았다. 서인국 연기 마니 늘었다 ㅋㅋ 
10,고민안하고 봐도 될 것 같습니다 
10,별 생각 없이 본건데 이렇게 타의로 강제 눈호강^^ 
10,노브레싱보다가 중간에 잠깐 울컥.. 가끔 가슴을 때리는 대사가 한마디씩 나온다. 
10,신선했던 소녀시대 유리의 연기실력! 오그라들지 않아서 다행이었다 
10,박철민 서인국 연기 잘함 그리고수영영화가 처음이라는 점에서..10점드림ㅋㅋ 
10,전국체전 장면은 좀 마음이 아팠다. 몇년간의 노력도 천재한테는 안된다는건가.. 싶어서 그래도 굴하지 않는 이종석의 모습이 멋지더라. 
10,어떤 영화건 아쉬움을 남길수 있지만 이정도면 적당히 훌륭하다고 할 수 있는 정도의 영화라고 생각한다. 
8,"몰입도 공범보다는 괜찮았다. 코믹이 많아서 중간중간 ㅋㅋ 거렸고, 눈물도 찔끔 나왔고, 유리 나올땐 좀 붕 뜨는 느낌이어서 스킵했으면 하는 심정이었음. 어쨋든, 재미있게 잘 봤음.평점 낮게 주면 뭔가 있어보이는 사람..."
10,노브레싱은 잉구기 매력이 철철 넘침 
10,오늘 노브레싱 보고 왔어요~~~ 서인국 진짜 짱 멋있다~ 
10,솔직히 잼나던데?^ㅜ^ 
10,와왕짱왕킹짱와옹!? 
10,결말도 나쁘지 않았고 괜찮더라구요  무지 재밌었어요 
3,손을 쥐어짜가면서 본 영화.서인국이 살렸다 유리 연기는 왜그리 어색..캐릭터 한 명 한명에 몰입하지 못해서 아쉽다.  마지막 수영대결은 멋졌다. 거기서 끝내지ㅠㅜ.러브라인도 절절하지 못했고 유리는 두 남자캐릭터 어느...
9,암튼 재밌었어요 수영대결들도 짜릿하구요. 
8,근데 솔직히 서인국 이종석둘다 연기잘하던데 
10,영화가 진행이 될수록 재미져요 
10,훈훈하고 더불어 눈도 즐거웠던 노브레싱! 
10,볼입도도 좋고 스토리도 나쁘지 않았다. 지루하라 틈이 없던데요 
10,서인국 먹성이~~~ 장난아니네요~ 보면서 어찌나 먹고 싶던지 
10,"서인국 연기에 대한 몰입도가,, 주군에서와는 또 다른 느낌이랄까.. "
10,왜 요즘 대세 배우들인지 확실하게 보여줌!! 연기도 잘하고 훈훈하더라 
9,서인국 연기 제법하는것 같더라구요. 서인국 앓이까진 아니지만 꽤 호감됐어요. 
10,첫사랑의 설렘도 너무 무겁지 않게 담아내서 좋았어요. 개인적으로는 괜찮았는데.. 
10,슈퍼스타K때부터 팬이었는데 이렇게 승승장구하는 모습을 보니 제가 다 뿌듯하네요~ 서인국의 첫영화를 응원합니다~ 
10,이제 먹방은 서인국에게 맡겨랏!! 
10,"유리랑 이종석보다,,이종석이랑 서인국 케미 돋네요~ 캬~ "
10,스포츠적인 요소가 들어가 있음에도 불구하고 배우들 덕분에전혀 지루함이 없었다 
9,이종석은  유니폼의 사나이. 트레이닝도  교복만큼 잘 어울리는 구나! 수영신에서 우상이와 원일이처럼 박태환 선수 를 이을 수영 꿈나무가 진짜로 있음 좋겠다는 생각이 절실히 들었음.  에구! 유리가  멋진 두남자의 데...
10,서인국 노래제목처럼 웃다울다 네요ㅋ수영씬 멋있고 색다른것 같았어요생각보다 괜찮은 영화! 
10,배우들의 비주얼도 멋있고 예쁘지만 진짜 영화도 잘만든것 같음  보는 내내 뿌듯함 
10,기대안하고 봤는데 예상외로 재밌다고 친구가 고마워했음 
10,"내내 흐뭇하게 볼 수 있었던영화개인적으로 고난,시련,갈등 너무 싫어하는데훈훈한 청춘만화처럼 기분좋게봤어요 추천 "
10,노브레싱 재밌게 잘봤어요~ 이종석 멋있어요ㅠㅜ 
9,진짜 이종석 서인국 보고 눈호강하려고 본 영화였는데 생각보다 훨씬 좋았음!! 비주얼때문에 보는 영화중에서는 거의 최상이라고 할만함.... 다만 권유리가 나오는 씬에서는 영화표값이아까워질수 있음ㅠㅠ 권유리 소시에서 젤...
10,잉구기~~~짱 감동~~~ 
10,서인국 연기력으로 오글거림을 커버하다니.. 연기 진짜 좋았습니다!! 
10,중간중간 수영신은 기대이상 좋았어요. 배우분들이 연습 많이 하신듯요 
10,특정계층을 겨냥하지 않은 가슴뭉클하고 따뜻해지는 가족영화라고 생각합니다. 별 기대 없이 봤는데 영화 재미있었어요. 
10,와.. 이 영화 짱임! 짱드셈요 
10,서인국의 연기만으로도 충분히 재밌고볼만한영화!!! 
10,쫑 나올때마다 한장면 한장면 버릴 것이 없었어요~ 걸어다니는 화보임~ 
10,조원일은 연기한 서인국의 연기하나만으로도 충분히 관객을 웃기고 울리고 꽤 괜찮은 영화라 할 수 있다 
10,꽤 볼만한 영화였습니다. 같이본 친구랑도 흡족해함 
10,영화 정말 잘봤습니다. 아직도 생각나네요.. 
10,이거 개봉날하고 그다음날 봤는데....ㅋ웃긴장면도 있고 슬픈장면도 있고 감동적인장면도 있고....ㅎㅎ또 보고싶다...ㅎㅎ 
10,재밌게 봤어요~ 아무래도 몰입도가 좋아서 몰입해서 봤습니다 
6,보고나서 멘붕에걸렸네요 너무아쉽습니다 
10,영화라는게 항상 복잡하고 무겁고 무슨 커다란 의미를 전달해야하는 것은 아닌 것 같아요.. 노브레싱처럼 그냥 편안한 마음으로 웃고..즐기고..또 가슴 찡..함도 느낄 수 있는 이런 영화! 진정 추천!!합니다. 그리고 ...
10,젊은 배우들의 연기력과 청춘의 풋풋함 비주얼적 부분으로 다분히 매력적인 작품읻당 
10,생각이상으로 영화 잘 뽑아 냈다. 정말 볼만하더라 
10,이건진짜추천해도 될 것 같다 
3,손발이 오글이라는 영화라함. 
10,볼때는 이종석나오니까 봐야지 했는데 나오면서 서인국 팬됐어요. 연기 정말 잘 하더라는 
10,영화계엔 신인인 배우들의 열정적인 연기하는 모습을 보며 몰입할 수있었다 
10,너무너무 재밌게 봤어요!! 서인국 이종석 땜에 본거였는데 정말 너무 유쾌하게 잘 봤어요! 두 훈남의 연기력이 정말 너무 좋았네요!! 또 보러 가야겠어요^^ 노브레싱 화이팅팅팅!!!! 
10,"개인적으로는재밌다고생각합니다, 생각보다 재밌었어요 "
10,이질감이 들지않았던 스토리 전개와 연기자들의 훌륭한 연기가 인상적 
10,방금 막 보고왔습니다~생각했던것보다 재밌었어요~! 
10,한번쯤 볼만한 영화예요 가서 재밌게 볼 수 있는 영화랄까? 
10,보길 잘 한것 같다 가족들이랑 같이봤는데 감동적이었고 만족스러웠음 
8,사실 초반에는 좀 산만하고 전체적으로 연출도 아쉬운 건 사실입니다. 그렇지만 후반부는 훅 빠져들었고 수영씬은 정말 좋았습니다. 두 남자 캐릭터의 밸런스도 좋았고요.. 이런 청춘물도 오랜만이고 소소하게 웃고 즐길만 했...
2,좋은 배우들 가지고 허술하기 짝이없는 내용의 영화를 만들었다..ㅜㅜ 아.. 안타깝네요.. 
7,오글오글ㅋㅋㅋ 뻔한 스토리ㅋ유리가 뜬금없이 노래함 
10,영화보고왔는데 괜찮더라구요 재밌어요 
10,요즘 본 영화중에 제일 잼있었던거 같다 
10,스토리도 재미나더니 역시 재밌더라구요~ 
10,연기력 연출 스토리 조연들 어느것 하나 버릴것 없는 알알이 알찬 영화 
4,"서인국,이종석 연기도 잘하고 재미있긴한데 영화로는 좀 돈아깝다..차라리 드라마로하지 영화는 오바인듯ㅠ팬이라서 눈호강해서 좋긴하다.근데 평점높게 주고싶진않다...중간중간 아이돌들 발연기..스토리.... "
10,이 영화 완전 기다렸는데 기다린 보람이 있네요 
10,"서인국, 주군의 태양하고 겹쳤지만 감정 연기 정말 잘하더라... 종석이도 카리스마 강렬했고, 조연들도 주연 못지 않은 개성넘치는 캐릭터들 뽐내서 가족끼리 와도 충분히 어색하지 않을 것 같다 "
10,"이종석, 서인국의 환상의 연기호흡! "
10,청춘영화답게 상큼하고 밝은 분위기와 두 배우의 캐릭터와 매력이 잘 보여지는 영화~ 보고나면 기분이 좋아져요 ㅎㅎ 
7,기대감 전혀없이 봤는데  쓰레기정도는 아니던데 ? 그냥 편하게 웃을수있는영화 . 스토리상 쓰잘데기없어보이는 유리의 오디션은 뭥미? 없어도되었을법한 유리의역할 . 
9,오랜만에 재미난 영화보네요 
10,진짜 오랜만에 영화다운 영화봤네요!!! 사랑해요 노브레싱!! 정말 재미와 감동을 모두 갖춘 영화네여~~~꺄 
10,"서인국씨와 이종석씨가 원일이와 우상이가 된 것 같았습니다 ! 캐릭터 소화력이 대단하신 것 같아요 ㅎㅎ먹는거, 우는거, 웃는거 .. 오랜만에 청춘영화보니 마음도 훈훈해지고 좋네요 :) "
5,진짜 서인국하고 이종석하고 박철민 덕분에 겨우 영화끝까지 봤다.. 나도 여자지만 그냥 눈만 호강하는 영화인듯.. 
6,"서인국의 연기가 이 영화의 핵심이라해도 과언이 아니었습니다. 스토리 전개, 인물들의 연기력 등이 5프로 부족했던 영화였어요. 스토리도 그다지 특별한 것은 없었고 서인국 빼고 어색한 연기가 진짜 거슬렸던 영화. 중간중..."
10,서인국은 응칠부터 정말 쭉쭉 잘나가네요~ 가수출신이지만 연기력 논란따위!! 
10,이종석과 서인국의 케미가 기대되는 영화! 보는내내 눈이 호강한다~ 강추~!! ㅎㅎ 
10,"간만에 자극적이지 않고 스트레스 안받고 즐겁게 본 영화입니다. 이종석,서인국 연기 합도 좋았구요. 이종석의 과장되지 않은 담백한 연기, 서인국의 코믹한 연기 가 조화를 잘 이룬영화입니다. 다시 보고싶네요. "
6,....뭘까 네티즌 평점이랑 전문가 평점은 따로놀고 댓글들은 전부 별점 만점에 왠지 알바같은 느낌이고 베댓들의 공감수가 같은건.... 
9,"뻔한얘기라 생각했는데 생각보다 안뻔하고, 재밌었다. 잔잔히 웃음터지고, 갈등구조가 무겁지않아 보기편했다. 같이 보자는 친구들이 많아 여러번 보게될것같다. 영화끝나곤 백프로 삼겹살집으로 갈듯ㅎ 먹방뿐아니라 전체적으로 ..."
1,이거 알바 확실함. 이종석 개 느끼남 비호감남으로 인식되고 서인국은 그나마 연기잘함 근데 총체적으로 스토리가 어디를 가야할지 길을 잃음. 이종석 '샴푸 바깠네?' 대사에서 여친이랑 영화관 조용히 퇴장함...
1,후우...뭐여 이게.. 
9,간만에 상큼한 영화임. 수영경기장면이 최고. 
9,너무 감동 받은 영화입니다. 배울 것이 너무 많아요. 다시 보러 가야 겠어요. ^^ 
8,오글오글거린다.... 
9,솔직히 진짜솔직히 재밋다 평점왤케 낮지 
10,재밌었던영화b보면서소름끼쳤고감동적이여서눈물이났던영화. 
10,수영이 무섭지만 이 영화보고 배우고 싶은 욕구가 마구생김 물개처럼 헤엄치는 모습 너무 멋있어. 
10,재미와 감동이 함께합니다.. 
4,정말 어이없는게 영화리뷰어들이 영화까면 배우팬들이 우루루 몰려가 화를내는데 리뷰어들은 영화를 보는거지 배우얼굴보는게 아니잖나... 화보구경도 아니고... 솔직히 영화자체는 뭐 감안하고 눈감아줘도 높은 수준은 아니었다...
1,저 배우들 중에 한명이라도 좋아하는 배우가 없다면 평점 10이 나올까싶다 
10,괜찮다고 하고 봤어요 순간순간 몰입도가 있네요 
4,영화 도중에 몸을 배배꼬게 만들었어요ㅜㅜ...재미없어서 
10,이종석과 서인국이 나옵니다.ㅎㅎㅎ 스토리는 좀 뻔하지만 충분히 감동적이였구요^^ 
10,갸봉허자마자봣는데 정멀재믹엇다 
3,이야기 중간중간 나오는 쓸데없는 러브라인이 이 영화의 가장 큰 단점. 권유리의 캐릭터가 없는 것이 차라리 나았을뻔....몰입도 방해엔 갑이었음 
3,내용이너무뻔하고지겨웠어요그래도 서인국이랑이종석 멋진연기잘봣어요 
9,영화적 특성을 고려해보더라도 이정도면 잘만든거 같아요. 최고인듯요 
10,제대로 재밌음 이런 스포츠 영화 좋으다 
10,저는 되게 재밌게 봤는데 제가 생각했던 평점보다 좀 낮네요 
10,서인국 짱짱! 주군때부터 심상치않다 했는데 한건 했네 
10,재밌습니다. 기대별로 안했는데 재밌게 봤어요 
10,가볍게 볼수도 있는 영화인거 같습니다. 풋풋한 느낌의 영화라 보고나서도 흐뭇했어요. 
10,싱그러운 청춘영화~ 멋있는 이종석 귀여운 서인국 보며 훈훈하게 스트레스 날렸어요.^^ 
10,간만에 재밌게 본 영화예요. 영화관에서 보기 딱 좋은 영화인듯 
10,한껏 기대하고 보는 영화는 의례 실망하기 마련인데 이번 영화만큼은 기대이상이라고 말할 수 있습니다. 
10,별 기대안하고 본건데 의외로 재밌네요^-^ 노브레싱 흥해랏! 
9,이런 장르 좋아하면 진짜 볼만함 
9,정말재밋고 의외로 웃긴장면이많아서 만족햇어오.기대햇던것보다 재밋고 좋앗어요!!ㅋ 앜ㅋㅋ근데손이너무오그라들어서 보기좀....ㅋ그랫음유리 노래가 정말....ㅋㅋ 나름 서인국먹방땜에많이재밋기도햇어요 
10,음. 영화 자체도 그렇고.. 한번쯤 볼만한 영화라고 생각합니다 
10,서인국 완죤 귀요미~대세남들이 모인만큼 비주얼 아주 굿~입니다 
10,전 남친이랑 봤는데도 남친도 괜찮다고 하더라구요.  유리가 나왕서 그런가; 
5,이영화는 서인국이살리고 유리가망친 그래서5점짜리영화 
10,"조금 더 잘 나올 수 있었다는 아쉬움은 남지만 이종석, 서인국의 연기가 좋았고 싱그러움이 느껴져서 나름 만족스러움 "
8,재미있었음....! 
2,"난 이걸 왜보고 있는걸까...뭘 말하고싶은건지 모르겠다. 수영하다가 노래하다가 비맞다가 울다가ㅋㅋ대체 유리 오디션 나가서 노래하는건 왜 나오는거지...러브라인이 영화 더 망치고 있는듯,그냥 버리고 가지. 유리는 연기..."
10,그냥 아주 서인국 이종석 연기는 아주 좋았다다만 아쉬운건 권유리의 연기. 아역들도 연기를 잘한것 같진않다. 손발이 오글오글.전체적으로 스토리도 괜찮았고 참 0.1초의 기적. 
10,서인국의 연기력이 이정도 였나 싶을 정도의 흡입력있는 연기가 인상적 
3,박철민아저씨의 깨알연기가 재밌었음. 이종석 서인국연기력 많이 물올르긴 했지만 유리의 오글연기때문에 다 묻힘.... 유리는 걍 소시활동만 하길....솔직히 유리나오는 내용빼면 좀 더 재밌었을듯...유리때문에 재미없었음...
10,재미있게 봤어요 ^^ 서인국이 빵빵터트려 주는데~~오오~능청맞은연기를 매우 잘하는것 같아요 ~ 수영하는 모습도 멋있고 ♥ㅡ♥ㅋㅋ강추예요~ 
10,소녀시대..솔직히 유리 연기력 걱정 좀 됐었는데 가수 출신 배우 2명이었지만 연기들 다 잘하더라 
10,기자들 평점은 낮지만 청춘영화에서 뭘 그리 기대하는 걸까?충분히 재미있다. 또 이종석 서인국을 좋아하는 팬들에게 충분히 흐뭇하게 해준다. 개인적으로는 은위보다 훨 좋았던 영화!! 
1,"기자 평점 보소.. 영화 자체에 대해서 뭐라 하는건 아닌데 ; 솔직히 이 영화는 서인국, 이종석 이런 애들 좋아하는 중, 고등학생들 및 성인 여자를 위한 영화 아닌가 ; "
5,"서인국친구의뜬금없는 엄마와의통화,어색한사투리,소시유리의 대박사건만연발하는대사 진짜유리그분은 연기하지마라 서인국연기만이 기억남는영화 "
1,제발 이런 쓰레기 좀 만들지 말자... 쫌... 
5,어색한 엇박자의 연속... 
1,간만에 정말 풋풋하고 유치찬란한 영화 잘봣습니다^^내손발이 어디간거지? 
1,제발좀  쓰레기는 쓰레기통으로 
1,    무감동무여운안습이다 
1,"쓰레기, 감히 평함 ㅇㅇ "
1,아이고.. 주 관객층인 10대 참여율이 10%에 평균 6.12점인데.. 40대 참여율이 36%에 평균 9.24점이라니.. 알바 티를 내도 적당히 내야지.. 양심적으로 너무하지 않냐?? 
1,????왜 이영화 평점이 8점이 넘지 ㅋㅋㅋ똥싸면서 5분만에쓴 스토린데 
10,좀 아쉬움이 남고 내용의 흐름이 조원일 위주가 더 많았던게 아쉽지만 볼만했어요 
10,시간이 언제 이렇게 지나갔는지 모를만큼 재밌었다 
10,와 .. 오늘 보고 왔는데 우왕 진짜 재밌더라! 
10,영화 내용이나 질이나 괜찮은거 같습니다. 봐도 무난하게 좋을 것 같네요 
10,우왕굳굳 다들 연기도 잘하시고 몸매도 좋으시고^^ 
10,닭발뼈 뱉기 신공;; 그래도 이뻐보이는건 유리 비주얼덕분인듯 
10,뭐 취향에 따라 좀 다를 수는 있지만 영화 자체적으로만 봤을 때도 충분히 잘 나왔다는 거! 
10,캬~~ 이거 괜찮다 스토리도 있고 볼만하네~ 
10,조연배우분들의 감칠맛나는 연기가 극의 재미를 돋궈주네욤~ 박철민 짱짱! 
9,처음으로 재밌게 본 스포츠 장르의 영화 
10,배우들의 그간 노력이 눈에 보이더라구요. 정말 선수같았던 몸놀림이었어요. 
10,"깔끔하게 연출력, 스토리 완전 맘에 쏙듭니다! "
10,너무 재밌어서 두번본영화 한번더 보려구요 ㅠㅠ이종석은 뭐 연기 말할것도 없고 서인국 넘 잘함..ㅠㅠㅠㅠ노브레싱 대 박 
10,"곳곳에 깨알같은 코믹설정이 웃기더라구요, 애드립이지는 모르겠지만 박철민씨 코믹연기 쫭 "
1,대단하다. 이런 영화를 만들다니. 
10,나쁘지 않았다고 봅니다. 엄마랑 봤는데 엄마도 볼만했다고 그러시더라구요. 
10,"방금 보고 왔는데요, 그냥 끝날때까지 시선고정이네요,, "
10,옴몸에 감동이 노브레싱다보고 토르보려 했지만 감동이 없어질까봐 이것만봄 
10,이런 장르 좋아하시는 분들한테 정말 강추하고 싶네요!! 재밌을 영화입니다 
10,전 엄마랑 봤는데 엄마도 꽤 좋아하셨어요. 울엄마도 소녀시네요~~ 
1,재밌어요 진정한 노브레싱 
2,졸라재미없음 서인국오버연기보기힘들어요 
1,공짜표 생겨서 봤는데 시간이 아까웠음 
1,이종석 팬이라서 봤다. 마른줄만 알았는데 비율좋고 몸매 좋아서 기분좋게 봤지만 말이 주인공이지 주인공은 서인국이였구 이종석 비중 적었음 보는내내 실망. 왜 이런작품에 나온건지. 안타깝더라.이종석에게 맞는 작품이 아닌...
4,그저 해맑은 서인국 영화. 
1,돈주고 잠자다가온영화다 
1,"..한 4점된다고 생각하는데 균형을 맞추기 위해!솔직히 기대는 하지말고 볼것을 권장.모든 대사와 내용이 나를 예언자로 만들어줌.뻔하고 오바스러움.감독님과 작가, 그리고 모든 스텝에게혹평들이 큰 발전의 원동력이 되길 ..."
10,너무 재밌어요ㅎㅎㅎ 유리누나 사랑해요ㅠㅠ 
10,웃다가 울다가 또 웃다가...시간가는 줄 모르고 봤어요. 서인국과 이종석의 매력에 흠뻑 취했네요^^ 밝고 건강한 영화!! 
9,서인국 이종석 다 좋은데 권유리 땜시 몰입도 확깨짐 뭔가 아쉬운 영화 
1,여자분들 제발 남친이나 가족한테 이 영화 같이 보자고 하지 마세요. 보고싶으면 취향맞는 친구랑 보던지 아니면 혼자 보든지.. 왜 엄한 사람 끌어들여서 같이 죽으려함 
10,청춘얘기 잘살린것 같아서 좋았다. 그리고 유리부분이 어색하기도 했지만 유리의 청춘을 얘기한것이니까 봐줄만 했고 감동도 재미도 고루가지고있던 영화였다. 
10,노브레싱 흥해라!!!내일 꼭보러갈꺼임♥ 
10,서인국 팬이라 서인국 수영씬으로 눈만 호강할줄 알았는데 이종석 연기가 꽤 놀라웠다. 오글거리는 모든 대사를 짊어진 이종석이 이정도 소화해냈다는 연기력에 박수를 쳐주고 싶었다. 서인국은 귀엽고 이종석은 멋있었다. 
10,이럴 줄 알았어요... 대박 재밌네! 
1,흥행못할꺼같습니다 에구 
1,ㅎㅎ... T 포인트로 천 원 주고 봤다. 그런데 천 원마저도 아까운 영화였음. 
1,이것도 영화라고 두시간이나 하나.유리가 예뻤음. 
1,전문가평점보세요..이렇게당황스러운영화는첨이네요ㅋㅋ 
1,평점알바 뿌렸구먼.. 헐~~!!! ㅠㅠㅠ 
1,"팬들을 위한 영화, 어설픈 청춘멜로영화인듯 "
1,이런거 한번만더 보러가자하면 의사얼굴면담시켜주고싶은영화 
1,"한마디 끝, 클리셰 투성이 "
1,내가 아는한 최악의 영화 
1,중간고사 시험기간에 촬영와서 학생들한테 미안하다고 한마디만 해주면 좋은데... 
1,개봉하루만에 평점질1000개돌파??이건 알바나 빠순이들의 조작질임이 틀림없다 
1,진짜 더럽게 재미없다... 
1,딱봐도 상업적요소만 물씬피어난다..저수많은 공감과 댓글알바들의 노력 가상하네 
1,어휴 제발 언제 철들래ㅋㅋㅋㅋ여자들이란.. 
1,와..이건 뭘보라는건지..ㅡㅡ 웃음밖에 안나와 진짜 돈아까워 보지마요 기대 잔뜩했는데 허망감만 잔뜩 준 영화 뭐야 이게ㅡㅡ 영화값 만원이면 호떡 10개나 사먹을수있는돈인데ㅡㅡ호떡이나 사먹을걸....후회막급 
1,늑대소년은위랑 비교하는데 늑대소년은위는 최소한의상업적재미는있었다ㅡㅡ 너목들때문에 이종석팬이지만 이게재밌다는사람들은 그냥 낙엽굴러가는것만봐도 재밌을듯 
1,유리 발연기 안습... 대사 내뱉는거마다 오글오글 거려서 흐름꺠짐 
1,진심 이 영화같지도 않은 영화는 영화계에 대한 모독이다. 
1,알바들말투다똑같애 ㅋㅋ존나티나염 어이가뺩을때리네 아진자 서인국연기가아깝다 서인국씨 다음엔 탄탄한작품과함께해서 제대로빛을보세요 ! 
1,연출의 미흡함과  지맘대로 널뛰는 스토리유리는 왜나온걸까에 대한의문. . .연기자에인기에 매달린  숨막히는영화ㅡㅅㅡ 
1,이게 뭐냐 ㅡㅡ?  출전 자격 미달 청춘영화 
2,솔직히 이런 영화는 아카데미에서 연습하면서 만들어봐야 할 영화지..관객들한테 돈주고 보라고 만드는 건 너무 하지 않나..?80~90년대 스포츠만화에나 어울릴법한 이야기에 오그라드는 CF연기까지..심하다..여자들 눈요...
1,"1점도 아까운 영화 발연기하는배우, 과장된 연기, 공감가지 않는 스토리 "
1,"남친있는 여자들아, 최소한 생각이 있고 매너를 알고 배려심이 있다면 데이트할때 남친한테 노브레싱 보자는 말은 하지 마라. 돈 한푼도 안내면서 남친한테 고추새끼들이 다 벗고 나오는 게이물을 보자는게 말이 되냐? "
1,이게 시바 평점 8점이넘네  알바시바랄들아 제발 쫌 내 평생 한국영화 안본다 
1,여자가 보기엔 모르겠지만 남자가 보기엔 솔직히 이종석 서인국 그렇게 매력있고 잘생긴캐릭터는 아니다...맨날 티비나올때마다 그런생각밖에 안든다. 캐스팅 실패다 진짜..하도알바많은것같아 1점준다. 
1,이것도 영화라고 참.... 알바들 평점 쩌네~ 쓰레기 즐이다~ 
4,서인국 이종석 그리고 선수로 나오는 다른 배우들의 훈훈함은 10점 준다.. 권유리 연기때문에 -10점 됐다.. 진짜 미치겠다 나올때마다 화면껐다 ㅋㅋㅋ 
4,요즘 나왔다면 수영복동 소리 들을 영화 
