score,review
10,이거 진짜 울고ㅠㅠㅠ난리가 아니고 웃길땐 웃기고ㅠㅠ이거 안보면 후회하뮤ㅠ<호흡을 멈추고 물살을 가른다 사랑하는 아내와 아들을 위해>이 말이 제일 슬펐고 진짜 안보면 후회하는 영화임 
10,영화적 관심은 없었는데 보게 되니까 괜히 요즘 말많은 영화가 아니구나 했네요 저는 호에 한표 걸겠습니다 
10,웃기기도 하고 감동적이기도 한 노브레싱 꼭 보세요 
10,이런거 좀 별로 안좋아했는데 이영화는 좀 재밌네요 ^^ 
10,지극히 주관적인 관점이지만 여자친구끼리 보면 더욱 재밌게 볼 것 같아요. 남친 눈치 안보고 보세요~ 
10,예고편은 그냥저냥 했는데 본편은 꽤 재밌네요 *-* 
5,유리랑 박정철 연기 어색해요 대박사건이종석이 잘생겨서 5점 
1,노잼 서인국 이종석 팬들이면 그냥 한번 볼만한정도  이종석의 몸매는 벗는 영화하기엔 쫌 그랬다 
2,..억지웃음유발.. 흐름끊기는건기본.. 
1,억지재미 억지감동 의  오글거리는 두 시간 
10,"뻔한 청춘영화라는 평에 별기대없이 봤는데 생각외로재미있게 잘봤습니다.  기분좋은 청춘,스포츠물이고,중간중간에 감동적인 부분도 있어 눈물도 살짝났네요.청춘스타들이 나온다고 색안경끼지마시고 가벼운마음으로 보면 즐겁게보실..."
10,호흡을 멈추고 물살을 가른다.. 둘이 마지막에 노브레싱하는거 멋졌어요. 
9,"학생인 아들하고 보기에 좋았습니다. 서인국 연기도 재미있고 자극적인 장면없고,보고나서도 기분 좋은영화. "
6,팬으로서 이종석과 서인국에 대한 최소한의 예의...연기도 스토리도 연출도 싹다 최악이다 
1,한국영화는 말도 안되는 로맨스같은 것으로 흐름 끊는것은 좀 안했으면 좋겠다... 
1,존구 영화! 보다가 나온 영화는 이게 처음 인듯 
1,2013년 또하나의 쓰레기 영화 탄생이네....매년 늑대소년 은위 노브레싱 이딴 OOO기 영화 나오는거 지겹다 
1,2013년 최고의 기대작이래 ㅋㅋ 진짜 양심없다 ㅉㅉ올해 나온 영화중 평가나 관객수 둘다 30위안에 못들듯 
1,권유리 때문에 화가 났다 얜 머냐? 젝스키스의 장수원과 비슷한 연기력 
1,후 내돈... 하... 
1,그냥 이종석 서인국나오는영화  창작의고통따윈없는영화 
1,"중간중간에 나오는 오글거리는 유리의 노래, 참 연계성 없는 끼워맞춤이 안타깝다. 이종석 서인국 빠순이들을 위한 영화. "
1,대놓도 오글토글한 영화 오랜만에 보네 
4,다된밥에 유리뿌리기ㅋ 
9,권유리가 영화망친듯.... 연기좀 아니다  그외 다른 연기자들의 연기는 정말 최고고 내용도 탄탄해 눈물 콧물 웃음 감동 다잡은영화!! 
1,생각보다 평점이 아주 높네... 개인 취향이니깐.. 전 정말 별로였어요.ㅋㅋㅋ 계속 무표정으로 보다가 끝난 영화... 별로 비추하고싶다아 ㅜㅜ 
1,진심으로 영화관 팝콘먹는맛으로 봤다. 울엄마 블록버스터같은거 말고 사람냄새나는 영화좋아하는데 첨으로 주무셨다 기승전결이 아니라 기기기결 이랄까 
1,재밌어요 진정한 노브레싱 
1,개봉 첫날 4위 ㅋㅋ 제대로 망했네 ㅉㅉ 
1,장난하냐이게무슨명작이냐으휴ㅉㅉ1점도아까운영화걍남자근육핡핡거릴려고만든영화 
1,이딴것도 영화라고 만드냐 ????  제발 이런 영화는 만들지 말어라 욕만 얻어 먹는다 
1,알바천국이 여기있었구만 
1,배우들 얼굴빼곤 볼게 없는 영화 
1,영화가 그지같으니까 평점알바를 풀었나보다 
1,알바 제발 ㄴㄴ 알바깝치는 네이버영화 평점믿지말고 왓챠 가서 평점좀보고영화봐요 
4,알바에 속지말고 보지마세요. 재미도없고 감동도없는 영화입니다. 
1,삼겹살먹다가 유리가 갑자기 기타연주를 시작했을 때부터 내 영혼은 이미 영화관을 뛰쳐나오고있었다.. 
8,눈이즐거웠음 그냥 그랬음..우정 스포츠 감동 코믹이 다 어설프게 녹아나있음..그래도 눈이즐거웠으므로 8점줌 
1,연기가. . .남주는괜찮은데 
1,머하자는거여시방머하자는거여시방머하자는거여시방머하자는거여시방 
10,아직도 잊혀지지 않는 영화입니다 
1,영화를 숨참고 만들었나봐요 ㅋㅋ 그냥 열심히 하는 배우들을 응원할뿐... 
4,오글거려 죽을뻔함 서인국이 가끔 인공호흡해줌 
8,이종석은 들마에서 많이 봐왔던 연기를 서인국은 정말 조원일 같았다 스토리는 하이틴로맨스도 아니고 러브라인은 안어울렸다 수영과 우상.원일의 우정에 좀 더 집중했더라면 더더 좋았을것 같다 제목은 노브레싱 스토리는 하이틴...
10,그냥 추천!! 보시면알아용ㅎ 
10,"굿 종석,인국멋지다!!!!~ "
1,ㅋㅋㅋ 개 망작이네요 ㅎㅎ 
10,진짜재밋게봤습니다ㅋㅋ 
10,재밌어요엄청매우와우 
10,굿진짜 재밌음ㅎㅎㅎㅎ 
10,정말 재밌게봤어요훈훈하고 감동적인 스토리 정말재밌었습니다이런영화 또 기대할게요~ 
5,진부함의 끝을 보여준 스포츠 영화 
5,조연들이 연기를 너무 못한다 
1,돈주고 보기는 아깝다. 평점 알바인가?? ㅡㅡ죽는다.. 
4,내용이깊이도없고왔다갔다....뭘의도하고만든건지전혀알수없는영화..감동도억지로짜낸것같고그렇다고개그치는데서는재밌는것도아니고...필요없는인물에그인물의필요없는사정까지 너무 정신없고재미도없는영화였음...돈아까웡.... 
3,서인국아빠 죽은건 통키아빠 피구하다 죽은것 만큼 충격적임. 스포츠영화가 너무 억지스러워서 감동요소에서 전혀 감동도 없음 
1,"어디서 본듯한장면, 눈베리는 연기, 오그라드는 대사, 관객 수 늘리려고 허구헌날 찌찌파티 "
4,영화라고 하기 보다는 그냥 드라마 수준 
1,"그래도 수영 영화인데, 이거 보고 수영에 대해서 알게 된게 전혀 없다 아....주구장창 유치한 설정 범벅... "
1,스토리 개판이네 ..졸립구 ..초반엔 양주까지 사먹던 학생이 후반엔 가난한 학생으로 둔갑하구 .. 폭력을 정당화 시키구 .. 아주 막장영화 ..잘망했음 
6,뭔가부족한느낌ㅎㅎ서인국연기잘햇 박철민아저씨도그리고오늘저녁은 삼겹살먹어야겟다 
9,나는 서인국은 영화에서 첨보는데 괜찮았다. 
10,재밌는데..왜 15세인지??ㅎㅎ 
5,아이돌 홍보영화 그 이하면 이하지 이상은 아님 
5,인소모음  보다 나왔는데 
7,주인공 둘이 멋진데 예상한대로 흘러가서 좀 아쉬움 그래도 볼만하드만ㅋ 
10,밝은 영화여서좋았어요!! 
5,별로... 암튼 감상평은 고기먹고싶다.... 서인국 고기 엄청 맛있게먹어 ㅠㅠ 
9,재밌게 봤어여.. 중간중간 편집이 좀 아쉬웠지만 서인국 박철민씨때문에 한참 웃었네요. 서인국씨 연기는 대박였네요... 
10,근육덩어리 서인국 스키니한 이종석 아아 좋다 이 영화 
10,재미돋네  사실 별로 기대는 안했는데 
10,김재영이랑 신민철 둘이 완전 웃겼음! 첨엔 이상한 애들인 줄 알았는데 둘다 허당~ 
10,진짜 재밌는거 같아요. 끝까지 재밌게 잘 봤습니닷 
6,"그저그런 뻔한 한국형 감동 스토리, 서인국이 연기잘해서 6점 "
10,말이 필요없음!! 이건 닥추! 겁나 재밌네 
10,당근 10점 이지~ 안그래?! 
10,정말 너무 재밌었어요~ 박철민 없었음 영화 어쩔뻔 했나요 감초연기최고봉이십니당 
10,줄거리도 모르고 그냥 봤는데 괜찮게 봤어요 
9,예상외로 재미있네 .. 원래는8점 /평점낮아+1 
10,잉구기...♥첫스크린 잘햇어요♥ 
1,설정이 무슨 80년대 수준이냐 온갖 오글거리는 장면 다나오고 마지막에 달려나가는 장면 개콘보고 만들었니ㅋㅋㅋ 
10,진짜  잼잇엇어요 서인국도 멋잇엇어요 
1,스토리가 너무 허접하다 억지감동.. 몇몇연기자들은 연기도어색.. 
1,유리때문에 망한듯.. 
4,유리노래부르는거 그런거안해도되유 
1,쓰레기같은 영화 시간과 돈이아깝다 10분보고 오글거려서 끔. 한마디로 총제적난국 
1,흥행한 스포츠 영화들의 요소를 다 넣고 싶었나보다. 아이돌의 영화출연 자체에 반대하는 것은 아니지만 이 영화에서 만큼은 수많은 실패요인의 하나인 듯. 어디서 들은 듯한 참신함 없는 대사. 클리셰의 연속. 올 해 본 ...
10,서인국 넘 귀요미 캐릭으로 나왔던듯 ㅋㅋ 보던 내내 웃음만 나온 영화 
1,스토리도 거지 연기도 거지 
1,노브레싱이 아니라 노잼 
2,건진건서인국연기력정도..? 
7,서인국을 다시 본 영화그리고 유리는 다음에 더 발전햇으면 
10,유리는진짜아닌듯 유리빼면짱ㅋㅋ 
1,킬링타임용도 안되는 오글영화 볼 건 삼겹살밖에 없네 
6,이건뭐죠? 수영 청춘 우정 사랑 학교 다건드리긴했는데 결과적으로는 아무것도 아닌 영화 
3,부실한 상 위에 박철민과 서인국과 이종석과 그 외 몇몇이 반찬과 밥과 국을 그럭저럭 먹을만하게 차려놨는데 유리가 숫가락으로 상을 뒤집는다.. 
10,나만 낚일 순 없지...샴푸가 바꼈네... 
4,유리 연기때문에 흐름 깨지고 몰입할수가 없었어요 
1,쌍팔년도 청춘영화도 이것보단 낫겠다. 어휴 돈 아까워 
1,1점도 주기 아까운 쓰레기영화다.. 이렇게 만들고 돈벌고 싶을까? 
1,"뻔한내용, 억지감동. 차라리 쌍팔년대 이덕화 주연의 '진짜진짜 좋아해' 두 번보는게 낫다. "
4,유리 연기 는 좀... 보기 힘들었음 ㅋ 
6,유리빼고 연기를 진짜 다잘해서 그나마 볼만했음 근데 각본이 너무 조잡하고 이것저것 다 뭉쳐놓은 느낌임 재미도 감동도 어정쩡함 러브라인은 무슨 인소도 아니고.. 
2,ㅠ 미안하지만 진짜 재미없었음ㅠ 
3,"공짜로 봤는데도 시간을 뺏긴것 같아 화가난다.. 3점은 열연해준 배우들의 몫.. 연기하면서 얼마나 오글거렸을까... 영화 본 뒤로 이종석과 서인국 사진을 못쳐다 보겠다 오글거려서... 스토리, 연출, 소품, 캐스팅까..."
10,생각보다 의외로 웃긴장면이많았음.. 성적인거나 더러운장면 없이도  잘웃겨서 꽤 만족함. 중간에약간 루즈하긴한데 그래도 재밌게 잘봤음 
1,"돈 아깝다. 억지로 본 영화 눈물,웃음,가족 어울러지지 않는 짬뽕 영화 -0- "
2,삼겹살...5글오글 
6,하...너무 뻔하고 뻔한영화...주제도 없고.. 딱히... 진자.. 뭐가 없음... 
1,진짜 많이 재미없었음 빼빼로데이에 여친이랑보러갔는데 우리커플포함해서 딱3커플이 영화관에있네요...여친이 보자고 했는데 보고나서 미안한다고 하네요 감동도없고 재미도없고. 
7,내가 배우들 팬 아니었으면 까고 또 깠을 영화. 배우 초이스가 살렸다. 
10,서인국♥  넘연기잘해요 훈훈한영화 
10,첨엔 좀 오글거리고 유치한 영화로만 생각했었는데 보다보니 푹 빠져서 울고있는 나를 발견 ㅡ.ㅡ..감동깊게 잘 봤습니다! 
10,재밌고 감동적이었음ㅠㅠ 이종석도 괜찮았고 서인국 연기 왜이렇게 잘해ㅋㅋ내내 즐겁게 봤어요! 유리 예쁘고 기대이상이었음 
10,서인국 친구로 나오는 모자란듯한 두 콤비 막판까지 웃긴다 
8,이종석한테 홀딱빠져 돌아옴 뭐이런 환상적인 비쥬얼 이ㅠㅠ 
9,재밌는거 개봉많이 하는데 이것도 괜찮아용 
9,서인국이 좋아졌습니다.최고 ^^ 
5,재미보단 배우들을 보게된 영화. 영화를 다 보고 난 후 줄거리를보면 순 뻥이라는 생각밖에 들지 않는다. 어느것 하나 집중이 되질 않았다. 
5,우정 그리고 사랑 스토리 좋아하지만...  이 영화는 둘다 너무 욕심 냈는듯 하네요. 거기다 흔들리는 여주인공의 큐피트의 화살이 러브스토리의 악영향이 아닐까 하네요. 90년대 초의 손가락 사라지는 대사도 좀 자제했었...
7,시사회로 보고왔었는데서인국이 정말 귀여웠어요ㅋㅋㅋ유치하고 오글거리는 장면도 많았지만 등장인물들도 귀엽고가볍게 즐기기 좋은 영화인듯 ㅎㅎ 
10,전체적인 레이아웃도 맘에 들구요 스토리도 재밌던데 
10,별 기대 안하고 이종석 때메 봤는데 재밌었어요! 유리의 연기가 쪼끔 어색하긴 했지만 노래도 잘 부르고..←스포인건가요ㅋㅋ 아무튼 웃긴것도 많았고ㅋㅋㅋㅋ슬픈것도ㅠㅠ 
10,이장르 영화 별로 안좋아하는데 이런영화치고 꽤 잘만든것 같네요 잘 봤어요 
10,세련된 맛보다는 풋풋한 맛에 보는 영화 
10,서인국의 순수한 모습 요즘에도 이런 남자 있을까? 
9,정정당당한게 멋지다는걸 이영화를 보면서 많이 느꼈습니다 
8,꺄~~~!!완전재밌었어요! 남자배우들도 다 멋있고!! 스토리도 괜찮고!! 웃기고 중간중간에 감동을주는 장면도 여럿있었어요!ㅎㅎ 
9,마무리가 좀 아쉬운 면도 있었지만 그래도 재밌었다는거 
9,영화배우 서인국을 발견하게 하는 영화..스포츠 관련 영화특유의 오글거림을 줄인 것만으로 ..성공한 영화..풋풋하고..귀여운..즐거웠던 영화..내  시간을 준게 아깝게  느껴지지 않은 것으로 충분한 영화ㅋ 
10,탄탄한 복근! 어째 남자배우들이 하나같이 복근이 뙇! 간만에 눈요기좀 했네요 
10,응칠부터 좋아했는데 점점 연기가 느더라니.. 첫 영화 도전이라면서 일케 잘하면 어카노~ 
10,너무너무너무 잼있었다 정말정말로 이종석 연기 너무 멋있었다 서인국도 연기 너무 잘했다♥ 노브레싱을 보는  내내 설레였다 
10,가장 기대되기도 했지만 가장 불안하기도 했는데 두 훈남 배우분들 다 연기를 안정적으로 해서 다행히 재밌게 잘 보고왔습니당 
10,와우~박철민이랑 서인국이랑 왤케 잘어울림?? 둘이 나오는 장면마다 겁나 웃겨요 
10,간만에 영화 재밌었네요 짱 재밌음! 영화도 간만에 봤는데~ 다행이 재밌어서 
10,진짜 영화 끝날때까지 눈을 뗄 수가 없게 하는거 같음  재밌네 
10,아직도 여운이 남아있네요~ 넘 재밌었어요~ 
10,"지인이랑 함께 보다 보니 두번 보게 되었는데, 두번 다 재밌었음. 유쾌하고 따뜻하고 감동이 있는 영화. 스토리는 부족한 면이 많이 있지만 오히려 그것을 유도하였나 할 정도로 내용 전개에 있어서는 어색하지 않네요. 누..."
10,영화를 보니 젊음은 젊음 그 자체만으로도 빛난다는걸 느꼈습니다. 그런데 그 젊음을 열정으로 불태울때 더욱 빛난다는 것도 알았습니다.. 노력하는 우상이가 넘 멋지면서도 아련하고 안타까웠는데 마지막엔 넘 대견했어요. 
10,"음..나는 이종석 보러 갔는데 서인국 넘 매력있더라구요, 캐릭터 매력일수도 있겠지만 연기 진짜 잘하는것 같아요 "
10,자!자! 우선 오백만 돌파 해보자구욧!! 
10,시간이 어떻게 갔는지도 모르게 영화에 푹 빠져서 봤어요^^ 
10,2시간이 어떻게 지나간 줄 모르고 봤어요~ 
10,원일은 귀엽고 우상은 걸어다니는 화보마냥 장면마다 멋지네요 
10,요즘 어두운 영화들도 많은데 오랜만에 이런 밝은 영화를 보게되서 좋았습니다. 
10,내 기준에선 가장 완벽했던 영화였다 
10,오오 재밌다~~ 볼까 안볼까 고민하다가 안볼려다가 본건데 안봤음 후회할뻔 
9,주연배우들 뿐만 아니라 조연배우분들도 한몸매 하네요?? 덕분에 눈이 호사스러웠네요~ 
10,서인국 캐릭 소화력이..! 능청스러운 연기 빙구스러운 연기~ 망가져도 귀여웠음 
6,그냥...요즘핫한 배우들 얼굴팔이같네요...그냥그냥 볼만했습니다 
10,"너무 재밌어요, 후반부로 갈수록 더재밌어 재밌어 지네요 "
10,완전 짱 재밌다. 기대를 하고 봤는데도 재밌었다 완전 
10,볼만하네 생각보다 꽤 볼만한거 같긴 하다 
10,참 재미나게 잘 만들었네여 
10,여자관객들을 위한 장면들이 무지 많네요~ 적어도 눈은 호강하겠더라구요 
10,우상이도 진짜 멋있고 원일이도 멋있고~누굴 응원할 수 가 없어서T.T 
10,오글거리는 장면이 좀 있었지만 잼잇엇음 ㅋ 
10,기대하기에 충분했던 영화였던거 같아요 예고편에서도 기대가 컸었는데 본편보고나니 보길 잘했다라는 생각이 들었거든요 
10,꽤 많은 사람들이 이영화를 보고 만족할 수 있을거 같네요 
10,^^  넘 즐겁게 울고 웃으면서 보고왔어요 요즘 온통 자극적인 영화들때문에 보고 나면 가라앉고 그랬었는데 정말 오랜만에 보는 청춘영화였던거 같습니다.이종석씨 서인국씨 연기 정말 많이 성장하신거 같네요^ 
10,음.. 보고만 있어도 절로 미소가 지어지는 장면들이 많아서 아주 흐뭇합니다~ 
10,훈남 두명이 나오는 영화라 전 보면서도 넘 행복했습니당~ 
10,원일이 매력쩐다! 서인국이 주연이래서 좀 걱정이었는데 이제 서인국의 원일이가 아닌 원일이는 상상할 수 없을 정도! 
10,어제 보고 왔는데요 생각했던거보다 훨씬 재밌었어요 친구가 추천해줬는데 역시 지인 평점은 믿을 만한거더군요 
10,눈도 훈훈 내용도 재밌어요!! 
10,완전 짱이네욤~ 캬~ 이런건 역시 극장에서 봐줘야해요 
10,진짜 최근에 본 영화들 중에서는 이게 최고 재밌었는데! 
10,"영화가 스토리도 탄탄하고, 생각보다 시시하지도 않구 좋습니다. "
10,진짜서인국대박대박ㅠㅠㅠ이건 서인국아니엇음안됫어요진짜강추 연기쨩 
9,전체적으로 봤을때 볼만한 영화 
9,난 꽤 재밌게 봤음  흥해라! 
9,"아주재밌더라구요,, 생각보다 괜찮아요 "
9,기준이 다르겠지만 내기준엔 흡족한 수준. 요정도면 뭐~ 
10,서인국의 서인국을 위한 영화 
10,연출도 좋았고 전반적으로 봤을때 괜찮은 수준! 
10,시나리오도 탄탄하고 흥미진진!.. 재미 없을 줄 알았는데 생각보다 재밌어서 급 호감으로 바뀐 영화예요 
10,쫭! 대박대박! 야무지게 재밌음! 
10,심장을 뛰게 만드는 머리를 울리는 드라마 같았던 경기! 노브레싱 기대보다 더 재밌었습니다. 
10,어떤 내용일지 짐작이 가긴 했지만 연출도 그렇고 영화 구성이 좋아서 그런지 시간가는 줄 몰랏다 정말! 
10,별기대는 안했었는데 기대하고 봐도 재밌을 것 같습니다 진짜 재밌게 잘 봤습니다^^ 
10,무겁지 않은 유쾌한 스토리와 배우들 연기도 좋았어요! 내내 재밌고 즐거운 기분으로 봤습니다~~ 
10,진짜여운남아서  좋은듯!! 이종석이랑 서인국 대박나라!! 
10,편안하게 웃으면서 볼 수 있었던 영화였습니당!!! 서인국 연기 너무 귀여워용 !! 웃고 감동도 있는 영화였어요~~~~!!!적극 추천~!>_< 
3,하하 .. 영화관이 좀 시끄럽겟다 ... ;; 
10,봤던 사람들 다 이 영화 좋았다고 리뷰남겼던데 나도 너무 푹 빠져서 보고 왔다 
10,그 싱그러움에 뭉클뭉클..풋풋했던 그시절로 돌아간느낌이였다. 설레였고... 따뜻했다. 
10,So Good~^^ 나쁘지 않아요~ 볼만해요 
10,박철민의 깨알같은 코믹연기 덕분에 영화가 더 활기있어 진거 같아요 타고난 코믹센쑤~ 
10,오글거리는 대사를 커버하는 배우들의 연기가 캐돋았던 영화 
10,또 보고싶은 영화~~^^  아윽~~ㅠㅠㅠ 조원일은 완전 매력덩어리~~ 너땜에 오늘 난 눈물바람~~ㅠㅠㅠ 서인국표발라드 마냥 웃다울다 했음~~ 
10,별 기대안하고 보게 된 영화~였는데 보고 난후 느낌은 그런대로  만족스러움.ㅋㅋ 유쾌함 속에 잔잔한 감동까지....ㅠㅠ 무엇보다 서인국의 연기는 기대이상~이었다. 원일아~~ 
10,와 영화너무재밌어요~내가 좋아하는 이종석이랑 서인국이 나와서 웃통 벗어주시니 더 좋았어용  또 보고싶어요~ 
9,여성관객들을 다분히 의식하고 배려한것같은 장면들이 ^^ 
10,여자라면~~꼭꼭! 봐야할 영홥니닷 
10,조합이 참 신선했다. 눈에 띄는건 서인국의 연기! 
10,시사회 다녀왔는데 오랜만에 많이 웃고 마음이 행복해졌습니다!노블레싱 대박입니다!!! 
10,신선한 소재를 잘 살린것같고 중간중간 웃음포인트때문에많이 웃음!! 
10,마음이 즐거워지는영화같다 너무좋았음~ 
10,나름 기대이상이였음 ㅋㅋ 
10,시사회 당첨되서 보고왔는데 넘재밌게 잘보고 왔어요^^ 지인들한테 입소문낼께요ㅋ 특히 원일이 넘  귀여워서 또 보고싶어ㅎㅎ 
10,친구랑  보고  웃으면서  나왔네요  보고나면  기분좋아지는영화 
10,영화 보는 내내 여성관객들의 침 넘어가는 소리가 들려온다^^ 
10,음 조금 손발이 없어지는 것 같은 장면이 있었지만 그것 마저도 훈훈함으로 덮을 수 있는 정도!!!  서인국 귀욤귀욤^^ 
10,진짜 수영선수 못지않아 보이는게 배우들 진짜 고생했겠더라 
10,완전재밌었어요.이종석씨도서인국씨도 연기너무잘하시네요!스토리를다담아내기118분이 좀모자라단생각이들정도였어요.두분다첫주연인데도불구하시고 아주 훌륭해요게다가 수영경기씬에선 진짜시합보든이 긴장되서 죽는줄알았요.오랜만에 젊고...
10,노브레싱 개봉두둥~서인국 연기넘잘해bbbb대박나자구요!!! 
10,완전 재밌는 영화네요~~~ 
10,마린보이는 박태환이다 
1,하..오글의 대명사. 미치도록 오글거림 
1,이런 영화는 1점 줘야 제맛^^ 
1,스포츠 영화 특유에 극적인 감동이 없음단편 드라마 수준임 ㅋ  여배우가 발연기로 영화흐름 방해 ㅋㅋ유리야 연기하지마라 부탁이다 
1,장난치나 여기 진짜 순알바생평점이구만 ....왠만한스포츠영화는 감동이 있기마련인데...내용부실하고 배우연기력 허접하고 기본드라마도 못되는수준이구만.. 
1,"중심을 잡아주는 배우가 없다. 연기못하는 배우들이 이렇게 많은줄 처음알았음. 여주걸고 수영내기할때 헛웃음나옴.. 마지막장면에서도 헛웃음나옴.. 왜 있는지 모르겠는 캐릭터에, 일회성으로 쓰려고 억지로 맞춘 캐릭터에....."
10,"유리 연기 는 오이려 조금 집중에 방해가 되지 않았나 싶다. 서인국 진짜 삽겹살 맛나게 먹던데 내배가 다 고프더라, 개인적으로 비오는 날 추울텐데도 연습에 몰입하는게 되게 멋있어 보였고 마치 바다에 수영하는 것 같아..."
10,보는내내 황홀하고 재밌고 또 감동을 주는 좋은영화 ♡ 
8,한줄요약 서인국생각외로연기잘하네 유리연기최악수준 이종석...은평타정도 영화자체는지루하진않음 볼만은함 
1,8점대는 아니다... 
10,서인국이 이렇게 귀여운줄 몰랐다 ^^ 이종석은 너목들의 수하 이미지랑 너무 비슷했지만 진짜 안구정화 제대로 해 주는 영화 ㅎㅎ 
10,재미있어요 정말재미있음 
2,삼겹살 겁나 맛있게 먹어서 2점... 아왜 서인국이종석ㅠㅠㅠㅠ이딴거 찍지말라고ㅠㅠㅠㅠ연기고 몸이고 보이지않음 그냥 재미없고 오글터터터터짐 
1,한마디로  오글오글 연기 
8,그냥 뻔한 스토리.. 그래도 눈호강 하고왔음 
10,내용은약간 뻔하긴 했지만 재밌게봤어요!!ㅋㅋㅋㅋ 
3,중간에나갈정도는아니였음 
9,배우들연기는좋아요스토리가더잘짜였으면좋았을텐데... 
10,한번쯤 볼만한 영화인거 같네요^-^ 
10,"재밌게 봤는데, 연출도 나쁘지 않았고 괜찮네용 "
10,재미남! 완전 잼슴^_^ 딱 보기 좋아요 
10,친구한테 이거 보자고 끌고 갔는데 그래도 재밌게 봐서 다행이었음 
10,잘 봤어요~ 영화 정말 굿이네요^.^ 
10,솔직히기대안하고봤는데 정말볼만합니다. 연출도 이만하면 꽤하는듯하구요 
10,너목들에선 보지 못했던 이종석의 또다른 매력을 알수있는 영화 
10,눈이 호강하는건 이런겁니다- 영화 비주얼이 장난 아니더라구요 
7,영화보다 배우가 아깝다 아쉬운 영화 그냥 볼만한 영화 그런영화 
10,완전 짱!보통 영화는 한번보는데 이 영화는 왜 또 보고싶지..이러다 두번 볼것같아 
10,"개인적으로 재밌게 본 영화였습니다, 극장에서 볼만합니다. "
10,"누구랑 봐도 어색하지 않을 영화네요, 엄마랑 간만에 데이트해도 되게써요 "
9,  노브레싱을 봤는데 정말 재미있음 한번 보러가세요 강추 !꼭 봐야함 ㅎㅎ 안보면 후회함서인국 먹는거 초대박 ㅋㅋ 
10,직접 봐야만 느낄 수 있는 그런 느낌이 있는 영화입니다. 
10,추천해주고 싶은 영화에요~영화 보고싶은게 없다면 이 영화 추천! 
10,눈정화는 이렇게 하는 거죵~ 웃기는 부분도 많고 전체적으로 따뜻한 영화네요 
10,재밌어요 간만에 영화 재밌었어요 
