score,review
10,김래원은 믿고 본다 했어도.. 이민호 진짜 대박... 
9,와진짜김래원지림ㅋㅋ표정연기개잘함그리고이민호눈빛이레이저갘ㅋㅋ 
10,오랜만에 엔딩크래딧이 올라가면서 여운이 남는 영화입니다. 영화 메세지도 배우들 연기도 좋네요 
10,진솔하고 멋지다. 시사회로 봤는데 보고 나니 담배 땡기고 술 땡긴다. 아직도 잔상이 남아 있다. 이 맛에 보는 거지. 영화란 ㅎㅎㅎ 이민호 의외기는 하다. 잘 한다. 김래원은 연기 잘 한다는 생각은 했으나 이 정돌 ...
9,시사회에서 봤었는데 난 재밌게 봤음 최소 돈값은 한다고 생각했음 19금인데 약간 각오하고 보셔야할듯 약한 19금이 아니라 좀 강한 19금이라 신세계보셨으면 그정도 수위는 최소 생각하고 보셔야할듯 
9,무거울줄 알았는데 의외로 술술봄 그러나 전하는 메세지는 가볍지 않음  멋지게 보이려 연출하지 않은 날액션인데 김래원 이민호가 간지가 쩔어서 액션이 아주 볼만함 
10,폭력보다 더 잔인한 시대에서 살아남기 위한 두 청춘의 안간힘이 씁쓸하면서도 애처럽게 느껴졌다. 마지막 진흙탕 액션씬은 꼭 스크린으로봐야 진가를 알 수 있음. 
10,가슴이 먹먹해지는 종대의 눈빛 ... 그저 소박한 꿈  따듯한 집에서 가족과 사람답게 살고자했던 가난한 청년이 왜 이리 될수밖에 없었는지 . 시대만 다르고 폭력만 없을뿐 지금 현실을 보는것 같아 보는 내내 씁쓸하고 ...
10,이민호 김래원 너무너무멋지고유하감독의 거리 3부작의 완결판이라 할 수있는 최고의 영화이다!기자 평론가 들은 너무 깐깐하다. 
10,"내 기준으로, 최소한 지루하지 않았단 것만으로도 높은점수 주고싶다. 강렬한 여운이 오랫동안 잔상에 남아있을 영화. "
10,영화가 묵직하네요 여운이 남습니다 배우들 연기도 인상깊어요 이민호 첫 주연영화라던데.. 잘 선택한 듯 
9,남자들은 꼭 봐라 실터치 액션이더라대형화면으로 볼만하다 이런영화 언제또보냐 여자들은 안구 호강할꺼임 잔인한장면도 있으나 그떄 눈감고 이유없는 잔인함이 아니라서 별줬다  작품 돈 안아깝더라 
10,영화가 끝나고 마음이 멍해졌습니다. 먹먹한 여운이 남더군요. 조금만 더 잘 살아보겠다고 발버둥치다 스스로 파멸의 길로 내딛고 결국 파국을 맞는 두 주인공을 보며 단지 그것이 그 시대만의 비극은 아닌 것 같다는 느낌을...
10,긴 여운을 남기는 영화입니다. 이민호와 김래원 연기도 너무 좋았어요. 특히 마지막 이민호의 눈빛이 떠나질않네요.ㅠ 
10,ㅎㄷㄷ비주얼ㄱ하 탄탄한 스토리 압권 
10,"대~박! 사실 이민호 좀 걱정했었는데, 아 우려 싹 날아갔음. 누가 봐도 후회 없을 영화임!!! "
10,솔직히 상상이상 기대이상이었음 이민호 스크린 신고식이 제법 성공적인듯 
10,생각보다 덜 잔인... 쫌 처연 하달까?  배우들 연기 볼만했고다들 늘씬 길쭉 ㅋㅋ  엔딩이 맘에 드네요... 
10,배우들연기좋고액션시원시원합니다 전체적으로묵직하지만중간에빵터지는부분도 있어 재밌게봤음 
10,김래원 연기야 해바라기때 입증됏고 이민호 눈빛연기 액션 쥑입니다. 간만에 볼만한 액션 누와르. 
10,역시 유하감독거라서인지 액션에 특화됐네요 배우들 연기도 좋고 진흙탕 액션은 죽이네요 
10,이민호 쩐다.ㄱㄱㄱㄱ 
10,김래원을 기대하고 갔지만 이민호를 얻을수 있는 영화 대사 하나하나 의미를 결코 무시할수 없다 
10,이 영화를 보고 한국식건달 영화 쯤으로 치부해 버린다면 아주 많은걸 놓치고 본듯하다. 배우들의 강력한 눈빛이 뇌리에서 떠나질 않는다. 간절한 사람의 욕망은 결코 아름다울 수 없다. 하지만 이 둘의 간절함에 매료되어 ...
10,완성도 높고 배우들 연기도 좋았다. 끝나고 여운도 남은ㅠ  돈 아깝지 않게 잘 봤고 영화보기 전에 인물 관계도 보고 가면 더 좋을 듯!! 
10,유하 감독의 이름값하는 강남1970 액션도 하다다~ 하고 1970년대의 청춘을 만날수 있다. 남자라면 꼭 봐야하는 영화! 
10,분명 한배우의 팬이어서 보러간 영화였지만 스토리와 연출이 풀어낸 이야기가 두시간넘는 러닝타임을 단1분도  버릴수가 없었습니다 묵직하게 감정을 추스리기에 오늘 하루는 다른 일을 할수가 없을듯합니다 
10,오늘 조조로 봤는데 정말 여운이 길게남는영화 ㅜ ㅜ김래원 이민호 눈빛이 모든걸 다 말해준다 
10,액션매니아 꼭 보세요시간이 언제 지나갔는지 모를만큼 재미났어요오랜만에 나온 상남자영화 
10,굿입니다요오오오옹오오 
10,민호랑래원이 고생했네 강력추천입니다 
10,"기대안했던 이민호~ 연기 좋고, 액션 베리굿이네요. 거기에 믿고보는 김래원~ 오랜만에 찐한 영화 한편 나왔네요. 강추!!!! "
10,배우들 연기굿 볼만했음 
9,리얼액션과 돈을부르는 권력. 딱 90년대 모습그대로 나타냈네요. 꼭 보세요^^ 
8,캐릭터 설명이나 감정선에 좀 약한 감은 있으나 대신 담는 내용이 많음. 그게 장점이자 단점이기도 함. 그럼에도 불구하고 배우들 연기는 최고. 
9,한국판 액션 느와르~~ 배우들 연기  눈빛  너무  좋구요     마지막   장면에서   가슴 먹먹함이    느껴지네요. 
9,한번보면 이민호 기록지만 생각나는 영화 두번보면 아~~~하는 영화 넘 잼나요!! 
10,기대보다 좋다.. 영화 묵직하고 여운이 남는.. 70년대만의 이야기가 아닌.. 이민호 김래원 배우들 연기 액션 멋지고 기대이상.. 진흙탕씬.. 추천.. 
10,두 배우의 연기력은 말할것도 없네요 
10,이민호 시원시원한 액션과 깊은 눈빛 연기 최고~ 드라마와는 또다른 매력이 있네요.  조연들 연기도 극의 재미를 더해주고 
10,근래에 보기드문 액션영화 이민호의 색다른 모습과 기대를 저버리지 않는 김래원의 연기 주제 의식있는 역시 유하감독 
10,"강남은 어떻게 생겨났는가. 단지 ""영화적""이란 말로만 평가하는 것이 맞나? 불편한 만큼 진실하다. 리얼 아닌 진실이었다. "
10,강남1970. 대박날듯.... 배우 이민호의 완벽한 종대변신...시원한 액션과 눈빛 연기. 최고~~~ 오늘 또 보러갑니다. ~~~^^* 
10,용기와 종대! 그들의 연기만으로 볼가치가 있는 영화!! 
10,많이 기다렸던 영화 강남 1970!!  세심한 감독의 연출과 배우들의 열연으로 시간이  LTE 급으로 지나가요.  마지막 엔딩 굿!!! 
10,기대를 져버리지 않네요  이 민호씨  아니 종대의 눈빛이 잊혀지지 않고 영화가 끝난 지금도 먹먹합니다  간만에 가슴 찡한 감동도 느껴보고 ..  영화 너무 좋으네요 적극 추천합니다~~ 
9,액션 느와르 첨 보는 1인. 하지만  영화보는 내내  몰입되서  거부감없이  지나갔음  이민호의  눈빛은 역시 갑!  있는그대로의  종대였다 
9,영화속에 나오는 기차 처럼 쉼표 없이 달려가는 영화. 강렬했어요 
10,멋진 영화 추천합니다 꼭 보세요 
10,근래 보기 드물게 밀고 나가는 서사의 힘. 
10,"영화를 보고난후 이민호의 눈빛이 잊혀지지 않네요~ 다소 폭력적이긴 하지만 내용이 있는 영화이고, 연기자들의 연기력에 정말 재밋게 봤습니다. 보고난뒤 가슴 한쪽이 아련하며, 울컥한 기분이 드네요.다시 한번 또보고싶네요..."
10,자극적이지만 배우들 연기도 좋고 재밌게 봤어요 . 
10,해바라기의 김래원이 나온다 .. 말이 더 필요한가 ? 
10,이민호  연기변신 리얼액션 멋지고 김래원 내면 감정연기 완벽호흡!! 
9,생각보다 쎄서 머리 잡고 봤지만 유하감독님의 거리완결일만한 임펙트네요 알지못한 이민호의 다른 모습 상남자 제대로 봤습니다 
10,오랜만에 남자 냄새나는 영화~~~액션 짱!!!! 
10,액션의별미. 꼭 봐야 하는 영화메세지가 있네요 
10,오랜만에 멋지고 가슴아픈 영화를 봄 
10,액션느와르에서 느끼지 못했던 찐한 감동이 있습니다 두배우 연기도 좋았고 잘 어울렸고요 엔딩에서 소리없이 흐르는 눈물을 닦으며 자리를 뜨지 못했습니다. 
10,영화를 다 보고 나오는데도 여운이 남아 다시 들어가 보고싶단 생각이 들 정도로 저는 재미있게 관람 하였습니다 
10,강남1970볼만한영화이다.^^ 
10,영화가 아이러니하게도 감성적으로 느껴집니다. 민호의 감성연기... 쎈 남자영화에서 드러나는 민호의 눈빛은 너무나 안타깝고 가슴 아프네요.  설현도 연기 잘하고 김래원의 연기도 좋네요. 
10,가슴시리고 먹먹하게 봤던...땅종대 돈용기화이팅멋있더라 
10,가슴이 먹먹..이런 장르에서  이런 느낌을 받을수가 있는지? 배우의 연기와 액션이 좋았다 특히 이민호의 그 눈빛..영화보고 나오면서 계속 그 눈빛때문에  비도 오는데 마음이 우울했다 세상은 힘있는자의 것인가? 결국 ...
10,영화의 클라이막스인 전투씬은 진짜 두고두고 볼 명장면인것 같아요. 역시 거리 3부작의 완결편..! 이민호 김래원 두 주연배우들의 활약도 대단하네요.. 이 영화 잘될거라 확신합니다! 
10,이민호의  눈빛이 아직도 생각난다. 
9,리얼한액션신이 긴장감을 더해요남자분들은 더 좋아하실것같아요^^간만에 신선한 흥미진지한 액션 영화가족애가 묻어나는 재밌었어요^^ 
10,이민호 연기 진짜 대박. 액션도 감정도 모두 다 훌륭 
10,두시간이 넘는 시간동안  지루할틈이 없이  몰입했네  아직까지  이민호씨의  눈빛이 잊어지지 않고  뇌리에 남네   두배우의 연기와  어우려짐이  참 좋다   잔인한거 못 보는 사람인데도  생각보다 잔인하진 않더라 ...
10,최고의 액션! 사랑합니다 
7,"재미있게 봤습니다. 저랑 여자친구는 김래원 팬인데, 김래원이 너무 조연처럼 나온부분이 아쉬웠고, 강남에대한 지식이 없어도 이해할수 있는점으로 미루어보아 이민호 팬 한류 수출이 가능할 것 같습니다. "
10,추억할수 있는 음악이 좋았고 폭력이 난무하는 영화라 하기에는 메세지가 분명한 영화.진흙탕 장면은 최고의 볼거리.이민호의 눈빛은 영화의 백미. 
10,역시 이민호 가슴이 두근거렸어요 
10,두 배우에 대박 연기! 난 정말 최고였다 생각한다!! 
10,"1970년대,,정치세력들의 자신의 욕망을 위해 사람은어떻게썼지 잘보았습니다.. 두 주연배우의 캐스팅은 탁월했고, 조연분들의 탄탄한연기력덕분에 거슬릴것이없던 영화였고, 현재의 강남의 발전이 어떻게 이루어졌는지간접적으로..."
9,배우들의 연기가 좋았던.. 뻔한 조폭 영화가 아니어서 더 만족스러웠음.. 비오는 씬에 흘러나오는 음악과 마지막 장면이 계속 생각남 
10,역시 믿고보는 이민호 김래원~강추강추^^ 
8,개봉첫날봤는데 액션이죽이네요 
9,오랜만에 영화 같은 영화 본 거 같아요. ㅎㅎ스크린으로 봐야 되는 이유가 여럿 있네요. 좋았습니다. 이민호 김래원 말고도 연기들이 다들 찰져요. 액션도 멋지고... 
10,간만에  돈값하는 영화  이민호는 아시아의 디카프리오? 
10,가슴이 아련해지는... 영화네요...액션씬 너무 멋있구요. 영화 잘 봤네요... 
10,와 진심 정말잼씀 ~  연기대박.마지막이내원하는대로되진않았지만 최고! 
10,이게 영화지 간지다 잘만들엇네 
10,70년대 시대상을 보여주는 영화... 여운이 남는 영화. 김래원 이민호의 연기가 돋보이는 영화~~ 
10,유하 감독의 거리3부작 결정판 인 듯 시사회에서 보고 왔는데 역시 ! 진짜 진한 남자들의 이야기 배우들도 연기 너무 잘해서 놀아웠음요 
10,운 몸에서 열이 날 정도로 몰두해서 봄. ㅌㄴ속 종대의 눈빛 잊을 수가 없다.  희망없는 젊음이  갈곳은 어딘지... 
10,"액션,스토리 다 죽인다^^ "
10,가슴이 뜨거워지게 만든 영화였습니다! 영화 전체가 무거운 시대극의 서사적 외피를 입고 있는 액션누아르라면 이 영화의 서정성은 배우 이민호의 눈빛이 담당했습니다.극 전체를 힘있게 끌고간 이민호와 그를 잘 뒷받침해준 김...
10,비루한청춘들의비극이여 
9,강남1970 보고 왔어요  감독의 표현대로 권력에의해소비되는는폭력이 낭자한  땅으로시작해 인간으로 끝나는  슬픈 액션영화 였어요  배우들언기며 액션씬이며  너무 멋졌고  특히  김종대역의이민호씨의눈빛이  사람맘  먹...
9,여자친구랑보세여..허허허 큰일납니다 
10,강남1970 유하 강독님 매유 시적인 거리 3부작 입니다. 
10,기대됨 믿고보는 해바라기 김래원 
10,평론가들은 영화나 한 번 만들어보고 말을 하든지 말든지 하길.. 
10,역시 유하감독님! 여운 짱! 연기 대박임! 
10,기대된다!!오늘보러갑니다 
10,"이민호 연기 변신 짱!!! 그동안의 달달한 로맨티스트 아닌, 오로지 강인하면서도 애절한 김종대의 모습만 보이네요. 아련하지만 기대고 싶은 남자. 안타까운 시대에 태어나 제대로 피어보지도 못하고  사라진 청춘. 두번보..."
10,"간만에 정말 속이 뻥 뚫리는 액션, 최고! "
10,굿재미있었다굿베리짱구국 
10,비주얼 스토리 영상 뭐 하나 빠지는게 없어요 
10,전문가 평점이 나쁘면 꼭 천만 가드만~ㅋㅋ 
9,스토리가 아쉽긴하지만 배우들 연기 하나는 굿이네여 잔인하지만 볼만해요 액션좋아하면 ㄱㄱㄱ 
8,여운이랄까~먹먹하네요.  진한 감동은 별로지만 많은 생각을 하게 만드는 조금은 어려운영화인듯! 이민호의 눈빛연긴 최고네요. 
10,두 배우 연기 응원 합니다.! 
10,역시 유하감독님 작품입니다. 다소 잔인한 느낌이 있긴하지만 그래도 기대를 져버리지않네요 
10,짱짱맨짱짱맨짱짱맨짱짱맨짱짱맨짱짱맨짱짱맨짱짱맨짱짱맨짱짱맨짱짱맨짱짱맨 
10,감독님 연출 짱이네요. 
10,오랜만에 가슴이 먹먹함을 느껴보는것 같다.요즘 너무 가볍고 쉽게 생각없이 보는것이 익숙해졌기에 표현하기가 어렵다.다시 보며 곱씹어보고 싶은 영화!! 
10,겁나 웃긴데 겁나 멋진영화 
10,그냥개쩜완전재밌음또보고파염 
10,시간가는 줄 모르고 봤네요 완전 강추강추! 
10,기다리는 영화 잘 보고 왔어요^^ 주인공의  눈빛이 너무 좋았어요~~내일 또 갑니다 
10,역시 김래원!!  그리고 개인적으론 이민호의 재발견?!! 유하감독 역시 실망시키지 않았다. 추천 꾸욱~ 
10,엔딩크래딧이 올라가는데 자리를 뜰수가 없어 연속 2회 상영하고 왔습니다. 가슴이 먹먹하고 아려옵니다. 고아출신으로 호적도 없이 넉마주의로 살아오던 두주인공의 삶이 이권다툼에 휘말리고 결국 이용만 당하고 끝나버린 인생...
9,배우들의 강렬한 눈빛이 잊혀지지 않네요 
10,이민호와 김래원 둘의 캐미효과로  아우라가 넘쳐서 영화내내 빠져들어 지루한줄 모르고 봤어요 
10,이민호김래원 간지좔좔~ 강렬한 맛이 좋음 
8,연기는 잘하고 좀 잔인합니다. 
10,"진흙탕 액션씬과 김래원, 이민호 연기 최고 "
10,시사회로 보고왔는데 아저씨 신세계보다 덜 잔인하구요 여운이남네요 쎄고 강한 영화입니다 액션 좋아하시는분들 보세요 
10,이민호 김래원 둘의 관계에 좀더 집중했으면 하는 아쉬움이..그래도 좋았어요 
9,단순히 조폭영화가 아닌 70년대의 사회상들이 고스란히 묻어있는 영화네요. 두배우의 열연이 돋보이고 액션이 시원시원. 보고나니 그 시대의 아픔을 느껴 아려옵니다. 보시면 후회 안하실듯. 
10,좀 야하고 잔인하지만 몰입되네..오스트랑 영화가 잘 어울림.이민호 개멋짐 
9,모처럼 영화다운 영화를 봤다 액션르와르  주연배우들의 연기변신과 단단한 조연배우들의 어우러짐 상쾌.통쾌한눈에 볼수 있었던 것같다  기대된당^^ ^^ 
10,참 잘 만들었네요. 어떤 분들은 일부러 이 영화 까려고 폭력적이다 잔인하다 말씀을 하시는데 다른 나라 외국보다 덜 폭력적이고 덜 잔인합니다.  청소년 관람불가입니다. 진짜 오랫만에괜찮은 내용의 한국 영화를 봤네요. ...
9,영화가 주는 메세지가 진한 여운을 남깁니다. 두배우의 연기도 좋았고 그시대의 이야기도 알수있어서 좋았습니다.강남1970 추천합니다 
10,이민호 김래원 연기변신!! 
10,남자냄새가 제대로 나는 영화ㅋㅋ스토리뿐 아니라 액션신들도 볼만하다 
10,유하감독 격하게 아낍니다 매니아가 될 수 밖에 없음 
10,이민호 첫 영화라길래 걱정반 기대반이였는데 기대이상으로 멋진 연기를 보여줬음ㅎㅎ 
8,재밋네요 먼가아쉬움이남긴하지만.... 
10,정말재미있습니다ㅎㅎㅎㅎ 
10,강남의 정말을 알고싶다면 말죽거리와 비열한거리를 잇네요 
9,영화보는내내이민호눈빛에빠졌네요..끝나고나와서도헤어나질못하는중..액션도멋찌고..슬프고아련하네요..느와르극장에서처음보는데또보러갈려구요.큰화면으로보니속이다시원하네요..계속승승장구하시길~ 
10,배우들의 눈빛연기가 좋았습니다 그시대를 처절하게 살다간 종대와 용기를 떠올리며 자꾸 먹먹해지는 영화 
10,솔직히 아무생각없이 봤는데 재밌었다.그리고 영화끝나면 항상 남는 찝찝함이 없어서 좋았다. 
10,조조로보고왔는데 다시저녁때보구싶네요~~시간가는줄모르구 잼있게봤습니다지금강남이 허허벌판인것도 느낌이 새롭더라구요.. 
9,기대하고봤는데   기대한만큼   재미있었어요 
10,"잔인한 폭력물로 치부하기엔 두 배우의 연기가 훌륭했다, 한 순간도 배우들의 감정선이 무너지지 않고 실재의 인물로 살았다. 이 영화는 나의 눈물샘을 자극하가 보다 상황을 중심으로 종대와 용기가 만들어 가는 한편의 묵직..."
10,"아.. 가슴이 먹먹하다는 말의 뜻을 알것같은 영화입니다. 그 시대가가질 수 밖에 없었던 고통과 아픔, 유하감독님께서 하고자 하셨던 그 '이야기'라는 소용돌이에 빠졌던 두시간이 참 의미깊었습니다. 종대와..."
10,오늘영화봤는데 우와~잼나네끝나고 여운이 길게가드라ㅜ 종대눈빛ㅜㅜ 
9,묵직한 서사시여운이 남아요~♡배우들 연기 대박입니당 
10,진한 숫컷의 냄새가 물씬! 스토리 장난아님 
10,또 보고싶은 영화는 근래에들어 강남1970이 처음. 배우들의 연기 좋고 음악도 좋고 민호도 좋고^^ 
10,처음엔  가슴이  먹먹.  다음회에선  종대의  눈빛과  아픔  때문에  마음이  아프네요. 
10,최고의영화♡ 보는내내 탄탄한 스토리와 배우들의 연기력에 시간가는줄모르게 봤다ㅜ 이민호의 매력은ㅎ  마지막 터널엔딩도 깊은 생각에 빠지게한 영화.. 오랜만에 좋은영화! 
10,"두시간이 시간가는줄 모르고 이민호, 김래원의 매력에 빠져드는 액션느와르. 강남의 탄생과 젊은이들의 야망 등 전혀 지루하지 않게 몰입되는 영화 "
10,이건 정말 최고의 영화다.... 보는 내내 손발어깨를 제대로 피고 볼 수 없었음.. 돼박! 
9,영화에서 빠질 수 없는 게 OST음악들이 당시 느낌을 더 잘 표현 한 것 같아요!! 집에 가면서도 계속 머릿속에 맴도는게 완전짱!그리고 런닝타임이 2시간이라는게 너무 아쉬웠어요.. 오히려 시간이 더 길었다면 어땠을까...
6,굿이다 잼있다   박진ㄱ감 있다 
10,액션도 시원하고 다들 연기도 좋고 잼있었어요 
10,오랜만에 탄탄한 영화 한편이였어요 보고나서 진한 여운도 남고 많은걸 느끼게 해주는 영화였습니다 
10,사람을도구로만보고이용하는것이그때나지금이나변함없음이슬프고 그걸잘표현해준두주인공들이민호.김래원의연기감동이었음 
10,명대사와 여운이 남는 영화 
9,이민호의 연기가 아직도 먹먹하다 
10,그냥 조폭영화가 아니고 내용이 있는영화임 수위는 좀 쎄지만 액션씬이 볼만했고 돈 안아까웠다 
10,진짜 너무 재밌어요 ~~~!!!액션씬 Good영화 꼭 흥하고 대박나세요 ^^ 
10,"폭력의 시대, 폭력의 도시. 2015년 대한민국을 보는 듯한 1970년의 강남.폭력을 미화하지 않고 날 것 그대로의 감성을 보여준다. "
10,이민호의 아련한 눈빛연기 액션  여운이 
10,재밌었어요~ 역시 믿고보는 배우와 감독♡ 
10,이민호의 연기가 기대이상었어요액션도 유하감독님 멋있게 그린신듯.잘 보았습니다. 
10,첨부터 긴장을 놓칠수 없었습니다  탄탄한 연기력의 배우들과 웃긴 조연들 ~감동도 있으면서 웃기도 하더라구요^^이민호배우는 화보 같았어요 ~아직까지 여운이 남네요~ 글고 남자들에게 추천 하고픈  영화인듯합니다^^ 
10,"시사회를 봤습니다, 강한 액션영화라 별기대 안했는데 와~~~1970년대에 빠져 있다 나온 느낌이였습니다. 두남자배우에 절절함 과 눈빛 그리고 멋있는 액션씬 잊혀지지가 않네요 다시한번 보러 가겠습니다. "
9,오랜만에 액션영화 제대로 본 기분이네요... 그럼에도  불구하고 먹먹함과 처절함이 남는 영화입니다... 부조리한 현실은 1970년이나 지금이나 다름없다는걸 느끼며... 
10,재밌네요 기대이상입니다 
10,마지막엔딩의 여운이 가시질않아요 핏빛액션이이렇게 슬프게 다가온것도  첨이에요 재밌었습니다 
10,예쁘게 포장만 된 영화만 보다  거르지 않은 다큐를 본 듯한 느낌?!  전개도 빠르고 순간순간  돌발되는 장면들이 나름 재미를 더했다. 폭력을 빙자해 요즘의 사회를 꼬집는 듯한 영화랄까  남자들은 꼭 봐야할 영화.....
10,엔딩크래딧이 올라가면서 여운이 남는 영화입니다. 추천! 
9, 조폭영화라 생각하고 봤다 시간이 지날수록 그시대에는ㅈ정말 그랬는데 지나간 시간이 그때 힘들고 억울했던 아무것도 할수없었던 그런게 생각났다 지금도 그렇지만 그래서 폭력이 시원하지만은않고 그저 가슴이 아리다 
10,1970년대라서.그럴수밖에 없었던 불운한 이들의 삶을 시대에 맞게 잘 녹여낸 영화. 이민호 눈빛연기 갑!! 가족과의 편안한 삶의 열망이 여러 상황의 소용돌이 속에 행복과는 점점 멀어지는 늪이되고 그가 변해가는 과정을...
10,기대이상으로존잼이었음 배우들연기도좋고ㅋㅋㅋㅋ 
7,재밋엇어요ㅎㅎ 액션신이 인상깊군요 
10,"진짜 대박,.이건 안보면 후회할듯 꼭 보시길 "
9,시간가는 줄 모르고 봤다. 재미있다. 영화비 아깝지 않다. 
9,많은생각을하게하는영화네요 ~ 두배우분의연기참좋았구요  이민호씨의마지막연기여운이오래가네요~ 영화대박나시길바랍니다  남자분들이좋아할거같네요~ 
10,거리 3부작의 끝판왕이라는 수식이 아깝지 않습니다허벅지 킬러 이민호 다시 돌아온 김래원 따뜻한 아버지 정진영 모두 파이팅!! 
8,볼만합니다 두사람넘연기좋네요 
10,김래원은 감성연기가 쩔었고 이민호는 액션연기ㄷㄷ.. 
10,"이민호의 첫 스크린주연작, 정말 몰입도 최고였고 배우들의연기또한 명품이라고 생각함!! "
9,거리 3부작 중 젤 낫다 싶네요. 비열한 거리랑 비교하니 강남 1970의 흐름이 약간 헐거운 것도 괜찮게 보입니다. 배우들 연기 좋던데요. 왜 혹평받는지 모르겠음. 이민호씨 얼굴이 아직 너무 고운 건 뭐 어쩔 수 없...
7,스토리가..생각보다ㅠ배우빨로 ㅇ봤음 
10,배우들의 연기가 일품인 모처럼만의 괜찮은 영화. 
10,이민호 눈빛 여운쩌네. 
10,보고나서 여운도 남고 보는내내 푹 빠져들었어요 유하감독님의 거리 3부작들 중에서 가장 주제 의식이 뚜렷하게 들어나 있는거 같아요 
10,짧지 않은 시간이 어찌 지나갔는지 모르게  집중해서 볼 수 있었네요.  엔딩 크레딧이 올라가고도  쉽게 일어날 수 없게 만드는 영화네요. 종대와 용기의  불안하고 슬프면서도 처절한 눈빛이 계속 생각나요. 
9,굿!굿!굿!굿!굿! 
10,영화를 통해 살아본 1970년대.가진것 없어 내것하나 가질려고 그렇게 노력했는데...엔딩씬의 이민호의 표정연기와 눈빛이 잊혀지지 않는다.이민호 역시 기대를 져버리지 않는구나.꼭 다시 한번더 보고싶어 지는 영화다. 
