score,review
10,그쪽 정권이 북한에 더 많이 퍼줬다는 소문이 사실무근은 아닌듯? 
5,절반을 주는것은 절반만 말했기 때문이다. 진정 중립적 시각을 보여주겠다면 김대중 정권후에 목숨 내놓고 남한을 위해 수십 년 간 헌신했던 대북공작원들 리스트를 김대중이 직접 북한에 넘겨줌으로서 공작원들이 싸그리 죽었다...
6,중립을 지향했으나 캡틴김대중으로 마무리 
10,오우 연기력  대박  무겁지만  나름 지루하지 않음 
5,뭔 평점창이 무슨 인터넷기사 댓글창이야? 영화 평점에 대해 써놓으라 만들어두니 자기들 정치성향 얘기하고 자빠졌어 누가 여기다 보수놈들 풀었냐 
10,우리가 모르는 같은 공간 다른 세계 
5,그럭저럭 볼만했네요 .. 
10,영화평점을 매겨야지 왜 정치가지고 ㅈㄹ하지 인터넷실명제하자 
7,"정말 어떤 분의 조언대로, 이 영화는 최소한 두 번은 봐야 제대로 진가가 드러나는 영화인 듯!  이 영화는 꼭들 보고, 돌아오는 총선까지 저들이 어떤 종자들인지  제발 좀 잊지 마시라!!! "
10,재미있다. 평점은... 
10,정말 죽였다. 구강 액션이라는 말이 아깝지 않았고 우리나라 첩보물의 또 하나의 없던 장르를 개척했다. 
10,팩트는 도발을 선거정치에 이용 했다는거 
10,흑금성 이름 석자가 드러나기전까지는 그것이 알고싶다에서 실제 흑금성이 밝힌 사실과 큰줄기에서 일치하네요. 연평도 포격을 영화에 대입하는 멍청이 리뷰가 저리 공감이라니.. 시기상으로도 안맞는 것을.. 
10,굿ㅓ안아나나눈투트타나니니 
10,그알을 보니 더 이해간다...여기 눈과 귀를 닫는 인간들이 너무 많네 ㅠㅠ 슬프다... 
10,볼 사람이라면 언젠간 보게 되갔지 
8,몰입감 좋으나 정치색이 너무 느껴져서  8점만 
8,댓글테러 오지게 많네마지막 조금 지루하지만 재미있습니다이성민 연기 장난아닙니다 
6,"대단한 연기자들인데,, 왜 보는 내내 불편한 마음이 들까요? 뭔가 임팩트가 없는 느낌이였어요. 조금 아쉬운감이 있습니다. 정치적인 냄새가 심하게 나는 느낌이랄까... "
9,연기력이 좋았던 영화였습니다. 영화적인 색감이 분위기랑 맞아서 좋아습니다 
2,북한 서투리 좀 제대로 연기했다면 더 재밌었을 듯 ㅠㅠ 
6,박진감부족. 중간에 잠시 잠들었네요. 배우들연기는 좋았습니다. 
5,누구를  탓 할것인가?  . . . . 
9,연기력 진짜 개오졌다 ;;근데 1993~1997년도에 조그마한 뱃지에 도청기를 달 만큼의 기술력이 있었을까 싶네 이건 살짝 미스... 
9,몰입도 깊은 연기에 깊히 빠졌다. 그러나 약간의 정치 편향적인 느낌을 받고 깨어났다. 
10,정치적인것을 떠나 참 좋은배우들이 한국에 많다는것을 느낀 영화 
8,대한민국에서만 가능한 첩보영화 
6,별로에요보지마셍ㆍ느 
8, 폭력없이 이런 긴장감을 만들줄이야...연기력 최고다 
9,로렉스 아입니까? 김홍파 배우 열연 / 이성민만 보인영화 
8,어디까지가 실화이고 픽션인지를 좀 더 알아야겠네요. 주조연 배우분들의 연기도 좋았고 몰입력있고 재미있었습니다 
6,영화와 연기성은 5점인데정치색은 1점 
8,딱 볼만하다연기력조으다 
8,믿고보는 배우들이였기에 
6,음 잘모르겠다. 어떤 의미를 주는지 
8,어떻게어떻게 해서 2 원 입찰일 
8,이성민연기정말잘하는듯.멋진배우 
6,내용보단 연기력이 더 돋보인 영화 
8,실화를 바탕으로 구성되어 박진감이 떨어짐** 
8,연기력  탄탄한배우들이 시대의 감춰진 진실을 보여주는  맘  아픈영화였어요  난 대한민국 국민으로 사는게 참! 거시기합니다. 이성민씨 카리스마 작렬~~ 
8,모두 연기를 잘하셨지만 이성민씨의 연기가 가장 기억에 남습니다. 그 덕에 영화에 더 몰입해서 볼 수 있었어요. 다 보고 나니 어쩐지 도니 브래스코라는 영화가 떠올랐습니다~ 
10,잔잔하지만 격렬한 첩보영화. 
10,연기자들의 연기가 모든걸 캐리햏다 
9,정말 뼈속까지 치미는 감동을 겨우 참고 봅니다. 
10,배우들에 연기가 너무 좋은 영화였어요^^ 
6,워낙 첫 기대치가 낮아서 보는내내 생각보다 잘만들었다는 생각이 들어서 좋았긴 한데 너무 프로파간다가 심한 영화인건 함정. 
6,배우들 연기력이 살렸지만  지루하고 뻔한얘기 
5,"해봄직한 상상이나 그려내는 방식이 너무 좌편향 되어 있다는 생각을 떨치기 힘들다, 이성민의 연기력에만 박수를 보낼 수 있을 것 같다, "
10,지금 이평점이 말이 안된다너의결혼식이 9점인 데 이정도수준의 영화가 7점대에 머문다니...왜지 불편해서 그런가 
10,츄천합니다 굿  흑금성얘기 알고 보셔야 더 재밋을거에용 
10,굳 ㅇㅇ잼씀 ㅋ재밋다 재밋네 
10,이성민씨의 연기가 정말 인상적입니다. 
8,호불호갈리겠지만난호엿으무ㅜㅜㅜㅜ 
8,명연기 속에 가려진 감독의 색깔 
8,이성민 천만관객 주연해도 될듯~^^ 
10,이성민 귀가 포인트ㅋㅋㅋㅋ 
8,ㅋㅋ기대안햇는데 재밌어요 
10,이성민의 연기가 어느시점부터 감정과잉같아서  아쉬웠는데 이번 영화에선 진짜 좋다. 배우들 연기 다 좋고 좋은 영화였다 
10,정치적 걱동기를 표현한것도 좋았고 스릴도있고 우정도있고 완벽하네요 dvd사야지 
8,정치색깔 진심 대박이라 불편하지만 그정도는 판단할줄아는 지식인이라면 그냥 배우들 연기만봅시다내용도 별로지만황정민 주지훈 조진웅 다 정말좋아하는 배우지만이성민에서 믹서기에 갈아마셔버림 
10,이 영화의 주인공은 누가뭐래도 이성민이다 
8,잼써요 ㅋㅋㅋ연기도 잘하소 놈 좋아요 
6,조금 지루하게 느낄 수도 있음 
7,선동한다는 말이 뭔지 알 것 같은 영화 그렇지만 배우들의 세밀한 감정연기가 명품이었다 믿고보는 배우들 모셔놓았으면 확실한 내용 정리가 필요했다 
8,사실을 벗어났지만 어디까지 픽션이고사실인지 분명히 했으면 더 좋았지만 스토리나 연기로 봤을땐 괜찮은 영화였다 
8,음.. 뭔가.. 오묘하게.. 
8,올해의 영화 cg빼고 완벽 
1,재미없고요!! 이게사실이라면 북에 돈준 정치인은 알려주셔야죠~ 
6,진짜 재밌었음 나는 영화적으로는 ㅇㅇ근데 좌편향 영화인건 사실이고 정치색이 너무 심하게 드러나는 영화인것도 사실이라서 영화는 영화로만 볼게 아니라면 기분이 나빠질수 있다는거왜냐하면 나도 영화 보고 기분이 나빴거든 
10,"주지훈의 새로운 매력,지루하지 않고 잼나게 봄주지훈 "
10,이성민bbb 별 기대 안 하고 봤는데 재미있었음 
10,이성민 짱  올해 대상 화이팅 
10,재밋고재밋고재밋고재밋다 
9,한 번 쯤 볼 만한 재밌는 영화 
10,우리나라의 현실과 슬픈현실을 그려낸 영화에 박수를 보낸다 
9,보고싶기도하고 간혹 악평도있어 시간 쪼개어 보았는데 부족함없는 좋은 영화였다 누가말한 총격없이도 긴장되는 액션감 신선했다 그리고 영원한적도 영원한 아군도 없다는 말이생각난다 북한은 적이지만 그보다 우리 내부의 숨은적...
10,재밌었다 ㅎㅎㅎㅎ훌륭 
2,노잼....~~~. 
8,배우들의 내면연기 좋았습니다 
8,잼있는데....뒤에만 조금만 담백했으면~~ㅎㅎ 
10,연기력이 모두들 어마어마 합니다!!! 
8,액션없이 연기력으로 긴장감을 끌고간다 
5,헷갈림 공부해야지... 
6,인물캐스팅이 좀 허약했다고 봅니다. 
10,배우들 연기가 인상적이었습니다 굿 
8,잘 봤습니다. 연기 잘 하시네요. 
8,연기가 참 좋네요..ㅎㅎ 
8,연기짱 연기짱 연기짱 연기짱 
10,스토리가 잼있어요^___^ 
6,그냥 그래요 그냥 볼만하지도 안볼만하지도 않아요 
10,정말 급배우님들 연기는 놀랍고도 또 놀랍고 생생한  현장을 본듯합니다~ 
8,북한에서 강아지와 그 분이 나오면서 빵터진 영화 
8,지루하지 않게 재밌게 봤어요 
10,"최고의 연기, 최고의 시나리오. "
10,웰메이드 스파이영화! 
8,정치색이나 이데올로기를 떠나 두사람의 우정이 너무좋았어요 끝나고도 여운이 있네요^^ 
9,다큐가 될뻔한 영화를 이성민이 살렸음. 
10,이성민을 위한 영화고  잔인한 장면 하나 없이  대사만으로 긴장감을 돌게하는  저한텐 촤고의 영화입니다 
8,재밌습니당 유쾌한 부분 없어도 지루 하지 않게 봤습니당 
7,주연배우 연기력이 좋으네요 
7,첩보물을 가장한 브로맨스! 
10,재밋네여 이성민 굿 !!! 
8,"다른 스파이영화처럼 탕탕 쏘다가 미션클리어! 같은걸 기대하면 안되고, 설전과 내면묘사가 중심이 되는 영화인듯함. 주인공의 당초목표는 완수도 못했고... "
10,영화같은실화. OOO기 
7,"개인적으로 이해가 잘 안돼서 어려웠던 영화,그럼에도 불구하고 여운이 남고 재밌었습니당이해하면 더 재밌을 것 같네여 "
8,갓성민 연기 잘하드라진짜 감성있는 북한군 연기 잘햇어연 
8,집중력깊게 지루한부분없이 볼수 있었던거 같아요~ 
10,액션하나 없었는데 예스잼 
10,최고의 영화.1점짜리 평점들 이어진걸 보니네이버 영화 댓글에도 알바들 들어왔네 
8,이성민배우님 연기 진짜 멋져요 
5,보다가 졸뻔 ... 마지막에 감동적이었지만 너무 늘어졌어요 스토리 전개도 어정쩡하고용 ㅎㅎ 
9,잘지내통일이라도?하면 
8,재미있어습니다.실화라니. 몰랐던 부분들이 많네요 
10,재밌지 이건재밌는거지 
10,재미보다는 의미.이성민 정말 연기 지리네요 
8,황정민이 돌아왔다! .. 
8,이성민 연기좋더라 조재웅은 약간 이상하지않아? 
10,극중 배우들의 연기력에 감탄했습니다. 
8,공작재미있게잘받습니다 
10,브로맨스!!! 의리의 영화는 역시다 
8,연기도 연출도 다 좋아요 
10,액션은 없지만 배우간 대화속에서 액션을 느끼는 영화였습니다 
8,너무기대를 한탓인가..별루다 
6,별로 재미없음..그 시대상황을 반영한 거겠지만 대화가 주를 이룸. 액션물이 아님. 
10,"총한번 안쏘고도 시종일관 흐르는 긴장감 탓에 두시간내내 긴장해서 봤어요. 대사 놓칠새라 얼굴에 있는 온 구멍 다 열고 들었어요. 이번년도에 본 영화중 가히 최고인듯합니다. 이성민님, 황정민님 얼굴 미세한 근육까지 연..."
8,남북이 평화적으로 통일될 날을 기다려 봅니다 
6,믿고보는 이성민배우의 연기에 반했습니다 
6,이영화 보는데 코고는소리가 들렸다 ㅋㅋ영화는 지루하고 그닥 ~ 
10,"액션장면 하나없는데 대사,연기로 액션하는 대단한배우들이다. "
4,연기가 좋았어도 지루한감이 없지 않았다. 
5,음....ㅋㅋㅋ할말이 없네요 
10,말이 필요 없음. 보시오! 
8,재미있게 잘봤습니다. 우리나라 정치에 대해 조금은 알아야 재미있어요. 
7,별다른 액션신 없이 이렇게 몰입도 높은 영화 만들기 힘들다. 
10,재밌음한번볼만함추천함 
10,올해 최고의 영화가 될거 같네요~ 
9,간만에 쫄깃한 영화 본거 같아요 
10,연기가 엄청나다.. 스토리진행도 훌륭하다.. 
8,분단의 아픈 현실....나쁜 정치인들 
8,나쁘지 않음 중간에 졸았던 부분도 있었지만 서스펜스가 좋고 마지막 장면 눈물 나드라 호연지기b 
8,"영화는 참 재밌게 잘 만들었는데 실화를 바탕으로 각색한 픽션인만큼, 사실과 허구인 부분은 좀 가려가며 볼 필요가 있을 듯. 여기만봐도 정치에 빠져서 무조건 찬양하거나 깎아내리는 정신못차리는 인간들이 너무 많다. "
8,차갑지만 따스하다는 모순의 정서를 정확히 담아낸 첩보물 
10,이성민 아저씨를 위한 영화! 
10,재미없다는 사람 이해안감. 일단 팩트라서 더 흥미진진하고 스토리가 지루할 틈없이 빠르게 전개됨. 황정민 연기력은 말할것도 없고 영화관 자리 만석에다가 영화끝나고 박수치는 아저씨도 있었음 
10,남과북  그런식으로 60년동안이 분단체제를이용한새끼들을 제대로 정곡을찌르는영화 남한보수세력 북한강경파 둘은 적대적공생관계를이루고있다 이 영화는 우리에게질문을하고있다 이 분단체제의지속이 올바른지? 북풍공작이 얼마나 위...
8,몰입도 있게 잘 본 영화였네요 
8, 실화를 기반이라니 좀 충격 
9,배우 연기력에 취한다... 
8,영화를 끌고가는 힘.. 역시 이야기!! 
8,재미있게 좋은영화 잘감상했습니다.^^ 
10,연기력이 대단함 볼만한 영화! 
10,정말 시간가는줄 모르고 봣어요 연기력들 다들 탄탄..!! 
10,정치성향이든 뭐든간에 영화 자체만 놓고 보면 박수 칠 만한 영화다. 연출 방식이 새롭고 배우들의 감정선이 압권이다. 
7,스토리에액션이약간가미되었음좋았는데좀아쉬움이남네요 
8,이성민연기 갑믿고보는 황정민 
8,볼만했어요 이성민 황정민 연기 굿 
8,볼만해요  연기를잘해요 
10,두번볼꺼임 존잼!!! 
6,이성민 멋있어요 이성민만 보였음 
8,감동적이고   즐거웠어요 
8,연기력에 압도됐다. 내용은 당황스러운 면이 없지 않았지만 전체적인 몰입도는 좋았다 
8,생각하면아이러니한 중딩들이보면진짜라고믿거나 정치에대한혼란이있을듯.빨리통일이되었으면 
8,재밌게 잘 뵜습니다. 실화라는게 정말 좋군요 
10,잘보고왔는데 평가가 극과극이네요 실화기반 픽션이라는데 왤케들 화가나셨는지 
8,재미있다 없다가 아니라 다큐를 하나 집중해서 본 느낌이네요. 무난했습니다. 
8,초반에 좀 지루했는데 볼만했어요. 
10,진심 연기자들의 연기력 대단하다 
8,나쁜 정치인들에게 국가와 개인이 유린당한 실체 
8,정치색 가득한영화  조금  불편한  영화~연기력은  굿입니다. 
10,그냥 재밌거만  ㅋㅋㅋ 주지훈땜에 10점! 
6,약간 지루한 느낌입니다 
10,리차장 대단했습니다... 
8,영화는 재미있었습니다 다만 정치적인 판단은 생각할 수 있는 여백으로 남겼으면 하는 아쉬움이 있습니다 
10,좀 촌스런 감성이긴한데 구성이랑 연기력이 지렷다 
7,메시지는 뻔하지만 전달하는 과정이 흥미롭다 
10,이성민님 ㅠㅠ진짜 대한민국 최고의 배우이십니다. 섬세한 연기ㅠㅠ 감정이입되서ㅠ 진짜 잠못 잘 듯ㅠㅠ 
10,재미있고 뭉클하고 많은 생각을 하게 하는 
8,배우들 믿고 볼만한 영화 
10,무지 재밌던데요~~~ 
8,액션신 없이 이정도면. 
8,재미있었습니다.ㅎㅎㅎㅎ 
10,재미있게 봤어요~~~~! 
10,굿~!~!~!~!~!~! 
9,재밌게봤어요 연기오짐 
8,조진웅 보러갔는데 이성민의 재발견이었어요감동적인 마무리정권에 대한 실망 
10,배우들의 명연기가 돋보이는 작품. 
8,이성민  잘하네 연말 시상식에서 보자 
7,음... 조금 지루했다고 할까... 그다지 몰입되지는 않았다... 
1,이 정권 빨아주는 종북영화라고밖에ㅋ 
10,이성민 복합적인 감정의 연기 최고입니다 
1,배우가 아깝다 이것도 구라치냐 
6,"배우들의 연기는 좋았으나, 전반적으로 잘 모르겠는 영화. "
10,간만에 본 웰메이드 영화 같아요 지루할 틈 없이 감동이 깊고 울림도 컸습니다 
10,잘봤습니다...재미있게...즐겁게...생각있는 영화이네요...^^ 
7,"정치색이 이렇게 짙으면 안 봤을 수도. 연기 잘하고 재미 있고 위험부담에 따른 긴장도 상당하지만, 불편한 마음은 감출 수 없다.. 현 정권 믿고 찍어대는구나 "
7,배우들  연기는좋던데요 
10,잼나여 잘 봤습니다 짱짱 헤헤 
10,연기 너무 잘하심 정말 잘만든 영환데 일베들한테 좌표찍혔나봄 
8,남한인인가 북한인인가 
10,액션없이도 긴장과 스릴을 충분히 만끽하였다.오랜만에 스준높은 한국영화를 보아서 뿌듯하다. 
6,그래서 황정민이 좌파역을 맡았다는건가? 
10,핵잼.. 정치관심 없이 오락영화 기대하고 본다면 노잼 
7,물 밑에서... 뭔가 일어나고 있어... 
8,긴박하고 그런건 없지만 그냥 한국정치판 비판하는거지 뭐... 
7,남북관계 브로맨스로 대동단결 
7,스토리전개가 큰 굴곡이 없고 잔잔함. 다소 지루했지만 몰입도는 좋았다. 근데 결말은 정말 아니었음ㅠ 
8,엄청 몰입해서 봤다 배우님들 연기 짱 이성민 개멋져 
8,지루할것 같으면서도 묘하게 집중됨 
6,단지 배우들 연기 잘하는거 보는게 영화보는 목적이 아니다...나는 
7,연기력에 감탄합니다. 재밌게 봤습니다. 
8,재미있습니다 연기력 훌륭합니다 
7,"배우들의 연기자체는 진짜 흠잡을데 없을정도로 장난아니고,  액션씬 하나없이 이렇게 긴장감 느껴지는 첩보물은 처음이었다. 다보고 댓글보고서야 액션씬 없었나라고 생각할정도...근데 좌우를 떠나 너무 정치색이 크다총선 대..."
10,넘 재밌네요 굿굿! 또 봐야지 
10,간만에 액션없이 팽팽한 긴장감 속에 숨죽이며 본영화 
9,오로지 배우의 연기력만으로 끝날 때까지 긴장감을 늦출 수 없다 
8,"감동도 있고 재미도 있고, 굿! "
8,연기력은좋아보이나스토리는그럭저럭하네요 
10,"믿고보는황정민,조진웅 "
10,1987+더킹 같은 느낌..? 
10,바둑을 두는 영화네요.. 
10,오랜만에 재밌는 영화였다 
7,굉장히 재밌게보았지만너무 정치색이짙어 아쉬운 
7,엄마를 닮았구나 ㅋㅋㅋ 
8,통일을 바라지 않는 세력들? 
9,생각보다 이성민이 연기가 좋습니다. 실화를 바탕으로 한 영화라 그런지 지루하실 수도  있지만 전 재미있게 봤습니다. 
10,배우들의 연기가 정말 대단하다. 
10,"긴장감 높은 잘 만든 영화다. 댓글 공작들 보면 북한 미화 얘기 하는데, 그런건 전혀 없다. 김정일 정권과 자한당의 전신인 한나라당의 공생관계를 신랄하게 까발린 영화. 북한은 도발의 대가로 달러를, 자한당은 국내정치..."
10,댓글 조작 오지다. ㅋㅋㅋㅋ. 
10,"박근혜때는 인천상륙작전, 문제인때는 공작... 정권에 따라 영화 테마가 바뀌는 것은  어쩔 수 없지만... 공작은 완성도가 매우 높습니다. 두 배우의 끈끈한 우정이 감동이었습니다. "
9,"실화,,, 무엇이 진짜 적일까 "
8,빨갱이들을 주적이라고 외치면서 빨갱이들의 도움을 간절히 원했던 진짜 빨갱이들의 이야기. 
10,"스토리 구성이 알차고 상영내내 단 일도 지루함이 없는 영화였는데, 평점이 낮아서 놀랬음. 그러나 내용을보니 수구꼴통들의 알바짓라는... 에휴.. "
8,조금지루한면이있었지만 실화라는게 믿기지않고 재미있는부분도잇었네요 
8,연기가 다했다!!그럴법한 이야기 
7,북한을 어떻게 보여줄지 궁금했었는데. 어느정도 고증을 잘 한거 같네요. 주체적표현이라던가. 근데 이성민과 황정민의 남북을 넘어선 우정은 너무 갔다..는 느낌이 드네요. JSA처럼 현실적인 결말을 보여줬다면 꽤 수작으...
10,너무 재밌습니다 최고입니다 
7,영화의 내용이 전반적인 흐름이 조금지루했음 
6,처음에는 이해가 잘안가는데 점점갈수록 잼잇음 
10,너무 좋았습니다 감동이었습니다 
5,"연기 연출 모든 것이 좋았지만,정치색이 너무 짙어 영화에 집중하지 못했습니다 ㅠ 개인적으로 너무 아쉬웠어요 "
9,잔잔하지만 힘있는영화 
10,신과함께 볼까하다가 공작봤는데 선택 잘한것 같아요. 오랜만에 영화보고 재미있게 봤다고 생각했어요. 
2,최악~~최악~최악~ㅅㅂ 
10,재밌습니다 강추입니다 
10,사실의 묵직함..진정성의 승리! 
8,첩보물인데 총질 없이 긴장감을 내내 유지함. 전개가 루즈하지 않게 잘 진행됨. 연기력은 두 말할 필요 없었음. 진짜 다들 완벽... 다만 정치색이 좀 진해서 사실관계를 떠나 다소 불편했음. 
7,변변한 액션씬하나없이 이렇게긴장감있는 스토리전개는 칭찬아쉬운건 너무 좌편향된 느낌...자막에 일부 픽션이란 단어를 삽입했지만분별력이 부족한사람이봤을때는북도발은 모두 한국정부에서요청한거라고생각할지도모른다는게 걱정..영...
8,암호명 흑금성 아주 잘보았습니다 
6,노잼 지루함기승전결중  기기기기밖에없음 
8,재밌었습니당..!!! 
8,전 재밋게 봤습니다. 전체적으로 긴장감이나 내용자체가 지루할것같으면서 지루하지 않네요 
8,이성민 연기력 진짜 대박 
10,재밌네~ 영화가 재밌으면 됐지. 늘 평균이상은 하는 윤종빈감독 
8,정치에대해 통일에대해 한번생각하게한영화 
10,그래서 총풍사건은요? 정치색 띤 영화라고 뭐라 하기전에 이것부터 반박좀? 뜰탁 일베들아? 
10,실화라서 더 리얼했던 영화. 자유당(한나라당)은 파도파도 괴담만.. 
8,남북사이에 이런 일이 있었다는것을 쉽게 알수 있었던거 같아요연기자 분들 연기가 좋았어요 
8,정치에 얼마나 북한을 이용해 먹었을지 
10,이성민 연기 진짜 와... 
10,"정말 재니있게 봤구요, 이 영화를 보고 느낀 건데 진짜로  얼른 통일이 되면 좋겠네요 "
8,브로맨스를 위한 영화네요 ㅋㅋ 
10,처음부터 눈을 뗄수 없이 몰입함 딱 그시대를산30~40대를 위한 영화임 
10,우리의 역사다역사를 예술로 표현했다시민의식이 없으면 이같은 일이 또 반복된다 
10,여기  틀딱자한당지지자들  글 싸지른거 봐라 무식하면 아닥이나 해야지 ㅉㅉ 저것들은 선동 좌파 아니면 할말이 없나봄 
9,배우들의 연기와 스토리 모두 완벽하네요 
9,정치색을 빼고 보자면 단연코수작. 한국에서 이런 첩보스릴러가 가능하다는걸 증명했단점에서 재밌게봤음. 
10,주연 조연을 떠나 모든 배우분들의 탄탄한 연기와 스토리에 집중할 수 있었던 영화.보고나면 아직도 멀었구나 싶네요. 
7,영화는 그냥 영화로 보시길 
8,정치색을 떠나 몰입도 높고 잘만든 영화 
6,배우분들 연기짱. 그런데 좀 지루한면이 있습니다. 어떤점이 사실이고 허구인지 .. 
10,연기력으로 스토리가 커버됫다 
8,영화가 시작하면서 끝날때까지 극장안은 쥐죽은듯 조용했다~정말 영화에 몰입하게한다~하나아쉬운점은 액션이 너무 없다는것이다 
8,스토리나 배우연기 모두 감탄하지만 루즈한 느낌을 지울 수 없었다 
10,액션씬 없이 눈빛과 대화만으로 엄청난 긴장감을 조성하는 명작 
10,재밋어 ㅠㅠ 멋지다 이성민은 사랑입니다 
10,볼만한 완성도 높은 영화 
9,마지막부분에서 감동적인것 같아요~이성민 연기굿~ 
9,시간가는줄 모르고 관람했어요 
9,진보와보수의양갈랫길.. 
10,과거 현재의 모습을 픽션이라 써야만하는 슬픈 영화!   넘 잘만들어서 좋은 영화! 
10,이성민 황정민 님 연기 너무 잘하시고 두 인물간의 관계가 이끄는 긴잠감 키야~ 
10,역시 믿고보는 이성민 배우님과 황정민 배우님!! 그리고 조진웅 배우님과 주지훈 배우님까지...!!!!진짜 즐거운 시간이었습니다!! 감사해요♡ 
10,연기대결에선 이성민의 압승. 순서대로 하자면  이>>>>황=주>조 
4,다들 연기를 너무너무 잘하네요 
10,"영화는 영화로봐야지,,,, "
10,배우들 연기가 역시나 다름클라스는 영원하다 
10,재밋습니다 이성민씨  인생연기 잘 봣습니다 
10,윤종빈 감독 연기 잘하시네요 
6,"흠,,모르겠다 그냥저냥 "
2,지루하고 또 지루함 연기자들은 최고 영화는 최악 
6,연기는 잘했지만 내용면에서 좀 지루함.. 
6,잘봤습니다. 조진웅 연기는 맨날 비슷한듯요 
8,관람객평점과 네티즌평점이 왜이리 차이가 많이 나지 
6,과거를 회상할 수 있었던 영화였습니다ㅅㅅ 
8,다들연기도잘하고 내용도 너두 집중해서 잼있게잘봤습니다 
7,기대한 것 보다는 괜찮았다.잔잔하고 내용도 있고~~ 
9,나는 이성민이란 배우가 좋다 
7,어제 봤는데 그냥 7점이요...엔딩이 영화에선 진지한대 오글거려서 웃음이 났네요 
6,그럭저럭무난한영화 황정민이란배우가나온다구해서봤어요 
4,영화보고꿀잠자긴처음이다 잠이 솔솔.. 
6,배우들이 다한 영화 같았어요이성민 아저씨 섹시하고 멋있는데영화 내용은 그냥 그랬어요 
8,재미있게봣어요즐영화보세요 
10,이성민 정말 연기 너무 잘한다 
9,재미있고 배우들 연기력 인정! 
10,정치인들이란...미소와 감동 
