score,review
7,흥미위주의 영화를 원한다면 비추거의 다큐 수준그 와중에 이성민 짱! 
6,황정민 이성민 둘다 연기력이 ㄷㄷ 
6,재미있게봤어요~~~ 
10,볼만합니다 배우들 연기도 좋고 재미를 추구하는 영화는 아닙니다 
6,술로 시작해서 술로 끝나네 
9,한국영화는 연기력으로 본다 
10,정부에 불만 있으신 분들은 관람을 삼가하시고. 영화를 그저 영화로 즐길 줄 아시는 분들만 보세요. 
10,꼭 보세요. 재밌어요. 
10,잘 만든영화죽이고 피터지고 이런게 없고 애기들이 보기엔 이해하기 어려워 재미없다 할지 모르겠지만.. 
10,50년만에 정권 교체라니 얼마나 해쳐먹었을꼬 
8,황정민과 이성민의 브로맨스 
8,"범죄와의전쟁때 알아봤는데, 시대를 꿰뚫으며 이야기를 만드는 솜씨가 정말 일품이다. "
8,재밌게 봤습니다 감사합니다 
10,디테일이 소름돋았다. 
7,내용이 조금 무겁다는느낌 
8,오늘 인과 연과 공작을 사정때문에 다른 영화관에서 봤는데 공작이 화면도 더 크고 방해하는 사람들이 없었던 인과 연보다 더 집중하면서 봤다. 영화가 정치적인 색이 너무 강했지만 영화적인 완성도는 꽤 좋았다. 영화는 재...
10,정말 올해본 영화 중 최고인듯 액션 없이도 긴장감 몰입!! 
10,방금 보고왔음.일단 배우진들이 기대를 져버리지 않음.스토리구성도 좋고깔끔함. 
7,"정치색만 좀 덜어냈으면 괜찮았을텐데.과거 여당의 과오를 조명하는건 좋았지만,김대중 대통령의 지나친 우상화가 있던거 같다.정치를 떠나서 그냥 첩보 영화로는 그럭저럭 "
10,롤락스 터졋다 땐쑤 ㅋㅋㅋ 
8,정치색이 있긴 하지만 그 당시의 남북화합의 감동이 전해지고 정치적 문제들을 좀 더 폭넓게 볼 수 있게끔 시야를 넓혀주는 영화였다 
8,"분노,배신감,,,, 마지막씬이 인상적임 "
10,지린다지려.. 갓정민 갓성민 
6,진지한 영화 였고 감명깊었습니다 
6,조진웅 등치 새삼 크다는거 느낀영화 
10,믿고 보는 배우들이 나와 봤는데 역시나 최고다~!! 
10,그냥 재밌다 말이필요없다 
10,배우들 연기 지림. 이제 이런 얘기도 검열없이 볼 수 있어서 더 지림. 
1,실제 공산주의 문정권이 만든 세뇌형 영화ㅋ 북한이 친구냐? 더러운 목적이 너~무 잘 보였습니다^^; 
10,"액션이나 총격신이 있을거라고 생각했는데 스토리와 인물간의 심리, 연기력으로만 이렇게 영화를 이끄네. 오랜만에 재밌는 영화 잘봤음 "
1,
1,권성휘 윤종빈 기억해두겠습니다 ㅎ 
10,
8,인간이 인간을 위해 만든 나라에서 인간이 대우받지 못하는 나라는 왜 만든거고 대우를 못 받으면서 그나라에 충성하는건 뭐냐  사람위에 사람없고 사람 밑에 사람 없다 뜬금없는 근본적인 문제가 떠올랐다 
8,긴장감 넘쳐서 눈을 뗄 수가 없다. 
6,영화는 볼만하다. 아니 재미있다. 그런데 조진웅이 연기는 도저히 못봐주겠다. 역시나.. 비열한거리 돼지양아치 역할 수준을 못벗어나네.. 
8,이상한걸로 욕을먹는 영화네... 
10,마지막 장면 정말 소름이 돋는다. 
10,재미있는 영화 입니다.그리고 제가 너무 많이 보고 있습니다 
10,10점 만점에 10점. 
6,생각했던것보다 별로다 
7,생각보다 재미없었음.. 
4,지루했습니다. 졸으면서 보았습니다 
8,이런 역사가 있었군요. 
8,재밌게 봄. 너무 늦게 쓰는거라 기억은 잘 안남. 
5,"북한이 핵 개발할 수 있게 소떼부터 금강산관광등 돈 날라서 비용 대준건 김대중 정권이잖아, 그럼 북한이 핵무기 갖는 데에 결정적 역할을 한게 황정민이란건가??ㅋㅋ "
10,탄탄한 배우 그리고탄탄한 스토리.. 
4,연기는 좋았으나 재미가 없어요 
6,웃김 국개의원 정치 나부랭이들의 음모로 만들어진 영화??? 
10,좋은 영화다.연기자들의 연기력도 좋았다 
10,하  소문이 괜히 나는게 아니었어연기들 짱입니당 
7,흥미롭게 재해석한 과거 남북관계를 그린 첩보영화. 사실이 아닌 '영화' 
10,와 다 보고나니 137분짜리네 시간가는줄 모르고 봤다. 흑금성이 안탑갑다/ 그리고 빨갱이 쇄퀴는 북에서 남쪽으로 총쏴달라고 하고 맨날 방산비리나 저질러 안보빵구내는 넘들이 빨갱이지 안글나... 
8,이성민 연기가 다했네. 
10,디테일한 연출력이 독보인다 실화라니 놀랍다 8.5점이상은 돼야한다 
10,뭐라할말이없습니다!꼭보세요! 
10,연기력 진짜 좋다!!! 
10,간만에 재밌는 영화 봤음 
10,하하헤헿로롫후후후흐히히 
2,황정민님 좋아하는 배우라 봤는데 이번 작은 영화관가는건 거르길 잘 했네요. 
1,영단어 하나를 더 외울걸... 
8,공작 저엉말 재미있습니다 : ) 
10,이게 재미없다고????젋은애들은 꼭봐야한다. 
9,말로만 들었던 것들이 현실이었네요 
8,왜이렇게 평점 을 낮게 주시는 분들 왜그런건지...38세 직장인으로 정치감정 배제하고 보는데. 실화인것도 좋지만 두남자의 영화감정선도 좋습니다. 정치 느와르인듯. 전 재미있게 봤어요. 저 어릴때 몰랐던 역사도 알게되...
10,"실화 바탕인데 1,2점 주는 애들 자유한국당 알바생들인듯 "
10,"영화 '강철비'에 이런 대사가 나오죠... ""분단국가 국민들은 분단 그 자체보다 분단을 정치적 이득을 위해 이용하는 자들에 의해 더 고통받는다.""  일맥상통하는 이 영화, 더 많은 분들이..."
10,"진짜 실화를 바탕으로 한것이고, 지금도 저렇게 북한을 이용해서 이익을 취하려는 집단은 존재하고 있다. 근데 참 웃기지 않냐? 우린 원래 같은 민족인데, 구소련과 미국이 자기들 마음데로 찢어놓고 전쟁일으키고  거기에 ..."
5,영화가 빨간맛이라 위험하네... 설마 확인도 되지 않은 영화의 스토리를 믿는 사람은 없겠지 설마~~ 영화는 영화일뿐 배우들의 연기는 확실히 좋았음 하지만 선동당할 위험이 있으므로 
10,명불허전 네일베 댓글알바들 여기서도 열일하는구나댓글부대 실장들 빨리 어준이형한테 가서 제보나해라그게 니들살길이다 
2,졸다보다졸다보다 배우가아깝다 
10,너네 인생에 정치가어떻든 상관없으니깐. 제발 정치가 이렇니저렇니 불평불만하지말고 영화감상이나하자 
8,피곤해서 시청중 잠들었습니다.. 
10,진짜 재밌다. 명불허전 자한당 
9,정치적 색깔이 있어서 더더욱 좋다. 다시는 새누리같은 종자들이 나라를 잡으면 안된다. 
10,20OOO 웰메이드 한국영화 
10,"정말 즐겁게 잘 관람했습니다. 배우들의 연기에도, 시나리오도 손에 땀을쥐게하는 영화였습니다. "
10,정말 대단한 영화입니다. 정치공작의 교과서가 되었으면 좋겠습니다. 
10,등장하는 모든 배우들이 연기를 너무 잘했다. 그리고 북한의 모습을 실제처럼 구현해내어 인상적이었다. 절제와 긴장감을 적절히 조율한 연출이 훌륭하다. 
10,여기도안기부가조작하겟지? 
10,재밌는건 확실함. 여러가지 말들은 있겠지만. 
10,재밌었는데 정치적으로 평점 테러군 
10,영화 참 잘 만든다... 지루한 일상에 정말 훌륭한 이야기이다. 
10,실화를 바탕으로 훌륭한 연기력을 입어 더욱 빛난다! 진심 강추!!! 
10,정치 거르고 영화를 진짜 잘 만들었다. 결말에 브로맨스가 좀 거슬렸지만 윤종빈 감독의 저력을 확인할 수 있었던 좋은 영화 
10,꼭 보세요. 정말 추천합니다. 
10,좌빨 영화라더니 좌빨영화가 아니었다 친민족영화였다. 북한과 남한정부의 치졸한 민낯을 드러났는데 무슨 좌빨. 과연 이성민의 연기가 돋보이고 황정민은 언제나 황정민스러움 새로울거 없지만 안정적인 연기가 인상깊었다 
7,김대중 대통령이 50년만에 첫 야당 대선 승리였었구나. 물론 안기부의 순기능과 북한의 미화도 모르는 건 아니다만. 안기부 김기춘 간첩조작. 북풍조작 이런 건 짜증난다. 영화가 다소 아쉽다. 동화같은 흐름만 조금 걸러...
7,흔한 총격신 없이 인물들의 심리 묘사와 연기력으로 만들어낸 수작 첩보물 
4,그냥 저녕 .. 잘 모르겠다 
10,역시는 역시다.!!! 
10,엄마가 즐거워 하셨습니다. 재미있었어요 
10,좋았자 정치색을 따져물고 들어갈게 아니라 영화로서 보았다 이성민 황정민 두분의 연기로만 영화를 끌고가는걸보고 깊이 감동받음 
7,북한을 미화 했다는 말에 반박 못하겠고 좌파에 편향된 영화라는 말에도 반박을 못하겠네.... 연기는 좋으나 내용은 썩... 
10,정치따지지말고 영화로만 보면 이성민 황정민 연기와 잘짜인 스토리 라인과 개연성 편집 어느하나 빠지지않는 충분히 만족감을 느끼는 수작이다 대단하다 두배우. 
1,니미 저런 일류급배우들을 가지고 영화를 저따구로 만들었나 ㅋㅋ 웃음만 나온다 ㅋㅋ 
10,내평점1점준 새/끼들 니들이 그러고도 영화가 빨갱이네 뭐 대통령이 누구네 이럴수가있냐? 이 영화의 참된 뜻을 모르고 저렇게 몰아가네.. 와.. 소름이다 진짜 영화자체가 남기는 여운이 엄청난데.. 정말 잘만든 영화 
6,느낀점은 정권 언론 영화  모든걸 못 믿겠다 
7,액션없는 첩보물(구강액션?)을 이 정도로 만든 우리나라 영화가 있었나??? 2018.년 지금까지 개봉한 한국영화 중 제일 좋았음 
1,별로별로별로별로별로 
1,당시 안기부판단이 맞았고 황정민 판단은 틀렸다. 
10,이 영화는 모든 국민들이 보고 깨달아야 할 영화이다. 
10,재밌고 의미있게 잘봤어요 
10,수작!..(열자)) 
6,연기는좋고나는졸렸고 
8,정말 재밋다  남북 통일기원 
10,정말 재미있게 봤습니다~국민으로서 많은걸 알게 되었습니다 
3,생각보다 기대에 미치지는 못했습니다 
10,보세요 잘만든 영화입니다 재미있게 봤어요 홍보가 잘 안된듯 하네요 
10,일베수구틀딱들 전쟁에 미친 벌레들이다. 벌레들이 죽어야 나라가 평화를 찾는다. 
10,역사물을 좋아해서 재밌었어요. 약간은 어려웠지만 많은 생각이 들게하는.. 
10,재밌어서  높은 점수를 줄 생각이였고  자기들 맘에  안 든다고 1점 주는 인간 들이 있어서 10점준다.  오랜만에 첩보물 같은 첩보영화라고 생각한다. 첩보는 저런 것이지 서로를 의심하고 위장하고 의도한  공작을 하...
10,안기부 쓰레기였어  쯧쯧 
8,마지막엔딩이 기가막힌장면아엿다 
7,"전체적으로 괜찮은데, 연평도 피해자들 분노할 듯 사실아닌건 아니라고 말을 해야지 "
9,근래의 보기드문 수작이었네요박진감 넘치고 손에 땀을 쥐었습니다.세상의 더러운 단면을 잘 보여줬네요 
10,★★★★명작★★★★ 
10,영화가 정권 보고 개봉한다고?? 박근혜 정권에 개봉한 변호인은 뭔데 그럼 ㅋㅋㅋㅋ 애국꼴통보수들의 자기 보고 싶은 대로 봐버리긔~~ 
10,잼있던데... 진짜! 
8,죽음앞에서도 내 조국은 하나뿐이라는 요원의 얘기가 왜..빨갱이 영화라는거야? 
8,멋집니다훌륭하구요ㅎㅎ 
1,북한미화 더럽다 진짜 나라꼬라지보소ㅋㅋㅋㅋ 
8,액션 없이도 충분히 재밌을 수 있음을 보여주는 영화. 
10,이런영화 계속나와야한다. 일베충들 별점깎는짓좀 하지말길 
10,재미없다 해서 안보다가 뒤늦게 봤는데 너무 재밌게 봤음. 뭐 우리나라는 북한없으면 정치적으로 생존하기 힘들듯 
7,주지훈이 왜 표준어하고 북조선말 같이 쓰냐? 젤 옥의 티였다 ;; 
9,진실 여부를 떠나 잘 만들었다. 팽팽한 긴장감과 감동! 
10,진짜 재미있게 봤습니다 
10,"와,,최고다,,자한당 전신의 새누리, 한나라당의 민낯을 낱낱이 보여주는 영화!!지금껏 이나라가 어떤식으로 굴러왔는지 알게되네요,, 눈이 번쩍 뜨입니다,,네이버 알바평점 믿지마시고 그냥 무조건!! 보셔야하는 영화!!!..."
7,비교적  잼나게 보았습니다 
10,이게 실화이면 왜 사후처리는 없는가? 
6,김선생은 빨갱이가 아니였다를 교묘히 주입시키는 영화 근데 왜 남북회담은 그들이 정권잡을때만이루어지는가 
10,반대를 위한 반대 하지말고~ 
10,"명작이다...,,,...,,, "
10,각본과 연출 그리고 배우들의 힘이 무겁게 어우러진 영화 
10,마지막장면  소름돋는다 
10,리명운 츤데레 우정... 북한사람들 순박해서 좋다...우리나라 사람들 너무 약아 빠졌다. 
10,난 괜찮은데 왜이렇게 악평이 많지. 실화이며 배우들 연기가 좋았다. 
10,몇년 후엔 역사책 한면을 채울법한 이야기 
10,최고네요.. 역시 윤종빈이네 
8,흑금성 실화 모티브를 잘이끌어 빙산의 감춰진면을 긴장감있게 풀어냈다 
8,정치 선동을 좋아하진 않지만.. 가능성도 충분히 있어 보이는 영화다.. 
10,연기 쩝니다 =_= 잘 봤습니다 
6,황정민 연기 어색한거 나만그런건가? 
8,잘봤습니다잘봤습니다 
10,잘만든 시나리오 유지되는 긴장감 
5,정치적으로 너무 편향된 점과 황정민의 늘 똑같은 연기에 실망 
6,"뭐 그냥 그랬던 영화., "
10,이성민  황정민..대단하다  정말.. 
10,배우들 연기가 좋았음... 
10,너무재밌었음 연기짱 몰입도 짱 
10,멋진 영화다  역사는 비밀리내에 이루어진다했다. 
8,괜히  걱정되네  북이보면 뭐랄까싶은ㅠㅠ 재미는있는데 맘이  짠하네 
10,우좀 빨갱이 새.끼들 똥싸는 댓글 많네 ㅋㅋ 
8,한국의 우익은 우익이었던 적이 없다 
8,배우들 연기력 최고입니다 
10,과하지 않은 연기 연출굿 
10,아. 새롭게 깨닳고 갑니다 새로운세계에 눈을 뜨게 되네요 인생이 점점 무서워집니다 ㅋ 
9,모르고 있던 사실들을 찾아보게 되는 내용이네요 정말 멋진 영화였습니다 
10,최고입니다 황정민짱ㅎㅎ 
9,"탄탄한 구성,완성도 한국영화가 밀리지않는 이유다. "
8,너무 민감해서 거부감이 생긴다 절정에 이르는건 좋겠지만 아직도 살아있는 쓰레기들에게 노골적 메시지를 전했다 층간소음 심한집에서 적당히 방음처리를 못했으니... 별점테러의 이유를 알겠네 ㅋ 흑금성 말고 구글에서 ...
10,정치색을 떠나서 배우들의 연기력에 감탄을 하지 않을 수가 없다. 
10,누구나보면 느낀다 빨갱이거르는 영화 ㅎㅎ 
1,ㅋㅋㅋ 이거보고 연기 잘한다는 애들은 모냐?황정민은 연기가 국제시장+검사외전 내용도 개구리고~진짜 보다가 지겹더라~ 
5,마지막 시계 넥타이핀 장면에 아직도 오글거린다 이런 억지감동은 그만좀 하자 지겹다. 전반적으로 지루하고 긴장감도 떨어진다 
6,좌편향이라는 리뷰가 많은데요. 실제 당시 여당 국회의원들이 북한 관계자에게 총으로 도발해달라고 부탁하던거는 실제 있던일입니다. 
10,지들한테 불리하면 정치성향 어쩌구 저쩌구 빨갱이 어쩌구 저쩌구 ㅋㅋㅋ 
10,한국인이라면 한 번 보는 것이 좋을 것 같다 
2,각색이 뭔지 모르냐 영화가 재밌는건 아니지막 모든내용이 사실인걸 보고싶으면 다큐를봐 이건 상업영화야 돈벌려고 만든거야 미드 높은성의 사나이는 뭐 나치 일본 빠는 드라마냐 
9,ㅋㅋㅋ아주 그냥 일베들과 그 추종자들 개아리 진하게 틀고 앉았구나... 역시 예상이 1도 빗나가지 않네... 단순하기 짝이없는 벌거지 찌끄래기들.... 아 영화라잖아~ 븅들아~! 
8,그래잼있게봤다낭름아 
10,"배우분들 연기 대박좋았고 전체적으로  분장, 세트장 완벽합니다 "
10,뒤늦게 봤는데 이성민 연기갑. 
10,최고...정치인들의 민낯을 보여주는 작품. 이거야 말로 정당 해산에 사형 감인데ㅎㅎ 
8,연기력이정말최고였어요~~추천추천 
10,이성민의 혼신의 연기가 인상적 
10,이성민 정말.... 소름 끼칠 정도로 연기 잘함 
8,재밌게 잘봤습니다. 영화기 짧지는 않았던.. 
9,음.. 어디까지 실화인지는 모르겠으나 영화로 보기에는 재미있었습니다. 
9,"지렸구요,, 오졌구요,, "
8,이성민님 연기를 보는 재미가 쏠쏠합니다. 전혀 지루하지 않아요^^ 
5,"약간 피곤한 상태에서 관람을시작했다  연기가 출중한 배우들이니만큼 훌륭한 연기력을 보여줬으나 진행 및 연출은, 영화 중반부 내가 잠들기에 충분했던것같다 "
10,이성민 연기 하드캐리네요 
6,영화 잘보았습니당 굿굿 
10,마지막 찡하던 여운이 열흘이 지난 지금 생각해도  울림이 있습니다 고맙습니다 
10,진짜 두번봐라나 댓글 알바 아니다 올해 황정민 연기대상이다. 
10,잘봤습니다. 조센징들 정신좀 차려라 ㅉㅉ 
10,조금한거 하나도 불편한게 느끼는 불편한 사람들 진짜 많구나세상  피곤해서 어떻게 사냐? 
10,윤종빈 감독 다시봤다. 
9,와... 이성민... 아니 리명운.... 
10,마지막 장면에서 감동이여 
7,현 정권의 눈치를 보는건.. 여전하구나 
8,새로운 내용을 알게 되어 충격적이었다.. 
8,내용은 잘 모르겠고 배우들의 연기력이 멱살잡고 끌고 간 듯한 영화. 그래도 괜찮은 영화라고 한번쯤은 볼 만한 것 같음! 
4,"정말 개인적인 견해입니다만 저는 처음에 잤어요. 자고 일어나서 보니까 괜찮았는데 개인적으로 나레이션 많은 영화 좋아하지 않아서,,, "
8,연기진짜 너무 멋잇었고 몰입감 대박이였어요!! 
8,황정민 때문에8점 사랑합니다 
6,재미는 있었다 근데 뭔가 좀 아쉽다 
7,연기가 보기 좋았습니다 
6,졸려서 보다가 나온 영화는 올해들어 너가 두번째야.. 
8,재밌게 잘 봤습니다. 시작부터 끝날때까지 긴장감을 유지하며 쉴 틈을 안주는것 같았어요. 
10,최고예요! 연기천재들! 
9,칸영화제에 갈만하다 연기력이 미쳤어 ㄷㄷ 
9,재미있게 보았습니다. 
8,한번보자~어떤지  재밋을려나~ 
8,감독의 노력이 보인다. 
10,이성민 연기 장난아님 볼만함니당 
6,재미있는 부분 춤씬밖에 없는 것 같고... 
10,좋았습니다. 연기 와  편집 
10,관람객 - 난 드라마 tvn만 본다 영화!! 죽인다라고 표현이 부족하다 그냥 멋지다 !!연기 연출 호흡이 적절하였다 연출이 영화속에 녹아들었다 이성민과 감독 그리고 연출에게 한표를 드린다. 
4,"킬링타임용, 지루한 감이 없지 않아 있다. "
9,아주 재미있지는 않지만 볼만하다 
8,그냥저냥볼만햇던영화 
8,기대안하고 봤는데 재밌어요. 
5,내용을 알면 재미있고 내용을 모르면 잠온다 영화자체가 잔잔해서 볼거리는 없지만 그 시대를 잘 반영한거 같다 나는 내용을 잘몰라서 잤다 
10,두번 보세요. 역시 믿고 보는 이성민 
10,이성민 연기 개지림!! 
10,재밌게 봤어요  나중에 또 보고싶음 이성민 연기력 쩔 
10,이 영화 정말 잘 만들었고 좌파우파로 안봤으면 좋겠습니다.  이성민 연기 황정민 연기 짱♡ 
9,굿 재미있었습닏ㆍ요ㅇㅇㅇ 
8,조금 전개가 지루한부분이 있었으나 전체적으로 재미있는 영화였습니다. 
9,20OOO 한국 영화 최고의 성취! 
10,어쨋거나 저쨋거나 잼익고 잘만든 첩보영화입니다 
9,믿고보는 배우..역시 입니다.^^ 
8,현실이해에도 도움이 될 괜찮은 영화같다 
10,너무 재미있게 봤어요~~^^ 
10,처음부터 끝까지 긴장감이 계속되는   올해 본 영화중 제일 재미있어요 
6,  ㅋㅋ 그냥저냥 아쉽 ㅎ ㅏㅐㅇ닁ㅌ 
8,재밌게 잘봤음.강아지 너무 귀여워서 아른거림 
5,계획에없이진지해졌던시간^^ 
6,댓글만 보면 자한당 알바들VS 문정부 찬양자 인데 오늘 보고 오겠음. 
6,이야기위주라중간에많이지겨웠다.스토리위주로 영화보려면 신기하겠지만...ㅠㅠ 
7,영화도 재밌고 배우들 연기도 좋았어요. 다만 정치 편향적인것을 조금만 자제했더라면 더 좋았을 듯. 
9,배우들 연기력 개꿀잼... 
8,몰입하며 재밋게 봣어뇨 
8,재미있고  새로운것울 알게돼서 좋아요 
6,기대한만큼은 아니었다 
8,생각보다재밋다별다른액션신은없지만 
8,잠시 졸았더니 북한한사람이 죽었어서 너무 안타까웠어요!다시 봐야하나????  암튼 깨었을때 부터는 넘 재밌게 잘 봤어여! 
10,목격자와 다른 이성민씨 연기 그리고 카리스마 존멋 
4,여자친구랑봐서 별10점주고는싶지만..영화장르가 로맨스인가요? 갑자기 뜬금포 브로맨스로 끝나서...멍... 
7,"정치가 어리석으면 국민에게는 생명이 위태롭다라는 말씀처럼, 어리석은 사람이 지도자가 되면 나라가 망하는 법입니다. 꼼수와 혼탕속에 결탁된 어둠이 악의 축으로 변질되지 않아 천만다행입니다. 픽션이라지만 논픽션에 가까운..."
6,그저그럼 그냥 볼만한 영화 
8,팩트와픽션을 조화롭게 만들었다. 다소 정치색이 있어 아쉽다 
6,정치색만아니면 꽤나 볼만했다. 이성민의 연기력을 제대로 입증한 영화 
6,중간에 잤습..니다. 지루한면이 없잖아 
8,약간 지루한느낌두있구  너무 앞서갔다해야하나 어디까지 현실인지 가상안지 좀... 
8,황정민의 연기는 다작으로 케릭터들이 너무 겹치네요 연기는 좋으신데 국제시장억약이 들려서 몰입이 안됐어요 이성민은 시상식에서 뵐수있을듯 인생작이십니다 
8,멸북통일최선봉 2소대 화이팅! 
4,OOO기 영화 영화관 런닝타임이 더 짜증을 유발하는영화  혹시나라도 보지마세요 제목부터 예측가능해서 그대로 끝납니다 해피엔딩 
10,진짜 재미있어요  긴장감 있게 잘 만들었음 
8,조금 지루한감이 없지않아 있네요. 
4,픽션과 사실의 구분을 명확히 짓지 않은 불편한 영화 
10,현대사 공부를 위해 꼭 봐야할 영화!!! 
10,총 쏘고 치고박고 싸우는 그런 액션씬을 단 1도 넣지 않고 오로지 말빨(일명 '구강액션)로 조져버리는 그런 영화!! 
8,감동 이었어요잼나게 봤어요~~~^^ 
8,감동 이었어요잼나게 봤어요~~~^^ 
8,강력한액션신보다는 감정선을 세밀하게 잘표현한영화 
10,진심 최고의 연기와 퀄리티 ...인간의 참 간사한 동물이야 
8,쟁배우들 연기가 ㅎㄷ ㄷ 합니다 잼있었습니다 
7,김성민 연기력 인정 ~ 주지훈은 뭔가 넘 어설픔~ 황정민씨 연기는 이제  뭔가 좀 식상함~  늘  비슷하다해야되나...연출도 걍  무던 ~ 내용 은근 가슴아프다는~ 
4,노잼 처음부터 끝까지 밋밋 
10,이게 북한 미화라고 지껄이는 것들은 영화도 안보고 좌표 찍고와서 별점 테러 날리는거 맞제? 김정일 묘사도 전형적인 독재자 빌런 클리셰에 평양 벗어나면 다 굶어죽어가고 대남도발 결정권도 다 김정일이 쥐고 있었다고 묘사...
10,최고..  여기 1점주는 틀딱및 일베 떼거지로 1점 주라는 지령떨어짐 
10,이게 전부 실화라니 너무나 놀라운 영화. 이성민 연기 감탄이지만 조진웅 연기 좀 어떻게 안될까.. 
10,오랜만에 재미있는 영화를 봤네요 ! 
10,이게 사실이란 말인가... 
8,1점짜린 알바단인듯..ㅎㅎ 
8,재밌게봤습니다^^^ 
8,재미있게 잘봤습니다. 
10,실화바탕이라 더 긴장하며봤고 배우들 연기도 너무 좋아서 몰입이잘됐다 
10,최고  뭐 더 할 말이 있겠는가.. 
10,재미있음~~~연기들 좋아요 
10,식상할것 같았는데 맛나게 잘 풀었음 
10,진정한 빨갱이는 누구인지 생각하게 만든다 
1,무엇을 위한 영화인가.... 
10,"이정도면 ""모스트원티드맨"" 과 비견할만한 첩보영화 "
8,"정치색이 있는 영화입니다. 사실과 허구의 구분이 명확하지않구요~평점이 별로라서 안보려했다가 봤는데,영화를 허구에 기반했다생각하고 정치색을 떠나 영화자체만본다면 볼만합니다. 몰입도도 있구요~재미있습니다 "
6,OO들 국정원은 북에 갈게 아니라 이인제한테 그돈들고 갔어야했음 그러 디제인 청와대 구경은 평생 못했음..  영화내용이 사실이라면.. 
6,아이들과 봤는데  중반부터는 앉아있기 너무너무 힘들어했어요~2시간까진 거뜬히 앉아있는 아이들이거든요 
10,이성민 만 보인다 이성민이 잘생겨보이긴처음 ㅋㅋ 
8,그저그래요 생각보다 크게 재밋지는 않은듯 
6,그냥볼만함 엄청 재미있자는않음 
6,내용이  썩~~~졸다 왔네요 
4,연기야 믿고 봤는데...제작 의도가 무엇인지... 
6,적당히 했어야지 너무 갔다 
2,노잼노잼노쟘노잼노잼 
4,연기는 좋았는데...무슨 
