score,review
10,영화를그냥 영화로봤음하는데 이상한사람들 많네요 그래서10점 8~9점사이영화 잼있네요 단 어디까지가 실화고 어디까지가 픽션인지 알고싶네요 
7,감독 스탭의 노력이 보인다. 배우들은 글쎄... 
10,북한이 친북김대중을 왜 대통령되기를 바라지않는지에 대한의구심을 억지설명할려는 연출ㅋㅋ그냥 우리는 역사적 사실로만 보자 친북정권이 들어설때 마다 북한이 어떻게 됐는지ㅋㅋㅋ 
6,"의미는 있지만, 표현은 아쉽다. 그나저나 댓글 보니까 ㅂ레들이 엄청 빼에엑 거리네. ㅋㅋ "
5,아는만큼 보인다?적어도 정치에 관해서는 믿는만큼 보이는거 아닌가요? 요즘같은 TMI가 난무하는 시대에는요 
10,"정치라는 요소를 배제한배우들의 연기는 별 10개를 받아마땅하다.다만, 정치적 요소에 대한 판단은 좌우 어느쪽의 선동에도 놀아나지 않는 본인만의 사리분별이 필요한 영화이다. 진실은 왜곡될 수 있으나 변하지않는다. 판단..."
8,'공동경비구역 JSA'와 비견되는 영화가 이제야 나타나다니 
8,잘만들었다.별 반개준것들은 국가에 쓸모없는 쓰레기 일베들. 
7,그냥 쏘쏘....?연기보는재미.말빨로 조지는 영화랄까 
5,아 완존 실망 연기력 그래 그럭저럭 이런 영화라면 어느 정도 액션이 들어가야 되는디 염병 액션은 찾아 볼수도 없고 글타고  긴박감도 없고 딱 백만정도 영화 글고 느낀건 역쉬나 울 대한민국 국민들이 개 돼지 새끼들이라...
7,"똥이있으면 똥파리가 꼬인다더니..그런걸 이용했다니....실제였다면, 리명운의 인격이 엄청나게 훌룽하기때문에 가능한이야기임 "
10,자칭 보수라는 집단의 민낯을 여실히 보여주다. 자신들의 권력 유지를 위해 북풍을 주문한 그들이 보수인가? 아니면 보수의 탈을 쓴 도둑들인가?? 
7,정소리인지 뭔지는 왜 자꾸 거슬리냐... 발음도 안좋은게 
8,볼만한듯 하네요  물론 집에서요 
8,좌파스럽지만 잘 만든 영화. 
5,어렵다어려워 이해하기 어렵다 
6,그런데로볼만함기대만큼은부족했지만 
6,무난 봤다는걸 곧 잊어버릴 거 같다. 
8,이성민 연기 잘하고 내용이 약간아쉬웠음 
7,그냥 저냥 무난한영화 수박겉햝기 
8,보통 나오는 격렬한 전투씬 같은기 없음에도 불구하고 연기가 너무 인상적이어서 기억에 남는 영화. 그중에서 개가 제일 귀엽더라 
10,효리 언니 나온다면 봐야겠다 오늘 보러갑니다 
6,남편은 잼있다고 하던데 전 조금 지루하더라구요.. 
7,재미있지는 않음.. 그냥.... 갓성민~~~ 주지훈 까불이 좋아 
4,배우들 연기 좋았어요. 나쁘지 않게 봤어요 
8,"무난하게 볼만했다 정치색을 띈다는 평은 주제상 그리고 내용상 피해갈 수 없는 평가같고, 애들 데려올거면 조용히 좀 시키세요 그리고 아주머니들 안방에서 보듯이 말하면서 보지마시고 전화 오면 나가서 받던가 끝나고 받으세..."
2,에레잇 ㅎㅎ그냥 알라부 황점ㅇ 
6,"영화가 상영중인 시점의 남북상황과 출연했던 배우들의 작품들이 흥행쌍끌이를 하고 있다는 거 외에는, 흥미롭지 못한 영화. 지루했다. 정치를 보여주려고 했던 것인지 개인의 감정교류를 보여주려 했던 것인지. "
6,‥‥.ㆍ.ㆍ.ㆍ.ㆍ 
6,이해하기 어려웟다...댜대ㅛㅐㅎ 
6,연기력이 좋았지만... 너무 지루했어요 
6,배우들 연기력은 지리긴하네 
6,생각보다 재미가 떨어져서 아쉽다.주지훈의 미소에 치임 
8,연기짱짱한 배우들!! 재밌었습니다~~ 
8,배우들이 연기는 잘하지만 스토리는 약간 진부했다 
8,들어보구 경험한이야기들이라 이해되는 줄거리들이지만 딸은 지루해했다 크게 중요시되는부분들이 많치않은것두있구  같은배우들이 세편에엥화에 동시에나오니까  신선감이나 기대감이 ㄷ좀 떨어져아쉬웠다 
10,정말 재미있게 보았어요...연기들 끝내주고  스토리 ...실화라 더 실감나요 
10,이성민이 제일 멋졌던 영화 공작.정말 명작입니다 
10,아주재미있게봤어요ㅋ 
10,최고 진짜 너무 감동적입니다그와중에 이효리 좀 웃김 
10,이성민 배우 다시봄...지림 
7,"생각보다 긴장감이 부족했던 첩보영화, 하지만 배우들의 연기는 볼만했다! "
10,배우들의 열연이 돋보인 영화. 과격하고 잔인한 장면 하나 없이 긴장감 있게 진행되어 더 좋았습니다 
10,감사하고 이런분들. 때문에 나라가 유지 
10,묵직함이 느껴지는 영화네요.이제 남북이 평화롭게 지냈으면해요.서로 감정과 돈과 군사력 소모하지 않고. 
6,역사 모르는 분 이라면 이해불가인 영화스파이 영화인데 스릴 하나도 없음내돈 돌여둬!!!’ㅜㅜ 
7,배우들의 연기는 좋았으나 다소 무겁고 두 주인공의 감성선에 집중되지 않았나 싶습니다. 
6,영화 자체로만 보면 좋지는  않았지만연기자들 연기가 좋습니다더 좋은 작품으로 만나뵙고 싶네요~~^^황정민씨 조진웅씨 이성민씨 팬입니당 
7,황정민의 주적 찾기가 재밌긴 했는데 대선 개입 할 때부터 지루해졌음 
6,중반 이후부터 긴장감 사라지면서 잠들었음 
6,새롭긴 한데애매한 느낌이네요 
8,이성민  연기 짱   좋아요 
8,내용도 좋고 연기도 좋고 팝콘도둑이었습니다 
10,재밋어요ㅎ재밋어요 ㅎㅎ 
10,최고입니다 올해 최고의 영화!! 
6,영화 재밌게 잘 봤습니다.새로운 사실을 알았네요.^^! 
10,sadsadsafcxqa 
7,모든 걸 내레이션과 대사로만 다 설명하자니 지친다. 
8,그럭저럭입니다..중간에 졸았다는ㅎ 
8,액쑌이 없어서 약간 실망쓰 
6,고등학생 딸아이와 함께 관람했네요. 
8,긴장감이 다소 떨어지는 연출. 아쉽네요 
9,"대체로 잘된 영화이나 기간,내용이 방대하여 영화아닌 드라마로 제작해야 더 잘  될 작품으로 보임. "
6,배우들의 연기는 좋았다 그것뿐이다 
8,배우 연기가 제일 좋았습니다. 내용은 중후반부터 전형적인 한국영화 스타일이 나와 진부하다는 느낌이 들었습니다. 
8,그냥그런내가피곤해서그런가 
8,기대보다는 좀아닌것같네요 그래도 재밌게 봤어요 
4,평점은 최대 왜 140자만 가능한가요??ㅠ 
2,이영화 공작처럼 여기댓글도 공작인가요 재미없음 
10,생각보다 지루했어요 연기는 좋았는데.. 
10,이러어어어어너어초ㅠ 허ㅜㅠ로ㅠㅍ포 
8,영화도 현실 정치를 따라갈수 밖에..전엔 이런 영화 1도 없었다.왜? 알면서 
10,정말 재밌게 봤습니다. 시나리오도 연기도 쵝오 !! 
10,이성민 마지막에 나타난거 보고 깜놀ㅋ 
8,남북은 하나요. 김정은 김정일. 
10,마지막장면이 감동~^^ 
8,기대한것보다 액션적이지 않지만 잔잔한 감동이 있는 영화 
10,난 재밌게봤다 그냥 영화는 영화로만 생각하는게 나을긋 
10,"흑금성 리명운 케미가 대박임.이 딱히 액션적인 부분은 없지만, 그게 또 매력인듯.  꽤 볼만한 영화. "
8,재밌었어요 시간도 금방 가는느낌이였습니다 
8,공작 배우들 연기최고네요!!!! 
10,너무 재밌어서 평남깁니다. 공작을 통해 우리나라의 정치색을 북한으로 가늠했던 시대를 되돌아 보았으며 한층더 넓은 시야를 가진것 같아 기분좋은 영화였습니다. 
8,마지막 뭔가 울컥했어요ㅠ 
8,이성민씨 연기짱!! 흑금성보다는 리명훈이 더 궁금해졌다..영화의 평점보단 배우 이성민의 연기평점에 10점을 주고 싶다! 
10,잼나요 ㅎㅎ 볼만하군요 
10,재미있게 봤습니다 이효리침투력 
10,잘 보고 왔습니다. 목요일 저녁인데도 분당 메가박스 꽉 찼더군요. 
10,스토리  연기 모두 좋아요~ 
8,"완벽한 연출 , 완벽한 배우의 연기. 하지만 오로지 '재미있다'라고 하기엔 부족했지만감동적이지만 미화된 영화 "
10,꾸르꾸르꿀잼!!구강액션 대박!! 
8,뭘그리들 복잡하게 생각들하슈. 
10,심야로 봤습니다 이성민 당신이 영화를 살렸다 
8,정치색은 확실히 있지만 연기가 너무 훌륭하고 나름 몰입해서 봤어요 
8,우익이 싫어합니다.... 
8,약간 지루한감이 있지만 배우들의 연기는 역시! 
8,한국판 팅커테일러솔져스파이 의 탄생 
10,썩어빠진 정치인들같으니라고 
8,"라인이 꽤 탄탄함, 배우들 연기도 괜찮고 "
10,간만에 진짜 재밌었음 ㄹㅇ 
10,이 2시간30분영화를보고 쉽고 재밌게 역사하나 알고갑니다 
10,최고의 영화하하하하ㅏ하하하ㅏ하하하하 
1,선동영화좀 그만찍어라. 지금이 1970년대냐?? 반공영화에 버금가는 선동이네 ㅋㅋ 
1,보다가 어이가 없어서 픽션이라고 하던가 아무리 감독이 정신이 나갔어도 포격을 해달라고 부탁을한다 ㅋㅋㅋ 황정민씨 조진웅씨 어떻게 이런 영화에 출연을 하실수가 있나요? 최소한 픽션이라고 언급이라도 했어야지 실제화면과 ...
1,
10,
8,네이버 알바는 여기서도 활동하는게 놀라울따름 ㅋ 
8,여태까지 봐온 첩보물들과 비교해서 같거나 또 다른데? 
7,재미보다 누구의 연기를 보는 작품이었다 
8,그냥 재미있게  봤어요. 
8,재미있습니다. 재미ㅇ 
8,긴장감은 너무 없다 . . . 
8,잘만든 스파이 영화다. 
4,황정민 배우를 좋아햐서 영화 봤어요 
7,연기력으로 2시간을 이끌어가는데 부족함이 없었다 
7,배우들 연기는 볼만합니다만.. 
7,남북분단과 정치적 사건을 소재로 한 한국형 첩보물의 새로운 진전 
10,재밌게 잘봤습니다^^ 
8,시대적인 아품이었다. 
10,실화를 바탕으로 한 영화들은 봐줘야한다 근데 좀 친정부적인 영화 같긴 하다 
10,답답한 영화 속상한영화 
10,정말로 감동적이다 이런결말 
10,"이성민...역쉬 멋쟁이~~^^이성민,황정민 올해 상복 터졌으면 좋겠습니다..^^ "
10,대존잼이다이게끼드라!!! 
10,감동도있고 재밋게 잘봤습니다. 
8,액션이 전혀 없어도 재미나게 본영화입니다. 
8,"스토리,실화,국내정치,푹풍,스파이 "
8,현실기반이라도 이런일은 영화이기만했으면? 
8,조았어요 뒤늦게 평점하요 
7,배우님들 연기는 좋았습니다 
8,연기도잘하고 괜찮네요 
10,재밌다 역시 믿고 보는 배우 황정민~! 
10,이 영화를 안 보면 진짜 후회항듯 
10,배우아니었음 안봤을건데 참 안타까움 연기가 
10,액션은 없는 긴장감.. 
6,그냥 그랫어요. 기대이하였던듯요 
6,영화가 생각보다 잔잔했다 
8,재밌어요 재밌어요 볼만해요 
8,이성민나이스~~~~ 
10,ㅋㅋ신선했고 무난하게 봤던 영화 
10,"한국영화에서 스파이 브릿지 같은 명화가 나올수있구나 . 좌편향이라는 불편한 정치적해석은 차치하고, 영화 후반부, 리명운과 흑금성이 남북을 관통하는 동일한 신념을 확인하고 서로의 입장을 이해하게 되는 장면은 전율을 흐..."
10,대단했습니다..그리고 대단하십니다... 하 
6,이 영화가 정말 사실이라면 남북은 더 이상 민족이 아닌 이해관계에 따라 움직이는 이해 국가임이 틀림없다. 
8,"날라댕기는 공작원은 없지만, 대화와 서류로 풀어가는 공작원을 현실감 있게 그린거같아 좋다.인물간 대립의 묘사가 조금더 어두웠다면 더 좋았을거같다 "
7,영화로만 봤을땐 뭔가 개연성이 약간 부족하지 않나 싶은데 나름 재밌게 봄. 
8,나쁘지 않았습니다 이성민씨의 연기가 특히 인상이 싶네요 소재는 약간 진부했더래도 배우들이 잘 살린 것 같습니다 
10,북한의실상을잘묘사함 
10,올해 최고의 영화 잘봤습니다 
10,정치색을 떠나서 근 10년 내의 대단한 작품 
10,영화가 진실인지는 사실 알수없다. 하지만 이런 음모론이 있었던것 또한 사실. 영화 자체는 잘 만들어졌다. 평점보고 별기대없이 봤는데 상당한 수작인듯. 평점 테러가 많아서 별 두개 추가한다. 
10,재밌습니다 두번보세요 
10,이게 실화임 같은 ㅣ민족임 
1,왜0점은안되냐 이런빨갱이영화 
1,현재 상황을 고려한다면 이따위 소설 영화를 만들면 안됐다 감독은 
10,누군가는 불편해할 영화 
10,너무 재밌게 잘 봤습니다. 
1,이효리 주름 보소 10자10자 
2,선동영화.다만 정치적인 색 배제하고는 나쁘지않은영화라 2점줍니다.본격 개돼지 사육 영화 
6,김대중 = 전두환 same mistake 
9,달을 보라는데 손가락만 보고 1점 준 사람은 머냐정치 빼고라도 쫄깃하게 만드는 연기력 갑 
10,이런 명작이 간간히 터져줘야 한국영화가 살죠 
10,역시나 생각 했던것들을 다시 한번 일깨워줬던 가슴 아프게 본 영화! 
6,내용이 뻔하지만 연기들이 다 살렸네요 끝까지 보지 못했네요 
10,"대박,,흑금성 줄타기 성공했으나,,안정된 사회가 절시히 필요할뿐,,선진국처럼 무직연금, 병원비 무료 약값전액유료,,,사회안전망. "
10,연평도 포격 사건 천안함사건은  한나라당 지금의 자유한국당 과  이명박을 철저히 재 조사 해야한다 
10,"단순한 영화로만 보여지지 않은, 기대 이상의 영화 "
8,주지훈이 클럽춤출때 관객 다 폭소ㅋㅋㅋ간만에 웃었네요 짱짱b 
10,최고예요 감동적이에요 
6,왜 그렇게흥행했는지 이유를 잘.... 
10,팩트는 있다..물론 작가의 상상력도 있다.. 
10,잘봤습니다. 혹시 다시 벽이 없어지는 날이 오면.. 어떤 감정을 느낄까.. 잠시 생각해볼수 있는 영화였습니다.. 그리고 .. 다시는 한나x당 인간들이 당선되는 일이 없었으면 하는 생각도 들었습니다 .좋은 영화 감사합...
6,남북간 희대의 뻘 짓 첩보물 잘 봤다 
10,감명깊게 보았습니다! 
10,이게실화라니...ㅜㅜ 연기실력 진짜 최강 다 진짜 실존인물들 같았다 
10,10점 영화는 아니지만 영화의 재미보다 평점이 낮은거 같아 10점흥미진진합니다 
10,경상도 통베충 쓰래기들만 불편한 영화 ㅋㅋ 경상도는 대한민국 아니니까 제발 분리하자^^ 
10,조폭 검사 나오는 영화보다 휠씬 재미만 있더만 그리고 픽션이라고 영화 초반에 나오는데 눈들 멀었냐?? 나라걱정?? 웃음만 나오네ㅋㅋㅋ 
9,구성이 좋고 연출좋고 연기가 좋은 영화다.영화의 완벽성 보다도 과거에 대한 성찰과 미래에 대해 잘 제시한 멋진 작품이라고 본다.  이영화를 만들어준 윤종빈감독에게 고마움을 전한다.용서받지 못한자의 윤종빈^^ 
10,꿀잼이여요~~~추천추천 
10,자꾸 생각나는 이성민연기 굿굿 
9,베댓들이 어이가 없어서 평점담 1점짜리는 절대아니고 근래 한국영화 폭망중에 건질만한건 이것밖에 없구만 무슨 정치색이고 나발이고 아예 정치색이 없다고 보긴 힘들어도 당시에 실제로 총풍사건이랑 연관되있는 사건이었는데 ㅡ...
10,북풍은 다 돈이지. 꽁짜가 어딨어? 
10,"진짜 오진다. 등장인물 벨런스, 흐름 다 좋네 "
10,전 너무 잘봤습니다. 긴강가도 좋고 연기도 좋고 
10,지금은 평화로운 시대라 다행이다 ㅎㅎ 
10,대바바바ㅏ빠ㅏ빠ㅏㄱ너무재민 
8,재미있게 관람했습니다. 
10,간만에 집중해서 보게되었습니다. 
8,긴장감 ㆍ ㆍ ㆍ 연기력 ㆍ ㆍ ㆍ 
10,마지막 서로 선물준거 보여주는 장면 지렸음 
6,기대보다 아쉬운 전개. 요즘 한국 영화는 내용보다  캐스팅과 마케팅에만 힘을 주는것 같아 아쉽다. 
10,그냥 딱 한마디로 정리. 웰메이드 
9,"잘 만든 영화, 무엇보다 모든것이 실화라는... 자유매국당 놈들 때문에 10년을 또 허비했다. "
10,깜-짝 놀란 연기와 현실감 넘치는 플롯구성이 매력적인 한국형 서스펜스 첩보물 
10,진짜 너무 재미있네요 ㅜㅜㅠ 
10,좌편향 미화 영화. 씨부리는 분들 그당시 정권에서 흑금성은  어덯게 설명하시려고 그러시나요 
10,"긴장감, 배우들의 연기 그리고 스토리 까지~~완벽하다!! "
10,아는만큼 보인다 .. . 
10,완전 재미있었음.!! 
8,Scene 1) 리차장이 잡혀가기전 가족 바라보며 복잡미묘한 감정으로 지었던 미소 / Scene 2)  리차장이 말없이 선물 받았던 롤랙스를 보여주고 흑금성은 그 답례로 받았던 넥타이핀을 보여주던 엔딩장면 
10,배우들 연기력 최고구요~ 좌편향 우편향 따질것도 없고 그냥 무지한 국민들에게 팩트를 알려준 영화라 인상깊네요.... 
10,연기력이과 스토리까지 생각보다 너무 재미있었다 
10,이성민 배우님 연기 좋네여 ㅎ 
10,재밌게봤어요..화이팅 
1,아니 공산당이 싫다는데 반대하는애들은 뭐냐진짜 북괴군이 이걸 보고있나봐!!!!잡았다 괴례군!!!! 
7,터미네이터 개발해서 다 싹다 쓸어버리고 싶다 ㅋㅋ개판오분전 조선 
10,정치색 정치색 그놈의 정치색. 니들이 정치해라. 
10,배우들 연기가 돋보였습니다 
10,각본과 연출 그리고 연기 다 좋았습니다. 
10,조국을 위해 나를 희생하는 것은 쉽다 하지만 가족을 희생할 수 있을지 생각하게되엇다. 
7,"좋은영화, 이런 영화가 계속 나와야한다, 첩보물이라고 007 아류만 만드는 국내 첩보물과는 다르다 "
8,ㅈ박이가또...ㅋㅋㅋㅋ 
10,"대박입니다 황정민에 푹 빠졌고, 정말 이런일이 일어난 사실에 대해서 놀랍네요. 지금도 어디선가 일어나고 있지 않을까 두렵네요 "
10,쥐색히 정권으로 넘어가면서 기가막히게 보복을 당했구나.. 정말 이런 나라에서 국가를 위해 희생한자의 최후가 어떤건지를 보여줌. 그나저나 하다하다 이제 영화 평점까지 좌표찍어서 일베충들 댓글 알바들 몰려왔네 ㅋㅋ 정말...
10,그렇다고 보수 영화 중에 잘만든 영화는 없음 
10,잘 봤어요 생각보다 무거운 주제네요 재밌게 봤어요! 
6,기대했던 것보다는.... 별로 였던거같아요 ㅜㅜ 너무 기대를 해서인지.. 
10,뉴스공장에서 박채서님 인터뷰 듣고 너무 재미있어서 감상했습니다.  황정민님 보고 사실 간거였는데 그도 그렇지만 이성민님 연기가 너무 좋았어요. 
8,그알다시 보고 이거보고 으앙 
10,#호연지기~~#로렉스짜퉁#넥타이핀 
10,짱재밋어요!!!대박이야 
10,굳 굳~.~>~>~>~>~>~> 
8,"역사성을 가지고 보기엔 좋은 영화, 재미를 기대하고 보기엔 아쉬운 영화 "
9,지루했지만 보게된걸 다행이라 생각했던 영화 
8,매우 재밋게 보았습니다 ~ 
10,두 배우의 연기가 영화 마지막까지 웃으며 보게 만들었다 
10,진짜 미쳤다 연기로 사람을 이렇게 감정을 만들어낸다는게... 
10,연기력이 장난 아닙니다! 
10,그렇게 재밌지도 안재밌지도 않은.. 준수한영화 
6,애매하게만한 영화ㅅㅇ 
7,너무 한쪽으로 쏠렸다.. 
8,조진웅 연기 넘 못함.... 
6,지루하긴하지만 내용은 있어서 
8,연기는 뭐 말할것 없는 배우들이라 좋았습니다. 하지만 정치색이 너무나 뚜렷하고 설령 그 내용이 사실이라 하더라도 수동적으로 받아들이는 관객의 입장에서 매우 사상적으로 위험한 영화라 할 수 있겠습니다. 
7,무슨 메세지를 전달하려는 건지 잘 모르겠음 
8,음...  재미있는데  뭔가 아쉬운... 
8,탄탄한 연기와 스토리 몰입도 있엇습니다 
4,후반부분이 긴장감없었다 
4,"보통 영화는 두 세번 보는 편인데, 이 영화는 한번이면 되겠네요. 연기자들 연기가 최고였습니다. 그것만 생각할게요. "
8,뭔지 뭉클했다. 잘만든 영화 
3,지루지루 하네요  조금 자다 나왔어요 
3,졸립고 클라이막스도 없고 그닥그닥ㅜㅜ 
10,난좋았다..연기.. 
6,많은 생각이 들었네요.  영화는 괜찮게 봤어요. 그런데 정치 공부를 해야겠다는 생각이 들더군요. 한쪽이 기다 아니다를 따져야만 할 것 처럼 만드는 영화였고 다만 이 영화하나로 그것을 판단하기에 매우 부족하였기 때문입...
8,괜찮았습니다 추천해용 
8,많은걸 생각해보게 하는 영화  이성민 배우 연기 진짜 최고 
10,너무 연기를 잘해서 빡친다 
8,이성민연기에 박수를ㅋㅋㅋ 
10,"일베, 박사모틀닥들 여기서  회식하냐?ㅋㅋㅋ "
9,"꽤 재미있게 잘 봤음.  몇몇 CG에서 옥의티가 있어 별 반개 감점이지만, 영화 자체는 재미있었음. "
8,평때문에 걱정했는데 재밌었음. 강추.이성민? 배우 마지막엔 잘생겨보이더라;; 엄마아빠보여드릴거임ㅎ 
10,실제로 일어난 일 주제로 만들어진 영화인데다들 연기 너무 잘하셨고 내용에 화가 났음 
7,재미는있지만 몇몇연기가아쉽네 
6,너무 길어 .. 조금 편집이 부족 나름 만족 
10,cwcgfdvvgffc 
8,최근 나온 한국영화중 베스트 
8,마지막 서로 선물한 시계랑 타이핀 보여주는 장면 나만 울컥했냐 
6,영화보다가 졸린적은 처음.... 
7,내용이너무쉽고평범한작품으로간주됨 
10,묵직한 주제속에 남과북이 처했던 1997년까지의 현실을 잘 다루고있다 하지만 감정적 호소는 별로다 우리는 북한을 보는 입장이 좀더 냉정해져야 한다 그리고 안기부 니들은 끝났다 이 오래묵고 철지난 왕권주의자들아 
10,옆자리에서 팝콘 먹는소리 냄새  넘 싫었어요개인적인 사정이지만   불편했어요~영화는 믾은 생각을 하게 만드네요연기자분들 최고입니다! 
9,그냥재밌습니다 연기력들이 진짜...;;픽션이 있을지언정 잘만든 수작입니다 
10,꿀잼입니다! 연기력 갑 
6,재밌는 점 1. 이효리 : 내가 언니네?2. ??3. ??그냥 그저 그랬던 영화... 사실 기반이라는데정말인지 아닍는 모르겠다 
1,황정민때문에 봤는데 후회함 
6,"정치색을 떠나서 사실을 바탕으로 한건지는 잘 모르겠으나, 저게 진짜 있었던 일이라면이라는 생각이 들었습니다.진짜 궁금한게 이성민이랑 그 유부장인가 북한 옹호하는 발언은 한적이 없는거 같은데, 소설 쓰지마요. 보수. ..."
6,ㅋㅋㅋ뭐 그냥...흥행할정도의 클라스는 아니였던걸로... 
6,먼가 조용하니 생각했던 느낌인데 조금 지루했다 
10,생각보다 재미있습니다_~~ 
2,영화내용보다 댓글이 드럽다 
2,이번년도에 본영화중 제일재미없엇다 
6,초중반은 괜찮은데 후반으로 갈수록 영... 
6,저는 그냥 무슨 브로맨스 영화보는 기분이였듬. 
8,생각보다는 흐름이 닮은 곳이 많은듯. 
4,재밋드아아아리리아아아 
8,재미있게  잘 봤습니다.추천 
8,재미있네요.역쉬~~~~ 
10,정말 재미있고 잘 만든 영화네요! 
9,기존의 영화와 레벨이 다른 영화다 돈값하는 영화 추천 한빵 
10,이성민 연기 쩝니다!! 액션이 없어도 스토리와 연기력으로 끌고가는영화 최곱니다!! 
1,진짜 돈 아까웠음... 
6,역동적인 액션 없음. 중간 웃음 포인트 없음 정치색 인정 북한 미화 인정 연기 인정 ㄹㅇ 인정 픽션은 픽션으로 팩트는 팩트로만 
6,어디까지가 진짜고 거짓인지 ... 이해가 잘 안되는 영화였음 
9,액션없이도 긴장을 놓을 수 없었던 영화.중간에 깨알 귀여움과 웃음도 있네요.추천합니다:-) 
10,"보는내내,북한과남북은정녕남남이여야하나~이효리하고북한사람남북찍는장면,좀찡했네요. "
10,꼭 알아야하는 꼭 봐야하는 영화눈물이나는 슬픈 현실먹먹하디 
6,꾸르잼안꾸르잼딸기잼 
10,"마음 아픈역사이지만, 지금 현재 분위기가 좋아 통일이 기대됩니다~배우들 하나하나 모두 연기가 극에 달해서 지루함 없이 잘봤습니다^^ "
10,"이정도 댓글 알바의 공작속에서 평점8점을 유지한다는 것은 20점짜리 영화라는 것이겠지요. 2,3번 봐도 아깝지 않은 영화입니다. "
7,"한번쯤 있을법한 액션이 전혀 없지만, 등장인물간의 관계에서 벌어지는 사건들과 배우들의 연기가 영화에 몰입하게 만듭니다. 북한을 지나치게  미화한부분도 없지 않아 있습니다만,  영화를 선동이라 하는건 잘못됐네요. 관련..."
10,재밌던데..ㅋ빠들 너무 발끈하넹ㅋ 
10,말없이 표정으로 극도의 긴장감 연출. 
10,동시대를 산 1 인으로  과하게 감정 이입이 되었는지 영화 보는 내내 엄청난 눈물을 쏟다.. 
8,"중학생 아들과 같이 관람했습니다. 결론적으로 저는 재미있게 봤습니다만, 이 시기를 겪지 못한 젊은 세대에게 여기 난무하는 악평들을 영화보며 날려 버릴 만큼 재미있게 만들었느냐의 관점에서는 조금 아쉬웠습니다. 그래서 ..."
