score,review
7,설경구는 이제 아무 영화나 다 하는것 같고 임시완은 변호인들 이후 선구안이 정말 별로인듯...경찰도 조직도 임시완을 이용하는 장치만 신선했다 
7, '착한 사람과 나쁜 사람 = 상처받지 않은 사람과 상처받은 사람' 이라는 등식으로 굴러가는 불한당들의 세상 
9,배우들 연기도  좋고 촬영 기법도  보는 재미가 있음. 이야기도 긴장감 있게 볼 수 있도록 되어 있다. 
10,연출 색감 미쟝센 캐릭터 감정선 모두 좋다 
8,재밌는데요 저는 평점이 너무 안좋네요잘 봤습니다 
7,"모두 연기 좋고 연출도 좋았다. 카메라 앵글도 좋고 잘 만드는 감독인데, 많이 본 줄거리를 짬뽕도 잘했다. 많이 꼬아놓은건 그런대로 먹을만 했다. 오히려 후반부의 늘어지는 연출과 막가파식의 내용은 주인공의 고뇌를 표..."
10,현수야 재호야... 내가 너희를 어떻게 놓냐 
10,내가 좋아하는 장르라 너무 재밌게 잘봤는데.. 다른분들은 재미없었나; 관객수는 100만에 못미쳤더라구요... 
10,몇번째 보는지 모르겠네 
5,미쟝센이 좋아요. 잘 빠진 학부생 작품처럼 생각나는대로 자유롭게 여러가지로 시도하려는 느낌도 좋았습니다. 실험적인 부분들이 많아서 좋게 봤어요. 그런데 대사가 너무 유치하고 플롯이 엉성한건 단점이네요 
10,변성현은 영화의 신이다 
8,"여러가지로 괜찮은데, 임시완같이 마른 사람이 덩치들을 때려눕히는 설정은 좀 안했으면. 최소 설경구 체격이거나, 아니면 말라도 예전 비트 때 정우성같이 키라도 크던가. 몰입이 잘 안되요~ "
10,"느와르, 로맨스, 설경구와 임시완, 김희원의 재발견 "
10,구우우우유우우우우웃 
10,평점이 호불호네....난 나름 재미있게 봤는데 
10,안보려다 보았는데 재미있네요 
8,영화 괜찮다 볼만함... 
10,쓰네기들이 머라하든 잘 만들었네.... 
10,영화가 감독을 잘못 만남 
8,연출도 나쁘지 않고만... 관람후기 보니 감독이 다른 문제가 있나본데... 영화는 볼만했다. 애들은 안봤으면 하는 거 빼곤... 
8,감독만 아니었어도 터졌을 영화ㅠㅠ 
10,극장에서 보고 vod다운받아서 5번 넘게 또 봤어요 
10,임시완 연기 . 솔직히 좀 놀랏음 넘 잘해서 .. 
9,재미만 있구만..이거 진짜 알바들이 많은가보네..ㅎ 
10,1점들이 왜 이렇게 많은진 모르겠지만 영화는 재밌게 잘봤습니다 
10,재미는 있는데 다보고나니 울적하다. 
10,"다른 프리즌,내부자들,더킹 같은 뻔한 영화 아니고 진짜 영화 내용보면 여혐을 했었다면 천인숙같은 캐릭터 못 나옵니다. 그리고 감독 욕하는 새끼들 당원님들이 명패사시킬듯^^ "
7,시간 때우기 좋은 영화임. 시나리오가 복잡해 인물들끼리의 관계 설정정하는데 쉽지 않음 
7,설경구 웃음소리만 기억에 남는다. 
8,그런데 불한당 첫부분에 임시완 출소 장면 오션스 일레븐 마지막 장면이랑 너무 비슷하다 ㅋ 
8,"영화 평점하는곳인데...왜 감독을 평점하고들계신가요 ..안타깝네요...대한민국..불한당"" 잘~ 봤어요""설경구 극중 특유의웃음.. 캐릭분석도좋고""걸경구.임시완 캐미는 좀 떨어지는듯했는데..워낙 내..."
8,감독이 말아먹어서 그렇지 영화로만 봤을때 시간때우기용정도인듯 그냥저냥 볼만함 
7,신세계 프리즌 의 줄기를 반반 가져오긴했는데 배우들 연기 때문에 더 높게 평점을 
7,그냥7점그럭저럭 볼만 
7,신세계 다른버젼이라고 생각하면됨 
7,뻔한스토리 알면서 열심히 봤는데..내 사랑 엠은 잠들었더ㅠㅠ 
4,믿고 보는배우연기 역시 탁월하지만 ....보여주고 싶은게 많은 초보감독님이신것 같아요..다음에 더 나아지겠죠^^; 
1,또라이 감독 때문에 망한 영화라죠...?   극장에서 안보길 정말 다행.... 
4,그럭저럭 나름 약간 애매하게 잼 없음 
1,평점이 딱 감독수준이네요 
1,영화최악...으으으 
1,인성이 영화를 말하는거 같음 
1,앞으로 이 감독 영화는 절대 안볼거임 
1,감독 수준이 쓰레기 보는게 시간 낭비 
1,팝콘이 맛있었음~~~ 
1,이런놈은 돈벌면 안 됨!!! 
1,별 한개도 아까움 일베감독out 
1,감독 수준이... 출연진을 확인하고 볼까했었는데... 
4,감독이 미드 굉장히 좋아하나봄. 근데 중2병도 있음. 거기에 트인낭기질까지..ㅋㅋㅋㅋ  1점 주려다 배우들때매 3점 더 줌. 
1,멍쩡한 정신으로 세상 사시길 
1,1점도 많은데 0점은 왜 없냐 
1,감독이 어마어마하다며ㅋㅋ 임시완은 진짜 좋아하지만 감독때문에 안볼생각이야ㅋㅋㅋ 
1,감독이고 나발이고 노잼.... 
1, 감독에게 고함. 트윗사건과 별개로 이따위로 만들면 망함. 나중에 트윗탓할까 그게걱정이다..제발 영화만들지마라...트윗이 문제가 아니다.. 
1,이해할수없는 정신세계를 가진 감독의 머리에서 나온 영화가. 과연  관객의 마음을 움직일수 있을까요? 안봐도 뻔할듯.... 
5,감독 인성과 별개로 영화자체도 잘만든 건 아님. 킬링타임으론 좋지만 
1,그냥 별로123333413 
1,감독님 멀리 안나갑니다. 안녕히가세요~ 
4,"평식이형 말처럼 우중충한 80년대 3류 영화 , 킬링타임도 아깝다. "
1,반별도 아깝다안 본 눈 사고 싶다대사의 질이 낮더니 이유가 있었다아까운 내 포인트!!배우들은 알고도 출연했을까.... 
1,",.,.,.,.,. "
1,임시완 연기에 1점 드립니다 
1,왜 0점은 없는것인가???? 
1,잼없음 잼없음 잼없음 잼없음 
1,영화감독정도면 자신의 소신과 예술에 대한 주관이 당연히 있을수 있다. 하지만 그게 보편다수에게 불쾌감을 일으킬 일베수준이라면 그건 솔직함과 소신이 아니라 망발이다. 감독 반성해라. 
1,"사상이 불순한 감독의 이런 작품이 팔리면 안된다고 생각합니다.영화가 곧 감독이 보여주고 싶은 작품인데,홍어라니... "
1,트위터  보고 왔는데  감독님이 이상해요 
1,물타기인줄알았는데 진짜트윗글보고 식겁했네요-_-어떻게 감독이란사람이 그런생각을하고있는지근래의최악의감독인듯 배우들한테사과하세요 
1,별반개도 아깝다  쓰레기중에 쓰레기 
1,불한당은 멀리있는게 아니네 
1,지 영화을 지가 디스.. 
1,개잼잇다 보는내내잤다 
1,안본다... 그만하고 내려라... 정신 좀 차려야지 쯧쯧 
1,트위터 보니까 감독 정신세계가 독특하시네요. 홍어라는 단어가 나오는거 보니까 일베하시는듯? 
1,"아무 생각없이 썼다는데, 아무 생각없이 뱉은 말이 그사람의 본심이고 인성이다. "
1,에이 이거 터지기전에 봤는데 환불받고 싶음사과문 쓴거보니 빼박 진짜네감독은 또 문빠니 어쩌니 욕하고 있겠네?그동안 생각없이 그랬쪄요? 트윗날리던거 보니 인성보이던데 일베좀 하셨나봐요~~ 
1,제 점수는요?10자제한 
1,아이고 감독님.... 
1,일베감독이 만든 영화는 망해야 제맛 
1,이런영화 빨리 사라지길 
1,박평식 형이 4점 줬다. 그럼 안봐도 되는거다. 
1,할말이 없습니다...할말이 없습니다...할말이 없습니다... 
1,트위터에 대체 왜 그런말씀들을 하신건가요 아 ..ㅡㅡ 
1,뻔히보이는 스토리라인 지루한전개.. 
1,4과문 잘 봤습니다. 제 평점도 잘받으시길 
1,;ㅅ; 문제가 심각한 사람은 당해봐야함 
1,배우 스텝 노력해서 찍은 작품에 연출은 숟가락만 들면 되는걸 키보드를 들다가 망하네.  에휴. 배우 스텝들한테도 꼭 사과하세요. 아 그런 태도의 사과라면 하나마나 겠지만. 
1,감독.... 긴말 안하겠습니다^^ 
1,베충 베충 베충 베충 베충 베충 비충 
1,진짜 별로네요 ㄷㄷㄷㄷ 
1,이거 재밌다고 한 강냉이들 그렇게 살지마라... 엉아는 순진해서 속아서 봤지만 그러는거 아니다...ㅋㅋ 
1,감독 임성 참!! 일베 끊어라 
1,감독 인성 대박 ㅋㅋ트위터 순기능인가 와~~~~살다 살다 내 주변에는 이런 양반 없으면 좋겠다 
1,응 일베영화 일베는 진짜 사회에서 사라져라 
1,10점은 왜이리 많아? 감독 수준 
2,"영화가 무엇을 나타내려 했는지, 무엇을 말할려고 했는지도 모르겠다는 느낌을 받았다. "
1,감독 사과해도 망했음 ㅡ그런정신상태로 영화만든것보면 뻔하다 ㅡ 
1,감독 정신이 반영됐을테니 내 정신을 더럽힐 순 없지 
1,신세계 짝퉁 느낌~ 감독 수준은 말로도 못해요 ㅠ 
1,돈 + 시간 +극장까지 가는 에너지 낭비 
2,밋밋한 영화. 별 느낌 없음 
1,ㅉㅉㅉ 뭘 알고 지껄여라 지역감정을 만든게 누군데 그따위 소리를 하냐 
1,별한개도 아깝다 감독 인성 일베충 매국노나 다름없음 
1,굳이 내 돈내고 안봐도 뻔할듯합니다. 
1,"변성현씨, 퍼거슨에게 1승 헌납하셨네요. "
1,이런 생각 가진 감독이 만든 영화라면 안봐도 빤하겠다. 
1,뭐 이런 영화가... ㅡㅡ 
1,시간 너무너무너무너무 아깝네 진짜이 영화를 극장가서 본 건 2017년 내가 한 행동 중 최대 실수다 ㅜㅜ 
1,재미없네요. 아뮤 사심없이 봐도 재미없는데 감독님 생각이 나니까 더 재미없습니다. 
1,...전혀 기대되지 않네요 
1,영화가 보고난 후 남는게 하나도 없더니오늘 감독이란 놈이 어떤 놈인지 알게 되었다.그런놈이 잘 만들 리가 있나... 
1,재미없어 너무 재미없어 이런거 그만 만들때도 되지 않아ㅛ나 
1,한번 션하게 말아먹고 평생교훈으로 삼아라 
1,영화 스토리도 뻔하고 설경구의 너무나 진부한 연기..;; 
1,오늘 조조보구 왔다. 신세계는 대작이요 명작이다.. 와 조조가 아깝기는 처음이었다. 
1,최고네 최고야 10자 ㅡㅡ 
1,별 반개도 아깝다 이런 감독이 만들었으니 영화라고 뭐 다를까 싶다 
1,1점도 아까움  마이너스 줘야한다 
1,1점도 아깝다 감독아불한당같은X 
1,이게 영화냐이게 영화냐 
1,감독이 그 모양인데 영화가 좋을리가요 
1,재미없음 출연한 배우들이 불쌍하네 
1,감독이 큰일했네 ㅋㅋㅋ 
1,"이건 진퉁쓰레기. 쓰레기, 쓰레기, 쓰, 쓰, 쓰레, 쓰레기. 인천상륙작전 따위 가볍게 상회하는 폐기물, 폐기물, 핵, 핵, 핵폐기, 핵폐기물. "
1,감독의 실체를 안 이상 보기 거북합니다. 안볼랍니다. 
10,아무런 정보없이 본 영환데 재밌네요 
10,진짜 기대 하나도 안하고 봤는데 느와르물의 정석을 본 듯 하다 
10,간만에 정말 볼만한 청불 범죄 액션 영화였다 
10,처음부터 끝까지 계속해서 긴장하고 봄ㅋㅋ 오랜만에 마음에 드는 영화가 나왔다 
10,이 정도의 퀄리티면 돈과 시간이 아깝지 않지ㅋㅋ 
7,임시완의 재발견 아수라랑 차이점을 별로 못느낌 
10,무개념 감독 하나땜에 수많은 배우들과 스탭들의 노고의 결실이 무너지는 게 참 안타깝네요 임시완 설경구 연기는 정말 최고였습니다 
9,쓰레기 감독 손에서 만들어진 너무 잘난 영화 
10,최고...뒤늦게 본 것이 후회되네요 
10,딱히 진부한 클리셰....라는 생각은 안 든다 오랜만에 감정이입하면서 느와르 영화 봐서 재밌었음 
10,일단보세요! 재밌습니다! 절대 뻔하지않은 스토리와 단단한 짜임. 설경구가 이렇게 섹시하다니 
10,처음 보고 바로 10번 돌려봤다. 임시완과 설경구의 연기와 감정선이 그냥... 미쳤음 ㅠㅠㅠㅠ 
8,"왜소해 보여서 거슬리기는 하나 투샷이 드물어 괜찮았고, 소재는 식상하나 편집으로 볼만하게 꾸몄다. "
8,"감독의 잘못만 없었어도 대박 흥행했을텐데.신선한 플롯,미장센이 풍기는 분위기,느와르 영화로 참 볼만했음,한마디로 꿀잼 덜덜 "
8,일단 영화는 잼나네요 감독 문젠 쩝. 
10,재밌는데 관객수 안습이네요 
8,김희원 개불쌍하다 ... 
10,엔딩 크레딧 다 올라가면 한동안 생각나는 영화 
10,너무 재밌게 봤어요변성현감독 작품들 다 찾아봐야겠어요~!!!배우들 연기와 연출력 분위기에 홀릭♡ 
10,"재호 현수 병갑 때문에 가슴아프고, 천팀장 정말 밉지만 매력있고 묵묵히 제역할 하시는 문지윤배우님도 인상적이고 어느하나 버릴것 없는 영화. 극장에서 못봤어요. 재상영, gv꼭 다시 해주세요!!! "
8,변성현 어렸을때 아역배우 였었는데감독이되었구나누군가했네 
8,기대 이상이었습니다. 
10,초반에는 망작 느낌이였는데 후반부로 갈수록 명작이 되었다... 
10,최소 7점 이상은 하는 영화다. 연출이 약간 부족해도 구성이 매끄럽고 배우들의 캐릭터가 계속 떠오를 정도로 연기력이 좋다. 
8,"감독이 주둥이만 관리 잘 했어도,, 영화는 너무 좋은데 감독 사상이 참 거지같네 "
10,".,.,.,.,.,., "
6,부분 부분 필요하지않은 여성의 성적노출이 있어서 읭 스러웠웠습니다. 근데 여기 후기들을 보니 왜 그런 장면들이 있었는지 알겠네요...알기전까진 좋은 영화였다고 생각했습니다. 배우들의 연기력을 봐서  5점 합니다 
8,영화는 괜찮다만 이상한점이있는데 제가 이해못하는건가 싶긴한데.. 한재호가 임시완 엄마 죽이고 시체를 확인하는데 애초에 그때는 한재호가 깜빵에 있지않나요? 
10,영화 진짜 재밌어요ㅠㅠ극장에서 못본 게 너무 후회되요ㅠㅠ 
8,재호야 너 지금 누굴 말리는거야? 
8,잘만든작품 허준호씨 무캘럭티로 등장하고 설경구 임시완 연기도 좋았다 김희원도 개성있고 다만 마지막 전개가 아쉬운 나머진 한국조폭영화 특유의 잔흑한 장면없고 깔끔하고 잘 정돈된 영화 
10,감독이 저짓만 안했어도ㅉㅉ 
10,말이 필요없다 최고의 조합이다 
8,코믹하면서도 액션부분이좋네요 
10,스크린 재개봉 원해요ㅠㅠ 
8,감독인성이고 뭐고 난 그런거 모르겠고 일단영화만 봤는데설경구 임시완 연기너무 멋지고 생각보다 영화 재밌었는데여자 팀장역 멋있는척 오바하는 연기때문에 정말 보다가 짜치고 보다가 짜치고.. 조화는 안되고 혼자 이상한연기...
8,먼가 이상하게 어색한 느낌~~ 
10,"진짜 평점 못믿겠다;; 재밌음 한국 느와르 치고는, 생각지도 못한결말에 긴장감과 몰입감도 좋았습니다. 느와르영화나 액션영화좋아한다면 이것또한 추천합니다 "
10,초반의 행복한 모습을 보고 싶어서 다시 보면 엔딩 때문에 다시 먹먹해지는데 이런 과정을 반복하게 만드는 영화! 
10,재밌게 봤습니다. 배우님들 연기잘하시네요 
10,진짜 존잼... 괜히 칸 간 거 아님 
5,분위기가 퇴폐적이다. 또 설경구는 멋있는 표정을 지을 줄 아는 사람 같다! 
10,결말 굉장히 세련되어서 놀랐어요. 아무 기대없이 보러간건데.. 감독 일베 건은 루머라고 밝혀졌는데 왜 자꾸 마녀사냥 하는건지.. 
10,진짜 내인생에 반환점같은 영화?느와르진짜 안보는데 너무최고인것?♡ 
10,소재가...좀 식상하긴 하지만.. 재미는 있네. 이런류의 영화는 또봐도 또봐도 재밌어.신세게2 어서 보자. 
10,진짜 불한당 미쳣네여 대박이네여 완전 설경구 사람이 아니네여 연기가 ....이게 백만이 안됫다니...영화가 군더더기가 하나도 없네여 아직 반도 못봣지만 최근에 이런한국영화 못봣네여 당연최고에여 
10,난 재밌었다  임시완 연기 잘해 
10,"두 배우의 연기와 케미가 너무 좋았고, 느와르에 나올법한 평범한 브로맨스와는 다르게 더 절절하면서도 절제를 하여 적절하게 잘 표현한것 같다. 정말 인생영화이다. "
10,와 이건 진짜 역대급 명작임  그동안 좌편향된 예술계에 뺨을 한대 후려갈긴 사이다 영화 
10,안보고 비판하는 사람들은 왜이렇게 많지? 영화 자체로만 보면 만점임 
3,이 영화는 정치를 떠나서 노잼.. 
8,"설경구에 명대사"" 사람을 믿지마라 상황을 믿어야지"" "
8,최근작들중 최고다. 감독이 쥐길넘이다. 이렇게 좋은 영화를 두고 왜 그랬대? 
10,보고 또 보는데도 계속 생각난다 
9,약간 아수라 느낌 나지만 재밋네요!영화평점인데 무슨 감독평점 주고있고 감독 이 무슨 발언 했는지는 모르지만 영화는 재밌어요 할튼 영화자체를 안보고 다른걸로 평점매기는애들은 무슨생각인지.. 
9,불한당보고 광명찾았읍니다.... 
10,불한당원 되버려서 내 인생 망했다 
10,저는 재미나게 봤습니다 
10,진짜짱연기잘해 프리즌이랑내용좀비슷한듯함 
7,마지막 여자형사년 임시완 총맞고 디졌을때 박수를 쳤다. 
10,다덜 불한당원이 되세염 
8,악마의 편집으로 마녀사냥이 지나친듯 한데. 안타깝다. 
7,요근래 나온 한국영화에서 꽤 괜춘. 역시 사람은 뒤를 조심해야해.  그리고 말도 조심해야지. 
7,대단한 수작은 아니지만  그래도 그닥 욕먹을 정도까진 아닌거같은대? ㅋㅋ 볼만은 한대? 
8,음...감독인성문제로 영화에 이렇게까지영향이...전영화는 괜찮은 영화라생각합니다.요즘 한국느와르영화가 안습이여서...몰입감도 괜찮았고 주연 배우연기도 좋았어요(임시완씨 연기가 특히)마지막 장면이 아쉬웠습니다.(짜맞춘...
6,난 볼만 하던데... 근무시간 땡땡이 치고 봐서 그런가...ㅎㅎ 
9,딱 봐도 사이즈 나오는 영화였는데 생각하는 거랑 다른 느낌을 받았다.. 스타일리쉬한 영상미는 물론 배우들의 맛깔나는 연기까지.. 
10,역시 착하면 된통 당하기만함ㅠ_ㅠ 
9,간만에 진짜 느와르를 보고 왔습니다. 
9,첫장면부터 날 사로잡은 영화 
9,"편집, 지루하지 않는 화면구성 존나 좋다 안보고 테러하지 마셈들..그저그런 느와르 아니라고 생각. 안 보신 분들은 감정선에 집중해서 보길 바랍니다. 전혀 새롭게 보일 것임 ㅠ "
8,칸에서 선택한 이유가 있었다 ㅎ 
10,익숙하고 뻔한 스토리일 것 같지만 멋진 연출과 배우들의 연기력덕분에 멋진 영화가 탄생했다.. 
8,감독님의 실수가 정말 아쉬운 영화ㅠㅠ이런 평가 받을 영화는 아닌데.. 
8,솔직히 재밌었어요..ㅋㅋㅋ 
9,임시완은 아이돌출신이라는게 믿기지 않는다 
9,앜ㅋㅋ김희원아찌 너무조앙ㅋㅋ 
4,뻔한 스토리. 반전이라 하기에는 너무 미미하네요 
10,임시완 진짜 멋있어요ㅠ 얼굴이 10점 만점에 11점이에요 ㅠ.ㅍ 
4,연기 정말 잘하는데 각본이...너무 읭??스러워요ㅠ갑자기 다 죽이고 뭐지??하는..차라리 감동이었음 좋았을텐데요 
9,같은듯 하면서도 다른 영화였어.. 
10,정말 재미있게봤어요 ㅜㅜ 연기력듀 다들 좋고 스토리도 정말 예상하지 못했구.. 좋았습니다. 
9,오늘 관람했는데 영화 재밌어요^^ 
9,정통 느와르 로맨스물ㅋㅋㅋ 새로운 장르의 탄생인가 
8,설경구 연기ㅡ자라드라 꾸웃 
5,그냥 그럭저럭인 영화 하지만 임시완 설경구 두배우의 연기는 쩔었습니다 
1,이시완 연기 잘 하는건 알고 있었지만 완전 믓찌네요내용은 그닥~~ 
2,아이고... 사과문 말처럼 개인의 영화가 아니고 수백명의 피땀의 결정체인걸  아셨으면 sns에서 그리 행동하지 마셨어야지요...  sns파급력을 아직도  모르셨나  변명으로밖에 안들리네요 
2,감독 말하는거 보이 인성이 보인다 
1,감독ㅋ 앞으로도 저 감독 영화는 안 본다. 
1,감독님 훌륭해요! 앞으로도 성공하세용 
1,이배우들로 이정도 밖에 못살리냐.  아니지 이 배우들때문에 이정도라도 한거다. 최악의 영화 
5,무료티켓으로봄 감독보이 돈주고는못보겠고ㅋ생각보다 진심 별로다 다른색히말듣지말고 왠만함 다른거보길 진짜 경고했다딱5점 
8,처음부터 끝까지 눈을 뗄 수 없었습니다 
1,감독이 책임 져야되지 않겠냐~ 
1,일베하는 감독이라며여 
1,이런 감독이 만든영화가 훌륭할거 같냐 
1,감독님 축하합니다!!! 
1,내용도 연출도 나도감독하것다 
1,청불 영화 입니다 입장시 어려보이는 관객이 있을때는 신고해 주세요 
2,빵야로 시작해 빵야로 끝난다 빵야 빵야 내돈 도 빵야 빵야석양이 진다 빵야 빵야 다 빵야 빵야 맨날 빵야 에라이 
1,영화를 보는동안 내내 불편했다. 지역주의 조장하는 일베스러운 구성... 이후 감독 트윗 기사 보고 이해가 됐다....추접스럽다... 
1,돈 아깝다.감독트위터..다들 아세요?ㄷㄷㄷ 
1,이따위 영화로 입만 살아서 되겠냐 
1,솔직히 재미가 없습니다 
1,감독은 자격미달로 사퇴해라~이영화 보려거든 홍어를 먹고 봐라~못참고 댓글달았다 이게 다 감독때문이다 변감독 매장시켜야한다 순실이랑 다른게 뭐가있냐 ㅉㅉㅉ 
1,진짜 재미없었음돈 아까울 정도 
2,감독 마인드가 쓰레기인 영화!더러운 입에서는 더러운 영화가 나올 뿐이다. 극혐! 
1,최악의영화. 감독의 인성이 문제. 키보드 워리어는 영화 만들지 말고  키보드랑 놀기 바람 
5,"뻔한 스토리, 임시완 연기는 좋았으나  어설픈 케릭터는 아닌듯! 고딩느낌! "
1,"이건 뭐 내용도 없고, 마무리도 깔끔하지 않은게 별로였습니다. "
1,이런 인성 ㅆㄹㄱ 가 만든 영화는 보지맙시다 
1,영화는 걍 그런데.. 감독이 사상이 왜 그럼?? 
1,감독 정신차리라고 1점 드림 
1,감독이.. 영;; 아닌듯 
1,이 영화는 감독떄문에 망합니다 
1,1점도 아깝네감독이 ㅉㅉㅉ 
1,감독때문에 기분잡치네요 
1,관람객 평점 왜 이러냐 차라리 잠이나 잘걸 
1,임시완 연기력이 아까울정도로 연출도 별로고 일단 감독이 문제가 많다보니 영화를 색안경끼고 보게 되더군요. 설경구는 연기는 잘했으나 캐릭터가 매력이 없네요. 
1,말 그대로 돈이 아까웠던 영화....에휴 
1,트윗 잘 봤습니다. ㅅㄱ 
1,내이버에 빵점은 없냐...1점도 아깝다 
1,자기 관리도 잘해야지.... 
1,sns는 인생의 낭비. 
2,음악은 좋네요! 너무 많은 시도를 해놔서 몰입은 좀 힘들었어요. 
1,감독이 불한당에 나쁜놈이더라. 나쁜세상이네. 
1,감독 사상이 이상한것같습니다 수고하세요 
1,임시완 왜 이런거 출연했냐! 원라인 할때가 좋았다! 
1,나는 감독이 이상한것도 모르고 봤는데 돈 버리고옴재미없음 진짜...배우연기 다 좋은데 스토리랑 연출이 망침 
1,감독 수준이 딱 담긴 영화 
1,감독때문에 망할꺼같은영화.... 
1,감독 수준이 매우 유치하군 
1,"볼 생각없었는데, 기사보고 더 볼 생각없어졌습니다. "
1,감독이 망친 영화!!!! 
1,티비에서 공짜로 보여줘도 안 본다 
1,반성하시라고 1점 드립니다 
1,재미도없고 감동도없고 
1,감독이 영화를 망친 영화 
1,감독 수고했어. 덕분에 우리나라에서 반지성주의의 행로를 제대로 보여주네. 이제 쭉~~  쉬어. 
1,OOO기 사상의 감독이 만든거니 뻔하지 
1,쓰레기 영화 ㅋㅋㅋ 조폭미화 + 공권력호구 + 부정부패  =  흥행  이라고 생각하는데 아무리 영화라지만 조금만더 현실성 있게 만들면 안되나여  지짜 이거보고 재밌는 애들 수준참.. 영화보고 곧이 곧대로 믿는 애들이...
1,정치를 배우지도 않은 사람이 정치에 대해 나불대니 싫다잘됀영화에 똥싸네 난 이 영화 안본 
1,감독사상이 너무 저급하다 보기도싫다 
1,일베충  감독의 그저그런 막장영화. 
1,마!직이뿌까?니 같은거는 한주먹거리다. 
1,감독때문에 망할영화 
1,잘가라 금수저 인성교육좀 받고 
1,기대 많이 했는데 개연성 떨어지고ㅠㅠㅠ 
1,"눈깔에 힘주고 톤을 어둡게 하고 총질만 해댄다고 다 누아르가 아니다,,유치한 대사,,식상한 설정,,어색한 유머,,설득력 떨어지는 낯익은 이야기,,대가들을 베낀 것 같은 단편적인 연출,,지루한 스토리,,,무간도와 신세..."
1,캬   감독수준에 맞는 영화임 
1,감독만 생각하면 1점도 아깝다 네이버 왜 0점 없냐 
1,딱히... 별로 딱 그 수준.. 
1,개봉첫날에 내가 왜봤을까 ㅠ_ㅠ   열심히 연기해준  배우와  스텝들 에게 사과 하세요!!!! 
1,이걸 영화라고...참 후.. 
1,니까짓게 무슨 영화로 남들한테 감동을 줄 수 있겠냐.. 
1,건강하지 못한 정신으로부터 명작이 나올수는 없음. ... 
1,감독수준  너무하다 진짜 
1,감독이 영화를 다망치는군요 
1, 영화제작자의 사상은 중요한게 아니지만 인성은 중요한거 그런이유로 이영화는 망해야 자정효과를 얻을수 있지 
