score,review
1,얼마나 똥줄타고 있을까 지금 ㅠㅠ얼른 돈 주고 평점조작 하세여살다살다 1점이 50% 다 돼가는 영화는 첨 봄정말 SNS는 똥이다. 감독님 그냥 그딴 쓰레기 생각은 혼자 머릿속으로만 하세오ㅓ 
1,볼 가치가 없는 영화. 돈아까움 
1,감독 일베하나?  제 정신이 아닌듯 
1,0 점은 없어서 1점 줍니다. 
1,보지마세요... 노답 노잼 노개념 영화... 개빢... 
1,"별하나도 아깝다. 똥을 싸는 빙법은 여러가지다. 이 감독은 영화로, 또 글로도 싸더라~ "
1,재미없어서 보다  나왔따 
1,재미없어요감독 생각도 없구 
1,내용도 아깝다.10자 채워쓸 가치를 못느낀다 
1,0점은 없나요? 0점 찾는 분들 많을 것 같은데? 
1,누가 누굴 평가해 진짜 수준이하다 
1,감독이 불한당임ㅇㅇㅇ 
1,감독 트위터 보면 진짜 생각 없는거 같고 위험한 수준; 
1,감독때문에 거릅니다^^^ 
1,어짜피 설경구 때문에  안볼영화였지만그밥에 그나물이네요 ㅉㅉㅉ 
1,0점왜없냐 잇음0점인데 
1,정말 이정도면 심각하다 내용없는영화 
1,이런 감독이 만든 영화는 망해야함니다 불륜배우 설ㅇㅇ배우를 쓴 이유가 있었네요 
1,트위터 보니 감독 겟아웃! 
1,겟아웃 흥미진진 할것같아 
1, 투자자들은 감독한테 피해보상청구해라.이게 다 이명박근혜때문이다.감독때문이다. 
6,감독이 어떠하더라 다 떠나서.. 영화가 매리트가 너무 없네.. 
1,감독이 참 저질이네요. 
1,트위터 글 하나로 감독의 수준이 보임 
1,"앞으로  출연진, 투자자들은 감독을 보고 선택해라. 빠른 VOD가 살길이다. "
1,"액션르와르보다 잠든건 이번이 처음인듯연출력,각본 다 별로임 "
1,이슈때문에 영화 망하면 투자쪽에서 손해배상가능하려나? 제발 다신 안보였으면 
1,자업자득하시길... 
1,정 궁금하면 그냥 vod로 
1,"좋아하는 배우들이 나와서 보고자 했었는데... 배우,내용 다 떠나서 어떤 사람이 이 영화를 만들었는지를 생각하니 못보겠네요. 케이블에서 나오면 그땐 보겠습니다. 홍어에 탁주 마시면서~ "
1,배우들 고생했어요... 
1,재미없어요 너무나도 재미가..없어요.. 
1,영화는 감독의 인성과 품격이 투영된다 하지요. 
1,마이너스 점수 없나?돈아깝고시간이 제일 아깝고 
1,다른말로 설명안해도 될듯 
1,이런영화가 언제까지 나올지 참 궁금합니다. 
1,생긴것도 이루 닮아가지고 재수가 없네요. 나라보다는 돈을 벌자는 물질만능주위를 잘 보여주네요. 
1,0점 없냐 감독 때문에 망^ㅎ^ 
1,1점도 아까운 영화이군요. 
1,ㅉㅉ  이제 이런 류의 영화는 더이상은 네이버 
1,감독 보고 영화 안봐야지 맘 먹은 적은 첨 
1,감독 트윗으로 폭망시킨 영화 
1,감독 인성이 일점이네요. 
1,평점10점인 글들 알바티가 너무 난다. 네이버  진짜  평점 올리는거 아이디로 제한하지 말고 아이피로 제한을 두는게 어떨까 싶다. 
1,그감독에 그영화 수준알만하다^.^~ 
1,인간다운 인간이 만든 영화를 보고싶다 
1,"트윗으로 왜 스스로의 공들인 탑을 무너뜨리나 모르겠다. 감독의 머리 속 깊이가 발목까지 밖에 안 오는 것을 알게되었는데, 내가 굳이 이 영화 속으로 다이빙 해야되나 "
1,글쎄 감독이 자신있게 sns에 별소리 다했던데 그런거 치고 영화는 별로 
1,정말 별로입니다. 차라리 여섯시 내고향을 보세요 
1,그냥 참 웃기다 먼사과야ㅋㅋㅋ 안어울려 억지로 사과한티가너무 나 ㅋㅋㅋ 돈은벌어야겠니?? 
1,에효.... 배우들만 불쌍하다.. 다른 제작진들도ㅠㅠ 
1,바쁘구만 이런일까지 해야하나 
1,감독 사상이 의심됨.. 같이 일한 배우들 및 스텝들만 불쌍하네 
1,감독이 병크터뜨린 거 아니라도 이 영화 자체도 분위기가 기분이 나쁨;; 임시완 불쌍함 ㅠㅠ 
1,감독이 영화망쳤네~ 잘가라 
1,영화에 감독의 사상이 녹아나기 마련이죠^^ 
1,감독이 진짜 대단한 사람이더라구요ㅎㅎ 제 점수는요 
1,감독 트위터 사건 터진다음에 사람들이 1점주니간 갑자기 10점 알바들 몰려와서 계속 미친듯이 10점 올라오네ㅎㅎㅎ 더 꼴비기싫다 진심 망했으면 
1,시간 낭비입니다. 이런 영화. 
1,킬링타임용으로 조차  부적합.  차라리 그 시간에 산책을 할걸 
1,1점도아깝다. 앞으로 당신 영화는 안 봅니다 
1,안삽니다~안사요~~ 
1,노무현입니다 보러 가야지 
1,이런 정신세계 같고있는감독영화는 절대못보지 
1,훌륭한 배우들 데리고 오랫동안 준비해왔다며 트위터로 한방에 망치네 
1,트위터 보니 감독 인성이 후덜덜 하던데 영화가 정상일까.. 
1,이넘꺼는 이제 평생거른다.... 다운받을가치도 없다. 
1,감독같은 영화네요^^ 
1,감독이 일베충으로 밝혀져 개봉하자마자 문닫네 ㅋㅋ http://www.instiz.net/pt/4549203 
1,영화 평점 처음 남겨봅니다. 1점 수준 
1,에휴 .. 출연한 배우들과 연출 제외 제작진이 불쌍하다. 
1,쯧쯧 한심하다. 심판을 받아라. 
1,좋아하는 배우 임시완이 나와서 내일 주말에 가족들과 관람하려했으나 안갑니다. 홍어??? 참나 
1,감독사상보면 뻔하지 않나요 
1,감독이 섹스라면서 BL요소가 있는건가요???? 섹스 섹스라면서 감독아?? 딴영화는 쓰레기라면서?? 
1,Garbage In Garbage Out 
1,"1점도 아까움, 흠... "
1,이거 좀 심각하더만요... 
1,보러 갈거는 아니지만 평점 1점 드릴게요^^ 
1,"SNS에서 다른 영화작품들을 조무래기라고 폄하했었지.  그리고 홍어드립으로 특정지역비하와 여성비하, 인신공격 등을 한 인성쓰레기가 만든 영화 안본다. "
1,쓰레기. 진짜 쓰레기 완전 
1,감독때문에  영화가 보기 싫은경우도 생기네요이분영화는 영원히 안볼랍니다 
1,소문이 영 아니더만요 감독 그러지마요....예술 한다는 사람이 말이야 
1,임시완 배우가 불쌍합니다군대가기전 마지막 영화라고 열심히 했다는데감독이 다 말아먹었다고한다 
1,감독 사상이 이상하네요 
1,0점을 못찍는게 슬픈 수준 
1,1 이하는 못 줘요??? 다음 영화는 대놓고 일베 영화 만든다던데?? 영화 내용도 감독 인터뷰랑 트위터 보고 나면 너무 더럽게 느껴집니다 
1,예매 했다가 귀찮게 취소 했네요 아까운 내시간 
1,이 감독의 트윗을 보니 이 사람 영화는 안봐도 뻔하니 무조건 스킵해야 한다는 생각이 든다. 1점도 아까움. 
1,감독님 트윗이 좀 충격적이네요.. 
1,영화평에 1점 주기는 진짜 오랜만인듯0점을 줄수있으면 주고싶을정도. 
1,어설픈 변명하지 마세요. 
1,예매했다가 트윗보고 취소합니다. 저런분이 만든 영화라면 안봐도 될거같아요. 일기장에 쓰던가. 지역감정조장. 비하입에담을수없는 언행들. 읔 역겹고 더러워요. 
1,감독수준이 영화수준이라고 생각합니다. 저속하고 상스러운 감독이 만든 영화 뻔하겠죠뭐 
1,진짜 보고왔는데 신세계 내용이랑 부당거래 내용 믹스 해놓고 영화 개봉 했네 거의 표절 이구만 ; 
1,조폭동성애 영화.    감독이 임시완한테는 성적함의가 담긴거 안알려줘서 브로맨스인줄알고 연기했다는거에서부터 기분이 쎄했는데 감독이 트위터에서  온갖 불한당관련 2차 동성섹드립 리트윗하고....홍어드립....여혐드립....
1,감독 트위터 한번 보고 오세요.불한당 참 잘 어울립니다 
1,감독 수준 진짜.. 절레절레 
10,잘만든영화!!감독의 개인정치색으로 평점테러당한것같아서 안타깝네요. 영화로만 평가하시죠.. 
10,으어... 뒤늦게 영화를 봤는데 스토리 배우 연기력 아주 좋았고 다소 뻔한 스토리를 뻔하지 않게 잘 풀어냈다 근데 감독 땜에 흥행 저조 한 것 같은데 넘 아쉽다...ㅠㅠ 
10,영화 자체는 정말 재밌음. 한국에서 만든거 맞나 할 정도의 느와르 
10,기대 1도 안했는데 잘 봤어요. 스토리 연출 배우연기 뭐하나 빠지는게 없네요. 그리구 이거 장르는 느와르가 아니라 로맨스던가요 ㅎㅎ 잘 봤습니다~ 
10, 맞춤 양복처럼 모든 배역이 제자리에서 반짝이는 참 매끈한 느와르 
10,내 인생을 건 영화 3주년 까지 가자! 
9,설경구님 현수울때 표정 연기보고 묘했습니다ㅜㅜ수트입은 모습 까리했습니다♡ 임시완 배우! 연기력 알고있었지만 선한 인상으로 이런 캐릭터도 소화하다니ㅜ다음작품도 기대돼요 김희원님 여기역할은 무섭기만은 않아서 좋았습니다 ...
10,기대 않하고 봤다가 푹 빠져봤다 
10,감정선에 이렇게 신경 쓴 한국영화가 있었던가 
10,하 잘만들긴 잘만들엇더라 
10,임시완 빨리 전역해라 ^^ 
10,왜 이제서야 봤는지.... 
10,좋은 영화를 네티즌평 때문에 놓칠뻔 했네요 
10,홍언지뭔지 그들은 자기들이 자기무덤판다... 
10,다들 어떻게든 깔려고 발광하네. 영화 자체로는 10점 만점이다. 
10,핵명작인데 왜이제봤을까ㅠ 
10,4번본 영화  임시완 연기 잘하더라 설경구도 이미지별로 였는데 영화보고 바뀜감독이 사고만 안쳤어도... 좀아쉬운영화 
10,현생불가....하루에 한번씪 보고 있어요.... 
10,영화는 진짜 최고예요 ! 연기력 작품력 다 완벽합니다 
10,재평가 받아야하는 내 인생 최고의 영화. 평범한 느와르라는 장르를 벗어난 격정적인 느와르 멜로(!) 라고 생각함. 
10,"변성현 감독 막말때문에 영화관에서 안본게 너무 후회된다.. 미술감독, 조명감독이름까지 찾아본 영화는 이게 처음이다. 화면 편집이 정말 최고였고, 설경구 연기는 살아있다. 임시완도 최고였고.  왜 칸에서 초청했는지 알..."
10,솔직하게 6점 받을 영화는 아니다 
10,감독이고 뭐고 오지게 아련하고 사랑스러운 영화입니다...제발 보세요 정말 인생작입니다ㅠㅠㅠㅠ설경구아저씨 너무 사랑하고 둘이 찰떡입니다 
10,평점테러 장난아니네 니들은 재밌는거 보지마라ㅎㅎ 
10,영화는 좋았다. 으휴 인간들이 여기 감독이 잘못했지만 우르르 와서 여기 욕하는 꼴이라니. 평점 1 준 사람중이 영화본 사람이 있긴하냐? 군중심리에 욕하면 자기가 뭐가 된줄 우월주의에 심취한 사람들 천지니 
10,매우 볼만합니다 평점테러 오져서 별하나 더 드립니다 
10,왜평점이래...졸라재밌게봣는뎅 
10,설경구와 임시완 두 배우의 감정선에 오조오억점... 
10,매우 좋네요 네티즌평가라는건 웃기네요 영화를 영화로 봐야지 그외 조건에 휘둘려서 영화를 보지않고 평가를 하다니 멋진영화였습니다 
9,정말 재밌는 요소가 많아서 시간가는지 모르고 본 영화 
10,재밌다 재미가 있다 재미 
10,변성현은 영화의 신이다! 
9,주인공의 연기가 일품입니다. 
10,난 완존 잼있었눈데 감독이 에센에스로 말아먹었네 
9,극장에서 못 본게 후회되는 영화중 하나 . 작은관에서라도 재개봉하길 간절히 바란다 
10,기존 느와르랑 다르게 신선했음. 연출력에 여러번 봐도 좋을정도... 영화퀄에비해 스코어가 너무너무 아쉬움 
10,여긴 영화 평점 주는곳이지 감독 인성 들먹이면서 평점테러하는곳이이냐 무식한것들아 ㅉㅉ 
10,불한당 영화관에서 못봐서 내년에 일본에서 개봉한다는데 보러갈라고 한다 큰 화면에서 보고 싶어서 그 정도로 재밌음 
10,임시완 연기 진짜 잘한다감정 진짜 좋음잘생겨서 연기력이 묻히는 케이스 
10,재밌습니다. 강추드립니다 
10,진심 존잼이다 안본사람들은 꼭 보길 추천한다 내가 왜 이걸 영화관에서 안봤는지 후회하는 작품1위다 오늘 한번더 볼예정이다  다시한번말한다 안본사람들 꼭.봐.라. 
10,영화 정말 잘 봤습니다! 
10,연출과 배우들의 연기가 감각적이고 센스 있었다. 감독 본인의 논란으로 배우들과 스탭들의 노력과 작품 자체가 저평가 된 게 안타까울 뿐. 임시완은 이 영화를 통해 어떤 배역이든 소화할 수 있다는 걸 단단히 확인시켰고 ...
10,"김희원이랑 임시완 설경구 연기도 완전 잘 하고 진짜 잼나게 봤는데요~  왜 못뜬건가요?  여기 뎃글에 감독이 문제있다 그러던데, 영화는 진짜 잼나게 봤어요 "
8,몰입한 시간!! 설경구님 임시완님 다시 보게 된 영화! 
9,"감독 논란과 관련해서 알아보니까 경솔한 부분도 있었지만 분명 왜곡되어서 악성 루머가 된 경우도 있었다.,우선 영화는 매끈하고, 세련되었고 영상미가 무척 예쁘다. 생각보다 설경구가 너무 퀴어의 느낌을 잘내주었다, 임시..."
8,오랜만에 감정적으로  ~ 쫌 슬픔 액션에서 보기힘든 영화였다 
10,존나 감겼어 설구 최고야 
10,Vod 로 관람했습니다. 너무 재미있네요. 지금 몇번째 다시보는지 모르겠어요. 감독에 대한 루머는 사실이 아니란걸 알았지만 영화가 이렇게 재밌고 훌륭하기까지 한 줄은 몰랐습니다. 설경구라는 배우를 다시 보게 될 것입...
10,이 정도면 10년에 한 번 나올까 말까한 영화네  굿~ 
10,그저 그런 알탕 범죄물 한국영화 #32353인줄 알고 별 기대도 없이 봤는데 재밌게 봤어요 연출과 멜로 서사도 만족스러웠어요 초반부는 유쾌하게 시작해서 점점 다크해지는게 마음에 들었고 배우분들 눈빛연기도 좋았음 
10,"사람은 믿지마라 상황을 믿어야지, 그냥 영화는 영화로만, 뻔한 스토리지만 영상미가 돋 보였습니다. "
10,우와~~~오랫만에 너무 재밌는데요~!!!!짱!!!! 
9,지루할틈없는영화입니다. 올만에 설경구괜찮은영화찍었네 임시완은 이런역도 가능하구나 
8,이슈때문에 평점 많이 깎여먹네...아쉽다 영화 괜찮은데...영화는 영화로만 봐주시길... 
10,보는 내내 연기에 감탄했고 연출에 감탄했다. 그리고 음악도 정말 좋았다. OST 내줘요... 
10,영화 개꿀재밌는데 어지간한 불편충들 평점테러해논거봐라 ㅋㅋ 
10,꿀잼핵잼존잼나이스잼딸기쨈사과잼 
10,젊은 감독의 스타일리시한 연출과 실험적 앵글과 스토리 라인을 잡아주는 색감까지 눈을 통해 보는 이야기가 많은 영홥니다. 기존 상업영화의 문법을 따르지 않는 점도 좋습니다. 오래 되고 무거운 배우와 새롭고 변칙적인 배...
10,다른 아무것도 보지 말고 영화만 보세요. 
10,"연출, 스토리, 연기 다 최고. "
10,이대로 묻히기는 아까운 역작. 설경구와임시완케미도환상 
10,주.조연. 모두가 배역에 충실하네요 임시완배우님  연기력이 갈수록 깊어집니다 
10,스타일리쉬한 연출이 클리셰를 살짝 비틀어간다.설경구가 이렇게나 멋있다니! 임시완의 딜리버리마저 완벽하다. 
10,재미있습니다  잘만든 영화 
10,너무 안타깝네 신세계 버금갈 영화였는데 개인적으로 설경구랑 임시완 너무 안됐다 설경구는 재기할 기회였구 임시완은 인생영화될뻔했는데 이게 100만도 안됐다는게 이해불가임 영화 해바라기처럼 뒤늦게 인정 받을라나 
10,평점이 너무 낮다 솔직히 영화 자체는 되게 괜찮게 잘 만들었음 
10,설경구연기 와~ 감동 임시완 담 작품 기대되네요 
10,최근 본 영화중 가장 훌륭합니다 흔한 느와르와는 다르게 느껴졌어요 
10,영화 재밌게 봤습니다 배우들 연기 좋았구요 내용도 볼만하더군요 
8,생각보다 재밌게 잘봤어요~! 
1,감독 배우 등등 관계자들아.영화 찍었으면 한번 리뷰하고 개봉해야하는거 아니냐?? 
1,감독을 떠나 영화 자체가 수준낮음 
1,내가 줄 수 있는건 이것뿐 
1,"수준이하 , 보고나서 후회 하지 마시길.... "
1,돈 아까비~~~아까비아까비 ㅠㅠ 
1,안그래도 배우 하나때문에 호감도 떨어지는데 감독이 확인사살을. 
1,설경구 임시완 가지고 이따위로 만들바엔 트위터나 주구장창하는게 생산적인거 같다. 
1,싫다 보기 싫다 싫어 싫어 
4,"여배우님 정말 안어울림...오랜만에 9000원 아깝단 생각든다...비슷한 부류 신세계,프리즌은 잼나게 봤는데...이건 뭐지? 평점보고 안보려다가 역시나...설배우님은 감시자들 이후로ㅜㅜ "
1,일베감독임? 절대안바야지 
1,감독이 더 불한당같다... 
1,영화 봤는데 감독을 떠나서 영화자체가 별로임 
1,ㅎㅎㅎ 절대 보지 말아야지.배우들이 불쌍하다 
1,sns를 보니 토나오네... 
1,감독 수준을보니 평생 이감독영화는 안본다꺼져라 
1,영화안보고 평점 등록하지 않지만 감독 발언을 보니 이런 감독의 영화는 뻔해서 1점. 
1,장그래 시완이 땜시 봤는데...하ㅏㅏ 왜 봤나 싶다...차라리 겟아웃 볼껄...내돈 아깝다.. 
1,http://www.ddanzi.com/free/184193086#88  와 감독수준 알만하네요... 
1,전라도 보고 홍어라니. 미쳤냐. 그럼 넌 변씨니 똥감독. 1점도 아깝네 
1,일베충 감독이 만든 작품이니 ㅋㅋ 
1,별로임...돈 주고 보기 아까움.. 
1,1점도 아깝다. 0점은 없나?? 
1,솔직히 배우분들이 굉장히 아깝다...아주 아수라랑 똑같이 실망했네.. 
1,감독때문아니라도 망한영화 
1,여러분 잘못된건 가차 없이 까줘야합니다. 몇몇 기사들보면 영화자체는 잘 만들어진 영화라고 하는데 짬뽕 같은 내용에 뻔한 연출의 장르영화입니다. 그저 킬링타임용 무비로 적절하지만 이말고도 좋은 킬링타임 무비 많습니다....
1,돈이 아깝다 ㅜ.ㅠ~~~~ 
1,그렇게 살지 맙시다~!!!배우들이 아깝네요 
1,이 쓰레기영화가 대선보다 중요하다는 감독ㅋ 
1,ㅜㅜ그닥이네정말ㅜㅜ 
1,"ㅋㅋㅋㅋ 관람색 평점이 8.63이라니!!!! 1점 주기도 아깝네요. 정말 별로 였습니다. 스토리 개안습, 연기력 더 개안습! "
1,"신세계와 무간도를 적적히 믹스해놓은상상력도..스토리도없는 지루한 영화..감독님~엉덩이 큰 여자 칭찬(?) 마시고....작품 구성에 좀 더 힘써보세요!!!관객은 바보도,호구도 아니랍니다.. "
1,영화 안보고 평할수 없어서 봤는데 무간도와 신세계 처럼 깊이가 없고 경찰의 범죄자 위장잠입 했다가 끝인 스토리 .. 진짜 뭔가 남는게 없는 영화네요. 기억나는거는 '입학'등 은어뿐 이게 뭔가?  경찰의...
1,시대적 가치관을 제대로 가진 사람만이 참 영화를 만들수있다 
1,감독이 불안당이다. 보고 후회한다 
1,"감독 생각이 없는데 영화가 잘 만들어질 수 있을까요?  정말 이 영화로 돈 벌려고하는게 소오르음.  호남사람비하,  문재인 비하. . . "
4,아수라 2다!!또 다 죽여~뭥미 ???스토리도 너무단순하고 여형사너무 무모하게일처리하는것도 이해안감고 
1,의식없는 감독의 영화는 안봐도 뻔한거 아니니가요? 
1,진짜 근 몇년동안 본 영화중에 최악이다...프리즌이 훨씬 재밌었음내용도 어수선하고 지루했음 
1,이영화는 절대로 안본다 
1,아무 이유없습니다.호남인이라서 그냥 기분나쁘네요홍어새끼라서 정말죄송합니다 
1,불한당10자 이상으로 써야 
1,배우들이 불쌍타..홍어는 귀한음식야.이 안귀한 감독. 
1,겟 아웃 보러가장 겟 아웃 
1,트윗에 대한 평점입니다. 
5,이영화 저영화 여기저기서 베껴도 어쩜 이렇게 어설프게 베낄까?... 
1,홍어 어쩌고 하는 감독영화를 볼 수는 없죠 
1,미안하지만 실망이다오빠생각 이후로 대실망이다 
1,소문만 무성한 캐스팅잔치. 
1,정말 지루하네요. 둘이 보다가 다 잠 들었네요. 신세계는 이 영화에  비하면 명작이네요. 
1,별로 별로 별로 별로네요 
1,그 유명한 일베감독인가요? 
1,감독이 홍어홍어거리는게 참트루? 
1,이런 감독의 작품을 돈주고 볼 바엔 기부를 하겠다. 
1,인생은 실전이다. 일베새끼한테 자비란 없지 
1,돈을 아낍시다! 맛있는거 사드세요~ 
1,트위터 보고 성지순례하고 갑니다. 
1,감독이 말하는 차기작이 더 어이가 없다.... 
1,감독보고도 이걸보다니 ㅉㅉ 
1,진짜 볼거없는영화..  시간 버리고 돈버리고 이게 머하는짓인지 
1,굳이 트윗 때문 아니어도 별로인 영화 
1,영화관에서 일해서 봤는데 최악. 감독 멘탈은 더 최악. 돈아까움 
1,0점은 왜 없나요 0점주고 싶습니다 
1,0점은 못주는거냐? ㅋㅋㅋ 0.5점도 안되겠냐? 
1,쯧쯧 노잼 핵노잼핵노답 영화 
1,별 테두리도 주기 싫다. 
1,비하 발언 때문에 영화 안 본다고 하지 마세요..솔직히 중요한 건 영화가 너무 재미없다는 거예요.여러분 감독이 싫은게 아니라 영화가 재미없어요. 
1,임시완 연기 구리고 내용도 짜집기라 이미 평정 1점이었지만 감독까지 그 모양이니 1점도 아깝긴하다 
1,배우들은 무슨죄야ㅠㅠ 감 
1,실....망.... 
1,감독의 인성을 보니 영화 수준은 뭐... -_-;; 
1,수준이하 십자십자십자샹 
1,제목이 감독별명이냐? 
1,대체 왜 0점이 없는거죠? 네이버는 자중해야 합니다 10점은 줄 수 있으면서 0점은 줄 수 없다니.. 권리침해입니다. 
1,프리즌+신세계 흉내내기.. 긴장감 하나도없음.. 12시 영화라그런지 졸려OO뻔ㅜ 
1,임시완이 아깝다.. 저런 감독과... 
1,배우들이 아깝다. 감독 지가 싸지른 글은 생각안하고  나중엔 네티즌 들이  쓴 글만  원망하겠지~ 
1,영화를 만든 감독이 수준이하 영화는 더 볼것도 없다. 
1,않보길 다행이다...!! 
1,절대로 보아서는 안되는 영화 
1,망작이네요 절대보지마세요 
1,감독이 불한당인듯 주변사람들에게도 널리널리 퍼뜨려주겠음. 노빠? 일베 같던데? 
4,감독 사건 모르고 봤는데 그냥 노잼이여.. 
1,평점이 생각보다 높네요.. 알바들인가..? 
1,일베같아 1점 드립니다^^ 
1,예매했다 바로 취소했습니다 
1,감독의 트위터를 보고도 이영화를 본다면 진짜 용자십니다... 
1,불한당은 자신을 뜻하는 말인지? 어떻게 그런 말을 할 수가 있지? 
1,감독도 지 영화가 다신 보기싫다는데 극장에서 개봉하면 되것음? 
1,ㅋㅋㅋㅋ 감독이 자기영화를 말아먹는구나 
3,하...코골다가 여친한테 혼났다...코믹배우들은 초반에 다없애버리고...지루하고 허무하게끝났네  조금웃겨준 배우들때문에3점... 
10,감독때매 평점 깎인거 ㅈㄴ 아쉽네  스토리상으로는 꽤 재밌는데  감독말고  영화 자체 평점을 줘라 임마들아 
10,여운이 남는 영화... 
10,정말 보기드문 수작이다 
8,영화 안보고 평 1점주는건 좀 아니라고 본다 
10,너어무 매력적인 잘만든 영화!! 첨으로 몇번을 다시보는.... 둘 케미가 장난아님ㅠㅠ 헤어나올수가 없음ㅠㅠ 
10,영화 진짜 잘 만들었네요. 대본 연기 연출 다 완벽 개인적으로 신세계 보다 좋아요 감독님은 이번 실수를 계기로 발언 조심하고 앞으로 더 좋은 영화 만들어주세요 
10,루머는 사실이 아니라 루머라는 점을 사람들이 좀 알고 살았으면 좋겠다. 불한당 잘된 영화입니다. 정말 잘 만들어진 영화고 배우들 연기도 정말 좋았음. 
10,"너무나도 잘 만들었기에 여러모로 아쉬운 영화....대종상에서 설경구를 향한 뜨거운 환호의 이유가 궁금해서 보게되었고, 나 또한 불한당원이 될 것만 같다. 오늘 청룡에서의 환호성에 의문이 들었다면 이 영화 꼭 보시길!..."
10,안 보면 후회함 근데 지금 봐도 후회할 걸 영화관에서 안 본걸 
10,어느 순간 하나 놓칠 수 없는 완벽한 영화 
10,볼만하다 이정도면 별점통수 오졌따리오졌따 
9,"무슨 이유에서인지는 모르겠지만 전체적으로 감독이 욕을 많이 먹는것 같은데... 단순 이 영화만 본 사람으로써, 탄탄한 시나리오에 높은 점수 드립니다. 최근 2~3년 동안 본 영화중에 한 손에 꼽을 정도로 스토리가 탄..."
10,영화 보셨어요? 말이 더 필요합니까? 변감독 오해 풀린지 한참입니다 불한당?그거 감독이 웅앵웅 하시면 명패들고옵니다 
10,첨에네티즌평점보고볼까말까햇는데보고나서안보면후회할뻔햇습니다.솔직히 더킹 프리즌이딴영화들보다백배낫습니다믿고보는설경구에 내용도좋습니다 뭔가생각하게하는영화네요  저는 신세계느낌을많이받앗습니다 그만큼대작입니다. 강추  볼까말...
9,"연출 지립니다. 감독의 여성,지역차별 발언한적 없는데 왜이리 와전됐지 뻘소리한건 맞는데 어찌보면 개불쌍 "
