score,review
10,기다리고 기대했던 영환데 기대이상으로 좋았습니다 
10,사실 보기전엔 살짝 걱정했었는데;;^^;; 막상 보고 나니까 괜한 걱정을 했다 싶더군요. 설경구씨의 연기는 두말할 것 없고 임시완은 와.. 소리가 절로 나오덥니다. 그 나이대 배우들 중에서 최고가 아닐까 싶어요 
10,치고 박고 하는 그런 범죄영화가 아닌 느낄 것도 많고 생각할 것도 많은 범죄 액션 영화였습니다 
10,처음부터 끝까지 눈을 뗄 수 없었어요! 몰입감 상당합니다! 
9,"최근 국내 느와르들이 쉴새 없이 나오는 가운데, 이번에도 뻔하겠지 싶었지만 예상외의 카타르시스를 선사함. 정말 잘만든 한국형 느와르. "
10,브로 멜로ㅋㅋ상상지도 못한 반전ㅋㅋ 연기 미쳤어 진짜ㅋㅋ 
10,시간 가는줄 모르고 감상!! 기대했던 영환데 완전 만족스러움!! 
10,간만에 보는 화끈한 액션과 간만에 느껴 보는 긴장감은 너무 좋았다 
9,배우들의 연기력이 진짜 최고였습니다 연기 잘하는 배우들과 흥미롭고 긴장감 넘쳤던 영화였습니다 
4,배우들 연기와 영상미는 봐줄만한데 전체적으로 개연성이 너무 떨어져서 유치하다. 대낮에 임시완 엄마를 차로 치고 모자하나 안쓰고 내려서 대놓고 확인하는 장면은 진짜.. 
6,연기는 좋다. 하지만 스토리가 부실하며 개연성도 떨어진다. 
1,여성혐오적 표현 다분해서 보다가 끔. OOO기 영화. 
10,홍어가 홍어지ㅋ왜 감독한테 OO 
1,재미있게 봤는데 감독님의 인성에 문제가 있었나요? 아쉽네요. 영화 평점은 9점 드립니다 
10,페미들아 역겁게 행동하지마 영화 너무 잼나네요 
1,캐릭터들이 너무 과함 몰입도 방해 
2,보다가 지루해서 그만봄 이어서 보고싶지도않으.... 
7,여배우라곤 한명 나오면서 핵고구마네 
6,무난잼 감독논란때문에 너무 저평가 당함 아수라보다 낫습니다 
1,감상평가감상평가감상평가감상평가 
10,진짜 재밌어요 배우들 연기지림 
1,감독수준 ㄷ.ㄷ.ㄷ.ㄷ.ㄷ.ㄷ.ㄷ 
1,ㅋ 감독새기 ㅋㅋㅋ 진짜  ㅋㅋ전라도 비하도 그렇고 존나 티나게 유치한 새끼 ㅋㅋㅋ 에혀 설경구랑 임시완이랑 이경영 배우만 존나 안타깝다 ㅋㅋㅋ 
1,감독아니여도 안보는게..재미없어요 
1,양아치들 미화시키는 쓰레기 영화는 만들지 마라... 설경구나 임시완이 입장에서도 이 영화는 흑역사가 될것이다... 
1,설경구씨 좋아하는 배운데... 왜 이런 스토리를 선택하셨는지...너무 뻔하고 감동도 없고 감독이 할려고 하는 말이 뭔가요?배우들의 연기력이 아깝네요 ㅜㅜ 
1,내생 최악의 영화 다시는 이런 영화가 나오지 않기를 
1,겉멋만 존나 들어가지고ㅋㅋㅋㅋ 
3,"제일 좋았던 장면 인 첫장면. 빼고는 그닥. 사소한것 하나도 예상되는 전개. 김희원 분 역할만 제일 캐릭터가 살아있고, 한재호 캐릭터가 부숴지면서 영화도 부숴짐. 극중 현수를 보고 '와 혁신적인 또라이다!&#..."
5,"김성오 나와서 좋아햇더니 초반에 죽어ㅡㅡ 설경구 연기도 좋고해서 7점 줄랫는데, 연기 잘하는 김성오 초반에 죽여서 5점!!! "
7,감독 트위터 넘 독특해서 할말을 잃음.. 돌아인지 끼가 많은건지.. 에휴.. 배우들도 놀랬을듯.. 
1,배우들 연기는 진짜 씹소름 임시완 대선배 설경구에 안밀리고 전반적으로 배우들 연기 다좋았다 근데 스토리 초딩수준 
1,재미가어디있어도대체 
5,감독이 너무 당당해서 혹시나하고 봤더니 그렇게 까불고 다닐만큼 잘찍은 영화가 아니니 많이 겸손하게 다녀야될 영화 
7,여자 경찰이 그렇게 못되져야 할 개연성이 없다. 윗사람 다 말리는데 자기가 그렇게 악해져서 범인을 잡을만큼 집착할만한 동기를 모르겠다. 
6,프리즌배경+신세계스토리=아수라결말 
1,할리우드 버무린 잡탕.임시완 연기 빼고는 시간 아깝다. 
5,스토리 조금 비현실적 이며 신선함 없음 흔한 전개연기 몰입할정도는 아니었으나 괜찮음 
6,현란하고 폼나게 그리고 멋지게...그런데 왜 감정이 올라오지 않을까? 에드가 라이트의 세상의 끝을 베껴놓은 짧은 씬이 아주 맘에 든다.(댓글 탓은 아니다) 
4,남신경쓰지말고 감독일이나잘하자 
5,어디서 많이 본 영화 짬뽕한 느낌   의리나 통쾌한 복수는 없고  잔인한 폭력만 난무 
4,"재미있는 영화이긴 하지만, 훌륭한 영화는 아니지. 어디 조폭, 마약, 나오는 영화가 훌륭한 영화냐? 주는 교훈도 없는데. "
8,약간 뭔가 아쉬운감이 있다. 
5,배우는 연기가 좋으나 영화의 엔딩이 좀.... 
3,신세계 아류작같은느낌에 지나지 않는다 .안타깝다 
6,"배우들의 연기력은 매우 흥미로웠지만 스토리 자체로서는 많이 미흡한것같고, 감독의 언행이 한몫 한 영화같네요 "
6,그냥 볼만한 영화입니다 
8,프리즌이 생각나는 영화 그러나... 
1,감독...무슨생각이신지... 
1,감독수준 최저 영화도 최저 
8,연기 연출 영상 모든게 완벽했던 영화 
8,현수는 임시완의 인생캐릭터가 될 듯 하다 
10,프리즌이랑 교도소 배경이라는거만 비슷하지 믿음과 감정을 다룬 디테일들은 확실히 다르던데? 
8,평점보고 기대안하고 봤는데 재밌네요 
10,평점이 왜이렇게 안좋죠 ?저는 너무 재미나게 봤는데 ..감독 때문인지 아니면 누가 뒤에서 조작을 하나 ?연기 정말로 좋았고 시간 가는줄 모르고 봤는데 ..영화는 영화로만 보세요 ..감독말 말고 ..연기자가 너무  아...
8,이것저것 섞인느낌이지만 연기력하나는 최고 
10,와 .. 연출 스토리가 별 7 개라면 연기력이 별 20개!! 만점드려요!!! 
9,"설경구님과 임시완님 케미도 좋았고 지루하지 않게 처음부터 끝까지 집중해서 잘봤습니다ㅎ 하,,,,처음부터 임시완님 외모에 치이고 눈물에 치이고 눈빛에 치이고ㅠㅠ영화보고 임시완님에게 빠졌네요 "
10,연출 조명 미술 배우들의 명품 연기 그리고 마지막 엔딩신을 본 사람이라면 별점 100개도 모자랄 것 
8,수고한 배우분들과 스텝분들에게 박수를 
10,두 주인공의 케미가 장난 아닌데~~ 
8,사람을 믿지 말고 상황을 믿어라라는 대사가 계속 떠오른다 
9,마지막 장면은 명장면인 아닐까.. 
9,뻔한 스토린데 연출 때문인지 보는 동안 전혀 눈치 못깠음ㅋㅋㅋ 볼땐 정말 재밌게 봤다 
7,반전의 반전.. 생각보다 너무 재밌게 봤어요 
8,첫장면 마지막 장면은 잊을 수가 없어요ㄷㄷ.. 
7,그냥저냥 볼만한데..신세계 이후로 우리나라 느와르장르는 배우말고는 바뀌는게 없는것 같네요.. 
9,"이토록 절절한 러브스토리라니.... 차라리 ""사랑해""라고 말해버렸으면 좋았을 것을... "
10,이런 장르 좋아하는데 오랜만에 재밌게 본 영화에요~ 
8,볼까 말까 하다가 봤는데 생각외로 너무 재밌었어요 
10,불한당: 나쁜 놈들의 세상 
10,배우들의 연기가 참 좋아요 
6,신세계와는 비교할 수 없다. 주연들이 무게감도 없고 이야기도 극적인 부분이 없이 지루하게 흘러간다. 반전을 기대했지만 그것마저도 없었다. 
9,볼만했습니다. 연기력 
8,신선하지는 않지만 세련되고 재기있다. 감독의 똥볼이 아쉽다. 
9,공짜표이고 평점테러라 기대없이 봐서 그런지?  잼이 있었다. 1.~6점수준보다는 연출도 잘하고  연기도 잘하고 멋있음 ^---^ 임시완은 이제 가수였다는걸 못느끼겠음  완전 배우인듯  불한당 대박나세요 ♥ 
9,객관적으로 최근에나온영화중 난 제일재밋게봤는데 반전의반전도잇고 연기들배우도좋앗고 형사여자가 좀 연기거슬리긴했지만 끝에서 약간허무한감잇긴있었어도 재밌게봣음 볼만함 추천함 
9,오랜만에 마음에 드는 영화ㅋㅋ 감독님 트위터 접으세여 
8,무섭따 무서워ㅠ ㅠ 아무리 잘해도 한번 실수하면 OOO되는구나ㅋㅋ 
8,뻔한 소재로 뻔하지 않은 영화를 만든것에 대한 놀라움.. 
8,꿀잼. 배우들 연기다 잘하고 연출도 기가막힌당 
7,감독 입만 안 놀렷으면 더 많은 관객 동원되엇을듯 
9,"평점보고 걱정했는데 진짜, 임시완 설경구 조주연분들 연기력 대단합니당!! "
9,배우들의 연기에 압도당하고 분위기에 압도당하고 나왔다 
10,설경구는 언제든 믿고봐요 이번엔 오랜만에 인생작품을 찍은듯! 
10,잠깐도 화면에서 눈을 떼지 못했습니다. 진짜 재밌었어요!! 
8,처음에 교도소 나오는 장면은 좀 흔한 설정이었지만 뒤로 갈수록 색다른 느낌이었음 
6,그저 그렇습니다. 별점 10점은 임시완 팬들인가? ㅋ 
10,배우들의 미친 연기력에 더 실감나게 볼 수 있었다 
10,재밌어요 진짜 기대안하고 봤는데 더 재밌어요촬영도 그렇고 굿굿 
10,"무너져가던 설경구를 살리고 임시완을 자리매김 시켜주는 느낌이랄까… 기존 이정재,황정민의 신세계에서 브로맨스를 좀 더 강조한 영화. 왜 이정재가 이 영화 제안을 거절했는지 알것같음 "
10,새로운 장르의 등장이랄까ㅋ? 
6,설경구 임시완 연기 지인짜 잘한다. 
10,19금이고 잔인한 장면이 있긴하지만 거부감이 없는 영화였습니다 
10,오랜만에 재밌었고 마음에 드는 영화 발견ㅎㅎ 
10,친구들에게 불한당 보라고 추천하고 다닐만큼 재미졋어여 ㅎㅎ 
10,임시완의 연기와 색다른 연출력이 제일 돋보였어요! 영화 자체는 별 다섯개가 전혀 아깝지 않아요~ 
9,임시완 연기가 진짜.. 쩔었음.. 솔직히 그 여경 짜증났었는데 마지막 장면 ㄹㅇ 통쾌 
10,몰입도 끝내주고 배우들 연기도 끝내주고 마지막장면 여운이 계속 머릿속에 맴도는 불한당 강추합니다~~! 
7,제목 잘지은 영화제목 뜻 모르고 봤다가 이해 안돼서 사전 찾아보니 바로 영화 요약 가능했다 그리고 믿고 보는 임시완! 
10,임시완… 작은 체구에서 뿜어져 나오는 액션과 자신감은 누구도 예상할 수 없을듯. 앞으로 많은 연기 활동을 보여줫으면 함^^ 
10,처음에 프리즌이랑 비슷한내용인거같았는데 전혀 달라요! 임시완님도 연기잘하시고 영화도 잘만들어졌네요 돈이 아깝지않아요ㅎ 
10,꼬리에 꼬리를 무슨 비밀과 배신.. 
9,또 한번 아무나 믿지 말라는 교훈을 깨닫고 갑니다 ㅎㅎ 
10,"영화의 매순간순간이 긴장감이 넘쳤고 지루함이 없었다, 너무잼있게 봤다. 배우 설경구는 너무 멋있었고 배우 임시완도 자신만의 매력이 잘보였던 매력적인 영화, 과장함 없는 아주 멋드러진 느와르 영화였다. "
10,초반부터 흥미진진한 스토리.. 뒤로갈수록 푹 빠져들게 된다 
10,재미는 둘쨰치고 굉장히 여운이 남네요.. 
10,미리 시사회로 만나본 사람들이 다 극찬을 해서 궁금했던 영화인데 그만한 이유가 충분했군요 오랜만에 보는 설경구씨의 액션느와르 맘에듭니다 
10,설경구의 인기는 제대로 빛났다!!임시완은 아마 유아인 뒤를 이을 차세대 라이징 스타가 되지 않을까 조심스레 생각해봄 ㅎㅎ 
10,유쾌한 부분도 있으면서 그 속에 있는 묵직한 한방이 정말 흥미로웠습니다 
10,"재호, 설경구의 눈빛은 아직도 잊을 수가 없어… "
9,설경구 임시완 두 배우의 연기가 정말 굿이였어요 그외의 조연분들의 연기까지도 끝내줬습니다 
7,다들 연기는 잘햇지만...뭘 말하고 싶은건지..ㅜㅜ 
1,도대체 대한민국 법무부를 얼마나 개ㅈ으로 알고있으면 이런영화가 만들어지나 싶다. 
10,홍어들 아주 그냥 부들부들거리노 
9,감독이 엄청 잘 만들었는데 감독이 엄청 잘 망침 
1,정신사납고.. 그냥 재미가 없다!!! 끝!! 
1,이딴영화를 해바라기에 비교하는 개무식한 잡것들이 누구냐대체.. 보는내내 역겨웠다 
3,시작과 클로징은 상당히 맘에든다. 하지만 진행은 어설프다. 느와르가 아니라 사기극. 
1,감독이 일베라고 그러던데 맞나요? 
1,"망한 이유를 알 수 있었다. 납득 안 가는 상황설정과, 인물들의 이해할 수 없는 심리와 행동들. 특히 남주의 마음이 갈대더라. "
10,"액션, 느와르 진짜 싫어하는데  이 영환 정말 괜찮네요.이글 보신 분 저 믿고 영화 한번 봐보세요. 추천합니다.영화는 영화로만 봐야 한다고 생각합니다. 이 영환 감독 혼자 만든게 아닙니다. 별점테러하는 몰상식한 행동..."
1,아수라 다시보게 만드는 느낌영화네  올해 최고로 재미없는 영화네 감히 달콤한인생 그런영화 이영화랑 차원이 틀리니 비교하지맙시다 임시완 나온영화 다신 안본다 
3,감독 sns없다 치고 솔직후기프리즌+신세계 배낀느낌ㅋ 결과가 예측되고무엇보다 신세계처럼 긴장되는 느낌은없었음 
5,그냥 그럭저럭햇어요..조금 지루했습니다 
1,돈주고 보기 아깝다. 공백. 
4,요즘은 영화가  비슷비슷하네 
6,임시완은 모든연기가 장그래임.. 원라인도 그렇고 장그래가 폼잡는 그이상이하도 아님 연기폭이 참 좁다 
5,싸구러 에다가 더럽게 노는 건달과 이용 당하는 짭새들의 애기 
5,좋은 배우들을 흔한 시나리오 짜집기에 썼넹 
6,임시완이 배역에 너무 안 어울려서 계속 거슬리고 범죄 느와르인데 엄마타령 지겹네 
6,보고도찝찝한영화.. 
10,전라도는 과학이다 전라도는 과학이다 
6,그냥 보통입니다. 그리 잼있는지 모르겠어요 
1,이게 잔인하단 애들은 대체 뭐지 
3,그저그런 쏘쏘 임시완 잘생김 
1,안그래도 누구 나와서 안볼라켔지만.. 감독까지..ㅋㅋ 
1,일베하는 백수쓰레기 애들은 많이 봐주겠지 불법 다운로드로ㅋㅋ 
1,일베? 진짜 일베?  진짜? 
1,감독 인성이 그렇게 못됐다면서요? 
1,영화도  잼 없었는데 보고나서보니  감독인성도 개판이었네 최악 ㅜㅜ 
1,할 말없는 감독이 영화를 망치는구나 
1,다된 망작에 감독트위터 뿌리기 
1,대선끝났으니까 화이팅!!! 
6,배우들보고 밨는데 조금 실망입니다.. 
10,계속 되는 반전 때문에 긴장감 넘치게 봤어요~ 
10,장르의 재미가 가득했던 느와르 
1,흥행돌풍이 불고있다~~~ 벌써 70만명 돌파~~!! 
1,배우들이 불쌍하다는 느낌.. 
10,완전 재미있어요ㅎㅎ대박임 
8,칸에서 7분이나 기립박수ㄷㄷ 보통 4~5분이면 끝난다는데 솔직히 영화 잘만들긴 했음 ㅋㅋ 
6,몇마디 발언으로 인성까지 정의내리고 마녀사냥 하는게 참 보긴 그렇네요 그렇게 까지 문제될 만한건 없어보이는데 홍어 라는게 지역 비하라면 홍어를 국어사전에서 찾아볼수없도록 하고 홍어 요리나 말을 금지 해야 하는거 아님...
9,기존의 느와르물과는 확실히 달라요 재밌게 봤어요 
10,영화는 너무 재밌다 근대 감독이 트윗에 좀오바했다 ㅋ 감독한명의 영화는 아니기에 평점준다 임시완이란배우는 양파같다 대성할배우 
10,가타부타 말많은 영화이지만 사전에 아무생각없이 영화를 본 저는 좋았습니다 
10,좌파들 ㅂㄷㅂㄷ부들부들 
8,안보고 1점 주는 사람들도 참...적어도 연출 배우들 연기로  따지면  절대 1점은 아닌.. 
10,임시완 연기 스크린 뚫고 나올듯 연기 미쳤다 
8,아 진짜 설경구 너무 섹시한거 아니냐 진짜 
9,액션은 제쳐두고 카메라 무빙이나 캐릭터가 이끌어가는 느낌이 좋았다. 퀴어코드 노린것 같은데 차라리 더 드러내는게 나았을것 같다. 
8,반전이 없는 너무 뻔한 스토리전개 
7,영화 자체는 묘하면서 매력있었다 배우들 역시 하나하나 보는 재미가 있었음 
9,설경구 진짜 존나 멋있다 진심 짱이다 
10,일단 재밌게 봄ㅋㅋㅋㅋ 
9,영화 결말이 좀 허무해서그렇지 볼만하던대 ㅋ 평점테러 심하내 
10,영화보고 나와서 감독 트윗 봤는데...랜선 뽑고 살지 그랬어요.... 
10,우덜 기분을 나쁘게하면 무슨짓을 해도 벌받는다는 교훈을 주는 영화. 영화는 재미가 아니라 얼마나 우덜 기분을 좋게 해주느냐가 흥행의 최대관건이라는걸 깨닫게해주는 영화. 
10,잘만든영화..영화는 영화로보자..무슨일베니.정치적으로 엮지말고. 
10,영화 안보고 평점 남기는 사람 많은듯 ㅋㅋㅋ 완전 푹 빠져버린 영화에요 영화관가서 3번 봄. 완전 추천합니다. 화면 연출도 배우들 연기도 정말 최고네요 1점테러 믿지마세요 ㅋㅋㅋ 
8,스토리가 아쉽다 연기는 좋음 
5,임시완 설경구 연기는 아주칭찬해 
8,좋은 작품.. 재미는 물론 영화가 주는 메시지도 확실히 있고 좋았음 
9,이런 장르 좋아해서 그런지 대만족!! 
8,설경구. 나오늘 영화는 대부분 잊지않고 영화를 보는데 이번은 생각했던것 보다는 그렇게 감동적이지는 않았어요 
10,이런 스타일의 영화를 기다렸어여ㅠㅠ 
9,설경구형맨날같은데 요번에틀림 좋음 임시완 욕너무못함 
7,조조로 봐서 다행이다 혹시나해서 봤는데 역시 설경구 임시완 믿고 거른다 이제 7점이 딱 적당하다 
10,재밌어요 그냥.. 믿고보세요!! 
8,결말이 좀 애매하네요오오ㅗㅗ오 
10,딴짓을 못하게 만드는 집중력을 발휘했습니다 ㅎㅎ 
9,기대안하구봤는데 재밋네요 
10,전체적인 스토리를 가늠하기가 힘들 정도로 강력한 몰입도를자랑한영화!! 
10,설경구의 연기는.. 진짜 덜덜;; 그에 못지 않은 임시완! 
7,결말쪽에힘이좀떨어져서 괜찮은영화였는데구려짐 
10,임시완의 귀엽고 곱상한 외모와는 다르게 그에게서 풍겨나오는 에너지는 정말 대단.. 
10,앞으로 변성현 감독님 영화 눈여겨 봐야겠습니다. 
10,또 느와르야? 했는데 너무 재밌더라 ㅋ 작품성 인정! 
10,영화 내내 몰입하게 만드는 힘이 있네요 
10,관객을 홀리게 만드는 연출!! 대단하다!! 
7,임시완연기진짜잘했음 영화는막 기똥찬정도는아니고 볼만했음 
10,임시완  연기에 솔직히 말하면 놀랬다.약간 스릴있는 영화였다. 
10,시사회에서 봤는데... 대박이다. 올해 젤 잼나게 본 영화는 분명함 
10,ㅋㅋㅋ 대깨문들이 이미다 평점 양념 해놨었네 ㅋㅋ 
1,밋밋한데 뭐 이리 요란한지~ 
1,개노잼 임시완이아깝다 
1,감독이 홍콩범죄영화 메니아인가. 대학생 레포트 만드는것처럼 여기서 조금 저기서 조금 가져와서 짜깁기한 느낌이 났음. 영화보는 내내 제발 외국인이 이 영화 안봤으면 좋겠다고 생각했다. 
1,영화 신세계의 아류작.. 
1,감독이  관종이긴하지만 그런걸 다 떠나서 영화가 존나 노잼이다. 너무 뻔한 한국형느와르ㅋㅋㅋㅋ반전이 1도 없네 
1,설경구 니도 그정도 되는 배우면 좀 영화를 골라라...이딴 영화 에휴 
1,아무것도 없는데 임시완만 홀로 빛난다시완아 담엔 이 감독하고 같이 일하지 말았으면영화속 한물간 유머와 연출력에는 탄식이 나온다캐스팅도 아쉽기만 하고비슷한 시기 개봉작 중 최하다원래 평점도 안 남기는데 보고 임시완 아...
1,제목이 불한당인줄 알았더니 감독이 불한당 
8,감독의 언행만 아니였어도 이정도 평가를 받을 영화는 아니였다고 본다. 다만 아쉬운점이라면 두 주연배우... 임시완은 맡은역에 비해 아직은 너무 가벼워보이고 설경구는 점점 예전폼으로 돌아오는듯하지만 비현실적 감정과잉은...
1,신세계에다 게이 코드만 좀더 끼얹어서 부녀자 타겟한 영화. 신세계의 아슬아슬한 캐미는 대중적으로도 먹힐만했지만 이 영화는 노림수를 너무 자극적으로 어필해서 이 맛도 저 맛도 아닌 영화가 됨. 감독이 sns 안했어도 ...
8,나쁘지않다   감독만 아니었다면...그리고 임시완은  좀  약해보인다억지로 악역을 하는  느낌이 아직 많이 남는다..싸서  캐스팅하는지 아님 연기력인지 그도 아님 소속사 빽인지 모르지만  연기는 어느정도 하는데  도...
7,요즘은 조직폭력배 검거했다는 뉴스도 안뜨고 마약사범 잡았다는 뉴스도 잘안뜨고 완벽하게 유착되있는듯 하긴 어차피 잡아봐야 또생기고 반복이니 뭐 잡으나마나 하긴함 
7,그냥 쏘쏘 약간 필요이상 잔인한 부분이 있는데 범죄액션영화로 보고 넘였어요. 적당히 재밌는데 지루한 부분도 없진 않았어요! 
1,트위터 글보고 이게 감독이란 사람이 할 말인가 했다. 
1,정말 생각보다 별로임. 비추. 
1,이런 놈이 만든 영화가 흥행이 된다면 정말   불한당:나쁜놈들의 세상인거지 
1,하나도 아깝다.!!! 
10,별점 테러 하는 인간들 문제인네요 
5,뇌리에 남는 장면이 없다 
1,감독땜에 안볼란다.... 
1,설경구 싫어서 안볼라고했는데 감독이 더 싫네 ㅋㅋㅋ 
10,스토리는 그냥 그랬는데 감정선 연출이 정말 좋았다 
7,설경구의 연기력과 임시완의 미모가 허투루 낭비되는 안타까운 시나리오. 설경구는 임시완의 미모에 빠진건가 홀린건가. 차라리 곡성처럼 귀신에 홀렸다고 하는게 더 나을듯한 개연성.. 
10,칸에서 7분 동안이나 기립 박수를 받을만 했지ㅋㅋ 진짜 최고였어 불한당! 
10,와우 대단한 영화다 연기짱 
1,감독 쓰레기 ㅋㅋㅋ 영화 폭망하기를 물떠놓고 빌란다. 
9,스타일리쉬한 멋진 남자 영화 
10,올해 본 영화중엔 최고였어. 연기력 쩔고 2시간이 어케 가는지... 근데 영화평점마저도 정치화하는 꼴불견들은 대체 뭐니? 
10,엔딩이 주는 여운은 진짜.. 
9,개재밌게봤다 다들 보세요 재미있어요 완전 대박영화는 아니지만 절대 돈 안아까움 
1,감독이 찍고 감독이 똥 질한 자체 폐업영화 
9,개인적으로 개인 소장 하고 싶음.. 
10,세상에 믿을 사람 하나 없다는걸 느끼게 해준 영화 
10,너무 욕처먹길래 보고 왔는데 존잼ㅋㅋㅋ욕하는 사람들 제발 영화보고 평가하길 ㅋㅋ 
10,정치색 논란으로 호도당할만큼 쓰레기영화는 아님. 평점테러하는 것들 아니라면 7.5는 받을만한영화라 올려주려고 10점준다. 
6,재미있게봤는데 마지막 결말이 허무했어요ㅠㅠ주인공2명 케미가 참좋았는데...끝에 큰반전이있을줄 기대했는데ㅠ_ㅠ아쉬워요 
9,하도 욕먹길래 봤는데 잘만들었더라 영화는 존잼임 
8,스토리는뻔하고별로이지만 임시완연기가다살린듯 눈빛부터 설경구에게 주눅들지않고 잘 이끌어나갔고 이런 연기조차 가능한 배우인줄 몰랐네요 
8,기존 느와르들과는 색다른 스토리! 연출도 세련됨! 
9,"임시완 설경구 캐미가 정말 좋고, 김희원 빛났음.  영화음악이 아쉽다. "
10,긴장감 만점에 스토리도 옳다 이런 느와르라면 두번 보고싶어 
8,초중반까진 재밌었으나 후반갈수록 지루함하지만 배우들 연기력이 좋아 배우들 보는맛에 재밌었음!! 
6,박평식의 리뷰 80년대 홍콩 양아치 포스 딱 그느낌 
7,재밌다옹 설경구아저씨 임시완 연기잘한다옹 
10,오프닝에서부터 압도됨 ㄷ.ㄷ.. 헐리우드 영화에서 볼 수 있을 것 같은 느낌?! 
10,와 대박이예요 정말 재미있고 영상이 세련되고 멋져요 설경수 임시완 연기 압권이예요 르와르인데 보고 나오면 뭔가 여운이 남는...강추예요 
10,임시완은 앞으로 변호인이 아니라 불한당이 생각날 것 같다 
10,평점보고 트윗사건 만행 알았네 감독 ㅆba새기 ; 근데 영화자체는 갠적으로 느와르 영화 탑3 안이라고 생각함 여자형사 연기력 안습인거만빼고 그자리 염정아 넣지  . . 영화는 재밌음 ㅇㅇ 
9,재미있네 근데 문빠들은 싫어하겠네ㅋ 
10,와지렷습니다...레알루다가 
1,신세계 짝퉁 딱 그거 10자 
1,1점도 아까워요 0.001 정도? 
1,그냥 신세계 따라한거같은데 
8,재미있으면서도 살짝 유치 
10,믿고보는 배우들 역시나 실망없이 봤습니다 
10,영화봤는데 솔직히 재밌음 감독이 말아먹은 영화 
1,"ㅆㄹㄱ ,이런 ㅆㄹㄱ 는첨본다 "
10,알바 아니구 조조로 봤어요 감독님이 싫어서 안보려다 임시완님 궁금해서 신랑이랑 봤는데 연기력에 내용 너무 재밌게 잘봤어요 전 한번더 보고싶네요 참고로 전36살 두아들의 엄마 아줌마입니다^^ 
1,영화 찍기 전에 인간 먼저 되라. 
1,1점의 가치는 제작진에게 바칩니다. 
