score,review
7,기대가 너무 컸나... 그냥 4편 다시보는 정도 수준... 그리고 인종차별이 아니고.. 남자 주인공 너무 간지 안나~ 뭔가 좀 멋있는 남자 주인공이었으면 어땠을까? 라는 생각? 여주인공과 썸타는게 몰입이 안됨!! 
7,킬링타임용으로 좀 지루함.. 
6,솔직히 이전 시리즈들과 비교시 수준이 너무 많이 떨어진다. 스토리 약하고 개연성 약하고 흥미성 약하고 볼거리도 약하고... 그냥.... 제목이 스타워즈라서 관심 받은 영화인 듯 함.. 제목이 스타워즈가 아니었으면 망...
10,정말 매력적인 주인공들이었음 
10,기대이상이라는 말 밖에는... 스타워즈를 조금이라도 아는 사람은 감동하며 볼 수 밖에 없는 영화. 
5,6점 이하의 완성도. 액션신에서 포스를 느낄 수 없었다.. 밀레니엄 팔콘과 늙어버린 과거의 주인공들을 빼면 무엇이 남을것인가 
4,"영화를 못 만든 것도 아니고, 실사 느낌도 아주 훌륭하고 다 좋은데... 예전 스타워즈의 그 묵짐함이 전혀 안 느껴집니다. "
10,죽어가던 스타워즈 시리즈의 완벽한 부활... 
10,꽤 재밌게 본 영화 ㅋㅋ~ 
10,ㅆㅅㅌㅊ 루크가 석양 맞으면서 나왔단 그 브금 본편 마지막에 다시 나올때 진짜 개지렸다....ㄷㄷ 
8,전작의 색채를 잘 살린듯 하다. 근데 화려한 검술은 어디갔나? 
10,왕년에 보던 성님들 다 나오시고. 처음에 한 솔로 나오는 장면에선 소름 돋을정도로 감동.. 8편은 언제 나옵니까? 
10,이야.. 재밋다 재밋어. 왠만한 SF영화 액션장면은 그닥 재밋게 못 보는데 역시 스타워즈는 다르구나 
10,아주아주 재미있습니다 
9,"예전 스타워즈 시리즈 4,5,6을 본 사람으로서 이번 새로운 시즌 7은 기대하지 않았지만 왠걸, 옛 추억이 떠오르고 재미졌다. 그리고 새로운 여자 제다이에 대한 궁금증까지. 다음 편이 기다려진다. 그나저나 스카이워커..."
10,새로운 시작과 익숙한 분위기의 조화 
10,다음 애피소드가 기다려집니다. 
10,난 솔찍히 이정도면 충분히 만족햇음 
10,재미있게봤어요 즐감했어여 
10,재밌습니다. 시리즈의 명성을 이어가면 좋겠습니다 
10,프리퀼 시리즈 보다는 훨씬 재밌었음. 
10,정말 재밌어요추천합니다 
10,다음편이 기다려지네요 언제나올라나 인제 ㅜㅜ 
10,전편보다는 아니지만 그래도 스타워즈임을 증명한 영화 
9,아이들이랑 재밌게봤습니다 
10,좋아요 근데 자느라 보러가지못했음 
10,잼나여정말 잼나요정말 
9,앞으로 나올 씨퀄의 프롤로그같은 느낌. 본격적인 시작은 다음편일 것 같고 즐기기 위해서는 꼭 봐야하는 에피소드 
10,엔딩이 다음편을 기다리게하네요 
10,내인생최고의 영화 굿 굿  보면 속 이다 시원함 
9,정통과는 다른 뉴제너레이션의 시작... 
9,다음시리즈가 정말궁금 
10,역시 스타워즈!재미있었다 
8,역시나 재미있게 봤었어요. 가기전에 시리즈 한바퀴 쫙 돌고서 시작했죠. ㅋ 
9,어떠한 기록을 남기든...그래도 스타워즈다. 
10,올드팬에게는 새로운 쓰릴로지의 시작^^ 
9,꾸벅꾸벅  열심히 잘 보았습니다 
8,스타워즈. 첨부터 다시 복습을해야하나 
10,카 일 로. .  ..너무..좋ㅇㅏ... 
9,명불허전 수OO 이어온 명품영화 
10,"강렬했지만, 어쩐지 다음 편을 위한 예고편 느낌 "
10,마지막에 다음편이 궁금해집니다ㅋㅋㅋ 
8,역대급은 아니지만 볼만합니다 ㅎ 
10,와나 진짜 우리나라 영화 알바들아 작작해라.알지도 못하면서 
7,옛인물들의 등장! 너무 반가웠다... 그리고 새로운 포스의 등장... 앞으로의 이야기가 기대된다..! 
7,최공 다시보고싶은영화 입니다 
9,ㅁ구루우우우우ㅜ웅ㄹ잼 
10,역시 스타워즈 초등학교아들과봤네요대를이어 보네요.. 
8,재밌어요재밌어요재밌어요재밌어요 
8,헤리슨 포드는 너무 늙은 거지....아쉽다.. 
10,역시 기대하던 스타워즈 시리즈 재밌네요 
8,스리즈로 다보지못해  약간 횡설수설 했지만저력은 아주굿 
10,이게 왜 7점대지....난 스타워즈 시리즈중에 이게 3번째로 재밌었는데 
8,건강한 젊은이들이 주는 기운. 
7,좋았습니다재미있었어요 
10,스타워즈는 진리입니다 
10,초등학교  6학년인 막내아들과  같이 영화를   봤는데  그 자체로  감동입니다. 
7,신선하지않고 내용도 별로 ! 
10,"또 설레게 만드는 영화, 몇번째야 "
10,추억과 기대를 함께 버무릴 수 있었던 순간이었다. 
10,"명 불 허 전 이예여 ㅎ옛날 3,4,5 1,2,3 을 봤었지만 배우들이 옛날배우들이 다시 등장에 계속 설레이면서 봤어요 "
10,역시 스타워즈는 재미있네요. 
10,스타워즈는 역시 스타워즈 
10,정말 스타워즈의 진가를 보여주네요 이거 보려고 스타워즈 전에 있던 편 다봤는데 아깝지 않음! 
8,전작을 봐야 추억에 잠길만한 영화 
9,오래간만에  영화같은영화 본거 같아요. 
9,가보고싶은우주여행^o^ ^o^ ^o^ 
10,빰빰빠빠빠빰빠빠빠빠빰빰빠빠빠빰 
9,잔잔한 감동을 주는 내용으로 모처럼 가슴이 먹먹해지는 영화였네요 
9,작년에 봐는데 리뷰는 지금씀 ㅋㅋ 
9,이름 값은 충분히 했다 8편도 이정도 퀄리티만 나왔으면 
10,매드맥스와 더불어 2015년 최고의 영화 
10,평점테러를 많이 당했군 
8,바톤 터치의 좋은 예시 작품 
10,재미나요. 포스와 함께하길 
7,네 재밋어요 추천추천추천합니다 다음편도기대중ㅁ 
10,굿~~~또보고싶어요 
8,평점은 최대 140까지 등록 가능합니다. 영화와 상관 없는 내용이나 스포일러는 약관에 의해 제재를 받을 수 있습니다. 
10,오래 기다린 보람이 있네요 
10,기대이상영화. 너무재미있습니다 
8,다음편이기대됩니다^^ 
10,스타워즈재미잇엇습니다다 
9,스타워즈를 새로 볼 수 있었던것만 해도별 10개 감이지만 악역의 포스가 약했던게 흠 
8,너무 기대해서 그런가 살짝 아쉬웠지만...담편이 빨리 나왔음 조켓음!! 
8,"반가운 작품, 새로 등장하는 인물들의 캐릭터성은 좀 부족했는가...! "
10,뻔한내용인데도ㅋㅋㅋ흥미진진했어용 
8,새로운  시리즈에대한 포석 !다음편이 기대되네요 
10,좋아요 좋아요 좋아요! 
8,좋아 좋아 좋아유. 선과 악의 대결!!! 
9,영화관에 불나서 못봤어요 
8,잼있다.  역시 실망을 시키지 않는다. 
10,에이브람스가 영화룰 넘 잘만들어서 스타트렉 팬들한테 칼맞을것같은 영화 
10,최고지만 추억팔이 약간 
10,다음편이 너무 궁금해요 빨리나왔으면 좋겠네요 
9,아이들과 재미있게 봤어요 
9,애들이랑 재미있게 봤어요 
10,재밌고 다음편이 기대되는 작품이다 
10,역시 믿고 보는 스타워즈 
8,이정도면 스타워즈 광팬이 아닌 입장에서 매우 재밌습니다만 매니아라면 실망을 할수도 있어요 
9,정말 재미있었습니다.ㅇ 
9,팬이라 무조건 즐거웠습니다 
9,루크 스카이워커... 이제야 나오나요오오 
9,스타워즈 전작을 제대로 보지 않고도 영화를 이해하는 데 어려움이 없어서 좋았습니다. 
10,딩굴이 귀요미 전편안봐도 재밌음 
10,아들 잘못 둔 한 솔로  ㅠㅠ... 
8,전 스토리 숙지 필! 다소 어려웠어요. 
10,다시 보게 되는 시리즈~ 감독에게 감사할뿐~ 
10,"배급사를 옮겼다고 들은 거 같아서 너무 바뀌지 않았을까 걱정했는데, 옛날의 스타워즈 감성에 최신 CG까지 장착해서 돌아왔더군요. 스타워즈 특유의 장면전환이랑 배경음, 이전 시리즈에서 봤던 배우들을 보면 전율과 감동이..."
9,벌써 다음편이 기대된다! 
10,굿드굿드굿드굿드 잼잼 
8,"그러니깐 이게 뭐야,   한솔로의 아버지에게 꼬드김을 당하여 어둠 세력에  붙은 루크의 아버지 다스베이더가  한솔로의 아들을 꾀어서 루크의 딸과 싸움을 붙이고 있다는겐가? 이거 완전 집안 싸움이였네?? "
7,산만했지만 볼만했어요. 
8,"평이 별로길래 기대 안했는데, 예상외로 정말 재밌었어요~오랫만에 유쾌하게 봤던 영화~^^ "
8,R2D2의 무심한 귀여움에 비해 BB8는 귀엽게 보일 거라는 걸 강하게 의식한 것 같다. 
6,스타워즈 처음보는거라 그런지 이해도가 떨어졌다. 하지만 지루하진 않았던 영화인것 같다. 
8,나머지 2점은 남은 두편을 위해 남긴다. 
7,스타워즈만의 세계가 있다상식적으로는 말이 안되는데 그 세계에서는 통한다.싸구려 영화라면 그려려니하겠지만천문학적 비용들였고 또 흥행도 성공했으니틀림이 아닌 다르다고 해야할듯 핟 
7,전반적으로 기대에 미치지 못한다 
6,그냥그래요 같이봤는데엄마는괜찮다하시고 
9,작명 만큼 전쟁의  서막입니다. 다음  편이  기대되요!!! 
8,12345679점이아닌8점 
8,재밌었습니다.... 
10,굉장히 재미있게 봤습니다. 
9,스타워즈 처음봅니다 재밌어요^^ 
8,"보는 즐거움이 확실한 영화!!마지막 장면 보고 울 아들 하는 말...""어? 엄마 저기 독도다!!"" ㅎㅎ "
10,다음편이 더욱 기대되는 영화 
10,역쉬 스타워즈 아하 언제 또 기다리나 
9,옛추억이 새록새록 돗아나는 영원한 SF의 명작 
10,난 이영화를 보고 광선검이 사고시ㅠ너졌다 
8,Good good  good 
10,개꿀잼이다!!!우리나라에서 스타워즈가 대중적이지 않아서 아쉽다ㅠㅠ 
8,다시 한번 SF의 신기원을 볼수 있는것만으로도 감동 
9,전편도 봐야할듯힙니다 
7,"스파워즈 시리즈를 별로 보지 않아서 (내용은 대충 알지만) 그닥 큰 감흥없이 봤어요,. 그래도 한 솔로나 츄바카 공주 등 예전 등장인물들을 보는 건 나름 재미있었어요. "
10,너무너무 조았어요 위잉 푸슝 표엉표엉 합니다 푸슝 쿠와아아아앙 
10,쪼오끔 재밌었어요 쪼오끔 
7,나쁘지 않았습니다. 전작에 비해서요.. 
9,루크등장을기대햇으나마지막만나와아쉽네여 
10,마지막 장면 보고 전율.. 
9,원작을 그리워하던 사람에겐 최고의 선물 하지만 한편의 영화로 보기엔 한참 아쉬운 
10,이번 편도 그렇다 스톰트루퍼가 쏘면 안맞고 스톰트루퍼를 쏘면 맞는다 
7,개연성이 쫌 떨어진다.  특히 여주인공이 아무런 훈련없이 훈련 받은 카이렌보다 포스가 더 강해서 이기는건 무리한 설정같다. 
6,스타워즈는 악역이 간지나야 제맛 
8,스타워즈 팬을 위한 교과서적인 속편이네요 
10,마루밑의 아리에티인줄! 
8,그래도 아직은 스타워즈 
10,스타워즈 팬인데 재밌게 잘 봤어요~ 
9,지루하지 않았어요 재미있었어요 
8,이영화를 보기위해 전편 6편을 다 보았답니다.참 매력있는 영화입니다. 
8,"좋아요... 그러나,,지난 시즌에 비해.. "
7,이전작들보다 내용이 떨어지는거 같음... 
9,재밋다진짜잼따너무너무잼따 
7,역시 우주영화는 스타워즈군요. 비쥬얼을 따라갈 수가 없습니다. 해리슨 포드 아저씨... 
10,완전 잼 있게 봄~~!! 짱~~!! 
8,쌍J의 깔끔하게 돌아온 스타워즈 
8,옛날 등장인물들 한명한명 기억이 새록새록 나면서 정말 재밌게 잘봤어요 
10,이전 시리즈 하나도 안봤는데 이해도 잘되고 재미있었어요! 
10,스타워즈의 새로운 3부작 기대됩니다.에피소드 4~6라도  꼭 보시고 7 보세요 
10,스타워즈 시리즈 중 첨본 작품.. 전작을 안봐서.. 약간이해가 안갔지만.. 그런건 전혀 노상관... 이건뭐 스케일이랑 영상이 비교불가수준.. 걍 보셈~ 
10,재밌는데..시리즈의 시작으론 괜찮은것같은데..근데 에피소드1 보다 평점이 낮은건 좀 이해가 안됀다 
4,누가그랬니? 전편들 안봐도 충분히 재미있을거라고... 핵수면제였음. 위상을 충분히 감안했음에도 불구하고 너무나 재미없었다. 우당탕탕 2시간 15분... 
10,"이정도면 7편으론 충분하다. 8,9 편이 기대된다 "
9,역시 스타워즈입니다      *^^* 
9,가족이 함께 관람했어요. 아이들보 즐감했고요. 어른들이 더 즐감한것 같아요. 가족이 즐감한다면 더 좋을것 같아요. 
10,재미남 근데 이 담편이 더재맜을거같음 
10,두번 보세요 세번 보세요 
10,개꿀잼 내인생 최고의 영화중 하나 
8,좋았다는 말로 설명될듯 
9,재밌어요 재밌어요 정말 
5,같이갔던 신랑 별 로라네요. 담편 홍보식 스토리 전계라고. 저도 첨엥 괜찮았은데 뒤로 갈수록 지루한 감이.... 
10,"안보신 분들 계시면 보지 마시고, 10편까지 나오면 몰아서 보시길... "
6,기대치가 너무 컸나...평가말들이 다맞다... 스케일 키우고 그러지. 이건 뭐 완전에스에프도 아니고.. 스케일로 조지는것도 아니고. 뭔가가 아쉽다.. 마지막장면은 독도 주인공들이 후지다. 
10,덕후로서 행복한 시간이었습니다 
7,"우주를  무대로 펼쳐지는  강력한  힘에 대한 욕망과 이에 맞서 끊임없이 투쟁하는 인간의 본성을  그린 휴먼드라마,  2세들의  등장과  늙은  주인공의  죽음으로 자연스런 세대교체를 보면서  인간의 숙명,  삶과 ..."
9,스타워즈시리즈 아들덕분에 처음봤는데 너무재미있게 봤어요. 2시간이 어떻게갔는지 모를정도로 너무너무 재밌게봤습니다 
10,좋아요좋아요좋아요좋아요 
9,오프닝치곤 탄탄하고 볼만함 
9, 딱 새로운 789시리즈 서장에는 맞으나 기대를 하고 봤다간 좀 실망스러울 수도 있기도 하다 
10,다음 에피소드는 어떻게 기다리나~!!!! 
10,무한 상상의 결과물...너무 재미있어 눈물이 난다. 옛 추억을 떠올리게 만드는 장면도 많았음 
7,재미있게잘보았습니다전편을보지않았는데도괜찮았어요~~^^♡ 
10,난  재미있었음!!!^^ 
8,옛 스타워즈의 향수를 불어왔던 영화 
10,기다려온 보람이 있는 영화 
9,생각만큼 아주 재미있습니다 
8,친구들과 크리스마스에 잘보고왔어요~자동응모된 이벤트에 당첨되서 넘나 좋은것ㅎ 
9,오랜만에 스타워즈 재밌게 봤어요 
10,2번 봤다 ...ㅜㅜ 너무 재밌음 그리고 bb-8 너무 귀여워 
9,스타워즈의 팬들에게 주는 선물같은 스토리! 그러나 에피소드 4가 겹쳐보이는것은 양날의 검과 같았습니다. 
9,믿고보는 스타워즈 다음편도 기대됩니다! 
9,재밌네요 역시 스타워즈네요 
10,미친 명작이다 이거. 비록 주인공들에게 너무 운ㄱ이 돌아가기는 했는데 미친 꿀잼 
10,잼있거 봤네요.볼까 말까 상품평도 검색하고 예매해봄..추천할만함 
8,재밋어요. 근데 루크는 마지막에만 잠시 나옴 ㅋ 
9,이야기 흐름이 전작들이랑 비슷해 식상한 측면이 있지만 연출력이 뛰어나서 꽤 재미있고 스타워즈 자체가 업그레이드 된듯한 느낌을 받는다. 라스트 광선검 대결씬에서 소름돋음. 
7,대호보다는잼씀.... 
9,카일로렌이 너무약한것 같은데 기분탓인가? 
10,원래  스타워즈 잘 몰랐는데도 정말 재밌게 봤어요!전편도 다 볼 예정이고 다음 에피소드도 기대됩니다!! 
8,아이들하고 보기엔  무난하고 잼있는 듯 
9,넘 잼나게 잘 봤습니다 ~~~ 
9,전편안봤는데재미있었음3D추천함 
9,오랫만에 아아들과 재밌게 보았음 
9,bb-8 사고 싶어요영화 보는내내 bb-8이 갖고 싶다엿음 ㅋㅋ츄이에서 갈아탐 
8,관객이 기대하는 바로 그것을 채워준다. 바로 스타워즈의 맛!!! 
8,알면서도 당하게 된다.J.J 에이브람스가 지금까지 보여왔던 떡밥의 기술을 총망라하여 관객을 괴롭히는데....요즘은 떡밥회수도 제대로 못하던데 믿어도 될까? ㅠㅜ아무튼 나름대로 스타워즈 팬이라면 재밌게 볼수있다고 생각...
10,역시 살아있는 영화네요!! I love Starwars!! 
7,포스가 쌍제이와 함께 하기를 
8,스타워즈 시리즈는 처음이었지만그 명성이 허투루 쌓인게 아님을온 몸으로 느꼈다. 전작을 다봤다면 분명 10점을 줬겠지... 
10,아들과 너무 재미있게 보았습니다. 
10,아들과 즐겁게 관람했어요. 
10,"루크가 나타나서 ""스승으로서 용서 안한다."" 하며 현란하게 칼질 하는 옛날모습을 기대하고 봣엇는뎁.... 에효ㅠ "
8,뛰어나진 않지만 무난하게 아이들과 볼만한 영화 그래픽도 좋고 스타워즈 모르는사람이라도 볼만한 영화인듯 
9,아이들과 부담없이 잘 봤어요.. 
10,스타워즈 계속 나와줘서 고마워요ㅠㅜ 
10,스타워즈 중에 명작이라고생각합니다 카일로렌의 그 가면벗기전에모습은 포스가 너무느껴졋어요 스토리를 모르시는분께는 이해가안가실수있지만 스토리를다보니 정말 인생영화였습니다. 
10,루크는 오랜 수련으로 배운 포스를 여주는 독학으로 단번에 해낸다는 설정이 조금 아쉽...후속편도 있는데 호흡을 좀만 느리게 했어도 좋았을뻔! 
9,거참 악당 마스크좀 멋있게 만들지 그래서 별점 1 깎음 
8,오랜만에 보는 반가운 얼굴들과 눈에 익숙한 우주선들 그리고 그 반가움을 계속 반감시키는 핀과 레아의 연기력. 루크와 한솔로 그리고 레이아공주가 살아있는 동안 한편 더 볼 수 있을지. 아이맥스3D 강추합니다. 통신사 ...
8,잘만들었는데 우와! 하는건 없음. 티켓값은 하는데 팝콘값까지는 못함. 
10,역시나 역시...스타워즈 
10,보는 내내 가슴 뛰었다. 한솔로 등장할때 일어나서 박수칠 뻔. 
9,레이가 쑥떡 먹는 장면이 가장 인상 깊은 먹방이었어.. 
10,시간이 너무빨리 지나가네요 ㅠㅠ 재밌어요^^ 
9,볼만합니다  다음편도 기대되네요 
10,이게 진짜 와 정말 굿입니다요 
10,야기븐조타을디응디응디 
10,오프닝 노래를 듣자마자 추억이 물씬... 
10,잼나네용 아들들이재밌어했어용 
10,두번 보고나니 알겠다. 쌍제이가 밑그림을 정말 잘 그려놓아서 감독이 바껴도 될 것 같다는 것을. 
9,재밌었어요 추억이 새록새록 
9,스타워즈의 추억을 가진 사람이라면 감동적으로 볼 수 있는 영화. JJ 에이브람스 감독의 뛰어난 구성이 돋보였다. 
10,졸잼스타워즈 시리즈임을 증명 
9,쌍제이 가 잘 살려놓은  새로운 트릴로지의 시작 
10,잘모르겠고 죽인다고 하드만 
8,나름 볼만하고 재미있었음 전 작을 보고 보는게 훨씬좋음 
7,전 시리즈를 봐야지 아는 내용이여서 약간 내용 이해가 부족했지만 재미있었다 
10,"역시 스타워즈는 한 솔로, 루크, 레아, 스톰 트루퍼가 나와야지... "
10,BB-8 완전 귀여워요 
9,명불허전 역시 스타워즈네요! 
10,와...내가이시대에  테어나서  이영화를  볼수있어서  정말로  다행이라고  생각한다. 
10,★★★★? (^^)b 
10,초중반부는 별로였지만 저항군 등장 이후부턴 대만족. 다만 영화가 향수 자극 위주라서 일반 관객들은 호불호가 갈릴법도 하다. 
9,"시리즘ㄹ은 연결하는 재미이죠,... "
7,재미는 있으나 쪼금은 지루한감이 없잖아 있었어요...개인적으로 4번째편이 가장 재미 있었는데... 
10,"다크포스의 약함은 있지만 나름 성장하는 중이고, 뒷 배경이 더 궁금해지네요. 옛날 시리즈 팬으로서 이번 연결은 진짜 쌍제이의 신의 한 수 이고 너무 잘 만든 느낌이 나네요. 영화 너무 재밌게 봤고 앞으로 너무 많은 ..."
10,완재!!!다음 시리즈가 기대됩니다 
10,이게 왜 7점대지???? 
9,첨 봤는데 나쁘지 않았어요^^줄거리 몰라도 괜찮았어요 
8,"왕의 귀환, 명불허전, 뿅뿅뿅 "
10,"스타워즈 전편을 봐왔기에 꼭 봐야할 7편...ㅋㅋ 보고나서 4,5,6편 다시봤는데 또 다른 재미가 있어여...^ "
10,이전 시리즈내용도 잘모르고봤는데 이번편 나름대로 이해가가고 재밌었어요ㅎㅎ집가서 전 시리즈다보니까 되게 감동적이었네요..근데 카일로렌 가면벗을때 이광수인줄;; 
9,"이전 작품을 하나도 못 봤는데도 불구하고 재미있었다. 스토리는 정확히 모르겠지만, 우주를 배경으로한 통쾌하고 시원한 영상미 만으로도 충분했던 영화. "
9,스타워즈 1편부터 보아온 팬으로서 다시 새로운 시작을 볼 수있었다는 사실에 대해 이미 감동적입니다. 상상력을 극대화 시키는 비주얼을 정말 대단하고 스토리 역시 실망없었습니다 
9,재밌었다 10자. 재밌었다 
7,"조지루카스의 1,2,3보단 나았다. 허나 다음편을 제대로 못풀면 망하는 시리즈, 제이제이 다웠던 시작이다. 스타트렉 리메이크보단 못한 시작이었지만 "
8,전편안보고본것치고좀괜찮 
10,최고입니다 기대를저버리지않네요 
8,솔직히 새로운 희망이랑 스토리가 비슷한것만 빼면 꽤나 수작이라고 생각한다.(사실 세세히 살펴보면 새로운 희망과도 많이 다름)확실히 쌍제이는 연출은 잘 하는데 제 떡밥에 자기가 넘어지는듯.... 
10,스타워즈답게 잘만든 스타워즈같은영화 
10,개재밋음 꼭보센 미친 개멋짐 
10,언제 다시 볼수 있을지...ㅜㅜ 
8,내용을또거꾸로했네 차암 에피소드4처럼 하는구나 
8,러닝타임이 모자랐던 느낌이다.. 너무 급전개다보니 연출이 허섭해보이기도.. 하지만 영상미가 끝내준다. 특히 올드스타일로 CG 떡칠이 아니고 광곽으로 잡은 장면이 많은데 상당히 날카로운 화질로 메마른 질감들이 입체적으...
10,재밌네요~~~~!! 역시 스타워즈~~! 
8,함 볼라해도 볼수가 읍넹 ㅜ.ㅜ  에겅..나왔을때 얼른 볼것을...CJ 징하다... 
9,팬이라면 강추합니다!!! 
8,전에 봤던 스타워즈 내용보다는 스케일이 조금 작이 진듯 했지만 그간 영화산업의 기술적 발전으로 인하여 좀더 스펙터클하고 박진감이 넘치는 것 같다. 앞으로 1년에 한편씩 나올 것 같은데 아이들이 있다면 1년에 한번씩 ...
10,전편 안봐도 아주 볼만한 영화~~ 
9,재미있게봤습니다만 ..전작에비해 주연들의 성장이 덜되그런지카일로 렌은 강력한적이라기보단 다스베이더 빠돌이같았음 
8,"요리재료는 어차피 정해져있는 상황에서 감독이 적절하게 요리를 했다고 본다. 같이 관람한 딸과 아버지인 나, 모두 만족스러웠다. "
8,아이들이 잼 있어합니다 
10,스타워즈를 이어나간다는 의미만으로도 10점! 개인적인 평가니까 10점. 
10,완전재밌네요 확실이 스타워즈 짱 
8,BB-8이 너무 사랑스럽당 
9,방학맞아 아이들과 함께 봤어요~ 
8,스타워즈를 보지 않은 저도 충분히 즐길 수 있었는 듯. 
10,와~~ 시간이 아깝지않았어요아이도 완죤  집중해서 보고 갠적으론 지금까지 본것중 젤 잼났어요 ^^ 
9,스타워즈 시리즈를 다 못봤는데도 내용이해에 크게 지장은 없었습니다. 지루하지않고 재밌었어요. 
8,초반에 좀 지루했지만 역시 스타워즈임당 
10,"쩐다는 말밖에 안나온다, 진짜 최고의 영화다. "
9,"역시 스타워즈. 예전에 나왔던 배우들을 그대로 캐스팅했다는것이 정말 신의 한 수. 그리고 스타워즈에서만 볼수있는 우주선추격신과 광선검의 마찰. 최고의 연출과 존 윌리암스의 음악. 모든것이 조화로웠고, 4,5,6편에 ..."
8,1편과비슷한느낌이 있지만 확실히 스타워즈는 반드시 봐야합니다ㅋㅋ 
8,아이와 함께 어른이 봐도 괜찮은 영화 
8,가족들과 함께 재미있게 봤습니다. 
7,눈이 호강합니다 엄청  화려하네요 
7,루크 스카이워커가 넘 보고싶다. 
8,간만에 재미잇게 잘봤어요 
10,"4050세대인 주부로서  스타워즈 초반시리즈를 남동생들과 챙겨보았는데, 이번엔 성인인 아들과 같이 보면서 감회가...아군전투기의  제국기지에 침투씬이나  한쏠로가 아들과 맞닥친 공중다리 씬도 예전에  영화장면과 겹치..."
10,결국 J.J 에이브람스는... 다음편에 떡밥을 던져놓았다.영화를 보면서 느낀점은 감독과 흑인 배우가 초반에는 친했다가 중반에는 싸웠다가 후반에는 살짝 배우가 숙이고 다음편 연장부탁 한듯한 느낌이 든다.. 나만 그런가...
10,최고.더 할말이 없다. 
9,스릴만점..재미있었어요 
10,스타워즈 첨보는데 넘 잼께봤어요 
8,"액션 장면들이 꽤 재미있었고, 주인공이 여자여서 색다르고 좋았음. "
8,중간중간 조금 지루하긴 하지만 아들과 재밌게봤네요.. 
