score,review
10,궁금한건 왜 벤이 다크사이드로 변했는지... 또 아쉬운건 비중이 큰 한 솔로가 너무 쉽게 죽은건 아닌지 좀 많이 아쉽네요. 인상깊은건 라이트(다크) 쉐이버의 간담을 서늘하게 긴장하게 하는 효과음 정말 좋았습니다. 다...
6,재미있네요. 스펙타클한 영상미에 매우 깊은 인상을 받았습니다. 
5,아 이게 왜 재밌는지 모르겠다 솔직히 
8,"아직 미완성인 빌런이  좀 아쉬웠지만 스타워즈 리부트로서는 충분히 만족할만한 영화. 뼈대를 4,5편에서 가져온게 좀 많이 티나지만 거북하지 않음. 오히려 3D로 떡칠한 프리퀄 3부작보다 훨씬 좋았음 "
10,"스타워즈를 막 챙겨보고 그런편이 아니라, 그냥 아빠께서 좋아하셔서 가족다같이 보러갔는데! 생각보다 꿀잼!! 반전도 있고, 흥미진진해서 계속 발끝에 힘들어가고ㅋㅋㅋㅋ진짜 정말 재미있었어요! 벌써 다음시리즈가 기대되요ㅠ..."
10,아무래도 이전에 스타워즈 456편 안보신분들은 스토리 이해가 잘 안되서 평점 낮게 적으신듯 아무리 봐도 완전 개명작인데 
10,박평식 기자 7점 줬는데 1점 주는 분들는 알바이신가 봅니다. ogs1****님이 생각한 그자체가 쓰레기이겠죠. 
9,당신의 잠재된 힘을 깨우치게 되는 초석이 될수도 있는 영화 
10,울었어요 포스가 얼마만에 깨어난거야 ㅠ 
9,잘보았음역시3D가대세 
10,남편때문에 따라갔다가 제가 더 흥분하면서봤네요.스타워즈 전편들을 못봤지만 깨어난포스하나로도 충분히 이해가됐어요! 
8,스타워즈의 그 웅장한 음악이 아쉬웠지만 잼있게 봤습니다. 
10,아들이넘재미나구담편이빨리나왔으면좋겠어요스타워즈최고 
9,후편이 없을거라고 생각하고 있었는데 나와 무지 기쁜 맘으로 보고 역시 기대를 저버리지않는 영화 
10,엄지척 엄지척 엄지척 엄지척 
10,초딩아들과재밌게봤어요 
10,스타워즈 기본에 충실한 괜찮은 영화였습니다 
10,6편이나 나온 스타워즈 프랜차이즈를 전혀 망치지 않은 수작이었다 
10,빌어먹을 알바련들아 평점 테러 작작해.평점 테러해서 얼마나 받는다고 
10,"수준이 다르다,,역시 스타워즈다 "
10,와이프 하고 잘보았습니다(￣▽￣)/2시간동안  정신없이  보았네요 
10,추억을 되살리고 새로운 등장인물이 잘 어우러진 비빔밥같아서 잘보았습니다 
6,꼭 보세요 잠 한숨자고 나온듯한 상쾌함. 옛날 심형래  감독의 영화느낌 물씬 
8,스타워즈 시리즈는 처음보는데 시간 가는줄 모르고 재밌게 봤네요 ㅎㅎ 
9,보고싶었던 영화 아들과 즐겁게 보았어요. 
9,역쉬~~스타워즈~~기다린 보람이 있네요.몰입 안되는 캐릭(다른 배우를 썼었으면 했던..)하나 제외하고는 기대를 벗어나진 않았어요~다음편도 기다릴테니 실컷 욕심대로 만들어주세요. ♡♡ 
9,돈이 아깝지는 않앗네요 
10,영화 1년 기다려서 봤는데이제 2년 또 기달려서8편 봐야겠네 
10,최고 짱짱 말이 필요없는 SF최고의 영화 
8,새로운 스타워즈  오리지날 팬들과 새로운 팬들 다 만족시키는 영화^^ 
8,지루하지않고 나름 스릴있었는데. 월래는 히말라야볼라고했는데 잘못예약해서 이거보게된거치곤 볼만했음 
10,엄청재밌네요!! 스타워즈처음봤는데 약간 옛날풍인데 신선하네요!! 다른 시리즈도봐야겟어요ㅋㅋ 
9,기다림을 채워주는 통쾌함! 
10,평점계의 천일염 박평식도 스타워즈의 팬이였어 ㅋㅋㅋ 
10,스타워즈는 명작이다. 
9,"에피소드4,5,6의 모든 인물을 만날수있는것만으로도 오케잇! "
10,역시 갓타워즈 한솔로 간쥐 
9,"점수가 낮아서 9점뿌리지만, 스덕인입장에선 좀 아쉬웠어. 에이브람스형이 딴건 다 강한데, 캐릭터성에는 살짝약한면이 있어. 스타트랙도 그랬고. "
10,정말 재밌다 무조건 봐야된다 1에서 6까지 다 본사람이라면 
8,카일로렌의 비밀과 가면을벗은모습을 너무빨리 보여줘서 좀...아쉬웠지만그래도 재밌긴 재밌었다. (만족!) 
10,재미짱입니다  울아들과 같이  잘봤어요 
9,기존 주인공들을 보는 감동과 함께 깜찍한 BB-8 보는 재미가 쏠쏠하다 
10,후속작 나온다길래 기대 중이었는데 저버리질 않았음 
10,광선검 고전영화! 짱짱 
10,"32년만에 속편을 본 듯 하다. CG로 떡칠된 지난 10여년전의 1, 2, 3편이 오징어처럼 보일 정도로 CG를 최소화한 것과 노년의 해리슨포드가 잘 녹아든 플로우가 압도적이다. 액션신은 당연히 최고 !! "
9,재미있어요 예전 캐릭터들을 보는 재미도 쏠쏠합니다 
10,정말정말 재미있었습니다. 
6,쓰리피오 알투디투 헤리슨포드?추억 속 얼굴들이 반가웠지만 전투기도 그대로 우주행성도 외계종족도 기존에 봤던것과 별반 다를게없이 어디서 본것같은 모습뿐기발한 상상력은 실종됐고 안이했다ㅜㅜ 
8,헤리슨 노환으로 돌아가신건 무척 아쉽지만 8편이 기대되는 2시간 30분이 10분 같있던 훌륭했네요 
10,정말 재미있었어요 여주 정말 멋졌어요! 
10,역시 포스에 일인자는 아니킨 스카이워커~ 일명 다스 베이더!! 손자에게 까지 영향을... 
7,여러 편 준비하고 있나보네요. 내용전개가 없었던 듯. . . 
9,재미있게잘보았습니다 
9,역시 스타워즈였다... 너무나 기다렸었던 영화이다보니 기대가 컸던만큼 좀 아쉬움도 남지만... 한솔로의 등장에서 세월의 허탈함이 느껴지며... 울컥 
9,10년만에 다시보니 새롭네요 
10,그들의 가족사적 레퀘엄!영화는 판타지와 재미다! 
7,"다좋은데 악당이... 약하고,포스없고,허무하고,이광수 닮았고 ... "
8,클리이막스가 없어서 밋밋 합니다 
7,전편들에 비해 재미 덜하다. 
5,미국에서 개봉한날에 지금 방금 막 보고나왔는데. 내가진짜 알바도 아니고 스타워즈 광팬도 아니지만. 아 솔직히아니 좀많이 재미없었다. 나랑같이 본 2명도 실망하고나옴. 양덕이 아닌이상 그냥 무표정으로 일관하고 상영관 ...
9,11살 아들과 관람했는데 감동적이였어요 
8,7살 아들이랑 재밌게 봤습니다.. 
9,신구의 조화가 좋았던 영화였습니다. 자녀와 함께 즐기기엔 더없이 좋은작품 이예요 
9,실제로 가보면 나이좀 드신 30~40대 분들이 많더군요ㅋ 
10,새로운 시대를 연 영화의 끝은 없다. 그 유산은 앞으로 영화라는 미디어가 사라진다해도 남을 것이다. 스타워즈는 그러한 영화이다. 나는 이 영화를 극장에서 봤다는 것 만으로도 감격에 벅차오르며 작품 자체도 10년만에 ...
7,"조지루카스가 감독이었다면, 10년만에 접하는 오랜 뮤지션들의 재결합같은 사골국 스타일은 아니었을듯.아마 ,몇번을  바야 할  스토리를 쏟아냈을 듯., 지난 과거의 오마주가 아닌 .꽉찬 내용이었을 텐데.언제 스타워즈가..."
9,아쉬웠건  가면 벗을때...마치 베컴얼굴만 보다가 목소리 들었을때 느낌...그리고  핀정도는 한번에 보냈어야 하는거 아닌가 싶은디..ㅋㅋ암턴 그거 뺴놓고는 재밌었다.  에피소드 4~6편 느낌을 그대로 살렸다.. 
5,시리즈를 안봐서 그런가 조조로보러가서 꿀잠자고옴 
10,역사에 남을  명작이 지금 상영되고 있습니다. 꼭보세요 
7,기대안했는데 안한만큼 딱 더도아닌 그정도 
8,재밋지만 아이들에겐 다소 지루할수있음 
8,"포스의 대결! R2D2나왔을때, 눈물남!!! "
6,초딩용 sf드라마.  스타워즈여서 봤을뿐 상영시간 절반은 졸았음 
4,쌍제이라서 어떤 떡밥이 나올까 기대했는데 456대본 그대로 가져와 쓴듯.. 주인공들은 어울리는데 신선함이 전혀없다. 
6,덕심으로는 볼만하나... 난 이 감독 반댈세. 쩝. 
9,새 시대를 알림이 자연스럽고. 긴장감과 몰입도는 가히 최고였다. 시리즈중 연출면에서는 베스트인듯하고. 다음시리즈가 무척이나 기대된다! 
10,아아너무재밌어요 135분이 10분과도같이 느껴진 영화는 스타워즈가 오랜만이네요 진짜로너무재밌어요 또다시 8을 기다리게되네요 죽지말아야겟다 
8,미스 캐스팅 때문에 너무 아쉽다. 왠지 모르는 거부감드는 그 흑인 배신자랑  역대급 존재감 없는 다스 베이더 아류 때문이다. 
7,주연배우 아담드라이버 빼곤 괜찮게 캐스팅된듯 합니다만... 나머지 배역들은 미스캐스팅 같습니다. 해리슨옹이나 기존 배우분들이야 당연히 나와주셔야 겠지만... 공화국진영 배우들은 연기는 좋으나. 비쥬얼이나 목소리톤이나...
9,기대한만큼은 아니지만 스타워즈를 보셨던분들에게는 추천합니다 
4,헝거게임의 광선검 버젼 같음; 
9,J.J 감독이 기존의 팬층과 대중성 중에서 잘 균형을 맞춘것 같다는 생각이 들었고 연기에 있어 자칫 부담 될 수도 있을 신예들을 기용해  좋은 성과를 거둔것 같습니다. 카일로 렌 빼고 연기력 모두 좋았습니다. 특히 ...
6,캐릭터 개성도 없고 재미가 없었음 
10,그냥 미친영화 2시간동안 우주에 있는 느낌이었다 
10,알바놈들때문에10점 
10,섹스란 무엇인가. 스타워즈가 바로 섹스다. 스타워즈를 보는순간 눈으로 섹스를 경험하게 될것이다. 
10,너무 오래 기다렸는데... 너무너무 잼난다~~^^ㅎㅎㅎ 
10,스타워즈 최고~~~짱짱짱 
10,프리퀄 첫번째에서 아나킨 스카이워커가 그랫듯 포스를 가진 주인공인 레이의 등장도 그렇네요. 
10,뭔1점주는인간들이 이리많아  이거보다재미없는영화본적없냐 1점주는인간들말믿지마시고 직접가서보세요 후회안합니다 
9,어찌 이보다 더 잘만들 수 있겠는가. 추억과 현재에 대한 배려.... 
10,너무 재미있게봤습니다^^ 
10,예전 시리즈들과의 연결점과 예전 주연배우들이 나오는장면에서 전작들의 추억과 감동이 밀려 왔네요예전 악역들에 비해 다소 약해보이는 악역(한 솔로아들)때문에 스릴감은 좀 떨어 지는듯... 아무튼 추억돋게 하는것엔 성공한...
10,스타워즈 광팬 남친 때문에 보게 됬는데 나도 입덕할듯.. 
10,기대이상 입니다. 속편 기다려져요! 
9,맨처음 스타워즈의 시작을 알리는 음악부터 설렘의 연속이었다. 
6,재미는 있는데...주인공들 해리포터같음... 해리포터 SF편 본 느낌 
8,Episode IV를 떠올리게하는 훌륭한 스토리 구성... 진정한 스타워즈의 컴백입니다 
9,40대이며 혼자보고왔음. 여주인공이 마지막결투에서 포스를 사용해 광선검을 잡는순간 감동. 루크스카이워커 기존원로배우 좋지만..담편 디즈니가 돈 더써서 유명배우로(조지크루니 러셀크로우..)캐스팅해줬으면 하는 욕심도.....
10,2000년대 이후 개봉한 스타워즈 중 젤 재밌었음. 이걸로 설명 끝. 
8,올드팬들에게 바치는 일종의 헌사가 아니었나 한다.시리즈 첫 편을 그대로 옮겨 놓은 듯한 세트장과 추억을 떠올리는 몇몇 장면들은 영화의 완성도와 상관없이 미소를 짓게 했다.새로운 시리즈의 출발로는 성공적인 편.하지만 ...
10,내가 시리즈를 다 보진 않았지만 이것만 봐도 다음 에피소드가 어떻게 진행될지 예상되더라ㅋㅋ 다음편도 완전 기대중 
10,시리즈의 초심을 유지하면서 새로운것들의 도입을 굉장히 잘 버무려 놈 
10,시스의 복수 이후 10년간의 기다림이 현실로 이루어지니 말하지 못할 감동...ㅠㅠ 8편과 로그원이 더욱더 기다려지네요 
10,같은 음악 같은 인물이기에 한층 더 감동적으로 다가오는 전설 
10,쌍제이 감독이 다음편도 맡아줬으면 좋겠다 정말 
10,왠만한 영화들은 3D나 4D로 안보는데 스타워즈는 3D로 볼만 하네요. 오히려 3D이상을 강추합니다 
10,스타워즈 4.5.6편의 주인공들을 다시 보게 되니까 반가웠고 감사한 마음^^ 
10,초반부터 눈을 뗄 수 없게 만드는 미친영화 ㅋㅋ 
9,스타워즈는 감동입니다.. 
8,스타워즈걸 봐야지..아무리 사람마다 달라도 한국영화 어떤거보다야 재미있지..오랜동안 보아오던 사람이나 새로 보는사람이나 괜찮다..시리즈중 평타에서 좀 떨어질려나...해도 어떤 국산 영화보다 낮다. 
10,잘만든영화!!~~~~ 
7,"빨간색 십자광선검 본걸로 만족한다  이전 에피소드들의 향수만 잔뜩느끼고 왔네요.. 새로움이 부족했던 작품,, 리부트가 아닌 리메이크격.. "
8,"에피소드 4편부터 (5편은 한국에서  상영을 안 했음.몇년전에 디지털리마스터링 버전은 상영되었음)3편까지 개봉관에서 본 사람으로 새로운 시리즈를 다시 본 것만으로 기쁘긴한데 새로운 인물, 스토리가 조금 낯설고 억지로..."
9,스톰투르퍼가 이렇게 인간적이였다니... 
7,내용이 전편과 비숫해 당황스러웠지만 나름감동도 있었다 
7,새로운 희망과 복붙수준. 다른 작품이라면 표절시비 당할지도? 
10,최고의 후속작이다찌질해보이면서도 처절한 악역이매력적이다 
10,에피소드4 :새로운 희망에 대한 오마주가 가득하다못해 철철 넘치는데 이게 스토리 라인을 해치지 않으면서 절묘하게 흘러간다.메인테마의 사용도 절제하듯 감정선이 폭발?하는 곳에서만 잔잔하게 잘 써서 감동도 더 진했고 카...
10,와 ㅜㅜ 진짜 오프닝부터 지림... 최고다 전설의 귀환! 10점도 부족해 이건 꼭 봐야되는게  맞음 
10,2015년에 보는 80년대 아날로그 감성.  새로운 에피소드 성공적 인 시작이자 적절히 조합한 오마쥬. 모든것을 담아낸 종합선물세트 최근에 시리즈 속편중 영화중 최고다. 
10,정말 너무 재미있었음.. 최고야.. 
10,"의무감에 보고 의무적으로 만점. 그리스,로마신화의 우주판, 우주 무협지.. "
10,선과 악  사이에서 갈등하는  아나킨 스카이워커와  그의  외손주  때문에  스타워즈가  재밌다.. 
9,예전의 전설들은 새로운 세대를 위한 밑밥이 되어있었네여 
8,에이브람스의 '블록버스터 무비'는 점점 진화하는 중. 
10,라이트세이버 씬은 언밸런스해서 아쉬움이 남았지만 평점테러 때문이라도 10점은 주고가야겠다 
10,스토리가 어디서 많이본 이야기다.하지만 그것도 이 시리즈 전통이니그나마 있는 단점도 봐줄만함알바들 적당히 해라 좀 
10,"내가 용접을 해봐서 아는데, 광선검이라게 그게 아크 가스 플라즈마 중에 하나라고 치면 가스불은 자외선 보단 적외선이 강해서 마스크는 쓰지 않지만 썬글라스정도는 써야 하고 아크는 자외선이 강하니까 마스크를 써야 얼굴이..."
8,그럭저럭 볼만한영화였습니다 
8,"조,ㅈ된다 개쩐다 눈물난다 "
9,지난 편 주인공들을 다시 만날 수 있어 반가웠어요. 다음 편을 즐거운 마음으로 기다릴 수 있겠네요.  기대합니다. 
8,시리즈를 보지않고 봤는데도 재밌었어요! 
7,"여자도 그렇고 심지어 청수부까지 갑자기 칼싸움을 그리 잘하는거지? 제2의 다스베이더가 그리 쉽게? 그 큰 인공행성이 그리 쉽게 폭탄 몇개와 미사일 몇발로 완파? 어릴때 우상들이 나와줘 7점 준다만 놀란, 카메론 땜에..."
8,'깨어난 포스'  말 그대로 포스만 깨어났어요 
9,솔직히 스타워즈를 아버지 덕분에 접해서 살면서 계속 6편을 보고 있다가 이 영화를 보고 느낀건 전작의 내용을 이어주는 전개 옛 주인공들의 귀환 앞으로 자녀들의 이야기가 펼쳐지는 부분에서 좋았습니다 전작을 봐야 알 수...
8,확실히 엄청난 영화다 감독이 시작부터 끝까지 모든 연출에 기를 쓴게 보인다 그런데 살짝 아쉬운 점은 그렇게나 인상적인 캐릭터가 없었다는거다  그가 가면을 벗을때 약간의 허무함 하지만 정말로 이 영화는 시작을 알리는 ...
9,J.J. 에이브럼스 감독님! 포스를 깨워 주셔서 감사합니다 
9,오프닝부터 엔딩크레딧까지 입가에 미소가 떠나지 않았네요 ㅋㅋ후속작으로써의 자격이 충분하다 못해 새로 상쾌한시작을 하려나봅니다  다만  새로운 시스의 포스가.... 베이더 옹을 넘는건 역시 무리였나봅니다...ㅜㅜ 
9,J.J 말고 누가 이 영화를 만들 수 있을까? 이 영화는 새로운 주인공을 위한 새로운 희망과 제국의 역습을 포함한 전개에 다크 사이드로 전락하게 되는 클론의 습격과 시스의 복수까지의 과정까지 담고 있다. 스타워즈 팬...
7,새로운 얼굴의 남녀주인공과 함께하는 초명작의 귀환. 
9,제목처럼 .... 포스가 깨어났구나.   헌것을 가져다 제대로 리폼했으니... 이젠 즐기기만 하면 되겠군.  한국영화도 이제 좀깨어나자. 
10,꼭보세요 그냥저냥 재밌네요 
10,친구가 끌고와서 아무생각없이 봤는데 잼씀!! 어벤져스 보는느낌 
9,"A long time ago, in a galaxy far, far away ... "
10,역시 꿀잼. 몰라도 보시길 
10,인물 장소 내용도 너무 좋았지만 무엇보다 라이타 팅~ 
10,"최근에 나온 1,2,3 프리퀄은 비교 대상이 아니며클래식 역대 명작인 제국의 역습 보다는 못하지만 새로운 희망이나 제다이의 귀환 보다는 재미있게 봤음 역대 스타워즈 영화중 상타치임. 팬이 아니여도 디즈니가 작정하고 ..."
10,이 영화를 또 볼수있다니 최고다 
10,카일로 렌이 좀 아쉬운데 진짜 재밌었음 
9,"루카스필름 인트로에 환호했던 분들, 공감! "
10,금방 보고 왔는데 다들 혼자 왔더라 영화 흥하다고 전해라~~~ 
10,a long time ago... 음악과 함께 올라갈때 가슴 떨림 어떤 영화가 이런 강렬함을 줄수 있을까? 팔콘 엑스윙 그리고 루크의 광선검 뭐가 더 필요한가 
10,내39년 인생과 함께한 걸작이다 난 어릴때부터 혼자스타워즈빠였다 
10,12월에 볼수있어 감사하다... 
10,조조로 보고왔다. 알바취급말아라. 정말 재밌어서 평점주는 거니까 루크보고 소름돋았다. 
8,"유치함을 많이 벗어났지만, 은하계 전쟁에 병력이 어째 전투기 수십대 정도냐. 게다가 레이더도 없나 적이 기지에 도착해도 모르고. 여러면에서 너무 많이 부족했음. 전쟁수준이 70년대에 머물러 있음. 우주전쟁의 웅장함을..."
10,와... 진짜... 울고싶다... 
10,"조조로  관람, 영화자체로 9점에 새로운 스타워즈시작이라는 점에 10점 "
10,스타워즈가 돌아왔다 전설의귀환 
10,캐릭터들이 역시나 매력적이네요ㅠㅠㅠㅠ진짜 다 맘에 듬 
9,깊이감이 약간 부족하지만 좋네요.. vod로 나오면 다시봐야겠음... 
10,welcome back... 
10,보고 왔는데 역시명불허전 스타워즈다 더이상 긴 말은 필요없다 
10,스타워즈는 살아났다.May the force be with you 
8,"그 전 이야기들을 알면 더 재밌고, 몰라도 재밌고. "
10,중간 중간 등장할때의 전율 !! 
10,"전설의 귀환, 더 이상의 설명은 생략한다!!! "
10,이게 봐로 진짜 스타워즈다 별들의전쟁 오징어 씹억가며 볼시간이없었다 ㅋㅋ 
10,루카스가 망쳐놓은 스타워즈를 쌍제이가 다시 살려냄!!쌍제이 감독 진짜 센스 있다!!밀레니엄 팔콘이나 X윙등을 cg처리 잘 해서 진짜 멋있었음!!! 
7,고정의 명성에 흠집을 내지 않는 올바른 속편의 예시 
5,늙은 한 솔로를 꼭 내세워야 했냐? 
10,레이야ㅠㅠ 이 별점 10점은 온전히 레이의 것이다ㅠ 
2,라제보단 나은거같긴하다만 그이상도 아닌 영화2편이 너무 붕괴되서 이것마저 잘만든건지도 의문인 영화이럴꺼면 감독을 왜 나누었냐 ;; 
7,스타워즈 시리즈 재밌네. 
7,"스타워즈가 돌아왔다. 매력있는 여주인공과 가면을 벗은 스톰 트루퍼, 색다른 멋이 있는 악역들이, 스타 트랙의 새 시대를 연 에이브람스 감독의 지휘 아래 새로운 이야기를 엮어 낸다. 그립던 영웅들의 귀환은 덤. 후속작..."
10,역시 기다린 보람을 주네요. 계속 기대 
9,솔직히 프리퀄 시리즈 이후로 재밌게 봄. 옛날껀 그래픽이.. 물론 그 시대 사람들은 재밌게 봤었겠지만 후작 로그원이 노잼인데 반해 이건 개봉 당시나 지금 다시봐도 재밌음. 
10,응니들이1점줘봐야 2억제작비로 20억달러벌었어 ㅅㄱ링~ 
9,클래식보단 못하지만 프리퀄보다는 몇배더 나은 스타워즈 영화! 살짝 배경 설명이 부족한 면이 있지만 성장형 악당이나 미스터리한 주인공등 캐릭터 설정을 멋들어지게 한것 같다. 마지막에 루크 찾기에서 스타킬러 베이스 침공...
10,"감독이 스타트렉의 감독인 JJ에이브럼스라는데 놀랐고, 추억속의 한솔로,추바카, 루크스카이워크, 레아공주 등등 추억속의 배우들을 다시 볼 수있어 행복했다.  또한 작정하고 디테일하게 확장시킨 에이브럼스의 연출력에 경악..."
7,명성답지 않게 소박하고 쉽게 촬영했던 듯 싶다  원형로봇 귀여웠어 
5,"스토리에서 땅을 치고, 캐릭터에서 또 땅을 쳤네...OTL "
6,너무 예전이라 잘 기억이 안나 
5,실소가 나오는 장면이 많은데 특히 마지막에 레이가 갑자기 포스에 눈뜨고 카일로를 바르는 장면은 진짜 ㅋㅋ 에휴 ㅠ 
6,배경지식이 없으면 노잼 
1,악역이 너무 약함 진짜 좀쎌 줄 알았는데 한방에 죽음 
1,Cg에 돈을 어디 발랏는지 그래픽 화질만 높고 70년대 456탄보다 볼만한 장면이 하나도 없네아직도 비행기 열대로 행성만한 적함선 터트리고ㅋㅋ 한솔로나와서 그나마보다가 다크사이더 가면 벗고난뒤부터 폭풍 2배속 시청별...
1,보는 내내 찝찝함이 계속되더니.. 어휴.. 
1,졸 허접하네....(10자10자) 
10,생각보다 재미있네요... 
10,최고의 영화!! 재밌어요!! 
10,예전 시리즈를 본지 오래되어서 걱정하면서 봤는데 진짜 굿굿너무 재미있게 봤음다음편이 너무나도 기대됨 
10,아주재밌게 봤어요 극장에서 보길잘 한것 같습니다 
5,스토리가.... 망작... 
5,절었을때밨은보다 재미가없는거같네요 
10,재미있게 봤습니다?로봇 귀여워요? 
10,스타워즈 팬에게는 최고의 선물을 받은듯한 감동이 있는 영화...기존의 배우들과 현 주연들이 너무나 잘 이어져 좋았고 깨알같은 조연들 특히 알투나 비비 는 압권...다만 아쉬운 점은 악역이 다스베이더가 너무 강해 묻히...
6,"쪼그라든 스케일,이해안되는 개연성..쌍제이 이양반 팬 맞아? "
1,"공감되지 않는 추억, 학습해야하는 추억 "
5,솔직히 ... 별루다 ... 에피소드3에서 끝냈어야됐다.. 연기 연출 스토리 뭐하나 내세울게 없다 CG조차 그냥 그랬음.. 
3,스토리가 참 너무 산으로 가네 개연성을 찾을래야 찾을수가 없다. 그리고 스타워즈 포스 의 힘은 핏줄의 힘인 걸로 결정 도대체 훈련은 왜하는겨??? 
3,헉 스타워즈 이제 진짜 끝났다.  난 순간 이거 짝통인가 했음. 내용도 없고 주인공도 최악이고 액션도 수준이하고 비행기전투신도 전편들 보다 못하고 왜 명작을 이따구로 만들어는지 쯔쯔 
1,씹노잼입니다...내스탈은 아닌걸로ㅜ 
1,내용 부실하고 볼거리도 전편에 비해 매우 빈약합니다. 
10,스타워즈는 스타워즈니까요 
10,"일단 기대했던것에 비하면 약간 부족한 느낌이 있음. 가장 최근 개봉했던 에피소드3편이 더 재미있었는데, 그래도 기존배우들의 포스는 강력했고 추억이 살아나 재미나게 감상한것 같습니다. 예상치 못했던 제다이의 등장. 부..."
10,주위 사람들 호불호가 갈리던데전 호입니다잼잼근데 전작 본지가 너무 오래 돼서 복습하고 봤으면 더 좋았을듯 
9,남자 주인공만 맘에 안듬 뭐 흑인이라서가 아니라 웰케 땀을 많이 흘림 보는 내내 찝찝해서 혼났음 
10,내가 본 영화 중에서 가장 재밌음근데 카일로 렌이약골임?별 무한개 줘도아깝지않음 
4,딱 3류영화를 보는 느낌이었다. 관객들도 나오면서 이거 머지? 그랫다. 물론 스타워즈 팬들은 확실히 잘 보더라. 하지만 모르는 사람이 보러 들어갔다면  한숨나오는 영화 
10,말이 필요없다 스타워즈가 돌아왔다 
7,볼만한 영화다. 감동적인 면도 있다. 
7,역시 화려한 연출의 영화였습니다 
10,아이가 재미있었다고 합니다 
10,속편들 안보고서 본사람들은 뭐 해줄 말이 없다 
9,전작보다 흥미있고 더리얼해서 좋았어요 
